TransactionNo,Date,ProductNo,ProductName,Price,Quantity,CustomerNo,Country
577057,2023-11-17,21930,Jumbo Storage Bag Skulls,12.38,1,12748.0,United Kingdom
577057,2023-11-17,82583,Hot Baths Metal Sign,12.4,1,12748.0,United Kingdom
577057,2023-11-17,20619,Tropical Passport Cover,12.4,1,12748.0,United Kingdom
577057,2023-11-17,21739,Cosy Slipper Shoes Small Green,13.27,1,12748.0,United Kingdom
577057,2023-11-17,21896,Potting Shed Twine,12.4,1,12748.0,United Kingdom
577057,2023-11-17,22825,Decorative Plant Pot With Frieze,18.4,1,12748.0,United Kingdom
577057,2023-11-17,22633,Hand Warmer Union Jack,12.4,1,12748.0,United Kingdom
577057,2023-11-17,23439,Hand Warmer Red Love Heart,12.4,1,12748.0,United Kingdom
577057,2023-11-17,23433,Hanging Quilted Patchwork Apples,11.1,1,12748.0,United Kingdom
577057,2023-11-17,85032C,Curious Images Gift Wrap Set,10.92,2,12748.0,United Kingdom
577057,2023-11-17,23282,Folding Butterfly Mirror Ivory,11.1,1,12748.0,United Kingdom
577057,2023-11-17,22572,Rocking Horse Green Christmas,11.12,1,12748.0,United Kingdom
577057,2023-11-17,85034C,3 Rose Morris Boxed Candles,11.53,1,12748.0,United Kingdom
577057,2023-11-17,23290,Spaceboy Childrens Bowl,11.53,1,12748.0,United Kingdom
577057,2023-11-17,21723,Alphabet Hearts Sticker Sheet,11.12,1,12748.0,United Kingdom
577057,2023-11-17,21724,Panda And Bunnies Sticker Sheet,11.12,2,12748.0,United Kingdom
577057,2023-11-17,23395,Belle Jardiniere Cushion Cover,14.09,1,12748.0,United Kingdom
577057,2023-11-17,23396,Le Jardin Botanique Cushion Cover,14.09,1,12748.0,United Kingdom
577057,2023-11-17,21725,Sweeties Stickers,11.12,1,12748.0,United Kingdom
577057,2023-11-17,21719,Lovely Bonbon Sticker Sheet,11.12,1,12748.0,United Kingdom
577057,2023-11-17,22313,Office Mug Warmer Pink,13.27,1,12748.0,United Kingdom
577057,2023-11-17,23534,Wall Art Stop For Tea,16.35,1,12748.0,United Kingdom
577057,2023-11-17,23539,Wall Art Loves' Secret,16.35,1,12748.0,United Kingdom
577057,2023-11-17,21452,Toadstool Money Box,13.27,1,12748.0,United Kingdom
577057,2023-11-17,85019A,Romantic Images Notebook Set,11.53,1,12748.0,United Kingdom
577057,2023-11-17,23083,Set 6 Paper Table Lantern Stars,14.09,1,12748.0,United Kingdom
577057,2023-11-17,21980,Pack Of 12 Red Retrospot Tissues,10.65,1,12748.0,United Kingdom
577057,2023-11-17,23298,Spotty Bunting,15.32,1,12748.0,United Kingdom
577057,2023-11-17,23156,Set Of 5 Mini Grocery Magnets,12.38,1,12748.0,United Kingdom
577057,2023-11-17,23154,Set Of 4 Jam Jar Magnets,12.38,1,12748.0,United Kingdom
577057,2023-11-17,22744,Make Your Own Monsoon Card Kit,13.27,1,12748.0,United Kingdom
577057,2023-11-17,21888,Bingo Set,14.09,1,12748.0,United Kingdom
577057,2023-11-17,20724,Red Retrospot Charlotte Bag,11.12,1,12748.0,United Kingdom
577057,2023-11-17,22633,Hand Warmer Union Jack,12.4,1,12748.0,United Kingdom
577057,2023-11-17,22632,Hand Warmer Red Retrospot,12.4,1,12748.0,United Kingdom
577057,2023-11-17,22866,Hand Warmer Scotty Dog Design,12.4,2,12748.0,United Kingdom
577057,2023-11-17,22632,Hand Warmer Red Retrospot,12.4,1,12748.0,United Kingdom
577057,2023-11-17,22372,Airline Bag Vintage World Champion,14.61,1,12748.0,United Kingdom
577057,2023-11-17,22374,Airline Bag Vintage Jet Set Red,14.61,1,12748.0,United Kingdom
577057,2023-11-17,22371,Airline Bag Vintage Tokyo 78,14.61,2,12748.0,United Kingdom
577057,2023-11-17,22375,Airline Bag Vintage Jet Set Brown,14.61,1,12748.0,United Kingdom
577057,2023-11-17,79190B,Retro Plastic Polka Tray,11.12,1,12748.0,United Kingdom
577057,2023-11-17,85038,6 Chocolate Love Heart T-Lights,12.4,1,12748.0,United Kingdom
577057,2023-11-17,23013,Glass Apothecary Bottle Tonic,14.3,1,12748.0,United Kingdom
577057,2023-11-17,22328,Round Snack Boxes Set Of 4 Fruits,13.27,1,12748.0,United Kingdom
577057,2023-11-17,21136,Painted Metal Pears Assorted,11.98,2,12748.0,United Kingdom
577057,2023-11-17,23252,Vintage Red Enamel Trim Jug,14.09,1,12748.0,United Kingdom
577057,2023-11-17,20752,Blue Polkadot Washing Up Gloves,12.4,1,12748.0,United Kingdom
577057,2023-11-17,20751,Funky Washing Up Gloves Assorted,12.4,2,12748.0,United Kingdom
577057,2023-11-17,71101E,Standing Fairy Pole Support,11.12,4,12748.0,United Kingdom
577057,2023-11-17,22752,Set 7 Babushka Nesting Boxes,18.96,1,12748.0,United Kingdom
577057,2023-11-17,23328,Set 6 School Milk Bottles In Crate,14.09,1,12748.0,United Kingdom
577057,2023-11-17,23081,Green Metal Box Army Supplies,18.71,1,12748.0,United Kingdom
577057,2023-11-17,23080,Red Metal Box Top Secret,18.71,1,12748.0,United Kingdom
577057,2023-11-17,20992,Jazz Hearts Purse Notebook,10.65,48,12748.0,United Kingdom
577057,2023-11-17,21592,Retrospot Cigar Box Matches,11.53,1,12748.0,United Kingdom
577057,2023-11-17,84347,Rotating Silver Angels T-Light Hldr,12.86,1,12748.0,United Kingdom
577057,2023-11-17,21591,Cosy Hour Cigar Box Matches,11.53,1,12748.0,United Kingdom
577057,2023-11-17,85034C,3 Rose Morris Boxed Candles,11.53,1,12748.0,United Kingdom
577057,2023-11-17,23081,Green Metal Box Army Supplies,18.71,1,12748.0,United Kingdom
577057,2023-11-17,85035C,Rose 3 Wick Morris Box Candle,11.53,1,12748.0,United Kingdom
577057,2023-11-17,21425,Skulls Storage Box Large,13.27,1,12748.0,United Kingdom
577057,2023-11-17,84674,Flying Pig Watering Can,13.27,2,12748.0,United Kingdom
577057,2023-11-17,23080,Red Metal Box Top Secret,18.71,1,12748.0,United Kingdom
577057,2023-11-17,21098,Christmas Toilet Roll,11.53,1,12748.0,United Kingdom
577057,2023-11-17,22659,Lunch Box I Love London,12.25,1,12748.0,United Kingdom
577057,2023-11-17,85014A,Black/Blue Polkadot Umbrella,16.35,1,12748.0,United Kingdom
577057,2023-11-17,21934,Skull Shoulder Bag,11.94,1,12748.0,United Kingdom
577057,2023-11-17,21930,Jumbo Storage Bag Skulls,12.38,1,12748.0,United Kingdom
577057,2023-11-17,21306,Set/4 Daisy Mirror Magnets,10.55,1,12748.0,United Kingdom
577057,2023-11-17,21311,Set/4 Bird Mirror Magnets,10.55,1,12748.0,United Kingdom
577057,2023-11-17,16045,Popart Wooden Pencils Asst,10.29,100,12748.0,United Kingdom
577057,2023-11-17,23159,Set Of 5 Pancake Day Magnets,12.38,1,12748.0,United Kingdom
577057,2023-11-17,84692,Box Of 24 Cocktail Parasols,10.68,1,12748.0,United Kingdom
577057,2023-11-17,21650,Assorted Tutti Frutti Bracelet,10.44,10,12748.0,United Kingdom
577057,2023-11-17,23491,Vintage Jingle Bells Heart,18.71,1,12748.0,United Kingdom
577057,2023-11-17,21931,Jumbo Storage Bag Suki,12.38,1,12748.0,United Kingdom
577057,2023-11-17,21990,Modern Floral Stationery Set,11.53,1,12748.0,United Kingdom
577057,2023-11-17,22727,Alarm Clock Bakelike Red,14.09,1,12748.0,United Kingdom
577057,2023-11-17,23489,Vintage Bells Garland,13.21,2,12748.0,United Kingdom
577057,2023-11-17,21306,Set/4 Daisy Mirror Magnets,10.55,1,12748.0,United Kingdom
577057,2023-11-17,22604,Set Of 4 Napkin Charms Cutlery,12.86,2,12748.0,United Kingdom
577057,2023-11-17,84596B,Small Dolly Mix Design Orange Bowl,10.68,1,12748.0,United Kingdom
577057,2023-11-17,84596F,Small Marshmallows Pink Bowl,10.68,1,12748.0,United Kingdom
577057,2023-11-17,22197,Popcorn Holder,11.12,2,12748.0,United Kingdom
577057,2023-11-17,22842,Biscuit Tin Vintage Red,17.17,1,12748.0,United Kingdom
577057,2023-11-17,22628,Picnic Boxes Set Of 3 Retrospot,15.32,1,12748.0,United Kingdom
577057,2023-11-17,23581,Jumbo Bag Paisley Park,6.19,1,12748.0,United Kingdom
577057,2023-11-17,22386,Jumbo Bag Pink Polkadot,6.19,1,12748.0,United Kingdom
577057,2023-11-17,23344,Jumbo Bag 50'S Christmas,6.19,1,12748.0,United Kingdom
577057,2023-11-17,23344,Jumbo Bag 50'S Christmas,6.19,1,12748.0,United Kingdom
577057,2023-11-17,23344,Jumbo Bag 50'S Christmas,6.19,3,12748.0,United Kingdom
577057,2023-11-17,23200,Jumbo Bag Pears,6.19,1,12748.0,United Kingdom
577057,2023-11-17,23201,Jumbo Bag Alphabet,6.19,1,12748.0,United Kingdom
577057,2023-11-17,22386,Jumbo Bag Pink Polkadot,6.19,1,12748.0,United Kingdom
577057,2023-11-17,23581,Jumbo Bag Paisley Park,6.19,1,12748.0,United Kingdom
577057,2023-11-17,23583,Lunch Bag Paisley Park,5.97,1,12748.0,United Kingdom
577057,2023-11-17,22383,Lunch Bag Suki Design,5.97,2,12748.0,United Kingdom
577057,2023-11-17,20727,Lunch Bag Black Skull,5.97,2,12748.0,United Kingdom
577057,2023-11-17,22382,Lunch Bag Spaceboy Design,5.97,1,12748.0,United Kingdom
577057,2023-11-17,20727,Lunch Bag Black Skull,5.97,3,12748.0,United Kingdom
577057,2023-11-17,20727,Lunch Bag Black Skull,5.97,1,12748.0,United Kingdom
577058,2023-11-17,23319,Box Of 6 Mini 50'S Crackers,12.8,4,18122.0,United Kingdom
577058,2023-11-17,23298,Spotty Bunting,15.32,1,18122.0,United Kingdom
577058,2023-11-17,23198,Pantry Magnetic Shopping List,11.74,1,18122.0,United Kingdom
577058,2023-11-17,22111,Scottie Dog Hot Water Bottle,15.32,1,18122.0,United Kingdom
577058,2023-11-17,70006,Love Heart Pocket Warmer,11.94,1,18122.0,United Kingdom
577058,2023-11-17,82552,Washroom Metal Sign,11.74,1,18122.0,United Kingdom
577058,2023-11-17,20761,Blue Paisley Sketchbook,14.09,1,18122.0,United Kingdom
577058,2023-11-17,20762,Green Fern Sketchbook,14.09,1,18122.0,United Kingdom
577058,2023-11-17,82582,Area Patrolled Metal Sign,12.4,1,18122.0,United Kingdom
577058,2023-11-17,22554,Plasters In Tin Woodland Animals,11.94,1,18122.0,United Kingdom
577058,2023-11-17,22728,Alarm Clock Bakelike Pink,14.09,1,18122.0,United Kingdom
577058,2023-11-17,23341,Pink Diner Wall Clock,18.96,1,18122.0,United Kingdom
577058,2023-11-17,48138,Doormat Union Flag,18.71,1,18122.0,United Kingdom
577058,2023-11-17,23370,Set 36 Colouring Pencils Doily,11.53,1,18122.0,United Kingdom
577058,2023-11-17,22371,Airline Bag Vintage Tokyo 78,14.61,1,18122.0,United Kingdom
577058,2023-11-17,85232D,Set/3 Decoupage Stacking Tins,15.32,1,18122.0,United Kingdom
577058,2023-11-17,21933,Pink Vintage Paisley Picnic Bag,11.94,1,18122.0,United Kingdom
577058,2023-11-17,21710,Folding Umbrella Pinkwhite Polkadot,15.32,1,18122.0,United Kingdom
577058,2023-11-17,72800C,4 Pink Dinner Candle Silver Flock,12.86,1,18122.0,United Kingdom
577058,2023-11-17,20985,Heart Calculator,11.53,1,18122.0,United Kingdom
577058,2023-11-17,22156,Heart Decoration With Pearls,11.12,5,18122.0,United Kingdom
577058,2023-11-17,85123A,Cream Hanging Heart T-Light Holder,13.27,3,18122.0,United Kingdom
577058,2023-11-17,84279B,Cherry Blossom Decorative Flask,14.09,1,18122.0,United Kingdom
577058,2023-11-17,23113,Pantry Chopping Board,15.32,1,18122.0,United Kingdom
577058,2023-11-17,22989,Set 2 Pantry Design Tea Towels,13.58,1,18122.0,United Kingdom
577058,2023-11-17,21851,Lilac Diamante Pen In Gift Box,15.32,1,18122.0,United Kingdom
577058,2023-11-17,84006,Magic Tree -Paper Flowers,11.12,1,18122.0,United Kingdom
577058,2023-11-17,23241,Treasure Tin Gymkhana Design,12.38,1,18122.0,United Kingdom
577058,2023-11-17,22791,T-Light Glass Fluted Antique,11.53,12,18122.0,United Kingdom
577058,2023-11-17,22111,Scottie Dog Hot Water Bottle,15.32,1,18122.0,United Kingdom
577058,2023-11-17,85183A,Charlie & Lola Wastepaper Bin Blue,11.53,1,18122.0,United Kingdom
577058,2023-11-17,20677,Pink Polkadot Bowl,11.53,4,18122.0,United Kingdom
577058,2023-11-17,84558A,3d Dog Picture Playing Cards,13.27,1,18122.0,United Kingdom
577058,2023-11-17,22438,Balloon Art Make Your Own Flowers,12.25,1,18122.0,United Kingdom
577058,2023-11-17,21820,Glitter Heart Garland With Bells,14.09,2,18122.0,United Kingdom
577058,2023-11-17,22599,Christmas Musical Zinc Star,10.55,6,18122.0,United Kingdom
577058,2023-11-17,21818,Glitter Heart Decoration,10.65,6,18122.0,United Kingdom
577058,2023-11-17,22338,Star Decoration Painted Zinc,10.44,6,18122.0,United Kingdom
577058,2023-11-17,22578,Wooden Star Christmas Scandinavian,10.55,47,18122.0,United Kingdom
577058,2023-11-17,22577,Wooden Heart Christmas Scandinavian,10.55,36,18122.0,United Kingdom
577058,2023-11-17,20985,Heart Calculator,11.53,1,18122.0,United Kingdom
577058,2023-11-17,22579,Wooden Tree Christmas Scandinavian,10.55,40,18122.0,United Kingdom
577058,2023-11-17,22154,Angel Decoration 3 Buttons,10.68,10,18122.0,United Kingdom
577058,2023-11-17,23500,Key Ring Baseball Boot Assorted,11.53,1,18122.0,United Kingdom
577058,2023-11-17,23501,Key Ring Baseball Boot Union Jack,11.53,1,18122.0,United Kingdom
577058,2023-11-17,22435,Set Of 9 Heart Shaped Balloons,11.53,1,18122.0,United Kingdom
577058,2023-11-17,22437,Set Of 9 Black Skull Balloons,11.12,1,18122.0,United Kingdom
577058,2023-11-17,23497,Classic Chrome Bicycle Bell,11.74,1,18122.0,United Kingdom
577058,2023-11-17,23504,Playing Cards Jubilee Union Jack,11.53,1,18122.0,United Kingdom
577058,2023-11-17,84558A,3d Dog Picture Playing Cards,13.27,1,18122.0,United Kingdom
577058,2023-11-17,23371,Set 36 Colour Pencils Spaceboy,11.53,3,18122.0,United Kingdom
577058,2023-11-17,84876B,Green Heart Compact Mirror,11.53,1,18122.0,United Kingdom
577058,2023-11-17,22422,Toothpaste Tube Pen,10.92,1,18122.0,United Kingdom
577058,2023-11-17,22421,Lipstick Pen Fuschia,10.68,1,18122.0,United Kingdom
577058,2023-11-17,21820,Glitter Heart Garland With Bells,14.09,1,18122.0,United Kingdom
577058,2023-11-17,20981,12 Pencils Tall Tube Woodland,11.12,3,18122.0,United Kingdom
577058,2023-11-17,20982,12 Pencils Tall Tube Skulls,11.12,1,18122.0,United Kingdom
577058,2023-11-17,20983,12 Pencils Tall Tube Red Retrospot,11.12,2,18122.0,United Kingdom
577058,2023-11-17,23332,Ivory Wicker Heart Large,11.94,4,18122.0,United Kingdom
577058,2023-11-17,20986,Blue Calculator Ruler,11.53,1,18122.0,United Kingdom
577058,2023-11-17,84535B,Fairy Cakes Notebook A6 Size,10.92,1,18122.0,United Kingdom
577058,2023-11-17,82613A,Metal Sign Cupcake Single Hook,11.53,1,18122.0,United Kingdom
577058,2023-11-17,82613A,Metal Sign Cupcake Single Hook,11.53,1,18122.0,United Kingdom
577058,2023-11-17,82613A,Metal Sign Cupcake Single Hook,11.53,1,18122.0,United Kingdom
577058,2023-11-17,21891,Traditional Wooden Skipping Rope,11.74,1,18122.0,United Kingdom
577058,2023-11-17,23182,Toilet Sign Occupied Or Vacant,11.1,1,18122.0,United Kingdom
577058,2023-11-17,22399,Magnets Pack Of 4 Childhood Memory,11.53,1,18122.0,United Kingdom
577058,2023-11-17,22403,Magnets Pack Of 4 Vintage Labels,10.65,1,18122.0,United Kingdom
577058,2023-11-17,22398,Magnets Pack Of 4 Swallows,10.65,1,18122.0,United Kingdom
577058,2023-11-17,22155,Star Decoration Rustic,10.68,8,18122.0,United Kingdom
577058,2023-11-17,22597,Musical Zinc Heart Decoration,10.55,6,18122.0,United Kingdom
577058,2023-11-17,22156,Heart Decoration With Pearls,11.12,6,18122.0,United Kingdom
577058,2023-11-17,21876,Pottering Mug,11.94,1,18122.0,United Kingdom
577058,2023-11-17,21872,Glamorous Mug,11.53,1,18122.0,United Kingdom
577058,2023-11-17,21068,Vintage Billboard Love/Hate Mug,11.53,1,18122.0,United Kingdom
577058,2023-11-17,21874,Gin And Tonic Mug,11.94,2,18122.0,United Kingdom
577058,2023-11-17,22557,Plasters In Tin Vintage Paisley,11.94,3,18122.0,United Kingdom
577058,2023-11-17,22554,Plasters In Tin Woodland Animals,11.94,3,18122.0,United Kingdom
577058,2023-11-17,22553,Plasters In Tin Skulls,11.94,3,18122.0,United Kingdom
577058,2023-11-17,22551,Plasters In Tin Spaceboy,11.94,3,18122.0,United Kingdom
577058,2023-11-17,85123A,Cream Hanging Heart T-Light Holder,13.27,2,18122.0,United Kingdom
577058,2023-11-17,22725,Alarm Clock Bakelike Chocolate,14.09,1,18122.0,United Kingdom
577058,2023-11-17,22082,Ribbon Reel Stripes Design,11.94,5,18122.0,United Kingdom
577058,2023-11-17,22111,Scottie Dog Hot Water Bottle,15.32,1,18122.0,United Kingdom
577058,2023-11-17,21481,Fawn Blue Hot Water Bottle,14.09,1,18122.0,United Kingdom
577058,2023-11-17,22794,Sweetheart Wire Magazine Rack,18.4,1,18122.0,United Kingdom
577058,2023-11-17,22174,Photo Cube,11.94,4,18122.0,United Kingdom
577058,2023-11-17,21137,Black Record Cover Frame,14.09,1,18122.0,United Kingdom
577058,2023-11-17,22041,"Record Frame 7"" Single Size",12.86,1,18122.0,United Kingdom
577058,2023-11-17,21169,You're Confusing Me Metal Sign,11.98,1,18122.0,United Kingdom
577058,2023-11-17,21328,Balloons Writing Set,11.94,1,18122.0,United Kingdom
577058,2023-11-17,21327,Skulls Writing Set,11.94,1,18122.0,United Kingdom
577058,2023-11-17,22086,Paper Chain Kit 50'S Christmas,13.27,1,18122.0,United Kingdom
577058,2023-11-17,82616B,Frappucino Scarf Knitting Kit,11.53,1,18122.0,United Kingdom
577058,2023-11-17,22743,Make Your Own Flowerpower Card Kit,13.27,1,18122.0,United Kingdom
577058,2023-11-17,23084,Rabbit Night Light,12.38,1,18122.0,United Kingdom
577058,2023-11-17,22158,3 Hearts Hanging Decoration Rustic,13.27,8,18122.0,United Kingdom
577058,2023-11-17,22197,Popcorn Holder,11.12,15,18122.0,United Kingdom
577058,2023-11-17,23319,Box Of 6 Mini 50'S Crackers,12.8,1,18122.0,United Kingdom
577058,2023-11-17,23313,Vintage Christmas Bunting,15.32,1,18122.0,United Kingdom
577058,2023-11-17,23350,Roll Wrap Vintage Spot,11.53,4,18122.0,United Kingdom
577058,2023-11-17,21933,Pink Vintage Paisley Picnic Bag,11.94,4,18122.0,United Kingdom
577058,2023-11-17,21935,Suki Shoulder Bag,11.94,1,18122.0,United Kingdom
577058,2023-11-17,23344,Jumbo Bag 50'S Christmas,6.19,1,18122.0,United Kingdom
577058,2023-11-17,23202,Jumbo Bag Vintage Leaf,6.19,3,18122.0,United Kingdom
577058,2023-11-17,21929,Jumbo Bag Pink Vintage Paisley,6.19,2,18122.0,United Kingdom
577058,2023-11-17,23581,Jumbo Bag Paisley Park,6.19,3,18122.0,United Kingdom
577058,2023-11-17,22384,Lunch Bag Pink Polkadot,5.97,2,18122.0,United Kingdom
577058,2023-11-17,22383,Lunch Bag Suki Design,5.97,1,18122.0,United Kingdom
577058,2023-11-17,22383,Lunch Bag Suki Design,5.97,1,18122.0,United Kingdom
577058,2023-11-17,20725,Lunch Bag Red Retrospot,5.97,2,18122.0,United Kingdom
577059,2023-11-17,22941,Christmas Lights 10 Reindeer,18.96,2,13704.0,United Kingdom
577059,2023-11-17,23352,Roll Wrap 50'S Red Christmas,11.53,12,13704.0,United Kingdom
577059,2023-11-17,22624,Ivory Kitchen Scales,18.96,2,13704.0,United Kingdom
577059,2023-11-17,22625,Red Kitchen Scales,18.96,2,13704.0,United Kingdom
577059,2023-11-17,22138,Baking Set 9 Piece Retrospot,15.32,3,13704.0,United Kingdom
577059,2023-11-17,22577,Wooden Heart Christmas Scandinavian,10.55,24,13704.0,United Kingdom
577059,2023-11-17,23313,Vintage Christmas Bunting,15.32,5,13704.0,United Kingdom
577059,2023-11-17,23311,Vintage Christmas Stocking,12.86,6,13704.0,United Kingdom
577059,2023-11-17,22621,Traditional Knitting Nancy,11.94,12,13704.0,United Kingdom
577059,2023-11-17,22960,Jam Making Set With Jars,14.61,6,13704.0,United Kingdom
577059,2023-11-17,22952,60 Cake Cases Vintage Christmas,10.81,24,13704.0,United Kingdom
577060,2023-11-17,22478,Birdhouse Garden Marker,11.53,20,14397.0,United Kingdom
577060,2023-11-17,20956,Porcelain T-Light Holders Assorted,11.53,36,14397.0,United Kingdom
577060,2023-11-17,22178,Victorian Glass Hanging T-Light,12.25,24,14397.0,United Kingdom
577060,2023-11-17,84946,Antique Silver T-Light Glass,11.53,12,14397.0,United Kingdom
577061,2023-11-17,23569,Tradtional Alphabet Stamp Set,15.32,4,14911.0,EIRE
577061,2023-11-17,21791,Vintage Heads And Tails Card Game,11.53,12,14911.0,EIRE
577061,2023-11-17,21914,Blue Harmonica In Box,11.53,12,14911.0,EIRE
577061,2023-11-17,22550,Holiday Fun Ludo,14.09,4,14911.0,EIRE
577061,2023-11-17,22745,Poppy's Playhouse Bedroom,12.4,6,14911.0,EIRE
577061,2023-11-17,22748,Poppy's Playhouse Kitchen,12.4,6,14911.0,EIRE
577061,2023-11-17,22746,Poppy's Playhouse Livingroom,12.4,6,14911.0,EIRE
577061,2023-11-17,23382,Box Of 6 Christmas Cake Decorations,14.09,4,14911.0,EIRE
577061,2023-11-17,23470,Card Holder Love Bird Large,16.66,2,14911.0,EIRE
577061,2023-11-17,23469,Card Holder Love Bird Small,14.5,6,14911.0,EIRE
577061,2023-11-17,23473,Woodland Small Red Felt Heart,11.1,12,14911.0,EIRE
577061,2023-11-17,23480,Mini Lights Woodland Mushrooms,14.09,4,14911.0,EIRE
577061,2023-11-17,23492,Vintage Jingle Bells Wreath,18.71,2,14911.0,EIRE
577061,2023-11-17,23542,Wall Art 70'S Alphabet,18.71,4,14911.0,EIRE
577061,2023-11-17,22734,Set Of 6 Ribbons Vintage Christmas,13.21,6,14911.0,EIRE
577061,2023-11-17,23434,3 Raffia Ribbons 50'S Christmas,11.06,10,14911.0,EIRE
577061,2023-11-17,22739,Ribbon Reel Christmas Sock Bauble,11.94,10,14911.0,EIRE
577061,2023-11-17,22737,Ribbon Reel Christmas Present,11.94,10,14911.0,EIRE
577061,2023-11-17,22959,Wrap Christmas Village,10.68,25,14911.0,EIRE
577061,2023-11-17,23320,Giant 50'S Christmas Cracker,13.21,12,14911.0,EIRE
577061,2023-11-17,23319,Box Of 6 Mini 50'S Crackers,12.8,6,14911.0,EIRE
577061,2023-11-17,72817,Set Of 2 Christmas Decoupage Candle,11.06,24,14911.0,EIRE
577061,2023-11-17,22591,Cardholder Gingham Christmas Tree,13.58,6,14911.0,EIRE
577061,2023-11-17,22141,Christmas Craft Tree Top Angel,12.4,6,14911.0,EIRE
577061,2023-11-17,22940,Feltcraft Christmas Fairy,14.61,4,14911.0,EIRE
577061,2023-11-17,22952,60 Cake Cases Vintage Christmas,10.81,24,14911.0,EIRE
577061,2023-11-17,35970,Zinc Folkart Sleigh Bells,11.98,12,14911.0,EIRE
577061,2023-11-17,20668,Disco Ball Christmas Decoration,10.37,24,14911.0,EIRE
577061,2023-11-17,23311,Vintage Christmas Stocking,12.86,6,14911.0,EIRE
577061,2023-11-17,20961,Strawberry Bath Sponge,11.53,10,14911.0,EIRE
577061,2023-11-17,20963,Apple Bath Sponge,11.53,10,14911.0,EIRE
577061,2023-11-17,21485,Retrospot Heart Hot Water Bottle,15.32,3,14911.0,EIRE
577061,2023-11-17,22111,Scottie Dog Hot Water Bottle,15.32,3,14911.0,EIRE
577061,2023-11-17,22110,Bird House Hot Water Bottle,12.86,6,14911.0,EIRE
577061,2023-11-17,21484,Chick Grey Hot Water Bottle,14.61,4,14911.0,EIRE
577061,2023-11-17,23084,Rabbit Night Light,12.38,12,14911.0,EIRE
577061,2023-11-17,23083,Set 6 Paper Table Lantern Stars,14.09,12,14911.0,EIRE
577061,2023-11-17,23109,Pack Of Six Led Tea Lights,13.21,6,14911.0,EIRE
577061,2023-11-17,20761,Blue Paisley Sketchbook,14.09,4,14911.0,EIRE
577061,2023-11-17,20764,Abstract Circles Sketchbook,14.09,4,14911.0,EIRE
577061,2023-11-17,21733,Red Hanging Heart T-Light Holder,13.27,12,14911.0,EIRE
577061,2023-11-17,85123A,Cream Hanging Heart T-Light Holder,13.27,12,14911.0,EIRE
577061,2023-11-17,23374,Red Spot Paper Gift Bag,5.55,10,14911.0,EIRE
577062,2023-11-17,21382,Set/4 Spring Flower Decoration,11.02,12,18221.0,United Kingdom
577062,2023-11-17,22091,Empire Tissue Box,10.65,36,18221.0,United Kingdom
577062,2023-11-17,22092,Blue Paisley Tissue Box,10.65,36,18221.0,United Kingdom
577062,2023-11-17,22093,Motoring Tissue Box,10.65,36,18221.0,United Kingdom
577062,2023-11-17,22115,Metal Sign Empire Tea,11.06,12,18221.0,United Kingdom
577062,2023-11-17,82613A,Metal Sign Cupcake Single Hook,11.53,8,18221.0,United Kingdom
577062,2023-11-17,82613A,Metal Sign Cupcake Single Hook,11.53,8,18221.0,United Kingdom
577062,2023-11-17,84988,Set Of 72 Pink Heart Paper Doilies,11.74,24,18221.0,United Kingdom
577062,2023-11-17,21210,Set Of 72 Retrospot Paper Doilies,11.74,12,18221.0,United Kingdom
577062,2023-11-17,84987,Set Of 36 Teatime Paper Doilies,11.74,12,18221.0,United Kingdom
577063,2023-11-17,22091,Empire Tissue Box,10.65,72,17183.0,United Kingdom
577063,2023-11-17,84029G,Knitted Union Flag Hot Water Bottle,14.09,48,17183.0,United Kingdom
577063,2023-11-17,22111,Scottie Dog Hot Water Bottle,15.32,6,17183.0,United Kingdom
577063,2023-11-17,22114,Hot Water Bottle Tea And Sympathy,14.09,24,17183.0,United Kingdom
577063,2023-11-17,22112,Chocolate Hot Water Bottle,15.32,9,17183.0,United Kingdom
577063,2023-11-17,22866,Hand Warmer Scotty Dog Design,12.4,12,17183.0,United Kingdom
577063,2023-11-17,22633,Hand Warmer Union Jack,12.4,24,17183.0,United Kingdom
577064,2023-11-17,22998,Travel Card Wallet Keep Calm,10.62,480,16656.0,United Kingdom
577064,2023-11-17,23428,Ivory Retro Kitchen Wall Clock,17.48,10,16656.0,United Kingdom
577064,2023-11-17,21704,Bag 250g Swirly Marbles,10.99,72,16656.0,United Kingdom
577065,2023-11-17,21485,Retrospot Heart Hot Water Bottle,15.32,3,13890.0,United Kingdom
577065,2023-11-17,22335,Heart Decoration Painted Zinc,10.92,24,13890.0,United Kingdom
577065,2023-11-17,85048,15cm Christmas Glass Ball 20 Lights,18.4,2,13890.0,United Kingdom
577065,2023-11-17,23404,Home Sweet Home Blackboard,15.32,6,13890.0,United Kingdom
577065,2023-11-17,22720,Set Of 3 Cake Tins Pantry Design,15.32,6,13890.0,United Kingdom
577065,2023-11-17,23393,Home Sweet Home Cushion Cover,14.09,4,13890.0,United Kingdom
577065,2023-11-17,46000S,Polyester Filler Pad 40x40cm,11.74,4,13890.0,United Kingdom
577065,2023-11-17,23355,Hot Water Bottle Keep Calm,15.32,4,13890.0,United Kingdom
577067,2023-11-17,22598,Christmas Musical Zinc Tree,10.55,72,12704.0,Finland
577067,2023-11-17,22597,Musical Zinc Heart Decoration,10.55,72,12704.0,Finland
577067,2023-11-17,23084,Rabbit Night Light,12.08,24,12704.0,Finland
577069,2023-11-17,90030B,Red Kukui Coconut Seed Necklace,11.27,6,12704.0,Finland
577069,2023-11-17,23146,Triple Hook Antique Ivory Rose,13.62,4,12704.0,Finland
577071,2023-11-17,79321,Chilli Lights,16.14,2,13969.0,United Kingdom
577071,2023-11-17,22340,Noel Garland Painted Zinc,10.65,4,13969.0,United Kingdom
577071,2023-11-17,21811,Hanging Heart With Bell,10.65,6,13969.0,United Kingdom
577071,2023-11-17,21810,Christmas Hanging Star With Bell,10.65,20,13969.0,United Kingdom
577071,2023-11-17,22339,Christmas Tree Painted Zinc,10.44,8,13969.0,United Kingdom
577071,2023-11-17,22338,Star Decoration Painted Zinc,10.44,5,13969.0,United Kingdom
577071,2023-11-17,22579,Wooden Tree Christmas Scandinavian,10.55,12,13969.0,United Kingdom
577071,2023-11-17,23480,Mini Lights Woodland Mushrooms,14.09,2,13969.0,United Kingdom
577071,2023-11-17,22141,Christmas Craft Tree Top Angel,12.4,6,13969.0,United Kingdom
577071,2023-11-17,23274,Star T-Light Holder Willie Winkie,11.94,5,13969.0,United Kingdom
577071,2023-11-17,23267,Set Of 4 Santa Place Settings,11.53,2,13969.0,United Kingdom
577071,2023-11-17,22941,Christmas Lights 10 Reindeer,18.96,2,13969.0,United Kingdom
577071,2023-11-17,23082,Set 6 Paper Table Lantern Hearts,14.09,4,13969.0,United Kingdom
577071,2023-11-17,21262,White Goose Feather Christmas Tree,13.27,1,13969.0,United Kingdom
577071,2023-11-17,23247,Biscuit Tin 50'S Christmas,13.21,18,13969.0,United Kingdom
