TransactionNo,Date,ProductNo,ProductName,Price,Quantity,CustomerNo,Country
548159,2023-03-29,22697,Green Regency Teacup And Saucer,13.27,4,15906.0,United Kingdom
548159,2023-03-29,22698,Pink Regency Teacup And Saucer,13.27,4,15906.0,United Kingdom
548159,2023-03-29,22636,Childs Breakfast Set Circus Parade,18.96,4,15906.0,United Kingdom
548160,2023-03-29,22077,6 Ribbons Rustic Charm,11.94,24,16253.0,United Kingdom
548160,2023-03-29,22570,Feltcraft Cushion Rabbit,14.09,12,16253.0,United Kingdom
548160,2023-03-29,22569,Feltcraft Cushion Butterfly,14.09,12,16253.0,United Kingdom
548160,2023-03-29,22536,Magic Drawing Slate Purdey,10.68,48,16253.0,United Kingdom
548160,2023-03-29,22457,Natural Slate Heart Chalkboard,13.27,18,16253.0,United Kingdom
548160,2023-03-29,21917,Set 12 Kids White Chalk Sticks,10.68,48,16253.0,United Kingdom
548160,2023-03-29,23155,Knickerbockerglory Magnet Assorted,11.1,48,16253.0,United Kingdom
548160,2023-03-29,22561,Wooden School Colouring Set,11.94,12,16253.0,United Kingdom
548160,2023-03-29,22438,Balloon Art Make Your Own Flowers,12.25,20,16253.0,United Kingdom
548160,2023-03-29,21640,Assorted Tutti Frutti Fob Notebook,11.12,24,16253.0,United Kingdom
548160,2023-03-29,22563,Happy Stencil Craft,11.53,24,16253.0,United Kingdom
548160,2023-03-29,47480,Hanging Photo Clip Rope Ladder,11.94,36,16253.0,United Kingdom
548160,2023-03-29,71270,Photo Clip Line,11.53,36,16253.0,United Kingdom
548160,2023-03-29,21642,Assorted Tutti Frutti Pen,11.12,48,16253.0,United Kingdom
548160,2023-03-29,11001,Asstd Design Racing Car Pen,11.98,32,16253.0,United Kingdom
548160,2023-03-29,84559A,3d Sheet Of Dog Stickers,11.12,24,16253.0,United Kingdom
548160,2023-03-29,84559B,3d Sheet Of Cat Stickers,11.12,24,16253.0,United Kingdom
548160,2023-03-29,22753,Small Yellow Babushka Notebook,11.12,24,16253.0,United Kingdom
548160,2023-03-29,22755,Small Purple Babushka Notebook,11.12,24,16253.0,United Kingdom
548160,2023-03-29,16237,Sleeping Cat Erasers,10.47,60,16253.0,United Kingdom
548160,2023-03-29,22148,Easter Craft 4 Chicks,12.25,12,16253.0,United Kingdom
548160,2023-03-29,22265,Easter Decoration Natural Chick,10.92,24,16253.0,United Kingdom
548160,2023-03-29,21389,Ivory Hanging Decoration Bird,11.12,12,16253.0,United Kingdom
548160,2023-03-29,22284,Hen House Decoration,11.94,12,16253.0,United Kingdom
548160,2023-03-29,22288,Hanging Metal Rabbit Decoration,11.53,24,16253.0,United Kingdom
548160,2023-03-29,22992,Revolver Wooden Ruler,12.25,36,16253.0,United Kingdom
548160,2023-03-29,22991,Giraffe Wooden Ruler,12.25,36,16253.0,United Kingdom
548160,2023-03-29,23000,Travel Card Wallet Transport,10.68,24,16253.0,United Kingdom
548160,2023-03-29,22999,Travel Card Wallet Vintage Leaf,10.68,24,16253.0,United Kingdom
548160,2023-03-29,23078,Ice Cream Pen Lip Gloss,11.53,72,16253.0,United Kingdom
548160,2023-03-29,23126,Feltcraft Girl Amelie Kit,15.32,16,16253.0,United Kingdom
548160,2023-03-29,21643,Assorted Tutti Frutti Mirror,11.53,36,16253.0,United Kingdom
548160,2023-03-29,21792,Classic French Style Basket Green,17.17,2,16253.0,United Kingdom
548160,2023-03-29,21793,Classic French Style Basket Brown,17.17,2,16253.0,United Kingdom
548160,2023-03-29,21794,Classic French Style Basket Natural,17.17,2,16253.0,United Kingdom
548160,2023-03-29,85172,Hyacinth Bulb T-Light Candles,10.68,48,16253.0,United Kingdom
548160,2023-03-29,22808,Set Of 6 T-Lights Easter Chicks,13.27,24,16253.0,United Kingdom
548160,2023-03-29,85175,Cacti T-Light Candles,10.68,32,16253.0,United Kingdom
548160,2023-03-29,21913,Vintage Seaside Jigsaw Puzzles,14.09,4,16253.0,United Kingdom
548160,2023-03-29,22547,Mini Jigsaw Dinosaur,10.68,24,16253.0,United Kingdom
548160,2023-03-29,22540,Mini Jigsaw Circus Parade,10.68,24,16253.0,United Kingdom
548160,2023-03-29,21790,Vintage Snap Cards,11.12,36,16253.0,United Kingdom
548160,2023-03-29,21791,Vintage Heads And Tails Card Game,11.53,24,16253.0,United Kingdom
548160,2023-03-29,21914,Blue Harmonica In Box,11.53,36,16253.0,United Kingdom
548160,2023-03-29,22549,Picture Dominoes,11.74,24,16253.0,United Kingdom
548160,2023-03-29,22493,Paint Your Own Canvas Set,11.94,24,16253.0,United Kingdom
548160,2023-03-29,22147,Feltcraft Butterfly Hearts,11.74,12,16253.0,United Kingdom
548160,2023-03-29,22150,3 Stripey Mice Feltcraft,12.25,18,16253.0,United Kingdom
548160,2023-03-29,85185B,Pink Horse Sock Puppet Kit,13.27,12,16253.0,United Kingdom
548160,2023-03-29,84879,Assorted Colour Bird Ornament,11.98,16,16253.0,United Kingdom
548160,2023-03-29,23052,Recycled Acapulco Mat Turquoise,18.71,2,16253.0,United Kingdom
548160,2023-03-29,85049D,Bright Blues Ribbons,11.53,24,16253.0,United Kingdom
548160,2023-03-29,22076,6 Ribbons Empire,11.94,24,16253.0,United Kingdom
548162,2023-03-29,21240,Blue Polkadot Cup,11.92,3,13162.0,United Kingdom
548162,2023-03-29,21243,Pink Polkadot Plate,13.62,1,13162.0,United Kingdom
548162,2023-03-29,21381,Mini Wooden Happy Birthday Garland,14.48,1,13162.0,United Kingdom
548162,2023-03-29,21424,Woodland Storage Box Large,17.05,5,13162.0,United Kingdom
548162,2023-03-29,21426,Woodland Storage Box Small,15.33,3,13162.0,United Kingdom
548162,2023-03-29,21481,Fawn Blue Hot Water Bottle,17.05,1,13162.0,United Kingdom
548162,2023-03-29,21484,Chick Grey Hot Water Bottle,18.75,1,13162.0,United Kingdom
548162,2023-03-29,21556,Ceramic Strawberry Money Box,14.48,3,13162.0,United Kingdom
548162,2023-03-29,21671,Red Spot Ceramic Drawer Knob,13.62,11,13162.0,United Kingdom
548162,2023-03-29,21672,White Spot Red Ceramic Drawer Knob,12.77,5,13162.0,United Kingdom
548162,2023-03-29,21731,Red Toadstool Led Night Light,14.48,3,13162.0,United Kingdom
548162,2023-03-29,21912,Vintage Snakes & Ladders,17.9,5,13162.0,United Kingdom
548162,2023-03-29,21934,Skull Shoulder Bag,13.62,8,13162.0,United Kingdom
548162,2023-03-29,21976,Pack Of 60 Mushroom Cake Cases,12.38,4,13162.0,United Kingdom
548162,2023-03-29,21989,Pack Of 20 Skull Paper Napkins,11.92,9,13162.0,United Kingdom
548162,2023-03-29,22074,6 Ribbons Shimmering Pinks,12.77,2,13162.0,United Kingdom
548162,2023-03-29,22076,6 Ribbons Empire,12.77,2,13162.0,United Kingdom
548162,2023-03-29,22077,6 Ribbons Rustic Charm,14.48,2,13162.0,United Kingdom
548162,2023-03-29,22079,Ribbon Reel Hearts Design,12.77,2,13162.0,United Kingdom
548162,2023-03-29,22083,Paper Chain Kit Retrospot,17.05,1,13162.0,United Kingdom
548162,2023-03-29,22084,Paper Chain Kit Empire,15.33,2,13162.0,United Kingdom
548162,2023-03-29,22110,Bird House Hot Water Bottle,17.9,3,13162.0,United Kingdom
548162,2023-03-29,22174,Photo Cube,14.48,2,13162.0,United Kingdom
548162,2023-03-29,22326,Round Snack Boxes Set Of4 Woodland,17.05,5,13162.0,United Kingdom
548162,2023-03-29,22327,Round Snack Boxes Set Of 4 Skulls,17.05,2,13162.0,United Kingdom
548162,2023-03-29,22328,Round Snack Boxes Set Of 4 Fruits,14.48,14,13162.0,United Kingdom
548162,2023-03-29,22355,Charlotte Bag Suki Design,12.77,175,13162.0,United Kingdom
548162,2023-03-29,22356,Charlotte Bag Pink Polkadot,12.77,45,13162.0,United Kingdom
548162,2023-03-29,22367,Childrens Apron Spaceboy Design,15.33,1,13162.0,United Kingdom
548162,2023-03-29,22377,Bottle Bag Retrospot,14.48,1,13162.0,United Kingdom
548162,2023-03-29,22380,Toy Tidy Spaceboy,14.48,2,13162.0,United Kingdom
548162,2023-03-29,22417,Pack Of 60 Spaceboy Cake Cases,12.38,2,13162.0,United Kingdom
548162,2023-03-29,22549,Picture Dominoes,12.77,3,13162.0,United Kingdom
548162,2023-03-29,22553,Plasters In Tin Skulls,13.62,2,13162.0,United Kingdom
548162,2023-03-29,22554,Plasters In Tin Woodland Animals,13.62,1,13162.0,United Kingdom
548162,2023-03-29,22560,Traditional Modelling Clay,12.77,1,13162.0,United Kingdom
548162,2023-03-29,22631,Circus Parade Lunch Box,13.62,2,13162.0,United Kingdom
548162,2023-03-29,22644,Ceramic Cherry Cake Money Bank,14.48,2,13162.0,United Kingdom
548162,2023-03-29,22645,Ceramic Heart Fairy Cake Money Bank,14.48,12,13162.0,United Kingdom
548162,2023-03-29,22646,Ceramic Strawberry Cake Money Bank,14.48,1,13162.0,United Kingdom
548162,2023-03-29,22652,Travel Sewing Kit,14.48,6,13162.0,United Kingdom
548162,2023-03-29,22665,Recipe Box Blue Sketchbook Design,17.05,4,13162.0,United Kingdom
548162,2023-03-29,22694,Wicker Star,13.62,2,13162.0,United Kingdom
548162,2023-03-29,22726,Alarm Clock Bakelike Green,18.75,2,13162.0,United Kingdom
548162,2023-03-29,22727,Alarm Clock Bakelike Red,18.75,4,13162.0,United Kingdom
548162,2023-03-29,22730,Alarm Clock Bakelike Ivory,18.75,1,13162.0,United Kingdom
548162,2023-03-29,22835,Hot Water Bottle I Am So Poorly,17.9,1,13162.0,United Kingdom
548162,2023-03-29,22896,Peg Bag Apples Design,16.18,4,13162.0,United Kingdom
548162,2023-03-29,22898,Childrens Apron Apples Design,15.33,3,13162.0,United Kingdom
548162,2023-03-29,35970,Zinc Folkart Sleigh Bells,14.48,1,13162.0,United Kingdom
548162,2023-03-29,47559B,Tea Time Oven Glove,13.62,1,13162.0,United Kingdom
548162,2023-03-29,47580,Tea Time Des Tea Cosy,16.18,4,13162.0,United Kingdom
548162,2023-03-29,82583,Hot Baths Metal Sign,15.33,17,13162.0,United Kingdom
548162,2023-03-29,84029G,Knitted Union Flag Hot Water Bottle,18.75,4,13162.0,United Kingdom
548162,2023-03-29,84030E,English Rose Hot Water Bottle,18.75,1,13162.0,United Kingdom
548162,2023-03-29,84692,Box Of 24 Cocktail Parasols,11.92,14,13162.0,United Kingdom
548162,2023-03-29,84991,60 Teatime Fairy Cake Cases,11.53,13,13162.0,United Kingdom
548162,2023-03-29,84997B,Childrens Cutlery Retrospot Red,18.75,11,13162.0,United Kingdom
548162,2023-03-29,84997C,Childrens Cutlery Polkadot Blue,18.75,6,13162.0,United Kingdom
548162,2023-03-29,84997D,Childrens Cutlery Polkadot Pink,18.75,3,13162.0,United Kingdom
548162,2023-03-29,20675,Blue Polkadot Bowl,12.77,1,13162.0,United Kingdom
548162,2023-03-29,20677,Pink Polkadot Bowl,12.77,4,13162.0,United Kingdom
548162,2023-03-29,20717,Strawberry Shopper Bag,12.77,2,13162.0,United Kingdom
548162,2023-03-29,20719,Woodland Charlotte Bag,12.77,71,13162.0,United Kingdom
548162,2023-03-29,20723,Strawberry Charlotte Bag,12.77,57,13162.0,United Kingdom
548162,2023-03-29,20724,Red Retrospot Charlotte Bag,12.77,89,13162.0,United Kingdom
548162,2023-03-29,20734,Silver Mini Tape Measure,11.92,7,13162.0,United Kingdom
548162,2023-03-29,21041,Red Retrospot Oven Glove Double,17.05,7,13162.0,United Kingdom
548162,2023-03-29,21082,Set/20 Fruit Salad Paper Napkins,11.92,4,13162.0,United Kingdom
548162,2023-03-29,21154,Red Retrospot Oven Glove,13.62,10,13162.0,United Kingdom
548162,2023-03-29,21155,Red Retrospot Peg Bag,15.33,11,13162.0,United Kingdom
548162,2023-03-29,21212,Pack Of 72 Retrospot Cake Cases,12.38,64,13162.0,United Kingdom
548162,2023-03-29,21213,Pack Of 72 Skull Cake Cases,12.38,14,13162.0,United Kingdom
548162,2023-03-29,21238,Red Retrospot Cup,11.92,2,13162.0,United Kingdom
548162,2023-03-29,21239,Pink Polkadot Cup,11.92,10,13162.0,United Kingdom
548162,2023-03-29,21929,Jumbo Bag Pink Vintage Paisley,7.67,30,13162.0,United Kingdom
548162,2023-03-29,22384,Lunch Bag Pink Polkadot,7.67,2,13162.0,United Kingdom
548162,2023-03-29,20725,Lunch Bag Red Retrospot,7.67,43,13162.0,United Kingdom
548162,2023-03-29,20728,Lunch Bag Cars Blue,7.67,17,13162.0,United Kingdom
548163,2023-03-29,21428,Set3 Book Box Green Gingham Flower,18.75,1,16163.0,United Kingdom
548163,2023-03-29,21430,Set/3 Red Gingham Rose Storage Box,17.9,2,16163.0,United Kingdom
548163,2023-03-29,21714,Citronella Candle Garden Pot,12.77,1,16163.0,United Kingdom
548163,2023-03-29,21719,Lovely Bonbon Sticker Sheet,11.92,1,16163.0,United Kingdom
548163,2023-03-29,21931,Jumbo Storage Bag Suki,14.48,3,16163.0,United Kingdom
548163,2023-03-29,21944,Kittens Design Flannel,11.92,1,16163.0,United Kingdom
548163,2023-03-29,21974,Set Of 36 Paisley Flower Doilies,14.09,1,16163.0,United Kingdom
548163,2023-03-29,22041,"Record Frame 7"" Single Size",15.33,1,16163.0,United Kingdom
548163,2023-03-29,22090,Paper Bunting Retrospot,17.05,3,16163.0,United Kingdom
548163,2023-03-29,22135,Mini Ladle Love Heart Pink,11.1,1,16163.0,United Kingdom
548163,2023-03-29,22178,Victorian Glass Hanging T-Light,12.77,1,16163.0,United Kingdom
548163,2023-03-29,22197,Popcorn Holder,11.92,2,16163.0,United Kingdom
548163,2023-03-29,22207,Frying Pan Union Flag,18.75,1,16163.0,United Kingdom
548163,2023-03-29,22317,Five Cats Hanging Decoration,16.18,1,16163.0,United Kingdom
548163,2023-03-29,22352,Lunch Box With Cutlery Retrospot,15.33,2,16163.0,United Kingdom
548163,2023-03-29,22411,Jumbo Shopper Vintage Red Paisley,14.48,8,16163.0,United Kingdom
548163,2023-03-29,22502,Picnic Basket Wicker Small,18.75,2,16163.0,United Kingdom
548163,2023-03-29,22518,Childs Garden Brush Blue,14.48,1,16163.0,United Kingdom
548163,2023-03-29,22629,Spaceboy Lunch Box,12.77,2,16163.0,United Kingdom
548163,2023-03-29,22630,Dolly Girl Lunch Box,12.77,1,16163.0,United Kingdom
548163,2023-03-29,22676,French Blue Metal Door Sign 1,12.77,1,16163.0,United Kingdom
548163,2023-03-29,22680,French Blue Metal Door Sign 5,12.77,1,16163.0,United Kingdom
548163,2023-03-29,22697,Green Regency Teacup And Saucer,16.18,1,16163.0,United Kingdom
548163,2023-03-29,22698,Pink Regency Teacup And Saucer,16.18,1,16163.0,United Kingdom
548163,2023-03-29,22699,Roses Regency Teacup And Saucer,16.18,1,16163.0,United Kingdom
548163,2023-03-29,22719,Gumball Monochrome Coat Rack,12.77,5,16163.0,United Kingdom
548163,2023-03-29,22900,Set 2 Tea Towels I Love London,14.48,1,16163.0,United Kingdom
548163,2023-03-29,22995,Travel Card Wallet Suki,11.1,2,16163.0,United Kingdom
548163,2023-03-29,23182,Toilet Sign Occupied Or Vacant,12.81,3,16163.0,United Kingdom
548163,2023-03-29,35961,Folkart Zinc Heart Christmas Dec,11.92,1,16163.0,United Kingdom
548163,2023-03-29,72349B,Set/6 Purple Butterfly T-Lights,14.48,3,16163.0,United Kingdom
548163,2023-03-29,84509A,Set Of 4 English Rose Placemats,17.9,1,16163.0,United Kingdom
548163,2023-03-29,84596F,Small Marshmallows Pink Bowl,12.77,1,16163.0,United Kingdom
548163,2023-03-29,84828,Jungle Popsicles Ice Lolly Moulds,12.77,2,16163.0,United Kingdom
548163,2023-03-29,84970S,Hanging Heart Zinc T-Light Holder,12.38,1,16163.0,United Kingdom
548163,2023-03-29,84987,Set Of 36 Teatime Paper Doilies,14.09,1,16163.0,United Kingdom
548163,2023-03-29,85062,Pearl Crystal Pumpkin T-Light Hldr,12.77,1,16163.0,United Kingdom
548163,2023-03-29,20658,Red Retrospot Luggage Tag,12.77,7,16163.0,United Kingdom
548163,2023-03-29,20676,Red Retrospot Bowl,12.77,1,16163.0,United Kingdom
548163,2023-03-29,20735,Black Mini Tape Measure,11.92,2,16163.0,United Kingdom
548163,2023-03-29,21061,Party Invites Football,11.92,1,16163.0,United Kingdom
548163,2023-03-29,21157,Red Retrospot Washbag,14.48,1,16163.0,United Kingdom
548163,2023-03-29,21166,Cook With Wine Metal Sign,14.48,1,16163.0,United Kingdom
548163,2023-03-29,21181,Please One Person Metal Sign,14.48,1,16163.0,United Kingdom
548163,2023-03-29,21210,Set Of 72 Retrospot Paper Doilies,14.09,1,16163.0,United Kingdom
548163,2023-03-29,21218,Red Spotty Biscuit Tin,18.75,1,16163.0,United Kingdom
548163,2023-03-29,21328,Balloons Writing Set,13.62,1,16163.0,United Kingdom
548163,2023-03-29,21928,Jumbo Bag Scandinavian Blue Paisley,7.24,4,16163.0,United Kingdom
548163,2023-03-29,22385,Jumbo Bag Spaceboy Design,7.24,2,16163.0,United Kingdom
548163,2023-03-29,22386,Jumbo Bag Pink Polkadot,7.24,4,16163.0,United Kingdom
548163,2023-03-29,85099B,Jumbo Bag Red Retrospot,7.24,8,16163.0,United Kingdom
548163,2023-03-29,85099C,Jumbo Bag Baroque Black White,7.24,1,16163.0,United Kingdom
548163,2023-03-29,20711,Jumbo Bag Toys,7.24,3,16163.0,United Kingdom
548163,2023-03-29,20713,Jumbo Bag Owls,7.24,5,16163.0,United Kingdom
548163,2023-03-29,21033,Jumbo Bag Charlie And Lola Toys,7.24,2,16163.0,United Kingdom
548163,2023-03-29,22383,Lunch Bag Suki Design,7.67,3,16163.0,United Kingdom
548163,2023-03-29,20727,Lunch Bag Black Skull,7.67,5,16163.0,United Kingdom
548164,2023-03-29,21035,Set/2 Red Retrospot Tea Towels,16.66,1,14164.0,United Kingdom
548164,2023-03-29,21124,Set/10 Blue Polkadot Party Candles,12.77,1,14164.0,United Kingdom
548164,2023-03-29,21156,Retrospot Childrens Apron,14.48,2,14164.0,United Kingdom
548164,2023-03-29,21157,Red Retrospot Washbag,14.48,2,14164.0,United Kingdom
548164,2023-03-29,21179,No Junk Mail Metal Sign,13.62,1,14164.0,United Kingdom
548164,2023-03-29,21181,Please One Person Metal Sign,14.48,1,14164.0,United Kingdom
548164,2023-03-29,21430,Set/3 Red Gingham Rose Storage Box,17.9,1,14164.0,United Kingdom
548164,2023-03-29,21714,Citronella Candle Garden Pot,12.77,1,14164.0,United Kingdom
548164,2023-03-29,21731,Red Toadstool Led Night Light,14.48,3,14164.0,United Kingdom
548164,2023-03-29,21786,Polkadot Rain Hat,11.06,1,14164.0,United Kingdom
548164,2023-03-29,21866,Union Jack Flag Luggage Tag,13.62,1,14164.0,United Kingdom
548164,2023-03-29,21931,Jumbo Storage Bag Suki,14.48,11,14164.0,United Kingdom
548164,2023-03-29,22041,"Record Frame 7"" Single Size",15.33,1,14164.0,United Kingdom
548164,2023-03-29,22069,Brown Pirate Treasure Chest,14.48,1,14164.0,United Kingdom
548164,2023-03-29,22090,Paper Bunting Retrospot,17.05,1,14164.0,United Kingdom
548164,2023-03-29,22109,Full English Breakfast Plate,17.9,1,14164.0,United Kingdom
548164,2023-03-29,22207,Frying Pan Union Flag,18.75,1,14164.0,United Kingdom
548164,2023-03-29,22212,Four Hook White Lovebirds,14.48,1,14164.0,United Kingdom
548164,2023-03-29,22379,Recycling Bag Retrospot,15.33,1,14164.0,United Kingdom
548164,2023-03-29,22411,Jumbo Shopper Vintage Red Paisley,14.48,3,14164.0,United Kingdom
548164,2023-03-29,22467,Gumball Coat Rack,15.33,1,14164.0,United Kingdom
548164,2023-03-29,22499,Wooden Union Jack Bunting,18.75,2,14164.0,United Kingdom
548164,2023-03-29,22502,Picnic Basket Wicker Small,18.75,1,14164.0,United Kingdom
548164,2023-03-29,22517,Childs Garden Rake Pink,14.48,1,14164.0,United Kingdom
548164,2023-03-29,22570,Feltcraft Cushion Rabbit,17.9,1,14164.0,United Kingdom
548164,2023-03-29,22630,Dolly Girl Lunch Box,12.77,1,14164.0,United Kingdom
548164,2023-03-29,22719,Gumball Monochrome Coat Rack,12.77,4,14164.0,United Kingdom
548164,2023-03-29,22900,Set 2 Tea Towels I Love London,14.48,4,14164.0,United Kingdom
548164,2023-03-29,23182,Toilet Sign Occupied Or Vacant,12.81,1,14164.0,United Kingdom
548164,2023-03-29,37340,Multicolour Spring Flower Mug,18.75,1,14164.0,United Kingdom
548164,2023-03-29,72801C,4 Rose Pink Dinner Candles,12.77,1,14164.0,United Kingdom
548164,2023-03-29,75049L,Large Circular Mirror Mobile,12.77,4,14164.0,United Kingdom
548164,2023-03-29,82581,Toilet Metal Sign,11.53,1,14164.0,United Kingdom
548164,2023-03-29,82600,N0 Singing Metal Sign,14.48,1,14164.0,United Kingdom
548164,2023-03-29,84987,Set Of 36 Teatime Paper Doilies,14.09,1,14164.0,United Kingdom
548164,2023-03-29,84997A,Childrens Cutlery Polkadot Green,18.75,2,14164.0,United Kingdom
548164,2023-03-29,20711,Jumbo Bag Toys,7.24,2,14164.0,United Kingdom
548164,2023-03-29,21928,Jumbo Bag Scandinavian Blue Paisley,7.24,2,14164.0,United Kingdom
548164,2023-03-29,22386,Jumbo Bag Pink Polkadot,7.24,1,14164.0,United Kingdom
548164,2023-03-29,85099B,Jumbo Bag Red Retrospot,7.24,4,14164.0,United Kingdom
548164,2023-03-29,22383,Lunch Bag Suki Design,7.67,1,14164.0,United Kingdom
548165,2023-03-29,22379,Recycling Bag Retrospot,15.33,1,12165.0,United Kingdom
548165,2023-03-29,22411,Jumbo Shopper Vintage Red Paisley,14.48,5,12165.0,United Kingdom
548165,2023-03-29,22488,Natural Slate Rectangle Chalkboard,13.62,1,12165.0,United Kingdom
548165,2023-03-29,22513,Doorstop Football Design,17.9,1,12165.0,United Kingdom
548165,2023-03-29,22630,Dolly Girl Lunch Box,12.77,1,12165.0,United Kingdom
548165,2023-03-29,22659,Lunch Box I Love London,12.77,1,12165.0,United Kingdom
548165,2023-03-29,22666,Recipe Box Pantry Yellow Design,17.05,1,12165.0,United Kingdom
548165,2023-03-29,22668,Pink Baby Bunting,16.18,1,12165.0,United Kingdom
548165,2023-03-29,22900,Set 2 Tea Towels I Love London,14.48,3,12165.0,United Kingdom
548165,2023-03-29,23182,Toilet Sign Occupied Or Vacant,12.81,3,12165.0,United Kingdom
548165,2023-03-29,47566B,Tea Time Party Bunting,18.75,1,12165.0,United Kingdom
548165,2023-03-29,72349B,Set/6 Purple Butterfly T-Lights,14.48,7,12165.0,United Kingdom
548165,2023-03-29,82599,Fanny's Rest Stopmetal Sign,14.48,1,12165.0,United Kingdom
548165,2023-03-29,84987,Set Of 36 Teatime Paper Doilies,14.09,1,12165.0,United Kingdom
548165,2023-03-29,85049B,Lush Greens Ribbons,12.77,1,12165.0,United Kingdom
548165,2023-03-29,85049D,Bright Blues Ribbons,12.77,1,12165.0,United Kingdom
548165,2023-03-29,21035,Set/2 Red Retrospot Tea Towels,16.66,1,12165.0,United Kingdom
548165,2023-03-29,21218,Red Spotty Biscuit Tin,18.75,1,12165.0,United Kingdom
548165,2023-03-29,21558,Skull Lunch Box With Cutlery,15.33,1,12165.0,United Kingdom
548165,2023-03-29,21668,Red Stripe Ceramic Drawer Knob,12.77,3,12165.0,United Kingdom
548165,2023-03-29,21700,Big Doughnut Fridge Magnets,18.75,1,12165.0,United Kingdom
548165,2023-03-29,21731,Red Toadstool Led Night Light,14.48,2,12165.0,United Kingdom
548165,2023-03-29,21931,Jumbo Storage Bag Suki,14.48,3,12165.0,United Kingdom
548165,2023-03-29,21936,Red Retrospot Picnic Bag,16.18,1,12165.0,United Kingdom
548165,2023-03-29,21977,Pack Of 60 Pink Paisley Cake Cases,12.38,2,12165.0,United Kingdom
548165,2023-03-29,22055,Mini Cake Stand Hanging Strawbery,13.62,1,12165.0,United Kingdom
548165,2023-03-29,22197,Popcorn Holder,11.92,20,12165.0,United Kingdom
548165,2023-03-29,22361,Glass Jar Daisy Fresh Cotton Wool,16.18,1,12165.0,United Kingdom
548165,2023-03-29,22371,Airline Bag Vintage Tokyo 78,18.75,1,12165.0,United Kingdom
548165,2023-03-29,22386,Jumbo Bag Pink Polkadot,7.24,2,12165.0,United Kingdom
548165,2023-03-29,20712,Jumbo Bag Woodland Animals,7.24,2,12165.0,United Kingdom
548165,2023-03-29,20713,Jumbo Bag Owls,7.24,5,12165.0,United Kingdom
548165,2023-03-29,21033,Jumbo Bag Charlie And Lola Toys,7.24,1,12165.0,United Kingdom
548165,2023-03-29,22383,Lunch Bag Suki Design,7.67,1,12165.0,United Kingdom
548165,2023-03-29,20726,Lunch Bag Woodland,7.67,1,12165.0,United Kingdom
548165,2023-03-29,20727,Lunch Bag Black Skull,7.67,1,12165.0,United Kingdom
548166,2023-03-29,20717,Strawberry Shopper Bag,12.77,2,16166.0,United Kingdom
548166,2023-03-29,21035,Set/2 Red Retrospot Tea Towels,16.66,1,16166.0,United Kingdom
548166,2023-03-29,21169,You're Confusing Me Metal Sign,14.48,1,16166.0,United Kingdom
548166,2023-03-29,21200,Multicolour Honeycomb Paper Garland,13.62,4,16166.0,United Kingdom
548166,2023-03-29,21215,Ivory Paper Cup Cake Cases,11.53,1,16166.0,United Kingdom
548166,2023-03-29,21494,Rotating Leaves T-Light Holder,16.18,1,16166.0,United Kingdom
548166,2023-03-29,21679,Skulls Stickers,11.92,1,16166.0,United Kingdom
548166,2023-03-29,21700,Big Doughnut Fridge Magnets,18.75,1,16166.0,United Kingdom
548166,2023-03-29,21930,Jumbo Storage Bag Skulls,15.33,2,16166.0,United Kingdom
548166,2023-03-29,21931,Jumbo Storage Bag Suki,14.48,2,16166.0,United Kingdom
548166,2023-03-29,21974,Set Of 36 Paisley Flower Doilies,14.09,2,16166.0,United Kingdom
548166,2023-03-29,21977,Pack Of 60 Pink Paisley Cake Cases,12.38,1,16166.0,United Kingdom
548166,2023-03-29,22041,"Record Frame 7"" Single Size",15.33,1,16166.0,United Kingdom
548166,2023-03-29,22064,Pink Doughnut Trinket Pot,13.62,1,16166.0,United Kingdom
548166,2023-03-29,22098,Boudoir Square Tissue Box,12.77,1,16166.0,United Kingdom
548166,2023-03-29,22197,Popcorn Holder,11.92,2,16166.0,United Kingdom
548166,2023-03-29,22308,Tea Cosy Blue Stripe,15.33,1,16166.0,United Kingdom
548166,2023-03-29,22379,Recycling Bag Retrospot,15.33,3,16166.0,United Kingdom
548166,2023-03-29,22381,Toy Tidy Pink Polkadot,15.33,2,16166.0,United Kingdom
548166,2023-03-29,22411,Jumbo Shopper Vintage Red Paisley,14.48,7,16166.0,United Kingdom
548166,2023-03-29,22412,Metal Sign Neighbourhood Witch,14.48,1,16166.0,United Kingdom
548166,2023-03-29,22457,Natural Slate Heart Chalkboard,16.18,1,16166.0,United Kingdom
548166,2023-03-29,22629,Spaceboy Lunch Box,12.77,1,16166.0,United Kingdom
548166,2023-03-29,22650,Ceramic Pirate Chest Money Bank,13.62,1,16166.0,United Kingdom
548166,2023-03-29,22719,Gumball Monochrome Coat Rack,12.77,3,16166.0,United Kingdom
548166,2023-03-29,22728,Alarm Clock Bakelike Pink,18.75,1,16166.0,United Kingdom
548166,2023-03-29,82494L,Wooden Frame Antique White,18.75,7,16166.0,United Kingdom
548166,2023-03-29,21171,Bathroom Metal Sign,11.53,1,16166.0,United Kingdom
548166,2023-03-29,84380,Set Of 3 Butterfly Cookie Cutters,13.62,1,16166.0,United Kingdom
548166,2023-03-29,84509A,Set Of 4 English Rose Placemats,17.9,3,16166.0,United Kingdom
548166,2023-03-29,84510A,Set Of 4 English Rose Coasters,12.77,3,16166.0,United Kingdom
548166,2023-03-29,84519A,Tomato Charlie+Lola Coaster Set,16.18,1,16166.0,United Kingdom
548166,2023-03-29,20711,Jumbo Bag Toys,7.24,1,16166.0,United Kingdom
548166,2023-03-29,20712,Jumbo Bag Woodland Animals,7.24,2,16166.0,United Kingdom
548166,2023-03-29,20713,Jumbo Bag Owls,7.24,5,16166.0,United Kingdom
548166,2023-03-29,21033,Jumbo Bag Charlie And Lola Toys,7.24,1,16166.0,United Kingdom
548166,2023-03-29,21928,Jumbo Bag Scandinavian Blue Paisley,7.24,2,16166.0,United Kingdom
548166,2023-03-29,22385,Jumbo Bag Spaceboy Design,7.24,1,16166.0,United Kingdom
548166,2023-03-29,22386,Jumbo Bag Pink Polkadot,7.24,3,16166.0,United Kingdom
548166,2023-03-29,85099B,Jumbo Bag Red Retrospot,7.24,3,16166.0,United Kingdom
548166,2023-03-29,20727,Lunch Bag Black Skull,7.67,1,16166.0,United Kingdom
548167,2023-03-29,20676,Red Retrospot Bowl,12.77,4,12167.0,United Kingdom
548167,2023-03-29,21035,Set/2 Red Retrospot Tea Towels,16.66,1,12167.0,United Kingdom
548167,2023-03-29,21080,Set/20 Red Retrospot Paper Napkins,12.77,3,12167.0,United Kingdom
548167,2023-03-29,21086,Set/6 Red Spotty Paper Cups,11.92,1,12167.0,United Kingdom
548167,2023-03-29,21094,Set/6 Red Spotty Paper Plates,12.77,2,12167.0,United Kingdom
