TransactionNo,Date,ProductNo,ProductName,Price,Quantity,CustomerNo,Country
548038,2023-03-29,84632,Decorative Hanging Shelving Unit,71.7,1,15696.0,United Kingdom
548194,2023-03-29,22606,Wooden Skittles Garden Set,44.37,1,14194.0,United Kingdom
548203,2023-03-29,23009,I Love London Baby Gift Set,40.95,2,14203.0,United Kingdom
548162,2023-03-29,22423,Regency Cakestand 3 Tier,35.83,17,13162.0,United Kingdom
548163,2023-03-29,22424,Enamel Bread Bin Cream,35.83,1,16163.0,United Kingdom
548163,2023-03-29,22526,Wheelbarrow For Children,35.83,1,16163.0,United Kingdom
548165,2023-03-29,22282,12 Egg House Painted Wood,35.83,1,12165.0,United Kingdom
548167,2023-03-29,85066,Cream Sweetheart Mini Chest,35.83,1,12167.0,United Kingdom
548191,2023-03-29,22485,Set Of 2 Wooden Market Crates,35.83,3,16191.0,United Kingdom
547990,2023-03-29,21277,French Style Embossed Heart Cabinet,32.75,1,15589.0,United Kingdom
548163,2023-03-29,22501,Picnic Basket Wicker Large,31.56,1,16163.0,United Kingdom
548166,2023-03-29,22501,Picnic Basket Wicker Large,31.56,1,16166.0,United Kingdom
548167,2023-03-29,22501,Picnic Basket Wicker Large,31.56,3,12167.0,United Kingdom
548194,2023-03-29,22501,Picnic Basket Wicker Large,31.56,1,14194.0,United Kingdom
548163,2023-03-29,22776,Sweetheart 3 Tier Cake Stand,30.71,1,16163.0,United Kingdom
548164,2023-03-29,22776,Sweetheart 3 Tier Cake Stand,30.71,1,14164.0,United Kingdom
548191,2023-03-29,22220,Cake Stand Lovebird 2 Tier White,30.71,7,16191.0,United Kingdom
548191,2023-03-29,22768,Family Photo Frame Cornice,30.71,1,16191.0,United Kingdom
548194,2023-03-29,22487,White Wood Garden Plant Ladder,30.71,2,14194.0,United Kingdom
548194,2023-03-29,22968,Rose Cottage Keepsake Box,30.71,1,14194.0,United Kingdom
548203,2023-03-29,21621,Vintage Union Jack Bunting,30.7,45,14203.0,United Kingdom
548003,2023-03-29,22848,Bread Bin Diner Style Pink,27.62,1,18044.0,United Kingdom
548003,2023-03-29,22849,Bread Bin Diner Style Mint,27.62,1,18044.0,United Kingdom
548188,2023-03-29,22848,Bread Bin Diner Style Pink,27.62,1,13263.0,United Kingdom
548198,2023-03-29,23008,Dolly Girl Baby Gift Set,27.62,1,16712.0,United Kingdom
548162,2023-03-29,21524,Doormat Spotty Home Sweet Home,27.3,1,13162.0,United Kingdom
548162,2023-03-29,22624,Ivory Kitchen Scales,27.3,1,13162.0,United Kingdom
548162,2023-03-29,22625,Red Kitchen Scales,27.3,2,13162.0,United Kingdom
548162,2023-03-29,48189,Doormat Friendship,27.3,3,13162.0,United Kingdom
548164,2023-03-29,20685,Doormat Red Retrospot,27.3,1,14164.0,United Kingdom
548164,2023-03-29,22844,Vintage Cream Dog Food Container,27.3,1,14164.0,United Kingdom
548165,2023-03-29,22171,3 Hook Photo Shelf Antique White,27.3,1,12165.0,United Kingdom
548167,2023-03-29,20685,Doormat Red Retrospot,27.3,2,12167.0,United Kingdom
548168,2023-03-29,22192,Blue Diner Wall Clock,27.3,1,14168.0,United Kingdom
548191,2023-03-29,22171,3 Hook Photo Shelf Antique White,27.3,1,16191.0,United Kingdom
548194,2023-03-29,21621,Vintage Union Jack Bunting,27.3,1,14194.0,United Kingdom
548194,2023-03-29,23053,Recycled Acapulco Mat Pink,27.3,1,14194.0,United Kingdom
548163,2023-03-29,21257,Victorian Sewing Box Medium,26.43,1,16163.0,United Kingdom
548166,2023-03-29,21257,Victorian Sewing Box Medium,26.43,1,16166.0,United Kingdom
548167,2023-03-29,22283,6 Egg House Painted Wood,26.43,2,12167.0,United Kingdom
548168,2023-03-29,22166,Wall Mirror Rectangle Diamante Pink,26.43,1,14168.0,United Kingdom
548191,2023-03-29,21524,Doormat Spotty Home Sweet Home,26.43,1,16191.0,United Kingdom
548191,2023-03-29,22443,Grow Your Own Herbs Set Of 3,26.43,1,16191.0,United Kingdom
548191,2023-03-29,22692,Doormat Welcome To Our Home,26.43,1,16191.0,United Kingdom
548191,2023-03-29,48138,Doormat Union Flag,26.43,1,16191.0,United Kingdom
548191,2023-03-29,48185,Doormat Fairy Cake,26.43,1,16191.0,United Kingdom
548194,2023-03-29,21524,Doormat Spotty Home Sweet Home,26.43,1,14194.0,United Kingdom
548010,2023-03-29,23008,Dolly Girl Baby Gift Set,25.57,18,14646.0,Netherlands
548010,2023-03-29,23007,Spaceboy Baby Gift Set,25.57,18,14646.0,Netherlands
548010,2023-03-29,23010,Circus Parade Baby Gift Set,25.57,6,14646.0,Netherlands
548011,2023-03-29,22848,Bread Bin Diner Style Pink,25.57,12,14646.0,Netherlands
548011,2023-03-29,22849,Bread Bin Diner Style Mint,25.57,12,14646.0,Netherlands
548196,2023-03-29,22605,Wooden Croquet Garden Set,25.57,1,16011.0,United Kingdom
548199,2023-03-29,21628,Triangular Pouffe Vintage,25.57,1,16945.0,United Kingdom
548203,2023-03-29,22927,Green Giant Garden Thermometer,25.57,7,14203.0,United Kingdom
548203,2023-03-29,22926,Ivory Giant Garden Thermometer,25.57,15,14203.0,United Kingdom
548204,2023-03-29,79321,Chilli Lights,25.57,14,13204.0,United Kingdom
547985,2023-03-29,22082,Ribbon Reel Stripes Design,11.94,10,16455.0,United Kingdom
547985,2023-03-29,22081,Ribbon Reel Flora + Fauna,11.94,10,16455.0,United Kingdom
547985,2023-03-29,22079,Ribbon Reel Hearts Design,11.94,10,16455.0,United Kingdom
547985,2023-03-29,22078,Ribbon Reel Lace Design,12.4,10,16455.0,United Kingdom
547985,2023-03-29,85049C,Romantic Pinks Ribbons,11.53,12,16455.0,United Kingdom
547985,2023-03-29,85049G,Chocolate Box Ribbons,11.53,12,16455.0,United Kingdom
547985,2023-03-29,22077,6 Ribbons Rustic Charm,11.94,12,16455.0,United Kingdom
547985,2023-03-29,22621,Traditional Knitting Nancy,11.74,12,16455.0,United Kingdom
547985,2023-03-29,20969,Red Floral Feltcraft Shoulder Bag,14.09,8,16455.0,United Kingdom
547985,2023-03-29,20970,Pink Floral Feltcraft Shoulder Bag,14.09,8,16455.0,United Kingdom
547985,2023-03-29,20967,Grey Floral Feltcraft Shoulder Bag,14.09,8,16455.0,United Kingdom
547985,2023-03-29,22570,Feltcraft Cushion Rabbit,14.09,8,16455.0,United Kingdom
547985,2023-03-29,22569,Feltcraft Cushion Butterfly,14.09,8,16455.0,United Kingdom
547985,2023-03-29,22568,Feltcraft Cushion Owl,14.09,8,16455.0,United Kingdom
547985,2023-03-29,22150,3 Stripey Mice Feltcraft,12.25,12,16455.0,United Kingdom
547985,2023-03-29,22149,Feltcraft 6 Flower Friends,12.4,12,16455.0,United Kingdom
547985,2023-03-29,22147,Feltcraft Butterfly Hearts,11.74,12,16455.0,United Kingdom
547985,2023-03-29,20971,Pink Blue Felt Craft Trinket Box,11.53,12,16455.0,United Kingdom
547985,2023-03-29,20972,Pink Cream Felt Craft Trinket Box,11.53,12,16455.0,United Kingdom
547986,2023-03-29,21931,Jumbo Storage Bag Suki,12.25,10,18177.0,United Kingdom
547986,2023-03-29,21936,Red Retrospot Picnic Bag,13.27,5,18177.0,United Kingdom
547986,2023-03-29,21937,Strawberry Picnic Bag,13.27,5,18177.0,United Kingdom
547986,2023-03-29,21932,Scandinavian Paisley Picnic Bag,13.27,5,18177.0,United Kingdom
547986,2023-03-29,21928,Jumbo Bag Scandinavian Blue Paisley,6.13,10,18177.0,United Kingdom
547986,2023-03-29,20713,Jumbo Bag Owls,6.13,4,18177.0,United Kingdom
547986,2023-03-29,21929,Jumbo Bag Pink Vintage Paisley,6.13,10,18177.0,United Kingdom
547986,2023-03-29,85099C,Jumbo Bag Baroque Black White,6.13,10,18177.0,United Kingdom
547986,2023-03-29,85099B,Jumbo Bag Red Retrospot,6.13,10,18177.0,United Kingdom
547986,2023-03-29,85099F,Jumbo Bag Strawberry,6.13,10,18177.0,United Kingdom
547987,2023-03-29,21931,Jumbo Storage Bag Suki,12.25,10,17428.0,United Kingdom
547987,2023-03-29,22411,Jumbo Shopper Vintage Red Paisley,12.25,10,17428.0,United Kingdom
547987,2023-03-29,22661,Charlotte Bag Dolly Girl Design,11.12,10,17428.0,United Kingdom
547987,2023-03-29,22355,Charlotte Bag Suki Design,11.12,10,17428.0,United Kingdom
547987,2023-03-29,20719,Woodland Charlotte Bag,11.12,10,17428.0,United Kingdom
547987,2023-03-29,20723,Strawberry Charlotte Bag,11.12,10,17428.0,United Kingdom
547987,2023-03-29,20724,Red Retrospot Charlotte Bag,11.12,10,17428.0,United Kingdom
547987,2023-03-29,22637,Piggy Bank Retrospot,12.86,4,17428.0,United Kingdom
547987,2023-03-29,21155,Red Retrospot Peg Bag,12.86,6,17428.0,United Kingdom
547987,2023-03-29,20718,Red Retrospot Shopper Bag,11.53,10,17428.0,United Kingdom
547987,2023-03-29,21212,Pack Of 72 Retrospot Cake Cases,10.81,24,17428.0,United Kingdom
547987,2023-03-29,21535,Red Retrospot Small Milk Jug,12.86,6,17428.0,United Kingdom
547987,2023-03-29,22892,Set Of Salt And Pepper Toadstools,11.53,12,17428.0,United Kingdom
547987,2023-03-29,21398,Red Polkadot Coffee Mug,10.65,48,17428.0,United Kingdom
547987,2023-03-29,21399,Blue Polkadot Coffee Mug,10.65,48,17428.0,United Kingdom
547987,2023-03-29,37327,Asstd Multicolour Circles Mug,10.65,48,17428.0,United Kingdom
547987,2023-03-29,37340,Multicolour Spring Flower Mug,10.65,48,17428.0,United Kingdom
547987,2023-03-29,37482P,Cubic Mug Pink Polkadot,10.65,6,17428.0,United Kingdom
547987,2023-03-29,20711,Jumbo Bag Toys,6.13,10,17428.0,United Kingdom
547987,2023-03-29,20712,Jumbo Bag Woodland Animals,6.13,10,17428.0,United Kingdom
547987,2023-03-29,21928,Jumbo Bag Scandinavian Blue Paisley,6.13,10,17428.0,United Kingdom
547987,2023-03-29,20713,Jumbo Bag Owls,6.13,10,17428.0,United Kingdom
547987,2023-03-29,22385,Jumbo Bag Spaceboy Design,6.13,10,17428.0,United Kingdom
547987,2023-03-29,22663,Jumbo Bag Dolly Girl Design,6.13,10,17428.0,United Kingdom
547987,2023-03-29,85099B,Jumbo Bag Red Retrospot,6.13,10,17428.0,United Kingdom
547987,2023-03-29,85099F,Jumbo Bag Strawberry,6.13,10,17428.0,United Kingdom
547987,2023-03-29,20725,Lunch Bag Red Retrospot,5.97,10,17428.0,United Kingdom
547987,2023-03-29,22662,Lunch Bag Dolly Girl Design,5.97,10,17428.0,United Kingdom
547987,2023-03-29,21039,Red Retrospot Shopping Bag,6.43,6,17428.0,United Kingdom
547990,2023-03-29,47580,Tea Time Des Tea Cosy,12.86,6,15589.0,United Kingdom
547990,2023-03-29,84050,Pink Heart Shape Egg Frying Pan,11.94,12,15589.0,United Kingdom
547990,2023-03-29,21358,Toast Its - Happy Birthday,11.53,12,15589.0,United Kingdom
547990,2023-03-29,22499,Wooden Union Jack Bunting,16.35,3,15589.0,United Kingdom
547990,2023-03-29,47566B,Tea Time Party Bunting,15.32,4,15589.0,United Kingdom
547990,2023-03-29,22090,Paper Bunting Retrospot,13.27,6,15589.0,United Kingdom
547990,2023-03-29,85123A,Cream Hanging Heart T-Light Holder,13.27,6,15589.0,United Kingdom
547990,2023-03-29,21533,Retrospot Large Milk Jug,15.32,3,15589.0,United Kingdom
547990,2023-03-29,22892,Set Of Salt And Pepper Toadstools,11.53,12,15589.0,United Kingdom
547990,2023-03-29,21555,Ceramic Strawberry Trinket Tray,12.86,6,15589.0,United Kingdom
547990,2023-03-29,22057,Ceramic Plate Strawberry Design,11.78,12,15589.0,United Kingdom
547990,2023-03-29,84817,Danish Rose Decorative Plate,12.4,6,15589.0,United Kingdom
547990,2023-03-29,21257,Victorian Sewing Box Medium,18.4,2,15589.0,United Kingdom
547990,2023-03-29,22168,Organiser Wood Antique White,18.96,2,15589.0,United Kingdom
547991,2023-03-29,23076,Ice Cream Sundae Lip Gloss,11.53,24,15589.0,United Kingdom
547993,2023-03-29,21212,Pack Of 72 Retrospot Cake Cases,10.81,24,12993.0,United Kingdom
547993,2023-03-29,21975,Pack Of 60 Dinosaur Cake Cases,10.81,24,12993.0,United Kingdom
547993,2023-03-29,21976,Pack Of 60 Mushroom Cake Cases,10.81,24,12993.0,United Kingdom
547993,2023-03-29,21977,Pack Of 60 Pink Paisley Cake Cases,10.81,24,12993.0,United Kingdom
547993,2023-03-29,22951,60 Cake Cases Dolly Girl Design,10.81,24,12993.0,United Kingdom
547993,2023-03-29,22417,Pack Of 60 Spaceboy Cake Cases,10.81,24,12993.0,United Kingdom
547993,2023-03-29,84991,60 Teatime Fairy Cake Cases,10.81,24,12993.0,United Kingdom
547993,2023-03-29,84992,72 Sweetheart Fairy Cake Cases,10.81,24,12993.0,United Kingdom
547993,2023-03-29,22379,Recycling Bag Retrospot,12.4,10,12993.0,United Kingdom
547993,2023-03-29,22380,Toy Tidy Spaceboy,12.4,10,12993.0,United Kingdom
547993,2023-03-29,22178,Victorian Glass Hanging T-Light,11.53,12,12993.0,United Kingdom
547993,2023-03-29,22139,Retrospot Tea Set Ceramic 11 Pc,15.32,3,12993.0,United Kingdom
547993,2023-03-29,22284,Hen House Decoration,11.94,12,12993.0,United Kingdom
547993,2023-03-29,22587,Feltcraft Hairband Red And Blue,11.12,12,12993.0,United Kingdom
547993,2023-03-29,22274,Feltcraft Doll Emily,13.27,6,12993.0,United Kingdom
547993,2023-03-29,22147,Feltcraft Butterfly Hearts,11.74,12,12993.0,United Kingdom
547993,2023-03-29,22652,Travel Sewing Kit,11.94,10,12993.0,United Kingdom
547993,2023-03-29,22722,Set Of 6 Spice Tins Pantry Design,14.3,4,12993.0,United Kingdom
547993,2023-03-29,22854,Cream Sweetheart Egg Holder,15.32,4,12993.0,United Kingdom
547993,2023-03-29,22863,Soap Dish Brocante,13.27,8,12993.0,United Kingdom
547993,2023-03-29,85099B,Jumbo Bag Red Retrospot,6.13,10,12993.0,United Kingdom
547993,2023-03-29,85099F,Jumbo Bag Strawberry,6.13,10,12993.0,United Kingdom
547993,2023-03-29,21929,Jumbo Bag Pink Vintage Paisley,6.13,10,12993.0,United Kingdom
548003,2023-03-29,21506,Fancy Font Birthday Card,10.68,12,18044.0,United Kingdom
548003,2023-03-29,16156S,Wrap Pink Fairy Cakes,10.68,25,18044.0,United Kingdom
548003,2023-03-29,22082,Ribbon Reel Stripes Design,11.94,10,18044.0,United Kingdom
548003,2023-03-29,22081,Ribbon Reel Flora + Fauna,11.94,10,18044.0,United Kingdom
548003,2023-03-29,22699,Roses Regency Teacup And Saucer,13.27,6,18044.0,United Kingdom
548003,2023-03-29,22698,Pink Regency Teacup And Saucer,13.27,6,18044.0,United Kingdom
548003,2023-03-29,22697,Green Regency Teacup And Saucer,13.27,6,18044.0,United Kingdom
548003,2023-03-29,22192,Blue Diner Wall Clock,18.96,2,18044.0,United Kingdom
548003,2023-03-29,22361,Glass Jar Daisy Fresh Cotton Wool,13.27,6,18044.0,United Kingdom
548003,2023-03-29,22362,Glass Jar Peacock Bath Salts,13.27,6,18044.0,United Kingdom
548003,2023-03-29,22915,Assorted Bottle Top Magnets,10.68,12,18044.0,United Kingdom
548003,2023-03-29,22969,Homemade Jam Scented Candles,11.74,12,18044.0,United Kingdom
548003,2023-03-29,85175,Cacti T-Light Candles,10.68,16,18044.0,United Kingdom
548003,2023-03-29,22784,Lantern Cream Gazebo,15.32,3,18044.0,United Kingdom
548003,2023-03-29,48138,Doormat Union Flag,18.4,4,18044.0,United Kingdom
548005,2023-03-29,22718,Card Cat And Tree,10.68,12,14128.0,United Kingdom
548005,2023-03-29,21506,Fancy Font Birthday Card,10.68,12,14128.0,United Kingdom
548005,2023-03-29,22717,Card Dog And Ball,10.68,12,14128.0,United Kingdom
548005,2023-03-29,22817,Card Suki Birthday,10.68,12,14128.0,United Kingdom
548005,2023-03-29,21497,Fancy Fonts Birthday Wrap,10.68,25,14128.0,United Kingdom
548005,2023-03-29,21498,Red Retrospot Wrap,10.68,25,14128.0,United Kingdom
548005,2023-03-29,21499,Blue Polkadot Wrap,10.68,25,14128.0,United Kingdom
548005,2023-03-29,21500,Pink Polkadot Wrap,10.68,25,14128.0,United Kingdom
548005,2023-03-29,23230,Wrap Alphabet Design,10.68,25,14128.0,United Kingdom
548005,2023-03-29,22300,Coffee Mug Dog + Ball Design,12.86,6,14128.0,United Kingdom
548005,2023-03-29,22303,Coffee Mug Apples Design,12.86,6,14128.0,United Kingdom
548005,2023-03-29,22301,Coffee Mug Cat + Bird Design,12.86,6,14128.0,United Kingdom
548005,2023-03-29,22302,Coffee Mug Pears Design,12.86,6,14128.0,United Kingdom
548005,2023-03-29,22508,Doorstop Retrospot Heart,14.09,4,14128.0,United Kingdom
548005,2023-03-29,22766,Photo Frame Cornice,13.27,8,14128.0,United Kingdom
548005,2023-03-29,82494L,Wooden Frame Antique White,13.27,6,14128.0,United Kingdom
548005,2023-03-29,82482,Wooden Picture Frame White Finish,12.86,6,14128.0,United Kingdom
548005,2023-03-29,21381,Mini Wooden Happy Birthday Garland,11.98,12,14128.0,United Kingdom
548005,2023-03-29,22139,Retrospot Tea Set Ceramic 11 Pc,15.32,6,14128.0,United Kingdom
548005,2023-03-29,21559,Strawberry Lunch Box With Cutlery,12.86,6,14128.0,United Kingdom
548005,2023-03-29,22646,Ceramic Strawberry Cake Money Bank,11.74,12,14128.0,United Kingdom
548005,2023-03-29,22645,Ceramic Heart Fairy Cake Money Bank,11.74,12,14128.0,United Kingdom
548006,2023-03-29,22241,Garland Wooden Happy Easter,11.53,12,18226.0,United Kingdom
548006,2023-03-29,47566,Party Bunting,15.32,8,18226.0,United Kingdom
548006,2023-03-29,22178,Victorian Glass Hanging T-Light,11.53,12,18226.0,United Kingdom
548006,2023-03-29,84978,Hanging Heart Jar T-Light Holder,11.53,12,18226.0,United Kingdom
548006,2023-03-29,21936,Red Retrospot Picnic Bag,13.27,5,18226.0,United Kingdom
548006,2023-03-29,21932,Scandinavian Paisley Picnic Bag,13.27,5,18226.0,United Kingdom
548006,2023-03-29,21933,Pink Vintage Paisley Picnic Bag,13.27,5,18226.0,United Kingdom
548006,2023-03-29,22771,Clear Drawer Knob Acrylic Edwardian,11.53,12,18226.0,United Kingdom
548006,2023-03-29,21063,Party Invites Jazz Hearts,11.12,12,18226.0,United Kingdom
548006,2023-03-29,21059,Party Invites Dinosaurs,11.12,12,18226.0,United Kingdom
548006,2023-03-29,21060,Party Invites Balloon Girl,11.12,12,18226.0,United Kingdom
548006,2023-03-29,21380,Wooden Happy Birthday Garland,13.27,6,18226.0,United Kingdom
548006,2023-03-29,85099B,Jumbo Bag Red Retrospot,6.13,20,18226.0,United Kingdom
548006,2023-03-29,20711,Jumbo Bag Toys,6.13,20,18226.0,United Kingdom
548006,2023-03-29,21929,Jumbo Bag Pink Vintage Paisley,6.13,10,18226.0,United Kingdom
548006,2023-03-29,21928,Jumbo Bag Scandinavian Blue Paisley,6.13,10,18226.0,United Kingdom
548006,2023-03-29,20725,Lunch Bag Red Retrospot,5.97,20,18226.0,United Kingdom
548006,2023-03-29,20728,Lunch Bag Cars Blue,5.97,10,18226.0,United Kingdom
548006,2023-03-29,20727,Lunch Bag Black Skull,5.97,10,18226.0,United Kingdom
548006,2023-03-29,22383,Lunch Bag Suki Design,5.97,10,18226.0,United Kingdom
548006,2023-03-29,22384,Lunch Bag Pink Polkadot,5.97,10,18226.0,United Kingdom
548007,2023-03-29,82494L,Wooden Frame Antique White,13.27,6,13769.0,United Kingdom
548007,2023-03-29,22854,Cream Sweetheart Egg Holder,15.32,4,13769.0,United Kingdom
548007,2023-03-29,85123A,Cream Hanging Heart T-Light Holder,13.27,6,13769.0,United Kingdom
548007,2023-03-29,22804,Pink Hanging Heart T-Light Holder,13.27,6,13769.0,United Kingdom
548007,2023-03-29,84945,Multi Colour Silver T-Light Holder,11.12,12,13769.0,United Kingdom
548007,2023-03-29,82600,N0 Singing Metal Sign,12.4,12,13769.0,United Kingdom
548007,2023-03-29,22115,Metal Sign Empire Tea,13.27,6,13769.0,United Kingdom
548007,2023-03-29,85150,Ladies & Gentlemen Metal Sign,12.86,6,13769.0,United Kingdom
548007,2023-03-29,22285,Hanging Hen On Nest Decoration,11.94,12,13769.0,United Kingdom
548007,2023-03-29,22284,Hen House Decoration,11.94,12,13769.0,United Kingdom
548007,2023-03-29,22499,Wooden Union Jack Bunting,16.35,3,13769.0,United Kingdom
548007,2023-03-29,48138,Doormat Union Flag,18.4,2,13769.0,United Kingdom
548007,2023-03-29,22228,Bunny Wooden Painted With Bird,11.12,12,13769.0,United Kingdom
548007,2023-03-29,22957,Set 3 Paper Vintage Chick Paper Egg,13.27,6,13769.0,United Kingdom
548007,2023-03-29,84836,Zinc Metal Heart Decoration,11.53,12,13769.0,United Kingdom
548007,2023-03-29,21626,Vintage Union Jack Pennant,12.25,12,13769.0,United Kingdom
548007,2023-03-29,85174,S/4 Cacti Candles,15.32,4,13769.0,United Kingdom
548010,2023-03-29,22712,Card Dolly Girl,10.62,144,14646.0,Netherlands
548010,2023-03-29,22037,Robot Birthday Card,10.68,72,14646.0,Netherlands
548010,2023-03-29,23128,Feltcraft Boy Jean-Paul Kit,14.5,40,14646.0,Netherlands
548010,2023-03-29,23126,Feltcraft Girl Amelie Kit,14.5,40,14646.0,Netherlands
548010,2023-03-29,22979,Pantry Washing Up Brush,11.53,72,14646.0,Netherlands
548010,2023-03-29,23178,Jam Clock Magnet,12.8,72,14646.0,Netherlands
548010,2023-03-29,23179,Clock Magnet Mum's Kitchen,12.8,72,14646.0,Netherlands
548010,2023-03-29,23184,Bull Dog Bottle Opener,14.5,36,14646.0,Netherlands
548010,2023-03-29,23154,Set Of 4 Jam Jar Magnets,12.15,120,14646.0,Netherlands
548010,2023-03-29,23158,Set Of 5 Lucky Cat Magnets,12.15,120,14646.0,Netherlands
548010,2023-03-29,23156,Set Of 5 Mini Grocery Magnets,12.15,120,14646.0,Netherlands
548010,2023-03-29,23159,Set Of 5 Pancake Day Magnets,12.15,120,14646.0,Netherlands
548011,2023-03-29,22149,Feltcraft 6 Flower Friends,12.15,40,14646.0,Netherlands
548011,2023-03-29,22968,Rose Cottage Keepsake Box,18.96,24,14646.0,Netherlands
548011,2023-03-29,22759,Set Of 3 Notebooks In Parcel,11.74,96,14646.0,Netherlands
548011,2023-03-29,20723,Strawberry Charlotte Bag,10.99,200,14646.0,Netherlands
548011,2023-03-29,20717,Strawberry Shopper Bag,11.34,100,14646.0,Netherlands
548011,2023-03-29,20719,Woodland Charlotte Bag,10.99,200,14646.0,Netherlands
548011,2023-03-29,20724,Red Retrospot Charlotte Bag,10.99,100,14646.0,Netherlands
548011,2023-03-29,21188,3d Hearts Honeycomb Paper Garland,12.86,48,14646.0,Netherlands
548011,2023-03-29,21207,Skull And Crossbones Garland,11.74,48,14646.0,Netherlands
548011,2023-03-29,21212,Pack Of 72 Retrospot Cake Cases,10.68,240,14646.0,Netherlands
548011,2023-03-29,21213,Pack Of 72 Skull Cake Cases,10.68,240,14646.0,Netherlands
548011,2023-03-29,21481,Fawn Blue Hot Water Bottle,12.86,36,14646.0,Netherlands
548011,2023-03-29,21559,Strawberry Lunch Box With Cutlery,12.4,180,14646.0,Netherlands
548011,2023-03-29,21561,Dinosaur Lunch Box With Cutlery,12.4,60,14646.0,Netherlands
548011,2023-03-29,21937,Strawberry Picnic Bag,12.86,100,14646.0,Netherlands
548011,2023-03-29,21975,Pack Of 60 Dinosaur Cake Cases,10.68,120,14646.0,Netherlands
548011,2023-03-29,21976,Pack Of 60 Mushroom Cake Cases,10.68,240,14646.0,Netherlands
548011,2023-03-29,22029,Spaceboy Birthday Card,10.62,216,14646.0,Netherlands
548011,2023-03-29,22245,Hook 1 Hanger Magic Garden,10.99,192,14646.0,Netherlands
548011,2023-03-29,22243,5 Hook Hanger Red Magic Toadstool,11.74,96,14646.0,Netherlands
548011,2023-03-29,22244,3 Hook Hanger Magic Garden,11.94,96,14646.0,Netherlands
548011,2023-03-29,22297,Heart Ivory Trellis Small,11.34,288,14646.0,Netherlands
548011,2023-03-29,22326,Round Snack Boxes Set Of4 Woodland,12.86,144,14646.0,Netherlands
548011,2023-03-29,22328,Round Snack Boxes Set Of 4 Fruits,12.86,144,14646.0,Netherlands
548011,2023-03-29,22327,Round Snack Boxes Set Of 4 Skulls,12.86,96,14646.0,Netherlands
548011,2023-03-29,22352,Lunch Box With Cutlery Retrospot,12.4,120,14646.0,Netherlands
548011,2023-03-29,22356,Charlotte Bag Pink Polkadot,10.99,100,14646.0,Netherlands
548011,2023-03-29,22367,Childrens Apron Spaceboy Design,11.94,50,14646.0,Netherlands
548011,2023-03-29,22399,Magnets Pack Of 4 Childhood Memory,11.34,108,14646.0,Netherlands
548011,2023-03-29,22417,Pack Of 60 Spaceboy Cake Cases,10.68,240,14646.0,Netherlands
548011,2023-03-29,22432,Watering Can Pink Bunny,11.94,48,14646.0,Netherlands
548011,2023-03-29,22554,Plasters In Tin Woodland Animals,11.74,192,14646.0,Netherlands
548011,2023-03-29,22555,Plasters In Tin Strongman,11.74,96,14646.0,Netherlands
548011,2023-03-29,22556,Plasters In Tin Circus Parade,11.74,96,14646.0,Netherlands
548011,2023-03-29,22557,Plasters In Tin Vintage Paisley,11.74,96,14646.0,Netherlands
548011,2023-03-29,22558,Clothes Pegs Retrospot Pack 24,11.53,96,14646.0,Netherlands
548011,2023-03-29,22613,Pack Of 20 Spaceboy Napkins,10.99,192,14646.0,Netherlands
548011,2023-03-29,22629,Spaceboy Lunch Box,11.94,640,14646.0,Netherlands
548011,2023-03-29,22630,Dolly Girl Lunch Box,11.94,640,14646.0,Netherlands
548011,2023-03-29,22631,Circus Parade Lunch Box,11.94,128,14646.0,Netherlands
548011,2023-03-29,22634,Childs Breakfast Set Spaceboy,18.96,16,14646.0,Netherlands
548011,2023-03-29,22635,Childs Breakfast Set Dolly Girl,18.96,16,14646.0,Netherlands
548011,2023-03-29,22661,Charlotte Bag Dolly Girl Design,10.99,100,14646.0,Netherlands
548011,2023-03-29,22667,Recipe Box Retrospot,12.86,48,14646.0,Netherlands
548011,2023-03-29,22666,Recipe Box Pantry Yellow Design,12.86,24,14646.0,Netherlands
548011,2023-03-29,22714,Card Birthday Cowboy,10.62,144,14646.0,Netherlands
548011,2023-03-29,22776,Sweetheart 3 Tier Cake Stand,18.96,12,14646.0,Netherlands
548011,2023-03-29,22779,Wooden Owls Light Garland,14.09,48,14646.0,Netherlands
548011,2023-03-29,22780,Light Garland Butterfiles Pink,14.09,48,14646.0,Netherlands
548011,2023-03-29,22814,Card Party Games,10.62,144,14646.0,Netherlands
548011,2023-03-29,22890,Novelty Biscuits Cake Stand 3 Tier,18.96,24,14646.0,Netherlands
548011,2023-03-29,22895,Set Of 2 Tea Towels Apple And Pears,12.86,100,14646.0,Netherlands
548011,2023-03-29,22899,Children's Apron Dolly Girl,12.15,50,14646.0,Netherlands
548011,2023-03-29,22908,Pack Of 20 Napkins Red Apples,10.99,96,14646.0,Netherlands
548011,2023-03-29,22951,60 Cake Cases Dolly Girl Design,10.68,240,14646.0,Netherlands
548011,2023-03-29,22956,36 Foil Heart Cake Cases,12.15,144,14646.0,Netherlands
548011,2023-03-29,22964,3 Piece Spaceboy Cookie Cutter Set,12.15,144,14646.0,Netherlands
548011,2023-03-29,22966,Gingerbread Man Cookie Cutter,11.34,144,14646.0,Netherlands
548011,2023-03-29,22967,Set 3 Song Bird Paper Eggs Assorted,12.86,48,14646.0,Netherlands
548011,2023-03-29,22972,Children's Spaceboy Mug,11.74,48,14646.0,Netherlands
548011,2023-03-29,22974,Childrens Dolly Girl Mug,11.74,48,14646.0,Netherlands
548011,2023-03-29,22992,Revolver Wooden Ruler,11.94,144,14646.0,Netherlands
548011,2023-03-29,22993,Set Of 4 Pantry Jelly Moulds,11.34,72,14646.0,Netherlands
548011,2023-03-29,84378,Set Of 3 Heart Cookie Cutters,11.34,144,14646.0,Netherlands
548011,2023-03-29,84380,Set Of 3 Butterfly Cookie Cutters,11.34,144,14646.0,Netherlands
548011,2023-03-29,84987,Set Of 36 Teatime Paper Doilies,11.53,144,14646.0,Netherlands
548011,2023-03-29,84988,Set Of 72 Pink Heart Paper Doilies,11.53,96,14646.0,Netherlands
548011,2023-03-29,84991,60 Teatime Fairy Cake Cases,10.68,240,14646.0,Netherlands
548011,2023-03-29,84459A,Pink Metal Chicken Heart,11.53,96,14646.0,Netherlands
548011,2023-03-29,21211,Set Of 72 Skull Paper Doilies,11.53,96,14646.0,Netherlands
548011,2023-03-29,22650,Ceramic Pirate Chest Money Bank,11.53,36,14646.0,Netherlands
548011,2023-03-29,22136,Love Heart Sock Hanger,11.74,96,14646.0,Netherlands
548011,2023-03-29,84992,72 Sweetheart Fairy Cake Cases,10.68,120,14646.0,Netherlands
548011,2023-03-29,22131,Food Container Set 3 Love Heart,11.94,144,14646.0,Netherlands
548011,2023-03-29,23158,Set Of 5 Lucky Cat Magnets,12.15,120,14646.0,Netherlands
