TransactionNo,Date,ProductNo,ProductName,Price,Quantity,CustomerNo,Country
570208,2023-10-09,23009,I Love London Baby Gift Set,27.62,3,16104.0,United Kingdom
570228,2023-10-09,23007,Spaceboy Baby Gift Set,27.62,1,15821.0,United Kingdom
570235,2023-10-09,22509,Sewing Box Retrospot Design,27.62,1,13193.0,United Kingdom
570210,2023-10-09,20748,Kensington Coffee Set,23.32,2,13259.0,United Kingdom
570230,2023-10-09,21258,Victorian Sewing Box Large,23.32,1,18088.0,United Kingdom
570230,2023-10-09,21331,Moroccan Beaten Metal Dish Large,23.32,1,18088.0,United Kingdom
570236,2023-10-09,22424,Enamel Bread Bin Cream,23.32,1,17236.0,United Kingdom
570218,2023-10-09,23314,Vintage Christmas Tablecloth,23.06,4,16873.0,United Kingdom
570223,2023-10-09,23094,Le Grand Tray Chic Set,23.06,1,15787.0,United Kingdom
570234,2023-10-09,23065,Large Deco Jewellery Stand,23.06,2,17790.0,United Kingdom
570228,2023-10-09,22622,Box Of Vintage Alphabet Blocks,22.5,2,15821.0,United Kingdom
570227,2023-10-09,22423,Regency Cakestand 3 Tier,21.47,20,13260.0,United Kingdom
570214,2023-10-09,23085,Antique Silver Bauble Lamp,20.91,1,12748.0,United Kingdom
570206,2023-10-09,21524,Doormat Spotty Home Sweet Home,17.51,10,15465.0,United Kingdom
570206,2023-10-09,48185,Doormat Fairy Cake,17.51,10,15465.0,United Kingdom
570206,2023-10-09,21745,Gaolers Keys Decorative Garden,14.09,2,15465.0,United Kingdom
570208,2023-10-09,20679,Edwardian Parasol Red,16.35,3,16104.0,United Kingdom
570208,2023-10-09,23211,Red Rocking Horse Hand Painted,11.53,12,16104.0,United Kingdom
570208,2023-10-09,23210,White Rocking Horse Hand Painted,11.53,12,16104.0,United Kingdom
570208,2023-10-09,23213,Star Wreath Decoration With Bell,11.53,12,16104.0,United Kingdom
570208,2023-10-09,22902,Tote Bag I Love London,12.4,5,16104.0,United Kingdom
570208,2023-10-09,23369,Set 36 Colour Pencils Love London,11.53,6,16104.0,United Kingdom
570208,2023-10-09,23504,Playing Cards Jubilee Union Jack,11.53,4,16104.0,United Kingdom
570208,2023-10-09,23503,Playing Cards Keep Calm & Carry On,11.53,6,16104.0,United Kingdom
570208,2023-10-09,22738,Ribbon Reel Snowy Village,11.94,1,16104.0,United Kingdom
570208,2023-10-09,22737,Ribbon Reel Christmas Present,11.94,2,16104.0,United Kingdom
570208,2023-10-09,22900,Set 2 Tea Towels I Love London,13.58,4,16104.0,United Kingdom
570208,2023-10-09,23319,Box Of 6 Mini 50'S Crackers,12.8,2,16104.0,United Kingdom
570208,2023-10-09,23318,Box Of 6 Mini Vintage Crackers,12.8,2,16104.0,United Kingdom
570208,2023-10-09,23323,White Wicker Star,12.4,4,16104.0,United Kingdom
570208,2023-10-09,22694,Wicker Star,12.4,4,16104.0,United Kingdom
570208,2023-10-09,23266,Set Of 3 Wooden Stocking Decoration,11.53,5,16104.0,United Kingdom
570208,2023-10-09,23264,Set Of 3 Wooden Sleigh Decorations,11.53,4,16104.0,United Kingdom
570208,2023-10-09,23265,Set Of 3 Wooden Tree Decorations,11.53,6,16104.0,United Kingdom
570208,2023-10-09,23044,Paper Lantern 9 Point Holly Star S,14.5,1,16104.0,United Kingdom
570208,2023-10-09,23040,Paper Lantern 9 Point Snow Star,16.14,1,16104.0,United Kingdom
570208,2023-10-09,23044,Paper Lantern 9 Point Holly Star S,14.5,1,16104.0,United Kingdom
570208,2023-10-09,23047,Paper Lantern 5 Point Sequin Star,16.14,1,16104.0,United Kingdom
570208,2023-10-09,23045,Paper Lantern 5 Point Star Moon,14.5,2,16104.0,United Kingdom
570208,2023-10-09,23391,I Love London Mini Backpack,14.5,2,16104.0,United Kingdom
570208,2023-10-09,85136A,Yellow Shark Helicopter,18.4,1,16104.0,United Kingdom
570208,2023-10-09,21034,Rex Cash+Carry Jumbo Shopper,11.22,2,16104.0,United Kingdom
570208,2023-10-09,22970,London Bus Coffee Mug,12.86,12,16104.0,United Kingdom
570209,2023-10-09,23539,Wall Art Loves' Secret,16.35,2,16326.0,United Kingdom
570209,2023-10-09,23541,Wall Art Classic Puddings,18.71,1,16326.0,United Kingdom
570209,2023-10-09,23533,Wall Art Garden Haven,16.35,1,16326.0,United Kingdom
570209,2023-10-09,23538,Wall Art Vintage Heart,15.32,1,16326.0,United Kingdom
570209,2023-10-09,90198A,Vintage Rose Bead Bracelet Raspberr,14.61,5,16326.0,United Kingdom
570209,2023-10-09,90122C,Turquoise Crystal+Glass Bracelet,15.32,5,16326.0,United Kingdom
570209,2023-10-09,23284,Doormat Keep Calm And Come In,18.71,2,16326.0,United Kingdom
570209,2023-10-09,48187,Doormat New England,18.71,1,16326.0,United Kingdom
570209,2023-10-09,48185,Doormat Fairy Cake,18.71,2,16326.0,United Kingdom
570209,2023-10-09,23283,Doormat Vintage Leaf,18.71,1,16326.0,United Kingdom
570209,2023-10-09,22691,Doormat Welcome Sunrise,18.71,1,16326.0,United Kingdom
570209,2023-10-09,23284,Doormat Keep Calm And Come In,18.71,6,16326.0,United Kingdom
570209,2023-10-09,23439,Hand Warmer Red Love Heart,12.4,5,16326.0,United Kingdom
570209,2023-10-09,22834,Hand Warmer Babushka Design,12.4,6,16326.0,United Kingdom
570209,2023-10-09,22867,Hand Warmer Bird Design,12.4,6,16326.0,United Kingdom
570209,2023-10-09,22866,Hand Warmer Scotty Dog Design,12.4,6,16326.0,United Kingdom
570209,2023-10-09,84029E,Red Woolly Hottie White Heart,14.61,2,16326.0,United Kingdom
570209,2023-10-09,23355,Hot Water Bottle Keep Calm,15.32,1,16326.0,United Kingdom
570209,2023-10-09,23356,Love Hot Water Bottle,16.35,2,16326.0,United Kingdom
570209,2023-10-09,22111,Scottie Dog Hot Water Bottle,15.32,3,16326.0,United Kingdom
570209,2023-10-09,22112,Chocolate Hot Water Bottle,15.32,1,16326.0,United Kingdom
570209,2023-10-09,22835,Hot Water Bottle I Am So Poorly,15.32,2,16326.0,United Kingdom
570209,2023-10-09,21485,Retrospot Heart Hot Water Bottle,15.32,3,16326.0,United Kingdom
570209,2023-10-09,22274,Feltcraft Doll Emily,13.27,1,16326.0,United Kingdom
570209,2023-10-09,22274,Feltcraft Doll Emily,13.27,1,16326.0,United Kingdom
570209,2023-10-09,22273,Feltcraft Doll Molly,13.27,2,16326.0,United Kingdom
570209,2023-10-09,22751,Feltcraft Princess Olivia Doll,14.09,1,16326.0,United Kingdom
570209,2023-10-09,22271,Feltcraft Doll Rosie,13.27,2,16326.0,United Kingdom
570209,2023-10-09,20971,Pink Blue Felt Craft Trinket Box,11.53,2,16326.0,United Kingdom
570209,2023-10-09,22750,Feltcraft Princess Lola Doll,14.09,2,16326.0,United Kingdom
570209,2023-10-09,22749,Feltcraft Princess Charlotte Doll,14.09,2,16326.0,United Kingdom
570209,2023-10-09,22751,Feltcraft Princess Olivia Doll,14.09,1,16326.0,United Kingdom
570209,2023-10-09,22586,Feltcraft Hairband Pink And Blue,11.12,2,16326.0,United Kingdom
570209,2023-10-09,20971,Pink Blue Felt Craft Trinket Box,11.53,2,16326.0,United Kingdom
570209,2023-10-09,20992,Jazz Hearts Purse Notebook,10.65,12,16326.0,United Kingdom
570209,2023-10-09,22382,Lunch Bag Spaceboy Design,5.97,2,16326.0,United Kingdom
570209,2023-10-09,22383,Lunch Bag Suki Design,5.97,2,16326.0,United Kingdom
570209,2023-10-09,20726,Lunch Bag Woodland,5.97,2,16326.0,United Kingdom
570209,2023-10-09,20725,Lunch Bag Red Retrospot,5.97,2,16326.0,United Kingdom
570209,2023-10-09,23208,Lunch Bag Vintage Leaf Design,5.97,2,16326.0,United Kingdom
570210,2023-10-09,22844,Vintage Cream Dog Food Container,18.96,1,13259.0,United Kingdom
570210,2023-10-09,21841,Baby Mouse Red Gingham Dress,14.61,2,13259.0,United Kingdom
570210,2023-10-09,84580,Mouse Toy With Pink T-Shirt,14.09,3,13259.0,United Kingdom
570210,2023-10-09,84581,Dog Toy With Pink Crochet Skirt,14.09,1,13259.0,United Kingdom
570210,2023-10-09,84032A,Charlie+Lola Pink Hot Water Bottle,13.27,1,13259.0,United Kingdom
570210,2023-10-09,84032B,Charlie + Lola Red Hot Water Bottle,13.27,1,13259.0,United Kingdom
570210,2023-10-09,22481,Black Tea Towel Classic Design,11.53,2,13259.0,United Kingdom
570210,2023-10-09,22210,Wood Stamp Set Best Wishes,11.1,1,13259.0,United Kingdom
570210,2023-10-09,22209,Wood Stamp Set Happy Birthday,11.1,1,13259.0,United Kingdom
570210,2023-10-09,22209,Wood Stamp Set Happy Birthday,11.1,2,13259.0,United Kingdom
570210,2023-10-09,22208,Wood Stamp Set Thank You,11.1,2,13259.0,United Kingdom
570210,2023-10-09,72802C,Vanilla Scent Candle Jewelled Box,14.61,1,13259.0,United Kingdom
570210,2023-10-09,23369,Set 36 Colour Pencils Love London,11.53,1,13259.0,United Kingdom
570210,2023-10-09,22139,Retrospot Tea Set Ceramic 11 Pc,15.32,1,13259.0,United Kingdom
570210,2023-10-09,23335,Egg Frying Pan Ivory,12.38,1,13259.0,United Kingdom
570210,2023-10-09,23366,Set 12 Colouring Pencils Doily,10.92,1,13259.0,United Kingdom
570210,2023-10-09,23368,Set 12 Colour Pencils Dolly Girl,10.92,1,13259.0,United Kingdom
570210,2023-10-09,23367,Set 12 Colour Pencils Spaceboy,10.92,1,13259.0,United Kingdom
570210,2023-10-09,85034A,3 Gardenia Morris Boxed Candles,14.61,2,13259.0,United Kingdom
570210,2023-10-09,85150,Ladies & Gentlemen Metal Sign,12.86,1,13259.0,United Kingdom
570210,2023-10-09,82582,Area Patrolled Metal Sign,12.4,1,13259.0,United Kingdom
570210,2023-10-09,85152,Hand Over The Chocolate Sign,12.4,1,13259.0,United Kingdom
570210,2023-10-09,21165,Beware Of The Cat Metal Sign,11.98,1,13259.0,United Kingdom
570210,2023-10-09,82552,Washroom Metal Sign,11.74,1,13259.0,United Kingdom
570210,2023-10-09,82551,Laundry 15c Metal Sign,11.74,1,13259.0,United Kingdom
570210,2023-10-09,21172,Party Metal Sign,11.74,1,13259.0,United Kingdom
570210,2023-10-09,23426,Metal Sign Drop Your Pants,13.21,2,13259.0,United Kingdom
570210,2023-10-09,22413,Metal Sign Take It Or Leave It,13.27,1,13259.0,United Kingdom
570210,2023-10-09,22412,Metal Sign Neighbourhood Witch,12.4,1,13259.0,United Kingdom
570210,2023-10-09,21908,Chocolate This Way Metal Sign,12.4,1,13259.0,United Kingdom
570210,2023-10-09,21905,More Butter Metal Sign,11.06,1,13259.0,United Kingdom
570210,2023-10-09,21181,Please One Person Metal Sign,12.4,1,13259.0,United Kingdom
570210,2023-10-09,22672,French Bathroom Sign Blue Metal,11.94,1,13259.0,United Kingdom
570210,2023-10-09,22210,Wood Stamp Set Best Wishes,11.1,1,13259.0,United Kingdom
570210,2023-10-09,22211,Wood Stamp Set Flowers,11.1,1,13259.0,United Kingdom
570210,2023-10-09,22208,Wood Stamp Set Thank You,11.1,1,13259.0,United Kingdom
570210,2023-10-09,23420,Pantry Hook Tea Strainer,12.38,1,13259.0,United Kingdom
570210,2023-10-09,21587,Cosy Hour Giant Tube Matches,12.86,2,13259.0,United Kingdom
570210,2023-10-09,22568,Feltcraft Cushion Owl,14.09,1,13259.0,United Kingdom
570210,2023-10-09,23420,Pantry Hook Tea Strainer,12.38,1,13259.0,United Kingdom
570210,2023-10-09,21710,Folding Umbrella Pinkwhite Polkadot,15.32,1,13259.0,United Kingdom
570210,2023-10-09,21816,Christmas Tree T-Light Holder,11.74,1,13259.0,United Kingdom
570210,2023-10-09,21709,Folding Umbrella Chocolate Polkadot,15.32,1,13259.0,United Kingdom
570210,2023-10-09,22937,Baking Mould Chocolate Cupcakes,12.86,2,13259.0,United Kingdom
570210,2023-10-09,21707,Folding Umbrella Blackblue Polkadot,15.32,1,13259.0,United Kingdom
570210,2023-10-09,21706,Folding Umbrella Red/White Polkadot,15.32,1,13259.0,United Kingdom
570210,2023-10-09,15056N,Edwardian Parasol Natural,16.35,2,13259.0,United Kingdom
570210,2023-10-09,22980,Pantry Scrubbing Brush,11.94,2,13259.0,United Kingdom
570210,2023-10-09,22993,Set Of 4 Pantry Jelly Moulds,11.53,2,13259.0,United Kingdom
570210,2023-10-09,22907,Pack Of 20 Napkins Pantry Design,11.12,2,13259.0,United Kingdom
570210,2023-10-09,22982,Pantry Pastry Brush,11.53,1,13259.0,United Kingdom
570210,2023-10-09,22981,Pantry Apple Corer,11.74,2,13259.0,United Kingdom
570210,2023-10-09,22982,Pantry Pastry Brush,11.53,1,13259.0,United Kingdom
570210,2023-10-09,21816,Christmas Tree T-Light Holder,11.74,1,13259.0,United Kingdom
570210,2023-10-09,21815,Star T-Light Holder,11.74,1,13259.0,United Kingdom
570210,2023-10-09,16238,Party Time Pencil Erasers,10.47,1,13259.0,United Kingdom
570210,2023-10-09,21698,Mock Lobster Fridge Magnet,10.65,2,13259.0,United Kingdom
570210,2023-10-09,23158,Set Of 5 Lucky Cat Magnets,12.38,1,13259.0,United Kingdom
570210,2023-10-09,23159,Set Of 5 Pancake Day Magnets,12.38,2,13259.0,United Kingdom
570210,2023-10-09,23154,Set Of 4 Jam Jar Magnets,12.38,2,13259.0,United Kingdom
570210,2023-10-09,23156,Set Of 5 Mini Grocery Magnets,12.38,1,13259.0,United Kingdom
570210,2023-10-09,22403,Magnets Pack Of 4 Vintage Labels,10.65,1,13259.0,United Kingdom
570210,2023-10-09,23337,Egg Frying Pan Mint,12.38,1,13259.0,United Kingdom
570210,2023-10-09,23336,Egg Frying Pan Pink,12.38,2,13259.0,United Kingdom
570210,2023-10-09,23156,Set Of 5 Mini Grocery Magnets,12.38,1,13259.0,United Kingdom
570210,2023-10-09,23131,Mistletoe Heart Wreath Cream,14.5,2,13259.0,United Kingdom
570210,2023-10-09,23421,Pantry Hook Spatula,12.38,2,13259.0,United Kingdom
570210,2023-10-09,22950,36 Doilies Vintage Christmas,11.74,2,13259.0,United Kingdom
570210,2023-10-09,22671,French Laundry Sign Blue Metal,11.94,1,13259.0,United Kingdom
570210,2023-10-09,23335,Egg Frying Pan Ivory,12.38,3,13259.0,United Kingdom
570210,2023-10-09,23422,Pantry Hook Balloon Whisk,12.38,2,13259.0,United Kingdom
570210,2023-10-09,22952,60 Cake Cases Vintage Christmas,10.81,2,13259.0,United Kingdom
570210,2023-10-09,22481,Black Tea Towel Classic Design,11.53,6,13259.0,United Kingdom
570210,2023-10-09,22895,Set Of 2 Tea Towels Apple And Pears,13.58,1,13259.0,United Kingdom
570210,2023-10-09,22900,Set 2 Tea Towels I Love London,13.58,1,13259.0,United Kingdom
570210,2023-10-09,22989,Set 2 Pantry Design Tea Towels,13.58,2,13259.0,United Kingdom
570210,2023-10-09,22931,Baking Mould Heart White Chocolate,12.86,1,13259.0,United Kingdom
570210,2023-10-09,22930,Baking Mould Heart Milk Chocolate,12.86,1,13259.0,United Kingdom
570210,2023-10-09,22909,Set Of 20 Vintage Christmas Napkins,11.12,4,13259.0,United Kingdom
570210,2023-10-09,22908,Pack Of 20 Napkins Red Apples,11.12,2,13259.0,United Kingdom
570210,2023-10-09,23273,Heart T-Light Holder Willie Winkie,11.94,1,13259.0,United Kingdom
570210,2023-10-09,21815,Star T-Light Holder,11.74,1,13259.0,United Kingdom
570210,2023-10-09,23274,Star T-Light Holder Willie Winkie,11.94,1,13259.0,United Kingdom
570210,2023-10-09,22996,Travel Card Wallet Vintage Ticket,10.68,8,13259.0,United Kingdom
570210,2023-10-09,23183,Mother's Kitchen Spoon Rest,14.09,2,13259.0,United Kingdom
570210,2023-10-09,84050,Pink Heart Shape Egg Frying Pan,11.94,1,13259.0,United Kingdom
570211,2023-10-09,23359,Set Of 12 T-Lights Vintage Doily,12.25,2,13558.0,United Kingdom
570211,2023-10-09,22677,French Blue Metal Door Sign 2,11.53,1,13558.0,United Kingdom
570211,2023-10-09,22680,French Blue Metal Door Sign 5,11.53,1,13558.0,United Kingdom
570211,2023-10-09,22676,French Blue Metal Door Sign 1,11.53,1,13558.0,United Kingdom
570211,2023-10-09,22681,French Blue Metal Door Sign 6,11.53,1,13558.0,United Kingdom
570211,2023-10-09,23330,Decorative Wicker Heart Medium,11.53,1,13558.0,United Kingdom
570211,2023-10-09,22791,T-Light Glass Fluted Antique,11.53,2,13558.0,United Kingdom
570211,2023-10-09,21689,Silver Vanilla Flower Candle Pot,14.09,2,13558.0,United Kingdom
570211,2023-10-09,21755,Love Building Block Word,16.66,1,13558.0,United Kingdom
570211,2023-10-09,22573,Star Wooden Christmas Decoration,11.12,1,13558.0,United Kingdom
570211,2023-10-09,23263,Set Of 3 Wooden Heart Decorations,11.53,1,13558.0,United Kingdom
570211,2023-10-09,85049A,Traditional Christmas Ribbons,11.53,3,13558.0,United Kingdom
570211,2023-10-09,84947,Antique Silver Tea Glass Engraved,11.53,1,13558.0,United Kingdom
570211,2023-10-09,23354,6 Gift Tags 50'S Christmas,11.1,5,13558.0,United Kingdom
570211,2023-10-09,23353,6 Gift Tags Vintage Christmas,11.1,3,13558.0,United Kingdom
570211,2023-10-09,22734,Set Of 6 Ribbons Vintage Christmas,13.21,3,13558.0,United Kingdom
570211,2023-10-09,85049A,Traditional Christmas Ribbons,11.53,1,13558.0,United Kingdom
570211,2023-10-09,23352,Roll Wrap 50'S Red Christmas,11.53,6,13558.0,United Kingdom
570211,2023-10-09,23351,Roll Wrap 50'S Christmas,11.53,6,13558.0,United Kingdom
570211,2023-10-09,23000,Travel Card Wallet Transport,10.68,1,13558.0,United Kingdom
570211,2023-10-09,22996,Travel Card Wallet Vintage Ticket,10.68,2,13558.0,United Kingdom
570211,2023-10-09,84879,Assorted Colour Bird Ornament,11.98,1,13558.0,United Kingdom
570211,2023-10-09,21136,Painted Metal Pears Assorted,11.98,2,13558.0,United Kingdom
570211,2023-10-09,23330,Decorative Wicker Heart Medium,11.53,1,13558.0,United Kingdom
570211,2023-10-09,23192,Bundle Of 3 Alphabet Exercise Books,11.94,3,13558.0,United Kingdom
570211,2023-10-09,22866,Hand Warmer Scotty Dog Design,12.4,1,13558.0,United Kingdom
570211,2023-10-09,22867,Hand Warmer Bird Design,12.4,1,13558.0,United Kingdom
570211,2023-10-09,15060B,Fairy Cake Design Umbrella,14.09,2,13558.0,United Kingdom
570211,2023-10-09,22427,Enamel Flower Jug Cream,16.35,1,13558.0,United Kingdom
570211,2023-10-09,22910,Paper Chain Kit Vintage Christmas,13.27,2,13558.0,United Kingdom
570211,2023-10-09,22086,Paper Chain Kit 50'S Christmas,13.27,4,13558.0,United Kingdom
570211,2023-10-09,23344,Jumbo Bag 50'S Christmas,6.19,4,13558.0,United Kingdom
570212,2023-10-09,20654,First Class Luggage Tag,11.53,1,17811.0,United Kingdom
570212,2023-10-09,23058,Christmas Hanging Snowflake,11.06,5,17811.0,United Kingdom
570212,2023-10-09,22772,Pink Drawer Knob Acrylic Edwardian,11.53,1,17811.0,United Kingdom
570212,2023-10-09,22771,Clear Drawer Knob Acrylic Edwardian,11.53,1,17811.0,United Kingdom
570212,2023-10-09,23222,Christmas Tree Hanging Gold,11.1,2,17811.0,United Kingdom
570212,2023-10-09,23218,Laurel Star Antique Gold,11.53,2,17811.0,United Kingdom
570212,2023-10-09,23216,Laurel Heart Antique Gold,11.53,2,17811.0,United Kingdom
570212,2023-10-09,23214,Jingle Bell Heart Antique Gold,12.38,4,17811.0,United Kingdom
570212,2023-10-09,23100,Silver Bells Table Decoration,11.53,1,17811.0,United Kingdom
570212,2023-10-09,22904,Calendar Paper Cut Design,13.27,1,17811.0,United Kingdom
570212,2023-10-09,23503,Playing Cards Keep Calm & Carry On,11.53,1,17811.0,United Kingdom
570212,2023-10-09,35970,Zinc Folkart Sleigh Bells,11.98,2,17811.0,United Kingdom
570212,2023-10-09,23284,Doormat Keep Calm And Come In,18.71,1,17811.0,United Kingdom
570212,2023-10-09,21878,Pack Of 6 Sandcastle Flags Assorted,11.12,5,17811.0,United Kingdom
570212,2023-10-09,22966,Gingerbread Man Cookie Cutter,11.53,3,17811.0,United Kingdom
570212,2023-10-09,21786,Polkadot Rain Hat,10.68,3,17811.0,United Kingdom
570212,2023-10-09,22197,Popcorn Holder,10.99,100,17811.0,United Kingdom
570213,2023-10-09,22866,Hand Warmer Scotty Dog Design,12.4,12,16248.0,United Kingdom
570213,2023-10-09,22865,Hand Warmer Owl Design,12.4,12,16248.0,United Kingdom
570213,2023-10-09,22809,Set Of 6 T-Lights Santa,13.27,6,16248.0,United Kingdom
570213,2023-10-09,23419,Home Sweet Home Bottle,12.38,12,16248.0,United Kingdom
570213,2023-10-09,23155,Knickerbockerglory Magnet Assorted,11.1,12,16248.0,United Kingdom
570213,2023-10-09,23156,Set Of 5 Mini Grocery Magnets,12.38,12,16248.0,United Kingdom
570213,2023-10-09,23157,Set Of 6 Nativity Magnets,12.38,12,16248.0,United Kingdom
570214,2023-10-09,20970,Pink Floral Feltcraft Shoulder Bag,14.09,1,12748.0,United Kingdom
570214,2023-10-09,20969,Red Floral Feltcraft Shoulder Bag,14.09,1,12748.0,United Kingdom
570214,2023-10-09,22138,Baking Set 9 Piece Retrospot,15.32,2,12748.0,United Kingdom
570214,2023-10-09,84077,World War 2 Gliders Asstd Designs,10.55,96,12748.0,United Kingdom
570214,2023-10-09,21094,Set/6 Red Spotty Paper Plates,11.12,3,12748.0,United Kingdom
570214,2023-10-09,21988,Pack Of 6 Skull Paper Plates,11.12,3,12748.0,United Kingdom
570214,2023-10-09,22082,Ribbon Reel Stripes Design,11.94,5,12748.0,United Kingdom
570214,2023-10-09,21086,Set/6 Red Spotty Paper Cups,10.92,4,12748.0,United Kingdom
570214,2023-10-09,21987,Pack Of 6 Skull Paper Cups,10.92,4,12748.0,United Kingdom
570214,2023-10-09,22610,Pens Assorted Funny Face,10.44,72,12748.0,United Kingdom
570214,2023-10-09,22152,Place Setting White Star,10.68,5,12748.0,United Kingdom
570214,2023-10-09,22577,Wooden Heart Christmas Scandinavian,10.55,20,12748.0,United Kingdom
570214,2023-10-09,22578,Wooden Star Christmas Scandinavian,10.55,20,12748.0,United Kingdom
570214,2023-10-09,22579,Wooden Tree Christmas Scandinavian,10.55,20,12748.0,United Kingdom
570214,2023-10-09,23083,Set 6 Paper Table Lantern Stars,14.09,1,12748.0,United Kingdom
570214,2023-10-09,23082,Set 6 Paper Table Lantern Hearts,14.09,1,12748.0,United Kingdom
570214,2023-10-09,17003,Brocade Ring Purse,10.65,36,12748.0,United Kingdom
570214,2023-10-09,21080,Set/20 Red Retrospot Paper Napkins,11.12,1,12748.0,United Kingdom
570214,2023-10-09,21989,Pack Of 20 Skull Paper Napkins,11.12,2,12748.0,United Kingdom
570214,2023-10-09,21990,Modern Floral Stationery Set,11.53,1,12748.0,United Kingdom
570214,2023-10-09,22332,Skulls Party Bag + Sticker Set,11.94,3,12748.0,United Kingdom
570214,2023-10-09,22333,Retrospot Party Bag + Sticker Set,11.94,3,12748.0,United Kingdom
570214,2023-10-09,21080,Set/20 Red Retrospot Paper Napkins,11.12,1,12748.0,United Kingdom
570214,2023-10-09,22086,Paper Chain Kit 50'S Christmas,13.27,1,12748.0,United Kingdom
570214,2023-10-09,21914,Blue Harmonica In Box,11.53,1,12748.0,United Kingdom
570214,2023-10-09,21982,Pack Of 12 Suki Tissues,10.65,2,12748.0,United Kingdom
570214,2023-10-09,22988,Soldiers Egg Cup,11.53,2,12748.0,United Kingdom
570214,2023-10-09,22049,Wrap Christmas Screen Print,10.44,25,12748.0,United Kingdom
570214,2023-10-09,20969,Red Floral Feltcraft Shoulder Bag,14.09,1,12748.0,United Kingdom
570214,2023-10-09,20970,Pink Floral Feltcraft Shoulder Bag,14.09,2,12748.0,United Kingdom
570214,2023-10-09,84077,World War 2 Gliders Asstd Designs,10.55,96,12748.0,United Kingdom
570214,2023-10-09,22840,Round Cake Tin Vintage Red,18.4,1,12748.0,United Kingdom
570214,2023-10-09,21034,Rex Cash+Carry Jumbo Shopper,11.22,2,12748.0,United Kingdom
570214,2023-10-09,22138,Baking Set 9 Piece Retrospot,15.32,2,12748.0,United Kingdom
570214,2023-10-09,23437,50'S Christmas Gift Bag Large,5.77,8,12748.0,United Kingdom
570215,2023-10-09,21811,Hanging Heart With Bell,10.65,12,16066.0,United Kingdom
570215,2023-10-09,22601,Christmas Retrospot Angel Wood,11.12,10,16066.0,United Kingdom
570215,2023-10-09,22578,Wooden Star Christmas Scandinavian,10.55,36,16066.0,United Kingdom
570215,2023-10-09,22577,Wooden Heart Christmas Scandinavian,10.55,36,16066.0,United Kingdom
570215,2023-10-09,22579,Wooden Tree Christmas Scandinavian,10.55,36,16066.0,United Kingdom
570215,2023-10-09,22571,Rocking Horse Red Christmas,11.12,12,16066.0,United Kingdom
570215,2023-10-09,22572,Rocking Horse Green Christmas,11.12,12,16066.0,United Kingdom
570215,2023-10-09,22818,Card Christmas Village,10.68,24,16066.0,United Kingdom
570215,2023-10-09,20767,Blue Paisley Journal,12.86,6,16066.0,United Kingdom
570215,2023-10-09,23371,Set 36 Colour Pencils Spaceboy,11.53,16,16066.0,United Kingdom
570215,2023-10-09,22940,Feltcraft Christmas Fairy,14.61,4,16066.0,United Kingdom
570215,2023-10-09,23353,6 Gift Tags Vintage Christmas,11.1,1,16066.0,United Kingdom
570215,2023-10-09,48129,Doormat Topiary,18.71,2,16066.0,United Kingdom
570215,2023-10-09,23284,Doormat Keep Calm And Come In,18.71,1,16066.0,United Kingdom
570215,2023-10-09,22660,Doormat I Love London,18.71,1,16066.0,United Kingdom
570215,2023-10-09,22147,Feltcraft Butterfly Hearts,11.74,1,16066.0,United Kingdom
570215,2023-10-09,85049A,Traditional Christmas Ribbons,11.53,2,16066.0,United Kingdom
570215,2023-10-09,22551,Plasters In Tin Spaceboy,11.94,5,16066.0,United Kingdom
570215,2023-10-09,23342,Mint Diner Wall Clock,18.96,1,16066.0,United Kingdom
570215,2023-10-09,22193,Red Diner Wall Clock,18.96,1,16066.0,United Kingdom
570215,2023-10-09,22349,Dog Bowl Chasing Ball Design,14.09,6,16066.0,United Kingdom
570215,2023-10-09,20969,Red Floral Feltcraft Shoulder Bag,14.09,4,16066.0,United Kingdom
570215,2023-10-09,35964,Folkart Clip On Stars,10.65,12,16066.0,United Kingdom
570215,2023-10-09,22044,Christmas Card Stack Of Presents,10.44,24,16066.0,United Kingdom
570215,2023-10-09,22959,Wrap Christmas Village,10.68,25,16066.0,United Kingdom
570215,2023-10-09,23270,Set Of 2 Ceramic Painted Hearts,11.74,6,16066.0,United Kingdom
570215,2023-10-09,23101,Silver Stars Table Decoration,11.1,12,16066.0,United Kingdom
570215,2023-10-09,23340,Vintage Christmas Cake Frill,11.94,2,16066.0,United Kingdom
570215,2023-10-09,23372,Set 36 Colour Pencils Dolly Girl,11.53,16,16066.0,United Kingdom
570215,2023-10-09,23353,6 Gift Tags Vintage Christmas,11.1,1,16066.0,United Kingdom
570215,2023-10-09,22147,Feltcraft Butterfly Hearts,11.74,3,16066.0,United Kingdom
570215,2023-10-09,22114,Hot Water Bottle Tea And Sympathy,14.61,3,16066.0,United Kingdom
570215,2023-10-09,84030E,English Rose Hot Water Bottle,14.61,3,16066.0,United Kingdom
570215,2023-10-09,22086,Paper Chain Kit 50'S Christmas,13.27,6,16066.0,United Kingdom
570215,2023-10-09,22141,Christmas Craft Tree Top Angel,12.4,4,16066.0,United Kingdom
570215,2023-10-09,22144,Christmas Craft Little Friends,12.4,4,16066.0,United Kingdom
570215,2023-10-09,22469,Heart Of Wicker Small,11.94,6,16066.0,United Kingdom
570216,2023-10-09,22993,Set Of 4 Pantry Jelly Moulds,11.53,8,14595.0,United Kingdom
570216,2023-10-09,22937,Baking Mould Chocolate Cupcakes,12.86,12,14595.0,United Kingdom
570216,2023-10-09,22931,Baking Mould Heart White Chocolate,12.86,8,14595.0,United Kingdom
570216,2023-10-09,22966,Gingerbread Man Cookie Cutter,11.53,1,14595.0,United Kingdom
570216,2023-10-09,22197,Popcorn Holder,11.12,12,14595.0,United Kingdom
570216,2023-10-09,84375,Set Of 20 Kids Cookie Cutters,12.4,6,14595.0,United Kingdom
570216,2023-10-09,22964,3 Piece Spaceboy Cookie Cutter Set,12.4,5,14595.0,United Kingdom
570216,2023-10-09,21215,Ivory Paper Cup Cake Cases,10.81,24,14595.0,United Kingdom
570216,2023-10-09,22938,Cupcake Lace Paper Set 6,12.25,8,14595.0,United Kingdom
570216,2023-10-09,84378,Set Of 3 Heart Cookie Cutters,11.74,12,14595.0,United Kingdom
570217,2023-10-09,22381,Toy Tidy Pink Polkadot,12.4,2,17323.0,United Kingdom
570217,2023-10-09,85049G,Chocolate Box Ribbons,11.53,2,17323.0,United Kingdom
570217,2023-10-09,85049A,Traditional Christmas Ribbons,11.53,7,17323.0,United Kingdom
