TransactionNo,Date,ProductNo,ProductName,Price,Quantity,CustomerNo,Country
553061,2023-05-13,23066,Small Deco Jewellery Stand,18.71,2,17238.0,United Kingdom
553061,2023-05-13,23055,Ivory Chandelier T-Light Holder,16.66,1,17238.0,United Kingdom
553061,2023-05-13,23084,Rabbit Night Light,12.38,6,17238.0,United Kingdom
553061,2023-05-13,21578,Woodland Design Cotton Tote Bag,12.56,2,17238.0,United Kingdom
553061,2023-05-13,85088,Candy Spot Hand Bag,12.4,1,17238.0,United Kingdom
553061,2023-05-13,22502,Picnic Basket Wicker Small,16.35,3,17238.0,United Kingdom
553061,2023-05-13,22518,Childs Garden Brush Blue,12.4,2,17238.0,United Kingdom
553061,2023-05-13,22519,Childs Garden Brush Pink,12.4,2,17238.0,United Kingdom
553061,2023-05-13,22367,Childrens Apron Spaceboy Design,12.25,2,17238.0,United Kingdom
553061,2023-05-13,22899,Children's Apron Dolly Girl,12.4,2,17238.0,United Kingdom
553061,2023-05-13,21931,Jumbo Storage Bag Suki,12.38,2,17238.0,United Kingdom
553061,2023-05-13,21930,Jumbo Storage Bag Skulls,12.38,1,17238.0,United Kingdom
553061,2023-05-13,21058,Party Invites Woodland,11.12,3,17238.0,United Kingdom
553061,2023-05-13,21059,Party Invites Dinosaurs,11.12,3,17238.0,United Kingdom
553061,2023-05-13,21060,Party Invites Balloon Girl,11.12,3,17238.0,United Kingdom
553061,2023-05-13,22431,Watering Can Blue Elephant,12.25,2,17238.0,United Kingdom
553061,2023-05-13,22450,Silk Purse Babushka Blue,13.68,1,17238.0,United Kingdom
553061,2023-05-13,21063,Party Invites Jazz Hearts,11.12,3,17238.0,United Kingdom
553061,2023-05-13,22451,Silk Purse Babushka Red,13.68,3,17238.0,United Kingdom
553061,2023-05-13,22449,Silk Purse Babushka Pink,13.68,3,17238.0,United Kingdom
553061,2023-05-13,22450,Silk Purse Babushka Blue,13.68,2,17238.0,United Kingdom
553061,2023-05-13,23199,Jumbo Bag Apples,6.19,1,17238.0,United Kingdom
553061,2023-05-13,23202,Jumbo Bag Vintage Leaf,6.19,1,17238.0,United Kingdom
553061,2023-05-13,85099C,Jumbo Bag Baroque Black White,6.19,2,17238.0,United Kingdom
553061,2023-05-13,23201,Jumbo Bag Alphabet,6.19,4,17238.0,United Kingdom
553061,2023-05-13,23199,Jumbo Bag Apples,6.19,8,17238.0,United Kingdom
553061,2023-05-13,20727,Lunch Bag Black Skull,5.97,1,17238.0,United Kingdom
553061,2023-05-13,23207,Lunch Bag Alphabet Design,5.97,7,17238.0,United Kingdom
553061,2023-05-13,22382,Lunch Bag Spaceboy Design,5.97,2,17238.0,United Kingdom
553061,2023-05-13,20727,Lunch Bag Black Skull,5.97,1,17238.0,United Kingdom
553061,2023-05-13,23209,Lunch Bag Vintage Doily,5.97,2,17238.0,United Kingdom
553061,2023-05-13,23208,Lunch Bag Vintage Leaf Design,5.97,4,17238.0,United Kingdom
553062,2023-05-13,22896,Peg Bag Apples Design,12.4,50,13629.0,United Kingdom
553062,2023-05-13,85099F,Jumbo Bag Strawberry,6.04,100,13629.0,United Kingdom
553062,2023-05-13,85099B,Jumbo Bag Red Retrospot,6.04,200,13629.0,United Kingdom
553062,2023-05-13,85099C,Jumbo Bag Baroque Black White,6.04,100,13629.0,United Kingdom
553063,2023-05-13,22792,Fluted Antique Candle Holder,11.12,12,13018.0,United Kingdom
553063,2023-05-13,21790,Vintage Snap Cards,11.12,12,13018.0,United Kingdom
553063,2023-05-13,21915,Red Harmonica In Box,11.53,12,13018.0,United Kingdom
553063,2023-05-13,21912,Vintage Snakes & Ladders,14.09,4,13018.0,United Kingdom
553063,2023-05-13,22619,Set Of 6 Soldier Skittles,14.09,4,13018.0,United Kingdom
553063,2023-05-13,22646,Ceramic Strawberry Cake Money Bank,11.74,12,13018.0,United Kingdom
553063,2023-05-13,22637,Piggy Bank Retrospot,12.86,4,13018.0,United Kingdom
553063,2023-05-13,22432,Watering Can Pink Bunny,12.25,6,13018.0,United Kingdom
553063,2023-05-13,22431,Watering Can Blue Elephant,12.25,6,13018.0,United Kingdom
553063,2023-05-13,22433,Watering Can Green Dinosaur,12.25,6,13018.0,United Kingdom
553063,2023-05-13,22514,Childs Garden Spade Blue,12.4,6,13018.0,United Kingdom
553063,2023-05-13,22515,Childs Garden Spade Pink,12.4,6,13018.0,United Kingdom
553063,2023-05-13,22520,Childs Garden Trowel Blue,11.12,12,13018.0,United Kingdom
553063,2023-05-13,22722,Set Of 6 Spice Tins Pantry Design,14.3,4,13018.0,United Kingdom
553063,2023-05-13,21531,Red Retrospot Sugar Jam Bowl,12.86,6,13018.0,United Kingdom
553063,2023-05-13,22084,Paper Chain Kit Empire,13.27,6,13018.0,United Kingdom
553063,2023-05-13,22892,Set Of Salt And Pepper Toadstools,11.53,12,13018.0,United Kingdom
553063,2023-05-13,21877,Home Sweet Home Mug,11.53,12,13018.0,United Kingdom
553063,2023-05-13,21875,Kings Choice Mug,11.53,12,13018.0,United Kingdom
553063,2023-05-13,21564,Pink Heart Shape Love Bucket,13.27,6,13018.0,United Kingdom
553063,2023-05-13,21563,Red Heart Shape Love Bucket,13.27,6,13018.0,United Kingdom
553063,2023-05-13,84913A,Soft Pink Rose Towel,15.02,4,13018.0,United Kingdom
553064,2023-05-13,23284,Doormat Keep Calm And Come In,18.4,2,13018.0,United Kingdom
553064,2023-05-13,23112,Parisienne Curio Cabinet,17.94,1,13018.0,United Kingdom
553064,2023-05-13,23205,Charlotte Bag Vintage Alphabet,11.12,10,13018.0,United Kingdom
553064,2023-05-13,23201,Jumbo Bag Alphabet,6.13,10,13018.0,United Kingdom
553067,2023-05-13,48138,Doormat Union Flag,18.4,6,16871.0,United Kingdom
553067,2023-05-13,22660,Doormat I Love London,18.4,2,16871.0,United Kingdom
553067,2023-05-13,21524,Doormat Spotty Home Sweet Home,18.4,2,16871.0,United Kingdom
553067,2023-05-13,22189,Cream Heart Card Holder,14.3,4,16871.0,United Kingdom
553067,2023-05-13,21164,Home Sweet Home Metal Sign,13.27,6,16871.0,United Kingdom
553067,2023-05-13,21174,Pottering In The Shed Metal Sign,12.38,6,16871.0,United Kingdom
553067,2023-05-13,22804,Pink Hanging Heart T-Light Holder,13.27,3,16871.0,United Kingdom
553067,2023-05-13,21754,Home Building Block Word,16.35,4,16871.0,United Kingdom
553067,2023-05-13,22178,Victorian Glass Hanging T-Light,11.53,6,16871.0,United Kingdom
553067,2023-05-13,35095A,Blue Victorian Fabric Oval Box,10.68,12,16871.0,United Kingdom
553067,2023-05-13,35095B,Red Victorian Fabric Oval Box,10.68,6,16871.0,United Kingdom
553067,2023-05-13,21428,Set3 Book Box Green Gingham Flower,14.61,6,16871.0,United Kingdom
553067,2023-05-13,21755,Love Building Block Word,16.35,4,16871.0,United Kingdom
553067,2023-05-13,22971,Queens Guard Coffee Mug,12.86,6,16871.0,United Kingdom
553067,2023-05-13,82581,Toilet Metal Sign,10.81,25,16871.0,United Kingdom
553067,2023-05-13,82578,Kitchen Metal Sign,10.81,25,16871.0,United Kingdom
553067,2023-05-13,21171,Bathroom Metal Sign,10.81,25,16871.0,United Kingdom
553067,2023-05-13,22500,Set Of 2 Tins Jardin De Provence,15.32,4,16871.0,United Kingdom
553067,2023-05-13,84970L,Single Heart Zinc T-Light Holder,11.22,24,16871.0,United Kingdom
553067,2023-05-13,22784,Lantern Cream Gazebo,15.32,1,16871.0,United Kingdom
553067,2023-05-13,72802B,Ocean Scent Candle In Jewelled Box,14.61,12,16871.0,United Kingdom
553067,2023-05-13,72807B,Set/3 Ocean Scent Candle Jewel Box,14.61,12,16871.0,United Kingdom
553067,2023-05-13,72807A,Set/3 Rose Candle In Jewelled Box,14.61,12,16871.0,United Kingdom
553067,2023-05-13,21125,Set 6 Football Celebration Candles,11.53,12,16871.0,United Kingdom
553067,2023-05-13,21126,Set Of 6 Girls Celebration Candles,11.53,12,16871.0,United Kingdom
553067,2023-05-13,72802C,Vanilla Scent Candle Jewelled Box,14.61,6,16871.0,United Kingdom
553067,2023-05-13,23146,Triple Hook Antique Ivory Rose,13.62,4,16871.0,United Kingdom
553067,2023-05-13,23148,Miniature Antique Rose Hook Ivory,11.1,12,16871.0,United Kingdom
553067,2023-05-13,72807C,Set/3 Vanilla Scented Candle In Box,14.61,12,16871.0,United Kingdom
553067,2023-05-13,22224,White Lovebird Lantern,13.27,16,16871.0,United Kingdom
553067,2023-05-13,22794,Sweetheart Wire Magazine Rack,18.4,4,16871.0,United Kingdom
553067,2023-05-13,85132A,Charlie + Lola Biscuits Tins,12.25,2,16871.0,United Kingdom
553067,2023-05-13,22721,Set Of 3 Cake Tins Sketchbook,15.32,6,16871.0,United Kingdom
553067,2023-05-13,22626,Black Kitchen Scales,18.96,2,16871.0,United Kingdom
553067,2023-05-13,22063,Ceramic Bowl With Strawberry Design,13.27,6,16871.0,United Kingdom
553067,2023-05-13,21868,Potting Shed Tea Mug,11.53,6,16871.0,United Kingdom
553067,2023-05-13,21232,Strawberry Ceramic Trinket Pot,11.53,6,16871.0,United Kingdom
553067,2023-05-13,21231,Sweetheart Ceramic Trinket Box,11.53,4,16871.0,United Kingdom
553067,2023-05-13,22055,Mini Cake Stand Hanging Strawbery,11.94,6,16871.0,United Kingdom
553067,2023-05-13,22649,Strawberry Fairy Cake Teapot,15.32,4,16871.0,United Kingdom
553067,2023-05-13,23089,Glass Bon Bon Jar,11.94,6,16871.0,United Kingdom
553067,2023-05-13,23080,Red Metal Box Top Secret,18.71,2,16871.0,United Kingdom
553067,2023-05-13,22171,3 Hook Photo Shelf Antique White,18.96,2,16871.0,United Kingdom
553067,2023-05-13,22169,Family Album White Picture Frame,18.96,3,16871.0,United Kingdom
553074,2023-05-13,22431,Watering Can Blue Elephant,12.25,2,15529.0,United Kingdom
553074,2023-05-13,84674,Flying Pig Watering Can,13.27,2,15529.0,United Kingdom
553074,2023-05-13,22045,Spaceboy Gift Wrap,10.68,25,15529.0,United Kingdom
553074,2023-05-13,22706,Wrap Cowboys,10.68,25,15529.0,United Kingdom
553074,2023-05-13,16161U,Wrap Suki And Friends,10.68,25,15529.0,United Kingdom
553074,2023-05-13,22711,Wrap Circus Parade,10.68,25,15529.0,United Kingdom
553074,2023-05-13,20716,Party Food Shopper Bag,11.53,2,15529.0,United Kingdom
553074,2023-05-13,47591D,Pink Fairy Cake Childrens Apron,12.25,4,15529.0,United Kingdom
553074,2023-05-13,22550,Holiday Fun Ludo,14.09,4,15529.0,United Kingdom
553074,2023-05-13,21912,Vintage Snakes & Ladders,14.09,4,15529.0,United Kingdom
553074,2023-05-13,79321,Chilli Lights,16.14,4,15529.0,United Kingdom
553074,2023-05-13,85040A,S/4 Pink Flower Candles In Bowl,11.94,3,15529.0,United Kingdom
553074,2023-05-13,72351A,Set/6 Turquoise Butterfly T-Lights,12.4,4,15529.0,United Kingdom
553074,2023-05-13,72351B,Set/6 Pink Butterfly T-Lights,12.4,2,15529.0,United Kingdom
553074,2023-05-13,21201,Tropical Honeycomb Paper Garland,12.86,1,15529.0,United Kingdom
553074,2023-05-13,21206,Strawberry Honeycomb Garland,11.94,1,15529.0,United Kingdom
553074,2023-05-13,23079,Toadstool Bedside Light,19.42,1,15529.0,United Kingdom
553074,2023-05-13,22993,Set Of 4 Pantry Jelly Moulds,11.53,2,15529.0,United Kingdom
553074,2023-05-13,22895,Set Of 2 Tea Towels Apple And Pears,13.58,1,15529.0,United Kingdom
553074,2023-05-13,20751,Funky Washing Up Gloves Assorted,12.4,6,15529.0,United Kingdom
553074,2023-05-13,40016,Chinese Dragon Paper Lanterns,10.68,60,15529.0,United Kingdom
553074,2023-05-13,79026B,S/4 Icon Coaster Elvis Lives,10.65,4,15529.0,United Kingdom
553074,2023-05-13,22243,5 Hook Hanger Red Magic Toadstool,11.94,3,15529.0,United Kingdom
553074,2023-05-13,23101,Silver Stars Table Decoration,11.1,4,15529.0,United Kingdom
553074,2023-05-13,84535B,Fairy Cakes Notebook A6 Size,10.92,4,15529.0,United Kingdom
553074,2023-05-13,84536B,Fairy Cakes Notebook A7 Size,10.68,6,15529.0,United Kingdom
553074,2023-05-13,84086C,Pink/Purple Retro Radio,13.27,1,15529.0,United Kingdom
553074,2023-05-13,84086B,Yellow/Blue Retro Radio,13.27,2,15529.0,United Kingdom
553074,2023-05-13,22727,Alarm Clock Bakelike Red,14.09,2,15529.0,United Kingdom
553074,2023-05-13,22728,Alarm Clock Bakelike Pink,14.09,2,15529.0,United Kingdom
553074,2023-05-13,21990,Modern Floral Stationery Set,13.27,3,15529.0,United Kingdom
553074,2023-05-13,23192,Bundle Of 3 Alphabet Exercise Books,11.94,2,15529.0,United Kingdom
553074,2023-05-13,22754,Small Red Babushka Notebook,11.12,2,15529.0,United Kingdom
553074,2023-05-13,22758,Large Purple Babushka Notebook,11.53,2,15529.0,United Kingdom
553074,2023-05-13,20775,Daisy Notebook,11.94,2,15529.0,United Kingdom
553074,2023-05-13,20774,Green Fern Notebook,11.94,2,15529.0,United Kingdom
553074,2023-05-13,20773,Blue Paisley Notebook,11.94,2,15529.0,United Kingdom
553074,2023-05-13,62043B,Blue Check Bag W Handle 34x20cm,11.1,2,15529.0,United Kingdom
553074,2023-05-13,22212,Four Hook White Lovebirds,12.4,2,15529.0,United Kingdom
553074,2023-05-13,22551,Plasters In Tin Spaceboy,11.94,3,15529.0,United Kingdom
553074,2023-05-13,22554,Plasters In Tin Woodland Animals,11.94,3,15529.0,United Kingdom
553074,2023-05-13,22557,Plasters In Tin Vintage Paisley,11.94,3,15529.0,United Kingdom
553074,2023-05-13,22553,Plasters In Tin Skulls,11.94,3,15529.0,United Kingdom
553074,2023-05-13,22436,12 Coloured Party Balloons,10.92,10,15529.0,United Kingdom
553074,2023-05-13,22434,Balloon Pump With 10 Balloons,12.25,2,15529.0,United Kingdom
553074,2023-05-13,21703,Bag 125g Swirly Marbles,10.68,4,15529.0,United Kingdom
553074,2023-05-13,21705,Bag 500g Swirly Marbles,11.94,4,15529.0,United Kingdom
553074,2023-05-13,22616,Pack Of 12 London Tissues,10.55,4,15529.0,United Kingdom
553074,2023-05-13,21967,Pack Of 12 Skull Tissues,10.55,4,15529.0,United Kingdom
553074,2023-05-13,22614,Pack Of 12 Spaceboy Tissues,10.55,4,15529.0,United Kingdom
553074,2023-05-13,21982,Pack Of 12 Suki Tissues,10.55,6,15529.0,United Kingdom
553074,2023-05-13,21981,Pack Of 12 Woodland Tissues,10.55,4,15529.0,United Kingdom
553074,2023-05-13,22966,Gingerbread Man Cookie Cutter,11.53,4,15529.0,United Kingdom
553074,2023-05-13,22440,Balloon Water Bomb Pack Of 35,10.68,10,15529.0,United Kingdom
553074,2023-05-13,21439,Basket Of Toadstools,11.53,2,15529.0,United Kingdom
553074,2023-05-13,20983,12 Pencils Tall Tube Red Retrospot,11.12,2,15529.0,United Kingdom
553074,2023-05-13,20982,12 Pencils Tall Tube Skulls,11.12,2,15529.0,United Kingdom
553074,2023-05-13,20974,12 Pencils Small Tube Skull,10.92,2,15529.0,United Kingdom
553074,2023-05-13,20981,12 Pencils Tall Tube Woodland,11.12,2,15529.0,United Kingdom
553074,2023-05-13,20973,12 Pencil Small Tube Woodland,10.92,2,15529.0,United Kingdom
553074,2023-05-13,23000,Travel Card Wallet Transport,10.68,1,15529.0,United Kingdom
553074,2023-05-13,22999,Travel Card Wallet Vintage Leaf,10.68,4,15529.0,United Kingdom
553074,2023-05-13,22998,Travel Card Wallet Keep Calm,10.68,4,15529.0,United Kingdom
553074,2023-05-13,23006,Travel Card Wallet Flower Meadow,10.68,4,15529.0,United Kingdom
553074,2023-05-13,23002,Travel Card Wallet Skulls,10.68,4,15529.0,United Kingdom
553074,2023-05-13,22995,Travel Card Wallet Suki,10.68,4,15529.0,United Kingdom
553074,2023-05-13,22994,Travel Card Wallet Retrospot,10.68,4,15529.0,United Kingdom
553074,2023-05-13,21080,Set/20 Red Retrospot Paper Napkins,11.12,2,15529.0,United Kingdom
553074,2023-05-13,22851,Set 20 Napkins Fairy Cakes Design,11.12,2,15529.0,United Kingdom
553074,2023-05-13,84828,Jungle Popsicles Ice Lolly Moulds,11.53,4,15529.0,United Kingdom
553074,2023-05-13,22088,Paper Bunting Coloured Lace,13.27,2,15529.0,United Kingdom
553074,2023-05-13,22741,Funky Diva Pen,11.12,48,15529.0,United Kingdom
553074,2023-05-13,21993,Floral Folk Stationery Set,13.27,1,15529.0,United Kingdom
553074,2023-05-13,23202,Jumbo Bag Vintage Leaf,6.19,1,15529.0,United Kingdom
553074,2023-05-13,23199,Jumbo Bag Apples,6.19,1,15529.0,United Kingdom
553074,2023-05-13,85099C,Jumbo Bag Baroque Black White,6.19,1,15529.0,United Kingdom
553074,2023-05-13,23200,Jumbo Bag Pears,6.19,1,15529.0,United Kingdom
553074,2023-05-13,23203,Jumbo Bag Vintage Doily,6.19,1,15529.0,United Kingdom
553074,2023-05-13,20725,Lunch Bag Red Retrospot,5.97,3,15529.0,United Kingdom
553074,2023-05-13,23209,Lunch Bag Vintage Doily,5.97,3,15529.0,United Kingdom
553088,2023-05-13,21931,Jumbo Storage Bag Suki,12.08,100,16180.0,United Kingdom
553088,2023-05-13,22411,Jumbo Shopper Vintage Red Paisley,12.08,100,16180.0,United Kingdom
553088,2023-05-13,21137,Black Record Cover Frame,14.09,4,16180.0,United Kingdom
553088,2023-05-13,23076,Ice Cream Sundae Lip Gloss,11.53,48,16180.0,United Kingdom
553088,2023-05-13,21559,Strawberry Lunch Box With Cutlery,12.86,6,16180.0,United Kingdom
553088,2023-05-13,21558,Skull Lunch Box With Cutlery,12.86,6,16180.0,United Kingdom
553088,2023-05-13,22326,Round Snack Boxes Set Of4 Woodland,13.27,6,16180.0,United Kingdom
553088,2023-05-13,22555,Plasters In Tin Strongman,11.94,12,16180.0,United Kingdom
553088,2023-05-13,22557,Plasters In Tin Vintage Paisley,11.94,12,16180.0,United Kingdom
553088,2023-05-13,22150,3 Stripey Mice Feltcraft,12.25,6,16180.0,United Kingdom
553088,2023-05-13,23091,Zinc Herb Garden Container,16.66,3,16180.0,United Kingdom
553088,2023-05-13,22854,Cream Sweetheart Egg Holder,15.32,4,16180.0,United Kingdom
553088,2023-05-13,22185,Slate Tile Natural Hanging,11.94,12,16180.0,United Kingdom
553088,2023-05-13,22457,Natural Slate Heart Chalkboard,13.27,6,16180.0,United Kingdom
553088,2023-05-13,20974,12 Pencils Small Tube Skull,10.92,24,16180.0,United Kingdom
553088,2023-05-13,20975,12 Pencils Small Tube Red Retrospot,10.92,24,16180.0,United Kingdom
553088,2023-05-13,22986,Wrap Gingham Rose,10.68,25,16180.0,United Kingdom
553088,2023-05-13,23089,Glass Bon Bon Jar,11.94,12,16180.0,United Kingdom
553088,2023-05-13,22646,Ceramic Strawberry Cake Money Bank,11.74,12,16180.0,United Kingdom
553088,2023-05-13,21232,Strawberry Ceramic Trinket Pot,11.53,24,16180.0,United Kingdom
553088,2023-05-13,22649,Strawberry Fairy Cake Teapot,15.32,8,16180.0,United Kingdom
553088,2023-05-13,21240,Blue Polkadot Cup,11.12,16,16180.0,United Kingdom
553088,2023-05-13,21244,Blue Polkadot Plate,11.98,16,16180.0,United Kingdom
553088,2023-05-13,84380,Set Of 3 Butterfly Cookie Cutters,11.53,12,16180.0,United Kingdom
553088,2023-05-13,22993,Set Of 4 Pantry Jelly Moulds,11.53,12,16180.0,United Kingdom
553088,2023-05-13,23175,Regency Milk Jug Pink,13.58,6,16180.0,United Kingdom
553088,2023-05-13,23174,Regency Sugar Bowl Green,14.5,6,16180.0,United Kingdom
553088,2023-05-13,21977,Pack Of 60 Pink Paisley Cake Cases,10.81,24,16180.0,United Kingdom
553088,2023-05-13,23147,Single Antique Rose Hook Ivory,11.74,12,16180.0,United Kingdom
553088,2023-05-13,23155,Knickerbockerglory Magnet Assorted,11.1,12,16180.0,United Kingdom
553088,2023-05-13,21745,Gaolers Keys Decorative Garden,14.09,3,16180.0,United Kingdom
553088,2023-05-13,23208,Lunch Bag Vintage Leaf Design,5.97,20,16180.0,United Kingdom
553088,2023-05-13,20728,Lunch Bag Cars Blue,5.97,20,16180.0,United Kingdom
553088,2023-05-13,22383,Lunch Bag Suki Design,5.97,20,16180.0,United Kingdom
553088,2023-05-13,22384,Lunch Bag Pink Polkadot,5.97,20,16180.0,United Kingdom
553088,2023-05-13,23206,Lunch Bag Apple Design,5.97,20,16180.0,United Kingdom
553093,2023-05-13,20723,Strawberry Charlotte Bag,10.99,100,13798.0,United Kingdom
553093,2023-05-13,21094,Set/6 Red Spotty Paper Plates,10.91,96,13798.0,United Kingdom
553093,2023-05-13,20685,Doormat Red Retrospot,17.17,10,13798.0,United Kingdom
553093,2023-05-13,85099B,Jumbo Bag Red Retrospot,6.04,100,13798.0,United Kingdom
553093,2023-05-13,85099F,Jumbo Bag Strawberry,6.04,100,13798.0,United Kingdom
553095,2023-05-13,23172,Regency Tea Plate Pink,11.94,12,16180.0,United Kingdom
553095,2023-05-13,23171,Regency Tea Plate Green,11.94,12,16180.0,United Kingdom
553095,2023-05-13,23170,Regency Tea Plate Roses,11.94,12,16180.0,United Kingdom
553095,2023-05-13,23202,Jumbo Bag Vintage Leaf,6.04,100,16180.0,United Kingdom
553095,2023-05-13,23203,Jumbo Bag Vintage Doily,6.04,100,16180.0,United Kingdom
553099,2023-05-13,21936,Red Retrospot Picnic Bag,12.86,50,13798.0,United Kingdom
553100,2023-05-13,21122,Set/10 Pink Polkadot Party Candles,11.53,3,17100.0,United Kingdom
553100,2023-05-13,22953,Birthday Party Cordon Barrier Tape,11.53,1,17100.0,United Kingdom
553100,2023-05-13,22435,Set Of 9 Heart Shaped Balloons,11.53,1,17100.0,United Kingdom
553100,2023-05-13,22436,12 Coloured Party Balloons,10.92,1,17100.0,United Kingdom
553102,2023-05-13,82001S,Silver Record Cover Frame,13.72,48,12980.0,United Kingdom
553102,2023-05-13,22041,"Record Frame 7"" Single Size",12.4,48,12980.0,United Kingdom
553120,2023-05-13,21523,Doormat Fancy Font Home Sweet Home,17.17,10,17139.0,United Kingdom
553120,2023-05-13,48184,Doormat English Rose,17.17,10,17139.0,United Kingdom
553120,2023-05-13,48138,Doormat Union Flag,17.17,10,17139.0,United Kingdom
553120,2023-05-13,22727,Alarm Clock Bakelike Red,14.09,4,17139.0,United Kingdom
553120,2023-05-13,22730,Alarm Clock Bakelike Ivory,14.09,4,17139.0,United Kingdom
553120,2023-05-13,22729,Alarm Clock Bakelike Orange,14.09,4,17139.0,United Kingdom
553120,2023-05-13,21495,Skulls And Crossbones Wrap,10.68,25,17139.0,United Kingdom
553120,2023-05-13,21499,Blue Polkadot Wrap,10.68,25,17139.0,United Kingdom
553120,2023-05-13,21500,Pink Polkadot Wrap,10.68,25,17139.0,United Kingdom
553120,2023-05-13,22706,Wrap Cowboys,10.68,25,17139.0,United Kingdom
553120,2023-05-13,22707,Wrap Monster Fun,10.68,25,17139.0,United Kingdom
553120,2023-05-13,23204,Charlotte Bag Apples Design,11.12,10,17139.0,United Kingdom
553120,2023-05-13,23205,Charlotte Bag Vintage Alphabet,11.12,10,17139.0,United Kingdom
553120,2023-05-13,22993,Set Of 4 Pantry Jelly Moulds,11.53,12,17139.0,United Kingdom
553120,2023-05-13,84879,Assorted Colour Bird Ornament,11.98,8,17139.0,United Kingdom
553120,2023-05-13,21936,Red Retrospot Picnic Bag,13.27,5,17139.0,United Kingdom
553120,2023-05-13,21937,Strawberry Picnic Bag,13.27,5,17139.0,United Kingdom
553120,2023-05-13,23284,Doormat Keep Calm And Come In,17.17,10,17139.0,United Kingdom
553120,2023-05-13,23283,Doormat Vintage Leaf,17.17,10,17139.0,United Kingdom
553120,2023-05-13,48173C,Doormat Black Flock,17.17,10,17139.0,United Kingdom
553120,2023-05-13,22692,Doormat Welcome To Our Home,17.17,10,17139.0,United Kingdom
553120,2023-05-13,23199,Jumbo Bag Apples,6.19,10,17139.0,United Kingdom
553120,2023-05-13,20728,Lunch Bag Cars Blue,5.97,10,17139.0,United Kingdom
553120,2023-05-13,20726,Lunch Bag Woodland,5.97,20,17139.0,United Kingdom
553120,2023-05-13,20727,Lunch Bag Black Skull,5.97,20,17139.0,United Kingdom
553120,2023-05-13,23206,Lunch Bag Apple Design,5.97,20,17139.0,United Kingdom
553120,2023-05-13,22383,Lunch Bag Suki Design,5.97,10,17139.0,United Kingdom
553120,2023-05-13,23208,Lunch Bag Vintage Leaf Design,5.97,20,17139.0,United Kingdom
553125,2023-05-13,23164,Regency Cake Slice,15.32,4,17139.0,United Kingdom
553125,2023-05-13,23163,Regency Sugar Tongs,12.8,8,17139.0,United Kingdom
553125,2023-05-13,23161,Regency Cake Fork,11.53,12,17139.0,United Kingdom
553125,2023-05-13,23160,Regency Tea Spoon,11.53,12,17139.0,United Kingdom
553125,2023-05-13,23162,Regency Tea Strainer,14.09,4,17139.0,United Kingdom
553125,2023-05-13,23171,Regency Tea Plate Green,11.94,12,17139.0,United Kingdom
553125,2023-05-13,23172,Regency Tea Plate Pink,11.94,12,17139.0,United Kingdom
553125,2023-05-13,23170,Regency Tea Plate Roses,11.94,12,17139.0,United Kingdom
553125,2023-05-13,23087,Zinc Heart T-Light Holder,11.53,8,17139.0,United Kingdom
553125,2023-05-13,23088,Zinc Heart Flower T-Light Holder,11.53,8,17139.0,United Kingdom
553125,2023-05-13,23091,Zinc Herb Garden Container,16.66,3,17139.0,United Kingdom
553125,2023-05-13,23284,Doormat Keep Calm And Come In,17.17,10,17139.0,United Kingdom
553125,2023-05-13,23204,Charlotte Bag Apples Design,11.12,10,17139.0,United Kingdom
553125,2023-05-13,23299,Food Cover With Beads Set 2,14.09,6,17139.0,United Kingdom
553125,2023-05-13,23169,Classic Glass Cookie Jar,14.5,6,17139.0,United Kingdom
553125,2023-05-13,23106,Zinc Hearts Plant Pot Holder,13.21,8,17139.0,United Kingdom
553125,2023-05-13,23133,Large Ivory Heart Wall Organiser,18.71,2,17139.0,United Kingdom
553125,2023-05-13,23132,Small Ivory Heart Wall Organiser,16.14,3,17139.0,United Kingdom
553125,2023-05-13,23066,Small Deco Jewellery Stand,18.71,2,17139.0,United Kingdom
553125,2023-05-13,23199,Jumbo Bag Apples,6.13,10,17139.0,United Kingdom
553125,2023-05-13,23200,Jumbo Bag Pears,6.13,10,17139.0,United Kingdom
553125,2023-05-13,23202,Jumbo Bag Vintage Leaf,6.13,10,17139.0,United Kingdom
553125,2023-05-13,23203,Jumbo Bag Vintage Doily,6.13,10,17139.0,United Kingdom
553125,2023-05-13,23208,Lunch Bag Vintage Leaf Design,5.97,10,17139.0,United Kingdom
553125,2023-05-13,23209,Lunch Bag Vintage Doily,5.97,10,17139.0,United Kingdom
553125,2023-05-13,23206,Lunch Bag Apple Design,5.97,10,17139.0,United Kingdom
553129,2023-05-13,22960,Jam Making Set With Jars,14.61,1,17765.0,United Kingdom
553129,2023-05-13,23082,Set 6 Paper Table Lantern Hearts,14.09,3,17765.0,United Kingdom
553129,2023-05-13,22853,Cat Bowl Vintage Cream,13.58,2,17765.0,United Kingdom
553129,2023-05-13,20669,Red Heart Luggage Tag,11.53,1,17765.0,United Kingdom
553129,2023-05-13,22960,Jam Making Set With Jars,14.61,1,17765.0,United Kingdom
553129,2023-05-13,22956,36 Foil Heart Cake Cases,12.4,3,17765.0,United Kingdom
553129,2023-05-13,22841,Round Cake Tin Vintage Green,18.4,1,17765.0,United Kingdom
553129,2023-05-13,22745,Poppy's Playhouse Bedroom,12.4,2,17765.0,United Kingdom
553129,2023-05-13,22747,Poppy's Playhouse Bathroom,12.4,2,17765.0,United Kingdom
553129,2023-05-13,22746,Poppy's Playhouse Livingroom,12.4,2,17765.0,United Kingdom
553129,2023-05-13,22748,Poppy's Playhouse Kitchen,12.4,2,17765.0,United Kingdom
553129,2023-05-13,22904,Calendar Paper Cut Design,13.27,2,17765.0,United Kingdom
553129,2023-05-13,23082,Set 6 Paper Table Lantern Hearts,14.09,1,17765.0,United Kingdom
553129,2023-05-13,23254,Childrens Cutlery Dolly Girl,14.5,1,17765.0,United Kingdom
553129,2023-05-13,21990,Modern Floral Stationery Set,13.27,1,17765.0,United Kingdom
553129,2023-05-13,23084,Rabbit Night Light,12.38,4,17765.0,United Kingdom
553129,2023-05-13,21588,Retrospot Giant Tube Matches,12.86,2,17765.0,United Kingdom
553129,2023-05-13,23165,Large Ceramic Top Storage Jar,11.94,12,17765.0,United Kingdom
553129,2023-05-13,23203,Jumbo Bag Vintage Doily,6.19,5,17765.0,United Kingdom
553129,2023-05-13,23201,Jumbo Bag Alphabet,6.19,2,17765.0,United Kingdom
553129,2023-05-13,23203,Jumbo Bag Vintage Doily,6.19,4,17765.0,United Kingdom
553129,2023-05-13,23209,Lunch Bag Vintage Doily,5.97,2,17765.0,United Kingdom
553129,2023-05-13,22662,Lunch Bag Dolly Girl Design,5.97,1,17765.0,United Kingdom
553129,2023-05-13,23209,Lunch Bag Vintage Doily,5.97,1,17765.0,United Kingdom
