TransactionNo,Date,ProductNo,ProductName,Price,Quantity,CustomerNo,Country
577174,2023-11-18,22947,Wooden Advent Calendar Red,18.4,1,17841.0,United Kingdom
577174,2023-11-18,22666,Recipe Box Pantry Yellow Design,13.27,2,17841.0,United Kingdom
577174,2023-11-18,22475,Skull Design Tv Dinner Tray,15.32,2,17841.0,United Kingdom
577174,2023-11-18,22087,Paper Bunting White Lace,13.27,6,17841.0,United Kingdom
577174,2023-11-18,84997C,Childrens Cutlery Polkadot Blue,14.5,1,17841.0,United Kingdom
577174,2023-11-18,84997D,Childrens Cutlery Polkadot Pink,14.5,1,17841.0,United Kingdom
577174,2023-11-18,84997B,Childrens Cutlery Retrospot Red,14.5,1,17841.0,United Kingdom
577174,2023-11-18,22379,Recycling Bag Retrospot,12.4,2,17841.0,United Kingdom
577174,2023-11-18,23137,Zinc Wire Sweetheart Letter Tray,14.09,1,17841.0,United Kingdom
577174,2023-11-18,23406,Home Sweet Home Key Holder,16.66,1,17841.0,United Kingdom
577174,2023-11-18,72800E,4 Ivory Dinner Candles Silver Flock,12.86,2,17841.0,United Kingdom
577174,2023-11-18,23413,Decorative Vintage Coffee Box,15.32,1,17841.0,United Kingdom
577174,2023-11-18,22517,Childs Garden Rake Pink,12.4,1,17841.0,United Kingdom
577174,2023-11-18,23301,Gardeners Kneeling Pad Keep Calm,11.94,1,17841.0,United Kingdom
577174,2023-11-18,84375,Set Of 20 Kids Cookie Cutters,12.4,1,17841.0,United Kingdom
577174,2023-11-18,47559B,Tea Time Oven Glove,11.53,1,17841.0,United Kingdom
577174,2023-11-18,20754,Retrospot Red Washing Up Gloves,12.4,1,17841.0,United Kingdom
577174,2023-11-18,22468,Babushka Lights String Of 10,17.17,1,17841.0,United Kingdom
577174,2023-11-18,22111,Scottie Dog Hot Water Bottle,15.32,1,17841.0,United Kingdom
577174,2023-11-18,47591D,Pink Fairy Cake Childrens Apron,12.25,1,17841.0,United Kingdom
577174,2023-11-18,47593B,Scottie Dogs Baby Bib,10.65,1,17841.0,United Kingdom
577174,2023-11-18,22621,Traditional Knitting Nancy,11.94,2,17841.0,United Kingdom
577174,2023-11-18,20622,Vip Passport Cover,12.4,1,17841.0,United Kingdom
577174,2023-11-18,20659,Economy Luggage Tag,11.53,1,17841.0,United Kingdom
577174,2023-11-18,23214,Jingle Bell Heart Antique Gold,12.38,1,17841.0,United Kingdom
577174,2023-11-18,23154,Set Of 4 Jam Jar Magnets,12.38,1,17841.0,United Kingdom
577174,2023-11-18,47422,Assorted Monkey Suction Cup Hook,10.68,8,17841.0,United Kingdom
577174,2023-11-18,21935,Suki Shoulder Bag,11.94,1,17841.0,United Kingdom
577174,2023-11-18,22419,Lipstick Pen Red,10.68,2,17841.0,United Kingdom
577174,2023-11-18,23210,White Rocking Horse Hand Painted,11.53,1,17841.0,United Kingdom
577174,2023-11-18,23223,Christmas Tree Hanging Silver,11.1,1,17841.0,United Kingdom
577174,2023-11-18,23157,Set Of 6 Nativity Magnets,12.38,1,17841.0,United Kingdom
577174,2023-11-18,23266,Set Of 3 Wooden Stocking Decoration,11.53,2,17841.0,United Kingdom
577174,2023-11-18,23264,Set Of 3 Wooden Sleigh Decorations,11.53,2,17841.0,United Kingdom
577174,2023-11-18,82581,Toilet Metal Sign,10.81,1,17841.0,United Kingdom
577174,2023-11-18,85199S,Small Hanging Ivory/Red Wood Bird,10.68,2,17841.0,United Kingdom
577174,2023-11-18,22195,Large Heart Measuring Spoons,11.94,1,17841.0,United Kingdom
577174,2023-11-18,22196,Small Heart Measuring Spoons,11.12,1,17841.0,United Kingdom
577174,2023-11-18,23394,Poste France Cushion Cover,14.09,1,17841.0,United Kingdom
577174,2023-11-18,21564,Pink Heart Shape Love Bucket,13.27,1,17841.0,United Kingdom
577174,2023-11-18,23218,Laurel Star Antique Gold,11.53,1,17841.0,United Kingdom
577174,2023-11-18,23219,Laurel Star Antique Silver,11.53,1,17841.0,United Kingdom
577174,2023-11-18,23265,Set Of 3 Wooden Tree Decorations,11.53,1,17841.0,United Kingdom
577174,2023-11-18,23266,Set Of 3 Wooden Stocking Decoration,11.53,1,17841.0,United Kingdom
577174,2023-11-18,23263,Set Of 3 Wooden Heart Decorations,11.53,1,17841.0,United Kingdom
577174,2023-11-18,23214,Jingle Bell Heart Antique Gold,12.38,1,17841.0,United Kingdom
577174,2023-11-18,22993,Set Of 4 Pantry Jelly Moulds,11.53,1,17841.0,United Kingdom
577174,2023-11-18,23321,Small White Heart Of Wicker,11.94,2,17841.0,United Kingdom
577174,2023-11-18,22720,Set Of 3 Cake Tins Pantry Design,15.32,1,17841.0,United Kingdom
577174,2023-11-18,23400,Shelf With 4 Hooks Home Sweet Home,16.66,1,17841.0,United Kingdom
577174,2023-11-18,22692,Doormat Welcome To Our Home,18.71,1,17841.0,United Kingdom
577174,2023-11-18,84509A,Set Of 4 English Rose Placemats,14.09,1,17841.0,United Kingdom
577174,2023-11-18,22215,Cake Stand White Two Tier Lace,18.96,1,17841.0,United Kingdom
577174,2023-11-18,21232,Strawberry Ceramic Trinket Pot,11.53,2,17841.0,United Kingdom
577174,2023-11-18,22723,Set Of 6 Herb Tins Sketchbook,14.3,1,17841.0,United Kingdom
577174,2023-11-18,22077,6 Ribbons Rustic Charm,12.25,2,17841.0,United Kingdom
577174,2023-11-18,22666,Recipe Box Pantry Yellow Design,13.27,1,17841.0,United Kingdom
577174,2023-11-18,23291,Dolly Girl Childrens Cup,11.53,1,17841.0,United Kingdom
577174,2023-11-18,23318,Box Of 6 Mini Vintage Crackers,12.8,1,17841.0,United Kingdom
577174,2023-11-18,23319,Box Of 6 Mini 50'S Crackers,12.8,1,17841.0,United Kingdom
577174,2023-11-18,22481,Black Tea Towel Classic Design,11.53,2,17841.0,United Kingdom
577174,2023-11-18,84510A,Set Of 4 English Rose Coasters,11.53,1,17841.0,United Kingdom
577174,2023-11-18,85053,French Enamel Candleholder,12.4,1,17841.0,United Kingdom
577174,2023-11-18,22384,Lunch Bag Pink Polkadot,5.97,1,17841.0,United Kingdom
577175,2023-11-18,23192,Bundle Of 3 Alphabet Exercise Books,11.94,12,14849.0,United Kingdom
577175,2023-11-18,22489,Pack Of 12 Traditional Crayons,10.68,24,14849.0,United Kingdom
577175,2023-11-18,22492,Mini Paint Set Vintage,10.92,36,14849.0,United Kingdom
577175,2023-11-18,22491,Pack Of 12 Coloured Pencils,11.12,12,14849.0,United Kingdom
577175,2023-11-18,47591D,Pink Fairy Cake Childrens Apron,12.25,8,14849.0,United Kingdom
577175,2023-11-18,22899,Children's Apron Dolly Girl,12.4,6,14849.0,United Kingdom
577175,2023-11-18,22141,Christmas Craft Tree Top Angel,12.4,6,14849.0,United Kingdom
577175,2023-11-18,23350,Roll Wrap Vintage Spot,11.53,12,14849.0,United Kingdom
577175,2023-11-18,23319,Box Of 6 Mini 50'S Crackers,12.8,12,14849.0,United Kingdom
577175,2023-11-18,22086,Paper Chain Kit 50'S Christmas,13.27,18,14849.0,United Kingdom
577175,2023-11-18,23344,Jumbo Bag 50'S Christmas,6.19,10,14849.0,United Kingdom
577176,2023-11-18,23493,Vintage Doily Travel Sewing Kit,12.25,10,13305.0,United Kingdom
577176,2023-11-18,22591,Cardholder Gingham Christmas Tree,13.58,6,13305.0,United Kingdom
577176,2023-11-18,23284,Doormat Keep Calm And Come In,18.71,6,13305.0,United Kingdom
577176,2023-11-18,22865,Hand Warmer Owl Design,12.4,12,13305.0,United Kingdom
577176,2023-11-18,20971,Pink Blue Felt Craft Trinket Box,11.53,12,13305.0,United Kingdom
577176,2023-11-18,20972,Pink Cream Felt Craft Trinket Box,11.53,12,13305.0,United Kingdom
577176,2023-11-18,21985,Pack Of 12 Hearts Design Tissues,10.65,24,13305.0,United Kingdom
577176,2023-11-18,22947,Wooden Advent Calendar Red,18.4,6,13305.0,United Kingdom
577176,2023-11-18,22580,Advent Calendar Gingham Sack,16.35,3,13305.0,United Kingdom
577176,2023-11-18,23247,Biscuit Tin 50'S Christmas,13.21,6,13305.0,United Kingdom
577176,2023-11-18,23234,Biscuit Tin Vintage Christmas,13.21,6,13305.0,United Kingdom
577176,2023-11-18,48194,Doormat Hearts,18.71,4,13305.0,United Kingdom
577176,2023-11-18,21982,Pack Of 12 Suki Tissues,10.65,24,13305.0,United Kingdom
577176,2023-11-18,23344,Jumbo Bag 50'S Christmas,6.19,10,13305.0,United Kingdom
577177,2023-11-18,23084,Rabbit Night Light,12.38,2,12748.0,United Kingdom
577178,2023-11-18,23480,Mini Lights Woodland Mushrooms,14.09,4,12618.0,Italy
577178,2023-11-18,22595,Gingham Heart Decoration,11.12,12,12618.0,Italy
577178,2023-11-18,21499,Blue Polkadot Wrap,10.68,25,12618.0,Italy
577178,2023-11-18,21500,Pink Polkadot Wrap,10.68,25,12618.0,Italy
577178,2023-11-18,23432,Pretty Hanging Quilted Hearts,11.1,12,12618.0,Italy
577178,2023-11-18,22320,Birds Mobile Vintage Design,16.35,3,12618.0,Italy
577178,2023-11-18,22483,Red Gingham Teddy Bear,13.27,6,12618.0,Italy
577178,2023-11-18,22138,Baking Set 9 Piece Retrospot,15.32,3,12618.0,Italy
577178,2023-11-18,20750,Red Retrospot Mini Cases,18.4,2,12618.0,Italy
577178,2023-11-18,22617,Baking Set Spaceboy Design,15.32,3,12618.0,Italy
577179,2023-11-18,21116,Owl Doorstop,15.32,12,18061.0,United Kingdom
577179,2023-11-18,21523,Doormat Fancy Font Home Sweet Home,18.71,4,18061.0,United Kingdom
577180,2023-11-18,23480,Mini Lights Woodland Mushrooms,13.62,48,12380.0,Belgium
577180,2023-11-18,21731,Red Toadstool Led Night Light,11.94,24,12380.0,Belgium
577180,2023-11-18,23084,Rabbit Night Light,12.08,48,12380.0,Belgium
577180,2023-11-18,21439,Basket Of Toadstools,11.53,12,12380.0,Belgium
577180,2023-11-18,20685,Doormat Red Retrospot,17.51,10,12380.0,Belgium
577180,2023-11-18,21621,Vintage Union Jack Bunting,18.96,4,12380.0,Belgium
577180,2023-11-18,22668,Pink Baby Bunting,13.27,5,12380.0,Belgium
577180,2023-11-18,22467,Gumball Coat Rack,12.4,36,12380.0,Belgium
577180,2023-11-18,22326,Round Snack Boxes Set Of4 Woodland,12.86,48,12380.0,Belgium
577180,2023-11-18,22628,Picnic Boxes Set Of 3 Retrospot,15.32,4,12380.0,Belgium
577180,2023-11-18,22329,Round Container Set Of 5 Retrospot,11.94,12,12380.0,Belgium
577180,2023-11-18,21931,Jumbo Storage Bag Suki,12.38,20,12380.0,Belgium
577180,2023-11-18,20726,Lunch Bag Woodland,5.97,10,12380.0,Belgium
577180,2023-11-18,23207,Lunch Bag Alphabet Design,5.97,10,12380.0,Belgium
577180,2023-11-18,22382,Lunch Bag Spaceboy Design,5.97,10,12380.0,Belgium
577181,2023-11-18,22835,Hot Water Bottle I Am So Poorly,14.61,48,13181.0,United Kingdom
577181,2023-11-18,22112,Chocolate Hot Water Bottle,14.61,48,13181.0,United Kingdom
577181,2023-11-18,23355,Hot Water Bottle Keep Calm,14.5,48,13181.0,United Kingdom
577181,2023-11-18,84029E,Red Woolly Hottie White Heart,14.09,48,13181.0,United Kingdom
577181,2023-11-18,22114,Hot Water Bottle Tea And Sympathy,14.09,48,13181.0,United Kingdom
577181,2023-11-18,82494L,Wooden Frame Antique White,12.86,48,13181.0,United Kingdom
577181,2023-11-18,23358,Hot Stuff Hot Water Bottle,13.62,36,13181.0,United Kingdom
577181,2023-11-18,23057,Beaded Chandelier T-Light Holder,11.27,96,13181.0,United Kingdom
577181,2023-11-18,23055,Ivory Chandelier T-Light Holder,11.27,96,13181.0,United Kingdom
577181,2023-11-18,23056,Flowers Chandelier T-Light Holder,11.27,96,13181.0,United Kingdom
577182,2023-11-18,21982,Pack Of 12 Suki Tissues,10.65,24,16945.0,United Kingdom
577182,2023-11-18,20973,12 Pencil Small Tube Woodland,10.92,24,16945.0,United Kingdom
577182,2023-11-18,20972,Pink Cream Felt Craft Trinket Box,11.53,12,16945.0,United Kingdom
577182,2023-11-18,21931,Jumbo Storage Bag Suki,12.38,10,16945.0,United Kingdom
577182,2023-11-18,21744,Snowflake Portable Table Light,13.27,6,16945.0,United Kingdom
577182,2023-11-18,21930,Jumbo Storage Bag Skulls,12.38,10,16945.0,United Kingdom
577182,2023-11-18,22779,Wooden Owls Light Garland,14.61,4,16945.0,United Kingdom
577182,2023-11-18,22780,Light Garland Butterfiles Pink,14.61,4,16945.0,United Kingdom
577182,2023-11-18,21703,Bag 125g Swirly Marbles,10.68,12,16945.0,United Kingdom
577182,2023-11-18,23201,Jumbo Bag Alphabet,6.19,10,16945.0,United Kingdom
577182,2023-11-18,22386,Jumbo Bag Pink Polkadot,6.19,10,16945.0,United Kingdom
577182,2023-11-18,23202,Jumbo Bag Vintage Leaf,6.19,10,16945.0,United Kingdom
577182,2023-11-18,23203,Jumbo Bag Vintage Doily,6.19,10,16945.0,United Kingdom
577182,2023-11-18,20711,Jumbo Bag Toys,6.19,10,16945.0,United Kingdom
577182,2023-11-18,85099B,Jumbo Bag Red Retrospot,6.19,10,16945.0,United Kingdom
577182,2023-11-18,23199,Jumbo Bag Apples,6.19,10,16945.0,United Kingdom
577182,2023-11-18,21929,Jumbo Bag Pink Vintage Paisley,6.19,10,16945.0,United Kingdom
577202,2023-11-18,21137,Black Record Cover Frame,13.72,24,12989.0,United Kingdom
577202,2023-11-18,23284,Doormat Keep Calm And Come In,17.51,30,12989.0,United Kingdom
577202,2023-11-18,22041,"Record Frame 7"" Single Size",12.86,24,12989.0,United Kingdom
577209,2023-11-18,85123A,Cream Hanging Heart T-Light Holder,12.86,64,15621.0,United Kingdom
577209,2023-11-18,21733,Red Hanging Heart T-Light Holder,12.86,64,15621.0,United Kingdom
577209,2023-11-18,71477,Coloured Glass Star T-Light Holder,13.62,72,15621.0,United Kingdom
577217,2023-11-18,21034,Rex Cash+Carry Jumbo Shopper,11.22,2,17324.0,United Kingdom
577217,2023-11-18,21499,Blue Polkadot Wrap,10.68,25,17324.0,United Kingdom
577217,2023-11-18,21500,Pink Polkadot Wrap,10.68,25,17324.0,United Kingdom
577217,2023-11-18,22046,Tea Party Wrapping Paper,10.68,25,17324.0,United Kingdom
577217,2023-11-18,21498,Red Retrospot Wrap,10.68,25,17324.0,United Kingdom
577217,2023-11-18,16161P,Wrap English Rose,10.68,25,17324.0,United Kingdom
577217,2023-11-18,23156,Set Of 5 Mini Grocery Magnets,12.38,1,17324.0,United Kingdom
577217,2023-11-18,23159,Set Of 5 Pancake Day Magnets,12.38,1,17324.0,United Kingdom
577217,2023-11-18,22791,T-Light Glass Fluted Antique,11.53,12,17324.0,United Kingdom
577217,2023-11-18,22969,Homemade Jam Scented Candles,11.74,12,17324.0,United Kingdom
577217,2023-11-18,23328,Set 6 School Milk Bottles In Crate,14.09,1,17324.0,United Kingdom
577217,2023-11-18,23423,Pantry 3 Hook Rolling Pin Hanger,14.09,1,17324.0,United Kingdom
577217,2023-11-18,22778,Glass Cloche Small,14.3,1,17324.0,United Kingdom
577217,2023-11-18,84946,Antique Silver T-Light Glass,11.53,6,17324.0,United Kingdom
577217,2023-11-18,84978,Hanging Heart Jar T-Light Holder,11.53,6,17324.0,United Kingdom
577217,2023-11-18,22739,Ribbon Reel Christmas Sock Bauble,11.94,5,17324.0,United Kingdom
577217,2023-11-18,23338,Egg Frying Pan Red,12.38,1,17324.0,United Kingdom
577217,2023-11-18,23335,Egg Frying Pan Ivory,12.38,1,17324.0,United Kingdom
577217,2023-11-18,23265,Set Of 3 Wooden Tree Decorations,11.53,2,17324.0,United Kingdom
577217,2023-11-18,23263,Set Of 3 Wooden Heart Decorations,11.53,2,17324.0,United Kingdom
577217,2023-11-18,23266,Set Of 3 Wooden Stocking Decoration,11.53,2,17324.0,United Kingdom
577217,2023-11-18,23328,Set 6 School Milk Bottles In Crate,14.09,1,17324.0,United Kingdom
577217,2023-11-18,35970,Zinc Folkart Sleigh Bells,11.98,1,17324.0,United Kingdom
577217,2023-11-18,21625,Vintage Union Jack Apron,17.37,1,17324.0,United Kingdom
577217,2023-11-18,23319,Box Of 6 Mini 50'S Crackers,12.8,5,17324.0,United Kingdom
577217,2023-11-18,21080,Set/20 Red Retrospot Paper Napkins,11.12,4,17324.0,United Kingdom
577217,2023-11-18,21291,Small Polkadot Chocolate Gift Bag,5.56,8,17324.0,United Kingdom
577218,2023-11-18,23058,Christmas Hanging Snowflake,11.06,12,13117.0,United Kingdom
577218,2023-11-18,21793,Classic French Style Basket Brown,14.3,8,13117.0,United Kingdom
577218,2023-11-18,90058B,Crystal Stud Earrings Assorted Col,10.64,36,13117.0,United Kingdom
577218,2023-11-18,22578,Wooden Star Christmas Scandinavian,10.55,24,13117.0,United Kingdom
577218,2023-11-18,35953,Folkart Star Christmas Decorations,10.65,48,13117.0,United Kingdom
577218,2023-11-18,23275,Set Of 3 Hanging Owls Ollie Beak,11.53,12,13117.0,United Kingdom
577218,2023-11-18,20668,Disco Ball Christmas Decoration,10.37,24,13117.0,United Kingdom
577218,2023-11-18,22153,Angel Decoration Stars On Dress,10.68,48,13117.0,United Kingdom
577218,2023-11-18,22579,Wooden Tree Christmas Scandinavian,10.55,24,13117.0,United Kingdom
577218,2023-11-18,22457,Natural Slate Heart Chalkboard,13.27,6,13117.0,United Kingdom
577228,2023-11-18,22669,Red Baby Bunting,13.27,1,12391.0,Cyprus
577228,2023-11-18,22668,Pink Baby Bunting,13.27,1,12391.0,Cyprus
577228,2023-11-18,22816,Card Motorbike Santa,10.68,12,12391.0,Cyprus
577228,2023-11-18,85088,Candy Spot Hand Bag,12.4,2,12391.0,Cyprus
577228,2023-11-18,23048,Set Of 10 Lanterns Fairy Light Star,14.5,1,12391.0,Cyprus
577228,2023-11-18,22435,Set Of 9 Heart Shaped Balloons,11.53,1,12391.0,Cyprus
577228,2023-11-18,22818,Card Christmas Village,10.68,24,12391.0,Cyprus
577228,2023-11-18,84199,Glow In Dark Dolphins,10.47,4,12391.0,Cyprus
577228,2023-11-18,22144,Christmas Craft Little Friends,12.4,1,12391.0,Cyprus
577228,2023-11-18,23077,Doughnut Lip Gloss,11.53,20,12391.0,Cyprus
577228,2023-11-18,23048,Set Of 10 Lanterns Fairy Light Star,14.5,1,12391.0,Cyprus
577228,2023-11-18,22586,Feltcraft Hairband Pink And Blue,11.12,1,12391.0,Cyprus
577228,2023-11-18,22566,Feltcraft Hairband Pink And Purple,11.12,1,12391.0,Cyprus
577228,2023-11-18,22565,Feltcraft Hairbands Pink And White,11.12,1,12391.0,Cyprus
577228,2023-11-18,22141,Christmas Craft Tree Top Angel,12.4,1,12391.0,Cyprus
577228,2023-11-18,23128,Feltcraft Boy Jean-Paul Kit,15.32,1,12391.0,Cyprus
577228,2023-11-18,22144,Christmas Craft Little Friends,12.4,1,12391.0,Cyprus
577228,2023-11-18,22142,Christmas Craft White Fairy,11.74,1,12391.0,Cyprus
577228,2023-11-18,21841,Baby Mouse Red Gingham Dress,14.61,2,12391.0,Cyprus
577228,2023-11-18,84580,Mouse Toy With Pink T-Shirt,14.09,1,12391.0,Cyprus
577228,2023-11-18,84581,Dog Toy With Pink Crochet Skirt,14.09,1,12391.0,Cyprus
577228,2023-11-18,23127,Feltcraft Girl Nicole Kit,15.32,1,12391.0,Cyprus
577228,2023-11-18,23126,Feltcraft Girl Amelie Kit,15.32,1,12391.0,Cyprus
577228,2023-11-18,84580,Mouse Toy With Pink T-Shirt,14.09,1,12391.0,Cyprus
577228,2023-11-18,22270,Happy Easter Hanging Decoration,14.09,1,12391.0,Cyprus
577228,2023-11-18,23048,Set Of 10 Lanterns Fairy Light Star,14.5,1,12391.0,Cyprus
577228,2023-11-18,23156,Set Of 5 Mini Grocery Magnets,12.38,1,12391.0,Cyprus
577228,2023-11-18,22270,Happy Easter Hanging Decoration,14.09,1,12391.0,Cyprus
577228,2023-11-18,20985,Heart Calculator,11.53,1,12391.0,Cyprus
577228,2023-11-18,22435,Set Of 9 Heart Shaped Balloons,11.53,1,12391.0,Cyprus
577228,2023-11-18,23298,Spotty Bunting,15.32,1,12391.0,Cyprus
577228,2023-11-18,47566,Party Bunting,15.32,1,12391.0,Cyprus
577228,2023-11-18,22273,Feltcraft Doll Molly,13.27,1,12391.0,Cyprus
577228,2023-11-18,22271,Feltcraft Doll Rosie,13.27,1,12391.0,Cyprus
577228,2023-11-18,22274,Feltcraft Doll Emily,13.27,1,12391.0,Cyprus
577228,2023-11-18,22749,Feltcraft Princess Charlotte Doll,14.09,1,12391.0,Cyprus
577228,2023-11-18,22128,Party Cones Candy Assorted,11.53,12,12391.0,Cyprus
577228,2023-11-18,22371,Airline Bag Vintage Tokyo 78,14.61,1,12391.0,Cyprus
577228,2023-11-18,22375,Airline Bag Vintage Jet Set Brown,14.61,1,12391.0,Cyprus
577228,2023-11-18,22374,Airline Bag Vintage Jet Set Red,14.61,1,12391.0,Cyprus
577228,2023-11-18,22372,Airline Bag Vintage World Champion,14.61,1,12391.0,Cyprus
577228,2023-11-18,22940,Feltcraft Christmas Fairy,14.61,2,12391.0,Cyprus
577228,2023-11-18,20971,Pink Blue Felt Craft Trinket Box,11.53,2,12391.0,Cyprus
577228,2023-11-18,23513,Embroidered Ribbon Reel Susie,12.38,1,12391.0,Cyprus
577228,2023-11-18,23512,Embroidered Ribbon Reel Rosie,12.38,1,12391.0,Cyprus
577228,2023-11-18,23511,Embroidered Ribbon Reel Emily,12.38,1,12391.0,Cyprus
577228,2023-11-18,23518,Embroidered Ribbon Reel Rachel,13.21,1,12391.0,Cyprus
577228,2023-11-18,23515,Embroidered Ribbon Reel Daisy,12.38,1,12391.0,Cyprus
577228,2023-11-18,23517,Embroidered Ribbon Reel Rebecca,13.21,1,12391.0,Cyprus
577228,2023-11-18,23514,Embroidered Ribbon Reel Sally,12.38,1,12391.0,Cyprus
577228,2023-11-18,23516,Embroidered Ribbon Reel Sophie,14.09,1,12391.0,Cyprus
577228,2023-11-18,23520,Embroidered Ribbon Reel Ruby,14.09,1,12391.0,Cyprus
577228,2023-11-18,23579,Snack Tray I Love London,12.25,1,12391.0,Cyprus
577228,2023-11-18,23335,Egg Frying Pan Ivory,12.38,1,12391.0,Cyprus
577228,2023-11-18,20985,Heart Calculator,11.53,2,12391.0,Cyprus
577228,2023-11-18,21733,Red Hanging Heart T-Light Holder,13.27,6,12391.0,Cyprus
577228,2023-11-18,85123A,Cream Hanging Heart T-Light Holder,13.27,10,12391.0,Cyprus
577228,2023-11-18,22804,Pink Hanging Heart T-Light Holder,13.27,6,12391.0,Cyprus
577228,2023-11-18,23156,Set Of 5 Mini Grocery Magnets,12.38,1,12391.0,Cyprus
577228,2023-11-18,23159,Set Of 5 Pancake Day Magnets,12.38,2,12391.0,Cyprus
577228,2023-11-18,23154,Set Of 4 Jam Jar Magnets,12.38,2,12391.0,Cyprus
577228,2023-11-18,21125,Set 6 Football Celebration Candles,11.53,2,12391.0,Cyprus
577228,2023-11-18,21126,Set Of 6 Girls Celebration Candles,11.53,2,12391.0,Cyprus
577228,2023-11-18,21439,Basket Of Toadstools,11.53,3,12391.0,Cyprus
577228,2023-11-18,22208,Wood Stamp Set Thank You,11.1,1,12391.0,Cyprus
577228,2023-11-18,22209,Wood Stamp Set Happy Birthday,11.1,1,12391.0,Cyprus
577228,2023-11-18,22210,Wood Stamp Set Best Wishes,11.1,1,12391.0,Cyprus
577228,2023-11-18,21446,12 Red Rose Peg Place Settings,11.53,3,12391.0,Cyprus
577228,2023-11-18,22758,Large Purple Babushka Notebook,11.53,1,12391.0,Cyprus
577228,2023-11-18,22754,Small Red Babushka Notebook,11.12,1,12391.0,Cyprus
577228,2023-11-18,22753,Small Yellow Babushka Notebook,11.12,1,12391.0,Cyprus
577228,2023-11-18,84536A,English Rose Notebook A7 Size,10.68,3,12391.0,Cyprus
577228,2023-11-18,22809,Set Of 6 T-Lights Santa,13.27,2,12391.0,Cyprus
577228,2023-11-18,23188,Vintage 2 Metre Folding Ruler,11.94,3,12391.0,Cyprus
577228,2023-11-18,22759,Set Of 3 Notebooks In Parcel,11.94,2,12391.0,Cyprus
577228,2023-11-18,23078,Ice Cream Pen Lip Gloss,11.53,20,12391.0,Cyprus
577228,2023-11-18,16238,Party Time Pencil Erasers,10.47,28,12391.0,Cyprus
577228,2023-11-18,21328,Balloons Writing Set,11.94,1,12391.0,Cyprus
577228,2023-11-18,22563,Happy Stencil Craft,11.53,1,12391.0,Cyprus
577228,2023-11-18,22562,Monsters Stencil Craft,11.53,1,12391.0,Cyprus
577228,2023-11-18,22564,Alphabet Stencil Craft,11.53,1,12391.0,Cyprus
577228,2023-11-18,23197,Sketchbook Magnetic Shopping List,11.74,1,12391.0,Cyprus
577228,2023-11-18,23198,Pantry Magnetic Shopping List,11.74,1,12391.0,Cyprus
577228,2023-11-18,23196,Vintage Leaf Magnetic Notepad,11.74,1,12391.0,Cyprus
577228,2023-11-18,16258A,Swirly Circular Rubbers In Bag,10.68,12,12391.0,Cyprus
577228,2023-11-18,23500,Key Ring Baseball Boot Assorted,11.53,20,12391.0,Cyprus
577228,2023-11-18,20674,Green Polkadot Bowl,11.53,2,12391.0,Cyprus
577228,2023-11-18,20675,Blue Polkadot Bowl,11.53,2,12391.0,Cyprus
577228,2023-11-18,20676,Red Retrospot Bowl,11.53,2,12391.0,Cyprus
577228,2023-11-18,20677,Pink Polkadot Bowl,11.53,2,12391.0,Cyprus
577228,2023-11-18,21061,Party Invites Football,11.12,3,12391.0,Cyprus
577228,2023-11-18,23214,Jingle Bell Heart Antique Gold,12.38,3,12391.0,Cyprus
577228,2023-11-18,21528,Dairy Maid Traditional Teapot,17.37,1,12391.0,Cyprus
577228,2023-11-18,22308,Tea Cosy Blue Stripe,12.86,1,12391.0,Cyprus
577228,2023-11-18,51014A,Feather Pen Hot Pink,10.65,12,12391.0,Cyprus
577228,2023-11-18,21034,Rex Cash+Carry Jumbo Shopper,11.22,1,12391.0,Cyprus
577228,2023-11-18,20725,Lunch Bag Red Retrospot,5.97,1,12391.0,Cyprus
577228,2023-11-18,22384,Lunch Bag Pink Polkadot,5.97,1,12391.0,Cyprus
577230,2023-11-18,22471,Tv Dinner Tray Air Hostess,15.32,1,18034.0,United Kingdom
577230,2023-11-18,22097,Swallow Square Tissue Box,10.65,7,18034.0,United Kingdom
577230,2023-11-18,79149B,Silicon Star Bulb Blue,10.68,1,18034.0,United Kingdom
577230,2023-11-18,22094,Red Retrospot Tissue Box,10.65,2,18034.0,United Kingdom
577230,2023-11-18,22311,Office Mug Warmer Black+Silver,13.27,1,18034.0,United Kingdom
577230,2023-11-18,20752,Blue Polkadot Washing Up Gloves,12.4,1,18034.0,United Kingdom
577230,2023-11-18,20754,Retrospot Red Washing Up Gloves,12.4,1,18034.0,United Kingdom
577230,2023-11-18,22900,Set 2 Tea Towels I Love London,13.58,1,18034.0,United Kingdom
577230,2023-11-18,21625,Vintage Union Jack Apron,17.37,1,18034.0,United Kingdom
577230,2023-11-18,22331,Woodland Party Bag + Sticker Set,11.94,1,18034.0,United Kingdom
577230,2023-11-18,22332,Skulls Party Bag + Sticker Set,11.94,2,18034.0,United Kingdom
577230,2023-11-18,22812,Pack 3 Boxes Christmas Panettone,12.25,1,18034.0,United Kingdom
577230,2023-11-18,23005,Travel Card Wallet I Love London,10.68,1,18034.0,United Kingdom
577230,2023-11-18,21650,Assorted Tutti Frutti Bracelet,10.44,9,18034.0,United Kingdom
577230,2023-11-18,21810,Christmas Hanging Star With Bell,10.65,2,18034.0,United Kingdom
577230,2023-11-18,21818,Glitter Heart Decoration,10.65,2,18034.0,United Kingdom
577230,2023-11-18,21819,Glitter Christmas Star,10.65,2,18034.0,United Kingdom
577230,2023-11-18,21820,Glitter Heart Garland With Bells,14.09,1,18034.0,United Kingdom
577230,2023-11-18,22584,Pack Of 6 Panettone Gift Boxes,12.86,1,18034.0,United Kingdom
577230,2023-11-18,22585,Pack Of 6 Birdy Gift Tags,11.53,1,18034.0,United Kingdom
577230,2023-11-18,22791,T-Light Glass Fluted Antique,11.53,3,18034.0,United Kingdom
577230,2023-11-18,23378,Pack Of 12 50'S Christmas Tissues,10.65,2,18034.0,United Kingdom
577230,2023-11-18,23504,Playing Cards Jubilee Union Jack,11.53,1,18034.0,United Kingdom
577230,2023-11-18,84558A,3d Dog Picture Playing Cards,13.27,2,18034.0,United Kingdom
577230,2023-11-18,23083,Set 6 Paper Table Lantern Stars,14.09,1,18034.0,United Kingdom
577230,2023-11-18,23300,Gardeners Kneeling Pad Cup Of Tea,11.94,1,18034.0,United Kingdom
577230,2023-11-18,23301,Gardeners Kneeling Pad Keep Calm,11.94,2,18034.0,United Kingdom
577230,2023-11-18,23309,Set Of 60 I Love London Cake Cases,10.81,1,18034.0,United Kingdom
577230,2023-11-18,84992,72 Sweetheart Fairy Cake Cases,10.81,1,18034.0,United Kingdom
577230,2023-11-18,21213,Pack Of 72 Skull Cake Cases,10.81,1,18034.0,United Kingdom
577230,2023-11-18,21588,Retrospot Giant Tube Matches,12.86,1,18034.0,United Kingdom
577230,2023-11-18,82616C,Midnight Glamour Scarf Knitting Kit,11.53,1,18034.0,United Kingdom
577230,2023-11-18,22780,Light Garland Butterfiles Pink,14.61,1,18034.0,United Kingdom
577230,2023-11-18,22437,Set Of 9 Black Skull Balloons,11.12,2,18034.0,United Kingdom
577230,2023-11-18,47594A,Carousel Design Washbag,12.25,2,18034.0,United Kingdom
577230,2023-11-18,23365,Set 12 Colour Pencils Love London,10.92,48,18034.0,United Kingdom
577230,2023-11-18,22208,Wood Stamp Set Thank You,11.1,12,18034.0,United Kingdom
577230,2023-11-18,22211,Wood Stamp Set Flowers,11.1,12,18034.0,United Kingdom
