TransactionNo,Date,ProductNo,ProductName,Price,Quantity,CustomerNo,Country
544906,2023-02-24,22197,Popcorn Holder,11.12,48,17017.0,United Kingdom
544906,2023-02-24,22616,Pack Of 12 London Tissues,10.55,48,17017.0,United Kingdom
544906,2023-02-24,22911,Paper Chain Kit London,13.27,12,17017.0,United Kingdom
544906,2023-02-24,22659,Lunch Box I Love London,12.25,12,17017.0,United Kingdom
544906,2023-02-24,22900,Set 2 Tea Towels I Love London,13.27,12,17017.0,United Kingdom
544906,2023-02-24,22988,Soldiers Egg Cup,11.53,24,17017.0,United Kingdom
544906,2023-02-24,21731,Red Toadstool Led Night Light,11.94,12,17017.0,United Kingdom
544906,2023-02-24,21559,Strawberry Lunch Box With Cutlery,12.86,12,17017.0,United Kingdom
544907,2023-02-24,22457,Natural Slate Heart Chalkboard,13.27,6,12945.0,United Kingdom
544907,2023-02-24,22087,Paper Bunting White Lace,13.27,6,12945.0,United Kingdom
544907,2023-02-24,22799,Sweetheart Wire Fruit Bowl,18.96,2,12945.0,United Kingdom
544907,2023-02-24,22469,Heart Of Wicker Small,11.74,40,12945.0,United Kingdom
544907,2023-02-24,22470,Heart Of Wicker Large,13.27,6,12945.0,United Kingdom
544907,2023-02-24,22426,Enamel Wash Bowl Cream,14.09,4,12945.0,United Kingdom
544907,2023-02-24,22427,Enamel Flower Jug Cream,16.35,3,12945.0,United Kingdom
544907,2023-02-24,82484,Wood Black Board Ant White Finish,18.4,2,12945.0,United Kingdom
544907,2023-02-24,22189,Cream Heart Card Holder,14.3,4,12945.0,United Kingdom
544907,2023-02-24,22188,Black Heart Card Holder,14.3,4,12945.0,United Kingdom
544907,2023-02-24,22624,Ivory Kitchen Scales,18.96,2,12945.0,United Kingdom
544907,2023-02-24,85123A,Cream Hanging Heart T-Light Holder,13.27,6,12945.0,United Kingdom
544907,2023-02-24,21930,Jumbo Storage Bag Skulls,12.25,10,12945.0,United Kingdom
544907,2023-02-24,22411,Jumbo Shopper Vintage Red Paisley,12.25,10,12945.0,United Kingdom
544907,2023-02-24,22585,Pack Of 6 Birdy Gift Tags,11.53,12,12945.0,United Kingdom
544907,2023-02-24,85099F,Jumbo Bag Strawberry,6.13,10,12945.0,United Kingdom
544907,2023-02-24,85099C,Jumbo Bag Baroque Black White,6.13,10,12945.0,United Kingdom
544907,2023-02-24,22386,Jumbo Bag Pink Polkadot,6.13,10,12945.0,United Kingdom
544907,2023-02-24,20728,Lunch Bag Cars Blue,5.97,10,12945.0,United Kingdom
544908,2023-02-24,71459,Hanging Jam Jar T-Light Holders,11.12,24,18056.0,United Kingdom
544908,2023-02-24,84978,Hanging Heart Jar T-Light Holder,11.53,12,18056.0,United Kingdom
544908,2023-02-24,22178,Victorian Glass Hanging T-Light,11.53,12,18056.0,United Kingdom
544908,2023-02-24,22084,Paper Chain Kit Empire,13.27,12,18056.0,United Kingdom
544908,2023-02-24,21716,Boys Vintage Tin Seaside Bucket,12.86,8,18056.0,United Kingdom
544908,2023-02-24,22241,Garland Wooden Happy Easter,11.53,12,18056.0,United Kingdom
544908,2023-02-24,22859,Easter Tin Bunny Bouquet,11.94,6,18056.0,United Kingdom
544908,2023-02-24,22858,Easter Tin Keepsake,11.94,6,18056.0,United Kingdom
544908,2023-02-24,22861,Easter Tin Chicks In Garden,11.94,6,18056.0,United Kingdom
544908,2023-02-24,22129,Party Cones Candy Decoration,11.12,12,18056.0,United Kingdom
544908,2023-02-24,22857,Assorted Easter Gift Tags,11.12,24,18056.0,United Kingdom
544908,2023-02-24,22957,Set 3 Paper Vintage Chick Paper Egg,13.27,6,18056.0,United Kingdom
544908,2023-02-24,22856,Assorted Easter Decorations Bells,11.53,24,18056.0,United Kingdom
544908,2023-02-24,21621,Vintage Union Jack Bunting,18.96,4,18056.0,United Kingdom
544908,2023-02-24,22938,Cupcake Lace Paper Set 6,12.25,12,18056.0,United Kingdom
544908,2023-02-24,21878,Pack Of 6 Sandcastle Flags Assorted,11.12,12,18056.0,United Kingdom
544908,2023-02-24,21718,Red Metal Beach Spade,11.53,6,18056.0,United Kingdom
544908,2023-02-24,21626,Vintage Union Jack Pennant,12.25,12,18056.0,United Kingdom
544909,2023-02-24,85170D,Set/6 Pink Bird T-Light Candles,11.12,24,14298.0,United Kingdom
544909,2023-02-24,85170B,Set/6 Black Bird T-Light Candles,11.12,24,14298.0,United Kingdom
544909,2023-02-24,85159B,White Tea Coffee Sugar Jars,11.53,24,14298.0,United Kingdom
544909,2023-02-24,85159A,Black Tea Coffee Sugar Jars,11.53,24,14298.0,United Kingdom
544909,2023-02-24,84509E,Set Of 4 Carousel Placemats,11.53,24,14298.0,United Kingdom
544909,2023-02-24,75178,Asstd Col Butterfly/Crystal W/Chime,10.68,144,14298.0,United Kingdom
544909,2023-02-24,22783,Set 3 Wicker Oval Baskets W Lids,18.4,8,14298.0,United Kingdom
544909,2023-02-24,22702,Black And White Cat Bowl,11.12,48,14298.0,United Kingdom
544909,2023-02-24,22701,Pink Dog Bowl,11.12,48,14298.0,United Kingdom
544909,2023-02-24,22700,Black And White Dog Bowl,11.12,48,14298.0,United Kingdom
544909,2023-02-24,22647,Ceramic Love Heart Money Bank,10.68,36,14298.0,United Kingdom
544909,2023-02-24,22378,Wall Tidy Retrospot,11.12,20,14298.0,United Kingdom
544909,2023-02-24,22377,Bottle Bag Retrospot,11.12,20,14298.0,United Kingdom
544909,2023-02-24,22117,Metal Sign Her Dinner Is Served,11.12,24,14298.0,United Kingdom
544909,2023-02-24,22116,Metal Sign His Dinner Is Served,11.12,24,14298.0,United Kingdom
544909,2023-02-24,47504K,English Rose Garden Secateurs,11.12,48,14298.0,United Kingdom
544909,2023-02-24,47504H,English Rose Spirit Level,11.12,24,14298.0,United Kingdom
544909,2023-02-24,47503A,Ass Floral Print Multi Screwdriver,10.68,48,14298.0,United Kingdom
544909,2023-02-24,22473,Tv Dinner Tray Vintage Paisley,12.25,8,14298.0,United Kingdom
544909,2023-02-24,22223,Cake Plate Lovebird Pink,12.25,24,14298.0,United Kingdom
544909,2023-02-24,22222,Cake Plate Lovebird White,12.25,24,14298.0,United Kingdom
544909,2023-02-24,21876,Pottering Mug,10.68,36,14298.0,United Kingdom
544909,2023-02-24,72232,Feng Shui Pillar Candle,10.44,96,14298.0,United Kingdom
544909,2023-02-24,62096A,Pink/Yellow Flowers Handbag,11.53,46,14298.0,United Kingdom
544909,2023-02-24,85184C,Set 4 Valentine Decoupage Heart Box,11.53,48,14298.0,United Kingdom
544909,2023-02-24,22610,Pens Assorted Funny Face,10.47,144,14298.0,United Kingdom
544909,2023-02-24,22609,Pens Assorted Spaceball,10.47,144,14298.0,United Kingdom
544909,2023-02-24,22608,Pens Assorted Funky Jeweled,10.47,144,14298.0,United Kingdom
544909,2023-02-24,21199,Pink Heart Confetti In Tube,10.68,48,14298.0,United Kingdom
544909,2023-02-24,21198,White Heart Confetti In Tube,10.68,48,14298.0,United Kingdom
544909,2023-02-24,21112,Swiss Roll Towel Pink Spots,11.53,48,14298.0,United Kingdom
544909,2023-02-24,21111,Swiss Roll Towel Chocolate Spots,11.53,48,14298.0,United Kingdom
544909,2023-02-24,21110,Large Cake Towel Pink Spots,12.25,48,14298.0,United Kingdom
544909,2023-02-24,21109,Large Cake Towel Chocolate Spots,12.25,48,14298.0,United Kingdom
544909,2023-02-24,21065,Boom Box Speaker Girls,11.53,96,14298.0,United Kingdom
544910,2023-02-24,22720,Set Of 3 Cake Tins Pantry Design,15.32,9,16072.0,United Kingdom
544910,2023-02-24,22722,Set Of 6 Spice Tins Pantry Design,14.3,4,16072.0,United Kingdom
544910,2023-02-24,22625,Red Kitchen Scales,18.96,2,16072.0,United Kingdom
544910,2023-02-24,22626,Black Kitchen Scales,18.96,2,16072.0,United Kingdom
544910,2023-02-24,22978,Pantry Rolling Pin,14.09,6,16072.0,United Kingdom
544910,2023-02-24,22844,Vintage Cream Dog Food Container,18.96,2,16072.0,United Kingdom
544910,2023-02-24,22845,Vintage Cream Cat Food Container,16.76,2,16072.0,United Kingdom
544910,2023-02-24,21232,Strawberry Ceramic Trinket Pot,11.53,12,16072.0,United Kingdom
544910,2023-02-24,15034,Paper Pocket Traveling Fan,10.39,48,16072.0,United Kingdom
544910,2023-02-24,22191,Ivory Diner Wall Clock,18.96,2,16072.0,United Kingdom
544910,2023-02-24,22192,Blue Diner Wall Clock,18.96,2,16072.0,United Kingdom
544910,2023-02-24,22193,Red Diner Wall Clock,18.96,2,16072.0,United Kingdom
544910,2023-02-24,22194,Black Diner Wall Clock,18.96,2,16072.0,United Kingdom
544910,2023-02-24,21191,Large White Honeycomb Paper Bell,12.4,6,16072.0,United Kingdom
544910,2023-02-24,22890,Novelty Biscuits Cake Stand 3 Tier,18.96,12,16072.0,United Kingdom
544910,2023-02-24,84926A,Wake Up Cockerel Tile Coaster,11.53,12,16072.0,United Kingdom
544911,2023-02-24,84879,Assorted Colour Bird Ornament,11.98,8,16838.0,United Kingdom
544911,2023-02-24,22926,Ivory Giant Garden Thermometer,16.35,2,16838.0,United Kingdom
544911,2023-02-24,84978,Hanging Heart Jar T-Light Holder,11.53,12,16838.0,United Kingdom
544911,2023-02-24,84792,Enchanted Bird Coathanger 5 Hook,15.02,4,16838.0,United Kingdom
544911,2023-02-24,22798,Antique Glass Dressing Table Pot,13.27,8,16838.0,United Kingdom
544911,2023-02-24,22791,T-Light Glass Fluted Antique,11.53,12,16838.0,United Kingdom
544911,2023-02-24,22800,Antique Tall Swirlglass Trinket Pot,14.09,4,16838.0,United Kingdom
544911,2023-02-24,22801,Antique Glass Pedestal Bowl,14.09,4,16838.0,United Kingdom
544911,2023-02-24,85014B,Red Retrospot Umbrella,16.35,3,16838.0,United Kingdom
544911,2023-02-24,85014A,Black/Blue Polkadot Umbrella,16.35,3,16838.0,United Kingdom
544911,2023-02-24,75049L,Large Circular Mirror Mobile,11.53,18,16838.0,United Kingdom
544911,2023-02-24,84949,Silver Hanging T-Light Holder,11.94,12,16838.0,United Kingdom
544912,2023-02-24,22178,Victorian Glass Hanging T-Light,11.34,192,18198.0,United Kingdom
544912,2023-02-24,84755,Colour Glass T-Light Holder Hanging,10.92,16,18198.0,United Kingdom
544912,2023-02-24,22332,Skulls Party Bag + Sticker Set,11.94,8,18198.0,United Kingdom
544912,2023-02-24,21213,Pack Of 72 Skull Cake Cases,10.81,24,18198.0,United Kingdom
544912,2023-02-24,21988,Pack Of 6 Skull Paper Plates,11.12,12,18198.0,United Kingdom
544912,2023-02-24,21989,Pack Of 20 Skull Paper Napkins,11.12,12,18198.0,United Kingdom
544912,2023-02-24,21987,Pack Of 6 Skull Paper Cups,10.92,12,18198.0,United Kingdom
544912,2023-02-24,22437,Set Of 9 Black Skull Balloons,11.12,20,18198.0,United Kingdom
544912,2023-02-24,22087,Paper Bunting White Lace,13.27,6,18198.0,United Kingdom
544913,2023-02-24,22353,Lunch Box With Cutlery Fairy Cakes,12.86,1,15543.0,United Kingdom
544913,2023-02-24,22131,Food Container Set 3 Love Heart,12.25,1,15543.0,United Kingdom
544913,2023-02-24,84997D,Childrens Cutlery Polkadot Pink,14.5,1,15543.0,United Kingdom
544913,2023-02-24,21985,Pack Of 12 Hearts Design Tissues,10.55,12,15543.0,United Kingdom
544913,2023-02-24,22907,Pack Of 20 Napkins Pantry Design,11.12,6,15543.0,United Kingdom
544913,2023-02-24,22851,Set 20 Napkins Fairy Cakes Design,11.12,4,15543.0,United Kingdom
544913,2023-02-24,84520B,Pack 20 English Rose Paper Napkins,11.12,4,15543.0,United Kingdom
544913,2023-02-24,21078,Set/20 Strawberry Paper Napkins,11.12,4,15543.0,United Kingdom
544913,2023-02-24,22906,12 Message Cards With Envelopes,11.94,6,15543.0,United Kingdom
544913,2023-02-24,22907,Pack Of 20 Napkins Pantry Design,11.12,1,15543.0,United Kingdom
544913,2023-02-24,84520B,Pack 20 English Rose Paper Napkins,11.12,1,15543.0,United Kingdom
544913,2023-02-24,22223,Cake Plate Lovebird Pink,15.32,1,15543.0,United Kingdom
544913,2023-02-24,21986,Pack Of 12 Pink Polkadot Tissues,10.55,12,15543.0,United Kingdom
544913,2023-02-24,85049D,Bright Blues Ribbons,11.53,2,15543.0,United Kingdom
544913,2023-02-24,85049C,Romantic Pinks Ribbons,11.53,2,15543.0,United Kingdom
544913,2023-02-24,21445,12 Pink Rose Peg Place Settings,11.53,1,15543.0,United Kingdom
544913,2023-02-24,21974,Set Of 36 Paisley Flower Doilies,11.74,1,15543.0,United Kingdom
544913,2023-02-24,84380,Set Of 3 Butterfly Cookie Cutters,11.53,1,15543.0,United Kingdom
544913,2023-02-24,21122,Set/10 Pink Polkadot Party Candles,11.53,3,15543.0,United Kingdom
544913,2023-02-24,84821,Danish Rose Deluxe Coaster,11.12,2,15543.0,United Kingdom
544913,2023-02-24,84820,Danish Rose Trinket Trays,16.35,1,15543.0,United Kingdom
544913,2023-02-24,84819,Danish Rose Round Sewing Box,14.61,2,15543.0,United Kingdom
544913,2023-02-24,22055,Mini Cake Stand Hanging Strawbery,11.94,2,15543.0,United Kingdom
544913,2023-02-24,37446,Mini Cake Stand With Hanging Cakes,11.74,2,15543.0,United Kingdom
544913,2023-02-24,22699,Roses Regency Teacup And Saucer,13.27,4,15543.0,United Kingdom
544913,2023-02-24,22697,Green Regency Teacup And Saucer,13.27,4,15543.0,United Kingdom
544913,2023-02-24,22698,Pink Regency Teacup And Saucer,13.27,4,15543.0,United Kingdom
544914,2023-02-24,21495,Skulls And Crossbones Wrap,10.68,25,16722.0,United Kingdom
544914,2023-02-24,22437,Set Of 9 Black Skull Balloons,11.12,20,16722.0,United Kingdom
544914,2023-02-24,21930,Jumbo Storage Bag Skulls,12.25,10,16722.0,United Kingdom
544914,2023-02-24,21934,Skull Shoulder Bag,11.94,20,16722.0,United Kingdom
544914,2023-02-24,23230,Wrap Alphabet Design,10.68,25,16722.0,United Kingdom
544914,2023-02-24,22045,Spaceboy Gift Wrap,10.68,25,16722.0,United Kingdom
544914,2023-02-24,22569,Feltcraft Cushion Butterfly,13.72,24,16722.0,United Kingdom
544914,2023-02-24,20727,Lunch Bag Black Skull,5.97,10,16722.0,United Kingdom
544914,2023-02-24,20725,Lunch Bag Red Retrospot,5.97,10,16722.0,United Kingdom
544914,2023-02-24,20726,Lunch Bag Woodland,5.97,10,16722.0,United Kingdom
544914,2023-02-24,22383,Lunch Bag Suki Design,5.97,10,16722.0,United Kingdom
544914,2023-02-24,22382,Lunch Bag Spaceboy Design,5.97,10,16722.0,United Kingdom
544914,2023-02-24,20728,Lunch Bag Cars Blue,5.97,10,16722.0,United Kingdom
544914,2023-02-24,22662,Lunch Bag Dolly Girl Design,5.97,10,16722.0,United Kingdom
544914,2023-02-24,22384,Lunch Bag Pink Polkadot,5.97,10,16722.0,United Kingdom
544915,2023-02-24,21232,Strawberry Ceramic Trinket Pot,11.34,24,13777.0,United Kingdom
544915,2023-02-24,22041,"Record Frame 7"" Single Size",12.4,18,13777.0,United Kingdom
544915,2023-02-24,84050,Pink Heart Shape Egg Frying Pan,11.53,24,13777.0,United Kingdom
544915,2023-02-24,85123A,Cream Hanging Heart T-Light Holder,12.86,12,13777.0,United Kingdom
544915,2023-02-24,20679,Edwardian Parasol Red,14.96,12,13777.0,United Kingdom
544916,2023-02-24,22994,Travel Card Wallet Retrospot,10.68,10,17377.0,United Kingdom
544916,2023-02-24,22998,Travel Card Wallet Keep Calm,10.68,10,17377.0,United Kingdom
544916,2023-02-24,84279B,Cherry Blossom Decorative Flask,14.09,1,17377.0,United Kingdom
544916,2023-02-24,84279B,Cherry Blossom Decorative Flask,14.09,1,17377.0,United Kingdom
544916,2023-02-24,35809A,Enamel Pink Tea Container,12.4,1,17377.0,United Kingdom
544916,2023-02-24,35810A,Enamel Pink Coffee Container,12.4,1,17377.0,United Kingdom
544916,2023-02-24,21755,Love Building Block Word,16.35,2,17377.0,United Kingdom
544916,2023-02-24,21754,Home Building Block Word,16.35,2,17377.0,United Kingdom
544916,2023-02-24,22353,Lunch Box With Cutlery Fairy Cakes,12.86,2,17377.0,United Kingdom
544916,2023-02-24,21559,Strawberry Lunch Box With Cutlery,12.86,2,17377.0,United Kingdom
544916,2023-02-24,22352,Lunch Box With Cutlery Retrospot,12.86,2,17377.0,United Kingdom
544916,2023-02-24,22983,Card Billboard Font,10.68,12,17377.0,United Kingdom
544916,2023-02-24,21507,Elephant Birthday Card,10.68,12,17377.0,United Kingdom
544916,2023-02-24,21509,Cowboys And Indians Birthday Card,10.68,12,17377.0,United Kingdom
544916,2023-02-24,22358,Kings Choice Tea Caddy,13.27,2,17377.0,United Kingdom
544916,2023-02-24,21071,Vintage Billboard Drink Me Mug,11.53,3,17377.0,United Kingdom
544916,2023-02-24,21070,Vintage Billboard Mug,11.53,3,17377.0,United Kingdom
544916,2023-02-24,21622,Vintage Union Jack Cushion Cover,15.32,6,17377.0,United Kingdom
544916,2023-02-24,22900,Set 2 Tea Towels I Love London,13.27,5,17377.0,United Kingdom
544917,2023-02-24,85136A,Yellow Shark Helicopter,18.4,1,13751.0,United Kingdom
544917,2023-02-24,82484,Wood Black Board Ant White Finish,18.4,6,13751.0,United Kingdom
544917,2023-02-24,85053,French Enamel Candleholder,12.4,2,13751.0,United Kingdom
544917,2023-02-24,22173,Metal 4 Hook Hanger French Chateau,13.27,8,13751.0,United Kingdom
544917,2023-02-24,22719,Gumball Monochrome Coat Rack,11.53,2,13751.0,United Kingdom
544917,2023-02-24,22467,Gumball Coat Rack,12.86,2,13751.0,United Kingdom
544917,2023-02-24,22507,Memo Board Retrospot Design,15.32,6,13751.0,United Kingdom
544917,2023-02-24,21498,Red Retrospot Wrap,10.68,25,13751.0,United Kingdom
544917,2023-02-24,85099B,Jumbo Bag Red Retrospot,5.97,100,13751.0,United Kingdom
544918,2023-02-24,22799,Sweetheart Wire Fruit Bowl,18.96,2,13081.0,United Kingdom
544918,2023-02-24,22666,Recipe Box Pantry Yellow Design,13.27,6,13081.0,United Kingdom
544918,2023-02-24,22993,Set Of 4 Pantry Jelly Moulds,11.53,12,13081.0,United Kingdom
544918,2023-02-24,22667,Recipe Box Retrospot,13.27,6,13081.0,United Kingdom
544918,2023-02-24,20679,Edwardian Parasol Red,16.35,3,13081.0,United Kingdom
544918,2023-02-24,21747,Small Skull Windmill,11.53,12,13081.0,United Kingdom
544918,2023-02-24,22859,Easter Tin Bunny Bouquet,11.94,6,13081.0,United Kingdom
544918,2023-02-24,22957,Set 3 Paper Vintage Chick Paper Egg,13.27,6,13081.0,United Kingdom
544918,2023-02-24,22967,Set 3 Song Bird Paper Eggs Assorted,13.27,6,13081.0,United Kingdom
544918,2023-02-24,21061,Party Invites Football,11.12,12,13081.0,United Kingdom
544918,2023-02-24,21244,Blue Polkadot Plate,11.98,8,13081.0,United Kingdom
544918,2023-02-24,21243,Pink Polkadot Plate,11.98,8,13081.0,United Kingdom
544918,2023-02-24,84997B,Childrens Cutlery Retrospot Red,14.5,8,13081.0,United Kingdom
544918,2023-02-24,22352,Lunch Box With Cutlery Retrospot,12.86,12,13081.0,United Kingdom
544918,2023-02-24,21245,Green Polkadot Plate,11.98,8,13081.0,United Kingdom
544918,2023-02-24,22630,Dolly Girl Lunch Box,12.25,12,13081.0,United Kingdom
544918,2023-02-24,22219,Lovebird Hanging Decoration White,11.12,12,13081.0,United Kingdom
544918,2023-02-24,20674,Green Polkadot Bowl,11.53,8,13081.0,United Kingdom
544918,2023-02-24,21240,Blue Polkadot Cup,11.12,8,13081.0,United Kingdom
544918,2023-02-24,21242,Red Retrospot Plate,11.98,16,13081.0,United Kingdom
544918,2023-02-24,21058,Party Invites Woodland,11.12,12,13081.0,United Kingdom
544918,2023-02-24,85014B,Red Retrospot Umbrella,16.35,3,13081.0,United Kingdom
544918,2023-02-24,21675,Butterflies Stickers,11.12,12,13081.0,United Kingdom
544918,2023-02-24,20677,Pink Polkadot Bowl,11.53,16,13081.0,United Kingdom
544918,2023-02-24,22432,Watering Can Pink Bunny,12.25,6,13081.0,United Kingdom
544918,2023-02-24,21866,Union Jack Flag Luggage Tag,11.53,12,13081.0,United Kingdom
544918,2023-02-24,22585,Pack Of 6 Birdy Gift Tags,11.53,12,13081.0,United Kingdom
544918,2023-02-24,21949,Set Of 6 Strawberry Chopsticks,11.53,12,13081.0,United Kingdom
544918,2023-02-24,20675,Blue Polkadot Bowl,11.53,16,13081.0,United Kingdom
544918,2023-02-24,21559,Strawberry Lunch Box With Cutlery,12.86,12,13081.0,United Kingdom
544918,2023-02-24,21060,Party Invites Balloon Girl,11.12,12,13081.0,United Kingdom
544918,2023-02-24,21063,Party Invites Jazz Hearts,11.12,12,13081.0,United Kingdom
544918,2023-02-24,21238,Red Retrospot Cup,11.12,8,13081.0,United Kingdom
544918,2023-02-24,62018,Sombrero,12.25,6,13081.0,United Kingdom
544918,2023-02-24,22332,Skulls Party Bag + Sticker Set,11.94,8,13081.0,United Kingdom
544918,2023-02-24,20676,Red Retrospot Bowl,11.53,16,13081.0,United Kingdom
544918,2023-02-24,21239,Pink Polkadot Cup,11.12,8,13081.0,United Kingdom
544918,2023-02-24,21988,Pack Of 6 Skull Paper Plates,11.12,24,13081.0,United Kingdom
544918,2023-02-24,21989,Pack Of 20 Skull Paper Napkins,11.12,12,13081.0,United Kingdom
544918,2023-02-24,22433,Watering Can Green Dinosaur,12.25,6,13081.0,United Kingdom
544918,2023-02-24,21644,Assorted Tutti Frutti Heart Box,11.53,12,13081.0,United Kingdom
544918,2023-02-24,21086,Set/6 Red Spotty Paper Cups,10.92,24,13081.0,United Kingdom
544918,2023-02-24,21497,Fancy Fonts Birthday Wrap,10.68,25,13081.0,United Kingdom
544918,2023-02-24,22431,Watering Can Blue Elephant,12.25,24,13081.0,United Kingdom
544918,2023-02-24,21094,Set/6 Red Spotty Paper Plates,11.12,24,13081.0,United Kingdom
544918,2023-02-24,71459,Hanging Jam Jar T-Light Holders,11.12,24,13081.0,United Kingdom
544918,2023-02-24,84006,Magic Tree -Paper Flowers,11.12,12,13081.0,United Kingdom
544918,2023-02-24,22029,Spaceboy Birthday Card,10.68,12,13081.0,United Kingdom
544918,2023-02-24,21621,Vintage Union Jack Bunting,18.96,8,13081.0,United Kingdom
544919,2023-02-24,21470,Flower Vine Raffia Food Cover,14.09,6,13725.0,United Kingdom
544919,2023-02-24,21472,Ladybird + Bee Raffia Food Cover,14.09,6,13725.0,United Kingdom
544919,2023-02-24,21171,Bathroom Metal Sign,10.81,12,13725.0,United Kingdom
544919,2023-02-24,82581,Toilet Metal Sign,10.81,12,13725.0,United Kingdom
544919,2023-02-24,82578,Kitchen Metal Sign,10.81,12,13725.0,United Kingdom
544919,2023-02-24,20725,Lunch Bag Red Retrospot,5.97,10,13725.0,United Kingdom
544919,2023-02-24,20726,Lunch Bag Woodland,5.97,10,13725.0,United Kingdom
544919,2023-02-24,20728,Lunch Bag Cars Blue,5.97,10,13725.0,United Kingdom
544919,2023-02-24,22384,Lunch Bag Pink Polkadot,5.97,10,13725.0,United Kingdom
544919,2023-02-24,22382,Lunch Bag Spaceboy Design,5.97,10,13725.0,United Kingdom
544920,2023-02-24,22840,Round Cake Tin Vintage Red,18.4,2,13081.0,United Kingdom
544920,2023-02-24,22842,Biscuit Tin Vintage Red,17.17,2,13081.0,United Kingdom
544920,2023-02-24,22841,Round Cake Tin Vintage Green,18.4,2,13081.0,United Kingdom
544920,2023-02-24,22843,Biscuit Tin Vintage Green,17.17,2,13081.0,United Kingdom
544920,2023-02-24,22897,Oven Mitt Apples Design,11.74,10,13081.0,United Kingdom
544920,2023-02-24,22021,Blue Felt Easter Egg Basket,11.94,24,13081.0,United Kingdom
544920,2023-02-24,85206A,Cream Felt Easter Egg Basket,11.94,24,13081.0,United Kingdom
544920,2023-02-24,22502,Picnic Basket Wicker Small,16.35,8,13081.0,United Kingdom
544920,2023-02-24,84231,Easter Bunny With Basket On Back,10.92,12,13081.0,United Kingdom
544920,2023-02-24,21155,Red Retrospot Peg Bag,12.86,18,13081.0,United Kingdom
544920,2023-02-24,22183,Cake Stand Victorian Filigree Med,17.17,3,13081.0,United Kingdom
544920,2023-02-24,22699,Roses Regency Teacup And Saucer,13.27,12,13081.0,United Kingdom
544920,2023-02-24,22698,Pink Regency Teacup And Saucer,13.27,12,13081.0,United Kingdom
544920,2023-02-24,22697,Green Regency Teacup And Saucer,13.27,6,13081.0,United Kingdom
544920,2023-02-24,22960,Jam Making Set With Jars,14.61,6,13081.0,United Kingdom
544920,2023-02-24,47566B,Tea Time Party Bunting,15.32,12,13081.0,United Kingdom
544920,2023-02-24,22907,Pack Of 20 Napkins Pantry Design,11.12,24,13081.0,United Kingdom
544920,2023-02-24,22990,Cotton Apron Pantry Design,15.32,6,13081.0,United Kingdom
544920,2023-02-24,22966,Gingerbread Man Cookie Cutter,11.53,12,13081.0,United Kingdom
544920,2023-02-24,22939,Adult Apron Apple Delight,15.32,4,13081.0,United Kingdom
544921,2023-02-24,22636,Childs Breakfast Set Circus Parade,18.09,12,17090.0,United Kingdom
544921,2023-02-24,22440,Balloon Water Bomb Pack Of 35,10.68,40,17090.0,United Kingdom
544921,2023-02-24,21891,Traditional Wooden Skipping Rope,11.53,24,17090.0,United Kingdom
544921,2023-02-24,21912,Vintage Snakes & Ladders,14.09,24,17090.0,United Kingdom
544921,2023-02-24,21892,Traditional Wooden Catch Cup Game,11.53,24,17090.0,United Kingdom
544921,2023-02-24,22548,Heads And Tails Sporting Fun,11.53,12,17090.0,United Kingdom
544921,2023-02-24,21381,Mini Wooden Happy Birthday Garland,11.98,12,17090.0,United Kingdom
544921,2023-02-24,22438,Balloon Art Make Your Own Flowers,12.25,20,17090.0,United Kingdom
544921,2023-02-24,85172,Hyacinth Bulb T-Light Candles,10.68,16,17090.0,United Kingdom
544921,2023-02-24,22302,Coffee Mug Pears Design,12.86,12,17090.0,United Kingdom
544921,2023-02-24,22303,Coffee Mug Apples Design,12.86,12,17090.0,United Kingdom
544922,2023-02-24,22356,Charlotte Bag Pink Polkadot,11.12,10,15847.0,United Kingdom
544922,2023-02-24,22355,Charlotte Bag Suki Design,11.12,10,15847.0,United Kingdom
544922,2023-02-24,22113,Grey Heart Hot Water Bottle,14.09,4,15847.0,United Kingdom
544922,2023-02-24,22111,Scottie Dog Hot Water Bottle,15.32,3,15847.0,United Kingdom
544922,2023-02-24,22258,Felt Farm Animal Rabbit,11.53,12,15847.0,United Kingdom
544922,2023-02-24,84568,Girls Alphabet Iron On Patches,10.47,288,15847.0,United Kingdom
544922,2023-02-24,21106,Cream Slice Flannel Chocolate Spot,13.27,6,15847.0,United Kingdom
544922,2023-02-24,21107,Cream Slice Flannel Pink Spot,13.27,6,15847.0,United Kingdom
544922,2023-02-24,21108,Fairy Cake Flannel Assorted Colour,12.86,9,15847.0,United Kingdom
544923,2023-02-24,22502,Picnic Basket Wicker Small,15.32,16,12877.0,United Kingdom
544924,2023-02-24,21378,Small Tall Camphor Wood Toadstool,11.94,6,13851.0,United Kingdom
544924,2023-02-24,21379,Camphor Wood Portobello Mushroom,11.53,6,13851.0,United Kingdom
544924,2023-02-24,21714,Citronella Candle Garden Pot,11.53,12,13851.0,United Kingdom
544924,2023-02-24,82482,Wooden Picture Frame White Finish,12.86,6,13851.0,United Kingdom
544924,2023-02-24,22766,Photo Frame Cornice,13.27,8,13851.0,United Kingdom
544924,2023-02-24,21983,Pack Of 12 Blue Paisley Tissues,10.55,24,13851.0,United Kingdom
544924,2023-02-24,21980,Pack Of 12 Red Retrospot Tissues,10.55,24,13851.0,United Kingdom
544924,2023-02-24,22441,Grow Your Own Basil In Enamel Mug,12.4,8,13851.0,United Kingdom
544924,2023-02-24,22652,Travel Sewing Kit,11.94,10,13851.0,United Kingdom
544924,2023-02-24,20972,Pink Cream Felt Craft Trinket Box,11.53,12,13851.0,United Kingdom
544924,2023-02-24,22149,Feltcraft 6 Flower Friends,12.4,6,13851.0,United Kingdom
544924,2023-02-24,22271,Feltcraft Doll Rosie,13.27,6,13851.0,United Kingdom
544924,2023-02-24,22568,Feltcraft Cushion Owl,14.09,4,13851.0,United Kingdom
544924,2023-02-24,22273,Feltcraft Doll Molly,13.27,6,13851.0,United Kingdom
544924,2023-02-24,22570,Feltcraft Cushion Rabbit,14.09,4,13851.0,United Kingdom
544924,2023-02-24,22749,Feltcraft Princess Charlotte Doll,14.09,4,13851.0,United Kingdom
544924,2023-02-24,47566,Party Bunting,15.32,4,13851.0,United Kingdom
544925,2023-02-24,85099B,Jumbo Bag Red Retrospot,6.13,20,16997.0,United Kingdom
544925,2023-02-24,21928,Jumbo Bag Scandinavian Blue Paisley,6.13,40,16997.0,United Kingdom
