TransactionNo,Date,ProductNo,ProductName,Price,Quantity,CustomerNo,Country
546980,2023-03-18,15044A,Pink Paper Parasol,13.27,6,13591.0,United Kingdom
546980,2023-03-18,22064,Pink Doughnut Trinket Pot,11.94,12,13591.0,United Kingdom
546980,2023-03-18,22071,Small White Retrospot Mug In Box,14.09,6,13591.0,United Kingdom
546980,2023-03-18,22072,Red Retrospot Tea Cup And Saucer,14.09,4,13591.0,United Kingdom
546980,2023-03-18,22507,Memo Board Retrospot Design,15.32,4,13591.0,United Kingdom
546980,2023-03-18,22960,Jam Making Set With Jars,14.61,6,13591.0,United Kingdom
546980,2023-03-18,22961,Jam Making Set Printed,11.74,12,13591.0,United Kingdom
546980,2023-03-18,21928,Jumbo Bag Scandinavian Blue Paisley,6.13,10,13591.0,United Kingdom
546980,2023-03-18,85099B,Jumbo Bag Red Retrospot,6.13,10,13591.0,United Kingdom
546981,2023-03-18,21547,Ceramic Birdhouse Crested Tit Small,13.27,6,14066.0,United Kingdom
546981,2023-03-18,22822,Cream Wall Planter Heart Shaped,16.35,6,14066.0,United Kingdom
546981,2023-03-18,21877,Home Sweet Home Mug,11.53,12,14066.0,United Kingdom
546981,2023-03-18,22303,Coffee Mug Apples Design,12.86,6,14066.0,United Kingdom
546981,2023-03-18,22971,Queens Guard Coffee Mug,12.86,6,14066.0,United Kingdom
546981,2023-03-18,22970,London Bus Coffee Mug,12.86,6,14066.0,United Kingdom
546982,2023-03-18,85014B,Red Retrospot Umbrella,16.35,1,15483.0,United Kingdom
546982,2023-03-18,22999,Travel Card Wallet Vintage Leaf,10.68,1,15483.0,United Kingdom
546982,2023-03-18,22181,Snowstorm Photo Frame Fridge Magnet,11.12,12,15483.0,United Kingdom
546982,2023-03-18,23004,Travel Card Wallet Pantry,10.68,1,15483.0,United Kingdom
546982,2023-03-18,23000,Travel Card Wallet Transport,10.68,2,15483.0,United Kingdom
546982,2023-03-18,85185B,Pink Horse Sock Puppet Kit,13.27,2,15483.0,United Kingdom
546982,2023-03-18,23002,Travel Card Wallet Skulls,10.68,1,15483.0,United Kingdom
546982,2023-03-18,22243,5 Hook Hanger Red Magic Toadstool,11.94,1,15483.0,United Kingdom
546982,2023-03-18,22977,Dolly Girl Childrens Egg Cup,11.53,1,15483.0,United Kingdom
546982,2023-03-18,22976,Circus Parade Childrens Egg Cup,11.53,2,15483.0,United Kingdom
546982,2023-03-18,22975,Spaceboy Childrens Egg Cup,11.53,1,15483.0,United Kingdom
546982,2023-03-18,22445,Pencil Case Life Is Beautiful,13.27,1,15483.0,United Kingdom
546982,2023-03-18,22449,Silk Purse Babushka Pink,13.68,1,15483.0,United Kingdom
546982,2023-03-18,15034,Paper Pocket Traveling Fan,10.39,48,15483.0,United Kingdom
546982,2023-03-18,22659,Lunch Box I Love London,12.25,1,15483.0,United Kingdom
546982,2023-03-18,84559B,3d Sheet Of Cat Stickers,11.12,1,15483.0,United Kingdom
546982,2023-03-18,22659,Lunch Box I Love London,12.25,1,15483.0,United Kingdom
546982,2023-03-18,22970,London Bus Coffee Mug,12.86,1,15483.0,United Kingdom
546982,2023-03-18,22971,Queens Guard Coffee Mug,12.86,2,15483.0,United Kingdom
546982,2023-03-18,22993,Set Of 4 Pantry Jelly Moulds,11.53,2,15483.0,United Kingdom
546982,2023-03-18,22555,Plasters In Tin Strongman,11.94,1,15483.0,United Kingdom
546982,2023-03-18,22718,Card Cat And Tree,10.68,12,15483.0,United Kingdom
546982,2023-03-18,22556,Plasters In Tin Circus Parade,11.94,1,15483.0,United Kingdom
546982,2023-03-18,84596L,Biscuits Small Bowl Light Blue,10.68,1,15483.0,United Kingdom
546982,2023-03-18,84596J,Mixed Nuts Light Green Bowl,10.68,1,15483.0,United Kingdom
546982,2023-03-18,84596B,Small Dolly Mix Design Orange Bowl,10.68,1,15483.0,United Kingdom
546982,2023-03-18,84596E,Small Licorice Des Pink Bowl,10.68,1,15483.0,United Kingdom
546982,2023-03-18,84596F,Small Marshmallows Pink Bowl,10.68,1,15483.0,United Kingdom
546982,2023-03-18,84596G,Small Chocolates Pink Bowl,10.68,1,15483.0,United Kingdom
546982,2023-03-18,22659,Lunch Box I Love London,12.25,1,15483.0,United Kingdom
546982,2023-03-18,22900,Set 2 Tea Towels I Love London,13.27,1,15483.0,United Kingdom
546982,2023-03-18,22244,3 Hook Hanger Magic Garden,12.25,1,15483.0,United Kingdom
546982,2023-03-18,20828,Glitter Butterfly Clips,12.86,1,15483.0,United Kingdom
546982,2023-03-18,22219,Lovebird Hanging Decoration White,11.12,2,15483.0,United Kingdom
546982,2023-03-18,17107D,Flower Fairy 5 Drawer Liners,12.86,1,15483.0,United Kingdom
546982,2023-03-18,85199S,Small Hanging Ivory/Red Wood Bird,10.68,1,15483.0,United Kingdom
546982,2023-03-18,22265,Easter Decoration Natural Chick,10.92,2,15483.0,United Kingdom
546982,2023-03-18,22421,Lipstick Pen Fuschia,10.68,1,15483.0,United Kingdom
546982,2023-03-18,22419,Lipstick Pen Red,10.68,3,15483.0,United Kingdom
546982,2023-03-18,22227,Hanging Heart Mirror Decoration,10.92,3,15483.0,United Kingdom
546982,2023-03-18,72351A,Set/6 Turquoise Butterfly T-Lights,12.4,1,15483.0,United Kingdom
546982,2023-03-18,84744,S/6 Sew On Crochet Flowers,11.53,1,15483.0,United Kingdom
546982,2023-03-18,23003,Travel Card Wallet Vintage Rose,10.68,1,15483.0,United Kingdom
546982,2023-03-18,23006,Travel Card Wallet Flower Meadow,10.68,2,15483.0,United Kingdom
546982,2023-03-18,23003,Travel Card Wallet Vintage Rose,10.68,2,15483.0,United Kingdom
546982,2023-03-18,22999,Travel Card Wallet Vintage Leaf,10.68,2,15483.0,United Kingdom
546982,2023-03-18,23004,Travel Card Wallet Pantry,10.68,2,15483.0,United Kingdom
546982,2023-03-18,85040B,Set/4 Blue Flower Candles In Bowl,11.94,1,15483.0,United Kingdom
546982,2023-03-18,85170D,Set/6 Pink Bird T-Light Candles,12.4,1,15483.0,United Kingdom
546982,2023-03-18,85169A,Ivory Love Bird Candle,11.53,6,15483.0,United Kingdom
546982,2023-03-18,85039B,S/4 Ivory Mini Rose Candle In Bowl,11.94,1,15483.0,United Kingdom
546982,2023-03-18,85038,6 Chocolate Love Heart T-Lights,12.4,1,15483.0,United Kingdom
546982,2023-03-18,85040A,S/4 Pink Flower Candles In Bowl,11.94,2,15483.0,United Kingdom
546982,2023-03-18,22421,Lipstick Pen Fuschia,10.68,2,15483.0,United Kingdom
546983,2023-03-18,22178,Victorian Glass Hanging T-Light,11.53,12,16626.0,United Kingdom
546983,2023-03-18,84755,Colour Glass T-Light Holder Hanging,10.92,16,16626.0,United Kingdom
546983,2023-03-18,84970L,Single Heart Zinc T-Light Holder,11.22,12,16626.0,United Kingdom
546983,2023-03-18,84978,Hanging Heart Jar T-Light Holder,11.53,12,16626.0,United Kingdom
546983,2023-03-18,71459,Hanging Jam Jar T-Light Holders,11.12,12,16626.0,United Kingdom
546983,2023-03-18,84945,Multi Colour Silver T-Light Holder,11.12,12,16626.0,United Kingdom
546983,2023-03-18,18097C,White Tall Porcelain T-Light Holder,12.86,6,16626.0,United Kingdom
546983,2023-03-18,21326,Aged Glass Silver T-Light Holder,10.92,12,16626.0,United Kingdom
546983,2023-03-18,21695,Small Silver Flower Candle Pot,13.27,6,16626.0,United Kingdom
546983,2023-03-18,21688,Silver Plate Candle Bowl Small,13.27,6,16626.0,United Kingdom
546983,2023-03-18,21693,Small Hammered Silver Candlepot,13.27,6,16626.0,United Kingdom
546983,2023-03-18,22138,Baking Set 9 Piece Retrospot,15.32,3,16626.0,United Kingdom
546983,2023-03-18,22617,Baking Set Spaceboy Design,15.32,3,16626.0,United Kingdom
546983,2023-03-18,22556,Plasters In Tin Circus Parade,11.94,12,16626.0,United Kingdom
546983,2023-03-18,84763,Zinc Finish 15cm Planter Pots,11.53,12,16626.0,United Kingdom
546983,2023-03-18,22525,Childrens Garden Gloves Pink,11.53,10,16626.0,United Kingdom
546983,2023-03-18,22524,Childrens Garden Gloves Blue,11.53,10,16626.0,United Kingdom
546983,2023-03-18,22521,Childs Garden Trowel Pink,11.12,12,16626.0,United Kingdom
546983,2023-03-18,22520,Childs Garden Trowel Blue,11.12,12,16626.0,United Kingdom
546983,2023-03-18,20685,Doormat Red Retrospot,18.4,2,16626.0,United Kingdom
546983,2023-03-18,21523,Doormat Fancy Font Home Sweet Home,18.4,2,16626.0,United Kingdom
546983,2023-03-18,22960,Jam Making Set With Jars,14.61,6,16626.0,United Kingdom
546983,2023-03-18,22457,Natural Slate Heart Chalkboard,13.27,6,16626.0,United Kingdom
546983,2023-03-18,21669,Blue Stripe Ceramic Drawer Knob,11.53,12,16626.0,United Kingdom
546983,2023-03-18,21673,White Spot Blue Ceramic Drawer Knob,11.53,12,16626.0,United Kingdom
546983,2023-03-18,20794,Blue Tile Hook,12.86,8,16626.0,United Kingdom
546983,2023-03-18,84792,Enchanted Bird Coathanger 5 Hook,15.02,4,16626.0,United Kingdom
546983,2023-03-18,84971S,Small Heart Flowers Hook,11.12,24,16626.0,United Kingdom
546983,2023-03-18,22989,Set 2 Pantry Design Tea Towels,13.58,6,16626.0,United Kingdom
546983,2023-03-18,22844,Vintage Cream Dog Food Container,18.96,2,16626.0,United Kingdom
546983,2023-03-18,22845,Vintage Cream Cat Food Container,16.76,2,16626.0,United Kingdom
546983,2023-03-18,21682,Large Medina Stamped Metal Bowl,15.32,4,16626.0,United Kingdom
546983,2023-03-18,21260,First Aid Tin,13.58,6,16626.0,United Kingdom
546983,2023-03-18,21756,Bath Building Block Word,16.35,3,16626.0,United Kingdom
546983,2023-03-18,21755,Love Building Block Word,16.35,3,16626.0,United Kingdom
546983,2023-03-18,22855,Fine Wicker Heart,11.53,12,16626.0,United Kingdom
546983,2023-03-18,22694,Wicker Star,12.4,6,16626.0,United Kingdom
546983,2023-03-18,21172,Party Metal Sign,11.74,12,16626.0,United Kingdom
546983,2023-03-18,21658,Glass Beurre Dish,14.3,4,16626.0,United Kingdom
546983,2023-03-18,21417,Cockle Shell Dish,12.4,6,16626.0,United Kingdom
546983,2023-03-18,22464,Hanging Metal Heart Lantern,11.94,12,16626.0,United Kingdom
546983,2023-03-18,22465,Hanging Metal Star Lantern,11.94,12,16626.0,United Kingdom
546984,2023-03-18,22595,Gingham Heart Decoration,11.12,1,15019.0,United Kingdom
546984,2023-03-18,22138,Baking Set 9 Piece Retrospot,15.32,1,15019.0,United Kingdom
546984,2023-03-18,22577,Wooden Heart Christmas Scandinavian,11.12,4,15019.0,United Kingdom
546984,2023-03-18,22419,Lipstick Pen Red,10.68,1,15019.0,United Kingdom
546984,2023-03-18,22865,Hand Warmer Owl Design,12.4,2,15019.0,United Kingdom
546984,2023-03-18,85130A,Beaded Pearl Heart White Large,11.94,1,15019.0,United Kingdom
546984,2023-03-18,37482P,Cubic Mug Pink Polkadot,10.65,6,15019.0,United Kingdom
546984,2023-03-18,20867,Pink Rose Fabric Mirror,11.53,1,15019.0,United Kingdom
546984,2023-03-18,22107,Pizza Plate In Box,14.09,1,15019.0,United Kingdom
546984,2023-03-18,20754,Retrospot Red Washing Up Gloves,12.4,1,15019.0,United Kingdom
546984,2023-03-18,22900,Set 2 Tea Towels I Love London,13.27,1,15019.0,United Kingdom
546984,2023-03-18,20971,Pink Blue Felt Craft Trinket Box,11.53,1,15019.0,United Kingdom
546984,2023-03-18,20972,Pink Cream Felt Craft Trinket Box,11.53,1,15019.0,United Kingdom
546984,2023-03-18,22421,Lipstick Pen Fuschia,10.68,1,15019.0,United Kingdom
546984,2023-03-18,84380,Set Of 3 Butterfly Cookie Cutters,11.53,1,15019.0,United Kingdom
546984,2023-03-18,84378,Set Of 3 Heart Cookie Cutters,11.53,1,15019.0,United Kingdom
546984,2023-03-18,21065,Boom Box Speaker Girls,16.35,1,15019.0,United Kingdom
546984,2023-03-18,22555,Plasters In Tin Strongman,11.94,1,15019.0,United Kingdom
546984,2023-03-18,20977,36 Pencils Tube Woodland,11.53,1,15019.0,United Kingdom
546984,2023-03-18,22483,Red Gingham Teddy Bear,13.27,1,15019.0,United Kingdom
546984,2023-03-18,20975,12 Pencils Small Tube Red Retrospot,10.92,5,15019.0,United Kingdom
546984,2023-03-18,37482P,Cubic Mug Pink Polkadot,10.65,6,15019.0,United Kingdom
546984,2023-03-18,85106,Cut Glass Hexagon T-Light Holder,12.86,4,15019.0,United Kingdom
546984,2023-03-18,20652,Blue Polkadot Luggage Tag,11.53,3,15019.0,United Kingdom
546984,2023-03-18,20658,Red Retrospot Luggage Tag,11.53,2,15019.0,United Kingdom
546984,2023-03-18,22083,Paper Chain Kit Retrospot,13.27,1,15019.0,United Kingdom
546984,2023-03-18,22834,Hand Warmer Babushka Design,12.4,2,15019.0,United Kingdom
546984,2023-03-18,84509C,Set Of 4 Polkadot Placemats,14.09,2,15019.0,United Kingdom
546984,2023-03-18,84692,Box Of 24 Cocktail Parasols,10.68,1,15019.0,United Kingdom
546984,2023-03-18,85049E,Scandinavian Reds Ribbons,11.53,1,15019.0,United Kingdom
546984,2023-03-18,85049H,Urban Black Ribbons,11.53,1,15019.0,United Kingdom
546984,2023-03-18,85049D,Bright Blues Ribbons,11.53,2,15019.0,United Kingdom
546984,2023-03-18,85049C,Romantic Pinks Ribbons,11.53,1,15019.0,United Kingdom
546984,2023-03-18,22582,Pack Of 6 Sweetie Gift Boxes,12.86,2,15019.0,United Kingdom
546984,2023-03-18,22584,Pack Of 6 Panettone Gift Boxes,12.86,2,15019.0,United Kingdom
546984,2023-03-18,18098C,Porcelain Butterfly Oil Burner,13.27,1,15019.0,United Kingdom
546984,2023-03-18,22558,Clothes Pegs Retrospot Pack 24,11.78,1,15019.0,United Kingdom
546984,2023-03-18,84510C,Set Of 4 Polkadot Coasters,11.53,2,15019.0,United Kingdom
546984,2023-03-18,22639,Set Of 4 Napkin Charms Hearts,12.86,2,15019.0,United Kingdom
546984,2023-03-18,21121,Set/10 Red Polkadot Party Candles,11.53,5,15019.0,United Kingdom
546984,2023-03-18,22087,Paper Bunting White Lace,13.27,1,15019.0,United Kingdom
546984,2023-03-18,77101A,Union Flag Windsock,11.53,2,15019.0,United Kingdom
546984,2023-03-18,21155,Red Retrospot Peg Bag,12.86,1,15019.0,United Kingdom
546984,2023-03-18,20752,Blue Polkadot Washing Up Gloves,12.4,1,15019.0,United Kingdom
546984,2023-03-18,22616,Pack Of 12 London Tissues,10.55,12,15019.0,United Kingdom
546984,2023-03-18,21399,Blue Polkadot Coffee Mug,10.65,2,15019.0,United Kingdom
546984,2023-03-18,21398,Red Polkadot Coffee Mug,10.65,4,15019.0,United Kingdom
546984,2023-03-18,22273,Feltcraft Doll Molly,13.27,1,15019.0,United Kingdom
546984,2023-03-18,22197,Popcorn Holder,11.12,3,15019.0,United Kingdom
546984,2023-03-18,22483,Red Gingham Teddy Bear,13.27,1,15019.0,United Kingdom
546984,2023-03-18,22626,Black Kitchen Scales,18.96,2,15019.0,United Kingdom
546984,2023-03-18,51020A,Summer Fun Design Shower Cap,10.55,10,15019.0,United Kingdom
546984,2023-03-18,84803B,White Allium Artificial Flower,11.98,5,15019.0,United Kingdom
546984,2023-03-18,22087,Paper Bunting White Lace,13.27,1,15019.0,United Kingdom
546984,2023-03-18,22953,Birthday Party Cordon Barrier Tape,11.53,2,15019.0,United Kingdom
546984,2023-03-18,22138,Baking Set 9 Piece Retrospot,15.32,1,15019.0,United Kingdom
546984,2023-03-18,22900,Set 2 Tea Towels I Love London,13.27,2,15019.0,United Kingdom
546984,2023-03-18,21064,Boom Box Speaker Boys,16.35,3,15019.0,United Kingdom
546984,2023-03-18,21065,Boom Box Speaker Girls,16.35,2,15019.0,United Kingdom
546984,2023-03-18,22319,Hairclips Forties Fabric Assorted,10.92,12,15019.0,United Kingdom
546984,2023-03-18,22748,Poppy's Playhouse Kitchen,12.4,1,15019.0,United Kingdom
546984,2023-03-18,22747,Poppy's Playhouse Bathroom,12.4,1,15019.0,United Kingdom
546984,2023-03-18,22272,Feltcraft Doll Maria,13.27,1,15019.0,United Kingdom
546984,2023-03-18,22940,Feltcraft Christmas Fairy,14.61,1,15019.0,United Kingdom
546984,2023-03-18,22411,Jumbo Shopper Vintage Red Paisley,12.25,4,15019.0,United Kingdom
546984,2023-03-18,21931,Jumbo Storage Bag Suki,12.25,2,15019.0,United Kingdom
546984,2023-03-18,22385,Jumbo Bag Spaceboy Design,6.13,2,15019.0,United Kingdom
546984,2023-03-18,21928,Jumbo Bag Scandinavian Blue Paisley,6.13,2,15019.0,United Kingdom
546984,2023-03-18,20725,Lunch Bag Red Retrospot,5.97,1,15019.0,United Kingdom
546985,2023-03-18,22980,Pantry Scrubbing Brush,11.94,12,18270.0,United Kingdom
546985,2023-03-18,84978,Hanging Heart Jar T-Light Holder,11.53,12,18270.0,United Kingdom
546985,2023-03-18,21316,Small Chunky Glass Roman Bowl,13.27,8,18270.0,United Kingdom
546985,2023-03-18,21320,Glass Chalice Green Large,12.86,6,18270.0,United Kingdom
546986,2023-03-18,21181,Please One Person Metal Sign,12.4,12,14194.0,United Kingdom
546986,2023-03-18,85123A,Cream Hanging Heart T-Light Holder,13.27,6,14194.0,United Kingdom
546986,2023-03-18,22139,Retrospot Tea Set Ceramic 11 Pc,15.32,3,14194.0,United Kingdom
546986,2023-03-18,22779,Wooden Owls Light Garland,14.61,4,14194.0,United Kingdom
546986,2023-03-18,21844,Red Retrospot Mug,13.27,6,14194.0,United Kingdom
546986,2023-03-18,22780,Light Garland Butterfiles Pink,14.61,4,14194.0,United Kingdom
546986,2023-03-18,21284,Retrospot Candle Small,11.98,12,14194.0,United Kingdom
546986,2023-03-18,21066,Vintage Red Mug,11.53,12,14194.0,United Kingdom
546986,2023-03-18,21259,Victorian Sewing Box Small,16.35,2,14194.0,United Kingdom
546986,2023-03-18,21175,Gin And Tonic Diet Metal Sign,12.86,12,14194.0,United Kingdom
546986,2023-03-18,82484,Wood Black Board Ant White Finish,18.35,2,14194.0,United Kingdom
546986,2023-03-18,21866,Union Jack Flag Luggage Tag,11.53,24,14194.0,United Kingdom
546986,2023-03-18,22561,Wooden School Colouring Set,11.94,12,14194.0,United Kingdom
546986,2023-03-18,21731,Red Toadstool Led Night Light,11.94,12,14194.0,United Kingdom
546986,2023-03-18,84991,60 Teatime Fairy Cake Cases,10.81,24,14194.0,United Kingdom
546986,2023-03-18,85150,Ladies & Gentlemen Metal Sign,12.86,6,14194.0,United Kingdom
546986,2023-03-18,21930,Jumbo Storage Bag Skulls,12.25,10,14194.0,United Kingdom
546986,2023-03-18,84946,Antique Silver T-Light Glass,11.53,12,14194.0,United Kingdom
546986,2023-03-18,21915,Red Harmonica In Box,11.53,12,14194.0,United Kingdom
546986,2023-03-18,84375,Set Of 20 Kids Cookie Cutters,12.4,12,14194.0,United Kingdom
546986,2023-03-18,21975,Pack Of 60 Dinosaur Cake Cases,10.81,24,14194.0,United Kingdom
546986,2023-03-18,84992,72 Sweetheart Fairy Cake Cases,10.81,24,14194.0,United Kingdom
546986,2023-03-18,84978,Hanging Heart Jar T-Light Holder,11.53,12,14194.0,United Kingdom
546986,2023-03-18,22457,Natural Slate Heart Chalkboard,13.27,6,14194.0,United Kingdom
546986,2023-03-18,47566,Party Bunting,15.32,4,14194.0,United Kingdom
546986,2023-03-18,21232,Strawberry Ceramic Trinket Pot,11.53,12,14194.0,United Kingdom
546986,2023-03-18,22178,Victorian Glass Hanging T-Light,11.53,12,14194.0,United Kingdom
546986,2023-03-18,21314,Small Glass Heart Trinket Pot,12.4,8,14194.0,United Kingdom
546986,2023-03-18,21985,Pack Of 12 Hearts Design Tissues,10.55,24,14194.0,United Kingdom
546986,2023-03-18,22721,Set Of 3 Cake Tins Sketchbook,15.32,3,14194.0,United Kingdom
546986,2023-03-18,22980,Pantry Scrubbing Brush,11.94,12,14194.0,United Kingdom
546986,2023-03-18,22996,Travel Card Wallet Vintage Ticket,10.68,24,14194.0,United Kingdom
546986,2023-03-18,22998,Travel Card Wallet Keep Calm,10.68,24,14194.0,United Kingdom
546986,2023-03-18,23182,Toilet Sign Occupied Or Vacant,11.1,24,14194.0,United Kingdom
546986,2023-03-18,23181,Bull Dog Bottle Top Wall Clock,18.71,2,14194.0,United Kingdom
546986,2023-03-18,23194,Gymkhana Treasure Book Box,12.56,8,14194.0,United Kingdom
546986,2023-03-18,23127,Feltcraft Girl Nicole Kit,15.32,4,14194.0,United Kingdom
546986,2023-03-18,23193,Buffalo Bill Treasure Book Box,12.56,8,14194.0,United Kingdom
546986,2023-03-18,85186A,Easter Bunny Garland Of Flowers,10.68,24,14194.0,United Kingdom
546986,2023-03-18,85194L,Hanging Spring Flower Egg Large,11.12,12,14194.0,United Kingdom
546986,2023-03-18,85194S,Hanging Spring Flower Egg Small,10.92,24,14194.0,United Kingdom
546986,2023-03-18,21928,Jumbo Bag Scandinavian Blue Paisley,6.13,10,14194.0,United Kingdom
546986,2023-03-18,85099C,Jumbo Bag Baroque Black White,6.13,10,14194.0,United Kingdom
546986,2023-03-18,85099F,Jumbo Bag Strawberry,6.13,10,14194.0,United Kingdom
546986,2023-03-18,20713,Jumbo Bag Owls,6.13,10,14194.0,United Kingdom
546988,2023-03-18,22961,Jam Making Set Printed,11.74,12,14194.0,United Kingdom
546988,2023-03-18,22966,Gingerbread Man Cookie Cutter,11.53,12,14194.0,United Kingdom
546988,2023-03-18,22960,Jam Making Set With Jars,14.61,6,14194.0,United Kingdom
546988,2023-03-18,22962,Jam Jar With Pink Lid,11.12,12,14194.0,United Kingdom
546988,2023-03-18,22963,Jam Jar With Green Lid,11.12,12,14194.0,United Kingdom
546988,2023-03-18,84380,Set Of 3 Butterfly Cookie Cutters,11.53,12,14194.0,United Kingdom
546988,2023-03-18,84378,Set Of 3 Heart Cookie Cutters,11.53,12,14194.0,United Kingdom
546988,2023-03-18,22722,Set Of 6 Spice Tins Pantry Design,14.3,4,14194.0,United Kingdom
546988,2023-03-18,22666,Recipe Box Pantry Yellow Design,13.27,6,14194.0,United Kingdom
546988,2023-03-18,47566,Party Bunting,15.32,4,14194.0,United Kingdom
546988,2023-03-18,22843,Biscuit Tin Vintage Green,17.17,2,14194.0,United Kingdom
546988,2023-03-18,22842,Biscuit Tin Vintage Red,17.17,2,14194.0,United Kingdom
546988,2023-03-18,22726,Alarm Clock Bakelike Green,14.09,4,14194.0,United Kingdom
546988,2023-03-18,22727,Alarm Clock Bakelike Red,14.09,4,14194.0,United Kingdom
546988,2023-03-18,22192,Blue Diner Wall Clock,18.96,2,14194.0,United Kingdom
546988,2023-03-18,84879,Assorted Colour Bird Ornament,11.98,8,14194.0,United Kingdom
546988,2023-03-18,23052,Recycled Acapulco Mat Turquoise,18.71,2,14194.0,United Kingdom
546988,2023-03-18,23049,Recycled Acapulco Mat Red,18.71,2,14194.0,United Kingdom
546990,2023-03-18,48173C,Doormat Black Flock,18.4,2,14315.0,United Kingdom
546990,2023-03-18,22604,Set Of 4 Napkin Charms Cutlery,12.86,6,14315.0,United Kingdom
546990,2023-03-18,22639,Set Of 4 Napkin Charms Hearts,12.86,6,14315.0,United Kingdom
546990,2023-03-18,22107,Pizza Plate In Box,14.09,4,14315.0,United Kingdom
546990,2023-03-18,22109,Full English Breakfast Plate,14.09,4,14315.0,United Kingdom
546990,2023-03-18,22300,Coffee Mug Dog + Ball Design,12.86,12,14315.0,United Kingdom
546990,2023-03-18,22301,Coffee Mug Cat + Bird Design,12.86,12,14315.0,United Kingdom
546990,2023-03-18,22302,Coffee Mug Pears Design,12.86,12,14315.0,United Kingdom
546990,2023-03-18,22303,Coffee Mug Apples Design,12.86,12,14315.0,United Kingdom
546990,2023-03-18,20914,Set/5 Red Retrospot Lid Glass Bowls,13.27,6,14315.0,United Kingdom
546990,2023-03-18,21576,Lets Go Shopping Cotton Tote Bag,12.56,6,14315.0,United Kingdom
546990,2023-03-18,22595,Gingham Heart Decoration,11.12,12,14315.0,United Kingdom
546990,2023-03-18,84970L,Single Heart Zinc T-Light Holder,11.22,12,14315.0,United Kingdom
546990,2023-03-18,21122,Set/10 Pink Polkadot Party Candles,11.53,24,14315.0,United Kingdom
546990,2023-03-18,21124,Set/10 Blue Polkadot Party Candles,11.53,24,14315.0,United Kingdom
546990,2023-03-18,22646,Ceramic Strawberry Cake Money Bank,11.74,12,14315.0,United Kingdom
546990,2023-03-18,22071,Small White Retrospot Mug In Box,14.09,6,14315.0,United Kingdom
546990,2023-03-18,48129,Doormat Topiary,18.4,2,14315.0,United Kingdom
546990,2023-03-18,48194,Doormat Hearts,18.4,2,14315.0,United Kingdom
546990,2023-03-18,22385,Jumbo Bag Spaceboy Design,6.13,10,14315.0,United Kingdom
546990,2023-03-18,22386,Jumbo Bag Pink Polkadot,6.13,10,14315.0,United Kingdom
546990,2023-03-18,20711,Jumbo Bag Toys,6.13,10,14315.0,United Kingdom
546990,2023-03-18,20712,Jumbo Bag Woodland Animals,6.13,10,14315.0,United Kingdom
546990,2023-03-18,85099C,Jumbo Bag Baroque Black White,6.13,10,14315.0,United Kingdom
546990,2023-03-18,22382,Lunch Bag Spaceboy Design,5.97,10,14315.0,United Kingdom
546990,2023-03-18,20726,Lunch Bag Woodland,5.97,10,14315.0,United Kingdom
546990,2023-03-18,22384,Lunch Bag Pink Polkadot,5.97,10,14315.0,United Kingdom
546991,2023-03-18,22711,Wrap Circus Parade,10.68,25,12748.0,United Kingdom
546991,2023-03-18,23230,Wrap Alphabet Design,10.68,25,12748.0,United Kingdom
546991,2023-03-18,22710,Wrap I Love London,10.68,25,12748.0,United Kingdom
546991,2023-03-18,22052,Vintage Caravan Gift Wrap,10.68,25,12748.0,United Kingdom
546991,2023-03-18,22045,Spaceboy Gift Wrap,10.68,25,12748.0,United Kingdom
546991,2023-03-18,21224,Set/4 Skull Badges,11.53,6,12748.0,United Kingdom
546991,2023-03-18,84929,Asstd Fruit+Flowers Fridge Magnets,10.81,6,12748.0,United Kingdom
546991,2023-03-18,22948,Metal Decoration Naughty Children,11.12,6,12748.0,United Kingdom
546991,2023-03-18,22945,Christmas Metal Tags Assorted,11.12,6,12748.0,United Kingdom
546991,2023-03-18,22922,Fridge Magnets Us Diner Assorted,11.12,6,12748.0,United Kingdom
546991,2023-03-18,22924,Fridge Magnets La Vie En Rose,11.12,6,12748.0,United Kingdom
546991,2023-03-18,22915,Assorted Bottle Top Magnets,10.68,6,12748.0,United Kingdom
546991,2023-03-18,22923,Fridge Magnets Les Enfants Assorted,11.12,6,12748.0,United Kingdom
546991,2023-03-18,22403,Magnets Pack Of 4 Vintage Labels,11.53,6,12748.0,United Kingdom
546991,2023-03-18,22402,Magnets Pack Of 4 Vintage Collage,11.53,6,12748.0,United Kingdom
546991,2023-03-18,22398,Magnets Pack Of 4 Swallows,11.53,6,12748.0,United Kingdom
546991,2023-03-18,22396,Magnets Pack Of 4 Retro Photo,11.53,6,12748.0,United Kingdom
546991,2023-03-18,22399,Magnets Pack Of 4 Childhood Memory,11.53,6,12748.0,United Kingdom
546991,2023-03-18,84879,Assorted Colour Bird Ornament,11.98,5,12748.0,United Kingdom
546991,2023-03-18,21135,Victorian Metal Postcard Spring,11.98,4,12748.0,United Kingdom
546991,2023-03-18,22992,Revolver Wooden Ruler,12.25,6,12748.0,United Kingdom
546991,2023-03-18,22991,Giraffe Wooden Ruler,12.25,6,12748.0,United Kingdom
546992,2023-03-18,22654,Deluxe Sewing Kit,15.32,80,16684.0,United Kingdom
546992,2023-03-18,22766,Photo Frame Cornice,12.86,48,16684.0,United Kingdom
546992,2023-03-18,22697,Green Regency Teacup And Saucer,12.86,72,16684.0,United Kingdom
546992,2023-03-18,22699,Roses Regency Teacup And Saucer,12.86,96,16684.0,United Kingdom
546992,2023-03-18,22993,Set Of 4 Pantry Jelly Moulds,11.34,72,16684.0,United Kingdom
546992,2023-03-18,22659,Lunch Box I Love London,11.94,320,16684.0,United Kingdom
546992,2023-03-18,22629,Spaceboy Lunch Box,11.94,128,16684.0,United Kingdom
546992,2023-03-18,22960,Jam Making Set With Jars,14.09,60,16684.0,United Kingdom
546992,2023-03-18,21166,Cook With Wine Metal Sign,12.15,144,16684.0,United Kingdom
546992,2023-03-18,82482,Wooden Picture Frame White Finish,12.4,144,16684.0,United Kingdom
546992,2023-03-18,82600,N0 Singing Metal Sign,12.15,144,16684.0,United Kingdom
546992,2023-03-18,15036,Assorted Colours Silk Fan,10.92,600,16684.0,United Kingdom
546992,2023-03-18,22741,Funky Diva Pen,10.99,576,16684.0,United Kingdom
546992,2023-03-18,21977,Pack Of 60 Pink Paisley Cake Cases,10.68,360,16684.0,United Kingdom
546992,2023-03-18,15056N,Edwardian Parasol Natural,15.32,144,16684.0,United Kingdom
546993,2023-03-18,22720,Set Of 3 Cake Tins Pantry Design,15.32,2,17921.0,United Kingdom
