TransactionNo,Date,ProductNo,ProductName,Price,Quantity,CustomerNo,Country
556580,2023-06-13,22853,Cat Bowl Vintage Cream,13.58,6,17719.0,United Kingdom
556580,2023-06-13,85049E,Scandinavian Reds Ribbons,11.53,12,17719.0,United Kingdom
556580,2023-06-13,22627,Mint Kitchen Scales,18.96,2,17719.0,United Kingdom
556580,2023-06-13,22624,Ivory Kitchen Scales,18.96,2,17719.0,United Kingdom
556580,2023-06-13,23243,Set Of Tea Coffee Sugar Tins Pantry,15.32,4,17719.0,United Kingdom
556596,2023-06-13,23230,Wrap Alphabet Design,10.68,25,17349.0,United Kingdom
556596,2023-06-13,23284,Doormat Keep Calm And Come In,18.4,1,17349.0,United Kingdom
556596,2023-06-13,22333,Retrospot Party Bag + Sticker Set,11.94,4,17349.0,United Kingdom
556596,2023-06-13,21719,Lovely Bonbon Sticker Sheet,11.12,50,17349.0,United Kingdom
556596,2023-06-13,84569A,Pack 3 Iron On Dog Patches,11.53,1,17349.0,United Kingdom
556596,2023-06-13,21220,Set/4 Badges Dogs,11.53,10,17349.0,United Kingdom
556596,2023-06-13,22440,Balloon Water Bomb Pack Of 35,10.68,10,17349.0,United Kingdom
556596,2023-06-13,21220,Set/4 Badges Dogs,11.53,10,17349.0,United Kingdom
556625,2023-06-13,22201,Frying Pan Blue Polkadot,14.61,1,15625.0,United Kingdom
556625,2023-06-13,22204,Milk Pan Blue Polkadot,14.09,1,15625.0,United Kingdom
556625,2023-06-13,37413,Icon Mug Revolutionary,10.65,1,15625.0,United Kingdom
556629,2023-06-13,22792,Fluted Antique Candle Holder,11.12,24,14841.0,United Kingdom
556629,2023-06-13,22801,Antique Glass Pedestal Bowl,14.09,4,14841.0,United Kingdom
556629,2023-06-13,84949,Silver Hanging T-Light Holder,11.94,6,14841.0,United Kingdom
556629,2023-06-13,84946,Antique Silver T-Light Glass,11.53,12,14841.0,United Kingdom
556629,2023-06-13,22460,Embossed Glass Tealight Holder,11.53,12,14841.0,United Kingdom
556629,2023-06-13,23148,Miniature Antique Rose Hook Ivory,11.1,24,14841.0,United Kingdom
556629,2023-06-13,23245,Set Of 3 Regency Cake Tins,15.32,4,14841.0,United Kingdom
556629,2023-06-13,23175,Regency Milk Jug Pink,13.58,4,14841.0,United Kingdom
556629,2023-06-13,23174,Regency Sugar Bowl Green,14.5,4,14841.0,United Kingdom
556629,2023-06-13,22427,Enamel Flower Jug Cream,16.35,3,14841.0,United Kingdom
556629,2023-06-13,23100,Silver Bells Table Decoration,11.53,12,14841.0,United Kingdom
556629,2023-06-13,23118,Parisienne Jewellery Drawer,17.94,2,14841.0,United Kingdom
556629,2023-06-13,23240,Set Of 4 Knick Knack Tins Doily,14.5,6,14841.0,United Kingdom
556629,2023-06-13,23243,Set Of Tea Coffee Sugar Tins Pantry,15.32,4,14841.0,United Kingdom
556629,2023-06-13,22961,Jam Making Set Printed,11.74,12,14841.0,United Kingdom
556629,2023-06-13,22907,Pack Of 20 Napkins Pantry Design,11.12,24,14841.0,United Kingdom
556629,2023-06-13,22960,Jam Making Set With Jars,14.61,6,14841.0,United Kingdom
556629,2023-06-13,23298,Spotty Bunting,15.32,9,14841.0,United Kingdom
556629,2023-06-13,22386,Jumbo Bag Pink Polkadot,6.19,20,14841.0,United Kingdom
556629,2023-06-13,21928,Jumbo Bag Scandinavian Blue Paisley,6.19,20,14841.0,United Kingdom
556629,2023-06-13,21929,Jumbo Bag Pink Vintage Paisley,6.19,20,14841.0,United Kingdom
556629,2023-06-13,23199,Jumbo Bag Apples,6.19,20,14841.0,United Kingdom
556629,2023-06-13,85099F,Jumbo Bag Strawberry,6.19,20,14841.0,United Kingdom
556629,2023-06-13,85099B,Jumbo Bag Red Retrospot,6.19,10,14841.0,United Kingdom
556630,2023-06-13,23192,Bundle Of 3 Alphabet Exercise Books,11.94,12,13999.0,United Kingdom
556630,2023-06-13,46000S,Polyester Filler Pad 40x40cm,11.74,8,13999.0,United Kingdom
556630,2023-06-13,21078,Set/20 Strawberry Paper Napkins,11.12,12,13999.0,United Kingdom
556630,2023-06-13,85053,French Enamel Candleholder,12.4,6,13999.0,United Kingdom
556630,2023-06-13,22411,Jumbo Shopper Vintage Red Paisley,12.38,10,13999.0,United Kingdom
556630,2023-06-13,22088,Paper Bunting Coloured Lace,13.27,12,13999.0,United Kingdom
556630,2023-06-13,21621,Vintage Union Jack Bunting,18.96,4,13999.0,United Kingdom
556630,2023-06-13,47566,Party Bunting,15.32,8,13999.0,United Kingdom
556630,2023-06-13,23298,Spotty Bunting,15.32,3,13999.0,United Kingdom
556630,2023-06-13,21928,Jumbo Bag Scandinavian Blue Paisley,6.19,10,13999.0,United Kingdom
556630,2023-06-13,21929,Jumbo Bag Pink Vintage Paisley,6.19,10,13999.0,United Kingdom
556630,2023-06-13,23202,Jumbo Bag Vintage Leaf,6.19,10,13999.0,United Kingdom
556630,2023-06-13,23203,Jumbo Bag Vintage Doily,6.19,10,13999.0,United Kingdom
556630,2023-06-13,20725,Lunch Bag Red Retrospot,5.97,10,13999.0,United Kingdom
556630,2023-06-13,23209,Lunch Bag Vintage Doily,5.97,10,13999.0,United Kingdom
556631,2023-06-13,15034,Paper Pocket Traveling Fan,10.39,24,13080.0,United Kingdom
556631,2023-06-13,21984,Pack Of 12 Pink Paisley Tissues,10.55,24,13080.0,United Kingdom
556631,2023-06-13,85032B,Blossom Images Gift Wrap Set,10.92,12,13080.0,United Kingdom
556631,2023-06-13,22969,Homemade Jam Scented Candles,11.74,12,13080.0,United Kingdom
556631,2023-06-13,21977,Pack Of 60 Pink Paisley Cake Cases,10.81,24,13080.0,United Kingdom
556631,2023-06-13,51014C,Feather Pen Coal Black,10.65,24,13080.0,United Kingdom
556632,2023-06-13,22794,Sweetheart Wire Magazine Rack,18.4,1,16987.0,United Kingdom
556632,2023-06-13,22470,Heart Of Wicker Large,13.27,2,16987.0,United Kingdom
556632,2023-06-13,22795,Sweetheart Recipe Book Stand,17.17,2,16987.0,United Kingdom
556632,2023-06-13,22469,Heart Of Wicker Small,11.94,2,16987.0,United Kingdom
556632,2023-06-13,85123A,Cream Hanging Heart T-Light Holder,13.27,2,16987.0,United Kingdom
556632,2023-06-13,21733,Red Hanging Heart T-Light Holder,13.27,2,16987.0,United Kingdom
556632,2023-06-13,22690,Doormat Home Sweet Home Blue,18.4,1,16987.0,United Kingdom
556632,2023-06-13,48129,Doormat Topiary,18.4,2,16987.0,United Kingdom
556632,2023-06-13,48188,Doormat Welcome Puppies,18.4,1,16987.0,United Kingdom
556636,2023-06-13,10133,Colouring Pencils Brown Tube,11.1,5,13636.0,United Kingdom
556636,2023-06-13,15036,Assorted Colours Silk Fan,11.92,11,13636.0,United Kingdom
556636,2023-06-13,15060B,Fairy Cake Design Umbrella,18.75,1,13636.0,United Kingdom
556636,2023-06-13,16219,House Shape Pencil Sharpener,11.1,1,13636.0,United Kingdom
556636,2023-06-13,16237,Sleeping Cat Erasers,10.68,1,13636.0,United Kingdom
556636,2023-06-13,17129F,Blue Glass Gems In Bag,11.92,3,13636.0,United Kingdom
556636,2023-06-13,20615,Blue Polkadot Passport Cover,14.48,1,13636.0,United Kingdom
556636,2023-06-13,20733,Gold Mini Tape Measure,11.1,3,13636.0,United Kingdom
556636,2023-06-13,20735,Black Mini Tape Measure,11.1,9,13636.0,United Kingdom
556636,2023-06-13,20754,Retrospot Red Washing Up Gloves,14.48,1,13636.0,United Kingdom
556636,2023-06-13,20898,Vintage Notebook Travelogue,12.77,2,13636.0,United Kingdom
556636,2023-06-13,20903,Vintage Keepsake Box Travelogue,14.48,1,13636.0,United Kingdom
556636,2023-06-13,20979,36 Pencils Tube Red Retrospot,12.77,1,13636.0,United Kingdom
556636,2023-06-13,20980,36 Pencils Tube Posy,11.1,9,13636.0,United Kingdom
556636,2023-06-13,21001,Rose Du Sud Washbag,14.48,1,13636.0,United Kingdom
556636,2023-06-13,21069,Vintage Billboard Tea Mug,12.77,1,13636.0,United Kingdom
556636,2023-06-13,21080,Set/20 Red Retrospot Paper Napkins,11.92,2,13636.0,United Kingdom
556636,2023-06-13,21084,Set/6 Collage Paper Cups,11.1,5,13636.0,United Kingdom
556636,2023-06-13,21088,Set/6 Fruit Salad Paper Cups,11.1,2,13636.0,United Kingdom
556636,2023-06-13,21090,Set/6 Collage Paper Plates,11.1,5,13636.0,United Kingdom
556636,2023-06-13,21096,Set/6 Fruit Salad Paper Plates,11.1,2,13636.0,United Kingdom
556636,2023-06-13,21131,Gold Standing Gnome,18.75,1,13636.0,United Kingdom
556636,2023-06-13,21137,Black Record Cover Frame,17.9,2,13636.0,United Kingdom
556636,2023-06-13,21154,Red Retrospot Oven Glove,12.77,1,13636.0,United Kingdom
556636,2023-06-13,21163,Do Not Touch My Stuff Door Hanger,13.62,1,13636.0,United Kingdom
556636,2023-06-13,21165,Beware Of The Cat Metal Sign,14.48,1,13636.0,United Kingdom
556636,2023-06-13,21171,Bathroom Metal Sign,13.62,1,13636.0,United Kingdom
556636,2023-06-13,21172,Party Metal Sign,14.48,1,13636.0,United Kingdom
556636,2023-06-13,21174,Pottering In The Shed Metal Sign,14.48,2,13636.0,United Kingdom
556636,2023-06-13,21179,No Junk Mail Metal Sign,11.92,3,13636.0,United Kingdom
556636,2023-06-13,21210,Set Of 72 Retrospot Paper Doilies,13.24,1,13636.0,United Kingdom
556636,2023-06-13,21213,Pack Of 72 Skull Cake Cases,11.53,1,13636.0,United Kingdom
556636,2023-06-13,21218,Red Spotty Biscuit Tin,18.75,1,13636.0,United Kingdom
556636,2023-06-13,21224,Set/4 Skull Badges,11.1,1,13636.0,United Kingdom
556636,2023-06-13,21313,Glass Heart T-Light Holder,11.92,22,13636.0,United Kingdom
556636,2023-06-13,21314,Small Glass Heart Trinket Pot,14.48,1,13636.0,United Kingdom
556636,2023-06-13,21385,Ivory Hanging Decoration Heart,11.92,1,13636.0,United Kingdom
556636,2023-06-13,21447,12 Ivory Rose Peg Place Settings,12.77,14,13636.0,United Kingdom
556636,2023-06-13,21519,Gin & Tonic Diet Greeting Card,11.1,5,13636.0,United Kingdom
556636,2023-06-13,21531,Red Retrospot Sugar Jam Bowl,15.33,1,13636.0,United Kingdom
556636,2023-06-13,21535,Red Retrospot Small Milk Jug,15.33,1,13636.0,United Kingdom
556636,2023-06-13,21558,Skull Lunch Box With Cutlery,15.33,1,13636.0,United Kingdom
556636,2023-06-13,21559,Strawberry Lunch Box With Cutlery,15.33,1,13636.0,United Kingdom
556636,2023-06-13,21683,Medium Medina Stamped Metal Bowl,16.18,1,13636.0,United Kingdom
556636,2023-06-13,21786,Polkadot Rain Hat,11.1,1,13636.0,United Kingdom
556636,2023-06-13,21880,Red Retrospot Tape,10.68,2,13636.0,United Kingdom
556636,2023-06-13,21881,Cute Cats Tape,11.92,1,13636.0,United Kingdom
556636,2023-06-13,21900,Key Fob Shed,11.92,1,13636.0,United Kingdom
556636,2023-06-13,21948,Set Of 6 Cake Chopsticks,12.77,1,13636.0,United Kingdom
556636,2023-06-13,21974,Set Of 36 Paisley Flower Doilies,13.24,1,13636.0,United Kingdom
556636,2023-06-13,21982,Pack Of 12 Suki Tissues,11.1,1,13636.0,United Kingdom
556636,2023-06-13,21986,Pack Of 12 Pink Polkadot Tissues,11.1,1,13636.0,United Kingdom
556636,2023-06-13,21993,Floral Folk Stationery Set,12.77,1,13636.0,United Kingdom
556636,2023-06-13,22024,Rainy Ladies Birthday Card,11.1,2,13636.0,United Kingdom
556636,2023-06-13,22027,Tea Party Birthday Card,11.1,2,13636.0,United Kingdom
556636,2023-06-13,22029,Spaceboy Birthday Card,11.1,1,13636.0,United Kingdom
556636,2023-06-13,22037,Robot Birthday Card,11.1,2,13636.0,United Kingdom
556636,2023-06-13,22091,Empire Tissue Box,12.77,1,13636.0,United Kingdom
556636,2023-06-13,22182,Cake Stand Victorian Filigree Small,14.48,4,13636.0,United Kingdom
556636,2023-06-13,22268,Decoration Sitting Bunny,10.9,1,13636.0,United Kingdom
556636,2023-06-13,22355,Charlotte Bag Suki Design,11.92,2,13636.0,United Kingdom
556636,2023-06-13,22378,Wall Tidy Retrospot,14.48,1,13636.0,United Kingdom
556636,2023-06-13,22379,Recycling Bag Retrospot,14.48,1,13636.0,United Kingdom
556636,2023-06-13,22411,Jumbo Shopper Vintage Red Paisley,14.48,2,13636.0,United Kingdom
556636,2023-06-13,22417,Pack Of 60 Spaceboy Cake Cases,11.53,1,13636.0,United Kingdom
556636,2023-06-13,22426,Enamel Wash Bowl Cream,17.9,1,13636.0,United Kingdom
556636,2023-06-13,22435,Set Of 9 Heart Shaped Balloons,12.77,1,13636.0,United Kingdom
556636,2023-06-13,22437,Set Of 9 Black Skull Balloons,11.92,1,13636.0,United Kingdom
556636,2023-06-13,22469,Heart Of Wicker Small,11.92,10,13636.0,United Kingdom
556636,2023-06-13,22489,Pack Of 12 Traditional Crayons,11.1,1,13636.0,United Kingdom
556636,2023-06-13,22494,Emergency First Aid Tin,12.77,2,13636.0,United Kingdom
556636,2023-06-13,22560,Traditional Modelling Clay,12.77,1,13636.0,United Kingdom
556636,2023-06-13,22582,Pack Of 6 Sweetie Gift Boxes,15.33,1,13636.0,United Kingdom
556636,2023-06-13,22586,Feltcraft Hairband Pink And Blue,11.92,1,13636.0,United Kingdom
556636,2023-06-13,22619,Set Of 6 Soldier Skittles,17.9,1,13636.0,United Kingdom
556636,2023-06-13,22629,Spaceboy Lunch Box,14.48,1,13636.0,United Kingdom
556636,2023-06-13,22631,Circus Parade Lunch Box,14.48,1,13636.0,United Kingdom
556636,2023-06-13,22661,Charlotte Bag Dolly Girl Design,11.92,1,13636.0,United Kingdom
556636,2023-06-13,22666,Recipe Box Pantry Yellow Design,16.18,1,13636.0,United Kingdom
556636,2023-06-13,22681,French Blue Metal Door Sign 6,12.77,1,13636.0,United Kingdom
556636,2023-06-13,22697,Green Regency Teacup And Saucer,16.18,1,13636.0,United Kingdom
556636,2023-06-13,22698,Pink Regency Teacup And Saucer,16.18,1,13636.0,United Kingdom
556636,2023-06-13,22699,Roses Regency Teacup And Saucer,16.18,1,13636.0,United Kingdom
556636,2023-06-13,22713,Card I Love London,11.1,2,13636.0,United Kingdom
556636,2023-06-13,22716,Card Circus Parade,11.1,2,13636.0,United Kingdom
556636,2023-06-13,22751,Feltcraft Princess Olivia Doll,17.9,1,13636.0,United Kingdom
556636,2023-06-13,22755,Small Purple Babushka Notebook,11.92,1,13636.0,United Kingdom
556636,2023-06-13,22817,Card Suki Birthday,11.1,1,13636.0,United Kingdom
556636,2023-06-13,22900,Set 2 Tea Towels I Love London,17.05,2,13636.0,United Kingdom
556636,2023-06-13,22902,Tote Bag I Love London,14.48,1,13636.0,United Kingdom
556636,2023-06-13,22949,Set Of 36 Dolly Girl Paper Doilies,13.24,1,13636.0,United Kingdom
556636,2023-06-13,22960,Jam Making Set With Jars,18.75,1,13636.0,United Kingdom
556636,2023-06-13,22969,Homemade Jam Scented Candles,13.62,6,13636.0,United Kingdom
556636,2023-06-13,22993,Set Of 4 Pantry Jelly Moulds,12.77,1,13636.0,United Kingdom
556636,2023-06-13,22996,Travel Card Wallet Vintage Ticket,11.1,1,13636.0,United Kingdom
556636,2023-06-13,23000,Travel Card Wallet Transport,11.1,2,13636.0,United Kingdom
556636,2023-06-13,23002,Travel Card Wallet Skulls,11.1,1,13636.0,United Kingdom
556636,2023-06-13,23082,Set 6 Paper Table Lantern Hearts,17.9,3,13636.0,United Kingdom
556636,2023-06-13,23161,Regency Cake Fork,12.77,4,13636.0,United Kingdom
556636,2023-06-13,23168,Classic Cafe Sugar Dispenser,12.77,1,13636.0,United Kingdom
556636,2023-06-13,23170,Regency Tea Plate Roses,13.62,3,13636.0,United Kingdom
556636,2023-06-13,23171,Regency Tea Plate Green,13.62,2,13636.0,United Kingdom
556636,2023-06-13,23174,Regency Sugar Bowl Green,18.75,1,13636.0,United Kingdom
556636,2023-06-13,23175,Regency Milk Jug Pink,17.9,1,13636.0,United Kingdom
556636,2023-06-13,23192,Bundle Of 3 Alphabet Exercise Books,13.62,1,13636.0,United Kingdom
556636,2023-06-13,23204,Charlotte Bag Apples Design,11.92,1,13636.0,United Kingdom
556636,2023-06-13,23205,Charlotte Bag Vintage Alphabet,11.92,1,13636.0,United Kingdom
556636,2023-06-13,23226,Filigree Heart Daisy White,12.77,3,13636.0,United Kingdom
556636,2023-06-13,23227,Filigree Heart Butterfly White,12.77,4,13636.0,United Kingdom
556636,2023-06-13,23238,Set Of 4 Knick Knack Tins London,18.75,1,13636.0,United Kingdom
556636,2023-06-13,23241,Treasure Tin Gymkhana Design,14.48,1,13636.0,United Kingdom
556636,2023-06-13,23275,Set Of 3 Hanging Owls Ollie Beak,12.77,1,13636.0,United Kingdom
556636,2023-06-13,23300,Gardeners Kneeling Pad Cup Of Tea,13.62,1,13636.0,United Kingdom
556636,2023-06-13,23301,Gardeners Kneeling Pad Keep Calm,13.62,1,13636.0,United Kingdom
556636,2023-06-13,23302,Kneeling Mat Housework Design,13.62,1,13636.0,United Kingdom
556636,2023-06-13,23306,Set Of 36 Pantry Paper Doilies,13.24,1,13636.0,United Kingdom
556636,2023-06-13,23307,Set Of 60 Pantry Design Cake Cases,11.53,2,13636.0,United Kingdom
556636,2023-06-13,23308,Set Of 60 Vintage Leaf Cake Cases,11.53,1,13636.0,United Kingdom
556636,2023-06-13,23309,Set Of 60 I Love London Cake Cases,11.53,2,13636.0,United Kingdom
556636,2023-06-13,23310,Bubblegum Ring Assorted,11.1,4,13636.0,United Kingdom
556636,2023-06-13,35004B,Set Of 3 Black Flying Ducks,16.18,1,13636.0,United Kingdom
556636,2023-06-13,35095B,Red Victorian Fabric Oval Box,11.1,1,13636.0,United Kingdom
556636,2023-06-13,35653,Vintage Bead Notebook,12.77,2,13636.0,United Kingdom
556636,2023-06-13,35916B,Blue Felt Hanging Heart With Flower,10.9,1,13636.0,United Kingdom
556636,2023-06-13,71143,Antique Silver Book Mark With Beads,11.1,2,13636.0,United Kingdom
556636,2023-06-13,82567,Airline Lounge Metal Sign,11.92,2,13636.0,United Kingdom
556636,2023-06-13,21171,Bathroom Metal Sign,11.53,1,13636.0,United Kingdom
556636,2023-06-13,82582,Area Patrolled Metal Sign,14.48,1,13636.0,United Kingdom
556636,2023-06-13,84077,World War 2 Gliders Asstd Designs,10.9,1,13636.0,United Kingdom
556636,2023-06-13,84380,Set Of 3 Butterfly Cookie Cutters,12.77,1,13636.0,United Kingdom
556636,2023-06-13,84559A,3d Sheet Of Dog Stickers,11.95,1,13636.0,United Kingdom
556636,2023-06-13,84596B,Small Dolly Mix Design Orange Bowl,11.1,3,13636.0,United Kingdom
556636,2023-06-13,84596F,Small Marshmallows Pink Bowl,11.1,1,13636.0,United Kingdom
556636,2023-06-13,84596L,Biscuits Small Bowl Light Blue,11.1,2,13636.0,United Kingdom
556636,2023-06-13,84637,Kitchen Flower Pots Wall Plaque,15.33,1,13636.0,United Kingdom
556636,2023-06-13,84692,Box Of 24 Cocktail Parasols,11.1,1,13636.0,United Kingdom
556636,2023-06-13,84796B,Blue Savannah Picnic Hamper For 2,18.75,1,13636.0,United Kingdom
556636,2023-06-13,84877A,Pink Round Compact Mirror,13.62,3,13636.0,United Kingdom
556636,2023-06-13,84877B,Green Round Compact Mirror,17.9,1,13636.0,United Kingdom
556636,2023-06-13,84877D,Blue Round Compact Mirror,13.62,2,13636.0,United Kingdom
556636,2023-06-13,84944,Set Of 6 Kashmir Folkart Baubles,10.81,6,13636.0,United Kingdom
556636,2023-06-13,84946,Antique Silver T-Light Glass,12.77,80,13636.0,United Kingdom
556636,2023-06-13,84988,Set Of 72 Pink Heart Paper Doilies,13.24,1,13636.0,United Kingdom
556636,2023-06-13,84997D,Childrens Cutlery Polkadot Pink,18.75,1,13636.0,United Kingdom
556636,2023-06-13,85078,Scandinavian 3 Hearts Napkin Ring,11.92,2,13636.0,United Kingdom
556636,2023-06-13,85123A,Cream Hanging Heart T-Light Holder,16.18,1,13636.0,United Kingdom
556636,2023-06-13,85131A,Beaded Pearl Heart White On Stick,11.1,4,13636.0,United Kingdom
556636,2023-06-13,85131B,Beaded Crystal Heart Green On Stick,11.1,2,13636.0,United Kingdom
556636,2023-06-13,85131C,Beaded Crystal Heart Blue On Stick,11.1,1,13636.0,United Kingdom
556636,2023-06-13,85132C,Charlie And Lola Figures Tins,16.18,1,13636.0,United Kingdom
556636,2023-06-13,85173,Set/6 Frog Prince T-Light Candles,15.33,1,13636.0,United Kingdom
556636,2023-06-13,90085,Crystal Stiletto Phone Charm,11.92,2,13636.0,United Kingdom
556636,2023-06-13,90086,Crystal Frog Phone Charm,11.92,1,13636.0,United Kingdom
556636,2023-06-13,90087,Crystal Sea Horse Phone Charm,11.92,1,13636.0,United Kingdom
556636,2023-06-13,90093,Clear Crystal Star Phone Charm,11.92,2,13636.0,United Kingdom
556636,2023-06-13,90214L,"Letter ""L"" Bling Key Ring",11.1,1,13636.0,United Kingdom
556636,2023-06-13,23131,Mistletoe Heart Wreath Cream,14.5,3,13636.0,United Kingdom
556636,2023-06-13,23130,Mistletoe Heart Wreath Green,14.5,7,13636.0,United Kingdom
556636,2023-06-13,22385,Jumbo Bag Spaceboy Design,7.24,4,13636.0,United Kingdom
556636,2023-06-13,23202,Jumbo Bag Vintage Leaf,7.24,1,13636.0,United Kingdom
556636,2023-06-13,85099B,Jumbo Bag Red Retrospot,7.24,3,13636.0,United Kingdom
556636,2023-06-13,20725,Lunch Bag Red Retrospot,7.24,1,13636.0,United Kingdom
556636,2023-06-13,23209,Lunch Bag Vintage Doily,7.24,1,13636.0,United Kingdom
556636,2023-06-13,21289,Large Stripes Chocolate Gift Bag,5.77,1,13636.0,United Kingdom
556641,2023-06-13,23052,Recycled Acapulco Mat Turquoise,18.71,2,13663.0,United Kingdom
556641,2023-06-13,23051,Recycled Acapulco Mat Blue,18.71,2,13663.0,United Kingdom
556641,2023-06-13,23284,Doormat Keep Calm And Come In,18.4,2,13663.0,United Kingdom
556641,2023-06-13,22935,Baking Mould Rose Milk Chocolate,13.58,6,13663.0,United Kingdom
556641,2023-06-13,72741,Grand Chocolatecandle,11.74,9,13663.0,United Kingdom
556641,2023-06-13,23271,Christmas Table Silver Candle Spike,11.1,16,13663.0,United Kingdom
556641,2023-06-13,23170,Regency Tea Plate Roses,11.94,12,13663.0,United Kingdom
556641,2023-06-13,22915,Assorted Bottle Top Magnets,10.68,12,13663.0,United Kingdom
556641,2023-06-13,22922,Fridge Magnets Us Diner Assorted,11.12,12,13663.0,United Kingdom
556641,2023-06-13,22924,Fridge Magnets La Vie En Rose,11.12,12,13663.0,United Kingdom
556641,2023-06-13,23050,Recycled Acapulco Mat Green,18.71,2,13663.0,United Kingdom
556641,2023-06-13,23053,Recycled Acapulco Mat Pink,18.71,2,13663.0,United Kingdom
556641,2023-06-13,23054,Recycled Acapulco Mat Lavender,18.71,2,13663.0,United Kingdom
556642,2023-06-13,23300,Gardeners Kneeling Pad Cup Of Tea,11.94,1,17236.0,United Kingdom
556642,2023-06-13,23301,Gardeners Kneeling Pad Keep Calm,11.94,1,17236.0,United Kingdom
556642,2023-06-13,23147,Single Antique Rose Hook Ivory,11.74,1,17236.0,United Kingdom
556642,2023-06-13,23146,Triple Hook Antique Ivory Rose,13.62,1,17236.0,United Kingdom
556642,2023-06-13,23152,Ivory Sweetheart Wire Letter Rack,14.09,4,17236.0,United Kingdom
556642,2023-06-13,23044,Paper Lantern 9 Point Holly Star S,14.5,1,17236.0,United Kingdom
556642,2023-06-13,21447,12 Ivory Rose Peg Place Settings,11.53,10,17236.0,United Kingdom
556642,2023-06-13,21754,Home Building Block Word,16.35,2,17236.0,United Kingdom
556642,2023-06-13,21756,Bath Building Block Word,16.35,1,17236.0,United Kingdom
556642,2023-06-13,21136,Painted Metal Pears Assorted,11.98,8,17236.0,United Kingdom
556642,2023-06-13,21668,Red Stripe Ceramic Drawer Knob,11.53,6,17236.0,United Kingdom
556642,2023-06-13,21672,White Spot Red Ceramic Drawer Knob,11.53,6,17236.0,United Kingdom
556642,2023-06-13,84755,Colour Glass T-Light Holder Hanging,10.92,8,17236.0,United Kingdom
556642,2023-06-13,22077,6 Ribbons Rustic Charm,11.94,4,17236.0,United Kingdom
556642,2023-06-13,23298,Spotty Bunting,15.32,4,17236.0,United Kingdom
556642,2023-06-13,22917,Herb Marker Rosemary,10.92,5,17236.0,United Kingdom
556642,2023-06-13,22918,Herb Marker Parsley,10.92,5,17236.0,United Kingdom
556642,2023-06-13,22916,Herb Marker Thyme,10.92,5,17236.0,United Kingdom
556642,2023-06-13,22919,Herb Marker Mint,10.92,5,17236.0,United Kingdom
556642,2023-06-13,22921,Herb Marker Chives,10.92,5,17236.0,United Kingdom
556667,2023-06-13,22379,Recycling Bag Retrospot,12.15,50,15838.0,United Kingdom
556667,2023-06-13,22381,Toy Tidy Pink Polkadot,12.15,50,15838.0,United Kingdom
556667,2023-06-13,21239,Pink Polkadot Cup,10.99,48,15838.0,United Kingdom
556667,2023-06-13,21240,Blue Polkadot Cup,10.99,48,15838.0,United Kingdom
556670,2023-06-13,21937,Strawberry Picnic Bag,12.86,50,15838.0,United Kingdom
556670,2023-06-13,21936,Red Retrospot Picnic Bag,12.86,50,15838.0,United Kingdom
556670,2023-06-13,84997D,Childrens Cutlery Polkadot Pink,14.09,72,15838.0,United Kingdom
556670,2023-06-13,21244,Blue Polkadot Plate,11.98,24,15838.0,United Kingdom
556670,2023-06-13,20974,12 Pencils Small Tube Skull,10.92,96,15838.0,United Kingdom
556670,2023-06-13,22432,Watering Can Pink Bunny,11.94,48,15838.0,United Kingdom
556670,2023-06-13,22431,Watering Can Blue Elephant,11.94,48,15838.0,United Kingdom
556671,2023-06-13,22754,Small Red Babushka Notebook,11.12,1,17841.0,United Kingdom
556671,2023-06-13,22753,Small Yellow Babushka Notebook,11.12,1,17841.0,United Kingdom
556671,2023-06-13,22755,Small Purple Babushka Notebook,11.12,3,17841.0,United Kingdom
556671,2023-06-13,23301,Gardeners Kneeling Pad Keep Calm,11.94,5,17841.0,United Kingdom
556671,2023-06-13,21927,Blue/Cream Stripe Cushion Cover,11.53,3,17841.0,United Kingdom
556671,2023-06-13,21733,Red Hanging Heart T-Light Holder,13.27,2,17841.0,United Kingdom
556671,2023-06-13,23006,Travel Card Wallet Flower Meadow,10.68,1,17841.0,United Kingdom
556671,2023-06-13,21986,Pack Of 12 Pink Polkadot Tissues,10.55,1,17841.0,United Kingdom
556671,2023-06-13,23180,Mum's Kitchen Clock,15.32,1,17841.0,United Kingdom
556671,2023-06-13,22953,Birthday Party Cordon Barrier Tape,11.53,2,17841.0,United Kingdom
556671,2023-06-13,22563,Happy Stencil Craft,11.53,1,17841.0,United Kingdom
556671,2023-06-13,22562,Monsters Stencil Craft,11.53,1,17841.0,United Kingdom
556671,2023-06-13,22564,Alphabet Stencil Craft,11.53,1,17841.0,United Kingdom
556671,2023-06-13,22893,Mini Cake Stand T-Light Holder,10.68,11,17841.0,United Kingdom
556671,2023-06-13,21034,Rex Cash+Carry Jumbo Shopper,11.22,2,17841.0,United Kingdom
556671,2023-06-13,22882,Number Tile Vintage Font 3,12.25,1,17841.0,United Kingdom
556671,2023-06-13,22884,Number Tile Vintage Font 5,12.25,1,17841.0,United Kingdom
556671,2023-06-13,23165,Large Ceramic Top Storage Jar,11.94,1,17841.0,United Kingdom
556671,2023-06-13,85170B,Set/6 Black Bird T-Light Candles,12.4,1,17841.0,United Kingdom
556671,2023-06-13,22378,Wall Tidy Retrospot,12.4,1,17841.0,United Kingdom
556671,2023-06-13,22379,Recycling Bag Retrospot,12.4,2,17841.0,United Kingdom
556671,2023-06-13,22355,Charlotte Bag Suki Design,11.12,1,17841.0,United Kingdom
556671,2023-06-13,22219,Lovebird Hanging Decoration White,11.12,1,17841.0,United Kingdom
556671,2023-06-13,22227,Hanging Heart Mirror Decoration,10.92,1,17841.0,United Kingdom
556671,2023-06-13,23146,Triple Hook Antique Ivory Rose,13.62,3,17841.0,United Kingdom
556671,2023-06-13,16225,Rattle Snake Eggs,11.53,2,17841.0,United Kingdom
556671,2023-06-13,22421,Lipstick Pen Fuschia,10.68,2,17841.0,United Kingdom
556671,2023-06-13,23102,Silver Hearts Table Decoration,11.1,2,17841.0,United Kingdom
556671,2023-06-13,22553,Plasters In Tin Skulls,11.94,2,17841.0,United Kingdom
556671,2023-06-13,21213,Pack Of 72 Skull Cake Cases,10.81,1,17841.0,United Kingdom
556671,2023-06-13,22554,Plasters In Tin Woodland Animals,11.94,1,17841.0,United Kingdom
556671,2023-06-13,21977,Pack Of 60 Pink Paisley Cake Cases,10.81,2,17841.0,United Kingdom
556671,2023-06-13,84991,60 Teatime Fairy Cake Cases,10.81,2,17841.0,United Kingdom
556671,2023-06-13,21975,Pack Of 60 Dinosaur Cake Cases,10.81,3,17841.0,United Kingdom
556671,2023-06-13,21976,Pack Of 60 Mushroom Cake Cases,10.81,2,17841.0,United Kingdom
