TransactionNo,Date,ProductNo,ProductName,Price,Quantity,CustomerNo,Country
560368,2023-07-18,23296,Set Of 6 Tea Time Baking Cases,11.53,1,17841.0,United Kingdom
560368,2023-07-18,23294,Set Of 6 Snack Loaf Baking Cases,11.1,1,17841.0,United Kingdom
560368,2023-07-18,21218,Red Spotty Biscuit Tin,14.09,1,17841.0,United Kingdom
560368,2023-07-18,22197,Popcorn Holder,11.12,2,17841.0,United Kingdom
560368,2023-07-18,22553,Plasters In Tin Skulls,11.94,1,17841.0,United Kingdom
560368,2023-07-18,21916,Set 12 Retro White Chalk Sticks,10.68,1,17841.0,United Kingdom
560368,2023-07-18,20726,Lunch Bag Woodland,5.97,1,17841.0,United Kingdom
560368,2023-07-18,20727,Lunch Bag Black Skull,5.97,5,17841.0,United Kingdom
560368,2023-07-18,20728,Lunch Bag Cars Blue,5.97,5,17841.0,United Kingdom
560368,2023-07-18,22382,Lunch Bag Spaceboy Design,5.97,5,17841.0,United Kingdom
560368,2023-07-18,20726,Lunch Bag Woodland,5.97,4,17841.0,United Kingdom
560368,2023-07-18,23206,Lunch Bag Apple Design,5.97,1,17841.0,United Kingdom
560381,2023-07-18,84660B,Black Stitched Wall Clock,11.06,20,14733.0,United Kingdom
560381,2023-07-18,84660A,White Stitched Wall Clock,11.06,20,14733.0,United Kingdom
560381,2023-07-18,22461,Savoy Art Deco Clock,14.3,12,14733.0,United Kingdom
560381,2023-07-18,23298,Spotty Bunting,15.32,6,14733.0,United Kingdom
560381,2023-07-18,22499,Wooden Union Jack Bunting,16.35,3,14733.0,United Kingdom
560381,2023-07-18,47566,Party Bunting,15.32,12,14733.0,United Kingdom
560381,2023-07-18,84978,Hanging Heart Jar T-Light Holder,11.34,36,14733.0,United Kingdom
560381,2023-07-18,71477,Coloured Glass Star T-Light Holder,13.07,24,14733.0,United Kingdom
560381,2023-07-18,22595,Gingham Heart Decoration,11.12,12,14733.0,United Kingdom
560381,2023-07-18,21535,Red Retrospot Small Milk Jug,12.86,6,14733.0,United Kingdom
560381,2023-07-18,21533,Retrospot Large Milk Jug,15.32,3,14733.0,United Kingdom
560381,2023-07-18,21539,Red Retrospot Butter Dish,15.32,3,14733.0,United Kingdom
560383,2023-07-18,22989,Set 2 Pantry Design Tea Towels,13.27,12,16762.0,United Kingdom
560383,2023-07-18,22907,Pack Of 20 Napkins Pantry Design,11.12,12,16762.0,United Kingdom
560383,2023-07-18,22666,Recipe Box Pantry Yellow Design,13.27,6,16762.0,United Kingdom
560383,2023-07-18,22960,Jam Making Set With Jars,14.09,12,16762.0,United Kingdom
560383,2023-07-18,22720,Set Of 3 Cake Tins Pantry Design,15.32,6,16762.0,United Kingdom
560383,2023-07-18,22993,Set Of 4 Pantry Jelly Moulds,11.53,12,16762.0,United Kingdom
560383,2023-07-18,22969,Homemade Jam Scented Candles,11.74,24,16762.0,United Kingdom
560383,2023-07-18,23198,Pantry Magnetic Shopping List,11.53,24,16762.0,United Kingdom
560383,2023-07-18,22624,Ivory Kitchen Scales,18.96,2,16762.0,United Kingdom
560383,2023-07-18,23165,Large Ceramic Top Storage Jar,11.94,12,16762.0,United Kingdom
560383,2023-07-18,22990,Cotton Apron Pantry Design,15.32,6,16762.0,United Kingdom
560383,2023-07-18,22966,Gingerbread Man Cookie Cutter,11.53,12,16762.0,United Kingdom
560383,2023-07-18,22112,Chocolate Hot Water Bottle,15.32,3,16762.0,United Kingdom
560385,2023-07-18,72803A,Rose Scent Candle Jewelled Drawer,14.61,2,14583.0,United Kingdom
560385,2023-07-18,22277,Cosmetic Bag Vintage Rose Paisley,12.4,2,14583.0,United Kingdom
560385,2023-07-18,47599B,Blue Party Bags,12.4,5,14583.0,United Kingdom
560385,2023-07-18,22742,Make Your Own Playtime Card Kit,13.27,2,14583.0,United Kingdom
560385,2023-07-18,47594B,Scotties Design Washbag,12.25,1,14583.0,United Kingdom
560385,2023-07-18,21063,Party Invites Jazz Hearts,11.12,3,14583.0,United Kingdom
560385,2023-07-18,22276,Wash Bag Vintage Rose Paisley,12.86,2,14583.0,United Kingdom
560385,2023-07-18,21034,Rex Cash+Carry Jumbo Shopper,11.22,3,14583.0,United Kingdom
560385,2023-07-18,21530,Dairy Maid Toastrack,11.06,4,14583.0,United Kingdom
560385,2023-07-18,22553,Plasters In Tin Skulls,11.94,1,14583.0,United Kingdom
560385,2023-07-18,21385,Ivory Hanging Decoration Heart,11.12,5,14583.0,United Kingdom
560385,2023-07-18,22557,Plasters In Tin Vintage Paisley,11.94,1,14583.0,United Kingdom
560385,2023-07-18,84673A,Pink Fly Swat,10.92,1,14583.0,United Kingdom
560385,2023-07-18,21408,Spotty Pink Duck Doorstop,14.61,1,14583.0,United Kingdom
560385,2023-07-18,22978,Pantry Rolling Pin,14.09,2,14583.0,United Kingdom
560385,2023-07-18,21504,Skulls Greeting Card,10.68,24,14583.0,United Kingdom
560385,2023-07-18,22852,Dog Bowl Vintage Cream,14.61,1,14583.0,United Kingdom
560385,2023-07-18,85123A,Cream Hanging Heart T-Light Holder,13.27,1,14583.0,United Kingdom
560385,2023-07-18,21385,Ivory Hanging Decoration Heart,11.12,3,14583.0,United Kingdom
560385,2023-07-18,84459A,Pink Metal Chicken Heart,11.78,2,14583.0,United Kingdom
560385,2023-07-18,72819,Cupid Design Scented Candles,12.86,2,14583.0,United Kingdom
560385,2023-07-18,21524,Doormat Spotty Home Sweet Home,18.4,1,14583.0,United Kingdom
560385,2023-07-18,48187,Doormat New England,18.4,1,14583.0,United Kingdom
560385,2023-07-18,22332,Skulls Party Bag + Sticker Set,11.94,3,14583.0,United Kingdom
560385,2023-07-18,22896,Peg Bag Apples Design,12.86,1,14583.0,United Kingdom
560385,2023-07-18,47599A,Pink Party Bags,12.4,6,14583.0,United Kingdom
560385,2023-07-18,84279B,Cherry Blossom Decorative Flask,14.09,2,14583.0,United Kingdom
560385,2023-07-18,22335,Heart Decoration Painted Zinc,10.92,4,14583.0,United Kingdom
560385,2023-07-18,22135,Mini Ladle Love Heart Pink,10.68,1,14583.0,United Kingdom
560385,2023-07-18,22804,Pink Hanging Heart T-Light Holder,13.27,4,14583.0,United Kingdom
560385,2023-07-18,85123A,Cream Hanging Heart T-Light Holder,13.27,1,14583.0,United Kingdom
560385,2023-07-18,22139,Retrospot Tea Set Ceramic 11 Pc,15.32,1,14583.0,United Kingdom
560385,2023-07-18,23168,Classic Cafe Sugar Dispenser,11.53,1,14583.0,United Kingdom
560385,2023-07-18,72802C,Vanilla Scent Candle Jewelled Box,14.61,5,14583.0,United Kingdom
560385,2023-07-18,21408,Spotty Pink Duck Doorstop,14.61,1,14583.0,United Kingdom
560385,2023-07-18,22224,White Lovebird Lantern,13.27,2,14583.0,United Kingdom
560385,2023-07-18,22252,Birdcage Decoration Tealight Holder,11.53,4,14583.0,United Kingdom
560385,2023-07-18,21559,Strawberry Lunch Box With Cutlery,12.86,1,14583.0,United Kingdom
560385,2023-07-18,71053,White Moroccan Metal Lantern,14.09,2,14583.0,United Kingdom
560385,2023-07-18,22511,Retrospot Babushka Doorstop,14.09,1,14583.0,United Kingdom
560385,2023-07-18,47590A,Blue Happy Birthday Bunting,15.84,1,14583.0,United Kingdom
560385,2023-07-18,21932,Scandinavian Paisley Picnic Bag,11.94,2,14583.0,United Kingdom
560385,2023-07-18,22381,Toy Tidy Pink Polkadot,12.4,1,14583.0,United Kingdom
560385,2023-07-18,22439,6 Rocket Balloons,10.92,1,14583.0,United Kingdom
560385,2023-07-18,47504K,English Rose Garden Secateurs,11.06,1,14583.0,United Kingdom
560385,2023-07-18,21975,Pack Of 60 Dinosaur Cake Cases,10.81,2,14583.0,United Kingdom
560385,2023-07-18,22508,Doorstop Retrospot Heart,14.09,1,14583.0,United Kingdom
560385,2023-07-18,79190B,Retro Plastic Polka Tray,10.68,1,14583.0,United Kingdom
560385,2023-07-18,84510A,Set Of 4 English Rose Coasters,11.53,1,14583.0,United Kingdom
560385,2023-07-18,22329,Round Container Set Of 5 Retrospot,11.94,1,14583.0,United Kingdom
560385,2023-07-18,21088,Set/6 Fruit Salad Paper Cups,10.44,5,14583.0,United Kingdom
560385,2023-07-18,21561,Dinosaur Lunch Box With Cutlery,12.86,1,14583.0,United Kingdom
560385,2023-07-18,22628,Picnic Boxes Set Of 3 Retrospot,15.32,1,14583.0,United Kingdom
560385,2023-07-18,21792,Classic French Style Basket Green,14.3,1,14583.0,United Kingdom
560385,2023-07-18,21035,Set/2 Red Retrospot Tea Towels,13.58,1,14583.0,United Kingdom
560385,2023-07-18,21096,Set/6 Fruit Salad Paper Plates,10.65,5,14583.0,United Kingdom
560385,2023-07-18,21216,Set 3 Retrospot Tea/Coffee/Sugar,15.32,1,14583.0,United Kingdom
560385,2023-07-18,84596B,Small Dolly Mix Design Orange Bowl,10.68,2,14583.0,United Kingdom
560385,2023-07-18,21218,Red Spotty Biscuit Tin,14.09,1,14583.0,United Kingdom
560385,2023-07-18,20728,Lunch Bag Cars Blue,5.97,3,14583.0,United Kingdom
560387,2023-07-18,22030,Swallows Greeting Card,10.68,48,14667.0,United Kingdom
560387,2023-07-18,22831,White Brocante Soap Dish,13.27,2,14667.0,United Kingdom
560387,2023-07-18,23192,Bundle Of 3 Alphabet Exercise Books,11.94,2,14667.0,United Kingdom
560387,2023-07-18,21754,Home Building Block Word,16.35,3,14667.0,United Kingdom
560387,2023-07-18,84879,Assorted Colour Bird Ornament,11.98,10,14667.0,United Kingdom
560387,2023-07-18,23301,Gardeners Kneeling Pad Keep Calm,11.94,3,14667.0,United Kingdom
560387,2023-07-18,23300,Gardeners Kneeling Pad Cup Of Tea,11.94,3,14667.0,United Kingdom
560387,2023-07-18,85169B,Black Love Bird Candle,11.53,2,14667.0,United Kingdom
560387,2023-07-18,85049C,Romantic Pinks Ribbons,11.53,2,14667.0,United Kingdom
560387,2023-07-18,84997D,Childrens Cutlery Polkadot Pink,14.5,3,14667.0,United Kingdom
560387,2023-07-18,85049A,Traditional Christmas Ribbons,11.53,2,14667.0,United Kingdom
560387,2023-07-18,85049D,Bright Blues Ribbons,11.53,2,14667.0,United Kingdom
560387,2023-07-18,21866,Union Jack Flag Luggage Tag,11.53,10,14667.0,United Kingdom
560387,2023-07-18,21034,Rex Cash+Carry Jumbo Shopper,11.22,2,14667.0,United Kingdom
560387,2023-07-18,23284,Doormat Keep Calm And Come In,18.4,2,14667.0,United Kingdom
560387,2023-07-18,90200B,Black Sweetheart Bracelet,14.61,6,14667.0,United Kingdom
560387,2023-07-18,90200D,Pink Sweetheart Bracelet,14.61,6,14667.0,United Kingdom
560387,2023-07-18,23209,Lunch Bag Vintage Doily,5.97,1,14667.0,United Kingdom
560392,2023-07-18,17021,Namaste Swagat Incense,10.56,72,13911.0,United Kingdom
560392,2023-07-18,22995,Travel Card Wallet Suki,10.68,24,13911.0,United Kingdom
560392,2023-07-18,16161U,Wrap Suki And Friends,10.68,50,13911.0,United Kingdom
560392,2023-07-18,22355,Charlotte Bag Suki Design,11.12,10,13911.0,United Kingdom
560392,2023-07-18,21982,Pack Of 12 Suki Tissues,10.55,24,13911.0,United Kingdom
560392,2023-07-18,15034,Paper Pocket Traveling Fan,10.39,96,13911.0,United Kingdom
560392,2023-07-18,15036,Assorted Colours Silk Fan,11.1,144,13911.0,United Kingdom
560392,2023-07-18,22383,Lunch Bag Suki Design,5.97,10,13911.0,United Kingdom
560393,2023-07-18,72801D,4 Sky Blue Dinner Candles,11.53,7,14808.0,United Kingdom
560393,2023-07-18,20723,Strawberry Charlotte Bag,11.12,10,14808.0,United Kingdom
560393,2023-07-18,20719,Woodland Charlotte Bag,11.12,10,14808.0,United Kingdom
560393,2023-07-18,22661,Charlotte Bag Dolly Girl Design,11.12,10,14808.0,United Kingdom
560393,2023-07-18,84508B,Stripes Design Teddy,12.86,2,14808.0,United Kingdom
560393,2023-07-18,21251,Dinosaur Height Chart Sticker Set,13.27,4,14808.0,United Kingdom
560393,2023-07-18,37491D,Purple/Blue Ceramic Candle Holder,11.94,2,14808.0,United Kingdom
560393,2023-07-18,37491B,Blue/Yellow Ceramic Candle Holder,11.94,4,14808.0,United Kingdom
560393,2023-07-18,37491C,Green/Blue Ceramic Candle Holder,11.94,8,14808.0,United Kingdom
560393,2023-07-18,21715,Girls Vintage Tin Seaside Bucket,12.86,2,14808.0,United Kingdom
560393,2023-07-18,21716,Boys Vintage Tin Seaside Bucket,12.86,6,14808.0,United Kingdom
560393,2023-07-18,23310,Bubblegum Ring Assorted,10.68,36,14808.0,United Kingdom
560393,2023-07-18,22492,Mini Paint Set Vintage,10.92,72,14808.0,United Kingdom
560393,2023-07-18,22629,Spaceboy Lunch Box,12.25,1,14808.0,United Kingdom
560393,2023-07-18,22752,Set 7 Babushka Nesting Boxes,18.96,2,14808.0,United Kingdom
560393,2023-07-18,22454,Measuring Tape Babushka Red,13.27,1,14808.0,United Kingdom
560393,2023-07-18,22233,Jigsaw Rabbit And Birdhouse,10.85,1,14808.0,United Kingdom
560393,2023-07-18,84508C,Blue Circles Design Teddy,12.86,2,14808.0,United Kingdom
560393,2023-07-18,22434,Balloon Pump With 10 Balloons,12.25,4,14808.0,United Kingdom
560393,2023-07-18,21749,Large Red Retrospot Windmill,12.4,2,14808.0,United Kingdom
560393,2023-07-18,22491,Pack Of 12 Coloured Pencils,11.12,12,14808.0,United Kingdom
560393,2023-07-18,21731,Red Toadstool Led Night Light,11.94,4,14808.0,United Kingdom
560393,2023-07-18,23335,Egg Frying Pan Ivory,12.38,1,14808.0,United Kingdom
560393,2023-07-18,23339,Egg Frying Pan Blue,12.38,1,14808.0,United Kingdom
560393,2023-07-18,23338,Egg Frying Pan Red,12.38,1,14808.0,United Kingdom
560393,2023-07-18,23336,Egg Frying Pan Pink,12.38,1,14808.0,United Kingdom
560393,2023-07-18,23337,Egg Frying Pan Mint,12.38,1,14808.0,United Kingdom
560393,2023-07-18,16216,Letter Shape Pencil Sharpener,10.31,80,14808.0,United Kingdom
560393,2023-07-18,16235,Recycled Pencil With Rabbit Eraser,10.47,35,14808.0,United Kingdom
560393,2023-07-18,22489,Pack Of 12 Traditional Crayons,10.68,24,14808.0,United Kingdom
560393,2023-07-18,22899,Children's Apron Dolly Girl,12.4,8,14808.0,United Kingdom
560393,2023-07-18,21832,Chocolate Calculator,11.94,6,14808.0,United Kingdom
560393,2023-07-18,22610,Pens Assorted Funny Face,10.44,36,14808.0,United Kingdom
560393,2023-07-18,22231,Jigsaw Tree With Birdhouse,10.85,2,14808.0,United Kingdom
560393,2023-07-18,22233,Jigsaw Rabbit And Birdhouse,10.85,1,14808.0,United Kingdom
560393,2023-07-18,22629,Spaceboy Lunch Box,12.25,5,14808.0,United Kingdom
560393,2023-07-18,22139,Retrospot Tea Set Ceramic 11 Pc,15.32,5,14808.0,United Kingdom
560393,2023-07-18,22367,Childrens Apron Spaceboy Design,12.25,8,14808.0,United Kingdom
560393,2023-07-18,79190B,Retro Plastic Polka Tray,10.68,4,14808.0,United Kingdom
560393,2023-07-18,79190D,Retro Plastic Daisy Tray,10.68,4,14808.0,United Kingdom
560393,2023-07-18,47591D,Pink Fairy Cake Childrens Apron,12.25,8,14808.0,United Kingdom
560393,2023-07-18,22630,Dolly Girl Lunch Box,12.25,6,14808.0,United Kingdom
560393,2023-07-18,22563,Happy Stencil Craft,11.53,3,14808.0,United Kingdom
560393,2023-07-18,22562,Monsters Stencil Craft,11.53,3,14808.0,United Kingdom
560393,2023-07-18,21062,Party Invites Spaceman,11.12,6,14808.0,United Kingdom
560393,2023-07-18,21063,Party Invites Jazz Hearts,11.12,8,14808.0,United Kingdom
560393,2023-07-18,22663,Jumbo Bag Dolly Girl Design,6.19,1,14808.0,United Kingdom
560394,2023-07-18,21506,Fancy Font Birthday Card,10.68,12,14390.0,United Kingdom
560394,2023-07-18,22470,Heart Of Wicker Large,13.27,5,14390.0,United Kingdom
560394,2023-07-18,23322,Large White Heart Of Wicker,13.27,2,14390.0,United Kingdom
560394,2023-07-18,23066,Small Deco Jewellery Stand,18.71,2,14390.0,United Kingdom
560394,2023-07-18,23083,Set 6 Paper Table Lantern Stars,14.09,12,14390.0,United Kingdom
560394,2023-07-18,22174,Photo Cube,11.94,6,14390.0,United Kingdom
560394,2023-07-18,23080,Red Metal Box Top Secret,18.71,2,14390.0,United Kingdom
560394,2023-07-18,22596,Christmas Star Wish List Chalkboard,11.53,60,14390.0,United Kingdom
560394,2023-07-18,21464,Disco Ball Rotator Battery Operated,14.61,2,14390.0,United Kingdom
560394,2023-07-18,20668,Disco Ball Christmas Decoration,10.37,24,14390.0,United Kingdom
560394,2023-07-18,84997D,Childrens Cutlery Polkadot Pink,14.5,4,14390.0,United Kingdom
560394,2023-07-18,23109,Pack Of Six Led Tea Lights,13.21,2,14390.0,United Kingdom
560394,2023-07-18,21179,No Junk Mail Metal Sign,10.65,1,14390.0,United Kingdom
560394,2023-07-18,22037,Robot Birthday Card,10.68,12,14390.0,United Kingdom
560394,2023-07-18,22983,Card Billboard Font,10.68,12,14390.0,United Kingdom
560394,2023-07-18,22716,Card Circus Parade,10.68,12,14390.0,United Kingdom
560394,2023-07-18,22556,Plasters In Tin Circus Parade,11.94,4,14390.0,United Kingdom
560394,2023-07-18,22197,Popcorn Holder,11.12,4,14390.0,United Kingdom
560394,2023-07-18,84029G,Knitted Union Flag Hot Water Bottle,14.09,2,14390.0,United Kingdom
560394,2023-07-18,22371,Airline Bag Vintage Tokyo 78,14.61,4,14390.0,United Kingdom
560394,2023-07-18,22112,Chocolate Hot Water Bottle,15.32,12,14390.0,United Kingdom
560394,2023-07-18,21463,Mirrored Disco Ball,16.35,2,14390.0,United Kingdom
560394,2023-07-18,85135B,Blue Dragonfly Helicopter,18.4,1,14390.0,United Kingdom
560394,2023-07-18,22356,Charlotte Bag Pink Polkadot,11.12,10,14390.0,United Kingdom
560394,2023-07-18,20718,Red Retrospot Shopper Bag,11.53,10,14390.0,United Kingdom
560394,2023-07-18,23284,Doormat Keep Calm And Come In,18.4,1,14390.0,United Kingdom
560394,2023-07-18,20717,Strawberry Shopper Bag,11.53,10,14390.0,United Kingdom
560394,2023-07-18,21930,Jumbo Storage Bag Skulls,12.38,5,14390.0,United Kingdom
560394,2023-07-18,23344,Jumbo Bag 50'S Christmas,6.19,10,14390.0,United Kingdom
560394,2023-07-18,85099F,Jumbo Bag Strawberry,6.19,10,14390.0,United Kingdom
560394,2023-07-18,85099B,Jumbo Bag Red Retrospot,6.19,10,14390.0,United Kingdom
560394,2023-07-18,21928,Jumbo Bag Scandinavian Blue Paisley,6.19,10,14390.0,United Kingdom
560394,2023-07-18,23203,Jumbo Bag Vintage Doily,6.19,1,14390.0,United Kingdom
560394,2023-07-18,22386,Jumbo Bag Pink Polkadot,6.19,8,14390.0,United Kingdom
560394,2023-07-18,22384,Lunch Bag Pink Polkadot,5.97,5,14390.0,United Kingdom
560394,2023-07-18,20725,Lunch Bag Red Retrospot,5.97,10,14390.0,United Kingdom
560394,2023-07-18,20728,Lunch Bag Cars Blue,5.97,5,14390.0,United Kingdom
560394,2023-07-18,20727,Lunch Bag Black Skull,5.97,5,14390.0,United Kingdom
560397,2023-07-18,22652,Travel Sewing Kit,11.94,20,17652.0,United Kingdom
560397,2023-07-18,21155,Red Retrospot Peg Bag,12.86,6,17652.0,United Kingdom
560397,2023-07-18,21535,Red Retrospot Small Milk Jug,12.86,6,17652.0,United Kingdom
560397,2023-07-18,21559,Strawberry Lunch Box With Cutlery,12.86,12,17652.0,United Kingdom
560397,2023-07-18,84596B,Small Dolly Mix Design Orange Bowl,10.68,16,17652.0,United Kingdom
560397,2023-07-18,85123A,Cream Hanging Heart T-Light Holder,13.27,6,17652.0,United Kingdom
560397,2023-07-18,22457,Natural Slate Heart Chalkboard,13.27,6,17652.0,United Kingdom
560397,2023-07-18,22197,Popcorn Holder,11.12,12,17652.0,United Kingdom
560397,2023-07-18,22352,Lunch Box With Cutlery Retrospot,12.86,6,17652.0,United Kingdom
560397,2023-07-18,22554,Plasters In Tin Woodland Animals,11.94,12,17652.0,United Kingdom
560397,2023-07-18,23198,Pantry Magnetic Shopping List,11.74,12,17652.0,United Kingdom
560397,2023-07-18,23293,Set Of 12 Fairy Cake Baking Cases,11.1,8,17652.0,United Kingdom
560397,2023-07-18,23294,Set Of 6 Snack Loaf Baking Cases,11.1,8,17652.0,United Kingdom
560397,2023-07-18,23295,Set Of 12 Mini Loaf Baking Cases,11.1,8,17652.0,United Kingdom
560397,2023-07-18,23296,Set Of 6 Tea Time Baking Cases,11.53,8,17652.0,United Kingdom
560397,2023-07-18,47590B,Pink Happy Birthday Bunting,15.84,3,17652.0,United Kingdom
560397,2023-07-18,22668,Pink Baby Bunting,13.27,5,17652.0,United Kingdom
560397,2023-07-18,20914,Set/5 Red Retrospot Lid Glass Bowls,13.27,10,17652.0,United Kingdom
560397,2023-07-18,23203,Jumbo Bag Vintage Doily,6.19,20,17652.0,United Kingdom
560397,2023-07-18,20725,Lunch Bag Red Retrospot,5.97,10,17652.0,United Kingdom
560397,2023-07-18,23209,Lunch Bag Vintage Doily,5.97,10,17652.0,United Kingdom
560398,2023-07-18,22139,Retrospot Tea Set Ceramic 11 Pc,14.61,24,12731.0,France
560398,2023-07-18,22561,Wooden School Colouring Set,11.94,24,12731.0,France
560398,2023-07-18,22560,Traditional Modelling Clay,11.34,48,12731.0,France
560398,2023-07-18,21889,Wooden Box Of Dominoes,11.53,24,12731.0,France
560398,2023-07-18,21915,Red Harmonica In Box,11.53,24,12731.0,France
560398,2023-07-18,21914,Blue Harmonica In Box,11.53,24,12731.0,France
560398,2023-07-18,21509,Cowboys And Indians Birthday Card,10.68,12,12731.0,France
560398,2023-07-18,22714,Card Birthday Cowboy,10.68,12,12731.0,France
560398,2023-07-18,85014A,Black/Blue Polkadot Umbrella,15.32,48,12731.0,France
560398,2023-07-18,21844,Red Retrospot Mug,12.86,72,12731.0,France
560398,2023-07-18,20682,Red Retrospot Childrens Umbrella,13.58,12,12731.0,France
560398,2023-07-18,22698,Pink Regency Teacup And Saucer,13.27,6,12731.0,France
560398,2023-07-18,22697,Green Regency Teacup And Saucer,13.27,12,12731.0,France
560398,2023-07-18,22699,Roses Regency Teacup And Saucer,12.86,24,12731.0,France
560398,2023-07-18,22892,Set Of Salt And Pepper Toadstools,11.53,24,12731.0,France
560398,2023-07-18,22195,Large Heart Measuring Spoons,11.94,24,12731.0,France
560398,2023-07-18,21563,Red Heart Shape Love Bucket,13.27,12,12731.0,France
560398,2023-07-18,22134,Mini Ladle Love Heart Red,10.68,48,12731.0,France
560398,2023-07-18,22398,Magnets Pack Of 4 Swallows,10.65,24,12731.0,France
560398,2023-07-18,21524,Doormat Spotty Home Sweet Home,17.17,10,12731.0,France
560398,2023-07-18,48187,Doormat New England,17.17,10,12731.0,France
560398,2023-07-18,48184,Doormat English Rose,17.17,10,12731.0,France
560398,2023-07-18,20685,Doormat Red Retrospot,17.17,10,12731.0,France
560398,2023-07-18,22352,Lunch Box With Cutlery Retrospot,12.86,20,12731.0,France
560398,2023-07-18,21558,Skull Lunch Box With Cutlery,12.86,20,12731.0,France
560398,2023-07-18,22630,Dolly Girl Lunch Box,12.25,20,12731.0,France
560398,2023-07-18,22629,Spaceboy Lunch Box,12.25,20,12731.0,France
560398,2023-07-18,10125,Mini Funky Design Tapes,11.12,100,12731.0,France
560398,2023-07-18,22382,Lunch Bag Spaceboy Design,5.97,30,12731.0,France
560398,2023-07-18,22662,Lunch Bag Dolly Girl Design,5.97,30,12731.0,France
560398,2023-07-18,20727,Lunch Bag Black Skull,5.97,30,12731.0,France
560398,2023-07-18,20725,Lunch Bag Red Retrospot,5.97,30,12731.0,France
560410,2023-07-18,85123A,Cream Hanging Heart T-Light Holder,13.27,6,17213.0,United Kingdom
560410,2023-07-18,84949,Silver Hanging T-Light Holder,11.94,6,17213.0,United Kingdom
560410,2023-07-18,84755,Colour Glass T-Light Holder Hanging,10.92,16,17213.0,United Kingdom
560410,2023-07-18,82494L,Wooden Frame Antique White,13.27,6,17213.0,United Kingdom
560410,2023-07-18,82486,3 Drawer Antique White Wood Cabinet,19.42,4,17213.0,United Kingdom
560410,2023-07-18,82483,Wood 2 Drawer Cabinet White Finish,17.37,4,17213.0,United Kingdom
560410,2023-07-18,82482,Wooden Picture Frame White Finish,12.86,6,17213.0,United Kingdom
560410,2023-07-18,71459,Hanging Jam Jar T-Light Holders,11.12,12,17213.0,United Kingdom
560410,2023-07-18,48184,Doormat English Rose,18.4,2,17213.0,United Kingdom
560410,2023-07-18,48138,Doormat Union Flag,18.4,2,17213.0,United Kingdom
560410,2023-07-18,23233,Wrap Poppies Design,10.68,25,17213.0,United Kingdom
560410,2023-07-18,23232,Wrap Vintage Leaf Design,10.68,25,17213.0,United Kingdom
560410,2023-07-18,23075,Parlour Ceramic Wall Hook,14.5,4,17213.0,United Kingdom
560410,2023-07-18,22986,Wrap Gingham Rose,10.68,25,17213.0,United Kingdom
560410,2023-07-18,22897,Oven Mitt Apples Design,11.74,10,17213.0,United Kingdom
560410,2023-07-18,22798,Antique Glass Dressing Table Pot,13.27,8,17213.0,United Kingdom
560410,2023-07-18,22794,Sweetheart Wire Magazine Rack,18.4,2,17213.0,United Kingdom
560410,2023-07-18,22784,Lantern Cream Gazebo,15.32,3,17213.0,United Kingdom
560410,2023-07-18,22704,Wrap Red Apples,10.68,25,17213.0,United Kingdom
560410,2023-07-18,22675,French Kitchen Sign Blue Metal,11.53,12,17213.0,United Kingdom
560410,2023-07-18,22672,French Bathroom Sign Blue Metal,11.94,12,17213.0,United Kingdom
560410,2023-07-18,21755,Love Building Block Word,16.35,3,17213.0,United Kingdom
560410,2023-07-18,21749,Large Red Retrospot Windmill,12.4,6,17213.0,United Kingdom
560410,2023-07-18,21746,Small Red Retrospot Windmill,11.53,12,17213.0,United Kingdom
560410,2023-07-18,21523,Doormat Fancy Font Home Sweet Home,18.4,2,17213.0,United Kingdom
560410,2023-07-18,20718,Red Retrospot Shopper Bag,11.53,10,17213.0,United Kingdom
560410,2023-07-18,20717,Strawberry Shopper Bag,11.53,10,17213.0,United Kingdom
560410,2023-07-18,15036,Assorted Colours Silk Fan,11.1,24,17213.0,United Kingdom
560412,2023-07-18,23169,Classic Glass Cookie Jar,14.5,2,12748.0,United Kingdom
560412,2023-07-18,22970,London Bus Coffee Mug,12.86,3,12748.0,United Kingdom
560412,2023-07-18,22971,Queens Guard Coffee Mug,12.86,3,12748.0,United Kingdom
560412,2023-07-18,23243,Set Of Tea Coffee Sugar Tins Pantry,15.32,2,12748.0,United Kingdom
560412,2023-07-18,20718,Red Retrospot Shopper Bag,11.53,4,12748.0,United Kingdom
560412,2023-07-18,20717,Strawberry Shopper Bag,11.53,4,12748.0,United Kingdom
560412,2023-07-18,21936,Red Retrospot Picnic Bag,13.27,2,12748.0,United Kingdom
560412,2023-07-18,22047,Empire Gift Wrap,10.68,25,12748.0,United Kingdom
560412,2023-07-18,22038,Botanical Lavender Gift Wrap,10.68,25,12748.0,United Kingdom
560412,2023-07-18,21930,Jumbo Storage Bag Skulls,12.38,2,12748.0,United Kingdom
560412,2023-07-18,15058B,Pink Polkadot Garden Parasol,18.4,3,12748.0,United Kingdom
560412,2023-07-18,22663,Jumbo Bag Dolly Girl Design,6.19,2,12748.0,United Kingdom
560412,2023-07-18,85099B,Jumbo Bag Red Retrospot,6.19,6,12748.0,United Kingdom
560412,2023-07-18,23202,Jumbo Bag Vintage Leaf,6.19,2,12748.0,United Kingdom
560412,2023-07-18,20712,Jumbo Bag Woodland Animals,6.19,2,12748.0,United Kingdom
560412,2023-07-18,85099F,Jumbo Bag Strawberry,6.19,10,12748.0,United Kingdom
560412,2023-07-18,22386,Jumbo Bag Pink Polkadot,6.19,4,12748.0,United Kingdom
560412,2023-07-18,23200,Jumbo Bag Pears,6.19,4,12748.0,United Kingdom
560412,2023-07-18,23199,Jumbo Bag Apples,6.19,4,12748.0,United Kingdom
560412,2023-07-18,23201,Jumbo Bag Alphabet,6.19,2,12748.0,United Kingdom
560412,2023-07-18,20728,Lunch Bag Cars Blue,5.97,3,12748.0,United Kingdom
560412,2023-07-18,23207,Lunch Bag Alphabet Design,5.97,3,12748.0,United Kingdom
560412,2023-07-18,22382,Lunch Bag Spaceboy Design,5.97,3,12748.0,United Kingdom
560412,2023-07-18,20726,Lunch Bag Woodland,5.97,3,12748.0,United Kingdom
560412,2023-07-18,22384,Lunch Bag Pink Polkadot,5.97,3,12748.0,United Kingdom
560412,2023-07-18,20725,Lunch Bag Red Retrospot,5.97,3,12748.0,United Kingdom
560412,2023-07-18,23206,Lunch Bag Apple Design,5.97,3,12748.0,United Kingdom
560415,2023-07-18,22666,Recipe Box Pantry Yellow Design,13.27,6,15152.0,United Kingdom
560415,2023-07-18,23240,Set Of 4 Knick Knack Tins Doily,14.5,6,15152.0,United Kingdom
560415,2023-07-18,20979,36 Pencils Tube Red Retrospot,11.53,16,15152.0,United Kingdom
