TransactionNo,Date,ProductNo,ProductName,Price,Quantity,CustomerNo,Country
548167,2023-03-29,21218,Red Spotty Biscuit Tin,18.75,1,12167.0,United Kingdom
548167,2023-03-29,21232,Strawberry Ceramic Trinket Pot,13.62,1,12167.0,United Kingdom
548167,2023-03-29,21700,Big Doughnut Fridge Magnets,18.75,1,12167.0,United Kingdom
548167,2023-03-29,21731,Red Toadstool Led Night Light,14.48,3,12167.0,United Kingdom
548167,2023-03-29,21931,Jumbo Storage Bag Suki,14.48,8,12167.0,United Kingdom
548167,2023-03-29,22059,Ceramic Strawberry Design Mug,13.62,1,12167.0,United Kingdom
548167,2023-03-29,22088,Paper Bunting Coloured Lace,14.48,1,12167.0,United Kingdom
548167,2023-03-29,22090,Paper Bunting Retrospot,17.05,1,12167.0,United Kingdom
548167,2023-03-29,22197,Popcorn Holder,11.92,2,12167.0,United Kingdom
548167,2023-03-29,22199,Frying Pan Red Retrospot,18.75,1,12167.0,United Kingdom
548167,2023-03-29,22297,Heart Ivory Trellis Small,12.77,1,12167.0,United Kingdom
548167,2023-03-29,22411,Jumbo Shopper Vintage Red Paisley,14.48,2,12167.0,United Kingdom
548167,2023-03-29,22488,Natural Slate Rectangle Chalkboard,13.62,3,12167.0,United Kingdom
548167,2023-03-29,22499,Wooden Union Jack Bunting,18.75,2,12167.0,United Kingdom
548167,2023-03-29,22502,Picnic Basket Wicker Small,18.75,1,12167.0,United Kingdom
548167,2023-03-29,22518,Childs Garden Brush Blue,14.48,1,12167.0,United Kingdom
548167,2023-03-29,22659,Lunch Box I Love London,12.77,1,12167.0,United Kingdom
548167,2023-03-29,22719,Gumball Monochrome Coat Rack,12.77,1,12167.0,United Kingdom
548167,2023-03-29,22773,Green Drawer Knob Acrylic Edwardian,12.77,10,12167.0,United Kingdom
548167,2023-03-29,72349B,Set/6 Purple Butterfly T-Lights,14.48,1,12167.0,United Kingdom
548167,2023-03-29,75049L,Large Circular Mirror Mobile,12.77,4,12167.0,United Kingdom
548167,2023-03-29,84969,Box Of 6 Assorted Colour Teaspoons,18.75,2,12167.0,United Kingdom
548167,2023-03-29,85132A,Charlie + Lola Biscuits Tins,18.75,1,12167.0,United Kingdom
548167,2023-03-29,20711,Jumbo Bag Toys,7.24,1,12167.0,United Kingdom
548167,2023-03-29,20712,Jumbo Bag Woodland Animals,7.24,2,12167.0,United Kingdom
548167,2023-03-29,20713,Jumbo Bag Owls,7.24,3,12167.0,United Kingdom
548167,2023-03-29,21928,Jumbo Bag Scandinavian Blue Paisley,7.24,1,12167.0,United Kingdom
548167,2023-03-29,22385,Jumbo Bag Spaceboy Design,7.24,1,12167.0,United Kingdom
548167,2023-03-29,22386,Jumbo Bag Pink Polkadot,7.24,4,12167.0,United Kingdom
548167,2023-03-29,85099B,Jumbo Bag Red Retrospot,7.24,2,12167.0,United Kingdom
548167,2023-03-29,20726,Lunch Bag Woodland,7.67,2,12167.0,United Kingdom
548168,2023-03-29,21078,Set/20 Strawberry Paper Napkins,12.77,1,14168.0,United Kingdom
548168,2023-03-29,21116,Owl Doorstop,18.75,1,14168.0,United Kingdom
548168,2023-03-29,21430,Set/3 Red Gingham Rose Storage Box,17.9,1,14168.0,United Kingdom
548168,2023-03-29,21557,Set Of 6 Funky Beakers,16.02,3,14168.0,United Kingdom
548168,2023-03-29,21731,Red Toadstool Led Night Light,14.48,2,14168.0,United Kingdom
548168,2023-03-29,21931,Jumbo Storage Bag Suki,14.48,8,14168.0,United Kingdom
548168,2023-03-29,21935,Suki Shoulder Bag,14.48,1,14168.0,United Kingdom
548168,2023-03-29,22069,Brown Pirate Treasure Chest,14.48,4,14168.0,United Kingdom
548168,2023-03-29,22088,Paper Bunting Coloured Lace,14.48,1,14168.0,United Kingdom
548168,2023-03-29,22196,Small Heart Measuring Spoons,11.92,2,14168.0,United Kingdom
548168,2023-03-29,22212,Four Hook White Lovebirds,14.48,1,14168.0,United Kingdom
548168,2023-03-29,22358,Kings Choice Tea Caddy,16.18,2,14168.0,United Kingdom
548168,2023-03-29,22411,Jumbo Shopper Vintage Red Paisley,14.48,5,14168.0,United Kingdom
548168,2023-03-29,22502,Picnic Basket Wicker Small,18.75,2,14168.0,United Kingdom
548168,2023-03-29,22518,Childs Garden Brush Blue,14.48,1,14168.0,United Kingdom
548168,2023-03-29,22719,Gumball Monochrome Coat Rack,12.77,1,14168.0,United Kingdom
548168,2023-03-29,22961,Jam Making Set Printed,13.62,1,14168.0,United Kingdom
548168,2023-03-29,22966,Gingerbread Man Cookie Cutter,12.77,1,14168.0,United Kingdom
548168,2023-03-29,47566B,Tea Time Party Bunting,18.75,2,14168.0,United Kingdom
548168,2023-03-29,82551,Laundry 15c Metal Sign,12.77,1,14168.0,United Kingdom
548168,2023-03-29,84509A,Set Of 4 English Rose Placemats,17.9,1,14168.0,United Kingdom
548168,2023-03-29,84510A,Set Of 4 English Rose Coasters,12.77,1,14168.0,United Kingdom
548168,2023-03-29,20711,Jumbo Bag Toys,7.24,2,14168.0,United Kingdom
548168,2023-03-29,20712,Jumbo Bag Woodland Animals,7.24,5,14168.0,United Kingdom
548168,2023-03-29,20713,Jumbo Bag Owls,7.24,2,14168.0,United Kingdom
548168,2023-03-29,21033,Jumbo Bag Charlie And Lola Toys,7.24,2,14168.0,United Kingdom
548168,2023-03-29,21928,Jumbo Bag Scandinavian Blue Paisley,7.24,2,14168.0,United Kingdom
548168,2023-03-29,20726,Lunch Bag Woodland,7.67,1,14168.0,United Kingdom
548169,2023-03-29,47566,Party Bunting,14.5,50,14680.0,United Kingdom
548169,2023-03-29,21937,Strawberry Picnic Bag,13.27,10,14680.0,United Kingdom
548169,2023-03-29,21936,Red Retrospot Picnic Bag,13.27,20,14680.0,United Kingdom
548169,2023-03-29,20724,Red Retrospot Charlotte Bag,11.12,20,14680.0,United Kingdom
548169,2023-03-29,22356,Charlotte Bag Pink Polkadot,11.12,20,14680.0,United Kingdom
548169,2023-03-29,21731,Red Toadstool Led Night Light,11.94,24,14680.0,United Kingdom
548169,2023-03-29,22628,Picnic Boxes Set Of 3 Retrospot,15.32,8,14680.0,United Kingdom
548169,2023-03-29,79321,Chilli Lights,15.32,48,14680.0,United Kingdom
548169,2023-03-29,21559,Strawberry Lunch Box With Cutlery,12.86,10,14680.0,United Kingdom
548169,2023-03-29,22327,Round Snack Boxes Set Of 4 Skulls,13.27,10,14680.0,United Kingdom
548169,2023-03-29,47559B,Tea Time Oven Glove,11.53,7,14680.0,United Kingdom
548169,2023-03-29,20914,Set/5 Red Retrospot Lid Glass Bowls,13.27,8,14680.0,United Kingdom
548169,2023-03-29,21154,Red Retrospot Oven Glove,11.53,7,14680.0,United Kingdom
548169,2023-03-29,21213,Pack Of 72 Skull Cake Cases,10.81,72,14680.0,United Kingdom
548169,2023-03-29,21212,Pack Of 72 Retrospot Cake Cases,10.81,72,14680.0,United Kingdom
548169,2023-03-29,84991,60 Teatime Fairy Cake Cases,10.81,72,14680.0,United Kingdom
548169,2023-03-29,84992,72 Sweetheart Fairy Cake Cases,10.81,72,14680.0,United Kingdom
548169,2023-03-29,22667,Recipe Box Retrospot,12.86,36,14680.0,United Kingdom
548169,2023-03-29,21430,Set/3 Red Gingham Rose Storage Box,13.72,24,14680.0,United Kingdom
548169,2023-03-29,21930,Jumbo Storage Bag Skulls,11.94,100,14680.0,United Kingdom
548169,2023-03-29,85099C,Jumbo Bag Baroque Black White,6.13,10,14680.0,United Kingdom
548169,2023-03-29,22386,Jumbo Bag Pink Polkadot,5.97,100,14680.0,United Kingdom
548169,2023-03-29,20712,Jumbo Bag Woodland Animals,5.97,100,14680.0,United Kingdom
548169,2023-03-29,20728,Lunch Bag Cars Blue,5.97,10,14680.0,United Kingdom
548169,2023-03-29,20727,Lunch Bag Black Skull,5.97,20,14680.0,United Kingdom
548169,2023-03-29,22384,Lunch Bag Pink Polkadot,5.97,20,14680.0,United Kingdom
548169,2023-03-29,20725,Lunch Bag Red Retrospot,5.87,100,14680.0,United Kingdom
548169,2023-03-29,22383,Lunch Bag Suki Design,5.87,100,14680.0,United Kingdom
548169,2023-03-29,20726,Lunch Bag Woodland,5.87,100,14680.0,United Kingdom
548170,2023-03-29,22084,Paper Chain Kit Empire,13.27,6,15290.0,United Kingdom
548170,2023-03-29,22908,Pack Of 20 Napkins Red Apples,11.12,12,15290.0,United Kingdom
548170,2023-03-29,21621,Vintage Union Jack Bunting,18.96,8,15290.0,United Kingdom
548170,2023-03-29,21704,Bag 250g Swirly Marbles,11.12,24,15290.0,United Kingdom
548170,2023-03-29,21078,Set/20 Strawberry Paper Napkins,11.12,12,15290.0,United Kingdom
548170,2023-03-29,22808,Set Of 6 T-Lights Easter Chicks,13.27,6,15290.0,United Kingdom
548170,2023-03-29,22568,Feltcraft Cushion Owl,14.09,16,15290.0,United Kingdom
548170,2023-03-29,22150,3 Stripey Mice Feltcraft,12.25,24,15290.0,United Kingdom
548171,2023-03-29,21094,Set/6 Red Spotty Paper Plates,10.91,96,16422.0,United Kingdom
548171,2023-03-29,21080,Set/20 Red Retrospot Paper Napkins,10.99,96,16422.0,United Kingdom
548171,2023-03-29,22333,Retrospot Party Bag + Sticker Set,11.74,48,16422.0,United Kingdom
548171,2023-03-29,17003,Brocade Ring Purse,10.51,720,16422.0,United Kingdom
548171,2023-03-29,22090,Paper Bunting Retrospot,12.86,40,16422.0,United Kingdom
548171,2023-03-29,47566B,Tea Time Party Bunting,15.32,20,16422.0,United Kingdom
548171,2023-03-29,22262,Felt Egg Cosy Chicken,11.12,36,16422.0,United Kingdom
548171,2023-03-29,22260,Felt Egg Cosy Blue Rabbit,11.12,48,16422.0,United Kingdom
548171,2023-03-29,22432,Watering Can Pink Bunny,12.25,18,16422.0,United Kingdom
548171,2023-03-29,22433,Watering Can Green Dinosaur,12.25,12,16422.0,United Kingdom
548171,2023-03-29,22084,Paper Chain Kit Empire,12.86,40,16422.0,United Kingdom
548171,2023-03-29,22499,Wooden Union Jack Bunting,16.35,21,16422.0,United Kingdom
548171,2023-03-29,22525,Childrens Garden Gloves Pink,11.53,10,16422.0,United Kingdom
548171,2023-03-29,22524,Childrens Garden Gloves Blue,11.53,10,16422.0,United Kingdom
548172,2023-03-29,47566B,Tea Time Party Bunting,15.32,4,15738.0,United Kingdom
548172,2023-03-29,47590A,Blue Happy Birthday Bunting,15.84,3,15738.0,United Kingdom
548172,2023-03-29,47599A,Pink Party Bags,12.4,6,15738.0,United Kingdom
548172,2023-03-29,10133,Colouring Pencils Brown Tube,11.12,10,15738.0,United Kingdom
548172,2023-03-29,21080,Set/20 Red Retrospot Paper Napkins,11.12,36,15738.0,United Kingdom
548172,2023-03-29,84997D,Childrens Cutlery Polkadot Pink,14.5,4,15738.0,United Kingdom
548172,2023-03-29,22090,Paper Bunting Retrospot,13.27,18,15738.0,United Kingdom
548172,2023-03-29,84997B,Childrens Cutlery Retrospot Red,14.5,4,15738.0,United Kingdom
548172,2023-03-29,20974,12 Pencils Small Tube Skull,10.92,24,15738.0,United Kingdom
548172,2023-03-29,22333,Retrospot Party Bag + Sticker Set,11.94,32,15738.0,United Kingdom
548172,2023-03-29,21238,Red Retrospot Cup,11.12,16,15738.0,United Kingdom
548172,2023-03-29,21086,Set/6 Red Spotty Paper Cups,10.92,48,15738.0,United Kingdom
548172,2023-03-29,21094,Set/6 Red Spotty Paper Plates,11.12,48,15738.0,United Kingdom
548176,2023-03-29,85194S,Hanging Spring Flower Egg Small,10.92,10,13439.0,United Kingdom
548176,2023-03-29,85199S,Small Hanging Ivory/Red Wood Bird,10.68,6,13439.0,United Kingdom
548176,2023-03-29,85204,Hanging Wood And Felt Flower,10.68,5,13439.0,United Kingdom
548176,2023-03-29,85202,Hanging Wood And Felt Heart,10.68,6,13439.0,United Kingdom
548176,2023-03-29,20794,Blue Tile Hook,12.86,3,13439.0,United Kingdom
548176,2023-03-29,22241,Garland Wooden Happy Easter,11.53,2,13439.0,United Kingdom
548176,2023-03-29,20682,Red Retrospot Childrens Umbrella,13.58,1,13439.0,United Kingdom
548176,2023-03-29,22637,Piggy Bank Retrospot,12.86,1,13439.0,United Kingdom
548176,2023-03-29,22645,Ceramic Heart Fairy Cake Money Bank,11.74,2,13439.0,United Kingdom
548176,2023-03-29,22773,Green Drawer Knob Acrylic Edwardian,11.53,2,13439.0,United Kingdom
548176,2023-03-29,84789,Enchanted Bird Plant Cage,14.09,2,13439.0,United Kingdom
548176,2023-03-29,22173,Metal 4 Hook Hanger French Chateau,13.27,2,13439.0,United Kingdom
548176,2023-03-29,85211,S/4 Groovy Cat Magnets,11.94,2,13439.0,United Kingdom
548176,2023-03-29,21644,Assorted Tutti Frutti Heart Box,11.53,4,13439.0,United Kingdom
548176,2023-03-29,22245,Hook 1 Hanger Magic Garden,11.12,4,13439.0,United Kingdom
548176,2023-03-29,22244,3 Hook Hanger Magic Garden,12.25,2,13439.0,United Kingdom
548176,2023-03-29,22212,Four Hook White Lovebirds,12.4,2,13439.0,United Kingdom
548176,2023-03-29,21642,Assorted Tutti Frutti Pen,11.12,8,13439.0,United Kingdom
548176,2023-03-29,75131,Metal Tube Chime On Bamboo,11.98,3,13439.0,United Kingdom
548176,2023-03-29,71459,Hanging Jam Jar T-Light Holders,11.12,12,13439.0,United Kingdom
548176,2023-03-29,21715,Girls Vintage Tin Seaside Bucket,12.86,8,13439.0,United Kingdom
548176,2023-03-29,22465,Hanging Metal Star Lantern,11.94,6,13439.0,United Kingdom
548176,2023-03-29,22464,Hanging Metal Heart Lantern,11.94,6,13439.0,United Kingdom
548176,2023-03-29,20845,Zinc Heart Lattice 2 Wall Planter,16.76,2,13439.0,United Kingdom
548176,2023-03-29,20829,Glitter Hanging Butterfly String,12.4,2,13439.0,United Kingdom
548176,2023-03-29,22088,Paper Bunting Coloured Lace,13.27,2,13439.0,United Kingdom
548176,2023-03-29,17003,Brocade Ring Purse,10.55,36,13439.0,United Kingdom
548176,2023-03-29,22147,Feltcraft Butterfly Hearts,11.74,2,13439.0,United Kingdom
548176,2023-03-29,22150,3 Stripey Mice Feltcraft,12.25,2,13439.0,United Kingdom
548176,2023-03-29,21891,Traditional Wooden Skipping Rope,11.53,2,13439.0,United Kingdom
548176,2023-03-29,21892,Traditional Wooden Catch Cup Game,11.53,2,13439.0,United Kingdom
548176,2023-03-29,22139,Retrospot Tea Set Ceramic 11 Pc,15.32,1,13439.0,United Kingdom
548176,2023-03-29,22178,Victorian Glass Hanging T-Light,11.53,6,13439.0,United Kingdom
548176,2023-03-29,16015,Medium Chinese Style Scissor,10.76,10,13439.0,United Kingdom
548176,2023-03-29,16016,Large Chinese Style Scissor,11.12,10,13439.0,United Kingdom
548176,2023-03-29,22431,Watering Can Blue Elephant,12.25,1,13439.0,United Kingdom
548176,2023-03-29,22433,Watering Can Green Dinosaur,12.25,1,13439.0,United Kingdom
548176,2023-03-29,72351A,Set/6 Turquoise Butterfly T-Lights,12.4,1,13439.0,United Kingdom
548176,2023-03-29,72351B,Set/6 Pink Butterfly T-Lights,12.4,1,13439.0,United Kingdom
548176,2023-03-29,21317,Glass Sphere Candle Stand Medium,15.84,2,13439.0,United Kingdom
548176,2023-03-29,21714,Citronella Candle Garden Pot,11.53,6,13439.0,United Kingdom
548176,2023-03-29,22336,Dove Decoration Painted Zinc,10.92,10,13439.0,United Kingdom
548176,2023-03-29,21383,Pack Of 12 Sticky Bunnies,10.92,10,13439.0,United Kingdom
548176,2023-03-29,22285,Hanging Hen On Nest Decoration,11.94,1,13439.0,United Kingdom
548176,2023-03-29,22284,Hen House Decoration,11.94,1,13439.0,United Kingdom
548176,2023-03-29,22291,Hanging Chick Cream Decoration,11.74,2,13439.0,United Kingdom
548176,2023-03-29,22293,Hanging Chick Green Decoration,11.74,4,13439.0,United Kingdom
548176,2023-03-29,22219,Lovebird Hanging Decoration White,11.12,4,13439.0,United Kingdom
548176,2023-03-29,75178,Asstd Col Butterfly/Crystal W/Chime,11.53,3,13439.0,United Kingdom
548176,2023-03-29,84971S,Small Heart Flowers Hook,11.12,8,13439.0,United Kingdom
548176,2023-03-29,84715,Set Of 6 Ice Cream Skittles,13.27,4,13439.0,United Kingdom
548176,2023-03-29,21390,Filigris Heart With Butterfly,11.53,3,13439.0,United Kingdom
548176,2023-03-29,44234,Assorted Circular Mobile,10.47,2,13439.0,United Kingdom
548176,2023-03-29,44235,Assorted Coloured Circle Mobile,10.68,2,13439.0,United Kingdom
548177,2023-03-29,79160,Heart Shape Wireless Doorbell,12.4,12,12888.0,United Kingdom
548177,2023-03-29,21137,Black Record Cover Frame,13.72,24,12888.0,United Kingdom
548178,2023-03-29,84978,Hanging Heart Jar T-Light Holder,11.53,12,14367.0,United Kingdom
548178,2023-03-29,22993,Set Of 4 Pantry Jelly Moulds,11.53,12,14367.0,United Kingdom
548178,2023-03-29,47566B,Tea Time Party Bunting,15.32,12,14367.0,United Kingdom
548178,2023-03-29,22334,Dinosaur Party Bag + Sticker Set,11.94,8,14367.0,United Kingdom
548178,2023-03-29,22668,Pink Baby Bunting,13.27,5,14367.0,United Kingdom
548178,2023-03-29,22781,Gumball Magazine Rack,18.09,2,14367.0,United Kingdom
548178,2023-03-29,22147,Feltcraft Butterfly Hearts,11.74,12,14367.0,United Kingdom
548178,2023-03-29,22149,Feltcraft 6 Flower Friends,12.4,6,14367.0,United Kingdom
548178,2023-03-29,22318,Five Heart Hanging Decoration,13.27,6,14367.0,United Kingdom
548178,2023-03-29,20723,Strawberry Charlotte Bag,11.12,10,14367.0,United Kingdom
548178,2023-03-29,20829,Glitter Hanging Butterfly String,12.4,8,14367.0,United Kingdom
548178,2023-03-29,21213,Pack Of 72 Skull Cake Cases,10.81,24,14367.0,United Kingdom
548178,2023-03-29,21080,Set/20 Red Retrospot Paper Napkins,11.12,12,14367.0,United Kingdom
548178,2023-03-29,21975,Pack Of 60 Dinosaur Cake Cases,10.81,24,14367.0,United Kingdom
548178,2023-03-29,21972,Set Of 36 Dinosaur Paper Doilies,11.74,12,14367.0,United Kingdom
548178,2023-03-29,22851,Set 20 Napkins Fairy Cakes Design,11.12,12,14367.0,United Kingdom
548178,2023-03-29,84992,72 Sweetheart Fairy Cake Cases,10.81,24,14367.0,United Kingdom
548178,2023-03-29,84991,60 Teatime Fairy Cake Cases,10.81,24,14367.0,United Kingdom
548178,2023-03-29,47566,Party Bunting,15.32,12,14367.0,United Kingdom
548178,2023-03-29,85123A,Cream Hanging Heart T-Light Holder,13.27,12,14367.0,United Kingdom
548178,2023-03-29,21985,Pack Of 12 Hearts Design Tissues,10.55,24,14367.0,United Kingdom
548178,2023-03-29,22457,Natural Slate Heart Chalkboard,13.27,6,14367.0,United Kingdom
548178,2023-03-29,85099B,Jumbo Bag Red Retrospot,6.13,10,14367.0,United Kingdom
548178,2023-03-29,22382,Lunch Bag Spaceboy Design,5.97,10,14367.0,United Kingdom
548178,2023-03-29,22384,Lunch Bag Pink Polkadot,5.97,10,14367.0,United Kingdom
548178,2023-03-29,20727,Lunch Bag Black Skull,5.97,10,14367.0,United Kingdom
548185,2023-03-29,21181,Please One Person Metal Sign,12.4,12,15628.0,United Kingdom
548185,2023-03-29,21870,I Can Only Please One Person Mug,11.53,12,15628.0,United Kingdom
548185,2023-03-29,22961,Jam Making Set Printed,11.74,12,15628.0,United Kingdom
548185,2023-03-29,20685,Doormat Red Retrospot,18.4,2,15628.0,United Kingdom
548185,2023-03-29,21524,Doormat Spotty Home Sweet Home,18.4,2,15628.0,United Kingdom
548185,2023-03-29,21232,Strawberry Ceramic Trinket Pot,11.53,12,15628.0,United Kingdom
548185,2023-03-29,84978,Hanging Heart Jar T-Light Holder,11.53,12,15628.0,United Kingdom
548185,2023-03-29,85123A,Cream Hanging Heart T-Light Holder,13.27,12,15628.0,United Kingdom
548185,2023-03-29,22077,6 Ribbons Rustic Charm,11.94,12,15628.0,United Kingdom
548185,2023-03-29,22993,Set Of 4 Pantry Jelly Moulds,11.53,12,15628.0,United Kingdom
548185,2023-03-29,22570,Feltcraft Cushion Rabbit,14.09,4,15628.0,United Kingdom
548185,2023-03-29,21528,Dairy Maid Traditional Teapot,17.37,2,15628.0,United Kingdom
548185,2023-03-29,22558,Clothes Pegs Retrospot Pack 24,11.78,12,15628.0,United Kingdom
548185,2023-03-29,22138,Baking Set 9 Piece Retrospot,15.32,3,15628.0,United Kingdom
548185,2023-03-29,22617,Baking Set Spaceboy Design,15.32,3,15628.0,United Kingdom
548185,2023-03-29,37495,Fairy Cake Birthday Candle Set,14.09,4,15628.0,United Kingdom
548185,2023-03-29,20971,Pink Blue Felt Craft Trinket Box,11.53,12,15628.0,United Kingdom
548185,2023-03-29,21155,Red Retrospot Peg Bag,12.86,6,15628.0,United Kingdom
548185,2023-03-29,22175,Pink Owl Soft Toy,13.27,6,15628.0,United Kingdom
548185,2023-03-29,21544,Skulls Water Transfer Tattoos,11.12,12,15628.0,United Kingdom
548185,2023-03-29,82494L,Wooden Frame Antique White,13.27,6,15628.0,United Kingdom
548185,2023-03-29,21534,Dairy Maid Large Milk Jug,15.32,3,15628.0,United Kingdom
548186,2023-03-29,21232,Strawberry Ceramic Trinket Pot,11.34,24,13777.0,United Kingdom
548186,2023-03-29,22041,"Record Frame 7"" Single Size",12.4,48,13777.0,United Kingdom
548186,2023-03-29,85123A,Cream Hanging Heart T-Light Holder,12.86,72,13777.0,United Kingdom
548186,2023-03-29,20679,Edwardian Parasol Red,14.96,12,13777.0,United Kingdom
548186,2023-03-29,85038,6 Chocolate Love Heart T-Lights,11.98,24,13777.0,United Kingdom
548186,2023-03-29,21107,Cream Slice Flannel Pink Spot,12.86,24,13777.0,United Kingdom
548186,2023-03-29,20725,Lunch Bag Red Retrospot,5.87,30,13777.0,United Kingdom
548186,2023-03-29,20727,Lunch Bag Black Skull,5.87,20,13777.0,United Kingdom
548188,2023-03-29,21171,Bathroom Metal Sign,11.74,2,13263.0,United Kingdom
548188,2023-03-29,21908,Chocolate This Way Metal Sign,12.4,3,13263.0,United Kingdom
548188,2023-03-29,21770,Open Closed Metal Sign,15.32,1,13263.0,United Kingdom
548188,2023-03-29,21903,Man Flu Metal Sign,12.4,2,13263.0,United Kingdom
548188,2023-03-29,23182,Toilet Sign Occupied Or Vacant,11.1,3,13263.0,United Kingdom
548188,2023-03-29,22916,Herb Marker Thyme,10.92,2,13263.0,United Kingdom
548188,2023-03-29,22917,Herb Marker Rosemary,10.92,2,13263.0,United Kingdom
548188,2023-03-29,22918,Herb Marker Parsley,10.92,2,13263.0,United Kingdom
548188,2023-03-29,22921,Herb Marker Chives,10.92,2,13263.0,United Kingdom
548188,2023-03-29,22920,Herb Marker Basil,10.92,2,13263.0,United Kingdom
548188,2023-03-29,22919,Herb Marker Mint,10.92,2,13263.0,United Kingdom
548188,2023-03-29,85053,French Enamel Candleholder,12.4,1,13263.0,United Kingdom
548188,2023-03-29,21038,Set/4 Modern Vintage Cotton Napkins,11.06,2,13263.0,United Kingdom
548188,2023-03-29,85123A,Cream Hanging Heart T-Light Holder,13.27,1,13263.0,United Kingdom
548188,2023-03-29,82494L,Wooden Frame Antique White,13.27,2,13263.0,United Kingdom
548188,2023-03-29,85231B,Cinammon Set Of 9 T-Lights,11.12,2,13263.0,United Kingdom
548188,2023-03-29,22077,6 Ribbons Rustic Charm,11.94,4,13263.0,United Kingdom
548188,2023-03-29,21755,Love Building Block Word,16.35,1,13263.0,United Kingdom
548188,2023-03-29,22652,Travel Sewing Kit,11.94,2,13263.0,United Kingdom
548188,2023-03-29,22558,Clothes Pegs Retrospot Pack 24,11.78,4,13263.0,United Kingdom
548188,2023-03-29,20751,Funky Washing Up Gloves Assorted,12.4,2,13263.0,United Kingdom
548188,2023-03-29,20754,Retrospot Red Washing Up Gloves,12.4,4,13263.0,United Kingdom
548188,2023-03-29,20665,Red Retrospot Purse,13.27,1,13263.0,United Kingdom
548188,2023-03-29,21069,Vintage Billboard Tea Mug,11.53,2,13263.0,United Kingdom
548188,2023-03-29,21070,Vintage Billboard Mug,11.53,2,13263.0,United Kingdom
548188,2023-03-29,22892,Set Of Salt And Pepper Toadstools,11.53,2,13263.0,United Kingdom
548188,2023-03-29,22907,Pack Of 20 Napkins Pantry Design,11.12,2,13263.0,United Kingdom
548188,2023-03-29,22993,Set Of 4 Pantry Jelly Moulds,11.53,1,13263.0,United Kingdom
548188,2023-03-29,22722,Set Of 6 Spice Tins Pantry Design,14.3,1,13263.0,United Kingdom
548188,2023-03-29,22667,Recipe Box Retrospot,13.27,1,13263.0,United Kingdom
548188,2023-03-29,22994,Travel Card Wallet Retrospot,10.68,1,13263.0,United Kingdom
548188,2023-03-29,22998,Travel Card Wallet Keep Calm,10.68,3,13263.0,United Kingdom
548188,2023-03-29,23003,Travel Card Wallet Vintage Rose,10.68,3,13263.0,United Kingdom
548188,2023-03-29,23004,Travel Card Wallet Pantry,10.68,2,13263.0,United Kingdom
548188,2023-03-29,22999,Travel Card Wallet Vintage Leaf,10.68,3,13263.0,United Kingdom
548188,2023-03-29,23006,Travel Card Wallet Flower Meadow,10.68,2,13263.0,United Kingdom
548188,2023-03-29,16161P,Wrap English Rose,10.68,25,13263.0,United Kingdom
548188,2023-03-29,22050,Pink Paisley Rose Gift Wrap,10.68,25,13263.0,United Kingdom
548188,2023-03-29,84313C,Orange Tv Tray Table,12.25,1,13263.0,United Kingdom
548188,2023-03-29,21171,Bathroom Metal Sign,10.81,4,13263.0,United Kingdom
548188,2023-03-29,82581,Toilet Metal Sign,10.81,4,13263.0,United Kingdom
548188,2023-03-29,21181,Please One Person Metal Sign,12.4,6,13263.0,United Kingdom
548188,2023-03-29,21166,Cook With Wine Metal Sign,12.38,6,13263.0,United Kingdom
548188,2023-03-29,21172,Party Metal Sign,11.74,2,13263.0,United Kingdom
548188,2023-03-29,85152,Hand Over The Chocolate Sign,12.4,5,13263.0,United Kingdom
548188,2023-03-29,85150,Ladies & Gentlemen Metal Sign,12.86,4,13263.0,United Kingdom
548188,2023-03-29,82582,Area Patrolled Metal Sign,12.4,4,13263.0,United Kingdom
548188,2023-03-29,21165,Beware Of The Cat Metal Sign,11.98,4,13263.0,United Kingdom
548188,2023-03-29,21175,Gin And Tonic Diet Metal Sign,12.86,6,13263.0,United Kingdom
548188,2023-03-29,21174,Pottering In The Shed Metal Sign,12.38,2,13263.0,United Kingdom
548189,2023-03-29,23193,Buffalo Bill Treasure Book Box,12.56,8,16607.0,United Kingdom
548189,2023-03-29,23177,Treasure Island Book Box,12.56,8,16607.0,United Kingdom
548189,2023-03-29,16156L,Wrap Carousel,10.68,25,16607.0,United Kingdom
548189,2023-03-29,22048,Birthday Banquet Gift Wrap,10.68,25,16607.0,United Kingdom
548189,2023-03-29,22704,Wrap Red Apples,10.68,25,16607.0,United Kingdom
548189,2023-03-29,23233,Wrap Poppies Design,10.68,25,16607.0,United Kingdom
548189,2023-03-29,22668,Pink Baby Bunting,13.27,5,16607.0,United Kingdom
548189,2023-03-29,22619,Set Of 6 Soldier Skittles,14.09,4,16607.0,United Kingdom
548189,2023-03-29,21982,Pack Of 12 Suki Tissues,10.55,24,16607.0,United Kingdom
548189,2023-03-29,22332,Skulls Party Bag + Sticker Set,11.94,8,16607.0,United Kingdom
548189,2023-03-29,21581,Skulls Design Cotton Tote Bag,12.56,6,16607.0,United Kingdom
548190,2023-03-29,21154,Red Retrospot Oven Glove,11.53,9,17511.0,United Kingdom
548190,2023-03-29,21041,Red Retrospot Oven Glove Double,13.27,6,17511.0,United Kingdom
548190,2023-03-29,47570B,Tea Time Table Cloth,18.95,27,17511.0,United Kingdom
548191,2023-03-29,21377,Small Camphor Wood Field Mushroom,13.62,1,16191.0,United Kingdom
548191,2023-03-29,21382,Set/4 Spring Flower Decoration,16.18,1,16191.0,United Kingdom
548191,2023-03-29,21383,Pack Of 12 Sticky Bunnies,11.92,1,16191.0,United Kingdom
548191,2023-03-29,21385,Ivory Hanging Decoration Heart,11.92,1,16191.0,United Kingdom
548191,2023-03-29,21417,Cockle Shell Dish,14.48,1,16191.0,United Kingdom
548191,2023-03-29,21430,Set/3 Red Gingham Rose Storage Box,17.9,1,16191.0,United Kingdom
548191,2023-03-29,21439,Basket Of Toadstools,12.77,1,16191.0,United Kingdom
548191,2023-03-29,21455,Painted Yellow Wooden Daisy,11.1,3,16191.0,United Kingdom
548191,2023-03-29,21458,2 Picture Book Eggs Easter Bunny,12.77,3,16191.0,United Kingdom
548191,2023-03-29,21559,Strawberry Lunch Box With Cutlery,15.33,1,16191.0,United Kingdom
548191,2023-03-29,21561,Dinosaur Lunch Box With Cutlery,15.33,1,16191.0,United Kingdom
548191,2023-03-29,21656,Ridged Glass Posy Vase,13.62,1,16191.0,United Kingdom
548191,2023-03-29,21731,Red Toadstool Led Night Light,13.62,1,16191.0,United Kingdom
548191,2023-03-29,21750,Large Skull Windmill,14.48,1,16191.0,United Kingdom
548191,2023-03-29,21774,Decorative Cats Bathroom Bottle,12.77,1,16191.0,United Kingdom
