TransactionNo,Date,ProductNo,ProductName,Price,Quantity,CustomerNo,Country
566048,2023-09-08,23394,Poste France Cushion Cover,14.09,4,16558.0,United Kingdom
566048,2023-09-08,46000M,Polyester Filler Pad 45x45cm,11.84,12,16558.0,United Kingdom
566048,2023-09-08,46000S,Polyester Filler Pad 40x40cm,11.74,4,16558.0,United Kingdom
566048,2023-09-08,23203,Jumbo Bag Vintage Doily,6.19,10,16558.0,United Kingdom
566049,2023-09-08,85048,15cm Christmas Glass Ball 20 Lights,18.4,2,15730.0,United Kingdom
566049,2023-09-08,21741,Cosy Slipper Shoes Large Green,13.27,6,15730.0,United Kingdom
566049,2023-09-08,84030E,English Rose Hot Water Bottle,14.61,4,15730.0,United Kingdom
566049,2023-09-08,84970L,Single Heart Zinc T-Light Holder,11.53,12,15730.0,United Kingdom
566049,2023-09-08,23318,Box Of 6 Mini Vintage Crackers,12.8,6,15730.0,United Kingdom
566049,2023-09-08,23349,Roll Wrap Vintage Christmas,11.53,12,15730.0,United Kingdom
566049,2023-09-08,16169E,Wrap 50'S Christmas,10.68,25,15730.0,United Kingdom
566049,2023-09-08,23351,Roll Wrap 50'S Christmas,11.53,12,15730.0,United Kingdom
566049,2023-09-08,16156L,Wrap Carousel,10.68,25,15730.0,United Kingdom
566049,2023-09-08,22720,Set Of 3 Cake Tins Pantry Design,15.32,3,15730.0,United Kingdom
566049,2023-09-08,23079,Toadstool Bedside Light,19.42,2,15730.0,United Kingdom
566049,2023-09-08,21068,Vintage Billboard Love/Hate Mug,11.53,12,15730.0,United Kingdom
566049,2023-09-08,21873,If You Can't Stand The Heat Mug,11.53,12,15730.0,United Kingdom
566049,2023-09-08,84086C,Pink/Purple Retro Radio,13.27,6,15730.0,United Kingdom
566049,2023-09-08,23181,Bull Dog Bottle Top Wall Clock,18.71,4,15730.0,United Kingdom
566049,2023-09-08,85135C,Red Dragonfly Helicopter,18.4,4,15730.0,United Kingdom
566049,2023-09-08,23307,Set Of 60 Pantry Design Cake Cases,10.81,24,15730.0,United Kingdom
566049,2023-09-08,23184,Bull Dog Bottle Opener,15.32,4,15730.0,United Kingdom
566050,2023-09-08,22941,Christmas Lights 10 Reindeer,18.96,2,13854.0,United Kingdom
566050,2023-09-08,22778,Glass Cloche Small,13.72,24,13854.0,United Kingdom
566050,2023-09-08,21264,White Goose Feather Tree 60cm,12.25,12,13854.0,United Kingdom
566050,2023-09-08,84879,Assorted Colour Bird Ornament,11.98,16,13854.0,United Kingdom
566051,2023-09-08,21136,Painted Metal Pears Assorted,11.98,8,15198.0,United Kingdom
566051,2023-09-08,22596,Christmas Star Wish List Chalkboard,11.53,12,15198.0,United Kingdom
566051,2023-09-08,23268,Set Of 2 Ceramic Christmas Reindeer,11.74,12,15198.0,United Kingdom
566051,2023-09-08,84347,Rotating Silver Angels T-Light Hldr,12.86,12,15198.0,United Kingdom
566051,2023-09-08,47504K,English Rose Garden Secateurs,11.06,12,15198.0,United Kingdom
566052,2023-09-08,23086,Zinc Star T-Light Holder,11.53,64,13199.0,United Kingdom
566052,2023-09-08,22993,Set Of 4 Pantry Jelly Moulds,11.53,24,13199.0,United Kingdom
566052,2023-09-08,84947,Antique Silver Tea Glass Engraved,11.34,72,13199.0,United Kingdom
566053,2023-09-08,72586,Set Of 6 Halloween Ghost T-Lights,10.68,4,14410.0,United Kingdom
566053,2023-09-08,22960,Jam Making Set With Jars,14.61,3,14410.0,United Kingdom
566053,2023-09-08,23297,Set 40 Heart Shape Petit Four Cases,11.94,2,14410.0,United Kingdom
566053,2023-09-08,21915,Red Harmonica In Box,11.53,2,14410.0,United Kingdom
566053,2023-09-08,21914,Blue Harmonica In Box,11.53,2,14410.0,United Kingdom
566053,2023-09-08,22620,4 Traditional Spinning Tops,11.74,2,14410.0,United Kingdom
566053,2023-09-08,22414,Doormat Neighbourhood Witch,18.71,1,14410.0,United Kingdom
566053,2023-09-08,23241,Treasure Tin Gymkhana Design,12.38,2,14410.0,United Kingdom
566053,2023-09-08,22203,Milk Pan Red Retrospot,14.09,1,14410.0,United Kingdom
566053,2023-09-08,22174,Photo Cube,11.94,1,14410.0,United Kingdom
566053,2023-09-08,22652,Travel Sewing Kit,11.94,2,14410.0,United Kingdom
566053,2023-09-08,21181,Please One Person Metal Sign,12.4,1,14410.0,United Kingdom
566053,2023-09-08,21175,Gin And Tonic Diet Metal Sign,12.86,1,14410.0,United Kingdom
566053,2023-09-08,82600,N0 Singing Metal Sign,12.4,1,14410.0,United Kingdom
566053,2023-09-08,21165,Beware Of The Cat Metal Sign,11.98,1,14410.0,United Kingdom
566053,2023-09-08,23426,Metal Sign Drop Your Pants,13.21,1,14410.0,United Kingdom
566053,2023-09-08,21166,Cook With Wine Metal Sign,12.38,1,14410.0,United Kingdom
566053,2023-09-08,22412,Metal Sign Neighbourhood Witch,12.4,4,14410.0,United Kingdom
566053,2023-09-08,21179,No Junk Mail Metal Sign,10.65,2,14410.0,United Kingdom
566053,2023-09-08,20718,Red Retrospot Shopper Bag,11.53,2,14410.0,United Kingdom
566053,2023-09-08,23301,Gardeners Kneeling Pad Keep Calm,11.94,2,14410.0,United Kingdom
566053,2023-09-08,23300,Gardeners Kneeling Pad Cup Of Tea,11.94,2,14410.0,United Kingdom
566053,2023-09-08,20717,Strawberry Shopper Bag,11.53,2,14410.0,United Kingdom
566053,2023-09-08,23307,Set Of 60 Pantry Design Cake Cases,10.81,2,14410.0,United Kingdom
566053,2023-09-08,22970,London Bus Coffee Mug,12.86,3,14410.0,United Kingdom
566053,2023-09-08,22973,Children's Circus Parade Mug,11.94,1,14410.0,United Kingdom
566053,2023-09-08,22988,Soldiers Egg Cup,11.53,2,14410.0,United Kingdom
566053,2023-09-08,21975,Pack Of 60 Dinosaur Cake Cases,10.81,2,14410.0,United Kingdom
566053,2023-09-08,84992,72 Sweetheart Fairy Cake Cases,10.81,3,14410.0,United Kingdom
566053,2023-09-08,22951,60 Cake Cases Dolly Girl Design,10.81,2,14410.0,United Kingdom
566053,2023-09-08,21213,Pack Of 72 Skull Cake Cases,10.81,2,14410.0,United Kingdom
566053,2023-09-08,22417,Pack Of 60 Spaceboy Cake Cases,10.81,2,14410.0,United Kingdom
566053,2023-09-08,21212,Pack Of 72 Retrospot Cake Cases,10.81,2,14410.0,United Kingdom
566053,2023-09-08,84991,60 Teatime Fairy Cake Cases,10.81,2,14410.0,United Kingdom
566053,2023-09-08,23309,Set Of 60 I Love London Cake Cases,10.81,2,14410.0,United Kingdom
566053,2023-09-08,21976,Pack Of 60 Mushroom Cake Cases,10.81,2,14410.0,United Kingdom
566053,2023-09-08,20724,Red Retrospot Charlotte Bag,11.12,1,14410.0,United Kingdom
566053,2023-09-08,22356,Charlotte Bag Pink Polkadot,11.12,1,14410.0,United Kingdom
566053,2023-09-08,22661,Charlotte Bag Dolly Girl Design,11.12,2,14410.0,United Kingdom
566053,2023-09-08,23205,Charlotte Bag Vintage Alphabet,11.12,2,14410.0,United Kingdom
566053,2023-09-08,20728,Lunch Bag Cars Blue,5.97,1,14410.0,United Kingdom
566054,2023-09-08,22812,Pack 3 Boxes Christmas Panettone,12.25,12,12592.0,Germany
566054,2023-09-08,22629,Spaceboy Lunch Box,12.25,12,12592.0,Germany
566054,2023-09-08,20719,Woodland Charlotte Bag,11.12,20,12592.0,Germany
566054,2023-09-08,20724,Red Retrospot Charlotte Bag,11.12,10,12592.0,Germany
566054,2023-09-08,20727,Lunch Bag Black Skull,5.97,10,12592.0,Germany
566054,2023-09-08,20726,Lunch Bag Woodland,5.97,20,12592.0,Germany
566054,2023-09-08,22382,Lunch Bag Spaceboy Design,5.97,20,12592.0,Germany
566054,2023-09-08,23206,Lunch Bag Apple Design,5.97,20,12592.0,Germany
566055,2023-09-08,23092,Large Antique White Photo Frame,18.35,1,15453.0,United Kingdom
566055,2023-09-08,23146,Triple Hook Antique Ivory Rose,13.62,1,15453.0,United Kingdom
566055,2023-09-08,23147,Single Antique Rose Hook Ivory,11.74,1,15453.0,United Kingdom
566055,2023-09-08,84971S,Small Heart Flowers Hook,11.12,2,15453.0,United Kingdom
566055,2023-09-08,23138,Single Wire Hook Ivory Heart,11.74,3,15453.0,United Kingdom
566055,2023-09-08,84836,Zinc Metal Heart Decoration,11.53,2,15453.0,United Kingdom
566055,2023-09-08,23301,Gardeners Kneeling Pad Keep Calm,11.94,1,15453.0,United Kingdom
566055,2023-09-08,23300,Gardeners Kneeling Pad Cup Of Tea,11.94,1,15453.0,United Kingdom
566055,2023-09-08,21116,Owl Doorstop,15.32,1,15453.0,United Kingdom
566055,2023-09-08,22744,Make Your Own Monsoon Card Kit,13.27,1,15453.0,United Kingdom
566055,2023-09-08,22488,Natural Slate Rectangle Chalkboard,11.94,2,15453.0,United Kingdom
566055,2023-09-08,23431,Natural Hanging Quilted Hearts,11.1,12,15453.0,United Kingdom
566055,2023-09-08,22580,Advent Calendar Gingham Sack,16.35,2,15453.0,United Kingdom
566055,2023-09-08,23432,Pretty Hanging Quilted Hearts,11.1,12,15453.0,United Kingdom
566055,2023-09-08,21876,Pottering Mug,11.94,1,15453.0,United Kingdom
566055,2023-09-08,21877,Home Sweet Home Mug,11.94,1,15453.0,United Kingdom
566055,2023-09-08,22470,Heart Of Wicker Large,13.27,1,15453.0,United Kingdom
566055,2023-09-08,21382,Set/4 Spring Flower Decoration,11.02,2,15453.0,United Kingdom
566055,2023-09-08,23169,Classic Glass Cookie Jar,14.5,1,15453.0,United Kingdom
566055,2023-09-08,23433,Hanging Quilted Patchwork Apples,11.1,1,15453.0,United Kingdom
566055,2023-09-08,23197,Sketchbook Magnetic Shopping List,11.74,1,15453.0,United Kingdom
566055,2023-09-08,23439,Hand Warmer Red Love Heart,12.4,1,15453.0,United Kingdom
566055,2023-09-08,22867,Hand Warmer Bird Design,12.4,1,15453.0,United Kingdom
566055,2023-09-08,22865,Hand Warmer Owl Design,12.4,1,15453.0,United Kingdom
566055,2023-09-08,23356,Love Hot Water Bottle,16.35,1,15453.0,United Kingdom
566055,2023-09-08,84029G,Knitted Union Flag Hot Water Bottle,14.61,1,15453.0,United Kingdom
566055,2023-09-08,82494L,Wooden Frame Antique White,13.27,3,15453.0,United Kingdom
566055,2023-09-08,22113,Grey Heart Hot Water Bottle,14.61,2,15453.0,United Kingdom
566055,2023-09-08,21896,Potting Shed Twine,12.4,1,15453.0,United Kingdom
566055,2023-09-08,22693,Grow A Flytrap Or Sunflower In Tin,11.53,24,15453.0,United Kingdom
566055,2023-09-08,23356,Love Hot Water Bottle,16.35,1,15453.0,United Kingdom
566055,2023-09-08,84029E,Red Woolly Hottie White Heart,14.61,1,15453.0,United Kingdom
566055,2023-09-08,23133,Large Ivory Heart Wall Organiser,18.71,1,15453.0,United Kingdom
566055,2023-09-08,23134,Large Zinc Heart Wall Organiser,18.71,1,15453.0,United Kingdom
566055,2023-09-08,84884A,Ant White Wire Heart Spiral,14.3,1,15453.0,United Kingdom
566055,2023-09-08,22171,3 Hook Photo Shelf Antique White,18.96,1,15453.0,United Kingdom
566055,2023-09-08,23404,Home Sweet Home Blackboard,15.32,1,15453.0,United Kingdom
566055,2023-09-08,23401,Rustic Mirror With Lace Heart,16.66,1,15453.0,United Kingdom
566055,2023-09-08,22507,Memo Board Retrospot Design,15.32,2,15453.0,United Kingdom
566056,2023-09-08,82582,Area Patrolled Metal Sign,12.4,1,14410.0,United Kingdom
566056,2023-09-08,21179,No Junk Mail Metal Sign,10.65,3,14410.0,United Kingdom
566056,2023-09-08,72586,Set Of 6 Halloween Ghost T-Lights,10.68,2,14410.0,United Kingdom
566057,2023-09-08,16218,Cartoon Pencil Sharpeners,10.31,160,17997.0,United Kingdom
566057,2023-09-08,47341B,Blue Table Run Flower,11.53,6,17997.0,United Kingdom
566057,2023-09-08,21213,Pack Of 72 Skull Cake Cases,10.81,3,17997.0,United Kingdom
566057,2023-09-08,22417,Pack Of 60 Spaceboy Cake Cases,10.81,3,17997.0,United Kingdom
566057,2023-09-08,84992,72 Sweetheart Fairy Cake Cases,10.81,3,17997.0,United Kingdom
566057,2023-09-08,23308,Set Of 60 Vintage Leaf Cake Cases,10.81,3,17997.0,United Kingdom
566057,2023-09-08,21976,Pack Of 60 Mushroom Cake Cases,10.81,3,17997.0,United Kingdom
566057,2023-09-08,23309,Set Of 60 I Love London Cake Cases,10.81,3,17997.0,United Kingdom
566057,2023-09-08,84991,60 Teatime Fairy Cake Cases,10.81,6,17997.0,United Kingdom
566057,2023-09-08,23307,Set Of 60 Pantry Design Cake Cases,10.81,6,17997.0,United Kingdom
566057,2023-09-08,21977,Pack Of 60 Pink Paisley Cake Cases,10.81,6,17997.0,United Kingdom
566057,2023-09-08,22114,Hot Water Bottle Tea And Sympathy,14.61,5,17997.0,United Kingdom
566057,2023-09-08,23156,Set Of 5 Mini Grocery Magnets,12.38,1,17997.0,United Kingdom
566057,2023-09-08,21162,Toxic Area Door Hanger,10.65,4,17997.0,United Kingdom
566057,2023-09-08,84030E,English Rose Hot Water Bottle,14.61,5,17997.0,United Kingdom
566057,2023-09-08,21159,Moody Boy Door Hanger,10.65,10,17997.0,United Kingdom
566057,2023-09-08,21158,Moody Girl Door Hanger,10.65,10,17997.0,United Kingdom
566057,2023-09-08,21163,Do Not Touch My Stuff Door Hanger,10.65,24,17997.0,United Kingdom
566057,2023-09-08,21179,No Junk Mail Metal Sign,10.65,24,17997.0,United Kingdom
566057,2023-09-08,84927F,Psychedelic Tile Hook,10.65,18,17997.0,United Kingdom
566057,2023-09-08,20992,Jazz Hearts Purse Notebook,10.65,24,17997.0,United Kingdom
566057,2023-09-08,21987,Pack Of 6 Skull Paper Cups,10.92,4,17997.0,United Kingdom
566057,2023-09-08,21988,Pack Of 6 Skull Paper Plates,11.12,4,17997.0,United Kingdom
566057,2023-09-08,21989,Pack Of 20 Skull Paper Napkins,11.12,4,17997.0,United Kingdom
566057,2023-09-08,21211,Set Of 72 Skull Paper Doilies,11.74,4,17997.0,United Kingdom
566057,2023-09-08,21374,Mirrored Wall Art Skulls,11.53,14,17997.0,United Kingdom
566057,2023-09-08,21930,Jumbo Storage Bag Skulls,12.38,4,17997.0,United Kingdom
566057,2023-09-08,84660A,White Stitched Wall Clock,11.06,9,17997.0,United Kingdom
566058,2023-09-08,21544,Skulls Water Transfer Tattoos,11.12,80,16682.0,United Kingdom
566058,2023-09-08,21833,Camouflage Led Torch,11.98,24,16682.0,United Kingdom
566058,2023-09-08,22614,Pack Of 12 Spaceboy Tissues,10.65,24,16682.0,United Kingdom
566058,2023-09-08,21213,Pack Of 72 Skull Cake Cases,10.81,48,16682.0,United Kingdom
566058,2023-09-08,22551,Plasters In Tin Spaceboy,11.94,24,16682.0,United Kingdom
566059,2023-09-08,22625,Red Kitchen Scales,18.96,4,12569.0,Germany
566059,2023-09-08,22624,Ivory Kitchen Scales,18.96,4,12569.0,Germany
566060,2023-09-08,22086,Paper Chain Kit 50'S Christmas,16.18,1,13060.0,United Kingdom
566060,2023-09-08,22492,Mini Paint Set Vintage,11.92,10,13060.0,United Kingdom
566060,2023-09-08,22602,Retrospot Wooden Heart Decoration,11.92,1,13060.0,United Kingdom
566060,2023-09-08,22661,Charlotte Bag Dolly Girl Design,11.92,2,13060.0,United Kingdom
566060,2023-09-08,22671,French Laundry Sign Blue Metal,13.62,2,13060.0,United Kingdom
566060,2023-09-08,22104,Mirror Mosaic Candle Plate,11.92,1,13060.0,United Kingdom
566060,2023-09-08,22553,Plasters In Tin Skulls,13.62,1,13060.0,United Kingdom
566060,2023-09-08,22107,Pizza Plate In Box,13.62,4,13060.0,United Kingdom
566060,2023-09-08,22123,Ping Microwave Apron,14.48,1,13060.0,United Kingdom
566060,2023-09-08,22124,Set Of 2 Tea Towels Ping Microwave,12.77,2,13060.0,United Kingdom
566060,2023-09-08,22131,Food Container Set 3 Love Heart,14.48,1,13060.0,United Kingdom
566060,2023-09-08,22133,Pink Love Heart Shape Cup,11.92,1,13060.0,United Kingdom
566060,2023-09-08,22151,Place Setting White Heart,11.92,1,13060.0,United Kingdom
566060,2023-09-08,22173,Metal 4 Hook Hanger French Chateau,16.18,1,13060.0,United Kingdom
566060,2023-09-08,22190,Local Cafe Mug,12.77,2,13060.0,United Kingdom
566060,2023-09-08,22197,Popcorn Holder,11.92,3,13060.0,United Kingdom
566060,2023-09-08,22200,Frying Pan Pink Polkadot,18.75,1,13060.0,United Kingdom
566060,2023-09-08,22244,3 Hook Hanger Magic Garden,14.48,3,13060.0,United Kingdom
566060,2023-09-08,22271,Feltcraft Doll Rosie,16.18,1,13060.0,United Kingdom
566060,2023-09-08,22294,Heart Filigree Dove Small,12.77,1,13060.0,United Kingdom
566060,2023-09-08,22310,Ivory Knitted Mug Cosy,13.62,2,13060.0,United Kingdom
566060,2023-09-08,22324,Blue Polkadot Kids Bag,14.48,1,13060.0,United Kingdom
566060,2023-09-08,22356,Charlotte Bag Pink Polkadot,11.92,1,13060.0,United Kingdom
566060,2023-09-08,15036,Assorted Colours Silk Fan,11.92,6,13060.0,United Kingdom
566060,2023-09-08,15044A,Pink Paper Parasol,16.18,1,13060.0,United Kingdom
566060,2023-09-08,20696,Floral Soft Car Toy,17.9,1,13060.0,United Kingdom
566060,2023-09-08,20717,Strawberry Shopper Bag,12.77,1,13060.0,United Kingdom
566060,2023-09-08,22361,Glass Jar Daisy Fresh Cotton Wool,16.18,1,13060.0,United Kingdom
566060,2023-09-08,22695,Wicker Wreath Small,13.62,3,13060.0,United Kingdom
566060,2023-09-08,22748,Poppy's Playhouse Kitchen,14.48,1,13060.0,United Kingdom
566060,2023-09-08,22998,Travel Card Wallet Keep Calm,11.1,1,13060.0,United Kingdom
566060,2023-09-08,23086,Zinc Star T-Light Holder,12.77,6,13060.0,United Kingdom
566060,2023-09-08,23189,Set Of 12 Fork Candles,16.18,1,13060.0,United Kingdom
566060,2023-09-08,23330,Decorative Wicker Heart Medium,12.77,6,13060.0,United Kingdom
566060,2023-09-08,23333,Ivory Wicker Heart Medium,12.77,2,13060.0,United Kingdom
566060,2023-09-08,23334,Ivory Wicker Heart Small,11.53,1,13060.0,United Kingdom
566060,2023-09-08,22364,Glass Jar Digestive Biscuits,16.18,4,13060.0,United Kingdom
566060,2023-09-08,22371,Airline Bag Vintage Tokyo 78,18.75,1,13060.0,United Kingdom
566060,2023-09-08,22389,Paperweight Save The Planet,15.33,1,13060.0,United Kingdom
566060,2023-09-08,22410,Money Box Housekeeping Design,12.77,1,13060.0,United Kingdom
566060,2023-09-08,22411,Jumbo Shopper Vintage Red Paisley,14.48,3,13060.0,United Kingdom
566060,2023-09-08,22419,Lipstick Pen Red,11.1,1,13060.0,United Kingdom
566060,2023-09-08,20718,Red Retrospot Shopper Bag,12.77,1,13060.0,United Kingdom
566060,2023-09-08,22426,Enamel Wash Bowl Cream,17.9,1,13060.0,United Kingdom
566060,2023-09-08,23087,Zinc Heart T-Light Holder,12.77,3,13060.0,United Kingdom
566060,2023-09-08,23103,Jingle Bell Heart Decoration,13.62,1,13060.0,United Kingdom
566060,2023-09-08,85116,Black Candelabra T-Light Holder,11.92,5,13060.0,United Kingdom
566060,2023-09-08,85123A,Cream Hanging Heart T-Light Holder,16.18,1,13060.0,United Kingdom
566060,2023-09-08,85184C,Set 4 Valentine Decoupage Heart Box,16.18,1,13060.0,United Kingdom
566060,2023-09-08,90130B,Turq Stone/Crystal Earrings,13.22,1,13060.0,United Kingdom
566060,2023-09-08,90143,Silver Bracelet W Pastel Flower,18.35,1,13060.0,United Kingdom
566060,2023-09-08,90144,Silver Drop Earrings With Flower,14.07,1,13060.0,United Kingdom
566060,2023-09-08,90185C,Black Diamante Expandable Ring,14.5,1,13060.0,United Kingdom
566060,2023-09-08,90214E,"Letter ""E"" Bling Key Ring",11.1,2,13060.0,United Kingdom
566060,2023-09-08,20719,Woodland Charlotte Bag,11.92,5,13060.0,United Kingdom
566060,2023-09-08,20724,Red Retrospot Charlotte Bag,11.92,1,13060.0,United Kingdom
566060,2023-09-08,20733,Gold Mini Tape Measure,11.1,1,13060.0,United Kingdom
566060,2023-09-08,20774,Green Fern Notebook,11.92,1,13060.0,United Kingdom
566060,2023-09-08,20914,Set/5 Red Retrospot Lid Glass Bowls,16.18,1,13060.0,United Kingdom
566060,2023-09-08,20977,36 Pencils Tube Woodland,12.77,1,13060.0,United Kingdom
566060,2023-09-08,21106,Cream Slice Flannel Chocolate Spot,16.18,1,13060.0,United Kingdom
566060,2023-09-08,21107,Cream Slice Flannel Pink Spot,16.18,1,13060.0,United Kingdom
566060,2023-09-08,21123,Set/10 Ivory Polkadot Party Candles,11.1,2,13060.0,United Kingdom
566060,2023-09-08,21125,Set 6 Football Celebration Candles,11.53,1,13060.0,United Kingdom
566060,2023-09-08,21126,Set Of 6 Girls Celebration Candles,11.53,1,13060.0,United Kingdom
566060,2023-09-08,21155,Red Retrospot Peg Bag,15.33,1,13060.0,United Kingdom
566060,2023-09-08,23238,Set Of 4 Knick Knack Tins London,18.75,1,13060.0,United Kingdom
566060,2023-09-08,23240,Set Of 4 Knick Knack Tins Doily,18.75,1,13060.0,United Kingdom
566060,2023-09-08,23275,Set Of 3 Hanging Owls Ollie Beak,12.77,1,13060.0,United Kingdom
566060,2023-09-08,23297,Set 40 Heart Shape Petit Four Cases,13.62,1,13060.0,United Kingdom
566060,2023-09-08,23302,Kneeling Mat Housework Design,13.62,1,13060.0,United Kingdom
566060,2023-09-08,23307,Set Of 60 Pantry Design Cake Cases,11.53,1,13060.0,United Kingdom
566060,2023-09-08,23326,Hanging Mini Coloured Bottles,18.75,3,13060.0,United Kingdom
566060,2023-09-08,23328,Set 6 School Milk Bottles In Crate,17.9,8,13060.0,United Kingdom
566060,2023-09-08,23399,Home Sweet Home Hanging Heart,12.38,1,13060.0,United Kingdom
566060,2023-09-08,23426,Metal Sign Drop Your Pants,16.18,1,13060.0,United Kingdom
566060,2023-09-08,35646,Vintage Bead Pink Evening Bag,12.77,1,13060.0,United Kingdom
566060,2023-09-08,46776A,Woven Bubble Gum Cushion Cover,14.48,1,13060.0,United Kingdom
566060,2023-09-08,46776B,Woven Berries Cushion Cover,14.48,2,13060.0,United Kingdom
566060,2023-09-08,47310M,Small Pop Box Funky Monkey,11.92,1,13060.0,United Kingdom
566060,2023-09-08,47504K,English Rose Garden Secateurs,13.62,1,13060.0,United Kingdom
566060,2023-09-08,47563A,Retro Longboard Ironing Board Cover,13.62,1,13060.0,United Kingdom
566060,2023-09-08,51014A,Feather Pen Hot Pink,11.1,2,13060.0,United Kingdom
566060,2023-09-08,51014C,Feather Pen Coal Black,11.1,4,13060.0,United Kingdom
566060,2023-09-08,51014L,Feather Pen Light Pink,11.1,3,13060.0,United Kingdom
566060,2023-09-08,21172,Party Metal Sign,14.48,1,13060.0,United Kingdom
566060,2023-09-08,71459,Hanging Jam Jar T-Light Holders,11.95,12,13060.0,United Kingdom
566060,2023-09-08,21207,Skull And Crossbones Garland,11.92,4,13060.0,United Kingdom
566060,2023-09-08,21213,Pack Of 72 Skull Cake Cases,11.53,1,13060.0,United Kingdom
566060,2023-09-08,21224,Set/4 Skull Badges,11.1,1,13060.0,United Kingdom
566060,2023-09-08,21232,Strawberry Ceramic Trinket Pot,12.77,1,13060.0,United Kingdom
566060,2023-09-08,21240,Blue Polkadot Cup,11.92,2,13060.0,United Kingdom
566060,2023-09-08,21314,Small Glass Heart Trinket Pot,14.48,1,13060.0,United Kingdom
566060,2023-09-08,21328,Balloons Writing Set,13.62,1,13060.0,United Kingdom
566060,2023-09-08,21356,Toast Its - Fairy Flower,11.1,2,13060.0,United Kingdom
566060,2023-09-08,21358,Toast Its - Happy Birthday,11.1,2,13060.0,United Kingdom
566060,2023-09-08,21377,Small Camphor Wood Field Mushroom,13.62,1,13060.0,United Kingdom
566060,2023-09-08,21379,Camphor Wood Portobello Mushroom,12.77,1,13060.0,United Kingdom
566060,2023-09-08,21385,Ivory Hanging Decoration Heart,11.12,9,13060.0,United Kingdom
566060,2023-09-08,21418,Starfish Soap Dish,15.33,1,13060.0,United Kingdom
566060,2023-09-08,23000,Travel Card Wallet Transport,11.1,1,13060.0,United Kingdom
566060,2023-09-08,21479,White Skull Hot Water Bottle,18.75,1,13060.0,United Kingdom
566060,2023-09-08,21506,Fancy Font Birthday Card,11.1,1,13060.0,United Kingdom
566060,2023-09-08,21519,Gin & Tonic Diet Greeting Card,11.1,1,13060.0,United Kingdom
566060,2023-09-08,21544,Skulls Water Transfer Tattoos,11.92,2,13060.0,United Kingdom
566060,2023-09-08,21558,Skull Lunch Box With Cutlery,15.33,1,13060.0,United Kingdom
566060,2023-09-08,21559,Strawberry Lunch Box With Cutlery,15.33,1,13060.0,United Kingdom
566060,2023-09-08,21579,Lolita Design Cotton Tote Bag,15.33,1,13060.0,United Kingdom
566060,2023-09-08,21617,4 Lily Botanical Dinner Candles,17.9,3,13060.0,United Kingdom
566060,2023-09-08,21669,Blue Stripe Ceramic Drawer Knob,13.62,6,13060.0,United Kingdom
566060,2023-09-08,21715,Girls Vintage Tin Seaside Bucket,15.33,2,13060.0,United Kingdom
566060,2023-09-08,22814,Card Party Games,10.68,4,13060.0,United Kingdom
566060,2023-09-08,22815,Card Psychedelic Apples,10.68,10,13060.0,United Kingdom
566060,2023-09-08,22817,Card Suki Birthday,10.68,2,13060.0,United Kingdom
566060,2023-09-08,22819,Birthday Card Retro Spot,10.68,10,13060.0,United Kingdom
566060,2023-09-08,22697,Green Regency Teacup And Saucer,16.18,2,13060.0,United Kingdom
566060,2023-09-08,22698,Pink Regency Teacup And Saucer,16.18,1,13060.0,United Kingdom
566060,2023-09-08,22713,Card I Love London,11.1,1,13060.0,United Kingdom
566060,2023-09-08,22554,Plasters In Tin Woodland Animals,13.62,1,13060.0,United Kingdom
566060,2023-09-08,22437,Set Of 9 Black Skull Balloons,11.92,2,13060.0,United Kingdom
566060,2023-09-08,22446,Pin Cushion Babushka Pink,12.77,2,13060.0,United Kingdom
566060,2023-09-08,22449,Silk Purse Babushka Pink,12.77,1,13060.0,United Kingdom
566060,2023-09-08,22452,Measuring Tape Babushka Pink,11.92,2,13060.0,United Kingdom
566060,2023-09-08,21716,Boys Vintage Tin Seaside Bucket,15.33,2,13060.0,United Kingdom
566060,2023-09-08,21739,Cosy Slipper Shoes Small Green,12.77,1,13060.0,United Kingdom
566060,2023-09-08,21790,Vintage Snap Cards,11.92,1,13060.0,United Kingdom
566060,2023-09-08,22466,Fairy Tale Cottage Night Light,14.48,1,13060.0,United Kingdom
566060,2023-09-08,22573,Star Wooden Christmas Decoration,11.92,6,13060.0,United Kingdom
566060,2023-09-08,22715,Card Wedding Day,11.1,1,13060.0,United Kingdom
566060,2023-09-08,22960,Jam Making Set With Jars,18.75,1,13060.0,United Kingdom
566060,2023-09-08,23002,Travel Card Wallet Skulls,11.1,1,13060.0,United Kingdom
566060,2023-09-08,23136,Ivory Wire Sweetheart Letter Tray,17.9,1,13060.0,United Kingdom
566060,2023-09-08,75049L,Large Circular Mirror Mobile,12.77,4,13060.0,United Kingdom
566060,2023-09-08,82583,Hot Baths Metal Sign,14.48,2,13060.0,United Kingdom
566060,2023-09-08,82613A,Metal Sign Cupcake Single Hook,12.77,1,13060.0,United Kingdom
566060,2023-09-08,84029E,Red Woolly Hottie White Heart,18.75,1,13060.0,United Kingdom
566060,2023-09-08,84535B,Fairy Cakes Notebook A6 Size,11.75,1,13060.0,United Kingdom
566060,2023-09-08,84568,Girls Alphabet Iron On Patches,10.68,6,13060.0,United Kingdom
566060,2023-09-08,84596F,Small Marshmallows Pink Bowl,11.1,2,13060.0,United Kingdom
566060,2023-09-08,84598,Boys Alphabet Iron On Patches,10.68,4,13060.0,United Kingdom
566060,2023-09-08,84692,Box Of 24 Cocktail Parasols,11.1,1,13060.0,United Kingdom
566060,2023-09-08,84923,Pink Butterfly Handbag W Bobbles,14.48,1,13060.0,United Kingdom
566060,2023-09-08,84946,Antique Silver T-Light Glass,12.77,3,13060.0,United Kingdom
566060,2023-09-08,84947,Antique Silver Tea Glass Engraved,12.77,3,13060.0,United Kingdom
566060,2023-09-08,84950,Assorted Colour T-Light Holder,11.66,6,13060.0,United Kingdom
566060,2023-09-08,84970S,Hanging Heart Zinc T-Light Holder,12.38,3,13060.0,United Kingdom
566060,2023-09-08,85032A,Romantic Images Gift Wrap Set,11.92,1,13060.0,United Kingdom
566060,2023-09-08,85049E,Scandinavian Reds Ribbons,12.77,2,13060.0,United Kingdom
566060,2023-09-08,85049G,Chocolate Box Ribbons,12.77,1,13060.0,United Kingdom
566060,2023-09-08,85049H,Urban Black Ribbons,11.1,1,13060.0,United Kingdom
566060,2023-09-08,22583,Pack Of 6 Handbag Gift Boxes,15.33,1,13060.0,United Kingdom
566060,2023-09-08,21832,Chocolate Calculator,13.62,1,13060.0,United Kingdom
566060,2023-09-08,21874,Gin And Tonic Mug,13.62,1,13060.0,United Kingdom
