TransactionNo,Date,ProductNo,ProductName,Price,Quantity,CustomerNo,Country
554999,2023-05-29,21473,Sweetheart Cream Steel Table Rect,30.7,1,15547.0,United Kingdom
554985,2023-05-29,22849,Bread Bin Diner Style Mint,27.62,1,12426.0,Germany
554975,2023-05-29,22605,Wooden Croquet Garden Set,25.57,1,17819.0,United Kingdom
554999,2023-05-29,21476,Steel Sweetheart Round Table Cream,25.57,2,15547.0,United Kingdom
554987,2023-05-29,85066,Cream Sweetheart Mini Chest,23.32,1,14823.0,United Kingdom
554991,2023-05-29,85066,Cream Sweetheart Mini Chest,23.32,1,14823.0,United Kingdom
554998,2023-05-29,22423,Regency Cakestand 3 Tier,23.32,3,15925.0,United Kingdom
554975,2023-05-29,23175,Regency Milk Jug Pink,13.07,24,17819.0,United Kingdom
554975,2023-05-29,23173,Regency Teapot Roses,18.6,24,17819.0,United Kingdom
554975,2023-05-29,23174,Regency Sugar Bowl Green,14.09,24,17819.0,United Kingdom
554975,2023-05-29,23170,Regency Tea Plate Roses,11.74,48,17819.0,United Kingdom
554975,2023-05-29,23172,Regency Tea Plate Pink,11.74,48,17819.0,United Kingdom
554975,2023-05-29,23171,Regency Tea Plate Green,11.74,48,17819.0,United Kingdom
554975,2023-05-29,23162,Regency Tea Strainer,13.62,48,17819.0,United Kingdom
554975,2023-05-29,23163,Regency Sugar Tongs,12.38,48,17819.0,United Kingdom
554976,2023-05-29,84792,Enchanted Bird Coathanger 5 Hook,15.02,3,15046.0,United Kingdom
554976,2023-05-29,84673B,Blue Fly Swat,10.92,1,15046.0,United Kingdom
554976,2023-05-29,84673A,Pink Fly Swat,10.92,1,15046.0,United Kingdom
554976,2023-05-29,22219,Lovebird Hanging Decoration White,11.12,20,15046.0,United Kingdom
554976,2023-05-29,23148,Miniature Antique Rose Hook Ivory,11.1,2,15046.0,United Kingdom
554976,2023-05-29,23147,Single Antique Rose Hook Ivory,11.74,2,15046.0,United Kingdom
554976,2023-05-29,23131,Mistletoe Heart Wreath Cream,14.5,12,15046.0,United Kingdom
554976,2023-05-29,23152,Ivory Sweetheart Wire Letter Rack,14.09,4,15046.0,United Kingdom
554976,2023-05-29,84879,Assorted Colour Bird Ornament,11.98,32,15046.0,United Kingdom
554976,2023-05-29,23146,Triple Hook Antique Ivory Rose,13.62,2,15046.0,United Kingdom
554976,2023-05-29,22915,Assorted Bottle Top Magnets,10.68,6,15046.0,United Kingdom
554976,2023-05-29,23138,Single Wire Hook Ivory Heart,11.74,12,15046.0,United Kingdom
554976,2023-05-29,23154,Set Of 4 Jam Jar Magnets,12.38,1,15046.0,United Kingdom
554976,2023-05-29,23156,Set Of 5 Mini Grocery Magnets,12.38,1,15046.0,United Kingdom
554976,2023-05-29,21272,Salle De Bain Hook,11.53,3,15046.0,United Kingdom
554976,2023-05-29,22189,Cream Heart Card Holder,14.3,3,15046.0,United Kingdom
554976,2023-05-29,21034,Rex Cash+Carry Jumbo Shopper,11.22,1,15046.0,United Kingdom
554976,2023-05-29,23132,Small Ivory Heart Wall Organiser,16.14,3,15046.0,United Kingdom
554976,2023-05-29,21390,Filigris Heart With Butterfly,11.53,24,15046.0,United Kingdom
554976,2023-05-29,21385,Ivory Hanging Decoration Heart,11.12,24,15046.0,United Kingdom
554976,2023-05-29,22295,Heart Filigree Dove Large,11.94,12,15046.0,United Kingdom
554976,2023-05-29,22294,Heart Filigree Dove Small,11.53,24,15046.0,United Kingdom
554977,2023-05-29,84673A,Pink Fly Swat,10.92,1,16444.0,United Kingdom
554977,2023-05-29,22328,Round Snack Boxes Set Of 4 Fruits,13.27,4,16444.0,United Kingdom
554977,2023-05-29,21561,Dinosaur Lunch Box With Cutlery,12.86,2,16444.0,United Kingdom
554977,2023-05-29,21559,Strawberry Lunch Box With Cutlery,12.86,2,16444.0,United Kingdom
554977,2023-05-29,22411,Jumbo Shopper Vintage Red Paisley,12.38,2,16444.0,United Kingdom
554977,2023-05-29,85152,Hand Over The Chocolate Sign,12.4,1,16444.0,United Kingdom
554977,2023-05-29,82567,Airline Lounge Metal Sign,12.4,1,16444.0,United Kingdom
554977,2023-05-29,21166,Cook With Wine Metal Sign,12.38,1,16444.0,United Kingdom
554977,2023-05-29,23298,Spotty Bunting,15.32,3,16444.0,United Kingdom
554977,2023-05-29,22090,Paper Bunting Retrospot,13.27,3,16444.0,United Kingdom
554977,2023-05-29,47590A,Blue Happy Birthday Bunting,15.84,2,16444.0,United Kingdom
554977,2023-05-29,47590B,Pink Happy Birthday Bunting,15.84,1,16444.0,United Kingdom
554977,2023-05-29,22197,Popcorn Holder,11.12,30,16444.0,United Kingdom
554977,2023-05-29,85099C,Jumbo Bag Baroque Black White,6.19,2,16444.0,United Kingdom
554977,2023-05-29,22384,Lunch Bag Pink Polkadot,5.97,2,16444.0,United Kingdom
554977,2023-05-29,20728,Lunch Bag Cars Blue,5.97,1,16444.0,United Kingdom
554977,2023-05-29,20725,Lunch Bag Red Retrospot,5.97,1,16444.0,United Kingdom
554977,2023-05-29,20727,Lunch Bag Black Skull,5.97,1,16444.0,United Kingdom
554978,2023-05-29,23102,Silver Hearts Table Decoration,11.1,12,16889.0,United Kingdom
554978,2023-05-29,23299,Food Cover With Beads Set 2,14.09,4,16889.0,United Kingdom
554978,2023-05-29,22907,Pack Of 20 Napkins Pantry Design,11.12,6,16889.0,United Kingdom
554978,2023-05-29,23300,Gardeners Kneeling Pad Cup Of Tea,11.94,4,16889.0,United Kingdom
554978,2023-05-29,23254,Childrens Cutlery Dolly Girl,14.5,3,16889.0,United Kingdom
554978,2023-05-29,23256,Childrens Cutlery Spaceboy,14.5,3,16889.0,United Kingdom
554978,2023-05-29,21080,Set/20 Red Retrospot Paper Napkins,11.12,10,16889.0,United Kingdom
554978,2023-05-29,16236,Kitty Pencil Erasers,10.47,28,16889.0,United Kingdom
554978,2023-05-29,15036,Assorted Colours Silk Fan,11.1,12,16889.0,United Kingdom
554978,2023-05-29,23168,Classic Cafe Sugar Dispenser,11.53,4,16889.0,United Kingdom
554978,2023-05-29,23298,Spotty Bunting,15.32,6,16889.0,United Kingdom
554978,2023-05-29,47566,Party Bunting,15.32,4,16889.0,United Kingdom
554978,2023-05-29,21094,Set/6 Red Spotty Paper Plates,11.12,10,16889.0,United Kingdom
554978,2023-05-29,22992,Revolver Wooden Ruler,12.25,12,16889.0,United Kingdom
554978,2023-05-29,22665,Recipe Box Blue Sketchbook Design,13.27,1,16889.0,United Kingdom
554978,2023-05-29,22090,Paper Bunting Retrospot,13.27,6,16889.0,United Kingdom
554978,2023-05-29,20677,Pink Polkadot Bowl,11.53,8,16889.0,United Kingdom
554978,2023-05-29,22728,Alarm Clock Bakelike Pink,14.09,2,16889.0,United Kingdom
554978,2023-05-29,22727,Alarm Clock Bakelike Red,14.09,2,16889.0,United Kingdom
554978,2023-05-29,21240,Blue Polkadot Cup,11.12,8,16889.0,United Kingdom
554978,2023-05-29,21239,Pink Polkadot Cup,11.12,8,16889.0,United Kingdom
554978,2023-05-29,23101,Silver Stars Table Decoration,11.1,12,16889.0,United Kingdom
554978,2023-05-29,21086,Set/6 Red Spotty Paper Cups,10.92,10,16889.0,United Kingdom
554978,2023-05-29,22045,Spaceboy Gift Wrap,10.68,25,16889.0,United Kingdom
554978,2023-05-29,23231,Wrap Vintage Doily,10.68,25,16889.0,United Kingdom
554978,2023-05-29,23052,Recycled Acapulco Mat Turquoise,18.71,1,16889.0,United Kingdom
554978,2023-05-29,23209,Lunch Bag Vintage Doily,5.97,10,16889.0,United Kingdom
554978,2023-05-29,22662,Lunch Bag Dolly Girl Design,5.97,10,16889.0,United Kingdom
554979,2023-05-29,23002,Travel Card Wallet Skulls,10.68,2,16931.0,United Kingdom
554979,2023-05-29,23148,Miniature Antique Rose Hook Ivory,11.1,3,16931.0,United Kingdom
554979,2023-05-29,23147,Single Antique Rose Hook Ivory,11.74,5,16931.0,United Kingdom
554979,2023-05-29,22551,Plasters In Tin Spaceboy,11.94,4,16931.0,United Kingdom
554979,2023-05-29,22998,Travel Card Wallet Keep Calm,10.68,10,16931.0,United Kingdom
554979,2023-05-29,22999,Travel Card Wallet Vintage Leaf,10.68,2,16931.0,United Kingdom
554979,2023-05-29,23000,Travel Card Wallet Transport,10.68,6,16931.0,United Kingdom
554979,2023-05-29,22995,Travel Card Wallet Suki,10.68,3,16931.0,United Kingdom
554979,2023-05-29,23003,Travel Card Wallet Vintage Rose,10.68,3,16931.0,United Kingdom
554979,2023-05-29,62074B,Elephant Clip W Suction Cup,10.68,3,16931.0,United Kingdom
554979,2023-05-29,23302,Kneeling Mat Housework Design,11.94,3,16931.0,United Kingdom
554979,2023-05-29,23300,Gardeners Kneeling Pad Cup Of Tea,11.94,5,16931.0,United Kingdom
554979,2023-05-29,84519B,Carrot Charlie+Lola Coaster Set,11.53,4,16931.0,United Kingdom
554979,2023-05-29,21174,Pottering In The Shed Metal Sign,12.38,1,16931.0,United Kingdom
554979,2023-05-29,20716,Party Food Shopper Bag,11.53,2,16931.0,United Kingdom
554979,2023-05-29,22568,Feltcraft Cushion Owl,14.09,3,16931.0,United Kingdom
554979,2023-05-29,85183A,Charlie & Lola Wastepaper Bin Blue,11.53,1,16931.0,United Kingdom
554979,2023-05-29,85183B,Charlie & Lola Wastepaper Bin Flora,11.53,2,16931.0,United Kingdom
554979,2023-05-29,84828,Jungle Popsicles Ice Lolly Moulds,11.53,3,16931.0,United Kingdom
554979,2023-05-29,22147,Feltcraft Butterfly Hearts,11.74,3,16931.0,United Kingdom
554979,2023-05-29,22993,Set Of 4 Pantry Jelly Moulds,11.53,3,16931.0,United Kingdom
554979,2023-05-29,85071A,Blue Charlie+Lola Personal Doorsign,13.27,2,16931.0,United Kingdom
554979,2023-05-29,85071C,"Charlie+Lola""Extremely Busy"" Sign",12.86,2,16931.0,United Kingdom
554979,2023-05-29,85174,S/4 Cacti Candles,15.32,1,16931.0,United Kingdom
554979,2023-05-29,85123A,Cream Hanging Heart T-Light Holder,13.27,6,16931.0,United Kingdom
554979,2023-05-29,22268,Decoration Sitting Bunny,11.12,6,16931.0,United Kingdom
554979,2023-05-29,22433,Watering Can Green Dinosaur,12.25,3,16931.0,United Kingdom
554979,2023-05-29,21294,Etched Glass Coaster,10.65,12,16931.0,United Kingdom
554979,2023-05-29,22297,Heart Ivory Trellis Small,11.53,3,16931.0,United Kingdom
554979,2023-05-29,22295,Heart Filigree Dove Large,11.94,3,16931.0,United Kingdom
554979,2023-05-29,22296,Heart Ivory Trellis Large,11.94,3,16931.0,United Kingdom
554979,2023-05-29,23138,Single Wire Hook Ivory Heart,11.74,3,16931.0,United Kingdom
554979,2023-05-29,84971S,Small Heart Flowers Hook,11.12,3,16931.0,United Kingdom
554979,2023-05-29,22813,Pack 3 Boxes Bird Panettone,12.25,1,16931.0,United Kingdom
554979,2023-05-29,20716,Party Food Shopper Bag,11.53,1,16931.0,United Kingdom
554979,2023-05-29,21033,Jumbo Bag Charlie And Lola Toys,6.19,3,16931.0,United Kingdom
554979,2023-05-29,23201,Jumbo Bag Alphabet,6.19,2,16931.0,United Kingdom
554980,2023-05-29,22749,Feltcraft Princess Charlotte Doll,14.09,1,17613.0,United Kingdom
554980,2023-05-29,22568,Feltcraft Cushion Owl,14.09,6,17613.0,United Kingdom
554980,2023-05-29,22750,Feltcraft Princess Lola Doll,14.09,2,17613.0,United Kingdom
554980,2023-05-29,22274,Feltcraft Doll Emily,13.27,1,17613.0,United Kingdom
554980,2023-05-29,22271,Feltcraft Doll Rosie,13.27,1,17613.0,United Kingdom
554980,2023-05-29,22273,Feltcraft Doll Molly,13.27,2,17613.0,United Kingdom
554980,2023-05-29,22274,Feltcraft Doll Emily,13.27,1,17613.0,United Kingdom
554980,2023-05-29,22749,Feltcraft Princess Charlotte Doll,14.09,1,17613.0,United Kingdom
554980,2023-05-29,22271,Feltcraft Doll Rosie,13.27,1,17613.0,United Kingdom
554981,2023-05-29,85132C,Charlie And Lola Figures Tins,12.25,2,17613.0,United Kingdom
554981,2023-05-29,85132B,Charlie And Lola Table Tins,12.25,2,17613.0,United Kingdom
554981,2023-05-29,84279B,Cherry Blossom Decorative Flask,14.09,2,17613.0,United Kingdom
554981,2023-05-29,84279B,Cherry Blossom Decorative Flask,14.09,2,17613.0,United Kingdom
554981,2023-05-29,21068,Vintage Billboard Love/Hate Mug,11.53,6,17613.0,United Kingdom
554981,2023-05-29,21043,Apron Modern Vintage Cotton,12.25,4,17613.0,United Kingdom
554981,2023-05-29,20914,Set/5 Red Retrospot Lid Glass Bowls,13.27,2,17613.0,United Kingdom
554981,2023-05-29,84429A,Medium Pink Buddha Head,13.27,3,17613.0,United Kingdom
554981,2023-05-29,20755,Blue Paisley Pocket Book,11.12,3,17613.0,United Kingdom
554981,2023-05-29,20759,Chrysanthemum Pocket Book,11.12,3,17613.0,United Kingdom
554981,2023-05-29,20777,Chrysanthemum Notebook,11.94,1,17613.0,United Kingdom
554981,2023-05-29,23147,Single Antique Rose Hook Ivory,11.74,2,17613.0,United Kingdom
554981,2023-05-29,82581,Toilet Metal Sign,10.81,2,17613.0,United Kingdom
554981,2023-05-29,21171,Bathroom Metal Sign,10.81,2,17613.0,United Kingdom
554981,2023-05-29,22219,Lovebird Hanging Decoration White,11.12,2,17613.0,United Kingdom
554981,2023-05-29,35961,Folkart Zinc Heart Christmas Dec,11.12,2,17613.0,United Kingdom
554981,2023-05-29,22297,Heart Ivory Trellis Small,11.53,2,17613.0,United Kingdom
554981,2023-05-29,23106,Zinc Hearts Plant Pot Holder,13.21,4,17613.0,United Kingdom
554981,2023-05-29,84725,Freestyle Canvas Art Picture,11.94,1,17613.0,United Kingdom
554981,2023-05-29,22562,Monsters Stencil Craft,11.53,5,17613.0,United Kingdom
554981,2023-05-29,22563,Happy Stencil Craft,11.53,5,17613.0,United Kingdom
554981,2023-05-29,22564,Alphabet Stencil Craft,11.53,5,17613.0,United Kingdom
554981,2023-05-29,23091,Zinc Herb Garden Container,16.66,3,17613.0,United Kingdom
554981,2023-05-29,85123A,Cream Hanging Heart T-Light Holder,13.27,2,17613.0,United Kingdom
554981,2023-05-29,16248B,Blue Hole Punch,11.53,1,17613.0,United Kingdom
554981,2023-05-29,21990,Modern Floral Stationery Set,13.27,3,17613.0,United Kingdom
554981,2023-05-29,21993,Floral Folk Stationery Set,13.27,3,17613.0,United Kingdom
554981,2023-05-29,23133,Large Ivory Heart Wall Organiser,18.71,2,17613.0,United Kingdom
554981,2023-05-29,21933,Pink Vintage Paisley Picnic Bag,11.94,10,17613.0,United Kingdom
554981,2023-05-29,22374,Airline Bag Vintage Jet Set Red,14.61,4,17613.0,United Kingdom
554981,2023-05-29,21932,Scandinavian Paisley Picnic Bag,11.94,10,17613.0,United Kingdom
554981,2023-05-29,22371,Airline Bag Vintage Tokyo 78,14.61,4,17613.0,United Kingdom
554981,2023-05-29,22375,Airline Bag Vintage Jet Set Brown,14.61,4,17613.0,United Kingdom
554981,2023-05-29,22411,Jumbo Shopper Vintage Red Paisley,12.38,3,17613.0,United Kingdom
554981,2023-05-29,21931,Jumbo Storage Bag Suki,12.38,5,17613.0,United Kingdom
554981,2023-05-29,22376,Airline Bag Vintage Jet Set White,14.61,4,17613.0,United Kingdom
554981,2023-05-29,21028,Ninja Rabbit Black,11.53,12,17613.0,United Kingdom
554981,2023-05-29,21032,Space Cadet White,11.53,12,17613.0,United Kingdom
554981,2023-05-29,21030,Space Cadet Red,11.53,12,17613.0,United Kingdom
554981,2023-05-29,21136,Painted Metal Pears Assorted,11.98,8,17613.0,United Kingdom
554981,2023-05-29,84879,Assorted Colour Bird Ornament,11.98,8,17613.0,United Kingdom
554981,2023-05-29,23300,Gardeners Kneeling Pad Cup Of Tea,11.94,2,17613.0,United Kingdom
554981,2023-05-29,23301,Gardeners Kneeling Pad Keep Calm,11.94,1,17613.0,United Kingdom
554981,2023-05-29,22382,Lunch Bag Spaceboy Design,5.97,1,17613.0,United Kingdom
554981,2023-05-29,20728,Lunch Bag Cars Blue,5.97,1,17613.0,United Kingdom
554981,2023-05-29,22383,Lunch Bag Suki Design,5.97,1,17613.0,United Kingdom
554981,2023-05-29,20727,Lunch Bag Black Skull,5.97,3,17613.0,United Kingdom
554981,2023-05-29,22382,Lunch Bag Spaceboy Design,5.97,1,17613.0,United Kingdom
554981,2023-05-29,22383,Lunch Bag Suki Design,5.97,1,17613.0,United Kingdom
554981,2023-05-29,20728,Lunch Bag Cars Blue,5.97,1,17613.0,United Kingdom
554981,2023-05-29,23208,Lunch Bag Vintage Leaf Design,5.97,3,17613.0,United Kingdom
554981,2023-05-29,23209,Lunch Bag Vintage Doily,5.97,3,17613.0,United Kingdom
554981,2023-05-29,20727,Lunch Bag Black Skull,5.97,10,17613.0,United Kingdom
554981,2023-05-29,22383,Lunch Bag Suki Design,5.97,10,17613.0,United Kingdom
554982,2023-05-29,22128,Party Cones Candy Assorted,11.53,30,17152.0,United Kingdom
554982,2023-05-29,21713,Citronella Candle Flowerpot,12.4,1,17152.0,United Kingdom
554982,2023-05-29,47590A,Blue Happy Birthday Bunting,15.02,120,17152.0,United Kingdom
554982,2023-05-29,47590B,Pink Happy Birthday Bunting,15.02,120,17152.0,United Kingdom
554984,2023-05-29,47590B,Pink Happy Birthday Bunting,15.84,20,17152.0,United Kingdom
554984,2023-05-29,47590A,Blue Happy Birthday Bunting,15.84,20,17152.0,United Kingdom
554985,2023-05-29,20665,Red Retrospot Purse,13.27,6,12426.0,Germany
554985,2023-05-29,20963,Apple Bath Sponge,11.53,10,12426.0,Germany
554985,2023-05-29,71459,Hanging Jam Jar T-Light Holders,11.12,12,12426.0,Germany
554985,2023-05-29,22551,Plasters In Tin Spaceboy,11.94,12,12426.0,Germany
554985,2023-05-29,22554,Plasters In Tin Woodland Animals,11.94,12,12426.0,Germany
554985,2023-05-29,22555,Plasters In Tin Strongman,11.94,12,12426.0,Germany
554985,2023-05-29,22414,Doormat Neighbourhood Witch,18.4,2,12426.0,Germany
554985,2023-05-29,22365,Doormat Respectable House,18.4,2,12426.0,Germany
554985,2023-05-29,22366,Doormat Airmail,18.4,2,12426.0,Germany
554985,2023-05-29,21747,Small Skull Windmill,11.53,12,12426.0,Germany
554985,2023-05-29,21746,Small Red Retrospot Windmill,11.53,12,12426.0,Germany
554985,2023-05-29,22960,Jam Making Set With Jars,14.61,6,12426.0,Germany
554985,2023-05-29,21165,Beware Of The Cat Metal Sign,11.98,12,12426.0,Germany
554985,2023-05-29,21770,Open Closed Metal Sign,15.32,2,12426.0,Germany
554985,2023-05-29,82600,N0 Singing Metal Sign,12.4,12,12426.0,Germany
554985,2023-05-29,22326,Round Snack Boxes Set Of4 Woodland,13.27,12,12426.0,Germany
554985,2023-05-29,22328,Round Snack Boxes Set Of 4 Fruits,13.27,6,12426.0,Germany
554985,2023-05-29,22329,Round Container Set Of 5 Retrospot,11.94,12,12426.0,Germany
554985,2023-05-29,22629,Spaceboy Lunch Box,12.25,12,12426.0,Germany
554985,2023-05-29,22631,Circus Parade Lunch Box,12.25,12,12426.0,Germany
554985,2023-05-29,22975,Spaceboy Childrens Egg Cup,11.53,12,12426.0,Germany
554985,2023-05-29,22976,Circus Parade Childrens Egg Cup,11.53,12,12426.0,Germany
554985,2023-05-29,23184,Bull Dog Bottle Opener,15.32,4,12426.0,Germany
554985,2023-05-29,22360,Glass Jar English Confectionery,13.27,6,12426.0,Germany
554985,2023-05-29,22363,Glass Jar Marmalade,13.27,6,12426.0,Germany
554985,2023-05-29,22350,Illustrated Cat Bowl,12.86,6,12426.0,Germany
554985,2023-05-29,22845,Vintage Cream Cat Food Container,16.76,2,12426.0,Germany
554985,2023-05-29,16161G,Wrap Bad Hair Day,10.35,25,12426.0,Germany
554986,2023-05-29,22515,Childs Garden Spade Pink,12.4,4,14451.0,United Kingdom
554986,2023-05-29,22514,Childs Garden Spade Blue,12.4,4,14451.0,United Kingdom
554986,2023-05-29,23204,Charlotte Bag Apples Design,11.12,1,14451.0,United Kingdom
554986,2023-05-29,23205,Charlotte Bag Vintage Alphabet,11.12,1,14451.0,United Kingdom
554986,2023-05-29,21932,Scandinavian Paisley Picnic Bag,11.94,2,14451.0,United Kingdom
554986,2023-05-29,21933,Pink Vintage Paisley Picnic Bag,11.94,5,14451.0,United Kingdom
554986,2023-05-29,23255,Childrens Cutlery Circus Parade,14.5,1,14451.0,United Kingdom
554986,2023-05-29,23254,Childrens Cutlery Dolly Girl,14.5,1,14451.0,United Kingdom
554986,2023-05-29,47566,Party Bunting,15.32,3,14451.0,United Kingdom
554986,2023-05-29,22326,Round Snack Boxes Set Of4 Woodland,13.27,1,14451.0,United Kingdom
554986,2023-05-29,22328,Round Snack Boxes Set Of 4 Fruits,13.27,5,14451.0,United Kingdom
554986,2023-05-29,22327,Round Snack Boxes Set Of 4 Skulls,13.27,3,14451.0,United Kingdom
554986,2023-05-29,22804,Pink Hanging Heart T-Light Holder,13.27,3,14451.0,United Kingdom
554986,2023-05-29,85123A,Cream Hanging Heart T-Light Holder,13.27,3,14451.0,United Kingdom
554986,2023-05-29,21243,Pink Polkadot Plate,11.98,2,14451.0,United Kingdom
554986,2023-05-29,21244,Blue Polkadot Plate,11.98,2,14451.0,United Kingdom
554986,2023-05-29,21430,Set/3 Red Gingham Rose Storage Box,14.09,3,14451.0,United Kingdom
554986,2023-05-29,22630,Dolly Girl Lunch Box,12.25,3,14451.0,United Kingdom
554986,2023-05-29,22629,Spaceboy Lunch Box,12.25,3,14451.0,United Kingdom
554986,2023-05-29,84563B,Blue & White Breakfast Tray,13.27,2,14451.0,United Kingdom
554986,2023-05-29,22171,3 Hook Photo Shelf Antique White,18.96,2,14451.0,United Kingdom
554986,2023-05-29,21174,Pottering In The Shed Metal Sign,12.38,2,14451.0,United Kingdom
554986,2023-05-29,21166,Cook With Wine Metal Sign,12.38,2,14451.0,United Kingdom
554986,2023-05-29,47593B,Scottie Dogs Baby Bib,10.65,3,14451.0,United Kingdom
554986,2023-05-29,21063,Party Invites Jazz Hearts,11.12,3,14451.0,United Kingdom
554986,2023-05-29,21329,Dinosaurs Writing Set,11.94,3,14451.0,United Kingdom
554986,2023-05-29,21328,Balloons Writing Set,11.94,3,14451.0,United Kingdom
554986,2023-05-29,21327,Skulls Writing Set,11.94,3,14451.0,United Kingdom
554986,2023-05-29,22562,Monsters Stencil Craft,11.53,2,14451.0,United Kingdom
554986,2023-05-29,23298,Spotty Bunting,15.32,3,14451.0,United Kingdom
554986,2023-05-29,85152,Hand Over The Chocolate Sign,12.4,2,14451.0,United Kingdom
554986,2023-05-29,82567,Airline Lounge Metal Sign,12.4,2,14451.0,United Kingdom
554986,2023-05-29,21175,Gin And Tonic Diet Metal Sign,12.86,2,14451.0,United Kingdom
554986,2023-05-29,22628,Picnic Boxes Set Of 3 Retrospot,15.32,4,14451.0,United Kingdom
554986,2023-05-29,84596B,Small Dolly Mix Design Orange Bowl,10.68,24,14451.0,United Kingdom
554986,2023-05-29,84596F,Small Marshmallows Pink Bowl,10.68,24,14451.0,United Kingdom
554986,2023-05-29,21937,Strawberry Picnic Bag,13.27,3,14451.0,United Kingdom
554986,2023-05-29,22469,Heart Of Wicker Small,11.94,4,14451.0,United Kingdom
554986,2023-05-29,22470,Heart Of Wicker Large,13.27,5,14451.0,United Kingdom
554986,2023-05-29,84519B,Carrot Charlie+Lola Coaster Set,11.53,6,14451.0,United Kingdom
554986,2023-05-29,79030G,Tumbler New England,10.65,6,14451.0,United Kingdom
554986,2023-05-29,85183B,Charlie & Lola Wastepaper Bin Flora,11.53,4,14451.0,United Kingdom
554986,2023-05-29,85132B,Charlie And Lola Table Tins,12.25,2,14451.0,United Kingdom
554986,2023-05-29,85132C,Charlie And Lola Figures Tins,12.25,2,14451.0,United Kingdom
554986,2023-05-29,20725,Lunch Bag Red Retrospot,5.97,5,14451.0,United Kingdom
554986,2023-05-29,23206,Lunch Bag Apple Design,5.97,1,14451.0,United Kingdom
554986,2023-05-29,20727,Lunch Bag Black Skull,5.97,5,14451.0,United Kingdom
554986,2023-05-29,22662,Lunch Bag Dolly Girl Design,5.97,5,14451.0,United Kingdom
554986,2023-05-29,22383,Lunch Bag Suki Design,5.97,5,14451.0,United Kingdom
554986,2023-05-29,23207,Lunch Bag Alphabet Design,5.97,6,14451.0,United Kingdom
554986,2023-05-29,20728,Lunch Bag Cars Blue,5.97,4,14451.0,United Kingdom
554986,2023-05-29,23209,Lunch Bag Vintage Doily,5.97,5,14451.0,United Kingdom
554987,2023-05-29,84970L,Single Heart Zinc T-Light Holder,11.22,2,14823.0,United Kingdom
554987,2023-05-29,23165,Large Ceramic Top Storage Jar,11.94,1,14823.0,United Kingdom
554987,2023-05-29,22464,Hanging Metal Heart Lantern,11.94,1,14823.0,United Kingdom
554987,2023-05-29,22795,Sweetheart Recipe Book Stand,17.17,1,14823.0,United Kingdom
554987,2023-05-29,22457,Natural Slate Heart Chalkboard,13.27,1,14823.0,United Kingdom
554987,2023-05-29,22189,Cream Heart Card Holder,14.3,1,14823.0,United Kingdom
554987,2023-05-29,22188,Black Heart Card Holder,14.3,1,14823.0,United Kingdom
554987,2023-05-29,82484,Wood Black Board Ant White Finish,18.4,1,14823.0,United Kingdom
554987,2023-05-29,22522,Childs Garden Fork Blue,11.12,1,14823.0,United Kingdom
554987,2023-05-29,22626,Black Kitchen Scales,18.96,1,14823.0,United Kingdom
554987,2023-05-29,20914,Set/5 Red Retrospot Lid Glass Bowls,13.27,1,14823.0,United Kingdom
554987,2023-05-29,22617,Baking Set Spaceboy Design,15.32,1,14823.0,United Kingdom
554987,2023-05-29,22723,Set Of 6 Herb Tins Sketchbook,14.3,2,14823.0,United Kingdom
554988,2023-05-29,84563B,Blue & White Breakfast Tray,13.27,1,15897.0,United Kingdom
554988,2023-05-29,16235,Recycled Pencil With Rabbit Eraser,10.47,11,15897.0,United Kingdom
554988,2023-05-29,22558,Clothes Pegs Retrospot Pack 24,11.94,1,15897.0,United Kingdom
554988,2023-05-29,20992,Jazz Hearts Purse Notebook,11.12,1,15897.0,United Kingdom
554988,2023-05-29,22981,Pantry Apple Corer,11.74,1,15897.0,United Kingdom
554988,2023-05-29,15039,Sandalwood Fan,11.12,130,15897.0,United Kingdom
554989,2023-05-29,22989,Set 2 Pantry Design Tea Towels,13.58,3,15897.0,United Kingdom
554989,2023-05-29,22990,Cotton Apron Pantry Design,15.32,1,15897.0,United Kingdom
554989,2023-05-29,84563B,Blue & White Breakfast Tray,13.27,2,15897.0,United Kingdom
554989,2023-05-29,16235,Recycled Pencil With Rabbit Eraser,10.47,36,15897.0,United Kingdom
554989,2023-05-29,20761,Blue Paisley Sketchbook,14.09,1,15897.0,United Kingdom
554989,2023-05-29,20766,Garden Path Sketchbook,14.09,1,15897.0,United Kingdom
554989,2023-05-29,22990,Cotton Apron Pantry Design,15.32,3,15897.0,United Kingdom
554989,2023-05-29,20992,Jazz Hearts Purse Notebook,11.12,1,15897.0,United Kingdom
554989,2023-05-29,22429,Enamel Measuring Jug Cream,14.61,1,15897.0,United Kingdom
554989,2023-05-29,84563B,Blue & White Breakfast Tray,13.27,2,15897.0,United Kingdom
554989,2023-05-29,84875D,Blue Square Compact Mirror,11.53,12,15897.0,United Kingdom
554989,2023-05-29,22561,Wooden School Colouring Set,11.94,4,15897.0,United Kingdom
554989,2023-05-29,16235,Recycled Pencil With Rabbit Eraser,10.47,36,15897.0,United Kingdom
554989,2023-05-29,22563,Happy Stencil Craft,11.53,1,15897.0,United Kingdom
554989,2023-05-29,22981,Pantry Apple Corer,11.74,2,15897.0,United Kingdom
554989,2023-05-29,84596B,Small Dolly Mix Design Orange Bowl,10.68,8,15897.0,United Kingdom
554989,2023-05-29,20711,Jumbo Bag Toys,6.19,1,15897.0,United Kingdom
554989,2023-05-29,21033,Jumbo Bag Charlie And Lola Toys,6.19,1,15897.0,United Kingdom
554990,2023-05-29,21668,Red Stripe Ceramic Drawer Knob,11.53,12,16567.0,United Kingdom
554990,2023-05-29,15060B,Fairy Cake Design Umbrella,14.09,8,16567.0,United Kingdom
554990,2023-05-29,85116,Black Candelabra T-Light Holder,10.92,24,16567.0,United Kingdom
554990,2023-05-29,79163,Black Champagne Glass,10.65,144,16567.0,United Kingdom
554990,2023-05-29,78124,Magazine Rack Gebra Assorted,11.53,24,16567.0,United Kingdom
554990,2023-05-29,21932,Scandinavian Paisley Picnic Bag,11.94,10,16567.0,United Kingdom
554990,2023-05-29,21933,Pink Vintage Paisley Picnic Bag,11.94,10,16567.0,United Kingdom
554990,2023-05-29,22123,Ping Microwave Apron,12.25,12,16567.0,United Kingdom
554990,2023-05-29,79337,Blue Flock Glass Candleholder,10.64,276,16567.0,United Kingdom
554991,2023-05-29,23145,Zinc T-Light Holder Star Large,11.22,1,14823.0,United Kingdom
554991,2023-05-29,21523,Doormat Fancy Font Home Sweet Home,18.4,1,14823.0,United Kingdom
554991,2023-05-29,21171,Bathroom Metal Sign,10.81,1,14823.0,United Kingdom
