TransactionNo,Date,ProductNo,ProductName,Price,Quantity,CustomerNo,Country
553940,2023-05-20,20724,Red Retrospot Charlotte Bag,11.12,10,14112.0,United Kingdom
553940,2023-05-20,23204,Charlotte Bag Apples Design,11.12,10,14112.0,United Kingdom
553940,2023-05-20,21931,Jumbo Storage Bag Suki,12.38,10,14112.0,United Kingdom
553940,2023-05-20,23203,Jumbo Bag Vintage Doily,6.19,10,14112.0,United Kingdom
553940,2023-05-20,23202,Jumbo Bag Vintage Leaf,6.19,10,14112.0,United Kingdom
553940,2023-05-20,22386,Jumbo Bag Pink Polkadot,6.19,10,14112.0,United Kingdom
553940,2023-05-20,85099B,Jumbo Bag Red Retrospot,6.19,10,14112.0,United Kingdom
553940,2023-05-20,23200,Jumbo Bag Pears,6.19,10,14112.0,United Kingdom
553940,2023-05-20,23199,Jumbo Bag Apples,6.19,10,14112.0,United Kingdom
553940,2023-05-20,22663,Jumbo Bag Dolly Girl Design,6.19,10,14112.0,United Kingdom
553940,2023-05-20,23201,Jumbo Bag Alphabet,6.19,10,14112.0,United Kingdom
553940,2023-05-20,85099C,Jumbo Bag Baroque Black White,6.19,10,14112.0,United Kingdom
553940,2023-05-20,22662,Lunch Bag Dolly Girl Design,5.97,10,14112.0,United Kingdom
553940,2023-05-20,22383,Lunch Bag Suki Design,5.97,10,14112.0,United Kingdom
553940,2023-05-20,20728,Lunch Bag Cars Blue,5.97,10,14112.0,United Kingdom
553940,2023-05-20,23207,Lunch Bag Alphabet Design,5.97,10,14112.0,United Kingdom
553940,2023-05-20,20727,Lunch Bag Black Skull,5.97,10,14112.0,United Kingdom
553940,2023-05-20,23208,Lunch Bag Vintage Leaf Design,5.97,10,14112.0,United Kingdom
553940,2023-05-20,23209,Lunch Bag Vintage Doily,5.97,10,14112.0,United Kingdom
553940,2023-05-20,20725,Lunch Bag Red Retrospot,5.97,10,14112.0,United Kingdom
553940,2023-05-20,23206,Lunch Bag Apple Design,5.97,10,14112.0,United Kingdom
553941,2023-05-20,22795,Sweetheart Recipe Book Stand,17.17,2,14334.0,United Kingdom
553941,2023-05-20,22854,Cream Sweetheart Egg Holder,15.32,4,14334.0,United Kingdom
553941,2023-05-20,22794,Sweetheart Wire Magazine Rack,18.4,2,14334.0,United Kingdom
553941,2023-05-20,22469,Heart Of Wicker Small,11.74,40,14334.0,United Kingdom
553941,2023-05-20,82484,Wood Black Board Ant White Finish,18.4,2,14334.0,United Kingdom
553941,2023-05-20,23096,Petit Tray Chic,11.94,12,14334.0,United Kingdom
553941,2023-05-20,23110,Parisienne Key Cabinet,16.14,2,14334.0,United Kingdom
553941,2023-05-20,21899,Garage Key Fob,10.92,24,14334.0,United Kingdom
553941,2023-05-20,48116,Doormat Multicolour Stripe,18.4,2,14334.0,United Kingdom
553941,2023-05-20,48194,Doormat Hearts,18.4,2,14334.0,United Kingdom
553941,2023-05-20,23284,Doormat Keep Calm And Come In,18.4,2,14334.0,United Kingdom
553941,2023-05-20,21523,Doormat Fancy Font Home Sweet Home,18.4,2,14334.0,United Kingdom
553941,2023-05-20,23181,Bull Dog Bottle Top Wall Clock,18.71,2,14334.0,United Kingdom
553941,2023-05-20,20983,12 Pencils Tall Tube Red Retrospot,11.12,12,14334.0,United Kingdom
553941,2023-05-20,20981,12 Pencils Tall Tube Woodland,11.12,12,14334.0,United Kingdom
553941,2023-05-20,22507,Memo Board Retrospot Design,15.32,4,14334.0,United Kingdom
553941,2023-05-20,21900,Key Fob Shed,10.92,24,14334.0,United Kingdom
553941,2023-05-20,23112,Parisienne Curio Cabinet,17.94,2,14334.0,United Kingdom
553941,2023-05-20,23300,Gardeners Kneeling Pad Cup Of Tea,11.94,12,14334.0,United Kingdom
553941,2023-05-20,23301,Gardeners Kneeling Pad Keep Calm,11.94,12,14334.0,United Kingdom
553942,2023-05-20,82486,3 Drawer Antique White Wood Cabinet,19.42,4,18055.0,United Kingdom
553942,2023-05-20,22149,Feltcraft 6 Flower Friends,12.4,6,18055.0,United Kingdom
553942,2023-05-20,22147,Feltcraft Butterfly Hearts,11.74,12,18055.0,United Kingdom
553942,2023-05-20,22568,Feltcraft Cushion Owl,14.09,4,18055.0,United Kingdom
553942,2023-05-20,22569,Feltcraft Cushion Butterfly,14.09,4,18055.0,United Kingdom
553942,2023-05-20,22651,Gentleman Shirt Repair Kit,11.12,12,18055.0,United Kingdom
553942,2023-05-20,21407,Brown Check Cat Doorstop,14.61,3,18055.0,United Kingdom
553942,2023-05-20,21115,Rose Caravan Doorstop,17.17,2,18055.0,United Kingdom
553942,2023-05-20,22183,Cake Stand Victorian Filigree Med,17.17,3,18055.0,United Kingdom
553942,2023-05-20,82482,Wooden Picture Frame White Finish,12.86,12,18055.0,United Kingdom
553942,2023-05-20,84879,Assorted Colour Bird Ornament,11.98,32,18055.0,United Kingdom
553942,2023-05-20,22617,Baking Set Spaceboy Design,15.32,6,18055.0,United Kingdom
553942,2023-05-20,22138,Baking Set 9 Piece Retrospot,15.32,6,18055.0,United Kingdom
553942,2023-05-20,21892,Traditional Wooden Catch Cup Game,11.53,12,18055.0,United Kingdom
553942,2023-05-20,21913,Vintage Seaside Jigsaw Puzzles,14.09,4,18055.0,United Kingdom
553942,2023-05-20,22798,Antique Glass Dressing Table Pot,13.27,8,18055.0,United Kingdom
553942,2023-05-20,22619,Set Of 6 Soldier Skittles,14.09,4,18055.0,United Kingdom
553942,2023-05-20,47566,Party Bunting,15.32,8,18055.0,United Kingdom
553942,2023-05-20,21791,Vintage Heads And Tails Card Game,11.53,12,18055.0,United Kingdom
553942,2023-05-20,22389,Paperweight Save The Planet,12.86,6,18055.0,United Kingdom
553942,2023-05-20,21175,Gin And Tonic Diet Metal Sign,12.86,12,18055.0,United Kingdom
553942,2023-05-20,46000M,Polyester Filler Pad 45x45cm,11.84,2,18055.0,United Kingdom
553942,2023-05-20,85123A,Cream Hanging Heart T-Light Holder,13.27,24,18055.0,United Kingdom
553942,2023-05-20,23103,Jingle Bell Heart Decoration,11.94,24,18055.0,United Kingdom
553942,2023-05-20,23161,Regency Cake Fork,11.53,12,18055.0,United Kingdom
553942,2023-05-20,23160,Regency Tea Spoon,11.53,12,18055.0,United Kingdom
553942,2023-05-20,23170,Regency Tea Plate Roses,11.94,12,18055.0,United Kingdom
553942,2023-05-20,23171,Regency Tea Plate Green,11.94,12,18055.0,United Kingdom
553942,2023-05-20,23172,Regency Tea Plate Pink,11.94,12,18055.0,United Kingdom
553942,2023-05-20,22699,Roses Regency Teacup And Saucer,13.27,6,18055.0,United Kingdom
553942,2023-05-20,22697,Green Regency Teacup And Saucer,13.27,6,18055.0,United Kingdom
553942,2023-05-20,22698,Pink Regency Teacup And Saucer,13.27,6,18055.0,United Kingdom
553942,2023-05-20,23174,Regency Sugar Bowl Green,14.5,6,18055.0,United Kingdom
553942,2023-05-20,23175,Regency Milk Jug Pink,13.58,4,18055.0,United Kingdom
553942,2023-05-20,23146,Triple Hook Antique Ivory Rose,13.62,8,18055.0,United Kingdom
553942,2023-05-20,22637,Piggy Bank Retrospot,12.86,4,18055.0,United Kingdom
553946,2023-05-20,22169,Family Album White Picture Frame,18.96,2,15601.0,United Kingdom
553946,2023-05-20,40016,Chinese Dragon Paper Lanterns,10.68,24,15601.0,United Kingdom
553946,2023-05-20,22752,Set 7 Babushka Nesting Boxes,18.96,8,15601.0,United Kingdom
553946,2023-05-20,21232,Strawberry Ceramic Trinket Pot,11.53,12,15601.0,United Kingdom
553946,2023-05-20,21754,Home Building Block Word,16.35,6,15601.0,United Kingdom
553946,2023-05-20,21506,Fancy Font Birthday Card,10.68,12,15601.0,United Kingdom
553946,2023-05-20,22023,Empire Birthday Card,10.68,12,15601.0,United Kingdom
553946,2023-05-20,21519,Gin & Tonic Diet Greeting Card,10.68,12,15601.0,United Kingdom
553946,2023-05-20,22037,Robot Birthday Card,10.68,12,15601.0,United Kingdom
553946,2023-05-20,22029,Spaceboy Birthday Card,10.68,12,15601.0,United Kingdom
553946,2023-05-20,22983,Card Billboard Font,10.68,12,15601.0,United Kingdom
553946,2023-05-20,22718,Card Cat And Tree,10.68,12,15601.0,United Kingdom
553946,2023-05-20,22028,Penny Farthing Birthday Card,10.68,12,15601.0,United Kingdom
553946,2023-05-20,22815,Card Psychedelic Apples,10.68,12,15601.0,United Kingdom
553946,2023-05-20,22817,Card Suki Birthday,10.68,12,15601.0,United Kingdom
553946,2023-05-20,22715,Card Wedding Day,10.68,12,15601.0,United Kingdom
553946,2023-05-20,22773,Green Drawer Knob Acrylic Edwardian,11.53,12,15601.0,United Kingdom
553946,2023-05-20,22497,Set Of 2 Tins Vintage Bathroom,14.61,4,15601.0,United Kingdom
553946,2023-05-20,85123A,Cream Hanging Heart T-Light Holder,13.27,12,15601.0,United Kingdom
553946,2023-05-20,23093,Small Parisienne Heart Photo Frame,12.8,8,15601.0,United Kingdom
553946,2023-05-20,23110,Parisienne Key Cabinet,16.14,4,15601.0,United Kingdom
553946,2023-05-20,23112,Parisienne Curio Cabinet,17.94,2,15601.0,United Kingdom
553946,2023-05-20,23118,Parisienne Jewellery Drawer,17.94,2,15601.0,United Kingdom
553946,2023-05-20,22666,Recipe Box Pantry Yellow Design,13.27,6,15601.0,United Kingdom
553946,2023-05-20,22722,Set Of 6 Spice Tins Pantry Design,14.3,4,15601.0,United Kingdom
553946,2023-05-20,22907,Pack Of 20 Napkins Pantry Design,11.12,12,15601.0,United Kingdom
553946,2023-05-20,23170,Regency Tea Plate Roses,11.94,12,15601.0,United Kingdom
553946,2023-05-20,22699,Roses Regency Teacup And Saucer,13.27,6,15601.0,United Kingdom
553946,2023-05-20,22171,3 Hook Photo Shelf Antique White,18.96,2,15601.0,United Kingdom
553946,2023-05-20,22173,Metal 4 Hook Hanger French Chateau,13.27,8,15601.0,United Kingdom
553946,2023-05-20,84687,Beach Hut Shelf W 3 Drawers,16.35,2,15601.0,United Kingdom
553946,2023-05-20,84685,Beach Hut Key Cabinet,14.09,4,15601.0,United Kingdom
553946,2023-05-20,72127,Columbian Candle Round,11.12,12,15601.0,United Kingdom
553946,2023-05-20,21131,Gold Standing Gnome,14.61,4,15601.0,United Kingdom
553946,2023-05-20,22170,Picture Frame Wood Triple Portrait,17.17,4,15601.0,United Kingdom
553946,2023-05-20,23202,Jumbo Bag Vintage Leaf,6.19,20,15601.0,United Kingdom
553978,2023-05-20,23203,Jumbo Bag Vintage Doily,5.97,200,16182.0,United Kingdom
553978,2023-05-20,23202,Jumbo Bag Vintage Leaf,5.97,200,16182.0,United Kingdom
553978,2023-05-20,23200,Jumbo Bag Pears,5.97,100,16182.0,United Kingdom
553978,2023-05-20,23199,Jumbo Bag Apples,5.97,200,16182.0,United Kingdom
553978,2023-05-20,85099B,Jumbo Bag Red Retrospot,6.04,200,16182.0,United Kingdom
553978,2023-05-20,21929,Jumbo Bag Pink Vintage Paisley,6.04,100,16182.0,United Kingdom
553979,2023-05-20,20749,Assorted Colour Mini Cases,16.76,12,15694.0,United Kingdom
553979,2023-05-20,47566,Party Bunting,14.5,50,15694.0,United Kingdom
553979,2023-05-20,22041,"Record Frame 7"" Single Size",12.86,12,15694.0,United Kingdom
553979,2023-05-20,35004B,Set Of 3 Black Flying Ducks,15.02,36,15694.0,United Kingdom
553996,2023-05-20,23084,Rabbit Night Light,12.38,12,15220.0,United Kingdom
553996,2023-05-20,23079,Toadstool Bedside Light,19.42,2,15220.0,United Kingdom
553996,2023-05-20,23280,Folding Butterfly Mirror Hot Pink,11.1,12,15220.0,United Kingdom
553996,2023-05-20,23281,Folding Butterfly Mirror Red,11.1,12,15220.0,United Kingdom
553996,2023-05-20,23282,Folding Butterfly Mirror Ivory,11.1,12,15220.0,United Kingdom
553996,2023-05-20,23298,Spotty Bunting,15.32,6,15220.0,United Kingdom
553996,2023-05-20,21894,Potting Shed Seed Envelopes,11.53,12,15220.0,United Kingdom
553996,2023-05-20,23053,Recycled Acapulco Mat Pink,18.71,2,15220.0,United Kingdom
553996,2023-05-20,23050,Recycled Acapulco Mat Green,18.71,2,15220.0,United Kingdom
553996,2023-05-20,21090,Set/6 Collage Paper Plates,10.65,120,15220.0,United Kingdom
553996,2023-05-20,21084,Set/6 Collage Paper Cups,10.44,120,15220.0,United Kingdom
553996,2023-05-20,84978,Hanging Heart Jar T-Light Holder,11.53,12,15220.0,United Kingdom
553996,2023-05-20,22212,Four Hook White Lovebirds,12.4,6,15220.0,United Kingdom
553996,2023-05-20,21980,Pack Of 12 Red Retrospot Tissues,10.55,24,15220.0,United Kingdom
553996,2023-05-20,22109,Full English Breakfast Plate,14.09,4,15220.0,United Kingdom
553996,2023-05-20,22107,Pizza Plate In Box,14.09,4,15220.0,United Kingdom
553996,2023-05-20,22190,Local Cafe Mug,12.4,6,15220.0,United Kingdom
553996,2023-05-20,22457,Natural Slate Heart Chalkboard,13.27,6,15220.0,United Kingdom
553996,2023-05-20,84313C,Orange Tv Tray Table,12.25,6,15220.0,United Kingdom
553996,2023-05-20,21731,Red Toadstool Led Night Light,11.94,12,15220.0,United Kingdom
553997,2023-05-20,22630,Dolly Girl Lunch Box,11.94,64,12656.0,France
553997,2023-05-20,22629,Spaceboy Lunch Box,11.94,64,12656.0,France
553997,2023-05-20,21937,Strawberry Picnic Bag,12.86,50,12656.0,France
553997,2023-05-20,21936,Red Retrospot Picnic Bag,12.86,100,12656.0,France
553997,2023-05-20,15058A,Blue Polkadot Garden Parasol,18.4,2,12656.0,France
553997,2023-05-20,15058B,Pink Polkadot Garden Parasol,18.4,2,12656.0,France
553997,2023-05-20,22382,Lunch Bag Spaceboy Design,5.97,50,12656.0,France
553997,2023-05-20,22662,Lunch Bag Dolly Girl Design,5.97,30,12656.0,France
553997,2023-05-20,23206,Lunch Bag Apple Design,5.97,30,12656.0,France
553997,2023-05-20,20725,Lunch Bag Red Retrospot,5.97,50,12656.0,France
553997,2023-05-20,20726,Lunch Bag Woodland,5.97,20,12656.0,France
554000,2023-05-20,18094C,White And Blue Ceramic Oil Burner,11.53,12,14794.0,United Kingdom
554000,2023-05-20,23170,Regency Tea Plate Roses,11.94,12,14794.0,United Kingdom
554000,2023-05-20,23171,Regency Tea Plate Green,11.94,12,14794.0,United Kingdom
554000,2023-05-20,23172,Regency Tea Plate Pink,11.94,12,14794.0,United Kingdom
554000,2023-05-20,23280,Folding Butterfly Mirror Hot Pink,11.1,12,14794.0,United Kingdom
554000,2023-05-20,23281,Folding Butterfly Mirror Red,11.1,12,14794.0,United Kingdom
554000,2023-05-20,22908,Pack Of 20 Napkins Red Apples,11.12,12,14794.0,United Kingdom
554000,2023-05-20,22727,Alarm Clock Bakelike Red,14.09,4,14794.0,United Kingdom
554000,2023-05-20,22729,Alarm Clock Bakelike Orange,14.09,4,14794.0,United Kingdom
554000,2023-05-20,21336,Gold Washbag,13.27,6,14794.0,United Kingdom
554000,2023-05-20,16161G,Wrap Bad Hair Day,10.35,25,14794.0,United Kingdom
554000,2023-05-20,22815,Card Psychedelic Apples,10.68,12,14794.0,United Kingdom
554000,2023-05-20,23202,Jumbo Bag Vintage Leaf,6.19,10,14794.0,United Kingdom
554003,2023-05-20,22961,Jam Making Set Printed,11.53,96,13324.0,United Kingdom
554003,2023-05-20,23170,Regency Tea Plate Roses,11.74,48,13324.0,United Kingdom
554003,2023-05-20,23172,Regency Tea Plate Pink,11.74,48,13324.0,United Kingdom
554003,2023-05-20,23171,Regency Tea Plate Green,11.74,48,13324.0,United Kingdom
554007,2023-05-20,23081,Green Metal Box Army Supplies,18.71,1,17961.0,United Kingdom
554008,2023-05-20,37450,Ceramic Cake Bowl + Hanging Cakes,13.27,6,17455.0,United Kingdom
554008,2023-05-20,37446,Mini Cake Stand With Hanging Cakes,11.74,8,17455.0,United Kingdom
554008,2023-05-20,23206,Lunch Bag Apple Design,5.97,10,17455.0,United Kingdom
554008,2023-05-20,23207,Lunch Bag Alphabet Design,5.97,10,17455.0,United Kingdom
554008,2023-05-20,23208,Lunch Bag Vintage Leaf Design,5.97,10,17455.0,United Kingdom
554008,2023-05-20,22383,Lunch Bag Suki Design,5.97,10,17455.0,United Kingdom
554008,2023-05-20,20728,Lunch Bag Cars Blue,5.97,10,17455.0,United Kingdom
554009,2023-05-20,22089,Paper Bunting Vintage Paisley,13.27,6,12935.0,United Kingdom
554009,2023-05-20,23298,Spotty Bunting,15.32,3,12935.0,United Kingdom
554009,2023-05-20,22963,Jam Jar With Green Lid,11.12,12,12935.0,United Kingdom
554009,2023-05-20,84987,Set Of 36 Teatime Paper Doilies,11.74,12,12935.0,United Kingdom
554009,2023-05-20,21787,Rain Poncho Retrospot,11.12,24,12935.0,United Kingdom
554009,2023-05-20,22367,Childrens Apron Spaceboy Design,12.25,8,12935.0,United Kingdom
554009,2023-05-20,47591D,Pink Fairy Cake Childrens Apron,12.25,8,12935.0,United Kingdom
554009,2023-05-20,84950,Assorted Colour T-Light Holder,10.92,12,12935.0,United Kingdom
554009,2023-05-20,18097C,White Tall Porcelain T-Light Holder,12.86,6,12935.0,United Kingdom
554009,2023-05-20,20971,Pink Blue Felt Craft Trinket Box,11.53,12,12935.0,United Kingdom
554009,2023-05-20,22149,Feltcraft 6 Flower Friends,12.4,6,12935.0,United Kingdom
554009,2023-05-20,16156S,Wrap Pink Fairy Cakes,10.68,25,12935.0,United Kingdom
554009,2023-05-20,21498,Red Retrospot Wrap,10.68,25,12935.0,United Kingdom
554009,2023-05-20,21499,Blue Polkadot Wrap,10.68,25,12935.0,United Kingdom
554009,2023-05-20,22055,Mini Cake Stand Hanging Strawbery,11.94,8,12935.0,United Kingdom
554009,2023-05-20,21936,Red Retrospot Picnic Bag,13.27,5,12935.0,United Kingdom
554009,2023-05-20,22558,Clothes Pegs Retrospot Pack 24,11.94,12,12935.0,United Kingdom
554009,2023-05-20,22090,Paper Bunting Retrospot,13.27,12,12935.0,United Kingdom
554009,2023-05-20,84380,Set Of 3 Butterfly Cookie Cutters,11.53,12,12935.0,United Kingdom
554009,2023-05-20,22961,Jam Making Set Printed,11.74,12,12935.0,United Kingdom
554009,2023-05-20,22960,Jam Making Set With Jars,14.61,6,12935.0,United Kingdom
554009,2023-05-20,84991,60 Teatime Fairy Cake Cases,10.81,24,12935.0,United Kingdom
554009,2023-05-20,71459,Hanging Jam Jar T-Light Holders,11.12,12,12935.0,United Kingdom
554009,2023-05-20,20725,Lunch Bag Red Retrospot,5.97,10,12935.0,United Kingdom
554013,2023-05-20,22569,Feltcraft Cushion Butterfly,14.09,4,13308.0,United Kingdom
554013,2023-05-20,22568,Feltcraft Cushion Owl,14.09,4,13308.0,United Kingdom
554013,2023-05-20,22147,Feltcraft Butterfly Hearts,11.74,12,13308.0,United Kingdom
554013,2023-05-20,22271,Feltcraft Doll Rosie,13.27,6,13308.0,United Kingdom
554013,2023-05-20,22274,Feltcraft Doll Emily,13.27,6,13308.0,United Kingdom
554013,2023-05-20,22149,Feltcraft 6 Flower Friends,12.4,6,13308.0,United Kingdom
554013,2023-05-20,22077,6 Ribbons Rustic Charm,11.94,12,13308.0,United Kingdom
554013,2023-05-20,23299,Food Cover With Beads Set 2,14.09,6,13308.0,United Kingdom
554013,2023-05-20,22427,Enamel Flower Jug Cream,16.35,3,13308.0,United Kingdom
554013,2023-05-20,23184,Bull Dog Bottle Opener,14.5,36,13308.0,United Kingdom
554013,2023-05-20,23056,Flowers Chandelier T-Light Holder,16.66,12,13308.0,United Kingdom
554013,2023-05-20,22178,Victorian Glass Hanging T-Light,11.53,12,13308.0,United Kingdom
554013,2023-05-20,71477,Coloured Glass Star T-Light Holder,13.07,24,13308.0,United Kingdom
554013,2023-05-20,71053,White Moroccan Metal Lantern,14.09,4,13308.0,United Kingdom
554013,2023-05-20,23109,Pack Of Six Led Tea Lights,13.21,8,13308.0,United Kingdom
554013,2023-05-20,23170,Regency Tea Plate Roses,11.94,12,13308.0,United Kingdom
554013,2023-05-20,22699,Roses Regency Teacup And Saucer,13.27,6,13308.0,United Kingdom
554013,2023-05-20,22507,Memo Board Retrospot Design,15.32,4,13308.0,United Kingdom
554013,2023-05-20,23166,Medium Ceramic Top Storage Jar,11.53,12,13308.0,United Kingdom
554013,2023-05-20,23165,Large Ceramic Top Storage Jar,11.94,12,13308.0,United Kingdom
554013,2023-05-20,22090,Paper Bunting Retrospot,13.27,6,13308.0,United Kingdom
554013,2023-05-20,22089,Paper Bunting Vintage Paisley,13.27,6,13308.0,United Kingdom
554013,2023-05-20,22139,Retrospot Tea Set Ceramic 11 Pc,15.32,6,13308.0,United Kingdom
554013,2023-05-20,84077,World War 2 Gliders Asstd Designs,10.47,288,13308.0,United Kingdom
554013,2023-05-20,22570,Feltcraft Cushion Rabbit,14.09,4,13308.0,United Kingdom
554014,2023-05-20,84970L,Single Heart Zinc T-Light Holder,11.22,12,13856.0,United Kingdom
554014,2023-05-20,35961,Folkart Zinc Heart Christmas Dec,11.12,12,13856.0,United Kingdom
554014,2023-05-20,84970S,Hanging Heart Zinc T-Light Holder,11.12,12,13856.0,United Kingdom
554014,2023-05-20,20723,Strawberry Charlotte Bag,11.12,10,13856.0,United Kingdom
554014,2023-05-20,79000,Moroccan Tea Glass,11.12,36,13856.0,United Kingdom
554014,2023-05-20,21925,Union Stripe Cushion Cover,11.53,12,13856.0,United Kingdom
554014,2023-05-20,20724,Red Retrospot Charlotte Bag,11.12,10,13856.0,United Kingdom
554015,2023-05-20,48138,Doormat Union Flag,18.4,2,17644.0,United Kingdom
554015,2023-05-20,20685,Doormat Red Retrospot,18.4,2,17644.0,United Kingdom
554015,2023-05-20,48194,Doormat Hearts,18.4,2,17644.0,United Kingdom
554015,2023-05-20,23146,Triple Hook Antique Ivory Rose,13.62,4,17644.0,United Kingdom
554015,2023-05-20,23147,Single Antique Rose Hook Ivory,11.74,12,17644.0,United Kingdom
554015,2023-05-20,21670,Blue Spot Ceramic Drawer Knob,11.53,12,17644.0,United Kingdom
554015,2023-05-20,23298,Spotty Bunting,15.32,3,17644.0,United Kingdom
554015,2023-05-20,21844,Red Retrospot Mug,13.27,6,17644.0,United Kingdom
554015,2023-05-20,21980,Pack Of 12 Red Retrospot Tissues,10.55,24,17644.0,United Kingdom
554015,2023-05-20,22045,Spaceboy Gift Wrap,10.68,25,17644.0,United Kingdom
554015,2023-05-20,22708,Wrap Dolly Girl,10.68,25,17644.0,United Kingdom
554015,2023-05-20,22029,Spaceboy Birthday Card,10.68,12,17644.0,United Kingdom
554015,2023-05-20,22712,Card Dolly Girl,10.68,12,17644.0,United Kingdom
554015,2023-05-20,23191,Bundle Of 3 Retro Note Books,11.94,12,17644.0,United Kingdom
554015,2023-05-20,22568,Feltcraft Cushion Owl,14.09,4,17644.0,United Kingdom
554015,2023-05-20,22569,Feltcraft Cushion Butterfly,14.09,4,17644.0,United Kingdom
554015,2023-05-20,22570,Feltcraft Cushion Rabbit,14.09,4,17644.0,United Kingdom
554015,2023-05-20,84880,White Wire Egg Holder,17.94,3,17644.0,United Kingdom
554015,2023-05-20,47566,Party Bunting,15.32,4,17644.0,United Kingdom
554015,2023-05-20,21936,Red Retrospot Picnic Bag,13.27,5,17644.0,United Kingdom
554015,2023-05-20,21754,Home Building Block Word,16.35,3,17644.0,United Kingdom
554015,2023-05-20,20724,Red Retrospot Charlotte Bag,11.12,10,17644.0,United Kingdom
554015,2023-05-20,23118,Parisienne Jewellery Drawer,17.94,2,17644.0,United Kingdom
554015,2023-05-20,22784,Lantern Cream Gazebo,15.32,3,17644.0,United Kingdom
554015,2023-05-20,22385,Jumbo Bag Spaceboy Design,6.19,10,17644.0,United Kingdom
554015,2023-05-20,85099B,Jumbo Bag Red Retrospot,6.19,10,17644.0,United Kingdom
554015,2023-05-20,22382,Lunch Bag Spaceboy Design,5.97,10,17644.0,United Kingdom
554016,2023-05-20,84945,Multi Colour Silver T-Light Holder,11.12,6,13243.0,United Kingdom
554016,2023-05-20,22474,Spaceboy Tv Dinner Tray,15.32,3,13243.0,United Kingdom
554016,2023-05-20,22472,Tv Dinner Tray Dolly Girl,15.32,3,13243.0,United Kingdom
554016,2023-05-20,20674,Green Polkadot Bowl,11.53,12,13243.0,United Kingdom
554016,2023-05-20,20675,Blue Polkadot Bowl,11.53,12,13243.0,United Kingdom
554016,2023-05-20,22977,Dolly Girl Childrens Egg Cup,11.53,6,13243.0,United Kingdom
554016,2023-05-20,22975,Spaceboy Childrens Egg Cup,11.53,6,13243.0,United Kingdom
554016,2023-05-20,82482,Wooden Picture Frame White Finish,12.86,3,13243.0,United Kingdom
554016,2023-05-20,22089,Paper Bunting Vintage Paisley,13.27,4,13243.0,United Kingdom
554016,2023-05-20,22088,Paper Bunting Coloured Lace,13.27,4,13243.0,United Kingdom
554016,2023-05-20,21930,Jumbo Storage Bag Skulls,12.38,2,13243.0,United Kingdom
554016,2023-05-20,22294,Heart Filigree Dove Small,11.53,1,13243.0,United Kingdom
554016,2023-05-20,20677,Pink Polkadot Bowl,11.53,8,13243.0,United Kingdom
554016,2023-05-20,22296,Heart Ivory Trellis Large,11.94,3,13243.0,United Kingdom
554016,2023-05-20,21389,Ivory Hanging Decoration Bird,11.12,2,13243.0,United Kingdom
554016,2023-05-20,20676,Red Retrospot Bowl,11.53,12,13243.0,United Kingdom
554016,2023-05-20,21828,Eight Piece Snake Set,11.53,1,13243.0,United Kingdom
554016,2023-05-20,84997D,Childrens Cutlery Polkadot Pink,14.5,5,13243.0,United Kingdom
554016,2023-05-20,84997C,Childrens Cutlery Polkadot Blue,14.5,4,13243.0,United Kingdom
554016,2023-05-20,84997A,Childrens Cutlery Polkadot Green,14.5,6,13243.0,United Kingdom
554016,2023-05-20,23254,Childrens Cutlery Dolly Girl,14.5,4,13243.0,United Kingdom
554016,2023-05-20,23298,Spotty Bunting,15.32,4,13243.0,United Kingdom
554016,2023-05-20,22156,Heart Decoration With Pearls,11.12,6,13243.0,United Kingdom
554016,2023-05-20,22602,Retrospot Wooden Heart Decoration,11.12,6,13243.0,United Kingdom
554016,2023-05-20,22083,Paper Chain Kit Retrospot,13.27,4,13243.0,United Kingdom
554016,2023-05-20,21389,Ivory Hanging Decoration Bird,11.12,8,13243.0,United Kingdom
554016,2023-05-20,21871,Save The Planet Mug,11.53,6,13243.0,United Kingdom
554016,2023-05-20,22328,Round Snack Boxes Set Of 4 Fruits,13.27,2,13243.0,United Kingdom
554016,2023-05-20,22326,Round Snack Boxes Set Of4 Woodland,13.27,3,13243.0,United Kingdom
554016,2023-05-20,22327,Round Snack Boxes Set Of 4 Skulls,13.27,2,13243.0,United Kingdom
554016,2023-05-20,21916,Set 12 Retro White Chalk Sticks,10.68,6,13243.0,United Kingdom
554016,2023-05-20,21056,Doctor's Bag Soft Toy,19.42,2,13243.0,United Kingdom
554016,2023-05-20,22090,Paper Bunting Retrospot,13.27,4,13243.0,United Kingdom
554016,2023-05-20,22636,Childs Breakfast Set Circus Parade,18.96,4,13243.0,United Kingdom
554016,2023-05-20,22457,Natural Slate Heart Chalkboard,13.27,6,13243.0,United Kingdom
554016,2023-05-20,84951A,Set Of 4 Pistachio Lovebird Coaster,11.06,6,13243.0,United Kingdom
554016,2023-05-20,23255,Childrens Cutlery Circus Parade,14.5,4,13243.0,United Kingdom
554016,2023-05-20,23256,Childrens Cutlery Spaceboy,14.5,4,13243.0,United Kingdom
554016,2023-05-20,21172,Party Metal Sign,11.74,6,13243.0,United Kingdom
554016,2023-05-20,22315,200 Red + White Bendy Straws,11.53,1,13243.0,United Kingdom
554016,2023-05-20,85123A,Cream Hanging Heart T-Light Holder,13.27,3,13243.0,United Kingdom
554016,2023-05-20,84969,Box Of 6 Assorted Colour Teaspoons,14.61,3,13243.0,United Kingdom
554016,2023-05-20,22973,Children's Circus Parade Mug,11.94,6,13243.0,United Kingdom
554016,2023-05-20,22617,Baking Set Spaceboy Design,15.32,2,13243.0,United Kingdom
554016,2023-05-20,22138,Baking Set 9 Piece Retrospot,15.32,2,13243.0,United Kingdom
554016,2023-05-20,22993,Set Of 4 Pantry Jelly Moulds,11.53,2,13243.0,United Kingdom
554016,2023-05-20,22992,Revolver Wooden Ruler,12.25,3,13243.0,United Kingdom
554016,2023-05-20,22991,Giraffe Wooden Ruler,12.25,3,13243.0,United Kingdom
554016,2023-05-20,22085,Paper Chain Kit Skulls,13.27,3,13243.0,United Kingdom
554016,2023-05-20,23201,Jumbo Bag Alphabet,6.19,4,13243.0,United Kingdom
554016,2023-05-20,22385,Jumbo Bag Spaceboy Design,6.19,2,13243.0,United Kingdom
554016,2023-05-20,20712,Jumbo Bag Woodland Animals,6.19,2,13243.0,United Kingdom
554016,2023-05-20,23200,Jumbo Bag Pears,6.19,2,13243.0,United Kingdom
554018,2023-05-20,23284,Doormat Keep Calm And Come In,18.4,2,17644.0,United Kingdom
554018,2023-05-20,23283,Doormat Vintage Leaf,18.4,2,17644.0,United Kingdom
554018,2023-05-20,23205,Charlotte Bag Vintage Alphabet,11.12,10,17644.0,United Kingdom
