TransactionNo,Date,ProductNo,ProductName,Price,Quantity,CustomerNo,Country
560035,2023-07-14,23064,Cinderella Chandelier,61.45,3,17706.0,United Kingdom
559981,2023-07-14,84078A,Set/4 White Retro Storage Cubes,51.2,2,14562.0,United Kingdom
560089,2023-07-14,22503,Cabin Bag Vintage Paisley,40.95,1,12748.0,United Kingdom
560090,2023-07-14,23142,Ivory Wire Kitchen Organiser,31.56,1,17090.0,United Kingdom
560090,2023-07-14,23173,Regency Teapot Roses,30.71,1,17090.0,United Kingdom
559931,2023-07-14,22847,Bread Bin Diner Style Ivory,27.62,2,17738.0,United Kingdom
559989,2023-07-14,22847,Bread Bin Diner Style Ivory,27.62,2,13319.0,United Kingdom
559989,2023-07-14,22846,Bread Bin Diner Style Red,27.62,2,13319.0,United Kingdom
560036,2023-07-14,22846,Bread Bin Diner Style Red,27.62,2,14911.0,EIRE
C559939,2023-07-14,22847,Bread Bin Diner Style Ivory,27.62,-1,14426.0,United Kingdom
560090,2023-07-14,21922,Union Stripe With Fringe Hammock,27.3,1,17090.0,United Kingdom
560090,2023-07-14,22504,Cabin Bag Vintage Retrospot,27.3,1,17090.0,United Kingdom
560090,2023-07-14,23050,Recycled Acapulco Mat Green,27.3,1,17090.0,United Kingdom
560090,2023-07-14,23051,Recycled Acapulco Mat Blue,27.3,1,17090.0,United Kingdom
560090,2023-07-14,48111,Doormat 3 Smiley Cats,26.43,1,17090.0,United Kingdom
560090,2023-07-14,48185,Doormat Fairy Cake,26.43,1,17090.0,United Kingdom
560090,2023-07-14,48194,Doormat Hearts,26.43,1,17090.0,United Kingdom
560090,2023-07-14,22781,Gumball Magazine Rack,25.58,1,17090.0,United Kingdom
559929,2023-07-14,21628,Triangular Pouffe Vintage,25.57,2,14265.0,Unspecified
559935,2023-07-14,22846,Bread Bin Diner Style Red,25.57,4,15125.0,United Kingdom
559991,2023-07-14,22839,3 Tier Cake Tin Green And Cream,25.57,1,14527.0,United Kingdom
559991,2023-07-14,21627,Elephant Carnival Pouffe,25.57,1,14527.0,United Kingdom
560036,2023-07-14,22847,Bread Bin Diner Style Ivory,25.57,4,14911.0,EIRE
560049,2023-07-14,22838,3 Tier Cake Tin Red And Cream,25.57,1,14857.0,United Kingdom
560106,2023-07-14,22605,Wooden Croquet Garden Set,25.57,2,17554.0,United Kingdom
560090,2023-07-14,23253,16 Piece Cutlery Set Pantry Design,24.73,3,17090.0,United Kingdom
559929,2023-07-14,22485,Set Of 2 Wooden Market Crates,23.32,2,14265.0,Unspecified
559929,2023-07-14,22423,Regency Cakestand 3 Tier,23.32,1,14265.0,Unspecified
559930,2023-07-14,22423,Regency Cakestand 3 Tier,23.32,8,17738.0,United Kingdom
559932,2023-07-14,22605,Wooden Croquet Garden Set,23.32,12,17389.0,United Kingdom
559932,2023-07-14,22760,Tray Breakfast In Bed,23.32,18,17389.0,United Kingdom
559933,2023-07-14,21735,Two Door Curio Cabinet,23.32,1,16719.0,United Kingdom
559938,2023-07-14,21361,Love Large Wood Letters,23.32,1,17315.0,United Kingdom
559981,2023-07-14,85066,Cream Sweetheart Mini Chest,23.32,1,14562.0,United Kingdom
559982,2023-07-14,22423,Regency Cakestand 3 Tier,23.32,2,12915.0,United Kingdom
559991,2023-07-14,22424,Enamel Bread Bin Cream,23.32,1,14527.0,United Kingdom
559991,2023-07-14,22282,12 Egg House Painted Wood,23.32,1,14527.0,United Kingdom
560035,2023-07-14,85066,Cream Sweetheart Mini Chest,23.32,3,17706.0,United Kingdom
560035,2023-07-14,21340,Classic Metal Birdcage Plant Holder,23.32,3,17706.0,United Kingdom
560035,2023-07-14,84968A,Set Of 16 Vintage Rose Cutlery,23.32,6,17706.0,United Kingdom
560036,2023-07-14,22424,Enamel Bread Bin Cream,23.32,1,14911.0,EIRE
560041,2023-07-14,22423,Regency Cakestand 3 Tier,23.32,4,14156.0,EIRE
560048,2023-07-14,22423,Regency Cakestand 3 Tier,23.32,2,13515.0,United Kingdom
560049,2023-07-14,22526,Wheelbarrow For Children,23.32,2,14857.0,United Kingdom
560049,2023-07-14,85066,Cream Sweetheart Mini Chest,23.32,2,14857.0,United Kingdom
560078,2023-07-14,22423,Regency Cakestand 3 Tier,23.32,2,16040.0,United Kingdom
560094,2023-07-14,85066,Cream Sweetheart Mini Chest,23.32,4,18109.0,United Kingdom
560094,2023-07-14,21340,Classic Metal Birdcage Plant Holder,23.32,3,18109.0,United Kingdom
560095,2023-07-14,21361,Love Large Wood Letters,23.32,1,17848.0,United Kingdom
C559983,2023-07-14,85066,Cream Sweetheart Mini Chest,23.32,-1,14562.0,United Kingdom
559933,2023-07-14,23104,Ivory Cafe Hanging Lamp,23.06,2,16719.0,United Kingdom
559937,2023-07-14,23111,Parisienne Sewing Box,23.06,1,13577.0,United Kingdom
559951,2023-07-14,23065,Large Deco Jewellery Stand,23.06,2,14847.0,United Kingdom
559984,2023-07-14,23018,Large Apothecary Measuring Jar,23.06,1,16657.0,United Kingdom
560018,2023-07-14,23018,Large Apothecary Measuring Jar,23.06,1,15987.0,United Kingdom
560093,2023-07-14,23020,Glass Songbird Storage Jar,23.06,1,14461.0,United Kingdom
560102,2023-07-14,23020,Glass Songbird Storage Jar,23.06,1,13994.0,United Kingdom
559928,2023-07-14,23241,Treasure Tin Gymkhana Design,12.38,6,12405.0,Finland
559928,2023-07-14,23240,Set Of 4 Knick Knack Tins Doily,14.5,6,12405.0,Finland
559928,2023-07-14,22138,Baking Set 9 Piece Retrospot,15.32,9,12405.0,Finland
559928,2023-07-14,22617,Baking Set Spaceboy Design,15.32,6,12405.0,Finland
559928,2023-07-14,21395,Blue Polkadot Beaker,10.65,48,12405.0,Finland
559928,2023-07-14,21394,Red Polkadot Beaker,10.65,48,12405.0,Finland
559928,2023-07-14,35810A,Enamel Pink Coffee Container,11.1,12,12405.0,Finland
559928,2023-07-14,47593B,Scottie Dogs Baby Bib,10.65,48,12405.0,Finland
559928,2023-07-14,21578,Woodland Design Cotton Tote Bag,12.56,11,12405.0,Finland
559928,2023-07-14,21429,Red Gingham Rose Jewellery Box,12.25,8,12405.0,Finland
559928,2023-07-14,20750,Red Retrospot Mini Cases,18.4,10,12405.0,Finland
559928,2023-07-14,20749,Assorted Colour Mini Cases,18.4,6,12405.0,Finland
559928,2023-07-14,84912A,Pink Rose Washbag,14.09,4,12405.0,Finland
559928,2023-07-14,21380,Wooden Happy Birthday Garland,13.27,6,12405.0,Finland
559928,2023-07-14,22498,Wooden Regatta Bunting,16.35,12,12405.0,Finland
559928,2023-07-14,22668,Pink Baby Bunting,13.27,10,12405.0,Finland
559928,2023-07-14,47590A,Blue Happy Birthday Bunting,15.84,9,12405.0,Finland
559928,2023-07-14,47566B,Tea Time Party Bunting,15.32,8,12405.0,Finland
559928,2023-07-14,47590B,Pink Happy Birthday Bunting,15.84,9,12405.0,Finland
559928,2023-07-14,22317,Five Cats Hanging Decoration,13.27,6,12405.0,Finland
559928,2023-07-14,22325,Mobile Vintage Hearts,15.32,9,12405.0,Finland
559928,2023-07-14,22318,Five Heart Hanging Decoration,13.27,12,12405.0,Finland
559928,2023-07-14,21249,Woodland Height Chart Stickers,13.27,12,12405.0,Finland
559928,2023-07-14,21251,Dinosaur Height Chart Sticker Set,13.27,12,12405.0,Finland
559928,2023-07-14,21156,Retrospot Childrens Apron,12.25,8,12405.0,Finland
559928,2023-07-14,22367,Childrens Apron Spaceboy Design,12.25,8,12405.0,Finland
559928,2023-07-14,47591D,Pink Fairy Cake Childrens Apron,12.25,8,12405.0,Finland
559928,2023-07-14,23243,Set Of Tea Coffee Sugar Tins Pantry,15.32,4,12405.0,Finland
559928,2023-07-14,21975,Pack Of 60 Dinosaur Cake Cases,10.81,48,12405.0,Finland
559928,2023-07-14,22417,Pack Of 60 Spaceboy Cake Cases,10.81,24,12405.0,Finland
559928,2023-07-14,21976,Pack Of 60 Mushroom Cake Cases,10.81,24,12405.0,Finland
559928,2023-07-14,21977,Pack Of 60 Pink Paisley Cake Cases,10.81,24,12405.0,Finland
559928,2023-07-14,22951,60 Cake Cases Dolly Girl Design,10.81,24,12405.0,Finland
559928,2023-07-14,84991,60 Teatime Fairy Cake Cases,10.81,24,12405.0,Finland
559928,2023-07-14,23307,Set Of 60 Pantry Design Cake Cases,10.81,24,12405.0,Finland
559928,2023-07-14,22627,Mint Kitchen Scales,18.96,2,12405.0,Finland
559928,2023-07-14,22624,Ivory Kitchen Scales,18.96,2,12405.0,Finland
559928,2023-07-14,22720,Set Of 3 Cake Tins Pantry Design,15.32,6,12405.0,Finland
559928,2023-07-14,22326,Round Snack Boxes Set Of4 Woodland,13.27,18,12405.0,Finland
559928,2023-07-14,23109,Pack Of Six Led Tea Lights,13.21,12,12405.0,Finland
559928,2023-07-14,21199,Pink Heart Confetti In Tube,11.94,12,12405.0,Finland
559928,2023-07-14,21986,Pack Of 12 Pink Polkadot Tissues,10.55,48,12405.0,Finland
559928,2023-07-14,21981,Pack Of 12 Woodland Tissues,10.55,48,12405.0,Finland
559928,2023-07-14,22614,Pack Of 12 Spaceboy Tissues,10.55,48,12405.0,Finland
559928,2023-07-14,22551,Plasters In Tin Spaceboy,11.94,12,12405.0,Finland
559928,2023-07-14,22554,Plasters In Tin Woodland Animals,11.94,12,12405.0,Finland
559928,2023-07-14,22556,Plasters In Tin Circus Parade,11.94,12,12405.0,Finland
559928,2023-07-14,20977,36 Pencils Tube Woodland,11.53,16,12405.0,Finland
559928,2023-07-14,20981,12 Pencils Tall Tube Woodland,11.12,12,12405.0,Finland
559928,2023-07-14,21424,Woodland Storage Box Large,13.27,12,12405.0,Finland
559928,2023-07-14,21426,Woodland Storage Box Small,12.4,12,12405.0,Finland
559928,2023-07-14,21430,Set/3 Red Gingham Rose Storage Box,14.09,12,12405.0,Finland
559928,2023-07-14,23238,Set Of 4 Knick Knack Tins London,14.5,6,12405.0,Finland
559929,2023-07-14,22960,Jam Making Set With Jars,14.61,6,14265.0,Unspecified
559929,2023-07-14,16161P,Wrap English Rose,10.68,25,14265.0,Unspecified
559929,2023-07-14,21499,Blue Polkadot Wrap,10.68,25,14265.0,Unspecified
559929,2023-07-14,21500,Pink Polkadot Wrap,10.68,25,14265.0,Unspecified
559929,2023-07-14,21503,Toybox Wrap,10.68,25,14265.0,Unspecified
559929,2023-07-14,22047,Empire Gift Wrap,10.68,25,14265.0,Unspecified
559929,2023-07-14,22051,Blue Scandinavian Paisley Wrap,10.68,25,14265.0,Unspecified
559929,2023-07-14,22050,Pink Paisley Rose Gift Wrap,10.68,25,14265.0,Unspecified
559929,2023-07-14,22709,Wrap Wedding Day,10.68,25,14265.0,Unspecified
559929,2023-07-14,40001,White Bamboo Ribs Lampshade,11.12,24,14265.0,Unspecified
559929,2023-07-14,46000S,Polyester Filler Pad 40x40cm,11.74,18,14265.0,Unspecified
559929,2023-07-14,46000M,Polyester Filler Pad 45x45cm,11.84,18,14265.0,Unspecified
559930,2023-07-14,22698,Pink Regency Teacup And Saucer,13.27,6,17738.0,United Kingdom
559930,2023-07-14,22697,Green Regency Teacup And Saucer,13.27,6,17738.0,United Kingdom
559930,2023-07-14,23175,Regency Milk Jug Pink,13.58,12,17738.0,United Kingdom
559930,2023-07-14,23174,Regency Sugar Bowl Green,14.5,6,17738.0,United Kingdom
559930,2023-07-14,21985,Pack Of 12 Hearts Design Tissues,10.55,24,17738.0,United Kingdom
559930,2023-07-14,21980,Pack Of 12 Red Retrospot Tissues,10.55,24,17738.0,United Kingdom
559930,2023-07-14,21232,Strawberry Ceramic Trinket Pot,11.53,12,17738.0,United Kingdom
559930,2023-07-14,84375,Set Of 20 Kids Cookie Cutters,12.4,12,17738.0,United Kingdom
559930,2023-07-14,22966,Gingerbread Man Cookie Cutter,11.53,12,17738.0,United Kingdom
559930,2023-07-14,22930,Baking Mould Heart Milk Chocolate,12.86,6,17738.0,United Kingdom
559930,2023-07-14,21975,Pack Of 60 Dinosaur Cake Cases,10.81,24,17738.0,United Kingdom
559930,2023-07-14,84991,60 Teatime Fairy Cake Cases,10.81,24,17738.0,United Kingdom
559930,2023-07-14,21212,Pack Of 72 Retrospot Cake Cases,10.81,24,17738.0,United Kingdom
559930,2023-07-14,22428,Enamel Fire Bucket Cream,17.37,6,17738.0,United Kingdom
559930,2023-07-14,21171,Bathroom Metal Sign,10.81,12,17738.0,United Kingdom
559930,2023-07-14,85123A,Cream Hanging Heart T-Light Holder,13.27,6,17738.0,United Kingdom
559930,2023-07-14,84970S,Hanging Heart Zinc T-Light Holder,11.12,12,17738.0,United Kingdom
559930,2023-07-14,84970L,Single Heart Zinc T-Light Holder,11.22,12,17738.0,United Kingdom
559930,2023-07-14,84755,Colour Glass T-Light Holder Hanging,10.92,32,17738.0,United Kingdom
559930,2023-07-14,23160,Regency Tea Spoon,11.53,12,17738.0,United Kingdom
559930,2023-07-14,23171,Regency Tea Plate Green,11.94,12,17738.0,United Kingdom
559930,2023-07-14,23170,Regency Tea Plate Roses,11.94,12,17738.0,United Kingdom
559930,2023-07-14,22699,Roses Regency Teacup And Saucer,13.27,6,17738.0,United Kingdom
559931,2023-07-14,23245,Set Of 3 Regency Cake Tins,15.32,4,17738.0,United Kingdom
559931,2023-07-14,23170,Regency Tea Plate Roses,11.94,12,17738.0,United Kingdom
559931,2023-07-14,23040,Paper Lantern 9 Point Snow Star,16.14,3,17738.0,United Kingdom
559931,2023-07-14,23089,Glass Bon Bon Jar,11.94,12,17738.0,United Kingdom
559931,2023-07-14,23103,Jingle Bell Heart Decoration,11.94,12,17738.0,United Kingdom
559931,2023-07-14,23013,Glass Apothecary Bottle Tonic,14.3,4,17738.0,United Kingdom
559931,2023-07-14,23307,Set Of 60 Pantry Design Cake Cases,10.81,24,17738.0,United Kingdom
559931,2023-07-14,23306,Set Of 36 Pantry Paper Doilies,11.74,12,17738.0,United Kingdom
559931,2023-07-14,23042,Paper Lantern 7 Point Snow Star,17.07,2,17738.0,United Kingdom
559931,2023-07-14,23284,Doormat Keep Calm And Come In,18.4,2,17738.0,United Kingdom
559932,2023-07-14,22607,Wooden Rounders Garden Set,18.96,12,17389.0,United Kingdom
559932,2023-07-14,22766,Photo Frame Cornice,13.27,6,17389.0,United Kingdom
559933,2023-07-14,20829,Glitter Hanging Butterfly String,12.4,1,16719.0,United Kingdom
559933,2023-07-14,21498,Red Retrospot Wrap,10.68,25,16719.0,United Kingdom
559933,2023-07-14,23233,Wrap Poppies Design,10.68,25,16719.0,United Kingdom
559933,2023-07-14,23232,Wrap Vintage Leaf Design,10.68,25,16719.0,United Kingdom
559933,2023-07-14,22704,Wrap Red Apples,10.68,25,16719.0,United Kingdom
559933,2023-07-14,16161P,Wrap English Rose,10.68,25,16719.0,United Kingdom
559933,2023-07-14,22371,Airline Bag Vintage Tokyo 78,14.61,1,16719.0,United Kingdom
559933,2023-07-14,22374,Airline Bag Vintage Jet Set Red,14.61,1,16719.0,United Kingdom
559933,2023-07-14,22199,Frying Pan Red Retrospot,14.61,2,16719.0,United Kingdom
559933,2023-07-14,22203,Milk Pan Red Retrospot,14.09,1,16719.0,United Kingdom
559933,2023-07-14,23096,Petit Tray Chic,11.94,2,16719.0,United Kingdom
559933,2023-07-14,22173,Metal 4 Hook Hanger French Chateau,13.27,1,16719.0,United Kingdom
559933,2023-07-14,84792,Enchanted Bird Coathanger 5 Hook,15.02,1,16719.0,United Kingdom
559933,2023-07-14,22467,Gumball Coat Rack,12.86,2,16719.0,United Kingdom
559933,2023-07-14,21871,Save The Planet Mug,11.53,2,16719.0,United Kingdom
559933,2023-07-14,20828,Glitter Butterfly Clips,12.86,2,16719.0,United Kingdom
559933,2023-07-14,79321,Chilli Lights,16.14,2,16719.0,United Kingdom
559933,2023-07-14,85123A,Cream Hanging Heart T-Light Holder,13.27,6,16719.0,United Kingdom
559933,2023-07-14,22729,Alarm Clock Bakelike Orange,14.09,3,16719.0,United Kingdom
559933,2023-07-14,22730,Alarm Clock Bakelike Ivory,14.09,3,16719.0,United Kingdom
559933,2023-07-14,22727,Alarm Clock Bakelike Red,14.09,4,16719.0,United Kingdom
559933,2023-07-14,20769,Daisy Journal,12.86,2,16719.0,United Kingdom
559933,2023-07-14,75049L,Large Circular Mirror Mobile,11.53,6,16719.0,United Kingdom
559933,2023-07-14,22971,Queens Guard Coffee Mug,12.86,5,16719.0,United Kingdom
559933,2023-07-14,23079,Toadstool Bedside Light,19.42,4,16719.0,United Kingdom
559933,2023-07-14,84360,Table Lamp White Shade Wood Base,16.35,2,16719.0,United Kingdom
559933,2023-07-14,21034,Rex Cash+Carry Jumbo Shopper,11.22,2,16719.0,United Kingdom
559934,2023-07-14,22098,Boudoir Square Tissue Box,10.65,36,13012.0,United Kingdom
559934,2023-07-14,22115,Metal Sign Empire Tea,11.06,12,13012.0,United Kingdom
559934,2023-07-14,22403,Magnets Pack Of 4 Vintage Labels,10.65,12,13012.0,United Kingdom
559934,2023-07-14,82600,N0 Singing Metal Sign,12.4,12,13012.0,United Kingdom
559934,2023-07-14,82552,Washroom Metal Sign,11.74,12,13012.0,United Kingdom
559934,2023-07-14,21175,Gin And Tonic Diet Metal Sign,12.86,12,13012.0,United Kingdom
559934,2023-07-14,22413,Metal Sign Take It Or Leave It,13.27,6,13012.0,United Kingdom
559934,2023-07-14,85152,Hand Over The Chocolate Sign,12.4,12,13012.0,United Kingdom
559934,2023-07-14,21174,Pottering In The Shed Metal Sign,12.38,12,13012.0,United Kingdom
559934,2023-07-14,21903,Man Flu Metal Sign,12.4,12,13012.0,United Kingdom
559934,2023-07-14,21905,More Butter Metal Sign,11.06,12,13012.0,United Kingdom
559934,2023-07-14,21169,You're Confusing Me Metal Sign,11.98,12,13012.0,United Kingdom
559934,2023-07-14,82567,Airline Lounge Metal Sign,12.4,6,13012.0,United Kingdom
559934,2023-07-14,21908,Chocolate This Way Metal Sign,12.4,12,13012.0,United Kingdom
559934,2023-07-14,21907,I'm On Holiday Metal Sign,12.4,12,13012.0,United Kingdom
559934,2023-07-14,15044A,Pink Paper Parasol,13.27,6,13012.0,United Kingdom
559935,2023-07-14,22892,Set Of Salt And Pepper Toadstools,11.34,72,15125.0,United Kingdom
559935,2023-07-14,23203,Jumbo Bag Vintage Doily,6.04,100,15125.0,United Kingdom
559936,2023-07-14,23198,Pantry Magnetic Shopping List,11.32,48,15125.0,United Kingdom
559937,2023-07-14,22991,Giraffe Wooden Ruler,12.25,12,13577.0,United Kingdom
559937,2023-07-14,22992,Revolver Wooden Ruler,12.25,12,13577.0,United Kingdom
559937,2023-07-14,22899,Children's Apron Dolly Girl,12.4,8,13577.0,United Kingdom
559937,2023-07-14,22898,Childrens Apron Apples Design,12.25,8,13577.0,United Kingdom
559937,2023-07-14,47591D,Pink Fairy Cake Childrens Apron,12.25,8,13577.0,United Kingdom
559937,2023-07-14,22367,Childrens Apron Spaceboy Design,12.25,8,13577.0,United Kingdom
559937,2023-07-14,22661,Charlotte Bag Dolly Girl Design,11.12,10,13577.0,United Kingdom
559937,2023-07-14,22355,Charlotte Bag Suki Design,11.12,10,13577.0,United Kingdom
559937,2023-07-14,20723,Strawberry Charlotte Bag,11.12,10,13577.0,United Kingdom
559937,2023-07-14,20719,Woodland Charlotte Bag,11.12,10,13577.0,United Kingdom
559937,2023-07-14,20724,Red Retrospot Charlotte Bag,11.12,10,13577.0,United Kingdom
559937,2023-07-14,23204,Charlotte Bag Apples Design,11.12,10,13577.0,United Kingdom
559937,2023-07-14,47566B,Tea Time Party Bunting,15.32,10,13577.0,United Kingdom
559937,2023-07-14,47566,Party Bunting,15.32,8,13577.0,United Kingdom
559937,2023-07-14,23298,Spotty Bunting,15.32,3,13577.0,United Kingdom
559937,2023-07-14,22690,Doormat Home Sweet Home Blue,18.4,2,13577.0,United Kingdom
559937,2023-07-14,48187,Doormat New England,18.4,2,13577.0,United Kingdom
559937,2023-07-14,23283,Doormat Vintage Leaf,18.4,2,13577.0,United Kingdom
559937,2023-07-14,23118,Parisienne Jewellery Drawer,17.94,2,13577.0,United Kingdom
559937,2023-07-14,22386,Jumbo Bag Pink Polkadot,6.19,10,13577.0,United Kingdom
559937,2023-07-14,85099C,Jumbo Bag Baroque Black White,6.19,10,13577.0,United Kingdom
559937,2023-07-14,23202,Jumbo Bag Vintage Leaf,6.19,10,13577.0,United Kingdom
559937,2023-07-14,23203,Jumbo Bag Vintage Doily,6.19,10,13577.0,United Kingdom
559937,2023-07-14,85099B,Jumbo Bag Red Retrospot,6.19,10,13577.0,United Kingdom
559937,2023-07-14,23199,Jumbo Bag Apples,6.19,10,13577.0,United Kingdom
559938,2023-07-14,22697,Green Regency Teacup And Saucer,13.27,3,17315.0,United Kingdom
559938,2023-07-14,22699,Roses Regency Teacup And Saucer,13.27,3,17315.0,United Kingdom
559938,2023-07-14,22698,Pink Regency Teacup And Saucer,13.27,3,17315.0,United Kingdom
559938,2023-07-14,82494L,Wooden Frame Antique White,13.27,1,17315.0,United Kingdom
559938,2023-07-14,85123A,Cream Hanging Heart T-Light Holder,13.27,4,17315.0,United Kingdom
559938,2023-07-14,23175,Regency Milk Jug Pink,13.58,1,17315.0,United Kingdom
559938,2023-07-14,23174,Regency Sugar Bowl Green,14.5,1,17315.0,United Kingdom
559938,2023-07-14,20831,Gold Photo Frame,12.4,2,17315.0,United Kingdom
559938,2023-07-14,47566,Party Bunting,15.32,5,17315.0,United Kingdom
559938,2023-07-14,21084,Set/6 Collage Paper Cups,10.44,5,17315.0,United Kingdom
559938,2023-07-14,21090,Set/6 Collage Paper Plates,10.65,4,17315.0,United Kingdom
559940,2023-07-14,23245,Set Of 3 Regency Cake Tins,14.5,144,17396.0,United Kingdom
559940,2023-07-14,23174,Regency Sugar Bowl Green,14.09,10,17396.0,United Kingdom
559940,2023-07-14,23172,Regency Tea Plate Pink,11.74,36,17396.0,United Kingdom
559940,2023-07-14,23171,Regency Tea Plate Green,11.74,36,17396.0,United Kingdom
559940,2023-07-14,23170,Regency Tea Plate Roses,11.74,36,17396.0,United Kingdom
559941,2023-07-14,22699,Roses Regency Teacup And Saucer,12.86,144,17396.0,United Kingdom
559941,2023-07-14,22698,Pink Regency Teacup And Saucer,12.86,144,17396.0,United Kingdom
559942,2023-07-14,23175,Regency Milk Jug Pink,13.07,48,17396.0,United Kingdom
559942,2023-07-14,23173,Regency Teapot Roses,18.6,66,17396.0,United Kingdom
559942,2023-07-14,22697,Green Regency Teacup And Saucer,12.86,144,17396.0,United Kingdom
559944,2023-07-14,22193,Red Diner Wall Clock,18.09,24,17396.0,United Kingdom
559944,2023-07-14,22191,Ivory Diner Wall Clock,18.09,30,17396.0,United Kingdom
559944,2023-07-14,22192,Blue Diner Wall Clock,18.09,24,17396.0,United Kingdom
559948,2023-07-14,23211,Red Rocking Horse Hand Painted,11.53,24,12653.0,Israel
559948,2023-07-14,21294,Etched Glass Coaster,10.65,48,12653.0,Israel
559948,2023-07-14,23179,Clock Magnet Mum's Kitchen,13.21,24,12653.0,Israel
559948,2023-07-14,20719,Woodland Charlotte Bag,11.12,10,12653.0,Israel
559948,2023-07-14,22661,Charlotte Bag Dolly Girl Design,11.12,20,12653.0,Israel
559948,2023-07-14,22355,Charlotte Bag Suki Design,11.12,20,12653.0,Israel
559948,2023-07-14,22913,Red Coat Rack Paris Fashion,15.32,9,12653.0,Israel
559948,2023-07-14,22912,Yellow Coat Rack Paris Fashion,15.32,6,12653.0,Israel
559948,2023-07-14,22914,Blue Coat Rack Paris Fashion,15.32,12,12653.0,Israel
559948,2023-07-14,23170,Regency Tea Plate Roses,11.74,48,12653.0,Israel
559948,2023-07-14,22585,Pack Of 6 Birdy Gift Tags,11.53,12,12653.0,Israel
559948,2023-07-14,23281,Folding Butterfly Mirror Red,11.1,12,12653.0,Israel
559948,2023-07-14,23280,Folding Butterfly Mirror Hot Pink,11.1,24,12653.0,Israel
559948,2023-07-14,23282,Folding Butterfly Mirror Ivory,11.1,24,12653.0,Israel
559948,2023-07-14,22629,Spaceboy Lunch Box,12.25,12,12653.0,Israel
559948,2023-07-14,22630,Dolly Girl Lunch Box,12.25,12,12653.0,Israel
559948,2023-07-14,22192,Blue Diner Wall Clock,18.09,12,12653.0,Israel
559948,2023-07-14,22595,Gingham Heart Decoration,11.12,36,12653.0,Israel
559948,2023-07-14,22652,Travel Sewing Kit,11.94,20,12653.0,Israel
559948,2023-07-14,23292,Spaceboy Childrens Cup,11.53,24,12653.0,Israel
559948,2023-07-14,23290,Spaceboy Childrens Bowl,11.53,24,12653.0,Israel
559948,2023-07-14,23291,Dolly Girl Childrens Cup,11.53,24,12653.0,Israel
559948,2023-07-14,23289,Dolly Girl Childrens Bowl,11.53,24,12653.0,Israel
559948,2023-07-14,23236,Storage Tin Vintage Doily,12.8,48,12653.0,Israel
559948,2023-07-14,23240,Set Of 4 Knick Knack Tins Doily,14.09,48,12653.0,Israel
559948,2023-07-14,23210,White Rocking Horse Hand Painted,11.53,24,12653.0,Israel
559951,2023-07-14,23066,Small Deco Jewellery Stand,18.71,4,14847.0,United Kingdom
559951,2023-07-14,22411,Jumbo Shopper Vintage Red Paisley,12.38,10,14847.0,United Kingdom
559951,2023-07-14,23035,Drawer Knob Ceramic Ivory,11.74,12,14847.0,United Kingdom
559951,2023-07-14,21672,White Spot Red Ceramic Drawer Knob,11.53,12,14847.0,United Kingdom
559951,2023-07-14,85123A,Cream Hanging Heart T-Light Holder,13.27,18,14847.0,United Kingdom
559951,2023-07-14,23133,Large Ivory Heart Wall Organiser,18.71,4,14847.0,United Kingdom
559951,2023-07-14,22470,Heart Of Wicker Large,13.27,6,14847.0,United Kingdom
559951,2023-07-14,22469,Heart Of Wicker Small,11.94,12,14847.0,United Kingdom
559951,2023-07-14,85099C,Jumbo Bag Baroque Black White,6.19,10,14847.0,United Kingdom
559951,2023-07-14,23203,Jumbo Bag Vintage Doily,6.19,10,14847.0,United Kingdom
559951,2023-07-14,22384,Lunch Bag Pink Polkadot,5.97,10,14847.0,United Kingdom
559951,2023-07-14,20728,Lunch Bag Cars Blue,5.97,10,14847.0,United Kingdom
559979,2023-07-14,16045,Popart Wooden Pencils Asst,10.29,100,14862.0,United Kingdom
559979,2023-07-14,22418,10 Colour Spaceboy Pen,11.12,24,14862.0,United Kingdom
559979,2023-07-14,22609,Pens Assorted Spaceball,10.44,36,14862.0,United Kingdom
559979,2023-07-14,21577,Save The Planet Cotton Tote Bag,12.56,6,14862.0,United Kingdom
559979,2023-07-14,23205,Charlotte Bag Vintage Alphabet,11.12,10,14862.0,United Kingdom
559979,2023-07-14,20719,Woodland Charlotte Bag,11.12,10,14862.0,United Kingdom
559979,2023-07-14,22492,Mini Paint Set Vintage,10.92,36,14862.0,United Kingdom
559979,2023-07-14,22564,Alphabet Stencil Craft,11.53,12,14862.0,United Kingdom
559979,2023-07-14,21703,Bag 125g Swirly Marbles,10.68,12,14862.0,United Kingdom
559979,2023-07-14,20981,12 Pencils Tall Tube Woodland,11.12,24,14862.0,United Kingdom
559979,2023-07-14,23198,Pantry Magnetic Shopping List,11.74,12,14862.0,United Kingdom
559979,2023-07-14,23190,Bundle Of 3 School Exercise Books,11.94,12,14862.0,United Kingdom
559979,2023-07-14,22507,Memo Board Retrospot Design,15.32,4,14862.0,United Kingdom
559979,2023-07-14,22596,Christmas Star Wish List Chalkboard,11.53,12,14862.0,United Kingdom
559979,2023-07-14,10125,Mini Funky Design Tapes,11.12,20,14862.0,United Kingdom
559979,2023-07-14,21328,Balloons Writing Set,11.94,12,14862.0,United Kingdom
559979,2023-07-14,20766,Garden Path Sketchbook,14.09,4,14862.0,United Kingdom
559979,2023-07-14,21889,Wooden Box Of Dominoes,11.53,12,14862.0,United Kingdom
559979,2023-07-14,16054,Popart Rect Pencil Sharpener Asst,10.37,36,14862.0,United Kingdom
559979,2023-07-14,22906,12 Message Cards With Envelopes,11.94,12,14862.0,United Kingdom
559979,2023-07-14,85015,Set Of 12 Vintage Postcard Set,10.92,24,14862.0,United Kingdom
559980,2023-07-14,15056N,Edwardian Parasol Natural,16.35,3,17314.0,United Kingdom
559980,2023-07-14,15056P,Edwardian Parasol Pink,16.35,9,17314.0,United Kingdom
559980,2023-07-14,20679,Edwardian Parasol Red,16.35,6,17314.0,United Kingdom
559980,2023-07-14,21832,Chocolate Calculator,11.94,12,17314.0,United Kingdom
559980,2023-07-14,23310,Bubblegum Ring Assorted,10.68,36,17314.0,United Kingdom
559980,2023-07-14,22436,12 Coloured Party Balloons,10.92,40,17314.0,United Kingdom
559980,2023-07-14,22437,Set Of 9 Black Skull Balloons,11.12,20,17314.0,United Kingdom
559981,2023-07-14,23082,Set 6 Paper Table Lantern Hearts,14.09,24,14562.0,United Kingdom
559981,2023-07-14,84836,Zinc Metal Heart Decoration,11.53,12,14562.0,United Kingdom
559981,2023-07-14,22667,Recipe Box Retrospot,13.27,6,14562.0,United Kingdom
559981,2023-07-14,82551,Laundry 15c Metal Sign,11.74,12,14562.0,United Kingdom
559981,2023-07-14,22671,French Laundry Sign Blue Metal,11.94,6,14562.0,United Kingdom
