TransactionNo,Date,ProductNo,ProductName,Price,Quantity,CustomerNo,Country
546951,2023-03-18,22301,Coffee Mug Cat + Bird Design,12.86,6,17673.0,United Kingdom
546951,2023-03-18,22300,Coffee Mug Dog + Ball Design,12.86,6,17673.0,United Kingdom
546951,2023-03-18,22807,Set Of 6 T-Lights Toadstools,13.27,6,17673.0,United Kingdom
546951,2023-03-18,22281,Easter Tree Yellow Birds,16.35,2,17673.0,United Kingdom
546951,2023-03-18,22971,Queens Guard Coffee Mug,12.86,6,17673.0,United Kingdom
546951,2023-03-18,21383,Pack Of 12 Sticky Bunnies,10.92,10,17673.0,United Kingdom
546951,2023-03-18,85152,Hand Over The Chocolate Sign,12.4,2,17673.0,United Kingdom
546951,2023-03-18,85150,Ladies & Gentlemen Metal Sign,12.86,3,17673.0,United Kingdom
546951,2023-03-18,21161,Keep Out Boys Door Hanger,11.74,1,17673.0,United Kingdom
546951,2023-03-18,21161,Keep Out Boys Door Hanger,11.74,2,17673.0,United Kingdom
546951,2023-03-18,21172,Party Metal Sign,11.74,3,17673.0,United Kingdom
546951,2023-03-18,22412,Metal Sign Neighbourhood Witch,12.4,2,17673.0,United Kingdom
546951,2023-03-18,22412,Metal Sign Neighbourhood Witch,12.4,1,17673.0,United Kingdom
546951,2023-03-18,22412,Metal Sign Neighbourhood Witch,12.4,1,17673.0,United Kingdom
546951,2023-03-18,21908,Chocolate This Way Metal Sign,12.4,3,17673.0,United Kingdom
546951,2023-03-18,21907,I'm On Holiday Metal Sign,12.4,1,17673.0,United Kingdom
546951,2023-03-18,21907,I'm On Holiday Metal Sign,12.4,1,17673.0,United Kingdom
546951,2023-03-18,82552,Washroom Metal Sign,11.74,2,17673.0,United Kingdom
546951,2023-03-18,21159,Moody Boy Door Hanger,11.74,3,17673.0,United Kingdom
546951,2023-03-18,82583,Hot Baths Metal Sign,12.4,4,17673.0,United Kingdom
546951,2023-03-18,82582,Area Patrolled Metal Sign,12.4,2,17673.0,United Kingdom
546951,2023-03-18,21165,Beware Of The Cat Metal Sign,11.98,2,17673.0,United Kingdom
546951,2023-03-18,21165,Beware Of The Cat Metal Sign,11.98,1,17673.0,United Kingdom
546951,2023-03-18,82605,Old Doc Russel Metal Sign,12.4,1,17673.0,United Kingdom
546951,2023-03-18,22287,Decoration Wobbly Chicken,11.94,4,17673.0,United Kingdom
546951,2023-03-18,21447,12 Ivory Rose Peg Place Settings,11.53,3,17673.0,United Kingdom
546951,2023-03-18,22148,Easter Craft 4 Chicks,12.25,1,17673.0,United Kingdom
546951,2023-03-18,22148,Easter Craft 4 Chicks,12.25,1,17673.0,United Kingdom
546951,2023-03-18,15039,Sandalwood Fan,11.12,6,17673.0,United Kingdom
546951,2023-03-18,21866,Union Jack Flag Luggage Tag,11.53,5,17673.0,United Kingdom
546951,2023-03-18,21792,Classic French Style Basket Green,17.17,1,17673.0,United Kingdom
546951,2023-03-18,21703,Bag 125g Swirly Marbles,10.68,2,17673.0,United Kingdom
546951,2023-03-18,21879,Hearts Gift Tape,10.92,2,17673.0,United Kingdom
546951,2023-03-18,22566,Feltcraft Hairband Pink And Purple,11.12,4,17673.0,United Kingdom
546951,2023-03-18,37423,White With Black Cats Plate,10.65,24,17673.0,United Kingdom
546951,2023-03-18,85175,Cacti T-Light Candles,10.68,32,17673.0,United Kingdom
546951,2023-03-18,85231G,Orange Scented Set/9 T-Lights,11.12,2,17673.0,United Kingdom
546951,2023-03-18,85231B,Cinammon Set Of 9 T-Lights,11.12,5,17673.0,United Kingdom
546951,2023-03-18,21882,Skulls Tape,10.92,4,17673.0,United Kingdom
546951,2023-03-18,21879,Hearts Gift Tape,10.92,2,17673.0,United Kingdom
546951,2023-03-18,21918,Set 12 Kids Colour Chalk Sticks,10.68,9,17673.0,United Kingdom
546951,2023-03-18,21672,White Spot Red Ceramic Drawer Knob,11.53,6,17673.0,United Kingdom
546951,2023-03-18,21670,Blue Spot Ceramic Drawer Knob,11.53,6,17673.0,United Kingdom
546951,2023-03-18,21671,Red Spot Ceramic Drawer Knob,11.53,6,17673.0,United Kingdom
546951,2023-03-18,21669,Blue Stripe Ceramic Drawer Knob,11.53,6,17673.0,United Kingdom
546951,2023-03-18,21669,Blue Stripe Ceramic Drawer Knob,11.53,6,17673.0,United Kingdom
546951,2023-03-18,21671,Red Spot Ceramic Drawer Knob,11.53,6,17673.0,United Kingdom
546951,2023-03-18,21670,Blue Spot Ceramic Drawer Knob,11.53,6,17673.0,United Kingdom
546951,2023-03-18,21668,Red Stripe Ceramic Drawer Knob,11.53,12,17673.0,United Kingdom
546951,2023-03-18,22436,12 Coloured Party Balloons,10.92,10,17673.0,United Kingdom
546951,2023-03-18,22439,6 Rocket Balloons,10.92,10,17673.0,United Kingdom
546951,2023-03-18,22435,Set Of 9 Heart Shaped Balloons,11.53,10,17673.0,United Kingdom
546951,2023-03-18,40001,White Bamboo Ribs Lampshade,11.12,12,17673.0,United Kingdom
546951,2023-03-18,40001,White Bamboo Ribs Lampshade,11.53,12,17673.0,United Kingdom
546951,2023-03-18,22548,Heads And Tails Sporting Fun,11.53,4,17673.0,United Kingdom
546951,2023-03-18,22332,Skulls Party Bag + Sticker Set,11.94,4,17673.0,United Kingdom
546951,2023-03-18,22149,Feltcraft 6 Flower Friends,12.4,1,17673.0,United Kingdom
546951,2023-03-18,22149,Feltcraft 6 Flower Friends,12.4,1,17673.0,United Kingdom
546951,2023-03-18,22149,Feltcraft 6 Flower Friends,12.4,1,17673.0,United Kingdom
546951,2023-03-18,21888,Bingo Set,14.09,3,17673.0,United Kingdom
546951,2023-03-18,22570,Feltcraft Cushion Rabbit,14.09,2,17673.0,United Kingdom
546957,2023-03-18,90065A,White Vintage Crystal Bracelet,17.17,1,15957.0,United Kingdom
546957,2023-03-18,90075,Montana Diamond Cluster Necklace,19.42,1,15957.0,United Kingdom
546957,2023-03-18,90068,"Ruby Glass Necklace 42""",17.94,1,15957.0,United Kingdom
546957,2023-03-18,90030B,Red Kukui Coconut Seed Necklace,16.35,1,15957.0,United Kingdom
546957,2023-03-18,90031,Bili Nut And Wood Necklace,16.35,1,15957.0,United Kingdom
546957,2023-03-18,90212B,Jet Black Las Vegas Bracelet Round,14.09,1,15957.0,United Kingdom
546957,2023-03-18,90212C,Purple Las Vegas Bracelet Round,14.09,1,15957.0,United Kingdom
546957,2023-03-18,90210C,Red Acrylic Faceted Bangle,13.27,1,15957.0,United Kingdom
546957,2023-03-18,90210A,Grey Acrylic Faceted Bangle,13.27,2,15957.0,United Kingdom
546963,2023-03-18,22064,Pink Doughnut Trinket Pot,11.94,12,16779.0,United Kingdom
546963,2023-03-18,84692,Box Of 24 Cocktail Parasols,10.68,50,16779.0,United Kingdom
546963,2023-03-18,21107,Cream Slice Flannel Pink Spot,12.86,24,16779.0,United Kingdom
546963,2023-03-18,21260,First Aid Tin,13.58,6,16779.0,United Kingdom
546963,2023-03-18,22197,Popcorn Holder,11.12,12,16779.0,United Kingdom
546963,2023-03-18,22644,Ceramic Cherry Cake Money Bank,11.74,12,16779.0,United Kingdom
546963,2023-03-18,21213,Pack Of 72 Skull Cake Cases,10.81,24,16779.0,United Kingdom
546963,2023-03-18,20718,Red Retrospot Shopper Bag,11.53,10,16779.0,United Kingdom
546963,2023-03-18,71053,White Moroccan Metal Lantern,14.09,4,16779.0,United Kingdom
546963,2023-03-18,18097C,White Tall Porcelain T-Light Holder,12.86,6,16779.0,United Kingdom
546963,2023-03-18,21564,Pink Heart Shape Love Bucket,13.27,6,16779.0,United Kingdom
546963,2023-03-18,22381,Toy Tidy Pink Polkadot,12.4,5,16779.0,United Kingdom
546963,2023-03-18,22701,Pink Dog Bowl,13.27,6,16779.0,United Kingdom
546963,2023-03-18,22703,Pink Cat Bowl,12.4,6,16779.0,United Kingdom
546963,2023-03-18,20711,Jumbo Bag Toys,6.13,10,16779.0,United Kingdom
546963,2023-03-18,20713,Jumbo Bag Owls,6.13,10,16779.0,United Kingdom
546972,2023-03-18,21327,Skulls Writing Set,12.77,2,13972.0,United Kingdom
546972,2023-03-18,21329,Dinosaurs Writing Set,13.62,2,13972.0,United Kingdom
546972,2023-03-18,21484,Chick Grey Hot Water Bottle,18.75,1,13972.0,United Kingdom
546972,2023-03-18,21556,Ceramic Strawberry Money Box,14.48,2,13972.0,United Kingdom
546972,2023-03-18,21672,White Spot Red Ceramic Drawer Knob,12.77,1,13972.0,United Kingdom
546972,2023-03-18,21731,Red Toadstool Led Night Light,14.48,15,13972.0,United Kingdom
546972,2023-03-18,21866,Union Jack Flag Luggage Tag,13.62,4,13972.0,United Kingdom
546972,2023-03-18,21934,Skull Shoulder Bag,13.62,1,13972.0,United Kingdom
546972,2023-03-18,21972,Set Of 36 Dinosaur Paper Doilies,12.77,1,13972.0,United Kingdom
546972,2023-03-18,21976,Pack Of 60 Mushroom Cake Cases,12.38,1,13972.0,United Kingdom
546972,2023-03-18,21989,Pack Of 20 Skull Paper Napkins,11.92,1,13972.0,United Kingdom
546972,2023-03-18,22068,Black Pirate Treasure Chest,14.48,2,13972.0,United Kingdom
546972,2023-03-18,22074,6 Ribbons Shimmering Pinks,12.77,1,13972.0,United Kingdom
546972,2023-03-18,22077,6 Ribbons Rustic Charm,14.48,1,13972.0,United Kingdom
546972,2023-03-18,22084,Paper Chain Kit Empire,15.33,1,13972.0,United Kingdom
546972,2023-03-18,22174,Photo Cube,14.48,2,13972.0,United Kingdom
546972,2023-03-18,22326,Round Snack Boxes Set Of4 Woodland,17.05,4,13972.0,United Kingdom
546972,2023-03-18,22327,Round Snack Boxes Set Of 4 Skulls,17.05,1,13972.0,United Kingdom
546972,2023-03-18,22328,Round Snack Boxes Set Of 4 Fruits,14.48,3,13972.0,United Kingdom
546972,2023-03-18,22355,Charlotte Bag Suki Design,12.77,36,13972.0,United Kingdom
546972,2023-03-18,22356,Charlotte Bag Pink Polkadot,12.77,16,13972.0,United Kingdom
546972,2023-03-18,22367,Childrens Apron Spaceboy Design,15.33,2,13972.0,United Kingdom
546972,2023-03-18,22377,Bottle Bag Retrospot,14.48,1,13972.0,United Kingdom
546972,2023-03-18,22380,Toy Tidy Spaceboy,14.48,1,13972.0,United Kingdom
546972,2023-03-18,22417,Pack Of 60 Spaceboy Cake Cases,12.38,1,13972.0,United Kingdom
546972,2023-03-18,22426,Enamel Wash Bowl Cream,18.75,1,13972.0,United Kingdom
546972,2023-03-18,22549,Picture Dominoes,12.77,3,13972.0,United Kingdom
546972,2023-03-18,22553,Plasters In Tin Skulls,13.62,1,13972.0,United Kingdom
546972,2023-03-18,22631,Circus Parade Lunch Box,13.62,1,13972.0,United Kingdom
546972,2023-03-18,22644,Ceramic Cherry Cake Money Bank,14.48,1,13972.0,United Kingdom
546972,2023-03-18,22645,Ceramic Heart Fairy Cake Money Bank,14.48,5,13972.0,United Kingdom
546972,2023-03-18,22665,Recipe Box Blue Sketchbook Design,17.05,2,13972.0,United Kingdom
546972,2023-03-18,22666,Recipe Box Pantry Yellow Design,17.05,4,13972.0,United Kingdom
546972,2023-03-18,22726,Alarm Clock Bakelike Green,18.75,2,13972.0,United Kingdom
546972,2023-03-18,22727,Alarm Clock Bakelike Red,18.75,1,13972.0,United Kingdom
546972,2023-03-18,22729,Alarm Clock Bakelike Orange,18.75,1,13972.0,United Kingdom
546972,2023-03-18,22745,Poppy's Playhouse Bedroom,13.62,1,13972.0,United Kingdom
546972,2023-03-18,22746,Poppy's Playhouse Livingroom,13.62,1,13972.0,United Kingdom
546972,2023-03-18,22896,Peg Bag Apples Design,16.18,2,13972.0,United Kingdom
546972,2023-03-18,22898,Childrens Apron Apples Design,15.33,2,13972.0,United Kingdom
546972,2023-03-18,35970,Zinc Folkart Sleigh Bells,14.48,2,13972.0,United Kingdom
546972,2023-03-18,82583,Hot Baths Metal Sign,15.33,5,13972.0,United Kingdom
546972,2023-03-18,84029E,Red Woolly Hottie White Heart,17.9,1,13972.0,United Kingdom
546972,2023-03-18,84029G,Knitted Union Flag Hot Water Bottle,18.75,6,13972.0,United Kingdom
546972,2023-03-18,84031A,Charlie+Lola Red Hot Water Bottle,19.61,1,13972.0,United Kingdom
546972,2023-03-18,84380,Set Of 3 Butterfly Cookie Cutters,13.62,5,13972.0,United Kingdom
546972,2023-03-18,84692,Box Of 24 Cocktail Parasols,11.92,13,13972.0,United Kingdom
546972,2023-03-18,84991,60 Teatime Fairy Cake Cases,11.53,4,13972.0,United Kingdom
546972,2023-03-18,84997B,Childrens Cutlery Retrospot Red,18.75,3,13972.0,United Kingdom
546972,2023-03-18,84997C,Childrens Cutlery Polkadot Blue,18.75,2,13972.0,United Kingdom
546972,2023-03-18,84997D,Childrens Cutlery Polkadot Pink,18.75,5,13972.0,United Kingdom
546972,2023-03-18,20675,Blue Polkadot Bowl,12.77,4,13972.0,United Kingdom
546972,2023-03-18,20677,Pink Polkadot Bowl,12.77,5,13972.0,United Kingdom
546972,2023-03-18,20717,Strawberry Shopper Bag,12.77,5,13972.0,United Kingdom
546972,2023-03-18,20718,Red Retrospot Shopper Bag,13.62,3,13972.0,United Kingdom
546972,2023-03-18,20719,Woodland Charlotte Bag,12.77,20,13972.0,United Kingdom
546972,2023-03-18,20723,Strawberry Charlotte Bag,12.77,17,13972.0,United Kingdom
546972,2023-03-18,20724,Red Retrospot Charlotte Bag,12.77,26,13972.0,United Kingdom
546972,2023-03-18,20734,Silver Mini Tape Measure,11.92,3,13972.0,United Kingdom
546972,2023-03-18,21041,Red Retrospot Oven Glove Double,17.05,3,13972.0,United Kingdom
546972,2023-03-18,21078,Set/20 Strawberry Paper Napkins,12.77,1,13972.0,United Kingdom
546972,2023-03-18,21154,Red Retrospot Oven Glove,13.62,1,13972.0,United Kingdom
546972,2023-03-18,21155,Red Retrospot Peg Bag,15.33,8,13972.0,United Kingdom
546972,2023-03-18,21212,Pack Of 72 Retrospot Cake Cases,12.38,9,13972.0,United Kingdom
546972,2023-03-18,21213,Pack Of 72 Skull Cake Cases,12.38,4,13972.0,United Kingdom
546972,2023-03-18,21240,Blue Polkadot Cup,11.92,1,13972.0,United Kingdom
546972,2023-03-18,21242,Red Retrospot Plate,13.62,2,13972.0,United Kingdom
546972,2023-03-18,21243,Pink Polkadot Plate,13.62,6,13972.0,United Kingdom
546972,2023-03-18,21244,Blue Polkadot Plate,13.62,2,13972.0,United Kingdom
546972,2023-03-18,21929,Jumbo Bag Pink Vintage Paisley,7.67,17,13972.0,United Kingdom
546972,2023-03-18,20725,Lunch Bag Red Retrospot,7.67,9,13972.0,United Kingdom
546972,2023-03-18,20728,Lunch Bag Cars Blue,7.67,6,13972.0,United Kingdom
546973,2023-03-18,21218,Red Spotty Biscuit Tin,18.75,1,17973.0,EIRE
546973,2023-03-18,21249,Woodland Height Chart Stickers,16.18,1,17973.0,EIRE
546973,2023-03-18,21328,Balloons Writing Set,13.62,1,17973.0,EIRE
546973,2023-03-18,21700,Big Doughnut Fridge Magnets,18.75,1,17973.0,EIRE
546973,2023-03-18,21977,Pack Of 60 Pink Paisley Cake Cases,12.38,1,17973.0,EIRE
546973,2023-03-18,22149,Feltcraft 6 Flower Friends,15.33,1,17973.0,EIRE
546973,2023-03-18,22200,Frying Pan Pink Polkadot,18.75,1,17973.0,EIRE
546973,2023-03-18,22355,Charlotte Bag Suki Design,12.77,5,17973.0,EIRE
546973,2023-03-18,22379,Recycling Bag Retrospot,15.33,2,17973.0,EIRE
546973,2023-03-18,22411,Jumbo Shopper Vintage Red Paisley,14.48,4,17973.0,EIRE
546973,2023-03-18,22412,Metal Sign Neighbourhood Witch,14.48,2,17973.0,EIRE
546973,2023-03-18,22431,Watering Can Blue Elephant,14.48,1,17973.0,EIRE
546973,2023-03-18,22465,Hanging Metal Star Lantern,13.62,1,17973.0,EIRE
546973,2023-03-18,22960,Jam Making Set With Jars,18.75,1,17973.0,EIRE
546973,2023-03-18,23179,Clock Magnet Mum's Kitchen,16.18,1,17973.0,EIRE
546973,2023-03-18,47566B,Tea Time Party Bunting,18.75,2,17973.0,EIRE
546973,2023-03-18,82482,Wooden Picture Frame White Finish,15.33,1,17973.0,EIRE
546973,2023-03-18,82578,Kitchen Metal Sign,11.53,1,17973.0,EIRE
546973,2023-03-18,82599,Fanny's Rest Stopmetal Sign,14.48,1,17973.0,EIRE
546973,2023-03-18,84970S,Hanging Heart Zinc T-Light Holder,12.38,1,17973.0,EIRE
546973,2023-03-18,20712,Jumbo Bag Woodland Animals,7.24,5,17973.0,EIRE
546973,2023-03-18,20713,Jumbo Bag Owls,7.24,4,17973.0,EIRE
546973,2023-03-18,21033,Jumbo Bag Charlie And Lola Toys,7.24,2,17973.0,EIRE
546973,2023-03-18,22386,Jumbo Bag Pink Polkadot,7.24,2,17973.0,EIRE
546973,2023-03-18,22663,Jumbo Bag Dolly Girl Design,7.24,1,17973.0,EIRE
546973,2023-03-18,85099B,Jumbo Bag Red Retrospot,7.24,3,17973.0,EIRE
546973,2023-03-18,85099C,Jumbo Bag Baroque Black White,7.24,3,17973.0,EIRE
546973,2023-03-18,20725,Lunch Bag Red Retrospot,7.67,1,17973.0,EIRE
546973,2023-03-18,22383,Lunch Bag Suki Design,7.67,1,17973.0,EIRE
546974,2023-03-18,20886,Box Of 9 Pebble Candles,14.48,2,12974.0,United Kingdom
546974,2023-03-18,21035,Set/2 Red Retrospot Tea Towels,16.66,1,12974.0,United Kingdom
546974,2023-03-18,21157,Red Retrospot Washbag,14.48,1,12974.0,United Kingdom
546974,2023-03-18,21166,Cook With Wine Metal Sign,14.48,1,12974.0,United Kingdom
546974,2023-03-18,21169,You're Confusing Me Metal Sign,14.48,1,12974.0,United Kingdom
546974,2023-03-18,21192,White Bell Honeycomb Paper,13.62,1,12974.0,United Kingdom
546974,2023-03-18,21194,Pink Honeycomb Paper Fan,14.48,3,12974.0,United Kingdom
546974,2023-03-18,21557,Set Of 6 Funky Beakers,16.02,1,12974.0,United Kingdom
546974,2023-03-18,21700,Big Doughnut Fridge Magnets,18.75,1,12974.0,United Kingdom
546974,2023-03-18,21903,Man Flu Metal Sign,14.48,1,12974.0,United Kingdom
546974,2023-03-18,21977,Pack Of 60 Pink Paisley Cake Cases,12.38,1,12974.0,United Kingdom
546974,2023-03-18,22041,"Record Frame 7"" Single Size",15.33,1,12974.0,United Kingdom
546974,2023-03-18,22131,Food Container Set 3 Love Heart,14.48,1,12974.0,United Kingdom
546974,2023-03-18,22141,Christmas Craft Tree Top Angel,14.48,1,12974.0,United Kingdom
546974,2023-03-18,22149,Feltcraft 6 Flower Friends,15.33,1,12974.0,United Kingdom
546974,2023-03-18,22178,Victorian Glass Hanging T-Light,12.77,2,12974.0,United Kingdom
546974,2023-03-18,22196,Small Heart Measuring Spoons,11.92,2,12974.0,United Kingdom
546974,2023-03-18,22297,Heart Ivory Trellis Small,12.77,1,12974.0,United Kingdom
546974,2023-03-18,22355,Charlotte Bag Suki Design,12.77,10,12974.0,United Kingdom
546974,2023-03-18,22379,Recycling Bag Retrospot,15.33,1,12974.0,United Kingdom
546974,2023-03-18,22381,Toy Tidy Pink Polkadot,15.33,1,12974.0,United Kingdom
546974,2023-03-18,22411,Jumbo Shopper Vintage Red Paisley,14.48,5,12974.0,United Kingdom
546974,2023-03-18,22431,Watering Can Blue Elephant,14.48,1,12974.0,United Kingdom
546974,2023-03-18,22619,Set Of 6 Soldier Skittles,17.9,1,12974.0,United Kingdom
546974,2023-03-18,72801D,4 Sky Blue Dinner Candles,12.77,1,12974.0,United Kingdom
546974,2023-03-18,84987,Set Of 36 Teatime Paper Doilies,14.09,1,12974.0,United Kingdom
546974,2023-03-18,85231G,Orange Scented Set/9 T-Lights,11.92,1,12974.0,United Kingdom
546974,2023-03-18,20713,Jumbo Bag Owls,7.24,2,12974.0,United Kingdom
546974,2023-03-18,85099B,Jumbo Bag Red Retrospot,7.24,2,12974.0,United Kingdom
546974,2023-03-18,22383,Lunch Bag Suki Design,7.67,3,12974.0,United Kingdom
546976,2023-03-18,20886,Box Of 9 Pebble Candles,14.48,1,16976.0,United Kingdom
546976,2023-03-18,21035,Set/2 Red Retrospot Tea Towels,16.66,2,16976.0,United Kingdom
546976,2023-03-18,21181,Please One Person Metal Sign,14.48,1,16976.0,United Kingdom
546976,2023-03-18,21272,Salle De Bain Hook,12.77,1,16976.0,United Kingdom
546976,2023-03-18,21328,Balloons Writing Set,13.62,1,16976.0,United Kingdom
546976,2023-03-18,21494,Rotating Leaves T-Light Holder,16.18,1,16976.0,United Kingdom
546976,2023-03-18,21658,Glass Beurre Dish,18.75,1,16976.0,United Kingdom
546976,2023-03-18,21977,Pack Of 60 Pink Paisley Cake Cases,12.38,2,16976.0,United Kingdom
546976,2023-03-18,22041,"Record Frame 7"" Single Size",15.33,1,16976.0,United Kingdom
546976,2023-03-18,22107,Pizza Plate In Box,17.9,1,16976.0,United Kingdom
546976,2023-03-18,22156,Heart Decoration With Pearls,11.92,1,16976.0,United Kingdom
546976,2023-03-18,22195,Large Heart Measuring Spoons,13.62,1,16976.0,United Kingdom
546976,2023-03-18,22200,Frying Pan Pink Polkadot,18.75,1,16976.0,United Kingdom
546976,2023-03-18,22352,Lunch Box With Cutlery Retrospot,15.33,1,16976.0,United Kingdom
546976,2023-03-18,22355,Charlotte Bag Suki Design,12.77,8,16976.0,United Kingdom
546976,2023-03-18,22379,Recycling Bag Retrospot,15.33,4,16976.0,United Kingdom
546976,2023-03-18,22411,Jumbo Shopper Vintage Red Paisley,14.48,2,16976.0,United Kingdom
546976,2023-03-18,22698,Pink Regency Teacup And Saucer,16.18,3,16976.0,United Kingdom
546976,2023-03-18,47566B,Tea Time Party Bunting,18.75,2,16976.0,United Kingdom
546976,2023-03-18,47591D,Pink Fairy Cake Childrens Apron,15.33,1,16976.0,United Kingdom
546976,2023-03-18,72349B,Set/6 Purple Butterfly T-Lights,14.48,1,16976.0,United Kingdom
546976,2023-03-18,82482,Wooden Picture Frame White Finish,15.33,1,16976.0,United Kingdom
546976,2023-03-18,20712,Jumbo Bag Woodland Animals,7.24,1,16976.0,United Kingdom
546976,2023-03-18,20713,Jumbo Bag Owls,7.24,10,16976.0,United Kingdom
546976,2023-03-18,21033,Jumbo Bag Charlie And Lola Toys,7.24,1,16976.0,United Kingdom
546976,2023-03-18,21928,Jumbo Bag Scandinavian Blue Paisley,7.24,1,16976.0,United Kingdom
546976,2023-03-18,22385,Jumbo Bag Spaceboy Design,7.24,1,16976.0,United Kingdom
546976,2023-03-18,22386,Jumbo Bag Pink Polkadot,7.24,4,16976.0,United Kingdom
546976,2023-03-18,85099B,Jumbo Bag Red Retrospot,7.24,4,16976.0,United Kingdom
546976,2023-03-18,85099C,Jumbo Bag Baroque Black White,7.24,4,16976.0,United Kingdom
546976,2023-03-18,20725,Lunch Bag Red Retrospot,7.67,2,16976.0,United Kingdom
546976,2023-03-18,20727,Lunch Bag Black Skull,7.67,1,16976.0,United Kingdom
546977,2023-03-18,20658,Red Retrospot Luggage Tag,12.77,1,13977.0,United Kingdom
546977,2023-03-18,20676,Red Retrospot Bowl,12.77,6,13977.0,United Kingdom
546977,2023-03-18,21035,Set/2 Red Retrospot Tea Towels,16.66,1,13977.0,United Kingdom
546977,2023-03-18,21116,Owl Doorstop,18.75,1,13977.0,United Kingdom
546977,2023-03-18,21122,Set/10 Pink Polkadot Party Candles,12.77,2,13977.0,United Kingdom
546977,2023-03-18,21172,Party Metal Sign,14.48,1,13977.0,United Kingdom
546977,2023-03-18,21218,Red Spotty Biscuit Tin,18.75,2,13977.0,United Kingdom
546977,2023-03-18,21354,Toast Its - Best Mum,12.77,1,13977.0,United Kingdom
546977,2023-03-18,21558,Skull Lunch Box With Cutlery,15.33,1,13977.0,United Kingdom
546977,2023-03-18,21700,Big Doughnut Fridge Magnets,18.75,1,13977.0,United Kingdom
546977,2023-03-18,21867,Pink Union Jack Luggage Tag,12.77,1,13977.0,United Kingdom
546977,2023-03-18,21888,Bingo Set,17.9,1,13977.0,United Kingdom
546977,2023-03-18,21911,Garden Metal Sign,13.62,1,13977.0,United Kingdom
546977,2023-03-18,21931,Jumbo Storage Bag Suki,14.48,2,13977.0,United Kingdom
546977,2023-03-18,21936,Red Retrospot Picnic Bag,16.18,1,13977.0,United Kingdom
546977,2023-03-18,21977,Pack Of 60 Pink Paisley Cake Cases,12.38,2,13977.0,United Kingdom
546977,2023-03-18,22023,Empire Birthday Card,11.1,1,13977.0,United Kingdom
546977,2023-03-18,22094,Red Retrospot Tissue Box,12.77,1,13977.0,United Kingdom
546977,2023-03-18,22176,Blue Owl Soft Toy,16.18,1,13977.0,United Kingdom
546977,2023-03-18,22219,Lovebird Hanging Decoration White,11.92,4,13977.0,United Kingdom
546977,2023-03-18,22276,Wash Bag Vintage Rose Paisley,16.18,1,13977.0,United Kingdom
546977,2023-03-18,22352,Lunch Box With Cutlery Retrospot,15.33,1,13977.0,United Kingdom
546977,2023-03-18,22355,Charlotte Bag Suki Design,12.77,4,13977.0,United Kingdom
546977,2023-03-18,22357,Kings Choice Biscuit Tin,18.75,1,13977.0,United Kingdom
546977,2023-03-18,22358,Kings Choice Tea Caddy,16.18,3,13977.0,United Kingdom
546977,2023-03-18,22379,Recycling Bag Retrospot,15.33,1,13977.0,United Kingdom
546977,2023-03-18,22381,Toy Tidy Pink Polkadot,15.33,1,13977.0,United Kingdom
546977,2023-03-18,22411,Jumbo Shopper Vintage Red Paisley,14.48,9,13977.0,United Kingdom
546977,2023-03-18,22502,Picnic Basket Wicker Small,18.75,1,13977.0,United Kingdom
546977,2023-03-18,22629,Spaceboy Lunch Box,12.77,1,13977.0,United Kingdom
546977,2023-03-18,22677,French Blue Metal Door Sign 2,12.77,1,13977.0,United Kingdom
546977,2023-03-18,22679,French Blue Metal Door Sign 4,12.77,1,13977.0,United Kingdom
546977,2023-03-18,22719,Gumball Monochrome Coat Rack,12.77,1,13977.0,United Kingdom
546977,2023-03-18,22807,Set Of 6 T-Lights Toadstools,16.18,1,13977.0,United Kingdom
546977,2023-03-18,22998,Travel Card Wallet Keep Calm,11.1,2,13977.0,United Kingdom
546977,2023-03-18,72349B,Set/6 Purple Butterfly T-Lights,14.48,1,13977.0,United Kingdom
546977,2023-03-18,82482,Wooden Picture Frame White Finish,15.33,1,13977.0,United Kingdom
546977,2023-03-18,84884A,Ant White Wire Heart Spiral,18.75,1,13977.0,United Kingdom
546977,2023-03-18,84970S,Hanging Heart Zinc T-Light Holder,12.38,1,13977.0,United Kingdom
546977,2023-03-18,84987,Set Of 36 Teatime Paper Doilies,14.09,1,13977.0,United Kingdom
546977,2023-03-18,85049E,Scandinavian Reds Ribbons,13.62,1,13977.0,United Kingdom
546977,2023-03-18,85215,Assorted Cheese Fridge Magnets,11.52,6,13977.0,United Kingdom
546977,2023-03-18,20712,Jumbo Bag Woodland Animals,7.24,4,13977.0,United Kingdom
546977,2023-03-18,20713,Jumbo Bag Owls,7.24,1,13977.0,United Kingdom
546977,2023-03-18,21033,Jumbo Bag Charlie And Lola Toys,7.24,2,13977.0,United Kingdom
546977,2023-03-18,21928,Jumbo Bag Scandinavian Blue Paisley,7.24,2,13977.0,United Kingdom
546977,2023-03-18,22663,Jumbo Bag Dolly Girl Design,7.24,1,13977.0,United Kingdom
546977,2023-03-18,85099B,Jumbo Bag Red Retrospot,7.24,3,13977.0,United Kingdom
546977,2023-03-18,85099C,Jumbo Bag Baroque Black White,7.24,7,13977.0,United Kingdom
546977,2023-03-18,20727,Lunch Bag Black Skull,7.67,3,13977.0,United Kingdom
546977,2023-03-18,22383,Lunch Bag Suki Design,7.67,3,13977.0,United Kingdom
546979,2023-03-18,22089,Paper Bunting Vintage Paisley,12.86,40,16256.0,United Kingdom
546979,2023-03-18,22090,Paper Bunting Retrospot,12.86,40,16256.0,United Kingdom
546979,2023-03-18,21380,Wooden Happy Birthday Garland,13.27,6,16256.0,United Kingdom
546979,2023-03-18,22088,Paper Bunting Coloured Lace,12.86,40,16256.0,United Kingdom
546979,2023-03-18,22499,Wooden Union Jack Bunting,16.35,12,16256.0,United Kingdom
546979,2023-03-18,22907,Pack Of 20 Napkins Pantry Design,10.99,96,16256.0,United Kingdom
546979,2023-03-18,21078,Set/20 Strawberry Paper Napkins,10.99,96,16256.0,United Kingdom
546979,2023-03-18,21080,Set/20 Red Retrospot Paper Napkins,10.99,96,16256.0,United Kingdom
546979,2023-03-18,22851,Set 20 Napkins Fairy Cakes Design,10.99,96,16256.0,United Kingdom
546979,2023-03-18,21977,Pack Of 60 Pink Paisley Cake Cases,10.81,24,16256.0,United Kingdom
546979,2023-03-18,21212,Pack Of 72 Retrospot Cake Cases,10.81,24,16256.0,United Kingdom
546979,2023-03-18,47566,Party Bunting,15.32,8,16256.0,United Kingdom
546979,2023-03-18,22720,Set Of 3 Cake Tins Pantry Design,15.32,3,16256.0,United Kingdom
546980,2023-03-18,22411,Jumbo Shopper Vintage Red Paisley,12.25,10,13591.0,United Kingdom
546980,2023-03-18,22699,Roses Regency Teacup And Saucer,13.27,6,13591.0,United Kingdom
546980,2023-03-18,22698,Pink Regency Teacup And Saucer,13.27,6,13591.0,United Kingdom
546980,2023-03-18,22697,Green Regency Teacup And Saucer,13.27,6,13591.0,United Kingdom
546980,2023-03-18,22189,Cream Heart Card Holder,14.3,4,13591.0,United Kingdom
546980,2023-03-18,84884A,Ant White Wire Heart Spiral,14.3,5,13591.0,United Kingdom
546980,2023-03-18,15044B,Blue Paper Parasol,13.27,6,13591.0,United Kingdom
