TransactionNo,Date,ProductNo,ProductName,Price,Quantity,CustomerNo,Country
553151,2023-05-13,84949,Silver Hanging T-Light Holder,11.94,24,13089.0,United Kingdom
553151,2023-05-13,20725,Lunch Bag Red Retrospot,5.97,10,13089.0,United Kingdom
553152,2023-05-13,23108,Set Of 10 Led Dolly Lights,16.66,6,13089.0,United Kingdom
553152,2023-05-13,23281,Folding Butterfly Mirror Red,11.1,12,13089.0,United Kingdom
553152,2023-05-13,23282,Folding Butterfly Mirror Ivory,11.1,12,13089.0,United Kingdom
553152,2023-05-13,23280,Folding Butterfly Mirror Hot Pink,11.1,12,13089.0,United Kingdom
553152,2023-05-13,23166,Medium Ceramic Top Storage Jar,11.53,12,13089.0,United Kingdom
553152,2023-05-13,23167,Small Ceramic Top Storage Jar,11.1,12,13089.0,United Kingdom
553152,2023-05-13,23165,Large Ceramic Top Storage Jar,11.94,12,13089.0,United Kingdom
553152,2023-05-13,23169,Classic Glass Cookie Jar,14.5,6,13089.0,United Kingdom
553152,2023-05-13,23298,Spotty Bunting,15.32,9,13089.0,United Kingdom
553152,2023-05-13,23093,Small Parisienne Heart Photo Frame,12.8,6,13089.0,United Kingdom
553152,2023-05-13,23110,Parisienne Key Cabinet,16.14,4,13089.0,United Kingdom
553152,2023-05-13,23112,Parisienne Curio Cabinet,17.94,4,13089.0,United Kingdom
553152,2023-05-13,23118,Parisienne Jewellery Drawer,17.94,4,13089.0,United Kingdom
553152,2023-05-13,23102,Silver Hearts Table Decoration,11.1,12,13089.0,United Kingdom
553152,2023-05-13,23100,Silver Bells Table Decoration,11.53,12,13089.0,United Kingdom
553152,2023-05-13,23101,Silver Stars Table Decoration,11.1,12,13089.0,United Kingdom
553152,2023-05-13,23203,Jumbo Bag Vintage Doily,6.13,10,13089.0,United Kingdom
553152,2023-05-13,23209,Lunch Bag Vintage Doily,5.97,10,13089.0,United Kingdom
553153,2023-05-13,22961,Jam Making Set Printed,11.74,12,13089.0,United Kingdom
553154,2023-05-13,23172,Regency Tea Plate Pink,11.74,48,17061.0,United Kingdom
553154,2023-05-13,23171,Regency Tea Plate Green,11.74,48,17061.0,United Kingdom
553154,2023-05-13,23170,Regency Tea Plate Roses,11.74,48,17061.0,United Kingdom
553155,2023-05-13,21621,Vintage Union Jack Bunting,18.96,4,13089.0,United Kingdom
553156,2023-05-13,21559,Strawberry Lunch Box With Cutlery,12.86,4,17841.0,United Kingdom
553156,2023-05-13,21558,Skull Lunch Box With Cutlery,12.86,4,17841.0,United Kingdom
553156,2023-05-13,22518,Childs Garden Brush Blue,12.4,1,17841.0,United Kingdom
553156,2023-05-13,22522,Childs Garden Fork Blue,11.12,1,17841.0,United Kingdom
553156,2023-05-13,22514,Childs Garden Spade Blue,12.4,1,17841.0,United Kingdom
553156,2023-05-13,22519,Childs Garden Brush Pink,12.4,1,17841.0,United Kingdom
553156,2023-05-13,22515,Childs Garden Spade Pink,12.4,1,17841.0,United Kingdom
553156,2023-05-13,22520,Childs Garden Trowel Blue,11.12,1,17841.0,United Kingdom
553156,2023-05-13,22517,Childs Garden Rake Pink,12.4,1,17841.0,United Kingdom
553156,2023-05-13,22516,Childs Garden Rake Blue,12.4,1,17841.0,United Kingdom
553156,2023-05-13,21672,White Spot Red Ceramic Drawer Knob,11.53,2,17841.0,United Kingdom
553156,2023-05-13,22772,Pink Drawer Knob Acrylic Edwardian,11.53,1,17841.0,United Kingdom
553156,2023-05-13,21669,Blue Stripe Ceramic Drawer Knob,11.53,2,17841.0,United Kingdom
553156,2023-05-13,20982,12 Pencils Tall Tube Skulls,11.12,2,17841.0,United Kingdom
553156,2023-05-13,22771,Clear Drawer Knob Acrylic Edwardian,11.53,12,17841.0,United Kingdom
553156,2023-05-13,72351A,Set/6 Turquoise Butterfly T-Lights,12.4,5,17841.0,United Kingdom
553156,2023-05-13,22467,Gumball Coat Rack,12.86,1,17841.0,United Kingdom
553156,2023-05-13,21090,Set/6 Collage Paper Plates,10.65,15,17841.0,United Kingdom
553156,2023-05-13,21718,Red Metal Beach Spade,11.53,4,17841.0,United Kingdom
553156,2023-05-13,22149,Feltcraft 6 Flower Friends,12.4,1,17841.0,United Kingdom
553156,2023-05-13,23284,Doormat Keep Calm And Come In,18.4,1,17841.0,United Kingdom
553156,2023-05-13,21927,Blue/Cream Stripe Cushion Cover,11.53,10,17841.0,United Kingdom
553156,2023-05-13,47591D,Pink Fairy Cake Childrens Apron,12.25,2,17841.0,United Kingdom
553156,2023-05-13,21155,Red Retrospot Peg Bag,12.86,1,17841.0,United Kingdom
553156,2023-05-13,21989,Pack Of 20 Skull Paper Napkins,11.12,4,17841.0,United Kingdom
553156,2023-05-13,72351B,Set/6 Pink Butterfly T-Lights,12.4,1,17841.0,United Kingdom
553156,2023-05-13,22557,Plasters In Tin Vintage Paisley,11.94,1,17841.0,United Kingdom
553156,2023-05-13,79321,Chilli Lights,16.14,2,17841.0,United Kingdom
553156,2023-05-13,23205,Charlotte Bag Vintage Alphabet,11.12,1,17841.0,United Kingdom
553156,2023-05-13,23147,Single Antique Rose Hook Ivory,11.74,1,17841.0,United Kingdom
553156,2023-05-13,22773,Green Drawer Knob Acrylic Edwardian,11.53,1,17841.0,United Kingdom
553156,2023-05-13,22208,Wood Stamp Set Thank You,11.94,1,17841.0,United Kingdom
553156,2023-05-13,22877,Number Tile Cottage Garden 9,12.25,1,17841.0,United Kingdom
553156,2023-05-13,21213,Pack Of 72 Skull Cake Cases,10.81,2,17841.0,United Kingdom
553156,2023-05-13,21976,Pack Of 60 Mushroom Cake Cases,10.81,1,17841.0,United Kingdom
553156,2023-05-13,21212,Pack Of 72 Retrospot Cake Cases,10.81,2,17841.0,United Kingdom
553156,2023-05-13,21462,Nursery A B C Painted Letters,17.17,1,17841.0,United Kingdom
553156,2023-05-13,20668,Disco Ball Christmas Decoration,10.37,24,17841.0,United Kingdom
553156,2023-05-13,22822,Cream Wall Planter Heart Shaped,16.35,1,17841.0,United Kingdom
553156,2023-05-13,22555,Plasters In Tin Strongman,11.94,1,17841.0,United Kingdom
553156,2023-05-13,22433,Watering Can Green Dinosaur,12.25,2,17841.0,United Kingdom
553156,2023-05-13,22712,Card Dolly Girl,10.68,12,17841.0,United Kingdom
553156,2023-05-13,22156,Heart Decoration With Pearls,11.12,1,17841.0,United Kingdom
553156,2023-05-13,23298,Spotty Bunting,15.32,2,17841.0,United Kingdom
553156,2023-05-13,22478,Birdhouse Garden Marker,11.53,1,17841.0,United Kingdom
553156,2023-05-13,22335,Heart Decoration Painted Zinc,10.92,1,17841.0,United Kingdom
553156,2023-05-13,23148,Miniature Antique Rose Hook Ivory,11.1,2,17841.0,United Kingdom
553156,2023-05-13,21770,Open Closed Metal Sign,15.32,3,17841.0,United Kingdom
553156,2023-05-13,23182,Toilet Sign Occupied Or Vacant,11.1,4,17841.0,United Kingdom
553156,2023-05-13,20618,Queen Of The Skies Passport Cover,12.4,1,17841.0,United Kingdom
553156,2023-05-13,51014C,Feather Pen Coal Black,11.12,1,17841.0,United Kingdom
553156,2023-05-13,23201,Jumbo Bag Alphabet,6.19,1,17841.0,United Kingdom
553156,2023-05-13,20725,Lunch Bag Red Retrospot,5.97,5,17841.0,United Kingdom
553156,2023-05-13,20727,Lunch Bag Black Skull,5.97,6,17841.0,United Kingdom
553156,2023-05-13,22384,Lunch Bag Pink Polkadot,5.97,5,17841.0,United Kingdom
553156,2023-05-13,20728,Lunch Bag Cars Blue,5.97,2,17841.0,United Kingdom
553156,2023-05-13,22383,Lunch Bag Suki Design,5.97,1,17841.0,United Kingdom
553156,2023-05-13,23206,Lunch Bag Apple Design,5.97,2,17841.0,United Kingdom
553156,2023-05-13,23207,Lunch Bag Alphabet Design,5.97,1,17841.0,United Kingdom
553156,2023-05-13,22382,Lunch Bag Spaceboy Design,5.97,1,17841.0,United Kingdom
553157,2023-05-13,23081,Green Metal Box Army Supplies,18.71,1,13157.0,United Kingdom
553158,2023-05-13,84978,Hanging Heart Jar T-Light Holder,11.53,12,14194.0,United Kingdom
553158,2023-05-13,23052,Recycled Acapulco Mat Turquoise,18.71,2,14194.0,United Kingdom
553158,2023-05-13,21621,Vintage Union Jack Bunting,18.96,2,14194.0,United Kingdom
553158,2023-05-13,22083,Paper Chain Kit Retrospot,13.27,6,14194.0,United Kingdom
553158,2023-05-13,21535,Red Retrospot Small Milk Jug,12.86,6,14194.0,United Kingdom
553158,2023-05-13,21733,Red Hanging Heart T-Light Holder,13.27,6,14194.0,United Kingdom
553158,2023-05-13,84997B,Childrens Cutlery Retrospot Red,14.5,6,14194.0,United Kingdom
553158,2023-05-13,22465,Hanging Metal Star Lantern,11.94,12,14194.0,United Kingdom
553158,2023-05-13,21539,Red Retrospot Butter Dish,15.32,3,14194.0,United Kingdom
553158,2023-05-13,79321,Chilli Lights,16.14,4,14194.0,United Kingdom
553158,2023-05-13,21259,Victorian Sewing Box Small,16.35,2,14194.0,United Kingdom
553158,2023-05-13,21212,Pack Of 72 Retrospot Cake Cases,10.81,24,14194.0,United Kingdom
553158,2023-05-13,37370,Retro Coffee Mugs Assorted,11.53,12,14194.0,United Kingdom
553158,2023-05-13,21870,I Can Only Please One Person Mug,11.53,12,14194.0,United Kingdom
553158,2023-05-13,22139,Retrospot Tea Set Ceramic 11 Pc,15.32,3,14194.0,United Kingdom
553158,2023-05-13,47566,Party Bunting,15.32,4,14194.0,United Kingdom
553158,2023-05-13,22411,Jumbo Shopper Vintage Red Paisley,12.38,10,14194.0,United Kingdom
553158,2023-05-13,22779,Wooden Owls Light Garland,14.61,4,14194.0,United Kingdom
553158,2023-05-13,22780,Light Garland Butterfiles Pink,14.61,4,14194.0,United Kingdom
553158,2023-05-13,20685,Doormat Red Retrospot,17.17,10,14194.0,United Kingdom
553158,2023-05-13,22090,Paper Bunting Retrospot,13.27,6,14194.0,United Kingdom
553158,2023-05-13,84880,White Wire Egg Holder,17.07,12,14194.0,United Kingdom
553158,2023-05-13,21181,Please One Person Metal Sign,12.4,6,14194.0,United Kingdom
553158,2023-05-13,85123A,Cream Hanging Heart T-Light Holder,13.27,6,14194.0,United Kingdom
553158,2023-05-13,22892,Set Of Salt And Pepper Toadstools,11.53,12,14194.0,United Kingdom
553158,2023-05-13,22963,Jam Jar With Green Lid,11.12,12,14194.0,United Kingdom
553158,2023-05-13,22721,Set Of 3 Cake Tins Sketchbook,15.32,3,14194.0,United Kingdom
553158,2023-05-13,22722,Set Of 6 Spice Tins Pantry Design,14.3,4,14194.0,United Kingdom
553158,2023-05-13,22192,Blue Diner Wall Clock,18.96,2,14194.0,United Kingdom
553158,2023-05-13,22727,Alarm Clock Bakelike Red,14.09,4,14194.0,United Kingdom
553158,2023-05-13,84879,Assorted Colour Bird Ornament,11.98,8,14194.0,United Kingdom
553158,2023-05-13,22178,Victorian Glass Hanging T-Light,11.53,12,14194.0,United Kingdom
553158,2023-05-13,21232,Strawberry Ceramic Trinket Pot,11.53,12,14194.0,United Kingdom
553159,2023-05-13,23149,Antique Ivory Wire Bowl Small,12.8,6,14194.0,United Kingdom
553159,2023-05-13,23254,Childrens Cutlery Dolly Girl,14.5,4,14194.0,United Kingdom
553159,2023-05-13,23150,Ivory Sweetheart Soap Dish,12.8,6,14194.0,United Kingdom
553159,2023-05-13,23204,Charlotte Bag Apples Design,11.12,10,14194.0,United Kingdom
553159,2023-05-13,23205,Charlotte Bag Vintage Alphabet,11.12,10,14194.0,United Kingdom
553159,2023-05-13,47566,Party Bunting,15.32,4,14194.0,United Kingdom
553159,2023-05-13,21314,Small Glass Heart Trinket Pot,12.4,8,14194.0,United Kingdom
553159,2023-05-13,23051,Recycled Acapulco Mat Blue,18.71,2,14194.0,United Kingdom
553159,2023-05-13,22674,French Toilet Sign Blue Metal,11.53,12,14194.0,United Kingdom
553159,2023-05-13,23182,Toilet Sign Occupied Or Vacant,11.1,24,14194.0,United Kingdom
553159,2023-05-13,22670,French Wc Sign Blue Metal,11.53,12,14194.0,United Kingdom
553159,2023-05-13,22673,French Garden Sign Blue Metal,11.53,12,14194.0,United Kingdom
553159,2023-05-13,22675,French Kitchen Sign Blue Metal,11.53,12,14194.0,United Kingdom
553159,2023-05-13,84924A,Wake Up Cockerel Calendar Sign,14.09,4,14194.0,United Kingdom
553159,2023-05-13,23255,Childrens Cutlery Circus Parade,14.5,4,14194.0,United Kingdom
553159,2023-05-13,23146,Triple Hook Antique Ivory Rose,13.62,4,14194.0,United Kingdom
553159,2023-05-13,23147,Single Antique Rose Hook Ivory,11.74,12,14194.0,United Kingdom
553159,2023-05-13,23199,Jumbo Bag Apples,6.19,20,14194.0,United Kingdom
553159,2023-05-13,23201,Jumbo Bag Alphabet,6.19,10,14194.0,United Kingdom
553159,2023-05-13,23206,Lunch Bag Apple Design,5.97,10,14194.0,United Kingdom
553159,2023-05-13,23207,Lunch Bag Alphabet Design,5.97,10,14194.0,United Kingdom
553159,2023-05-13,23208,Lunch Bag Vintage Leaf Design,5.97,10,14194.0,United Kingdom
553160,2023-05-13,23167,Small Ceramic Top Storage Jar,11.1,12,14194.0,United Kingdom
553160,2023-05-13,23166,Medium Ceramic Top Storage Jar,11.53,12,14194.0,United Kingdom
553160,2023-05-13,23165,Large Ceramic Top Storage Jar,11.94,12,14194.0,United Kingdom
553160,2023-05-13,23298,Spotty Bunting,15.32,4,14194.0,United Kingdom
553160,2023-05-13,23203,Jumbo Bag Vintage Doily,6.19,10,14194.0,United Kingdom
553161,2023-05-13,23066,Small Deco Jewellery Stand,18.71,2,12681.0,France
553161,2023-05-13,23145,Zinc T-Light Holder Star Large,11.22,12,12681.0,France
553161,2023-05-13,23144,Zinc T-Light Holder Stars Small,11.1,12,12681.0,France
553161,2023-05-13,23204,Charlotte Bag Apples Design,11.12,10,12681.0,France
553161,2023-05-13,20724,Red Retrospot Charlotte Bag,11.12,10,12681.0,France
553161,2023-05-13,22904,Calendar Paper Cut Design,13.27,12,12681.0,France
553161,2023-05-13,22976,Circus Parade Childrens Egg Cup,11.53,12,12681.0,France
553161,2023-05-13,21980,Pack Of 12 Red Retrospot Tissues,10.55,24,12681.0,France
553161,2023-05-13,22615,Pack Of 12 Circus Parade Tissues,10.55,24,12681.0,France
553161,2023-05-13,21212,Pack Of 72 Retrospot Cake Cases,10.81,24,12681.0,France
553161,2023-05-13,22303,Coffee Mug Apples Design,12.86,12,12681.0,France
553161,2023-05-13,22365,Doormat Respectable House,18.4,2,12681.0,France
553161,2023-05-13,84692,Box Of 24 Cocktail Parasols,10.68,25,12681.0,France
553161,2023-05-13,22413,Metal Sign Take It Or Leave It,13.27,6,12681.0,France
553161,2023-05-13,22908,Pack Of 20 Napkins Red Apples,11.12,12,12681.0,France
553161,2023-05-13,22895,Set Of 2 Tea Towels Apple And Pears,13.58,12,12681.0,France
553161,2023-05-13,21828,Eight Piece Snake Set,11.53,12,12681.0,France
553161,2023-05-13,84212,"Assorted Flower Colour ""Leis""",10.92,24,12681.0,France
553161,2023-05-13,22559,Seaside Flying Disc,11.53,12,12681.0,France
553162,2023-05-13,21086,Set/6 Red Spotty Paper Cups,11.92,3,16162.0,United Kingdom
553162,2023-05-13,21095,Set/6 Posies Paper Plates,11.12,4,16162.0,United Kingdom
553162,2023-05-13,21137,Black Record Cover Frame,14.09,11,16162.0,United Kingdom
553162,2023-05-13,21212,Pack Of 72 Retrospot Cake Cases,11.53,1,16162.0,United Kingdom
553162,2023-05-13,21215,Ivory Paper Cup Cake Cases,11.53,3,16162.0,United Kingdom
553162,2023-05-13,21238,Red Retrospot Cup,11.92,1,16162.0,United Kingdom
553162,2023-05-13,21240,Blue Polkadot Cup,11.92,1,16162.0,United Kingdom
553162,2023-05-13,21242,Red Retrospot Plate,13.62,1,16162.0,United Kingdom
553162,2023-05-13,21244,Blue Polkadot Plate,13.62,1,16162.0,United Kingdom
553162,2023-05-13,21279,Vintage Kitchen Print Fruits,15.33,1,16162.0,United Kingdom
553162,2023-05-13,21288,Stripey Chocolate Nesting Boxes,13.62,4,16162.0,United Kingdom
553162,2023-05-13,21380,Wooden Happy Birthday Garland,16.18,1,16162.0,United Kingdom
553162,2023-05-13,21455,Painted Yellow Wooden Daisy,11.1,5,16162.0,United Kingdom
553162,2023-05-13,21519,Gin & Tonic Diet Greeting Card,11.1,1,16162.0,United Kingdom
553162,2023-05-13,21773,Decorative Rose Bathroom Bottle,12.77,1,16162.0,United Kingdom
553162,2023-05-13,21774,Decorative Cats Bathroom Bottle,12.77,2,16162.0,United Kingdom
553162,2023-05-13,21832,Chocolate Calculator,13.62,1,16162.0,United Kingdom
553162,2023-05-13,21918,Set 12 Kids Colour Chalk Sticks,11.1,1,16162.0,United Kingdom
553162,2023-05-13,21933,Pink Vintage Paisley Picnic Bag,12.77,1,16162.0,United Kingdom
553162,2023-05-13,22079,Ribbon Reel Hearts Design,13.62,1,16162.0,United Kingdom
553162,2023-05-13,22090,Paper Bunting Retrospot,16.18,8,16162.0,United Kingdom
553162,2023-05-13,22123,Ping Microwave Apron,14.48,1,16162.0,United Kingdom
553162,2023-05-13,22161,Heart Decoration Rustic Hanging,10.92,1,16162.0,United Kingdom
553162,2023-05-13,22178,Victorian Glass Hanging T-Light,12.77,7,16162.0,United Kingdom
553162,2023-05-13,22183,Cake Stand Victorian Filigree Med,16.18,2,16162.0,United Kingdom
553162,2023-05-13,22188,Black Heart Card Holder,18.75,1,16162.0,United Kingdom
553162,2023-05-13,22190,Local Cafe Mug,12.77,2,16162.0,United Kingdom
553162,2023-05-13,22197,Popcorn Holder,11.92,3,16162.0,United Kingdom
553162,2023-05-13,22201,Frying Pan Blue Polkadot,18.75,1,16162.0,United Kingdom
553162,2023-05-13,22219,Lovebird Hanging Decoration White,11.92,1,16162.0,United Kingdom
553162,2023-05-13,22224,White Lovebird Lantern,16.18,6,16162.0,United Kingdom
553162,2023-05-13,22241,Garland Wooden Happy Easter,12.77,1,16162.0,United Kingdom
553162,2023-05-13,22293,Hanging Chick Green Decoration,13.24,1,16162.0,United Kingdom
553162,2023-05-13,22312,Office Mug Warmer Polkadot,16.18,1,16162.0,United Kingdom
553162,2023-05-13,22381,Toy Tidy Pink Polkadot,14.48,1,16162.0,United Kingdom
553162,2023-05-13,22411,Jumbo Shopper Vintage Red Paisley,14.48,2,16162.0,United Kingdom
553162,2023-05-13,22457,Natural Slate Heart Chalkboard,16.18,2,16162.0,United Kingdom
553162,2023-05-13,22464,Hanging Metal Heart Lantern,13.62,8,16162.0,United Kingdom
553162,2023-05-13,22560,Traditional Modelling Clay,12.77,2,16162.0,United Kingdom
553162,2023-05-13,22561,Wooden School Colouring Set,13.62,2,16162.0,United Kingdom
553162,2023-05-13,22583,Pack Of 6 Handbag Gift Boxes,15.33,2,16162.0,United Kingdom
553162,2023-05-13,22597,Musical Zinc Heart Decoration,11.92,1,16162.0,United Kingdom
553162,2023-05-13,22619,Set Of 6 Soldier Skittles,17.9,1,16162.0,United Kingdom
553162,2023-05-13,22659,Lunch Box I Love London,14.48,1,16162.0,United Kingdom
553162,2023-05-13,22664,Toy Tidy Dolly Girl Design,14.48,1,16162.0,United Kingdom
553162,2023-05-13,22666,Recipe Box Pantry Yellow Design,16.18,1,16162.0,United Kingdom
553162,2023-05-13,22681,French Blue Metal Door Sign 6,12.77,1,16162.0,United Kingdom
553162,2023-05-13,22684,French Blue Metal Door Sign 9,12.77,1,16162.0,United Kingdom
553162,2023-05-13,22686,French Blue Metal Door Sign No,12.77,1,16162.0,United Kingdom
553162,2023-05-13,22697,Green Regency Teacup And Saucer,16.18,1,16162.0,United Kingdom
553162,2023-05-13,22698,Pink Regency Teacup And Saucer,16.18,1,16162.0,United Kingdom
553162,2023-05-13,22699,Roses Regency Teacup And Saucer,16.18,1,16162.0,United Kingdom
553162,2023-05-13,22720,Set Of 3 Cake Tins Pantry Design,15.32,2,16162.0,United Kingdom
553162,2023-05-13,22722,Set Of 6 Spice Tins Pantry Design,18.75,2,16162.0,United Kingdom
553162,2023-05-13,22771,Clear Drawer Knob Acrylic Edwardian,12.77,8,16162.0,United Kingdom
553162,2023-05-13,22800,Antique Tall Swirlglass Trinket Pot,17.9,1,16162.0,United Kingdom
553162,2023-05-13,22805,Blue Drawer Knob Acrylic Edwardian,12.77,4,16162.0,United Kingdom
553162,2023-05-13,22907,Pack Of 20 Napkins Pantry Design,11.92,7,16162.0,United Kingdom
553162,2023-05-13,22961,Jam Making Set Printed,13.62,3,16162.0,United Kingdom
553162,2023-05-13,22969,Homemade Jam Scented Candles,13.62,1,16162.0,United Kingdom
553162,2023-05-13,23004,Travel Card Wallet Pantry,11.1,2,16162.0,United Kingdom
553162,2023-05-13,23096,Petit Tray Chic,13.62,1,16162.0,United Kingdom
553162,2023-05-13,23103,Jingle Bell Heart Decoration,13.62,1,16162.0,United Kingdom
553162,2023-05-13,23146,Triple Hook Antique Ivory Rose,17.05,1,16162.0,United Kingdom
553162,2023-05-13,23174,Regency Sugar Bowl Green,18.75,1,16162.0,United Kingdom
553162,2023-05-13,23175,Regency Milk Jug Pink,17.9,1,16162.0,United Kingdom
553162,2023-05-13,23182,Toilet Sign Occupied Or Vacant,12.77,1,16162.0,United Kingdom
553162,2023-05-13,23190,Bundle Of 3 School Exercise Books,13.62,1,16162.0,United Kingdom
553162,2023-05-13,23191,Bundle Of 3 Retro Note Books,13.62,1,16162.0,United Kingdom
553162,2023-05-13,23192,Bundle Of 3 Alphabet Exercise Books,13.62,1,16162.0,United Kingdom
553162,2023-05-13,23348,Childrens Toy Cooking Utensil Set,14.48,1,16162.0,United Kingdom
553162,2023-05-13,35004B,Set Of 3 Black Flying Ducks,16.18,2,16162.0,United Kingdom
553162,2023-05-13,37342,Polkadot Coffee Cup & Saucer Pink,12.77,4,16162.0,United Kingdom
553162,2023-05-13,47574A,English Rose Scented Hanging Flower,12.77,8,16162.0,United Kingdom
553162,2023-05-13,47593B,Scottie Dogs Baby Bib,11.1,1,16162.0,United Kingdom
553162,2023-05-13,71143,Antique Silver Book Mark With Beads,12.77,2,16162.0,United Kingdom
553162,2023-05-13,71459,Hanging Jam Jar T-Light Holders,11.95,4,16162.0,United Kingdom
553162,2023-05-13,71477,Coloured Glass Star T-Light Holder,17.05,1,16162.0,United Kingdom
553162,2023-05-13,82095,Heart Buttons Jewellery Box,15.33,3,16162.0,United Kingdom
553162,2023-05-13,82551,Laundry 15c Metal Sign,12.77,1,16162.0,United Kingdom
553162,2023-05-13,21171,Bathroom Metal Sign,11.53,1,16162.0,United Kingdom
553162,2023-05-13,82583,Hot Baths Metal Sign,14.48,1,16162.0,United Kingdom
553162,2023-05-13,82613A,Metal Sign Cupcake Single Hook,12.77,1,16162.0,United Kingdom
553162,2023-05-13,82613A,Metal Sign Cupcake Single Hook,12.77,1,16162.0,United Kingdom
553162,2023-05-13,84251C,Greeting Card Two Sisters,11.1,1,16162.0,United Kingdom
553162,2023-05-13,84279B,Cherry Blossom Decorative Flask,18.75,1,16162.0,United Kingdom
553162,2023-05-13,84692,Box Of 24 Cocktail Parasols,11.1,2,16162.0,United Kingdom
553162,2023-05-13,84796B,Blue Savannah Picnic Hamper For 2,18.75,2,16162.0,United Kingdom
553162,2023-05-13,84877D,Blue Round Compact Mirror,13.62,1,16162.0,United Kingdom
553162,2023-05-13,84879,Assorted Colour Bird Ornament,13.45,8,16162.0,United Kingdom
553162,2023-05-13,84913A,Soft Pink Rose Towel,13.62,1,16162.0,United Kingdom
553162,2023-05-13,84970L,Single Heart Zinc T-Light Holder,12.38,1,16162.0,United Kingdom
553162,2023-05-13,84987,Set Of 36 Teatime Paper Doilies,13.24,1,16162.0,United Kingdom
553162,2023-05-13,84988,Set Of 72 Pink Heart Paper Doilies,13.24,3,16162.0,United Kingdom
553162,2023-05-13,85039B,S/4 Ivory Mini Rose Candle In Bowl,11.92,1,16162.0,United Kingdom
553162,2023-05-13,85131A,Beaded Pearl Heart White On Stick,11.1,3,16162.0,United Kingdom
553162,2023-05-13,85131B,Beaded Crystal Heart Green On Stick,11.1,1,16162.0,United Kingdom
553162,2023-05-13,85131D,Beaded Crystal Heart Pink On Stick,11.1,4,16162.0,United Kingdom
553162,2023-05-13,85132A,Charlie + Lola Biscuits Tins,16.18,3,16162.0,United Kingdom
553162,2023-05-13,85150,Ladies & Gentlemen Metal Sign,12.86,1,16162.0,United Kingdom
553162,2023-05-13,85202,Hanging Wood And Felt Heart,10.68,1,16162.0,United Kingdom
553162,2023-05-13,90059C,Diamante Hair Grip Pack/2 Montana,11.94,1,16162.0,United Kingdom
553162,2023-05-13,90059D,Diamante Hair Grip Pack/2 Peridot,11.94,1,16162.0,United Kingdom
553162,2023-05-13,90200A,Purple Sweetheart Bracelet,14.5,1,16162.0,United Kingdom
553162,2023-05-13,90205C,Large Crystal Diamante Hairslide,11.94,1,16162.0,United Kingdom
553162,2023-05-13,90209B,Green Enamel+Glass Hair Comb,12.37,1,16162.0,United Kingdom
553162,2023-05-13,90214D,"Letter ""D"" Bling Key Ring",11.1,1,16162.0,United Kingdom
553162,2023-05-13,15036,Assorted Colours Silk Fan,11.1,13,16162.0,United Kingdom
553162,2023-05-13,17012F,Origami Sandlewood Incense/Cand Set,12.77,1,16162.0,United Kingdom
553162,2023-05-13,20619,Tropical Passport Cover,11.92,1,16162.0,United Kingdom
553162,2023-05-13,20675,Blue Polkadot Bowl,12.77,1,16162.0,United Kingdom
553162,2023-05-13,20676,Red Retrospot Bowl,12.77,1,16162.0,United Kingdom
553162,2023-05-13,20682,Red Retrospot Childrens Umbrella,17.05,1,16162.0,United Kingdom
553162,2023-05-13,20707,Crazy Daisy Heart Decoration,11.1,1,16162.0,United Kingdom
553162,2023-05-13,20718,Red Retrospot Shopper Bag,12.77,1,16162.0,United Kingdom
553162,2023-05-13,20719,Woodland Charlotte Bag,11.92,1,16162.0,United Kingdom
553162,2023-05-13,20731,Posy Candy Bag,11.1,2,16162.0,United Kingdom
553162,2023-05-13,20735,Black Mini Tape Measure,11.1,1,16162.0,United Kingdom
553162,2023-05-13,20830,Silver Photo Frame,14.48,1,16162.0,United Kingdom
553162,2023-05-13,20886,Box Of 9 Pebble Candles,14.48,2,16162.0,United Kingdom
553162,2023-05-13,20914,Set/5 Red Retrospot Lid Glass Bowls,16.18,1,16162.0,United Kingdom
553162,2023-05-13,20979,36 Pencils Tube Red Retrospot,12.77,1,16162.0,United Kingdom
553162,2023-05-13,20997,Rose Du Sud Cushion Cover,14.48,1,16162.0,United Kingdom
553162,2023-05-13,20997,Rose Du Sud Cushion Cover,16.18,1,16162.0,United Kingdom
553162,2023-05-13,21078,Set/20 Strawberry Paper Napkins,11.92,1,16162.0,United Kingdom
553162,2023-05-13,35001G,Hand Open Shape Gold,13.72,9,16162.0,United Kingdom
553162,2023-05-13,22386,Jumbo Bag Pink Polkadot,7.24,1,16162.0,United Kingdom
553162,2023-05-13,23199,Jumbo Bag Apples,7.24,1,16162.0,United Kingdom
553162,2023-05-13,23200,Jumbo Bag Pears,7.24,2,16162.0,United Kingdom
553162,2023-05-13,23203,Jumbo Bag Vintage Doily,7.24,1,16162.0,United Kingdom
553162,2023-05-13,22384,Lunch Bag Pink Polkadot,7.24,1,16162.0,United Kingdom
553162,2023-05-13,20725,Lunch Bag Red Retrospot,7.24,1,16162.0,United Kingdom
553164,2023-05-13,22636,Childs Breakfast Set Circus Parade,18.96,1,17961.0,United Kingdom
553164,2023-05-13,21877,Home Sweet Home Mug,11.53,1,17961.0,United Kingdom
553164,2023-05-13,22378,Wall Tidy Retrospot,12.4,1,17961.0,United Kingdom
553164,2023-05-13,21870,I Can Only Please One Person Mug,11.53,1,17961.0,United Kingdom
553164,2023-05-13,21876,Pottering Mug,11.53,1,17961.0,United Kingdom
553164,2023-05-13,21874,Gin And Tonic Mug,11.53,1,17961.0,United Kingdom
553164,2023-05-13,22383,Lunch Bag Suki Design,5.97,1,17961.0,United Kingdom
553164,2023-05-13,23209,Lunch Bag Vintage Doily,5.97,1,17961.0,United Kingdom
553165,2023-05-13,21896,Potting Shed Twine,12.4,1,13623.0,United Kingdom
553165,2023-05-13,47504K,English Rose Garden Secateurs,12.25,1,13623.0,United Kingdom
553165,2023-05-13,22852,Dog Bowl Vintage Cream,14.61,2,13623.0,United Kingdom
553165,2023-05-13,85123A,Cream Hanging Heart T-Light Holder,13.27,3,13623.0,United Kingdom
553165,2023-05-13,21931,Jumbo Storage Bag Suki,12.38,1,13623.0,United Kingdom
553165,2023-05-13,23103,Jingle Bell Heart Decoration,11.94,4,13623.0,United Kingdom
553165,2023-05-13,23057,Beaded Chandelier T-Light Holder,15.32,2,13623.0,United Kingdom
553165,2023-05-13,23069,Edwardian Photo Frame,16.66,2,13623.0,United Kingdom
553165,2023-05-13,23055,Ivory Chandelier T-Light Holder,16.66,1,13623.0,United Kingdom
553165,2023-05-13,23070,Edwardian Heart Photo Frame,14.5,4,13623.0,United Kingdom
