TransactionNo,Date,ProductNo,ProductName,Price,Quantity,CustomerNo,Country
567182,2023-09-18,22900,Set 2 Tea Towels I Love London,13.58,3,13334.0,United Kingdom
567182,2023-09-18,47566,Party Bunting,15.32,2,13334.0,United Kingdom
567182,2023-09-18,20970,Pink Floral Feltcraft Shoulder Bag,14.09,3,13334.0,United Kingdom
567182,2023-09-18,22750,Feltcraft Princess Lola Doll,14.09,3,13334.0,United Kingdom
567182,2023-09-18,22274,Feltcraft Doll Emily,13.27,2,13334.0,United Kingdom
567182,2023-09-18,23127,Feltcraft Girl Nicole Kit,15.32,1,13334.0,United Kingdom
567182,2023-09-18,22750,Feltcraft Princess Lola Doll,14.09,3,13334.0,United Kingdom
567182,2023-09-18,23126,Feltcraft Girl Amelie Kit,15.32,1,13334.0,United Kingdom
567182,2023-09-18,22271,Feltcraft Doll Rosie,13.27,2,13334.0,United Kingdom
567182,2023-09-18,22147,Feltcraft Butterfly Hearts,11.74,3,13334.0,United Kingdom
567182,2023-09-18,22570,Feltcraft Cushion Rabbit,14.09,2,13334.0,United Kingdom
567182,2023-09-18,22569,Feltcraft Cushion Butterfly,14.09,2,13334.0,United Kingdom
567182,2023-09-18,22568,Feltcraft Cushion Owl,14.09,2,13334.0,United Kingdom
567182,2023-09-18,20971,Pink Blue Felt Craft Trinket Box,11.53,12,13334.0,United Kingdom
567182,2023-09-18,20972,Pink Cream Felt Craft Trinket Box,11.53,12,13334.0,United Kingdom
567182,2023-09-18,22150,3 Stripey Mice Feltcraft,12.25,3,13334.0,United Kingdom
567182,2023-09-18,22587,Feltcraft Hairband Red And Blue,11.12,12,13334.0,United Kingdom
567182,2023-09-18,22866,Hand Warmer Scotty Dog Design,12.4,12,13334.0,United Kingdom
567182,2023-09-18,22867,Hand Warmer Bird Design,12.4,6,13334.0,United Kingdom
567182,2023-09-18,84380,Set Of 3 Butterfly Cookie Cutters,11.74,3,13334.0,United Kingdom
567182,2023-09-18,84375,Set Of 20 Kids Cookie Cutters,12.4,6,13334.0,United Kingdom
567182,2023-09-18,23300,Gardeners Kneeling Pad Cup Of Tea,11.94,6,13334.0,United Kingdom
567182,2023-09-18,23302,Kneeling Mat Housework Design,11.94,3,13334.0,United Kingdom
567182,2023-09-18,23322,Large White Heart Of Wicker,13.27,3,13334.0,United Kingdom
567182,2023-09-18,23355,Hot Water Bottle Keep Calm,15.32,6,13334.0,United Kingdom
567182,2023-09-18,23200,Jumbo Bag Pears,6.19,10,13334.0,United Kingdom
567182,2023-09-18,21928,Jumbo Bag Scandinavian Blue Paisley,6.19,10,13334.0,United Kingdom
567182,2023-09-18,23203,Jumbo Bag Vintage Doily,6.19,10,13334.0,United Kingdom
567182,2023-09-18,20713,Jumbo Bag Owls,6.19,10,13334.0,United Kingdom
567182,2023-09-18,85099B,Jumbo Bag Red Retrospot,6.19,10,13334.0,United Kingdom
567182,2023-09-18,23202,Jumbo Bag Vintage Leaf,6.19,10,13334.0,United Kingdom
567182,2023-09-18,20727,Lunch Bag Black Skull,5.97,10,13334.0,United Kingdom
567182,2023-09-18,22383,Lunch Bag Suki Design,5.97,10,13334.0,United Kingdom
567183,2023-09-18,82484,Wood Black Board Ant White Finish,18.4,6,14769.0,United Kingdom
567183,2023-09-18,23398,Hanging Heart Bonheur,11.12,6,14769.0,United Kingdom
567183,2023-09-18,23399,Home Sweet Home Hanging Heart,11.12,6,14769.0,United Kingdom
567183,2023-09-18,21259,Victorian Sewing Box Small,16.35,2,14769.0,United Kingdom
567183,2023-09-18,21754,Home Building Block Word,16.66,2,14769.0,United Kingdom
567183,2023-09-18,22121,Noel Wooden Block Letters,16.35,2,14769.0,United Kingdom
567183,2023-09-18,82483,Wood 2 Drawer Cabinet White Finish,17.37,6,14769.0,United Kingdom
567183,2023-09-18,23404,Home Sweet Home Blackboard,15.32,2,14769.0,United Kingdom
567183,2023-09-18,22169,Family Album White Picture Frame,18.96,2,14769.0,United Kingdom
567183,2023-09-18,82486,3 Drawer Antique White Wood Cabinet,19.42,6,14769.0,United Kingdom
567183,2023-09-18,23408,Photo Frame Linen And Lace Small,12.38,12,14769.0,United Kingdom
567183,2023-09-18,23400,Shelf With 4 Hooks Home Sweet Home,16.66,4,14769.0,United Kingdom
567183,2023-09-18,23405,Home Sweet Home 2 Drawer Cabinet,15.32,4,14769.0,United Kingdom
567183,2023-09-18,23401,Rustic Mirror With Lace Heart,16.66,6,14769.0,United Kingdom
567183,2023-09-18,23412,Heart Mirror Antique White,17.94,4,14769.0,United Kingdom
567183,2023-09-18,23396,Le Jardin Botanique Cushion Cover,14.09,2,14769.0,United Kingdom
567183,2023-09-18,23395,Belle Jardiniere Cushion Cover,14.09,2,14769.0,United Kingdom
567183,2023-09-18,23393,Home Sweet Home Cushion Cover,14.09,2,14769.0,United Kingdom
567183,2023-09-18,23410,Curio Cabinet Linen And Lace,18.6,4,14769.0,United Kingdom
567183,2023-09-18,23402,Home Sweet Home 3 Peg Hanger,14.09,2,14769.0,United Kingdom
567183,2023-09-18,23403,Letter Holder Home Sweet Home,14.09,2,14769.0,United Kingdom
567183,2023-09-18,23406,Home Sweet Home Key Holder,16.66,4,14769.0,United Kingdom
567183,2023-09-18,21524,Doormat Spotty Home Sweet Home,18.71,1,14769.0,United Kingdom
567183,2023-09-18,22690,Doormat Home Sweet Home Blue,18.71,1,14769.0,United Kingdom
567183,2023-09-18,23232,Wrap Vintage Leaf Design,10.68,25,14769.0,United Kingdom
567183,2023-09-18,23546,Wrap Paisley Park,10.68,25,14769.0,United Kingdom
567183,2023-09-18,23548,Wrap Magic Forest,10.68,25,14769.0,United Kingdom
567183,2023-09-18,23549,Wrap Bird Garden,10.68,25,14769.0,United Kingdom
567183,2023-09-18,22047,Empire Gift Wrap,10.68,25,14769.0,United Kingdom
567183,2023-09-18,22047,Empire Gift Wrap,10.68,25,14769.0,United Kingdom
567183,2023-09-18,22046,Tea Party Wrapping Paper,10.68,25,14769.0,United Kingdom
567183,2023-09-18,21498,Red Retrospot Wrap,10.68,25,14769.0,United Kingdom
567183,2023-09-18,16161P,Wrap English Rose,10.68,25,14769.0,United Kingdom
567183,2023-09-18,22718,Card Cat And Tree,10.68,12,14769.0,United Kingdom
567183,2023-09-18,21504,Skulls Greeting Card,10.68,12,14769.0,United Kingdom
567183,2023-09-18,22714,Card Birthday Cowboy,10.68,12,14769.0,United Kingdom
567183,2023-09-18,22984,Card Gingham Rose,10.68,12,14769.0,United Kingdom
567183,2023-09-18,22713,Card I Love London,10.68,12,14769.0,United Kingdom
567183,2023-09-18,22405,Money Box Pocket Money Design,11.53,2,14769.0,United Kingdom
567183,2023-09-18,22410,Money Box Housekeeping Design,11.53,2,14769.0,United Kingdom
567183,2023-09-18,22407,Money Box First Aid Design,11.53,2,14769.0,United Kingdom
567183,2023-09-18,22408,Money Box Confectionery Design,11.53,2,14769.0,United Kingdom
567183,2023-09-18,22409,Money Box Biscuits Design,11.53,2,14769.0,United Kingdom
567183,2023-09-18,22406,Money Box Kings Choice Design,11.53,2,14769.0,United Kingdom
567183,2023-09-18,22966,Gingerbread Man Cookie Cutter,11.53,6,14769.0,United Kingdom
567183,2023-09-18,22666,Recipe Box Pantry Yellow Design,13.27,3,14769.0,United Kingdom
567183,2023-09-18,22960,Jam Making Set With Jars,14.61,3,14769.0,United Kingdom
567183,2023-09-18,22654,Deluxe Sewing Kit,16.35,3,14769.0,United Kingdom
567183,2023-09-18,22668,Pink Baby Bunting,13.27,5,14769.0,United Kingdom
567183,2023-09-18,23298,Spotty Bunting,15.32,2,14769.0,United Kingdom
567183,2023-09-18,47566,Party Bunting,15.32,3,14769.0,United Kingdom
567183,2023-09-18,22815,Card Psychedelic Apples,10.68,12,14769.0,United Kingdom
567183,2023-09-18,21621,Vintage Union Jack Bunting,18.96,2,14769.0,United Kingdom
567183,2023-09-18,84580,Mouse Toy With Pink T-Shirt,14.09,2,14769.0,United Kingdom
567183,2023-09-18,21841,Baby Mouse Red Gingham Dress,14.61,4,14769.0,United Kingdom
567183,2023-09-18,23031,Drawer Knob Crackle Glaze Pink,11.94,6,14769.0,United Kingdom
567183,2023-09-18,20679,Edwardian Parasol Red,16.35,1,14769.0,United Kingdom
567183,2023-09-18,85014B,Red Retrospot Umbrella,16.35,1,14769.0,United Kingdom
567183,2023-09-18,85014A,Black/Blue Polkadot Umbrella,16.35,1,14769.0,United Kingdom
567183,2023-09-18,22318,Five Heart Hanging Decoration,13.27,3,14769.0,United Kingdom
567183,2023-09-18,23300,Gardeners Kneeling Pad Cup Of Tea,11.94,3,14769.0,United Kingdom
567183,2023-09-18,23301,Gardeners Kneeling Pad Keep Calm,11.94,3,14769.0,United Kingdom
567183,2023-09-18,22617,Baking Set Spaceboy Design,15.32,1,14769.0,United Kingdom
567183,2023-09-18,22138,Baking Set 9 Piece Retrospot,15.32,3,14769.0,United Kingdom
567183,2023-09-18,23357,Hot Water Bottle Sex Bomb,15.32,1,14769.0,United Kingdom
567183,2023-09-18,23355,Hot Water Bottle Keep Calm,15.32,2,14769.0,United Kingdom
567183,2023-09-18,23358,Hot Stuff Hot Water Bottle,14.09,2,14769.0,United Kingdom
567183,2023-09-18,22113,Grey Heart Hot Water Bottle,14.61,2,14769.0,United Kingdom
567183,2023-09-18,21481,Fawn Blue Hot Water Bottle,14.09,1,14769.0,United Kingdom
567183,2023-09-18,22111,Scottie Dog Hot Water Bottle,15.32,1,14769.0,United Kingdom
567183,2023-09-18,21485,Retrospot Heart Hot Water Bottle,15.32,1,14769.0,United Kingdom
567183,2023-09-18,22835,Hot Water Bottle I Am So Poorly,15.32,1,14769.0,United Kingdom
567183,2023-09-18,21484,Chick Grey Hot Water Bottle,14.61,1,14769.0,United Kingdom
567183,2023-09-18,23356,Love Hot Water Bottle,16.35,3,14769.0,United Kingdom
567183,2023-09-18,22114,Hot Water Bottle Tea And Sympathy,14.61,2,14769.0,United Kingdom
567183,2023-09-18,22112,Chocolate Hot Water Bottle,15.32,1,14769.0,United Kingdom
567183,2023-09-18,21577,Save The Planet Cotton Tote Bag,12.56,4,14769.0,United Kingdom
567183,2023-09-18,22616,Pack Of 12 London Tissues,10.65,12,14769.0,United Kingdom
567183,2023-09-18,22907,Pack Of 20 Napkins Pantry Design,11.12,8,14769.0,United Kingdom
567183,2023-09-18,22179,Set 10 Night Owl Lights,17.17,2,14769.0,United Kingdom
567183,2023-09-18,22468,Babushka Lights String Of 10,17.17,1,14769.0,United Kingdom
567183,2023-09-18,84077,World War 2 Gliders Asstd Designs,10.55,48,14769.0,United Kingdom
567183,2023-09-18,22659,Lunch Box I Love London,12.25,2,14769.0,United Kingdom
567183,2023-09-18,23310,Bubblegum Ring Assorted,10.68,36,14769.0,United Kingdom
567183,2023-09-18,21136,Painted Metal Pears Assorted,11.98,8,14769.0,United Kingdom
567183,2023-09-18,22996,Travel Card Wallet Vintage Ticket,10.68,6,14769.0,United Kingdom
567183,2023-09-18,22998,Travel Card Wallet Keep Calm,10.68,5,14769.0,United Kingdom
567183,2023-09-18,23005,Travel Card Wallet I Love London,10.68,3,14769.0,United Kingdom
567183,2023-09-18,23006,Travel Card Wallet Flower Meadow,10.68,3,14769.0,United Kingdom
567183,2023-09-18,22551,Plasters In Tin Spaceboy,11.94,2,14769.0,United Kingdom
567183,2023-09-18,22556,Plasters In Tin Circus Parade,11.94,1,14769.0,United Kingdom
567183,2023-09-18,22555,Plasters In Tin Strongman,11.94,3,14769.0,United Kingdom
567183,2023-09-18,22652,Travel Sewing Kit,11.94,2,14769.0,United Kingdom
567183,2023-09-18,22779,Wooden Owls Light Garland,14.61,2,14769.0,United Kingdom
567183,2023-09-18,22780,Light Garland Butterfiles Pink,14.61,2,14769.0,United Kingdom
567183,2023-09-18,22507,Memo Board Retrospot Design,15.32,4,14769.0,United Kingdom
567183,2023-09-18,22505,Memo Board Cottage Design,15.32,2,14769.0,United Kingdom
567183,2023-09-18,21135,Victorian Metal Postcard Spring,11.98,16,14769.0,United Kingdom
567183,2023-09-18,22178,Victorian Glass Hanging T-Light,12.25,12,14769.0,United Kingdom
567183,2023-09-18,22375,Airline Bag Vintage Jet Set Brown,14.61,1,14769.0,United Kingdom
567183,2023-09-18,22374,Airline Bag Vintage Jet Set Red,14.61,1,14769.0,United Kingdom
567183,2023-09-18,22371,Airline Bag Vintage Tokyo 78,14.61,1,14769.0,United Kingdom
567183,2023-09-18,84755,Colour Glass T-Light Holder Hanging,10.92,16,14769.0,United Kingdom
567183,2023-09-18,22865,Hand Warmer Owl Design,12.4,2,14769.0,United Kingdom
567183,2023-09-18,84879,Assorted Colour Bird Ornament,11.98,8,14769.0,United Kingdom
567183,2023-09-18,22494,Emergency First Aid Tin,11.53,4,14769.0,United Kingdom
567183,2023-09-18,22496,Set Of 2 Round Tins Dutch Cheese,13.27,2,14769.0,United Kingdom
567183,2023-09-18,22495,Set Of 2 Round Tins Camembert,13.27,2,14769.0,United Kingdom
567183,2023-09-18,71459,Hanging Jam Jar T-Light Holders,11.12,12,14769.0,United Kingdom
567183,2023-09-18,21260,First Aid Tin,13.58,2,14769.0,United Kingdom
567183,2023-09-18,23035,Drawer Knob Ceramic Ivory,11.74,12,14769.0,United Kingdom
567183,2023-09-18,23031,Drawer Knob Crackle Glaze Pink,11.94,6,14769.0,United Kingdom
567183,2023-09-18,23032,Drawer Knob Crackle Glaze Ivory,11.94,12,14769.0,United Kingdom
567183,2023-09-18,22728,Alarm Clock Bakelike Pink,14.09,4,14769.0,United Kingdom
567183,2023-09-18,22727,Alarm Clock Bakelike Red,14.09,2,14769.0,United Kingdom
567183,2023-09-18,22729,Alarm Clock Bakelike Orange,14.09,3,14769.0,United Kingdom
567183,2023-09-18,22726,Alarm Clock Bakelike Green,14.09,4,14769.0,United Kingdom
567183,2023-09-18,22081,Ribbon Reel Flora + Fauna,11.94,4,14769.0,United Kingdom
567183,2023-09-18,22079,Ribbon Reel Hearts Design,11.94,2,14769.0,United Kingdom
567183,2023-09-18,22082,Ribbon Reel Stripes Design,11.94,2,14769.0,United Kingdom
567183,2023-09-18,22078,Ribbon Reel Lace Design,12.4,2,14769.0,United Kingdom
567183,2023-09-18,22080,Ribbon Reel Polkadots,11.94,2,14769.0,United Kingdom
567183,2023-09-18,23413,Decorative Vintage Coffee Box,15.32,3,14769.0,United Kingdom
567183,2023-09-18,23409,Photo Frame Linen And Lace Large,14.09,12,14769.0,United Kingdom
567183,2023-09-18,23241,Treasure Tin Gymkhana Design,12.38,2,14769.0,United Kingdom
567183,2023-09-18,23242,Treasure Tin Buffalo Bill,12.38,2,14769.0,United Kingdom
567183,2023-09-18,23074,Embossed Heart Trinket Box,12.38,4,14769.0,United Kingdom
567183,2023-09-18,23235,Storage Tin Vintage Leaf,13.21,2,14769.0,United Kingdom
567183,2023-09-18,23423,Pantry 3 Hook Rolling Pin Hanger,14.09,3,14769.0,United Kingdom
567183,2023-09-18,23237,Set Of 4 Knick Knack Tins Leaf,14.5,2,14769.0,United Kingdom
567183,2023-09-18,23240,Set Of 4 Knick Knack Tins Doily,14.5,2,14769.0,United Kingdom
567183,2023-09-18,23238,Set Of 4 Knick Knack Tins London,14.5,1,14769.0,United Kingdom
567183,2023-09-18,23239,Set Of 4 Knick Knack Tins Poppies,14.5,1,14769.0,United Kingdom
567183,2023-09-18,23236,Storage Tin Vintage Doily,13.21,2,14769.0,United Kingdom
567183,2023-09-18,22766,Photo Frame Cornice,13.27,4,14769.0,United Kingdom
567183,2023-09-18,82494L,Wooden Frame Antique White,13.27,12,14769.0,United Kingdom
567183,2023-09-18,82482,Wooden Picture Frame White Finish,13.27,12,14769.0,United Kingdom
567183,2023-09-18,21745,Gaolers Keys Decorative Garden,14.09,6,14769.0,United Kingdom
567183,2023-09-18,23181,Bull Dog Bottle Top Wall Clock,18.71,2,14769.0,United Kingdom
567183,2023-09-18,22396,Magnets Pack Of 4 Retro Photo,10.65,12,14769.0,United Kingdom
567183,2023-09-18,22398,Magnets Pack Of 4 Swallows,10.65,12,14769.0,United Kingdom
567183,2023-09-18,23093,Small Parisienne Heart Photo Frame,12.8,16,14769.0,United Kingdom
567183,2023-09-18,22174,Photo Cube,11.94,6,14769.0,United Kingdom
567183,2023-09-18,23392,Spaceboy Rocket Lolly Makers,12.38,3,14769.0,United Kingdom
567183,2023-09-18,23559,Woodland Bunnies Lolly Makers,12.38,1,14769.0,United Kingdom
567183,2023-09-18,22173,Metal 4 Hook Hanger French Chateau,13.62,2,14769.0,United Kingdom
567183,2023-09-18,22212,Four Hook White Lovebirds,12.4,4,14769.0,United Kingdom
567183,2023-09-18,22467,Gumball Coat Rack,12.86,2,14769.0,United Kingdom
567183,2023-09-18,23342,Mint Diner Wall Clock,18.96,1,14769.0,United Kingdom
567183,2023-09-18,85150,Ladies & Gentlemen Metal Sign,12.86,2,14769.0,United Kingdom
567183,2023-09-18,21770,Open Closed Metal Sign,15.32,4,14769.0,United Kingdom
567183,2023-09-18,21905,More Butter Metal Sign,11.06,2,14769.0,United Kingdom
567183,2023-09-18,21166,Cook With Wine Metal Sign,12.38,2,14769.0,United Kingdom
567183,2023-09-18,21169,You're Confusing Me Metal Sign,11.98,4,14769.0,United Kingdom
567183,2023-09-18,23426,Metal Sign Drop Your Pants,13.21,3,14769.0,United Kingdom
567183,2023-09-18,85152,Hand Over The Chocolate Sign,12.4,2,14769.0,United Kingdom
567183,2023-09-18,82600,N0 Singing Metal Sign,12.4,2,14769.0,United Kingdom
567183,2023-09-18,82583,Hot Baths Metal Sign,12.4,4,14769.0,United Kingdom
567183,2023-09-18,82582,Area Patrolled Metal Sign,12.4,2,14769.0,United Kingdom
567183,2023-09-18,82567,Airline Lounge Metal Sign,12.4,3,14769.0,United Kingdom
567183,2023-09-18,21174,Pottering In The Shed Metal Sign,12.38,2,14769.0,United Kingdom
567183,2023-09-18,21175,Gin And Tonic Diet Metal Sign,12.86,3,14769.0,United Kingdom
567183,2023-09-18,22115,Metal Sign Empire Tea,11.06,2,14769.0,United Kingdom
567183,2023-09-18,21181,Please One Person Metal Sign,12.4,2,14769.0,United Kingdom
567183,2023-09-18,22412,Metal Sign Neighbourhood Witch,12.4,2,14769.0,United Kingdom
567183,2023-09-18,85049G,Chocolate Box Ribbons,11.53,2,14769.0,United Kingdom
567183,2023-09-18,85049C,Romantic Pinks Ribbons,11.53,2,14769.0,United Kingdom
567183,2023-09-18,85049F,Baby Boom Ribbons,11.53,1,14769.0,United Kingdom
567183,2023-09-18,85049E,Scandinavian Reds Ribbons,11.53,1,14769.0,United Kingdom
567183,2023-09-18,85049A,Traditional Christmas Ribbons,11.53,6,14769.0,United Kingdom
567183,2023-09-18,22077,6 Ribbons Rustic Charm,12.25,6,14769.0,United Kingdom
567183,2023-09-18,85124B,Blue Juicy Fruit Photo Frame,12.86,2,14769.0,United Kingdom
567183,2023-09-18,85124C,Green Juicy Fruit Photo Frame,12.86,2,14769.0,United Kingdom
567183,2023-09-18,20831,Gold Photo Frame,12.4,2,14769.0,United Kingdom
567183,2023-09-18,20830,Silver Photo Frame,12.4,2,14769.0,United Kingdom
567183,2023-09-18,22915,Assorted Bottle Top Magnets,10.68,6,14769.0,United Kingdom
567183,2023-09-18,84926A,Wake Up Cockerel Tile Coaster,10.55,4,14769.0,United Kingdom
567183,2023-09-18,46000S,Polyester Filler Pad 40x40cm,11.74,6,14769.0,United Kingdom
567183,2023-09-18,22400,Magnets Pack Of 4 Home Sweet Home,10.65,12,14769.0,United Kingdom
567183,2023-09-18,21442,Green Birdhouse Decoration,11.12,6,14769.0,United Kingdom
567183,2023-09-18,21441,Blue Birdhouse Decoration,11.12,6,14769.0,United Kingdom
567183,2023-09-18,21454,Painted Pink Rabbit,11.12,6,14769.0,United Kingdom
567183,2023-09-18,23342,Mint Diner Wall Clock,18.96,1,14769.0,United Kingdom
567183,2023-09-18,22191,Ivory Diner Wall Clock,18.96,1,14769.0,United Kingdom
567183,2023-09-18,23341,Pink Diner Wall Clock,18.96,1,14769.0,United Kingdom
567183,2023-09-18,22192,Blue Diner Wall Clock,18.96,1,14769.0,United Kingdom
567183,2023-09-18,22193,Red Diner Wall Clock,18.96,1,14769.0,United Kingdom
567183,2023-09-18,23074,Embossed Heart Trinket Box,12.38,4,14769.0,United Kingdom
567183,2023-09-18,22151,Place Setting White Heart,10.68,24,14769.0,United Kingdom
567183,2023-09-18,22152,Place Setting White Star,10.68,24,14769.0,United Kingdom
567183,2023-09-18,22402,Magnets Pack Of 4 Vintage Collage,10.65,12,14769.0,United Kingdom
567183,2023-09-18,21121,Set/10 Red Polkadot Party Candles,11.53,2,14769.0,United Kingdom
567183,2023-09-18,21122,Set/10 Pink Polkadot Party Candles,11.53,2,14769.0,United Kingdom
567183,2023-09-18,21124,Set/10 Blue Polkadot Party Candles,11.53,2,14769.0,United Kingdom
567183,2023-09-18,17107D,Flower Fairy 5 Drawer Liners,12.86,2,14769.0,United Kingdom
567183,2023-09-18,17084N,Fairy Dreams Incense,10.47,75,14769.0,United Kingdom
567183,2023-09-18,22188,Black Heart Card Holder,14.3,2,14769.0,United Kingdom
567183,2023-09-18,22615,Pack Of 12 Circus Parade Tissues,10.65,12,14769.0,United Kingdom
567183,2023-09-18,23380,Pack Of 12 Vintage Doily Tissues,10.65,12,14769.0,United Kingdom
567183,2023-09-18,23381,Pack Of 12 Vintage Leaf Tissues,10.65,12,14769.0,United Kingdom
567183,2023-09-18,23377,Pack Of 12 Dolly Girl Tissues,10.65,12,14769.0,United Kingdom
567183,2023-09-18,23551,Pack Of 12 Paisley Park Tissues,10.65,12,14769.0,United Kingdom
567183,2023-09-18,22614,Pack Of 12 Spaceboy Tissues,10.65,12,14769.0,United Kingdom
567183,2023-09-18,21982,Pack Of 12 Suki Tissues,10.65,12,14769.0,United Kingdom
567183,2023-09-18,22098,Boudoir Square Tissue Box,10.65,36,14769.0,United Kingdom
567183,2023-09-18,22097,Swallow Square Tissue Box,10.65,12,14769.0,United Kingdom
567183,2023-09-18,47422,Assorted Monkey Suction Cup Hook,10.68,19,14769.0,United Kingdom
567183,2023-09-18,47420,Assorted Colour Suction Cup Hook,10.44,16,14769.0,United Kingdom
567183,2023-09-18,23252,Vintage Red Enamel Trim Jug,14.09,2,14769.0,United Kingdom
567183,2023-09-18,23251,Vintage Red Enamel Trim Mug,11.53,2,14769.0,United Kingdom
567183,2023-09-18,23162,Regency Tea Strainer,14.09,2,14769.0,United Kingdom
567183,2023-09-18,22427,Enamel Flower Jug Cream,16.35,2,14769.0,United Kingdom
567183,2023-09-18,22107,Pizza Plate In Box,14.09,2,14769.0,United Kingdom
567183,2023-09-18,22109,Full English Breakfast Plate,14.09,2,14769.0,United Kingdom
567183,2023-09-18,37468,Hardman Mug 3 Assorted,10.65,13,14769.0,United Kingdom
567183,2023-09-18,22795,Sweetheart Recipe Book Stand,17.17,1,14769.0,United Kingdom
567183,2023-09-18,84510A,Set Of 4 English Rose Coasters,11.53,6,14769.0,United Kingdom
567183,2023-09-18,22359,Glass Jar Kings Choice,13.27,2,14769.0,United Kingdom
567183,2023-09-18,22360,Glass Jar English Confectionery,13.27,2,14769.0,United Kingdom
567183,2023-09-18,22361,Glass Jar Daisy Fresh Cotton Wool,13.27,2,14769.0,United Kingdom
567183,2023-09-18,22363,Glass Jar Marmalade,13.27,2,14769.0,United Kingdom
567183,2023-09-18,22364,Glass Jar Digestive Biscuits,13.27,2,14769.0,United Kingdom
567183,2023-09-18,22362,Glass Jar Peacock Bath Salts,13.27,2,14769.0,United Kingdom
567183,2023-09-18,23184,Bull Dog Bottle Opener,15.32,2,14769.0,United Kingdom
567183,2023-09-18,23176,Abc Treasure Book Box,12.56,2,14769.0,United Kingdom
567183,2023-09-18,23194,Gymkhana Treasure Book Box,12.56,2,14769.0,United Kingdom
567183,2023-09-18,23177,Treasure Island Book Box,12.56,2,14769.0,United Kingdom
567183,2023-09-18,23193,Buffalo Bill Treasure Book Box,12.56,2,14769.0,United Kingdom
567183,2023-09-18,23309,Set Of 60 I Love London Cake Cases,10.81,4,14769.0,United Kingdom
567183,2023-09-18,23338,Egg Frying Pan Red,12.38,1,14769.0,United Kingdom
567183,2023-09-18,23336,Egg Frying Pan Pink,12.38,1,14769.0,United Kingdom
567183,2023-09-18,23337,Egg Frying Pan Mint,12.38,1,14769.0,United Kingdom
567183,2023-09-18,23335,Egg Frying Pan Ivory,12.38,1,14769.0,United Kingdom
567183,2023-09-18,23339,Egg Frying Pan Blue,12.38,1,14769.0,United Kingdom
567183,2023-09-18,22203,Milk Pan Red Retrospot,14.09,2,14769.0,United Kingdom
567183,2023-09-18,22200,Frying Pan Pink Polkadot,14.61,2,14769.0,United Kingdom
567183,2023-09-18,22224,White Lovebird Lantern,13.27,6,14769.0,United Kingdom
567183,2023-09-18,23113,Pantry Chopping Board,15.32,4,14769.0,United Kingdom
567183,2023-09-18,21591,Cosy Hour Cigar Box Matches,11.53,1,14769.0,United Kingdom
567183,2023-09-18,23295,Set Of 12 Mini Loaf Baking Cases,11.1,2,14769.0,United Kingdom
567183,2023-09-18,23189,Set Of 12 Fork Candles,13.21,2,14769.0,United Kingdom
567183,2023-09-18,23293,Set Of 12 Fairy Cake Baking Cases,11.1,2,14769.0,United Kingdom
567183,2023-09-18,23294,Set Of 6 Snack Loaf Baking Cases,11.1,2,14769.0,United Kingdom
567183,2023-09-18,23296,Set Of 6 Tea Time Baking Cases,11.53,2,14769.0,United Kingdom
567183,2023-09-18,23432,Pretty Hanging Quilted Hearts,11.1,12,14769.0,United Kingdom
567183,2023-09-18,23431,Natural Hanging Quilted Hearts,11.1,12,14769.0,United Kingdom
567183,2023-09-18,23328,Set 6 School Milk Bottles In Crate,14.09,2,14769.0,United Kingdom
567183,2023-09-18,22465,Hanging Metal Star Lantern,11.94,6,14769.0,United Kingdom
567183,2023-09-18,23326,Hanging Mini Coloured Bottles,10.9,48,14769.0,United Kingdom
567183,2023-09-18,23325,Rustic Strawberry Jam Pot Small,11.94,8,14769.0,United Kingdom
567183,2023-09-18,23324,Rustic Strawberry Jam Pot Large,12.38,6,14769.0,United Kingdom
567183,2023-09-18,22252,Birdcage Decoration Tealight Holder,11.53,18,14769.0,United Kingdom
567183,2023-09-18,23307,Set Of 60 Pantry Design Cake Cases,10.81,24,14769.0,United Kingdom
567183,2023-09-18,23308,Set Of 60 Vintage Leaf Cake Cases,10.81,24,14769.0,United Kingdom
567183,2023-09-18,22951,60 Cake Cases Dolly Girl Design,10.81,24,14769.0,United Kingdom
567183,2023-09-18,22464,Hanging Metal Heart Lantern,11.94,6,14769.0,United Kingdom
567183,2023-09-18,72232,Feng Shui Pillar Candle,10.44,24,14769.0,United Kingdom
567183,2023-09-18,22252,Birdcage Decoration Tealight Holder,11.53,6,14769.0,United Kingdom
567183,2023-09-18,23418,Lavender Toilette Bottle,12.38,12,14769.0,United Kingdom
567183,2023-09-18,23265,Set Of 3 Wooden Tree Decorations,11.53,12,14769.0,United Kingdom
567183,2023-09-18,35970,Zinc Folkart Sleigh Bells,11.98,6,14769.0,United Kingdom
567183,2023-09-18,21802,Christmas Tree Heart Decoration,10.68,36,14769.0,United Kingdom
567183,2023-09-18,23224,Cherub Heart Decoration Gold,11.1,48,14769.0,United Kingdom
567183,2023-09-18,23212,Heart Wreath Decoration With Bell,11.53,36,14769.0,United Kingdom
567183,2023-09-18,23213,Star Wreath Decoration With Bell,11.53,36,14769.0,United Kingdom
567183,2023-09-18,23210,White Rocking Horse Hand Painted,11.53,24,14769.0,United Kingdom
567183,2023-09-18,23211,Red Rocking Horse Hand Painted,11.53,24,14769.0,United Kingdom
567183,2023-09-18,23221,Reindeer Heart Decoration Silver,11.1,48,14769.0,United Kingdom
567183,2023-09-18,23220,Reindeer Heart Decoration Gold,11.1,48,14769.0,United Kingdom
567183,2023-09-18,21807,White Christmas Star Decoration,10.68,36,14769.0,United Kingdom
567183,2023-09-18,23264,Set Of 3 Wooden Sleigh Decorations,11.53,12,14769.0,United Kingdom
567183,2023-09-18,22574,Heart Wooden Christmas Decoration,11.12,4,14769.0,United Kingdom
567183,2023-09-18,22573,Star Wooden Christmas Decoration,11.12,4,14769.0,United Kingdom
567183,2023-09-18,22576,Swallow Wooden Christmas Decoration,11.12,12,14769.0,United Kingdom
567183,2023-09-18,22572,Rocking Horse Green Christmas,11.12,6,14769.0,United Kingdom
567183,2023-09-18,22601,Christmas Retrospot Angel Wood,11.12,6,14769.0,United Kingdom
567183,2023-09-18,22600,Christmas Retrospot Star Wood,11.12,6,14769.0,United Kingdom
567183,2023-09-18,22603,Christmas Retrospot Tree Wood,11.12,6,14769.0,United Kingdom
567183,2023-09-18,84754,S/15 Silver Glass Baubles In Bag,11.53,24,14769.0,United Kingdom
567183,2023-09-18,21801,Christmas Tree Decoration With Bell,10.68,36,14769.0,United Kingdom
