TransactionNo,Date,ProductNo,ProductName,Price,Quantity,CustomerNo,Country
567183,2023-09-18,21822,Glitter Christmas Tree With Bells,12.25,6,14769.0,United Kingdom
567183,2023-09-18,23082,Set 6 Paper Table Lantern Hearts,14.09,12,14769.0,United Kingdom
567183,2023-09-18,22284,Hen House Decoration,11.94,6,14769.0,United Kingdom
567183,2023-09-18,85194S,Hanging Spring Flower Egg Small,10.44,8,14769.0,United Kingdom
567183,2023-09-18,21383,Pack Of 12 Sticky Bunnies,10.92,4,14769.0,United Kingdom
567183,2023-09-18,85199S,Small Hanging Ivory/Red Wood Bird,10.68,6,14769.0,United Kingdom
567183,2023-09-18,85199L,Large Hanging Ivory & Red Wood Bird,10.92,6,14769.0,United Kingdom
567183,2023-09-18,21385,Ivory Hanging Decoration Heart,11.12,10,14769.0,United Kingdom
567183,2023-09-18,22595,Gingham Heart Decoration,11.12,5,14769.0,United Kingdom
567183,2023-09-18,22227,Hanging Heart Mirror Decoration,10.92,20,14769.0,United Kingdom
567183,2023-09-18,22219,Lovebird Hanging Decoration White,11.12,20,14769.0,United Kingdom
567183,2023-09-18,22577,Wooden Heart Christmas Scandinavian,11.12,6,14769.0,United Kingdom
567183,2023-09-18,22602,Retrospot Wooden Heart Decoration,11.12,10,14769.0,United Kingdom
567183,2023-09-18,21446,12 Red Rose Peg Place Settings,11.53,4,14769.0,United Kingdom
567183,2023-09-18,21114,Lavender Scented Fabric Heart,11.53,10,14769.0,United Kingdom
567183,2023-09-18,84912B,Green Rose Washbag,14.09,2,14769.0,United Kingdom
567183,2023-09-18,84912A,Pink Rose Washbag,14.09,2,14769.0,United Kingdom
567183,2023-09-18,84849D,Hot Baths Soap Holder,11.98,4,14769.0,United Kingdom
567183,2023-09-18,22734,Set Of 6 Ribbons Vintage Christmas,13.21,24,14769.0,United Kingdom
567183,2023-09-18,23091,Zinc Herb Garden Container,16.66,2,14769.0,United Kingdom
567183,2023-09-18,22024,Rainy Ladies Birthday Card,10.68,12,14769.0,United Kingdom
567183,2023-09-18,22025,Ring Of Roses Birthday Card,10.68,12,14769.0,United Kingdom
567183,2023-09-18,22028,Penny Farthing Birthday Card,10.68,12,14769.0,United Kingdom
567183,2023-09-18,22966,Gingerbread Man Cookie Cutter,11.53,4,14769.0,United Kingdom
567183,2023-09-18,23376,Pack Of 12 Vintage Christmas Tissue,10.65,12,14769.0,United Kingdom
567183,2023-09-18,23378,Pack Of 12 50'S Christmas Tissues,10.65,12,14769.0,United Kingdom
567183,2023-09-18,22628,Picnic Boxes Set Of 3 Retrospot,15.32,1,14769.0,United Kingdom
567183,2023-09-18,23243,Set Of Tea Coffee Sugar Tins Pantry,15.32,2,14769.0,United Kingdom
567183,2023-09-18,23068,Aluminium Stamped Heart,12.8,4,14769.0,United Kingdom
567183,2023-09-18,23061,Vintage Embossed Heart,11.53,18,14769.0,United Kingdom
567183,2023-09-18,22723,Set Of 6 Herb Tins Sketchbook,14.3,2,14769.0,United Kingdom
567183,2023-09-18,85032C,Curious Images Gift Wrap Set,10.92,2,14769.0,United Kingdom
567183,2023-09-18,85032D,Yuletide Images Gift Wrap Set,10.92,4,14769.0,United Kingdom
567183,2023-09-18,85032A,Romantic Images Gift Wrap Set,10.92,2,14769.0,United Kingdom
567183,2023-09-18,23306,Set Of 36 Pantry Paper Doilies,11.74,2,14769.0,United Kingdom
567183,2023-09-18,22961,Jam Making Set Printed,11.74,2,14769.0,United Kingdom
567183,2023-09-18,23198,Pantry Magnetic Shopping List,11.74,4,14769.0,United Kingdom
567183,2023-09-18,85017B,Envelope 50 Blossom Images,10.68,6,14769.0,United Kingdom
567183,2023-09-18,22327,Round Snack Boxes Set Of 4 Skulls,13.27,1,14769.0,United Kingdom
567183,2023-09-18,22131,Food Container Set 3 Love Heart,12.25,4,14769.0,United Kingdom
567183,2023-09-18,21561,Dinosaur Lunch Box With Cutlery,12.86,2,14769.0,United Kingdom
567183,2023-09-18,22352,Lunch Box With Cutlery Retrospot,12.86,2,14769.0,United Kingdom
567183,2023-09-18,21559,Strawberry Lunch Box With Cutlery,12.86,4,14769.0,United Kingdom
567183,2023-09-18,22629,Spaceboy Lunch Box,12.25,1,14769.0,United Kingdom
567183,2023-09-18,22659,Lunch Box I Love London,12.25,2,14769.0,United Kingdom
567183,2023-09-18,22630,Dolly Girl Lunch Box,12.25,3,14769.0,United Kingdom
567183,2023-09-18,22631,Circus Parade Lunch Box,12.25,2,14769.0,United Kingdom
567183,2023-09-18,21558,Skull Lunch Box With Cutlery,12.86,2,14769.0,United Kingdom
567183,2023-09-18,21355,Toast Its - I Love You,11.53,2,14769.0,United Kingdom
567183,2023-09-18,21358,Toast Its - Happy Birthday,11.53,2,14769.0,United Kingdom
567183,2023-09-18,23290,Spaceboy Childrens Bowl,11.53,2,14769.0,United Kingdom
567183,2023-09-18,23345,Dolly Girl Beaker,11.53,4,14769.0,United Kingdom
567183,2023-09-18,23289,Dolly Girl Childrens Bowl,11.53,12,14769.0,United Kingdom
567183,2023-09-18,22315,200 Red + White Bendy Straws,11.53,2,14769.0,United Kingdom
567183,2023-09-18,22348,Tea Bag Plate Red Retrospot,11.12,10,14769.0,United Kingdom
567183,2023-09-18,21078,Set/20 Strawberry Paper Napkins,11.12,4,14769.0,United Kingdom
567183,2023-09-18,22851,Set 20 Napkins Fairy Cakes Design,11.12,4,14769.0,United Kingdom
567183,2023-09-18,22613,Pack Of 20 Spaceboy Napkins,11.12,8,14769.0,United Kingdom
567183,2023-09-18,21080,Set/20 Red Retrospot Paper Napkins,11.12,10,14769.0,United Kingdom
567183,2023-09-18,22907,Pack Of 20 Napkins Pantry Design,11.12,6,14769.0,United Kingdom
567183,2023-09-18,22329,Round Container Set Of 5 Retrospot,11.94,2,14769.0,United Kingdom
567183,2023-09-18,21845,Dairy Maid Stripe Mug,11.06,6,14769.0,United Kingdom
567183,2023-09-18,22182,Cake Stand Victorian Filigree Small,15.32,2,14769.0,United Kingdom
567183,2023-09-18,21534,Dairy Maid Large Milk Jug,15.32,1,14769.0,United Kingdom
567183,2023-09-18,21533,Retrospot Large Milk Jug,15.32,1,14769.0,United Kingdom
567183,2023-09-18,84692,Box Of 24 Cocktail Parasols,10.68,25,14769.0,United Kingdom
567183,2023-09-18,22197,Popcorn Holder,11.12,40,14769.0,United Kingdom
567183,2023-09-18,21534,Dairy Maid Large Milk Jug,15.32,1,14769.0,United Kingdom
567183,2023-09-18,21539,Red Retrospot Butter Dish,15.32,1,14769.0,United Kingdom
567183,2023-09-18,23186,French Style Storage Jar Cafe,10.55,6,14769.0,United Kingdom
567183,2023-09-18,23187,French Style Storage Jar Bonbons,10.55,6,14769.0,United Kingdom
567183,2023-09-18,23286,Blue Vintage Spot Beaker,11.12,4,14769.0,United Kingdom
567183,2023-09-18,23287,Red Vintage Spot Beaker,11.12,4,14769.0,United Kingdom
567183,2023-09-18,23285,Pink Vintage Spot Beaker,11.12,4,14769.0,United Kingdom
567183,2023-09-18,23288,Green Vintage Spot Beaker,11.12,4,14769.0,United Kingdom
567183,2023-09-18,22558,Clothes Pegs Retrospot Pack 24,11.94,12,14769.0,United Kingdom
567183,2023-09-18,20914,Set/5 Red Retrospot Lid Glass Bowls,13.27,6,14769.0,United Kingdom
567183,2023-09-18,21535,Red Retrospot Small Milk Jug,12.86,1,14769.0,United Kingdom
567183,2023-09-18,23089,Glass Bon Bon Jar,12.25,6,14769.0,United Kingdom
567183,2023-09-18,21535,Red Retrospot Small Milk Jug,12.86,1,14769.0,United Kingdom
567183,2023-09-18,21314,Small Glass Heart Trinket Pot,12.4,4,14769.0,United Kingdom
567183,2023-09-18,22800,Antique Tall Swirlglass Trinket Pot,14.09,4,14769.0,United Kingdom
567183,2023-09-18,23168,Classic Cafe Sugar Dispenser,11.53,6,14769.0,United Kingdom
567183,2023-09-18,23014,Glass Apothecary Bottle Elixir,14.3,3,14769.0,United Kingdom
567183,2023-09-18,23012,Glass Apothecary Bottle Perfume,14.3,3,14769.0,United Kingdom
567183,2023-09-18,23013,Glass Apothecary Bottle Tonic,14.3,3,14769.0,United Kingdom
567183,2023-09-18,20754,Retrospot Red Washing Up Gloves,12.4,2,14769.0,United Kingdom
567183,2023-09-18,21471,Strawberry Raffia Food Cover,14.09,3,14769.0,United Kingdom
567183,2023-09-18,21465,Pink Flower Crochet Food Cover,14.09,2,14769.0,United Kingdom
567183,2023-09-18,20713,Jumbo Bag Owls,6.19,4,14769.0,United Kingdom
567183,2023-09-18,22382,Lunch Bag Spaceboy Design,5.97,2,14769.0,United Kingdom
567183,2023-09-18,20725,Lunch Bag Red Retrospot,5.97,2,14769.0,United Kingdom
567183,2023-09-18,23207,Lunch Bag Alphabet Design,5.97,2,14769.0,United Kingdom
567183,2023-09-18,22662,Lunch Bag Dolly Girl Design,5.97,2,14769.0,United Kingdom
567183,2023-09-18,20728,Lunch Bag Cars Blue,5.97,2,14769.0,United Kingdom
567183,2023-09-18,22384,Lunch Bag Pink Polkadot,5.97,2,14769.0,United Kingdom
567183,2023-09-18,22383,Lunch Bag Suki Design,5.97,3,14769.0,United Kingdom
567183,2023-09-18,20726,Lunch Bag Woodland,5.97,2,14769.0,United Kingdom
567183,2023-09-18,22662,Lunch Bag Dolly Girl Design,5.97,4,14769.0,United Kingdom
567183,2023-09-18,23208,Lunch Bag Vintage Leaf Design,5.97,4,14769.0,United Kingdom
567183,2023-09-18,20727,Lunch Bag Black Skull,5.97,2,14769.0,United Kingdom
567183,2023-09-18,23206,Lunch Bag Apple Design,5.97,2,14769.0,United Kingdom
567183,2023-09-18,23207,Lunch Bag Alphabet Design,5.97,3,14769.0,United Kingdom
567183,2023-09-18,23209,Lunch Bag Vintage Doily,5.97,20,14769.0,United Kingdom
567183,2023-09-18,22821,Gift Bag Psychedelic Apples,5.46,24,14769.0,United Kingdom
567184,2023-09-18,23401,Rustic Mirror With Lace Heart,16.66,1,16033.0,United Kingdom
567184,2023-09-18,23406,Home Sweet Home Key Holder,16.66,2,16033.0,United Kingdom
567184,2023-09-18,23400,Shelf With 4 Hooks Home Sweet Home,16.66,2,16033.0,United Kingdom
567184,2023-09-18,23399,Home Sweet Home Hanging Heart,11.12,4,16033.0,United Kingdom
567184,2023-09-18,23413,Decorative Vintage Coffee Box,15.32,1,16033.0,United Kingdom
567184,2023-09-18,23148,Miniature Antique Rose Hook Ivory,11.1,12,16033.0,United Kingdom
567184,2023-09-18,23146,Triple Hook Antique Ivory Rose,13.62,1,16033.0,United Kingdom
567184,2023-09-18,23403,Letter Holder Home Sweet Home,14.09,1,16033.0,United Kingdom
567184,2023-09-18,22173,Metal 4 Hook Hanger French Chateau,13.62,1,16033.0,United Kingdom
567184,2023-09-18,23426,Metal Sign Drop Your Pants,13.21,12,16033.0,United Kingdom
567184,2023-09-18,23156,Set Of 5 Mini Grocery Magnets,12.38,2,16033.0,United Kingdom
567184,2023-09-18,23154,Set Of 4 Jam Jar Magnets,12.38,2,16033.0,United Kingdom
567184,2023-09-18,23159,Set Of 5 Pancake Day Magnets,12.38,2,16033.0,United Kingdom
567184,2023-09-18,21175,Gin And Tonic Diet Metal Sign,12.86,4,16033.0,United Kingdom
567184,2023-09-18,22371,Airline Bag Vintage Tokyo 78,14.61,3,16033.0,United Kingdom
567184,2023-09-18,22730,Alarm Clock Bakelike Ivory,14.09,2,16033.0,United Kingdom
567184,2023-09-18,22726,Alarm Clock Bakelike Green,14.09,2,16033.0,United Kingdom
567184,2023-09-18,23355,Hot Water Bottle Keep Calm,15.32,6,16033.0,United Kingdom
567184,2023-09-18,22835,Hot Water Bottle I Am So Poorly,15.32,2,16033.0,United Kingdom
567184,2023-09-18,22112,Chocolate Hot Water Bottle,15.32,2,16033.0,United Kingdom
567184,2023-09-18,22114,Hot Water Bottle Tea And Sympathy,14.61,2,16033.0,United Kingdom
567184,2023-09-18,23298,Spotty Bunting,15.32,2,16033.0,United Kingdom
567184,2023-09-18,47566B,Tea Time Party Bunting,15.32,2,16033.0,United Kingdom
567184,2023-09-18,21755,Love Building Block Word,16.66,2,16033.0,United Kingdom
567184,2023-09-18,21756,Bath Building Block Word,16.66,2,16033.0,United Kingdom
567184,2023-09-18,82494L,Wooden Frame Antique White,13.27,6,16033.0,United Kingdom
567184,2023-09-18,22734,Set Of 6 Ribbons Vintage Christmas,13.21,6,16033.0,United Kingdom
567184,2023-09-18,22086,Paper Chain Kit 50'S Christmas,13.27,4,16033.0,United Kingdom
567184,2023-09-18,22573,Star Wooden Christmas Decoration,11.12,4,16033.0,United Kingdom
567184,2023-09-18,22581,Wood Stocking Christmas Scandispot,11.12,4,16033.0,United Kingdom
567184,2023-09-18,22571,Rocking Horse Red Christmas,11.12,8,16033.0,United Kingdom
567184,2023-09-18,22572,Rocking Horse Green Christmas,11.12,8,16033.0,United Kingdom
567184,2023-09-18,23295,Set Of 12 Mini Loaf Baking Cases,11.1,2,16033.0,United Kingdom
567184,2023-09-18,23247,Biscuit Tin 50'S Christmas,13.21,2,16033.0,United Kingdom
567184,2023-09-18,23293,Set Of 12 Fairy Cake Baking Cases,11.1,2,16033.0,United Kingdom
567184,2023-09-18,22907,Pack Of 20 Napkins Pantry Design,11.12,4,16033.0,United Kingdom
567184,2023-09-18,23313,Vintage Christmas Bunting,15.32,1,16033.0,United Kingdom
567184,2023-09-18,23328,Set 6 School Milk Bottles In Crate,14.09,1,16033.0,United Kingdom
567184,2023-09-18,23122,Party Charms 50 Pieces,11.1,1,16033.0,United Kingdom
567184,2023-09-18,23266,Set Of 3 Wooden Stocking Decoration,11.53,12,16033.0,United Kingdom
567184,2023-09-18,23267,Set Of 4 Santa Place Settings,11.53,12,16033.0,United Kingdom
567184,2023-09-18,35970,Zinc Folkart Sleigh Bells,11.98,1,16033.0,United Kingdom
567184,2023-09-18,22733,3d Traditional Christmas Stickers,11.53,18,16033.0,United Kingdom
567184,2023-09-18,22731,3d Christmas Stamps Stickers,11.53,18,16033.0,United Kingdom
567184,2023-09-18,21744,Snowflake Portable Table Light,13.27,6,16033.0,United Kingdom
567184,2023-09-18,23388,Woodland Mini Backpack,14.5,2,16033.0,United Kingdom
567184,2023-09-18,23389,Spaceboy Mini Backpack,14.5,2,16033.0,United Kingdom
567184,2023-09-18,22362,Glass Jar Peacock Bath Salts,13.27,1,16033.0,United Kingdom
567184,2023-09-18,23123,Cocktail Swords 50 Pieces,11.1,4,16033.0,United Kingdom
567184,2023-09-18,22580,Advent Calendar Gingham Sack,16.35,2,16033.0,United Kingdom
567184,2023-09-18,23313,Vintage Christmas Bunting,15.32,3,16033.0,United Kingdom
567184,2023-09-18,23431,Natural Hanging Quilted Hearts,11.1,12,16033.0,United Kingdom
567184,2023-09-18,21809,Christmas Hanging Tree With Bell,11.53,10,16033.0,United Kingdom
567184,2023-09-18,21810,Christmas Hanging Star With Bell,11.53,10,16033.0,United Kingdom
567184,2023-09-18,23122,Party Charms 50 Pieces,11.1,3,16033.0,United Kingdom
567184,2023-09-18,22687,Doormat Christmas Village,18.71,2,16033.0,United Kingdom
567184,2023-09-18,22689,Doormat Merry Christmas Red,18.71,2,16033.0,United Kingdom
567184,2023-09-18,23013,Glass Apothecary Bottle Tonic,14.3,1,16033.0,United Kingdom
567184,2023-09-18,23175,Regency Milk Jug Pink,13.58,2,16033.0,United Kingdom
567184,2023-09-18,22361,Glass Jar Daisy Fresh Cotton Wool,13.27,2,16033.0,United Kingdom
567184,2023-09-18,21534,Dairy Maid Large Milk Jug,15.32,1,16033.0,United Kingdom
567184,2023-09-18,79066K,Retro Mod Tray,11.12,3,16033.0,United Kingdom
567184,2023-09-18,22696,Wicker Wreath Large,12.25,1,16033.0,United Kingdom
567184,2023-09-18,23264,Set Of 3 Wooden Sleigh Decorations,11.53,12,16033.0,United Kingdom
567184,2023-09-18,23359,Set Of 12 T-Lights Vintage Doily,12.25,12,16033.0,United Kingdom
567184,2023-09-18,21231,Sweetheart Ceramic Trinket Box,11.53,2,16033.0,United Kingdom
567184,2023-09-18,21232,Strawberry Ceramic Trinket Pot,11.53,2,16033.0,United Kingdom
567184,2023-09-18,22696,Wicker Wreath Large,12.25,3,16033.0,United Kingdom
567184,2023-09-18,23174,Regency Sugar Bowl Green,14.5,2,16033.0,United Kingdom
567184,2023-09-18,22698,Pink Regency Teacup And Saucer,13.27,2,16033.0,United Kingdom
567184,2023-09-18,22697,Green Regency Teacup And Saucer,13.27,3,16033.0,United Kingdom
567184,2023-09-18,22696,Wicker Wreath Large,12.25,2,16033.0,United Kingdom
567184,2023-09-18,23171,Regency Tea Plate Green,11.94,2,16033.0,United Kingdom
567184,2023-09-18,23170,Regency Tea Plate Roses,11.94,2,16033.0,United Kingdom
567184,2023-09-18,23172,Regency Tea Plate Pink,11.94,2,16033.0,United Kingdom
567184,2023-09-18,23243,Set Of Tea Coffee Sugar Tins Pantry,15.32,2,16033.0,United Kingdom
567184,2023-09-18,23184,Bull Dog Bottle Opener,15.32,6,16033.0,United Kingdom
567184,2023-09-18,22959,Wrap Christmas Village,10.68,25,16033.0,United Kingdom
567184,2023-09-18,22567,20 Dolly Pegs Retrospot,11.74,4,16033.0,United Kingdom
567184,2023-09-18,22642,Set Of 4 Napkin Charms Stars,12.86,4,16033.0,United Kingdom
567184,2023-09-18,22638,Set Of 4 Napkin Charms Crowns,12.86,4,16033.0,United Kingdom
567184,2023-09-18,22640,Set Of 4 Napkin Charms 3 Keys,12.86,4,16033.0,United Kingdom
567184,2023-09-18,84989A,75 Green Fairy Cake Cases,10.81,3,16033.0,United Kingdom
567184,2023-09-18,21215,Ivory Paper Cup Cake Cases,10.81,3,16033.0,United Kingdom
567184,2023-09-18,23307,Set Of 60 Pantry Design Cake Cases,10.81,2,16033.0,United Kingdom
567184,2023-09-18,21977,Pack Of 60 Pink Paisley Cake Cases,10.81,2,16033.0,United Kingdom
567184,2023-09-18,84991,60 Teatime Fairy Cake Cases,10.81,2,16033.0,United Kingdom
567184,2023-09-18,23296,Set Of 6 Tea Time Baking Cases,11.53,2,16033.0,United Kingdom
567184,2023-09-18,23294,Set Of 6 Snack Loaf Baking Cases,11.1,2,16033.0,United Kingdom
567184,2023-09-18,23360,Set 8 Candles Vintage Doily,12.25,2,16033.0,United Kingdom
567184,2023-09-18,21974,Set Of 36 Paisley Flower Doilies,11.74,2,16033.0,United Kingdom
567184,2023-09-18,21210,Set Of 72 Retrospot Paper Doilies,11.74,2,16033.0,United Kingdom
567184,2023-09-18,84987,Set Of 36 Teatime Paper Doilies,11.74,2,16033.0,United Kingdom
567184,2023-09-18,23306,Set Of 36 Pantry Paper Doilies,11.74,2,16033.0,United Kingdom
567184,2023-09-18,22990,Cotton Apron Pantry Design,15.32,2,16033.0,United Kingdom
567184,2023-09-18,22989,Set 2 Pantry Design Tea Towels,13.58,2,16033.0,United Kingdom
567184,2023-09-18,20751,Funky Washing Up Gloves Assorted,12.4,1,16033.0,United Kingdom
567184,2023-09-18,20752,Blue Polkadot Washing Up Gloves,12.4,1,16033.0,United Kingdom
567184,2023-09-18,20754,Retrospot Red Washing Up Gloves,12.4,1,16033.0,United Kingdom
567184,2023-09-18,84378,Set Of 3 Heart Cookie Cutters,11.74,1,16033.0,United Kingdom
567184,2023-09-18,22965,3 Traditional Biscuit Cutters Set,12.4,2,16033.0,United Kingdom
567184,2023-09-18,22964,3 Piece Spaceboy Cookie Cutter Set,12.4,1,16033.0,United Kingdom
567184,2023-09-18,22966,Gingerbread Man Cookie Cutter,11.53,2,16033.0,United Kingdom
567184,2023-09-18,84692,Box Of 24 Cocktail Parasols,10.68,6,16033.0,United Kingdom
567184,2023-09-18,22471,Tv Dinner Tray Air Hostess,15.32,1,16033.0,United Kingdom
567184,2023-09-18,21218,Red Spotty Biscuit Tin,14.09,1,16033.0,United Kingdom
567184,2023-09-18,22844,Vintage Cream Dog Food Container,18.96,1,16033.0,United Kingdom
567184,2023-09-18,22845,Vintage Cream Cat Food Container,16.76,1,16033.0,United Kingdom
567184,2023-09-18,22720,Set Of 3 Cake Tins Pantry Design,15.32,2,16033.0,United Kingdom
567184,2023-09-18,22960,Jam Making Set With Jars,14.61,1,16033.0,United Kingdom
567184,2023-09-18,22722,Set Of 6 Spice Tins Pantry Design,14.3,1,16033.0,United Kingdom
567184,2023-09-18,22667,Recipe Box Retrospot,13.27,1,16033.0,United Kingdom
567184,2023-09-18,22666,Recipe Box Pantry Yellow Design,13.27,4,16033.0,United Kingdom
567184,2023-09-18,22292,Hanging Chick Yellow Decoration,11.74,1,16033.0,United Kingdom
567184,2023-09-18,22293,Hanging Chick Green Decoration,11.74,3,16033.0,United Kingdom
567184,2023-09-18,23198,Pantry Magnetic Shopping List,11.74,2,16033.0,United Kingdom
567185,2023-09-18,22759,Set Of 3 Notebooks In Parcel,11.94,2,16370.0,United Kingdom
567185,2023-09-18,20979,36 Pencils Tube Red Retrospot,11.53,7,16370.0,United Kingdom
567185,2023-09-18,23321,Small White Heart Of Wicker,11.94,8,16370.0,United Kingdom
567185,2023-09-18,23322,Large White Heart Of Wicker,13.27,5,16370.0,United Kingdom
567185,2023-09-18,21754,Home Building Block Word,16.66,1,16370.0,United Kingdom
567185,2023-09-18,22121,Noel Wooden Block Letters,16.35,1,16370.0,United Kingdom
567185,2023-09-18,22329,Round Container Set Of 5 Retrospot,11.94,4,16370.0,United Kingdom
567185,2023-09-18,21733,Red Hanging Heart T-Light Holder,13.27,2,16370.0,United Kingdom
567185,2023-09-18,22694,Wicker Star,12.4,1,16370.0,United Kingdom
567185,2023-09-18,22470,Heart Of Wicker Large,13.27,2,16370.0,United Kingdom
567185,2023-09-18,22507,Memo Board Retrospot Design,15.32,2,16370.0,United Kingdom
567185,2023-09-18,22840,Round Cake Tin Vintage Red,18.4,1,16370.0,United Kingdom
567185,2023-09-18,20914,Set/5 Red Retrospot Lid Glass Bowls,13.27,1,16370.0,United Kingdom
567185,2023-09-18,23133,Large Ivory Heart Wall Organiser,18.71,2,16370.0,United Kingdom
567185,2023-09-18,23132,Small Ivory Heart Wall Organiser,16.14,2,16370.0,United Kingdom
567185,2023-09-18,85123A,Cream Hanging Heart T-Light Holder,13.27,1,16370.0,United Kingdom
567185,2023-09-18,22866,Hand Warmer Scotty Dog Design,12.4,2,16370.0,United Kingdom
567185,2023-09-18,22632,Hand Warmer Red Retrospot,12.4,2,16370.0,United Kingdom
567185,2023-09-18,23439,Hand Warmer Red Love Heart,12.4,2,16370.0,United Kingdom
567185,2023-09-18,23204,Charlotte Bag Apples Design,11.12,3,16370.0,United Kingdom
567185,2023-09-18,22356,Charlotte Bag Pink Polkadot,11.12,4,16370.0,United Kingdom
567185,2023-09-18,20719,Woodland Charlotte Bag,11.12,3,16370.0,United Kingdom
567185,2023-09-18,21733,Red Hanging Heart T-Light Holder,13.27,1,16370.0,United Kingdom
567185,2023-09-18,22840,Round Cake Tin Vintage Red,18.4,1,16370.0,United Kingdom
567185,2023-09-18,21931,Jumbo Storage Bag Suki,12.38,1,16370.0,United Kingdom
567185,2023-09-18,21931,Jumbo Storage Bag Suki,12.38,1,16370.0,United Kingdom
567185,2023-09-18,84380,Set Of 3 Butterfly Cookie Cutters,11.74,3,16370.0,United Kingdom
567185,2023-09-18,84378,Set Of 3 Heart Cookie Cutters,11.74,3,16370.0,United Kingdom
567185,2023-09-18,21212,Pack Of 72 Retrospot Cake Cases,10.81,3,16370.0,United Kingdom
567185,2023-09-18,23309,Set Of 60 I Love London Cake Cases,10.81,1,16370.0,United Kingdom
567185,2023-09-18,23307,Set Of 60 Pantry Design Cake Cases,10.81,3,16370.0,United Kingdom
567185,2023-09-18,84992,72 Sweetheart Fairy Cake Cases,10.81,2,16370.0,United Kingdom
567185,2023-09-18,20713,Jumbo Bag Owls,6.19,1,16370.0,United Kingdom
567185,2023-09-18,22386,Jumbo Bag Pink Polkadot,6.19,2,16370.0,United Kingdom
567185,2023-09-18,85099B,Jumbo Bag Red Retrospot,6.19,2,16370.0,United Kingdom
567185,2023-09-18,85099B,Jumbo Bag Red Retrospot,6.19,1,16370.0,United Kingdom
567185,2023-09-18,20712,Jumbo Bag Woodland Animals,6.19,2,16370.0,United Kingdom
567185,2023-09-18,23199,Jumbo Bag Apples,6.19,6,16370.0,United Kingdom
567185,2023-09-18,20713,Jumbo Bag Owls,6.19,4,16370.0,United Kingdom
567185,2023-09-18,85099B,Jumbo Bag Red Retrospot,6.19,5,16370.0,United Kingdom
567185,2023-09-18,85099F,Jumbo Bag Strawberry,6.19,5,16370.0,United Kingdom
567185,2023-09-18,22386,Jumbo Bag Pink Polkadot,6.19,5,16370.0,United Kingdom
567185,2023-09-18,22383,Lunch Bag Suki Design,5.97,2,16370.0,United Kingdom
567185,2023-09-18,23206,Lunch Bag Apple Design,5.97,4,16370.0,United Kingdom
567186,2023-09-18,23252,Vintage Red Enamel Trim Jug,14.09,2,17073.0,United Kingdom
567186,2023-09-18,20983,12 Pencils Tall Tube Red Retrospot,11.12,2,17073.0,United Kingdom
567186,2023-09-18,21584,Retrospot Small Tube Matches,11.94,4,17073.0,United Kingdom
567186,2023-09-18,21878,Pack Of 6 Sandcastle Flags Assorted,11.12,1,17073.0,United Kingdom
567186,2023-09-18,23101,Silver Stars Table Decoration,11.1,1,17073.0,United Kingdom
567186,2023-09-18,20979,36 Pencils Tube Red Retrospot,11.53,2,17073.0,United Kingdom
567186,2023-09-18,22437,Set Of 9 Black Skull Balloons,11.12,1,17073.0,United Kingdom
567186,2023-09-18,22616,Pack Of 12 London Tissues,10.65,12,17073.0,United Kingdom
567186,2023-09-18,84832,Zinc Willie Winkie Candle Stick,11.12,2,17073.0,United Kingdom
567186,2023-09-18,21683,Medium Medina Stamped Metal Bowl,13.27,2,17073.0,United Kingdom
567186,2023-09-18,22084,Paper Chain Kit Empire,13.27,2,17073.0,United Kingdom
567186,2023-09-18,23298,Spotty Bunting,15.32,3,17073.0,United Kingdom
567186,2023-09-18,21621,Vintage Union Jack Bunting,18.96,3,17073.0,United Kingdom
567186,2023-09-18,47566,Party Bunting,15.32,7,17073.0,United Kingdom
567186,2023-09-18,21485,Retrospot Heart Hot Water Bottle,15.32,2,17073.0,United Kingdom
567186,2023-09-18,22111,Scottie Dog Hot Water Bottle,15.32,3,17073.0,United Kingdom
567186,2023-09-18,21986,Pack Of 12 Pink Polkadot Tissues,10.65,12,17073.0,United Kingdom
567186,2023-09-18,22911,Paper Chain Kit London,13.27,3,17073.0,United Kingdom
567186,2023-09-18,22498,Wooden Regatta Bunting,16.35,2,17073.0,United Kingdom
567186,2023-09-18,84832,Zinc Willie Winkie Candle Stick,11.12,4,17073.0,United Kingdom
567186,2023-09-18,84970L,Single Heart Zinc T-Light Holder,11.53,12,17073.0,United Kingdom
567186,2023-09-18,23145,Zinc T-Light Holder Star Large,11.22,12,17073.0,United Kingdom
567186,2023-09-18,23144,Zinc T-Light Holder Stars Small,11.1,12,17073.0,United Kingdom
567186,2023-09-18,84970S,Hanging Heart Zinc T-Light Holder,11.12,12,17073.0,United Kingdom
567186,2023-09-18,22070,Small Red Retrospot Mug In Box,14.09,2,17073.0,United Kingdom
567186,2023-09-18,84978,Hanging Heart Jar T-Light Holder,11.53,6,17073.0,United Kingdom
567186,2023-09-18,21207,Skull And Crossbones Garland,11.94,1,17073.0,United Kingdom
567186,2023-09-18,82552,Washroom Metal Sign,11.74,3,17073.0,United Kingdom
567186,2023-09-18,23184,Bull Dog Bottle Opener,15.32,2,17073.0,United Kingdom
567186,2023-09-18,22150,3 Stripey Mice Feltcraft,12.25,2,17073.0,United Kingdom
567186,2023-09-18,21899,Garage Key Fob,10.92,2,17073.0,United Kingdom
567186,2023-09-18,21900,Key Fob Shed,10.92,5,17073.0,United Kingdom
567186,2023-09-18,22672,French Bathroom Sign Blue Metal,11.94,2,17073.0,United Kingdom
567186,2023-09-18,22673,French Garden Sign Blue Metal,11.53,2,17073.0,United Kingdom
567186,2023-09-18,22095,Lads Only Tissue Box,10.65,4,17073.0,United Kingdom
567186,2023-09-18,22091,Empire Tissue Box,10.65,4,17073.0,United Kingdom
567186,2023-09-18,22099,Caravan Square Tissue Box,10.65,2,17073.0,United Kingdom
567186,2023-09-18,21988,Pack Of 6 Skull Paper Plates,11.12,2,17073.0,United Kingdom
567186,2023-09-18,21989,Pack Of 20 Skull Paper Napkins,11.12,1,17073.0,United Kingdom
567186,2023-09-18,21987,Pack Of 6 Skull Paper Cups,10.92,3,17073.0,United Kingdom
567186,2023-09-18,22625,Red Kitchen Scales,18.96,1,17073.0,United Kingdom
567186,2023-09-18,23360,Set 8 Candles Vintage Doily,12.25,2,17073.0,United Kingdom
567186,2023-09-18,21588,Retrospot Giant Tube Matches,12.86,6,17073.0,United Kingdom
567186,2023-09-18,21592,Retrospot Cigar Box Matches,11.53,6,17073.0,United Kingdom
567186,2023-09-18,22694,Wicker Star,12.4,3,17073.0,United Kingdom
567186,2023-09-18,23342,Mint Diner Wall Clock,18.96,1,17073.0,United Kingdom
567186,2023-09-18,22193,Red Diner Wall Clock,18.96,1,17073.0,United Kingdom
