TransactionNo,Date,ProductNo,ProductName,Price,Quantity,CustomerNo,Country
577331,2023-11-18,84347,Rotating Silver Angels T-Light Hldr,12.86,12,14667.0,United Kingdom
577331,2023-11-18,82482,Wooden Picture Frame White Finish,13.27,6,14667.0,United Kingdom
577331,2023-11-18,22371,Airline Bag Vintage Tokyo 78,14.61,1,14667.0,United Kingdom
577331,2023-11-18,23033,Drawer Knob Ceramic Red,11.74,6,14667.0,United Kingdom
577331,2023-11-18,23029,Drawer Knob Crackle Glaze Green,11.94,6,14667.0,United Kingdom
577331,2023-11-18,23031,Drawer Knob Crackle Glaze Pink,11.94,6,14667.0,United Kingdom
577331,2023-11-18,21670,Blue Spot Ceramic Drawer Knob,11.74,6,14667.0,United Kingdom
577331,2023-11-18,21034,Rex Cash+Carry Jumbo Shopper,11.22,1,14667.0,United Kingdom
577331,2023-11-18,23035,Drawer Knob Ceramic Ivory,11.74,6,14667.0,United Kingdom
577331,2023-11-18,21136,Painted Metal Pears Assorted,11.98,8,14667.0,United Kingdom
577331,2023-11-18,23439,Hand Warmer Red Love Heart,12.4,24,14667.0,United Kingdom
577331,2023-11-18,21479,White Skull Hot Water Bottle,14.61,1,14667.0,United Kingdom
577332,2023-11-18,22112,Chocolate Hot Water Bottle,15.32,8,13013.0,United Kingdom
577332,2023-11-18,23159,Set Of 5 Pancake Day Magnets,12.38,12,13013.0,United Kingdom
577332,2023-11-18,23154,Set Of 4 Jam Jar Magnets,12.38,12,13013.0,United Kingdom
577332,2023-11-18,22111,Scottie Dog Hot Water Bottle,15.32,3,13013.0,United Kingdom
577332,2023-11-18,22114,Hot Water Bottle Tea And Sympathy,14.61,4,13013.0,United Kingdom
577332,2023-11-18,21169,You're Confusing Me Metal Sign,11.98,12,13013.0,United Kingdom
577332,2023-11-18,23267,Set Of 4 Santa Place Settings,11.53,24,13013.0,United Kingdom
577332,2023-11-18,22738,Ribbon Reel Snowy Village,11.94,10,13013.0,United Kingdom
577332,2023-11-18,22952,60 Cake Cases Vintage Christmas,10.81,24,13013.0,United Kingdom
577332,2023-11-18,22909,Set Of 20 Vintage Christmas Napkins,11.12,12,13013.0,United Kingdom
577332,2023-11-18,22910,Paper Chain Kit Vintage Christmas,13.27,24,13013.0,United Kingdom
577332,2023-11-18,23311,Vintage Christmas Stocking,12.86,6,13013.0,United Kingdom
577333,2023-11-18,23389,Spaceboy Mini Backpack,14.5,4,14868.0,United Kingdom
577333,2023-11-18,23480,Mini Lights Woodland Mushrooms,14.09,4,14868.0,United Kingdom
577333,2023-11-18,23084,Rabbit Night Light,12.38,12,14868.0,United Kingdom
577333,2023-11-18,22568,Feltcraft Cushion Owl,14.09,8,14868.0,United Kingdom
577333,2023-11-18,22621,Traditional Knitting Nancy,11.94,12,14868.0,United Kingdom
577333,2023-11-18,20969,Red Floral Feltcraft Shoulder Bag,14.09,4,14868.0,United Kingdom
577333,2023-11-18,20970,Pink Floral Feltcraft Shoulder Bag,14.09,4,14868.0,United Kingdom
577333,2023-11-18,23493,Vintage Doily Travel Sewing Kit,12.25,10,14868.0,United Kingdom
577333,2023-11-18,23494,Vintage Doily Deluxe Sewing Kit,16.35,3,14868.0,United Kingdom
577333,2023-11-18,23355,Hot Water Bottle Keep Calm,15.32,4,14868.0,United Kingdom
577333,2023-11-18,22114,Hot Water Bottle Tea And Sympathy,14.61,4,14868.0,United Kingdom
577333,2023-11-18,22835,Hot Water Bottle I Am So Poorly,15.32,4,14868.0,United Kingdom
577333,2023-11-18,22112,Chocolate Hot Water Bottle,15.32,9,14868.0,United Kingdom
577333,2023-11-18,35970,Zinc Folkart Sleigh Bells,11.98,12,14868.0,United Kingdom
577333,2023-11-18,23100,Silver Bells Table Decoration,11.53,12,14868.0,United Kingdom
577333,2023-11-18,23083,Set 6 Paper Table Lantern Stars,14.09,12,14868.0,United Kingdom
577333,2023-11-18,21914,Blue Harmonica In Box,11.53,12,14868.0,United Kingdom
577334,2023-11-18,23133,Large Ivory Heart Wall Organiser,18.71,2,15368.0,United Kingdom
577334,2023-11-18,23215,Jingle Bell Heart Antique Silver,12.08,156,15368.0,United Kingdom
577334,2023-11-18,22302,Coffee Mug Pears Design,12.4,36,15368.0,United Kingdom
577334,2023-11-18,22303,Coffee Mug Apples Design,12.4,36,15368.0,United Kingdom
577335,2023-11-18,22086,Paper Chain Kit 50'S Christmas,13.27,6,14285.0,United Kingdom
577335,2023-11-18,22910,Paper Chain Kit Vintage Christmas,12.86,40,14285.0,United Kingdom
577335,2023-11-18,23318,Box Of 6 Mini Vintage Crackers,12.8,12,14285.0,United Kingdom
577335,2023-11-18,22623,Box Of Vintage Jigsaw Blocks,16.35,12,14285.0,United Kingdom
577335,2023-11-18,22113,Grey Heart Hot Water Bottle,14.09,36,14285.0,United Kingdom
577336,2023-11-18,23502,Playing Cards Vintage Doily,11.53,12,14793.0,United Kingdom
577336,2023-11-18,22860,Easter Tin Chicks Pink Daisy,11.94,6,14793.0,United Kingdom
577336,2023-11-18,21479,White Skull Hot Water Bottle,14.61,4,14793.0,United Kingdom
577336,2023-11-18,21481,Fawn Blue Hot Water Bottle,14.09,4,14793.0,United Kingdom
577336,2023-11-18,23358,Hot Stuff Hot Water Bottle,14.09,6,14793.0,United Kingdom
577336,2023-11-18,22835,Hot Water Bottle I Am So Poorly,15.32,4,14793.0,United Kingdom
577336,2023-11-18,23355,Hot Water Bottle Keep Calm,15.32,4,14793.0,United Kingdom
577336,2023-11-18,23243,Set Of Tea Coffee Sugar Tins Pantry,15.32,4,14793.0,United Kingdom
577336,2023-11-18,22720,Set Of 3 Cake Tins Pantry Design,15.32,3,14793.0,United Kingdom
577336,2023-11-18,23245,Set Of 3 Regency Cake Tins,15.32,4,14793.0,United Kingdom
577336,2023-11-18,23426,Metal Sign Drop Your Pants,13.21,6,14793.0,United Kingdom
577336,2023-11-18,23351,Roll Wrap 50'S Christmas,11.53,12,14793.0,United Kingdom
577336,2023-11-18,23375,50'S Christmas Paper Gift Bag,5.55,10,14793.0,United Kingdom
577336,2023-11-18,23437,50'S Christmas Gift Bag Large,5.77,12,14793.0,United Kingdom
577337,2023-11-18,84347,Rotating Silver Angels T-Light Hldr,12.86,1,15494.0,United Kingdom
577337,2023-11-18,23467,Vintage Zinc Planter,13.62,1,15494.0,United Kingdom
577337,2023-11-18,23335,Egg Frying Pan Ivory,12.38,1,15494.0,United Kingdom
577337,2023-11-18,21351,Cinammon & Orange Wreath,17.17,1,15494.0,United Kingdom
577337,2023-11-18,23496,Pantry Kitchen Thermometer,11.53,1,15494.0,United Kingdom
577337,2023-11-18,22915,Assorted Bottle Top Magnets,10.68,6,15494.0,United Kingdom
577337,2023-11-18,23328,Set 6 School Milk Bottles In Crate,14.09,1,15494.0,United Kingdom
577337,2023-11-18,23250,Vintage Red Trim Enamel Bowl,11.53,6,15494.0,United Kingdom
577337,2023-11-18,23165,Large Ceramic Top Storage Jar,11.94,3,15494.0,United Kingdom
577337,2023-11-18,23084,Rabbit Night Light,12.38,1,15494.0,United Kingdom
577337,2023-11-18,22928,Yellow Giant Garden Thermometer,16.35,1,15494.0,United Kingdom
577337,2023-11-18,22909,Set Of 20 Vintage Christmas Napkins,11.12,1,15494.0,United Kingdom
577337,2023-11-18,22734,Set Of 6 Ribbons Vintage Christmas,13.21,1,15494.0,United Kingdom
577337,2023-11-18,72780,Black Silouette Candle Plate,11.12,1,15494.0,United Kingdom
577337,2023-11-18,22922,Fridge Magnets Us Diner Assorted,11.12,4,15494.0,United Kingdom
577337,2023-11-18,22979,Pantry Washing Up Brush,11.74,1,15494.0,United Kingdom
577337,2023-11-18,22910,Paper Chain Kit Vintage Christmas,13.27,2,15494.0,United Kingdom
577337,2023-11-18,23090,Vintage Glass T-Light Holder,11.1,1,15494.0,United Kingdom
577337,2023-11-18,22791,T-Light Glass Fluted Antique,11.53,1,15494.0,United Kingdom
577337,2023-11-18,23313,Vintage Christmas Bunting,15.32,2,15494.0,United Kingdom
577337,2023-11-18,84347,Rotating Silver Angels T-Light Hldr,12.86,6,15494.0,United Kingdom
577337,2023-11-18,23036,T-Light Holder Silver Petit Four,11.53,1,15494.0,United Kingdom
577337,2023-11-18,23382,Box Of 6 Christmas Cake Decorations,14.09,1,15494.0,United Kingdom
577337,2023-11-18,22941,Christmas Lights 10 Reindeer,18.96,1,15494.0,United Kingdom
577337,2023-11-18,47503A,Ass Floral Print Multi Screwdriver,10.68,1,15494.0,United Kingdom
577337,2023-11-18,22736,Ribbon Reel Making Snowmen,11.94,1,15494.0,United Kingdom
577337,2023-11-18,23313,Vintage Christmas Bunting,15.32,2,15494.0,United Kingdom
577337,2023-11-18,23130,Mistletoe Heart Wreath Green,14.5,1,15494.0,United Kingdom
577337,2023-11-18,23108,Set Of 10 Led Dolly Lights,16.66,1,15494.0,United Kingdom
577337,2023-11-18,21191,Large White Honeycomb Paper Bell,12.4,1,15494.0,United Kingdom
577337,2023-11-18,21192,White Bell Honeycomb Paper,11.94,1,15494.0,United Kingdom
577337,2023-11-18,22030,Swallows Greeting Card,10.68,12,15494.0,United Kingdom
577337,2023-11-18,23541,Wall Art Classic Puddings,18.71,1,15494.0,United Kingdom
577337,2023-11-18,23036,T-Light Holder Silver Petit Four,11.53,1,15494.0,United Kingdom
577338,2023-11-18,22560,Traditional Modelling Clay,11.53,24,17650.0,United Kingdom
577338,2023-11-18,22491,Pack Of 12 Coloured Pencils,11.12,24,17650.0,United Kingdom
577338,2023-11-18,22489,Pack Of 12 Traditional Crayons,10.68,24,17650.0,United Kingdom
577338,2023-11-18,22561,Wooden School Colouring Set,11.94,21,17650.0,United Kingdom
577338,2023-11-18,22425,Enamel Colander Cream,15.32,3,17650.0,United Kingdom
577338,2023-11-18,22138,Baking Set 9 Piece Retrospot,15.32,6,17650.0,United Kingdom
577338,2023-11-18,21212,Pack Of 72 Retrospot Cake Cases,10.81,24,17650.0,United Kingdom
577338,2023-11-18,21977,Pack Of 60 Pink Paisley Cake Cases,10.81,24,17650.0,United Kingdom
577341,2023-11-18,22942,Christmas Lights 10 Santas,18.96,2,16279.0,United Kingdom
577341,2023-11-18,23274,Star T-Light Holder Willie Winkie,11.94,12,16279.0,United Kingdom
577341,2023-11-18,22144,Christmas Craft Little Friends,12.4,6,16279.0,United Kingdom
577341,2023-11-18,23319,Box Of 6 Mini 50'S Crackers,12.8,6,16279.0,United Kingdom
577341,2023-11-18,23312,Vintage Christmas Gift Sack,14.5,4,16279.0,United Kingdom
577341,2023-11-18,23311,Vintage Christmas Stocking,12.86,6,16279.0,United Kingdom
577341,2023-11-18,20914,Set/5 Red Retrospot Lid Glass Bowls,13.27,6,16279.0,United Kingdom
577341,2023-11-18,23284,Doormat Keep Calm And Come In,18.71,2,16279.0,United Kingdom
577341,2023-11-18,21121,Set/10 Red Polkadot Party Candles,11.53,24,16279.0,United Kingdom
577341,2023-11-18,47590B,Pink Happy Birthday Bunting,15.84,3,16279.0,United Kingdom
577341,2023-11-18,47590A,Blue Happy Birthday Bunting,15.84,3,16279.0,United Kingdom
577341,2023-11-18,22534,Magic Drawing Slate Spaceboy,10.68,24,16279.0,United Kingdom
577341,2023-11-18,23445,Ice Cream Bubbles,11.1,20,16279.0,United Kingdom
577341,2023-11-18,23310,Bubblegum Ring Assorted,10.68,36,16279.0,United Kingdom
577341,2023-11-18,84077,World War 2 Gliders Asstd Designs,10.55,48,16279.0,United Kingdom
577341,2023-11-18,21889,Wooden Box Of Dominoes,11.53,12,16279.0,United Kingdom
577341,2023-11-18,22560,Traditional Modelling Clay,11.53,24,16279.0,United Kingdom
577341,2023-11-18,23168,Classic Cafe Sugar Dispenser,11.53,12,16279.0,United Kingdom
577341,2023-11-18,23399,Home Sweet Home Hanging Heart,11.12,12,16279.0,United Kingdom
577341,2023-11-18,22595,Gingham Heart Decoration,11.12,12,16279.0,United Kingdom
577341,2023-11-18,22594,Christmas Gingham Tree,11.12,12,16279.0,United Kingdom
577341,2023-11-18,22593,Christmas Gingham Star,11.12,12,16279.0,United Kingdom
577341,2023-11-18,23497,Classic Chrome Bicycle Bell,11.74,12,16279.0,United Kingdom
577341,2023-11-18,22418,10 Colour Spaceboy Pen,11.12,24,16279.0,United Kingdom
577341,2023-11-18,23571,Traditional Naughts & Crosses,11.94,12,16279.0,United Kingdom
577341,2023-11-18,23439,Hand Warmer Red Love Heart,12.4,12,16279.0,United Kingdom
577341,2023-11-18,22114,Hot Water Bottle Tea And Sympathy,14.61,4,16279.0,United Kingdom
577341,2023-11-18,22112,Chocolate Hot Water Bottle,15.32,3,16279.0,United Kingdom
577341,2023-11-18,23493,Vintage Doily Travel Sewing Kit,12.25,10,16279.0,United Kingdom
577341,2023-11-18,23326,Hanging Mini Coloured Bottles,10.9,48,16279.0,United Kingdom
577341,2023-11-18,23298,Spotty Bunting,15.32,3,16279.0,United Kingdom
577341,2023-11-18,84991,60 Teatime Fairy Cake Cases,10.81,24,16279.0,United Kingdom
577341,2023-11-18,22624,Ivory Kitchen Scales,18.96,2,16279.0,United Kingdom
577341,2023-11-18,23483,Hanging Butterfly T-Light Holder,11.53,12,16279.0,United Kingdom
577341,2023-11-18,22488,Natural Slate Rectangle Chalkboard,11.94,12,16279.0,United Kingdom
577341,2023-11-18,23506,Mini Playing Cards Spaceboy,10.68,20,16279.0,United Kingdom
577341,2023-11-18,22693,Grow A Flytrap Or Sunflower In Tin,11.53,24,16279.0,United Kingdom
577341,2023-11-18,84375,Set Of 20 Kids Cookie Cutters,12.4,12,16279.0,United Kingdom
577341,2023-11-18,22960,Jam Making Set With Jars,14.61,6,16279.0,United Kingdom
577341,2023-11-18,21210,Set Of 72 Retrospot Paper Doilies,11.74,12,16279.0,United Kingdom
577341,2023-11-18,71477,Coloured Glass Star T-Light Holder,14.3,4,16279.0,United Kingdom
577341,2023-11-18,23343,Jumbo Bag Vintage Christmas,6.19,10,16279.0,United Kingdom
577341,2023-11-18,85099B,Jumbo Bag Red Retrospot,6.19,10,16279.0,United Kingdom
577341,2023-11-18,85099F,Jumbo Bag Strawberry,6.19,10,16279.0,United Kingdom
577344,2023-11-18,21080,Set/20 Red Retrospot Paper Napkins,11.12,12,12437.0,France
577344,2023-11-18,22130,Party Cone Christmas Decoration,11.12,12,12437.0,France
577344,2023-11-18,22333,Retrospot Party Bag + Sticker Set,11.94,8,12437.0,France
577344,2023-11-18,23229,Vintage Donkey Tail Game,14.09,6,12437.0,France
577344,2023-11-18,22435,Set Of 9 Heart Shaped Balloons,11.53,24,12437.0,France
577344,2023-11-18,21987,Pack Of 6 Skull Paper Cups,10.92,12,12437.0,France
577344,2023-11-18,21989,Pack Of 20 Skull Paper Napkins,11.12,12,12437.0,France
577347,2023-11-18,23322,Large White Heart Of Wicker,13.27,6,13960.0,United Kingdom
577347,2023-11-18,22595,Gingham Heart Decoration,11.12,12,13960.0,United Kingdom
577347,2023-11-18,22578,Wooden Star Christmas Scandinavian,10.55,24,13960.0,United Kingdom
577347,2023-11-18,22579,Wooden Tree Christmas Scandinavian,10.55,24,13960.0,United Kingdom
577347,2023-11-18,22470,Heart Of Wicker Large,13.27,6,13960.0,United Kingdom
577347,2023-11-18,22694,Wicker Star,12.4,6,13960.0,United Kingdom
577347,2023-11-18,23330,Decorative Wicker Heart Medium,11.53,12,13960.0,United Kingdom
577347,2023-11-18,23333,Ivory Wicker Heart Medium,11.53,12,13960.0,United Kingdom
577352,2023-11-18,23491,Vintage Jingle Bells Heart,18.71,4,14820.0,United Kingdom
577352,2023-11-18,22086,Paper Chain Kit 50'S Christmas,13.27,12,14820.0,United Kingdom
577352,2023-11-18,22101,Mirror Mosaic Votive Holder,12.4,6,14820.0,United Kingdom
577352,2023-11-18,21137,Black Record Cover Frame,14.09,4,14820.0,United Kingdom
577352,2023-11-18,23061,Vintage Embossed Heart,11.53,12,14820.0,United Kingdom
577352,2023-11-18,84836,Zinc Metal Heart Decoration,11.53,12,14820.0,United Kingdom
577355,2023-11-18,23171,Regency Tea Plate Green,11.94,12,14911.0,EIRE
577355,2023-11-18,23175,Regency Milk Jug Pink,13.58,4,14911.0,EIRE
577355,2023-11-18,23174,Regency Sugar Bowl Green,14.5,4,14911.0,EIRE
577355,2023-11-18,21871,Save The Planet Mug,11.94,12,14911.0,EIRE
577355,2023-11-18,23144,Zinc T-Light Holder Stars Small,11.1,12,14911.0,EIRE
577355,2023-11-18,85123A,Cream Hanging Heart T-Light Holder,13.27,12,14911.0,EIRE
577355,2023-11-18,71459,Hanging Jam Jar T-Light Holders,11.12,24,14911.0,EIRE
577355,2023-11-18,23413,Decorative Vintage Coffee Box,15.32,3,14911.0,EIRE
577355,2023-11-18,23403,Letter Holder Home Sweet Home,14.09,4,14911.0,EIRE
577355,2023-11-18,23490,T-Light Holder Hanging Love Bird,14.09,6,14911.0,EIRE
577355,2023-11-18,22942,Christmas Lights 10 Santas,18.96,2,14911.0,EIRE
577355,2023-11-18,23083,Set 6 Paper Table Lantern Stars,14.09,6,14911.0,EIRE
577355,2023-11-18,23109,Pack Of Six Led Tea Lights,13.21,6,14911.0,EIRE
577355,2023-11-18,23040,Paper Lantern 9 Point Snow Star,16.14,3,14911.0,EIRE
577355,2023-11-18,23046,Paper Lantern 9 Point Deluxe Star,17.07,2,14911.0,EIRE
577355,2023-11-18,23271,Christmas Table Silver Candle Spike,11.1,16,14911.0,EIRE
577355,2023-11-18,22809,Set Of 6 T-Lights Santa,13.27,6,14911.0,EIRE
577355,2023-11-18,22141,Christmas Craft Tree Top Angel,12.4,6,14911.0,EIRE
577355,2023-11-18,22940,Feltcraft Christmas Fairy,14.61,4,14911.0,EIRE
577355,2023-11-18,23157,Set Of 6 Nativity Magnets,12.38,12,14911.0,EIRE
577355,2023-11-18,22078,Ribbon Reel Lace Design,12.4,10,14911.0,EIRE
577355,2023-11-18,23479,Wire Egg Basket,18.3,2,14911.0,EIRE
577355,2023-11-18,71477,Coloured Glass Star T-Light Holder,14.3,4,14911.0,EIRE
577355,2023-11-18,23245,Set Of 3 Regency Cake Tins,15.32,4,14911.0,EIRE
577355,2023-11-18,79321,Chilli Lights,16.14,4,14911.0,EIRE
577355,2023-11-18,23189,Set Of 12 Fork Candles,13.21,6,14911.0,EIRE
577355,2023-11-18,23108,Set Of 10 Led Dolly Lights,16.66,4,14911.0,EIRE
577355,2023-11-18,22139,Retrospot Tea Set Ceramic 11 Pc,15.32,3,14911.0,EIRE
577355,2023-11-18,22138,Baking Set 9 Piece Retrospot,15.32,3,14911.0,EIRE
577355,2023-11-18,23126,Feltcraft Girl Amelie Kit,15.32,4,14911.0,EIRE
577355,2023-11-18,22030,Swallows Greeting Card,10.68,12,14911.0,EIRE
577355,2023-11-18,22028,Penny Farthing Birthday Card,10.68,12,14911.0,EIRE
577355,2023-11-18,22835,Hot Water Bottle I Am So Poorly,15.32,4,14911.0,EIRE
577355,2023-11-18,22113,Grey Heart Hot Water Bottle,14.61,4,14911.0,EIRE
577355,2023-11-18,22969,Homemade Jam Scented Candles,11.74,12,14911.0,EIRE
577355,2023-11-18,22699,Roses Regency Teacup And Saucer,13.27,6,14911.0,EIRE
577355,2023-11-18,22698,Pink Regency Teacup And Saucer,13.27,6,14911.0,EIRE
577355,2023-11-18,22697,Green Regency Teacup And Saucer,13.27,6,14911.0,EIRE
577355,2023-11-18,23170,Regency Tea Plate Roses,11.94,12,14911.0,EIRE
577355,2023-11-18,20970,Pink Floral Feltcraft Shoulder Bag,14.09,4,14911.0,EIRE
577355,2023-11-18,23172,Regency Tea Plate Pink,11.94,12,14911.0,EIRE
577356,2023-11-18,22470,Heart Of Wicker Large,13.27,12,16350.0,United Kingdom
577356,2023-11-18,22469,Heart Of Wicker Small,11.94,12,16350.0,United Kingdom
577356,2023-11-18,23329,Decorative Wicker Heart Large,11.94,24,16350.0,United Kingdom
577356,2023-11-18,23332,Ivory Wicker Heart Large,11.94,12,16350.0,United Kingdom
577357,2023-11-18,23293,Set Of 12 Fairy Cake Baking Cases,11.1,24,13098.0,United Kingdom
577357,2023-11-18,79321,Chilli Lights,15.32,24,13098.0,United Kingdom
577357,2023-11-18,23568,Egg Cup Henrietta Hen Cream,11.53,24,13098.0,United Kingdom
577357,2023-11-18,23567,Egg Cup Henrietta Hen Pink,11.53,24,13098.0,United Kingdom
577357,2023-11-18,23319,Box Of 6 Mini 50'S Crackers,12.38,48,13098.0,United Kingdom
577357,2023-11-18,23084,Rabbit Night Light,12.08,72,13098.0,United Kingdom
577357,2023-11-18,23013,Glass Apothecary Bottle Tonic,13.79,12,13098.0,United Kingdom
577357,2023-11-18,23012,Glass Apothecary Bottle Perfume,13.79,12,13098.0,United Kingdom
577357,2023-11-18,23344,Jumbo Bag 50'S Christmas,6.19,40,13098.0,United Kingdom
577357,2023-11-18,23681,Lunch Bag Red Vintage Doily,5.97,20,13098.0,United Kingdom
577357,2023-11-18,23583,Lunch Bag Paisley Park,5.97,20,13098.0,United Kingdom
577357,2023-11-18,23207,Lunch Bag Alphabet Design,5.97,20,13098.0,United Kingdom
577358,2023-11-18,21810,Christmas Hanging Star With Bell,11.1,10,12358.0,Austria
577358,2023-11-18,21811,Hanging Heart With Bell,11.1,4,12358.0,Austria
577358,2023-11-18,21812,Garland With Hearts And Bells,13.62,3,12358.0,Austria
577358,2023-11-18,21813,Garland With Stars And Bells,13.62,3,12358.0,Austria
577358,2023-11-18,21832,Chocolate Calculator,13.62,2,12358.0,Austria
577358,2023-11-18,21871,Save The Planet Mug,13.62,1,12358.0,Austria
577358,2023-11-18,21872,Glamorous Mug,13.62,2,12358.0,Austria
577358,2023-11-18,21888,Bingo Set,17.9,4,12358.0,Austria
577358,2023-11-18,21889,Wooden Box Of Dominoes,12.77,2,12358.0,Austria
577358,2023-11-18,21890,S/6 Wooden Skittles In Cotton Bag,16.18,1,12358.0,Austria
577358,2023-11-18,21891,Traditional Wooden Skipping Rope,12.77,2,12358.0,Austria
577358,2023-11-18,21892,Traditional Wooden Catch Cup Game,12.77,1,12358.0,Austria
577358,2023-11-18,21894,Potting Shed Seed Envelopes,12.77,1,12358.0,Austria
577358,2023-11-18,21907,I'm On Holiday Metal Sign,14.48,1,12358.0,Austria
577358,2023-11-18,21908,Chocolate This Way Metal Sign,14.48,1,12358.0,Austria
577358,2023-11-18,21912,Vintage Snakes & Ladders,17.9,2,12358.0,Austria
577358,2023-11-18,21914,Blue Harmonica In Box,12.77,4,12358.0,Austria
577358,2023-11-18,21915,Red Harmonica In Box,12.77,3,12358.0,Austria
577358,2023-11-18,21918,Set 12 Kids Colour Chalk Sticks,11.1,3,12358.0,Austria
577358,2023-11-18,21934,Skull Shoulder Bag,11.92,9,12358.0,Austria
577358,2023-11-18,21935,Suki Shoulder Bag,11.92,15,12358.0,Austria
577358,2023-11-18,21944,Kittens Design Flannel,11.92,1,12358.0,Austria
577358,2023-11-18,21967,Pack Of 12 Skull Tissues,11.1,5,12358.0,Austria
577358,2023-11-18,21975,Pack Of 60 Dinosaur Cake Cases,11.53,2,12358.0,Austria
577358,2023-11-18,21976,Pack Of 60 Mushroom Cake Cases,11.53,3,12358.0,Austria
577358,2023-11-18,21977,Pack Of 60 Pink Paisley Cake Cases,11.53,1,12358.0,Austria
577358,2023-11-18,21980,Pack Of 12 Red Retrospot Tissues,11.1,2,12358.0,Austria
577358,2023-11-18,21981,Pack Of 12 Woodland Tissues,11.1,2,12358.0,Austria
577358,2023-11-18,21982,Pack Of 12 Suki Tissues,11.1,10,12358.0,Austria
577358,2023-11-18,21984,Pack Of 12 Pink Paisley Tissues,11.1,1,12358.0,Austria
577358,2023-11-18,21985,Pack Of 12 Hearts Design Tissues,11.1,3,12358.0,Austria
577358,2023-11-18,21986,Pack Of 12 Pink Polkadot Tissues,11.1,1,12358.0,Austria
577358,2023-11-18,21990,Modern Floral Stationery Set,12.77,6,12358.0,Austria
577358,2023-11-18,21993,Floral Folk Stationery Set,12.77,4,12358.0,Austria
577358,2023-11-18,22025,Ring Of Roses Birthday Card,11.1,1,12358.0,Austria
577358,2023-11-18,22027,Tea Party Birthday Card,11.1,1,12358.0,Austria
577358,2023-11-18,22028,Penny Farthing Birthday Card,11.1,1,12358.0,Austria
577358,2023-11-18,22029,Spaceboy Birthday Card,11.1,1,12358.0,Austria
577358,2023-11-18,22037,Robot Birthday Card,11.1,1,12358.0,Austria
577358,2023-11-18,22059,Ceramic Strawberry Design Mug,13.62,2,12358.0,Austria
577358,2023-11-18,22065,Christmas Pudding Trinket Pot,11.92,5,12358.0,Austria
577358,2023-11-18,22069,Brown Pirate Treasure Chest,13.62,1,12358.0,Austria
577358,2023-11-18,22074,6 Ribbons Shimmering Pinks,11.53,4,12358.0,Austria
577358,2023-11-18,22075,6 Ribbons Elegant Christmas,11.92,10,12358.0,Austria
577358,2023-11-18,22076,6 Ribbons Empire,11.53,5,12358.0,Austria
577358,2023-11-18,22077,6 Ribbons Rustic Charm,14.48,2,12358.0,Austria
577358,2023-11-18,22082,Ribbon Reel Stripes Design,13.62,1,12358.0,Austria
577358,2023-11-18,22086,Paper Chain Kit 50'S Christmas,16.18,10,12358.0,Austria
577358,2023-11-18,22104,Mirror Mosaic Candle Plate,11.92,1,12358.0,Austria
577358,2023-11-18,22107,Pizza Plate In Box,13.62,7,12358.0,Austria
577358,2023-11-18,22110,Bird House Hot Water Bottle,16.18,1,12358.0,Austria
577358,2023-11-18,22113,Grey Heart Hot Water Bottle,18.75,1,12358.0,Austria
577358,2023-11-18,22114,Hot Water Bottle Tea And Sympathy,18.75,1,12358.0,Austria
577358,2023-11-18,22115,Metal Sign Empire Tea,16.18,1,12358.0,Austria
577358,2023-11-18,22123,Ping Microwave Apron,14.48,1,12358.0,Austria
577358,2023-11-18,22129,Party Cones Candy Decoration,12.77,2,12358.0,Austria
577358,2023-11-18,22141,Christmas Craft Tree Top Angel,14.48,1,12358.0,Austria
577358,2023-11-18,22142,Christmas Craft White Fairy,13.62,1,12358.0,Austria
577358,2023-11-18,22144,Christmas Craft Little Friends,14.48,1,12358.0,Austria
577358,2023-11-18,22153,Angel Decoration Stars On Dress,11.1,1,12358.0,Austria
577358,2023-11-18,22154,Angel Decoration 3 Buttons,11.1,1,12358.0,Austria
577358,2023-11-18,22162,Heart Garland Rustic Padded,13.62,1,12358.0,Austria
577358,2023-11-18,22163,Heart String Memo Holder Hanging,11.92,14,12358.0,Austria
577358,2023-11-18,22167,Oval Wall Mirror Diamante,18.75,1,12358.0,Austria
577358,2023-11-18,22175,Pink Owl Soft Toy,16.18,1,12358.0,Austria
577358,2023-11-18,22178,Victorian Glass Hanging T-Light,12.77,2,12358.0,Austria
577358,2023-11-18,22195,Large Heart Measuring Spoons,13.62,1,12358.0,Austria
577358,2023-11-18,22196,Small Heart Measuring Spoons,11.92,2,12358.0,Austria
577358,2023-11-18,22197,Popcorn Holder,11.92,4,12358.0,Austria
577358,2023-11-18,22219,Lovebird Hanging Decoration White,11.92,1,12358.0,Austria
577358,2023-11-18,22227,Hanging Heart Mirror Decoration,11.53,2,12358.0,Austria
577358,2023-11-18,22271,Feltcraft Doll Rosie,16.18,2,12358.0,Austria
577358,2023-11-18,22273,Feltcraft Doll Molly,16.18,1,12358.0,Austria
577358,2023-11-18,22284,Hen House Decoration,13.62,1,12358.0,Austria
577358,2023-11-18,22297,Heart Ivory Trellis Small,12.77,1,12358.0,Austria
577358,2023-11-18,22300,Coffee Mug Dog + Ball Design,15.33,1,12358.0,Austria
577358,2023-11-18,22301,Coffee Mug Cat + Bird Design,15.33,1,12358.0,Austria
577358,2023-11-18,22304,Coffee Mug Blue Paisley Design,15.33,1,12358.0,Austria
577358,2023-11-18,22306,Silver Mug Bone China Tree Of Life,18.75,1,12358.0,Austria
577358,2023-11-18,22328,Round Snack Boxes Set Of 4 Fruits,16.18,1,12358.0,Austria
577358,2023-11-18,22332,Skulls Party Bag + Sticker Set,13.62,2,12358.0,Austria
577358,2023-11-18,22337,Angel Decoration Painted Zinc,10.9,4,12358.0,Austria
577358,2023-11-18,22338,Star Decoration Painted Zinc,10.9,6,12358.0,Austria
577358,2023-11-18,22340,Noel Garland Painted Zinc,11.1,9,12358.0,Austria
577358,2023-11-18,22348,Tea Bag Plate Red Retrospot,11.92,3,12358.0,Austria
577358,2023-11-18,22355,Charlotte Bag Suki Design,11.92,10,12358.0,Austria
577358,2023-11-18,22356,Charlotte Bag Pink Polkadot,11.92,6,12358.0,Austria
577358,2023-11-18,22359,Glass Jar Kings Choice,16.18,1,12358.0,Austria
577358,2023-11-18,22361,Glass Jar Daisy Fresh Cotton Wool,16.18,2,12358.0,Austria
577358,2023-11-18,22378,Wall Tidy Retrospot,14.48,1,12358.0,Austria
577358,2023-11-18,22379,Recycling Bag Retrospot,14.48,2,12358.0,Austria
577358,2023-11-18,22381,Toy Tidy Pink Polkadot,14.48,1,12358.0,Austria
577358,2023-11-18,22411,Jumbo Shopper Vintage Red Paisley,14.48,1,12358.0,Austria
577358,2023-11-18,22418,10 Colour Spaceboy Pen,11.92,3,12358.0,Austria
577358,2023-11-18,22419,Lipstick Pen Red,11.1,8,12358.0,Austria
577358,2023-11-18,22422,Toothpaste Tube Pen,11.53,2,12358.0,Austria
577358,2023-11-18,22426,Enamel Wash Bowl Cream,17.9,1,12358.0,Austria
