TransactionNo,Date,ProductNo,ProductName,Price,Quantity,CustomerNo,Country
572281,2023-10-23,22655,Vintage Red Kitchen Cabinet,594.5,1,17211.0,United Kingdom
572292,2023-10-23,23462,Rococo Wall Mirror White,30.7,1,16017.0,United Kingdom
572305,2023-10-23,23462,Rococo Wall Mirror White,30.7,1,17131.0,United Kingdom
572300,2023-10-23,23007,Spaceboy Baby Gift Set,27.62,1,18005.0,United Kingdom
572284,2023-10-23,23486,Antique Heart Shelf Unit,27.32,1,16744.0,United Kingdom
572287,2023-10-23,23486,Antique Heart Shelf Unit,27.32,1,15584.0,United Kingdom
572295,2023-10-23,23486,Antique Heart Shelf Unit,27.32,1,16686.0,United Kingdom
572282,2023-10-23,22838,3 Tier Cake Tin Red And Cream,25.57,1,17634.0,United Kingdom
572317,2023-10-23,22839,3 Tier Cake Tin Green And Cream,25.57,1,14629.0,United Kingdom
572277,2023-10-23,21340,Classic Metal Birdcage Plant Holder,23.32,1,16768.0,United Kingdom
572277,2023-10-23,85066,Cream Sweetheart Mini Chest,23.32,2,16768.0,United Kingdom
572287,2023-10-23,22424,Enamel Bread Bin Cream,23.32,1,15584.0,United Kingdom
572296,2023-10-23,85066,Cream Sweetheart Mini Chest,23.32,2,13598.0,United Kingdom
572296,2023-10-23,85066,Cream Sweetheart Mini Chest,23.32,1,13598.0,United Kingdom
572300,2023-10-23,22423,Regency Cakestand 3 Tier,23.32,2,18005.0,United Kingdom
572303,2023-10-23,21340,Classic Metal Birdcage Plant Holder,23.32,1,18109.0,United Kingdom
572303,2023-10-23,85066,Cream Sweetheart Mini Chest,23.32,8,18109.0,United Kingdom
572304,2023-10-23,85066,Cream Sweetheart Mini Chest,23.32,3,17131.0,United Kingdom
572306,2023-10-23,22424,Enamel Bread Bin Cream,23.32,1,17841.0,United Kingdom
572307,2023-10-23,85066,Cream Sweetheart Mini Chest,23.32,2,16905.0,United Kingdom
572307,2023-10-23,22423,Regency Cakestand 3 Tier,23.32,2,16905.0,United Kingdom
572310,2023-10-23,22423,Regency Cakestand 3 Tier,23.32,1,12748.0,United Kingdom
572317,2023-10-23,22423,Regency Cakestand 3 Tier,23.32,1,14629.0,United Kingdom
C572275,2023-10-23,22423,Regency Cakestand 3 Tier,23.32,-1,12572.0,Germany
C572299,2023-10-23,85066,Cream Sweetheart Mini Chest,23.32,-1,13598.0,United Kingdom
572290,2023-10-23,23558,Landmark Frame London Bridge,23.06,2,14800.0,United Kingdom
572290,2023-10-23,23557,Landmark Frame Baker Street,23.06,2,14800.0,United Kingdom
572290,2023-10-23,23554,Landmark Frame Oxford Street,23.06,2,14800.0,United Kingdom
572290,2023-10-23,23555,Landmark Frame Notting Hill,23.06,2,14800.0,United Kingdom
572290,2023-10-23,23556,Landmark Frame Covent Garden,23.06,2,14800.0,United Kingdom
572291,2023-10-23,23555,Landmark Frame Notting Hill,23.06,1,16931.0,United Kingdom
572291,2023-10-23,23553,Landmark Frame Camden Town,23.06,1,16931.0,United Kingdom
572298,2023-10-23,23556,Landmark Frame Covent Garden,23.06,3,14071.0,United Kingdom
572298,2023-10-23,23554,Landmark Frame Oxford Street,23.06,3,14071.0,United Kingdom
572298,2023-10-23,23555,Landmark Frame Notting Hill,23.06,1,14071.0,United Kingdom
572298,2023-10-23,23558,Landmark Frame London Bridge,23.06,1,14071.0,United Kingdom
572298,2023-10-23,23557,Landmark Frame Baker Street,23.06,1,14071.0,United Kingdom
572298,2023-10-23,23553,Landmark Frame Camden Town,23.06,1,14071.0,United Kingdom
572302,2023-10-23,23558,Landmark Frame London Bridge,23.06,1,15427.0,United Kingdom
572302,2023-10-23,23555,Landmark Frame Notting Hill,23.06,2,15427.0,United Kingdom
572302,2023-10-23,23554,Landmark Frame Oxford Street,23.06,1,15427.0,United Kingdom
572302,2023-10-23,23314,Vintage Christmas Tablecloth,23.06,1,15427.0,United Kingdom
572313,2023-10-23,23314,Vintage Christmas Tablecloth,23.06,1,14731.0,United Kingdom
572317,2023-10-23,23556,Landmark Frame Covent Garden,23.06,1,14629.0,United Kingdom
572317,2023-10-23,23554,Landmark Frame Oxford Street,23.06,1,14629.0,United Kingdom
572317,2023-10-23,23555,Landmark Frame Notting Hill,23.06,1,14629.0,United Kingdom
572317,2023-10-23,23557,Landmark Frame Baker Street,23.06,1,14629.0,United Kingdom
572317,2023-10-23,23553,Landmark Frame Camden Town,23.06,1,14629.0,United Kingdom
572307,2023-10-23,23085,Antique Silver Bauble Lamp,20.91,3,16905.0,United Kingdom
572307,2023-10-23,23085,Antique Silver Bauble Lamp,20.91,2,16905.0,United Kingdom
572277,2023-10-23,20914,Set/5 Red Retrospot Lid Glass Bowls,13.27,1,16768.0,United Kingdom
572277,2023-10-23,23300,Gardeners Kneeling Pad Cup Of Tea,11.94,2,16768.0,United Kingdom
572277,2023-10-23,22633,Hand Warmer Union Jack,12.4,2,16768.0,United Kingdom
572277,2023-10-23,22867,Hand Warmer Bird Design,12.4,2,16768.0,United Kingdom
572277,2023-10-23,22834,Hand Warmer Babushka Design,12.4,4,16768.0,United Kingdom
572277,2023-10-23,22866,Hand Warmer Scotty Dog Design,12.4,4,16768.0,United Kingdom
572277,2023-10-23,22693,Grow A Flytrap Or Sunflower In Tin,11.53,48,16768.0,United Kingdom
572277,2023-10-23,23078,Ice Cream Pen Lip Gloss,11.53,40,16768.0,United Kingdom
572277,2023-10-23,22121,Noel Wooden Block Letters,16.35,2,16768.0,United Kingdom
572278,2023-10-23,22692,Doormat Welcome To Our Home,18.71,2,16326.0,United Kingdom
572278,2023-10-23,48187,Doormat New England,18.71,2,16326.0,United Kingdom
572278,2023-10-23,23284,Doormat Keep Calm And Come In,18.71,3,16326.0,United Kingdom
572278,2023-10-23,23283,Doormat Vintage Leaf,18.71,3,16326.0,United Kingdom
572278,2023-10-23,48116,Doormat Multicolour Stripe,18.71,1,16326.0,United Kingdom
572278,2023-10-23,21524,Doormat Spotty Home Sweet Home,18.71,2,16326.0,United Kingdom
572278,2023-10-23,48173C,Doormat Black Flock,18.71,2,16326.0,United Kingdom
572278,2023-10-23,21523,Doormat Fancy Font Home Sweet Home,18.71,1,16326.0,United Kingdom
572278,2023-10-23,48129,Doormat Topiary,18.71,2,16326.0,United Kingdom
572278,2023-10-23,48184,Doormat English Rose,18.71,2,16326.0,United Kingdom
572278,2023-10-23,48111,Doormat 3 Smiley Cats,18.71,1,16326.0,United Kingdom
572278,2023-10-23,22866,Hand Warmer Scotty Dog Design,12.4,2,16326.0,United Kingdom
572278,2023-10-23,22867,Hand Warmer Bird Design,12.4,3,16326.0,United Kingdom
572278,2023-10-23,23439,Hand Warmer Red Love Heart,12.4,5,16326.0,United Kingdom
572278,2023-10-23,84347,Rotating Silver Angels T-Light Hldr,12.86,1,16326.0,United Kingdom
572278,2023-10-23,21494,Rotating Leaves T-Light Holder,11.53,2,16326.0,United Kingdom
572278,2023-10-23,21352,Eucalyptus & Pinecone Wreath,13.27,4,16326.0,United Kingdom
572279,2023-10-23,22380,Toy Tidy Spaceboy,12.4,3,16066.0,United Kingdom
572279,2023-10-23,22469,Heart Of Wicker Small,11.94,6,16066.0,United Kingdom
572279,2023-10-23,22694,Wicker Star,12.4,5,16066.0,United Kingdom
572279,2023-10-23,23301,Gardeners Kneeling Pad Keep Calm,11.94,5,16066.0,United Kingdom
572279,2023-10-23,22660,Doormat I Love London,18.71,1,16066.0,United Kingdom
572279,2023-10-23,23284,Doormat Keep Calm And Come In,18.71,5,16066.0,United Kingdom
572279,2023-10-23,22556,Plasters In Tin Circus Parade,11.94,1,16066.0,United Kingdom
572279,2023-10-23,17012C,Origami Lavender Incense/Candl Set,11.12,2,16066.0,United Kingdom
572279,2023-10-23,22557,Plasters In Tin Vintage Paisley,11.94,2,16066.0,United Kingdom
572279,2023-10-23,21787,Rain Poncho Retrospot,11.12,2,16066.0,United Kingdom
572279,2023-10-23,22138,Baking Set 9 Piece Retrospot,15.32,4,16066.0,United Kingdom
572279,2023-10-23,22271,Feltcraft Doll Rosie,13.27,1,16066.0,United Kingdom
572279,2023-10-23,22749,Feltcraft Princess Charlotte Doll,14.09,1,16066.0,United Kingdom
572279,2023-10-23,20969,Red Floral Feltcraft Shoulder Bag,14.09,2,16066.0,United Kingdom
572279,2023-10-23,23355,Hot Water Bottle Keep Calm,15.32,4,16066.0,United Kingdom
572279,2023-10-23,22114,Hot Water Bottle Tea And Sympathy,14.61,5,16066.0,United Kingdom
572279,2023-10-23,22359,Glass Jar Kings Choice,13.27,1,16066.0,United Kingdom
572279,2023-10-23,22362,Glass Jar Peacock Bath Salts,13.27,1,16066.0,United Kingdom
572279,2023-10-23,22361,Glass Jar Daisy Fresh Cotton Wool,13.27,1,16066.0,United Kingdom
572280,2023-10-23,84536A,English Rose Notebook A7 Size,10.68,6,16007.0,United Kingdom
572280,2023-10-23,20996,Jazz Hearts Address Book,10.44,5,16007.0,United Kingdom
572280,2023-10-23,20992,Jazz Hearts Purse Notebook,10.65,4,16007.0,United Kingdom
572280,2023-10-23,21212,Pack Of 72 Retrospot Cake Cases,10.81,2,16007.0,United Kingdom
572280,2023-10-23,21975,Pack Of 60 Dinosaur Cake Cases,10.81,2,16007.0,United Kingdom
572280,2023-10-23,23308,Set Of 60 Vintage Leaf Cake Cases,10.81,2,16007.0,United Kingdom
572280,2023-10-23,22951,60 Cake Cases Dolly Girl Design,10.81,2,16007.0,United Kingdom
572280,2023-10-23,21213,Pack Of 72 Skull Cake Cases,10.81,2,16007.0,United Kingdom
572280,2023-10-23,23307,Set Of 60 Pantry Design Cake Cases,10.81,2,16007.0,United Kingdom
572280,2023-10-23,84992,72 Sweetheart Fairy Cake Cases,10.81,2,16007.0,United Kingdom
572280,2023-10-23,21976,Pack Of 60 Mushroom Cake Cases,10.81,2,16007.0,United Kingdom
572280,2023-10-23,21989,Pack Of 20 Skull Paper Napkins,11.12,1,16007.0,United Kingdom
572280,2023-10-23,22795,Sweetheart Recipe Book Stand,17.17,2,16007.0,United Kingdom
572280,2023-10-23,21790,Vintage Snap Cards,11.12,4,16007.0,United Kingdom
572280,2023-10-23,23368,Set 12 Colour Pencils Dolly Girl,10.92,6,16007.0,United Kingdom
572280,2023-10-23,23366,Set 12 Colouring Pencils Doily,10.92,6,16007.0,United Kingdom
572280,2023-10-23,23367,Set 12 Colour Pencils Spaceboy,10.92,2,16007.0,United Kingdom
572280,2023-10-23,20974,12 Pencils Small Tube Skull,10.92,1,16007.0,United Kingdom
572280,2023-10-23,21262,White Goose Feather Christmas Tree,13.27,2,16007.0,United Kingdom
572280,2023-10-23,20975,12 Pencils Small Tube Red Retrospot,10.92,6,16007.0,United Kingdom
572280,2023-10-23,20973,12 Pencil Small Tube Woodland,10.92,2,16007.0,United Kingdom
572280,2023-10-23,20974,12 Pencils Small Tube Skull,10.92,2,16007.0,United Kingdom
572280,2023-10-23,23507,Mini Playing Cards Buffalo Bill,10.68,2,16007.0,United Kingdom
572280,2023-10-23,23509,Mini Playing Cards Fun Fair,10.68,2,16007.0,United Kingdom
572280,2023-10-23,23508,Mini Playing Cards Dolly Girl,10.68,2,16007.0,United Kingdom
572280,2023-10-23,23510,Mini Playing Cards Gymkhana,10.68,2,16007.0,United Kingdom
572280,2023-10-23,20973,12 Pencil Small Tube Woodland,10.92,4,16007.0,United Kingdom
572280,2023-10-23,22944,Christmas Metal Postcard With Bells,10.65,24,16007.0,United Kingdom
572280,2023-10-23,23354,6 Gift Tags 50'S Christmas,11.1,1,16007.0,United Kingdom
572280,2023-10-23,23335,Egg Frying Pan Ivory,12.38,1,16007.0,United Kingdom
572280,2023-10-23,23337,Egg Frying Pan Mint,12.38,1,16007.0,United Kingdom
572280,2023-10-23,23339,Egg Frying Pan Blue,12.38,1,16007.0,United Kingdom
572280,2023-10-23,23148,Miniature Antique Rose Hook Ivory,11.1,12,16007.0,United Kingdom
572280,2023-10-23,20974,12 Pencils Small Tube Skull,10.92,1,16007.0,United Kingdom
572280,2023-10-23,21902,Key Fob Front Door,10.92,8,16007.0,United Kingdom
572280,2023-10-23,23102,Silver Hearts Table Decoration,11.1,9,16007.0,United Kingdom
572280,2023-10-23,22730,Alarm Clock Bakelike Ivory,14.09,1,16007.0,United Kingdom
572280,2023-10-23,22729,Alarm Clock Bakelike Orange,14.09,1,16007.0,United Kingdom
572280,2023-10-23,22728,Alarm Clock Bakelike Pink,14.09,1,16007.0,United Kingdom
572280,2023-10-23,22726,Alarm Clock Bakelike Green,14.09,1,16007.0,United Kingdom
572280,2023-10-23,22621,Traditional Knitting Nancy,11.94,4,16007.0,United Kingdom
572280,2023-10-23,21892,Traditional Wooden Catch Cup Game,11.53,2,16007.0,United Kingdom
572280,2023-10-23,23470,Card Holder Love Bird Large,16.66,3,16007.0,United Kingdom
572280,2023-10-23,22356,Charlotte Bag Pink Polkadot,11.12,2,16007.0,United Kingdom
572280,2023-10-23,23204,Charlotte Bag Apples Design,11.12,2,16007.0,United Kingdom
572280,2023-10-23,22355,Charlotte Bag Suki Design,11.12,2,16007.0,United Kingdom
572280,2023-10-23,20724,Red Retrospot Charlotte Bag,11.12,2,16007.0,United Kingdom
572280,2023-10-23,20719,Woodland Charlotte Bag,11.12,2,16007.0,United Kingdom
572280,2023-10-23,20723,Strawberry Charlotte Bag,11.12,2,16007.0,United Kingdom
572280,2023-10-23,23205,Charlotte Bag Vintage Alphabet,11.12,2,16007.0,United Kingdom
572280,2023-10-23,22661,Charlotte Bag Dolly Girl Design,11.12,2,16007.0,United Kingdom
572280,2023-10-23,21992,Vintage Paisley Stationery Set,11.53,3,16007.0,United Kingdom
572280,2023-10-23,23354,6 Gift Tags 50'S Christmas,11.1,5,16007.0,United Kingdom
572280,2023-10-23,84535B,Fairy Cakes Notebook A6 Size,10.92,4,16007.0,United Kingdom
572280,2023-10-23,22646,Ceramic Strawberry Cake Money Bank,11.74,4,16007.0,United Kingdom
572280,2023-10-23,23191,Bundle Of 3 Retro Note Books,11.94,4,16007.0,United Kingdom
572280,2023-10-23,22549,Picture Dominoes,11.74,3,16007.0,United Kingdom
572280,2023-10-23,21993,Floral Folk Stationery Set,11.53,3,16007.0,United Kingdom
572280,2023-10-23,23300,Gardeners Kneeling Pad Cup Of Tea,11.94,6,16007.0,United Kingdom
572280,2023-10-23,23301,Gardeners Kneeling Pad Keep Calm,11.94,6,16007.0,United Kingdom
572280,2023-10-23,21791,Vintage Heads And Tails Card Game,11.53,4,16007.0,United Kingdom
572280,2023-10-23,22197,Popcorn Holder,11.12,6,16007.0,United Kingdom
572281,2023-10-23,23232,Wrap Vintage Leaf Design,10.68,25,17211.0,United Kingdom
572281,2023-10-23,84507C,Blue Circles Design Monkey Doll,12.86,5,17211.0,United Kingdom
572281,2023-10-23,22940,Feltcraft Christmas Fairy,14.61,4,17211.0,United Kingdom
572281,2023-10-23,23321,Small White Heart Of Wicker,11.94,6,17211.0,United Kingdom
572281,2023-10-23,23323,White Wicker Star,12.4,3,17211.0,United Kingdom
572281,2023-10-23,85123A,Cream Hanging Heart T-Light Holder,13.27,6,17211.0,United Kingdom
572281,2023-10-23,22435,Set Of 9 Heart Shaped Balloons,11.53,10,17211.0,United Kingdom
572281,2023-10-23,23101,Silver Stars Table Decoration,11.1,6,17211.0,United Kingdom
572281,2023-10-23,22600,Christmas Retrospot Star Wood,11.12,12,17211.0,United Kingdom
572281,2023-10-23,22980,Pantry Scrubbing Brush,11.94,1,17211.0,United Kingdom
572281,2023-10-23,22154,Angel Decoration 3 Buttons,10.68,20,17211.0,United Kingdom
572281,2023-10-23,22737,Ribbon Reel Christmas Present,11.94,5,17211.0,United Kingdom
572281,2023-10-23,22735,Ribbon Reel Socks And Mittens,11.94,5,17211.0,United Kingdom
572281,2023-10-23,22739,Ribbon Reel Christmas Sock Bauble,11.94,5,17211.0,United Kingdom
572281,2023-10-23,22086,Paper Chain Kit 50'S Christmas,13.27,10,17211.0,United Kingdom
572281,2023-10-23,22963,Jam Jar With Green Lid,11.12,6,17211.0,United Kingdom
572281,2023-10-23,23490,T-Light Holder Hanging Love Bird,14.09,6,17211.0,United Kingdom
572281,2023-10-23,84949,Silver Hanging T-Light Holder,11.94,6,17211.0,United Kingdom
572281,2023-10-23,23355,Hot Water Bottle Keep Calm,15.32,3,17211.0,United Kingdom
572281,2023-10-23,23357,Hot Water Bottle Sex Bomb,15.32,3,17211.0,United Kingdom
572281,2023-10-23,23356,Love Hot Water Bottle,16.35,3,17211.0,United Kingdom
572281,2023-10-23,22835,Hot Water Bottle I Am So Poorly,15.32,3,17211.0,United Kingdom
572281,2023-10-23,48194,Doormat Hearts,18.71,2,17211.0,United Kingdom
572281,2023-10-23,23284,Doormat Keep Calm And Come In,18.71,2,17211.0,United Kingdom
572281,2023-10-23,48187,Doormat New England,18.71,2,17211.0,United Kingdom
572281,2023-10-23,21955,Doormat Union Jack Guns And Roses,18.71,2,17211.0,United Kingdom
572281,2023-10-23,23283,Doormat Vintage Leaf,18.71,2,17211.0,United Kingdom
572281,2023-10-23,23344,Jumbo Bag 50'S Christmas,6.19,10,17211.0,United Kingdom
572282,2023-10-23,23501,Key Ring Baseball Boot Union Jack,11.53,10,17634.0,United Kingdom
572282,2023-10-23,84596B,Small Dolly Mix Design Orange Bowl,10.68,2,17634.0,United Kingdom
572282,2023-10-23,84596F,Small Marshmallows Pink Bowl,10.68,2,17634.0,United Kingdom
572282,2023-10-23,84380,Set Of 3 Butterfly Cookie Cutters,11.74,6,17634.0,United Kingdom
572282,2023-10-23,22993,Set Of 4 Pantry Jelly Moulds,11.53,2,17634.0,United Kingdom
572282,2023-10-23,22064,Pink Doughnut Trinket Pot,11.94,2,17634.0,United Kingdom
572282,2023-10-23,23469,Card Holder Love Bird Small,14.5,2,17634.0,United Kingdom
572282,2023-10-23,23470,Card Holder Love Bird Large,16.66,1,17634.0,United Kingdom
572282,2023-10-23,47559B,Tea Time Oven Glove,11.53,4,17634.0,United Kingdom
572282,2023-10-23,22197,Popcorn Holder,11.12,6,17634.0,United Kingdom
572282,2023-10-23,22067,Choc Truffle Gold Trinket Pot,11.94,2,17634.0,United Kingdom
572282,2023-10-23,21232,Strawberry Ceramic Trinket Pot,11.53,2,17634.0,United Kingdom
572282,2023-10-23,21242,Red Retrospot Plate,11.98,2,17634.0,United Kingdom
572282,2023-10-23,20676,Red Retrospot Bowl,11.53,2,17634.0,United Kingdom
572282,2023-10-23,22960,Jam Making Set With Jars,14.61,2,17634.0,United Kingdom
572282,2023-10-23,23404,Home Sweet Home Blackboard,15.32,2,17634.0,United Kingdom
572282,2023-10-23,23300,Gardeners Kneeling Pad Cup Of Tea,11.94,2,17634.0,United Kingdom
572282,2023-10-23,21367,Mirrored Wall Art Gents,11.02,3,17634.0,United Kingdom
572282,2023-10-23,21368,Mirrored Wall Art Ladies,11.02,2,17634.0,United Kingdom
572282,2023-10-23,22966,Gingerbread Man Cookie Cutter,11.53,5,17634.0,United Kingdom
572282,2023-10-23,22371,Airline Bag Vintage Tokyo 78,14.61,1,17634.0,United Kingdom
572282,2023-10-23,22961,Jam Making Set Printed,11.74,6,17634.0,United Kingdom
572282,2023-10-23,20914,Set/5 Red Retrospot Lid Glass Bowls,13.27,2,17634.0,United Kingdom
572282,2023-10-23,22720,Set Of 3 Cake Tins Pantry Design,15.32,1,17634.0,United Kingdom
572282,2023-10-23,22324,Blue Polkadot Kids Bag,12.25,2,17634.0,United Kingdom
572282,2023-10-23,20719,Woodland Charlotte Bag,11.12,2,17634.0,United Kingdom
572282,2023-10-23,20724,Red Retrospot Charlotte Bag,11.12,2,17634.0,United Kingdom
572282,2023-10-23,23205,Charlotte Bag Vintage Alphabet,11.12,2,17634.0,United Kingdom
572282,2023-10-23,22355,Charlotte Bag Suki Design,11.12,2,17634.0,United Kingdom
572282,2023-10-23,22356,Charlotte Bag Pink Polkadot,11.12,2,17634.0,United Kingdom
572283,2023-10-23,22119,Peace Wooden Block Letters,17.37,2,15000.0,United Kingdom
572283,2023-10-23,23542,Wall Art 70'S Alphabet,18.71,1,15000.0,United Kingdom
572283,2023-10-23,23541,Wall Art Classic Puddings,18.71,1,15000.0,United Kingdom
572283,2023-10-23,21755,Love Building Block Word,16.66,2,15000.0,United Kingdom
572283,2023-10-23,22121,Noel Wooden Block Letters,16.35,2,15000.0,United Kingdom
572283,2023-10-23,21754,Home Building Block Word,16.66,2,15000.0,United Kingdom
572283,2023-10-23,22118,Joy Wooden Block Letters,15.32,2,15000.0,United Kingdom
572283,2023-10-23,21380,Wooden Happy Birthday Garland,13.27,2,15000.0,United Kingdom
572283,2023-10-23,21808,Christmas Garland Stars Trees,14.09,3,15000.0,United Kingdom
572283,2023-10-23,22617,Baking Set Spaceboy Design,15.32,2,15000.0,United Kingdom
572283,2023-10-23,22271,Feltcraft Doll Rosie,13.27,1,15000.0,United Kingdom
572283,2023-10-23,22569,Feltcraft Cushion Butterfly,14.09,2,15000.0,United Kingdom
572283,2023-10-23,22568,Feltcraft Cushion Owl,14.09,2,15000.0,United Kingdom
572283,2023-10-23,47590B,Pink Happy Birthday Bunting,15.84,2,15000.0,United Kingdom
572283,2023-10-23,47590A,Blue Happy Birthday Bunting,15.84,2,15000.0,United Kingdom
572283,2023-10-23,21002,Rose Du Sud Drawstring Bag,14.61,2,15000.0,United Kingdom
572283,2023-10-23,21481,Fawn Blue Hot Water Bottle,14.09,2,15000.0,United Kingdom
572283,2023-10-23,23298,Spotty Bunting,15.32,2,15000.0,United Kingdom
572283,2023-10-23,21577,Save The Planet Cotton Tote Bag,12.56,2,15000.0,United Kingdom
572283,2023-10-23,21580,Rabbit Design Cotton Tote Bag,12.56,2,15000.0,United Kingdom
572283,2023-10-23,21484,Chick Grey Hot Water Bottle,14.61,2,15000.0,United Kingdom
572283,2023-10-23,22110,Bird House Hot Water Bottle,12.86,2,15000.0,United Kingdom
572283,2023-10-23,84030E,English Rose Hot Water Bottle,14.61,2,15000.0,United Kingdom
572283,2023-10-23,23390,Dolly Girl Mini Backpack,14.5,2,15000.0,United Kingdom
572283,2023-10-23,23388,Woodland Mini Backpack,14.5,2,15000.0,United Kingdom
572283,2023-10-23,23389,Spaceboy Mini Backpack,14.5,2,15000.0,United Kingdom
572283,2023-10-23,22430,Enamel Watering Can Cream,15.32,1,15000.0,United Kingdom
572283,2023-10-23,23395,Belle Jardiniere Cushion Cover,14.09,3,15000.0,United Kingdom
572283,2023-10-23,23394,Poste France Cushion Cover,14.09,3,15000.0,United Kingdom
572283,2023-10-23,23396,Le Jardin Botanique Cushion Cover,14.09,3,15000.0,United Kingdom
572283,2023-10-23,23393,Home Sweet Home Cushion Cover,14.09,3,15000.0,United Kingdom
572283,2023-10-23,23419,Home Sweet Home Bottle,12.38,2,15000.0,United Kingdom
572283,2023-10-23,23418,Lavender Toilette Bottle,12.38,2,15000.0,United Kingdom
572283,2023-10-23,21261,Green Goose Feather Christmas Tree,13.27,1,15000.0,United Kingdom
572283,2023-10-23,22867,Hand Warmer Bird Design,12.4,2,15000.0,United Kingdom
572283,2023-10-23,22866,Hand Warmer Scotty Dog Design,12.4,2,15000.0,United Kingdom
572283,2023-10-23,22865,Hand Warmer Owl Design,12.4,2,15000.0,United Kingdom
572283,2023-10-23,22945,Christmas Metal Tags Assorted,11.12,36,15000.0,United Kingdom
572283,2023-10-23,22578,Wooden Star Christmas Scandinavian,10.55,4,15000.0,United Kingdom
572283,2023-10-23,22078,Ribbon Reel Lace Design,12.4,2,15000.0,United Kingdom
572283,2023-10-23,22082,Ribbon Reel Stripes Design,11.94,2,15000.0,United Kingdom
572283,2023-10-23,22579,Wooden Tree Christmas Scandinavian,10.55,4,15000.0,United Kingdom
572283,2023-10-23,22577,Wooden Heart Christmas Scandinavian,10.55,4,15000.0,United Kingdom
572283,2023-10-23,22077,6 Ribbons Rustic Charm,12.25,2,15000.0,United Kingdom
572283,2023-10-23,85049A,Traditional Christmas Ribbons,11.53,3,15000.0,United Kingdom
572283,2023-10-23,22583,Pack Of 6 Handbag Gift Boxes,12.86,3,15000.0,United Kingdom
572283,2023-10-23,22582,Pack Of 6 Sweetie Gift Boxes,12.86,3,15000.0,United Kingdom
572283,2023-10-23,22585,Pack Of 6 Birdy Gift Tags,11.53,3,15000.0,United Kingdom
572283,2023-10-23,22584,Pack Of 6 Panettone Gift Boxes,12.86,3,15000.0,United Kingdom
572283,2023-10-23,85049G,Chocolate Box Ribbons,11.53,2,15000.0,United Kingdom
572283,2023-10-23,21824,Painted Metal Star With Holly Bells,10.65,3,15000.0,United Kingdom
572283,2023-10-23,21823,Painted Metal Heart With Holly Bell,10.65,3,15000.0,United Kingdom
572283,2023-10-23,22643,Set Of 4 Napkin Charms Leaves,12.86,2,15000.0,United Kingdom
572283,2023-10-23,22604,Set Of 4 Napkin Charms Cutlery,12.86,2,15000.0,United Kingdom
572283,2023-10-23,22138,Baking Set 9 Piece Retrospot,15.32,2,15000.0,United Kingdom
572283,2023-10-23,35970,Zinc Folkart Sleigh Bells,11.98,4,15000.0,United Kingdom
572283,2023-10-23,23265,Set Of 3 Wooden Tree Decorations,11.53,2,15000.0,United Kingdom
572283,2023-10-23,23266,Set Of 3 Wooden Stocking Decoration,11.53,2,15000.0,United Kingdom
572283,2023-10-23,23264,Set Of 3 Wooden Sleigh Decorations,11.53,2,15000.0,United Kingdom
572283,2023-10-23,23263,Set Of 3 Wooden Heart Decorations,11.53,2,15000.0,United Kingdom
572283,2023-10-23,23433,Hanging Quilted Patchwork Apples,11.1,6,15000.0,United Kingdom
572283,2023-10-23,84879,Assorted Colour Bird Ornament,11.98,4,15000.0,United Kingdom
572283,2023-10-23,23398,Hanging Heart Bonheur,11.12,2,15000.0,United Kingdom
572283,2023-10-23,21156,Retrospot Childrens Apron,12.25,2,15000.0,United Kingdom
572283,2023-10-23,47591D,Pink Fairy Cake Childrens Apron,12.25,2,15000.0,United Kingdom
572283,2023-10-23,21114,Lavender Scented Fabric Heart,11.53,10,15000.0,United Kingdom
572283,2023-10-23,22367,Childrens Apron Spaceboy Design,12.25,2,15000.0,United Kingdom
572283,2023-10-23,22899,Children's Apron Dolly Girl,12.4,2,15000.0,United Kingdom
572283,2023-10-23,22731,3d Christmas Stamps Stickers,11.53,2,15000.0,United Kingdom
572283,2023-10-23,22732,3d Vintage Christmas Stickers,11.53,2,15000.0,United Kingdom
572283,2023-10-23,22733,3d Traditional Christmas Stickers,11.53,2,15000.0,United Kingdom
572283,2023-10-23,22734,Set Of 6 Ribbons Vintage Christmas,13.21,2,15000.0,United Kingdom
572283,2023-10-23,23398,Hanging Heart Bonheur,11.12,1,15000.0,United Kingdom
572283,2023-10-23,23399,Home Sweet Home Hanging Heart,11.12,3,15000.0,United Kingdom
572283,2023-10-23,22090,Paper Bunting Retrospot,13.27,2,15000.0,United Kingdom
572283,2023-10-23,22089,Paper Bunting Vintage Paisley,13.27,2,15000.0,United Kingdom
572283,2023-10-23,21034,Rex Cash+Carry Jumbo Shopper,11.22,3,15000.0,United Kingdom
572284,2023-10-23,22483,Red Gingham Teddy Bear,13.27,1,16744.0,United Kingdom
572284,2023-10-23,21770,Open Closed Metal Sign,15.32,1,16744.0,United Kingdom
572284,2023-10-23,22110,Bird House Hot Water Bottle,12.86,2,16744.0,United Kingdom
572284,2023-10-23,21452,Toadstool Money Box,13.27,3,16744.0,United Kingdom
572284,2023-10-23,22173,Metal 4 Hook Hanger French Chateau,13.62,1,16744.0,United Kingdom
572284,2023-10-23,21389,Ivory Hanging Decoration Bird,11.12,6,16744.0,United Kingdom
572284,2023-10-23,22991,Giraffe Wooden Ruler,12.25,4,16744.0,United Kingdom
572284,2023-10-23,21114,Lavender Scented Fabric Heart,11.53,5,16744.0,United Kingdom
572284,2023-10-23,85017B,Envelope 50 Blossom Images,10.68,1,16744.0,United Kingdom
572284,2023-10-23,23138,Single Wire Hook Ivory Heart,11.74,3,16744.0,United Kingdom
572284,2023-10-23,21891,Traditional Wooden Skipping Rope,11.74,3,16744.0,United Kingdom
572284,2023-10-23,22619,Set Of 6 Soldier Skittles,14.09,3,16744.0,United Kingdom
572284,2023-10-23,23528,Wall Art Spaceboy,14.09,1,16744.0,United Kingdom
572284,2023-10-23,23529,Wall Art Dolly Girl,14.09,1,16744.0,United Kingdom
572284,2023-10-23,22138,Baking Set 9 Piece Retrospot,15.32,2,16744.0,United Kingdom
572284,2023-10-23,21704,Bag 250g Swirly Marbles,11.12,3,16744.0,United Kingdom
572284,2023-10-23,22534,Magic Drawing Slate Spaceboy,10.68,6,16744.0,United Kingdom
572284,2023-10-23,22530,Magic Drawing Slate Dolly Girl,10.68,6,16744.0,United Kingdom
572284,2023-10-23,23368,Set 12 Colour Pencils Dolly Girl,10.92,10,16744.0,United Kingdom
572284,2023-10-23,23367,Set 12 Colour Pencils Spaceboy,10.92,10,16744.0,United Kingdom
