TransactionNo,Date,ProductNo,ProductName,Price,Quantity,CustomerNo,Country
577132,2023-11-18,84078A,Set/4 White Retro Storage Cubes,51.2,2,13599.0,United Kingdom
577358,2023-11-18,22838,3 Tier Cake Tin Red And Cream,40.11,1,12358.0,Austria
577358,2023-11-18,22839,3 Tier Cake Tin Green And Cream,40.11,1,12358.0,Austria
577217,2023-11-18,23485,Botanical Gardens Wall Clock,35.88,1,17324.0,United Kingdom
577359,2023-11-18,23485,Botanical Gardens Wall Clock,35.88,1,14903.0,United Kingdom
577150,2023-11-18,22423,Regency Cakestand 3 Tier,35.83,13,14150.0,United Kingdom
577358,2023-11-18,23553,Landmark Frame Camden Town,35.83,1,12358.0,Austria
577358,2023-11-18,23554,Landmark Frame Oxford Street,35.83,1,12358.0,Austria
577358,2023-11-18,23558,Landmark Frame London Bridge,35.83,1,12358.0,Austria
577180,2023-11-18,22504,Cabin Bag Vintage Retrospot,35.82,6,12380.0,Belgium
577165,2023-11-18,23485,Botanical Gardens Wall Clock,31.57,4,13171.0,United Kingdom
577358,2023-11-18,23143,Zinc Wire Kitchen Organiser,31.56,1,12358.0,Austria
577358,2023-11-18,23397,Foot Stool Home Sweet Home,30.71,1,12358.0,Austria
577358,2023-11-18,21630,Floor Cushion Elephant Carnival,29.0,1,12358.0,Austria
577150,2023-11-18,79321,Chilli Lights,28.58,1,14150.0,United Kingdom
577174,2023-11-18,22946,Wooden Advent Calendar Cream,27.62,1,17841.0,United Kingdom
577228,2023-11-18,23008,Dolly Girl Baby Gift Set,27.62,1,12391.0,Cyprus
577150,2023-11-18,22111,Scottie Dog Hot Water Bottle,27.34,1,14150.0,United Kingdom
577158,2023-11-18,23486,Antique Heart Shelf Unit,27.32,1,16293.0,United Kingdom
577359,2023-11-18,23486,Antique Heart Shelf Unit,27.32,1,14903.0,United Kingdom
577150,2023-11-18,22941,Christmas Lights 10 Reindeer,27.3,3,14150.0,United Kingdom
577150,2023-11-18,22942,Christmas Lights 10 Santas,27.3,1,14150.0,United Kingdom
577358,2023-11-18,22169,Family Album White Picture Frame,27.3,1,12358.0,Austria
577358,2023-11-18,22193,Red Diner Wall Clock,27.3,1,12358.0,Austria
577358,2023-11-18,22627,Mint Kitchen Scales,27.3,1,12358.0,Austria
577358,2023-11-18,22687,Doormat Christmas Village,27.3,1,12358.0,Austria
577358,2023-11-18,22689,Doormat Merry Christmas Red,27.3,1,12358.0,Austria
577358,2023-11-18,22941,Christmas Lights 10 Reindeer,27.3,1,12358.0,Austria
577358,2023-11-18,23080,Red Metal Box Top Secret,27.3,1,12358.0,Austria
577358,2023-11-18,23081,Green Metal Box Army Supplies,27.3,3,12358.0,Austria
577358,2023-11-18,23407,Set Of 2 Trays Home Sweet Home,27.3,1,12358.0,Austria
577358,2023-11-18,23284,Doormat Keep Calm And Come In,26.43,1,12358.0,Austria
577358,2023-11-18,48184,Doormat English Rose,26.43,1,12358.0,Austria
577358,2023-11-18,20685,Doormat Red Retrospot,26.43,2,12358.0,Austria
577358,2023-11-18,23112,Parisienne Curio Cabinet,25.58,1,12358.0,Austria
577314,2023-11-18,22847,Bread Bin Diner Style Ivory,25.57,4,12444.0,Norway
577316,2023-11-18,22847,Bread Bin Diner Style Ivory,25.57,4,12578.0,Italy
577331,2023-11-18,23458,Dolly Cabinet 3 Drawers,25.57,2,14667.0,United Kingdom
577150,2023-11-18,84029E,Red Woolly Hottie White Heart,23.71,1,14150.0,United Kingdom
577133,2023-11-18,21340,Classic Metal Birdcage Plant Holder,23.32,1,13962.0,United Kingdom
577143,2023-11-18,22424,Enamel Bread Bin Cream,23.32,2,13200.0,United Kingdom
577158,2023-11-18,85066,Cream Sweetheart Mini Chest,23.32,2,16293.0,United Kingdom
577174,2023-11-18,22423,Regency Cakestand 3 Tier,23.32,1,17841.0,United Kingdom
577286,2023-11-18,84968A,Set Of 16 Vintage Rose Cutlery,23.32,2,14606.0,United Kingdom
577286,2023-11-18,22526,Wheelbarrow For Children,23.32,1,14606.0,United Kingdom
577302,2023-11-18,22485,Set Of 2 Wooden Market Crates,23.32,2,17904.0,United Kingdom
577308,2023-11-18,22423,Regency Cakestand 3 Tier,23.32,2,15088.0,United Kingdom
577312,2023-11-18,85066,Cream Sweetheart Mini Chest,23.32,2,17049.0,United Kingdom
577316,2023-11-18,22423,Regency Cakestand 3 Tier,23.32,1,12578.0,Italy
577331,2023-11-18,85066,Cream Sweetheart Mini Chest,23.32,2,14667.0,United Kingdom
577344,2023-11-18,22236,Cake Stand 3 Tier Magic Garden,23.32,3,12437.0,France
577344,2023-11-18,22423,Regency Cakestand 3 Tier,23.32,3,12437.0,France
577355,2023-11-18,22423,Regency Cakestand 3 Tier,23.32,2,14911.0,EIRE
C577147,2023-11-18,22423,Regency Cakestand 3 Tier,23.32,-1,13396.0,United Kingdom
C577323,2023-11-18,22485,Set Of 2 Wooden Market Crates,23.32,-1,17904.0,United Kingdom
C577388,2023-11-18,22423,Regency Cakestand 3 Tier,23.32,-1,14911.0,EIRE
C577397,2023-11-18,22236,Cake Stand 3 Tier Magic Garden,23.32,-1,12504.0,Germany
C577398,2023-11-18,21340,Classic Metal Birdcage Plant Holder,23.32,-1,16839.0,United Kingdom
577217,2023-11-18,23094,Le Grand Tray Chic Set,23.06,1,17324.0,United Kingdom
577217,2023-11-18,23553,Landmark Frame Camden Town,23.06,1,17324.0,United Kingdom
577217,2023-11-18,23558,Landmark Frame London Bridge,23.06,2,17324.0,United Kingdom
577235,2023-11-18,23556,Landmark Frame Covent Garden,23.06,3,14367.0,United Kingdom
577337,2023-11-18,23314,Vintage Christmas Tablecloth,23.06,1,15494.0,United Kingdom
C577327,2023-11-18,23065,Large Deco Jewellery Stand,23.06,-1,17779.0,United Kingdom
C577375,2023-11-18,23111,Parisienne Sewing Box,23.06,-1,14441.0,United Kingdom
577150,2023-11-18,22111,Scottie Dog Hot Water Bottle,23.02,4,14150.0,United Kingdom
577150,2023-11-18,22112,Chocolate Hot Water Bottle,23.02,11,14150.0,United Kingdom
577150,2023-11-18,22835,Hot Water Bottle I Am So Poorly,23.02,3,14150.0,United Kingdom
577150,2023-11-18,23356,Love Hot Water Bottle,23.02,1,14150.0,United Kingdom
577150,2023-11-18,79321,Chilli Lights,23.02,29,14150.0,United Kingdom
577358,2023-11-18,22845,Vintage Cream Cat Food Container,23.02,1,12358.0,Austria
577358,2023-11-18,22928,Yellow Giant Garden Thermometer,23.02,1,12358.0,Austria
577358,2023-11-18,23132,Small Ivory Heart Wall Organiser,23.02,1,12358.0,Austria
577358,2023-11-18,23526,Wall Art Dog Licence,23.02,1,12358.0,Austria
577358,2023-11-18,23534,Wall Art Stop For Tea,23.02,2,12358.0,Austria
577358,2023-11-18,23535,Wall Art Bicycle Safety,23.02,5,12358.0,Austria
577358,2023-11-18,79321,Chilli Lights,23.02,1,12358.0,Austria
577358,2023-11-18,21128,Gold Fishing Gnome,23.02,1,12358.0,Austria
577150,2023-11-18,21485,Retrospot Heart Hot Water Bottle,22.77,2,14150.0,United Kingdom
577150,2023-11-18,22725,Alarm Clock Bakelike Chocolate,22.77,1,14150.0,United Kingdom
577170,2023-11-18,22622,Box Of Vintage Alphabet Blocks,22.5,2,13456.0,United Kingdom
577358,2023-11-18,22121,Noel Wooden Block Letters,22.17,1,12358.0,Austria
577393,2023-11-18,23020,Glass Songbird Storage Jar,21.68,8,14031.0,United Kingdom
577168,2023-11-18,22423,Regency Cakestand 3 Tier,21.47,56,12603.0,Germany
577357,2023-11-18,22423,Regency Cakestand 3 Tier,21.47,16,13098.0,United Kingdom
577393,2023-11-18,22423,Regency Cakestand 3 Tier,21.47,16,14031.0,United Kingdom
577150,2023-11-18,22943,Christmas Lights 10 Vintage Baubles,21.31,1,14150.0,United Kingdom
577150,2023-11-18,23298,Spotty Bunting,21.31,11,14150.0,United Kingdom
577150,2023-11-18,47566,Party Bunting,21.31,12,14150.0,United Kingdom
577358,2023-11-18,22112,Chocolate Hot Water Bottle,21.31,3,12358.0,Austria
577358,2023-11-18,22138,Baking Set 9 Piece Retrospot,21.31,2,12358.0,Austria
577358,2023-11-18,22139,Retrospot Tea Set Ceramic 11 Pc,21.31,1,12358.0,Austria
577358,2023-11-18,22617,Baking Set Spaceboy Design,21.31,1,12358.0,Austria
577358,2023-11-18,22720,Set Of 3 Cake Tins Pantry Design,21.31,1,12358.0,Austria
577358,2023-11-18,23008,Dolly Girl Baby Gift Set,21.31,1,12358.0,Austria
577358,2023-11-18,23009,I Love London Baby Gift Set,21.31,1,12358.0,Austria
577358,2023-11-18,23010,Circus Parade Baby Gift Set,21.31,1,12358.0,Austria
577358,2023-11-18,23126,Feltcraft Girl Amelie Kit,21.31,1,12358.0,Austria
577358,2023-11-18,23245,Set Of 3 Regency Cake Tins,21.31,3,12358.0,Austria
577358,2023-11-18,23396,Le Jardin Botanique Cushion Cover,21.31,2,12358.0,Austria
577358,2023-11-18,23413,Decorative Vintage Coffee Box,21.31,1,12358.0,Austria
577358,2023-11-18,23424,Gingham Recipe Book Box,21.31,1,12358.0,Austria
577319,2023-11-18,23085,Antique Silver Bauble Lamp,20.91,1,17301.0,United Kingdom
577319,2023-11-18,23085,Antique Silver Bauble Lamp,20.91,1,17301.0,United Kingdom
577319,2023-11-18,23085,Antique Silver Bauble Lamp,20.91,1,17301.0,United Kingdom
577355,2023-11-18,23085,Antique Silver Bauble Lamp,20.91,2,14911.0,EIRE
577365,2023-11-18,23085,Antique Silver Bauble Lamp,20.91,4,17063.0,United Kingdom
577150,2023-11-18,21481,Fawn Blue Hot Water Bottle,20.8,1,14150.0,United Kingdom
577358,2023-11-18,22222,Cake Plate Lovebird White,20.46,1,12358.0,Austria
577132,2023-11-18,79321,Chilli Lights,16.14,4,13599.0,United Kingdom
577132,2023-11-18,21137,Black Record Cover Frame,13.72,24,13599.0,United Kingdom
577133,2023-11-18,85015,Set Of 12 Vintage Postcard Set,10.92,24,13962.0,United Kingdom
577133,2023-11-18,22151,Place Setting White Heart,10.68,24,13962.0,United Kingdom
577133,2023-11-18,84879,Assorted Colour Bird Ornament,11.98,8,13962.0,United Kingdom
577134,2023-11-18,23355,Hot Water Bottle Keep Calm,14.5,48,14434.0,United Kingdom
577134,2023-11-18,23284,Doormat Keep Calm And Come In,17.51,20,14434.0,United Kingdom
577135,2023-11-18,23084,Rabbit Night Light,12.08,24,12427.0,Germany
577135,2023-11-18,22634,Childs Breakfast Set Spaceboy,18.96,8,12427.0,Germany
577135,2023-11-18,21328,Balloons Writing Set,11.94,12,12427.0,Germany
577135,2023-11-18,84598,Boys Alphabet Iron On Patches,10.47,288,12427.0,Germany
577135,2023-11-18,23348,Childrens Toy Cooking Utensil Set,12.38,6,12427.0,Germany
577136,2023-11-18,22112,Chocolate Hot Water Bottle,14.61,24,17163.0,United Kingdom
577136,2023-11-18,22113,Grey Heart Hot Water Bottle,14.61,16,17163.0,United Kingdom
577137,2023-11-18,21137,Black Record Cover Frame,13.72,96,14110.0,United Kingdom
577138,2023-11-18,20936,Forked Cactus Candle,13.27,6,13079.0,United Kingdom
577139,2023-11-18,23480,Mini Lights Woodland Mushrooms,14.09,4,16500.0,United Kingdom
577139,2023-11-18,22792,Fluted Antique Candle Holder,11.12,12,16500.0,United Kingdom
577139,2023-11-18,22086,Paper Chain Kit 50'S Christmas,13.27,6,16500.0,United Kingdom
577140,2023-11-18,23569,Tradtional Alphabet Stamp Set,15.32,4,13269.0,United Kingdom
577140,2023-11-18,23382,Box Of 6 Christmas Cake Decorations,14.09,4,13269.0,United Kingdom
577140,2023-11-18,23581,Jumbo Bag Paisley Park,6.19,10,13269.0,United Kingdom
577141,2023-11-18,23382,Box Of 6 Christmas Cake Decorations,14.09,4,13269.0,United Kingdom
577141,2023-11-18,22941,Christmas Lights 10 Reindeer,18.96,4,13269.0,United Kingdom
577141,2023-11-18,22952,60 Cake Cases Vintage Christmas,10.81,24,13269.0,United Kingdom
577141,2023-11-18,23084,Rabbit Night Light,12.38,6,13269.0,United Kingdom
577141,2023-11-18,21212,Pack Of 72 Retrospot Cake Cases,10.81,24,13269.0,United Kingdom
577141,2023-11-18,22555,Plasters In Tin Strongman,11.94,12,13269.0,United Kingdom
577141,2023-11-18,23349,Roll Wrap Vintage Christmas,11.53,12,13269.0,United Kingdom
577141,2023-11-18,23350,Roll Wrap Vintage Spot,11.53,12,13269.0,United Kingdom
577141,2023-11-18,23546,Wrap Paisley Park,10.68,25,13269.0,United Kingdom
577141,2023-11-18,21787,Rain Poncho Retrospot,11.12,24,13269.0,United Kingdom
577141,2023-11-18,22041,"Record Frame 7"" Single Size",12.86,6,13269.0,United Kingdom
577141,2023-11-18,23312,Vintage Christmas Gift Sack,14.5,4,13269.0,United Kingdom
577141,2023-11-18,22666,Recipe Box Pantry Yellow Design,13.27,6,13269.0,United Kingdom
577141,2023-11-18,23328,Set 6 School Milk Bottles In Crate,13.72,24,13269.0,United Kingdom
577141,2023-11-18,22752,Set 7 Babushka Nesting Boxes,18.96,4,13269.0,United Kingdom
577141,2023-11-18,22629,Spaceboy Lunch Box,12.25,12,13269.0,United Kingdom
577141,2023-11-18,22551,Plasters In Tin Spaceboy,11.94,12,13269.0,United Kingdom
577141,2023-11-18,22630,Dolly Girl Lunch Box,12.25,12,13269.0,United Kingdom
577141,2023-11-18,22961,Jam Making Set Printed,11.74,12,13269.0,United Kingdom
577141,2023-11-18,22993,Set Of 4 Pantry Jelly Moulds,11.53,12,13269.0,United Kingdom
577141,2023-11-18,23480,Mini Lights Woodland Mushrooms,14.09,4,13269.0,United Kingdom
577141,2023-11-18,23497,Classic Chrome Bicycle Bell,11.74,12,13269.0,United Kingdom
577141,2023-11-18,23535,Wall Art Bicycle Safety,16.35,4,13269.0,United Kingdom
577141,2023-11-18,85099B,Jumbo Bag Red Retrospot,6.19,10,13269.0,United Kingdom
577141,2023-11-18,23343,Jumbo Bag Vintage Christmas,6.19,10,13269.0,United Kingdom
577141,2023-11-18,23436,Vintage Christmas Gift Bag Large,5.77,12,13269.0,United Kingdom
577141,2023-11-18,22821,Gift Bag Psychedelic Apples,5.46,12,13269.0,United Kingdom
577142,2023-11-18,22131,Food Container Set 3 Love Heart,12.25,12,13985.0,United Kingdom
577142,2023-11-18,23348,Childrens Toy Cooking Utensil Set,12.38,12,13985.0,United Kingdom
577142,2023-11-18,22139,Retrospot Tea Set Ceramic 11 Pc,15.32,9,13985.0,United Kingdom
577142,2023-11-18,22348,Tea Bag Plate Red Retrospot,11.12,12,13985.0,United Kingdom
577142,2023-11-18,21238,Red Retrospot Cup,11.12,8,13985.0,United Kingdom
577142,2023-11-18,21240,Blue Polkadot Cup,11.12,8,13985.0,United Kingdom
577142,2023-11-18,21239,Pink Polkadot Cup,11.12,8,13985.0,United Kingdom
577142,2023-11-18,21559,Strawberry Lunch Box With Cutlery,12.86,12,13985.0,United Kingdom
577142,2023-11-18,21558,Skull Lunch Box With Cutlery,12.86,6,13985.0,United Kingdom
577142,2023-11-18,23311,Vintage Christmas Stocking,12.86,6,13985.0,United Kingdom
577142,2023-11-18,23312,Vintage Christmas Gift Sack,14.5,8,13985.0,United Kingdom
577142,2023-11-18,21790,Vintage Snap Cards,11.12,12,13985.0,United Kingdom
577142,2023-11-18,82494L,Wooden Frame Antique White,13.27,6,13985.0,United Kingdom
577142,2023-11-18,21731,Red Toadstool Led Night Light,11.94,12,13985.0,United Kingdom
577142,2023-11-18,23203,Jumbo Bag Vintage Doily,6.19,10,13985.0,United Kingdom
577142,2023-11-18,23582,Vintage Doily Jumbo Bag Red,6.19,10,13985.0,United Kingdom
577142,2023-11-18,23343,Jumbo Bag Vintage Christmas,6.19,10,13985.0,United Kingdom
577142,2023-11-18,23681,Lunch Bag Red Vintage Doily,5.97,10,13985.0,United Kingdom
577143,2023-11-18,22456,Natural Slate Chalkboard Large,15.32,3,13200.0,United Kingdom
577143,2023-11-18,22792,Fluted Antique Candle Holder,11.12,24,13200.0,United Kingdom
577143,2023-11-18,21326,Aged Glass Silver T-Light Holder,10.92,12,13200.0,United Kingdom
577143,2023-11-18,22429,Enamel Measuring Jug Cream,14.61,4,13200.0,United Kingdom
577143,2023-11-18,22425,Enamel Colander Cream,15.32,3,13200.0,United Kingdom
577143,2023-11-18,84946,Antique Silver T-Light Glass,11.53,12,13200.0,United Kingdom
577143,2023-11-18,23084,Rabbit Night Light,12.38,6,13200.0,United Kingdom
577143,2023-11-18,22426,Enamel Wash Bowl Cream,14.09,4,13200.0,United Kingdom
577146,2023-11-18,20750,Red Retrospot Mini Cases,18.4,2,16414.0,United Kingdom
577146,2023-11-18,23491,Vintage Jingle Bells Heart,18.71,4,16414.0,United Kingdom
577146,2023-11-18,23067,Hanging Engraved Metal Heart,14.5,4,16414.0,United Kingdom
577148,2023-11-18,72741,Grand Chocolatecandle,11.53,72,13941.0,United Kingdom
577148,2023-11-18,79302M,Art Lights Funk Monkey,13.27,6,13941.0,United Kingdom
577148,2023-11-18,22179,Set 10 Night Owl Lights,16.35,24,13941.0,United Kingdom
577148,2023-11-18,79321,Chilli Lights,15.32,72,13941.0,United Kingdom
577148,2023-11-18,21731,Red Toadstool Led Night Light,11.94,96,13941.0,United Kingdom
577148,2023-11-18,23480,Mini Lights Woodland Mushrooms,13.62,96,13941.0,United Kingdom
577148,2023-11-18,85174,S/4 Cacti Candles,14.61,16,13941.0,United Kingdom
577148,2023-11-18,20931,Blue Pot Plant Candle,13.27,12,13941.0,United Kingdom
577148,2023-11-18,85175,Cacti T-Light Candles,10.62,192,13941.0,United Kingdom
577150,2023-11-18,20675,Blue Polkadot Bowl,12.77,10,14150.0,United Kingdom
577150,2023-11-18,20677,Pink Polkadot Bowl,12.77,3,14150.0,United Kingdom
577150,2023-11-18,20719,Woodland Charlotte Bag,12.77,71,14150.0,United Kingdom
577150,2023-11-18,20723,Strawberry Charlotte Bag,12.77,25,14150.0,United Kingdom
577150,2023-11-18,20724,Red Retrospot Charlotte Bag,12.77,126,14150.0,United Kingdom
577150,2023-11-18,21154,Red Retrospot Oven Glove,13.62,20,14150.0,United Kingdom
577150,2023-11-18,21155,Red Retrospot Peg Bag,15.33,4,14150.0,United Kingdom
577150,2023-11-18,21212,Pack Of 72 Retrospot Cake Cases,12.38,35,14150.0,United Kingdom
577150,2023-11-18,21213,Pack Of 72 Skull Cake Cases,12.38,26,14150.0,United Kingdom
577150,2023-11-18,21238,Red Retrospot Cup,11.92,4,14150.0,United Kingdom
577150,2023-11-18,21239,Pink Polkadot Cup,11.92,6,14150.0,United Kingdom
577150,2023-11-18,21240,Blue Polkadot Cup,11.92,7,14150.0,United Kingdom
577150,2023-11-18,21242,Red Retrospot Plate,13.62,3,14150.0,United Kingdom
577150,2023-11-18,21243,Pink Polkadot Plate,13.62,3,14150.0,United Kingdom
577150,2023-11-18,21244,Blue Polkadot Plate,13.62,3,14150.0,United Kingdom
577150,2023-11-18,21479,White Skull Hot Water Bottle,19.61,36,14150.0,United Kingdom
577150,2023-11-18,21481,Fawn Blue Hot Water Bottle,18.75,2,14150.0,United Kingdom
577150,2023-11-18,21484,Chick Grey Hot Water Bottle,19.61,5,14150.0,United Kingdom
577150,2023-11-18,21485,Retrospot Heart Hot Water Bottle,17.9,1,14150.0,United Kingdom
577150,2023-11-18,21668,Red Stripe Ceramic Drawer Knob,13.62,2,14150.0,United Kingdom
577150,2023-11-18,21671,Red Spot Ceramic Drawer Knob,13.62,1,14150.0,United Kingdom
577150,2023-11-18,21672,White Spot Red Ceramic Drawer Knob,13.62,1,14150.0,United Kingdom
577150,2023-11-18,22086,Paper Chain Kit 50'S Christmas,17.05,86,14150.0,United Kingdom
577150,2023-11-18,22110,Bird House Hot Water Bottle,16.18,3,14150.0,United Kingdom
577150,2023-11-18,22113,Grey Heart Hot Water Bottle,19.61,4,14150.0,United Kingdom
577150,2023-11-18,22114,Hot Water Bottle Tea And Sympathy,19.61,50,14150.0,United Kingdom
577150,2023-11-18,22197,Popcorn Holder,12.77,94,14150.0,United Kingdom
577150,2023-11-18,22327,Round Snack Boxes Set Of 4 Skulls,17.05,6,14150.0,United Kingdom
577150,2023-11-18,22355,Charlotte Bag Suki Design,12.77,219,14150.0,United Kingdom
577150,2023-11-18,22356,Charlotte Bag Pink Polkadot,12.77,7,14150.0,United Kingdom
577150,2023-11-18,22426,Enamel Wash Bowl Cream,18.75,1,14150.0,United Kingdom
577150,2023-11-18,22631,Circus Parade Lunch Box,15.33,3,14150.0,United Kingdom
577150,2023-11-18,22645,Ceramic Heart Fairy Cake Money Bank,14.48,1,14150.0,United Kingdom
577150,2023-11-18,22665,Recipe Box Blue Sketchbook Design,17.05,11,14150.0,United Kingdom
577150,2023-11-18,22725,Alarm Clock Bakelike Chocolate,18.75,2,14150.0,United Kingdom
577150,2023-11-18,22726,Alarm Clock Bakelike Green,18.75,20,14150.0,United Kingdom
577150,2023-11-18,22727,Alarm Clock Bakelike Red,18.75,9,14150.0,United Kingdom
577150,2023-11-18,22729,Alarm Clock Bakelike Orange,18.75,5,14150.0,United Kingdom
577150,2023-11-18,22730,Alarm Clock Bakelike Ivory,18.75,2,14150.0,United Kingdom
577150,2023-11-18,22731,3d Christmas Stamps Stickers,11.92,14,14150.0,United Kingdom
577150,2023-11-18,22735,Ribbon Reel Socks And Mittens,14.48,2,14150.0,United Kingdom
577150,2023-11-18,22735,Ribbon Reel Socks And Mittens,17.94,1,14150.0,United Kingdom
577150,2023-11-18,22736,Ribbon Reel Making Snowmen,14.48,2,14150.0,United Kingdom
577150,2023-11-18,22737,Ribbon Reel Christmas Present,14.48,1,14150.0,United Kingdom
577150,2023-11-18,22737,Ribbon Reel Christmas Present,17.94,1,14150.0,United Kingdom
577150,2023-11-18,22738,Ribbon Reel Snowy Village,14.48,2,14150.0,United Kingdom
577150,2023-11-18,22745,Poppy's Playhouse Bedroom,13.62,1,14150.0,United Kingdom
577150,2023-11-18,22746,Poppy's Playhouse Livingroom,13.62,1,14150.0,United Kingdom
577150,2023-11-18,22772,Pink Drawer Knob Acrylic Edwardian,13.62,3,14150.0,United Kingdom
577150,2023-11-18,22834,Hand Warmer Babushka Design,15.33,3,14150.0,United Kingdom
577150,2023-11-18,22896,Peg Bag Apples Design,16.18,2,14150.0,United Kingdom
577150,2023-11-18,22898,Childrens Apron Apples Design,15.33,6,14150.0,United Kingdom
577150,2023-11-18,22910,Paper Chain Kit Vintage Christmas,17.05,12,14150.0,United Kingdom
577150,2023-11-18,22952,60 Cake Cases Vintage Christmas,12.38,42,14150.0,United Kingdom
577150,2023-11-18,23084,Rabbit Night Light,15.33,48,14150.0,United Kingdom
577150,2023-11-18,23168,Classic Cafe Sugar Dispenser,13.62,6,14150.0,United Kingdom
577150,2023-11-18,23204,Charlotte Bag Apples Design,12.77,31,14150.0,United Kingdom
577150,2023-11-18,23205,Charlotte Bag Vintage Alphabet,12.77,26,14150.0,United Kingdom
577150,2023-11-18,23355,Hot Water Bottle Keep Calm,18.75,2,14150.0,United Kingdom
577150,2023-11-18,35970,Zinc Folkart Sleigh Bells,14.48,12,14150.0,United Kingdom
577150,2023-11-18,82583,Hot Baths Metal Sign,15.33,16,14150.0,United Kingdom
577150,2023-11-18,84029E,Red Woolly Hottie White Heart,19.61,19,14150.0,United Kingdom
577150,2023-11-18,84030E,English Rose Hot Water Bottle,19.61,2,14150.0,United Kingdom
577150,2023-11-18,84347,Rotating Silver Angels T-Light Hldr,16.18,41,14150.0,United Kingdom
577150,2023-11-18,84692,Box Of 24 Cocktail Parasols,11.92,4,14150.0,United Kingdom
577150,2023-11-18,84997B,Childrens Cutlery Retrospot Red,18.75,16,14150.0,United Kingdom
577150,2023-11-18,84997C,Childrens Cutlery Polkadot Blue,18.75,7,14150.0,United Kingdom
577150,2023-11-18,84997D,Childrens Cutlery Polkadot Pink,18.75,15,14150.0,United Kingdom
577150,2023-11-18,85049G,Chocolate Box Ribbons,12.77,3,14150.0,United Kingdom
577150,2023-11-18,20725,Lunch Bag Red Retrospot,7.67,42,14150.0,United Kingdom
577150,2023-11-18,20726,Lunch Bag Woodland,7.67,12,14150.0,United Kingdom
577150,2023-11-18,20727,Lunch Bag Black Skull,7.67,17,14150.0,United Kingdom
577150,2023-11-18,20728,Lunch Bag Cars Blue,7.67,13,14150.0,United Kingdom
577150,2023-11-18,22382,Lunch Bag Spaceboy Design,7.67,4,14150.0,United Kingdom
577150,2023-11-18,22383,Lunch Bag Suki Design,7.67,9,14150.0,United Kingdom
577150,2023-11-18,23206,Lunch Bag Apple Design,7.67,5,14150.0,United Kingdom
577150,2023-11-18,23208,Lunch Bag Vintage Leaf Design,7.67,1,14150.0,United Kingdom
577152,2023-11-18,21121,Set/10 Red Polkadot Party Candles,11.53,24,14277.0,France
577152,2023-11-18,22899,Children's Apron Dolly Girl,12.4,6,14277.0,France
577152,2023-11-18,21559,Strawberry Lunch Box With Cutlery,12.86,6,14277.0,France
577152,2023-11-18,84997D,Childrens Cutlery Polkadot Pink,14.5,8,14277.0,France
577152,2023-11-18,84997B,Childrens Cutlery Retrospot Red,14.5,8,14277.0,France
577152,2023-11-18,84997C,Childrens Cutlery Polkadot Blue,14.5,8,14277.0,France
577152,2023-11-18,84997A,Childrens Cutlery Polkadot Green,14.5,8,14277.0,France
577152,2023-11-18,23192,Bundle Of 3 Alphabet Exercise Books,11.94,12,14277.0,France
577152,2023-11-18,22741,Funky Diva Pen,11.12,48,14277.0,France
577152,2023-11-18,22754,Small Red Babushka Notebook,11.12,12,14277.0,France
577152,2023-11-18,22753,Small Yellow Babushka Notebook,11.12,12,14277.0,France
577152,2023-11-18,22325,Mobile Vintage Hearts,15.32,6,14277.0,France
577152,2023-11-18,21080,Set/20 Red Retrospot Paper Napkins,11.12,12,14277.0,France
577152,2023-11-18,21977,Pack Of 60 Pink Paisley Cake Cases,10.81,24,14277.0,France
577152,2023-11-18,21212,Pack Of 72 Retrospot Cake Cases,10.81,24,14277.0,France
577152,2023-11-18,22908,Pack Of 20 Napkins Red Apples,11.12,12,14277.0,France
577152,2023-11-18,22898,Childrens Apron Apples Design,12.25,8,14277.0,France
577152,2023-11-18,22352,Lunch Box With Cutlery Retrospot,12.86,6,14277.0,France
577152,2023-11-18,22949,Set Of 36 Dolly Girl Paper Doilies,11.74,12,14277.0,France
577152,2023-11-18,21210,Set Of 72 Retrospot Paper Doilies,11.74,12,14277.0,France
577152,2023-11-18,20725,Lunch Bag Red Retrospot,5.97,10,14277.0,France
577152,2023-11-18,22662,Lunch Bag Dolly Girl Design,5.97,10,14277.0,France
577152,2023-11-18,23206,Lunch Bag Apple Design,5.97,10,14277.0,France
577155,2023-11-18,84596F,Small Marshmallows Pink Bowl,10.68,16,13050.0,United Kingdom
577155,2023-11-18,23301,Gardeners Kneeling Pad Keep Calm,11.94,12,13050.0,United Kingdom
577155,2023-11-18,85048,15cm Christmas Glass Ball 20 Lights,18.4,2,13050.0,United Kingdom
577155,2023-11-18,23245,Set Of 3 Regency Cake Tins,15.32,4,13050.0,United Kingdom
577155,2023-11-18,22947,Wooden Advent Calendar Red,18.4,6,13050.0,United Kingdom
577155,2023-11-18,22728,Alarm Clock Bakelike Pink,14.09,4,13050.0,United Kingdom
577155,2023-11-18,22666,Recipe Box Pantry Yellow Design,13.27,6,13050.0,United Kingdom
577155,2023-11-18,21871,Save The Planet Mug,11.94,12,13050.0,United Kingdom
577155,2023-11-18,21874,Gin And Tonic Mug,11.94,12,13050.0,United Kingdom
577155,2023-11-18,84077,World War 2 Gliders Asstd Designs,10.55,48,13050.0,United Kingdom
577155,2023-11-18,23313,Vintage Christmas Bunting,15.32,10,13050.0,United Kingdom
577155,2023-11-18,23084,Rabbit Night Light,12.38,6,13050.0,United Kingdom
577155,2023-11-18,22144,Christmas Craft Little Friends,12.4,6,13050.0,United Kingdom
577155,2023-11-18,22151,Place Setting White Heart,10.68,24,13050.0,United Kingdom
577155,2023-11-18,22158,3 Hearts Hanging Decoration Rustic,13.27,8,13050.0,United Kingdom
577155,2023-11-18,47566,Party Bunting,15.32,4,13050.0,United Kingdom
577155,2023-11-18,22865,Hand Warmer Owl Design,12.4,12,13050.0,United Kingdom
577156,2023-11-18,23367,Set 12 Colour Pencils Spaceboy,10.92,16,13471.0,United Kingdom
577156,2023-11-18,21108,Fairy Cake Flannel Assorted Colour,11.06,18,13471.0,United Kingdom
577156,2023-11-18,23434,3 Raffia Ribbons 50'S Christmas,11.06,10,13471.0,United Kingdom
577156,2023-11-18,21787,Rain Poncho Retrospot,11.12,24,13471.0,United Kingdom
577156,2023-11-18,22819,Birthday Card Retro Spot,10.68,12,13471.0,United Kingdom
577156,2023-11-18,21498,Red Retrospot Wrap,10.68,25,13471.0,United Kingdom
577156,2023-11-18,21500,Pink Polkadot Wrap,10.68,25,13471.0,United Kingdom
577156,2023-11-18,21499,Blue Polkadot Wrap,10.68,25,13471.0,United Kingdom
577156,2023-11-18,16161P,Wrap English Rose,10.68,25,13471.0,United Kingdom
