TransactionNo,Date,ProductNo,ProductName,Price,Quantity,CustomerNo,Country
544597,2023-02-21,22666,Recipe Box Pantry Yellow Design,13.27,2,16014.0,United Kingdom
544597,2023-02-21,22665,Recipe Box Blue Sketchbook Design,13.27,2,16014.0,United Kingdom
544597,2023-02-21,22799,Sweetheart Wire Fruit Bowl,18.96,1,16014.0,United Kingdom
544597,2023-02-21,21888,Bingo Set,14.09,1,16014.0,United Kingdom
544597,2023-02-21,22189,Cream Heart Card Holder,14.3,1,16014.0,United Kingdom
544597,2023-02-21,22283,6 Egg House Painted Wood,18.4,2,16014.0,United Kingdom
544597,2023-02-21,22822,Cream Wall Planter Heart Shaped,16.35,2,16014.0,United Kingdom
544598,2023-02-21,84796B,Blue Savannah Picnic Hamper For 2,18.75,1,14598.0,United Kingdom
544598,2023-02-21,84832,Zinc Willie Winkie Candle Stick,11.92,2,14598.0,United Kingdom
544598,2023-02-21,84912B,Green Rose Washbag,13.62,1,14598.0,United Kingdom
544598,2023-02-21,84913A,Soft Pink Rose Towel,13.62,2,14598.0,United Kingdom
544598,2023-02-21,84913B,Mint Green Rose Towel,13.62,1,14598.0,United Kingdom
544598,2023-02-21,84923,Pink Butterfly Handbag W Bobbles,14.48,1,14598.0,United Kingdom
544598,2023-02-21,84946,Antique Silver T-Light Glass,12.77,6,14598.0,United Kingdom
544598,2023-02-21,84947,Antique Silver Tea Glass Engraved,12.77,3,14598.0,United Kingdom
544598,2023-02-21,84949,Silver Hanging T-Light Holder,13.62,3,14598.0,United Kingdom
544598,2023-02-21,84969,Box Of 6 Assorted Colour Teaspoons,13.62,1,14598.0,United Kingdom
544598,2023-02-21,84992,72 Sweetheart Fairy Cake Cases,11.53,1,14598.0,United Kingdom
544598,2023-02-21,85131A,Beaded Pearl Heart White On Stick,11.1,1,14598.0,United Kingdom
544598,2023-02-21,85131D,Beaded Crystal Heart Pink On Stick,11.1,1,14598.0,United Kingdom
544598,2023-02-21,85176,Sewing Susan 21 Needle Set,11.92,3,14598.0,United Kingdom
544598,2023-02-21,90201D,Green Enamel Flower Ring,13.22,1,14598.0,United Kingdom
544598,2023-02-21,15044B,Blue Paper Parasol,16.18,1,14598.0,United Kingdom
544598,2023-02-21,20707,Crazy Daisy Heart Decoration,11.1,3,14598.0,United Kingdom
544598,2023-02-21,20719,Woodland Charlotte Bag,11.92,1,14598.0,United Kingdom
544598,2023-02-21,20733,Gold Mini Tape Measure,11.1,2,14598.0,United Kingdom
544598,2023-02-21,20735,Black Mini Tape Measure,11.1,2,14598.0,United Kingdom
544598,2023-02-21,20846,Zinc Heart Lattice T-Light Holder,12.77,3,14598.0,United Kingdom
544598,2023-02-21,20979,36 Pencils Tube Red Retrospot,12.77,1,14598.0,United Kingdom
544598,2023-02-21,21002,Rose Du Sud Drawstring Bag,13.62,1,14598.0,United Kingdom
544598,2023-02-21,21012,Antique All Glass Candlestick,12.77,1,14598.0,United Kingdom
544598,2023-02-21,21087,Set/6 Posies Paper Cups,11.1,4,14598.0,United Kingdom
544598,2023-02-21,21090,Set/6 Collage Paper Plates,11.1,3,14598.0,United Kingdom
544598,2023-02-21,22892,Set Of Salt And Pepper Toadstools,11.53,6,14598.0,United Kingdom
544598,2023-02-21,82600,N0 Singing Metal Sign,12.4,3,14598.0,United Kingdom
544598,2023-02-21,82494L,Wooden Frame Antique White,13.27,6,14598.0,United Kingdom
544598,2023-02-21,85231G,Orange Scented Set/9 T-Lights,11.12,6,14598.0,United Kingdom
544598,2023-02-21,85231B,Cinammon Set Of 9 T-Lights,11.12,6,14598.0,United Kingdom
544598,2023-02-21,20676,Red Retrospot Bowl,11.53,6,14598.0,United Kingdom
544598,2023-02-21,21175,Gin And Tonic Diet Metal Sign,15.33,1,14598.0,United Kingdom
544598,2023-02-21,21232,Strawberry Ceramic Trinket Pot,12.77,1,14598.0,United Kingdom
544598,2023-02-21,21238,Red Retrospot Cup,11.92,6,14598.0,United Kingdom
544598,2023-02-21,21314,Small Glass Heart Trinket Pot,14.48,1,14598.0,United Kingdom
544598,2023-02-21,21320,Glass Chalice Green Large,15.33,1,14598.0,United Kingdom
544598,2023-02-21,21326,Aged Glass Silver T-Light Holder,11.92,11,14598.0,United Kingdom
544598,2023-02-21,21407,Brown Check Cat Doorstop,18.75,1,14598.0,United Kingdom
544598,2023-02-21,21408,Spotty Pink Duck Doorstop,18.75,1,14598.0,United Kingdom
544598,2023-02-21,21484,Chick Grey Hot Water Bottle,17.9,1,14598.0,United Kingdom
544598,2023-02-21,21555,Ceramic Strawberry Trinket Tray,15.33,1,14598.0,United Kingdom
544598,2023-02-21,21773,Decorative Rose Bathroom Bottle,12.77,1,14598.0,United Kingdom
544598,2023-02-21,21775,Decorative Flore Bathroom Bottle,12.77,1,14598.0,United Kingdom
544598,2023-02-21,21787,Rain Poncho Retrospot,11.92,1,14598.0,United Kingdom
544598,2023-02-21,21790,Vintage Snap Cards,11.92,1,14598.0,United Kingdom
544598,2023-02-21,21865,Pink Union Jack Passport Cover,14.48,1,14598.0,United Kingdom
544598,2023-02-21,21867,Pink Union Jack Luggage Tag,12.77,1,14598.0,United Kingdom
544598,2023-02-21,21914,Blue Harmonica In Box,12.77,2,14598.0,United Kingdom
544598,2023-02-21,21915,Red Harmonica In Box,12.77,3,14598.0,United Kingdom
544598,2023-02-21,21931,Jumbo Storage Bag Suki,14.48,1,14598.0,United Kingdom
544598,2023-02-21,21935,Suki Shoulder Bag,13.62,1,14598.0,United Kingdom
544598,2023-02-21,22091,Empire Tissue Box,12.77,1,14598.0,United Kingdom
544598,2023-02-21,22107,Pizza Plate In Box,17.9,1,14598.0,United Kingdom
544598,2023-02-21,22109,Full English Breakfast Plate,17.9,1,14598.0,United Kingdom
544598,2023-02-21,22148,Easter Craft 4 Chicks,14.48,1,14598.0,United Kingdom
544598,2023-02-21,22156,Heart Decoration With Pearls,11.92,2,14598.0,United Kingdom
544598,2023-02-21,22183,Cake Stand Victorian Filigree Med,16.18,1,14598.0,United Kingdom
544598,2023-02-21,22195,Large Heart Measuring Spoons,13.62,1,14598.0,United Kingdom
544598,2023-02-21,22196,Small Heart Measuring Spoons,11.92,1,14598.0,United Kingdom
544598,2023-02-21,22197,Popcorn Holder,11.92,4,14598.0,United Kingdom
544598,2023-02-21,22243,5 Hook Hanger Red Magic Toadstool,13.62,1,14598.0,United Kingdom
544598,2023-02-21,22244,3 Hook Hanger Magic Garden,14.48,1,14598.0,United Kingdom
544598,2023-02-21,22321,Bird Decoration Red Retrospot,11.92,1,14598.0,United Kingdom
544598,2023-02-21,22352,Lunch Box With Cutlery Retrospot,15.33,1,14598.0,United Kingdom
544598,2023-02-21,22354,Retrospot Padded Seat Cushion,17.9,1,14598.0,United Kingdom
544598,2023-02-21,22355,Charlotte Bag Suki Design,11.92,1,14598.0,United Kingdom
544598,2023-02-21,22377,Bottle Bag Retrospot,14.48,2,14598.0,United Kingdom
544598,2023-02-21,22469,Heart Of Wicker Small,13.62,1,14598.0,United Kingdom
544598,2023-02-21,22488,Natural Slate Rectangle Chalkboard,13.62,1,14598.0,United Kingdom
544598,2023-02-21,22502,Picnic Basket Wicker Small,18.75,3,14598.0,United Kingdom
544598,2023-02-21,22568,Feltcraft Cushion Owl,17.9,1,14598.0,United Kingdom
544598,2023-02-21,22585,Pack Of 6 Birdy Gift Tags,12.77,2,14598.0,United Kingdom
544598,2023-02-21,22602,Retrospot Wooden Heart Decoration,11.92,3,14598.0,United Kingdom
544598,2023-02-21,22616,Pack Of 12 London Tissues,11.1,8,14598.0,United Kingdom
544598,2023-02-21,22629,Spaceboy Lunch Box,14.48,1,14598.0,United Kingdom
544598,2023-02-21,22631,Circus Parade Lunch Box,14.48,1,14598.0,United Kingdom
544598,2023-02-21,22641,Set Of 4 Napkin Charms Instrument,15.33,5,14598.0,United Kingdom
544598,2023-02-21,22665,Recipe Box Blue Sketchbook Design,16.18,1,14598.0,United Kingdom
544598,2023-02-21,22666,Recipe Box Pantry Yellow Design,16.18,1,14598.0,United Kingdom
544598,2023-02-21,22679,French Blue Metal Door Sign 4,12.77,1,14598.0,United Kingdom
544598,2023-02-21,22682,French Blue Metal Door Sign 7,12.77,1,14598.0,United Kingdom
544598,2023-02-21,22698,Pink Regency Teacup And Saucer,16.18,1,14598.0,United Kingdom
544598,2023-02-21,22726,Alarm Clock Bakelike Green,17.9,2,14598.0,United Kingdom
544598,2023-02-21,22728,Alarm Clock Bakelike Pink,17.9,1,14598.0,United Kingdom
544598,2023-02-21,22766,Photo Frame Cornice,16.18,1,14598.0,United Kingdom
544598,2023-02-21,22851,Set 20 Napkins Fairy Cakes Design,11.92,1,14598.0,United Kingdom
544598,2023-02-21,22863,Soap Dish Brocante,16.18,1,14598.0,United Kingdom
544598,2023-02-21,22880,Number Tile Vintage Font 1,14.48,1,14598.0,United Kingdom
544598,2023-02-21,22886,Number Tile Vintage Font 7,14.48,1,14598.0,United Kingdom
544598,2023-02-21,22889,Number Tile Vintage Font No,14.48,1,14598.0,United Kingdom
544598,2023-02-21,22893,Mini Cake Stand T-Light Holder,11.1,8,14598.0,United Kingdom
544598,2023-02-21,22894,Tablecloth Red Apples Design,18.75,1,14598.0,United Kingdom
544598,2023-02-21,22900,Set 2 Tea Towels I Love London,16.18,1,14598.0,United Kingdom
544598,2023-02-21,22902,Tote Bag I Love London,14.48,1,14598.0,United Kingdom
544598,2023-02-21,22930,Baking Mould Heart Milk Chocolate,15.33,1,14598.0,United Kingdom
544598,2023-02-21,22938,Cupcake Lace Paper Set 6,14.48,1,14598.0,United Kingdom
544598,2023-02-21,22961,Jam Making Set Printed,13.62,2,14598.0,United Kingdom
544598,2023-02-21,22966,Gingerbread Man Cookie Cutter,12.77,1,14598.0,United Kingdom
544598,2023-02-21,22971,Queens Guard Coffee Mug,15.33,1,14598.0,United Kingdom
544598,2023-02-21,22976,Circus Parade Childrens Egg Cup,12.77,1,14598.0,United Kingdom
544598,2023-02-21,22993,Set Of 4 Pantry Jelly Moulds,12.81,1,14598.0,United Kingdom
544598,2023-02-21,22995,Travel Card Wallet Suki,11.1,2,14598.0,United Kingdom
544598,2023-02-21,22996,Travel Card Wallet Vintage Ticket,11.1,2,14598.0,United Kingdom
544598,2023-02-21,22997,Travel Card Wallet Union Jack,11.1,3,14598.0,United Kingdom
544598,2023-02-21,22998,Travel Card Wallet Keep Calm,11.1,5,14598.0,United Kingdom
544598,2023-02-21,23002,Travel Card Wallet Skulls,11.1,1,14598.0,United Kingdom
544598,2023-02-21,23004,Travel Card Wallet Pantry,11.1,1,14598.0,United Kingdom
544598,2023-02-21,35971,Rose Folkart Heart Decorations,12.77,1,14598.0,United Kingdom
544598,2023-02-21,40016,Chinese Dragon Paper Lanterns,18.75,1,14598.0,United Kingdom
544598,2023-02-21,72122,Coffee Scent Pillar Candle,12.18,1,14598.0,United Kingdom
544598,2023-02-21,75049L,Large Circular Mirror Mobile,12.77,1,14598.0,United Kingdom
544598,2023-02-21,82552,Washroom Metal Sign,12.77,1,14598.0,United Kingdom
544598,2023-02-21,82567,Airline Lounge Metal Sign,11.92,1,14598.0,United Kingdom
544598,2023-02-21,21171,Bathroom Metal Sign,11.53,1,14598.0,United Kingdom
544598,2023-02-21,84031B,Charlie Lola Blue Hot Water Bottle,14.48,1,14598.0,United Kingdom
544598,2023-02-21,84077,World War 2 Gliders Asstd Designs,10.68,12,14598.0,United Kingdom
544598,2023-02-21,84536A,English Rose Notebook A7 Size,11.1,2,14598.0,United Kingdom
544598,2023-02-21,84796A,Pink Hawaiian Picnic Hamper For 2,18.75,1,14598.0,United Kingdom
544598,2023-02-21,85099B,Jumbo Bag Red Retrospot,7.24,1,14598.0,United Kingdom
544598,2023-02-21,20711,Jumbo Bag Toys,7.24,1,14598.0,United Kingdom
544598,2023-02-21,20712,Jumbo Bag Woodland Animals,7.24,1,14598.0,United Kingdom
544598,2023-02-21,20713,Jumbo Bag Owls,7.24,1,14598.0,United Kingdom
544598,2023-02-21,21033,Jumbo Bag Charlie And Lola Toys,8.09,1,14598.0,United Kingdom
544598,2023-02-21,85099C,Jumbo Bag Baroque Black White,6.13,3,14598.0,United Kingdom
544598,2023-02-21,22383,Lunch Bag Suki Design,7.24,2,14598.0,United Kingdom
544598,2023-02-21,22662,Lunch Bag Dolly Girl Design,7.24,1,14598.0,United Kingdom
544599,2023-02-21,22197,Popcorn Holder,11.92,5,15599.0,United Kingdom
544599,2023-02-21,22992,Revolver Wooden Ruler,14.09,2,15599.0,United Kingdom
544599,2023-02-21,82482,Wooden Picture Frame White Finish,15.33,1,15599.0,United Kingdom
544599,2023-02-21,22212,Four Hook White Lovebirds,14.48,1,15599.0,United Kingdom
544599,2023-02-21,22219,Lovebird Hanging Decoration White,11.92,1,15599.0,United Kingdom
544599,2023-02-21,22227,Hanging Heart Mirror Decoration,11.53,2,15599.0,United Kingdom
544599,2023-02-21,22233,Jigsaw Rabbit And Birdhouse,13.62,1,15599.0,United Kingdom
544599,2023-02-21,22249,Decoration White Chick Magic Garden,11.92,1,15599.0,United Kingdom
544599,2023-02-21,22250,Decoration Butterfly Magic Garden,11.92,1,15599.0,United Kingdom
544599,2023-02-21,22268,Decoration Sitting Bunny,11.92,1,15599.0,United Kingdom
544599,2023-02-21,22286,Decoration Wobbly Rabbit Metal,13.62,1,15599.0,United Kingdom
544599,2023-02-21,22291,Hanging Chick Cream Decoration,13.24,2,15599.0,United Kingdom
544599,2023-02-21,22994,Travel Card Wallet Retrospot,11.1,4,15599.0,United Kingdom
544599,2023-02-21,22296,Heart Ivory Trellis Large,13.62,1,15599.0,United Kingdom
544599,2023-02-21,22297,Heart Ivory Trellis Small,12.77,1,15599.0,United Kingdom
544599,2023-02-21,22318,Five Heart Hanging Decoration,16.18,1,15599.0,United Kingdom
544599,2023-02-21,22321,Bird Decoration Red Retrospot,11.92,1,15599.0,United Kingdom
544599,2023-02-21,22329,Round Container Set Of 5 Retrospot,13.62,1,15599.0,United Kingdom
544599,2023-02-21,22331,Woodland Party Bag + Sticker Set,13.62,2,15599.0,United Kingdom
544599,2023-02-21,22335,Heart Decoration Painted Zinc,11.53,2,15599.0,United Kingdom
544599,2023-02-21,22342,Home Garland Painted Zinc,13.62,1,15599.0,United Kingdom
544599,2023-02-21,22378,Wall Tidy Retrospot,14.48,1,15599.0,United Kingdom
544599,2023-02-21,84279B,Cherry Blossom Decorative Flask,18.75,1,15599.0,United Kingdom
544599,2023-02-21,84796B,Blue Savannah Picnic Hamper For 2,18.75,1,15599.0,United Kingdom
544599,2023-02-21,84988,Set Of 72 Pink Heart Paper Doilies,13.24,3,15599.0,United Kingdom
544599,2023-02-21,85049H,Urban Black Ribbons,12.77,1,15599.0,United Kingdom
544599,2023-02-21,85131D,Beaded Crystal Heart Pink On Stick,11.1,2,15599.0,United Kingdom
544599,2023-02-21,22380,Toy Tidy Spaceboy,14.48,1,15599.0,United Kingdom
544599,2023-02-21,22413,Metal Sign Take It Or Leave It,16.18,1,15599.0,United Kingdom
544599,2023-02-21,22417,Pack Of 60 Spaceboy Cake Cases,11.53,1,15599.0,United Kingdom
544599,2023-02-21,22419,Lipstick Pen Red,11.1,1,15599.0,United Kingdom
544599,2023-02-21,22435,Set Of 9 Heart Shaped Balloons,12.77,1,15599.0,United Kingdom
544599,2023-02-21,22444,Grow Your Own Plant In A Can,11.53,1,15599.0,United Kingdom
544599,2023-02-21,22457,Natural Slate Heart Chalkboard,16.18,5,15599.0,United Kingdom
544599,2023-02-21,22467,Gumball Coat Rack,15.33,1,15599.0,United Kingdom
544599,2023-02-21,22469,Heart Of Wicker Small,13.62,2,15599.0,United Kingdom
544599,2023-02-21,22489,Pack Of 12 Traditional Crayons,11.1,15,15599.0,United Kingdom
544599,2023-02-21,22529,Magic Drawing Slate Go To The Fair,11.1,4,15599.0,United Kingdom
544599,2023-02-21,22530,Magic Drawing Slate Dolly Girl,11.1,3,15599.0,United Kingdom
544599,2023-02-21,22534,Magic Drawing Slate Spaceboy,11.1,5,15599.0,United Kingdom
544599,2023-02-21,22995,Travel Card Wallet Suki,11.1,5,15599.0,United Kingdom
544599,2023-02-21,82494L,Wooden Frame Antique White,17.9,1,15599.0,United Kingdom
544599,2023-02-21,84378,Set Of 3 Heart Cookie Cutters,12.77,1,15599.0,United Kingdom
544599,2023-02-21,84836,Zinc Metal Heart Decoration,12.77,1,15599.0,United Kingdom
544599,2023-02-21,84991,60 Teatime Fairy Cake Cases,11.53,1,15599.0,United Kingdom
544599,2023-02-21,85059,French Enamel Water Basin,17.9,1,15599.0,United Kingdom
544599,2023-02-21,85202,Hanging Wood And Felt Heart,11.06,1,15599.0,United Kingdom
544599,2023-02-21,22535,Magic Drawing Slate Bunnies,11.1,3,15599.0,United Kingdom
544599,2023-02-21,22544,Mini Jigsaw Spaceboy,11.1,1,15599.0,United Kingdom
544599,2023-02-21,22554,Plasters In Tin Woodland Animals,13.62,1,15599.0,United Kingdom
544599,2023-02-21,22568,Feltcraft Cushion Owl,17.9,1,15599.0,United Kingdom
544599,2023-02-21,22602,Retrospot Wooden Heart Decoration,11.92,1,15599.0,United Kingdom
544599,2023-02-21,22615,Pack Of 12 Circus Parade Tissues,11.1,1,15599.0,United Kingdom
544599,2023-02-21,22616,Pack Of 12 London Tissues,11.1,1,15599.0,United Kingdom
544599,2023-02-21,22624,Ivory Kitchen Scales,18.96,1,15599.0,United Kingdom
544599,2023-02-21,22645,Ceramic Heart Fairy Cake Money Bank,13.62,1,15599.0,United Kingdom
544599,2023-02-21,85215,Assorted Cheese Fridge Magnets,11.52,6,15599.0,United Kingdom
544599,2023-02-21,90114,Summer Daisies Bag Charm,12.77,1,15599.0,United Kingdom
544599,2023-02-21,90133,Teal/Fuschia Col Bead Necklace,15.35,1,15599.0,United Kingdom
544599,2023-02-21,85114A,Black Enchanted Forest Placemat,13.62,4,15599.0,United Kingdom
544599,2023-02-21,85114B,Ivory Enchanted Forest Placemat,13.62,1,15599.0,United Kingdom
544599,2023-02-21,84849B,Fairy Soap Soap Holder,13.62,1,15599.0,United Kingdom
544599,2023-02-21,84993A,75 Green Petit Four Cases,11.1,1,15599.0,United Kingdom
544599,2023-02-21,22996,Travel Card Wallet Vintage Ticket,11.1,14,15599.0,United Kingdom
544599,2023-02-21,22997,Travel Card Wallet Union Jack,11.1,3,15599.0,United Kingdom
544599,2023-02-21,22998,Travel Card Wallet Keep Calm,11.1,5,15599.0,United Kingdom
544599,2023-02-21,22999,Travel Card Wallet Vintage Leaf,11.1,3,15599.0,United Kingdom
544599,2023-02-21,23000,Travel Card Wallet Transport,11.1,5,15599.0,United Kingdom
544599,2023-02-21,23002,Travel Card Wallet Skulls,11.1,1,15599.0,United Kingdom
544599,2023-02-21,23004,Travel Card Wallet Pantry,11.1,2,15599.0,United Kingdom
544599,2023-02-21,23006,Travel Card Wallet Flower Meadow,11.1,1,15599.0,United Kingdom
544599,2023-02-21,40016,Chinese Dragon Paper Lanterns,18.75,1,15599.0,United Kingdom
544599,2023-02-21,84459B,Yellow Metal Chicken Heart,13.62,1,15599.0,United Kingdom
544599,2023-02-21,84568,Girls Alphabet Iron On Patches,10.68,7,15599.0,United Kingdom
544599,2023-02-21,82567,Airline Lounge Metal Sign,11.92,1,15599.0,United Kingdom
544599,2023-02-21,21171,Bathroom Metal Sign,11.53,1,15599.0,United Kingdom
544599,2023-02-21,82581,Toilet Metal Sign,11.53,1,15599.0,United Kingdom
544599,2023-02-21,15060B,Fairy Cake Design Umbrella,18.75,1,15599.0,United Kingdom
544599,2023-02-21,16207A,Pink Strawberry Handbag,13.62,1,15599.0,United Kingdom
544599,2023-02-21,16237,Sleeping Cat Erasers,10.68,5,15599.0,United Kingdom
544599,2023-02-21,17012D,Origami Rose Incense/Candle Set,12.77,1,15599.0,United Kingdom
544599,2023-02-21,17129F,Blue Glass Gems In Bag,11.92,3,15599.0,United Kingdom
544599,2023-02-21,18094C,White And Blue Ceramic Oil Burner,12.77,2,15599.0,United Kingdom
544599,2023-02-21,18097C,White Tall Porcelain T-Light Holder,15.33,1,15599.0,United Kingdom
544599,2023-02-21,20619,Tropical Passport Cover,11.92,1,15599.0,United Kingdom
544599,2023-02-21,20707,Crazy Daisy Heart Decoration,11.1,4,15599.0,United Kingdom
544599,2023-02-21,20719,Woodland Charlotte Bag,11.92,1,15599.0,United Kingdom
544599,2023-02-21,20723,Strawberry Charlotte Bag,11.92,1,15599.0,United Kingdom
544599,2023-02-21,20735,Black Mini Tape Measure,11.1,1,15599.0,United Kingdom
544599,2023-02-21,21165,Beware Of The Cat Metal Sign,14.48,2,15599.0,United Kingdom
544599,2023-02-21,21175,Gin And Tonic Diet Metal Sign,15.33,1,15599.0,United Kingdom
544599,2023-02-21,21212,Pack Of 72 Retrospot Cake Cases,11.53,1,15599.0,United Kingdom
544599,2023-02-21,22653,Button Box,14.48,1,15599.0,United Kingdom
544599,2023-02-21,22668,Pink Baby Bunting,16.18,1,15599.0,United Kingdom
544599,2023-02-21,22669,Red Baby Bunting,16.18,1,15599.0,United Kingdom
544599,2023-02-21,22677,French Blue Metal Door Sign 2,12.77,1,15599.0,United Kingdom
544599,2023-02-21,22679,French Blue Metal Door Sign 4,12.77,1,15599.0,United Kingdom
544599,2023-02-21,22713,Card I Love London,11.1,1,15599.0,United Kingdom
544599,2023-02-21,22714,Card Birthday Cowboy,11.1,1,15599.0,United Kingdom
544599,2023-02-21,22716,Card Circus Parade,11.1,1,15599.0,United Kingdom
544599,2023-02-21,22718,Card Cat And Tree,11.1,1,15599.0,United Kingdom
544599,2023-02-21,22722,Set Of 6 Spice Tins Pantry Design,18.75,3,15599.0,United Kingdom
544599,2023-02-21,22723,Set Of 6 Herb Tins Sketchbook,18.75,1,15599.0,United Kingdom
544599,2023-02-21,22814,Card Party Games,11.1,1,15599.0,United Kingdom
544599,2023-02-21,22815,Card Psychedelic Apples,11.1,2,15599.0,United Kingdom
544599,2023-02-21,22819,Birthday Card Retro Spot,11.1,1,15599.0,United Kingdom
544599,2023-02-21,22855,Fine Wicker Heart,12.77,1,15599.0,United Kingdom
544599,2023-02-21,22858,Easter Tin Keepsake,13.62,1,15599.0,United Kingdom
544599,2023-02-21,22868,Number Tile Cottage Garden 0,14.48,1,15599.0,United Kingdom
544599,2023-02-21,47574A,English Rose Scented Hanging Flower,12.77,2,15599.0,United Kingdom
544599,2023-02-21,22869,Number Tile Cottage Garden 1,14.48,1,15599.0,United Kingdom
544599,2023-02-21,22870,Number Tile Cottage Garden 2,14.48,2,15599.0,United Kingdom
544599,2023-02-21,22873,Number Tile Cottage Garden 5,14.48,1,15599.0,United Kingdom
544599,2023-02-21,22883,Number Tile Vintage Font 4,14.48,1,15599.0,United Kingdom
544599,2023-02-21,22885,Number Tile Vintage Font 6,14.48,1,15599.0,United Kingdom
544599,2023-02-21,79000,Moroccan Tea Glass,11.94,3,15599.0,United Kingdom
544599,2023-02-21,84030E,English Rose Hot Water Bottle,18.75,1,15599.0,United Kingdom
544599,2023-02-21,84596J,Mixed Nuts Light Green Bowl,12.77,1,15599.0,United Kingdom
544599,2023-02-21,84913A,Soft Pink Rose Towel,13.62,4,15599.0,United Kingdom
544599,2023-02-21,85032A,Romantic Images Gift Wrap Set,14.48,1,15599.0,United Kingdom
544599,2023-02-21,85123A,Cream Hanging Heart T-Light Holder,16.18,3,15599.0,United Kingdom
544599,2023-02-21,22896,Peg Bag Apples Design,15.33,1,15599.0,United Kingdom
544599,2023-02-21,22908,Pack Of 20 Napkins Red Apples,11.92,1,15599.0,United Kingdom
544599,2023-02-21,22951,60 Cake Cases Dolly Girl Design,11.53,1,15599.0,United Kingdom
544599,2023-02-21,22960,Jam Making Set With Jars,18.75,2,15599.0,United Kingdom
544599,2023-02-21,22961,Jam Making Set Printed,13.62,3,15599.0,United Kingdom
544599,2023-02-21,22962,Jam Jar With Pink Lid,11.92,1,15599.0,United Kingdom
544599,2023-02-21,22964,3 Piece Spaceboy Cookie Cutter Set,14.48,1,15599.0,United Kingdom
544599,2023-02-21,22967,Set 3 Song Bird Paper Eggs Assorted,16.18,1,15599.0,United Kingdom
544599,2023-02-21,22971,Queens Guard Coffee Mug,15.33,1,15599.0,United Kingdom
544599,2023-02-21,22972,Children's Spaceboy Mug,13.62,1,15599.0,United Kingdom
544599,2023-02-21,22974,Childrens Dolly Girl Mug,13.62,1,15599.0,United Kingdom
544599,2023-02-21,22976,Circus Parade Childrens Egg Cup,12.77,1,15599.0,United Kingdom
544599,2023-02-21,22983,Card Billboard Font,11.1,1,15599.0,United Kingdom
544599,2023-02-21,21218,Red Spotty Biscuit Tin,18.75,1,15599.0,United Kingdom
544599,2023-02-21,21288,Stripey Chocolate Nesting Boxes,13.62,1,15599.0,United Kingdom
544599,2023-02-21,21314,Small Glass Heart Trinket Pot,14.48,1,15599.0,United Kingdom
544599,2023-02-21,21366,Mirrored Wall Art Photo Frames,18.75,1,15599.0,United Kingdom
544599,2023-02-21,21385,Ivory Hanging Decoration Heart,11.92,4,15599.0,United Kingdom
544599,2023-02-21,21390,Filigris Heart With Butterfly,12.77,1,15599.0,United Kingdom
544599,2023-02-21,21408,Spotty Pink Duck Doorstop,18.75,1,15599.0,United Kingdom
544599,2023-02-21,21417,Cockle Shell Dish,14.48,3,15599.0,United Kingdom
544599,2023-02-21,21452,Toadstool Money Box,16.18,1,15599.0,United Kingdom
544599,2023-02-21,21481,Fawn Blue Hot Water Bottle,16.18,1,15599.0,United Kingdom
544599,2023-02-21,21508,Vintage Kid Dolly Card,11.1,1,15599.0,United Kingdom
544599,2023-02-21,21509,Cowboys And Indians Birthday Card,11.1,1,15599.0,United Kingdom
544599,2023-02-21,21531,Red Retrospot Sugar Jam Bowl,15.33,2,15599.0,United Kingdom
544599,2023-02-21,21535,Red Retrospot Small Milk Jug,15.33,1,15599.0,United Kingdom
544599,2023-02-21,21578,Woodland Design Cotton Tote Bag,15.33,2,15599.0,United Kingdom
544599,2023-02-21,21658,Glass Beurre Dish,18.75,1,15599.0,United Kingdom
544599,2023-02-21,21775,Decorative Flore Bathroom Bottle,12.77,1,15599.0,United Kingdom
544599,2023-02-21,21811,Hanging Heart With Bell,12.77,1,15599.0,United Kingdom
544599,2023-02-21,21874,Gin And Tonic Mug,13.62,1,15599.0,United Kingdom
544599,2023-02-21,21905,More Butter Metal Sign,11.92,2,15599.0,United Kingdom
544599,2023-02-21,21934,Skull Shoulder Bag,13.62,1,15599.0,United Kingdom
544599,2023-02-21,85129B,Beaded Crystal Heart Green Small,12.77,1,15599.0,United Kingdom
544599,2023-02-21,85129D,Beaded Crystal Heart Pink Small,12.77,1,15599.0,United Kingdom
544599,2023-02-21,85131B,Beaded Crystal Heart Green On Stick,11.1,1,15599.0,United Kingdom
544599,2023-02-21,84913B,Mint Green Rose Towel,13.62,2,15599.0,United Kingdom
544599,2023-02-21,84951B,Set Of 4 Black Lovebird Coasters,15.33,1,15599.0,United Kingdom
544599,2023-02-21,84969,Box Of 6 Assorted Colour Teaspoons,13.62,2,15599.0,United Kingdom
544599,2023-02-21,84978,Hanging Heart Jar T-Light Holder,12.77,1,15599.0,United Kingdom
544599,2023-02-21,85049A,Traditional Christmas Ribbons,12.77,1,15599.0,United Kingdom
544599,2023-02-21,84598,Boys Alphabet Iron On Patches,10.68,3,15599.0,United Kingdom
544599,2023-02-21,84660C,Pink Stitched Wall Clock,17.9,1,15599.0,United Kingdom
544599,2023-02-21,84077,World War 2 Gliders Asstd Designs,10.68,5,15599.0,United Kingdom
544599,2023-02-21,84249A,Greeting Card Square Doughnuts,11.1,1,15599.0,United Kingdom
544599,2023-02-21,21942,Skulls Design Flannel,11.92,1,15599.0,United Kingdom
544599,2023-02-21,21944,Kittens Design Flannel,11.92,3,15599.0,United Kingdom
544599,2023-02-21,21947,Set Of 6 Heart Chopsticks,12.77,1,15599.0,United Kingdom
544599,2023-02-21,21977,Pack Of 60 Pink Paisley Cake Cases,11.53,1,15599.0,United Kingdom
544599,2023-02-21,21993,Floral Folk Stationery Set,12.77,3,15599.0,United Kingdom
544599,2023-02-21,22023,Empire Birthday Card,11.1,2,15599.0,United Kingdom
544599,2023-02-21,22024,Rainy Ladies Birthday Card,11.1,1,15599.0,United Kingdom
544599,2023-02-21,22025,Ring Of Roses Birthday Card,11.1,1,15599.0,United Kingdom
544599,2023-02-21,22026,Banquet Birthday Card,11.1,1,15599.0,United Kingdom
544599,2023-02-21,22027,Tea Party Birthday Card,11.1,3,15599.0,United Kingdom
544599,2023-02-21,22029,Spaceboy Birthday Card,11.1,1,15599.0,United Kingdom
544599,2023-02-21,22077,6 Ribbons Rustic Charm,13.62,3,15599.0,United Kingdom
544599,2023-02-21,22083,Paper Chain Kit Retrospot,16.18,1,15599.0,United Kingdom
544599,2023-02-21,22093,Motoring Tissue Box,12.77,1,15599.0,United Kingdom
