TransactionNo,Date,ProductNo,ProductName,Price,Quantity,CustomerNo,Country
550016,2023-04-14,22967,Set 3 Song Bird Paper Eggs Assorted,13.27,12,15416.0,United Kingdom
550016,2023-04-14,22291,Hanging Chick Cream Decoration,11.74,24,15416.0,United Kingdom
550016,2023-04-14,22084,Paper Chain Kit Empire,13.27,24,15416.0,United Kingdom
550016,2023-04-14,22083,Paper Chain Kit Retrospot,13.27,12,15416.0,United Kingdom
550016,2023-04-14,22556,Plasters In Tin Circus Parade,11.94,12,15416.0,United Kingdom
550016,2023-04-14,22557,Plasters In Tin Vintage Paisley,11.94,12,15416.0,United Kingdom
550016,2023-04-14,22554,Plasters In Tin Woodland Animals,11.94,12,15416.0,United Kingdom
550016,2023-04-14,21746,Small Red Retrospot Windmill,11.53,12,15416.0,United Kingdom
550016,2023-04-14,22707,Wrap Monster Fun,10.68,25,15416.0,United Kingdom
550016,2023-04-14,22985,Wrap Billboard Fonts Design,10.68,25,15416.0,United Kingdom
550016,2023-04-14,23232,Wrap Vintage Leaf Design,10.68,25,15416.0,United Kingdom
550016,2023-04-14,21937,Strawberry Picnic Bag,13.27,5,15416.0,United Kingdom
550016,2023-04-14,22427,Enamel Flower Jug Cream,16.35,6,15416.0,United Kingdom
550016,2023-04-14,22855,Fine Wicker Heart,11.53,12,15416.0,United Kingdom
550016,2023-04-14,84879,Assorted Colour Bird Ornament,11.98,24,15416.0,United Kingdom
550016,2023-04-14,21755,Love Building Block Word,16.35,3,15416.0,United Kingdom
550016,2023-04-14,21326,Aged Glass Silver T-Light Holder,10.92,12,15416.0,United Kingdom
550017,2023-04-14,84821,Danish Rose Deluxe Coaster,11.12,12,17865.0,United Kingdom
550017,2023-04-14,22858,Easter Tin Keepsake,11.94,18,17865.0,United Kingdom
550017,2023-04-14,22859,Easter Tin Bunny Bouquet,11.94,12,17865.0,United Kingdom
550017,2023-04-14,22247,Bunny Decoration Magic Garden,11.12,16,17865.0,United Kingdom
550017,2023-04-14,21458,2 Picture Book Eggs Easter Bunny,11.53,12,17865.0,United Kingdom
550017,2023-04-14,21164,Home Sweet Home Metal Sign,13.27,12,17865.0,United Kingdom
550017,2023-04-14,21169,You're Confusing Me Metal Sign,11.98,24,17865.0,United Kingdom
550017,2023-04-14,21165,Beware Of The Cat Metal Sign,11.98,12,17865.0,United Kingdom
550017,2023-04-14,21171,Bathroom Metal Sign,11.74,12,17865.0,United Kingdom
550017,2023-04-14,21175,Gin And Tonic Diet Metal Sign,12.86,12,17865.0,United Kingdom
550017,2023-04-14,21166,Cook With Wine Metal Sign,12.38,12,17865.0,United Kingdom
550017,2023-04-14,21172,Party Metal Sign,11.74,12,17865.0,United Kingdom
550017,2023-04-14,21181,Please One Person Metal Sign,12.4,12,17865.0,United Kingdom
550017,2023-04-14,21905,More Butter Metal Sign,12.4,6,17865.0,United Kingdom
550017,2023-04-14,21908,Chocolate This Way Metal Sign,12.4,12,17865.0,United Kingdom
550017,2023-04-14,22412,Metal Sign Neighbourhood Witch,12.4,12,17865.0,United Kingdom
550017,2023-04-14,21171,Bathroom Metal Sign,10.81,12,17865.0,United Kingdom
550017,2023-04-14,82567,Airline Lounge Metal Sign,12.4,6,17865.0,United Kingdom
550017,2023-04-14,82581,Toilet Metal Sign,10.81,12,17865.0,United Kingdom
550017,2023-04-14,82582,Area Patrolled Metal Sign,12.15,72,17865.0,United Kingdom
550017,2023-04-14,82600,N0 Singing Metal Sign,12.4,12,17865.0,United Kingdom
550025,2023-04-14,22698,Pink Regency Teacup And Saucer,12.86,48,17315.0,United Kingdom
550025,2023-04-14,22697,Green Regency Teacup And Saucer,13.27,4,17315.0,United Kingdom
550025,2023-04-14,22699,Roses Regency Teacup And Saucer,13.27,4,17315.0,United Kingdom
550030,2023-04-14,22384,Lunch Bag Pink Polkadot,5.97,2,17315.0,United Kingdom
550030,2023-04-14,20727,Lunch Bag Black Skull,5.97,24,17315.0,United Kingdom
550031,2023-04-14,22896,Peg Bag Apples Design,12.4,50,13629.0,United Kingdom
550031,2023-04-14,85099F,Jumbo Bag Strawberry,6.04,100,13629.0,United Kingdom
550031,2023-04-14,85099B,Jumbo Bag Red Retrospot,6.04,100,13629.0,United Kingdom
550031,2023-04-14,85099C,Jumbo Bag Baroque Black White,6.04,100,13629.0,United Kingdom
550032,2023-04-14,21090,Set/6 Collage Paper Plates,10.65,24,15139.0,United Kingdom
550032,2023-04-14,21043,Apron Modern Vintage Cotton,12.25,12,15139.0,United Kingdom
550032,2023-04-14,20801,Large Pink Glass Sundae Dish,11.06,16,15139.0,United Kingdom
550032,2023-04-14,21084,Set/6 Collage Paper Cups,10.44,48,15139.0,United Kingdom
550032,2023-04-14,21397,Blue Polkadot Egg Cup,10.65,6,15139.0,United Kingdom
550033,2023-04-14,21034,Rex Cash+Carry Jumbo Shopper,11.22,3,15005.0,United Kingdom
550033,2023-04-14,21931,Jumbo Storage Bag Suki,12.38,2,15005.0,United Kingdom
550033,2023-04-14,85123A,Cream Hanging Heart T-Light Holder,13.27,6,15005.0,United Kingdom
550033,2023-04-14,22139,Retrospot Tea Set Ceramic 11 Pc,15.32,1,15005.0,United Kingdom
550033,2023-04-14,20703,Blue Padded Soft Mobile,14.61,1,15005.0,United Kingdom
550033,2023-04-14,20702,Pink Padded Mobile,14.61,1,15005.0,United Kingdom
550033,2023-04-14,23205,Charlotte Bag Vintage Alphabet,11.12,7,15005.0,United Kingdom
550033,2023-04-14,23204,Charlotte Bag Apples Design,11.12,6,15005.0,United Kingdom
550033,2023-04-14,22356,Charlotte Bag Pink Polkadot,11.12,10,15005.0,United Kingdom
550033,2023-04-14,22115,Metal Sign Empire Tea,13.27,2,15005.0,United Kingdom
550033,2023-04-14,21238,Red Retrospot Cup,11.12,4,15005.0,United Kingdom
550033,2023-04-14,21239,Pink Polkadot Cup,11.12,4,15005.0,United Kingdom
550033,2023-04-14,22661,Charlotte Bag Dolly Girl Design,11.12,10,15005.0,United Kingdom
550033,2023-04-14,20723,Strawberry Charlotte Bag,11.12,10,15005.0,United Kingdom
550033,2023-04-14,20724,Red Retrospot Charlotte Bag,11.12,4,15005.0,United Kingdom
550033,2023-04-14,20750,Red Retrospot Mini Cases,18.4,1,15005.0,United Kingdom
550033,2023-04-14,22138,Baking Set 9 Piece Retrospot,15.32,1,15005.0,United Kingdom
550033,2023-04-14,22189,Cream Heart Card Holder,14.3,2,15005.0,United Kingdom
550033,2023-04-14,84507C,Blue Circles Design Monkey Doll,12.86,2,15005.0,United Kingdom
550033,2023-04-14,23254,Childrens Cutlery Dolly Girl,14.5,1,15005.0,United Kingdom
550033,2023-04-14,23255,Childrens Cutlery Circus Parade,14.5,1,15005.0,United Kingdom
550033,2023-04-14,23256,Childrens Cutlery Spaceboy,14.5,1,15005.0,United Kingdom
550033,2023-04-14,20674,Green Polkadot Bowl,11.53,4,15005.0,United Kingdom
550033,2023-04-14,20676,Red Retrospot Bowl,11.53,4,15005.0,United Kingdom
550033,2023-04-14,23199,Jumbo Bag Apples,6.19,3,15005.0,United Kingdom
550033,2023-04-14,22663,Jumbo Bag Dolly Girl Design,6.19,2,15005.0,United Kingdom
550033,2023-04-14,85099F,Jumbo Bag Strawberry,6.19,3,15005.0,United Kingdom
550033,2023-04-14,20712,Jumbo Bag Woodland Animals,6.19,2,15005.0,United Kingdom
550033,2023-04-14,22386,Jumbo Bag Pink Polkadot,6.19,5,15005.0,United Kingdom
550033,2023-04-14,85099C,Jumbo Bag Baroque Black White,6.19,3,15005.0,United Kingdom
550033,2023-04-14,23201,Jumbo Bag Alphabet,6.19,2,15005.0,United Kingdom
550033,2023-04-14,22382,Lunch Bag Spaceboy Design,5.97,2,15005.0,United Kingdom
550033,2023-04-14,20727,Lunch Bag Black Skull,5.97,2,15005.0,United Kingdom
550033,2023-04-14,23208,Lunch Bag Vintage Leaf Design,5.97,2,15005.0,United Kingdom
550033,2023-04-14,23207,Lunch Bag Alphabet Design,5.97,2,15005.0,United Kingdom
550034,2023-04-14,22831,White Brocante Soap Dish,13.27,12,16187.0,United Kingdom
550034,2023-04-14,84879,Assorted Colour Bird Ornament,11.98,16,16187.0,United Kingdom
550034,2023-04-14,84836,Zinc Metal Heart Decoration,11.53,12,16187.0,United Kingdom
550034,2023-04-14,22457,Natural Slate Heart Chalkboard,13.27,12,16187.0,United Kingdom
550034,2023-04-14,48187,Doormat New England,18.4,2,16187.0,United Kingdom
550034,2023-04-14,71459,Hanging Jam Jar T-Light Holders,11.12,12,16187.0,United Kingdom
550034,2023-04-14,84970L,Single Heart Zinc T-Light Holder,11.22,12,16187.0,United Kingdom
550034,2023-04-14,84946,Antique Silver T-Light Glass,11.53,24,16187.0,United Kingdom
550034,2023-04-14,22852,Dog Bowl Vintage Cream,14.61,4,16187.0,United Kingdom
550034,2023-04-14,22853,Cat Bowl Vintage Cream,13.58,6,16187.0,United Kingdom
550034,2023-04-14,84991,60 Teatime Fairy Cake Cases,10.81,24,16187.0,United Kingdom
550034,2023-04-14,84992,72 Sweetheart Fairy Cake Cases,10.81,24,16187.0,United Kingdom
550034,2023-04-14,21975,Pack Of 60 Dinosaur Cake Cases,10.81,24,16187.0,United Kingdom
550034,2023-04-14,22652,Travel Sewing Kit,11.94,20,16187.0,United Kingdom
550034,2023-04-14,22653,Button Box,12.25,10,16187.0,United Kingdom
550034,2023-04-14,22411,Jumbo Shopper Vintage Red Paisley,12.38,10,16187.0,United Kingdom
550034,2023-04-14,20723,Strawberry Charlotte Bag,11.12,10,16187.0,United Kingdom
550034,2023-04-14,22355,Charlotte Bag Suki Design,11.12,10,16187.0,United Kingdom
550034,2023-04-14,21986,Pack Of 12 Pink Polkadot Tissues,10.55,24,16187.0,United Kingdom
550034,2023-04-14,21983,Pack Of 12 Blue Paisley Tissues,10.55,24,16187.0,United Kingdom
550034,2023-04-14,22025,Ring Of Roses Birthday Card,10.68,12,16187.0,United Kingdom
550034,2023-04-14,22716,Card Circus Parade,10.68,12,16187.0,United Kingdom
550034,2023-04-14,22814,Card Party Games,10.68,12,16187.0,United Kingdom
550034,2023-04-14,22741,Funky Diva Pen,11.12,48,16187.0,United Kingdom
550034,2023-04-14,21878,Pack Of 6 Sandcastle Flags Assorted,11.12,12,16187.0,United Kingdom
550034,2023-04-14,21790,Vintage Snap Cards,11.12,12,16187.0,United Kingdom
550034,2023-04-14,22138,Baking Set 9 Piece Retrospot,15.32,6,16187.0,United Kingdom
550034,2023-04-14,47591D,Pink Fairy Cake Childrens Apron,12.25,16,16187.0,United Kingdom
550034,2023-04-14,22555,Plasters In Tin Strongman,11.94,12,16187.0,United Kingdom
550034,2023-04-14,22556,Plasters In Tin Circus Parade,11.94,12,16187.0,United Kingdom
550034,2023-04-14,22899,Children's Apron Dolly Girl,12.4,6,16187.0,United Kingdom
550034,2023-04-14,47566B,Tea Time Party Bunting,15.32,4,16187.0,United Kingdom
550034,2023-04-14,22499,Wooden Union Jack Bunting,16.35,3,16187.0,United Kingdom
550034,2023-04-14,22722,Set Of 6 Spice Tins Pantry Design,14.3,8,16187.0,United Kingdom
550034,2023-04-14,22386,Jumbo Bag Pink Polkadot,6.19,10,16187.0,United Kingdom
550034,2023-04-14,22384,Lunch Bag Pink Polkadot,5.97,10,16187.0,United Kingdom
550034,2023-04-14,20728,Lunch Bag Cars Blue,5.97,10,16187.0,United Kingdom
550035,2023-04-14,22375,Airline Bag Vintage Jet Set Brown,14.61,1,15039.0,United Kingdom
550035,2023-04-14,15056N,Edwardian Parasol Natural,16.35,2,15039.0,United Kingdom
550035,2023-04-14,21430,Set/3 Red Gingham Rose Storage Box,13.72,24,15039.0,United Kingdom
550035,2023-04-14,21313,Glass Heart T-Light Holder,11.12,3,15039.0,United Kingdom
550035,2023-04-14,84030E,English Rose Hot Water Bottle,14.61,1,15039.0,United Kingdom
550035,2023-04-14,21479,White Skull Hot Water Bottle,14.09,1,15039.0,United Kingdom
550035,2023-04-14,47585A,Pink Fairy Cake Cushion Cover,12.86,1,15039.0,United Kingdom
550035,2023-04-14,22553,Plasters In Tin Skulls,11.94,2,15039.0,United Kingdom
550035,2023-04-14,22644,Ceramic Cherry Cake Money Bank,11.74,1,15039.0,United Kingdom
550035,2023-04-14,22690,Doormat Home Sweet Home Blue,18.4,2,15039.0,United Kingdom
550035,2023-04-14,21523,Doormat Fancy Font Home Sweet Home,18.4,2,15039.0,United Kingdom
550035,2023-04-14,47566B,Tea Time Party Bunting,15.32,4,15039.0,United Kingdom
550035,2023-04-14,15058C,Ice Cream Design Garden Parasol,18.4,2,15039.0,United Kingdom
550035,2023-04-14,15058B,Pink Polkadot Garden Parasol,18.4,2,15039.0,United Kingdom
550035,2023-04-14,21922,Union Stripe With Fringe Hammock,18.4,3,15039.0,United Kingdom
550035,2023-04-14,22670,French Wc Sign Blue Metal,11.53,1,15039.0,United Kingdom
550035,2023-04-14,21672,White Spot Red Ceramic Drawer Knob,11.53,1,15039.0,United Kingdom
550035,2023-04-14,21080,Set/20 Red Retrospot Paper Napkins,11.12,12,15039.0,United Kingdom
550035,2023-04-14,21669,Blue Stripe Ceramic Drawer Knob,11.53,12,15039.0,United Kingdom
550035,2023-04-14,21672,White Spot Red Ceramic Drawer Knob,11.53,18,15039.0,United Kingdom
550035,2023-04-14,21755,Love Building Block Word,16.35,1,15039.0,United Kingdom
550035,2023-04-14,84792,Enchanted Bird Coathanger 5 Hook,15.02,1,15039.0,United Kingdom
550035,2023-04-14,21989,Pack Of 20 Skull Paper Napkins,11.12,8,15039.0,United Kingdom
550035,2023-04-14,21907,I'm On Holiday Metal Sign,12.4,1,15039.0,United Kingdom
550035,2023-04-14,23052,Recycled Acapulco Mat Turquoise,18.71,2,15039.0,United Kingdom
550035,2023-04-14,47599A,Pink Party Bags,12.4,12,15039.0,United Kingdom
550035,2023-04-14,47599B,Blue Party Bags,12.4,9,15039.0,United Kingdom
550035,2023-04-14,84596G,Small Chocolates Pink Bowl,10.68,8,15039.0,United Kingdom
550035,2023-04-14,84596B,Small Dolly Mix Design Orange Bowl,10.68,8,15039.0,United Kingdom
550035,2023-04-14,82483,Wood 2 Drawer Cabinet White Finish,17.37,2,15039.0,United Kingdom
550035,2023-04-14,84596F,Small Marshmallows Pink Bowl,10.68,8,15039.0,United Kingdom
550035,2023-04-14,21428,Set3 Book Box Green Gingham Flower,14.61,4,15039.0,United Kingdom
550035,2023-04-14,35911A,Multicolour Rabbit Egg Warmer,11.12,1,15039.0,United Kingdom
550035,2023-04-14,21937,Strawberry Picnic Bag,13.27,1,15039.0,United Kingdom
550035,2023-04-14,22088,Paper Bunting Coloured Lace,13.27,2,15039.0,United Kingdom
550035,2023-04-14,22087,Paper Bunting White Lace,13.27,6,15039.0,United Kingdom
550035,2023-04-14,21215,Ivory Paper Cup Cake Cases,10.81,6,15039.0,United Kingdom
550035,2023-04-14,21975,Pack Of 60 Dinosaur Cake Cases,10.81,2,15039.0,United Kingdom
550035,2023-04-14,21931,Jumbo Storage Bag Suki,12.38,10,15039.0,United Kingdom
550035,2023-04-14,21930,Jumbo Storage Bag Skulls,12.38,10,15039.0,United Kingdom
550035,2023-04-14,22411,Jumbo Shopper Vintage Red Paisley,12.38,30,15039.0,United Kingdom
550035,2023-04-14,22386,Jumbo Bag Pink Polkadot,6.19,10,15039.0,United Kingdom
550035,2023-04-14,85099B,Jumbo Bag Red Retrospot,6.19,10,15039.0,United Kingdom
550035,2023-04-14,20712,Jumbo Bag Woodland Animals,6.19,10,15039.0,United Kingdom
550035,2023-04-14,22385,Jumbo Bag Spaceboy Design,6.19,10,15039.0,United Kingdom
550035,2023-04-14,20711,Jumbo Bag Toys,6.19,10,15039.0,United Kingdom
550035,2023-04-14,22663,Jumbo Bag Dolly Girl Design,6.19,10,15039.0,United Kingdom
550035,2023-04-14,85099C,Jumbo Bag Baroque Black White,6.19,10,15039.0,United Kingdom
550035,2023-04-14,85099F,Jumbo Bag Strawberry,6.19,10,15039.0,United Kingdom
550035,2023-04-14,21929,Jumbo Bag Pink Vintage Paisley,6.19,10,15039.0,United Kingdom
550035,2023-04-14,21928,Jumbo Bag Scandinavian Blue Paisley,6.19,10,15039.0,United Kingdom
550052,2023-04-14,22084,Paper Chain Kit Empire,13.27,6,17068.0,United Kingdom
550052,2023-04-14,47566B,Tea Time Party Bunting,15.32,8,17068.0,United Kingdom
550052,2023-04-14,21937,Strawberry Picnic Bag,13.27,5,17068.0,United Kingdom
550052,2023-04-14,21936,Red Retrospot Picnic Bag,13.27,5,17068.0,United Kingdom
550052,2023-04-14,22628,Picnic Boxes Set Of 3 Retrospot,15.32,4,17068.0,United Kingdom
550052,2023-04-14,22380,Toy Tidy Spaceboy,12.4,5,17068.0,United Kingdom
550052,2023-04-14,22379,Recycling Bag Retrospot,12.4,10,17068.0,United Kingdom
550052,2023-04-14,22664,Toy Tidy Dolly Girl Design,12.4,5,17068.0,United Kingdom
550052,2023-04-14,22381,Toy Tidy Pink Polkadot,12.4,5,17068.0,United Kingdom
550052,2023-04-14,21714,Citronella Candle Garden Pot,11.53,12,17068.0,United Kingdom
550052,2023-04-14,20914,Set/5 Red Retrospot Lid Glass Bowls,13.27,6,17068.0,United Kingdom
550052,2023-04-14,20717,Strawberry Shopper Bag,11.53,10,17068.0,United Kingdom
550052,2023-04-14,20718,Red Retrospot Shopper Bag,11.53,10,17068.0,United Kingdom
550052,2023-04-14,47566,Party Bunting,15.32,4,17068.0,United Kingdom
550052,2023-04-14,47590B,Pink Happy Birthday Bunting,15.84,3,17068.0,United Kingdom
550052,2023-04-14,21935,Suki Shoulder Bag,11.94,10,17068.0,United Kingdom
550052,2023-04-14,21934,Skull Shoulder Bag,11.94,10,17068.0,United Kingdom
550052,2023-04-14,20731,Posy Candy Bag,11.53,10,17068.0,United Kingdom
550052,2023-04-14,21928,Jumbo Bag Scandinavian Blue Paisley,6.19,10,17068.0,United Kingdom
550052,2023-04-14,85099F,Jumbo Bag Strawberry,6.19,10,17068.0,United Kingdom
550052,2023-04-14,20726,Lunch Bag Woodland,5.97,10,17068.0,United Kingdom
550052,2023-04-14,22384,Lunch Bag Pink Polkadot,5.97,10,17068.0,United Kingdom
550052,2023-04-14,22383,Lunch Bag Suki Design,5.97,10,17068.0,United Kingdom
550052,2023-04-14,20725,Lunch Bag Red Retrospot,5.97,10,17068.0,United Kingdom
550052,2023-04-14,22662,Lunch Bag Dolly Girl Design,5.97,10,17068.0,United Kingdom
550054,2023-04-14,71459,Hanging Jam Jar T-Light Holders,11.12,48,14040.0,United Kingdom
550054,2023-04-14,85099B,Jumbo Bag Red Retrospot,6.19,10,14040.0,United Kingdom
550054,2023-04-14,20725,Lunch Bag Red Retrospot,5.97,10,14040.0,United Kingdom
550054,2023-04-14,23207,Lunch Bag Alphabet Design,5.97,10,14040.0,United Kingdom
550057,2023-04-14,84755,Colour Glass T-Light Holder Hanging,10.92,8,14606.0,United Kingdom
550057,2023-04-14,21136,Painted Metal Pears Assorted,11.98,8,14606.0,United Kingdom
550057,2023-04-14,22199,Frying Pan Red Retrospot,14.61,1,14606.0,United Kingdom
550057,2023-04-14,21205,Multicolour 3d Balls Garland,12.86,1,14606.0,United Kingdom
550057,2023-04-14,22286,Decoration Wobbly Rabbit Metal,11.94,2,14606.0,United Kingdom
550057,2023-04-14,84880,White Wire Egg Holder,17.94,1,14606.0,United Kingdom
550057,2023-04-14,21171,Bathroom Metal Sign,10.81,2,14606.0,United Kingdom
550057,2023-04-14,22477,Watering Can Garden Marker,11.53,22,14606.0,United Kingdom
550057,2023-04-14,21280,Vintage Kitchen Print Vegetables,12.86,1,14606.0,United Kingdom
550057,2023-04-14,21272,Salle De Bain Hook,11.53,1,14606.0,United Kingdom
550057,2023-04-14,85194S,Hanging Spring Flower Egg Small,10.92,3,14606.0,United Kingdom
550057,2023-04-14,22460,Embossed Glass Tealight Holder,11.53,4,14606.0,United Kingdom
550057,2023-04-14,22090,Paper Bunting Retrospot,13.27,2,14606.0,United Kingdom
550057,2023-04-14,21703,Bag 125g Swirly Marbles,10.68,1,14606.0,United Kingdom
550057,2023-04-14,21390,Filigris Heart With Butterfly,11.53,6,14606.0,United Kingdom
550057,2023-04-14,22227,Hanging Heart Mirror Decoration,10.92,3,14606.0,United Kingdom
550057,2023-04-14,51014L,Feather Pen Light Pink,11.12,12,14606.0,United Kingdom
550057,2023-04-14,21307,Set/4 Butterfly Mirror Magnets,12.4,1,14606.0,United Kingdom
550057,2023-04-14,84970L,Single Heart Zinc T-Light Holder,11.22,2,14606.0,United Kingdom
550057,2023-04-14,72807C,Set/3 Vanilla Scented Candle In Box,14.61,1,14606.0,United Kingdom
550057,2023-04-14,22311,Office Mug Warmer Black+Silver,13.27,1,14606.0,United Kingdom
550057,2023-04-14,22178,Victorian Glass Hanging T-Light,11.53,8,14606.0,United Kingdom
550057,2023-04-14,22217,T-Light Holder Hanging Lace,11.53,5,14606.0,United Kingdom
550071,2023-04-14,22996,Travel Card Wallet Vintage Ticket,10.68,24,16735.0,United Kingdom
550071,2023-04-14,22998,Travel Card Wallet Keep Calm,10.68,24,16735.0,United Kingdom
550071,2023-04-14,22999,Travel Card Wallet Vintage Leaf,10.68,24,16735.0,United Kingdom
550071,2023-04-14,22997,Travel Card Wallet Union Jack,10.68,24,16735.0,United Kingdom
550071,2023-04-14,21870,I Can Only Please One Person Mug,11.53,12,16735.0,United Kingdom
550071,2023-04-14,22301,Coffee Mug Cat + Bird Design,12.86,6,16735.0,United Kingdom
550071,2023-04-14,22300,Coffee Mug Dog + Ball Design,12.86,6,16735.0,United Kingdom
550071,2023-04-14,85123A,Cream Hanging Heart T-Light Holder,13.27,12,16735.0,United Kingdom
550071,2023-04-14,71459,Hanging Jam Jar T-Light Holders,11.12,24,16735.0,United Kingdom
550071,2023-04-14,84755,Colour Glass T-Light Holder Hanging,10.92,32,16735.0,United Kingdom
550071,2023-04-14,22488,Natural Slate Rectangle Chalkboard,11.94,12,16735.0,United Kingdom
550071,2023-04-14,22457,Natural Slate Heart Chalkboard,13.27,6,16735.0,United Kingdom
550071,2023-04-14,22295,Heart Filigree Dove Large,11.94,24,16735.0,United Kingdom
550071,2023-04-14,22294,Heart Filigree Dove Small,11.53,24,16735.0,United Kingdom
550071,2023-04-14,84879,Assorted Colour Bird Ornament,11.98,16,16735.0,United Kingdom
550071,2023-04-14,22188,Black Heart Card Holder,14.3,8,16735.0,United Kingdom
550071,2023-04-14,22189,Cream Heart Card Holder,14.3,8,16735.0,United Kingdom
550071,2023-04-14,21755,Love Building Block Word,16.35,3,16735.0,United Kingdom
550071,2023-04-14,21754,Home Building Block Word,16.35,3,16735.0,United Kingdom
550071,2023-04-14,23208,Lunch Bag Vintage Leaf Design,5.97,10,16735.0,United Kingdom
550106,2023-04-14,20682,Red Retrospot Childrens Umbrella,13.58,1,13772.0,United Kingdom
550106,2023-04-14,22722,Set Of 6 Spice Tins Pantry Design,14.3,2,13772.0,United Kingdom
550106,2023-04-14,22993,Set Of 4 Pantry Jelly Moulds,11.53,3,13772.0,United Kingdom
550106,2023-04-14,23052,Recycled Acapulco Mat Turquoise,18.71,1,13772.0,United Kingdom
550106,2023-04-14,21584,Retrospot Small Tube Matches,11.94,1,13772.0,United Kingdom
550106,2023-04-14,22721,Set Of 3 Cake Tins Sketchbook,15.32,1,13772.0,United Kingdom
550106,2023-04-14,22807,Set Of 6 T-Lights Toadstools,13.27,1,13772.0,United Kingdom
550106,2023-04-14,22980,Pantry Scrubbing Brush,11.94,5,13772.0,United Kingdom
550106,2023-04-14,22176,Blue Owl Soft Toy,13.27,1,13772.0,United Kingdom
550106,2023-04-14,22979,Pantry Washing Up Brush,11.74,5,13772.0,United Kingdom
550106,2023-04-14,22989,Set 2 Pantry Design Tea Towels,13.58,3,13772.0,United Kingdom
550106,2023-04-14,22990,Cotton Apron Pantry Design,15.32,3,13772.0,United Kingdom
550106,2023-04-14,22907,Pack Of 20 Napkins Pantry Design,11.12,3,13772.0,United Kingdom
550106,2023-04-14,22356,Charlotte Bag Pink Polkadot,11.12,1,13772.0,United Kingdom
550106,2023-04-14,22895,Set Of 2 Tea Towels Apple And Pears,13.58,1,13772.0,United Kingdom
550106,2023-04-14,21578,Woodland Design Cotton Tote Bag,12.56,1,13772.0,United Kingdom
550106,2023-04-14,47566,Party Bunting,15.32,15,13772.0,United Kingdom
550106,2023-04-14,20719,Woodland Charlotte Bag,11.12,1,13772.0,United Kingdom
550106,2023-04-14,22355,Charlotte Bag Suki Design,11.12,3,13772.0,United Kingdom
550106,2023-04-14,84375,Set Of 20 Kids Cookie Cutters,12.4,2,13772.0,United Kingdom
550106,2023-04-14,21088,Set/6 Fruit Salad Paper Cups,10.44,8,13772.0,United Kingdom
550106,2023-04-14,22353,Lunch Box With Cutlery Fairy Cakes,12.86,1,13772.0,United Kingdom
550106,2023-04-14,21559,Strawberry Lunch Box With Cutlery,12.86,1,13772.0,United Kingdom
550106,2023-04-14,22084,Paper Chain Kit Empire,13.27,5,13772.0,United Kingdom
550106,2023-04-14,22963,Jam Jar With Green Lid,11.12,3,13772.0,United Kingdom
550106,2023-04-14,22962,Jam Jar With Pink Lid,11.12,3,13772.0,United Kingdom
550106,2023-04-14,22626,Black Kitchen Scales,18.96,1,13772.0,United Kingdom
550106,2023-04-14,21929,Jumbo Bag Pink Vintage Paisley,6.19,1,13772.0,United Kingdom
550106,2023-04-14,21928,Jumbo Bag Scandinavian Blue Paisley,6.19,1,13772.0,United Kingdom
550106,2023-04-14,22386,Jumbo Bag Pink Polkadot,6.19,1,13772.0,United Kingdom
550106,2023-04-14,85099F,Jumbo Bag Strawberry,6.19,1,13772.0,United Kingdom
550106,2023-04-14,20712,Jumbo Bag Woodland Animals,6.19,1,13772.0,United Kingdom
550106,2023-04-14,23207,Lunch Bag Alphabet Design,5.97,1,13772.0,United Kingdom
550106,2023-04-14,23206,Lunch Bag Apple Design,5.97,1,13772.0,United Kingdom
550106,2023-04-14,23208,Lunch Bag Vintage Leaf Design,5.97,2,13772.0,United Kingdom
550120,2023-04-14,22467,Gumball Coat Rack,12.86,6,17071.0,United Kingdom
550120,2023-04-14,47566,Party Bunting,15.32,12,17071.0,United Kingdom
550120,2023-04-14,47566B,Tea Time Party Bunting,15.32,8,17071.0,United Kingdom
550120,2023-04-14,82486,3 Drawer Antique White Wood Cabinet,19.42,6,17071.0,United Kingdom
550120,2023-04-14,21212,Pack Of 72 Retrospot Cake Cases,10.81,24,17071.0,United Kingdom
550120,2023-04-14,23204,Charlotte Bag Apples Design,11.12,10,17071.0,United Kingdom
550120,2023-04-14,21164,Home Sweet Home Metal Sign,13.27,6,17071.0,United Kingdom
550120,2023-04-14,21175,Gin And Tonic Diet Metal Sign,12.86,12,17071.0,United Kingdom
550120,2023-04-14,85150,Ladies & Gentlemen Metal Sign,12.86,6,17071.0,United Kingdom
550120,2023-04-14,82599,Fanny's Rest Stopmetal Sign,12.4,12,17071.0,United Kingdom
550121,2023-04-14,22148,Easter Craft 4 Chicks,12.25,12,15271.0,United Kingdom
550121,2023-04-14,21385,Ivory Hanging Decoration Heart,11.12,24,15271.0,United Kingdom
550121,2023-04-14,21624,Vintage Union Jack Doorstop,16.35,3,15271.0,United Kingdom
550121,2023-04-14,85123A,Cream Hanging Heart T-Light Holder,13.27,6,15271.0,United Kingdom
550121,2023-04-14,22087,Paper Bunting White Lace,13.27,6,15271.0,United Kingdom
550121,2023-04-14,22464,Hanging Metal Heart Lantern,11.94,12,15271.0,United Kingdom
550121,2023-04-14,22691,Doormat Welcome Sunrise,18.4,2,15271.0,United Kingdom
550121,2023-04-14,22611,Vintage Union Jack Shopping Bag,7.66,3,15271.0,United Kingdom
550122,2023-04-14,22604,Set Of 4 Napkin Charms Cutlery,12.4,192,12931.0,United Kingdom
550122,2023-04-14,22149,Feltcraft 6 Flower Friends,12.15,240,12931.0,United Kingdom
550122,2023-04-14,22197,Popcorn Holder,10.99,600,12931.0,United Kingdom
550122,2023-04-14,21731,Red Toadstool Led Night Light,11.74,144,12931.0,United Kingdom
550123,2023-04-14,22514,Childs Garden Spade Blue,12.4,1,17123.0,United Kingdom
550123,2023-04-14,22519,Childs Garden Brush Pink,12.4,2,17123.0,United Kingdom
550123,2023-04-14,22516,Childs Garden Rake Blue,12.4,1,17123.0,United Kingdom
550123,2023-04-14,22518,Childs Garden Brush Blue,12.4,2,17123.0,United Kingdom
550123,2023-04-14,22957,Set 3 Paper Vintage Chick Paper Egg,13.27,5,17123.0,United Kingdom
550123,2023-04-14,20992,Jazz Hearts Purse Notebook,11.12,4,17123.0,United Kingdom
550123,2023-04-14,22967,Set 3 Song Bird Paper Eggs Assorted,13.27,5,17123.0,United Kingdom
550123,2023-04-14,20996,Jazz Hearts Address Book,10.68,6,17123.0,United Kingdom
550123,2023-04-14,22432,Watering Can Pink Bunny,12.25,1,17123.0,United Kingdom
550123,2023-04-14,21442,Green Birdhouse Decoration,11.12,4,17123.0,United Kingdom
