TransactionNo,Date,ProductNo,ProductName,Price,Quantity,CustomerNo,Country
560359,2023-07-18,21216,Set 3 Retrospot Tea/Coffee/Sugar,15.32,1,14159.0,United Kingdom
560359,2023-07-18,21992,Vintage Paisley Stationery Set,11.53,2,14159.0,United Kingdom
560359,2023-07-18,21993,Floral Folk Stationery Set,11.53,2,14159.0,United Kingdom
560359,2023-07-18,21990,Modern Floral Stationery Set,11.53,2,14159.0,United Kingdom
560359,2023-07-18,85071B,Red Charlie+Lola Personal Doorsign,10.65,2,14159.0,United Kingdom
560359,2023-07-18,85071A,Blue Charlie+Lola Personal Doorsign,10.65,2,14159.0,United Kingdom
560359,2023-07-18,47566,Party Bunting,15.32,2,14159.0,United Kingdom
560359,2023-07-18,23298,Spotty Bunting,15.32,2,14159.0,United Kingdom
560359,2023-07-18,15056N,Edwardian Parasol Natural,16.35,1,14159.0,United Kingdom
560359,2023-07-18,21531,Red Retrospot Sugar Jam Bowl,12.86,1,14159.0,United Kingdom
560359,2023-07-18,21535,Red Retrospot Small Milk Jug,12.86,1,14159.0,United Kingdom
560359,2023-07-18,21218,Red Spotty Biscuit Tin,14.09,1,14159.0,United Kingdom
560359,2023-07-18,23013,Glass Apothecary Bottle Tonic,14.3,1,14159.0,United Kingdom
560359,2023-07-18,35923,Candy Heart Hanging Decoration,10.65,5,14159.0,United Kingdom
560359,2023-07-18,84927D,La Palmiera Tile Hook,10.65,6,14159.0,United Kingdom
560359,2023-07-18,84755,Colour Glass T-Light Holder Hanging,10.92,8,14159.0,United Kingdom
560359,2023-07-18,22232,Jigsaw Toadstools 3 Piece,10.85,16,14159.0,United Kingdom
560359,2023-07-18,22993,Set Of 4 Pantry Jelly Moulds,11.53,6,14159.0,United Kingdom
560359,2023-07-18,35924,Hanging Fairy Cake Decoration,12.4,1,14159.0,United Kingdom
560359,2023-07-18,22097,Swallow Square Tissue Box,10.65,4,14159.0,United Kingdom
560359,2023-07-18,22629,Spaceboy Lunch Box,12.25,1,14159.0,United Kingdom
560359,2023-07-18,22630,Dolly Girl Lunch Box,12.25,1,14159.0,United Kingdom
560359,2023-07-18,22098,Boudoir Square Tissue Box,10.65,4,14159.0,United Kingdom
560359,2023-07-18,22099,Caravan Square Tissue Box,10.65,4,14159.0,United Kingdom
560359,2023-07-18,20832,Red Flock Love Heart Photo Frame,10.65,24,14159.0,United Kingdom
560359,2023-07-18,21367,Mirrored Wall Art Gents,11.02,1,14159.0,United Kingdom
560359,2023-07-18,21368,Mirrored Wall Art Ladies,11.02,1,14159.0,United Kingdom
560359,2023-07-18,81953P,Round Articulated Pink Clock W/Suck,10.44,4,14159.0,United Kingdom
560359,2023-07-18,81952B,Round Blue Clock With Sucker,10.44,1,14159.0,United Kingdom
560359,2023-07-18,81952V,Round Purple Clock With Sucker,10.44,6,14159.0,United Kingdom
560359,2023-07-18,81952B,Round Blue Clock With Sucker,10.44,6,14159.0,United Kingdom
560359,2023-07-18,22617,Baking Set Spaceboy Design,15.32,1,14159.0,United Kingdom
560359,2023-07-18,22138,Baking Set 9 Piece Retrospot,15.32,1,14159.0,United Kingdom
560359,2023-07-18,23301,Gardeners Kneeling Pad Keep Calm,11.94,3,14159.0,United Kingdom
560359,2023-07-18,23300,Gardeners Kneeling Pad Cup Of Tea,11.94,4,14159.0,United Kingdom
560359,2023-07-18,23209,Lunch Bag Vintage Doily,5.97,4,14159.0,United Kingdom
560359,2023-07-18,23208,Lunch Bag Vintage Leaf Design,5.97,4,14159.0,United Kingdom
560360,2023-07-18,23323,White Wicker Star,12.4,18,12744.0,Singapore
560360,2023-07-18,22343,Party Pizza Dish Red Retrospot,10.99,72,12744.0,Singapore
560360,2023-07-18,22191,Ivory Diner Wall Clock,18.09,12,12744.0,Singapore
560360,2023-07-18,23341,Pink Diner Wall Clock,18.09,12,12744.0,Singapore
560360,2023-07-18,22925,Blue Giant Garden Thermometer,16.35,12,12744.0,Singapore
560360,2023-07-18,22927,Green Giant Garden Thermometer,16.35,12,12744.0,Singapore
560360,2023-07-18,21955,Doormat Union Jack Guns And Roses,17.17,10,12744.0,Singapore
560360,2023-07-18,22689,Doormat Merry Christmas Red,17.17,10,12744.0,Singapore
560360,2023-07-18,22596,Christmas Star Wish List Chalkboard,11.53,48,12744.0,Singapore
560360,2023-07-18,22558,Clothes Pegs Retrospot Pack 24,11.94,12,12744.0,Singapore
560360,2023-07-18,20984,12 Pencils Tall Tube Posy,10.55,24,12744.0,Singapore
560360,2023-07-18,21179,No Junk Mail Metal Sign,10.65,24,12744.0,Singapore
560360,2023-07-18,21359,Relax Large Wood Letters,14.3,6,12744.0,Singapore
560360,2023-07-18,47503A,Ass Floral Print Multi Screwdriver,10.68,24,12744.0,Singapore
560360,2023-07-18,81950B,Flower Blue Clock With Sucker,10.55,20,12744.0,Singapore
560360,2023-07-18,84596F,Small Marshmallows Pink Bowl,10.68,16,12744.0,Singapore
560360,2023-07-18,85071A,Blue Charlie+Lola Personal Doorsign,10.65,24,12744.0,Singapore
560360,2023-07-18,22893,Mini Cake Stand T-Light Holder,10.68,24,12744.0,Singapore
560360,2023-07-18,22119,Peace Wooden Block Letters,16.76,12,12744.0,Singapore
560360,2023-07-18,22121,Noel Wooden Block Letters,15.84,12,12744.0,Singapore
560360,2023-07-18,23100,Silver Bells Table Decoration,11.53,24,12744.0,Singapore
560360,2023-07-18,23101,Silver Stars Table Decoration,11.1,12,12744.0,Singapore
560360,2023-07-18,23102,Silver Hearts Table Decoration,11.1,12,12744.0,Singapore
560360,2023-07-18,21351,Cinammon & Orange Wreath,16.35,16,12744.0,Singapore
560360,2023-07-18,23131,Mistletoe Heart Wreath Cream,14.5,8,12744.0,Singapore
560360,2023-07-18,23129,Heart Shaped Holly Wreath,14.5,8,12744.0,Singapore
560360,2023-07-18,21810,Christmas Hanging Star With Bell,11.53,48,12744.0,Singapore
560360,2023-07-18,21809,Christmas Hanging Tree With Bell,11.53,48,12744.0,Singapore
560360,2023-07-18,21819,Glitter Christmas Star,11.12,48,12744.0,Singapore
560360,2023-07-18,22339,Christmas Tree Painted Zinc,10.81,288,12744.0,Singapore
560360,2023-07-18,23214,Jingle Bell Heart Antique Gold,12.38,48,12744.0,Singapore
560360,2023-07-18,23215,Jingle Bell Heart Antique Silver,12.38,48,12744.0,Singapore
560360,2023-07-18,23218,Laurel Star Antique Gold,11.53,48,12744.0,Singapore
560360,2023-07-18,23225,Cherub Heart Decoration Silver,11.1,48,12744.0,Singapore
560360,2023-07-18,22578,Wooden Star Christmas Scandinavian,11.12,48,12744.0,Singapore
560360,2023-07-18,22593,Christmas Gingham Star,11.12,48,12744.0,Singapore
560360,2023-07-18,22601,Christmas Retrospot Angel Wood,11.12,48,12744.0,Singapore
560360,2023-07-18,22579,Wooden Tree Christmas Scandinavian,11.12,48,12744.0,Singapore
560360,2023-07-18,22594,Christmas Gingham Tree,11.12,48,12744.0,Singapore
560360,2023-07-18,22581,Wood Stocking Christmas Scandispot,11.12,48,12744.0,Singapore
560360,2023-07-18,22600,Christmas Retrospot Star Wood,11.12,48,12744.0,Singapore
560360,2023-07-18,23266,Set Of 3 Wooden Stocking Decoration,11.53,48,12744.0,Singapore
560360,2023-07-18,22571,Rocking Horse Red Christmas,11.12,48,12744.0,Singapore
560360,2023-07-18,23211,Red Rocking Horse Hand Painted,11.53,48,12744.0,Singapore
560360,2023-07-18,23212,Heart Wreath Decoration With Bell,11.53,48,12744.0,Singapore
560360,2023-07-18,22910,Paper Chain Kit Vintage Christmas,13.27,18,12744.0,Singapore
560360,2023-07-18,22086,Paper Chain Kit 50'S Christmas,13.27,18,12744.0,Singapore
560360,2023-07-18,85048,15cm Christmas Glass Ball 20 Lights,17.37,12,12744.0,Singapore
560360,2023-07-18,21733,Red Hanging Heart T-Light Holder,12.86,32,12744.0,Singapore
560360,2023-07-18,85123A,Cream Hanging Heart T-Light Holder,12.86,32,12744.0,Singapore
560360,2023-07-18,22457,Natural Slate Heart Chalkboard,13.27,6,12744.0,Singapore
560360,2023-07-18,21165,Beware Of The Cat Metal Sign,11.98,12,12744.0,Singapore
560360,2023-07-18,82582,Area Patrolled Metal Sign,12.4,12,12744.0,Singapore
560360,2023-07-18,21621,Vintage Union Jack Bunting,18.96,6,12744.0,Singapore
560360,2023-07-18,23255,Childrens Cutlery Circus Parade,14.5,4,12744.0,Singapore
560360,2023-07-18,23254,Childrens Cutlery Dolly Girl,14.5,4,12744.0,Singapore
560360,2023-07-18,23108,Set Of 10 Led Dolly Lights,16.66,2,12744.0,Singapore
560360,2023-07-18,23109,Pack Of Six Led Tea Lights,13.21,18,12744.0,Singapore
560360,2023-07-18,21471,Strawberry Raffia Food Cover,14.09,6,12744.0,Singapore
560360,2023-07-18,21470,Flower Vine Raffia Food Cover,14.09,6,12744.0,Singapore
560360,2023-07-18,23175,Regency Milk Jug Pink,13.58,12,12744.0,Singapore
560360,2023-07-18,23174,Regency Sugar Bowl Green,14.5,12,12744.0,Singapore
560360,2023-07-18,21936,Red Retrospot Picnic Bag,12.86,50,12744.0,Singapore
560360,2023-07-18,22192,Blue Diner Wall Clock,18.09,12,12744.0,Singapore
560360,2023-07-18,23028,Drawer Knob Crackle Glaze Blue,11.94,18,12744.0,Singapore
560360,2023-07-18,23029,Drawer Knob Crackle Glaze Green,11.94,18,12744.0,Singapore
560360,2023-07-18,23298,Spotty Bunting,15.32,12,12744.0,Singapore
560360,2023-07-18,47566,Party Bunting,15.32,8,12744.0,Singapore
560360,2023-07-18,22090,Paper Bunting Retrospot,13.27,12,12744.0,Singapore
560360,2023-07-18,23284,Doormat Keep Calm And Come In,17.17,10,12744.0,Singapore
560360,2023-07-18,22469,Heart Of Wicker Small,11.74,40,12744.0,Singapore
560360,2023-07-18,35970,Zinc Folkart Sleigh Bells,11.78,72,12744.0,Singapore
560360,2023-07-18,23312,Vintage Christmas Gift Sack,14.5,36,12744.0,Singapore
560361,2023-07-18,23122,Party Charms 50 Pieces,11.1,12,13488.0,United Kingdom
560361,2023-07-18,23119,Pack Of 6 Large Fruit Straws,10.89,12,13488.0,United Kingdom
560361,2023-07-18,23243,Set Of Tea Coffee Sugar Tins Pantry,15.32,4,13488.0,United Kingdom
560361,2023-07-18,22720,Set Of 3 Cake Tins Pantry Design,15.32,3,13488.0,United Kingdom
560361,2023-07-18,23288,Green Vintage Spot Beaker,11.12,8,13488.0,United Kingdom
560361,2023-07-18,23287,Red Vintage Spot Beaker,11.12,8,13488.0,United Kingdom
560361,2023-07-18,23286,Blue Vintage Spot Beaker,11.12,8,13488.0,United Kingdom
560361,2023-07-18,23285,Pink Vintage Spot Beaker,11.12,8,13488.0,United Kingdom
560361,2023-07-18,23245,Set Of 3 Regency Cake Tins,15.32,4,13488.0,United Kingdom
560361,2023-07-18,23297,Set 40 Heart Shape Petit Four Cases,11.94,12,13488.0,United Kingdom
560361,2023-07-18,23296,Set Of 6 Tea Time Baking Cases,11.53,12,13488.0,United Kingdom
560361,2023-07-18,23294,Set Of 6 Snack Loaf Baking Cases,11.1,12,13488.0,United Kingdom
560361,2023-07-18,23250,Vintage Red Trim Enamel Bowl,11.53,12,13488.0,United Kingdom
560361,2023-07-18,23249,Vintage Red Enamel Trim Plate,11.94,12,13488.0,United Kingdom
560361,2023-07-18,23252,Vintage Red Enamel Trim Jug,14.09,4,13488.0,United Kingdom
560361,2023-07-18,23032,Drawer Knob Crackle Glaze Ivory,11.94,12,13488.0,United Kingdom
560361,2023-07-18,23031,Drawer Knob Crackle Glaze Pink,11.94,12,13488.0,United Kingdom
560361,2023-07-18,23029,Drawer Knob Crackle Glaze Green,11.94,12,13488.0,United Kingdom
560361,2023-07-18,23028,Drawer Knob Crackle Glaze Blue,11.94,12,13488.0,United Kingdom
560362,2023-07-18,23121,Pack Of 6 Cocktail Parasol Straws,10.68,24,13488.0,United Kingdom
560362,2023-07-18,23240,Set Of 4 Knick Knack Tins Doily,14.5,6,13488.0,United Kingdom
560362,2023-07-18,23287,Red Vintage Spot Beaker,11.12,8,13488.0,United Kingdom
560362,2023-07-18,23286,Blue Vintage Spot Beaker,11.12,8,13488.0,United Kingdom
560362,2023-07-18,23285,Pink Vintage Spot Beaker,11.12,8,13488.0,United Kingdom
560362,2023-07-18,23296,Set Of 6 Tea Time Baking Cases,11.53,12,13488.0,United Kingdom
560362,2023-07-18,23297,Set 40 Heart Shape Petit Four Cases,11.94,12,13488.0,United Kingdom
560362,2023-07-18,23307,Set Of 60 Pantry Design Cake Cases,10.81,24,13488.0,United Kingdom
560362,2023-07-18,23306,Set Of 36 Pantry Paper Doilies,11.74,12,13488.0,United Kingdom
560362,2023-07-18,22771,Clear Drawer Knob Acrylic Edwardian,11.53,24,13488.0,United Kingdom
560363,2023-07-18,23296,Set Of 6 Tea Time Baking Cases,11.53,8,12589.0,France
560363,2023-07-18,23295,Set Of 12 Mini Loaf Baking Cases,11.1,16,12589.0,France
560363,2023-07-18,23293,Set Of 12 Fairy Cake Baking Cases,11.1,16,12589.0,France
560363,2023-07-18,23294,Set Of 6 Snack Loaf Baking Cases,11.1,8,12589.0,France
560363,2023-07-18,82613A,Metal Sign Cupcake Single Hook,11.53,8,12589.0,France
560363,2023-07-18,22646,Ceramic Strawberry Cake Money Bank,11.74,12,12589.0,France
560363,2023-07-18,22644,Ceramic Cherry Cake Money Bank,11.74,12,12589.0,France
560364,2023-07-18,47566,Party Bunting,14.5,50,16705.0,United Kingdom
560364,2023-07-18,84997D,Childrens Cutlery Polkadot Pink,14.5,8,16705.0,United Kingdom
560364,2023-07-18,84997C,Childrens Cutlery Polkadot Blue,14.5,8,16705.0,United Kingdom
560364,2023-07-18,84997B,Childrens Cutlery Retrospot Red,14.5,8,16705.0,United Kingdom
560364,2023-07-18,84997A,Childrens Cutlery Polkadot Green,14.5,8,16705.0,United Kingdom
560364,2023-07-18,22328,Round Snack Boxes Set Of 4 Fruits,13.27,12,16705.0,United Kingdom
560364,2023-07-18,20685,Doormat Red Retrospot,17.17,10,16705.0,United Kingdom
560364,2023-07-18,22892,Set Of Salt And Pepper Toadstools,11.53,24,16705.0,United Kingdom
560364,2023-07-18,21535,Red Retrospot Small Milk Jug,12.86,12,16705.0,United Kingdom
560364,2023-07-18,22960,Jam Making Set With Jars,14.09,12,16705.0,United Kingdom
560364,2023-07-18,22993,Set Of 4 Pantry Jelly Moulds,11.53,12,16705.0,United Kingdom
560364,2023-07-18,22840,Round Cake Tin Vintage Red,18.4,4,16705.0,United Kingdom
560364,2023-07-18,22627,Mint Kitchen Scales,18.96,2,16705.0,United Kingdom
560364,2023-07-18,21078,Set/20 Strawberry Paper Napkins,11.12,24,16705.0,United Kingdom
560364,2023-07-18,22851,Set 20 Napkins Fairy Cakes Design,11.12,24,16705.0,United Kingdom
560364,2023-07-18,22908,Pack Of 20 Napkins Red Apples,11.12,24,16705.0,United Kingdom
560364,2023-07-18,23054,Recycled Acapulco Mat Lavender,18.71,2,16705.0,United Kingdom
560364,2023-07-18,23052,Recycled Acapulco Mat Turquoise,18.71,2,16705.0,United Kingdom
560364,2023-07-18,23050,Recycled Acapulco Mat Green,18.71,2,16705.0,United Kingdom
560364,2023-07-18,23051,Recycled Acapulco Mat Blue,18.71,2,16705.0,United Kingdom
560364,2023-07-18,22467,Gumball Coat Rack,12.4,36,16705.0,United Kingdom
560364,2023-07-18,85123A,Cream Hanging Heart T-Light Holder,12.86,32,16705.0,United Kingdom
560364,2023-07-18,48188,Doormat Welcome Puppies,17.17,10,16705.0,United Kingdom
560364,2023-07-18,23283,Doormat Vintage Leaf,17.17,10,16705.0,United Kingdom
560364,2023-07-18,48184,Doormat English Rose,17.17,10,16705.0,United Kingdom
560364,2023-07-18,48187,Doormat New England,17.17,10,16705.0,United Kingdom
560364,2023-07-18,22456,Natural Slate Chalkboard Large,14.61,18,16705.0,United Kingdom
560364,2023-07-18,82486,3 Drawer Antique White Wood Cabinet,19.42,4,16705.0,United Kingdom
560364,2023-07-18,82483,Wood 2 Drawer Cabinet White Finish,17.37,2,16705.0,United Kingdom
560364,2023-07-18,82482,Wooden Picture Frame White Finish,12.4,36,16705.0,United Kingdom
560364,2023-07-18,82494L,Wooden Frame Antique White,12.86,24,16705.0,United Kingdom
560364,2023-07-18,22189,Cream Heart Card Holder,13.72,36,16705.0,United Kingdom
560366,2023-07-18,22460,Embossed Glass Tealight Holder,11.53,12,16859.0,United Kingdom
560366,2023-07-18,23022,Small Bonne Jam Jar T-Light Holder,12.38,6,16859.0,United Kingdom
560366,2023-07-18,23145,Zinc T-Light Holder Star Large,11.22,12,16859.0,United Kingdom
560366,2023-07-18,23144,Zinc T-Light Holder Stars Small,11.1,12,16859.0,United Kingdom
560366,2023-07-18,84755,Colour Glass T-Light Holder Hanging,10.92,16,16859.0,United Kingdom
560366,2023-07-18,84970L,Single Heart Zinc T-Light Holder,11.22,12,16859.0,United Kingdom
560366,2023-07-18,84949,Silver Hanging T-Light Holder,11.94,6,16859.0,United Kingdom
560366,2023-07-18,84978,Hanging Heart Jar T-Light Holder,11.53,12,16859.0,United Kingdom
560366,2023-07-18,18097C,White Tall Porcelain T-Light Holder,12.86,6,16859.0,United Kingdom
560366,2023-07-18,22791,T-Light Glass Fluted Antique,11.53,12,16859.0,United Kingdom
560366,2023-07-18,23039,T-Light Holder Silver Heart Handle,12.25,6,16859.0,United Kingdom
560366,2023-07-18,23086,Zinc Star T-Light Holder,11.53,16,16859.0,United Kingdom
560366,2023-07-18,23090,Vintage Glass T-Light Holder,11.1,12,16859.0,United Kingdom
560366,2023-07-18,23087,Zinc Heart T-Light Holder,11.53,16,16859.0,United Kingdom
560366,2023-07-18,84945,Multi Colour Silver T-Light Holder,11.12,12,16859.0,United Kingdom
560366,2023-07-18,84946,Antique Silver T-Light Glass,11.53,12,16859.0,United Kingdom
560366,2023-07-18,72807C,Set/3 Vanilla Scented Candle In Box,14.61,4,16859.0,United Kingdom
560366,2023-07-18,72807A,Set/3 Rose Candle In Jewelled Box,14.61,4,16859.0,United Kingdom
560366,2023-07-18,85231B,Cinammon Set Of 9 T-Lights,11.12,12,16859.0,United Kingdom
560366,2023-07-18,85231G,Orange Scented Set/9 T-Lights,11.12,12,16859.0,United Kingdom
560366,2023-07-18,82484,Wood Black Board Ant White Finish,18.4,2,16859.0,United Kingdom
560366,2023-07-18,22752,Set 7 Babushka Nesting Boxes,18.96,2,16859.0,United Kingdom
560366,2023-07-18,22149,Feltcraft 6 Flower Friends,12.4,6,16859.0,United Kingdom
560366,2023-07-18,23310,Bubblegum Ring Assorted,10.68,36,16859.0,United Kingdom
560366,2023-07-18,23109,Pack Of Six Led Tea Lights,13.21,6,16859.0,United Kingdom
560366,2023-07-18,20974,12 Pencils Small Tube Skull,10.92,24,16859.0,United Kingdom
560366,2023-07-18,21829,Dinosaur Keyrings Assorted,10.47,36,16859.0,United Kingdom
560366,2023-07-18,21495,Skulls And Crossbones Wrap,10.68,25,16859.0,United Kingdom
560366,2023-07-18,21498,Red Retrospot Wrap,10.68,25,16859.0,United Kingdom
560366,2023-07-18,23230,Wrap Alphabet Design,10.68,25,16859.0,United Kingdom
560366,2023-07-18,16237,Sleeping Cat Erasers,10.47,30,16859.0,United Kingdom
560366,2023-07-18,10125,Mini Funky Design Tapes,11.12,20,16859.0,United Kingdom
560368,2023-07-18,22652,Travel Sewing Kit,11.94,1,17841.0,United Kingdom
560368,2023-07-18,22893,Mini Cake Stand T-Light Holder,10.68,5,17841.0,United Kingdom
560368,2023-07-18,22557,Plasters In Tin Vintage Paisley,11.94,3,17841.0,United Kingdom
560368,2023-07-18,23241,Treasure Tin Gymkhana Design,12.38,4,17841.0,United Kingdom
560368,2023-07-18,47566B,Tea Time Party Bunting,15.32,2,17841.0,United Kingdom
560368,2023-07-18,85170D,Set/6 Pink Bird T-Light Candles,12.4,1,17841.0,United Kingdom
560368,2023-07-18,21523,Doormat Fancy Font Home Sweet Home,18.4,2,17841.0,United Kingdom
560368,2023-07-18,23284,Doormat Keep Calm And Come In,18.4,2,17841.0,United Kingdom
560368,2023-07-18,22690,Doormat Home Sweet Home Blue,18.4,2,17841.0,United Kingdom
560368,2023-07-18,22691,Doormat Welcome Sunrise,18.4,2,17841.0,United Kingdom
560368,2023-07-18,48116,Doormat Multicolour Stripe,18.4,2,17841.0,United Kingdom
560368,2023-07-18,22692,Doormat Welcome To Our Home,18.4,2,17841.0,United Kingdom
560368,2023-07-18,48138,Doormat Union Flag,18.4,2,17841.0,United Kingdom
560368,2023-07-18,48194,Doormat Hearts,18.4,2,17841.0,United Kingdom
560368,2023-07-18,48129,Doormat Topiary,18.4,2,17841.0,United Kingdom
560368,2023-07-18,23300,Gardeners Kneeling Pad Cup Of Tea,11.94,5,17841.0,United Kingdom
560368,2023-07-18,23301,Gardeners Kneeling Pad Keep Calm,11.94,5,17841.0,United Kingdom
560368,2023-07-18,20886,Box Of 9 Pebble Candles,12.25,7,17841.0,United Kingdom
560368,2023-07-18,72351A,Set/6 Turquoise Butterfly T-Lights,12.4,7,17841.0,United Kingdom
560368,2023-07-18,22551,Plasters In Tin Spaceboy,11.94,7,17841.0,United Kingdom
560368,2023-07-18,22556,Plasters In Tin Circus Parade,11.94,5,17841.0,United Kingdom
560368,2023-07-18,22555,Plasters In Tin Strongman,11.94,5,17841.0,United Kingdom
560368,2023-07-18,22554,Plasters In Tin Woodland Animals,11.94,7,17841.0,United Kingdom
560368,2023-07-18,22553,Plasters In Tin Skulls,11.94,5,17841.0,United Kingdom
560368,2023-07-18,20719,Woodland Charlotte Bag,11.12,5,17841.0,United Kingdom
560368,2023-07-18,72349B,Set/6 Purple Butterfly T-Lights,12.4,7,17841.0,United Kingdom
560368,2023-07-18,72351B,Set/6 Pink Butterfly T-Lights,12.4,7,17841.0,United Kingdom
560368,2023-07-18,22807,Set Of 6 T-Lights Toadstools,13.27,4,17841.0,United Kingdom
560368,2023-07-18,22730,Alarm Clock Bakelike Ivory,14.09,5,17841.0,United Kingdom
560368,2023-07-18,22728,Alarm Clock Bakelike Pink,14.09,5,17841.0,United Kingdom
560368,2023-07-18,22725,Alarm Clock Bakelike Chocolate,14.09,5,17841.0,United Kingdom
560368,2023-07-18,21559,Strawberry Lunch Box With Cutlery,12.86,5,17841.0,United Kingdom
560368,2023-07-18,21561,Dinosaur Lunch Box With Cutlery,12.86,5,17841.0,United Kingdom
560368,2023-07-18,21558,Skull Lunch Box With Cutlery,12.86,5,17841.0,United Kingdom
560368,2023-07-18,22993,Set Of 4 Pantry Jelly Moulds,11.53,5,17841.0,United Kingdom
560368,2023-07-18,22766,Photo Frame Cornice,13.27,6,17841.0,United Kingdom
560368,2023-07-18,82482,Wooden Picture Frame White Finish,12.86,6,17841.0,United Kingdom
560368,2023-07-18,22998,Travel Card Wallet Keep Calm,10.68,10,17841.0,United Kingdom
560368,2023-07-18,23000,Travel Card Wallet Transport,10.68,10,17841.0,United Kingdom
560368,2023-07-18,22999,Travel Card Wallet Vintage Leaf,10.68,10,17841.0,United Kingdom
560368,2023-07-18,23002,Travel Card Wallet Skulls,10.68,10,17841.0,United Kingdom
560368,2023-07-18,20717,Strawberry Shopper Bag,11.53,1,17841.0,United Kingdom
560368,2023-07-18,21927,Blue/Cream Stripe Cushion Cover,11.53,2,17841.0,United Kingdom
560368,2023-07-18,46000M,Polyester Filler Pad 45x45cm,11.84,1,17841.0,United Kingdom
560368,2023-07-18,20679,Edwardian Parasol Red,16.35,1,17841.0,United Kingdom
560368,2023-07-18,85014B,Red Retrospot Umbrella,16.35,1,17841.0,United Kingdom
560368,2023-07-18,22659,Lunch Box I Love London,12.25,1,17841.0,United Kingdom
560368,2023-07-18,23133,Large Ivory Heart Wall Organiser,18.71,1,17841.0,United Kingdom
560368,2023-07-18,84519B,Carrot Charlie+Lola Coaster Set,11.53,2,17841.0,United Kingdom
560368,2023-07-18,84375,Set Of 20 Kids Cookie Cutters,12.4,1,17841.0,United Kingdom
560368,2023-07-18,23160,Regency Tea Spoon,11.53,1,17841.0,United Kingdom
560368,2023-07-18,22757,Large Red Babushka Notebook,11.53,1,17841.0,United Kingdom
560368,2023-07-18,22348,Tea Bag Plate Red Retrospot,11.12,1,17841.0,United Kingdom
560368,2023-07-18,21975,Pack Of 60 Dinosaur Cake Cases,10.81,2,17841.0,United Kingdom
560368,2023-07-18,84992,72 Sweetheart Fairy Cake Cases,10.81,2,17841.0,United Kingdom
560368,2023-07-18,21213,Pack Of 72 Skull Cake Cases,10.81,2,17841.0,United Kingdom
560368,2023-07-18,20668,Disco Ball Christmas Decoration,10.37,24,17841.0,United Kingdom
560368,2023-07-18,23156,Set Of 5 Mini Grocery Magnets,12.38,1,17841.0,United Kingdom
560368,2023-07-18,23158,Set Of 5 Lucky Cat Magnets,12.38,1,17841.0,United Kingdom
560368,2023-07-18,23154,Set Of 4 Jam Jar Magnets,12.38,1,17841.0,United Kingdom
560368,2023-07-18,21894,Potting Shed Seed Envelopes,11.53,1,17841.0,United Kingdom
560368,2023-07-18,22419,Lipstick Pen Red,10.68,2,17841.0,United Kingdom
560368,2023-07-18,22981,Pantry Apple Corer,11.74,1,17841.0,United Kingdom
560368,2023-07-18,22676,French Blue Metal Door Sign 1,11.53,2,17841.0,United Kingdom
560368,2023-07-18,85123A,Cream Hanging Heart T-Light Holder,13.27,1,17841.0,United Kingdom
560368,2023-07-18,71270,Photo Clip Line,11.53,1,17841.0,United Kingdom
560368,2023-07-18,22671,French Laundry Sign Blue Metal,11.94,1,17841.0,United Kingdom
560368,2023-07-18,22672,French Bathroom Sign Blue Metal,11.94,1,17841.0,United Kingdom
560368,2023-07-18,22875,Number Tile Cottage Garden 7,12.25,1,17841.0,United Kingdom
560368,2023-07-18,22886,Number Tile Vintage Font 7,12.25,1,17841.0,United Kingdom
560368,2023-07-18,84971S,Small Heart Flowers Hook,11.12,3,17841.0,United Kingdom
560368,2023-07-18,22173,Metal 4 Hook Hanger French Chateau,13.27,1,17841.0,United Kingdom
560368,2023-07-18,23147,Single Antique Rose Hook Ivory,11.74,1,17841.0,United Kingdom
560368,2023-07-18,23146,Triple Hook Antique Ivory Rose,13.62,1,17841.0,United Kingdom
560368,2023-07-18,23144,Zinc T-Light Holder Stars Small,11.1,2,17841.0,United Kingdom
560368,2023-07-18,22595,Gingham Heart Decoration,11.12,1,17841.0,United Kingdom
560368,2023-07-18,84637,Kitchen Flower Pots Wall Plaque,16.35,1,17841.0,United Kingdom
560368,2023-07-18,71053,White Moroccan Metal Lantern,14.09,2,17841.0,United Kingdom
560368,2023-07-18,22427,Enamel Flower Jug Cream,16.35,1,17841.0,United Kingdom
560368,2023-07-18,21756,Bath Building Block Word,16.35,1,17841.0,United Kingdom
560368,2023-07-18,23165,Large Ceramic Top Storage Jar,11.94,1,17841.0,United Kingdom
560368,2023-07-18,21446,12 Red Rose Peg Place Settings,11.53,5,17841.0,United Kingdom
560368,2023-07-18,22771,Clear Drawer Knob Acrylic Edwardian,11.53,3,17841.0,United Kingdom
560368,2023-07-18,22773,Green Drawer Knob Acrylic Edwardian,11.53,26,17841.0,United Kingdom
560368,2023-07-18,22469,Heart Of Wicker Small,11.94,1,17841.0,United Kingdom
560368,2023-07-18,22470,Heart Of Wicker Large,13.27,2,17841.0,United Kingdom
560368,2023-07-18,22666,Recipe Box Pantry Yellow Design,13.27,1,17841.0,United Kingdom
560368,2023-07-18,22665,Recipe Box Blue Sketchbook Design,13.27,1,17841.0,United Kingdom
560368,2023-07-18,21495,Skulls And Crossbones Wrap,10.68,25,17841.0,United Kingdom
560368,2023-07-18,20618,Queen Of The Skies Passport Cover,12.4,1,17841.0,United Kingdom
560368,2023-07-18,20655,Queen Of Skies Luggage Tag,11.53,1,17841.0,United Kingdom
560368,2023-07-18,22483,Red Gingham Teddy Bear,13.27,1,17841.0,United Kingdom
560368,2023-07-18,23300,Gardeners Kneeling Pad Cup Of Tea,11.94,1,17841.0,United Kingdom
560368,2023-07-18,21935,Suki Shoulder Bag,11.94,2,17841.0,United Kingdom
560368,2023-07-18,22355,Charlotte Bag Suki Design,11.12,5,17841.0,United Kingdom
560368,2023-07-18,20723,Strawberry Charlotte Bag,11.12,1,17841.0,United Kingdom
560368,2023-07-18,20724,Red Retrospot Charlotte Bag,11.12,1,17841.0,United Kingdom
560368,2023-07-18,23108,Set Of 10 Led Dolly Lights,16.66,1,17841.0,United Kingdom
560368,2023-07-18,23297,Set 40 Heart Shape Petit Four Cases,11.94,1,17841.0,United Kingdom
560368,2023-07-18,23293,Set Of 12 Fairy Cake Baking Cases,11.1,1,17841.0,United Kingdom
560368,2023-07-18,20719,Woodland Charlotte Bag,11.12,1,17841.0,United Kingdom
560368,2023-07-18,22756,Large Yellow Babushka Notebook,11.53,1,17841.0,United Kingdom
560368,2023-07-18,22753,Small Yellow Babushka Notebook,11.12,1,17841.0,United Kingdom
