TransactionNo,Date,ProductNo,ProductName,Price,Quantity,CustomerNo,Country
572284,2023-10-23,23377,Pack Of 12 Dolly Girl Tissues,10.65,12,16744.0,United Kingdom
572284,2023-10-23,22090,Paper Bunting Retrospot,13.27,1,16744.0,United Kingdom
572284,2023-10-23,21680,Woodland Stickers,11.12,6,16744.0,United Kingdom
572284,2023-10-23,20981,12 Pencils Tall Tube Woodland,11.12,3,16744.0,United Kingdom
572284,2023-10-23,23289,Dolly Girl Childrens Bowl,11.53,4,16744.0,United Kingdom
572284,2023-10-23,21578,Woodland Design Cotton Tote Bag,12.56,2,16744.0,United Kingdom
572284,2023-10-23,23292,Spaceboy Childrens Cup,11.53,4,16744.0,United Kingdom
572284,2023-10-23,23290,Spaceboy Childrens Bowl,11.53,4,16744.0,United Kingdom
572284,2023-10-23,22712,Card Dolly Girl,10.68,12,16744.0,United Kingdom
572284,2023-10-23,22029,Spaceboy Birthday Card,10.68,12,16744.0,United Kingdom
572284,2023-10-23,21918,Set 12 Kids Colour Chalk Sticks,10.68,4,16744.0,United Kingdom
572284,2023-10-23,23390,Dolly Girl Mini Backpack,14.5,2,16744.0,United Kingdom
572284,2023-10-23,22326,Round Snack Boxes Set Of4 Woodland,13.27,2,16744.0,United Kingdom
572284,2023-10-23,23389,Spaceboy Mini Backpack,14.5,2,16744.0,United Kingdom
572284,2023-10-23,22899,Children's Apron Dolly Girl,12.4,4,16744.0,United Kingdom
572284,2023-10-23,23291,Dolly Girl Childrens Cup,11.53,4,16744.0,United Kingdom
572284,2023-10-23,22617,Baking Set Spaceboy Design,15.32,2,16744.0,United Kingdom
572284,2023-10-23,22273,Feltcraft Doll Molly,13.27,1,16744.0,United Kingdom
572284,2023-10-23,22274,Feltcraft Doll Emily,13.27,1,16744.0,United Kingdom
572284,2023-10-23,51014L,Feather Pen Light Pink,10.65,12,16744.0,United Kingdom
572284,2023-10-23,51014A,Feather Pen Hot Pink,10.65,12,16744.0,United Kingdom
572284,2023-10-23,22560,Traditional Modelling Clay,11.53,4,16744.0,United Kingdom
572284,2023-10-23,21790,Vintage Snap Cards,11.12,4,16744.0,United Kingdom
572284,2023-10-23,21791,Vintage Heads And Tails Card Game,11.53,4,16744.0,United Kingdom
572284,2023-10-23,21578,Woodland Design Cotton Tote Bag,12.56,2,16744.0,United Kingdom
572284,2023-10-23,22630,Dolly Girl Lunch Box,12.25,4,16744.0,United Kingdom
572284,2023-10-23,22629,Spaceboy Lunch Box,12.25,4,16744.0,United Kingdom
572284,2023-10-23,22662,Lunch Bag Dolly Girl Design,5.97,6,16744.0,United Kingdom
572284,2023-10-23,22382,Lunch Bag Spaceboy Design,5.97,6,16744.0,United Kingdom
572285,2023-10-23,22692,Doormat Welcome To Our Home,18.71,1,14698.0,United Kingdom
572285,2023-10-23,82484,Wood Black Board Ant White Finish,18.4,1,14698.0,United Kingdom
572285,2023-10-23,23541,Wall Art Classic Puddings,18.71,1,14698.0,United Kingdom
572285,2023-10-23,23534,Wall Art Stop For Tea,16.35,2,14698.0,United Kingdom
572285,2023-10-23,23093,Small Parisienne Heart Photo Frame,12.8,2,14698.0,United Kingdom
572285,2023-10-23,23328,Set 6 School Milk Bottles In Crate,14.09,1,14698.0,United Kingdom
572285,2023-10-23,84832,Zinc Willie Winkie Candle Stick,11.12,8,14698.0,United Kingdom
572285,2023-10-23,23431,Natural Hanging Quilted Hearts,11.1,12,14698.0,United Kingdom
572285,2023-10-23,21391,French Lavender Scent Heart,11.02,3,14698.0,United Kingdom
572285,2023-10-23,21391,French Lavender Scent Heart,11.02,3,14698.0,United Kingdom
572285,2023-10-23,23354,6 Gift Tags 50'S Christmas,11.1,6,14698.0,United Kingdom
572285,2023-10-23,35970,Zinc Folkart Sleigh Bells,11.98,1,14698.0,United Kingdom
572285,2023-10-23,79051A,Smokey Grey Colour Glass,10.55,16,14698.0,United Kingdom
572285,2023-10-23,23107,White Hearts Wire Plant Pot Holder,13.21,4,14698.0,United Kingdom
572285,2023-10-23,35970,Zinc Folkart Sleigh Bells,11.98,3,14698.0,United Kingdom
572285,2023-10-23,22575,Metal Merry Christmas Wreath,12.25,2,14698.0,United Kingdom
572285,2023-10-23,23328,Set 6 School Milk Bottles In Crate,14.09,1,14698.0,United Kingdom
572285,2023-10-23,23352,Roll Wrap 50'S Red Christmas,11.53,4,14698.0,United Kingdom
572285,2023-10-23,23351,Roll Wrap 50'S Christmas,11.53,4,14698.0,United Kingdom
572285,2023-10-23,23360,Set 8 Candles Vintage Doily,12.25,4,14698.0,United Kingdom
572286,2023-10-23,22500,Set Of 2 Tins Jardin De Provence,15.32,4,16434.0,United Kingdom
572286,2023-10-23,23378,Pack Of 12 50'S Christmas Tissues,10.65,12,16434.0,United Kingdom
572286,2023-10-23,23264,Set Of 3 Wooden Sleigh Decorations,11.53,12,16434.0,United Kingdom
572286,2023-10-23,22219,Lovebird Hanging Decoration White,11.12,12,16434.0,United Kingdom
572286,2023-10-23,23570,Traditional Pick Up Sticks Game,11.53,1,16434.0,United Kingdom
572286,2023-10-23,22557,Plasters In Tin Vintage Paisley,11.94,1,16434.0,United Kingdom
572286,2023-10-23,22555,Plasters In Tin Strongman,11.94,1,16434.0,United Kingdom
572286,2023-10-23,23534,Wall Art Stop For Tea,16.35,1,16434.0,United Kingdom
572286,2023-10-23,22739,Ribbon Reel Christmas Sock Bauble,11.94,5,16434.0,United Kingdom
572286,2023-10-23,23503,Playing Cards Keep Calm & Carry On,11.53,6,16434.0,United Kingdom
572286,2023-10-23,22774,Red Drawer Knob Acrylic Edwardian,11.53,12,16434.0,United Kingdom
572286,2023-10-23,23266,Set Of 3 Wooden Stocking Decoration,11.53,12,16434.0,United Kingdom
572286,2023-10-23,23265,Set Of 3 Wooden Tree Decorations,11.53,12,16434.0,United Kingdom
572286,2023-10-23,21823,Painted Metal Heart With Holly Bell,10.65,24,16434.0,United Kingdom
572286,2023-10-23,22800,Antique Tall Swirlglass Trinket Pot,14.09,4,16434.0,United Kingdom
572286,2023-10-23,22798,Antique Glass Dressing Table Pot,13.27,4,16434.0,United Kingdom
572286,2023-10-23,84947,Antique Silver Tea Glass Engraved,11.53,6,16434.0,United Kingdom
572286,2023-10-23,23234,Biscuit Tin Vintage Christmas,13.21,6,16434.0,United Kingdom
572286,2023-10-23,23100,Silver Bells Table Decoration,11.53,12,16434.0,United Kingdom
572287,2023-10-23,48185,Doormat Fairy Cake,18.71,1,15584.0,United Kingdom
572287,2023-10-23,23320,Giant 50'S Christmas Cracker,13.21,3,15584.0,United Kingdom
572287,2023-10-23,37446,Mini Cake Stand With Hanging Cakes,11.74,4,15584.0,United Kingdom
572287,2023-10-23,23319,Box Of 6 Mini 50'S Crackers,12.8,2,15584.0,United Kingdom
572287,2023-10-23,23318,Box Of 6 Mini Vintage Crackers,12.8,1,15584.0,United Kingdom
572287,2023-10-23,20973,12 Pencil Small Tube Woodland,10.92,2,15584.0,United Kingdom
572287,2023-10-23,23156,Set Of 5 Mini Grocery Magnets,12.38,1,15584.0,United Kingdom
572287,2023-10-23,23159,Set Of 5 Pancake Day Magnets,12.38,2,15584.0,United Kingdom
572287,2023-10-23,37340,Multicolour Spring Flower Mug,10.65,6,15584.0,United Kingdom
572287,2023-10-23,22158,3 Hearts Hanging Decoration Rustic,13.27,2,15584.0,United Kingdom
572287,2023-10-23,23311,Vintage Christmas Stocking,12.86,3,15584.0,United Kingdom
572287,2023-10-23,23313,Vintage Christmas Bunting,15.32,3,15584.0,United Kingdom
572287,2023-10-23,20724,Red Retrospot Charlotte Bag,11.12,2,15584.0,United Kingdom
572287,2023-10-23,84879,Assorted Colour Bird Ornament,11.98,8,15584.0,United Kingdom
572287,2023-10-23,22086,Paper Chain Kit 50'S Christmas,13.27,2,15584.0,United Kingdom
572287,2023-10-23,22911,Paper Chain Kit London,13.27,2,15584.0,United Kingdom
572287,2023-10-23,85049E,Scandinavian Reds Ribbons,11.53,2,15584.0,United Kingdom
572287,2023-10-23,22909,Set Of 20 Vintage Christmas Napkins,11.12,3,15584.0,United Kingdom
572287,2023-10-23,23170,Regency Tea Plate Roses,11.94,12,15584.0,United Kingdom
572287,2023-10-23,23048,Set Of 10 Lanterns Fairy Light Star,14.5,2,15584.0,United Kingdom
572287,2023-10-23,23013,Glass Apothecary Bottle Tonic,14.3,1,15584.0,United Kingdom
572287,2023-10-23,23012,Glass Apothecary Bottle Perfume,14.3,1,15584.0,United Kingdom
572287,2023-10-23,22810,Set Of 6 T-Lights Snowmen,13.27,6,15584.0,United Kingdom
572287,2023-10-23,22799,Sweetheart Wire Fruit Bowl,18.96,1,15584.0,United Kingdom
572287,2023-10-23,23161,Regency Cake Fork,11.53,12,15584.0,United Kingdom
572287,2023-10-23,23249,Vintage Red Enamel Trim Plate,11.94,3,15584.0,United Kingdom
572287,2023-10-23,23250,Vintage Red Trim Enamel Bowl,11.53,4,15584.0,United Kingdom
572287,2023-10-23,21328,Balloons Writing Set,11.94,2,15584.0,United Kingdom
572287,2023-10-23,72818,Christmas Decoupage Candle,10.65,12,15584.0,United Kingdom
572287,2023-10-23,22809,Set Of 6 T-Lights Santa,13.27,6,15584.0,United Kingdom
572287,2023-10-23,22186,Red Star Card Holder,12.25,1,15584.0,United Kingdom
572287,2023-10-23,23252,Vintage Red Enamel Trim Jug,14.09,1,15584.0,United Kingdom
572287,2023-10-23,23133,Large Ivory Heart Wall Organiser,18.71,2,15584.0,United Kingdom
572287,2023-10-23,84006,Magic Tree -Paper Flowers,11.12,3,15584.0,United Kingdom
572287,2023-10-23,21034,Rex Cash+Carry Jumbo Shopper,11.22,1,15584.0,United Kingdom
572288,2023-10-23,22960,Jam Making Set With Jars,14.61,1,17377.0,United Kingdom
572288,2023-10-23,22963,Jam Jar With Green Lid,11.12,2,17377.0,United Kingdom
572288,2023-10-23,22962,Jam Jar With Pink Lid,11.12,2,17377.0,United Kingdom
572288,2023-10-23,22766,Photo Frame Cornice,13.27,1,17377.0,United Kingdom
572288,2023-10-23,22111,Scottie Dog Hot Water Bottle,15.32,2,17377.0,United Kingdom
572288,2023-10-23,23355,Hot Water Bottle Keep Calm,15.32,2,17377.0,United Kingdom
572288,2023-10-23,21485,Retrospot Heart Hot Water Bottle,15.32,2,17377.0,United Kingdom
572288,2023-10-23,23354,6 Gift Tags 50'S Christmas,11.1,2,17377.0,United Kingdom
572288,2023-10-23,22979,Pantry Washing Up Brush,11.74,1,17377.0,United Kingdom
572288,2023-10-23,22980,Pantry Scrubbing Brush,11.94,1,17377.0,United Kingdom
572288,2023-10-23,23298,Spotty Bunting,15.32,4,17377.0,United Kingdom
572288,2023-10-23,23356,Love Hot Water Bottle,16.35,3,17377.0,United Kingdom
572288,2023-10-23,23355,Hot Water Bottle Keep Calm,15.32,5,17377.0,United Kingdom
572288,2023-10-23,21621,Vintage Union Jack Bunting,18.96,5,17377.0,United Kingdom
572288,2023-10-23,47566B,Tea Time Party Bunting,15.32,5,17377.0,United Kingdom
572288,2023-10-23,22023,Empire Birthday Card,10.68,12,17377.0,United Kingdom
572288,2023-10-23,22712,Card Dolly Girl,10.68,12,17377.0,United Kingdom
572288,2023-10-23,22024,Rainy Ladies Birthday Card,10.68,12,17377.0,United Kingdom
572288,2023-10-23,22028,Penny Farthing Birthday Card,10.68,12,17377.0,United Kingdom
572288,2023-10-23,22983,Card Billboard Font,10.68,12,17377.0,United Kingdom
572288,2023-10-23,85099B,Jumbo Bag Red Retrospot,6.19,2,17377.0,United Kingdom
572289,2023-10-23,23320,Giant 50'S Christmas Cracker,13.21,2,13782.0,United Kingdom
572289,2023-10-23,23469,Card Holder Love Bird Small,14.5,2,13782.0,United Kingdom
572289,2023-10-23,21773,Decorative Rose Bathroom Bottle,11.53,1,13782.0,United Kingdom
572289,2023-10-23,21775,Decorative Flore Bathroom Bottle,11.53,1,13782.0,United Kingdom
572289,2023-10-23,85123A,Cream Hanging Heart T-Light Holder,13.27,2,13782.0,United Kingdom
572289,2023-10-23,21733,Red Hanging Heart T-Light Holder,13.27,2,13782.0,United Kingdom
572289,2023-10-23,21175,Gin And Tonic Diet Metal Sign,12.86,2,13782.0,United Kingdom
572289,2023-10-23,21774,Decorative Cats Bathroom Bottle,11.53,1,13782.0,United Kingdom
572289,2023-10-23,21351,Cinammon & Orange Wreath,17.17,1,13782.0,United Kingdom
572289,2023-10-23,23274,Star T-Light Holder Willie Winkie,11.94,2,13782.0,United Kingdom
572289,2023-10-23,23272,Tree T-Light Holder Willie Winkie,11.94,2,13782.0,United Kingdom
572289,2023-10-23,23273,Heart T-Light Holder Willie Winkie,11.94,2,13782.0,United Kingdom
572289,2023-10-23,85184C,Set 4 Valentine Decoupage Heart Box,13.27,2,13782.0,United Kingdom
572289,2023-10-23,23418,Lavender Toilette Bottle,12.38,2,13782.0,United Kingdom
572289,2023-10-23,23089,Glass Bon Bon Jar,12.25,2,13782.0,United Kingdom
572289,2023-10-23,21288,Stripey Chocolate Nesting Boxes,13.27,2,13782.0,United Kingdom
572289,2023-10-23,22766,Photo Frame Cornice,13.27,2,13782.0,United Kingdom
572289,2023-10-23,84970S,Hanging Heart Zinc T-Light Holder,11.12,12,13782.0,United Kingdom
572289,2023-10-23,22798,Antique Glass Dressing Table Pot,13.27,2,13782.0,United Kingdom
572289,2023-10-23,23090,Vintage Glass T-Light Holder,11.1,12,13782.0,United Kingdom
572289,2023-10-23,23169,Classic Glass Cookie Jar,14.5,2,13782.0,United Kingdom
572290,2023-10-23,22491,Pack Of 12 Coloured Pencils,11.12,12,14800.0,United Kingdom
572290,2023-10-23,22983,Card Billboard Font,10.68,12,14800.0,United Kingdom
572290,2023-10-23,22029,Spaceboy Birthday Card,10.68,12,14800.0,United Kingdom
572290,2023-10-23,22712,Card Dolly Girl,10.68,12,14800.0,United Kingdom
572290,2023-10-23,23280,Folding Butterfly Mirror Hot Pink,11.1,1,14800.0,United Kingdom
572290,2023-10-23,22865,Hand Warmer Owl Design,12.4,3,14800.0,United Kingdom
572290,2023-10-23,23439,Hand Warmer Red Love Heart,12.4,3,14800.0,United Kingdom
572290,2023-10-23,22866,Hand Warmer Scotty Dog Design,12.4,2,14800.0,United Kingdom
572290,2023-10-23,22633,Hand Warmer Union Jack,12.4,4,14800.0,United Kingdom
572290,2023-10-23,23501,Key Ring Baseball Boot Union Jack,11.53,20,14800.0,United Kingdom
572290,2023-10-23,23500,Key Ring Baseball Boot Assorted,11.53,40,14800.0,United Kingdom
572290,2023-10-23,23390,Dolly Girl Mini Backpack,14.5,2,14800.0,United Kingdom
572290,2023-10-23,23389,Spaceboy Mini Backpack,14.5,2,14800.0,United Kingdom
572290,2023-10-23,82616C,Midnight Glamour Scarf Knitting Kit,11.53,1,14800.0,United Kingdom
572290,2023-10-23,21875,Kings Choice Mug,11.53,1,14800.0,United Kingdom
572290,2023-10-23,21871,Save The Planet Mug,11.94,1,14800.0,United Kingdom
572290,2023-10-23,22659,Lunch Box I Love London,12.25,6,14800.0,United Kingdom
572290,2023-10-23,47599A,Pink Party Bags,12.4,3,14800.0,United Kingdom
572290,2023-10-23,47599B,Blue Party Bags,12.4,2,14800.0,United Kingdom
572290,2023-10-23,22530,Magic Drawing Slate Dolly Girl,10.68,15,14800.0,United Kingdom
572290,2023-10-23,22534,Magic Drawing Slate Spaceboy,10.68,12,14800.0,United Kingdom
572290,2023-10-23,23506,Mini Playing Cards Spaceboy,10.68,12,14800.0,United Kingdom
572290,2023-10-23,23508,Mini Playing Cards Dolly Girl,10.68,15,14800.0,United Kingdom
572290,2023-10-23,22998,Travel Card Wallet Keep Calm,10.68,24,14800.0,United Kingdom
572290,2023-10-23,23284,Doormat Keep Calm And Come In,18.71,1,14800.0,United Kingdom
572290,2023-10-23,85124C,Green Juicy Fruit Photo Frame,12.86,1,14800.0,United Kingdom
572290,2023-10-23,20970,Pink Floral Feltcraft Shoulder Bag,14.09,6,14800.0,United Kingdom
572290,2023-10-23,22985,Wrap Billboard Fonts Design,10.68,25,14800.0,United Kingdom
572290,2023-10-23,22708,Wrap Dolly Girl,10.68,25,14800.0,United Kingdom
572290,2023-10-23,22045,Spaceboy Gift Wrap,10.68,25,14800.0,United Kingdom
572291,2023-10-23,22598,Christmas Musical Zinc Tree,10.55,3,16931.0,United Kingdom
572291,2023-10-23,85123A,Cream Hanging Heart T-Light Holder,13.27,6,16931.0,United Kingdom
572291,2023-10-23,85038,6 Chocolate Love Heart T-Lights,12.4,6,16931.0,United Kingdom
572291,2023-10-23,47518F,Icon Placemat Pop Art Elvis,10.37,1,16931.0,United Kingdom
572291,2023-10-23,22625,Red Kitchen Scales,18.96,1,16931.0,United Kingdom
572291,2023-10-23,22627,Mint Kitchen Scales,18.96,1,16931.0,United Kingdom
572291,2023-10-23,22624,Ivory Kitchen Scales,18.96,2,16931.0,United Kingdom
572291,2023-10-23,23354,6 Gift Tags 50'S Christmas,11.1,6,16931.0,United Kingdom
572291,2023-10-23,21823,Painted Metal Heart With Holly Bell,10.65,6,16931.0,United Kingdom
572291,2023-10-23,21824,Painted Metal Star With Holly Bells,10.65,6,16931.0,United Kingdom
572291,2023-10-23,22577,Wooden Heart Christmas Scandinavian,10.55,3,16931.0,United Kingdom
572291,2023-10-23,22581,Wood Stocking Christmas Scandispot,11.12,3,16931.0,United Kingdom
572291,2023-10-23,22335,Heart Decoration Painted Zinc,10.92,6,16931.0,United Kingdom
572291,2023-10-23,22339,Christmas Tree Painted Zinc,10.44,6,16931.0,United Kingdom
572291,2023-10-23,22338,Star Decoration Painted Zinc,10.44,6,16931.0,United Kingdom
572291,2023-10-23,23342,Mint Diner Wall Clock,18.96,1,16931.0,United Kingdom
572291,2023-10-23,22193,Red Diner Wall Clock,18.96,1,16931.0,United Kingdom
572291,2023-10-23,22191,Ivory Diner Wall Clock,18.96,1,16931.0,United Kingdom
572291,2023-10-23,22599,Christmas Musical Zinc Star,10.55,6,16931.0,United Kingdom
572291,2023-10-23,22598,Christmas Musical Zinc Tree,10.55,3,16931.0,United Kingdom
572291,2023-10-23,23088,Zinc Heart Flower T-Light Holder,11.53,6,16931.0,United Kingdom
572291,2023-10-23,23272,Tree T-Light Holder Willie Winkie,11.94,3,16931.0,United Kingdom
572291,2023-10-23,23273,Heart T-Light Holder Willie Winkie,11.94,3,16931.0,United Kingdom
572291,2023-10-23,23274,Star T-Light Holder Willie Winkie,11.94,3,16931.0,United Kingdom
572291,2023-10-23,23265,Set Of 3 Wooden Tree Decorations,11.53,1,16931.0,United Kingdom
572291,2023-10-23,23263,Set Of 3 Wooden Heart Decorations,11.53,1,16931.0,United Kingdom
572291,2023-10-23,23266,Set Of 3 Wooden Stocking Decoration,11.53,1,16931.0,United Kingdom
572291,2023-10-23,23264,Set Of 3 Wooden Sleigh Decorations,11.53,1,16931.0,United Kingdom
572291,2023-10-23,23501,Key Ring Baseball Boot Union Jack,11.53,6,16931.0,United Kingdom
572291,2023-10-23,23469,Card Holder Love Bird Small,14.5,1,16931.0,United Kingdom
572291,2023-10-23,23148,Miniature Antique Rose Hook Ivory,11.1,6,16931.0,United Kingdom
572291,2023-10-23,22728,Alarm Clock Bakelike Pink,14.09,3,16931.0,United Kingdom
572291,2023-10-23,22730,Alarm Clock Bakelike Ivory,14.09,3,16931.0,United Kingdom
572291,2023-10-23,84347,Rotating Silver Angels T-Light Hldr,12.86,6,16931.0,United Kingdom
572291,2023-10-23,23147,Single Antique Rose Hook Ivory,11.74,3,16931.0,United Kingdom
572291,2023-10-23,20754,Retrospot Red Washing Up Gloves,12.4,3,16931.0,United Kingdom
572291,2023-10-23,22560,Traditional Modelling Clay,11.53,6,16931.0,United Kingdom
572291,2023-10-23,23131,Mistletoe Heart Wreath Cream,14.5,1,16931.0,United Kingdom
572291,2023-10-23,22812,Pack 3 Boxes Christmas Panettone,12.25,3,16931.0,United Kingdom
572291,2023-10-23,37413,Icon Mug Revolutionary,10.65,4,16931.0,United Kingdom
572291,2023-10-23,23320,Giant 50'S Christmas Cracker,13.21,1,16931.0,United Kingdom
572291,2023-10-23,22086,Paper Chain Kit 50'S Christmas,13.27,1,16931.0,United Kingdom
572291,2023-10-23,23319,Box Of 6 Mini 50'S Crackers,12.8,3,16931.0,United Kingdom
572291,2023-10-23,23351,Roll Wrap 50'S Christmas,11.53,12,16931.0,United Kingdom
572291,2023-10-23,23199,Jumbo Bag Apples,6.19,2,16931.0,United Kingdom
572291,2023-10-23,23344,Jumbo Bag 50'S Christmas,6.19,3,16931.0,United Kingdom
572291,2023-10-23,23437,50'S Christmas Gift Bag Large,5.77,6,16931.0,United Kingdom
572291,2023-10-23,23375,50'S Christmas Paper Gift Bag,5.55,6,16931.0,United Kingdom
572292,2023-10-23,22469,Heart Of Wicker Small,11.94,6,16017.0,United Kingdom
572292,2023-10-23,22470,Heart Of Wicker Large,13.27,3,16017.0,United Kingdom
572292,2023-10-23,85049E,Scandinavian Reds Ribbons,11.53,2,16017.0,United Kingdom
572292,2023-10-23,85049A,Traditional Christmas Ribbons,11.53,6,16017.0,United Kingdom
572292,2023-10-23,85049E,Scandinavian Reds Ribbons,11.53,5,16017.0,United Kingdom
572292,2023-10-23,22866,Hand Warmer Scotty Dog Design,12.4,1,16017.0,United Kingdom
572292,2023-10-23,22633,Hand Warmer Union Jack,12.4,1,16017.0,United Kingdom
572292,2023-10-23,23515,Embroidered Ribbon Reel Daisy,12.38,3,16017.0,United Kingdom
572292,2023-10-23,23513,Embroidered Ribbon Reel Susie,12.38,3,16017.0,United Kingdom
572292,2023-10-23,23518,Embroidered Ribbon Reel Rachel,13.21,3,16017.0,United Kingdom
572292,2023-10-23,23579,Snack Tray I Love London,12.25,3,16017.0,United Kingdom
572292,2023-10-23,23226,Filigree Heart Daisy White,11.53,1,16017.0,United Kingdom
572292,2023-10-23,23226,Filigree Heart Daisy White,11.53,6,16017.0,United Kingdom
572292,2023-10-23,22079,Ribbon Reel Hearts Design,11.94,5,16017.0,United Kingdom
572292,2023-10-23,22479,Daisy Garden Marker,11.53,10,16017.0,United Kingdom
572292,2023-10-23,22866,Hand Warmer Scotty Dog Design,12.4,2,16017.0,United Kingdom
572292,2023-10-23,22633,Hand Warmer Union Jack,12.4,2,16017.0,United Kingdom
572292,2023-10-23,22632,Hand Warmer Red Retrospot,12.4,3,16017.0,United Kingdom
572292,2023-10-23,23106,Zinc Hearts Plant Pot Holder,13.21,2,16017.0,United Kingdom
572292,2023-10-23,23107,White Hearts Wire Plant Pot Holder,13.21,2,16017.0,United Kingdom
572292,2023-10-23,23439,Hand Warmer Red Love Heart,12.4,4,16017.0,United Kingdom
572292,2023-10-23,23439,Hand Warmer Red Love Heart,12.4,2,16017.0,United Kingdom
572292,2023-10-23,22866,Hand Warmer Scotty Dog Design,12.4,3,16017.0,United Kingdom
572292,2023-10-23,85049H,Urban Black Ribbons,11.53,3,16017.0,United Kingdom
572292,2023-10-23,85049G,Chocolate Box Ribbons,11.53,3,16017.0,United Kingdom
572292,2023-10-23,85049C,Romantic Pinks Ribbons,11.53,3,16017.0,United Kingdom
572292,2023-10-23,22074,6 Ribbons Shimmering Pinks,11.94,3,16017.0,United Kingdom
572292,2023-10-23,21135,Victorian Metal Postcard Spring,11.98,3,16017.0,United Kingdom
572292,2023-10-23,23302,Kneeling Mat Housework Design,11.94,3,16017.0,United Kingdom
572292,2023-10-23,23301,Gardeners Kneeling Pad Keep Calm,11.94,3,16017.0,United Kingdom
572294,2023-10-23,22557,Plasters In Tin Vintage Paisley,11.94,5,13471.0,United Kingdom
572294,2023-10-23,23078,Ice Cream Pen Lip Gloss,11.53,20,13471.0,United Kingdom
572294,2023-10-23,23077,Doughnut Lip Gloss,11.53,20,13471.0,United Kingdom
572294,2023-10-23,85014B,Red Retrospot Umbrella,16.35,4,13471.0,United Kingdom
572294,2023-10-23,20682,Red Retrospot Childrens Umbrella,13.58,5,13471.0,United Kingdom
572294,2023-10-23,22111,Scottie Dog Hot Water Bottle,15.32,3,13471.0,United Kingdom
572294,2023-10-23,22835,Hot Water Bottle I Am So Poorly,15.32,3,13471.0,United Kingdom
572294,2023-10-23,22114,Hot Water Bottle Tea And Sympathy,14.61,2,13471.0,United Kingdom
572294,2023-10-23,84030E,English Rose Hot Water Bottle,14.61,2,13471.0,United Kingdom
572294,2023-10-23,21485,Retrospot Heart Hot Water Bottle,15.32,2,13471.0,United Kingdom
572294,2023-10-23,22112,Chocolate Hot Water Bottle,15.32,2,13471.0,United Kingdom
572294,2023-10-23,22377,Bottle Bag Retrospot,12.4,10,13471.0,United Kingdom
572294,2023-10-23,22951,60 Cake Cases Dolly Girl Design,10.81,24,13471.0,United Kingdom
572294,2023-10-23,21212,Pack Of 72 Retrospot Cake Cases,10.81,24,13471.0,United Kingdom
572294,2023-10-23,22567,20 Dolly Pegs Retrospot,11.74,4,13471.0,United Kingdom
572294,2023-10-23,23380,Pack Of 12 Vintage Doily Tissues,10.65,12,13471.0,United Kingdom
572294,2023-10-23,23377,Pack Of 12 Dolly Girl Tissues,10.65,12,13471.0,United Kingdom
572294,2023-10-23,21980,Pack Of 12 Red Retrospot Tissues,10.65,12,13471.0,United Kingdom
572294,2023-10-23,22625,Red Kitchen Scales,18.96,2,13471.0,United Kingdom
572294,2023-10-23,21716,Boys Vintage Tin Seaside Bucket,12.86,8,13471.0,United Kingdom
572294,2023-10-23,21715,Girls Vintage Tin Seaside Bucket,12.86,8,13471.0,United Kingdom
572294,2023-10-23,22978,Pantry Rolling Pin,14.09,2,13471.0,United Kingdom
572294,2023-10-23,22907,Pack Of 20 Napkins Pantry Design,11.12,5,13471.0,United Kingdom
572294,2023-10-23,20718,Red Retrospot Shopper Bag,11.53,20,13471.0,United Kingdom
572294,2023-10-23,21411,Gingham Heart Doorstop Red,14.61,2,13471.0,United Kingdom
572294,2023-10-23,21429,Red Gingham Rose Jewellery Box,12.25,4,13471.0,United Kingdom
572294,2023-10-23,22522,Childs Garden Fork Blue,11.12,5,13471.0,United Kingdom
572294,2023-10-23,22523,Childs Garden Fork Pink,11.12,5,13471.0,United Kingdom
572294,2023-10-23,22514,Childs Garden Spade Blue,12.4,4,13471.0,United Kingdom
572294,2023-10-23,22515,Childs Garden Spade Pink,12.4,4,13471.0,United Kingdom
572294,2023-10-23,21558,Skull Lunch Box With Cutlery,12.86,2,13471.0,United Kingdom
572294,2023-10-23,22567,20 Dolly Pegs Retrospot,11.74,1,13471.0,United Kingdom
572294,2023-10-23,21154,Red Retrospot Oven Glove,11.53,2,13471.0,United Kingdom
572294,2023-10-23,23198,Pantry Magnetic Shopping List,11.74,4,13471.0,United Kingdom
572294,2023-10-23,21986,Pack Of 12 Pink Polkadot Tissues,10.65,12,13471.0,United Kingdom
572294,2023-10-23,21718,Red Metal Beach Spade,11.53,16,13471.0,United Kingdom
572294,2023-10-23,23184,Bull Dog Bottle Opener,15.32,3,13471.0,United Kingdom
572294,2023-10-23,21559,Strawberry Lunch Box With Cutlery,12.86,2,13471.0,United Kingdom
572294,2023-10-23,20754,Retrospot Red Washing Up Gloves,12.4,6,13471.0,United Kingdom
572294,2023-10-23,23300,Gardeners Kneeling Pad Cup Of Tea,11.94,5,13471.0,United Kingdom
572294,2023-10-23,23301,Gardeners Kneeling Pad Keep Calm,11.94,5,13471.0,United Kingdom
572294,2023-10-23,23366,Set 12 Colouring Pencils Doily,10.92,48,13471.0,United Kingdom
572294,2023-10-23,22193,Red Diner Wall Clock,18.96,2,13471.0,United Kingdom
572294,2023-10-23,21974,Set Of 36 Paisley Flower Doilies,11.74,6,13471.0,United Kingdom
572294,2023-10-23,21211,Set Of 72 Skull Paper Doilies,11.74,4,13471.0,United Kingdom
572294,2023-10-23,84987,Set Of 36 Teatime Paper Doilies,11.74,6,13471.0,United Kingdom
572294,2023-10-23,23306,Set Of 36 Pantry Paper Doilies,11.74,6,13471.0,United Kingdom
572294,2023-10-23,84988,Set Of 72 Pink Heart Paper Doilies,11.74,5,13471.0,United Kingdom
572294,2023-10-23,21155,Red Retrospot Peg Bag,12.86,10,13471.0,United Kingdom
572294,2023-10-23,21625,Vintage Union Jack Apron,17.37,5,13471.0,United Kingdom
572294,2023-10-23,22899,Children's Apron Dolly Girl,12.4,8,13471.0,United Kingdom
572294,2023-10-23,21154,Red Retrospot Oven Glove,11.53,3,13471.0,United Kingdom
572294,2023-10-23,47591D,Pink Fairy Cake Childrens Apron,12.25,6,13471.0,United Kingdom
572294,2023-10-23,21156,Retrospot Childrens Apron,12.25,7,13471.0,United Kingdom
572294,2023-10-23,22367,Childrens Apron Spaceboy Design,12.25,5,13471.0,United Kingdom
572294,2023-10-23,22666,Recipe Box Pantry Yellow Design,13.27,4,13471.0,United Kingdom
572294,2023-10-23,23293,Set Of 12 Fairy Cake Baking Cases,11.1,8,13471.0,United Kingdom
572294,2023-10-23,23296,Set Of 6 Tea Time Baking Cases,11.53,4,13471.0,United Kingdom
572294,2023-10-23,23295,Set Of 12 Mini Loaf Baking Cases,11.1,8,13471.0,United Kingdom
