TransactionNo,Date,ProductNo,ProductName,Price,Quantity,CustomerNo,Country
544925,2023-02-24,21929,Jumbo Bag Pink Vintage Paisley,6.13,30,16997.0,United Kingdom
544925,2023-02-24,20712,Jumbo Bag Woodland Animals,6.13,30,16997.0,United Kingdom
544926,2023-02-24,37450,Ceramic Cake Bowl + Hanging Cakes,13.27,6,13468.0,United Kingdom
544926,2023-02-24,79321,Chilli Lights,16.14,4,13468.0,United Kingdom
544926,2023-02-24,85123A,Cream Hanging Heart T-Light Holder,13.27,6,13468.0,United Kingdom
544926,2023-02-24,22993,Set Of 4 Pantry Jelly Moulds,11.53,12,13468.0,United Kingdom
544926,2023-02-24,48184,Doormat English Rose,18.4,2,13468.0,United Kingdom
544926,2023-02-24,48185,Doormat Fairy Cake,18.4,2,13468.0,United Kingdom
544927,2023-02-24,44092C,Purple/Copper Hanging Lampshade,11.12,1,15927.0,EIRE
544928,2023-02-24,20979,36 Pencils Tube Red Retrospot,12.77,1,15928.0,United Kingdom
544928,2023-02-24,21002,Rose Du Sud Drawstring Bag,13.62,2,15928.0,United Kingdom
544928,2023-02-24,21071,Vintage Billboard Drink Me Mug,12.77,1,15928.0,United Kingdom
544928,2023-02-24,21080,Set/20 Red Retrospot Paper Napkins,11.92,2,15928.0,United Kingdom
544928,2023-02-24,21094,Set/6 Red Spotty Paper Plates,11.1,6,15928.0,United Kingdom
544928,2023-02-24,21121,Set/10 Red Polkadot Party Candles,12.77,1,15928.0,United Kingdom
544928,2023-02-24,21154,Red Retrospot Oven Glove,12.77,3,15928.0,United Kingdom
544928,2023-02-24,21165,Beware Of The Cat Metal Sign,14.48,1,15928.0,United Kingdom
544928,2023-02-24,21219,Set/4 Badges Balloon Girl,12.77,2,15928.0,United Kingdom
544928,2023-02-24,21253,Set Of Picture Frame Stickers,16.18,3,15928.0,United Kingdom
544928,2023-02-24,21285,Retrospot Candle Medium,14.48,1,15928.0,United Kingdom
544928,2023-02-24,21314,Small Glass Heart Trinket Pot,14.48,1,15928.0,United Kingdom
544928,2023-02-24,21422,Porcelain Rose Small,11.92,1,15928.0,United Kingdom
544928,2023-02-24,21470,Flower Vine Raffia Food Cover,17.9,1,15928.0,United Kingdom
544928,2023-02-24,21481,Fawn Blue Hot Water Bottle,16.18,1,15928.0,United Kingdom
544928,2023-02-24,21531,Red Retrospot Sugar Jam Bowl,15.33,1,15928.0,United Kingdom
544928,2023-02-24,21641,Assorted Tutti Frutti Keyring Ball,11.92,1,15928.0,United Kingdom
544928,2023-02-24,21643,Assorted Tutti Frutti Mirror,12.77,1,15928.0,United Kingdom
544928,2023-02-24,21673,White Spot Blue Ceramic Drawer Knob,13.66,2,15928.0,United Kingdom
544928,2023-02-24,21733,Red Hanging Heart T-Light Holder,16.18,1,15928.0,United Kingdom
544928,2023-02-24,21791,Vintage Heads And Tails Card Game,12.77,1,15928.0,United Kingdom
544928,2023-02-24,21833,Camouflage Led Torch,13.62,21,15928.0,United Kingdom
544928,2023-02-24,21864,Union Jack Flag Passport Cover,14.48,1,15928.0,United Kingdom
544928,2023-02-24,21880,Red Retrospot Tape,10.68,1,15928.0,United Kingdom
544928,2023-02-24,21905,More Butter Metal Sign,11.92,4,15928.0,United Kingdom
544928,2023-02-24,21931,Jumbo Storage Bag Suki,14.48,1,15928.0,United Kingdom
544928,2023-02-24,21985,Pack Of 12 Hearts Design Tissues,11.1,1,15928.0,United Kingdom
544928,2023-02-24,21991,Bohemian Collage Stationery Set,12.77,1,15928.0,United Kingdom
544928,2023-02-24,21992,Vintage Paisley Stationery Set,12.77,4,15928.0,United Kingdom
544928,2023-02-24,21993,Floral Folk Stationery Set,12.77,1,15928.0,United Kingdom
544928,2023-02-24,22055,Mini Cake Stand Hanging Strawbery,13.62,2,15928.0,United Kingdom
544928,2023-02-24,22064,Pink Doughnut Trinket Pot,13.62,3,15928.0,United Kingdom
544928,2023-02-24,22090,Paper Bunting Retrospot,16.18,2,15928.0,United Kingdom
544928,2023-02-24,22123,Ping Microwave Apron,15.33,2,15928.0,United Kingdom
544928,2023-02-24,22174,Photo Cube,13.62,1,15928.0,United Kingdom
544928,2023-02-24,22183,Cake Stand Victorian Filigree Med,16.18,1,15928.0,United Kingdom
544928,2023-02-24,22245,Hook 1 Hanger Magic Garden,11.92,2,15928.0,United Kingdom
544928,2023-02-24,22268,Decoration Sitting Bunny,11.92,1,15928.0,United Kingdom
544928,2023-02-24,22329,Round Container Set Of 5 Retrospot,13.62,1,15928.0,United Kingdom
544928,2023-02-24,22349,Dog Bowl Chasing Ball Design,17.9,1,15928.0,United Kingdom
544928,2023-02-24,22356,Charlotte Bag Pink Polkadot,11.92,1,15928.0,United Kingdom
544928,2023-02-24,22378,Wall Tidy Retrospot,14.48,1,15928.0,United Kingdom
544928,2023-02-24,22393,Paperweight Vintage Collage,15.33,1,15928.0,United Kingdom
544928,2023-02-24,22395,Paperweight Vintage Paisley,15.33,1,15928.0,United Kingdom
544928,2023-02-24,22409,Money Box Biscuits Design,12.77,1,15928.0,United Kingdom
544928,2023-02-24,22441,Grow Your Own Basil In Enamel Mug,14.48,1,15928.0,United Kingdom
544928,2023-02-24,22457,Natural Slate Heart Chalkboard,16.18,2,15928.0,United Kingdom
544928,2023-02-24,22470,Heart Of Wicker Large,16.18,1,15928.0,United Kingdom
544928,2023-02-24,22494,Emergency First Aid Tin,12.77,1,15928.0,United Kingdom
544928,2023-02-24,22502,Picnic Basket Wicker Small,18.75,1,15928.0,United Kingdom
544928,2023-02-24,22551,Plasters In Tin Spaceboy,13.62,1,15928.0,United Kingdom
544928,2023-02-24,22557,Plasters In Tin Vintage Paisley,13.62,1,15928.0,United Kingdom
544928,2023-02-24,22558,Clothes Pegs Retrospot Pack 24,12.77,1,15928.0,United Kingdom
544928,2023-02-24,22616,Pack Of 12 London Tissues,11.1,1,15928.0,United Kingdom
544928,2023-02-24,22630,Dolly Girl Lunch Box,14.48,2,15928.0,United Kingdom
544928,2023-02-24,22659,Lunch Box I Love London,14.48,1,15928.0,United Kingdom
544928,2023-02-24,22666,Recipe Box Pantry Yellow Design,16.18,2,15928.0,United Kingdom
544928,2023-02-24,22674,French Toilet Sign Blue Metal,12.77,1,15928.0,United Kingdom
544928,2023-02-24,22697,Green Regency Teacup And Saucer,16.18,2,15928.0,United Kingdom
544928,2023-02-24,22698,Pink Regency Teacup And Saucer,16.18,2,15928.0,United Kingdom
544928,2023-02-24,22699,Roses Regency Teacup And Saucer,16.18,4,15928.0,United Kingdom
544928,2023-02-24,22713,Card I Love London,11.1,1,15928.0,United Kingdom
544928,2023-02-24,22722,Set Of 6 Spice Tins Pantry Design,18.75,2,15928.0,United Kingdom
544928,2023-02-24,22723,Set Of 6 Herb Tins Sketchbook,18.75,1,15928.0,United Kingdom
544928,2023-02-24,22759,Set Of 3 Notebooks In Parcel,13.62,2,15928.0,United Kingdom
544928,2023-02-24,22771,Clear Drawer Knob Acrylic Edwardian,12.81,9,15928.0,United Kingdom
544928,2023-02-24,22772,Pink Drawer Knob Acrylic Edwardian,12.81,7,15928.0,United Kingdom
544928,2023-02-24,22774,Red Drawer Knob Acrylic Edwardian,12.81,1,15928.0,United Kingdom
544928,2023-02-24,22792,Fluted Antique Candle Holder,11.92,6,15928.0,United Kingdom
544928,2023-02-24,22805,Blue Drawer Knob Acrylic Edwardian,12.81,8,15928.0,United Kingdom
544928,2023-02-24,22815,Card Psychedelic Apples,11.1,1,15928.0,United Kingdom
544928,2023-02-24,22893,Mini Cake Stand T-Light Holder,11.1,7,15928.0,United Kingdom
544928,2023-02-24,22900,Set 2 Tea Towels I Love London,16.18,1,15928.0,United Kingdom
544928,2023-02-24,22915,Assorted Bottle Top Magnets,15.33,2,15928.0,United Kingdom
544928,2023-02-24,22916,Herb Marker Thyme,11.92,1,15928.0,United Kingdom
544928,2023-02-24,22917,Herb Marker Rosemary,11.92,1,15928.0,United Kingdom
544928,2023-02-24,22919,Herb Marker Mint,11.92,1,15928.0,United Kingdom
544928,2023-02-24,22920,Herb Marker Basil,11.92,1,15928.0,United Kingdom
544928,2023-02-24,22949,Set Of 36 Dolly Girl Paper Doilies,13.24,1,15928.0,United Kingdom
544928,2023-02-24,22961,Jam Making Set Printed,13.62,4,15928.0,United Kingdom
544928,2023-02-24,22980,Pantry Scrubbing Brush,13.62,1,15928.0,United Kingdom
544928,2023-02-24,22993,Set Of 4 Pantry Jelly Moulds,12.81,2,15928.0,United Kingdom
544928,2023-02-24,22994,Travel Card Wallet Retrospot,11.1,1,15928.0,United Kingdom
544928,2023-02-24,22995,Travel Card Wallet Suki,11.1,2,15928.0,United Kingdom
544928,2023-02-24,22996,Travel Card Wallet Vintage Ticket,11.1,3,15928.0,United Kingdom
544928,2023-02-24,22998,Travel Card Wallet Keep Calm,11.1,1,15928.0,United Kingdom
544928,2023-02-24,23000,Travel Card Wallet Transport,11.1,2,15928.0,United Kingdom
544928,2023-02-24,23002,Travel Card Wallet Skulls,11.1,1,15928.0,United Kingdom
544928,2023-02-24,23004,Travel Card Wallet Pantry,11.1,1,15928.0,United Kingdom
544928,2023-02-24,35809A,Enamel Pink Tea Container,14.48,2,15928.0,United Kingdom
544928,2023-02-24,35810A,Enamel Pink Coffee Container,14.48,2,15928.0,United Kingdom
544928,2023-02-24,35915B,Blue Knitted Hen,11.1,4,15928.0,United Kingdom
544928,2023-02-24,35915C,Peach Knitted Hen,11.1,8,15928.0,United Kingdom
544928,2023-02-24,47559B,Tea Time Oven Glove,12.77,3,15928.0,United Kingdom
544928,2023-02-24,47593B,Scottie Dogs Baby Bib,11.1,4,15928.0,United Kingdom
544928,2023-02-24,72051S,Bag Of Silver Stones,11.1,2,15928.0,United Kingdom
544928,2023-02-24,72369A,Pink Clear Glass Candle Plate,12.77,1,15928.0,United Kingdom
544928,2023-02-24,82567,Airline Lounge Metal Sign,11.92,1,15928.0,United Kingdom
544928,2023-02-24,82600,N0 Singing Metal Sign,14.48,1,15928.0,United Kingdom
544928,2023-02-24,84279B,Cherry Blossom Decorative Flask,18.75,1,15928.0,United Kingdom
544928,2023-02-24,84378,Set Of 3 Heart Cookie Cutters,12.77,2,15928.0,United Kingdom
544928,2023-02-24,84509B,Set Of 4 Fairy Cake Placemats,17.9,1,15928.0,United Kingdom
544928,2023-02-24,84598,Boys Alphabet Iron On Patches,10.68,4,15928.0,United Kingdom
544928,2023-02-24,84692,Box Of 24 Cocktail Parasols,11.1,1,15928.0,United Kingdom
544928,2023-02-24,84796A,Pink Hawaiian Picnic Hamper For 2,18.75,1,15928.0,United Kingdom
544928,2023-02-24,84796B,Blue Savannah Picnic Hamper For 2,18.75,2,15928.0,United Kingdom
544928,2023-02-24,84913A,Soft Pink Rose Towel,13.62,5,15928.0,United Kingdom
544928,2023-02-24,84913B,Mint Green Rose Towel,13.62,5,15928.0,United Kingdom
544928,2023-02-24,84987,Set Of 36 Teatime Paper Doilies,13.24,1,15928.0,United Kingdom
544928,2023-02-24,84988,Set Of 72 Pink Heart Paper Doilies,13.24,1,15928.0,United Kingdom
544928,2023-02-24,85059,French Enamel Water Basin,17.9,1,15928.0,United Kingdom
544928,2023-02-24,85116,Black Candelabra T-Light Holder,11.92,7,15928.0,United Kingdom
544928,2023-02-24,85132C,Charlie And Lola Figures Tins,18.75,1,15928.0,United Kingdom
544928,2023-02-24,90013A,Midnight Blue Vintage Earrings,14.07,1,15928.0,United Kingdom
544928,2023-02-24,90013B,Black Vintage Earrings,14.5,1,15928.0,United Kingdom
544928,2023-02-24,90086,Crystal Frog Phone Charm,11.92,1,15928.0,United Kingdom
544928,2023-02-24,90214H,"Letter ""H"" Bling Key Ring",11.1,1,15928.0,United Kingdom
544928,2023-02-24,16052,Teatime Push Down Rubber,11.1,2,15928.0,United Kingdom
544928,2023-02-24,16235,Recycled Pencil With Rabbit Eraser,10.68,1,15928.0,United Kingdom
544928,2023-02-24,16236,Kitty Pencil Erasers,10.68,1,15928.0,United Kingdom
544928,2023-02-24,16237,Sleeping Cat Erasers,10.68,1,15928.0,United Kingdom
544928,2023-02-24,16238,Party Time Pencil Erasers,10.68,1,15928.0,United Kingdom
544928,2023-02-24,20617,First Class Passport Cover,14.48,1,15928.0,United Kingdom
544928,2023-02-24,20619,Tropical Passport Cover,11.92,1,15928.0,United Kingdom
544928,2023-02-24,20653,Cherry Blossom Luggage Tag,12.77,1,15928.0,United Kingdom
544928,2023-02-24,20665,Red Retrospot Purse,16.18,1,15928.0,United Kingdom
544928,2023-02-24,20707,Crazy Daisy Heart Decoration,11.1,1,15928.0,United Kingdom
544928,2023-02-24,20719,Woodland Charlotte Bag,11.92,1,15928.0,United Kingdom
544928,2023-02-24,20723,Strawberry Charlotte Bag,11.92,1,15928.0,United Kingdom
544928,2023-02-24,20724,Red Retrospot Charlotte Bag,11.92,1,15928.0,United Kingdom
544928,2023-02-24,20735,Black Mini Tape Measure,11.1,20,15928.0,United Kingdom
544928,2023-02-24,20770,Abstract Circle Journal,12.77,1,15928.0,United Kingdom
544928,2023-02-24,20829,Glitter Hanging Butterfly String,14.48,1,15928.0,United Kingdom
544928,2023-02-24,20914,Set/5 Red Retrospot Lid Glass Bowls,16.18,1,15928.0,United Kingdom
544928,2023-02-24,20931,Blue Pot Plant Candle,17.9,2,15928.0,United Kingdom
544928,2023-02-24,20978,36 Pencils Tube Skulls,12.77,1,15928.0,United Kingdom
544928,2023-02-24,22173,Metal 4 Hook Hanger French Chateau,13.27,3,15928.0,United Kingdom
544928,2023-02-24,85123A,Cream Hanging Heart T-Light Holder,13.27,3,15928.0,United Kingdom
544928,2023-02-24,82494L,Wooden Frame Antique White,13.27,9,15928.0,United Kingdom
544928,2023-02-24,21733,Red Hanging Heart T-Light Holder,13.27,5,15928.0,United Kingdom
544928,2023-02-24,85099B,Jumbo Bag Red Retrospot,7.24,1,15928.0,United Kingdom
544928,2023-02-24,85099C,Jumbo Bag Baroque Black White,7.24,1,15928.0,United Kingdom
544928,2023-02-24,85099F,Jumbo Bag Strawberry,7.24,1,15928.0,United Kingdom
544928,2023-02-24,20713,Jumbo Bag Owls,7.24,1,15928.0,United Kingdom
544928,2023-02-24,20725,Lunch Bag Red Retrospot,7.24,1,15928.0,United Kingdom
544929,2023-02-24,47566,Party Bunting,15.32,12,15189.0,United Kingdom
544929,2023-02-24,84946,Antique Silver T-Light Glass,11.34,72,15189.0,United Kingdom
544930,2023-02-24,22440,Balloon Water Bomb Pack Of 35,10.68,1,17472.0,United Kingdom
544930,2023-02-24,22241,Garland Wooden Happy Easter,11.53,2,17472.0,United Kingdom
544930,2023-02-24,22621,Traditional Knitting Nancy,11.74,2,17472.0,United Kingdom
544930,2023-02-24,22470,Heart Of Wicker Large,13.27,1,17472.0,United Kingdom
544930,2023-02-24,21730,Glass Star Frosted T-Light Holder,15.32,1,17472.0,United Kingdom
544930,2023-02-24,47599A,Pink Party Bags,12.4,1,17472.0,United Kingdom
544930,2023-02-24,47599B,Blue Party Bags,12.4,1,17472.0,United Kingdom
544930,2023-02-24,22348,Tea Bag Plate Red Retrospot,11.12,2,17472.0,United Kingdom
544930,2023-02-24,22294,Heart Filigree Dove Small,11.53,2,17472.0,United Kingdom
544930,2023-02-24,22993,Set Of 4 Pantry Jelly Moulds,11.53,1,17472.0,United Kingdom
544930,2023-02-24,22297,Heart Ivory Trellis Small,11.53,1,17472.0,United Kingdom
544930,2023-02-24,21389,Ivory Hanging Decoration Bird,11.12,2,17472.0,United Kingdom
544930,2023-02-24,21385,Ivory Hanging Decoration Heart,11.12,2,17472.0,United Kingdom
544930,2023-02-24,22295,Heart Filigree Dove Large,11.94,1,17472.0,United Kingdom
544930,2023-02-24,22297,Heart Ivory Trellis Small,11.53,1,17472.0,United Kingdom
544930,2023-02-24,22296,Heart Ivory Trellis Large,11.94,2,17472.0,United Kingdom
544930,2023-02-24,22907,Pack Of 20 Napkins Pantry Design,11.12,1,17472.0,United Kingdom
544930,2023-02-24,22851,Set 20 Napkins Fairy Cakes Design,11.12,3,17472.0,United Kingdom
544930,2023-02-24,22405,Money Box Pocket Money Design,11.53,1,17472.0,United Kingdom
544930,2023-02-24,84597C,Retro Pink Ball Ashtray,11.53,2,17472.0,United Kingdom
544930,2023-02-24,22557,Plasters In Tin Vintage Paisley,11.94,1,17472.0,United Kingdom
544930,2023-02-24,22266,Easter Decoration Hanging Bunny,10.92,5,17472.0,United Kingdom
544930,2023-02-24,22405,Money Box Pocket Money Design,11.53,1,17472.0,United Kingdom
544930,2023-02-24,40016,Chinese Dragon Paper Lanterns,10.68,12,17472.0,United Kingdom
544930,2023-02-24,21984,Pack Of 12 Pink Paisley Tissues,10.55,1,17472.0,United Kingdom
544930,2023-02-24,21894,Potting Shed Seed Envelopes,11.53,1,17472.0,United Kingdom
544930,2023-02-24,21894,Potting Shed Seed Envelopes,11.53,1,17472.0,United Kingdom
544930,2023-02-24,47590B,Pink Happy Birthday Bunting,15.84,1,17472.0,United Kingdom
544930,2023-02-24,22488,Natural Slate Rectangle Chalkboard,11.94,9,17472.0,United Kingdom
544930,2023-02-24,22457,Natural Slate Heart Chalkboard,13.27,2,17472.0,United Kingdom
544930,2023-02-24,22185,Slate Tile Natural Hanging,11.94,4,17472.0,United Kingdom
544930,2023-02-24,21894,Potting Shed Seed Envelopes,11.53,1,17472.0,United Kingdom
544930,2023-02-24,21125,Set 6 Football Celebration Candles,11.53,1,17472.0,United Kingdom
544930,2023-02-24,22555,Plasters In Tin Strongman,11.94,1,17472.0,United Kingdom
544930,2023-02-24,21212,Pack Of 72 Retrospot Cake Cases,10.81,2,17472.0,United Kingdom
544930,2023-02-24,21873,If You Can't Stand The Heat Mug,11.53,1,17472.0,United Kingdom
544930,2023-02-24,22666,Recipe Box Pantry Yellow Design,13.27,1,17472.0,United Kingdom
544930,2023-02-24,22667,Recipe Box Retrospot,13.27,2,17472.0,United Kingdom
544930,2023-02-24,21124,Set/10 Blue Polkadot Party Candles,11.53,1,17472.0,United Kingdom
544930,2023-02-24,21122,Set/10 Pink Polkadot Party Candles,11.53,1,17472.0,United Kingdom
544930,2023-02-24,21121,Set/10 Red Polkadot Party Candles,11.53,1,17472.0,United Kingdom
544930,2023-02-24,22558,Clothes Pegs Retrospot Pack 24,11.78,2,17472.0,United Kingdom
544930,2023-02-24,22456,Natural Slate Chalkboard Large,15.32,2,17472.0,United Kingdom
544930,2023-02-24,20914,Set/5 Red Retrospot Lid Glass Bowls,13.27,2,17472.0,United Kingdom
544930,2023-02-24,21216,Set 3 Retrospot Tea/Coffee/Sugar,15.32,1,17472.0,United Kingdom
544930,2023-02-24,21980,Pack Of 12 Red Retrospot Tissues,10.55,12,17472.0,United Kingdom
544930,2023-02-24,22723,Set Of 6 Herb Tins Sketchbook,14.3,2,17472.0,United Kingdom
544930,2023-02-24,20894,Hanging Bauble T-Light Holder Large,13.27,1,17472.0,United Kingdom
544930,2023-02-24,22722,Set Of 6 Spice Tins Pantry Design,14.3,1,17472.0,United Kingdom
544930,2023-02-24,22723,Set Of 6 Herb Tins Sketchbook,14.3,1,17472.0,United Kingdom
544930,2023-02-24,71459,Hanging Jam Jar T-Light Holders,11.12,12,17472.0,United Kingdom
544930,2023-02-24,22477,Watering Can Garden Marker,11.53,10,17472.0,United Kingdom
544930,2023-02-24,22479,Daisy Garden Marker,11.53,10,17472.0,United Kingdom
544930,2023-02-24,84755,Colour Glass T-Light Holder Hanging,10.92,8,17472.0,United Kingdom
544930,2023-02-24,22722,Set Of 6 Spice Tins Pantry Design,14.3,1,17472.0,United Kingdom
544930,2023-02-24,21034,Rex Cash+Carry Jumbo Shopper,11.22,1,17472.0,United Kingdom
544931,2023-02-24,21680,Woodland Stickers,11.12,12,13501.0,United Kingdom
544931,2023-02-24,22968,Rose Cottage Keepsake Box,18.96,8,13501.0,United Kingdom
544931,2023-02-24,37495,Fairy Cake Birthday Candle Set,14.09,4,13501.0,United Kingdom
544931,2023-02-24,15060B,Fairy Cake Design Umbrella,14.09,4,13501.0,United Kingdom
544931,2023-02-24,22891,Tea For One Polkadot,14.61,3,13501.0,United Kingdom
544931,2023-02-24,22558,Clothes Pegs Retrospot Pack 24,11.78,12,13501.0,United Kingdom
544931,2023-02-24,84991,60 Teatime Fairy Cake Cases,10.81,24,13501.0,United Kingdom
544931,2023-02-24,22057,Ceramic Plate Strawberry Design,11.78,12,13501.0,United Kingdom
544931,2023-02-24,37446,Mini Cake Stand With Hanging Cakes,11.74,8,13501.0,United Kingdom
544931,2023-02-24,37448,Ceramic Cake Design Spotted Mug,11.78,12,13501.0,United Kingdom
544931,2023-02-24,22851,Set 20 Napkins Fairy Cakes Design,11.12,12,13501.0,United Kingdom
544931,2023-02-24,22450,Silk Purse Babushka Blue,13.68,6,13501.0,United Kingdom
544931,2023-02-24,22570,Feltcraft Cushion Rabbit,14.09,4,13501.0,United Kingdom
544931,2023-02-24,21485,Retrospot Heart Hot Water Bottle,15.32,4,13501.0,United Kingdom
544931,2023-02-24,22063,Ceramic Bowl With Strawberry Design,13.27,6,13501.0,United Kingdom
544931,2023-02-24,37447,Ceramic Cake Design Spotted Plate,11.78,12,13501.0,United Kingdom
544931,2023-02-24,47559B,Tea Time Oven Glove,11.53,10,13501.0,United Kingdom
544931,2023-02-24,84987,Set Of 36 Teatime Paper Doilies,11.74,12,13501.0,United Kingdom
544931,2023-02-24,22804,Pink Hanging Heart T-Light Holder,12.86,36,13501.0,United Kingdom
544931,2023-02-24,21733,Red Hanging Heart T-Light Holder,12.86,36,13501.0,United Kingdom
544931,2023-02-24,85123A,Cream Hanging Heart T-Light Holder,12.86,36,13501.0,United Kingdom
544931,2023-02-24,72741,Grand Chocolatecandle,11.74,9,13501.0,United Kingdom
544931,2023-02-24,22808,Set Of 6 T-Lights Easter Chicks,13.27,6,13501.0,United Kingdom
544931,2023-02-24,85175,Cacti T-Light Candles,10.68,16,13501.0,United Kingdom
544931,2023-02-24,48111,Doormat 3 Smiley Cats,18.4,2,13501.0,United Kingdom
544931,2023-02-24,48194,Doormat Hearts,18.4,2,13501.0,United Kingdom
544931,2023-02-24,48116,Doormat Multicolour Stripe,18.4,2,13501.0,United Kingdom
544931,2023-02-24,48129,Doormat Topiary,18.4,2,13501.0,United Kingdom
544931,2023-02-24,22822,Cream Wall Planter Heart Shaped,15.32,16,13501.0,United Kingdom
544931,2023-02-24,22430,Enamel Watering Can Cream,15.32,4,13501.0,United Kingdom
544931,2023-02-24,22441,Grow Your Own Basil In Enamel Mug,12.4,8,13501.0,United Kingdom
544931,2023-02-24,22852,Dog Bowl Vintage Cream,14.61,4,13501.0,United Kingdom
544931,2023-02-24,22845,Vintage Cream Cat Food Container,16.76,2,13501.0,United Kingdom
544931,2023-02-24,22844,Vintage Cream Dog Food Container,18.96,2,13501.0,United Kingdom
544931,2023-02-24,22843,Biscuit Tin Vintage Green,17.17,2,13501.0,United Kingdom
544931,2023-02-24,22842,Biscuit Tin Vintage Red,17.17,2,13501.0,United Kingdom
544931,2023-02-24,22841,Round Cake Tin Vintage Green,18.4,2,13501.0,United Kingdom
544931,2023-02-24,22840,Round Cake Tin Vintage Red,18.4,2,13501.0,United Kingdom
544931,2023-02-24,22469,Heart Of Wicker Small,11.94,24,13501.0,United Kingdom
544931,2023-02-24,84459B,Yellow Metal Chicken Heart,11.78,12,13501.0,United Kingdom
544931,2023-02-24,22231,Jigsaw Tree With Birdhouse,11.74,12,13501.0,United Kingdom
544931,2023-02-24,22445,Pencil Case Life Is Beautiful,13.27,12,13501.0,United Kingdom
544931,2023-02-24,21648,Assorted Tutti Frutti Small Purse,11.53,24,13501.0,United Kingdom
544931,2023-02-24,21643,Assorted Tutti Frutti Mirror,11.53,24,13501.0,United Kingdom
544931,2023-02-24,22139,Retrospot Tea Set Ceramic 11 Pc,14.61,24,13501.0,United Kingdom
544931,2023-02-24,22746,Poppy's Playhouse Livingroom,12.4,6,13501.0,United Kingdom
544931,2023-02-24,21329,Dinosaurs Writing Set,11.94,12,13501.0,United Kingdom
544931,2023-02-24,21328,Balloons Writing Set,11.94,24,13501.0,United Kingdom
544931,2023-02-24,10133,Colouring Pencils Brown Tube,11.12,10,13501.0,United Kingdom
544931,2023-02-24,20977,36 Pencils Tube Woodland,11.53,16,13501.0,United Kingdom
544824,2023-02-24,22606,Wooden Skittles Garden Set,26.6,1,17139.0,United Kingdom
544928,2023-02-24,21955,Doormat Union Jack Guns And Roses,26.43,1,15928.0,United Kingdom
544928,2023-02-24,48111,Doormat 3 Smiley Cats,26.43,1,15928.0,United Kingdom
544928,2023-02-24,48184,Doormat English Rose,26.43,1,15928.0,United Kingdom
544823,2023-02-24,22846,Bread Bin Diner Style Red,25.57,4,14004.0,United Kingdom
544823,2023-02-24,22848,Bread Bin Diner Style Pink,25.57,4,14004.0,United Kingdom
544823,2023-02-24,22849,Bread Bin Diner Style Mint,25.57,4,14004.0,United Kingdom
544824,2023-02-24,22605,Wooden Croquet Garden Set,25.57,1,17139.0,United Kingdom
544910,2023-02-24,22848,Bread Bin Diner Style Pink,25.57,4,16072.0,United Kingdom
544910,2023-02-24,22838,3 Tier Cake Tin Red And Cream,25.57,1,16072.0,United Kingdom
544910,2023-02-24,22839,3 Tier Cake Tin Green And Cream,25.57,1,16072.0,United Kingdom
544823,2023-02-24,22605,Wooden Croquet Garden Set,23.32,4,14004.0,United Kingdom
544824,2023-02-24,22423,Regency Cakestand 3 Tier,23.32,3,17139.0,United Kingdom
544833,2023-02-24,21735,Two Door Curio Cabinet,23.32,2,15974.0,United Kingdom
544835,2023-02-24,85066,Cream Sweetheart Mini Chest,23.32,2,17830.0,United Kingdom
544837,2023-02-24,21735,Two Door Curio Cabinet,23.32,1,15910.0,United Kingdom
544839,2023-02-24,22423,Regency Cakestand 3 Tier,23.32,2,14841.0,United Kingdom
544846,2023-02-24,22461,Savoy Art Deco Clock,23.32,1,16719.0,United Kingdom
544885,2023-02-24,21361,Love Large Wood Letters,23.32,1,14243.0,United Kingdom
544885,2023-02-24,22424,Enamel Bread Bin Cream,23.32,1,14243.0,United Kingdom
544888,2023-02-24,22423,Regency Cakestand 3 Tier,23.32,1,14231.0,United Kingdom
544896,2023-02-24,21633,Sunflower Decorative Parasol,23.32,2,17867.0,United Kingdom
544907,2023-02-24,22423,Regency Cakestand 3 Tier,23.32,2,12945.0,United Kingdom
544907,2023-02-24,22424,Enamel Bread Bin Cream,23.32,2,12945.0,United Kingdom
544909,2023-02-24,22504,Cabin Bag Vintage Retrospot,23.32,12,14298.0,United Kingdom
544909,2023-02-24,22503,Cabin Bag Vintage Paisley,23.32,12,14298.0,United Kingdom
544910,2023-02-24,22424,Enamel Bread Bin Cream,23.32,4,16072.0,United Kingdom
544920,2023-02-24,22236,Cake Stand 3 Tier Magic Garden,23.32,2,13081.0,United Kingdom
C544828,2023-02-24,22423,Regency Cakestand 3 Tier,23.32,-1,17147.0,United Kingdom
C544840,2023-02-24,22461,Savoy Art Deco Clock,23.32,-1,16719.0,United Kingdom
C544897,2023-02-24,21633,Sunflower Decorative Parasol,23.32,-1,17867.0,United Kingdom
544928,2023-02-24,21755,Love Building Block Word,22.17,1,15928.0,United Kingdom
544824,2023-02-24,21843,Red Retrospot Cake Stand,21.47,3,17139.0,United Kingdom
544833,2023-02-24,22423,Regency Cakestand 3 Tier,21.47,16,15974.0,United Kingdom
544929,2023-02-24,22423,Regency Cakestand 3 Tier,21.47,16,15189.0,United Kingdom
544928,2023-02-24,22720,Set Of 3 Cake Tins Pantry Design,21.31,1,15928.0,United Kingdom
544928,2023-02-24,47566,Party Bunting,21.31,1,15928.0,United Kingdom
544928,2023-02-24,84872A,Teatime Funky Flower Backpack For 2,21.31,3,15928.0,United Kingdom
544885,2023-02-24,22832,Brocante Shelf With Hooks,21.27,2,14243.0,United Kingdom
544911,2023-02-24,22832,Brocante Shelf With Hooks,21.27,2,16838.0,United Kingdom
544928,2023-02-24,35241,Enamel Blue Rim Biscuit Bin,20.46,1,15928.0,United Kingdom
544823,2023-02-24,22767,Triple Photo Frame Cornice,20.45,2,14004.0,United Kingdom
544824,2023-02-24,22501,Picnic Basket Wicker Large,20.45,2,17139.0,United Kingdom
544824,2023-02-24,22607,Wooden Rounders Garden Set,20.45,2,17139.0,United Kingdom
544824,2023-02-24,22968,Rose Cottage Keepsake Box,20.45,2,17139.0,United Kingdom
544824,2023-02-24,21623,Vintage Union Jack Memoboard,20.45,2,17139.0,United Kingdom
544824,2023-02-24,21217,Red Retrospot Round Cake Tins,20.45,1,17139.0,United Kingdom
544839,2023-02-24,22061,Large Cake Stand Hanging Strawbery,20.45,2,14841.0,United Kingdom
544846,2023-02-24,22501,Picnic Basket Wicker Large,20.45,1,16719.0,United Kingdom
544847,2023-02-24,22607,Wooden Rounders Garden Set,20.45,3,16086.0,United Kingdom
544885,2023-02-24,22788,Brocante Coat Rack,20.45,1,14243.0,United Kingdom
