TransactionNo,Date,ProductNo,ProductName,Price,Quantity,CustomerNo,Country
560024,2023-07-14,20719,Woodland Charlotte Bag,11.12,10,15005.0,United Kingdom
560024,2023-07-14,22355,Charlotte Bag Suki Design,11.12,10,15005.0,United Kingdom
560024,2023-07-14,20724,Red Retrospot Charlotte Bag,11.12,10,15005.0,United Kingdom
560024,2023-07-14,22356,Charlotte Bag Pink Polkadot,11.12,10,15005.0,United Kingdom
560024,2023-07-14,20723,Strawberry Charlotte Bag,11.12,10,15005.0,United Kingdom
560024,2023-07-14,23300,Gardeners Kneeling Pad Cup Of Tea,11.94,4,15005.0,United Kingdom
560024,2023-07-14,23301,Gardeners Kneeling Pad Keep Calm,11.94,4,15005.0,United Kingdom
560024,2023-07-14,23302,Kneeling Mat Housework Design,11.94,3,15005.0,United Kingdom
560024,2023-07-14,84508B,Stripes Design Teddy,12.86,1,15005.0,United Kingdom
560025,2023-07-14,20886,Box Of 9 Pebble Candles,12.25,1,18283.0,United Kingdom
560025,2023-07-14,22077,6 Ribbons Rustic Charm,11.94,1,18283.0,United Kingdom
560025,2023-07-14,21213,Pack Of 72 Skull Cake Cases,10.81,1,18283.0,United Kingdom
560025,2023-07-14,22951,60 Cake Cases Dolly Girl Design,10.81,1,18283.0,United Kingdom
560025,2023-07-14,22417,Pack Of 60 Spaceboy Cake Cases,10.81,2,18283.0,United Kingdom
560025,2023-07-14,21975,Pack Of 60 Dinosaur Cake Cases,10.81,2,18283.0,United Kingdom
560025,2023-07-14,21981,Pack Of 12 Woodland Tissues,10.55,2,18283.0,United Kingdom
560025,2023-07-14,21982,Pack Of 12 Suki Tissues,10.55,1,18283.0,United Kingdom
560025,2023-07-14,22614,Pack Of 12 Spaceboy Tissues,10.55,2,18283.0,United Kingdom
560025,2023-07-14,21967,Pack Of 12 Skull Tissues,10.55,2,18283.0,United Kingdom
560025,2023-07-14,23296,Set Of 6 Tea Time Baking Cases,11.53,1,18283.0,United Kingdom
560025,2023-07-14,21733,Red Hanging Heart T-Light Holder,13.27,1,18283.0,United Kingdom
560025,2023-07-14,22652,Travel Sewing Kit,11.94,1,18283.0,United Kingdom
560025,2023-07-14,22554,Plasters In Tin Woodland Animals,11.94,2,18283.0,United Kingdom
560025,2023-07-14,22553,Plasters In Tin Skulls,11.94,2,18283.0,United Kingdom
560025,2023-07-14,85123A,Cream Hanging Heart T-Light Holder,13.27,1,18283.0,United Kingdom
560025,2023-07-14,23196,Vintage Leaf Magnetic Notepad,11.74,1,18283.0,United Kingdom
560025,2023-07-14,22964,3 Piece Spaceboy Cookie Cutter Set,12.4,1,18283.0,United Kingdom
560025,2023-07-14,22328,Round Snack Boxes Set Of 4 Fruits,13.27,1,18283.0,United Kingdom
560025,2023-07-14,22326,Round Snack Boxes Set Of4 Woodland,13.27,1,18283.0,United Kingdom
560025,2023-07-14,22327,Round Snack Boxes Set Of 4 Skulls,13.27,1,18283.0,United Kingdom
560025,2023-07-14,22975,Spaceboy Childrens Egg Cup,11.53,1,18283.0,United Kingdom
560025,2023-07-14,22972,Children's Spaceboy Mug,11.94,1,18283.0,United Kingdom
560025,2023-07-14,21874,Gin And Tonic Mug,11.53,1,18283.0,United Kingdom
560025,2023-07-14,23240,Set Of 4 Knick Knack Tins Doily,14.5,2,18283.0,United Kingdom
560025,2023-07-14,23237,Set Of 4 Knick Knack Tins Leaf,14.5,2,18283.0,United Kingdom
560025,2023-07-14,84755,Colour Glass T-Light Holder Hanging,10.92,8,18283.0,United Kingdom
560025,2023-07-14,23077,Doughnut Lip Gloss,11.53,13,18283.0,United Kingdom
560025,2023-07-14,22418,10 Colour Spaceboy Pen,11.12,10,18283.0,United Kingdom
560025,2023-07-14,20719,Woodland Charlotte Bag,11.12,1,18283.0,United Kingdom
560025,2023-07-14,20724,Red Retrospot Charlotte Bag,11.12,2,18283.0,United Kingdom
560025,2023-07-14,22356,Charlotte Bag Pink Polkadot,11.12,1,18283.0,United Kingdom
560025,2023-07-14,22661,Charlotte Bag Dolly Girl Design,11.12,2,18283.0,United Kingdom
560025,2023-07-14,23204,Charlotte Bag Apples Design,11.12,4,18283.0,United Kingdom
560025,2023-07-14,21931,Jumbo Storage Bag Suki,12.38,1,18283.0,United Kingdom
560025,2023-07-14,21930,Jumbo Storage Bag Skulls,12.38,2,18283.0,United Kingdom
560025,2023-07-14,23202,Jumbo Bag Vintage Leaf,6.19,1,18283.0,United Kingdom
560025,2023-07-14,20712,Jumbo Bag Woodland Animals,6.19,1,18283.0,United Kingdom
560025,2023-07-14,85099B,Jumbo Bag Red Retrospot,6.19,1,18283.0,United Kingdom
560025,2023-07-14,22386,Jumbo Bag Pink Polkadot,6.19,1,18283.0,United Kingdom
560025,2023-07-14,23200,Jumbo Bag Pears,6.19,1,18283.0,United Kingdom
560025,2023-07-14,23203,Jumbo Bag Vintage Doily,6.19,2,18283.0,United Kingdom
560025,2023-07-14,23199,Jumbo Bag Apples,6.19,1,18283.0,United Kingdom
560025,2023-07-14,22663,Jumbo Bag Dolly Girl Design,6.19,1,18283.0,United Kingdom
560025,2023-07-14,22382,Lunch Bag Spaceboy Design,5.97,1,18283.0,United Kingdom
560025,2023-07-14,20726,Lunch Bag Woodland,5.97,1,18283.0,United Kingdom
560025,2023-07-14,20727,Lunch Bag Black Skull,5.97,1,18283.0,United Kingdom
560025,2023-07-14,23208,Lunch Bag Vintage Leaf Design,5.97,1,18283.0,United Kingdom
560025,2023-07-14,22383,Lunch Bag Suki Design,5.97,1,18283.0,United Kingdom
560025,2023-07-14,23209,Lunch Bag Vintage Doily,5.97,1,18283.0,United Kingdom
560025,2023-07-14,20727,Lunch Bag Black Skull,5.97,1,18283.0,United Kingdom
560025,2023-07-14,20725,Lunch Bag Red Retrospot,5.97,1,18283.0,United Kingdom
560025,2023-07-14,22662,Lunch Bag Dolly Girl Design,5.97,1,18283.0,United Kingdom
560025,2023-07-14,23209,Lunch Bag Vintage Doily,5.97,1,18283.0,United Kingdom
560025,2023-07-14,23206,Lunch Bag Apple Design,5.97,1,18283.0,United Kingdom
560025,2023-07-14,22384,Lunch Bag Pink Polkadot,5.97,1,18283.0,United Kingdom
560026,2023-07-14,21670,Blue Spot Ceramic Drawer Knob,11.53,12,16928.0,United Kingdom
560026,2023-07-14,21668,Red Stripe Ceramic Drawer Knob,11.53,12,16928.0,United Kingdom
560026,2023-07-14,21671,Red Spot Ceramic Drawer Knob,11.53,1,16928.0,United Kingdom
560026,2023-07-14,22775,Purple Drawerknob Acrylic Edwardian,11.53,12,16928.0,United Kingdom
560026,2023-07-14,22772,Pink Drawer Knob Acrylic Edwardian,11.53,12,16928.0,United Kingdom
560026,2023-07-14,21669,Blue Stripe Ceramic Drawer Knob,11.53,2,16928.0,United Kingdom
560026,2023-07-14,23033,Drawer Knob Ceramic Red,11.74,8,16928.0,United Kingdom
560026,2023-07-14,23028,Drawer Knob Crackle Glaze Blue,11.94,2,16928.0,United Kingdom
560026,2023-07-14,22805,Blue Drawer Knob Acrylic Edwardian,11.53,5,16928.0,United Kingdom
560026,2023-07-14,21669,Blue Stripe Ceramic Drawer Knob,11.53,2,16928.0,United Kingdom
560026,2023-07-14,23032,Drawer Knob Crackle Glaze Ivory,11.94,1,16928.0,United Kingdom
560026,2023-07-14,22771,Clear Drawer Knob Acrylic Edwardian,11.53,24,16928.0,United Kingdom
560032,2023-07-14,21874,Gin And Tonic Mug,11.53,2,18283.0,United Kingdom
560033,2023-07-14,22910,Paper Chain Kit Vintage Christmas,13.27,6,12388.0,Australia
560033,2023-07-14,22338,Star Decoration Painted Zinc,10.92,24,12388.0,Australia
560033,2023-07-14,22576,Swallow Wooden Christmas Decoration,11.12,12,12388.0,Australia
560033,2023-07-14,22600,Christmas Retrospot Star Wood,11.12,12,12388.0,Australia
560033,2023-07-14,22478,Birdhouse Garden Marker,11.53,10,12388.0,Australia
560033,2023-07-14,22496,Set Of 2 Round Tins Dutch Cheese,13.27,6,12388.0,Australia
560033,2023-07-14,22495,Set Of 2 Round Tins Camembert,13.27,6,12388.0,Australia
560033,2023-07-14,22310,Ivory Knitted Mug Cosy,11.94,24,12388.0,Australia
560033,2023-07-14,23019,Small Apothecary Measuring Jar,17.89,6,12388.0,Australia
560033,2023-07-14,23024,Large Bonne Jam Jar T-Light Holder,13.21,24,12388.0,Australia
560033,2023-07-14,23236,Storage Tin Vintage Doily,13.21,6,12388.0,Australia
560033,2023-07-14,23243,Set Of Tea Coffee Sugar Tins Pantry,15.32,8,12388.0,Australia
560033,2023-07-14,23245,Set Of 3 Regency Cake Tins,15.32,8,12388.0,Australia
560033,2023-07-14,23252,Vintage Red Enamel Trim Jug,14.09,8,12388.0,Australia
560033,2023-07-14,23249,Vintage Red Enamel Trim Plate,11.94,12,12388.0,Australia
560033,2023-07-14,23250,Vintage Red Trim Enamel Bowl,11.53,12,12388.0,Australia
560033,2023-07-14,23318,Box Of 6 Mini Vintage Crackers,12.8,6,12388.0,Australia
560033,2023-07-14,23319,Box Of 6 Mini 50'S Crackers,12.8,6,12388.0,Australia
560033,2023-07-14,22262,Felt Egg Cosy Chicken,11.12,24,12388.0,Australia
560033,2023-07-14,23298,Spotty Bunting,15.32,6,12388.0,Australia
560033,2023-07-14,47566,Party Bunting,15.32,8,12388.0,Australia
560033,2023-07-14,47590A,Blue Happy Birthday Bunting,15.84,3,12388.0,Australia
560033,2023-07-14,47590B,Pink Happy Birthday Bunting,15.84,6,12388.0,Australia
560033,2023-07-14,71459,Hanging Jam Jar T-Light Holders,11.12,12,12388.0,Australia
560033,2023-07-14,84970L,Single Heart Zinc T-Light Holder,11.22,12,12388.0,Australia
560033,2023-07-14,84978,Hanging Heart Jar T-Light Holder,11.53,12,12388.0,Australia
560033,2023-07-14,22580,Advent Calendar Gingham Sack,16.35,6,12388.0,Australia
560033,2023-07-14,22086,Paper Chain Kit 50'S Christmas,13.27,6,12388.0,Australia
560033,2023-07-14,23311,Vintage Christmas Stocking,12.86,12,12388.0,Australia
560033,2023-07-14,23294,Set Of 6 Snack Loaf Baking Cases,11.1,24,12388.0,Australia
560033,2023-07-14,23293,Set Of 12 Fairy Cake Baking Cases,11.1,24,12388.0,Australia
560033,2023-07-14,23295,Set Of 12 Mini Loaf Baking Cases,11.1,24,12388.0,Australia
560033,2023-07-14,23297,Set 40 Heart Shape Petit Four Cases,11.94,24,12388.0,Australia
560033,2023-07-14,23296,Set Of 6 Tea Time Baking Cases,11.53,24,12388.0,Australia
560034,2023-07-14,22138,Baking Set 9 Piece Retrospot,15.32,3,13933.0,United Kingdom
560034,2023-07-14,23236,Storage Tin Vintage Doily,13.21,6,13933.0,United Kingdom
560034,2023-07-14,20749,Assorted Colour Mini Cases,18.4,4,13933.0,United Kingdom
560034,2023-07-14,22720,Set Of 3 Cake Tins Pantry Design,15.32,3,13933.0,United Kingdom
560034,2023-07-14,23298,Spotty Bunting,15.32,3,13933.0,United Kingdom
560034,2023-07-14,23198,Pantry Magnetic Shopping List,11.74,12,13933.0,United Kingdom
560034,2023-07-14,23299,Food Cover With Beads Set 2,14.09,6,13933.0,United Kingdom
560034,2023-07-14,22969,Homemade Jam Scented Candles,11.74,12,13933.0,United Kingdom
560034,2023-07-14,22666,Recipe Box Pantry Yellow Design,13.27,6,13933.0,United Kingdom
560034,2023-07-14,84987,Set Of 36 Teatime Paper Doilies,11.74,12,13933.0,United Kingdom
560034,2023-07-14,23306,Set Of 36 Pantry Paper Doilies,11.74,12,13933.0,United Kingdom
560034,2023-07-14,22692,Doormat Welcome To Our Home,17.17,10,13933.0,United Kingdom
560034,2023-07-14,21231,Sweetheart Ceramic Trinket Box,11.53,12,13933.0,United Kingdom
560034,2023-07-14,21232,Strawberry Ceramic Trinket Pot,11.53,12,13933.0,United Kingdom
560035,2023-07-14,23112,Parisienne Curio Cabinet,17.94,3,17706.0,United Kingdom
560035,2023-07-14,23137,Zinc Wire Sweetheart Letter Tray,14.09,4,17706.0,United Kingdom
560035,2023-07-14,23152,Ivory Sweetheart Wire Letter Rack,14.09,4,17706.0,United Kingdom
560035,2023-07-14,21231,Sweetheart Ceramic Trinket Box,11.53,12,17706.0,United Kingdom
560035,2023-07-14,23298,Spotty Bunting,15.32,6,17706.0,United Kingdom
560035,2023-07-14,17003,Brocade Ring Purse,10.55,36,17706.0,United Kingdom
560035,2023-07-14,20685,Doormat Red Retrospot,18.4,6,17706.0,United Kingdom
560035,2023-07-14,15044D,Red Paper Parasol,13.27,6,17706.0,United Kingdom
560035,2023-07-14,15044C,Purple Paper Parasol,13.27,6,17706.0,United Kingdom
560035,2023-07-14,15044B,Blue Paper Parasol,13.27,6,17706.0,United Kingdom
560035,2023-07-14,15044A,Pink Paper Parasol,13.27,6,17706.0,United Kingdom
560035,2023-07-14,15036,Assorted Colours Silk Fan,11.1,24,17706.0,United Kingdom
560035,2023-07-14,84836,Zinc Metal Heart Decoration,11.53,24,17706.0,United Kingdom
560035,2023-07-14,16156S,Wrap Pink Fairy Cakes,10.68,25,17706.0,United Kingdom
560035,2023-07-14,84247G,Decoupage Greeting Card,10.68,24,17706.0,United Kingdom
560035,2023-07-14,23028,Drawer Knob Crackle Glaze Blue,11.94,36,17706.0,United Kingdom
560035,2023-07-14,23029,Drawer Knob Crackle Glaze Green,11.94,36,17706.0,United Kingdom
560035,2023-07-14,23032,Drawer Knob Crackle Glaze Ivory,11.94,36,17706.0,United Kingdom
560035,2023-07-14,23026,Drawer Knob Vintage Glass Star,12.38,24,17706.0,United Kingdom
560035,2023-07-14,48111,Doormat 3 Smiley Cats,18.4,6,17706.0,United Kingdom
560035,2023-07-14,21278,Vintage Kitchen Print Puddings,12.86,6,17706.0,United Kingdom
560035,2023-07-14,85059,French Enamel Water Basin,14.09,6,17706.0,United Kingdom
560035,2023-07-14,85053,French Enamel Candleholder,12.4,6,17706.0,United Kingdom
560035,2023-07-14,79000,Moroccan Tea Glass,11.12,24,17706.0,United Kingdom
560035,2023-07-14,82613A,Metal Sign Cupcake Single Hook,11.53,25,17706.0,United Kingdom
560035,2023-07-14,84795B,Sunset Check Hammock,18.4,12,17706.0,United Kingdom
560035,2023-07-14,48138,Doormat Union Flag,18.4,6,17706.0,United Kingdom
560035,2023-07-14,48194,Doormat Hearts,18.4,6,17706.0,United Kingdom
560035,2023-07-14,84030E,English Rose Hot Water Bottle,14.61,6,17706.0,United Kingdom
560035,2023-07-14,82494L,Wooden Frame Antique White,13.27,6,17706.0,United Kingdom
560035,2023-07-14,82482,Wooden Picture Frame White Finish,12.86,6,17706.0,United Kingdom
560035,2023-07-14,85184C,Set 4 Valentine Decoupage Heart Box,13.27,18,17706.0,United Kingdom
560035,2023-07-14,37501,Tea Time Tea Set In Gift Box,17.37,6,17706.0,United Kingdom
560035,2023-07-14,47580,Tea Time Des Tea Cosy,12.86,6,17706.0,United Kingdom
560035,2023-07-14,84406B,Cream Cupid Hearts Coat Hanger,14.5,6,17706.0,United Kingdom
560035,2023-07-14,84792,Enchanted Bird Coathanger 5 Hook,15.02,6,17706.0,United Kingdom
560035,2023-07-14,71477,Coloured Glass Star T-Light Holder,13.58,6,17706.0,United Kingdom
560035,2023-07-14,85231G,Orange Scented Set/9 T-Lights,11.12,6,17706.0,United Kingdom
560035,2023-07-14,40001,White Bamboo Ribs Lampshade,11.12,24,17706.0,United Kingdom
560035,2023-07-14,71038,White Hanging Beads Candle Holder,15.84,6,17706.0,United Kingdom
560035,2023-07-14,85123A,Cream Hanging Heart T-Light Holder,13.27,6,17706.0,United Kingdom
560035,2023-07-14,21159,Moody Boy Door Hanger,11.74,12,17706.0,United Kingdom
560035,2023-07-14,21248,Door Hanger Mum + Dads Room,11.74,12,17706.0,United Kingdom
560035,2023-07-14,82600,N0 Singing Metal Sign,12.4,12,17706.0,United Kingdom
560035,2023-07-14,21163,Do Not Touch My Stuff Door Hanger,11.74,12,17706.0,United Kingdom
560035,2023-07-14,21169,You're Confusing Me Metal Sign,11.98,12,17706.0,United Kingdom
560035,2023-07-14,21174,Pottering In The Shed Metal Sign,12.38,12,17706.0,United Kingdom
560035,2023-07-14,21175,Gin And Tonic Diet Metal Sign,12.86,12,17706.0,United Kingdom
560035,2023-07-14,21165,Beware Of The Cat Metal Sign,11.98,12,17706.0,United Kingdom
560035,2023-07-14,85152,Hand Over The Chocolate Sign,12.4,12,17706.0,United Kingdom
560035,2023-07-14,21080,Set/20 Red Retrospot Paper Napkins,11.12,12,17706.0,United Kingdom
560035,2023-07-14,21242,Red Retrospot Plate,11.98,12,17706.0,United Kingdom
560035,2023-07-14,21041,Red Retrospot Oven Glove Double,13.27,6,17706.0,United Kingdom
560035,2023-07-14,21284,Retrospot Candle Small,11.98,12,17706.0,United Kingdom
560035,2023-07-14,20682,Red Retrospot Childrens Umbrella,13.58,6,17706.0,United Kingdom
560035,2023-07-14,20754,Retrospot Red Washing Up Gloves,12.4,6,17706.0,United Kingdom
560035,2023-07-14,23249,Vintage Red Enamel Trim Plate,11.94,12,17706.0,United Kingdom
560035,2023-07-14,23240,Set Of 4 Knick Knack Tins Doily,14.5,12,17706.0,United Kingdom
560035,2023-07-14,23252,Vintage Red Enamel Trim Jug,14.09,12,17706.0,United Kingdom
560035,2023-07-14,23251,Vintage Red Enamel Trim Mug,11.53,36,17706.0,United Kingdom
560035,2023-07-14,23181,Bull Dog Bottle Top Wall Clock,18.71,4,17706.0,United Kingdom
560035,2023-07-14,23155,Knickerbockerglory Magnet Assorted,11.1,24,17706.0,United Kingdom
560035,2023-07-14,84946,Antique Silver T-Light Glass,11.53,24,17706.0,United Kingdom
560035,2023-07-14,23039,T-Light Holder Silver Heart Handle,12.25,12,17706.0,United Kingdom
560035,2023-07-14,85099B,Jumbo Bag Red Retrospot,6.19,10,17706.0,United Kingdom
560036,2023-07-14,21163,Do Not Touch My Stuff Door Hanger,10.65,24,14911.0,EIRE
560036,2023-07-14,22269,Egg Cup Natural Chicken,10.65,16,14911.0,EIRE
560036,2023-07-14,23186,French Style Storage Jar Cafe,10.55,96,14911.0,EIRE
560036,2023-07-14,23187,French Style Storage Jar Bonbons,10.55,48,14911.0,EIRE
560036,2023-07-14,37342,Polkadot Coffee Cup & Saucer Pink,11.06,24,14911.0,EIRE
560036,2023-07-14,85194S,Hanging Spring Flower Egg Small,10.44,48,14911.0,EIRE
560036,2023-07-14,23205,Charlotte Bag Vintage Alphabet,11.12,10,14911.0,EIRE
560036,2023-07-14,22278,Overnight Bag Vintage Rose Paisley,15.32,6,14911.0,EIRE
560036,2023-07-14,48188,Doormat Welcome Puppies,18.4,2,14911.0,EIRE
560036,2023-07-14,48187,Doormat New England,18.4,2,14911.0,EIRE
560036,2023-07-14,21523,Doormat Fancy Font Home Sweet Home,18.4,2,14911.0,EIRE
560036,2023-07-14,22693,Grow A Flytrap Or Sunflower In Tin,11.53,24,14911.0,EIRE
560036,2023-07-14,21259,Victorian Sewing Box Small,16.35,2,14911.0,EIRE
560036,2023-07-14,21172,Party Metal Sign,11.74,12,14911.0,EIRE
560036,2023-07-14,85123A,Cream Hanging Heart T-Light Holder,13.27,24,14911.0,EIRE
560036,2023-07-14,21469,Polka Dot Raffia Food Cover,14.09,6,14911.0,EIRE
560036,2023-07-14,21467,Cherry Crochet Food Cover,14.09,6,14911.0,EIRE
560036,2023-07-14,22197,Popcorn Holder,11.12,48,14911.0,EIRE
560036,2023-07-14,23171,Regency Tea Plate Green,11.94,12,14911.0,EIRE
560036,2023-07-14,23172,Regency Tea Plate Pink,11.94,12,14911.0,EIRE
560036,2023-07-14,23170,Regency Tea Plate Roses,11.94,12,14911.0,EIRE
560036,2023-07-14,22698,Pink Regency Teacup And Saucer,13.27,6,14911.0,EIRE
560036,2023-07-14,22699,Roses Regency Teacup And Saucer,13.27,6,14911.0,EIRE
560036,2023-07-14,22697,Green Regency Teacup And Saucer,13.27,6,14911.0,EIRE
560036,2023-07-14,22425,Enamel Colander Cream,15.32,6,14911.0,EIRE
560036,2023-07-14,22429,Enamel Measuring Jug Cream,14.61,8,14911.0,EIRE
560036,2023-07-14,22427,Enamel Flower Jug Cream,16.35,3,14911.0,EIRE
560036,2023-07-14,23308,Set Of 60 Vintage Leaf Cake Cases,10.81,24,14911.0,EIRE
560036,2023-07-14,23307,Set Of 60 Pantry Design Cake Cases,10.81,24,14911.0,EIRE
560036,2023-07-14,84991,60 Teatime Fairy Cake Cases,10.81,24,14911.0,EIRE
560036,2023-07-14,22720,Set Of 3 Cake Tins Pantry Design,15.32,3,14911.0,EIRE
560036,2023-07-14,22979,Pantry Washing Up Brush,11.74,12,14911.0,EIRE
560036,2023-07-14,22980,Pantry Scrubbing Brush,11.94,12,14911.0,EIRE
560036,2023-07-14,22978,Pantry Rolling Pin,14.09,6,14911.0,EIRE
560036,2023-07-14,22993,Set Of 4 Pantry Jelly Moulds,11.53,12,14911.0,EIRE
560036,2023-07-14,23165,Large Ceramic Top Storage Jar,11.94,12,14911.0,EIRE
560036,2023-07-14,23167,Small Ceramic Top Storage Jar,11.1,12,14911.0,EIRE
560036,2023-07-14,23201,Jumbo Bag Alphabet,6.19,10,14911.0,EIRE
560036,2023-07-14,23202,Jumbo Bag Vintage Leaf,6.19,10,14911.0,EIRE
560036,2023-07-14,23203,Jumbo Bag Vintage Doily,6.19,10,14911.0,EIRE
560036,2023-07-14,23209,Lunch Bag Vintage Doily,5.97,10,14911.0,EIRE
560036,2023-07-14,23208,Lunch Bag Vintage Leaf Design,5.97,10,14911.0,EIRE
560038,2023-07-14,22333,Retrospot Party Bag + Sticker Set,11.94,32,12709.0,Germany
560038,2023-07-14,21094,Set/6 Red Spotty Paper Plates,11.12,40,12709.0,Germany
560038,2023-07-14,21086,Set/6 Red Spotty Paper Cups,10.92,40,12709.0,Germany
560038,2023-07-14,21080,Set/20 Red Retrospot Paper Napkins,11.12,12,12709.0,Germany
560038,2023-07-14,22627,Mint Kitchen Scales,18.96,4,12709.0,Germany
560038,2023-07-14,21242,Red Retrospot Plate,11.98,16,12709.0,Germany
560038,2023-07-14,21244,Blue Polkadot Plate,11.98,16,12709.0,Germany
560038,2023-07-14,21238,Red Retrospot Cup,11.12,24,12709.0,Germany
560038,2023-07-14,21239,Pink Polkadot Cup,11.12,24,12709.0,Germany
560038,2023-07-14,20685,Doormat Red Retrospot,17.17,20,12709.0,Germany
560038,2023-07-14,21658,Glass Beurre Dish,14.3,20,12709.0,Germany
560038,2023-07-14,22090,Paper Bunting Retrospot,13.27,20,12709.0,Germany
560041,2023-07-14,22569,Feltcraft Cushion Butterfly,14.09,4,14156.0,EIRE
560041,2023-07-14,22568,Feltcraft Cushion Owl,14.09,4,14156.0,EIRE
560041,2023-07-14,15036,Assorted Colours Silk Fan,11.1,24,14156.0,EIRE
560041,2023-07-14,21218,Red Spotty Biscuit Tin,14.09,6,14156.0,EIRE
560041,2023-07-14,21216,Set 3 Retrospot Tea/Coffee/Sugar,15.32,4,14156.0,EIRE
560041,2023-07-14,21539,Red Retrospot Butter Dish,15.32,3,14156.0,EIRE
560041,2023-07-14,21535,Red Retrospot Small Milk Jug,12.86,6,14156.0,EIRE
560041,2023-07-14,21531,Red Retrospot Sugar Jam Bowl,12.86,6,14156.0,EIRE
560041,2023-07-14,22960,Jam Making Set With Jars,14.09,24,14156.0,EIRE
560041,2023-07-14,84997B,Childrens Cutlery Retrospot Red,14.5,6,14156.0,EIRE
560041,2023-07-14,84997C,Childrens Cutlery Polkadot Blue,14.5,6,14156.0,EIRE
560041,2023-07-14,84997D,Childrens Cutlery Polkadot Pink,14.5,6,14156.0,EIRE
560041,2023-07-14,84987,Set Of 36 Teatime Paper Doilies,11.74,12,14156.0,EIRE
560041,2023-07-14,21466,Red Flower Crochet Food Cover,14.09,6,14156.0,EIRE
560041,2023-07-14,21465,Pink Flower Crochet Food Cover,14.09,6,14156.0,EIRE
560041,2023-07-14,22627,Mint Kitchen Scales,18.96,2,14156.0,EIRE
560041,2023-07-14,22626,Black Kitchen Scales,18.96,2,14156.0,EIRE
560041,2023-07-14,22625,Red Kitchen Scales,18.96,2,14156.0,EIRE
560041,2023-07-14,22624,Ivory Kitchen Scales,18.96,2,14156.0,EIRE
560041,2023-07-14,22667,Recipe Box Retrospot,13.27,6,14156.0,EIRE
560041,2023-07-14,22191,Ivory Diner Wall Clock,18.96,2,14156.0,EIRE
560041,2023-07-14,22192,Blue Diner Wall Clock,18.96,2,14156.0,EIRE
560041,2023-07-14,22193,Red Diner Wall Clock,18.96,2,14156.0,EIRE
560041,2023-07-14,22558,Clothes Pegs Retrospot Pack 24,11.94,12,14156.0,EIRE
560041,2023-07-14,22567,20 Dolly Pegs Retrospot,11.74,12,14156.0,EIRE
560041,2023-07-14,22467,Gumball Coat Rack,12.86,6,14156.0,EIRE
560042,2023-07-14,22379,Recycling Bag Retrospot,12.4,5,17068.0,United Kingdom
560042,2023-07-14,23298,Spotty Bunting,15.32,3,17068.0,United Kingdom
560042,2023-07-14,22377,Bottle Bag Retrospot,12.4,5,17068.0,United Kingdom
560042,2023-07-14,22381,Toy Tidy Pink Polkadot,12.4,5,17068.0,United Kingdom
560042,2023-07-14,23203,Jumbo Bag Vintage Doily,6.19,10,17068.0,United Kingdom
560042,2023-07-14,23202,Jumbo Bag Vintage Leaf,6.19,10,17068.0,United Kingdom
560042,2023-07-14,20727,Lunch Bag Black Skull,5.97,10,17068.0,United Kingdom
560042,2023-07-14,23206,Lunch Bag Apple Design,5.97,10,17068.0,United Kingdom
560042,2023-07-14,20726,Lunch Bag Woodland,5.97,10,17068.0,United Kingdom
560042,2023-07-14,22384,Lunch Bag Pink Polkadot,5.97,10,17068.0,United Kingdom
560042,2023-07-14,22662,Lunch Bag Dolly Girl Design,5.97,10,17068.0,United Kingdom
560047,2023-07-14,23242,Treasure Tin Buffalo Bill,12.38,1,17259.0,United Kingdom
560047,2023-07-14,22139,Retrospot Tea Set Ceramic 11 Pc,15.32,1,17259.0,United Kingdom
560047,2023-07-14,22623,Box Of Vintage Jigsaw Blocks,16.35,1,17259.0,United Kingdom
560047,2023-07-14,22491,Pack Of 12 Coloured Pencils,11.12,1,17259.0,United Kingdom
560047,2023-07-14,47566,Party Bunting,15.32,1,17259.0,United Kingdom
560047,2023-07-14,21719,Lovely Bonbon Sticker Sheet,11.12,1,17259.0,United Kingdom
560047,2023-07-14,21936,Red Retrospot Picnic Bag,13.27,1,17259.0,United Kingdom
560047,2023-07-14,21889,Wooden Box Of Dominoes,11.53,1,17259.0,United Kingdom
560047,2023-07-14,21918,Set 12 Kids Colour Chalk Sticks,10.68,1,17259.0,United Kingdom
560047,2023-07-14,23238,Set Of 4 Knick Knack Tins London,14.5,1,17259.0,United Kingdom
560047,2023-07-14,21509,Cowboys And Indians Birthday Card,10.68,12,17259.0,United Kingdom
560047,2023-07-14,22029,Spaceboy Birthday Card,10.68,12,17259.0,United Kingdom
560047,2023-07-14,21504,Skulls Greeting Card,10.68,12,17259.0,United Kingdom
560047,2023-07-14,21713,Citronella Candle Flowerpot,12.4,4,17259.0,United Kingdom
560047,2023-07-14,21755,Love Building Block Word,16.35,1,17259.0,United Kingdom
560047,2023-07-14,84870B,Blue Geisha Girl,14.09,2,17259.0,United Kingdom
560047,2023-07-14,85049D,Bright Blues Ribbons,11.53,1,17259.0,United Kingdom
560047,2023-07-14,23092,Large Antique White Photo Frame,18.35,4,17259.0,United Kingdom
560047,2023-07-14,22475,Skull Design Tv Dinner Tray,15.32,1,17259.0,United Kingdom
560047,2023-07-14,22118,Joy Wooden Block Letters,15.32,1,17259.0,United Kingdom
560047,2023-07-14,21755,Love Building Block Word,16.35,1,17259.0,United Kingdom
560047,2023-07-14,71459,Hanging Jam Jar T-Light Holders,11.12,12,17259.0,United Kingdom
560047,2023-07-14,21609,Set 12 Lavender Botanical T-Lights,13.27,4,17259.0,United Kingdom
560047,2023-07-14,85049C,Romantic Pinks Ribbons,11.53,1,17259.0,United Kingdom
560047,2023-07-14,85049G,Chocolate Box Ribbons,11.53,2,17259.0,United Kingdom
560047,2023-07-14,85049D,Bright Blues Ribbons,11.53,1,17259.0,United Kingdom
560047,2023-07-14,22077,6 Ribbons Rustic Charm,11.94,2,17259.0,United Kingdom
560047,2023-07-14,85049C,Romantic Pinks Ribbons,11.53,1,17259.0,United Kingdom
560047,2023-07-14,84978,Hanging Heart Jar T-Light Holder,11.53,6,17259.0,United Kingdom
560047,2023-07-14,23022,Small Bonne Jam Jar T-Light Holder,12.38,6,17259.0,United Kingdom
560047,2023-07-14,84945,Multi Colour Silver T-Light Holder,11.12,24,17259.0,United Kingdom
560047,2023-07-14,22315,200 Red + White Bendy Straws,11.53,1,17259.0,United Kingdom
560047,2023-07-14,22441,Grow Your Own Basil In Enamel Mug,12.4,3,17259.0,United Kingdom
560047,2023-07-14,23023,Ridged Bonne Jam Jar T-Light Holder,11.94,6,17259.0,United Kingdom
560047,2023-07-14,21467,Cherry Crochet Food Cover,14.09,3,17259.0,United Kingdom
560047,2023-07-14,85099C,Jumbo Bag Baroque Black White,6.19,1,17259.0,United Kingdom
560047,2023-07-14,22611,Vintage Union Jack Shopping Bag,7.66,1,17259.0,United Kingdom
560048,2023-07-14,23300,Gardeners Kneeling Pad Cup Of Tea,11.94,12,13515.0,United Kingdom
560048,2023-07-14,23301,Gardeners Kneeling Pad Keep Calm,11.94,12,13515.0,United Kingdom
560048,2023-07-14,85123A,Cream Hanging Heart T-Light Holder,13.27,6,13515.0,United Kingdom
560048,2023-07-14,22951,60 Cake Cases Dolly Girl Design,10.81,24,13515.0,United Kingdom
560048,2023-07-14,16161P,Wrap English Rose,10.68,25,13515.0,United Kingdom
