TransactionNo,Date,ProductNo,ProductName,Price,Quantity,CustomerNo,Country
558096,2023-06-26,17012D,Origami Rose Incense/Candle Set,12.86,1,15532.0,United Kingdom
558096,2023-06-26,17012C,Origami Lavender Incense/Candl Set,11.12,2,15532.0,United Kingdom
558096,2023-06-26,23091,Zinc Herb Garden Container,16.66,2,15532.0,United Kingdom
558096,2023-06-26,21713,Citronella Candle Flowerpot,12.4,2,15532.0,United Kingdom
558096,2023-06-26,22795,Sweetheart Recipe Book Stand,17.17,2,15532.0,United Kingdom
558096,2023-06-26,22794,Sweetheart Wire Magazine Rack,18.4,1,15532.0,United Kingdom
558096,2023-06-26,21259,Victorian Sewing Box Small,16.35,1,15532.0,United Kingdom
558096,2023-06-26,22654,Deluxe Sewing Kit,16.35,1,15532.0,United Kingdom
558096,2023-06-26,23300,Gardeners Kneeling Pad Cup Of Tea,11.94,1,15532.0,United Kingdom
558096,2023-06-26,23301,Gardeners Kneeling Pad Keep Calm,11.94,1,15532.0,United Kingdom
558096,2023-06-26,22443,Grow Your Own Herbs Set Of 3,18.4,1,15532.0,United Kingdom
558096,2023-06-26,22442,Grow Your Own Flowers Set Of 3,18.4,1,15532.0,United Kingdom
558098,2023-06-26,22616,Pack Of 12 London Tissues,10.55,24,18044.0,United Kingdom
558098,2023-06-26,22082,Ribbon Reel Stripes Design,11.94,10,18044.0,United Kingdom
558098,2023-06-26,22109,Full English Breakfast Plate,13.72,16,18044.0,United Kingdom
558098,2023-06-26,22030,Swallows Greeting Card,10.68,12,18044.0,United Kingdom
558098,2023-06-26,22028,Penny Farthing Birthday Card,10.68,12,18044.0,United Kingdom
558098,2023-06-26,22037,Robot Birthday Card,10.68,12,18044.0,United Kingdom
558098,2023-06-26,22988,Soldiers Egg Cup,11.53,12,18044.0,United Kingdom
558098,2023-06-26,22971,Queens Guard Coffee Mug,12.86,6,18044.0,United Kingdom
558098,2023-06-26,22970,London Bus Coffee Mug,12.86,6,18044.0,United Kingdom
558098,2023-06-26,22081,Ribbon Reel Flora + Fauna,11.94,10,18044.0,United Kingdom
558098,2023-06-26,21232,Strawberry Ceramic Trinket Pot,11.53,12,18044.0,United Kingdom
558098,2023-06-26,23175,Regency Milk Jug Pink,13.58,6,18044.0,United Kingdom
558098,2023-06-26,23342,Mint Diner Wall Clock,18.96,2,18044.0,United Kingdom
558098,2023-06-26,23284,Doormat Keep Calm And Come In,18.4,2,18044.0,United Kingdom
558099,2023-06-26,90160D,Pink Boudicca Large Bracelet,17.37,1,17593.0,United Kingdom
558099,2023-06-26,90176D,Diamante Necklace Purple,17.94,2,17593.0,United Kingdom
558099,2023-06-26,90177D,Drop Diamante Earrings Purple,13.27,2,17593.0,United Kingdom
558099,2023-06-26,90067A,Pink Vintage Victorian Earrings,13.27,3,17593.0,United Kingdom
558099,2023-06-26,90000A,Raspberry Ant Copper Flower Necklac,16.35,3,17593.0,United Kingdom
558099,2023-06-26,90073,Vintage Enamel & Crystal Earrings,15.32,3,17593.0,United Kingdom
558099,2023-06-26,90160C,Turq+Red Boudicca Large Bracelet,17.37,1,17593.0,United Kingdom
558099,2023-06-26,90160A,Purple Boudicca Large Bracelet,17.37,1,17593.0,United Kingdom
558099,2023-06-26,90170,Daisy Hair Band,11.94,6,17593.0,United Kingdom
558099,2023-06-26,90200E,Green Sweetheart Bracelet,14.61,3,17593.0,United Kingdom
558099,2023-06-26,90200D,Pink Sweetheart Bracelet,14.61,3,17593.0,United Kingdom
558099,2023-06-26,90200A,Purple Sweetheart Bracelet,14.61,3,17593.0,United Kingdom
558099,2023-06-26,90201C,Red Enamel Flower Ring,13.27,3,17593.0,United Kingdom
558099,2023-06-26,90201D,Green Enamel Flower Ring,13.27,3,17593.0,United Kingdom
558099,2023-06-26,90201A,Purple Enamel Flower Ring,13.27,3,17593.0,United Kingdom
558099,2023-06-26,90129F,Red Glass Tassle Bag Charm,13.27,3,17593.0,United Kingdom
558099,2023-06-26,90129C,Green Glass Tassle Bag Charm,13.27,3,17593.0,United Kingdom
558099,2023-06-26,90129B,Turquoise Glass Tassle Bag Charm,13.27,3,17593.0,United Kingdom
558099,2023-06-26,90129A,Pink Glass Tassle Bag Charm,13.27,3,17593.0,United Kingdom
558099,2023-06-26,90065A,White Vintage Crystal Bracelet,17.17,3,17593.0,United Kingdom
558099,2023-06-26,22778,Glass Cloche Small,14.3,1,17593.0,United Kingdom
558099,2023-06-26,35649,Vintage Bead Cosmetic Bag,13.68,1,17593.0,United Kingdom
558099,2023-06-26,35651,Vintage Bead Pink Scarf,11.94,1,17593.0,United Kingdom
558099,2023-06-26,35648,Vintage Bead Pink Purse,11.1,7,17593.0,United Kingdom
558099,2023-06-26,35649,Vintage Bead Cosmetic Bag,13.68,3,17593.0,United Kingdom
558099,2023-06-26,35651,Vintage Bead Pink Scarf,11.94,3,17593.0,United Kingdom
558099,2023-06-26,22621,Traditional Knitting Nancy,11.94,7,17593.0,United Kingdom
558099,2023-06-26,35648,Vintage Bead Pink Purse,11.1,3,17593.0,United Kingdom
558099,2023-06-26,21618,4 Wildflower Botanical Candles,14.09,4,17593.0,United Kingdom
558099,2023-06-26,21616,4 Pear Botanical Dinner Candles,14.09,4,17593.0,United Kingdom
558099,2023-06-26,21617,4 Lily Botanical Dinner Candles,14.09,4,17593.0,United Kingdom
558099,2023-06-26,85014A,Black/Blue Polkadot Umbrella,16.35,1,17593.0,United Kingdom
558099,2023-06-26,84821,Danish Rose Deluxe Coaster,11.12,12,17593.0,United Kingdom
558099,2023-06-26,22583,Pack Of 6 Handbag Gift Boxes,12.86,3,17593.0,United Kingdom
558099,2023-06-26,22584,Pack Of 6 Panettone Gift Boxes,12.86,3,17593.0,United Kingdom
558099,2023-06-26,22585,Pack Of 6 Birdy Gift Tags,11.53,3,17593.0,United Kingdom
558099,2023-06-26,23182,Toilet Sign Occupied Or Vacant,11.1,5,17593.0,United Kingdom
558099,2023-06-26,22604,Set Of 4 Napkin Charms Cutlery,12.86,4,17593.0,United Kingdom
558099,2023-06-26,22643,Set Of 4 Napkin Charms Leaves,12.86,3,17593.0,United Kingdom
558099,2023-06-26,22641,Set Of 4 Napkin Charms Instrument,12.86,3,17593.0,United Kingdom
558099,2023-06-26,22639,Set Of 4 Napkin Charms Hearts,12.86,4,17593.0,United Kingdom
558099,2023-06-26,21212,Pack Of 72 Retrospot Cake Cases,10.81,1,17593.0,United Kingdom
558099,2023-06-26,22162,Heart Garland Rustic Padded,13.27,8,17593.0,United Kingdom
558099,2023-06-26,22161,Heart Decoration Rustic Hanging,10.44,48,17593.0,United Kingdom
558099,2023-06-26,21034,Rex Cash+Carry Jumbo Shopper,11.22,3,17593.0,United Kingdom
558099,2023-06-26,21136,Painted Metal Pears Assorted,11.98,16,17593.0,United Kingdom
558099,2023-06-26,23061,Vintage Embossed Heart,11.53,6,17593.0,United Kingdom
558099,2023-06-26,21314,Small Glass Heart Trinket Pot,12.4,4,17593.0,United Kingdom
558099,2023-06-26,23060,Heart Beaded Trellis Decoration,12.38,12,17593.0,United Kingdom
558099,2023-06-26,71038,White Hanging Beads Candle Holder,15.84,4,17593.0,United Kingdom
558099,2023-06-26,23067,Hanging Engraved Metal Heart,14.5,4,17593.0,United Kingdom
558099,2023-06-26,23068,Aluminium Stamped Heart,12.8,4,17593.0,United Kingdom
558099,2023-06-26,22986,Wrap Gingham Rose,10.68,25,17593.0,United Kingdom
558099,2023-06-26,21983,Pack Of 12 Blue Paisley Tissues,10.55,24,17593.0,United Kingdom
558099,2023-06-26,21984,Pack Of 12 Pink Paisley Tissues,10.55,12,17593.0,United Kingdom
558099,2023-06-26,21984,Pack Of 12 Pink Paisley Tissues,10.55,12,17593.0,United Kingdom
558099,2023-06-26,84609,Tall Rococo Candle Holder,18.96,2,17593.0,United Kingdom
558099,2023-06-26,21619,4 Vanilla Botanical Candles,14.09,4,17593.0,United Kingdom
558099,2023-06-26,85104,Silver Glass T-Light Set,13.27,4,17593.0,United Kingdom
558099,2023-06-26,84709B,Pink Oval Jewelled Mirror,16.35,4,17593.0,United Kingdom
558099,2023-06-26,21135,Victorian Metal Postcard Spring,11.98,16,17593.0,United Kingdom
558099,2023-06-26,84821,Danish Rose Deluxe Coaster,11.12,24,17593.0,United Kingdom
558099,2023-06-26,85125,Small Round Cut Glass Candlestick,15.32,4,17593.0,United Kingdom
558099,2023-06-26,22794,Sweetheart Wire Magazine Rack,18.4,3,17593.0,United Kingdom
558099,2023-06-26,22795,Sweetheart Recipe Book Stand,17.17,4,17593.0,United Kingdom
558099,2023-06-26,22156,Heart Decoration With Pearls,11.12,24,17593.0,United Kingdom
558099,2023-06-26,22778,Glass Cloche Small,14.3,2,17593.0,United Kingdom
558099,2023-06-26,82483,Wood 2 Drawer Cabinet White Finish,17.37,2,17593.0,United Kingdom
558099,2023-06-26,23066,Small Deco Jewellery Stand,18.71,4,17593.0,United Kingdom
558099,2023-06-26,22821,Gift Bag Psychedelic Apples,5.46,12,17593.0,United Kingdom
558100,2023-06-26,21500,Pink Polkadot Wrap,10.68,25,17768.0,United Kingdom
558100,2023-06-26,21499,Blue Polkadot Wrap,10.68,25,17768.0,United Kingdom
558100,2023-06-26,21955,Doormat Union Jack Guns And Roses,18.4,1,17768.0,United Kingdom
558100,2023-06-26,48194,Doormat Hearts,18.4,1,17768.0,United Kingdom
558100,2023-06-26,20685,Doormat Red Retrospot,18.4,1,17768.0,United Kingdom
558100,2023-06-26,48184,Doormat English Rose,18.4,1,17768.0,United Kingdom
558100,2023-06-26,48138,Doormat Union Flag,18.4,1,17768.0,United Kingdom
558100,2023-06-26,21524,Doormat Spotty Home Sweet Home,18.4,1,17768.0,United Kingdom
558100,2023-06-26,22690,Doormat Home Sweet Home Blue,18.4,1,17768.0,United Kingdom
558100,2023-06-26,23284,Doormat Keep Calm And Come In,18.4,1,17768.0,United Kingdom
558100,2023-06-26,21754,Home Building Block Word,16.35,8,17768.0,United Kingdom
558100,2023-06-26,23144,Zinc T-Light Holder Stars Small,11.1,12,17768.0,United Kingdom
558100,2023-06-26,22217,T-Light Holder Hanging Lace,11.53,14,17768.0,United Kingdom
558100,2023-06-26,21756,Bath Building Block Word,16.35,6,17768.0,United Kingdom
558100,2023-06-26,21034,Rex Cash+Carry Jumbo Shopper,11.22,1,17768.0,United Kingdom
558100,2023-06-26,21713,Citronella Candle Flowerpot,12.4,4,17768.0,United Kingdom
558100,2023-06-26,23106,Zinc Hearts Plant Pot Holder,13.21,8,17768.0,United Kingdom
558101,2023-06-26,23252,Vintage Red Enamel Trim Jug,14.09,4,18112.0,United Kingdom
558101,2023-06-26,23019,Small Apothecary Measuring Jar,18.71,2,18112.0,United Kingdom
558101,2023-06-26,23012,Glass Apothecary Bottle Perfume,14.3,2,18112.0,United Kingdom
558101,2023-06-26,23091,Zinc Herb Garden Container,16.66,5,18112.0,United Kingdom
558101,2023-06-26,23079,Toadstool Bedside Light,19.42,1,18112.0,United Kingdom
558101,2023-06-26,23014,Glass Apothecary Bottle Elixir,14.3,2,18112.0,United Kingdom
558101,2023-06-26,21773,Decorative Rose Bathroom Bottle,11.53,12,18112.0,United Kingdom
558101,2023-06-26,23015,Cordial Glass Jug,18.71,2,18112.0,United Kingdom
558101,2023-06-26,79403,Frosted White Base,10.48,72,18112.0,United Kingdom
558101,2023-06-26,22360,Glass Jar English Confectionery,13.27,4,18112.0,United Kingdom
558102,2023-06-26,21121,Set/10 Red Polkadot Party Candles,11.53,3,17372.0,United Kingdom
558102,2023-06-26,84997D,Childrens Cutlery Polkadot Pink,14.5,4,17372.0,United Kingdom
558102,2023-06-26,84997B,Childrens Cutlery Retrospot Red,14.5,3,17372.0,United Kingdom
558102,2023-06-26,22960,Jam Making Set With Jars,14.61,1,17372.0,United Kingdom
558102,2023-06-26,21034,Rex Cash+Carry Jumbo Shopper,11.22,1,17372.0,United Kingdom
558102,2023-06-26,48188,Doormat Welcome Puppies,18.4,1,17372.0,United Kingdom
558102,2023-06-26,23284,Doormat Keep Calm And Come In,18.4,2,17372.0,United Kingdom
558102,2023-06-26,22720,Set Of 3 Cake Tins Pantry Design,15.32,2,17372.0,United Kingdom
558102,2023-06-26,23243,Set Of Tea Coffee Sugar Tins Pantry,15.32,1,17372.0,United Kingdom
558102,2023-06-26,23321,Small White Heart Of Wicker,11.94,2,17372.0,United Kingdom
558102,2023-06-26,23322,Large White Heart Of Wicker,13.27,2,17372.0,United Kingdom
558102,2023-06-26,10133,Colouring Pencils Brown Tube,10.68,2,17372.0,United Kingdom
558102,2023-06-26,20981,12 Pencils Tall Tube Woodland,11.12,2,17372.0,United Kingdom
558102,2023-06-26,10133,Colouring Pencils Brown Tube,11.53,2,17372.0,United Kingdom
558102,2023-06-26,20977,36 Pencils Tube Woodland,11.53,2,17372.0,United Kingdom
558102,2023-06-26,23166,Medium Ceramic Top Storage Jar,11.53,2,17372.0,United Kingdom
558102,2023-06-26,23238,Set Of 4 Knick Knack Tins London,14.5,1,17372.0,United Kingdom
558102,2023-06-26,23239,Set Of 4 Knick Knack Tins Poppies,14.5,1,17372.0,United Kingdom
558102,2023-06-26,23237,Set Of 4 Knick Knack Tins Leaf,14.5,1,17372.0,United Kingdom
558102,2023-06-26,23245,Set Of 3 Regency Cake Tins,15.32,1,17372.0,United Kingdom
558102,2023-06-26,84828,Jungle Popsicles Ice Lolly Moulds,11.53,1,17372.0,United Kingdom
558102,2023-06-26,23308,Set Of 60 Vintage Leaf Cake Cases,10.81,4,17372.0,United Kingdom
558102,2023-06-26,22659,Lunch Box I Love London,12.25,2,17372.0,United Kingdom
558102,2023-06-26,22628,Picnic Boxes Set Of 3 Retrospot,15.32,1,17372.0,United Kingdom
558102,2023-06-26,22329,Round Container Set Of 5 Retrospot,11.94,1,17372.0,United Kingdom
558102,2023-06-26,23005,Travel Card Wallet I Love London,10.68,2,17372.0,United Kingdom
558102,2023-06-26,22996,Travel Card Wallet Vintage Ticket,10.68,2,17372.0,United Kingdom
558102,2023-06-26,84828,Jungle Popsicles Ice Lolly Moulds,11.53,1,17372.0,United Kingdom
558102,2023-06-26,23198,Pantry Magnetic Shopping List,11.74,2,17372.0,United Kingdom
558102,2023-06-26,23197,Sketchbook Magnetic Shopping List,11.74,2,17372.0,United Kingdom
558102,2023-06-26,23196,Vintage Leaf Magnetic Notepad,11.74,2,17372.0,United Kingdom
558102,2023-06-26,84997D,Childrens Cutlery Polkadot Pink,14.5,2,17372.0,United Kingdom
558102,2023-06-26,22553,Plasters In Tin Skulls,11.94,1,17372.0,United Kingdom
558102,2023-06-26,22554,Plasters In Tin Woodland Animals,11.94,1,17372.0,United Kingdom
558102,2023-06-26,22556,Plasters In Tin Circus Parade,11.94,1,17372.0,United Kingdom
558102,2023-06-26,22623,Box Of Vintage Jigsaw Blocks,16.35,1,17372.0,United Kingdom
558102,2023-06-26,21124,Set/10 Blue Polkadot Party Candles,11.53,3,17372.0,United Kingdom
558102,2023-06-26,21122,Set/10 Pink Polkadot Party Candles,11.53,2,17372.0,United Kingdom
558103,2023-06-26,22090,Paper Bunting Retrospot,13.27,6,13767.0,United Kingdom
558103,2023-06-26,15044D,Red Paper Parasol,13.27,6,13767.0,United Kingdom
558103,2023-06-26,15044A,Pink Paper Parasol,13.27,6,13767.0,United Kingdom
558103,2023-06-26,23284,Doormat Keep Calm And Come In,18.4,4,13767.0,United Kingdom
558103,2023-06-26,22728,Alarm Clock Bakelike Pink,14.09,6,13767.0,United Kingdom
558103,2023-06-26,22729,Alarm Clock Bakelike Orange,14.09,6,13767.0,United Kingdom
558103,2023-06-26,22726,Alarm Clock Bakelike Green,14.09,8,13767.0,United Kingdom
558103,2023-06-26,22699,Roses Regency Teacup And Saucer,13.27,6,13767.0,United Kingdom
558103,2023-06-26,22698,Pink Regency Teacup And Saucer,13.27,6,13767.0,United Kingdom
558103,2023-06-26,22697,Green Regency Teacup And Saucer,13.27,6,13767.0,United Kingdom
558104,2023-06-26,22352,Lunch Box With Cutlery Retrospot,12.86,4,13668.0,United Kingdom
558104,2023-06-26,82600,N0 Singing Metal Sign,12.4,4,13668.0,United Kingdom
558104,2023-06-26,21174,Pottering In The Shed Metal Sign,12.38,4,13668.0,United Kingdom
558104,2023-06-26,22953,Birthday Party Cordon Barrier Tape,11.53,4,13668.0,United Kingdom
558104,2023-06-26,22352,Lunch Box With Cutlery Retrospot,12.86,2,13668.0,United Kingdom
558104,2023-06-26,22567,20 Dolly Pegs Retrospot,11.74,2,13668.0,United Kingdom
558104,2023-06-26,21754,Home Building Block Word,16.35,2,13668.0,United Kingdom
558104,2023-06-26,21755,Love Building Block Word,16.35,2,13668.0,United Kingdom
558104,2023-06-26,23245,Set Of 3 Regency Cake Tins,15.32,2,13668.0,United Kingdom
558104,2023-06-26,84375,Set Of 20 Kids Cookie Cutters,12.4,2,13668.0,United Kingdom
558104,2023-06-26,22469,Heart Of Wicker Small,11.94,3,13668.0,United Kingdom
558104,2023-06-26,22077,6 Ribbons Rustic Charm,11.94,1,13668.0,United Kingdom
558104,2023-06-26,72351A,Set/6 Turquoise Butterfly T-Lights,12.4,2,13668.0,United Kingdom
558104,2023-06-26,72351B,Set/6 Pink Butterfly T-Lights,12.4,2,13668.0,United Kingdom
558104,2023-06-26,85039C,S/4 Black Mini Rose Candle In Bowl,11.94,2,13668.0,United Kingdom
558104,2023-06-26,85039B,S/4 Ivory Mini Rose Candle In Bowl,11.94,2,13668.0,United Kingdom
558104,2023-06-26,85039A,Set/4 Red Mini Rose Candle In Bowl,11.94,2,13668.0,United Kingdom
558104,2023-06-26,21257,Victorian Sewing Box Medium,18.4,1,13668.0,United Kingdom
558104,2023-06-26,21259,Victorian Sewing Box Small,16.35,2,13668.0,United Kingdom
558104,2023-06-26,23321,Small White Heart Of Wicker,11.94,4,13668.0,United Kingdom
558104,2023-06-26,23322,Large White Heart Of Wicker,13.27,4,13668.0,United Kingdom
558105,2023-06-26,22569,Feltcraft Cushion Butterfly,14.09,1,15644.0,United Kingdom
558105,2023-06-26,22570,Feltcraft Cushion Rabbit,14.09,1,15644.0,United Kingdom
558105,2023-06-26,22568,Feltcraft Cushion Owl,14.09,1,15644.0,United Kingdom
558105,2023-06-26,20971,Pink Blue Felt Craft Trinket Box,11.53,1,15644.0,United Kingdom
558105,2023-06-26,20972,Pink Cream Felt Craft Trinket Box,11.53,1,15644.0,United Kingdom
558105,2023-06-26,84951A,Set Of 4 Pistachio Lovebird Coaster,11.06,1,15644.0,United Kingdom
558105,2023-06-26,84692,Box Of 24 Cocktail Parasols,10.68,1,15644.0,United Kingdom
558105,2023-06-26,22196,Small Heart Measuring Spoons,11.12,1,15644.0,United Kingdom
558105,2023-06-26,22195,Large Heart Measuring Spoons,11.94,1,15644.0,United Kingdom
558105,2023-06-26,85045,Green Christmas Tree String 20light,15.32,1,15644.0,United Kingdom
558105,2023-06-26,21787,Rain Poncho Retrospot,11.12,4,15644.0,United Kingdom
558105,2023-06-26,22621,Traditional Knitting Nancy,11.94,2,15644.0,United Kingdom
558105,2023-06-26,21786,Polkadot Rain Hat,10.68,4,15644.0,United Kingdom
558105,2023-06-26,22553,Plasters In Tin Skulls,11.94,2,15644.0,United Kingdom
558105,2023-06-26,85116,Black Candelabra T-Light Holder,10.92,2,15644.0,United Kingdom
558105,2023-06-26,22652,Travel Sewing Kit,11.94,3,15644.0,United Kingdom
558105,2023-06-26,22554,Plasters In Tin Woodland Animals,11.94,2,15644.0,United Kingdom
558105,2023-06-26,22555,Plasters In Tin Strongman,11.94,2,15644.0,United Kingdom
558105,2023-06-26,22551,Plasters In Tin Spaceboy,11.94,1,15644.0,United Kingdom
558105,2023-06-26,22367,Childrens Apron Spaceboy Design,12.25,1,15644.0,United Kingdom
558105,2023-06-26,21156,Retrospot Childrens Apron,12.25,1,15644.0,United Kingdom
558105,2023-06-26,47591D,Pink Fairy Cake Childrens Apron,12.25,1,15644.0,United Kingdom
558105,2023-06-26,22899,Children's Apron Dolly Girl,12.4,1,15644.0,United Kingdom
558105,2023-06-26,22898,Childrens Apron Apples Design,12.25,1,15644.0,United Kingdom
558105,2023-06-26,22123,Ping Microwave Apron,12.25,2,15644.0,United Kingdom
558105,2023-06-26,23124,18pc Wooden Cutlery Set Disposable,11.53,2,15644.0,United Kingdom
558105,2023-06-26,84692,Box Of 24 Cocktail Parasols,10.68,1,15644.0,United Kingdom
558105,2023-06-26,21558,Skull Lunch Box With Cutlery,12.86,1,15644.0,United Kingdom
558105,2023-06-26,84692,Box Of 24 Cocktail Parasols,10.68,2,15644.0,United Kingdom
558105,2023-06-26,22417,Pack Of 60 Spaceboy Cake Cases,10.81,2,15644.0,United Kingdom
558105,2023-06-26,84992,72 Sweetheart Fairy Cake Cases,10.81,2,15644.0,United Kingdom
558105,2023-06-26,21213,Pack Of 72 Skull Cake Cases,10.81,2,15644.0,United Kingdom
558105,2023-06-26,21832,Chocolate Calculator,11.94,1,15644.0,United Kingdom
558105,2023-06-26,84951A,Set Of 4 Pistachio Lovebird Coaster,11.06,1,15644.0,United Kingdom
558105,2023-06-26,22196,Small Heart Measuring Spoons,11.12,2,15644.0,United Kingdom
558105,2023-06-26,21832,Chocolate Calculator,11.94,1,15644.0,United Kingdom
558105,2023-06-26,21976,Pack Of 60 Mushroom Cake Cases,10.81,2,15644.0,United Kingdom
558105,2023-06-26,22551,Plasters In Tin Spaceboy,11.94,1,15644.0,United Kingdom
558105,2023-06-26,21975,Pack Of 60 Dinosaur Cake Cases,10.81,2,15644.0,United Kingdom
558105,2023-06-26,22952,60 Cake Cases Vintage Christmas,10.81,2,15644.0,United Kingdom
558105,2023-06-26,22907,Pack Of 20 Napkins Pantry Design,11.12,1,15644.0,United Kingdom
558105,2023-06-26,35965,Folkart Heart Napkin Rings,11.06,3,15644.0,United Kingdom
558105,2023-06-26,84991,60 Teatime Fairy Cake Cases,10.81,2,15644.0,United Kingdom
558105,2023-06-26,22897,Oven Mitt Apples Design,11.74,1,15644.0,United Kingdom
558105,2023-06-26,21154,Red Retrospot Oven Glove,11.53,1,15644.0,United Kingdom
558105,2023-06-26,21212,Pack Of 72 Retrospot Cake Cases,10.81,2,15644.0,United Kingdom
558105,2023-06-26,22989,Set 2 Pantry Design Tea Towels,13.58,1,15644.0,United Kingdom
558105,2023-06-26,22895,Set Of 2 Tea Towels Apple And Pears,13.58,1,15644.0,United Kingdom
558105,2023-06-26,22961,Jam Making Set Printed,11.74,4,15644.0,United Kingdom
558105,2023-06-26,21035,Set/2 Red Retrospot Tea Towels,13.58,1,15644.0,United Kingdom
558105,2023-06-26,47559B,Tea Time Oven Glove,11.53,1,15644.0,United Kingdom
558105,2023-06-26,22908,Pack Of 20 Napkins Red Apples,11.12,1,15644.0,United Kingdom
558105,2023-06-26,23168,Classic Cafe Sugar Dispenser,11.53,3,15644.0,United Kingdom
558105,2023-06-26,84378,Set Of 3 Heart Cookie Cutters,11.53,1,15644.0,United Kingdom
558105,2023-06-26,84380,Set Of 3 Butterfly Cookie Cutters,11.53,1,15644.0,United Kingdom
558105,2023-06-26,23084,Rabbit Night Light,12.38,3,15644.0,United Kingdom
558105,2023-06-26,22174,Photo Cube,11.94,2,15644.0,United Kingdom
558105,2023-06-26,79051A,Smokey Grey Colour Glass,10.55,16,15644.0,United Kingdom
558105,2023-06-26,85032D,Yuletide Images Gift Wrap Set,10.92,3,15644.0,United Kingdom
558105,2023-06-26,85032B,Blossom Images Gift Wrap Set,10.92,3,15644.0,United Kingdom
558105,2023-06-26,85032A,Romantic Images Gift Wrap Set,10.92,3,15644.0,United Kingdom
558105,2023-06-26,85032C,Curious Images Gift Wrap Set,10.92,4,15644.0,United Kingdom
558105,2023-06-26,23079,Toadstool Bedside Light,19.42,2,15644.0,United Kingdom
558105,2023-06-26,22960,Jam Making Set With Jars,14.61,3,15644.0,United Kingdom
558105,2023-06-26,84596F,Small Marshmallows Pink Bowl,10.68,8,15644.0,United Kingdom
558105,2023-06-26,84596B,Small Dolly Mix Design Orange Bowl,10.68,8,15644.0,United Kingdom
558105,2023-06-26,20914,Set/5 Red Retrospot Lid Glass Bowls,13.27,2,15644.0,United Kingdom
558105,2023-06-26,22531,Magic Drawing Slate Circus Parade,10.68,1,15644.0,United Kingdom
558105,2023-06-26,21559,Strawberry Lunch Box With Cutlery,12.86,1,15644.0,United Kingdom
558105,2023-06-26,20718,Red Retrospot Shopper Bag,11.53,2,15644.0,United Kingdom
558105,2023-06-26,21988,Pack Of 6 Skull Paper Plates,11.12,2,15644.0,United Kingdom
558105,2023-06-26,21987,Pack Of 6 Skull Paper Cups,10.92,2,15644.0,United Kingdom
558105,2023-06-26,21090,Set/6 Collage Paper Plates,10.65,4,15644.0,United Kingdom
558105,2023-06-26,21084,Set/6 Collage Paper Cups,10.44,4,15644.0,United Kingdom
558105,2023-06-26,22727,Alarm Clock Bakelike Red,14.09,1,15644.0,United Kingdom
558105,2023-06-26,20974,12 Pencils Small Tube Skull,10.92,3,15644.0,United Kingdom
558105,2023-06-26,84828,Jungle Popsicles Ice Lolly Moulds,11.53,2,15644.0,United Kingdom
558105,2023-06-26,21372,Mirrored Wall Art Table Lamp,11.02,2,15644.0,United Kingdom
558105,2023-06-26,21368,Mirrored Wall Art Ladies,11.02,2,15644.0,United Kingdom
558105,2023-06-26,21367,Mirrored Wall Art Gents,11.02,2,15644.0,United Kingdom
558105,2023-06-26,20716,Party Food Shopper Bag,11.53,2,15644.0,United Kingdom
558105,2023-06-26,21096,Set/6 Fruit Salad Paper Plates,10.65,4,15644.0,United Kingdom
558105,2023-06-26,21088,Set/6 Fruit Salad Paper Cups,10.44,4,15644.0,United Kingdom
558105,2023-06-26,21789,Kids Rain Mac Pink,11.12,2,15644.0,United Kingdom
558105,2023-06-26,22537,Magic Drawing Slate Dinosaur,10.68,1,15644.0,United Kingdom
558105,2023-06-26,22534,Magic Drawing Slate Spaceboy,10.68,1,15644.0,United Kingdom
558105,2023-06-26,21788,Kids Rain Mac Blue,11.12,2,15644.0,United Kingdom
558105,2023-06-26,22560,Traditional Modelling Clay,11.53,2,15644.0,United Kingdom
558105,2023-06-26,23301,Gardeners Kneeling Pad Keep Calm,11.94,3,15644.0,United Kingdom
558105,2023-06-26,22508,Doorstop Retrospot Heart,14.09,2,15644.0,United Kingdom
558105,2023-06-26,22730,Alarm Clock Bakelike Ivory,14.09,3,15644.0,United Kingdom
558105,2023-06-26,22467,Gumball Coat Rack,12.86,3,15644.0,United Kingdom
558105,2023-06-26,23196,Vintage Leaf Magnetic Notepad,11.74,2,15644.0,United Kingdom
558105,2023-06-26,23198,Pantry Magnetic Shopping List,11.74,2,15644.0,United Kingdom
558105,2023-06-26,22749,Feltcraft Princess Charlotte Doll,14.09,2,15644.0,United Kingdom
558105,2023-06-26,22751,Feltcraft Princess Olivia Doll,14.09,1,15644.0,United Kingdom
558105,2023-06-26,22379,Recycling Bag Retrospot,12.4,2,15644.0,United Kingdom
558105,2023-06-26,21989,Pack Of 20 Skull Paper Napkins,11.12,1,15644.0,United Kingdom
558105,2023-06-26,23148,Miniature Antique Rose Hook Ivory,11.1,4,15644.0,United Kingdom
558105,2023-06-26,21832,Chocolate Calculator,11.94,1,15644.0,United Kingdom
558105,2023-06-26,21558,Skull Lunch Box With Cutlery,12.86,2,15644.0,United Kingdom
558105,2023-06-26,22352,Lunch Box With Cutlery Retrospot,12.86,1,15644.0,United Kingdom
558105,2023-06-26,21934,Skull Shoulder Bag,11.94,1,15644.0,United Kingdom
558105,2023-06-26,22993,Set Of 4 Pantry Jelly Moulds,11.53,2,15644.0,United Kingdom
558105,2023-06-26,21559,Strawberry Lunch Box With Cutlery,12.86,2,15644.0,United Kingdom
558105,2023-06-26,21935,Suki Shoulder Bag,11.94,3,15644.0,United Kingdom
558105,2023-06-26,85017B,Envelope 50 Blossom Images,10.68,4,15644.0,United Kingdom
558105,2023-06-26,23147,Single Antique Rose Hook Ivory,11.74,4,15644.0,United Kingdom
558105,2023-06-26,22558,Clothes Pegs Retrospot Pack 24,11.94,4,15644.0,United Kingdom
558105,2023-06-26,84988,Set Of 72 Pink Heart Paper Doilies,11.74,2,15644.0,United Kingdom
558105,2023-06-26,22781,Gumball Magazine Rack,18.09,3,15644.0,United Kingdom
558105,2023-06-26,21034,Rex Cash+Carry Jumbo Shopper,11.22,4,15644.0,United Kingdom
558105,2023-06-26,85132C,Charlie And Lola Figures Tins,12.25,2,15644.0,United Kingdom
558105,2023-06-26,22382,Lunch Bag Spaceboy Design,5.97,3,15644.0,United Kingdom
558105,2023-06-26,20726,Lunch Bag Woodland,5.97,1,15644.0,United Kingdom
558105,2023-06-26,23206,Lunch Bag Apple Design,5.97,1,15644.0,United Kingdom
558105,2023-06-26,22383,Lunch Bag Suki Design,5.97,3,15644.0,United Kingdom
558105,2023-06-26,23208,Lunch Bag Vintage Leaf Design,5.97,2,15644.0,United Kingdom
558105,2023-06-26,20725,Lunch Bag Red Retrospot,5.97,3,15644.0,United Kingdom
