TransactionNo,Date,ProductNo,ProductName,Price,Quantity,CustomerNo,Country
C556673,2023-06-13,22656,Vintage Blue Kitchen Cabinet,594.5,-1,16949.0,United Kingdom
C556678,2023-06-13,23064,Cinderella Chandelier,53.04,-4,13658.0,United Kingdom
C556638,2023-06-13,84078A,Set/4 White Retro Storage Cubes,51.2,-2,14231.0,United Kingdom
556508,2023-06-13,22824,3 Tier Sweetheart Garden Shelf,47.1,1,16342.0,United Kingdom
556636,2023-06-13,22423,Regency Cakestand 3 Tier,35.83,1,13636.0,United Kingdom
556636,2023-06-13,22760,Tray Breakfast In Bed,35.83,1,13636.0,United Kingdom
556580,2023-06-13,22761,Chest 7 Drawer Ma Campagne,35.82,1,17719.0,United Kingdom
556513,2023-06-13,21843,Red Retrospot Cake Stand,31.56,1,16513.0,United Kingdom
556513,2023-06-13,22501,Picnic Basket Wicker Large,31.56,1,16513.0,United Kingdom
556516,2023-06-13,22501,Picnic Basket Wicker Large,31.56,1,17516.0,United Kingdom
556636,2023-06-13,21843,Red Retrospot Cake Stand,31.56,1,13636.0,United Kingdom
556513,2023-06-13,22167,Oval Wall Mirror Diamante,30.71,2,16513.0,United Kingdom
556636,2023-06-13,22487,White Wood Garden Plant Ladder,30.71,1,13636.0,United Kingdom
556636,2023-06-13,23173,Regency Teapot Roses,30.71,1,13636.0,United Kingdom
556514,2023-06-13,22776,Sweetheart 3 Tier Cake Stand,30.7,1,14514.0,United Kingdom
556632,2023-06-13,21473,Sweetheart Cream Steel Table Rect,30.7,2,16987.0,United Kingdom
556507,2023-06-13,23008,Dolly Girl Baby Gift Set,27.62,4,12567.0,France
556507,2023-06-13,23007,Spaceboy Baby Gift Set,27.62,4,12567.0,France
556517,2023-06-13,22849,Bread Bin Diner Style Mint,27.62,2,12481.0,Germany
556531,2023-06-13,22847,Bread Bin Diner Style Ivory,27.62,1,15491.0,United Kingdom
556531,2023-06-13,22849,Bread Bin Diner Style Mint,27.62,1,15491.0,United Kingdom
556531,2023-06-13,22846,Bread Bin Diner Style Red,27.62,1,15491.0,United Kingdom
556531,2023-06-13,22848,Bread Bin Diner Style Pink,27.62,1,15491.0,United Kingdom
556536,2023-06-13,22847,Bread Bin Diner Style Ivory,27.62,1,17795.0,United Kingdom
556579,2023-06-13,22849,Bread Bin Diner Style Mint,27.62,1,15069.0,United Kingdom
556513,2023-06-13,22844,Vintage Cream Dog Food Container,27.3,1,16513.0,United Kingdom
556636,2023-06-13,22607,Wooden Rounders Garden Set,27.3,1,13636.0,United Kingdom
556509,2023-06-13,23253,16 Piece Cutlery Set Pantry Design,26.6,2,12708.0,Germany
556515,2023-06-13,22166,Wall Mirror Rectangle Diamante Pink,26.43,1,17515.0,United Kingdom
556636,2023-06-13,20685,Doormat Red Retrospot,26.43,1,13636.0,United Kingdom
556636,2023-06-13,84600,New Baroque Jewellery Box,26.43,1,13636.0,United Kingdom
556636,2023-06-13,23112,Parisienne Curio Cabinet,25.58,2,13636.0,United Kingdom
556517,2023-06-13,22847,Bread Bin Diner Style Ivory,25.57,4,12481.0,Germany
556537,2023-06-13,21781,Ma Campagne Cutlery Box,25.57,2,17725.0,United Kingdom
556539,2023-06-13,22605,Wooden Croquet Garden Set,25.57,1,13589.0,United Kingdom
556580,2023-06-13,22839,3 Tier Cake Tin Green And Cream,25.57,2,17719.0,United Kingdom
556636,2023-06-13,22762,Cupboard 3 Drawer Ma Campagne,25.57,1,13636.0,United Kingdom
556672,2023-06-13,22838,3 Tier Cake Tin Red And Cream,25.57,1,13742.0,United Kingdom
556513,2023-06-13,48185,Doormat Fairy Cake,24.73,1,16513.0,United Kingdom
556503,2023-06-13,22423,Regency Cakestand 3 Tier,23.32,2,13517.0,United Kingdom
556510,2023-06-13,22423,Regency Cakestand 3 Tier,23.32,2,14911.0,EIRE
556510,2023-06-13,22605,Wooden Croquet Garden Set,23.32,4,14911.0,EIRE
556531,2023-06-13,22424,Enamel Bread Bin Cream,23.32,2,15491.0,United Kingdom
556531,2023-06-13,21340,Classic Metal Birdcage Plant Holder,23.32,2,15491.0,United Kingdom
556534,2023-06-13,22423,Regency Cakestand 3 Tier,23.32,1,15036.0,United Kingdom
556539,2023-06-13,22485,Set Of 2 Wooden Market Crates,23.32,2,13589.0,United Kingdom
556539,2023-06-13,84796A,Pink Hawaiian Picnic Hamper For 2,23.32,1,13589.0,United Kingdom
556577,2023-06-13,20748,Kensington Coffee Set,23.32,1,17579.0,United Kingdom
556578,2023-06-13,22423,Regency Cakestand 3 Tier,23.32,4,12472.0,Germany
556579,2023-06-13,22423,Regency Cakestand 3 Tier,23.32,1,15069.0,United Kingdom
556596,2023-06-13,22236,Cake Stand 3 Tier Magic Garden,23.32,1,17349.0,United Kingdom
556636,2023-06-13,22485,Set Of 2 Wooden Market Crates,23.32,2,13636.0,United Kingdom
C556635,2023-06-13,22423,Regency Cakestand 3 Tier,23.32,-1,13505.0,Switzerland
C556640,2023-06-13,21735,Two Door Curio Cabinet,23.32,-2,13148.0,United Kingdom
C556644,2023-06-13,22423,Regency Cakestand 3 Tier,23.32,-1,17115.0,United Kingdom
C556647,2023-06-13,22424,Enamel Bread Bin Cream,23.32,-1,13012.0,United Kingdom
556500,2023-06-13,23170,Regency Tea Plate Roses,11.94,12,13468.0,United Kingdom
556500,2023-06-13,23174,Regency Sugar Bowl Green,14.5,4,13468.0,United Kingdom
556500,2023-06-13,23175,Regency Milk Jug Pink,13.58,4,13468.0,United Kingdom
556500,2023-06-13,23093,Small Parisienne Heart Photo Frame,12.8,8,13468.0,United Kingdom
556500,2023-06-13,22179,Set 10 Night Owl Lights,17.17,2,13468.0,United Kingdom
556501,2023-06-13,23240,Set Of 4 Knick Knack Tins Doily,14.5,6,16700.0,United Kingdom
556501,2023-06-13,23237,Set Of 4 Knick Knack Tins Leaf,14.5,6,16700.0,United Kingdom
556501,2023-06-13,23238,Set Of 4 Knick Knack Tins London,14.5,6,16700.0,United Kingdom
556501,2023-06-13,23236,Storage Tin Vintage Doily,13.21,6,16700.0,United Kingdom
556501,2023-06-13,22720,Set Of 3 Cake Tins Pantry Design,15.32,6,16700.0,United Kingdom
556501,2023-06-13,23004,Travel Card Wallet Pantry,10.68,24,16700.0,United Kingdom
556501,2023-06-13,23299,Food Cover With Beads Set 2,14.09,6,16700.0,United Kingdom
556501,2023-06-13,22699,Roses Regency Teacup And Saucer,13.27,6,16700.0,United Kingdom
556501,2023-06-13,22995,Travel Card Wallet Suki,10.68,24,16700.0,United Kingdom
556501,2023-06-13,22999,Travel Card Wallet Vintage Leaf,10.68,24,16700.0,United Kingdom
556501,2023-06-13,23006,Travel Card Wallet Flower Meadow,10.68,24,16700.0,United Kingdom
556501,2023-06-13,15036,Assorted Colours Silk Fan,11.1,12,16700.0,United Kingdom
556501,2023-06-13,23203,Jumbo Bag Vintage Doily,6.19,20,16700.0,United Kingdom
556501,2023-06-13,23202,Jumbo Bag Vintage Leaf,6.19,10,16700.0,United Kingdom
556501,2023-06-13,85099C,Jumbo Bag Baroque Black White,6.19,10,16700.0,United Kingdom
556501,2023-06-13,23209,Lunch Bag Vintage Doily,5.97,20,16700.0,United Kingdom
556501,2023-06-13,23207,Lunch Bag Alphabet Design,5.97,10,16700.0,United Kingdom
556501,2023-06-13,23208,Lunch Bag Vintage Leaf Design,5.97,10,16700.0,United Kingdom
556501,2023-06-13,22662,Lunch Bag Dolly Girl Design,5.97,10,16700.0,United Kingdom
556501,2023-06-13,20728,Lunch Bag Cars Blue,5.97,10,16700.0,United Kingdom
556502,2023-06-13,23283,Doormat Vintage Leaf,18.4,2,13761.0,United Kingdom
556502,2023-06-13,48188,Doormat Welcome Puppies,18.4,2,13761.0,United Kingdom
556502,2023-06-13,23118,Parisienne Jewellery Drawer,17.94,2,13761.0,United Kingdom
556502,2023-06-13,22841,Round Cake Tin Vintage Green,18.4,2,13761.0,United Kingdom
556502,2023-06-13,22840,Round Cake Tin Vintage Red,18.4,2,13761.0,United Kingdom
556502,2023-06-13,23236,Storage Tin Vintage Doily,13.21,6,13761.0,United Kingdom
556502,2023-06-13,22720,Set Of 3 Cake Tins Pantry Design,15.32,3,13761.0,United Kingdom
556502,2023-06-13,22960,Jam Making Set With Jars,14.61,6,13761.0,United Kingdom
556502,2023-06-13,22637,Piggy Bank Retrospot,12.86,4,13761.0,United Kingdom
556502,2023-06-13,21844,Red Retrospot Mug,13.27,6,13761.0,United Kingdom
556502,2023-06-13,22505,Memo Board Cottage Design,15.32,4,13761.0,United Kingdom
556502,2023-06-13,22147,Feltcraft Butterfly Hearts,11.74,12,13761.0,United Kingdom
556502,2023-06-13,22748,Poppy's Playhouse Kitchen,12.4,6,13761.0,United Kingdom
556502,2023-06-13,22746,Poppy's Playhouse Livingroom,12.4,6,13761.0,United Kingdom
556502,2023-06-13,22379,Recycling Bag Retrospot,12.4,5,13761.0,United Kingdom
556502,2023-06-13,20972,Pink Cream Felt Craft Trinket Box,11.53,12,13761.0,United Kingdom
556502,2023-06-13,20829,Glitter Hanging Butterfly String,12.4,8,13761.0,United Kingdom
556502,2023-06-13,22814,Card Party Games,10.68,12,13761.0,United Kingdom
556502,2023-06-13,22925,Blue Giant Garden Thermometer,16.35,2,13761.0,United Kingdom
556502,2023-06-13,22927,Green Giant Garden Thermometer,16.35,2,13761.0,United Kingdom
556502,2023-06-13,21169,You're Confusing Me Metal Sign,11.98,12,13761.0,United Kingdom
556502,2023-06-13,21907,I'm On Holiday Metal Sign,12.4,12,13761.0,United Kingdom
556502,2023-06-13,23147,Single Antique Rose Hook Ivory,11.74,12,13761.0,United Kingdom
556502,2023-06-13,21080,Set/20 Red Retrospot Paper Napkins,11.12,12,13761.0,United Kingdom
556502,2023-06-13,20750,Red Retrospot Mini Cases,18.4,2,13761.0,United Kingdom
556502,2023-06-13,20983,12 Pencils Tall Tube Red Retrospot,11.12,12,13761.0,United Kingdom
556502,2023-06-13,21749,Large Red Retrospot Windmill,12.4,6,13761.0,United Kingdom
556502,2023-06-13,21790,Vintage Snap Cards,11.12,12,13761.0,United Kingdom
556502,2023-06-13,23202,Jumbo Bag Vintage Leaf,6.13,10,13761.0,United Kingdom
556502,2023-06-13,23203,Jumbo Bag Vintage Doily,6.13,10,13761.0,United Kingdom
556502,2023-06-13,23209,Lunch Bag Vintage Doily,5.97,10,13761.0,United Kingdom
556502,2023-06-13,23208,Lunch Bag Vintage Leaf Design,5.97,10,13761.0,United Kingdom
556503,2023-06-13,23302,Kneeling Mat Housework Design,11.94,12,13517.0,United Kingdom
556503,2023-06-13,22969,Homemade Jam Scented Candles,11.74,12,13517.0,United Kingdom
556503,2023-06-13,84581,Dog Toy With Pink Crochet Skirt,14.09,4,13517.0,United Kingdom
556503,2023-06-13,84580,Mouse Toy With Pink T-Shirt,14.09,4,13517.0,United Kingdom
556503,2023-06-13,21314,Small Glass Heart Trinket Pot,12.4,8,13517.0,United Kingdom
556503,2023-06-13,23089,Glass Bon Bon Jar,11.94,12,13517.0,United Kingdom
556503,2023-06-13,21578,Woodland Design Cotton Tote Bag,12.56,6,13517.0,United Kingdom
556503,2023-06-13,21078,Set/20 Strawberry Paper Napkins,11.12,12,13517.0,United Kingdom
556503,2023-06-13,21080,Set/20 Red Retrospot Paper Napkins,11.12,12,13517.0,United Kingdom
556503,2023-06-13,23163,Regency Sugar Tongs,12.8,8,13517.0,United Kingdom
556503,2023-06-13,22817,Card Suki Birthday,10.68,12,13517.0,United Kingdom
556503,2023-06-13,22037,Robot Birthday Card,10.68,12,13517.0,United Kingdom
556503,2023-06-13,21495,Skulls And Crossbones Wrap,10.68,25,13517.0,United Kingdom
556503,2023-06-13,21504,Skulls Greeting Card,10.68,12,13517.0,United Kingdom
556503,2023-06-13,20836,French Paisley Cushion Cover,11.12,12,13517.0,United Kingdom
556503,2023-06-13,46000M,Polyester Filler Pad 45x45cm,11.84,12,13517.0,United Kingdom
556503,2023-06-13,15060B,Fairy Cake Design Umbrella,14.09,4,13517.0,United Kingdom
556503,2023-06-13,15056N,Edwardian Parasol Natural,16.35,3,13517.0,United Kingdom
556503,2023-06-13,85014B,Red Retrospot Umbrella,16.35,3,13517.0,United Kingdom
556503,2023-06-13,21579,Lolita Design Cotton Tote Bag,12.56,6,13517.0,United Kingdom
556503,2023-06-13,21577,Save The Planet Cotton Tote Bag,12.56,6,13517.0,United Kingdom
556503,2023-06-13,20717,Strawberry Shopper Bag,11.53,10,13517.0,United Kingdom
556503,2023-06-13,20718,Red Retrospot Shopper Bag,11.53,10,13517.0,United Kingdom
556503,2023-06-13,21925,Union Stripe Cushion Cover,11.53,12,13517.0,United Kingdom
556503,2023-06-13,46000S,Polyester Filler Pad 40x40cm,11.74,12,13517.0,United Kingdom
556503,2023-06-13,21981,Pack Of 12 Woodland Tissues,10.55,24,13517.0,United Kingdom
556503,2023-06-13,21982,Pack Of 12 Suki Tissues,10.55,24,13517.0,United Kingdom
556503,2023-06-13,22030,Swallows Greeting Card,10.68,12,13517.0,United Kingdom
556503,2023-06-13,16156S,Wrap Pink Fairy Cakes,10.68,25,13517.0,United Kingdom
556503,2023-06-13,16161U,Wrap Suki And Friends,10.68,25,13517.0,United Kingdom
556503,2023-06-13,84249A,Greeting Card Square Doughnuts,10.68,12,13517.0,United Kingdom
556503,2023-06-13,84661A,White Square Table Clock,12.86,6,13517.0,United Kingdom
556503,2023-06-13,84660A,White Stitched Wall Clock,14.09,4,13517.0,United Kingdom
556503,2023-06-13,84660B,Black Stitched Wall Clock,14.09,4,13517.0,United Kingdom
556503,2023-06-13,20963,Apple Bath Sponge,11.53,10,13517.0,United Kingdom
556503,2023-06-13,21481,Fawn Blue Hot Water Bottle,13.27,6,13517.0,United Kingdom
556503,2023-06-13,22835,Hot Water Bottle I Am So Poorly,15.02,4,13517.0,United Kingdom
556503,2023-06-13,85123A,Cream Hanging Heart T-Light Holder,13.27,12,13517.0,United Kingdom
556503,2023-06-13,85111,Silver Glitter Flower Votive Holder,10.55,36,13517.0,United Kingdom
556503,2023-06-13,22224,White Lovebird Lantern,13.27,6,13517.0,United Kingdom
556503,2023-06-13,21922,Union Stripe With Fringe Hammock,18.4,2,13517.0,United Kingdom
556503,2023-06-13,23284,Doormat Keep Calm And Come In,18.4,2,13517.0,United Kingdom
556503,2023-06-13,22692,Doormat Welcome To Our Home,18.4,2,13517.0,United Kingdom
556503,2023-06-13,48185,Doormat Fairy Cake,18.4,2,13517.0,United Kingdom
556503,2023-06-13,48194,Doormat Hearts,18.4,2,13517.0,United Kingdom
556503,2023-06-13,23301,Gardeners Kneeling Pad Keep Calm,11.94,12,13517.0,United Kingdom
556503,2023-06-13,23300,Gardeners Kneeling Pad Cup Of Tea,11.94,12,13517.0,United Kingdom
556503,2023-06-13,22478,Birdhouse Garden Marker,11.53,10,13517.0,United Kingdom
556503,2023-06-13,21137,Black Record Cover Frame,14.09,4,13517.0,United Kingdom
556503,2023-06-13,22595,Gingham Heart Decoration,11.12,12,13517.0,United Kingdom
556503,2023-06-13,22597,Musical Zinc Heart Decoration,11.12,12,13517.0,United Kingdom
556503,2023-06-13,22212,Four Hook White Lovebirds,12.4,6,13517.0,United Kingdom
556503,2023-06-13,23174,Regency Sugar Bowl Green,14.5,4,13517.0,United Kingdom
556503,2023-06-13,23175,Regency Milk Jug Pink,13.58,4,13517.0,United Kingdom
556503,2023-06-13,22698,Pink Regency Teacup And Saucer,13.27,4,13517.0,United Kingdom
556503,2023-06-13,22697,Green Regency Teacup And Saucer,13.27,6,13517.0,United Kingdom
556503,2023-06-13,22699,Roses Regency Teacup And Saucer,13.27,6,13517.0,United Kingdom
556503,2023-06-13,85160B,Black Bird Garden Design Mug,10.65,6,13517.0,United Kingdom
556503,2023-06-13,21658,Glass Beurre Dish,14.3,4,13517.0,United Kingdom
556503,2023-06-13,23161,Regency Cake Fork,11.53,12,13517.0,United Kingdom
556503,2023-06-13,23160,Regency Tea Spoon,11.53,12,13517.0,United Kingdom
556503,2023-06-13,23162,Regency Tea Strainer,14.09,4,13517.0,United Kingdom
556503,2023-06-13,22481,Black Tea Towel Classic Design,11.53,12,13517.0,United Kingdom
556503,2023-06-13,22480,Red Tea Towel Classic Design,11.53,12,13517.0,United Kingdom
556503,2023-06-13,23167,Small Ceramic Top Storage Jar,11.1,12,13517.0,United Kingdom
556503,2023-06-13,22721,Set Of 3 Cake Tins Sketchbook,15.32,3,13517.0,United Kingdom
556503,2023-06-13,85159B,White Tea Coffee Sugar Jars,12.25,12,13517.0,United Kingdom
556503,2023-06-13,85159A,Black Tea Coffee Sugar Jars,12.25,12,13517.0,United Kingdom
556503,2023-06-13,84050,Pink Heart Shape Egg Frying Pan,11.94,6,13517.0,United Kingdom
556503,2023-06-13,21155,Red Retrospot Peg Bag,12.86,6,13517.0,United Kingdom
556503,2023-06-13,22558,Clothes Pegs Retrospot Pack 24,11.94,12,13517.0,United Kingdom
556503,2023-06-13,20754,Retrospot Red Washing Up Gloves,12.4,6,13517.0,United Kingdom
556503,2023-06-13,16168M,Funky Monkey Gift Bag Medium,5.34,24,13517.0,United Kingdom
556504,2023-06-13,85213,Mini Zinc Garden Decorations,10.55,12,13936.0,United Kingdom
556504,2023-06-13,22558,Clothes Pegs Retrospot Pack 24,11.94,12,13936.0,United Kingdom
556504,2023-06-13,21793,Classic French Style Basket Brown,14.3,8,13936.0,United Kingdom
556504,2023-06-13,20751,Funky Washing Up Gloves Assorted,12.4,12,13936.0,United Kingdom
556504,2023-06-13,22077,6 Ribbons Rustic Charm,11.94,12,13936.0,United Kingdom
556504,2023-06-13,85049G,Chocolate Box Ribbons,11.53,12,13936.0,United Kingdom
556504,2023-06-13,85049C,Romantic Pinks Ribbons,11.53,12,13936.0,United Kingdom
556504,2023-06-13,47566B,Tea Time Party Bunting,15.32,4,13936.0,United Kingdom
556504,2023-06-13,22549,Picture Dominoes,11.74,12,13936.0,United Kingdom
556504,2023-06-13,22405,Money Box Pocket Money Design,11.53,12,13936.0,United Kingdom
556504,2023-06-13,84920,Pink Flower Fabric Pony,14.09,4,13936.0,United Kingdom
556504,2023-06-13,90174,Butterfly Hair Band,12.86,6,13936.0,United Kingdom
556504,2023-06-13,90114,Summer Daisies Bag Charm,12.86,6,13936.0,United Kingdom
556504,2023-06-13,21640,Assorted Tutti Frutti Fob Notebook,11.12,24,13936.0,United Kingdom
556504,2023-06-13,21983,Pack Of 12 Blue Paisley Tissues,10.55,24,13936.0,United Kingdom
556504,2023-06-13,21197,Multicolour Confetti In Tube,11.94,12,13936.0,United Kingdom
556504,2023-06-13,47578A,English Rose Small Scented Flower,11.12,10,13936.0,United Kingdom
556504,2023-06-13,22441,Grow Your Own Basil In Enamel Mug,12.4,8,13936.0,United Kingdom
556504,2023-06-13,10133,Colouring Pencils Brown Tube,10.68,20,13936.0,United Kingdom
556504,2023-06-13,21209,Multicolour Honeycomb Fan,10.65,12,13936.0,United Kingdom
556504,2023-06-13,22208,Wood Stamp Set Thank You,11.1,12,13936.0,United Kingdom
556504,2023-06-13,22608,Pens Assorted Funky Jeweled,10.44,36,13936.0,United Kingdom
556504,2023-06-13,35923,Candy Heart Hanging Decoration,10.65,12,13936.0,United Kingdom
556504,2023-06-13,75172,Painted Sea Shell Metal Windchime,11.06,12,13936.0,United Kingdom
556504,2023-06-13,23263,Set Of 3 Wooden Heart Decorations,11.53,12,13936.0,United Kingdom
556504,2023-06-13,23306,Set Of 36 Pantry Paper Doilies,11.74,12,13936.0,United Kingdom
556505,2023-06-13,22616,Pack Of 12 London Tissues,10.55,504,17381.0,United Kingdom
556505,2023-06-13,22555,Plasters In Tin Strongman,11.94,192,17381.0,United Kingdom
556506,2023-06-13,22560,Traditional Modelling Clay,11.34,48,17381.0,United Kingdom
556507,2023-06-13,84879,Assorted Colour Bird Ornament,11.98,16,12567.0,France
556507,2023-06-13,23112,Parisienne Curio Cabinet,17.94,2,12567.0,France
556507,2023-06-13,48184,Doormat English Rose,18.4,4,12567.0,France
556507,2023-06-13,23158,Set Of 5 Lucky Cat Magnets,12.38,12,12567.0,France
556507,2023-06-13,22730,Alarm Clock Bakelike Ivory,14.09,8,12567.0,France
556507,2023-06-13,22467,Gumball Coat Rack,12.86,12,12567.0,France
556507,2023-06-13,22725,Alarm Clock Bakelike Chocolate,14.09,8,12567.0,France
556507,2023-06-13,22781,Gumball Magazine Rack,18.09,4,12567.0,France
556507,2023-06-13,23052,Recycled Acapulco Mat Turquoise,18.71,4,12567.0,France
556507,2023-06-13,23053,Recycled Acapulco Mat Pink,18.71,4,12567.0,France
556507,2023-06-13,23054,Recycled Acapulco Mat Lavender,18.71,4,12567.0,France
556507,2023-06-13,23049,Recycled Acapulco Mat Red,18.71,6,12567.0,France
556507,2023-06-13,23050,Recycled Acapulco Mat Green,18.71,4,12567.0,France
556507,2023-06-13,23204,Charlotte Bag Apples Design,11.12,10,12567.0,France
556507,2023-06-13,22303,Coffee Mug Apples Design,12.86,6,12567.0,France
556507,2023-06-13,22908,Pack Of 20 Napkins Red Apples,11.12,12,12567.0,France
556507,2023-06-13,22989,Set 2 Pantry Design Tea Towels,13.58,6,12567.0,France
556507,2023-06-13,22352,Lunch Box With Cutlery Retrospot,12.86,6,12567.0,France
556507,2023-06-13,22379,Recycling Bag Retrospot,12.4,5,12567.0,France
556507,2023-06-13,22752,Set 7 Babushka Nesting Boxes,18.96,6,12567.0,France
556507,2023-06-13,23190,Bundle Of 3 School Exercise Books,11.94,12,12567.0,France
556507,2023-06-13,23192,Bundle Of 3 Alphabet Exercise Books,11.94,12,12567.0,France
556507,2023-06-13,22440,Balloon Water Bomb Pack Of 35,10.68,20,12567.0,France
556507,2023-06-13,21746,Small Red Retrospot Windmill,11.53,12,12567.0,France
556507,2023-06-13,22992,Revolver Wooden Ruler,12.25,12,12567.0,France
556507,2023-06-13,22991,Giraffe Wooden Ruler,12.25,12,12567.0,France
556507,2023-06-13,21891,Traditional Wooden Skipping Rope,11.74,12,12567.0,France
556507,2023-06-13,21914,Blue Harmonica In Box,11.53,12,12567.0,France
556507,2023-06-13,22139,Retrospot Tea Set Ceramic 11 Pc,15.32,3,12567.0,France
556507,2023-06-13,22554,Plasters In Tin Woodland Animals,11.94,12,12567.0,France
556507,2023-06-13,22555,Plasters In Tin Strongman,11.94,12,12567.0,France
556507,2023-06-13,21561,Dinosaur Lunch Box With Cutlery,12.86,6,12567.0,France
556507,2023-06-13,23076,Ice Cream Sundae Lip Gloss,11.53,24,12567.0,France
556507,2023-06-13,22631,Circus Parade Lunch Box,12.25,12,12567.0,France
556507,2023-06-13,22556,Plasters In Tin Circus Parade,11.94,12,12567.0,France
556507,2023-06-13,23108,Set Of 10 Led Dolly Lights,16.66,6,12567.0,France
556507,2023-06-13,22693,Grow A Flytrap Or Sunflower In Tin,11.53,24,12567.0,France
556507,2023-06-13,21124,Set/10 Blue Polkadot Party Candles,11.53,24,12567.0,France
556507,2023-06-13,22088,Paper Bunting Coloured Lace,13.27,6,12567.0,France
556507,2023-06-13,23282,Folding Butterfly Mirror Ivory,11.1,12,12567.0,France
556507,2023-06-13,23281,Folding Butterfly Mirror Red,11.1,12,12567.0,France
556507,2023-06-13,23084,Rabbit Night Light,12.38,6,12567.0,France
556507,2023-06-13,23079,Toadstool Bedside Light,19.42,2,12567.0,France
556507,2023-06-13,23048,Set Of 10 Lanterns Fairy Light Star,14.5,4,12567.0,France
556507,2023-06-13,21754,Home Building Block Word,16.35,3,12567.0,France
556507,2023-06-13,21755,Love Building Block Word,16.35,3,12567.0,France
556507,2023-06-13,85099B,Jumbo Bag Red Retrospot,6.19,10,12567.0,France
556507,2023-06-13,20712,Jumbo Bag Woodland Animals,6.19,10,12567.0,France
556507,2023-06-13,23200,Jumbo Bag Pears,6.19,10,12567.0,France
556507,2023-06-13,23199,Jumbo Bag Apples,6.19,20,12567.0,France
556507,2023-06-13,23206,Lunch Bag Apple Design,5.97,10,12567.0,France
556507,2023-06-13,20726,Lunch Bag Woodland,5.97,10,12567.0,France
556507,2023-06-13,22384,Lunch Bag Pink Polkadot,5.97,10,12567.0,France
556507,2023-06-13,20728,Lunch Bag Cars Blue,5.97,10,12567.0,France
556507,2023-06-13,23209,Lunch Bag Vintage Doily,5.97,10,12567.0,France
556508,2023-06-13,71459,Hanging Jam Jar T-Light Holders,11.12,12,16342.0,United Kingdom
556508,2023-06-13,85036A,Gardenia 1 Wick Morris Boxed Candle,14.61,4,16342.0,United Kingdom
556508,2023-06-13,72819,Cupid Design Scented Candles,12.86,6,16342.0,United Kingdom
556508,2023-06-13,23079,Toadstool Bedside Light,19.42,2,16342.0,United Kingdom
556508,2023-06-13,21731,Red Toadstool Led Night Light,11.94,12,16342.0,United Kingdom
556508,2023-06-13,85099F,Jumbo Bag Strawberry,6.19,10,16342.0,United Kingdom
556509,2023-06-13,23192,Bundle Of 3 Alphabet Exercise Books,11.94,12,12708.0,Germany
556509,2023-06-13,23236,Storage Tin Vintage Doily,13.21,6,12708.0,Germany
556509,2023-06-13,23240,Set Of 4 Knick Knack Tins Doily,14.5,6,12708.0,Germany
556509,2023-06-13,23243,Set Of Tea Coffee Sugar Tins Pantry,15.32,4,12708.0,Germany
556509,2023-06-13,23242,Treasure Tin Buffalo Bill,12.38,6,12708.0,Germany
556509,2023-06-13,23245,Set Of 3 Regency Cake Tins,15.32,4,12708.0,Germany
556509,2023-06-13,23307,Set Of 60 Pantry Design Cake Cases,10.81,24,12708.0,Germany
556509,2023-06-13,22962,Jam Jar With Pink Lid,11.12,12,12708.0,Germany
556509,2023-06-13,22989,Set 2 Pantry Design Tea Towels,13.58,6,12708.0,Germany
556509,2023-06-13,22990,Cotton Apron Pantry Design,15.32,2,12708.0,Germany
556509,2023-06-13,22627,Mint Kitchen Scales,18.96,2,12708.0,Germany
556509,2023-06-13,21578,Woodland Design Cotton Tote Bag,12.56,6,12708.0,Germany
556509,2023-06-13,21577,Save The Planet Cotton Tote Bag,12.56,6,12708.0,Germany
556510,2023-06-13,23108,Set Of 10 Led Dolly Lights,16.66,4,14911.0,EIRE
556510,2023-06-13,23163,Regency Sugar Tongs,12.8,8,14911.0,EIRE
556510,2023-06-13,23174,Regency Sugar Bowl Green,14.5,6,14911.0,EIRE
556510,2023-06-13,23175,Regency Milk Jug Pink,13.58,8,14911.0,EIRE
556510,2023-06-13,23170,Regency Tea Plate Roses,11.94,12,14911.0,EIRE
556510,2023-06-13,23084,Rabbit Night Light,12.38,6,14911.0,EIRE
556510,2023-06-13,23079,Toadstool Bedside Light,19.42,4,14911.0,EIRE
556510,2023-06-13,23169,Classic Glass Cookie Jar,14.5,6,14911.0,EIRE
556510,2023-06-13,11001,Asstd Design Racing Car Pen,11.98,16,14911.0,EIRE
556510,2023-06-13,23310,Bubblegum Ring Assorted,10.68,72,14911.0,EIRE
556510,2023-06-13,23245,Set Of 3 Regency Cake Tins,15.32,4,14911.0,EIRE
556510,2023-06-13,23241,Treasure Tin Gymkhana Design,12.38,6,14911.0,EIRE
556510,2023-06-13,23240,Set Of 4 Knick Knack Tins Doily,14.5,6,14911.0,EIRE
556510,2023-06-13,23273,Heart T-Light Holder Willie Winkie,11.94,12,14911.0,EIRE
556510,2023-06-13,23306,Set Of 36 Pantry Paper Doilies,11.74,12,14911.0,EIRE
556510,2023-06-13,21949,Set Of 6 Strawberry Chopsticks,11.53,12,14911.0,EIRE
556510,2023-06-13,84692,Box Of 24 Cocktail Parasols,10.68,25,14911.0,EIRE
556510,2023-06-13,21634,Assorted Mini Madras Notebook,10.65,24,14911.0,EIRE
556510,2023-06-13,22367,Childrens Apron Spaceboy Design,12.25,8,14911.0,EIRE
556510,2023-06-13,22899,Children's Apron Dolly Girl,12.4,6,14911.0,EIRE
556510,2023-06-13,22895,Set Of 2 Tea Towels Apple And Pears,13.58,6,14911.0,EIRE
556510,2023-06-13,22989,Set 2 Pantry Design Tea Towels,13.58,6,14911.0,EIRE
556510,2023-06-13,79321,Chilli Lights,16.14,4,14911.0,EIRE
556510,2023-06-13,22037,Robot Birthday Card,10.68,12,14911.0,EIRE
556510,2023-06-13,22716,Card Circus Parade,10.68,12,14911.0,EIRE
556510,2023-06-13,22983,Card Billboard Font,10.68,12,14911.0,EIRE
556510,2023-06-13,22028,Penny Farthing Birthday Card,10.68,12,14911.0,EIRE
556510,2023-06-13,22027,Tea Party Birthday Card,10.68,12,14911.0,EIRE
556510,2023-06-13,22433,Watering Can Green Dinosaur,12.25,6,14911.0,EIRE
556510,2023-06-13,22432,Watering Can Pink Bunny,12.25,6,14911.0,EIRE
556510,2023-06-13,22431,Watering Can Blue Elephant,12.25,6,14911.0,EIRE
556510,2023-06-13,84674,Flying Pig Watering Can,13.27,6,14911.0,EIRE
556510,2023-06-13,22747,Poppy's Playhouse Bathroom,12.4,6,14911.0,EIRE
556510,2023-06-13,23199,Jumbo Bag Apples,6.19,10,14911.0,EIRE
556510,2023-06-13,23200,Jumbo Bag Pears,6.19,10,14911.0,EIRE
556510,2023-06-13,23201,Jumbo Bag Alphabet,6.19,10,14911.0,EIRE
556510,2023-06-13,23202,Jumbo Bag Vintage Leaf,6.19,10,14911.0,EIRE
