TransactionNo,Date,ProductNo,ProductName,Price,Quantity,CustomerNo,Country
560547,2023-07-19,22826,Love Seat Antique White Metal,97.37,1,17419.0,United Kingdom
560567,2023-07-19,22423,Regency Cakestand 3 Tier,35.83,10,13567.0,United Kingdom
560451,2023-07-19,23008,Dolly Girl Baby Gift Set,27.62,2,14911.0,EIRE
560451,2023-07-19,23007,Spaceboy Baby Gift Set,27.62,2,14911.0,EIRE
560451,2023-07-19,23010,Circus Parade Baby Gift Set,27.62,2,14911.0,EIRE
560451,2023-07-19,22846,Bread Bin Diner Style Red,27.62,2,14911.0,EIRE
560454,2023-07-19,22509,Sewing Box Retrospot Design,27.62,1,12947.0,United Kingdom
560499,2023-07-19,22847,Bread Bin Diner Style Ivory,27.62,2,16713.0,United Kingdom
560590,2023-07-19,22847,Bread Bin Diner Style Ivory,27.62,1,12560.0,Germany
560503,2023-07-19,22606,Wooden Skittles Garden Set,26.6,1,17682.0,United Kingdom
560504,2023-07-19,22606,Wooden Skittles Garden Set,26.6,2,13081.0,United Kingdom
560579,2023-07-19,22606,Wooden Skittles Garden Set,26.6,1,15867.0,United Kingdom
560451,2023-07-19,21627,Elephant Carnival Pouffe,25.57,4,14911.0,EIRE
560451,2023-07-19,21628,Triangular Pouffe Vintage,25.57,4,14911.0,EIRE
560503,2023-07-19,22605,Wooden Croquet Garden Set,25.57,1,17682.0,United Kingdom
560445,2023-07-19,22839,3 Tier Cake Tin Green And Cream,23.32,12,14156.0,EIRE
560445,2023-07-19,22838,3 Tier Cake Tin Red And Cream,23.32,12,14156.0,EIRE
560451,2023-07-19,22423,Regency Cakestand 3 Tier,23.32,4,14911.0,EIRE
560499,2023-07-19,22424,Enamel Bread Bin Cream,23.32,4,16713.0,United Kingdom
560504,2023-07-19,22605,Wooden Croquet Garden Set,23.32,4,13081.0,United Kingdom
560562,2023-07-19,22424,Enamel Bread Bin Cream,23.32,1,15713.0,United Kingdom
560569,2023-07-19,22236,Cake Stand 3 Tier Magic Garden,23.32,1,12480.0,Germany
560569,2023-07-19,22423,Regency Cakestand 3 Tier,23.32,1,12480.0,Germany
560571,2023-07-19,22423,Regency Cakestand 3 Tier,23.32,1,17735.0,United Kingdom
560576,2023-07-19,22423,Regency Cakestand 3 Tier,23.32,2,17287.0,United Kingdom
560579,2023-07-19,22423,Regency Cakestand 3 Tier,23.32,3,15867.0,United Kingdom
560580,2023-07-19,22606,Wooden Skittles Garden Set,23.32,6,14088.0,United Kingdom
560580,2023-07-19,22605,Wooden Croquet Garden Set,23.32,7,14088.0,United Kingdom
C560560,2023-07-19,22423,Regency Cakestand 3 Tier,23.32,-1,17738.0,United Kingdom
560537,2023-07-19,23065,Large Deco Jewellery Stand,23.06,1,17779.0,United Kingdom
560567,2023-07-19,22112,Chocolate Hot Water Bottle,23.02,1,13567.0,United Kingdom
560567,2023-07-19,79321,Chilli Lights,23.02,5,13567.0,United Kingdom
560445,2023-07-19,21888,Bingo Set,13.72,36,14156.0,EIRE
560445,2023-07-19,22548,Heads And Tails Sporting Fun,11.34,72,14156.0,EIRE
560445,2023-07-19,22492,Mini Paint Set Vintage,10.92,216,14156.0,EIRE
560445,2023-07-19,23192,Bundle Of 3 Alphabet Exercise Books,11.74,48,14156.0,EIRE
560445,2023-07-19,20983,12 Pencils Tall Tube Red Retrospot,11.12,96,14156.0,EIRE
560445,2023-07-19,22711,Wrap Circus Parade,10.6,200,14156.0,EIRE
560445,2023-07-19,22048,Birthday Banquet Gift Wrap,10.6,200,14156.0,EIRE
560445,2023-07-19,23230,Wrap Alphabet Design,10.6,200,14156.0,EIRE
560445,2023-07-19,21485,Retrospot Heart Hot Water Bottle,14.61,72,14156.0,EIRE
560445,2023-07-19,22111,Scottie Dog Hot Water Bottle,14.61,72,14156.0,EIRE
560445,2023-07-19,22112,Chocolate Hot Water Bottle,14.61,72,14156.0,EIRE
560445,2023-07-19,21984,Pack Of 12 Pink Paisley Tissues,10.55,96,14156.0,EIRE
560445,2023-07-19,21980,Pack Of 12 Red Retrospot Tissues,10.55,96,14156.0,EIRE
560445,2023-07-19,21983,Pack Of 12 Blue Paisley Tissues,10.55,96,14156.0,EIRE
560445,2023-07-19,22615,Pack Of 12 Circus Parade Tissues,10.55,96,14156.0,EIRE
560445,2023-07-19,23205,Charlotte Bag Vintage Alphabet,10.99,100,14156.0,EIRE
560445,2023-07-19,23236,Storage Tin Vintage Doily,12.8,48,14156.0,EIRE
560445,2023-07-19,22652,Travel Sewing Kit,11.94,100,14156.0,EIRE
560445,2023-07-19,22637,Piggy Bank Retrospot,12.4,72,14156.0,EIRE
560445,2023-07-19,22558,Clothes Pegs Retrospot Pack 24,11.74,144,14156.0,EIRE
560445,2023-07-19,21035,Set/2 Red Retrospot Tea Towels,13.07,200,14156.0,EIRE
560445,2023-07-19,21154,Red Retrospot Oven Glove,11.34,200,14156.0,EIRE
560445,2023-07-19,20914,Set/5 Red Retrospot Lid Glass Bowls,12.86,48,14156.0,EIRE
560445,2023-07-19,21539,Red Retrospot Butter Dish,14.61,54,14156.0,EIRE
560445,2023-07-19,21216,Set 3 Retrospot Tea/Coffee/Sugar,14.61,24,14156.0,EIRE
560445,2023-07-19,22960,Jam Making Set With Jars,14.09,48,14156.0,EIRE
560445,2023-07-19,23299,Food Cover With Beads Set 2,13.72,100,14156.0,EIRE
560445,2023-07-19,23298,Spotty Bunting,14.5,200,14156.0,EIRE
560445,2023-07-19,22989,Set 2 Pantry Design Tea Towels,13.07,100,14156.0,EIRE
560445,2023-07-19,22978,Pantry Rolling Pin,13.72,24,14156.0,EIRE
560445,2023-07-19,22993,Set Of 4 Pantry Jelly Moulds,11.34,72,14156.0,EIRE
560445,2023-07-19,23164,Regency Cake Slice,14.5,48,14156.0,EIRE
560445,2023-07-19,23163,Regency Sugar Tongs,12.38,48,14156.0,EIRE
560445,2023-07-19,23162,Regency Tea Strainer,13.62,48,14156.0,EIRE
560445,2023-07-19,23245,Set Of 3 Regency Cake Tins,14.5,48,14156.0,EIRE
560445,2023-07-19,22843,Biscuit Tin Vintage Green,16.35,24,14156.0,EIRE
560445,2023-07-19,22842,Biscuit Tin Vintage Red,16.35,24,14156.0,EIRE
560445,2023-07-19,21165,Beware Of The Cat Metal Sign,11.74,192,14156.0,EIRE
560445,2023-07-19,22671,French Laundry Sign Blue Metal,11.74,192,14156.0,EIRE
560445,2023-07-19,22672,French Bathroom Sign Blue Metal,11.74,192,14156.0,EIRE
560445,2023-07-19,22674,French Toilet Sign Blue Metal,11.34,192,14156.0,EIRE
560445,2023-07-19,22675,French Kitchen Sign Blue Metal,11.34,192,14156.0,EIRE
560445,2023-07-19,71459,Hanging Jam Jar T-Light Holders,10.99,144,14156.0,EIRE
560445,2023-07-19,22795,Sweetheart Recipe Book Stand,16.35,48,14156.0,EIRE
560445,2023-07-19,22831,White Brocante Soap Dish,12.86,144,14156.0,EIRE
560445,2023-07-19,23124,18pc Wooden Cutlery Set Disposable,11.53,80,14156.0,EIRE
560445,2023-07-19,23066,Small Deco Jewellery Stand,17.89,48,14156.0,EIRE
560445,2023-07-19,47566,Party Bunting,14.5,72,14156.0,EIRE
560445,2023-07-19,22630,Dolly Girl Lunch Box,11.94,64,14156.0,EIRE
560445,2023-07-19,23108,Set Of 10 Led Dolly Lights,15.77,48,14156.0,EIRE
560445,2023-07-19,22631,Circus Parade Lunch Box,11.94,64,14156.0,EIRE
560445,2023-07-19,84077,World War 2 Gliders Asstd Designs,10.55,48,14156.0,EIRE
560445,2023-07-19,21914,Blue Harmonica In Box,11.53,96,14156.0,EIRE
560445,2023-07-19,21915,Red Harmonica In Box,11.53,96,14156.0,EIRE
560445,2023-07-19,22384,Lunch Bag Pink Polkadot,5.87,100,14156.0,EIRE
560445,2023-07-19,20725,Lunch Bag Red Retrospot,5.87,100,14156.0,EIRE
560445,2023-07-19,22662,Lunch Bag Dolly Girl Design,5.87,100,14156.0,EIRE
560446,2023-07-19,23294,Set Of 6 Snack Loaf Baking Cases,10.99,128,14156.0,EIRE
560446,2023-07-19,23293,Set Of 12 Fairy Cake Baking Cases,10.99,128,14156.0,EIRE
560446,2023-07-19,23297,Set 40 Heart Shape Petit Four Cases,11.74,240,14156.0,EIRE
560447,2023-07-19,21314,Small Glass Heart Trinket Pot,12.15,56,13756.0,United Kingdom
560447,2023-07-19,22800,Antique Tall Swirlglass Trinket Pot,14.09,16,13756.0,United Kingdom
560447,2023-07-19,22726,Alarm Clock Bakelike Green,14.09,12,13756.0,United Kingdom
560447,2023-07-19,22729,Alarm Clock Bakelike Orange,14.09,12,13756.0,United Kingdom
560447,2023-07-19,22728,Alarm Clock Bakelike Pink,14.09,16,13756.0,United Kingdom
560447,2023-07-19,85014A,Black/Blue Polkadot Umbrella,16.35,3,13756.0,United Kingdom
560447,2023-07-19,85014B,Red Retrospot Umbrella,16.35,3,13756.0,United Kingdom
560447,2023-07-19,47566,Party Bunting,15.32,4,13756.0,United Kingdom
560447,2023-07-19,23298,Spotty Bunting,15.32,3,13756.0,United Kingdom
560447,2023-07-19,21175,Gin And Tonic Diet Metal Sign,12.86,12,13756.0,United Kingdom
560447,2023-07-19,21907,I'm On Holiday Metal Sign,12.4,12,13756.0,United Kingdom
560447,2023-07-19,84755,Colour Glass T-Light Holder Hanging,10.92,48,13756.0,United Kingdom
560447,2023-07-19,84879,Assorted Colour Bird Ornament,11.98,32,13756.0,United Kingdom
560448,2023-07-19,22465,Hanging Metal Star Lantern,11.94,24,12840.0,United Kingdom
560448,2023-07-19,22224,White Lovebird Lantern,13.27,6,12840.0,United Kingdom
560448,2023-07-19,71053,White Moroccan Metal Lantern,14.09,4,12840.0,United Kingdom
560448,2023-07-19,22464,Hanging Metal Heart Lantern,11.94,12,12840.0,United Kingdom
560448,2023-07-19,23087,Zinc Heart T-Light Holder,11.53,16,12840.0,United Kingdom
560448,2023-07-19,21390,Filigris Heart With Butterfly,11.53,24,12840.0,United Kingdom
560448,2023-07-19,22156,Heart Decoration With Pearls,11.12,12,12840.0,United Kingdom
560448,2023-07-19,22296,Heart Ivory Trellis Large,11.94,12,12840.0,United Kingdom
560448,2023-07-19,22294,Heart Filigree Dove Small,11.53,24,12840.0,United Kingdom
560448,2023-07-19,22227,Hanging Heart Mirror Decoration,10.92,24,12840.0,United Kingdom
560448,2023-07-19,22488,Natural Slate Rectangle Chalkboard,11.94,12,12840.0,United Kingdom
560448,2023-07-19,21471,Strawberry Raffia Food Cover,14.09,6,12840.0,United Kingdom
560448,2023-07-19,21470,Flower Vine Raffia Food Cover,14.09,6,12840.0,United Kingdom
560448,2023-07-19,21932,Scandinavian Paisley Picnic Bag,11.94,10,12840.0,United Kingdom
560448,2023-07-19,21936,Red Retrospot Picnic Bag,13.27,10,12840.0,United Kingdom
560448,2023-07-19,21933,Pink Vintage Paisley Picnic Bag,11.94,10,12840.0,United Kingdom
560448,2023-07-19,20728,Lunch Bag Cars Blue,5.97,20,12840.0,United Kingdom
560448,2023-07-19,20725,Lunch Bag Red Retrospot,5.97,20,12840.0,United Kingdom
560448,2023-07-19,20726,Lunch Bag Woodland,5.97,20,12840.0,United Kingdom
560448,2023-07-19,20727,Lunch Bag Black Skull,5.97,20,12840.0,United Kingdom
560448,2023-07-19,22383,Lunch Bag Suki Design,5.97,20,12840.0,United Kingdom
560448,2023-07-19,22384,Lunch Bag Pink Polkadot,5.97,20,12840.0,United Kingdom
560448,2023-07-19,23206,Lunch Bag Apple Design,5.97,20,12840.0,United Kingdom
560449,2023-07-19,23031,Drawer Knob Crackle Glaze Pink,11.94,12,14732.0,United Kingdom
560449,2023-07-19,23028,Drawer Knob Crackle Glaze Blue,11.94,12,14732.0,United Kingdom
560449,2023-07-19,22171,3 Hook Photo Shelf Antique White,18.96,2,14732.0,United Kingdom
560449,2023-07-19,23112,Parisienne Curio Cabinet,17.94,4,14732.0,United Kingdom
560449,2023-07-19,22962,Jam Jar With Pink Lid,11.12,12,14732.0,United Kingdom
560449,2023-07-19,22771,Clear Drawer Knob Acrylic Edwardian,11.53,24,14732.0,United Kingdom
560449,2023-07-19,22219,Lovebird Hanging Decoration White,11.12,12,14732.0,United Kingdom
560449,2023-07-19,22990,Cotton Apron Pantry Design,15.32,2,14732.0,United Kingdom
560449,2023-07-19,22077,6 Ribbons Rustic Charm,11.94,12,14732.0,United Kingdom
560449,2023-07-19,21429,Red Gingham Rose Jewellery Box,12.25,8,14732.0,United Kingdom
560449,2023-07-19,22356,Charlotte Bag Pink Polkadot,11.12,10,14732.0,United Kingdom
560449,2023-07-19,23205,Charlotte Bag Vintage Alphabet,11.12,10,14732.0,United Kingdom
560449,2023-07-19,23035,Drawer Knob Ceramic Ivory,11.53,96,14732.0,United Kingdom
560449,2023-07-19,21658,Glass Beurre Dish,14.3,4,14732.0,United Kingdom
560450,2023-07-19,84946,Antique Silver T-Light Glass,11.53,24,14117.0,United Kingdom
560450,2023-07-19,22791,T-Light Glass Fluted Antique,11.53,24,14117.0,United Kingdom
560450,2023-07-19,84947,Antique Silver Tea Glass Engraved,11.53,24,14117.0,United Kingdom
560451,2023-07-19,21373,Mirrored Wall Art Snowflakes,11.02,12,14911.0,EIRE
560451,2023-07-19,22269,Egg Cup Natural Chicken,10.65,16,14911.0,EIRE
560451,2023-07-19,84402B,Purple Dress Jewellery Stand,11.06,12,14911.0,EIRE
560451,2023-07-19,84818,Danish Rose Photo Frame,11.06,24,14911.0,EIRE
560451,2023-07-19,84926A,Wake Up Cockerel Tile Coaster,10.55,24,14911.0,EIRE
560451,2023-07-19,84944,Set Of 6 Kashmir Folkart Baubles,11.94,24,14911.0,EIRE
560451,2023-07-19,22715,Card Wedding Day,10.68,12,14911.0,EIRE
560451,2023-07-19,22032,Botanical Lily Greeting Card,10.68,12,14911.0,EIRE
560451,2023-07-19,22178,Victorian Glass Hanging T-Light,11.53,24,14911.0,EIRE
560451,2023-07-19,82486,3 Drawer Antique White Wood Cabinet,19.42,2,14911.0,EIRE
560451,2023-07-19,21422,Porcelain Rose Small,11.12,16,14911.0,EIRE
560451,2023-07-19,72225C,Lavender Scent Cake Candle,10.55,24,14911.0,EIRE
560451,2023-07-19,18094C,White And Blue Ceramic Oil Burner,11.53,12,14911.0,EIRE
560451,2023-07-19,22557,Plasters In Tin Vintage Paisley,11.94,12,14911.0,EIRE
560451,2023-07-19,22182,Cake Stand Victorian Filigree Small,15.32,4,14911.0,EIRE
560451,2023-07-19,23015,Cordial Glass Jug,18.71,2,14911.0,EIRE
560451,2023-07-19,22822,Cream Wall Planter Heart Shaped,16.35,4,14911.0,EIRE
560451,2023-07-19,22784,Lantern Cream Gazebo,15.32,3,14911.0,EIRE
560451,2023-07-19,23099,French Carriage Lantern,17.07,2,14911.0,EIRE
560451,2023-07-19,22460,Embossed Glass Tealight Holder,11.53,12,14911.0,EIRE
560451,2023-07-19,23154,Set Of 4 Jam Jar Magnets,12.38,12,14911.0,EIRE
560451,2023-07-19,23155,Knickerbockerglory Magnet Assorted,11.1,12,14911.0,EIRE
560451,2023-07-19,23052,Recycled Acapulco Mat Turquoise,18.71,2,14911.0,EIRE
560451,2023-07-19,23054,Recycled Acapulco Mat Lavender,18.71,2,14911.0,EIRE
560451,2023-07-19,23049,Recycled Acapulco Mat Red,18.71,2,14911.0,EIRE
560451,2023-07-19,23032,Drawer Knob Crackle Glaze Ivory,11.94,18,14911.0,EIRE
560451,2023-07-19,22626,Black Kitchen Scales,18.96,2,14911.0,EIRE
560451,2023-07-19,22625,Red Kitchen Scales,18.96,2,14911.0,EIRE
560451,2023-07-19,22429,Enamel Measuring Jug Cream,14.61,4,14911.0,EIRE
560451,2023-07-19,22425,Enamel Colander Cream,15.32,3,14911.0,EIRE
560451,2023-07-19,22844,Vintage Cream Dog Food Container,18.96,2,14911.0,EIRE
560451,2023-07-19,22955,36 Foil Star Cake Cases,12.4,12,14911.0,EIRE
560451,2023-07-19,22956,36 Foil Heart Cake Cases,12.4,12,14911.0,EIRE
560451,2023-07-19,23297,Set 40 Heart Shape Petit Four Cases,11.94,16,14911.0,EIRE
560451,2023-07-19,23295,Set Of 12 Mini Loaf Baking Cases,11.1,16,14911.0,EIRE
560451,2023-07-19,23293,Set Of 12 Fairy Cake Baking Cases,11.1,16,14911.0,EIRE
560451,2023-07-19,23294,Set Of 6 Snack Loaf Baking Cases,11.1,16,14911.0,EIRE
560451,2023-07-19,23296,Set Of 6 Tea Time Baking Cases,11.53,16,14911.0,EIRE
560451,2023-07-19,21873,If You Can't Stand The Heat Mug,11.53,12,14911.0,EIRE
560451,2023-07-19,21868,Potting Shed Tea Mug,11.53,12,14911.0,EIRE
560451,2023-07-19,21872,Glamorous Mug,11.53,12,14911.0,EIRE
560451,2023-07-19,23174,Regency Sugar Bowl Green,14.5,16,14911.0,EIRE
560451,2023-07-19,23175,Regency Milk Jug Pink,13.58,4,14911.0,EIRE
560451,2023-07-19,22697,Green Regency Teacup And Saucer,13.27,12,14911.0,EIRE
560451,2023-07-19,22698,Pink Regency Teacup And Saucer,13.27,12,14911.0,EIRE
560451,2023-07-19,22699,Roses Regency Teacup And Saucer,13.27,12,14911.0,EIRE
560451,2023-07-19,23171,Regency Tea Plate Green,11.94,12,14911.0,EIRE
560451,2023-07-19,23172,Regency Tea Plate Pink,11.94,12,14911.0,EIRE
560451,2023-07-19,23170,Regency Tea Plate Roses,11.94,12,14911.0,EIRE
560451,2023-07-19,22969,Homemade Jam Scented Candles,11.74,24,14911.0,EIRE
560451,2023-07-19,22982,Pantry Pastry Brush,11.53,12,14911.0,EIRE
560451,2023-07-19,22981,Pantry Apple Corer,11.74,12,14911.0,EIRE
560451,2023-07-19,22978,Pantry Rolling Pin,14.09,6,14911.0,EIRE
560451,2023-07-19,21231,Sweetheart Ceramic Trinket Box,11.53,12,14911.0,EIRE
560451,2023-07-19,21232,Strawberry Ceramic Trinket Pot,11.53,12,14911.0,EIRE
560451,2023-07-19,22906,12 Message Cards With Envelopes,11.94,12,14911.0,EIRE
560451,2023-07-19,23077,Doughnut Lip Gloss,11.53,40,14911.0,EIRE
560451,2023-07-19,23280,Folding Butterfly Mirror Hot Pink,11.1,12,14911.0,EIRE
560451,2023-07-19,22821,Gift Bag Psychedelic Apples,5.46,48,14911.0,EIRE
560452,2023-07-19,47566,Party Bunting,15.32,8,12682.0,France
560452,2023-07-19,21746,Small Red Retrospot Windmill,11.53,12,12682.0,France
560452,2023-07-19,22432,Watering Can Pink Bunny,12.25,6,12682.0,France
560452,2023-07-19,22303,Coffee Mug Apples Design,12.86,6,12682.0,France
560453,2023-07-19,23103,Jingle Bell Heart Decoration,11.94,24,13209.0,United Kingdom
560453,2023-07-19,23168,Classic Cafe Sugar Dispenser,11.53,12,13209.0,United Kingdom
560453,2023-07-19,23190,Bundle Of 3 School Exercise Books,11.94,12,13209.0,United Kingdom
560453,2023-07-19,15036,Assorted Colours Silk Fan,11.1,12,13209.0,United Kingdom
560453,2023-07-19,21415,Clam Shell Small,12.4,12,13209.0,United Kingdom
560453,2023-07-19,22745,Poppy's Playhouse Bedroom,12.4,6,13209.0,United Kingdom
560453,2023-07-19,22748,Poppy's Playhouse Kitchen,12.4,6,13209.0,United Kingdom
560453,2023-07-19,22432,Watering Can Pink Bunny,12.25,12,13209.0,United Kingdom
560453,2023-07-19,22448,Pin Cushion Babushka Red,13.68,18,13209.0,United Kingdom
560453,2023-07-19,22076,6 Ribbons Empire,11.94,12,13209.0,United Kingdom
560453,2023-07-19,22077,6 Ribbons Rustic Charm,11.94,12,13209.0,United Kingdom
560453,2023-07-19,20971,Pink Blue Felt Craft Trinket Box,11.53,12,13209.0,United Kingdom
560453,2023-07-19,22749,Feltcraft Princess Charlotte Doll,14.09,12,13209.0,United Kingdom
560453,2023-07-19,22750,Feltcraft Princess Lola Doll,14.09,12,13209.0,United Kingdom
560453,2023-07-19,22751,Feltcraft Princess Olivia Doll,14.09,12,13209.0,United Kingdom
560453,2023-07-19,22728,Alarm Clock Bakelike Pink,14.09,8,13209.0,United Kingdom
560453,2023-07-19,22729,Alarm Clock Bakelike Orange,14.09,8,13209.0,United Kingdom
560453,2023-07-19,22727,Alarm Clock Bakelike Red,14.09,16,13209.0,United Kingdom
560453,2023-07-19,22192,Blue Diner Wall Clock,18.96,2,13209.0,United Kingdom
560453,2023-07-19,21394,Red Polkadot Beaker,10.65,48,13209.0,United Kingdom
560453,2023-07-19,21395,Blue Polkadot Beaker,10.65,48,13209.0,United Kingdom
560453,2023-07-19,21561,Dinosaur Lunch Box With Cutlery,12.86,6,13209.0,United Kingdom
560453,2023-07-19,22326,Round Snack Boxes Set Of4 Woodland,13.27,18,13209.0,United Kingdom
560453,2023-07-19,21559,Strawberry Lunch Box With Cutlery,12.86,6,13209.0,United Kingdom
560453,2023-07-19,22328,Round Snack Boxes Set Of 4 Fruits,13.27,12,13209.0,United Kingdom
560453,2023-07-19,79066K,Retro Mod Tray,11.12,10,13209.0,United Kingdom
560453,2023-07-19,62018,Sombrero,12.25,6,13209.0,United Kingdom
560453,2023-07-19,21731,Red Toadstool Led Night Light,11.94,48,13209.0,United Kingdom
560453,2023-07-19,22466,Fairy Tale Cottage Night Light,11.94,48,13209.0,United Kingdom
560453,2023-07-19,84212,"Assorted Flower Colour ""Leis""",10.92,24,13209.0,United Kingdom
560453,2023-07-19,21829,Dinosaur Keyrings Assorted,10.47,36,13209.0,United Kingdom
560453,2023-07-19,22025,Ring Of Roses Birthday Card,10.68,24,13209.0,United Kingdom
560453,2023-07-19,22024,Rainy Ladies Birthday Card,10.68,24,13209.0,United Kingdom
560453,2023-07-19,22028,Penny Farthing Birthday Card,10.68,36,13209.0,United Kingdom
560453,2023-07-19,22037,Robot Birthday Card,10.68,12,13209.0,United Kingdom
560453,2023-07-19,22716,Card Circus Parade,10.68,12,13209.0,United Kingdom
560453,2023-07-19,22714,Card Birthday Cowboy,10.68,12,13209.0,United Kingdom
560453,2023-07-19,22035,Vintage Caravan Greeting Card,10.68,12,13209.0,United Kingdom
560453,2023-07-19,16219,House Shape Pencil Sharpener,10.47,12,13209.0,United Kingdom
560453,2023-07-19,21058,Party Invites Woodland,11.12,12,13209.0,United Kingdom
560453,2023-07-19,21059,Party Invites Dinosaurs,11.12,12,13209.0,United Kingdom
560453,2023-07-19,21060,Party Invites Balloon Girl,11.12,12,13209.0,United Kingdom
560453,2023-07-19,21062,Party Invites Spaceman,11.12,12,13209.0,United Kingdom
560453,2023-07-19,21530,Dairy Maid Toastrack,11.06,18,13209.0,United Kingdom
560453,2023-07-19,21090,Set/6 Collage Paper Plates,10.65,12,13209.0,United Kingdom
560453,2023-07-19,21084,Set/6 Collage Paper Cups,10.44,24,13209.0,United Kingdom
560453,2023-07-19,22197,Popcorn Holder,11.12,36,13209.0,United Kingdom
560453,2023-07-19,20728,Lunch Bag Cars Blue,5.97,10,13209.0,United Kingdom
560453,2023-07-19,20727,Lunch Bag Black Skull,5.97,10,13209.0,United Kingdom
560453,2023-07-19,22384,Lunch Bag Pink Polkadot,5.97,10,13209.0,United Kingdom
560453,2023-07-19,23209,Lunch Bag Vintage Doily,5.97,10,13209.0,United Kingdom
560453,2023-07-19,23206,Lunch Bag Apple Design,5.97,10,13209.0,United Kingdom
560454,2023-07-19,22822,Cream Wall Planter Heart Shaped,16.35,2,12947.0,United Kingdom
560454,2023-07-19,20750,Red Retrospot Mini Cases,18.4,2,12947.0,United Kingdom
560454,2023-07-19,22138,Baking Set 9 Piece Retrospot,15.32,3,12947.0,United Kingdom
560454,2023-07-19,22150,3 Stripey Mice Feltcraft,12.25,12,12947.0,United Kingdom
560454,2023-07-19,22570,Feltcraft Cushion Rabbit,14.09,4,12947.0,United Kingdom
560454,2023-07-19,22569,Feltcraft Cushion Butterfly,14.09,4,12947.0,United Kingdom
560454,2023-07-19,22568,Feltcraft Cushion Owl,14.09,4,12947.0,United Kingdom
560454,2023-07-19,22149,Feltcraft 6 Flower Friends,12.4,6,12947.0,United Kingdom
560454,2023-07-19,22083,Paper Chain Kit Retrospot,13.27,6,12947.0,United Kingdom
560454,2023-07-19,23209,Lunch Bag Vintage Doily,5.97,10,12947.0,United Kingdom
560454,2023-07-19,20728,Lunch Bag Cars Blue,5.97,10,12947.0,United Kingdom
560454,2023-07-19,23206,Lunch Bag Apple Design,5.97,10,12947.0,United Kingdom
560454,2023-07-19,22383,Lunch Bag Suki Design,5.97,10,12947.0,United Kingdom
560469,2023-07-19,85103,Silver T-Light Setting,16.35,37,12971.0,United Kingdom
560473,2023-07-19,22699,Roses Regency Teacup And Saucer,13.27,6,12431.0,Australia
560473,2023-07-19,23170,Regency Tea Plate Roses,11.94,12,12431.0,Australia
560473,2023-07-19,21481,Fawn Blue Hot Water Bottle,13.27,6,12431.0,Australia
560473,2023-07-19,21524,Doormat Spotty Home Sweet Home,18.4,2,12431.0,Australia
560473,2023-07-19,22727,Alarm Clock Bakelike Red,14.09,4,12431.0,Australia
560473,2023-07-19,84978,Hanging Heart Jar T-Light Holder,11.53,24,12431.0,Australia
560473,2023-07-19,22726,Alarm Clock Bakelike Green,14.09,4,12431.0,Australia
560473,2023-07-19,22138,Baking Set 9 Piece Retrospot,15.32,3,12431.0,Australia
560473,2023-07-19,22617,Baking Set Spaceboy Design,15.32,3,12431.0,Australia
560473,2023-07-19,21507,Elephant Birthday Card,10.68,12,12431.0,Australia
560473,2023-07-19,22027,Tea Party Birthday Card,10.68,12,12431.0,Australia
560473,2023-07-19,22712,Card Dolly Girl,10.68,12,12431.0,Australia
560473,2023-07-19,23083,Set 6 Paper Table Lantern Stars,14.09,6,12431.0,Australia
560473,2023-07-19,23298,Spotty Bunting,15.32,6,12431.0,Australia
560473,2023-07-19,23175,Regency Milk Jug Pink,13.58,4,12431.0,Australia
560473,2023-07-19,23174,Regency Sugar Bowl Green,14.5,4,12431.0,Australia
560473,2023-07-19,21745,Gaolers Keys Decorative Garden,14.09,4,12431.0,Australia
560473,2023-07-19,20685,Doormat Red Retrospot,18.4,6,12431.0,Australia
560473,2023-07-19,21706,Folding Umbrella Red/White Polkadot,15.32,8,12431.0,Australia
560473,2023-07-19,21707,Folding Umbrella Blackblue Polkadot,15.32,8,12431.0,Australia
560473,2023-07-19,48129,Doormat Topiary,18.4,4,12431.0,Australia
560473,2023-07-19,22835,Hot Water Bottle I Am So Poorly,15.02,4,12431.0,Australia
560473,2023-07-19,20725,Lunch Bag Red Retrospot,5.97,20,12431.0,Australia
560483,2023-07-19,21791,Vintage Heads And Tails Card Game,11.53,12,12955.0,United Kingdom
560483,2023-07-19,21892,Traditional Wooden Catch Cup Game,11.53,12,12955.0,United Kingdom
560483,2023-07-19,15039,Sandalwood Fan,11.12,60,12955.0,United Kingdom
560483,2023-07-19,22295,Heart Filigree Dove Large,11.94,12,12955.0,United Kingdom
560483,2023-07-19,20972,Pink Cream Felt Craft Trinket Box,11.53,12,12955.0,United Kingdom
560483,2023-07-19,22536,Magic Drawing Slate Purdey,10.68,24,12955.0,United Kingdom
560483,2023-07-19,21704,Bag 250g Swirly Marbles,11.12,24,12955.0,United Kingdom
560483,2023-07-19,21790,Vintage Snap Cards,11.12,24,12955.0,United Kingdom
560483,2023-07-19,23310,Bubblegum Ring Assorted,10.68,72,12955.0,United Kingdom
560483,2023-07-19,21915,Red Harmonica In Box,11.53,24,12955.0,United Kingdom
560483,2023-07-19,22620,4 Traditional Spinning Tops,11.74,12,12955.0,United Kingdom
560483,2023-07-19,20983,12 Pencils Tall Tube Red Retrospot,11.12,12,12955.0,United Kingdom
560483,2023-07-19,21136,Painted Metal Pears Assorted,11.98,16,12955.0,United Kingdom
560483,2023-07-19,84879,Assorted Colour Bird Ornament,11.98,32,12955.0,United Kingdom
560491,2023-07-19,23293,Set Of 12 Fairy Cake Baking Cases,11.1,2,12415.0,Australia
560491,2023-07-19,23232,Wrap Vintage Leaf Design,10.68,1,12415.0,Australia
560491,2023-07-19,21503,Toybox Wrap,10.68,1,12415.0,Australia
560491,2023-07-19,22546,Mini Jigsaw Purdey,10.68,1,12415.0,Australia
560491,2023-07-19,22545,Mini Jigsaw Bunnies,10.68,1,12415.0,Australia
560491,2023-07-19,21918,Set 12 Kids Colour Chalk Sticks,10.68,1,12415.0,Australia
560491,2023-07-19,21917,Set 12 Kids White Chalk Sticks,10.68,1,12415.0,Australia
560491,2023-07-19,20979,36 Pencils Tube Red Retrospot,11.53,1,12415.0,Australia
560491,2023-07-19,23245,Set Of 3 Regency Cake Tins,15.32,1,12415.0,Australia
560491,2023-07-19,23307,Set Of 60 Pantry Design Cake Cases,10.81,1,12415.0,Australia
560491,2023-07-19,23243,Set Of Tea Coffee Sugar Tins Pantry,15.32,1,12415.0,Australia
560491,2023-07-19,21210,Set Of 72 Retrospot Paper Doilies,11.74,1,12415.0,Australia
560491,2023-07-19,23240,Set Of 4 Knick Knack Tins Doily,14.5,1,12415.0,Australia
560491,2023-07-19,23229,Vintage Donkey Tail Game,14.09,1,12415.0,Australia
560491,2023-07-19,23254,Childrens Cutlery Dolly Girl,14.5,1,12415.0,Australia
560491,2023-07-19,21974,Set Of 36 Paisley Flower Doilies,11.74,1,12415.0,Australia
560491,2023-07-19,23242,Treasure Tin Buffalo Bill,12.38,1,12415.0,Australia
560491,2023-07-19,23241,Treasure Tin Gymkhana Design,12.38,1,12415.0,Australia
560491,2023-07-19,23236,Storage Tin Vintage Doily,13.21,1,12415.0,Australia
560491,2023-07-19,23306,Set Of 36 Pantry Paper Doilies,11.74,1,12415.0,Australia
560491,2023-07-19,23192,Bundle Of 3 Alphabet Exercise Books,11.94,1,12415.0,Australia
560491,2023-07-19,23190,Bundle Of 3 School Exercise Books,11.94,1,12415.0,Australia
