TransactionNo,Date,ProductNo,ProductName,Price,Quantity,CustomerNo,Country
540946,2023-01-12,22656,Vintage Blue Kitchen Cabinet,660.62,1,12359.0,Cyprus
540946,2023-01-12,22655,Vintage Red Kitchen Cabinet,660.62,1,12359.0,Cyprus
540970,2023-01-12,22827,Rustic Seventeen Drawer Sideboard,179.37,1,14185.0,United Kingdom
540907,2023-01-12,22833,Hall Cabinet With 3 Drawers,61.45,1,13488.0,United Kingdom
540908,2023-01-12,84078A,Set/4 White Retro Storage Cubes,46.07,16,12980.0,United Kingdom
C540852,2023-01-12,84078A,Set/4 White Retro Storage Cubes,46.07,-12,15197.0,United Kingdom
540848,2023-01-12,22848,Bread Bin Diner Style Pink,45.1,1,17848.0,United Kingdom
540848,2023-01-12,22485,Set Of 2 Wooden Market Crates,36.38,1,17848.0,United Kingdom
540848,2023-01-12,22424,Enamel Bread Bin Cream,36.38,1,17848.0,United Kingdom
540848,2023-01-12,85066,Cream Sweetheart Mini Chest,36.38,1,17848.0,United Kingdom
540977,2023-01-12,22423,Regency Cakestand 3 Tier,36.38,1,14977.0,United Kingdom
540940,2023-01-12,22761,Chest 7 Drawer Ma Campagne,35.82,1,18109.0,United Kingdom
540977,2023-01-12,47570B,Tea Time Table Cloth,32.01,1,14977.0,United Kingdom
540977,2023-01-12,21843,Red Retrospot Cake Stand,32.01,1,14977.0,United Kingdom
540848,2023-01-12,90201B,Black Enamel Flower Ring,13.28,1,17848.0,United Kingdom
540848,2023-01-12,90201C,Red Enamel Flower Ring,13.28,1,17848.0,United Kingdom
540848,2023-01-12,90201D,Green Enamel Flower Ring,13.28,2,17848.0,United Kingdom
540848,2023-01-12,90204,Pair Of Enamel Butterfly Hairclip,13.72,1,17848.0,United Kingdom
540848,2023-01-12,90209B,Green Enamel+Glass Hair Comb,12.41,2,17848.0,United Kingdom
540848,2023-01-12,90209C,Pink Enamel+Glass Hair Comb,12.41,2,17848.0,United Kingdom
540848,2023-01-12,90214A,"Letter ""A"" Bling Key Ring",11.12,2,17848.0,United Kingdom
540848,2023-01-12,90214K,"Letter ""K"" Bling Key Ring",11.12,1,17848.0,United Kingdom
540848,2023-01-12,21043,Apron Modern Vintage Cotton,14.57,1,17848.0,United Kingdom
540848,2023-01-12,21520,Booze & Women Greeting Card,10.69,2,17848.0,United Kingdom
540848,2023-01-12,21707,Folding Umbrella Blackblue Polkadot,13.69,1,17848.0,United Kingdom
540848,2023-01-12,21884,Cakes And Bows Gift Tape,10.69,7,17848.0,United Kingdom
540848,2023-01-12,22144,Christmas Craft Little Friends,14.57,1,17848.0,United Kingdom
540848,2023-01-12,22219,Lovebird Hanging Decoration White,11.95,3,17848.0,United Kingdom
540848,2023-01-12,22641,Set Of 4 Napkin Charms Instrument,11.95,1,17848.0,United Kingdom
540848,2023-01-12,22804,Pink Hanging Heart T-Light Holder,16.31,1,17848.0,United Kingdom
540848,2023-01-12,21916,Set 12 Retro White Chalk Sticks,11.12,1,17848.0,United Kingdom
540848,2023-01-12,21918,Set 12 Kids Colour Chalk Sticks,11.12,1,17848.0,United Kingdom
540848,2023-01-12,21931,Jumbo Storage Bag Suki,14.57,1,17848.0,United Kingdom
540848,2023-01-12,21934,Skull Shoulder Bag,11.95,3,17848.0,United Kingdom
540848,2023-01-12,21935,Suki Shoulder Bag,11.95,2,17848.0,United Kingdom
540848,2023-01-12,21943,Cakes And Rabbits Design Flannel,11.95,1,17848.0,United Kingdom
540848,2023-01-12,21947,Set Of 6 Heart Chopsticks,11.56,3,17848.0,United Kingdom
540848,2023-01-12,21948,Set Of 6 Cake Chopsticks,11.56,1,17848.0,United Kingdom
540848,2023-01-12,21949,Set Of 6 Strawberry Chopsticks,11.56,2,17848.0,United Kingdom
540848,2023-01-12,21975,Pack Of 60 Dinosaur Cake Cases,11.56,1,17848.0,United Kingdom
540848,2023-01-12,21977,Pack Of 60 Pink Paisley Cake Cases,11.56,2,17848.0,United Kingdom
540848,2023-01-12,21985,Pack Of 12 Hearts Design Tissues,11.12,1,17848.0,United Kingdom
540848,2023-01-12,21992,Vintage Paisley Stationery Set,12.82,4,17848.0,United Kingdom
540848,2023-01-12,21993,Floral Folk Stationery Set,12.82,2,17848.0,United Kingdom
540848,2023-01-12,35651,Vintage Bead Pink Scarf,13.69,8,17848.0,United Kingdom
540848,2023-01-12,35957,Smallfolkart Bauble Christmas Dec,11.95,1,17848.0,United Kingdom
540848,2023-01-12,35965,Folkart Heart Napkin Rings,13.69,2,17848.0,United Kingdom
540848,2023-01-12,37482P,Cubic Mug Pink Polkadot,16.31,2,17848.0,United Kingdom
540848,2023-01-12,47593B,Scottie Dogs Baby Bib,11.12,1,17848.0,United Kingdom
540848,2023-01-12,47594B,Scotties Design Washbag,11.95,2,17848.0,United Kingdom
540848,2023-01-12,72799F,Ivory Pillar Candle Gold Flock,13.69,1,17848.0,United Kingdom
540848,2023-01-12,79190B,Retro Plastic Polka Tray,11.12,1,17848.0,United Kingdom
540848,2023-01-12,79190D,Retro Plastic Daisy Tray,11.12,1,17848.0,United Kingdom
540848,2023-01-12,82567,Airline Lounge Metal Sign,14.57,1,17848.0,United Kingdom
540848,2023-01-12,82578,Kitchen Metal Sign,11.56,3,17848.0,United Kingdom
540848,2023-01-12,21171,Bathroom Metal Sign,11.56,3,17848.0,United Kingdom
540848,2023-01-12,82613A,Metal Sign Cupcake Single Hook,11.12,5,17848.0,United Kingdom
540848,2023-01-12,82613A,Metal Sign Cupcake Single Hook,11.12,8,17848.0,United Kingdom
540848,2023-01-12,82613A,Metal Sign Cupcake Single Hook,11.12,9,17848.0,United Kingdom
540848,2023-01-12,84012,Magic Sheep Wool Growing From Paper,11.95,4,17848.0,United Kingdom
540848,2023-01-12,47504H,English Rose Spirit Level,13.69,2,17848.0,United Kingdom
540848,2023-01-12,47585A,Pink Fairy Cake Cushion Cover,14.57,2,17848.0,United Kingdom
540848,2023-01-12,47591B,Scotties Childrens Apron,11.95,1,17848.0,United Kingdom
540848,2023-01-12,37327,Asstd Multicolour Circles Mug,16.31,2,17848.0,United Kingdom
540848,2023-01-12,37342,Polkadot Coffee Cup & Saucer Pink,12.82,1,17848.0,United Kingdom
540848,2023-01-12,21208,Pastel Colour Honeycomb Fan,11.95,1,17848.0,United Kingdom
540848,2023-01-12,21209,Multicolour Honeycomb Fan,11.95,2,17848.0,United Kingdom
540848,2023-01-12,21213,Pack Of 72 Skull Cake Cases,11.56,1,17848.0,United Kingdom
540848,2023-01-12,21231,Sweetheart Ceramic Trinket Box,12.82,3,17848.0,United Kingdom
540848,2023-01-12,21232,Strawberry Ceramic Trinket Pot,12.82,3,17848.0,United Kingdom
540848,2023-01-12,21264,White Goose Feather Tree 60cm,16.31,1,17848.0,United Kingdom
540848,2023-01-12,20866,Blue Rose Fabric Mirror,11.12,10,17848.0,United Kingdom
540848,2023-01-12,21270,Antique Cream Cutlery Cupboard,18.93,3,17848.0,United Kingdom
540848,2023-01-12,10125,Mini Funky Design Tapes,11.08,5,17848.0,United Kingdom
540848,2023-01-12,10133,Colouring Pencils Brown Tube,11.08,7,17848.0,United Kingdom
540848,2023-01-12,10133,Colouring Pencils Brown Tube,11.56,5,17848.0,United Kingdom
540848,2023-01-12,15036,Assorted Colours Silk Fan,11.56,2,17848.0,United Kingdom
540848,2023-01-12,16237,Sleeping Cat Erasers,10.69,1,17848.0,United Kingdom
540848,2023-01-12,17012A,Origami Vanilla Incense/Candle Set,12.82,2,17848.0,United Kingdom
540848,2023-01-12,17012B,Origami Jasmine Incense/Candle Set,12.82,1,17848.0,United Kingdom
540848,2023-01-12,17012C,Origami Lavender Incense/Candl Set,12.82,1,17848.0,United Kingdom
540848,2023-01-12,17012D,Origami Rose Incense/Candle Set,12.82,2,17848.0,United Kingdom
540848,2023-01-12,18007,Essential Balm 35g Tin In Envelope,10.69,2,17848.0,United Kingdom
540848,2023-01-12,20615,Blue Polkadot Passport Cover,11.95,1,17848.0,United Kingdom
540848,2023-01-12,20616,Cherry Blossom Passport Cover,11.95,1,17848.0,United Kingdom
540848,2023-01-12,20618,Queen Of The Skies Passport Cover,11.95,2,17848.0,United Kingdom
540848,2023-01-12,20622,Vip Passport Cover,11.95,1,17848.0,United Kingdom
540848,2023-01-12,20652,Blue Polkadot Luggage Tag,11.12,11,17848.0,United Kingdom
540848,2023-01-12,20653,Cherry Blossom Luggage Tag,11.12,1,17848.0,United Kingdom
540848,2023-01-12,20654,First Class Luggage Tag,11.12,1,17848.0,United Kingdom
540848,2023-01-12,20655,Queen Of Skies Luggage Tag,11.12,4,17848.0,United Kingdom
540848,2023-01-12,20663,Queen Of The Skies Holiday Purse,12.82,1,17848.0,United Kingdom
540848,2023-01-12,20665,Red Retrospot Purse,16.31,2,17848.0,United Kingdom
540848,2023-01-12,20696,Floral Soft Car Toy,13.69,1,17848.0,United Kingdom
540848,2023-01-12,20699,Mousey Long Legs Soft Toy,12.82,2,17848.0,United Kingdom
540848,2023-01-12,20717,Strawberry Shopper Bag,11.12,11,17848.0,United Kingdom
540848,2023-01-12,20724,Red Retrospot Charlotte Bag,11.95,3,17848.0,United Kingdom
540848,2023-01-12,20733,Gold Mini Tape Measure,11.12,1,17848.0,United Kingdom
540848,2023-01-12,20735,Black Mini Tape Measure,11.12,1,17848.0,United Kingdom
540848,2023-01-12,20770,Abstract Circle Journal,12.82,1,17848.0,United Kingdom
540848,2023-01-12,20801,Large Pink Glass Sundae Dish,12.82,5,17848.0,United Kingdom
540848,2023-01-12,20832,Red Flock Love Heart Photo Frame,11.08,1,17848.0,United Kingdom
540848,2023-01-12,20854,Blue Patch Purse Pink Heart,11.95,1,17848.0,United Kingdom
540848,2023-01-12,20856,Denim Patch Purse Pink Butterfly,11.95,3,17848.0,United Kingdom
540848,2023-01-12,35964,Folkart Clip On Stars,11.95,2,17848.0,United Kingdom
540848,2023-01-12,35833P,4 Pink Flock Christmas Balls,13.69,1,17848.0,United Kingdom
540848,2023-01-12,22961,Jam Making Set Printed,13.69,1,17848.0,United Kingdom
540848,2023-01-12,22983,Card Billboard Font,11.12,1,17848.0,United Kingdom
540848,2023-01-12,35095A,Blue Victorian Fabric Oval Box,11.11,1,17848.0,United Kingdom
540848,2023-01-12,35471D,Set Of 3 Bird Light Pink Feather,12.82,1,17848.0,United Kingdom
540848,2023-01-12,35646,Vintage Bead Pink Evening Bag,12.82,5,17848.0,United Kingdom
540848,2023-01-12,35648,Vintage Bead Pink Purse,11.95,5,17848.0,United Kingdom
540848,2023-01-12,22814,Card Party Games,11.12,1,17848.0,United Kingdom
540848,2023-01-12,22817,Card Suki Birthday,10.69,13,17848.0,United Kingdom
540848,2023-01-12,22819,Birthday Card Retro Spot,10.69,14,17848.0,United Kingdom
540848,2023-01-12,22834,Hand Warmer Babushka Design,11.95,4,17848.0,United Kingdom
540848,2023-01-12,22835,Hot Water Bottle I Am So Poorly,19.8,1,17848.0,United Kingdom
540848,2023-01-12,22855,Fine Wicker Heart,12.82,1,17848.0,United Kingdom
540848,2023-01-12,22862,Love Heart Napkin Box,18.93,1,17848.0,United Kingdom
540848,2023-01-12,22893,Mini Cake Stand T-Light Holder,11.12,2,17848.0,United Kingdom
540848,2023-01-12,22910,Paper Chain Kit Vintage Christmas,16.31,1,17848.0,United Kingdom
540848,2023-01-12,22940,Feltcraft Christmas Fairy,18.93,1,17848.0,United Kingdom
540848,2023-01-12,90087,Crystal Sea Horse Phone Charm,11.95,1,17848.0,United Kingdom
540848,2023-01-12,90092,Blue Crystal Boot Phone Charm,11.95,1,17848.0,United Kingdom
540848,2023-01-12,90101,White Frangipani Necklace,12.85,2,17848.0,United Kingdom
540848,2023-01-12,90103,Purple Frangipani Necklace,12.85,1,17848.0,United Kingdom
540848,2023-01-12,90104,Purple Frangipani Hairclip,11.1,4,17848.0,United Kingdom
540848,2023-01-12,90114,Summer Daisies Bag Charm,12.82,1,17848.0,United Kingdom
540848,2023-01-12,90119,Metalic Leaves Bag Charms,12.82,1,17848.0,United Kingdom
540848,2023-01-12,90125B,Aqua Bertie Glass Bead Bag Charm,11.95,3,17848.0,United Kingdom
540848,2023-01-12,90138,White/Pink Mini Crystals Necklace,15.9,1,17848.0,United Kingdom
540848,2023-01-12,90160B,Red Boudicca Large Bracelet,17.65,1,17848.0,United Kingdom
540848,2023-01-12,90161A,Ant Copper Red Boudicca Bracelet,15.47,1,17848.0,United Kingdom
540848,2023-01-12,90161B,Ant Copper Turq Boudicca Bracelet,15.47,2,17848.0,United Kingdom
540848,2023-01-12,90161C,Ant Copper Lime Boudicca Bracelet,15.47,1,17848.0,United Kingdom
540848,2023-01-12,90161D,Ant Copper Pink Boudicca Bracelet,15.47,1,17848.0,United Kingdom
540848,2023-01-12,90169,Daisy Hair Comb,12.85,2,17848.0,United Kingdom
540848,2023-01-12,90173,Pair Butterfly Hair Clips,14.16,1,17848.0,United Kingdom
540848,2023-01-12,90190A,Silver/Crystal Drop Earrings W Leaf,13.28,1,17848.0,United Kingdom
540848,2023-01-12,90190B,Gold/Amber Drop Earrings W Leaf,13.28,2,17848.0,United Kingdom
540848,2023-01-12,90197B,Black Glass Bracelet W Heart Charms,15.47,1,17848.0,United Kingdom
540848,2023-01-12,90198A,Vintage Rose Bead Bracelet Raspberr,14.6,1,17848.0,United Kingdom
540848,2023-01-12,90200D,Pink Sweetheart Bracelet,14.6,1,17848.0,United Kingdom
540848,2023-01-12,85071D,Charlie+Lola My Room Door Sign,11.12,2,17848.0,United Kingdom
540848,2023-01-12,85087,Candy Spot Cushion Cover,13.69,6,17848.0,United Kingdom
540848,2023-01-12,85088,Candy Spot Hand Bag,11.95,3,17848.0,United Kingdom
540848,2023-01-12,85095,Three Canvas Luggage Tags,11.56,6,17848.0,United Kingdom
540848,2023-01-12,85103,Silver T-Light Setting,16.31,2,17848.0,United Kingdom
540848,2023-01-12,22029,Spaceboy Birthday Card,11.12,1,17848.0,United Kingdom
540848,2023-01-12,22031,Botanical Lavender Birthday Card,10.69,2,17848.0,United Kingdom
540848,2023-01-12,22035,Vintage Caravan Greeting Card,11.12,1,17848.0,United Kingdom
540848,2023-01-12,22070,Small Red Retrospot Mug In Box,13.69,3,17848.0,United Kingdom
540848,2023-01-12,22071,Small White Retrospot Mug In Box,13.69,2,17848.0,United Kingdom
540848,2023-01-12,22074,6 Ribbons Shimmering Pinks,11.12,9,17848.0,United Kingdom
540848,2023-01-12,22077,6 Ribbons Rustic Charm,13.69,1,17848.0,United Kingdom
540848,2023-01-12,22086,Paper Chain Kit 50'S Christmas,16.31,3,17848.0,United Kingdom
540848,2023-01-12,22087,Paper Bunting White Lace,16.31,2,17848.0,United Kingdom
540848,2023-01-12,22088,Paper Bunting Coloured Lace,16.31,1,17848.0,United Kingdom
540848,2023-01-12,22110,Bird House Hot Water Bottle,13.69,5,17848.0,United Kingdom
540848,2023-01-12,22117,Metal Sign Her Dinner Is Served,11.95,1,17848.0,United Kingdom
540848,2023-01-12,22134,Mini Ladle Love Heart Red,10.69,2,17848.0,United Kingdom
540848,2023-01-12,22208,Wood Stamp Set Thank You,11.95,4,17848.0,United Kingdom
540848,2023-01-12,22209,Wood Stamp Set Happy Birthday,11.95,2,17848.0,United Kingdom
540848,2023-01-12,22210,Wood Stamp Set Best Wishes,11.95,2,17848.0,United Kingdom
540848,2023-01-12,22211,Wood Stamp Set Flowers,11.95,2,17848.0,United Kingdom
540848,2023-01-12,22212,Four Hook White Lovebirds,14.57,1,17848.0,United Kingdom
540848,2023-01-12,22214,Candle Plate Lace White,11.95,2,17848.0,United Kingdom
540848,2023-01-12,22216,T-Light Holder White Lace,11.08,4,17848.0,United Kingdom
540848,2023-01-12,22325,Mobile Vintage Hearts,13.69,3,17848.0,United Kingdom
540848,2023-01-12,22328,Round Snack Boxes Set Of 4 Fruits,16.31,1,17848.0,United Kingdom
540848,2023-01-12,22342,Home Garland Painted Zinc,11.95,6,17848.0,United Kingdom
540848,2023-01-12,22343,Party Pizza Dish Red Retrospot,10.69,12,17848.0,United Kingdom
540848,2023-01-12,22344,Party Pizza Dish Pink Polkadot,10.69,12,17848.0,United Kingdom
540848,2023-01-12,22345,Party Pizza Dish Blue Polkadot,10.69,10,17848.0,United Kingdom
540848,2023-01-12,22346,Party Pizza Dish Green Polkadot,10.69,14,17848.0,United Kingdom
540848,2023-01-12,22355,Charlotte Bag Suki Design,11.95,2,17848.0,United Kingdom
540848,2023-01-12,22361,Glass Jar Daisy Fresh Cotton Wool,16.31,1,17848.0,United Kingdom
540848,2023-01-12,22371,Airline Bag Vintage Tokyo 78,14.57,2,17848.0,United Kingdom
540848,2023-01-12,22374,Airline Bag Vintage Jet Set Red,14.57,1,17848.0,United Kingdom
540848,2023-01-12,22376,Airline Bag Vintage Jet Set White,14.57,2,17848.0,United Kingdom
540848,2023-01-12,22377,Bottle Bag Retrospot,11.95,5,17848.0,United Kingdom
540848,2023-01-12,22378,Wall Tidy Retrospot,11.95,9,17848.0,United Kingdom
540848,2023-01-12,22379,Recycling Bag Retrospot,14.57,1,17848.0,United Kingdom
540848,2023-01-12,22469,Heart Of Wicker Small,13.69,2,17848.0,United Kingdom
540848,2023-01-12,22471,Tv Dinner Tray Air Hostess,14.57,2,17848.0,United Kingdom
540848,2023-01-12,22473,Tv Dinner Tray Vintage Paisley,14.57,3,17848.0,United Kingdom
540848,2023-01-12,22481,Black Tea Towel Classic Design,11.12,2,17848.0,United Kingdom
540848,2023-01-12,22494,Emergency First Aid Tin,12.82,1,17848.0,United Kingdom
540848,2023-01-12,22508,Doorstop Retrospot Heart,18.06,1,17848.0,United Kingdom
540848,2023-01-12,22537,Magic Drawing Slate Dinosaur,11.12,1,17848.0,United Kingdom
540848,2023-01-12,22547,Mini Jigsaw Dinosaur,11.12,1,17848.0,United Kingdom
540848,2023-01-12,22557,Plasters In Tin Vintage Paisley,13.69,2,17848.0,United Kingdom
540848,2023-01-12,22621,Traditional Knitting Nancy,13.69,1,17848.0,United Kingdom
540848,2023-01-12,22638,Set Of 4 Napkin Charms Crowns,11.95,2,17848.0,United Kingdom
540848,2023-01-12,22643,Set Of 4 Napkin Charms Leaves,11.95,2,17848.0,United Kingdom
540848,2023-01-12,22644,Ceramic Cherry Cake Money Bank,13.69,2,17848.0,United Kingdom
540848,2023-01-12,22651,Gentleman Shirt Repair Kit,11.95,1,17848.0,United Kingdom
540848,2023-01-12,22678,French Blue Metal Door Sign 3,12.82,1,17848.0,United Kingdom
540848,2023-01-12,22680,French Blue Metal Door Sign 5,12.82,1,17848.0,United Kingdom
540848,2023-01-12,22681,French Blue Metal Door Sign 6,12.82,1,17848.0,United Kingdom
540848,2023-01-12,22694,Wicker Star,14.57,1,17848.0,United Kingdom
540848,2023-01-12,22695,Wicker Wreath Small,13.69,1,17848.0,United Kingdom
540848,2023-01-12,22697,Green Regency Teacup And Saucer,16.31,1,17848.0,United Kingdom
540848,2023-01-12,22716,Card Circus Parade,11.12,1,17848.0,United Kingdom
540848,2023-01-12,22718,Card Cat And Tree,11.12,2,17848.0,United Kingdom
540848,2023-01-12,22732,3d Vintage Christmas Stickers,12.82,1,17848.0,United Kingdom
540848,2023-01-12,22757,Large Red Babushka Notebook,12.82,1,17848.0,United Kingdom
540848,2023-01-12,22801,Antique Glass Pedestal Bowl,18.06,1,17848.0,United Kingdom
540848,2023-01-12,21272,Salle De Bain Hook,12.82,1,17848.0,United Kingdom
540848,2023-01-12,21316,Small Chunky Glass Roman Bowl,16.31,1,17848.0,United Kingdom
540848,2023-01-12,84032A,Charlie+Lola Pink Hot Water Bottle,13.69,1,17848.0,United Kingdom
540848,2023-01-12,84050,Pink Heart Shape Egg Frying Pan,14.57,2,17848.0,United Kingdom
540848,2023-01-12,84086C,Pink/Purple Retro Radio,12.82,1,17848.0,United Kingdom
540848,2023-01-12,84251C,Greeting Card Two Sisters,10.69,4,17848.0,United Kingdom
540848,2023-01-12,84251G,Greeting Card Overcrowded Pool,10.69,3,17848.0,United Kingdom
540848,2023-01-12,84313B,Blue Tv Tray Table,16.31,3,17848.0,United Kingdom
540848,2023-01-12,84313C,Orange Tv Tray Table,16.31,1,17848.0,United Kingdom
540848,2023-01-12,84347,Rotating Silver Angels T-Light Hldr,15.44,1,17848.0,United Kingdom
540848,2023-01-12,84356,Pompom Curtain,16.31,1,17848.0,United Kingdom
540848,2023-01-12,22156,Heart Decoration With Pearls,11.95,10,17848.0,United Kingdom
540848,2023-01-12,22161,Heart Decoration Rustic Hanging,11.08,2,17848.0,United Kingdom
540848,2023-01-12,22162,Heart Garland Rustic Padded,13.69,7,17848.0,United Kingdom
540848,2023-01-12,22163,Heart String Memo Holder Hanging,13.69,1,17848.0,United Kingdom
540848,2023-01-12,22167,Oval Wall Mirror Diamante,18.93,1,17848.0,United Kingdom
540848,2023-01-12,22174,Photo Cube,13.69,1,17848.0,United Kingdom
540848,2023-01-12,22182,Cake Stand Victorian Filigree Small,14.57,1,17848.0,United Kingdom
540848,2023-01-12,22183,Cake Stand Victorian Filigree Med,16.31,1,17848.0,United Kingdom
540848,2023-01-12,22184,Cake Stand Victorian Filigree Large,18.93,1,17848.0,United Kingdom
540848,2023-01-12,22189,Cream Heart Card Holder,18.93,1,17848.0,United Kingdom
540848,2023-01-12,22197,Popcorn Holder,11.95,6,17848.0,United Kingdom
540848,2023-01-12,22200,Frying Pan Pink Polkadot,18.93,1,17848.0,United Kingdom
540848,2023-01-12,22201,Frying Pan Blue Polkadot,13.69,1,17848.0,United Kingdom
540848,2023-01-12,22222,Cake Plate Lovebird White,14.57,9,17848.0,United Kingdom
540848,2023-01-12,22223,Cake Plate Lovebird Pink,14.57,1,17848.0,United Kingdom
540848,2023-01-12,22247,Bunny Decoration Magic Garden,11.08,7,17848.0,United Kingdom
540848,2023-01-12,22248,Decoration Pink Chick Magic Garden,11.08,7,17848.0,United Kingdom
540848,2023-01-12,22249,Decoration White Chick Magic Garden,11.08,6,17848.0,United Kingdom
540848,2023-01-12,22250,Decoration Butterfly Magic Garden,11.08,7,17848.0,United Kingdom
540848,2023-01-12,22257,Felt Farm Animal Sheep,11.12,4,17848.0,United Kingdom
540848,2023-01-12,22258,Felt Farm Animal Rabbit,11.12,14,17848.0,United Kingdom
540848,2023-01-12,22259,Felt Farm Animal Hen,11.12,7,17848.0,United Kingdom
540848,2023-01-12,22264,Felt Farm Animal White Bunny,11.08,2,17848.0,United Kingdom
540848,2023-01-12,22279,Pocket Bag Blue Paisley Red Spot,11.12,3,17848.0,United Kingdom
540848,2023-01-12,22280,Pocket Bag Pink Paisely Brown Spot,11.12,1,17848.0,United Kingdom
540848,2023-01-12,22294,Heart Filigree Dove Small,12.82,3,17848.0,United Kingdom
540848,2023-01-12,22295,Heart Filigree Dove Large,13.69,3,17848.0,United Kingdom
540848,2023-01-12,22300,Coffee Mug Dog + Ball Design,15.44,2,17848.0,United Kingdom
540848,2023-01-12,22317,Five Cats Hanging Decoration,12.82,1,17848.0,United Kingdom
540848,2023-01-12,22411,Jumbo Shopper Vintage Red Paisley,14.57,1,17848.0,United Kingdom
540848,2023-01-12,22422,Toothpaste Tube Pen,11.56,2,17848.0,United Kingdom
540848,2023-01-12,22438,Balloon Art Make Your Own Flowers,11.95,1,17848.0,United Kingdom
540848,2023-01-12,22440,Balloon Water Bomb Pack Of 35,11.12,1,17848.0,United Kingdom
540848,2023-01-12,22446,Pin Cushion Babushka Pink,12.82,1,17848.0,United Kingdom
540848,2023-01-12,22447,Pin Cushion Babushka Blue,12.82,3,17848.0,United Kingdom
540848,2023-01-12,22452,Measuring Tape Babushka Pink,11.95,5,17848.0,United Kingdom
540848,2023-01-12,22453,Measuring Tape Babushka Blue,11.95,5,17848.0,United Kingdom
540848,2023-01-12,22457,Natural Slate Heart Chalkboard,16.31,2,17848.0,United Kingdom
540848,2023-01-12,21051,Ribbons Purse,11.95,2,17848.0,United Kingdom
540848,2023-01-12,21065,Boom Box Speaker Girls,13.69,2,17848.0,United Kingdom
540848,2023-01-12,21109,Large Cake Towel Chocolate Spots,14.57,4,17848.0,United Kingdom
540848,2023-01-12,21110,Large Cake Towel Pink Spots,14.57,6,17848.0,United Kingdom
540848,2023-01-12,21111,Swiss Roll Towel Chocolate Spots,12.82,5,17848.0,United Kingdom
540848,2023-01-12,21112,Swiss Roll Towel Pink Spots,12.82,4,17848.0,United Kingdom
540848,2023-01-12,21116,Owl Doorstop,18.93,1,17848.0,United Kingdom
540848,2023-01-12,21122,Set/10 Pink Polkadot Party Candles,12.82,3,17848.0,United Kingdom
540848,2023-01-12,21147,Jingle Bells Tree Decoration,12.82,1,17848.0,United Kingdom
540848,2023-01-12,21194,Pink Honeycomb Paper Fan,11.95,1,17848.0,United Kingdom
540848,2023-01-12,21195,Pink Honeycomb Paper Ball,11.95,2,17848.0,United Kingdom
540848,2023-01-12,21200,Multicolour Honeycomb Paper Garland,11.95,2,17848.0,United Kingdom
540848,2023-01-12,21205,Multicolour 3d Balls Garland,12.82,1,17848.0,United Kingdom
540848,2023-01-12,21556,Ceramic Strawberry Money Box,12.82,1,17848.0,United Kingdom
540848,2023-01-12,21563,Red Heart Shape Love Bucket,16.31,1,17848.0,United Kingdom
540848,2023-01-12,21615,4 Lavender Botanical Dinner Candles,12.82,3,17848.0,United Kingdom
540848,2023-01-12,21616,4 Pear Botanical Dinner Candles,12.82,3,17848.0,United Kingdom
540848,2023-01-12,21617,4 Lily Botanical Dinner Candles,12.82,7,17848.0,United Kingdom
540848,2023-01-12,21618,4 Wildflower Botanical Candles,12.82,7,17848.0,United Kingdom
540848,2023-01-12,21619,4 Vanilla Botanical Candles,12.82,8,17848.0,United Kingdom
540848,2023-01-12,21708,Folding Umbrella Cream Polkadot,13.69,1,17848.0,United Kingdom
540848,2023-01-12,21709,Folding Umbrella Chocolate Polkadot,13.69,1,17848.0,United Kingdom
540848,2023-01-12,21731,Red Toadstool Led Night Light,13.69,1,17848.0,United Kingdom
540848,2023-01-12,21773,Decorative Rose Bathroom Bottle,11.56,6,17848.0,United Kingdom
540848,2023-01-12,21774,Decorative Cats Bathroom Bottle,11.56,5,17848.0,United Kingdom
540848,2023-01-12,21775,Decorative Flore Bathroom Bottle,11.56,11,17848.0,United Kingdom
540848,2023-01-12,21790,Vintage Snap Cards,11.95,1,17848.0,United Kingdom
540848,2023-01-12,84707B,Pink Jewelled Mirror Trinket Tray,16.31,1,17848.0,United Kingdom
540848,2023-01-12,84711A,Silver Oval Shape Trinket Box,16.31,1,17848.0,United Kingdom
540848,2023-01-12,84748,Folk Felt Hanging Multicol Garland,12.82,2,17848.0,United Kingdom
540848,2023-01-12,84828,Jungle Popsicles Ice Lolly Moulds,12.82,1,17848.0,United Kingdom
540848,2023-01-12,84832,Zinc Willie Winkie Candle Stick,11.95,1,17848.0,United Kingdom
540848,2023-01-12,84870B,Blue Geisha Girl,12.82,1,17848.0,United Kingdom
540848,2023-01-12,84870C,Green Geisha Girl,12.82,1,17848.0,United Kingdom
540848,2023-01-12,84912B,Green Rose Washbag,13.69,2,17848.0,United Kingdom
540848,2023-01-12,84913A,Soft Pink Rose Towel,13.69,6,17848.0,United Kingdom
540848,2023-01-12,84913B,Mint Green Rose Towel,13.69,2,17848.0,United Kingdom
540848,2023-01-12,84915,Hand Towel Pink Flower And Daisy,14.57,2,17848.0,United Kingdom
540848,2023-01-12,84916,Hand Towel Pale Blue W Flowers,14.57,1,17848.0,United Kingdom
540848,2023-01-12,84917,White Hand Towel With Butterfly,14.57,1,17848.0,United Kingdom
540848,2023-01-12,84923,Pink Butterfly Handbag W Bobbles,14.57,1,17848.0,United Kingdom
540848,2023-01-12,21328,Balloons Writing Set,13.69,1,17848.0,United Kingdom
540848,2023-01-12,21382,Set/4 Spring Flower Decoration,16.31,1,17848.0,United Kingdom
540848,2023-01-12,21383,Pack Of 12 Sticky Bunnies,11.95,1,17848.0,United Kingdom
540848,2023-01-12,21385,Ivory Hanging Decoration Heart,11.95,3,17848.0,United Kingdom
540848,2023-01-12,21389,Ivory Hanging Decoration Bird,11.95,1,17848.0,United Kingdom
540848,2023-01-12,21390,Filigris Heart With Butterfly,12.82,1,17848.0,United Kingdom
540848,2023-01-12,21439,Basket Of Toadstools,12.82,1,17848.0,United Kingdom
540848,2023-01-12,21448,12 Daisy Pegs In Wood Box,13.69,1,17848.0,United Kingdom
540848,2023-01-12,21494,Rotating Leaves T-Light Holder,11.95,7,17848.0,United Kingdom
540848,2023-01-12,21506,Fancy Font Birthday Card,11.12,2,17848.0,United Kingdom
540848,2023-01-12,21508,Vintage Kid Dolly Card,11.12,2,17848.0,United Kingdom
540848,2023-01-12,21518,Bank Account Greeting Card,10.69,1,17848.0,United Kingdom
540848,2023-01-12,84968E,Set Of 16 Vintage Black Cutlery,18.93,8,17848.0,United Kingdom
540848,2023-01-12,84968F,Set Of 16 Vintage Sky Blue Cutlery,18.93,2,17848.0,United Kingdom
