TransactionNo,Date,ProductNo,ProductName,Price,Quantity,CustomerNo,Country
546133,2023-03-09,22243,5 Hook Hanger Red Magic Toadstool,11.94,12,14291.0,United Kingdom
546133,2023-03-09,22746,Poppy's Playhouse Livingroom,12.4,6,14291.0,United Kingdom
546133,2023-03-09,22745,Poppy's Playhouse Bedroom,12.4,6,14291.0,United Kingdom
546133,2023-03-09,22747,Poppy's Playhouse Bathroom,12.4,6,14291.0,United Kingdom
546133,2023-03-09,22748,Poppy's Playhouse Kitchen,12.4,6,14291.0,United Kingdom
546133,2023-03-09,20749,Assorted Colour Mini Cases,18.4,2,14291.0,United Kingdom
546133,2023-03-09,23128,Feltcraft Boy Jean-Paul Kit,15.32,4,14291.0,United Kingdom
546133,2023-03-09,23126,Feltcraft Girl Amelie Kit,15.32,4,14291.0,United Kingdom
546133,2023-03-09,23127,Feltcraft Girl Nicole Kit,15.32,4,14291.0,United Kingdom
546133,2023-03-09,22631,Circus Parade Lunch Box,12.25,12,14291.0,United Kingdom
546133,2023-03-09,22636,Childs Breakfast Set Circus Parade,18.96,2,14291.0,United Kingdom
546133,2023-03-09,22561,Wooden School Colouring Set,11.94,12,14291.0,United Kingdom
546133,2023-03-09,22197,Popcorn Holder,11.12,12,14291.0,United Kingdom
546133,2023-03-09,23177,Treasure Island Book Box,12.56,8,14291.0,United Kingdom
546133,2023-03-09,23176,Abc Treasure Book Box,12.56,8,14291.0,United Kingdom
546133,2023-03-09,23194,Gymkhana Treasure Book Box,12.56,8,14291.0,United Kingdom
546133,2023-03-09,21790,Vintage Snap Cards,11.12,12,14291.0,United Kingdom
546133,2023-03-09,21915,Red Harmonica In Box,11.53,12,14291.0,United Kingdom
546133,2023-03-09,21914,Blue Harmonica In Box,11.53,12,14291.0,United Kingdom
546133,2023-03-09,22405,Money Box Pocket Money Design,11.53,12,14291.0,United Kingdom
546133,2023-03-09,22492,Mini Paint Set Vintage,10.92,36,14291.0,United Kingdom
546133,2023-03-09,22637,Piggy Bank Retrospot,12.86,12,14291.0,United Kingdom
546133,2023-03-09,22088,Paper Bunting Coloured Lace,13.27,6,14291.0,United Kingdom
546133,2023-03-09,22382,Lunch Bag Spaceboy Design,5.97,10,14291.0,United Kingdom
546133,2023-03-09,22662,Lunch Bag Dolly Girl Design,5.97,10,14291.0,United Kingdom
546133,2023-03-09,20726,Lunch Bag Woodland,5.97,10,14291.0,United Kingdom
546134,2023-03-09,22860,Easter Tin Chicks Pink Daisy,11.94,60,13493.0,Switzerland
546134,2023-03-09,22858,Easter Tin Keepsake,11.74,108,13493.0,Switzerland
546134,2023-03-09,22857,Assorted Easter Gift Tags,10.99,144,13493.0,Switzerland
546135,2023-03-09,22967,Set 3 Song Bird Paper Eggs Assorted,13.27,6,12388.0,Australia
546135,2023-03-09,22957,Set 3 Paper Vintage Chick Paper Egg,13.27,6,12388.0,Australia
546135,2023-03-09,22148,Easter Craft 4 Chicks,12.25,12,12388.0,Australia
546135,2023-03-09,22262,Felt Egg Cosy Chicken,11.12,12,12388.0,Australia
546135,2023-03-09,22310,Ivory Knitted Mug Cosy,11.94,6,12388.0,Australia
546135,2023-03-09,47566,Party Bunting,15.32,12,12388.0,Australia
546135,2023-03-09,22720,Set Of 3 Cake Tins Pantry Design,15.32,6,12388.0,Australia
546135,2023-03-09,84978,Hanging Heart Jar T-Light Holder,11.53,12,12388.0,Australia
546135,2023-03-09,84970S,Hanging Heart Zinc T-Light Holder,11.12,12,12388.0,Australia
546135,2023-03-09,22083,Paper Chain Kit Retrospot,13.27,6,12388.0,Australia
546136,2023-03-09,21166,Cook With Wine Metal Sign,14.48,1,13136.0,United Kingdom
546136,2023-03-09,21181,Please One Person Metal Sign,14.48,4,13136.0,United Kingdom
546136,2023-03-09,21210,Set Of 72 Retrospot Paper Doilies,13.24,1,13136.0,United Kingdom
546136,2023-03-09,21212,Pack Of 72 Retrospot Cake Cases,11.53,1,13136.0,United Kingdom
546136,2023-03-09,21218,Red Spotty Biscuit Tin,18.75,1,13136.0,United Kingdom
546136,2023-03-09,21328,Balloons Writing Set,13.62,1,13136.0,United Kingdom
546136,2023-03-09,21383,Pack Of 12 Sticky Bunnies,11.92,1,13136.0,United Kingdom
546136,2023-03-09,21398,Red Polkadot Coffee Mug,11.92,7,13136.0,United Kingdom
546136,2023-03-09,21454,Painted Pink Rabbit,11.1,1,13136.0,United Kingdom
546136,2023-03-09,21455,Painted Yellow Wooden Daisy,11.1,1,13136.0,United Kingdom
546136,2023-03-09,21479,White Skull Hot Water Bottle,17.9,2,13136.0,United Kingdom
546136,2023-03-09,21535,Red Retrospot Small Milk Jug,15.33,1,13136.0,United Kingdom
546136,2023-03-09,21559,Strawberry Lunch Box With Cutlery,15.33,1,13136.0,United Kingdom
546136,2023-03-09,21626,Vintage Union Jack Pennant,11.92,1,13136.0,United Kingdom
546136,2023-03-09,21634,Assorted Mini Madras Notebook,12.77,1,13136.0,United Kingdom
546136,2023-03-09,21713,Citronella Candle Flowerpot,14.48,1,13136.0,United Kingdom
546136,2023-03-09,21731,Red Toadstool Led Night Light,13.62,2,13136.0,United Kingdom
546136,2023-03-09,21746,Small Red Retrospot Windmill,12.77,12,13136.0,United Kingdom
546136,2023-03-09,21773,Decorative Rose Bathroom Bottle,12.77,1,13136.0,United Kingdom
546136,2023-03-09,21774,Decorative Cats Bathroom Bottle,12.77,1,13136.0,United Kingdom
546136,2023-03-09,21775,Decorative Flore Bathroom Bottle,12.77,1,13136.0,United Kingdom
546136,2023-03-09,21788,Kids Rain Mac Blue,11.92,1,13136.0,United Kingdom
546136,2023-03-09,21832,Chocolate Calculator,13.62,1,13136.0,United Kingdom
546136,2023-03-09,21865,Pink Union Jack Passport Cover,14.48,1,13136.0,United Kingdom
546136,2023-03-09,21871,Save The Planet Mug,13.62,1,13136.0,United Kingdom
546136,2023-03-09,21880,Red Retrospot Tape,10.68,1,13136.0,United Kingdom
546136,2023-03-09,21898,Potting Shed Rose Candle,12.77,3,13136.0,United Kingdom
546136,2023-03-09,21900,Key Fob Shed,11.92,1,13136.0,United Kingdom
546136,2023-03-09,21901,Key Fob Back Door,11.92,1,13136.0,United Kingdom
546136,2023-03-09,21902,Key Fob Front Door,11.92,1,13136.0,United Kingdom
546136,2023-03-09,21907,I'm On Holiday Metal Sign,14.48,1,13136.0,United Kingdom
546136,2023-03-09,21908,Chocolate This Way Metal Sign,14.48,1,13136.0,United Kingdom
546136,2023-03-09,21914,Blue Harmonica In Box,12.77,2,13136.0,United Kingdom
546136,2023-03-09,21935,Suki Shoulder Bag,13.62,2,13136.0,United Kingdom
546136,2023-03-09,21945,Strawberries Design Flannel,11.92,2,13136.0,United Kingdom
546136,2023-03-09,21974,Set Of 36 Paisley Flower Doilies,13.24,1,13136.0,United Kingdom
546136,2023-03-09,21977,Pack Of 60 Pink Paisley Cake Cases,11.53,1,13136.0,United Kingdom
546136,2023-03-09,21980,Pack Of 12 Red Retrospot Tissues,11.1,4,13136.0,United Kingdom
546136,2023-03-09,21992,Vintage Paisley Stationery Set,12.77,1,13136.0,United Kingdom
546136,2023-03-09,22076,6 Ribbons Empire,13.62,1,13136.0,United Kingdom
546136,2023-03-09,22077,6 Ribbons Rustic Charm,13.62,1,13136.0,United Kingdom
546136,2023-03-09,22087,Paper Bunting White Lace,16.18,2,13136.0,United Kingdom
546136,2023-03-09,22090,Paper Bunting Retrospot,16.18,6,13136.0,United Kingdom
546136,2023-03-09,22109,Full English Breakfast Plate,17.9,1,13136.0,United Kingdom
546136,2023-03-09,22116,Metal Sign His Dinner Is Served,11.92,1,13136.0,United Kingdom
546136,2023-03-09,22161,Heart Decoration Rustic Hanging,11.06,4,13136.0,United Kingdom
546136,2023-03-09,22182,Cake Stand Victorian Filigree Small,14.48,1,13136.0,United Kingdom
546136,2023-03-09,22183,Cake Stand Victorian Filigree Med,16.18,3,13136.0,United Kingdom
546136,2023-03-09,22189,Cream Heart Card Holder,18.75,1,13136.0,United Kingdom
546136,2023-03-09,22197,Popcorn Holder,11.92,1,13136.0,United Kingdom
546136,2023-03-09,22224,White Lovebird Lantern,16.18,2,13136.0,United Kingdom
546136,2023-03-09,22227,Hanging Heart Mirror Decoration,11.53,1,13136.0,United Kingdom
546136,2023-03-09,22241,Garland Wooden Happy Easter,12.77,1,13136.0,United Kingdom
546136,2023-03-09,22249,Decoration White Chick Magic Garden,11.92,1,13136.0,United Kingdom
546136,2023-03-09,22260,Felt Egg Cosy Blue Rabbit,11.92,4,13136.0,United Kingdom
546136,2023-03-09,22276,Wash Bag Vintage Rose Paisley,16.18,2,13136.0,United Kingdom
546136,2023-03-09,22296,Heart Ivory Trellis Large,13.62,1,13136.0,United Kingdom
546136,2023-03-09,22310,Ivory Knitted Mug Cosy,13.62,1,13136.0,United Kingdom
546136,2023-03-09,22342,Home Garland Painted Zinc,13.62,1,13136.0,United Kingdom
546136,2023-03-09,22355,Charlotte Bag Suki Design,11.92,2,13136.0,United Kingdom
546136,2023-03-09,22356,Charlotte Bag Pink Polkadot,11.92,2,13136.0,United Kingdom
546136,2023-03-09,22361,Glass Jar Daisy Fresh Cotton Wool,16.18,1,13136.0,United Kingdom
546136,2023-03-09,22362,Glass Jar Peacock Bath Salts,16.18,1,13136.0,United Kingdom
546136,2023-03-09,22374,Airline Bag Vintage Jet Set Red,18.75,1,13136.0,United Kingdom
546136,2023-03-09,22379,Recycling Bag Retrospot,14.48,1,13136.0,United Kingdom
546136,2023-03-09,22381,Toy Tidy Pink Polkadot,14.48,1,13136.0,United Kingdom
546136,2023-03-09,22421,Lipstick Pen Fuschia,11.1,1,13136.0,United Kingdom
546136,2023-03-09,22433,Watering Can Green Dinosaur,14.48,1,13136.0,United Kingdom
546136,2023-03-09,22469,Heart Of Wicker Small,11.94,1,13136.0,United Kingdom
546136,2023-03-09,22520,Childs Garden Trowel Blue,11.92,2,13136.0,United Kingdom
546136,2023-03-09,22521,Childs Garden Trowel Pink,11.92,2,13136.0,United Kingdom
546136,2023-03-09,22557,Plasters In Tin Vintage Paisley,13.62,1,13136.0,United Kingdom
546136,2023-03-09,22558,Clothes Pegs Retrospot Pack 24,13.62,1,13136.0,United Kingdom
546136,2023-03-09,22564,Alphabet Stencil Craft,12.77,1,13136.0,United Kingdom
546136,2023-03-09,22566,Feltcraft Hairband Pink And Purple,11.92,1,13136.0,United Kingdom
546136,2023-03-09,22608,Pens Assorted Funky Jeweled,11.92,1,13136.0,United Kingdom
546136,2023-03-09,22621,Traditional Knitting Nancy,13.62,1,13136.0,United Kingdom
546136,2023-03-09,22624,Ivory Kitchen Scales,18.96,1,13136.0,United Kingdom
546136,2023-03-09,22630,Dolly Girl Lunch Box,14.48,1,13136.0,United Kingdom
546136,2023-03-09,22637,Piggy Bank Retrospot,15.33,2,13136.0,United Kingdom
546136,2023-03-09,22661,Charlotte Bag Dolly Girl Design,11.92,1,13136.0,United Kingdom
546136,2023-03-09,22666,Recipe Box Pantry Yellow Design,16.18,1,13136.0,United Kingdom
546136,2023-03-09,22668,Pink Baby Bunting,16.18,2,13136.0,United Kingdom
546136,2023-03-09,22697,Green Regency Teacup And Saucer,16.18,1,13136.0,United Kingdom
546136,2023-03-09,22698,Pink Regency Teacup And Saucer,16.18,1,13136.0,United Kingdom
546136,2023-03-09,22699,Roses Regency Teacup And Saucer,16.18,2,13136.0,United Kingdom
546136,2023-03-09,22722,Set Of 6 Spice Tins Pantry Design,18.75,3,13136.0,United Kingdom
546136,2023-03-09,22723,Set Of 6 Herb Tins Sketchbook,18.75,1,13136.0,United Kingdom
546136,2023-03-09,22727,Alarm Clock Bakelike Red,17.9,1,13136.0,United Kingdom
546136,2023-03-09,22728,Alarm Clock Bakelike Pink,17.9,3,13136.0,United Kingdom
546136,2023-03-09,22749,Feltcraft Princess Charlotte Doll,17.9,1,13136.0,United Kingdom
546136,2023-03-09,22771,Clear Drawer Knob Acrylic Edwardian,12.81,2,13136.0,United Kingdom
546136,2023-03-09,22772,Pink Drawer Knob Acrylic Edwardian,12.81,6,13136.0,United Kingdom
546136,2023-03-09,22773,Green Drawer Knob Acrylic Edwardian,12.81,12,13136.0,United Kingdom
546136,2023-03-09,11001,Asstd Design Racing Car Pen,13.62,1,13136.0,United Kingdom
546136,2023-03-09,15039,Sandalwood Fan,11.92,1,13136.0,United Kingdom
546136,2023-03-09,17012C,Origami Lavender Incense/Candl Set,12.77,1,13136.0,United Kingdom
546136,2023-03-09,17012F,Origami Sandlewood Incense/Cand Set,12.77,1,13136.0,United Kingdom
546136,2023-03-09,17013D,Origami Rose Incense In Tube,13.62,2,13136.0,United Kingdom
546136,2023-03-09,17084N,Fairy Dreams Incense,10.68,1,13136.0,United Kingdom
546136,2023-03-09,17091J,Vanilla Incense In Tin,12.77,2,13136.0,United Kingdom
546136,2023-03-09,17129F,Blue Glass Gems In Bag,11.92,1,13136.0,United Kingdom
546136,2023-03-09,20616,Cherry Blossom Passport Cover,11.92,1,13136.0,United Kingdom
546136,2023-03-09,20618,Queen Of The Skies Passport Cover,11.92,1,13136.0,United Kingdom
546136,2023-03-09,20674,Green Polkadot Bowl,12.77,1,13136.0,United Kingdom
546136,2023-03-09,20676,Red Retrospot Bowl,12.77,2,13136.0,United Kingdom
546136,2023-03-09,20682,Red Retrospot Childrens Umbrella,17.05,1,13136.0,United Kingdom
546136,2023-03-09,20707,Crazy Daisy Heart Decoration,11.1,3,13136.0,United Kingdom
546136,2023-03-09,20719,Woodland Charlotte Bag,11.92,3,13136.0,United Kingdom
546136,2023-03-09,20724,Red Retrospot Charlotte Bag,11.92,6,13136.0,United Kingdom
546136,2023-03-09,20733,Gold Mini Tape Measure,11.1,1,13136.0,United Kingdom
546136,2023-03-09,20752,Blue Polkadot Washing Up Gloves,14.48,1,13136.0,United Kingdom
546136,2023-03-09,22837,Hot Water Bottle Babushka,19.61,1,13136.0,United Kingdom
546136,2023-03-09,22859,Easter Tin Bunny Bouquet,13.62,1,13136.0,United Kingdom
546136,2023-03-09,22866,Hand Warmer Scotty Dog Design,12.4,2,13136.0,United Kingdom
546136,2023-03-09,22938,Cupcake Lace Paper Set 6,14.48,1,13136.0,United Kingdom
546136,2023-03-09,22960,Jam Making Set With Jars,18.75,2,13136.0,United Kingdom
546136,2023-03-09,22961,Jam Making Set Printed,13.62,1,13136.0,United Kingdom
546136,2023-03-09,22962,Jam Jar With Pink Lid,11.92,2,13136.0,United Kingdom
546136,2023-03-09,22978,Pantry Rolling Pin,17.9,1,13136.0,United Kingdom
546136,2023-03-09,22979,Pantry Washing Up Brush,13.24,1,13136.0,United Kingdom
546136,2023-03-09,22982,Pantry Pastry Brush,12.77,1,13136.0,United Kingdom
546136,2023-03-09,22989,Set 2 Pantry Design Tea Towels,17.05,1,13136.0,United Kingdom
546136,2023-03-09,22993,Set Of 4 Pantry Jelly Moulds,12.77,1,13136.0,United Kingdom
546136,2023-03-09,22996,Travel Card Wallet Vintage Ticket,11.1,1,13136.0,United Kingdom
546136,2023-03-09,22998,Travel Card Wallet Keep Calm,11.1,2,13136.0,United Kingdom
546136,2023-03-09,23004,Travel Card Wallet Pantry,11.1,1,13136.0,United Kingdom
546136,2023-03-09,23176,Abc Treasure Book Box,14.94,1,13136.0,United Kingdom
546136,2023-03-09,35241,Enamel Blue Rim Biscuit Bin,14.48,1,13136.0,United Kingdom
546136,2023-03-09,35911A,Multicolour Rabbit Egg Warmer,11.1,2,13136.0,United Kingdom
546136,2023-03-09,35911B,Pink/Flower Rabbit Egg Warmer,11.1,2,13136.0,United Kingdom
546136,2023-03-09,35914,Pink Chick Egg Warmer + Egg Cup,11.1,2,13136.0,United Kingdom
546136,2023-03-09,35915B,Blue Knitted Hen,11.1,7,13136.0,United Kingdom
546136,2023-03-09,35915C,Peach Knitted Hen,11.1,7,13136.0,United Kingdom
546136,2023-03-09,35971,Rose Folkart Heart Decorations,12.77,1,13136.0,United Kingdom
546136,2023-03-09,37447,Ceramic Cake Design Spotted Plate,13.62,1,13136.0,United Kingdom
546136,2023-03-09,37500,Tea Time Teapot In Gift Box,18.75,3,13136.0,United Kingdom
546136,2023-03-09,37501,Tea Time Tea Set In Gift Box,16.18,1,13136.0,United Kingdom
546136,2023-03-09,46118,Funky Monkey Cushion Cover,18.75,1,13136.0,United Kingdom
546136,2023-03-09,46776D,Woven Sunset Cushion Cover,14.48,3,13136.0,United Kingdom
546136,2023-03-09,47574A,English Rose Scented Hanging Flower,12.77,1,13136.0,United Kingdom
546136,2023-03-09,47591D,Pink Fairy Cake Childrens Apron,14.48,1,13136.0,United Kingdom
546136,2023-03-09,71270,Photo Clip Line,12.77,1,13136.0,United Kingdom
546136,2023-03-09,79000,Moroccan Tea Glass,11.94,3,13136.0,United Kingdom
546136,2023-03-09,79190D,Retro Plastic Daisy Tray,11.1,2,13136.0,United Kingdom
546136,2023-03-09,82095,Heart Buttons Jewellery Box,15.33,1,13136.0,United Kingdom
546136,2023-03-09,82583,Hot Baths Metal Sign,14.48,2,13136.0,United Kingdom
546136,2023-03-09,84029G,Knitted Union Flag Hot Water Bottle,17.9,2,13136.0,United Kingdom
546136,2023-03-09,84031A,Charlie+Lola Red Hot Water Bottle,14.48,1,13136.0,United Kingdom
546136,2023-03-09,84279B,Cherry Blossom Decorative Flask,18.75,1,13136.0,United Kingdom
546136,2023-03-09,84459B,Yellow Metal Chicken Heart,13.62,2,13136.0,United Kingdom
546136,2023-03-09,84507B,Stripes Design Monkey Doll,15.33,1,13136.0,United Kingdom
546136,2023-03-09,84507C,Blue Circles Design Monkey Doll,15.33,1,13136.0,United Kingdom
546136,2023-03-09,84509A,Set Of 4 English Rose Placemats,17.9,1,13136.0,United Kingdom
546136,2023-03-09,84510A,Set Of 4 English Rose Coasters,12.77,1,13136.0,United Kingdom
546136,2023-03-09,84595E,Large Tortilla Design Red Bowl,13.62,1,13136.0,United Kingdom
546136,2023-03-09,84596J,Mixed Nuts Light Green Bowl,11.1,1,13136.0,United Kingdom
546136,2023-03-09,84673B,Blue Fly Swat,11.53,1,13136.0,United Kingdom
546136,2023-03-09,84913B,Mint Green Rose Towel,13.62,3,13136.0,United Kingdom
546136,2023-03-09,84923,Pink Butterfly Handbag W Bobbles,14.48,2,13136.0,United Kingdom
546136,2023-03-09,84969,Box Of 6 Assorted Colour Teaspoons,13.62,2,13136.0,United Kingdom
546136,2023-03-09,84992,72 Sweetheart Fairy Cake Cases,11.53,1,13136.0,United Kingdom
546136,2023-03-09,85054,French Enamel Pot W Lid,16.18,1,13136.0,United Kingdom
546136,2023-03-09,85093,Candy Spot Egg Warmer Hare,11.1,1,13136.0,United Kingdom
546136,2023-03-09,85094,Candy Spot Egg Warmer Rabbit,11.1,1,13136.0,United Kingdom
546136,2023-03-09,85131A,Beaded Pearl Heart White On Stick,11.1,1,13136.0,United Kingdom
546136,2023-03-09,85131C,Beaded Crystal Heart Blue On Stick,11.1,10,13136.0,United Kingdom
546136,2023-03-09,85150,Ladies & Gentlemen Metal Sign,15.33,2,13136.0,United Kingdom
546136,2023-03-09,85152,Hand Over The Chocolate Sign,14.48,2,13136.0,United Kingdom
546136,2023-03-09,85185B,Pink Horse Sock Puppet Kit,16.18,1,13136.0,United Kingdom
546136,2023-03-09,85186A,Easter Bunny Garland Of Flowers,11.1,2,13136.0,United Kingdom
546136,2023-03-09,85186C,Bunny Egg Garland,11.1,2,13136.0,United Kingdom
546136,2023-03-09,85202,Hanging Wood And Felt Heart,11.06,2,13136.0,United Kingdom
546136,2023-03-09,85203,Hanging Wood And Felt Butterfly,11.06,2,13136.0,United Kingdom
546136,2023-03-09,85204,Hanging Wood And Felt Flower,10.68,3,13136.0,United Kingdom
546136,2023-03-09,90114,Summer Daisies Bag Charm,12.77,1,13136.0,United Kingdom
546136,2023-03-09,90115,Summer Butterflies Bag Charm,12.77,1,13136.0,United Kingdom
546136,2023-03-09,90204,Pair Of Enamel Butterfly Hairclip,13.65,1,13136.0,United Kingdom
546136,2023-03-09,20767,Blue Paisley Journal,15.33,1,13136.0,United Kingdom
546136,2023-03-09,20914,Set/5 Red Retrospot Lid Glass Bowls,16.18,2,13136.0,United Kingdom
546136,2023-03-09,20973,12 Pencil Small Tube Woodland,11.53,1,13136.0,United Kingdom
546136,2023-03-09,21041,Red Retrospot Oven Glove Double,16.18,1,13136.0,United Kingdom
546136,2023-03-09,21071,Vintage Billboard Drink Me Mug,12.77,1,13136.0,United Kingdom
546136,2023-03-09,21107,Cream Slice Flannel Pink Spot,16.18,1,13136.0,United Kingdom
546136,2023-03-09,20914,Set/5 Red Retrospot Lid Glass Bowls,13.27,2,13136.0,United Kingdom
546136,2023-03-09,20676,Red Retrospot Bowl,11.53,8,13136.0,United Kingdom
546136,2023-03-09,21213,Pack Of 72 Skull Cake Cases,10.81,12,13136.0,United Kingdom
546136,2023-03-09,22900,Set 2 Tea Towels I Love London,13.27,3,13136.0,United Kingdom
546136,2023-03-09,22993,Set Of 4 Pantry Jelly Moulds,11.53,6,13136.0,United Kingdom
546136,2023-03-09,22579,Wooden Tree Christmas Scandinavian,11.12,6,13136.0,United Kingdom
546136,2023-03-09,22844,Vintage Cream Dog Food Container,18.96,2,13136.0,United Kingdom
546136,2023-03-09,22470,Heart Of Wicker Large,13.27,3,13136.0,United Kingdom
546136,2023-03-09,21929,Jumbo Bag Pink Vintage Paisley,7.24,1,13136.0,United Kingdom
546136,2023-03-09,20711,Jumbo Bag Toys,7.24,3,13136.0,United Kingdom
546136,2023-03-09,85099B,Jumbo Bag Red Retrospot,7.24,5,13136.0,United Kingdom
546136,2023-03-09,85099F,Jumbo Bag Strawberry,7.24,2,13136.0,United Kingdom
546136,2023-03-09,21033,Jumbo Bag Charlie And Lola Toys,7.24,1,13136.0,United Kingdom
546136,2023-03-09,22383,Lunch Bag Suki Design,7.24,1,13136.0,United Kingdom
546136,2023-03-09,20725,Lunch Bag Red Retrospot,7.24,1,13136.0,United Kingdom
546136,2023-03-09,20726,Lunch Bag Woodland,7.24,1,13136.0,United Kingdom
546104,2023-03-09,21627,Elephant Carnival Pouffe,25.57,1,14527.0,United Kingdom
546104,2023-03-09,22762,Cupboard 3 Drawer Ma Campagne,25.57,1,14527.0,United Kingdom
546132,2023-03-09,23009,I Love London Baby Gift Set,25.57,18,15057.0,United Kingdom
546133,2023-03-09,23007,Spaceboy Baby Gift Set,25.57,6,14291.0,United Kingdom
546133,2023-03-09,23008,Dolly Girl Baby Gift Set,25.57,6,14291.0,United Kingdom
546136,2023-03-09,21109,Large Cake Towel Chocolate Spots,23.87,1,13136.0,United Kingdom
546136,2023-03-09,21906,Pharmacie First Aid Tin,23.87,1,13136.0,United Kingdom
546036,2023-03-09,22838,3 Tier Cake Tin Red And Cream,23.32,8,14645.0,United Kingdom
546037,2023-03-09,22606,Wooden Skittles Garden Set,23.32,4,14825.0,United Kingdom
546037,2023-03-09,22605,Wooden Croquet Garden Set,23.32,4,14825.0,United Kingdom
546079,2023-03-09,22485,Set Of 2 Wooden Market Crates,23.32,1,14534.0,United Kingdom
546091,2023-03-09,22423,Regency Cakestand 3 Tier,23.32,2,14936.0,Channel Islands
546092,2023-03-09,22423,Regency Cakestand 3 Tier,23.32,1,17138.0,United Kingdom
546096,2023-03-09,22423,Regency Cakestand 3 Tier,23.32,8,15502.0,United Kingdom
546096,2023-03-09,22424,Enamel Bread Bin Cream,23.32,2,15502.0,United Kingdom
546096,2023-03-09,21340,Classic Metal Birdcage Plant Holder,23.32,2,15502.0,United Kingdom
546111,2023-03-09,22760,Tray Breakfast In Bed,23.32,1,14165.0,United Kingdom
546113,2023-03-09,22423,Regency Cakestand 3 Tier,23.32,1,14344.0,United Kingdom
546113,2023-03-09,85066,Cream Sweetheart Mini Chest,23.32,1,14344.0,United Kingdom
546117,2023-03-09,22423,Regency Cakestand 3 Tier,23.32,3,16771.0,United Kingdom
546123,2023-03-09,22423,Regency Cakestand 3 Tier,23.32,4,16419.0,United Kingdom
C546080,2023-03-09,22423,Regency Cakestand 3 Tier,23.32,-1,15078.0,United Kingdom
546136,2023-03-09,21758,Vintage Shells Print,23.02,1,13136.0,United Kingdom
546136,2023-03-09,15056N,Edwardian Parasol Natural,23.02,2,13136.0,United Kingdom
546136,2023-03-09,85014B,Red Retrospot Umbrella,23.02,1,13136.0,United Kingdom
546136,2023-03-09,21756,Bath Building Block Word,22.17,1,13136.0,United Kingdom
546084,2023-03-09,21843,Red Retrospot Cake Stand,21.47,1,14112.0,United Kingdom
546101,2023-03-09,22423,Regency Cakestand 3 Tier,21.47,16,14803.0,United Kingdom
546103,2023-03-09,22423,Regency Cakestand 3 Tier,21.47,16,13093.0,United Kingdom
546117,2023-03-09,84306,S/3 Pink Square Planters Roses,21.47,1,16771.0,United Kingdom
546136,2023-03-09,22617,Baking Set Spaceboy Design,21.31,1,13136.0,United Kingdom
546136,2023-03-09,22720,Set Of 3 Cake Tins Pantry Design,21.31,1,13136.0,United Kingdom
546136,2023-03-09,47566,Party Bunting,21.31,1,13136.0,United Kingdom
546136,2023-03-09,21534,Dairy Maid Large Milk Jug,20.46,1,13136.0,United Kingdom
546136,2023-03-09,21706,Folding Umbrella Red/White Polkadot,20.46,1,13136.0,United Kingdom
546136,2023-03-09,22913,Red Coat Rack Paris Fashion,20.46,1,13136.0,United Kingdom
546079,2023-03-09,22618,Cooking Set Retrospot,20.45,2,14534.0,United Kingdom
546084,2023-03-09,22501,Picnic Basket Wicker Large,20.45,2,14112.0,United Kingdom
546084,2023-03-09,22968,Rose Cottage Keepsake Box,20.45,2,14112.0,United Kingdom
546084,2023-03-09,22776,Sweetheart 3 Tier Cake Stand,20.45,2,14112.0,United Kingdom
546091,2023-03-09,21217,Red Retrospot Round Cake Tins,20.45,2,14936.0,Channel Islands
546091,2023-03-09,22501,Picnic Basket Wicker Large,20.45,2,14936.0,Channel Islands
546092,2023-03-09,22167,Oval Wall Mirror Diamante,20.45,1,17138.0,United Kingdom
546092,2023-03-09,22968,Rose Cottage Keepsake Box,20.45,2,17138.0,United Kingdom
546096,2023-03-09,22501,Picnic Basket Wicker Large,20.45,2,15502.0,United Kingdom
546096,2023-03-09,22829,Sweetheart Wire Wall Tidy,20.45,2,15502.0,United Kingdom
546100,2023-03-09,22776,Sweetheart 3 Tier Cake Stand,20.45,1,16572.0,United Kingdom
546105,2023-03-09,22061,Large Cake Stand Hanging Strawbery,20.45,1,14662.0,United Kingdom
546116,2023-03-09,22776,Sweetheart 3 Tier Cake Stand,20.45,4,15367.0,United Kingdom
546117,2023-03-09,22768,Family Photo Frame Cornice,20.45,1,16771.0,United Kingdom
546117,2023-03-09,22767,Triple Photo Frame Cornice,20.45,2,16771.0,United Kingdom
546117,2023-03-09,22796,Photo Frame 3 Classic Hanging,20.45,2,16771.0,United Kingdom
546123,2023-03-09,21340,Classic Metal Birdcage Plant Holder,20.45,8,16419.0,United Kingdom
546123,2023-03-09,84974,S/2 Zinc Heart Design Planters,20.45,1,16419.0,United Kingdom
546133,2023-03-09,22634,Childs Breakfast Set Spaceboy,20.45,2,14291.0,United Kingdom
546133,2023-03-09,22635,Childs Breakfast Set Dolly Girl,20.45,2,14291.0,United Kingdom
546133,2023-03-09,22622,Box Of Vintage Alphabet Blocks,20.45,2,14291.0,United Kingdom
C546081,2023-03-09,85116,Black Candelabra T-Light Holder,12.4,-6,15974.0,United Kingdom
C546125,2023-03-09,22697,Green Regency Teacup And Saucer,13.27,-6,16316.0,United Kingdom
C546128,2023-03-09,22726,Alarm Clock Bakelike Green,14.09,-1,15622.0,United Kingdom
C546128,2023-03-09,22842,Biscuit Tin Vintage Red,17.17,-1,15622.0,United Kingdom
C546128,2023-03-09,22840,Round Cake Tin Vintage Red,18.4,-1,15622.0,United Kingdom
C546131,2023-03-09,22978,Pantry Rolling Pin,14.09,-6,16057.0,United Kingdom
C546131,2023-03-09,22841,Round Cake Tin Vintage Green,18.4,-1,16057.0,United Kingdom
C546131,2023-03-09,22720,Set Of 3 Cake Tins Pantry Design,15.32,-1,16057.0,United Kingdom
C546131,2023-03-09,22072,Red Retrospot Tea Cup And Saucer,14.09,-1,16057.0,United Kingdom
C546131,2023-03-09,21539,Red Retrospot Butter Dish,15.32,-1,16057.0,United Kingdom
C546131,2023-03-09,21531,Red Retrospot Sugar Jam Bowl,12.86,-1,16057.0,United Kingdom
C546131,2023-03-09,21218,Red Spotty Biscuit Tin,14.09,-1,16057.0,United Kingdom
C546131,2023-03-09,22776,Sweetheart 3 Tier Cake Stand,20.45,-1,16057.0,United Kingdom
