TransactionNo,Date,ProductNo,ProductName,Price,Quantity,CustomerNo,Country
565932,2023-09-08,22362,Glass Jar Peacock Bath Salts,13.27,1,16418.0,United Kingdom
565932,2023-09-08,22079,Ribbon Reel Hearts Design,11.94,5,16418.0,United Kingdom
565932,2023-09-08,22082,Ribbon Reel Stripes Design,11.94,5,16418.0,United Kingdom
565932,2023-09-08,84947,Antique Silver Tea Glass Engraved,11.53,6,16418.0,United Kingdom
565932,2023-09-08,84949,Silver Hanging T-Light Holder,11.94,6,16418.0,United Kingdom
565932,2023-09-08,23215,Jingle Bell Heart Antique Silver,12.38,1,16418.0,United Kingdom
565932,2023-09-08,21742,Large Round Wicker Platter,16.35,1,16418.0,United Kingdom
565932,2023-09-08,84978,Hanging Heart Jar T-Light Holder,11.53,12,16418.0,United Kingdom
565932,2023-09-08,20793,Blue Tiled Tray,17.17,1,16418.0,United Kingdom
565932,2023-09-08,23321,Small White Heart Of Wicker,11.94,1,16418.0,United Kingdom
565932,2023-09-08,22158,3 Hearts Hanging Decoration Rustic,13.27,3,16418.0,United Kingdom
565932,2023-09-08,23215,Jingle Bell Heart Antique Silver,12.38,2,16418.0,United Kingdom
565932,2023-09-08,20796,Small Blue Provencal Ceramic Ball,11.94,8,16418.0,United Kingdom
565932,2023-09-08,23323,White Wicker Star,12.4,1,16418.0,United Kingdom
565932,2023-09-08,84658,White Stitched Cushion Cover,17.37,1,16418.0,United Kingdom
565932,2023-09-08,85014A,Black/Blue Polkadot Umbrella,16.35,1,16418.0,United Kingdom
565932,2023-09-08,21755,Love Building Block Word,16.66,4,16418.0,United Kingdom
565932,2023-09-08,23410,Curio Cabinet Linen And Lace,18.6,2,16418.0,United Kingdom
565932,2023-09-08,22585,Pack Of 6 Birdy Gift Tags,11.53,6,16418.0,United Kingdom
565932,2023-09-08,21586,Kings Choice Giant Tube Matches,12.86,3,16418.0,United Kingdom
565932,2023-09-08,22795,Sweetheart Recipe Book Stand,17.17,1,16418.0,United Kingdom
565932,2023-09-08,23129,Heart Shaped Holly Wreath,14.5,1,16418.0,United Kingdom
565932,2023-09-08,22766,Photo Frame Cornice,13.27,1,16418.0,United Kingdom
565932,2023-09-08,23322,Large White Heart Of Wicker,13.27,2,16418.0,United Kingdom
565932,2023-09-08,21929,Jumbo Bag Pink Vintage Paisley,6.19,1,16418.0,United Kingdom
565932,2023-09-08,85099F,Jumbo Bag Strawberry,6.19,1,16418.0,United Kingdom
565932,2023-09-08,21928,Jumbo Bag Scandinavian Blue Paisley,6.19,1,16418.0,United Kingdom
565932,2023-09-08,23203,Jumbo Bag Vintage Doily,6.19,3,16418.0,United Kingdom
565932,2023-09-08,23203,Jumbo Bag Vintage Doily,6.19,1,16418.0,United Kingdom
565934,2023-09-08,84879,Assorted Colour Bird Ornament,11.98,24,18222.0,United Kingdom
565934,2023-09-08,21212,Pack Of 72 Retrospot Cake Cases,10.81,24,18222.0,United Kingdom
565934,2023-09-08,22333,Retrospot Party Bag + Sticker Set,11.94,8,18222.0,United Kingdom
565934,2023-09-08,22266,Easter Decoration Hanging Bunny,10.44,64,18222.0,United Kingdom
565934,2023-09-08,21385,Ivory Hanging Decoration Heart,11.12,24,18222.0,United Kingdom
565934,2023-09-08,22693,Grow A Flytrap Or Sunflower In Tin,11.53,24,18222.0,United Kingdom
565934,2023-09-08,20749,Assorted Colour Mini Cases,18.4,2,18222.0,United Kingdom
565934,2023-09-08,23310,Bubblegum Ring Assorted,10.68,36,18222.0,United Kingdom
565934,2023-09-08,22138,Baking Set 9 Piece Retrospot,15.32,3,18222.0,United Kingdom
565934,2023-09-08,22906,12 Message Cards With Envelopes,11.94,12,18222.0,United Kingdom
565934,2023-09-08,22705,Wrap Green Pears,10.68,25,18222.0,United Kingdom
565934,2023-09-08,22866,Hand Warmer Scotty Dog Design,12.4,12,18222.0,United Kingdom
565934,2023-09-08,22865,Hand Warmer Owl Design,12.4,12,18222.0,United Kingdom
565934,2023-09-08,22867,Hand Warmer Bird Design,12.4,12,18222.0,United Kingdom
565934,2023-09-08,85123A,Cream Hanging Heart T-Light Holder,13.27,12,18222.0,United Kingdom
565934,2023-09-08,22295,Heart Filigree Dove Large,11.94,12,18222.0,United Kingdom
565934,2023-09-08,21136,Painted Metal Pears Assorted,11.98,24,18222.0,United Kingdom
565936,2023-09-08,22573,Star Wooden Christmas Decoration,10.99,576,15653.0,United Kingdom
565936,2023-09-08,22601,Christmas Retrospot Angel Wood,10.99,576,15653.0,United Kingdom
565937,2023-09-08,23433,Hanging Quilted Patchwork Apples,11.1,12,13468.0,United Kingdom
565937,2023-09-08,23432,Pretty Hanging Quilted Hearts,11.1,12,13468.0,United Kingdom
565937,2023-09-08,84356,Pompom Curtain,17.37,4,13468.0,United Kingdom
565937,2023-09-08,23426,Metal Sign Drop Your Pants,13.21,6,13468.0,United Kingdom
565937,2023-09-08,23408,Photo Frame Linen And Lace Small,12.38,6,13468.0,United Kingdom
565937,2023-09-08,20829,Glitter Hanging Butterfly String,12.4,8,13468.0,United Kingdom
565937,2023-09-08,23401,Rustic Mirror With Lace Heart,16.66,2,13468.0,United Kingdom
565967,2023-09-08,23243,Set Of Tea Coffee Sugar Tins Pantry,14.5,24,14646.0,Netherlands
565967,2023-09-08,22989,Set 2 Pantry Design Tea Towels,13.58,6,14646.0,Netherlands
565967,2023-09-08,22367,Childrens Apron Spaceboy Design,11.94,50,14646.0,Netherlands
565967,2023-09-08,21121,Set/10 Red Polkadot Party Candles,11.53,48,14646.0,Netherlands
565967,2023-09-08,22898,Childrens Apron Apples Design,11.94,50,14646.0,Netherlands
565967,2023-09-08,22659,Lunch Box I Love London,12.25,12,14646.0,Netherlands
565967,2023-09-08,21559,Strawberry Lunch Box With Cutlery,12.86,6,14646.0,Netherlands
565967,2023-09-08,22329,Round Container Set Of 5 Retrospot,11.94,12,14646.0,Netherlands
565967,2023-09-08,23289,Dolly Girl Childrens Bowl,11.53,24,14646.0,Netherlands
565967,2023-09-08,23291,Dolly Girl Childrens Cup,11.53,24,14646.0,Netherlands
565967,2023-09-08,23290,Spaceboy Childrens Bowl,11.53,24,14646.0,Netherlands
565967,2023-09-08,23292,Spaceboy Childrens Cup,11.53,24,14646.0,Netherlands
565967,2023-09-08,20750,Red Retrospot Mini Cases,16.76,12,14646.0,Netherlands
565967,2023-09-08,23108,Set Of 10 Led Dolly Lights,15.77,12,14646.0,Netherlands
565967,2023-09-08,21430,Set/3 Red Gingham Rose Storage Box,14.09,4,14646.0,Netherlands
565967,2023-09-08,21428,Set3 Book Box Green Gingham Flower,14.61,4,14646.0,Netherlands
565967,2023-09-08,21918,Set 12 Kids Colour Chalk Sticks,10.68,24,14646.0,Netherlands
565967,2023-09-08,21481,Fawn Blue Hot Water Bottle,14.09,12,14646.0,Netherlands
565967,2023-09-08,22556,Plasters In Tin Circus Parade,11.94,12,14646.0,Netherlands
565967,2023-09-08,22652,Travel Sewing Kit,11.94,30,14646.0,Netherlands
565967,2023-09-08,22653,Button Box,12.25,20,14646.0,Netherlands
565967,2023-09-08,22624,Ivory Kitchen Scales,18.09,12,14646.0,Netherlands
565967,2023-09-08,22625,Red Kitchen Scales,18.09,12,14646.0,Netherlands
565967,2023-09-08,22626,Black Kitchen Scales,18.96,2,14646.0,Netherlands
565967,2023-09-08,22956,36 Foil Heart Cake Cases,12.15,48,14646.0,Netherlands
565967,2023-09-08,20752,Blue Polkadot Washing Up Gloves,12.4,12,14646.0,Netherlands
565967,2023-09-08,20754,Retrospot Red Washing Up Gloves,12.4,12,14646.0,Netherlands
565967,2023-09-08,21240,Blue Polkadot Cup,11.12,8,14646.0,Netherlands
565967,2023-09-08,20674,Green Polkadot Bowl,11.53,16,14646.0,Netherlands
565967,2023-09-08,20675,Blue Polkadot Bowl,11.53,8,14646.0,Netherlands
565967,2023-09-08,20677,Pink Polkadot Bowl,11.53,24,14646.0,Netherlands
565967,2023-09-08,21035,Set/2 Red Retrospot Tea Towels,13.58,18,14646.0,Netherlands
565967,2023-09-08,22895,Set Of 2 Tea Towels Apple And Pears,13.58,24,14646.0,Netherlands
565967,2023-09-08,22667,Recipe Box Retrospot,12.86,24,14646.0,Netherlands
565967,2023-09-08,21094,Set/6 Red Spotty Paper Plates,11.12,36,14646.0,Netherlands
565967,2023-09-08,21086,Set/6 Red Spotty Paper Cups,10.92,36,14646.0,Netherlands
565967,2023-09-08,21987,Pack Of 6 Skull Paper Cups,10.92,36,14646.0,Netherlands
565967,2023-09-08,21989,Pack Of 20 Skull Paper Napkins,11.12,24,14646.0,Netherlands
565967,2023-09-08,23306,Set Of 36 Pantry Paper Doilies,11.74,12,14646.0,Netherlands
565967,2023-09-08,21212,Pack Of 72 Retrospot Cake Cases,10.81,24,14646.0,Netherlands
565967,2023-09-08,21977,Pack Of 60 Pink Paisley Cake Cases,10.81,24,14646.0,Netherlands
565967,2023-09-08,21670,Blue Spot Ceramic Drawer Knob,11.74,12,14646.0,Netherlands
565967,2023-09-08,22467,Gumball Coat Rack,12.4,36,14646.0,Netherlands
565967,2023-09-08,22244,3 Hook Hanger Magic Garden,12.25,12,14646.0,Netherlands
565967,2023-09-08,22028,Penny Farthing Birthday Card,10.68,12,14646.0,Netherlands
565967,2023-09-08,20713,Jumbo Bag Owls,6.19,10,14646.0,Netherlands
565967,2023-09-08,22386,Jumbo Bag Pink Polkadot,6.19,20,14646.0,Netherlands
565967,2023-09-08,20711,Jumbo Bag Toys,6.19,20,14646.0,Netherlands
565967,2023-09-08,23344,Jumbo Bag 50'S Christmas,6.19,20,14646.0,Netherlands
565967,2023-09-08,20727,Lunch Bag Black Skull,5.97,20,14646.0,Netherlands
565971,2023-09-08,22222,Cake Plate Lovebird White,15.32,2,13571.0,United Kingdom
565971,2023-09-08,21794,Classic French Style Basket Natural,14.3,3,13571.0,United Kingdom
565971,2023-09-08,23271,Christmas Table Silver Candle Spike,11.1,6,13571.0,United Kingdom
565971,2023-09-08,23322,Large White Heart Of Wicker,13.27,4,13571.0,United Kingdom
565971,2023-09-08,23321,Small White Heart Of Wicker,11.94,2,13571.0,United Kingdom
565971,2023-09-08,85152,Hand Over The Chocolate Sign,12.4,3,13571.0,United Kingdom
565971,2023-09-08,82583,Hot Baths Metal Sign,12.4,2,13571.0,United Kingdom
565971,2023-09-08,82582,Area Patrolled Metal Sign,12.4,2,13571.0,United Kingdom
565971,2023-09-08,21169,You're Confusing Me Metal Sign,11.98,1,13571.0,United Kingdom
565971,2023-09-08,22682,French Blue Metal Door Sign 7,11.53,1,13571.0,United Kingdom
565971,2023-09-08,21181,Please One Person Metal Sign,12.4,6,13571.0,United Kingdom
565971,2023-09-08,21908,Chocolate This Way Metal Sign,12.4,2,13571.0,United Kingdom
565971,2023-09-08,21365,Mirrored Wall Art Stars,11.02,5,13571.0,United Kingdom
565971,2023-09-08,21733,Red Hanging Heart T-Light Holder,13.27,4,13571.0,United Kingdom
565971,2023-09-08,22086,Paper Chain Kit 50'S Christmas,13.27,3,13571.0,United Kingdom
565971,2023-09-08,21169,You're Confusing Me Metal Sign,11.98,5,13571.0,United Kingdom
565971,2023-09-08,22197,Popcorn Holder,11.12,10,13571.0,United Kingdom
565971,2023-09-08,22412,Metal Sign Neighbourhood Witch,12.4,4,13571.0,United Kingdom
565971,2023-09-08,23307,Set Of 60 Pantry Design Cake Cases,10.81,4,13571.0,United Kingdom
565971,2023-09-08,23293,Set Of 12 Fairy Cake Baking Cases,11.1,8,13571.0,United Kingdom
565971,2023-09-08,22910,Paper Chain Kit Vintage Christmas,13.27,3,13571.0,United Kingdom
565971,2023-09-08,22567,20 Dolly Pegs Retrospot,11.74,2,13571.0,United Kingdom
565971,2023-09-08,23004,Travel Card Wallet Pantry,10.68,1,13571.0,United Kingdom
565971,2023-09-08,22993,Set Of 4 Pantry Jelly Moulds,11.53,6,13571.0,United Kingdom
565971,2023-09-08,22099,Caravan Square Tissue Box,10.65,5,13571.0,United Kingdom
565971,2023-09-08,23296,Set Of 6 Tea Time Baking Cases,11.53,8,13571.0,United Kingdom
565971,2023-09-08,23295,Set Of 12 Mini Loaf Baking Cases,11.1,8,13571.0,United Kingdom
565971,2023-09-08,23294,Set Of 6 Snack Loaf Baking Cases,11.1,8,13571.0,United Kingdom
565971,2023-09-08,21931,Jumbo Storage Bag Suki,12.38,3,13571.0,United Kingdom
565971,2023-09-08,22355,Charlotte Bag Suki Design,11.12,6,13571.0,United Kingdom
565971,2023-09-08,20719,Woodland Charlotte Bag,11.12,3,13571.0,United Kingdom
565971,2023-09-08,23205,Charlotte Bag Vintage Alphabet,11.12,3,13571.0,United Kingdom
565971,2023-09-08,22356,Charlotte Bag Pink Polkadot,11.12,3,13571.0,United Kingdom
565971,2023-09-08,22091,Empire Tissue Box,10.65,7,13571.0,United Kingdom
565971,2023-09-08,22093,Motoring Tissue Box,10.65,10,13571.0,United Kingdom
565971,2023-09-08,85014A,Black/Blue Polkadot Umbrella,16.35,2,13571.0,United Kingdom
565971,2023-09-08,85014B,Red Retrospot Umbrella,16.35,2,13571.0,United Kingdom
565971,2023-09-08,23343,Jumbo Bag Vintage Christmas,6.19,3,13571.0,United Kingdom
565971,2023-09-08,23344,Jumbo Bag 50'S Christmas,6.19,3,13571.0,United Kingdom
565971,2023-09-08,20712,Jumbo Bag Woodland Animals,6.19,2,13571.0,United Kingdom
565971,2023-09-08,21929,Jumbo Bag Pink Vintage Paisley,6.19,2,13571.0,United Kingdom
565971,2023-09-08,23201,Jumbo Bag Alphabet,6.19,2,13571.0,United Kingdom
565971,2023-09-08,85099C,Jumbo Bag Baroque Black White,6.19,2,13571.0,United Kingdom
565971,2023-09-08,23203,Jumbo Bag Vintage Doily,6.19,3,13571.0,United Kingdom
565971,2023-09-08,85099B,Jumbo Bag Red Retrospot,6.19,3,13571.0,United Kingdom
565975,2023-09-08,23392,Spaceboy Rocket Lolly Makers,12.38,1,14646.0,Netherlands
565990,2023-09-08,23232,Wrap Vintage Leaf Design,10.68,25,13577.0,United Kingdom
565990,2023-09-08,21498,Red Retrospot Wrap,10.68,25,13577.0,United Kingdom
565990,2023-09-08,23204,Charlotte Bag Apples Design,11.12,10,13577.0,United Kingdom
565990,2023-09-08,20724,Red Retrospot Charlotte Bag,11.12,20,13577.0,United Kingdom
565990,2023-09-08,20723,Strawberry Charlotte Bag,11.12,10,13577.0,United Kingdom
565990,2023-09-08,22355,Charlotte Bag Suki Design,11.12,10,13577.0,United Kingdom
565990,2023-09-08,23205,Charlotte Bag Vintage Alphabet,11.12,10,13577.0,United Kingdom
565990,2023-09-08,22661,Charlotte Bag Dolly Girl Design,11.12,10,13577.0,United Kingdom
565990,2023-09-08,22411,Jumbo Shopper Vintage Red Paisley,12.38,10,13577.0,United Kingdom
565990,2023-09-08,21931,Jumbo Storage Bag Suki,12.38,10,13577.0,United Kingdom
565990,2023-09-08,23200,Jumbo Bag Pears,6.19,10,13577.0,United Kingdom
565990,2023-09-08,85099B,Jumbo Bag Red Retrospot,6.19,20,13577.0,United Kingdom
565990,2023-09-08,22386,Jumbo Bag Pink Polkadot,6.19,10,13577.0,United Kingdom
565990,2023-09-08,85099C,Jumbo Bag Baroque Black White,6.19,10,13577.0,United Kingdom
565990,2023-09-08,23203,Jumbo Bag Vintage Doily,6.19,10,13577.0,United Kingdom
565990,2023-09-08,23202,Jumbo Bag Vintage Leaf,6.19,10,13577.0,United Kingdom
565990,2023-09-08,21928,Jumbo Bag Scandinavian Blue Paisley,6.19,10,13577.0,United Kingdom
565990,2023-09-08,21929,Jumbo Bag Pink Vintage Paisley,6.19,10,13577.0,United Kingdom
565990,2023-09-08,85099F,Jumbo Bag Strawberry,6.19,10,13577.0,United Kingdom
565990,2023-09-08,23201,Jumbo Bag Alphabet,6.19,10,13577.0,United Kingdom
565990,2023-09-08,22663,Jumbo Bag Dolly Girl Design,6.19,10,13577.0,United Kingdom
565993,2023-09-08,22321,Bird Decoration Red Retrospot,11.12,24,13013.0,United Kingdom
565993,2023-09-08,22176,Blue Owl Soft Toy,13.27,6,13013.0,United Kingdom
565993,2023-09-08,22175,Pink Owl Soft Toy,13.27,6,13013.0,United Kingdom
565993,2023-09-08,85014B,Red Retrospot Umbrella,16.35,3,13013.0,United Kingdom
565993,2023-09-08,21041,Red Retrospot Oven Glove Double,13.27,6,13013.0,United Kingdom
565993,2023-09-08,21116,Owl Doorstop,15.32,6,13013.0,United Kingdom
565993,2023-09-08,21624,Vintage Union Jack Doorstop,16.35,3,13013.0,United Kingdom
565993,2023-09-08,22114,Hot Water Bottle Tea And Sympathy,14.61,8,13013.0,United Kingdom
565993,2023-09-08,84029G,Knitted Union Flag Hot Water Bottle,14.61,12,13013.0,United Kingdom
565993,2023-09-08,22835,Hot Water Bottle I Am So Poorly,15.32,8,13013.0,United Kingdom
565994,2023-09-08,22914,Blue Coat Rack Paris Fashion,15.32,1,13244.0,United Kingdom
565994,2023-09-08,82552,Washroom Metal Sign,11.74,1,13244.0,United Kingdom
565994,2023-09-08,23249,Vintage Red Enamel Trim Plate,11.94,2,13244.0,United Kingdom
565994,2023-09-08,23252,Vintage Red Enamel Trim Jug,14.09,1,13244.0,United Kingdom
565994,2023-09-08,21086,Set/6 Red Spotty Paper Cups,10.92,3,13244.0,United Kingdom
565994,2023-09-08,22925,Blue Giant Garden Thermometer,16.35,1,13244.0,United Kingdom
565994,2023-09-08,21621,Vintage Union Jack Bunting,18.96,1,13244.0,United Kingdom
565994,2023-09-08,23342,Mint Diner Wall Clock,18.96,1,13244.0,United Kingdom
565994,2023-09-08,37500,Tea Time Teapot In Gift Box,15.32,1,13244.0,United Kingdom
565994,2023-09-08,21974,Set Of 36 Paisley Flower Doilies,11.74,1,13244.0,United Kingdom
565994,2023-09-08,84969,Box Of 6 Assorted Colour Teaspoons,14.61,1,13244.0,United Kingdom
565994,2023-09-08,22090,Paper Bunting Retrospot,13.27,2,13244.0,United Kingdom
565994,2023-09-08,22989,Set 2 Pantry Design Tea Towels,13.58,1,13244.0,United Kingdom
565994,2023-09-08,22699,Roses Regency Teacup And Saucer,13.27,2,13244.0,United Kingdom
565994,2023-09-08,23172,Regency Tea Plate Pink,11.94,2,13244.0,United Kingdom
565994,2023-09-08,23171,Regency Tea Plate Green,11.94,2,13244.0,United Kingdom
565994,2023-09-08,23170,Regency Tea Plate Roses,11.94,2,13244.0,United Kingdom
565994,2023-09-08,23163,Regency Sugar Tongs,12.8,1,13244.0,United Kingdom
565994,2023-09-08,23164,Regency Cake Slice,15.32,1,13244.0,United Kingdom
565994,2023-09-08,22698,Pink Regency Teacup And Saucer,13.27,2,13244.0,United Kingdom
565994,2023-09-08,22697,Green Regency Teacup And Saucer,13.27,2,13244.0,United Kingdom
565994,2023-09-08,21528,Dairy Maid Traditional Teapot,17.37,1,13244.0,United Kingdom
565994,2023-09-08,22309,Tea Cosy Red Stripe,12.86,1,13244.0,United Kingdom
565994,2023-09-08,22907,Pack Of 20 Napkins Pantry Design,11.12,2,13244.0,United Kingdom
565994,2023-09-08,23175,Regency Milk Jug Pink,13.58,1,13244.0,United Kingdom
565994,2023-09-08,23174,Regency Sugar Bowl Green,14.5,1,13244.0,United Kingdom
565995,2023-09-08,22960,Jam Making Set With Jars,14.61,2,16076.0,United Kingdom
565995,2023-09-08,22617,Baking Set Spaceboy Design,15.32,5,16076.0,United Kingdom
565995,2023-09-08,21914,Blue Harmonica In Box,11.53,12,16076.0,United Kingdom
565995,2023-09-08,21915,Red Harmonica In Box,11.53,12,16076.0,United Kingdom
565995,2023-09-08,22090,Paper Bunting Retrospot,13.27,3,16076.0,United Kingdom
565995,2023-09-08,22150,3 Stripey Mice Feltcraft,12.25,3,16076.0,United Kingdom
565995,2023-09-08,21790,Vintage Snap Cards,11.12,48,16076.0,United Kingdom
565995,2023-09-08,21922,Union Stripe With Fringe Hammock,18.4,1,16076.0,United Kingdom
565995,2023-09-08,21888,Bingo Set,14.09,2,16076.0,United Kingdom
565995,2023-09-08,22457,Natural Slate Heart Chalkboard,13.27,2,16076.0,United Kingdom
565995,2023-09-08,21169,You're Confusing Me Metal Sign,11.98,1,16076.0,United Kingdom
565995,2023-09-08,22413,Metal Sign Take It Or Leave It,13.27,1,16076.0,United Kingdom
565995,2023-09-08,82551,Laundry 15c Metal Sign,11.74,2,16076.0,United Kingdom
565995,2023-09-08,85150,Ladies & Gentlemen Metal Sign,12.86,1,16076.0,United Kingdom
565995,2023-09-08,21172,Party Metal Sign,11.74,2,16076.0,United Kingdom
565995,2023-09-08,21171,Bathroom Metal Sign,10.81,2,16076.0,United Kingdom
565995,2023-09-08,82578,Kitchen Metal Sign,10.81,2,16076.0,United Kingdom
565995,2023-09-08,82581,Toilet Metal Sign,10.81,2,16076.0,United Kingdom
565995,2023-09-08,22621,Traditional Knitting Nancy,11.94,3,16076.0,United Kingdom
565995,2023-09-08,23298,Spotty Bunting,15.32,2,16076.0,United Kingdom
565995,2023-09-08,21889,Wooden Box Of Dominoes,11.53,12,16076.0,United Kingdom
565995,2023-09-08,85123A,Cream Hanging Heart T-Light Holder,13.27,2,16076.0,United Kingdom
565995,2023-09-08,22865,Hand Warmer Owl Design,12.4,2,16076.0,United Kingdom
565995,2023-09-08,22867,Hand Warmer Bird Design,12.4,2,16076.0,United Kingdom
565995,2023-09-08,22139,Retrospot Tea Set Ceramic 11 Pc,15.32,4,16076.0,United Kingdom
565995,2023-09-08,22619,Set Of 6 Soldier Skittles,14.09,6,16076.0,United Kingdom
565995,2023-09-08,21790,Vintage Snap Cards,11.12,24,16076.0,United Kingdom
565995,2023-09-08,21705,Bag 500g Swirly Marbles,11.94,24,16076.0,United Kingdom
565995,2023-09-08,23301,Gardeners Kneeling Pad Keep Calm,11.94,24,16076.0,United Kingdom
565995,2023-09-08,22138,Baking Set 9 Piece Retrospot,15.32,12,16076.0,United Kingdom
565995,2023-09-08,23208,Lunch Bag Vintage Leaf Design,5.97,2,16076.0,United Kingdom
565995,2023-09-08,23207,Lunch Bag Alphabet Design,5.97,2,16076.0,United Kingdom
565995,2023-09-08,22382,Lunch Bag Spaceboy Design,5.97,2,16076.0,United Kingdom
565995,2023-09-08,20725,Lunch Bag Red Retrospot,5.97,2,16076.0,United Kingdom
565995,2023-09-08,20728,Lunch Bag Cars Blue,5.97,2,16076.0,United Kingdom
566001,2023-09-08,22112,Chocolate Hot Water Bottle,15.32,1,13700.0,United Kingdom
566001,2023-09-08,22563,Happy Stencil Craft,11.53,3,13700.0,United Kingdom
566001,2023-09-08,22211,Wood Stamp Set Flowers,11.1,3,13700.0,United Kingdom
566001,2023-09-08,21640,Assorted Tutti Frutti Fob Notebook,11.12,3,13700.0,United Kingdom
566001,2023-09-08,21872,Glamorous Mug,11.53,1,13700.0,United Kingdom
566005,2023-09-08,84660A,White Stitched Wall Clock,11.06,12,16426.0,United Kingdom
566005,2023-09-08,84660C,Pink Stitched Wall Clock,11.06,1,16426.0,United Kingdom
566005,2023-09-08,22469,Heart Of Wicker Small,11.94,2,16426.0,United Kingdom
566005,2023-09-08,23321,Small White Heart Of Wicker,11.94,4,16426.0,United Kingdom
566005,2023-09-08,21179,No Junk Mail Metal Sign,10.65,8,16426.0,United Kingdom
566005,2023-09-08,22412,Metal Sign Neighbourhood Witch,12.4,4,16426.0,United Kingdom
566005,2023-09-08,82583,Hot Baths Metal Sign,12.4,2,16426.0,United Kingdom
566005,2023-09-08,21166,Cook With Wine Metal Sign,12.38,3,16426.0,United Kingdom
566005,2023-09-08,82552,Washroom Metal Sign,11.74,1,16426.0,United Kingdom
566005,2023-09-08,85071A,Blue Charlie+Lola Personal Doorsign,10.65,12,16426.0,United Kingdom
566005,2023-09-08,85071B,Red Charlie+Lola Personal Doorsign,10.65,12,16426.0,United Kingdom
566005,2023-09-08,23323,White Wicker Star,12.4,4,16426.0,United Kingdom
566005,2023-09-08,22694,Wicker Star,12.4,2,16426.0,United Kingdom
566005,2023-09-08,22467,Gumball Coat Rack,12.86,3,16426.0,United Kingdom
566005,2023-09-08,23129,Heart Shaped Holly Wreath,14.5,2,16426.0,United Kingdom
566005,2023-09-08,23403,Letter Holder Home Sweet Home,14.09,4,16426.0,United Kingdom
566005,2023-09-08,23400,Shelf With 4 Hooks Home Sweet Home,16.66,4,16426.0,United Kingdom
566005,2023-09-08,22371,Airline Bag Vintage Tokyo 78,14.61,2,16426.0,United Kingdom
566005,2023-09-08,22666,Recipe Box Pantry Yellow Design,13.27,2,16426.0,United Kingdom
566005,2023-09-08,22665,Recipe Box Blue Sketchbook Design,13.27,2,16426.0,United Kingdom
566006,2023-09-08,22219,Lovebird Hanging Decoration White,11.12,12,13018.0,United Kingdom
566006,2023-09-08,22469,Heart Of Wicker Small,11.94,12,13018.0,United Kingdom
566006,2023-09-08,23322,Large White Heart Of Wicker,13.27,6,13018.0,United Kingdom
566006,2023-09-08,20982,12 Pencils Tall Tube Skulls,11.12,12,13018.0,United Kingdom
566006,2023-09-08,22142,Christmas Craft White Fairy,11.74,12,13018.0,United Kingdom
566006,2023-09-08,22141,Christmas Craft Tree Top Angel,12.4,6,13018.0,United Kingdom
566006,2023-09-08,22144,Christmas Craft Little Friends,12.4,6,13018.0,United Kingdom
566006,2023-09-08,22694,Wicker Star,12.4,6,13018.0,United Kingdom
566006,2023-09-08,22338,Star Decoration Painted Zinc,10.92,24,13018.0,United Kingdom
566006,2023-09-08,23221,Reindeer Heart Decoration Silver,11.1,12,13018.0,United Kingdom
566006,2023-09-08,23223,Christmas Tree Hanging Silver,11.1,12,13018.0,United Kingdom
566006,2023-09-08,23225,Cherub Heart Decoration Silver,11.1,12,13018.0,United Kingdom
566006,2023-09-08,22574,Heart Wooden Christmas Decoration,11.12,12,13018.0,United Kingdom
566006,2023-09-08,23263,Set Of 3 Wooden Heart Decorations,11.53,12,13018.0,United Kingdom
566006,2023-09-08,22147,Feltcraft Butterfly Hearts,11.74,12,13018.0,United Kingdom
566006,2023-09-08,23326,Hanging Mini Coloured Bottles,10.9,48,13018.0,United Kingdom
566006,2023-09-08,23334,Ivory Wicker Heart Small,10.9,48,13018.0,United Kingdom
566006,2023-09-08,23399,Home Sweet Home Hanging Heart,11.12,12,13018.0,United Kingdom
566006,2023-09-08,23333,Ivory Wicker Heart Medium,11.53,12,13018.0,United Kingdom
566008,2023-09-08,23322,Large White Heart Of Wicker,13.27,5,16426.0,United Kingdom
566008,2023-09-08,22470,Heart Of Wicker Large,13.27,3,16426.0,United Kingdom
566008,2023-09-08,82551,Laundry 15c Metal Sign,11.74,1,16426.0,United Kingdom
566008,2023-09-08,82552,Washroom Metal Sign,11.74,1,16426.0,United Kingdom
566008,2023-09-08,21166,Cook With Wine Metal Sign,12.38,1,16426.0,United Kingdom
566008,2023-09-08,21179,No Junk Mail Metal Sign,10.65,8,16426.0,United Kingdom
566008,2023-09-08,21163,Do Not Touch My Stuff Door Hanger,10.65,5,16426.0,United Kingdom
566008,2023-09-08,21162,Toxic Area Door Hanger,10.65,4,16426.0,United Kingdom
566008,2023-09-08,21158,Moody Girl Door Hanger,10.65,4,16426.0,United Kingdom
566008,2023-09-08,85071A,Blue Charlie+Lola Personal Doorsign,10.65,4,16426.0,United Kingdom
566008,2023-09-08,85071B,Red Charlie+Lola Personal Doorsign,10.65,4,16426.0,United Kingdom
566008,2023-09-08,22412,Metal Sign Neighbourhood Witch,12.4,1,16426.0,United Kingdom
566008,2023-09-08,20657,Tropical Luggage Tag,11.53,1,16426.0,United Kingdom
566008,2023-09-08,21866,Union Jack Flag Luggage Tag,11.53,2,16426.0,United Kingdom
566008,2023-09-08,20652,Blue Polkadot Luggage Tag,11.53,2,16426.0,United Kingdom
566008,2023-09-08,21864,Union Jack Flag Passport Cover,12.4,2,16426.0,United Kingdom
566008,2023-09-08,20615,Blue Polkadot Passport Cover,11.02,2,16426.0,United Kingdom
566008,2023-09-08,20622,Vip Passport Cover,12.4,2,16426.0,United Kingdom
566008,2023-09-08,20617,First Class Passport Cover,12.4,2,16426.0,United Kingdom
566008,2023-09-08,20654,First Class Luggage Tag,11.53,2,16426.0,United Kingdom
566008,2023-09-08,22411,Jumbo Shopper Vintage Red Paisley,12.38,2,16426.0,United Kingdom
566008,2023-09-08,22433,Watering Can Green Dinosaur,12.25,1,16426.0,United Kingdom
566008,2023-09-08,22432,Watering Can Pink Bunny,12.25,1,16426.0,United Kingdom
566008,2023-09-08,22371,Airline Bag Vintage Tokyo 78,14.61,2,16426.0,United Kingdom
566008,2023-09-08,22376,Airline Bag Vintage Jet Set White,14.61,2,16426.0,United Kingdom
566008,2023-09-08,22375,Airline Bag Vintage Jet Set Brown,14.61,2,16426.0,United Kingdom
566008,2023-09-08,22553,Plasters In Tin Skulls,11.94,1,16426.0,United Kingdom
566008,2023-09-08,22556,Plasters In Tin Circus Parade,11.94,1,16426.0,United Kingdom
566008,2023-09-08,22551,Plasters In Tin Spaceboy,11.94,1,16426.0,United Kingdom
566008,2023-09-08,22557,Plasters In Tin Vintage Paisley,11.94,1,16426.0,United Kingdom
