TransactionNo,Date,ProductNo,ProductName,Price,Quantity,CustomerNo,Country
560534,2023-07-19,22197,Popcorn Holder,11.12,12,14911.0,EIRE
560534,2023-07-19,84077,World War 2 Gliders Asstd Designs,10.55,48,14911.0,EIRE
560534,2023-07-19,21912,Vintage Snakes & Ladders,14.09,4,14911.0,EIRE
560534,2023-07-19,23202,Jumbo Bag Vintage Leaf,6.19,10,14911.0,EIRE
560534,2023-07-19,22821,Gift Bag Psychedelic Apples,5.46,12,14911.0,EIRE
560535,2023-07-19,17003,Brocade Ring Purse,10.55,144,13167.0,United Kingdom
560535,2023-07-19,22759,Set Of 3 Notebooks In Parcel,11.94,12,13167.0,United Kingdom
560535,2023-07-19,23298,Spotty Bunting,15.32,5,13167.0,United Kingdom
560535,2023-07-19,22985,Wrap Billboard Fonts Design,10.68,50,13167.0,United Kingdom
560535,2023-07-19,21634,Assorted Mini Madras Notebook,10.65,96,13167.0,United Kingdom
560535,2023-07-19,82486,3 Drawer Antique White Wood Cabinet,19.42,2,13167.0,United Kingdom
560535,2023-07-19,22170,Picture Frame Wood Triple Portrait,17.17,2,13167.0,United Kingdom
560535,2023-07-19,23089,Glass Bon Bon Jar,11.94,6,13167.0,United Kingdom
560535,2023-07-19,82483,Wood 2 Drawer Cabinet White Finish,17.37,2,13167.0,United Kingdom
560535,2023-07-19,22792,Fluted Antique Candle Holder,11.12,12,13167.0,United Kingdom
560535,2023-07-19,21326,Aged Glass Silver T-Light Holder,10.92,12,13167.0,United Kingdom
560535,2023-07-19,22178,Victorian Glass Hanging T-Light,11.53,12,13167.0,United Kingdom
560535,2023-07-19,23090,Vintage Glass T-Light Holder,11.1,12,13167.0,United Kingdom
560536,2023-07-19,84978,Hanging Heart Jar T-Light Holder,11.53,12,16626.0,United Kingdom
560536,2023-07-19,21326,Aged Glass Silver T-Light Holder,10.92,24,16626.0,United Kingdom
560536,2023-07-19,23028,Drawer Knob Crackle Glaze Blue,11.94,12,16626.0,United Kingdom
560536,2023-07-19,23031,Drawer Knob Crackle Glaze Pink,11.94,6,16626.0,United Kingdom
560536,2023-07-19,23032,Drawer Knob Crackle Glaze Ivory,11.94,12,16626.0,United Kingdom
560536,2023-07-19,21417,Cockle Shell Dish,12.4,12,16626.0,United Kingdom
560536,2023-07-19,21755,Love Building Block Word,16.35,3,16626.0,United Kingdom
560537,2023-07-19,22355,Charlotte Bag Suki Design,11.12,10,17779.0,United Kingdom
560537,2023-07-19,20724,Red Retrospot Charlotte Bag,11.12,10,17779.0,United Kingdom
560537,2023-07-19,23066,Small Deco Jewellery Stand,18.71,2,17779.0,United Kingdom
560537,2023-07-19,21122,Set/10 Pink Polkadot Party Candles,11.53,1,17779.0,United Kingdom
560537,2023-07-19,21124,Set/10 Blue Polkadot Party Candles,11.53,2,17779.0,United Kingdom
560537,2023-07-19,21126,Set Of 6 Girls Celebration Candles,11.53,1,17779.0,United Kingdom
560537,2023-07-19,21125,Set 6 Football Celebration Candles,11.53,1,17779.0,United Kingdom
560537,2023-07-19,22398,Magnets Pack Of 4 Swallows,10.65,7,17779.0,United Kingdom
560537,2023-07-19,21484,Chick Grey Hot Water Bottle,13.79,3,17779.0,United Kingdom
560537,2023-07-19,22595,Gingham Heart Decoration,11.12,15,17779.0,United Kingdom
560537,2023-07-19,22469,Heart Of Wicker Small,11.94,6,17779.0,United Kingdom
560537,2023-07-19,21936,Red Retrospot Picnic Bag,13.27,2,17779.0,United Kingdom
560537,2023-07-19,84032B,Charlie + Lola Red Hot Water Bottle,13.27,2,17779.0,United Kingdom
560537,2023-07-19,84032A,Charlie+Lola Pink Hot Water Bottle,13.27,2,17779.0,United Kingdom
560537,2023-07-19,22457,Natural Slate Heart Chalkboard,13.27,4,17779.0,United Kingdom
560537,2023-07-19,84978,Hanging Heart Jar T-Light Holder,11.53,6,17779.0,United Kingdom
560537,2023-07-19,35961,Folkart Zinc Heart Christmas Dec,11.12,12,17779.0,United Kingdom
560537,2023-07-19,20845,Zinc Heart Lattice 2 Wall Planter,16.76,6,17779.0,United Kingdom
560537,2023-07-19,84519B,Carrot Charlie+Lola Coaster Set,11.53,6,17779.0,United Kingdom
560537,2023-07-19,85183B,Charlie & Lola Wastepaper Bin Flora,11.53,12,17779.0,United Kingdom
560537,2023-07-19,23103,Jingle Bell Heart Decoration,11.94,24,17779.0,United Kingdom
560537,2023-07-19,84596F,Small Marshmallows Pink Bowl,10.68,8,17779.0,United Kingdom
560537,2023-07-19,84596B,Small Dolly Mix Design Orange Bowl,10.68,8,17779.0,United Kingdom
560537,2023-07-19,84836,Zinc Metal Heart Decoration,11.53,12,17779.0,United Kingdom
560537,2023-07-19,20992,Jazz Hearts Purse Notebook,10.65,5,17779.0,United Kingdom
560537,2023-07-19,22210,Wood Stamp Set Best Wishes,11.1,9,17779.0,United Kingdom
560537,2023-07-19,22818,Card Christmas Village,10.68,24,17779.0,United Kingdom
560537,2023-07-19,22044,Christmas Card Stack Of Presents,10.68,24,17779.0,United Kingdom
560537,2023-07-19,21993,Floral Folk Stationery Set,11.53,6,17779.0,United Kingdom
560537,2023-07-19,85099B,Jumbo Bag Red Retrospot,6.19,2,17779.0,United Kingdom
560537,2023-07-19,22382,Lunch Bag Spaceboy Design,5.97,5,17779.0,United Kingdom
560537,2023-07-19,20728,Lunch Bag Cars Blue,5.97,5,17779.0,United Kingdom
560537,2023-07-19,23206,Lunch Bag Apple Design,5.97,5,17779.0,United Kingdom
560538,2023-07-19,21907,I'm On Holiday Metal Sign,12.4,12,16128.0,United Kingdom
560538,2023-07-19,21718,Red Metal Beach Spade,11.53,12,16128.0,United Kingdom
560538,2023-07-19,21715,Girls Vintage Tin Seaside Bucket,12.86,8,16128.0,United Kingdom
560538,2023-07-19,21716,Boys Vintage Tin Seaside Bucket,12.86,8,16128.0,United Kingdom
560538,2023-07-19,22274,Feltcraft Doll Emily,13.27,6,16128.0,United Kingdom
560538,2023-07-19,22273,Feltcraft Doll Molly,13.27,6,16128.0,United Kingdom
560538,2023-07-19,20972,Pink Cream Felt Craft Trinket Box,11.53,12,16128.0,United Kingdom
560538,2023-07-19,21507,Elephant Birthday Card,10.68,12,16128.0,United Kingdom
560538,2023-07-19,21509,Cowboys And Indians Birthday Card,10.68,12,16128.0,United Kingdom
560538,2023-07-19,22965,3 Traditional Biscuit Cutters Set,12.4,12,16128.0,United Kingdom
560538,2023-07-19,22961,Jam Making Set Printed,11.74,24,16128.0,United Kingdom
560538,2023-07-19,22960,Jam Making Set With Jars,14.09,12,16128.0,United Kingdom
560538,2023-07-19,22993,Set Of 4 Pantry Jelly Moulds,11.53,12,16128.0,United Kingdom
560538,2023-07-19,21868,Potting Shed Tea Mug,11.53,12,16128.0,United Kingdom
560538,2023-07-19,23296,Set Of 6 Tea Time Baking Cases,11.53,8,16128.0,United Kingdom
560538,2023-07-19,23294,Set Of 6 Snack Loaf Baking Cases,11.1,8,16128.0,United Kingdom
560538,2023-07-19,23293,Set Of 12 Fairy Cake Baking Cases,11.1,8,16128.0,United Kingdom
560538,2023-07-19,23295,Set Of 12 Mini Loaf Baking Cases,11.1,8,16128.0,United Kingdom
560539,2023-07-19,21930,Jumbo Storage Bag Skulls,12.38,10,16745.0,United Kingdom
560539,2023-07-19,21155,Red Retrospot Peg Bag,12.86,5,16745.0,United Kingdom
560539,2023-07-19,22961,Jam Making Set Printed,11.74,10,16745.0,United Kingdom
560539,2023-07-19,21218,Red Spotty Biscuit Tin,14.09,6,16745.0,United Kingdom
560539,2023-07-19,82578,Kitchen Metal Sign,10.81,25,16745.0,United Kingdom
560539,2023-07-19,21179,No Junk Mail Metal Sign,10.65,12,16745.0,United Kingdom
560539,2023-07-19,21171,Bathroom Metal Sign,10.81,25,16745.0,United Kingdom
560539,2023-07-19,22131,Food Container Set 3 Love Heart,12.25,5,16745.0,United Kingdom
560539,2023-07-19,22908,Pack Of 20 Napkins Red Apples,11.12,1,16745.0,United Kingdom
560539,2023-07-19,21175,Gin And Tonic Diet Metal Sign,12.86,5,16745.0,United Kingdom
560539,2023-07-19,23321,Small White Heart Of Wicker,11.94,10,16745.0,United Kingdom
560539,2023-07-19,21212,Pack Of 72 Retrospot Cake Cases,10.81,48,16745.0,United Kingdom
560539,2023-07-19,21213,Pack Of 72 Skull Cake Cases,10.81,48,16745.0,United Kingdom
560539,2023-07-19,84992,72 Sweetheart Fairy Cake Cases,10.81,48,16745.0,United Kingdom
560539,2023-07-19,21975,Pack Of 60 Dinosaur Cake Cases,10.81,48,16745.0,United Kingdom
560539,2023-07-19,22960,Jam Making Set With Jars,14.61,4,16745.0,United Kingdom
560539,2023-07-19,21216,Set 3 Retrospot Tea/Coffee/Sugar,14.61,24,16745.0,United Kingdom
560539,2023-07-19,85099B,Jumbo Bag Red Retrospot,6.19,10,16745.0,United Kingdom
560539,2023-07-19,22386,Jumbo Bag Pink Polkadot,6.19,10,16745.0,United Kingdom
560539,2023-07-19,20712,Jumbo Bag Woodland Animals,6.19,10,16745.0,United Kingdom
560539,2023-07-19,85099F,Jumbo Bag Strawberry,6.19,10,16745.0,United Kingdom
560539,2023-07-19,23203,Jumbo Bag Vintage Doily,6.19,10,16745.0,United Kingdom
560539,2023-07-19,23199,Jumbo Bag Apples,6.19,10,16745.0,United Kingdom
560539,2023-07-19,23208,Lunch Bag Vintage Leaf Design,5.97,10,16745.0,United Kingdom
560539,2023-07-19,21289,Large Stripes Chocolate Gift Bag,5.77,4,16745.0,United Kingdom
560544,2023-07-19,21042,Red Retrospot Apron,16.35,3,12569.0,Germany
560544,2023-07-19,20754,Retrospot Red Washing Up Gloves,12.4,6,12569.0,Germany
560544,2023-07-19,21154,Red Retrospot Oven Glove,11.53,10,12569.0,Germany
560544,2023-07-19,71279,Pink Glass Candleholder,13.27,6,12569.0,Germany
560545,2023-07-19,22553,Plasters In Tin Skulls,11.94,12,12569.0,Germany
560545,2023-07-19,22055,Mini Cake Stand Hanging Strawbery,11.94,8,12569.0,Germany
560545,2023-07-19,22064,Pink Doughnut Trinket Pot,11.94,12,12569.0,Germany
560545,2023-07-19,21232,Strawberry Ceramic Trinket Pot,11.53,12,12569.0,Germany
560545,2023-07-19,22551,Plasters In Tin Spaceboy,11.94,12,12569.0,Germany
560546,2023-07-19,85103,Silver T-Light Setting,16.35,37,17867.0,United Kingdom
560546,2023-07-19,15056N,Edwardian Parasol Natural,16.35,2,17867.0,United Kingdom
560547,2023-07-19,23080,Red Metal Box Top Secret,18.71,2,17419.0,United Kingdom
560547,2023-07-19,23196,Vintage Leaf Magnetic Notepad,11.74,12,17419.0,United Kingdom
560547,2023-07-19,23198,Pantry Magnetic Shopping List,11.74,12,17419.0,United Kingdom
560547,2023-07-19,23342,Mint Diner Wall Clock,18.96,2,17419.0,United Kingdom
560547,2023-07-19,23341,Pink Diner Wall Clock,18.96,2,17419.0,United Kingdom
560547,2023-07-19,21314,Small Glass Heart Trinket Pot,12.4,8,17419.0,United Kingdom
560547,2023-07-19,71053,White Moroccan Metal Lantern,14.09,4,17419.0,United Kingdom
560547,2023-07-19,22464,Hanging Metal Heart Lantern,11.94,12,17419.0,United Kingdom
560547,2023-07-19,22077,6 Ribbons Rustic Charm,11.94,12,17419.0,United Kingdom
560547,2023-07-19,85185B,Pink Horse Sock Puppet Kit,13.27,6,17419.0,United Kingdom
560547,2023-07-19,22566,Feltcraft Hairband Pink And Purple,11.12,12,17419.0,United Kingdom
560547,2023-07-19,22169,Family Album White Picture Frame,18.96,2,17419.0,United Kingdom
560547,2023-07-19,82482,Wooden Picture Frame White Finish,12.86,6,17419.0,United Kingdom
560547,2023-07-19,84879,Assorted Colour Bird Ornament,11.98,8,17419.0,United Kingdom
560547,2023-07-19,84792,Enchanted Bird Coathanger 5 Hook,15.02,4,17419.0,United Kingdom
560547,2023-07-19,84406B,Cream Cupid Hearts Coat Hanger,14.5,4,17419.0,United Kingdom
560547,2023-07-19,84971S,Small Heart Flowers Hook,11.12,24,17419.0,United Kingdom
560547,2023-07-19,82552,Washroom Metal Sign,11.74,12,17419.0,United Kingdom
560547,2023-07-19,82551,Laundry 15c Metal Sign,11.74,12,17419.0,United Kingdom
560547,2023-07-19,82600,N0 Singing Metal Sign,12.4,12,17419.0,United Kingdom
560547,2023-07-19,22191,Ivory Diner Wall Clock,18.96,2,17419.0,United Kingdom
560547,2023-07-19,21990,Modern Floral Stationery Set,11.53,12,17419.0,United Kingdom
560547,2023-07-19,21992,Vintage Paisley Stationery Set,11.53,12,17419.0,United Kingdom
560547,2023-07-19,21993,Floral Folk Stationery Set,11.53,12,17419.0,United Kingdom
560547,2023-07-19,22400,Magnets Pack Of 4 Home Sweet Home,10.65,12,17419.0,United Kingdom
560547,2023-07-19,22189,Cream Heart Card Holder,14.3,4,17419.0,United Kingdom
560547,2023-07-19,47566,Party Bunting,15.32,16,17419.0,United Kingdom
560548,2023-07-19,23109,Pack Of Six Led Tea Lights,13.21,42,17867.0,United Kingdom
560549,2023-07-19,22488,Natural Slate Rectangle Chalkboard,11.94,12,12664.0,Finland
560549,2023-07-19,82578,Kitchen Metal Sign,10.81,12,12664.0,Finland
560549,2023-07-19,21171,Bathroom Metal Sign,10.81,12,12664.0,Finland
560549,2023-07-19,82581,Toilet Metal Sign,10.81,12,12664.0,Finland
560549,2023-07-19,22467,Gumball Coat Rack,12.86,6,12664.0,Finland
560549,2023-07-19,84997D,Childrens Cutlery Polkadot Pink,14.09,72,12664.0,Finland
560549,2023-07-19,84997C,Childrens Cutlery Polkadot Blue,14.5,36,12664.0,Finland
560549,2023-07-19,84997A,Childrens Cutlery Polkadot Green,14.5,24,12664.0,Finland
560551,2023-07-19,23229,Vintage Donkey Tail Game,14.09,1,18041.0,United Kingdom
560551,2023-07-19,23249,Vintage Red Enamel Trim Plate,11.94,1,18041.0,United Kingdom
560551,2023-07-19,23250,Vintage Red Trim Enamel Bowl,11.53,1,18041.0,United Kingdom
560551,2023-07-19,23251,Vintage Red Enamel Trim Mug,11.53,1,18041.0,United Kingdom
560551,2023-07-19,21864,Union Jack Flag Passport Cover,12.4,1,18041.0,United Kingdom
560551,2023-07-19,21866,Union Jack Flag Luggage Tag,11.53,1,18041.0,United Kingdom
560551,2023-07-19,22441,Grow Your Own Basil In Enamel Mug,12.4,1,18041.0,United Kingdom
560551,2023-07-19,22425,Enamel Colander Cream,15.32,1,18041.0,United Kingdom
560551,2023-07-19,21625,Vintage Union Jack Apron,17.37,1,18041.0,United Kingdom
560551,2023-07-19,23180,Mum's Kitchen Clock,15.32,1,18041.0,United Kingdom
560551,2023-07-19,20749,Assorted Colour Mini Cases,18.4,2,18041.0,United Kingdom
560551,2023-07-19,22560,Traditional Modelling Clay,11.53,10,18041.0,United Kingdom
560551,2023-07-19,23294,Set Of 6 Snack Loaf Baking Cases,11.1,4,18041.0,United Kingdom
560551,2023-07-19,23293,Set Of 12 Fairy Cake Baking Cases,11.1,5,18041.0,United Kingdom
560551,2023-07-19,72802B,Ocean Scent Candle In Jewelled Box,14.61,1,18041.0,United Kingdom
560551,2023-07-19,23121,Pack Of 6 Cocktail Parasol Straws,10.68,3,18041.0,United Kingdom
560551,2023-07-19,84692,Box Of 24 Cocktail Parasols,10.68,1,18041.0,United Kingdom
560551,2023-07-19,22766,Photo Frame Cornice,13.27,1,18041.0,United Kingdom
560551,2023-07-19,85035A,Gardenia 3 Wick Morris Boxed Candle,14.61,3,18041.0,United Kingdom
560551,2023-07-19,22467,Gumball Coat Rack,12.86,3,18041.0,United Kingdom
560551,2023-07-19,23201,Jumbo Bag Alphabet,6.19,1,18041.0,United Kingdom
560551,2023-07-19,22611,Vintage Union Jack Shopping Bag,7.66,2,18041.0,United Kingdom
560551,2023-07-19,16162M,The King Gift Bag 25x24x12cm,5.34,4,18041.0,United Kingdom
560552,2023-07-19,85159A,Black Tea Coffee Sugar Jars,12.25,8,15311.0,United Kingdom
560552,2023-07-19,85159B,White Tea Coffee Sugar Jars,12.25,7,15311.0,United Kingdom
560552,2023-07-19,21930,Jumbo Storage Bag Skulls,12.38,2,15311.0,United Kingdom
560552,2023-07-19,85014B,Red Retrospot Umbrella,16.35,1,15311.0,United Kingdom
560552,2023-07-19,82613A,Metal Sign Cupcake Single Hook,11.53,2,15311.0,United Kingdom
560552,2023-07-19,22671,French Laundry Sign Blue Metal,11.94,1,15311.0,United Kingdom
560552,2023-07-19,20829,Glitter Hanging Butterfly String,12.4,3,15311.0,United Kingdom
560552,2023-07-19,21211,Set Of 72 Skull Paper Doilies,11.74,2,15311.0,United Kingdom
560552,2023-07-19,20898,Vintage Notebook Travelogue,13.27,1,15311.0,United Kingdom
560552,2023-07-19,21867,Pink Union Jack Luggage Tag,11.53,1,15311.0,United Kingdom
560552,2023-07-19,22756,Large Yellow Babushka Notebook,11.53,2,15311.0,United Kingdom
560552,2023-07-19,22753,Small Yellow Babushka Notebook,11.12,2,15311.0,United Kingdom
560552,2023-07-19,22758,Large Purple Babushka Notebook,11.53,2,15311.0,United Kingdom
560552,2023-07-19,22757,Large Red Babushka Notebook,11.53,2,15311.0,United Kingdom
560552,2023-07-19,22754,Small Red Babushka Notebook,11.12,2,15311.0,United Kingdom
560552,2023-07-19,22755,Small Purple Babushka Notebook,11.12,2,15311.0,United Kingdom
560552,2023-07-19,22620,4 Traditional Spinning Tops,11.74,2,15311.0,United Kingdom
560552,2023-07-19,22139,Retrospot Tea Set Ceramic 11 Pc,15.32,2,15311.0,United Kingdom
560552,2023-07-19,23182,Toilet Sign Occupied Or Vacant,11.1,5,15311.0,United Kingdom
560552,2023-07-19,22151,Place Setting White Heart,10.68,2,15311.0,United Kingdom
560552,2023-07-19,21447,12 Ivory Rose Peg Place Settings,11.53,5,15311.0,United Kingdom
560552,2023-07-19,21232,Strawberry Ceramic Trinket Pot,11.53,1,15311.0,United Kingdom
560552,2023-07-19,82486,3 Drawer Antique White Wood Cabinet,19.42,1,15311.0,United Kingdom
560552,2023-07-19,22905,Calendar In Season Design,13.27,2,15311.0,United Kingdom
560552,2023-07-19,22904,Calendar Paper Cut Design,13.27,2,15311.0,United Kingdom
560552,2023-07-19,22903,Calendar Family Favourites,13.27,2,15311.0,United Kingdom
560552,2023-07-19,23197,Sketchbook Magnetic Shopping List,11.74,2,15311.0,United Kingdom
560552,2023-07-19,16225,Rattle Snake Eggs,11.53,3,15311.0,United Kingdom
560552,2023-07-19,23192,Bundle Of 3 Alphabet Exercise Books,11.94,1,15311.0,United Kingdom
560552,2023-07-19,23190,Bundle Of 3 School Exercise Books,11.94,1,15311.0,United Kingdom
560552,2023-07-19,22908,Pack Of 20 Napkins Red Apples,11.12,1,15311.0,United Kingdom
560552,2023-07-19,21787,Rain Poncho Retrospot,11.12,2,15311.0,United Kingdom
560552,2023-07-19,47351B,Blue Voile Lampshade,13.27,2,15311.0,United Kingdom
560552,2023-07-19,75049L,Large Circular Mirror Mobile,11.12,96,15311.0,United Kingdom
560552,2023-07-19,22360,Glass Jar English Confectionery,12.86,24,15311.0,United Kingdom
560552,2023-07-19,23033,Drawer Knob Ceramic Red,11.53,96,15311.0,United Kingdom
560552,2023-07-19,22426,Enamel Wash Bowl Cream,13.27,16,15311.0,United Kingdom
560552,2023-07-19,23035,Drawer Knob Ceramic Ivory,11.53,96,15311.0,United Kingdom
560552,2023-07-19,20711,Jumbo Bag Toys,6.19,1,15311.0,United Kingdom
560552,2023-07-19,22386,Jumbo Bag Pink Polkadot,6.04,100,15311.0,United Kingdom
560553,2023-07-19,22356,Charlotte Bag Pink Polkadot,11.12,10,13991.0,United Kingdom
560553,2023-07-19,72741,Grand Chocolatecandle,11.74,9,13991.0,United Kingdom
560553,2023-07-19,37495,Fairy Cake Birthday Candle Set,14.09,8,13991.0,United Kingdom
560553,2023-07-19,21232,Strawberry Ceramic Trinket Pot,11.53,12,13991.0,United Kingdom
560553,2023-07-19,22064,Pink Doughnut Trinket Pot,11.94,12,13991.0,United Kingdom
560553,2023-07-19,21231,Sweetheart Ceramic Trinket Box,11.53,12,13991.0,United Kingdom
560553,2023-07-19,23077,Doughnut Lip Gloss,11.53,20,13991.0,United Kingdom
560554,2023-07-19,21389,Ivory Hanging Decoration Bird,11.12,24,16232.0,United Kingdom
560554,2023-07-19,21386,Ivory Hanging Decoration Egg,10.44,24,16232.0,United Kingdom
560554,2023-07-19,21385,Ivory Hanging Decoration Heart,11.12,24,16232.0,United Kingdom
560554,2023-07-19,21136,Painted Metal Pears Assorted,11.98,8,16232.0,United Kingdom
560554,2023-07-19,84879,Assorted Colour Bird Ornament,11.98,8,16232.0,United Kingdom
560554,2023-07-19,23154,Set Of 4 Jam Jar Magnets,12.38,12,16232.0,United Kingdom
560554,2023-07-19,23156,Set Of 5 Mini Grocery Magnets,12.38,12,16232.0,United Kingdom
560554,2023-07-19,47566B,Tea Time Party Bunting,15.32,9,16232.0,United Kingdom
560554,2023-07-19,47566,Party Bunting,15.32,10,16232.0,United Kingdom
560554,2023-07-19,23298,Spotty Bunting,15.32,10,16232.0,United Kingdom
560554,2023-07-19,84836,Zinc Metal Heart Decoration,11.53,60,16232.0,United Kingdom
560554,2023-07-19,85123A,Cream Hanging Heart T-Light Holder,13.27,6,16232.0,United Kingdom
560555,2023-07-19,21162,Toxic Area Door Hanger,10.65,2,14178.0,United Kingdom
560555,2023-07-19,21933,Pink Vintage Paisley Picnic Bag,11.94,1,14178.0,United Kingdom
560555,2023-07-19,22834,Hand Warmer Babushka Design,12.4,2,14178.0,United Kingdom
560555,2023-07-19,85123A,Cream Hanging Heart T-Light Holder,13.27,1,14178.0,United Kingdom
560555,2023-07-19,18007,Essential Balm 35g Tin In Envelope,10.43,12,14178.0,United Kingdom
560555,2023-07-19,21983,Pack Of 12 Blue Paisley Tissues,10.55,2,14178.0,United Kingdom
560555,2023-07-19,21984,Pack Of 12 Pink Paisley Tissues,10.55,3,14178.0,United Kingdom
560555,2023-07-19,22507,Memo Board Retrospot Design,15.32,1,14178.0,United Kingdom
560555,2023-07-19,21982,Pack Of 12 Suki Tissues,10.55,7,14178.0,United Kingdom
560555,2023-07-19,21163,Do Not Touch My Stuff Door Hanger,10.65,1,14178.0,United Kingdom
560555,2023-07-19,21584,Retrospot Small Tube Matches,11.94,1,14178.0,United Kingdom
560555,2023-07-19,20992,Jazz Hearts Purse Notebook,10.65,1,14178.0,United Kingdom
560555,2023-07-19,37467,Pig Mug In Two Colour Designs,10.65,2,14178.0,United Kingdom
560555,2023-07-19,20868,Silver Fabric Mirror,10.65,2,14178.0,United Kingdom
560555,2023-07-19,16008,Small Folding Scissor(Pointed Edge),10.37,2,14178.0,United Kingdom
560555,2023-07-19,22457,Natural Slate Heart Chalkboard,13.27,2,14178.0,United Kingdom
560555,2023-07-19,85123A,Cream Hanging Heart T-Light Holder,13.27,1,14178.0,United Kingdom
560555,2023-07-19,21402,Red Egg Spoon,10.37,6,14178.0,United Kingdom
560555,2023-07-19,21403,Blue Egg Spoon,10.37,7,14178.0,United Kingdom
560555,2023-07-19,22112,Chocolate Hot Water Bottle,15.32,1,14178.0,United Kingdom
560555,2023-07-19,21158,Moody Girl Door Hanger,10.65,2,14178.0,United Kingdom
560555,2023-07-19,21163,Do Not Touch My Stuff Door Hanger,10.65,6,14178.0,United Kingdom
560555,2023-07-19,21916,Set 12 Retro White Chalk Sticks,10.68,1,14178.0,United Kingdom
560555,2023-07-19,20984,12 Pencils Tall Tube Posy,10.55,2,14178.0,United Kingdom
560555,2023-07-19,21588,Retrospot Giant Tube Matches,12.86,1,14178.0,United Kingdom
560555,2023-07-19,22355,Charlotte Bag Suki Design,11.12,1,14178.0,United Kingdom
560555,2023-07-19,21992,Vintage Paisley Stationery Set,11.53,2,14178.0,United Kingdom
560555,2023-07-19,20984,12 Pencils Tall Tube Posy,10.55,2,14178.0,United Kingdom
560555,2023-07-19,22097,Swallow Square Tissue Box,10.65,1,14178.0,United Kingdom
560555,2023-07-19,22098,Boudoir Square Tissue Box,10.65,1,14178.0,United Kingdom
560555,2023-07-19,21034,Rex Cash+Carry Jumbo Shopper,11.22,2,14178.0,United Kingdom
560555,2023-07-19,22804,Pink Hanging Heart T-Light Holder,13.27,1,14178.0,United Kingdom
560555,2023-07-19,18007,Essential Balm 35g Tin In Envelope,10.43,8,14178.0,United Kingdom
560555,2023-07-19,22092,Blue Paisley Tissue Box,10.65,1,14178.0,United Kingdom
560555,2023-07-19,21137,Black Record Cover Frame,14.09,1,14178.0,United Kingdom
560555,2023-07-19,22420,Lipstick Pen Baby Pink,10.68,1,14178.0,United Kingdom
560555,2023-07-19,21916,Set 12 Retro White Chalk Sticks,10.68,2,14178.0,United Kingdom
560555,2023-07-19,22096,Pink Paisley Square Tissue Box,10.65,1,14178.0,United Kingdom
560555,2023-07-19,85123A,Cream Hanging Heart T-Light Holder,13.27,1,14178.0,United Kingdom
560555,2023-07-19,84818,Danish Rose Photo Frame,11.06,2,14178.0,United Kingdom
560555,2023-07-19,22278,Overnight Bag Vintage Rose Paisley,15.32,1,14178.0,United Kingdom
560555,2023-07-19,22457,Natural Slate Heart Chalkboard,13.27,2,14178.0,United Kingdom
560555,2023-07-19,22064,Pink Doughnut Trinket Pot,11.94,2,14178.0,United Kingdom
560555,2023-07-19,21179,No Junk Mail Metal Sign,10.65,1,14178.0,United Kingdom
560555,2023-07-19,21584,Retrospot Small Tube Matches,11.94,1,14178.0,United Kingdom
560555,2023-07-19,22979,Pantry Washing Up Brush,11.74,1,14178.0,United Kingdom
560555,2023-07-19,22098,Boudoir Square Tissue Box,10.65,1,14178.0,United Kingdom
560555,2023-07-19,22099,Caravan Square Tissue Box,10.65,1,14178.0,United Kingdom
560555,2023-07-19,22093,Motoring Tissue Box,10.65,1,14178.0,United Kingdom
560555,2023-07-19,22575,Metal Merry Christmas Wreath,12.25,1,14178.0,United Kingdom
560555,2023-07-19,21932,Scandinavian Paisley Picnic Bag,11.94,2,14178.0,United Kingdom
560555,2023-07-19,21933,Pink Vintage Paisley Picnic Bag,11.94,1,14178.0,United Kingdom
560555,2023-07-19,21260,First Aid Tin,13.58,2,14178.0,United Kingdom
560555,2023-07-19,22361,Glass Jar Daisy Fresh Cotton Wool,13.27,1,14178.0,United Kingdom
560555,2023-07-19,23300,Gardeners Kneeling Pad Cup Of Tea,11.94,2,14178.0,United Kingdom
560555,2023-07-19,22276,Wash Bag Vintage Rose Paisley,12.86,1,14178.0,United Kingdom
560555,2023-07-19,21242,Red Retrospot Plate,11.98,4,14178.0,United Kingdom
560557,2023-07-19,35653,Vintage Bead Notebook,13.27,1,18101.0,United Kingdom
560557,2023-07-19,35648,Vintage Bead Pink Purse,11.1,1,18101.0,United Kingdom
560557,2023-07-19,22101,Mirror Mosaic Votive Holder,12.4,6,18101.0,United Kingdom
560557,2023-07-19,72741,Grand Chocolatecandle,11.74,2,18101.0,United Kingdom
560557,2023-07-19,84581,Dog Toy With Pink Crochet Skirt,14.09,1,18101.0,United Kingdom
560557,2023-07-19,22318,Five Heart Hanging Decoration,13.27,1,18101.0,United Kingdom
560557,2023-07-19,23069,Edwardian Photo Frame,16.66,2,18101.0,United Kingdom
560557,2023-07-19,23070,Edwardian Heart Photo Frame,14.5,2,18101.0,United Kingdom
560557,2023-07-19,84875D,Blue Square Compact Mirror,11.53,1,18101.0,United Kingdom
560557,2023-07-19,84876D,Blue Heart Compact Mirror,11.53,1,18101.0,United Kingdom
560557,2023-07-19,84877D,Blue Round Compact Mirror,11.53,1,18101.0,United Kingdom
560562,2023-07-19,22426,Enamel Wash Bowl Cream,14.09,4,15713.0,United Kingdom
560562,2023-07-19,23118,Parisienne Jewellery Drawer,17.94,2,15713.0,United Kingdom
560562,2023-07-19,21983,Pack Of 12 Blue Paisley Tissues,10.55,24,15713.0,United Kingdom
560562,2023-07-19,21977,Pack Of 60 Pink Paisley Cake Cases,10.81,24,15713.0,United Kingdom
560562,2023-07-19,22427,Enamel Flower Jug Cream,16.35,3,15713.0,United Kingdom
560562,2023-07-19,22425,Enamel Colander Cream,15.32,3,15713.0,United Kingdom
560562,2023-07-19,21260,First Aid Tin,13.58,6,15713.0,United Kingdom
560562,2023-07-19,23109,Pack Of Six Led Tea Lights,13.21,6,15713.0,United Kingdom
560562,2023-07-19,85123A,Cream Hanging Heart T-Light Holder,13.27,18,15713.0,United Kingdom
560566,2023-07-19,23298,Spotty Bunting,15.32,6,12662.0,Germany
560566,2023-07-19,21242,Red Retrospot Plate,11.98,8,12662.0,Germany
560566,2023-07-19,21245,Green Polkadot Plate,11.98,8,12662.0,Germany
560566,2023-07-19,21243,Pink Polkadot Plate,11.98,8,12662.0,Germany
560566,2023-07-19,23288,Green Vintage Spot Beaker,11.12,8,12662.0,Germany
560566,2023-07-19,20677,Pink Polkadot Bowl,11.53,8,12662.0,Germany
560566,2023-07-19,20676,Red Retrospot Bowl,11.53,8,12662.0,Germany
560566,2023-07-19,84997B,Childrens Cutlery Retrospot Red,14.5,4,12662.0,Germany
