TransactionNo,Date,ProductNo,ProductName,Price,Quantity,CustomerNo,Country
556510,2023-06-13,23203,Jumbo Bag Vintage Doily,6.19,10,14911.0,EIRE
556512,2023-06-13,21936,Red Retrospot Picnic Bag,13.27,2,14688.0,United Kingdom
556512,2023-06-13,21931,Jumbo Storage Bag Suki,12.38,5,14688.0,United Kingdom
556512,2023-06-13,22953,Birthday Party Cordon Barrier Tape,11.53,5,14688.0,United Kingdom
556512,2023-06-13,20719,Woodland Charlotte Bag,11.12,6,14688.0,United Kingdom
556512,2023-06-13,23204,Charlotte Bag Apples Design,11.12,20,14688.0,United Kingdom
556512,2023-06-13,21770,Open Closed Metal Sign,15.32,5,14688.0,United Kingdom
556512,2023-06-13,23205,Charlotte Bag Vintage Alphabet,11.12,10,14688.0,United Kingdom
556512,2023-06-13,23182,Toilet Sign Occupied Or Vacant,11.1,4,14688.0,United Kingdom
556512,2023-06-13,82551,Laundry 15c Metal Sign,11.74,2,14688.0,United Kingdom
556512,2023-06-13,22996,Travel Card Wallet Vintage Ticket,10.68,11,14688.0,United Kingdom
556512,2023-06-13,22355,Charlotte Bag Suki Design,11.12,20,14688.0,United Kingdom
556512,2023-06-13,22356,Charlotte Bag Pink Polkadot,11.12,20,14688.0,United Kingdom
556512,2023-06-13,22386,Jumbo Bag Pink Polkadot,6.19,5,14688.0,United Kingdom
556512,2023-06-13,23199,Jumbo Bag Apples,6.19,5,14688.0,United Kingdom
556513,2023-06-13,22961,Jam Making Set Printed,13.62,5,16513.0,United Kingdom
556513,2023-06-13,20655,Queen Of Skies Luggage Tag,12.77,1,16513.0,United Kingdom
556513,2023-06-13,21080,Set/20 Red Retrospot Paper Napkins,12.77,2,16513.0,United Kingdom
556513,2023-06-13,21116,Owl Doorstop,18.75,1,16513.0,United Kingdom
556513,2023-06-13,21166,Cook With Wine Metal Sign,14.48,1,16513.0,United Kingdom
556513,2023-06-13,21328,Balloons Writing Set,13.62,1,16513.0,United Kingdom
556513,2023-06-13,21426,Woodland Storage Box Small,15.33,1,16513.0,United Kingdom
556513,2023-06-13,21672,White Spot Red Ceramic Drawer Knob,12.77,2,16513.0,United Kingdom
556513,2023-06-13,21931,Jumbo Storage Bag Suki,14.48,6,16513.0,United Kingdom
556513,2023-06-13,21974,Set Of 36 Paisley Flower Doilies,14.09,1,16513.0,United Kingdom
556513,2023-06-13,21989,Pack Of 20 Skull Paper Napkins,11.92,1,16513.0,United Kingdom
556513,2023-06-13,22055,Mini Cake Stand Hanging Strawbery,13.62,2,16513.0,United Kingdom
556513,2023-06-13,22089,Paper Bunting Vintage Paisley,14.48,2,16513.0,United Kingdom
556513,2023-06-13,22131,Food Container Set 3 Love Heart,14.48,1,16513.0,United Kingdom
556513,2023-06-13,22352,Lunch Box With Cutlery Retrospot,15.33,1,16513.0,United Kingdom
556513,2023-06-13,22371,Airline Bag Vintage Tokyo 78,18.75,1,16513.0,United Kingdom
556513,2023-06-13,22411,Jumbo Shopper Vintage Red Paisley,14.48,3,16513.0,United Kingdom
556513,2023-06-13,22570,Feltcraft Cushion Rabbit,17.9,1,16513.0,United Kingdom
556513,2023-06-13,23199,Jumbo Bag Apples,7.24,1,16513.0,United Kingdom
556513,2023-06-13,20711,Jumbo Bag Toys,7.24,2,16513.0,United Kingdom
556513,2023-06-13,21929,Jumbo Bag Pink Vintage Paisley,7.24,1,16513.0,United Kingdom
556515,2023-06-13,21714,Citronella Candle Garden Pot,12.77,6,17515.0,United Kingdom
556515,2023-06-13,21977,Pack Of 60 Pink Paisley Cake Cases,12.38,1,17515.0,United Kingdom
556515,2023-06-13,21989,Pack Of 20 Skull Paper Napkins,11.92,1,17515.0,United Kingdom
556515,2023-06-13,22197,Popcorn Holder,11.92,6,17515.0,United Kingdom
556515,2023-06-13,22411,Jumbo Shopper Vintage Red Paisley,14.48,2,17515.0,United Kingdom
556515,2023-06-13,22876,Number Tile Cottage Garden 8,14.48,1,17515.0,United Kingdom
556515,2023-06-13,23165,Large Ceramic Top Storage Jar,13.62,3,17515.0,United Kingdom
556515,2023-06-13,47566B,Tea Time Party Bunting,18.75,1,17515.0,United Kingdom
556515,2023-06-13,84029G,Knitted Union Flag Hot Water Bottle,18.75,1,17515.0,United Kingdom
556515,2023-06-13,84378,Set Of 3 Heart Cookie Cutters,13.62,1,17515.0,United Kingdom
556515,2023-06-13,84992,72 Sweetheart Fairy Cake Cases,12.38,1,17515.0,United Kingdom
556515,2023-06-13,20711,Jumbo Bag Toys,7.24,2,17515.0,United Kingdom
556515,2023-06-13,20712,Jumbo Bag Woodland Animals,7.24,1,17515.0,United Kingdom
556515,2023-06-13,21929,Jumbo Bag Pink Vintage Paisley,7.24,1,17515.0,United Kingdom
556515,2023-06-13,22385,Jumbo Bag Spaceboy Design,7.24,1,17515.0,United Kingdom
556515,2023-06-13,22386,Jumbo Bag Pink Polkadot,7.24,2,17515.0,United Kingdom
556515,2023-06-13,23199,Jumbo Bag Apples,7.24,1,17515.0,United Kingdom
556515,2023-06-13,85099B,Jumbo Bag Red Retrospot,7.24,1,17515.0,United Kingdom
556516,2023-06-13,20676,Red Retrospot Bowl,12.77,1,17516.0,United Kingdom
556516,2023-06-13,20718,Red Retrospot Shopper Bag,13.62,1,17516.0,United Kingdom
556516,2023-06-13,21218,Red Spotty Biscuit Tin,18.75,1,17516.0,United Kingdom
556516,2023-06-13,21424,Woodland Storage Box Large,17.05,1,17516.0,United Kingdom
556516,2023-06-13,21430,Set/3 Red Gingham Rose Storage Box,17.9,2,17516.0,United Kingdom
556516,2023-06-13,21901,Key Fob Back Door,11.92,1,17516.0,United Kingdom
556516,2023-06-13,21917,Set 12 Kids White Chalk Sticks,11.06,1,17516.0,United Kingdom
556516,2023-06-13,21931,Jumbo Storage Bag Suki,14.48,9,17516.0,United Kingdom
556516,2023-06-13,21936,Red Retrospot Picnic Bag,16.18,1,17516.0,United Kingdom
556516,2023-06-13,21974,Set Of 36 Paisley Flower Doilies,14.09,1,17516.0,United Kingdom
556516,2023-06-13,21989,Pack Of 20 Skull Paper Napkins,11.92,3,17516.0,United Kingdom
556516,2023-06-13,22055,Mini Cake Stand Hanging Strawbery,13.62,1,17516.0,United Kingdom
556516,2023-06-13,22411,Jumbo Shopper Vintage Red Paisley,14.48,4,17516.0,United Kingdom
556516,2023-06-13,22680,French Blue Metal Door Sign 5,12.77,1,17516.0,United Kingdom
556516,2023-06-13,22723,Set Of 6 Herb Tins Sketchbook,18.75,1,17516.0,United Kingdom
556516,2023-06-13,22961,Jam Making Set Printed,13.62,1,17516.0,United Kingdom
556516,2023-06-13,22972,Children's Spaceboy Mug,13.62,1,17516.0,United Kingdom
556516,2023-06-13,22982,Pantry Pastry Brush,12.77,1,17516.0,United Kingdom
556516,2023-06-13,22993,Set Of 4 Pantry Jelly Moulds,13.62,1,17516.0,United Kingdom
556516,2023-06-13,20711,Jumbo Bag Toys,7.24,3,17516.0,United Kingdom
556516,2023-06-13,21929,Jumbo Bag Pink Vintage Paisley,7.24,3,17516.0,United Kingdom
556516,2023-06-13,22385,Jumbo Bag Spaceboy Design,7.24,1,17516.0,United Kingdom
556516,2023-06-13,23199,Jumbo Bag Apples,7.24,1,17516.0,United Kingdom
556517,2023-06-13,23118,Parisienne Jewellery Drawer,17.94,4,12481.0,Germany
556517,2023-06-13,84692,Box Of 24 Cocktail Parasols,10.68,25,12481.0,Germany
556517,2023-06-13,22728,Alarm Clock Bakelike Pink,14.09,8,12481.0,Germany
556517,2023-06-13,22727,Alarm Clock Bakelike Red,14.09,8,12481.0,Germany
556517,2023-06-13,22730,Alarm Clock Bakelike Ivory,14.09,8,12481.0,Germany
556517,2023-06-13,84663A,Grass Hopper Wooden Wall Clock,16.35,3,12481.0,Germany
556517,2023-06-13,22961,Jam Making Set Printed,11.74,24,12481.0,Germany
556517,2023-06-13,22962,Jam Jar With Pink Lid,11.12,12,12481.0,Germany
556517,2023-06-13,22993,Set Of 4 Pantry Jelly Moulds,11.53,12,12481.0,Germany
556517,2023-06-13,23244,Round Storage Tin Vintage Leaf,12.25,12,12481.0,Germany
556517,2023-06-13,23245,Set Of 3 Regency Cake Tins,15.32,4,12481.0,Germany
556517,2023-06-13,22895,Set Of 2 Tea Towels Apple And Pears,13.58,12,12481.0,Germany
556517,2023-06-13,23254,Childrens Cutlery Dolly Girl,14.5,4,12481.0,Germany
556517,2023-06-13,15036,Assorted Colours Silk Fan,11.1,12,12481.0,Germany
556517,2023-06-13,22556,Plasters In Tin Circus Parade,11.94,24,12481.0,Germany
556517,2023-06-13,22551,Plasters In Tin Spaceboy,11.94,24,12481.0,Germany
556517,2023-06-13,22554,Plasters In Tin Woodland Animals,11.94,24,12481.0,Germany
556517,2023-06-13,22637,Piggy Bank Retrospot,12.86,8,12481.0,Germany
556517,2023-06-13,21787,Rain Poncho Retrospot,11.12,24,12481.0,Germany
556517,2023-06-13,23237,Set Of 4 Knick Knack Tins Leaf,14.5,6,12481.0,Germany
556517,2023-06-13,23240,Set Of 4 Knick Knack Tins Doily,14.5,6,12481.0,Germany
556517,2023-06-13,22627,Mint Kitchen Scales,18.96,2,12481.0,Germany
556517,2023-06-13,23203,Jumbo Bag Vintage Doily,6.19,50,12481.0,Germany
556517,2023-06-13,23202,Jumbo Bag Vintage Leaf,6.19,50,12481.0,Germany
556517,2023-06-13,23208,Lunch Bag Vintage Leaf Design,5.97,20,12481.0,Germany
556517,2023-06-13,23209,Lunch Bag Vintage Doily,5.97,20,12481.0,Germany
556519,2023-06-13,21901,Key Fob Back Door,10.92,2,16794.0,United Kingdom
556520,2023-06-13,23052,Recycled Acapulco Mat Turquoise,18.71,1,14177.0,United Kingdom
556520,2023-06-13,23054,Recycled Acapulco Mat Lavender,18.71,1,14177.0,United Kingdom
556520,2023-06-13,21468,Butterfly Crochet Food Cover,14.09,2,14177.0,United Kingdom
556520,2023-06-13,22222,Cake Plate Lovebird White,15.32,2,14177.0,United Kingdom
556520,2023-06-13,47566,Party Bunting,15.32,2,14177.0,United Kingdom
556520,2023-06-13,21381,Mini Wooden Happy Birthday Garland,11.98,2,14177.0,United Kingdom
556520,2023-06-13,22197,Popcorn Holder,11.12,12,14177.0,United Kingdom
556520,2023-06-13,22551,Plasters In Tin Spaceboy,11.94,1,14177.0,United Kingdom
556520,2023-06-13,22553,Plasters In Tin Skulls,11.94,1,14177.0,United Kingdom
556520,2023-06-13,22556,Plasters In Tin Circus Parade,11.94,1,14177.0,United Kingdom
556520,2023-06-13,22557,Plasters In Tin Vintage Paisley,11.94,1,14177.0,United Kingdom
556520,2023-06-13,22844,Vintage Cream Dog Food Container,18.96,1,14177.0,United Kingdom
556520,2023-06-13,82494L,Wooden Frame Antique White,13.27,1,14177.0,United Kingdom
556520,2023-06-13,82482,Wooden Picture Frame White Finish,12.86,1,14177.0,United Kingdom
556520,2023-06-13,85123A,Cream Hanging Heart T-Light Holder,13.27,2,14177.0,United Kingdom
556520,2023-06-13,22654,Deluxe Sewing Kit,16.35,1,14177.0,United Kingdom
556520,2023-06-13,22851,Set 20 Napkins Fairy Cakes Design,11.12,4,14177.0,United Kingdom
556520,2023-06-13,84708B,Pink Jewelled Photo Frame,15.32,1,14177.0,United Kingdom
556521,2023-06-13,37468,Hardman Mug 3 Assorted,10.65,6,14573.0,United Kingdom
556521,2023-06-13,37413,Icon Mug Revolutionary,10.65,6,14573.0,United Kingdom
556521,2023-06-13,37462E,Pet Mug Goldfish,10.44,12,14573.0,United Kingdom
556521,2023-06-13,23110,Parisienne Key Cabinet,16.14,2,14573.0,United Kingdom
556521,2023-06-13,22173,Metal 4 Hook Hanger French Chateau,13.27,2,14573.0,United Kingdom
556521,2023-06-13,22794,Sweetheart Wire Magazine Rack,18.4,2,14573.0,United Kingdom
556521,2023-06-13,22795,Sweetheart Recipe Book Stand,17.17,2,14573.0,United Kingdom
556521,2023-06-13,82578,Kitchen Metal Sign,10.81,2,14573.0,United Kingdom
556521,2023-06-13,21171,Bathroom Metal Sign,10.81,2,14573.0,United Kingdom
556521,2023-06-13,82581,Toilet Metal Sign,10.81,2,14573.0,United Kingdom
556523,2023-06-13,22920,Herb Marker Basil,10.92,15,16938.0,United Kingdom
556526,2023-06-13,23256,Childrens Cutlery Spaceboy,14.5,8,12732.0,France
556526,2023-06-13,23254,Childrens Cutlery Dolly Girl,14.5,8,12732.0,France
556526,2023-06-13,23255,Childrens Cutlery Circus Parade,14.5,8,12732.0,France
556526,2023-06-13,20979,36 Pencils Tube Red Retrospot,11.53,32,12732.0,France
556526,2023-06-13,21238,Red Retrospot Cup,11.12,8,12732.0,France
556526,2023-06-13,21242,Red Retrospot Plate,11.98,8,12732.0,France
556526,2023-06-13,21244,Blue Polkadot Plate,11.98,8,12732.0,France
556526,2023-06-13,21240,Blue Polkadot Cup,11.12,8,12732.0,France
556526,2023-06-13,21239,Pink Polkadot Cup,11.12,8,12732.0,France
556526,2023-06-13,21243,Pink Polkadot Plate,11.98,8,12732.0,France
556526,2023-06-13,22328,Round Snack Boxes Set Of 4 Fruits,13.27,6,12732.0,France
556527,2023-06-13,23238,Set Of 4 Knick Knack Tins London,14.5,2,16205.0,United Kingdom
556527,2023-06-13,23298,Spotty Bunting,15.32,2,16205.0,United Kingdom
556527,2023-06-13,21096,Set/6 Fruit Salad Paper Plates,10.65,2,16205.0,United Kingdom
556527,2023-06-13,23193,Buffalo Bill Treasure Book Box,12.56,1,16205.0,United Kingdom
556527,2023-06-13,23000,Travel Card Wallet Transport,10.68,1,16205.0,United Kingdom
556527,2023-06-13,84596F,Small Marshmallows Pink Bowl,10.68,1,16205.0,United Kingdom
556527,2023-06-13,21088,Set/6 Fruit Salad Paper Cups,10.44,2,16205.0,United Kingdom
556527,2023-06-13,84596B,Small Dolly Mix Design Orange Bowl,10.68,1,16205.0,United Kingdom
556527,2023-06-13,22729,Alarm Clock Bakelike Orange,14.09,1,16205.0,United Kingdom
556527,2023-06-13,22728,Alarm Clock Bakelike Pink,14.09,2,16205.0,United Kingdom
556527,2023-06-13,22727,Alarm Clock Bakelike Red,14.09,1,16205.0,United Kingdom
556527,2023-06-13,22730,Alarm Clock Bakelike Ivory,14.09,1,16205.0,United Kingdom
556527,2023-06-13,22268,Decoration Sitting Bunny,10.44,10,16205.0,United Kingdom
556527,2023-06-13,22197,Popcorn Holder,11.12,3,16205.0,United Kingdom
556527,2023-06-13,22629,Spaceboy Lunch Box,12.25,2,16205.0,United Kingdom
556527,2023-06-13,23084,Rabbit Night Light,12.38,2,16205.0,United Kingdom
556527,2023-06-13,22659,Lunch Box I Love London,12.25,6,16205.0,United Kingdom
556527,2023-06-13,21933,Pink Vintage Paisley Picnic Bag,11.94,2,16205.0,United Kingdom
556527,2023-06-13,21936,Red Retrospot Picnic Bag,13.27,2,16205.0,United Kingdom
556527,2023-06-13,21932,Scandinavian Paisley Picnic Bag,11.94,2,16205.0,United Kingdom
556527,2023-06-13,21937,Strawberry Picnic Bag,13.27,2,16205.0,United Kingdom
556527,2023-06-13,23203,Jumbo Bag Vintage Doily,6.19,2,16205.0,United Kingdom
556527,2023-06-13,23343,Jumbo Bag Vintage Christmas,6.19,2,16205.0,United Kingdom
556527,2023-06-13,23209,Lunch Bag Vintage Doily,5.97,3,16205.0,United Kingdom
556527,2023-06-13,22662,Lunch Bag Dolly Girl Design,5.97,2,16205.0,United Kingdom
556527,2023-06-13,23207,Lunch Bag Alphabet Design,5.97,3,16205.0,United Kingdom
556528,2023-06-13,23112,Parisienne Curio Cabinet,17.94,2,13269.0,United Kingdom
556528,2023-06-13,23237,Set Of 4 Knick Knack Tins Leaf,14.5,6,13269.0,United Kingdom
556528,2023-06-13,23308,Set Of 60 Vintage Leaf Cake Cases,10.81,24,13269.0,United Kingdom
556528,2023-06-13,22197,Popcorn Holder,11.12,12,13269.0,United Kingdom
556528,2023-06-13,22752,Set 7 Babushka Nesting Boxes,18.96,2,13269.0,United Kingdom
556528,2023-06-13,22629,Spaceboy Lunch Box,12.25,12,13269.0,United Kingdom
556528,2023-06-13,22431,Watering Can Blue Elephant,12.25,12,13269.0,United Kingdom
556528,2023-06-13,47566,Party Bunting,15.32,4,13269.0,United Kingdom
556528,2023-06-13,21232,Strawberry Ceramic Trinket Pot,11.53,12,13269.0,United Kingdom
556528,2023-06-13,22083,Paper Chain Kit Retrospot,13.27,6,13269.0,United Kingdom
556528,2023-06-13,22963,Jam Jar With Green Lid,11.12,12,13269.0,United Kingdom
556528,2023-06-13,21137,Black Record Cover Frame,14.09,4,13269.0,United Kingdom
556528,2023-06-13,22610,Pens Assorted Funny Face,10.44,36,13269.0,United Kingdom
556528,2023-06-13,21498,Red Retrospot Wrap,10.68,25,13269.0,United Kingdom
556528,2023-06-13,22986,Wrap Gingham Rose,10.68,25,13269.0,United Kingdom
556528,2023-06-13,22961,Jam Making Set Printed,11.74,12,13269.0,United Kingdom
556528,2023-06-13,23201,Jumbo Bag Alphabet,6.19,10,13269.0,United Kingdom
556528,2023-06-13,23202,Jumbo Bag Vintage Leaf,6.19,10,13269.0,United Kingdom
556528,2023-06-13,85099B,Jumbo Bag Red Retrospot,6.19,10,13269.0,United Kingdom
556529,2023-06-13,21931,Jumbo Storage Bag Suki,12.38,10,12714.0,France
556529,2023-06-13,22411,Jumbo Shopper Vintage Red Paisley,12.38,10,12714.0,France
556529,2023-06-13,21936,Red Retrospot Picnic Bag,13.27,5,12714.0,France
556529,2023-06-13,21937,Strawberry Picnic Bag,13.27,5,12714.0,France
556529,2023-06-13,23050,Recycled Acapulco Mat Green,18.71,2,12714.0,France
556529,2023-06-13,21537,Red Retrospot Pudding Bowl,14.61,4,12714.0,France
556529,2023-06-13,22332,Skulls Party Bag + Sticker Set,11.94,8,12714.0,France
556529,2023-06-13,22333,Retrospot Party Bag + Sticker Set,11.94,8,12714.0,France
556529,2023-06-13,22331,Woodland Party Bag + Sticker Set,11.94,8,12714.0,France
556529,2023-06-13,23308,Set Of 60 Vintage Leaf Cake Cases,10.81,24,12714.0,France
556529,2023-06-13,21558,Skull Lunch Box With Cutlery,12.86,6,12714.0,France
556529,2023-06-13,21559,Strawberry Lunch Box With Cutlery,12.86,12,12714.0,France
556529,2023-06-13,21914,Blue Harmonica In Box,11.53,12,12714.0,France
556529,2023-06-13,22352,Lunch Box With Cutlery Retrospot,12.86,12,12714.0,France
556529,2023-06-13,23084,Rabbit Night Light,12.08,24,12714.0,France
556529,2023-06-13,21239,Pink Polkadot Cup,11.12,16,12714.0,France
556529,2023-06-13,21928,Jumbo Bag Scandinavian Blue Paisley,6.19,10,12714.0,France
556529,2023-06-13,20712,Jumbo Bag Woodland Animals,6.19,10,12714.0,France
556529,2023-06-13,21929,Jumbo Bag Pink Vintage Paisley,6.19,10,12714.0,France
556529,2023-06-13,22386,Jumbo Bag Pink Polkadot,6.19,10,12714.0,France
556529,2023-06-13,23201,Jumbo Bag Alphabet,6.19,10,12714.0,France
556529,2023-06-13,23209,Lunch Bag Vintage Doily,5.97,10,12714.0,France
556529,2023-06-13,21039,Red Retrospot Shopping Bag,6.43,6,12714.0,France
556531,2023-06-13,23243,Set Of Tea Coffee Sugar Tins Pantry,15.32,4,15491.0,United Kingdom
556531,2023-06-13,47566,Party Bunting,15.32,8,15491.0,United Kingdom
556531,2023-06-13,22178,Victorian Glass Hanging T-Light,11.53,12,15491.0,United Kingdom
556531,2023-06-13,84946,Antique Silver T-Light Glass,11.53,12,15491.0,United Kingdom
556531,2023-06-13,84978,Hanging Heart Jar T-Light Holder,11.53,24,15491.0,United Kingdom
556531,2023-06-13,22457,Natural Slate Heart Chalkboard,13.27,6,15491.0,United Kingdom
556531,2023-06-13,22464,Hanging Metal Heart Lantern,11.94,12,15491.0,United Kingdom
556531,2023-06-13,22627,Mint Kitchen Scales,18.96,2,15491.0,United Kingdom
556531,2023-06-13,22123,Ping Microwave Apron,12.25,12,15491.0,United Kingdom
556531,2023-06-13,21519,Gin & Tonic Diet Greeting Card,10.68,12,15491.0,United Kingdom
556531,2023-06-13,21391,French Lavender Scent Heart,11.02,12,15491.0,United Kingdom
556531,2023-06-13,22771,Clear Drawer Knob Acrylic Edwardian,11.53,12,15491.0,United Kingdom
556531,2023-06-13,82494L,Wooden Frame Antique White,13.27,6,15491.0,United Kingdom
556531,2023-06-13,23053,Recycled Acapulco Mat Pink,18.71,2,15491.0,United Kingdom
556531,2023-06-13,23052,Recycled Acapulco Mat Turquoise,18.71,2,15491.0,United Kingdom
556531,2023-06-13,23054,Recycled Acapulco Mat Lavender,18.71,2,15491.0,United Kingdom
556531,2023-06-13,23050,Recycled Acapulco Mat Green,18.71,2,15491.0,United Kingdom
556531,2023-06-13,21534,Dairy Maid Large Milk Jug,15.32,3,15491.0,United Kingdom
556531,2023-06-13,21535,Red Retrospot Small Milk Jug,12.86,6,15491.0,United Kingdom
556531,2023-06-13,22117,Metal Sign Her Dinner Is Served,13.27,6,15491.0,United Kingdom
556531,2023-06-13,21175,Gin And Tonic Diet Metal Sign,12.86,12,15491.0,United Kingdom
556531,2023-06-13,21166,Cook With Wine Metal Sign,12.38,12,15491.0,United Kingdom
556531,2023-06-13,85152,Hand Over The Chocolate Sign,12.4,12,15491.0,United Kingdom
556531,2023-06-13,21164,Home Sweet Home Metal Sign,13.27,6,15491.0,United Kingdom
556531,2023-06-13,21165,Beware Of The Cat Metal Sign,11.98,12,15491.0,United Kingdom
556531,2023-06-13,21770,Open Closed Metal Sign,15.32,2,15491.0,United Kingdom
556531,2023-06-13,21908,Chocolate This Way Metal Sign,12.4,12,15491.0,United Kingdom
556531,2023-06-13,23066,Small Deco Jewellery Stand,18.71,2,15491.0,United Kingdom
556531,2023-06-13,84970L,Single Heart Zinc T-Light Holder,11.22,24,15491.0,United Kingdom
556531,2023-06-13,84970S,Hanging Heart Zinc T-Light Holder,11.12,24,15491.0,United Kingdom
556531,2023-06-13,85062,Pearl Crystal Pumpkin T-Light Hldr,11.94,12,15491.0,United Kingdom
556531,2023-06-13,21874,Gin And Tonic Mug,11.53,24,15491.0,United Kingdom
556533,2023-06-13,21912,Vintage Snakes & Ladders,14.09,4,15625.0,United Kingdom
556533,2023-06-13,84945,Multi Colour Silver T-Light Holder,11.12,24,15625.0,United Kingdom
556533,2023-06-13,15036,Assorted Colours Silk Fan,11.1,48,15625.0,United Kingdom
556533,2023-06-13,22693,Grow A Flytrap Or Sunflower In Tin,11.53,24,15625.0,United Kingdom
556533,2023-06-13,21914,Blue Harmonica In Box,11.53,24,15625.0,United Kingdom
556533,2023-06-13,21915,Red Harmonica In Box,11.53,24,15625.0,United Kingdom
556533,2023-06-13,21791,Vintage Heads And Tails Card Game,11.53,12,15625.0,United Kingdom
556533,2023-06-13,21790,Vintage Snap Cards,11.12,12,15625.0,United Kingdom
556533,2023-06-13,21936,Red Retrospot Picnic Bag,13.27,10,15625.0,United Kingdom
556533,2023-06-13,21868,Potting Shed Tea Mug,11.53,24,15625.0,United Kingdom
556534,2023-06-13,37479B,Cubic Mug Flock Blue On Brown,10.65,60,15036.0,United Kingdom
556534,2023-06-13,85035B,Chocolate 3 Wick Morris Box Candle,14.61,4,15036.0,United Kingdom
556536,2023-06-13,23309,Set Of 60 I Love London Cake Cases,10.81,2,17795.0,United Kingdom
556536,2023-06-13,22467,Gumball Coat Rack,12.86,1,17795.0,United Kingdom
556536,2023-06-13,22076,6 Ribbons Empire,11.94,1,17795.0,United Kingdom
556536,2023-06-13,84375,Set Of 20 Kids Cookie Cutters,12.4,12,17795.0,United Kingdom
556536,2023-06-13,84865,New Baroque Black Photo Album,13.27,2,17795.0,United Kingdom
556536,2023-06-13,23192,Bundle Of 3 Alphabet Exercise Books,11.94,1,17795.0,United Kingdom
556536,2023-06-13,23190,Bundle Of 3 School Exercise Books,11.94,1,17795.0,United Kingdom
556536,2023-06-13,22609,Pens Assorted Spaceball,10.44,36,17795.0,United Kingdom
556536,2023-06-13,22558,Clothes Pegs Retrospot Pack 24,11.94,1,17795.0,United Kingdom
556536,2023-06-13,20992,Jazz Hearts Purse Notebook,10.65,6,17795.0,United Kingdom
556536,2023-06-13,21634,Assorted Mini Madras Notebook,10.65,24,17795.0,United Kingdom
556536,2023-06-13,10133,Colouring Pencils Brown Tube,10.68,10,17795.0,United Kingdom
556536,2023-06-13,23165,Large Ceramic Top Storage Jar,11.94,4,17795.0,United Kingdom
556536,2023-06-13,23238,Set Of 4 Knick Knack Tins London,14.5,4,17795.0,United Kingdom
556536,2023-06-13,85132B,Charlie And Lola Table Tins,12.25,2,17795.0,United Kingdom
556536,2023-06-13,85132C,Charlie And Lola Figures Tins,12.25,2,17795.0,United Kingdom
556536,2023-06-13,21051,Ribbons Purse,12.4,1,17795.0,United Kingdom
556536,2023-06-13,22621,Traditional Knitting Nancy,11.94,8,17795.0,United Kingdom
556536,2023-06-13,22619,Set Of 6 Soldier Skittles,14.09,3,17795.0,United Kingdom
556536,2023-06-13,21890,S/6 Wooden Skittles In Cotton Bag,13.58,3,17795.0,United Kingdom
556536,2023-06-13,21892,Traditional Wooden Catch Cup Game,11.53,8,17795.0,United Kingdom
556536,2023-06-13,47310M,Small Pop Box Funky Monkey,11.53,4,17795.0,United Kingdom
556536,2023-06-13,47591D,Pink Fairy Cake Childrens Apron,12.25,2,17795.0,United Kingdom
556536,2023-06-13,21156,Retrospot Childrens Apron,12.25,2,17795.0,United Kingdom
556536,2023-06-13,22367,Childrens Apron Spaceboy Design,12.25,2,17795.0,United Kingdom
556536,2023-06-13,22898,Childrens Apron Apples Design,12.25,2,17795.0,United Kingdom
556536,2023-06-13,22899,Children's Apron Dolly Girl,12.4,3,17795.0,United Kingdom
556536,2023-06-13,21034,Rex Cash+Carry Jumbo Shopper,11.22,2,17795.0,United Kingdom
556537,2023-06-13,23075,Parlour Ceramic Wall Hook,14.5,4,17725.0,United Kingdom
556537,2023-06-13,21609,Set 12 Lavender Botanical T-Lights,13.27,6,17725.0,United Kingdom
556537,2023-06-13,85231G,Orange Scented Set/9 T-Lights,11.12,12,17725.0,United Kingdom
556537,2023-06-13,22040,Botanical Rose Gift Wrap,10.68,25,17725.0,United Kingdom
556537,2023-06-13,22038,Botanical Lavender Gift Wrap,10.68,25,17725.0,United Kingdom
556537,2023-06-13,23232,Wrap Vintage Leaf Design,10.68,25,17725.0,United Kingdom
556537,2023-06-13,21499,Blue Polkadot Wrap,10.68,25,17725.0,United Kingdom
556537,2023-06-13,22178,Victorian Glass Hanging T-Light,11.53,12,17725.0,United Kingdom
556537,2023-06-13,84836,Zinc Metal Heart Decoration,11.53,12,17725.0,United Kingdom
556537,2023-06-13,85038,6 Chocolate Love Heart T-Lights,12.4,6,17725.0,United Kingdom
556537,2023-06-13,85040A,S/4 Pink Flower Candles In Bowl,11.94,12,17725.0,United Kingdom
556537,2023-06-13,84755,Colour Glass T-Light Holder Hanging,10.92,16,17725.0,United Kingdom
556537,2023-06-13,84687,Beach Hut Shelf W 3 Drawers,16.35,2,17725.0,United Kingdom
556537,2023-06-13,22470,Heart Of Wicker Large,13.27,6,17725.0,United Kingdom
556537,2023-06-13,23182,Toilet Sign Occupied Or Vacant,11.1,24,17725.0,United Kingdom
556537,2023-06-13,85230E,Strawbry Scented Votive Candle,10.55,24,17725.0,United Kingdom
556537,2023-06-13,23096,Petit Tray Chic,11.94,12,17725.0,United Kingdom
556537,2023-06-13,21417,Cockle Shell Dish,12.4,12,17725.0,United Kingdom
556537,2023-06-13,22296,Heart Ivory Trellis Large,11.94,12,17725.0,United Kingdom
556538,2023-06-13,23301,Gardeners Kneeling Pad Keep Calm,11.94,24,15845.0,United Kingdom
556538,2023-06-13,22469,Heart Of Wicker Small,11.94,24,15845.0,United Kingdom
556538,2023-06-13,22624,Ivory Kitchen Scales,18.96,6,15845.0,United Kingdom
556538,2023-06-13,22666,Recipe Box Pantry Yellow Design,13.27,12,15845.0,United Kingdom
556538,2023-06-13,84978,Hanging Heart Jar T-Light Holder,11.53,12,15845.0,United Kingdom
556538,2023-06-13,22791,T-Light Glass Fluted Antique,11.53,12,15845.0,United Kingdom
556538,2023-06-13,84946,Antique Silver T-Light Glass,11.53,12,15845.0,United Kingdom
556538,2023-06-13,82578,Kitchen Metal Sign,10.81,12,15845.0,United Kingdom
556538,2023-06-13,21977,Pack Of 60 Pink Paisley Cake Cases,10.81,24,15845.0,United Kingdom
556538,2023-06-13,22841,Round Cake Tin Vintage Green,18.4,2,15845.0,United Kingdom
556538,2023-06-13,21986,Pack Of 12 Pink Polkadot Tissues,10.55,24,15845.0,United Kingdom
556538,2023-06-13,21984,Pack Of 12 Pink Paisley Tissues,10.55,24,15845.0,United Kingdom
556538,2023-06-13,84536A,English Rose Notebook A7 Size,10.68,16,15845.0,United Kingdom
556538,2023-06-13,23307,Set Of 60 Pantry Design Cake Cases,10.81,48,15845.0,United Kingdom
556538,2023-06-13,22960,Jam Making Set With Jars,14.61,6,15845.0,United Kingdom
556538,2023-06-13,22961,Jam Making Set Printed,11.74,12,15845.0,United Kingdom
556538,2023-06-13,22963,Jam Jar With Green Lid,11.12,12,15845.0,United Kingdom
556538,2023-06-13,22993,Set Of 4 Pantry Jelly Moulds,11.53,12,15845.0,United Kingdom
