TransactionNo,Date,ProductNo,ProductName,Price,Quantity,CustomerNo,Country
548191,2023-03-29,21790,Vintage Snap Cards,11.92,1,16191.0,United Kingdom
548191,2023-03-29,21916,Set 12 Retro White Chalk Sticks,11.1,1,16191.0,United Kingdom
548191,2023-03-29,21991,Bohemian Collage Stationery Set,12.77,1,16191.0,United Kingdom
548191,2023-03-29,22059,Ceramic Strawberry Design Mug,13.62,1,16191.0,United Kingdom
548191,2023-03-29,22062,Ceramic Bowl With Love Heart Design,12.77,2,16191.0,United Kingdom
548191,2023-03-29,22065,Christmas Pudding Trinket Pot,13.62,1,16191.0,United Kingdom
548191,2023-03-29,22073,Red Retrospot Storage Jar,17.9,1,16191.0,United Kingdom
548191,2023-03-29,22078,Ribbon Reel Lace Design,14.48,1,16191.0,United Kingdom
548191,2023-03-29,22084,Paper Chain Kit Empire,16.18,5,16191.0,United Kingdom
548191,2023-03-29,22087,Paper Bunting White Lace,16.18,1,16191.0,United Kingdom
548191,2023-03-29,22134,Mini Ladle Love Heart Red,11.1,2,16191.0,United Kingdom
548191,2023-03-29,22156,Heart Decoration With Pearls,11.92,1,16191.0,United Kingdom
548191,2023-03-29,22178,Victorian Glass Hanging T-Light,12.77,12,16191.0,United Kingdom
548191,2023-03-29,22219,Lovebird Hanging Decoration White,11.92,4,16191.0,United Kingdom
548191,2023-03-29,22229,Bunny Wooden Painted With Flower,11.92,2,16191.0,United Kingdom
548191,2023-03-29,22230,Jigsaw Tree With Watering Can,11.92,1,16191.0,United Kingdom
548191,2023-03-29,22246,Magic Garden Felt Garland,14.48,1,16191.0,United Kingdom
548191,2023-03-29,22247,Bunny Decoration Magic Garden,11.92,1,16191.0,United Kingdom
548191,2023-03-29,22260,Felt Egg Cosy Blue Rabbit,11.92,1,16191.0,United Kingdom
548191,2023-03-29,22265,Easter Decoration Natural Chick,11.53,1,16191.0,United Kingdom
548191,2023-03-29,22268,Decoration Sitting Bunny,11.92,1,16191.0,United Kingdom
548191,2023-03-29,22276,Wash Bag Vintage Rose Paisley,16.18,1,16191.0,United Kingdom
548191,2023-03-29,22277,Cosmetic Bag Vintage Rose Paisley,14.48,1,16191.0,United Kingdom
548191,2023-03-29,22284,Hen House Decoration,13.62,1,16191.0,United Kingdom
548191,2023-03-29,22293,Hanging Chick Green Decoration,13.24,1,16191.0,United Kingdom
548191,2023-03-29,22296,Heart Ivory Trellis Large,13.62,3,16191.0,United Kingdom
548191,2023-03-29,22315,200 Red + White Bendy Straws,12.77,1,16191.0,United Kingdom
548191,2023-03-29,22316,200 Bendy Skull Straws,12.77,1,16191.0,United Kingdom
548191,2023-03-29,22326,Round Snack Boxes Set Of4 Woodland,16.18,2,16191.0,United Kingdom
548191,2023-03-29,22335,Heart Decoration Painted Zinc,11.53,4,16191.0,United Kingdom
548191,2023-03-29,22341,Love Garland Painted Zinc,13.62,1,16191.0,United Kingdom
548191,2023-03-29,22362,Glass Jar Peacock Bath Salts,16.18,1,16191.0,United Kingdom
548191,2023-03-29,22377,Bottle Bag Retrospot,14.48,1,16191.0,United Kingdom
548191,2023-03-29,22379,Recycling Bag Retrospot,14.48,2,16191.0,United Kingdom
548191,2023-03-29,22411,Jumbo Shopper Vintage Red Paisley,14.48,1,16191.0,United Kingdom
548191,2023-03-29,22429,Enamel Measuring Jug Cream,18.75,1,16191.0,United Kingdom
548191,2023-03-29,22457,Natural Slate Heart Chalkboard,16.18,1,16191.0,United Kingdom
548191,2023-03-29,22467,Gumball Coat Rack,15.33,1,16191.0,United Kingdom
548191,2023-03-29,22469,Heart Of Wicker Small,13.62,1,16191.0,United Kingdom
548191,2023-03-29,22497,Set Of 2 Tins Vintage Bathroom,18.75,2,16191.0,United Kingdom
548191,2023-03-29,22508,Doorstop Retrospot Heart,17.9,1,16191.0,United Kingdom
548191,2023-03-29,22549,Picture Dominoes,13.62,1,16191.0,United Kingdom
548191,2023-03-29,22555,Plasters In Tin Strongman,13.62,1,16191.0,United Kingdom
548191,2023-03-29,22616,Pack Of 12 London Tissues,11.1,11,16191.0,United Kingdom
548191,2023-03-29,22630,Dolly Girl Lunch Box,14.48,1,16191.0,United Kingdom
548191,2023-03-29,22661,Charlotte Bag Dolly Girl Design,11.92,1,16191.0,United Kingdom
548191,2023-03-29,22670,French Wc Sign Blue Metal,12.77,1,16191.0,United Kingdom
548191,2023-03-29,22680,French Blue Metal Door Sign 5,12.77,1,16191.0,United Kingdom
548191,2023-03-29,22697,Green Regency Teacup And Saucer,16.18,1,16191.0,United Kingdom
548191,2023-03-29,22729,Alarm Clock Bakelike Orange,17.9,1,16191.0,United Kingdom
548191,2023-03-29,22736,Ribbon Reel Making Snowmen,13.62,1,16191.0,United Kingdom
548191,2023-03-29,22737,Ribbon Reel Christmas Present,13.62,1,16191.0,United Kingdom
548191,2023-03-29,22758,Large Purple Babushka Notebook,12.77,1,16191.0,United Kingdom
548191,2023-03-29,22766,Photo Frame Cornice,16.18,1,16191.0,United Kingdom
548191,2023-03-29,22798,Antique Glass Dressing Table Pot,16.18,2,16191.0,United Kingdom
548191,2023-03-29,22800,Antique Tall Swirlglass Trinket Pot,17.9,1,16191.0,United Kingdom
548191,2023-03-29,22801,Antique Glass Pedestal Bowl,17.9,15,16191.0,United Kingdom
548191,2023-03-29,22814,Card Party Games,11.1,1,16191.0,United Kingdom
548191,2023-03-29,22860,Easter Tin Chicks Pink Daisy,13.62,1,16191.0,United Kingdom
548191,2023-03-29,22884,Number Tile Vintage Font 5,14.48,1,16191.0,United Kingdom
548191,2023-03-29,22933,Baking Mould Easter Egg Milk Choc,16.18,1,16191.0,United Kingdom
548191,2023-03-29,22939,Adult Apron Apple Delight,15.33,1,16191.0,United Kingdom
548191,2023-03-29,22957,Set 3 Paper Vintage Chick Paper Egg,16.18,1,16191.0,United Kingdom
548191,2023-03-29,22994,Travel Card Wallet Retrospot,11.1,1,16191.0,United Kingdom
548191,2023-03-29,23158,Set Of 5 Lucky Cat Magnets,14.48,1,16191.0,United Kingdom
548191,2023-03-29,23159,Set Of 5 Pancake Day Magnets,14.48,2,16191.0,United Kingdom
548191,2023-03-29,35911A,Multicolour Rabbit Egg Warmer,11.1,10,16191.0,United Kingdom
548191,2023-03-29,35915C,Peach Knitted Hen,11.1,2,16191.0,United Kingdom
548191,2023-03-29,35961,Folkart Zinc Heart Christmas Dec,11.92,3,16191.0,United Kingdom
548191,2023-03-29,37448,Ceramic Cake Design Spotted Mug,13.62,2,16191.0,United Kingdom
548191,2023-03-29,46776C,Woven Frost Cushion Cover,14.48,1,16191.0,United Kingdom
548191,2023-03-29,46776F,Woven Rose Garden Cushion Cover,14.48,2,16191.0,United Kingdom
548191,2023-03-29,47593B,Scottie Dogs Baby Bib,11.1,1,16191.0,United Kingdom
548191,2023-03-29,71459,Hanging Jam Jar T-Light Holders,11.95,4,16191.0,United Kingdom
548191,2023-03-29,72351A,Set/6 Turquoise Butterfly T-Lights,14.48,8,16191.0,United Kingdom
548191,2023-03-29,72586,Set Of 6 Halloween Ghost T-Lights,11.1,2,16191.0,United Kingdom
548191,2023-03-29,79000,Moroccan Tea Glass,11.94,15,16191.0,United Kingdom
548191,2023-03-29,79144B,Painted Lightbulb Star+ Moon,11.1,2,16191.0,United Kingdom
548191,2023-03-29,82494L,Wooden Frame Antique White,17.9,1,16191.0,United Kingdom
548191,2023-03-29,21171,Bathroom Metal Sign,11.53,1,16191.0,United Kingdom
548191,2023-03-29,82583,Hot Baths Metal Sign,14.48,1,16191.0,United Kingdom
548191,2023-03-29,84378,Set Of 3 Heart Cookie Cutters,12.77,1,16191.0,United Kingdom
548191,2023-03-29,84536A,English Rose Notebook A7 Size,11.1,11,16191.0,United Kingdom
548191,2023-03-29,84596B,Small Dolly Mix Design Orange Bowl,11.1,2,16191.0,United Kingdom
548191,2023-03-29,84596E,Small Licorice Des Pink Bowl,11.1,2,16191.0,United Kingdom
548191,2023-03-29,84596F,Small Marshmallows Pink Bowl,11.1,2,16191.0,United Kingdom
548191,2023-03-29,84596J,Mixed Nuts Light Green Bowl,11.1,2,16191.0,United Kingdom
548191,2023-03-29,84596L,Biscuits Small Bowl Light Blue,11.1,2,16191.0,United Kingdom
548191,2023-03-29,84625C,Blue New Baroque Candlestick Candle,16.18,1,16191.0,United Kingdom
548191,2023-03-29,84692,Box Of 24 Cocktail Parasols,11.1,2,16191.0,United Kingdom
548191,2023-03-29,84754,S/15 Silver Glass Baubles In Bag,12.77,2,16191.0,United Kingdom
548191,2023-03-29,84913A,Soft Pink Rose Towel,13.62,1,16191.0,United Kingdom
548191,2023-03-29,84913B,Mint Green Rose Towel,13.62,1,16191.0,United Kingdom
548191,2023-03-29,84946,Antique Silver T-Light Glass,12.77,15,16191.0,United Kingdom
548191,2023-03-29,84949,Silver Hanging T-Light Holder,13.62,12,16191.0,United Kingdom
548191,2023-03-29,84978,Hanging Heart Jar T-Light Holder,12.77,2,16191.0,United Kingdom
548191,2023-03-29,84988,Set Of 72 Pink Heart Paper Doilies,13.24,1,16191.0,United Kingdom
548191,2023-03-29,84991,60 Teatime Fairy Cake Cases,11.53,1,16191.0,United Kingdom
548191,2023-03-29,85049D,Bright Blues Ribbons,12.77,2,16191.0,United Kingdom
548191,2023-03-29,85093,Candy Spot Egg Warmer Hare,11.1,3,16191.0,United Kingdom
548191,2023-03-29,85131A,Beaded Pearl Heart White On Stick,11.1,4,16191.0,United Kingdom
548191,2023-03-29,85131D,Beaded Crystal Heart Pink On Stick,11.1,2,16191.0,United Kingdom
548191,2023-03-29,85150,Ladies & Gentlemen Metal Sign,15.33,1,16191.0,United Kingdom
548191,2023-03-29,85169C,Eau De Nil Love Bird Candle,12.77,2,16191.0,United Kingdom
548191,2023-03-29,85170C,Set/6 Eau De Nil Bird T-Lights,14.48,1,16191.0,United Kingdom
548191,2023-03-29,85186A,Easter Bunny Garland Of Flowers,11.1,8,16191.0,United Kingdom
548191,2023-03-29,85186C,Bunny Egg Garland,11.1,6,16191.0,United Kingdom
548191,2023-03-29,85194L,Hanging Spring Flower Egg Large,11.92,1,16191.0,United Kingdom
548191,2023-03-29,85203,Hanging Wood And Felt Butterfly,11.06,2,16191.0,United Kingdom
548191,2023-03-29,90024E,New Baroque B'fly Necklace Montana,18.78,1,16191.0,United Kingdom
548191,2023-03-29,90030B,Red Kukui Coconut Seed Necklace,16.22,1,16191.0,United Kingdom
548191,2023-03-29,90201A,Purple Enamel Flower Ring,13.22,1,16191.0,United Kingdom
548191,2023-03-29,90201B,Black Enamel Flower Ring,13.22,1,16191.0,United Kingdom
548191,2023-03-29,15039,Sandalwood Fan,11.92,1,16191.0,United Kingdom
548191,2023-03-29,16235,Recycled Pencil With Rabbit Eraser,10.68,5,16191.0,United Kingdom
548191,2023-03-29,20719,Woodland Charlotte Bag,11.92,2,16191.0,United Kingdom
548191,2023-03-29,20724,Red Retrospot Charlotte Bag,11.92,1,16191.0,United Kingdom
548191,2023-03-29,20733,Gold Mini Tape Measure,11.1,1,16191.0,United Kingdom
548191,2023-03-29,20914,Set/5 Red Retrospot Lid Glass Bowls,16.18,1,16191.0,United Kingdom
548191,2023-03-29,21012,Antique All Glass Candlestick,12.77,1,16191.0,United Kingdom
548191,2023-03-29,21041,Red Retrospot Oven Glove Double,16.18,1,16191.0,United Kingdom
548191,2023-03-29,21078,Set/20 Strawberry Paper Napkins,11.92,3,16191.0,United Kingdom
548191,2023-03-29,21094,Set/6 Red Spotty Paper Plates,11.1,10,16191.0,United Kingdom
548191,2023-03-29,21122,Set/10 Pink Polkadot Party Candles,12.77,1,16191.0,United Kingdom
548191,2023-03-29,21126,Set Of 6 Girls Celebration Candles,12.77,1,16191.0,United Kingdom
548191,2023-03-29,21155,Red Retrospot Peg Bag,15.33,1,16191.0,United Kingdom
548191,2023-03-29,21179,No Junk Mail Metal Sign,11.92,1,16191.0,United Kingdom
548191,2023-03-29,21209,Multicolour Honeycomb Fan,13.62,1,16191.0,United Kingdom
548191,2023-03-29,21231,Sweetheart Ceramic Trinket Box,12.77,1,16191.0,United Kingdom
548191,2023-03-29,21928,Jumbo Bag Scandinavian Blue Paisley,7.24,1,16191.0,United Kingdom
548191,2023-03-29,85099B,Jumbo Bag Red Retrospot,7.24,1,16191.0,United Kingdom
548191,2023-03-29,20712,Jumbo Bag Woodland Animals,7.24,1,16191.0,United Kingdom
548192,2023-03-29,23077,Doughnut Lip Gloss,11.53,20,17364.0,United Kingdom
548192,2023-03-29,22492,Mini Paint Set Vintage,10.92,36,17364.0,United Kingdom
548192,2023-03-29,84465,15 Pink Fluffy Chicks In Box,13.27,1,17364.0,United Kingdom
548192,2023-03-29,85200,Bunny Egg Box,11.53,6,17364.0,United Kingdom
548192,2023-03-29,22859,Easter Tin Bunny Bouquet,11.94,4,17364.0,United Kingdom
548192,2023-03-29,22957,Set 3 Paper Vintage Chick Paper Egg,13.27,6,17364.0,United Kingdom
548192,2023-03-29,84461,12 Pink Hen+Chicks In Basket,12.86,2,17364.0,United Kingdom
548192,2023-03-29,22148,Easter Craft 4 Chicks,12.25,5,17364.0,United Kingdom
548192,2023-03-29,21592,Retrospot Cigar Box Matches,11.53,5,17364.0,United Kingdom
548192,2023-03-29,22139,Retrospot Tea Set Ceramic 11 Pc,15.32,2,17364.0,United Kingdom
548192,2023-03-29,22992,Revolver Wooden Ruler,12.25,4,17364.0,United Kingdom
548192,2023-03-29,22991,Giraffe Wooden Ruler,12.25,4,17364.0,United Kingdom
548192,2023-03-29,22979,Pantry Washing Up Brush,11.74,4,17364.0,United Kingdom
548192,2023-03-29,23078,Ice Cream Pen Lip Gloss,11.53,24,17364.0,United Kingdom
548192,2023-03-29,23053,Recycled Acapulco Mat Pink,18.71,1,17364.0,United Kingdom
548192,2023-03-29,23054,Recycled Acapulco Mat Lavender,18.71,1,17364.0,United Kingdom
548192,2023-03-29,23051,Recycled Acapulco Mat Blue,18.71,1,17364.0,United Kingdom
548192,2023-03-29,23052,Recycled Acapulco Mat Turquoise,18.71,1,17364.0,United Kingdom
548192,2023-03-29,22170,Picture Frame Wood Triple Portrait,17.17,3,17364.0,United Kingdom
548192,2023-03-29,23127,Feltcraft Girl Nicole Kit,15.32,2,17364.0,United Kingdom
548192,2023-03-29,23128,Feltcraft Boy Jean-Paul Kit,15.32,2,17364.0,United Kingdom
548192,2023-03-29,22697,Green Regency Teacup And Saucer,13.27,1,17364.0,United Kingdom
548192,2023-03-29,22699,Roses Regency Teacup And Saucer,13.27,2,17364.0,United Kingdom
548194,2023-03-29,21399,Blue Polkadot Coffee Mug,11.92,1,14194.0,United Kingdom
548194,2023-03-29,21430,Set/3 Red Gingham Rose Storage Box,17.9,1,14194.0,United Kingdom
548194,2023-03-29,21507,Elephant Birthday Card,11.1,1,14194.0,United Kingdom
548194,2023-03-29,21508,Vintage Kid Dolly Card,11.1,1,14194.0,United Kingdom
548194,2023-03-29,21509,Cowboys And Indians Birthday Card,11.1,1,14194.0,United Kingdom
548194,2023-03-29,21669,Blue Stripe Ceramic Drawer Knob,13.62,5,14194.0,United Kingdom
548194,2023-03-29,21670,Blue Spot Ceramic Drawer Knob,13.62,2,14194.0,United Kingdom
548194,2023-03-29,21695,Small Silver Flower Candle Pot,16.18,1,14194.0,United Kingdom
548194,2023-03-29,21716,Boys Vintage Tin Seaside Bucket,15.33,1,14194.0,United Kingdom
548194,2023-03-29,21718,Red Metal Beach Spade,12.77,4,14194.0,United Kingdom
548194,2023-03-29,21731,Red Toadstool Led Night Light,13.62,1,14194.0,United Kingdom
548194,2023-03-29,21787,Rain Poncho Retrospot,11.92,1,14194.0,United Kingdom
548194,2023-03-29,21844,Red Retrospot Mug,16.18,1,14194.0,United Kingdom
548194,2023-03-29,21877,Home Sweet Home Mug,13.62,1,14194.0,United Kingdom
548194,2023-03-29,21878,Pack Of 6 Sandcastle Flags Assorted,11.92,3,14194.0,United Kingdom
548194,2023-03-29,21945,Strawberries Design Flannel,11.92,1,14194.0,United Kingdom
548194,2023-03-29,21974,Set Of 36 Paisley Flower Doilies,13.24,2,14194.0,United Kingdom
548194,2023-03-29,21977,Pack Of 60 Pink Paisley Cake Cases,11.53,1,14194.0,United Kingdom
548194,2023-03-29,21980,Pack Of 12 Red Retrospot Tissues,11.1,11,14194.0,United Kingdom
548194,2023-03-29,21981,Pack Of 12 Woodland Tissues,11.1,1,14194.0,United Kingdom
548194,2023-03-29,21985,Pack Of 12 Hearts Design Tissues,11.1,10,14194.0,United Kingdom
548194,2023-03-29,21992,Vintage Paisley Stationery Set,12.77,1,14194.0,United Kingdom
548194,2023-03-29,22030,Swallows Greeting Card,11.1,1,14194.0,United Kingdom
548194,2023-03-29,22077,6 Ribbons Rustic Charm,13.62,1,14194.0,United Kingdom
548194,2023-03-29,22089,Paper Bunting Vintage Paisley,16.18,3,14194.0,United Kingdom
548194,2023-03-29,22090,Paper Bunting Retrospot,16.18,4,14194.0,United Kingdom
548194,2023-03-29,22115,Metal Sign Empire Tea,16.18,1,14194.0,United Kingdom
548194,2023-03-29,22116,Metal Sign His Dinner Is Served,11.92,1,14194.0,United Kingdom
548194,2023-03-29,22178,Victorian Glass Hanging T-Light,12.77,55,14194.0,United Kingdom
548194,2023-03-29,22183,Cake Stand Victorian Filigree Med,16.18,1,14194.0,United Kingdom
548194,2023-03-29,22219,Lovebird Hanging Decoration White,11.92,1,14194.0,United Kingdom
548194,2023-03-29,22260,Felt Egg Cosy Blue Rabbit,11.92,6,14194.0,United Kingdom
548194,2023-03-29,22262,Felt Egg Cosy Chicken,11.92,1,14194.0,United Kingdom
548194,2023-03-29,22297,Heart Ivory Trellis Small,12.77,1,14194.0,United Kingdom
548194,2023-03-29,22299,Pig Keyring With Light & Sound,12.77,1,14194.0,United Kingdom
548194,2023-03-29,22304,Coffee Mug Blue Paisley Design,15.33,1,14194.0,United Kingdom
548194,2023-03-29,22311,Office Mug Warmer Black+Silver,16.18,1,14194.0,United Kingdom
548194,2023-03-29,22321,Bird Decoration Red Retrospot,11.92,4,14194.0,United Kingdom
548194,2023-03-29,22326,Round Snack Boxes Set Of4 Woodland,16.18,1,14194.0,United Kingdom
548194,2023-03-29,22342,Home Garland Painted Zinc,13.62,1,14194.0,United Kingdom
548194,2023-03-29,22355,Charlotte Bag Suki Design,11.92,1,14194.0,United Kingdom
548194,2023-03-29,22360,Glass Jar English Confectionery,16.18,1,14194.0,United Kingdom
548194,2023-03-29,22371,Airline Bag Vintage Tokyo 78,18.75,1,14194.0,United Kingdom
548194,2023-03-29,22398,Magnets Pack Of 4 Swallows,12.77,1,14194.0,United Kingdom
548194,2023-03-29,22421,Lipstick Pen Fuschia,11.1,12,14194.0,United Kingdom
548194,2023-03-29,22429,Enamel Measuring Jug Cream,18.75,1,14194.0,United Kingdom
548194,2023-03-29,22457,Natural Slate Heart Chalkboard,16.18,1,14194.0,United Kingdom
548194,2023-03-29,22464,Hanging Metal Heart Lantern,13.62,9,14194.0,United Kingdom
548194,2023-03-29,22469,Heart Of Wicker Small,13.62,2,14194.0,United Kingdom
548194,2023-03-29,22478,Birdhouse Garden Marker,12.77,1,14194.0,United Kingdom
548194,2023-03-29,22488,Natural Slate Rectangle Chalkboard,13.62,1,14194.0,United Kingdom
548194,2023-03-29,22492,Mini Paint Set Vintage,11.92,1,14194.0,United Kingdom
548194,2023-03-29,22538,Mini Jigsaw Go To The Fair,11.1,1,14194.0,United Kingdom
548194,2023-03-29,22541,Mini Jigsaw Leap Frog,11.1,1,14194.0,United Kingdom
548194,2023-03-29,22544,Mini Jigsaw Spaceboy,11.1,1,14194.0,United Kingdom
548194,2023-03-29,22558,Clothes Pegs Retrospot Pack 24,13.62,2,14194.0,United Kingdom
548194,2023-03-29,22561,Wooden School Colouring Set,13.62,1,14194.0,United Kingdom
548194,2023-03-29,22616,Pack Of 12 London Tissues,11.1,9,14194.0,United Kingdom
548194,2023-03-29,22665,Recipe Box Blue Sketchbook Design,16.18,1,14194.0,United Kingdom
548194,2023-03-29,22666,Recipe Box Pantry Yellow Design,16.18,3,14194.0,United Kingdom
548194,2023-03-29,22668,Pink Baby Bunting,16.18,3,14194.0,United Kingdom
548194,2023-03-29,22671,French Laundry Sign Blue Metal,13.62,1,14194.0,United Kingdom
548194,2023-03-29,22672,French Bathroom Sign Blue Metal,13.62,1,14194.0,United Kingdom
548194,2023-03-29,22675,French Kitchen Sign Blue Metal,12.77,1,14194.0,United Kingdom
548194,2023-03-29,22678,French Blue Metal Door Sign 3,12.77,1,14194.0,United Kingdom
548194,2023-03-29,22685,French Blue Metal Door Sign 0,12.77,1,14194.0,United Kingdom
548194,2023-03-29,22697,Green Regency Teacup And Saucer,16.18,1,14194.0,United Kingdom
548194,2023-03-29,22699,Roses Regency Teacup And Saucer,16.18,1,14194.0,United Kingdom
548194,2023-03-29,22719,Gumball Monochrome Coat Rack,12.77,1,14194.0,United Kingdom
548194,2023-03-29,22722,Set Of 6 Spice Tins Pantry Design,18.75,2,14194.0,United Kingdom
548194,2023-03-29,22726,Alarm Clock Bakelike Green,17.9,1,14194.0,United Kingdom
548194,2023-03-29,22728,Alarm Clock Bakelike Pink,17.9,1,14194.0,United Kingdom
548194,2023-03-29,22766,Photo Frame Cornice,16.18,1,14194.0,United Kingdom
548194,2023-03-29,22771,Clear Drawer Knob Acrylic Edwardian,12.77,4,14194.0,United Kingdom
548194,2023-03-29,22815,Card Psychedelic Apples,11.1,1,14194.0,United Kingdom
548194,2023-03-29,22860,Easter Tin Chicks Pink Daisy,13.62,1,14194.0,United Kingdom
548194,2023-03-29,22900,Set 2 Tea Towels I Love London,17.05,1,14194.0,United Kingdom
548194,2023-03-29,22916,Herb Marker Thyme,11.92,1,14194.0,United Kingdom
548194,2023-03-29,22917,Herb Marker Rosemary,11.92,1,14194.0,United Kingdom
548194,2023-03-29,22920,Herb Marker Basil,11.92,1,14194.0,United Kingdom
548194,2023-03-29,22921,Herb Marker Chives,11.92,1,14194.0,United Kingdom
548194,2023-03-29,22949,Set Of 36 Dolly Girl Paper Doilies,13.24,1,14194.0,United Kingdom
548194,2023-03-29,22960,Jam Making Set With Jars,18.75,2,14194.0,United Kingdom
548194,2023-03-29,22966,Gingerbread Man Cookie Cutter,12.77,1,14194.0,United Kingdom
548194,2023-03-29,22984,Card Gingham Rose,11.1,1,14194.0,United Kingdom
548194,2023-03-29,23004,Travel Card Wallet Pantry,11.1,1,14194.0,United Kingdom
548194,2023-03-29,23006,Travel Card Wallet Flower Meadow,11.1,1,14194.0,United Kingdom
548194,2023-03-29,23155,Knickerbockerglory Magnet Assorted,18.75,1,14194.0,United Kingdom
548194,2023-03-29,23156,Set Of 5 Mini Grocery Magnets,14.48,1,14194.0,United Kingdom
548194,2023-03-29,23158,Set Of 5 Lucky Cat Magnets,14.48,1,14194.0,United Kingdom
548194,2023-03-29,35915C,Peach Knitted Hen,11.1,2,14194.0,United Kingdom
548194,2023-03-29,35961,Folkart Zinc Heart Christmas Dec,11.92,1,14194.0,United Kingdom
548194,2023-03-29,35971,Rose Folkart Heart Decorations,12.77,1,14194.0,United Kingdom
548194,2023-03-29,37446,Mini Cake Stand With Hanging Cakes,13.62,3,14194.0,United Kingdom
548194,2023-03-29,47599A,Pink Party Bags,14.48,9,14194.0,United Kingdom
548194,2023-03-29,47599B,Blue Party Bags,14.48,7,14194.0,United Kingdom
548194,2023-03-29,72741,Grand Chocolatecandle,13.08,3,14194.0,United Kingdom
548194,2023-03-29,79000,Moroccan Tea Glass,11.94,3,14194.0,United Kingdom
548194,2023-03-29,82567,Airline Lounge Metal Sign,11.92,1,14194.0,United Kingdom
548194,2023-03-29,84637,Kitchen Flower Pots Wall Plaque,15.33,1,14194.0,United Kingdom
548194,2023-03-29,84638,Small Kitchen Flower Pots Plaque,16.23,1,14194.0,United Kingdom
548194,2023-03-29,84913A,Soft Pink Rose Towel,13.62,1,14194.0,United Kingdom
548194,2023-03-29,84926A,Wake Up Cockerel Tile Coaster,12.77,1,14194.0,United Kingdom
548194,2023-03-29,84969,Box Of 6 Assorted Colour Teaspoons,13.62,1,14194.0,United Kingdom
548194,2023-03-29,84991,60 Teatime Fairy Cake Cases,11.53,1,14194.0,United Kingdom
548194,2023-03-29,85039C,S/4 Black Mini Rose Candle In Bowl,11.92,1,14194.0,United Kingdom
548194,2023-03-29,85049C,Romantic Pinks Ribbons,12.77,1,14194.0,United Kingdom
548194,2023-03-29,85049E,Scandinavian Reds Ribbons,12.77,1,14194.0,United Kingdom
548194,2023-03-29,85054,French Enamel Pot W Lid,16.18,1,14194.0,United Kingdom
548194,2023-03-29,85061W,White Jewelled Heart Decoration,11.92,1,14194.0,United Kingdom
548194,2023-03-29,85130B,Beaded Crystal Heart Green Large,13.62,1,14194.0,United Kingdom
548194,2023-03-29,85150,Ladies & Gentlemen Metal Sign,15.33,2,14194.0,United Kingdom
548194,2023-03-29,85152,Hand Over The Chocolate Sign,14.48,3,14194.0,United Kingdom
548194,2023-03-29,85169C,Eau De Nil Love Bird Candle,12.77,2,14194.0,United Kingdom
548194,2023-03-29,85175,Cacti T-Light Candles,11.1,32,14194.0,United Kingdom
548194,2023-03-29,85186C,Bunny Egg Garland,11.1,1,14194.0,United Kingdom
548194,2023-03-29,85194L,Hanging Spring Flower Egg Large,11.92,1,14194.0,United Kingdom
548194,2023-03-29,90040C,Murano Style Glass Bracelet Gold,14.07,1,14194.0,United Kingdom
548194,2023-03-29,90214J,"Letter ""J"" Bling Key Ring",11.1,1,14194.0,United Kingdom
548194,2023-03-29,16207A,Pink Strawberry Handbag,13.62,1,14194.0,United Kingdom
548194,2023-03-29,18007,Essential Balm 35g Tin In Envelope,10.68,12,14194.0,United Kingdom
548194,2023-03-29,20719,Woodland Charlotte Bag,11.92,2,14194.0,United Kingdom
548194,2023-03-29,20733,Gold Mini Tape Measure,11.1,1,14194.0,United Kingdom
548194,2023-03-29,20914,Set/5 Red Retrospot Lid Glass Bowls,16.18,1,14194.0,United Kingdom
548194,2023-03-29,20931,Blue Pot Plant Candle,17.9,1,14194.0,United Kingdom
548194,2023-03-29,21032,Space Cadet White,12.77,1,14194.0,United Kingdom
548194,2023-03-29,21071,Vintage Billboard Drink Me Mug,12.77,6,14194.0,United Kingdom
548194,2023-03-29,21165,Beware Of The Cat Metal Sign,14.48,1,14194.0,United Kingdom
548194,2023-03-29,21175,Gin And Tonic Diet Metal Sign,15.33,1,14194.0,United Kingdom
548194,2023-03-29,21179,No Junk Mail Metal Sign,11.92,1,14194.0,United Kingdom
548194,2023-03-29,21195,Pink Honeycomb Paper Ball,14.48,4,14194.0,United Kingdom
548194,2023-03-29,21212,Pack Of 72 Retrospot Cake Cases,11.53,2,14194.0,United Kingdom
548194,2023-03-29,21218,Red Spotty Biscuit Tin,18.75,1,14194.0,United Kingdom
548194,2023-03-29,21232,Strawberry Ceramic Trinket Pot,12.77,1,14194.0,United Kingdom
548194,2023-03-29,21313,Glass Heart T-Light Holder,11.92,8,14194.0,United Kingdom
548194,2023-03-29,21314,Small Glass Heart Trinket Pot,14.48,4,14194.0,United Kingdom
548194,2023-03-29,21354,Toast Its - Best Mum,12.77,1,14194.0,United Kingdom
548194,2023-03-29,21377,Small Camphor Wood Field Mushroom,13.62,1,14194.0,United Kingdom
548194,2023-03-29,21379,Camphor Wood Portobello Mushroom,12.77,1,14194.0,United Kingdom
548194,2023-03-29,21385,Ivory Hanging Decoration Heart,11.92,1,14194.0,United Kingdom
548194,2023-03-29,21398,Red Polkadot Coffee Mug,11.92,1,14194.0,United Kingdom
548194,2023-03-29,21928,Jumbo Bag Scandinavian Blue Paisley,7.24,4,14194.0,United Kingdom
548194,2023-03-29,21929,Jumbo Bag Pink Vintage Paisley,7.24,4,14194.0,United Kingdom
548194,2023-03-29,85099B,Jumbo Bag Red Retrospot,7.24,4,14194.0,United Kingdom
548194,2023-03-29,85099C,Jumbo Bag Baroque Black White,7.24,4,14194.0,United Kingdom
548194,2023-03-29,85099F,Jumbo Bag Strawberry,7.24,4,14194.0,United Kingdom
548194,2023-03-29,22662,Lunch Bag Dolly Girl Design,7.24,1,14194.0,United Kingdom
548194,2023-03-29,21039,Red Retrospot Shopping Bag,8.09,1,14194.0,United Kingdom
548196,2023-03-29,22766,Photo Frame Cornice,13.27,4,16011.0,United Kingdom
548196,2023-03-29,22771,Clear Drawer Knob Acrylic Edwardian,11.53,24,16011.0,United Kingdom
548196,2023-03-29,21407,Brown Check Cat Doorstop,14.61,3,16011.0,United Kingdom
548196,2023-03-29,21669,Blue Stripe Ceramic Drawer Knob,11.53,12,16011.0,United Kingdom
548196,2023-03-29,84946,Antique Silver T-Light Glass,11.53,12,16011.0,United Kingdom
548196,2023-03-29,22467,Gumball Coat Rack,12.86,6,16011.0,United Kingdom
548196,2023-03-29,82011A,Bathroom Scales Tropical Beach,14.09,1,16011.0,United Kingdom
548197,2023-03-29,22256,Felt Farm Animal Chicken,11.53,12,13588.0,United Kingdom
548197,2023-03-29,22957,Set 3 Paper Vintage Chick Paper Egg,13.27,6,13588.0,United Kingdom
