TransactionNo,Date,ProductNo,ProductName,Price,Quantity,CustomerNo,Country
554991,2023-05-29,23204,Charlotte Bag Apples Design,11.12,1,14823.0,United Kingdom
554991,2023-05-29,22149,Feltcraft 6 Flower Friends,12.4,1,14823.0,United Kingdom
554991,2023-05-29,85062,Pearl Crystal Pumpkin T-Light Hldr,11.94,1,14823.0,United Kingdom
554991,2023-05-29,85123A,Cream Hanging Heart T-Light Holder,13.27,1,14823.0,United Kingdom
554991,2023-05-29,84970L,Single Heart Zinc T-Light Holder,11.22,1,14823.0,United Kingdom
554991,2023-05-29,22112,Chocolate Hot Water Bottle,15.32,1,14823.0,United Kingdom
554991,2023-05-29,22621,Traditional Knitting Nancy,11.94,1,14823.0,United Kingdom
554991,2023-05-29,23184,Bull Dog Bottle Opener,15.32,1,14823.0,United Kingdom
554991,2023-05-29,22507,Memo Board Retrospot Design,15.32,1,14823.0,United Kingdom
554991,2023-05-29,22188,Black Heart Card Holder,14.3,1,14823.0,United Kingdom
554991,2023-05-29,22470,Heart Of Wicker Large,13.27,1,14823.0,United Kingdom
554991,2023-05-29,22795,Sweetheart Recipe Book Stand,17.17,1,14823.0,United Kingdom
554991,2023-05-29,84509A,Set Of 4 English Rose Placemats,14.09,1,14823.0,United Kingdom
554991,2023-05-29,22617,Baking Set Spaceboy Design,15.32,1,14823.0,United Kingdom
554991,2023-05-29,22138,Baking Set 9 Piece Retrospot,15.32,1,14823.0,United Kingdom
554991,2023-05-29,84510A,Set Of 4 English Rose Coasters,11.53,1,14823.0,United Kingdom
554991,2023-05-29,21754,Home Building Block Word,16.35,1,14823.0,United Kingdom
554991,2023-05-29,22627,Mint Kitchen Scales,18.96,1,14823.0,United Kingdom
554991,2023-05-29,22960,Jam Making Set With Jars,14.61,1,14823.0,United Kingdom
554991,2023-05-29,23099,French Carriage Lantern,17.07,1,14823.0,United Kingdom
554991,2023-05-29,20914,Set/5 Red Retrospot Lid Glass Bowls,13.27,1,14823.0,United Kingdom
554991,2023-05-29,21411,Gingham Heart Doorstop Red,14.61,1,14823.0,United Kingdom
554991,2023-05-29,22666,Recipe Box Pantry Yellow Design,13.27,1,14823.0,United Kingdom
554991,2023-05-29,22723,Set Of 6 Herb Tins Sketchbook,14.3,1,14823.0,United Kingdom
554991,2023-05-29,22766,Photo Frame Cornice,13.27,1,14823.0,United Kingdom
554991,2023-05-29,22457,Natural Slate Heart Chalkboard,13.27,1,14823.0,United Kingdom
554992,2023-05-29,22045,Spaceboy Gift Wrap,10.68,25,16686.0,United Kingdom
554992,2023-05-29,22710,Wrap I Love London,10.68,25,16686.0,United Kingdom
554992,2023-05-29,22704,Wrap Red Apples,10.68,25,16686.0,United Kingdom
554992,2023-05-29,16169M,Wrap Daisy Carpet,10.68,25,16686.0,United Kingdom
554992,2023-05-29,16161P,Wrap English Rose,10.68,25,16686.0,United Kingdom
554992,2023-05-29,23230,Wrap Alphabet Design,10.68,25,16686.0,United Kingdom
554992,2023-05-29,22779,Wooden Owls Light Garland,14.61,1,16686.0,United Kingdom
554992,2023-05-29,21913,Vintage Seaside Jigsaw Puzzles,14.09,1,16686.0,United Kingdom
554992,2023-05-29,22550,Holiday Fun Ludo,14.09,1,16686.0,United Kingdom
554992,2023-05-29,21790,Vintage Snap Cards,11.12,2,16686.0,United Kingdom
554992,2023-05-29,22621,Traditional Knitting Nancy,11.94,2,16686.0,United Kingdom
554992,2023-05-29,22331,Woodland Party Bag + Sticker Set,11.94,2,16686.0,United Kingdom
554992,2023-05-29,22334,Dinosaur Party Bag + Sticker Set,11.94,2,16686.0,United Kingdom
554992,2023-05-29,21328,Balloons Writing Set,11.94,1,16686.0,United Kingdom
554992,2023-05-29,85227,Set Of 6 3d Kit Cards For Kids,11.12,1,16686.0,United Kingdom
554992,2023-05-29,23192,Bundle Of 3 Alphabet Exercise Books,11.94,2,16686.0,United Kingdom
554992,2023-05-29,23190,Bundle Of 3 School Exercise Books,11.94,2,16686.0,United Kingdom
554992,2023-05-29,22273,Feltcraft Doll Molly,13.27,2,16686.0,United Kingdom
554992,2023-05-29,22570,Feltcraft Cushion Rabbit,14.09,2,16686.0,United Kingdom
554992,2023-05-29,20972,Pink Cream Felt Craft Trinket Box,11.53,1,16686.0,United Kingdom
554992,2023-05-29,21328,Balloons Writing Set,11.94,1,16686.0,United Kingdom
554992,2023-05-29,22754,Small Red Babushka Notebook,11.12,1,16686.0,United Kingdom
554992,2023-05-29,22758,Large Purple Babushka Notebook,11.53,2,16686.0,United Kingdom
554992,2023-05-29,22753,Small Yellow Babushka Notebook,11.12,2,16686.0,United Kingdom
554992,2023-05-29,22150,3 Stripey Mice Feltcraft,12.25,2,16686.0,United Kingdom
554992,2023-05-29,22328,Round Snack Boxes Set Of 4 Fruits,13.27,1,16686.0,United Kingdom
554992,2023-05-29,22742,Make Your Own Playtime Card Kit,13.27,1,16686.0,United Kingdom
554992,2023-05-29,22744,Make Your Own Monsoon Card Kit,13.27,1,16686.0,United Kingdom
554992,2023-05-29,22531,Magic Drawing Slate Circus Parade,10.68,48,16686.0,United Kingdom
554992,2023-05-29,20972,Pink Cream Felt Craft Trinket Box,11.53,1,16686.0,United Kingdom
554992,2023-05-29,22779,Wooden Owls Light Garland,14.61,1,16686.0,United Kingdom
554992,2023-05-29,22554,Plasters In Tin Woodland Animals,11.94,1,16686.0,United Kingdom
554992,2023-05-29,22555,Plasters In Tin Strongman,11.94,1,16686.0,United Kingdom
554992,2023-05-29,22556,Plasters In Tin Circus Parade,11.94,1,16686.0,United Kingdom
554992,2023-05-29,84536A,English Rose Notebook A7 Size,10.68,2,16686.0,United Kingdom
554992,2023-05-29,84828,Jungle Popsicles Ice Lolly Moulds,11.53,1,16686.0,United Kingdom
554992,2023-05-29,22549,Picture Dominoes,11.74,2,16686.0,United Kingdom
554992,2023-05-29,21731,Red Toadstool Led Night Light,11.94,2,16686.0,United Kingdom
554992,2023-05-29,22466,Fairy Tale Cottage Night Light,12.25,2,16686.0,United Kingdom
554992,2023-05-29,23127,Feltcraft Girl Nicole Kit,15.32,3,16686.0,United Kingdom
554992,2023-05-29,22548,Heads And Tails Sporting Fun,11.53,1,16686.0,United Kingdom
554992,2023-05-29,16236,Kitty Pencil Erasers,10.47,26,16686.0,United Kingdom
554992,2023-05-29,22431,Watering Can Blue Elephant,12.25,1,16686.0,United Kingdom
554992,2023-05-29,22432,Watering Can Pink Bunny,12.25,1,16686.0,United Kingdom
554992,2023-05-29,22147,Feltcraft Butterfly Hearts,11.74,2,16686.0,United Kingdom
554992,2023-05-29,21912,Vintage Snakes & Ladders,14.09,2,16686.0,United Kingdom
554992,2023-05-29,23079,Toadstool Bedside Light,19.42,1,16686.0,United Kingdom
554992,2023-05-29,22138,Baking Set 9 Piece Retrospot,15.32,3,16686.0,United Kingdom
554992,2023-05-29,16012,Food/Drink Sponge Stickers,10.47,24,16686.0,United Kingdom
554992,2023-05-29,22211,Wood Stamp Set Flowers,11.94,4,16686.0,United Kingdom
554992,2023-05-29,84466,Top Secret Pen Set,11.53,4,16686.0,United Kingdom
554992,2023-05-29,22747,Poppy's Playhouse Bathroom,12.4,2,16686.0,United Kingdom
554992,2023-05-29,22745,Poppy's Playhouse Bedroom,12.4,2,16686.0,United Kingdom
554992,2023-05-29,22746,Poppy's Playhouse Livingroom,12.4,2,16686.0,United Kingdom
554992,2023-05-29,22139,Retrospot Tea Set Ceramic 11 Pc,15.32,4,16686.0,United Kingdom
554992,2023-05-29,22326,Round Snack Boxes Set Of4 Woodland,13.27,1,16686.0,United Kingdom
554992,2023-05-29,22328,Round Snack Boxes Set Of 4 Fruits,13.27,1,16686.0,United Kingdom
554992,2023-05-29,22748,Poppy's Playhouse Kitchen,12.4,2,16686.0,United Kingdom
554992,2023-05-29,21832,Chocolate Calculator,11.94,1,16686.0,United Kingdom
554992,2023-05-29,22560,Traditional Modelling Clay,11.53,4,16686.0,United Kingdom
554992,2023-05-29,22563,Happy Stencil Craft,11.53,2,16686.0,United Kingdom
554992,2023-05-29,22564,Alphabet Stencil Craft,11.53,3,16686.0,United Kingdom
554992,2023-05-29,23191,Bundle Of 3 Retro Note Books,11.94,1,16686.0,United Kingdom
554992,2023-05-29,22431,Watering Can Blue Elephant,12.25,1,16686.0,United Kingdom
554992,2023-05-29,22432,Watering Can Pink Bunny,12.25,1,16686.0,United Kingdom
554992,2023-05-29,22993,Set Of 4 Pantry Jelly Moulds,11.53,2,16686.0,United Kingdom
554992,2023-05-29,23084,Rabbit Night Light,12.38,1,16686.0,United Kingdom
554992,2023-05-29,22617,Baking Set Spaceboy Design,15.32,2,16686.0,United Kingdom
554992,2023-05-29,84375,Set Of 20 Kids Cookie Cutters,12.4,1,16686.0,United Kingdom
554992,2023-05-29,84828,Jungle Popsicles Ice Lolly Moulds,11.53,3,16686.0,United Kingdom
554992,2023-05-29,84375,Set Of 20 Kids Cookie Cutters,12.4,1,16686.0,United Kingdom
554992,2023-05-29,22610,Pens Assorted Funny Face,11.12,36,16686.0,United Kingdom
554992,2023-05-29,23084,Rabbit Night Light,12.38,3,16686.0,United Kingdom
554992,2023-05-29,22489,Pack Of 12 Traditional Crayons,10.68,6,16686.0,United Kingdom
554992,2023-05-29,21356,Toast Its - Fairy Flower,11.53,2,16686.0,United Kingdom
554992,2023-05-29,20726,Lunch Bag Woodland,5.97,5,16686.0,United Kingdom
554993,2023-05-29,21673,White Spot Blue Ceramic Drawer Knob,11.53,2,17051.0,United Kingdom
554993,2023-05-29,20718,Red Retrospot Shopper Bag,11.53,5,17051.0,United Kingdom
554993,2023-05-29,23298,Spotty Bunting,15.32,1,17051.0,United Kingdom
554993,2023-05-29,85123A,Cream Hanging Heart T-Light Holder,13.27,3,17051.0,United Kingdom
554993,2023-05-29,17091J,Vanilla Incense In Tin,10.64,2,17051.0,United Kingdom
554993,2023-05-29,22457,Natural Slate Heart Chalkboard,13.27,3,17051.0,United Kingdom
554993,2023-05-29,20914,Set/5 Red Retrospot Lid Glass Bowls,13.27,2,17051.0,United Kingdom
554993,2023-05-29,22196,Small Heart Measuring Spoons,11.12,3,17051.0,United Kingdom
554993,2023-05-29,22195,Large Heart Measuring Spoons,11.94,3,17051.0,United Kingdom
554993,2023-05-29,84378,Set Of 3 Heart Cookie Cutters,11.53,3,17051.0,United Kingdom
554993,2023-05-29,84380,Set Of 3 Butterfly Cookie Cutters,11.53,3,17051.0,United Kingdom
554993,2023-05-29,85132B,Charlie And Lola Table Tins,12.25,1,17051.0,United Kingdom
554993,2023-05-29,85132C,Charlie And Lola Figures Tins,12.25,3,17051.0,United Kingdom
554993,2023-05-29,21212,Pack Of 72 Retrospot Cake Cases,10.81,12,17051.0,United Kingdom
554993,2023-05-29,22417,Pack Of 60 Spaceboy Cake Cases,10.81,12,17051.0,United Kingdom
554993,2023-05-29,21213,Pack Of 72 Skull Cake Cases,10.81,12,17051.0,United Kingdom
554993,2023-05-29,21975,Pack Of 60 Dinosaur Cake Cases,10.81,12,17051.0,United Kingdom
554993,2023-05-29,84991,60 Teatime Fairy Cake Cases,10.81,12,17051.0,United Kingdom
554993,2023-05-29,22469,Heart Of Wicker Small,11.94,4,17051.0,United Kingdom
554993,2023-05-29,22470,Heart Of Wicker Large,13.27,3,17051.0,United Kingdom
554993,2023-05-29,21561,Dinosaur Lunch Box With Cutlery,12.86,3,17051.0,United Kingdom
554993,2023-05-29,21558,Skull Lunch Box With Cutlery,12.86,3,17051.0,United Kingdom
554993,2023-05-29,21559,Strawberry Lunch Box With Cutlery,12.86,3,17051.0,United Kingdom
554993,2023-05-29,22352,Lunch Box With Cutlery Retrospot,12.86,3,17051.0,United Kingdom
554993,2023-05-29,37342,Polkadot Coffee Cup & Saucer Pink,11.06,2,17051.0,United Kingdom
554993,2023-05-29,21232,Strawberry Ceramic Trinket Pot,11.53,4,17051.0,United Kingdom
554993,2023-05-29,23300,Gardeners Kneeling Pad Cup Of Tea,11.94,3,17051.0,United Kingdom
554993,2023-05-29,20724,Red Retrospot Charlotte Bag,11.12,5,17051.0,United Kingdom
554993,2023-05-29,22355,Charlotte Bag Suki Design,11.12,5,17051.0,United Kingdom
554993,2023-05-29,21043,Apron Modern Vintage Cotton,12.25,15,17051.0,United Kingdom
554993,2023-05-29,22898,Childrens Apron Apples Design,12.25,2,17051.0,United Kingdom
554993,2023-05-29,21156,Retrospot Childrens Apron,12.25,2,17051.0,United Kingdom
554993,2023-05-29,22367,Childrens Apron Spaceboy Design,12.25,2,17051.0,United Kingdom
554993,2023-05-29,20724,Red Retrospot Charlotte Bag,11.12,2,17051.0,United Kingdom
554993,2023-05-29,23204,Charlotte Bag Apples Design,11.12,2,17051.0,United Kingdom
554993,2023-05-29,20718,Red Retrospot Shopper Bag,11.53,5,17051.0,United Kingdom
554993,2023-05-29,20724,Red Retrospot Charlotte Bag,11.12,10,17051.0,United Kingdom
554993,2023-05-29,22383,Lunch Bag Suki Design,5.97,3,17051.0,United Kingdom
554993,2023-05-29,23206,Lunch Bag Apple Design,5.97,1,17051.0,United Kingdom
554993,2023-05-29,20728,Lunch Bag Cars Blue,5.97,3,17051.0,United Kingdom
554993,2023-05-29,22382,Lunch Bag Spaceboy Design,5.97,2,17051.0,United Kingdom
554993,2023-05-29,20725,Lunch Bag Red Retrospot,5.97,2,17051.0,United Kingdom
554994,2023-05-29,21246,Red Retrospot Big Bowl,15.32,4,14606.0,United Kingdom
554994,2023-05-29,21868,Potting Shed Tea Mug,11.53,1,14606.0,United Kingdom
554994,2023-05-29,20979,36 Pencils Tube Red Retrospot,11.53,1,14606.0,United Kingdom
554994,2023-05-29,85130D,Beaded Crystal Heart Pink Large,11.94,2,14606.0,United Kingdom
554994,2023-05-29,84988,Set Of 72 Pink Heart Paper Doilies,11.74,3,14606.0,United Kingdom
554994,2023-05-29,22090,Paper Bunting Retrospot,13.27,1,14606.0,United Kingdom
554994,2023-05-29,21035,Set/2 Red Retrospot Tea Towels,13.58,2,14606.0,United Kingdom
554994,2023-05-29,21154,Red Retrospot Oven Glove,11.53,1,14606.0,United Kingdom
554994,2023-05-29,21080,Set/20 Red Retrospot Paper Napkins,11.12,3,14606.0,United Kingdom
554994,2023-05-29,21157,Red Retrospot Washbag,12.4,1,14606.0,United Kingdom
554994,2023-05-29,22416,Set Of 36 Spaceboy Paper Doilies,11.74,1,14606.0,United Kingdom
554994,2023-05-29,22417,Pack Of 60 Spaceboy Cake Cases,10.81,2,14606.0,United Kingdom
554994,2023-05-29,22344,Party Pizza Dish Pink Polkadot,11.12,1,14606.0,United Kingdom
554994,2023-05-29,22345,Party Pizza Dish Blue Polkadot,11.12,1,14606.0,United Kingdom
554994,2023-05-29,22613,Pack Of 20 Spaceboy Napkins,11.12,2,14606.0,United Kingdom
554994,2023-05-29,21242,Red Retrospot Plate,11.98,3,14606.0,United Kingdom
554994,2023-05-29,21238,Red Retrospot Cup,11.12,3,14606.0,United Kingdom
554994,2023-05-29,22348,Tea Bag Plate Red Retrospot,11.12,1,14606.0,United Kingdom
554994,2023-05-29,21669,Blue Stripe Ceramic Drawer Knob,11.53,2,14606.0,United Kingdom
554994,2023-05-29,90214A,"Letter ""A"" Bling Key Ring",11.53,1,14606.0,United Kingdom
554994,2023-05-29,22996,Travel Card Wallet Vintage Ticket,10.68,1,14606.0,United Kingdom
554994,2023-05-29,22998,Travel Card Wallet Keep Calm,10.68,1,14606.0,United Kingdom
554994,2023-05-29,22994,Travel Card Wallet Retrospot,10.68,1,14606.0,United Kingdom
554994,2023-05-29,21985,Pack Of 12 Hearts Design Tissues,10.55,1,14606.0,United Kingdom
554994,2023-05-29,82583,Hot Baths Metal Sign,12.4,1,14606.0,United Kingdom
554994,2023-05-29,21165,Beware Of The Cat Metal Sign,11.98,1,14606.0,United Kingdom
554994,2023-05-29,21307,Set/4 Butterfly Mirror Magnets,12.4,1,14606.0,United Kingdom
554994,2023-05-29,21533,Retrospot Large Milk Jug,15.32,1,14606.0,United Kingdom
554994,2023-05-29,22405,Money Box Pocket Money Design,11.53,1,14606.0,United Kingdom
554994,2023-05-29,21901,Key Fob Back Door,10.92,1,14606.0,United Kingdom
554994,2023-05-29,21216,Set 3 Retrospot Tea/Coffee/Sugar,15.32,1,14606.0,United Kingdom
554994,2023-05-29,22193,Red Diner Wall Clock,18.96,1,14606.0,United Kingdom
554994,2023-05-29,51014A,Feather Pen Hot Pink,11.12,12,14606.0,United Kingdom
554994,2023-05-29,22507,Memo Board Retrospot Design,15.32,1,14606.0,United Kingdom
554994,2023-05-29,15044A,Pink Paper Parasol,13.27,1,14606.0,United Kingdom
554994,2023-05-29,84031A,Charlie+Lola Red Hot Water Bottle,15.02,1,14606.0,United Kingdom
554994,2023-05-29,84032B,Charlie + Lola Red Hot Water Bottle,13.27,1,14606.0,United Kingdom
554994,2023-05-29,21746,Small Red Retrospot Windmill,11.53,1,14606.0,United Kingdom
554994,2023-05-29,22366,Doormat Airmail,18.4,1,14606.0,United Kingdom
554994,2023-05-29,20914,Set/5 Red Retrospot Lid Glass Bowls,13.27,1,14606.0,United Kingdom
554994,2023-05-29,21533,Retrospot Large Milk Jug,15.32,1,14606.0,United Kingdom
554994,2023-05-29,22467,Gumball Coat Rack,12.86,1,14606.0,United Kingdom
554994,2023-05-29,22219,Lovebird Hanging Decoration White,11.12,1,14606.0,United Kingdom
554994,2023-05-29,22136,Love Heart Sock Hanger,11.94,1,14606.0,United Kingdom
554995,2023-05-29,22469,Heart Of Wicker Small,11.94,2,18109.0,United Kingdom
554995,2023-05-29,21218,Red Spotty Biscuit Tin,14.09,2,18109.0,United Kingdom
554995,2023-05-29,23118,Parisienne Jewellery Drawer,17.94,3,18109.0,United Kingdom
554995,2023-05-29,22855,Fine Wicker Heart,11.53,2,18109.0,United Kingdom
554995,2023-05-29,23110,Parisienne Key Cabinet,16.14,1,18109.0,United Kingdom
554995,2023-05-29,22961,Jam Making Set Printed,11.74,2,18109.0,United Kingdom
554995,2023-05-29,22151,Place Setting White Heart,10.68,48,18109.0,United Kingdom
554995,2023-05-29,21577,Save The Planet Cotton Tote Bag,12.56,2,18109.0,United Kingdom
554995,2023-05-29,23112,Parisienne Curio Cabinet,17.94,2,18109.0,United Kingdom
554995,2023-05-29,23067,Hanging Engraved Metal Heart,14.5,4,18109.0,United Kingdom
554995,2023-05-29,84836,Zinc Metal Heart Decoration,11.53,2,18109.0,United Kingdom
554995,2023-05-29,21447,12 Ivory Rose Peg Place Settings,11.53,1,18109.0,United Kingdom
554995,2023-05-29,21446,12 Red Rose Peg Place Settings,11.53,2,18109.0,United Kingdom
554995,2023-05-29,85123A,Cream Hanging Heart T-Light Holder,13.27,3,18109.0,United Kingdom
554995,2023-05-29,21259,Victorian Sewing Box Small,16.35,2,18109.0,United Kingdom
554995,2023-05-29,22487,White Wood Garden Plant Ladder,18.96,4,18109.0,United Kingdom
554996,2023-05-29,21742,Large Round Wicker Platter,16.35,1,16407.0,United Kingdom
554996,2023-05-29,48138,Doormat Union Flag,18.4,1,16407.0,United Kingdom
554996,2023-05-29,22469,Heart Of Wicker Small,11.94,10,16407.0,United Kingdom
554996,2023-05-29,22470,Heart Of Wicker Large,13.27,10,16407.0,United Kingdom
554996,2023-05-29,85123A,Cream Hanging Heart T-Light Holder,13.27,2,16407.0,United Kingdom
554996,2023-05-29,21733,Red Hanging Heart T-Light Holder,13.27,2,16407.0,United Kingdom
554996,2023-05-29,82486,3 Drawer Antique White Wood Cabinet,19.42,4,16407.0,United Kingdom
554996,2023-05-29,21673,White Spot Blue Ceramic Drawer Knob,11.53,6,16407.0,United Kingdom
554996,2023-05-29,21670,Blue Spot Ceramic Drawer Knob,11.53,6,16407.0,United Kingdom
554996,2023-05-29,21669,Blue Stripe Ceramic Drawer Knob,11.53,6,16407.0,United Kingdom
554996,2023-05-29,21668,Red Stripe Ceramic Drawer Knob,11.53,6,16407.0,United Kingdom
554996,2023-05-29,22773,Green Drawer Knob Acrylic Edwardian,11.53,12,16407.0,United Kingdom
554996,2023-05-29,22772,Pink Drawer Knob Acrylic Edwardian,11.53,12,16407.0,United Kingdom
554996,2023-05-29,22771,Clear Drawer Knob Acrylic Edwardian,11.53,12,16407.0,United Kingdom
554996,2023-05-29,21754,Home Building Block Word,16.35,1,16407.0,United Kingdom
554996,2023-05-29,21756,Bath Building Block Word,16.35,1,16407.0,United Kingdom
554997,2023-05-29,22336,Dove Decoration Painted Zinc,10.92,48,16746.0,United Kingdom
554997,2023-05-29,23082,Set 6 Paper Table Lantern Hearts,14.09,6,16746.0,United Kingdom
554997,2023-05-29,23084,Rabbit Night Light,12.38,6,16746.0,United Kingdom
554997,2023-05-29,22027,Tea Party Birthday Card,10.68,12,16746.0,United Kingdom
554997,2023-05-29,22712,Card Dolly Girl,10.68,12,16746.0,United Kingdom
554997,2023-05-29,22948,Metal Decoration Naughty Children,11.12,24,16746.0,United Kingdom
554997,2023-05-29,22900,Set 2 Tea Towels I Love London,13.58,6,16746.0,United Kingdom
554997,2023-05-29,20971,Pink Blue Felt Craft Trinket Box,11.53,12,16746.0,United Kingdom
554997,2023-05-29,23203,Jumbo Bag Vintage Doily,6.19,10,16746.0,United Kingdom
554997,2023-05-29,23202,Jumbo Bag Vintage Leaf,6.19,10,16746.0,United Kingdom
554997,2023-05-29,20712,Jumbo Bag Woodland Animals,6.19,10,16746.0,United Kingdom
554997,2023-05-29,22386,Jumbo Bag Pink Polkadot,6.19,10,16746.0,United Kingdom
554997,2023-05-29,85099B,Jumbo Bag Red Retrospot,6.19,10,16746.0,United Kingdom
554997,2023-05-29,23199,Jumbo Bag Apples,6.19,10,16746.0,United Kingdom
554997,2023-05-29,23209,Lunch Bag Vintage Doily,5.97,10,16746.0,United Kingdom
554997,2023-05-29,20726,Lunch Bag Woodland,5.97,10,16746.0,United Kingdom
554997,2023-05-29,22382,Lunch Bag Spaceboy Design,5.97,10,16746.0,United Kingdom
554997,2023-05-29,23206,Lunch Bag Apple Design,5.97,10,16746.0,United Kingdom
554998,2023-05-29,84347,Rotating Silver Angels T-Light Hldr,12.86,12,15925.0,United Kingdom
554998,2023-05-29,85152,Hand Over The Chocolate Sign,12.4,12,15925.0,United Kingdom
554998,2023-05-29,79000,Moroccan Tea Glass,11.12,12,15925.0,United Kingdom
554998,2023-05-29,82482,Wooden Picture Frame White Finish,12.86,6,15925.0,United Kingdom
554998,2023-05-29,23170,Regency Tea Plate Roses,11.94,12,15925.0,United Kingdom
554998,2023-05-29,84987,Set Of 36 Teatime Paper Doilies,11.74,4,15925.0,United Kingdom
554998,2023-05-29,84988,Set Of 72 Pink Heart Paper Doilies,11.74,4,15925.0,United Kingdom
554998,2023-05-29,21974,Set Of 36 Paisley Flower Doilies,11.74,4,15925.0,United Kingdom
554998,2023-05-29,84821,Danish Rose Deluxe Coaster,11.12,12,15925.0,United Kingdom
554998,2023-05-29,23174,Regency Sugar Bowl Green,14.5,4,15925.0,United Kingdom
554998,2023-05-29,22863,Soap Dish Brocante,13.27,8,15925.0,United Kingdom
554999,2023-05-29,21922,Union Stripe With Fringe Hammock,18.4,1,15547.0,United Kingdom
554999,2023-05-29,23298,Spotty Bunting,15.32,1,15547.0,United Kingdom
554999,2023-05-29,85123A,Cream Hanging Heart T-Light Holder,13.27,6,15547.0,United Kingdom
554999,2023-05-29,84991,60 Teatime Fairy Cake Cases,10.81,1,15547.0,United Kingdom
554999,2023-05-29,84992,72 Sweetheart Fairy Cake Cases,10.81,2,15547.0,United Kingdom
554999,2023-05-29,20914,Set/5 Red Retrospot Lid Glass Bowls,13.27,1,15547.0,United Kingdom
554999,2023-05-29,23118,Parisienne Jewellery Drawer,17.94,2,15547.0,United Kingdom
554999,2023-05-29,47566,Party Bunting,15.32,1,15547.0,United Kingdom
554999,2023-05-29,37413,Icon Mug Revolutionary,10.65,30,15547.0,United Kingdom
554999,2023-05-29,21533,Retrospot Large Milk Jug,15.32,1,15547.0,United Kingdom
554999,2023-05-29,21539,Red Retrospot Butter Dish,15.32,1,15547.0,United Kingdom
554999,2023-05-29,37413,Icon Mug Revolutionary,10.65,6,15547.0,United Kingdom
554999,2023-05-29,23048,Set Of 10 Lanterns Fairy Light Star,14.5,2,15547.0,United Kingdom
554999,2023-05-29,21466,Red Flower Crochet Food Cover,14.09,1,15547.0,United Kingdom
554999,2023-05-29,21470,Flower Vine Raffia Food Cover,14.09,2,15547.0,United Kingdom
554999,2023-05-29,20754,Retrospot Red Washing Up Gloves,12.4,2,15547.0,United Kingdom
554999,2023-05-29,82600,N0 Singing Metal Sign,12.4,2,15547.0,United Kingdom
554999,2023-05-29,85152,Hand Over The Chocolate Sign,12.4,2,15547.0,United Kingdom
554999,2023-05-29,82582,Area Patrolled Metal Sign,12.4,2,15547.0,United Kingdom
554999,2023-05-29,21165,Beware Of The Cat Metal Sign,11.98,2,15547.0,United Kingdom
554999,2023-05-29,21175,Gin And Tonic Diet Metal Sign,12.86,2,15547.0,United Kingdom
554999,2023-05-29,21174,Pottering In The Shed Metal Sign,12.38,1,15547.0,United Kingdom
554999,2023-05-29,22413,Metal Sign Take It Or Leave It,13.27,2,15547.0,United Kingdom
554999,2023-05-29,21908,Chocolate This Way Metal Sign,12.4,2,15547.0,United Kingdom
554999,2023-05-29,21166,Cook With Wine Metal Sign,12.38,3,15547.0,United Kingdom
554999,2023-05-29,21905,More Butter Metal Sign,12.4,1,15547.0,United Kingdom
554999,2023-05-29,84949,Silver Hanging T-Light Holder,11.94,6,15547.0,United Kingdom
554999,2023-05-29,20718,Red Retrospot Shopper Bag,11.53,2,15547.0,United Kingdom
554999,2023-05-29,22212,Four Hook White Lovebirds,12.4,2,15547.0,United Kingdom
554999,2023-05-29,82484,Wood Black Board Ant White Finish,18.4,1,15547.0,United Kingdom
554999,2023-05-29,15034,Paper Pocket Traveling Fan,10.39,24,15547.0,United Kingdom
554999,2023-05-29,22840,Round Cake Tin Vintage Red,18.4,1,15547.0,United Kingdom
554999,2023-05-29,23158,Set Of 5 Lucky Cat Magnets,12.38,2,15547.0,United Kingdom
554999,2023-05-29,23156,Set Of 5 Mini Grocery Magnets,12.38,2,15547.0,United Kingdom
554999,2023-05-29,84978,Hanging Heart Jar T-Light Holder,11.53,6,15547.0,United Kingdom
554999,2023-05-29,22460,Embossed Glass Tealight Holder,11.53,4,15547.0,United Kingdom
554999,2023-05-29,17021,Namaste Swagat Incense,10.56,6,15547.0,United Kingdom
554999,2023-05-29,22794,Sweetheart Wire Magazine Rack,18.4,1,15547.0,United Kingdom
554999,2023-05-29,85062,Pearl Crystal Pumpkin T-Light Hldr,11.94,12,15547.0,United Kingdom
554999,2023-05-29,23145,Zinc T-Light Holder Star Large,11.22,12,15547.0,United Kingdom
554999,2023-05-29,84755,Colour Glass T-Light Holder Hanging,10.92,16,15547.0,United Kingdom
554999,2023-05-29,82486,3 Drawer Antique White Wood Cabinet,19.42,2,15547.0,United Kingdom
554999,2023-05-29,79321,Chilli Lights,16.14,2,15547.0,United Kingdom
554999,2023-05-29,22354,Retrospot Padded Seat Cushion,14.09,2,15547.0,United Kingdom
554999,2023-05-29,21259,Victorian Sewing Box Small,16.35,1,15547.0,United Kingdom
554999,2023-05-29,44092C,Purple/Copper Hanging Lampshade,11.12,3,15547.0,United Kingdom
554999,2023-05-29,44092B,Blue White Plastic Rings Lampshade,11.12,1,15547.0,United Kingdom
554999,2023-05-29,20685,Doormat Red Retrospot,18.4,1,15547.0,United Kingdom
554999,2023-05-29,48111,Doormat 3 Smiley Cats,18.4,1,15547.0,United Kingdom
554999,2023-05-29,48185,Doormat Fairy Cake,18.4,1,15547.0,United Kingdom
554999,2023-05-29,85099B,Jumbo Bag Red Retrospot,6.19,2,15547.0,United Kingdom
554991,2023-05-29,21843,Red Retrospot Cake Stand,21.47,1,14823.0,United Kingdom
554999,2023-05-29,21843,Red Retrospot Cake Stand,21.47,1,15547.0,United Kingdom
554975,2023-05-29,22607,Wooden Rounders Garden Set,20.45,1,17819.0,United Kingdom
554977,2023-05-29,22167,Oval Wall Mirror Diamante,20.45,1,16444.0,United Kingdom
554978,2023-05-29,22634,Childs Breakfast Set Spaceboy,20.45,2,16889.0,United Kingdom
554978,2023-05-29,22635,Childs Breakfast Set Dolly Girl,20.45,2,16889.0,United Kingdom
554991,2023-05-29,22776,Sweetheart 3 Tier Cake Stand,20.45,1,14823.0,United Kingdom
554993,2023-05-29,22487,White Wood Garden Plant Ladder,20.45,1,17051.0,United Kingdom
554994,2023-05-29,21217,Red Retrospot Round Cake Tins,20.45,1,14606.0,United Kingdom
554999,2023-05-29,21217,Red Retrospot Round Cake Tins,20.45,1,15547.0,United Kingdom
554999,2023-05-29,84358,Floor Lamp Shade Wood Base,20.45,1,15547.0,United Kingdom
C554983,2023-05-29,47590B,Pink Happy Birthday Bunting,15.02,-20,17152.0,United Kingdom
C554983,2023-05-29,47590A,Blue Happy Birthday Bunting,15.02,-20,17152.0,United Kingdom
