TransactionNo,Date,ProductNo,ProductName,Price,Quantity,CustomerNo,Country
571653,2023-10-18,46118,Funky Monkey Cushion Cover,11.12,36,14298.0,United Kingdom
571653,2023-10-18,71495B,Cd Wall Tidy Red Flowers,10.62,48,14298.0,United Kingdom
571653,2023-10-18,51014A,Feather Pen Hot Pink,10.65,48,14298.0,United Kingdom
571653,2023-10-18,84596B,Small Dolly Mix Design Orange Bowl,10.68,32,14298.0,United Kingdom
571653,2023-10-18,84596F,Small Marshmallows Pink Bowl,10.68,32,14298.0,United Kingdom
571653,2023-10-18,85071C,"Charlie+Lola""Extremely Busy"" Sign",10.65,24,14298.0,United Kingdom
571653,2023-10-18,85071A,Blue Charlie+Lola Personal Doorsign,10.65,24,14298.0,United Kingdom
571653,2023-10-18,85071D,Charlie+Lola My Room Door Sign,10.65,24,14298.0,United Kingdom
571653,2023-10-18,85071B,Red Charlie+Lola Personal Doorsign,10.65,24,14298.0,United Kingdom
571653,2023-10-18,85111,Silver Glitter Flower Votive Holder,10.55,72,14298.0,United Kingdom
571653,2023-10-18,90058B,Crystal Stud Earrings Assorted Col,10.64,72,14298.0,United Kingdom
571653,2023-10-18,90057,Diamante Ring Assorted In Box,11.53,24,14298.0,United Kingdom
571653,2023-10-18,90191,Silver Lariat 40cm,13.27,6,14298.0,United Kingdom
571653,2023-10-18,90058A,Crystal Stud Earrings Clear Display,10.64,72,14298.0,United Kingdom
571653,2023-10-18,23367,Set 12 Colour Pencils Spaceboy,10.81,24,14298.0,United Kingdom
571653,2023-10-18,23365,Set 12 Colour Pencils Love London,10.81,24,14298.0,United Kingdom
571653,2023-10-18,23368,Set 12 Colour Pencils Dolly Girl,10.81,24,14298.0,United Kingdom
571653,2023-10-18,23469,Card Holder Love Bird Small,13.62,12,14298.0,United Kingdom
571653,2023-10-18,23470,Card Holder Love Bird Large,15.77,6,14298.0,United Kingdom
571653,2023-10-18,23483,Hanging Butterfly T-Light Holder,11.32,24,14298.0,United Kingdom
571653,2023-10-18,23484,Heart Trellis Triple T-Light Holder,12.8,24,14298.0,United Kingdom
571653,2023-10-18,23500,Key Ring Baseball Boot Assorted,11.32,20,14298.0,United Kingdom
571653,2023-10-18,23501,Key Ring Baseball Boot Union Jack,11.32,20,14298.0,United Kingdom
571653,2023-10-18,23502,Playing Cards Vintage Doily,11.32,12,14298.0,United Kingdom
571653,2023-10-18,23503,Playing Cards Keep Calm & Carry On,11.32,24,14298.0,United Kingdom
571653,2023-10-18,23508,Mini Playing Cards Dolly Girl,10.62,20,14298.0,United Kingdom
571653,2023-10-18,23506,Mini Playing Cards Spaceboy,10.62,20,14298.0,United Kingdom
571653,2023-10-18,23509,Mini Playing Cards Fun Fair,10.62,20,14298.0,United Kingdom
571653,2023-10-18,23504,Playing Cards Jubilee Union Jack,11.32,12,14298.0,United Kingdom
571653,2023-10-18,23507,Mini Playing Cards Buffalo Bill,10.62,20,14298.0,United Kingdom
571653,2023-10-18,23511,Embroidered Ribbon Reel Emily,12.08,6,14298.0,United Kingdom
571653,2023-10-18,23514,Embroidered Ribbon Reel Sally,12.08,6,14298.0,United Kingdom
571653,2023-10-18,23517,Embroidered Ribbon Reel Rebecca,12.8,6,14298.0,United Kingdom
571653,2023-10-18,23512,Embroidered Ribbon Reel Rosie,12.08,6,14298.0,United Kingdom
571653,2023-10-18,23515,Embroidered Ribbon Reel Daisy,12.08,6,14298.0,United Kingdom
571653,2023-10-18,23523,Wall Art Treasure Ahoy,13.62,6,14298.0,United Kingdom
571653,2023-10-18,23526,Wall Art Dog Licence,15.73,4,14298.0,United Kingdom
571653,2023-10-18,23521,Wall Art Cat And Bird,12.8,6,14298.0,United Kingdom
571653,2023-10-18,23524,Wall Art Horse & Pony,13.62,6,14298.0,United Kingdom
571653,2023-10-18,23527,Wall Art Animals And Nature,13.62,6,14298.0,United Kingdom
571653,2023-10-18,23522,Wall Art Dog And Ball,12.8,6,14298.0,United Kingdom
571653,2023-10-18,23525,Wall Art Buffalo Bill,13.62,6,14298.0,United Kingdom
571653,2023-10-18,23528,Wall Art Spaceboy,13.62,6,14298.0,United Kingdom
571653,2023-10-18,23532,Wall Art Work Rest And Play,14.5,3,14298.0,United Kingdom
571653,2023-10-18,23530,Wall Art Only One Person,14.5,6,14298.0,United Kingdom
571653,2023-10-18,23531,Wall Art Big Love,16.66,6,14298.0,United Kingdom
571653,2023-10-18,23534,Wall Art Stop For Tea,15.73,6,14298.0,United Kingdom
571653,2023-10-18,23538,Wall Art Vintage Heart,14.5,6,14298.0,United Kingdom
571653,2023-10-18,23541,Wall Art Classic Puddings,17.89,4,14298.0,United Kingdom
571653,2023-10-18,23543,Wall Art Keep Calm,17.89,4,14298.0,United Kingdom
571653,2023-10-18,23539,Wall Art Loves' Secret,15.73,4,14298.0,United Kingdom
571653,2023-10-18,22798,Antique Glass Dressing Table Pot,12.86,8,14298.0,United Kingdom
571653,2023-10-18,22801,Antique Glass Pedestal Bowl,13.72,4,14298.0,United Kingdom
571653,2023-10-18,22800,Antique Tall Swirlglass Trinket Pot,13.72,4,14298.0,United Kingdom
571653,2023-10-18,21314,Small Glass Heart Trinket Pot,12.15,16,14298.0,United Kingdom
571653,2023-10-18,23074,Embossed Heart Trinket Box,12.08,6,14298.0,United Kingdom
571653,2023-10-18,23089,Glass Bon Bon Jar,11.94,24,14298.0,United Kingdom
571653,2023-10-18,21789,Kids Rain Mac Pink,10.92,24,14298.0,United Kingdom
571653,2023-10-18,21787,Rain Poncho Retrospot,10.92,24,14298.0,United Kingdom
571653,2023-10-18,23280,Folding Butterfly Mirror Hot Pink,10.99,24,14298.0,United Kingdom
571653,2023-10-18,23282,Folding Butterfly Mirror Ivory,10.99,24,14298.0,United Kingdom
571653,2023-10-18,35001G,Hand Open Shape Gold,13.72,12,14298.0,United Kingdom
571653,2023-10-18,15039,Sandalwood Fan,10.79,50,14298.0,United Kingdom
571653,2023-10-18,17003,Brocade Ring Purse,10.58,72,14298.0,United Kingdom
571653,2023-10-18,21479,White Skull Hot Water Bottle,14.09,8,14298.0,United Kingdom
571653,2023-10-18,21485,Retrospot Heart Hot Water Bottle,14.61,6,14298.0,United Kingdom
571653,2023-10-18,22112,Chocolate Hot Water Bottle,14.61,6,14298.0,United Kingdom
571653,2023-10-18,22113,Grey Heart Hot Water Bottle,14.09,8,14298.0,United Kingdom
571653,2023-10-18,21484,Chick Grey Hot Water Bottle,14.09,8,14298.0,United Kingdom
571653,2023-10-18,22114,Hot Water Bottle Tea And Sympathy,14.09,12,14298.0,United Kingdom
571653,2023-10-18,22835,Hot Water Bottle I Am So Poorly,14.61,8,14298.0,United Kingdom
571653,2023-10-18,23357,Hot Water Bottle Sex Bomb,14.5,8,14298.0,United Kingdom
571653,2023-10-18,84029G,Knitted Union Flag Hot Water Bottle,14.09,8,14298.0,United Kingdom
571653,2023-10-18,23355,Hot Water Bottle Keep Calm,14.5,12,14298.0,United Kingdom
571653,2023-10-18,23356,Love Hot Water Bottle,15.32,6,14298.0,United Kingdom
571653,2023-10-18,22465,Hanging Metal Star Lantern,11.74,24,14298.0,United Kingdom
571653,2023-10-18,22464,Hanging Metal Heart Lantern,11.74,24,14298.0,United Kingdom
571653,2023-10-18,84755,Colour Glass T-Light Holder Hanging,10.81,32,14298.0,United Kingdom
571653,2023-10-18,84970S,Hanging Heart Zinc T-Light Holder,10.99,24,14298.0,United Kingdom
571653,2023-10-18,84950,Assorted Colour T-Light Holder,10.81,36,14298.0,United Kingdom
571653,2023-10-18,20846,Zinc Heart Lattice T-Light Holder,11.34,24,14298.0,United Kingdom
571653,2023-10-18,21313,Glass Heart T-Light Holder,10.91,24,14298.0,United Kingdom
571653,2023-10-18,84947,Antique Silver Tea Glass Engraved,11.34,12,14298.0,United Kingdom
571653,2023-10-18,84946,Antique Silver T-Light Glass,11.34,12,14298.0,United Kingdom
571653,2023-10-18,85053,French Enamel Candleholder,11.98,12,14298.0,United Kingdom
571653,2023-10-18,21012,Antique All Glass Candlestick,11.98,12,14298.0,United Kingdom
571653,2023-10-18,72127,Columbian Candle Round,10.91,36,14298.0,United Kingdom
571653,2023-10-18,72132,Columbian Cube Candle,10.68,36,14298.0,United Kingdom
571653,2023-10-18,72598,Set/12 Taper Candles,10.91,24,14298.0,United Kingdom
571653,2023-10-18,21804,White Christmas Garland Stars Trees,13.72,12,14298.0,United Kingdom
571653,2023-10-18,21820,Glitter Heart Garland With Bells,13.72,12,14298.0,United Kingdom
571653,2023-10-18,21812,Garland With Hearts And Bells,14.61,6,14298.0,United Kingdom
571653,2023-10-18,85061W,White Jewelled Heart Decoration,10.91,48,14298.0,United Kingdom
571653,2023-10-18,35953,Folkart Star Christmas Decorations,10.65,48,14298.0,United Kingdom
571653,2023-10-18,21818,Glitter Heart Decoration,10.65,36,14298.0,United Kingdom
571653,2023-10-18,22335,Heart Decoration Painted Zinc,10.81,48,14298.0,United Kingdom
571653,2023-10-18,22337,Angel Decoration Painted Zinc,10.81,24,14298.0,United Kingdom
571653,2023-10-18,22597,Musical Zinc Heart Decoration,10.55,72,14298.0,United Kingdom
571653,2023-10-18,22294,Heart Filigree Dove Small,11.34,24,14298.0,United Kingdom
571653,2023-10-18,22599,Christmas Musical Zinc Star,10.55,72,14298.0,United Kingdom
571653,2023-10-18,23215,Jingle Bell Heart Antique Silver,12.08,24,14298.0,United Kingdom
571653,2023-10-18,22944,Christmas Metal Postcard With Bells,10.65,72,14298.0,United Kingdom
571653,2023-10-18,23103,Jingle Bell Heart Decoration,11.74,24,14298.0,United Kingdom
571653,2023-10-18,23217,Laurel Heart Antique Silver,11.32,24,14298.0,United Kingdom
571653,2023-10-18,23223,Christmas Tree Hanging Silver,10.99,24,14298.0,United Kingdom
571653,2023-10-18,23224,Cherub Heart Decoration Gold,10.99,24,14298.0,United Kingdom
571653,2023-10-18,23219,Laurel Star Antique Silver,11.32,24,14298.0,United Kingdom
571653,2023-10-18,23225,Cherub Heart Decoration Silver,10.99,24,14298.0,United Kingdom
571653,2023-10-18,23226,Filigree Heart Daisy White,11.32,24,14298.0,United Kingdom
571653,2023-10-18,23227,Filigree Heart Butterfly White,11.32,24,14298.0,United Kingdom
571653,2023-10-18,23228,Filigree Heart Bird White,11.32,24,14298.0,United Kingdom
571653,2023-10-18,35970,Zinc Folkart Sleigh Bells,11.78,12,14298.0,United Kingdom
571653,2023-10-18,22573,Star Wooden Christmas Decoration,10.99,24,14298.0,United Kingdom
571653,2023-10-18,22574,Heart Wooden Christmas Decoration,10.99,24,14298.0,United Kingdom
571653,2023-10-18,22578,Wooden Star Christmas Scandinavian,10.55,24,14298.0,United Kingdom
571653,2023-10-18,22576,Swallow Wooden Christmas Decoration,10.99,24,14298.0,United Kingdom
571653,2023-10-18,22581,Wood Stocking Christmas Scandispot,10.99,24,14298.0,United Kingdom
571653,2023-10-18,22595,Gingham Heart Decoration,10.99,24,14298.0,United Kingdom
571653,2023-10-18,22602,Retrospot Wooden Heart Decoration,10.99,24,14298.0,United Kingdom
571653,2023-10-18,23263,Set Of 3 Wooden Heart Decorations,11.32,48,14298.0,United Kingdom
571653,2023-10-18,22601,Christmas Retrospot Angel Wood,10.99,12,14298.0,United Kingdom
571653,2023-10-18,22603,Christmas Retrospot Tree Wood,10.99,12,14298.0,United Kingdom
571653,2023-10-18,23264,Set Of 3 Wooden Sleigh Decorations,11.32,36,14298.0,United Kingdom
571653,2023-10-18,23266,Set Of 3 Wooden Stocking Decoration,11.32,36,14298.0,United Kingdom
571653,2023-10-18,23265,Set Of 3 Wooden Tree Decorations,11.32,36,14298.0,United Kingdom
571653,2023-10-18,20668,Disco Ball Christmas Decoration,10.35,96,14298.0,United Kingdom
571653,2023-10-18,22153,Angel Decoration Stars On Dress,10.62,48,14298.0,United Kingdom
571653,2023-10-18,22158,3 Hearts Hanging Decoration Rustic,12.86,16,14298.0,United Kingdom
571653,2023-10-18,22575,Metal Merry Christmas Wreath,11.94,8,14298.0,United Kingdom
571653,2023-10-18,22156,Heart Decoration With Pearls,10.99,24,14298.0,United Kingdom
571653,2023-10-18,23212,Heart Wreath Decoration With Bell,11.32,24,14298.0,United Kingdom
571653,2023-10-18,22488,Natural Slate Rectangle Chalkboard,11.74,24,14298.0,United Kingdom
571653,2023-10-18,22219,Lovebird Hanging Decoration White,10.99,24,14298.0,United Kingdom
571653,2023-10-18,20829,Glitter Hanging Butterfly String,11.98,16,14298.0,United Kingdom
571653,2023-10-18,23275,Set Of 3 Hanging Owls Ollie Beak,11.32,12,14298.0,United Kingdom
571653,2023-10-18,35924,Hanging Fairy Cake Decoration,11.98,6,14298.0,United Kingdom
571653,2023-10-18,20707,Crazy Daisy Heart Decoration,11.34,12,14298.0,United Kingdom
571653,2023-10-18,22227,Hanging Heart Mirror Decoration,10.81,48,14298.0,United Kingdom
571653,2023-10-18,21114,Lavender Scented Fabric Heart,11.34,20,14298.0,United Kingdom
571653,2023-10-18,23432,Pretty Hanging Quilted Hearts,10.99,48,14298.0,United Kingdom
571653,2023-10-18,23398,Hanging Heart Bonheur,10.99,24,14298.0,United Kingdom
571653,2023-10-18,23399,Home Sweet Home Hanging Heart,10.99,24,14298.0,United Kingdom
571653,2023-10-18,17021,Namaste Swagat Incense,10.5,72,14298.0,United Kingdom
571653,2023-10-18,17084N,Fairy Dreams Incense,10.41,50,14298.0,United Kingdom
571653,2023-10-18,17084R,Assorted Incense Pack,10.41,72,14298.0,United Kingdom
571653,2023-10-18,23122,Party Charms 50 Pieces,10.99,72,14298.0,United Kingdom
571653,2023-10-18,84692,Box Of 24 Cocktail Parasols,10.58,100,14298.0,United Kingdom
571653,2023-10-18,23121,Pack Of 6 Cocktail Parasol Straws,10.62,48,14298.0,United Kingdom
571653,2023-10-18,23123,Cocktail Swords 50 Pieces,10.99,48,14298.0,United Kingdom
571653,2023-10-18,23119,Pack Of 6 Large Fruit Straws,10.79,48,14298.0,United Kingdom
571653,2023-10-18,23083,Set 6 Paper Table Lantern Stars,13.62,12,14298.0,United Kingdom
571653,2023-10-18,23082,Set 6 Paper Table Lantern Hearts,13.62,12,14298.0,United Kingdom
571653,2023-10-18,22466,Fairy Tale Cottage Night Light,11.94,12,14298.0,United Kingdom
571653,2023-10-18,79321,Chilli Lights,15.32,12,14298.0,United Kingdom
571653,2023-10-18,79302M,Art Lights Funk Monkey,12.86,12,14298.0,United Kingdom
571653,2023-10-18,40001,White Bamboo Ribs Lampshade,10.91,48,14298.0,United Kingdom
571653,2023-10-18,79144B,Painted Lightbulb Star+ Moon,10.63,24,14298.0,United Kingdom
571653,2023-10-18,79144C,Painted Lightbulb Rainbow Design,10.63,24,14298.0,United Kingdom
571653,2023-10-18,21464,Disco Ball Rotator Battery Operated,14.09,6,14298.0,United Kingdom
571653,2023-10-18,22310,Ivory Knitted Mug Cosy,11.74,12,14298.0,United Kingdom
571653,2023-10-18,22314,Office Mug Warmer Choc+Blue,12.86,6,14298.0,United Kingdom
571653,2023-10-18,22311,Office Mug Warmer Black+Silver,12.86,6,14298.0,United Kingdom
571653,2023-10-18,22313,Office Mug Warmer Pink,12.86,255,14298.0,United Kingdom
571653,2023-10-18,21544,Skulls Water Transfer Tattoos,10.92,96,14298.0,United Kingdom
571653,2023-10-18,21679,Skulls Stickers,10.99,36,14298.0,United Kingdom
571653,2023-10-18,21675,Butterflies Stickers,10.99,36,14298.0,United Kingdom
571653,2023-10-18,21677,Hearts Stickers,10.99,36,14298.0,United Kingdom
571653,2023-10-18,21629,Square Floor Cushion Vintage Red,17.37,6,14298.0,United Kingdom
571653,2023-10-18,21630,Floor Cushion Elephant Carnival,18.4,6,14298.0,United Kingdom
571653,2023-10-18,21224,Set/4 Skull Badges,11.34,20,14298.0,United Kingdom
571653,2023-10-18,22534,Magic Drawing Slate Spaceboy,10.62,24,14298.0,United Kingdom
571653,2023-10-18,22535,Magic Drawing Slate Bunnies,10.62,24,14298.0,United Kingdom
571653,2023-10-18,22530,Magic Drawing Slate Dolly Girl,10.62,24,14298.0,United Kingdom
571654,2023-10-18,23564,Egg Cup Milkmaid Ingrid,11.53,1,18118.0,United Kingdom
571654,2023-10-18,23566,Egg Cup Milkmaid Heidi,11.53,1,18118.0,United Kingdom
571654,2023-10-18,23565,Egg Cup Milkmaid Helga,11.53,1,18118.0,United Kingdom
571654,2023-10-18,22306,Silver Mug Bone China Tree Of Life,11.34,4,18118.0,United Kingdom
571654,2023-10-18,22569,Feltcraft Cushion Butterfly,14.09,1,18118.0,United Kingdom
571654,2023-10-18,23264,Set Of 3 Wooden Sleigh Decorations,11.53,2,18118.0,United Kingdom
571654,2023-10-18,23329,Decorative Wicker Heart Large,11.94,1,18118.0,United Kingdom
571654,2023-10-18,84510C,Set Of 4 Polkadot Coasters,11.53,2,18118.0,United Kingdom
571654,2023-10-18,21108,Fairy Cake Flannel Assorted Colour,11.06,1,18118.0,United Kingdom
571654,2023-10-18,21108,Fairy Cake Flannel Assorted Colour,11.06,1,18118.0,United Kingdom
571654,2023-10-18,21479,White Skull Hot Water Bottle,14.61,3,18118.0,United Kingdom
571654,2023-10-18,23270,Set Of 2 Ceramic Painted Hearts,11.74,1,18118.0,United Kingdom
571654,2023-10-18,23269,Set Of 2 Ceramic Christmas Trees,11.74,1,18118.0,United Kingdom
571654,2023-10-18,23266,Set Of 3 Wooden Stocking Decoration,11.53,2,18118.0,United Kingdom
571654,2023-10-18,22457,Natural Slate Heart Chalkboard,13.27,1,18118.0,United Kingdom
571654,2023-10-18,22144,Christmas Craft Little Friends,12.4,1,18118.0,United Kingdom
571654,2023-10-18,22596,Christmas Star Wish List Chalkboard,11.53,1,18118.0,United Kingdom
571654,2023-10-18,47559B,Tea Time Oven Glove,11.53,2,18118.0,United Kingdom
571654,2023-10-18,21733,Red Hanging Heart T-Light Holder,13.27,1,18118.0,United Kingdom
571654,2023-10-18,22595,Gingham Heart Decoration,11.12,1,18118.0,United Kingdom
571654,2023-10-18,85123A,Cream Hanging Heart T-Light Holder,13.27,1,18118.0,United Kingdom
571654,2023-10-18,21430,Set/3 Red Gingham Rose Storage Box,14.09,1,18118.0,United Kingdom
571654,2023-10-18,72586,Set Of 6 Halloween Ghost T-Lights,10.68,2,18118.0,United Kingdom
571654,2023-10-18,21238,Red Retrospot Cup,11.12,1,18118.0,United Kingdom
571654,2023-10-18,85034C,3 Rose Morris Boxed Candles,11.53,1,18118.0,United Kingdom
571654,2023-10-18,85034A,3 Gardenia Morris Boxed Candles,11.53,1,18118.0,United Kingdom
571654,2023-10-18,22138,Baking Set 9 Piece Retrospot,15.32,1,18118.0,United Kingdom
571654,2023-10-18,22784,Lantern Cream Gazebo,15.32,1,18118.0,United Kingdom
571654,2023-10-18,85035C,Rose 3 Wick Morris Box Candle,11.53,1,18118.0,United Kingdom
571654,2023-10-18,85035A,Gardenia 3 Wick Morris Boxed Candle,11.53,1,18118.0,United Kingdom
571654,2023-10-18,20914,Set/5 Red Retrospot Lid Glass Bowls,13.27,2,18118.0,United Kingdom
571654,2023-10-18,20752,Blue Polkadot Washing Up Gloves,12.4,1,18118.0,United Kingdom
571654,2023-10-18,20754,Retrospot Red Washing Up Gloves,12.4,1,18118.0,United Kingdom
571654,2023-10-18,22379,Recycling Bag Retrospot,12.4,1,18118.0,United Kingdom
571654,2023-10-18,22381,Toy Tidy Pink Polkadot,12.4,2,18118.0,United Kingdom
571654,2023-10-18,21931,Jumbo Storage Bag Suki,12.38,2,18118.0,United Kingdom
571654,2023-10-18,21930,Jumbo Storage Bag Skulls,12.38,3,18118.0,United Kingdom
571654,2023-10-18,22580,Advent Calendar Gingham Sack,16.35,1,18118.0,United Kingdom
571654,2023-10-18,23344,Jumbo Bag 50'S Christmas,6.19,2,18118.0,United Kingdom
571654,2023-10-18,23343,Jumbo Bag Vintage Christmas,6.19,3,18118.0,United Kingdom
571654,2023-10-18,21929,Jumbo Bag Pink Vintage Paisley,6.19,1,18118.0,United Kingdom
571654,2023-10-18,85099B,Jumbo Bag Red Retrospot,6.19,2,18118.0,United Kingdom
571654,2023-10-18,85099F,Jumbo Bag Strawberry,6.19,2,18118.0,United Kingdom
571654,2023-10-18,85099C,Jumbo Bag Baroque Black White,6.19,4,18118.0,United Kingdom
571654,2023-10-18,23208,Lunch Bag Vintage Leaf Design,5.97,1,18118.0,United Kingdom
571655,2023-10-18,21770,Open Closed Metal Sign,15.32,12,14688.0,United Kingdom
571655,2023-10-18,22996,Travel Card Wallet Vintage Ticket,10.68,10,14688.0,United Kingdom
571655,2023-10-18,47310M,Small Pop Box Funky Monkey,11.53,5,14688.0,United Kingdom
571655,2023-10-18,21427,Skulls Storage Box Small,12.4,1,14688.0,United Kingdom
571655,2023-10-18,22674,French Toilet Sign Blue Metal,11.53,1,14688.0,United Kingdom
571655,2023-10-18,22138,Baking Set 9 Piece Retrospot,15.32,12,14688.0,United Kingdom
571655,2023-10-18,22617,Baking Set Spaceboy Design,15.32,5,14688.0,United Kingdom
571655,2023-10-18,22379,Recycling Bag Retrospot,12.15,50,14688.0,United Kingdom
571655,2023-10-18,22381,Toy Tidy Pink Polkadot,12.4,10,14688.0,United Kingdom
571655,2023-10-18,23348,Childrens Toy Cooking Utensil Set,12.38,6,14688.0,United Kingdom
571656,2023-10-18,21914,Blue Harmonica In Box,11.53,3,16393.0,United Kingdom
571656,2023-10-18,21915,Red Harmonica In Box,11.53,3,16393.0,United Kingdom
571656,2023-10-18,22633,Hand Warmer Union Jack,12.4,5,16393.0,United Kingdom
571656,2023-10-18,22632,Hand Warmer Red Retrospot,12.4,4,16393.0,United Kingdom
571656,2023-10-18,22371,Airline Bag Vintage Tokyo 78,14.61,7,16393.0,United Kingdom
571656,2023-10-18,22374,Airline Bag Vintage Jet Set Red,14.61,4,16393.0,United Kingdom
571656,2023-10-18,23391,I Love London Mini Backpack,14.5,3,16393.0,United Kingdom
571656,2023-10-18,23390,Dolly Girl Mini Backpack,14.5,4,16393.0,United Kingdom
571656,2023-10-18,23389,Spaceboy Mini Backpack,14.5,5,16393.0,United Kingdom
571656,2023-10-18,23388,Woodland Mini Backpack,14.5,3,16393.0,United Kingdom
571656,2023-10-18,21034,Rex Cash+Carry Jumbo Shopper,11.22,2,16393.0,United Kingdom
571656,2023-10-18,21936,Red Retrospot Picnic Bag,13.27,4,16393.0,United Kingdom
571656,2023-10-18,23300,Gardeners Kneeling Pad Cup Of Tea,11.94,1,16393.0,United Kingdom
571656,2023-10-18,23238,Set Of 4 Knick Knack Tins London,14.5,12,16393.0,United Kingdom
571656,2023-10-18,23241,Treasure Tin Gymkhana Design,12.38,6,16393.0,United Kingdom
571656,2023-10-18,22659,Lunch Box I Love London,12.25,2,16393.0,United Kingdom
571656,2023-10-18,22367,Childrens Apron Spaceboy Design,12.25,1,16393.0,United Kingdom
571656,2023-10-18,23311,Vintage Christmas Stocking,12.86,6,16393.0,United Kingdom
571656,2023-10-18,22899,Children's Apron Dolly Girl,12.4,1,16393.0,United Kingdom
571656,2023-10-18,22898,Childrens Apron Apples Design,12.25,2,16393.0,United Kingdom
571656,2023-10-18,22367,Childrens Apron Spaceboy Design,12.25,1,16393.0,United Kingdom
571656,2023-10-18,23365,Set 12 Colour Pencils Love London,10.92,4,16393.0,United Kingdom
571656,2023-10-18,23505,Playing Cards I Love London,11.53,2,16393.0,United Kingdom
571656,2023-10-18,21790,Vintage Snap Cards,11.12,2,16393.0,United Kingdom
571656,2023-10-18,23504,Playing Cards Jubilee Union Jack,11.53,2,16393.0,United Kingdom
571656,2023-10-18,23199,Jumbo Bag Apples,6.19,6,16393.0,United Kingdom
571656,2023-10-18,23200,Jumbo Bag Pears,6.19,5,16393.0,United Kingdom
571656,2023-10-18,23201,Jumbo Bag Alphabet,6.19,1,16393.0,United Kingdom
571656,2023-10-18,23343,Jumbo Bag Vintage Christmas,6.19,10,16393.0,United Kingdom
571656,2023-10-18,23344,Jumbo Bag 50'S Christmas,6.19,10,16393.0,United Kingdom
571656,2023-10-18,23201,Jumbo Bag Alphabet,6.19,4,16393.0,United Kingdom
571656,2023-10-18,20726,Lunch Bag Woodland,5.97,5,16393.0,United Kingdom
571656,2023-10-18,22382,Lunch Bag Spaceboy Design,5.97,2,16393.0,United Kingdom
571656,2023-10-18,20728,Lunch Bag Cars Blue,5.97,5,16393.0,United Kingdom
571656,2023-10-18,22383,Lunch Bag Suki Design,5.97,5,16393.0,United Kingdom
571657,2023-10-18,22596,Christmas Star Wish List Chalkboard,11.53,12,13835.0,United Kingdom
571657,2023-10-18,23393,Home Sweet Home Cushion Cover,14.09,4,13835.0,United Kingdom
571657,2023-10-18,22728,Alarm Clock Bakelike Pink,14.09,4,13835.0,United Kingdom
571657,2023-10-18,22727,Alarm Clock Bakelike Red,14.09,4,13835.0,United Kingdom
571657,2023-10-18,46000S,Polyester Filler Pad 40x40cm,11.74,4,13835.0,United Kingdom
571657,2023-10-18,22772,Pink Drawer Knob Acrylic Edwardian,11.53,12,13835.0,United Kingdom
571657,2023-10-18,85048,15cm Christmas Glass Ball 20 Lights,18.4,2,13835.0,United Kingdom
571657,2023-10-18,23401,Rustic Mirror With Lace Heart,16.66,2,13835.0,United Kingdom
571657,2023-10-18,22307,Gold Mug Bone China Tree Of Life,11.34,12,13835.0,United Kingdom
571657,2023-10-18,23399,Home Sweet Home Hanging Heart,11.12,12,13835.0,United Kingdom
571657,2023-10-18,23343,Jumbo Bag Vintage Christmas,6.19,10,13835.0,United Kingdom
571657,2023-10-18,23436,Vintage Christmas Gift Bag Large,5.77,12,13835.0,United Kingdom
571657,2023-10-18,22821,Gift Bag Psychedelic Apples,5.46,12,13835.0,United Kingdom
571658,2023-10-18,23382,Box Of 6 Christmas Cake Decorations,14.09,8,12621.0,Germany
571658,2023-10-18,23493,Vintage Doily Travel Sewing Kit,12.25,10,12621.0,Germany
571658,2023-10-18,23494,Vintage Doily Deluxe Sewing Kit,16.35,3,12621.0,Germany
571658,2023-10-18,23510,Mini Playing Cards Gymkhana,10.68,20,12621.0,Germany
571658,2023-10-18,21212,Pack Of 72 Retrospot Cake Cases,10.81,24,12621.0,Germany
571658,2023-10-18,22621,Traditional Knitting Nancy,11.94,12,12621.0,Germany
571658,2023-10-18,23240,Set Of 4 Knick Knack Tins Doily,14.5,12,12621.0,Germany
571658,2023-10-18,23353,6 Gift Tags Vintage Christmas,11.1,24,12621.0,Germany
571658,2023-10-18,23354,6 Gift Tags 50'S Christmas,11.1,12,12621.0,Germany
571658,2023-10-18,22144,Christmas Craft Little Friends,12.4,6,12621.0,Germany
571658,2023-10-18,21871,Save The Planet Mug,11.94,12,12621.0,Germany
571658,2023-10-18,20719,Woodland Charlotte Bag,11.12,20,12621.0,Germany
571658,2023-10-18,22355,Charlotte Bag Suki Design,11.12,20,12621.0,Germany
571658,2023-10-18,22867,Hand Warmer Bird Design,12.4,12,12621.0,Germany
571658,2023-10-18,22865,Hand Warmer Owl Design,12.4,12,12621.0,Germany
571658,2023-10-18,20973,12 Pencil Small Tube Woodland,10.92,48,12621.0,Germany
571658,2023-10-18,22419,Lipstick Pen Red,10.68,36,12621.0,Germany
571658,2023-10-18,21731,Red Toadstool Led Night Light,11.94,12,12621.0,Germany
571658,2023-10-18,20971,Pink Blue Felt Craft Trinket Box,11.53,12,12621.0,Germany
571658,2023-10-18,23437,50'S Christmas Gift Bag Large,5.77,12,12621.0,Germany
571660,2023-10-18,22959,Wrap Christmas Village,10.68,25,16191.0,United Kingdom
571660,2023-10-18,22705,Wrap Green Pears,10.68,25,16191.0,United Kingdom
571660,2023-10-18,16161P,Wrap English Rose,10.68,25,16191.0,United Kingdom
571660,2023-10-18,23232,Wrap Vintage Leaf Design,10.68,25,16191.0,United Kingdom
571660,2023-10-18,22704,Wrap Red Apples,10.68,25,16191.0,United Kingdom
571660,2023-10-18,23233,Wrap Poppies Design,10.68,25,16191.0,United Kingdom
571660,2023-10-18,22713,Card I Love London,10.68,24,16191.0,United Kingdom
571660,2023-10-18,23568,Egg Cup Henrietta Hen Cream,11.53,12,16191.0,United Kingdom
571660,2023-10-18,23567,Egg Cup Henrietta Hen Pink,11.53,12,16191.0,United Kingdom
571660,2023-10-18,84970S,Hanging Heart Zinc T-Light Holder,11.12,12,16191.0,United Kingdom
571660,2023-10-18,23263,Set Of 3 Wooden Heart Decorations,11.53,12,16191.0,United Kingdom
571660,2023-10-18,23270,Set Of 2 Ceramic Painted Hearts,11.74,12,16191.0,United Kingdom
571660,2023-10-18,23212,Heart Wreath Decoration With Bell,11.53,12,16191.0,United Kingdom
571660,2023-10-18,23224,Cherub Heart Decoration Gold,11.1,12,16191.0,United Kingdom
