TransactionNo,Date,ProductNo,ProductName,Price,Quantity,CustomerNo,Country
558092,2023-06-26,22656,Vintage Blue Kitchen Cabinet,594.5,1,14808.0,United Kingdom
C558091,2023-06-26,22929,School Desk And Chair,76.88,-1,14808.0,United Kingdom
558090,2023-06-26,84078A,Set/4 White Retro Storage Cubes,51.2,2,14808.0,United Kingdom
558096,2023-06-26,21277,French Style Embossed Heart Cabinet,32.75,1,15532.0,United Kingdom
558092,2023-06-26,22846,Bread Bin Diner Style Red,27.62,1,14808.0,United Kingdom
558104,2023-06-26,22846,Bread Bin Diner Style Red,27.62,1,13668.0,United Kingdom
558104,2023-06-26,22847,Bread Bin Diner Style Ivory,27.62,1,13668.0,United Kingdom
C558080,2023-06-26,22847,Bread Bin Diner Style Ivory,27.62,-1,15104.0,United Kingdom
C558110,2023-06-26,23010,Circus Parade Baby Gift Set,27.62,-2,17731.0,United Kingdom
C558110,2023-06-26,23008,Dolly Girl Baby Gift Set,27.62,-2,17731.0,United Kingdom
558096,2023-06-26,22606,Wooden Skittles Garden Set,26.6,1,15532.0,United Kingdom
558100,2023-06-26,22606,Wooden Skittles Garden Set,26.6,3,17768.0,United Kingdom
558093,2023-06-26,21627,Elephant Carnival Pouffe,25.57,2,17969.0,United Kingdom
558096,2023-06-26,22770,Mirror Cornice,25.57,1,15532.0,United Kingdom
558100,2023-06-26,21476,Steel Sweetheart Round Table Cream,25.57,3,17768.0,United Kingdom
C558081,2023-06-26,22838,3 Tier Cake Tin Red And Cream,25.57,-3,18172.0,United Kingdom
558085,2023-06-26,85066,Cream Sweetheart Mini Chest,23.32,2,13021.0,United Kingdom
558089,2023-06-26,22423,Regency Cakestand 3 Tier,23.32,7,13505.0,Switzerland
558096,2023-06-26,20748,Kensington Coffee Set,23.32,2,15532.0,United Kingdom
558100,2023-06-26,85066,Cream Sweetheart Mini Chest,23.32,2,17768.0,United Kingdom
558100,2023-06-26,85066,Cream Sweetheart Mini Chest,23.32,2,17768.0,United Kingdom
558102,2023-06-26,22423,Regency Cakestand 3 Tier,23.32,1,17372.0,United Kingdom
558103,2023-06-26,22423,Regency Cakestand 3 Tier,23.32,12,13767.0,United Kingdom
C558110,2023-06-26,22423,Regency Cakestand 3 Tier,23.32,-4,17731.0,United Kingdom
558096,2023-06-26,23072,Marie Antoinette Trinket Box Silver,23.06,1,15532.0,United Kingdom
558096,2023-06-26,23111,Parisienne Sewing Box,23.06,1,15532.0,United Kingdom
558101,2023-06-26,23017,Apothecary Measuring Jar,23.06,2,18112.0,United Kingdom
558101,2023-06-26,23018,Large Apothecary Measuring Jar,23.06,2,18112.0,United Kingdom
558077,2023-06-26,21917,Set 12 Kids White Chalk Sticks,10.68,48,13408.0,United Kingdom
558077,2023-06-26,20972,Pink Cream Felt Craft Trinket Box,11.53,36,13408.0,United Kingdom
558077,2023-06-26,20983,12 Pencils Tall Tube Red Retrospot,11.12,24,13408.0,United Kingdom
558077,2023-06-26,21504,Skulls Greeting Card,10.68,24,13408.0,United Kingdom
558077,2023-06-26,21506,Fancy Font Birthday Card,10.68,24,13408.0,United Kingdom
558077,2023-06-26,21673,White Spot Blue Ceramic Drawer Knob,11.53,24,13408.0,United Kingdom
558077,2023-06-26,21700,Big Doughnut Fridge Magnets,11.12,12,13408.0,United Kingdom
558077,2023-06-26,22355,Charlotte Bag Suki Design,11.12,30,13408.0,United Kingdom
558077,2023-06-26,22726,Alarm Clock Bakelike Green,14.09,24,13408.0,United Kingdom
558077,2023-06-26,47590A,Blue Happy Birthday Bunting,15.84,12,13408.0,United Kingdom
558077,2023-06-26,82600,N0 Singing Metal Sign,12.4,12,13408.0,United Kingdom
558077,2023-06-26,85123A,Cream Hanging Heart T-Light Holder,12.86,32,13408.0,United Kingdom
558077,2023-06-26,22746,Poppy's Playhouse Livingroom,12.4,12,13408.0,United Kingdom
558077,2023-06-26,23251,Vintage Red Enamel Trim Mug,11.53,12,13408.0,United Kingdom
558077,2023-06-26,23252,Vintage Red Enamel Trim Jug,14.09,12,13408.0,United Kingdom
558077,2023-06-26,22431,Watering Can Blue Elephant,12.25,24,13408.0,United Kingdom
558077,2023-06-26,22740,Polkadot Pen,11.12,96,13408.0,United Kingdom
558077,2023-06-26,85230G,Orange Votive Candle,10.55,48,13408.0,United Kingdom
558077,2023-06-26,85230E,Strawbry Scented Votive Candle,10.55,48,13408.0,United Kingdom
558077,2023-06-26,20725,Lunch Bag Red Retrospot,5.97,20,13408.0,United Kingdom
558078,2023-06-26,22667,Recipe Box Retrospot,13.27,12,13408.0,United Kingdom
558079,2023-06-26,22619,Set Of 6 Soldier Skittles,14.09,12,17402.0,United Kingdom
558079,2023-06-26,23084,Rabbit Night Light,12.08,24,17402.0,United Kingdom
558083,2023-06-26,21830,Assorted Creepy Crawlies,10.68,24,17284.0,United Kingdom
558083,2023-06-26,21219,Set/4 Badges Balloon Girl,11.53,2,17284.0,United Kingdom
558083,2023-06-26,21220,Set/4 Badges Dogs,11.53,2,17284.0,United Kingdom
558083,2023-06-26,21175,Gin And Tonic Diet Metal Sign,12.86,1,17284.0,United Kingdom
558083,2023-06-26,21907,I'm On Holiday Metal Sign,12.4,1,17284.0,United Kingdom
558083,2023-06-26,85152,Hand Over The Chocolate Sign,12.4,1,17284.0,United Kingdom
558083,2023-06-26,23309,Set Of 60 I Love London Cake Cases,10.81,24,17284.0,United Kingdom
558083,2023-06-26,21828,Eight Piece Snake Set,11.53,3,17284.0,United Kingdom
558083,2023-06-26,22900,Set 2 Tea Towels I Love London,13.58,15,17284.0,United Kingdom
558083,2023-06-26,22902,Tote Bag I Love London,12.4,10,17284.0,United Kingdom
558084,2023-06-26,23110,Parisienne Key Cabinet,16.14,2,14837.0,United Kingdom
558084,2023-06-26,23212,Heart Wreath Decoration With Bell,11.53,12,14837.0,United Kingdom
558084,2023-06-26,23236,Storage Tin Vintage Doily,13.21,6,14837.0,United Kingdom
558084,2023-06-26,23234,Biscuit Tin Vintage Christmas,13.21,6,14837.0,United Kingdom
558084,2023-06-26,23241,Treasure Tin Gymkhana Design,12.38,6,14837.0,United Kingdom
558084,2023-06-26,23307,Set Of 60 Pantry Design Cake Cases,10.81,24,14837.0,United Kingdom
558084,2023-06-26,79321,Chilli Lights,16.14,4,14837.0,United Kingdom
558084,2023-06-26,23084,Rabbit Night Light,12.38,6,14837.0,United Kingdom
558084,2023-06-26,23108,Set Of 10 Led Dolly Lights,16.66,2,14837.0,United Kingdom
558084,2023-06-26,22650,Ceramic Pirate Chest Money Bank,11.74,12,14837.0,United Kingdom
558084,2023-06-26,23177,Treasure Island Book Box,12.56,8,14837.0,United Kingdom
558084,2023-06-26,23194,Gymkhana Treasure Book Box,12.56,8,14837.0,United Kingdom
558084,2023-06-26,21914,Blue Harmonica In Box,11.53,12,14837.0,United Kingdom
558084,2023-06-26,23229,Vintage Donkey Tail Game,14.09,6,14837.0,United Kingdom
558084,2023-06-26,22585,Pack Of 6 Birdy Gift Tags,11.53,12,14837.0,United Kingdom
558084,2023-06-26,23233,Wrap Poppies Design,10.68,25,14837.0,United Kingdom
558084,2023-06-26,23231,Wrap Vintage Doily,10.68,25,14837.0,United Kingdom
558084,2023-06-26,23048,Set Of 10 Lanterns Fairy Light Star,14.5,4,14837.0,United Kingdom
558084,2023-06-26,23040,Paper Lantern 9 Point Snow Star,14.5,4,14837.0,United Kingdom
558084,2023-06-26,23148,Miniature Antique Rose Hook Ivory,11.1,12,14837.0,United Kingdom
558084,2023-06-26,85170B,Set/6 Black Bird T-Light Candles,12.4,6,14837.0,United Kingdom
558084,2023-06-26,22969,Homemade Jam Scented Candles,11.74,12,14837.0,United Kingdom
558084,2023-06-26,21544,Skulls Water Transfer Tattoos,11.12,12,14837.0,United Kingdom
558084,2023-06-26,22437,Set Of 9 Black Skull Balloons,11.12,20,14837.0,United Kingdom
558084,2023-06-26,20984,12 Pencils Tall Tube Posy,10.55,24,14837.0,United Kingdom
558084,2023-06-26,22230,Jigsaw Tree With Watering Can,10.55,48,14837.0,United Kingdom
558084,2023-06-26,22269,Egg Cup Natural Chicken,10.65,16,14837.0,United Kingdom
558084,2023-06-26,85212,Mini Painted Garden Decoration,10.55,24,14837.0,United Kingdom
558084,2023-06-26,22595,Gingham Heart Decoration,11.12,12,14837.0,United Kingdom
558084,2023-06-26,22178,Victorian Glass Hanging T-Light,11.53,12,14837.0,United Kingdom
558084,2023-06-26,16259,Piece Of Camo Stationery Set,10.33,108,14837.0,United Kingdom
558084,2023-06-26,22792,Fluted Antique Candle Holder,11.12,12,14837.0,United Kingdom
558084,2023-06-26,20996,Jazz Hearts Address Book,10.44,24,14837.0,United Kingdom
558084,2023-06-26,22754,Small Red Babushka Notebook,11.12,12,14837.0,United Kingdom
558084,2023-06-26,22755,Small Purple Babushka Notebook,11.12,12,14837.0,United Kingdom
558085,2023-06-26,20749,Assorted Colour Mini Cases,18.4,2,13021.0,United Kingdom
558085,2023-06-26,21242,Red Retrospot Plate,11.98,8,13021.0,United Kingdom
558085,2023-06-26,21936,Red Retrospot Picnic Bag,13.27,5,13021.0,United Kingdom
558085,2023-06-26,22411,Jumbo Shopper Vintage Red Paisley,12.38,20,13021.0,United Kingdom
558085,2023-06-26,23034,Drawer Knob Ceramic Black,11.74,6,13021.0,United Kingdom
558085,2023-06-26,21673,White Spot Blue Ceramic Drawer Knob,11.53,12,13021.0,United Kingdom
558085,2023-06-26,23145,Zinc T-Light Holder Star Large,11.22,12,13021.0,United Kingdom
558085,2023-06-26,23108,Set Of 10 Led Dolly Lights,16.66,2,13021.0,United Kingdom
558085,2023-06-26,20750,Red Retrospot Mini Cases,18.4,2,13021.0,United Kingdom
558085,2023-06-26,21238,Red Retrospot Cup,11.12,8,13021.0,United Kingdom
558085,2023-06-26,22840,Round Cake Tin Vintage Red,18.4,2,13021.0,United Kingdom
558085,2023-06-26,22771,Clear Drawer Knob Acrylic Edwardian,11.53,12,13021.0,United Kingdom
558085,2023-06-26,22465,Hanging Metal Star Lantern,11.94,12,13021.0,United Kingdom
558085,2023-06-26,22457,Natural Slate Heart Chalkboard,13.27,6,13021.0,United Kingdom
558085,2023-06-26,22169,Family Album White Picture Frame,18.96,2,13021.0,United Kingdom
558085,2023-06-26,85099B,Jumbo Bag Red Retrospot,6.19,30,13021.0,United Kingdom
558085,2023-06-26,85099C,Jumbo Bag Baroque Black White,6.19,20,13021.0,United Kingdom
558085,2023-06-26,20725,Lunch Bag Red Retrospot,5.97,10,13021.0,United Kingdom
558086,2023-06-26,21907,I'm On Holiday Metal Sign,12.4,1,16728.0,United Kingdom
558086,2023-06-26,21174,Pottering In The Shed Metal Sign,12.38,1,16728.0,United Kingdom
558086,2023-06-26,21908,Chocolate This Way Metal Sign,12.4,1,16728.0,United Kingdom
558086,2023-06-26,21169,You're Confusing Me Metal Sign,11.98,1,16728.0,United Kingdom
558086,2023-06-26,22117,Metal Sign Her Dinner Is Served,13.27,1,16728.0,United Kingdom
558086,2023-06-26,21165,Beware Of The Cat Metal Sign,11.98,2,16728.0,United Kingdom
558086,2023-06-26,21171,Bathroom Metal Sign,11.74,1,16728.0,United Kingdom
558086,2023-06-26,82578,Kitchen Metal Sign,10.81,2,16728.0,United Kingdom
558086,2023-06-26,21171,Bathroom Metal Sign,10.81,3,16728.0,United Kingdom
558086,2023-06-26,82581,Toilet Metal Sign,10.81,2,16728.0,United Kingdom
558086,2023-06-26,21169,You're Confusing Me Metal Sign,11.98,1,16728.0,United Kingdom
558086,2023-06-26,85152,Hand Over The Chocolate Sign,12.4,1,16728.0,United Kingdom
558086,2023-06-26,82552,Washroom Metal Sign,11.74,1,16728.0,United Kingdom
558086,2023-06-26,22625,Red Kitchen Scales,18.96,2,16728.0,United Kingdom
558086,2023-06-26,82486,3 Drawer Antique White Wood Cabinet,19.42,2,16728.0,United Kingdom
558086,2023-06-26,23112,Parisienne Curio Cabinet,17.94,1,16728.0,United Kingdom
558086,2023-06-26,22171,3 Hook Photo Shelf Antique White,18.96,1,16728.0,United Kingdom
558086,2023-06-26,21403,Blue Egg Spoon,10.37,16,16728.0,United Kingdom
558086,2023-06-26,21876,Pottering Mug,11.53,1,16728.0,United Kingdom
558086,2023-06-26,21872,Glamorous Mug,11.53,1,16728.0,United Kingdom
558086,2023-06-26,21868,Potting Shed Tea Mug,11.53,2,16728.0,United Kingdom
558086,2023-06-26,22362,Glass Jar Peacock Bath Salts,13.27,1,16728.0,United Kingdom
558086,2023-06-26,22360,Glass Jar English Confectionery,13.27,1,16728.0,United Kingdom
558086,2023-06-26,22361,Glass Jar Daisy Fresh Cotton Wool,13.27,1,16728.0,United Kingdom
558086,2023-06-26,22364,Glass Jar Digestive Biscuits,13.27,1,16728.0,United Kingdom
558086,2023-06-26,22359,Glass Jar Kings Choice,13.27,1,16728.0,United Kingdom
558086,2023-06-26,22363,Glass Jar Marmalade,13.27,1,16728.0,United Kingdom
558086,2023-06-26,23286,Blue Vintage Spot Beaker,11.12,6,16728.0,United Kingdom
558086,2023-06-26,35004B,Set Of 3 Black Flying Ducks,15.84,1,16728.0,United Kingdom
558086,2023-06-26,21896,Potting Shed Twine,12.4,1,16728.0,United Kingdom
558086,2023-06-26,22441,Grow Your Own Basil In Enamel Mug,12.4,1,16728.0,United Kingdom
558086,2023-06-26,21745,Gaolers Keys Decorative Garden,14.09,6,16728.0,United Kingdom
558086,2023-06-26,23342,Mint Diner Wall Clock,18.96,1,16728.0,United Kingdom
558086,2023-06-26,23147,Single Antique Rose Hook Ivory,11.74,6,16728.0,United Kingdom
558086,2023-06-26,84828,Jungle Popsicles Ice Lolly Moulds,11.53,1,16728.0,United Kingdom
558086,2023-06-26,15036,Assorted Colours Silk Fan,11.1,12,16728.0,United Kingdom
558086,2023-06-26,85059,French Enamel Water Basin,14.09,1,16728.0,United Kingdom
558086,2023-06-26,22434,Balloon Pump With 10 Balloons,12.25,1,16728.0,United Kingdom
558086,2023-06-26,22286,Decoration Wobbly Rabbit Metal,10.65,1,16728.0,United Kingdom
558086,2023-06-26,23252,Vintage Red Enamel Trim Jug,14.09,1,16728.0,United Kingdom
558086,2023-06-26,23239,Set Of 4 Knick Knack Tins Poppies,14.5,1,16728.0,United Kingdom
558086,2023-06-26,47574A,English Rose Scented Hanging Flower,11.02,4,16728.0,United Kingdom
558086,2023-06-26,23242,Treasure Tin Buffalo Bill,12.38,1,16728.0,United Kingdom
558086,2023-06-26,21990,Modern Floral Stationery Set,11.53,2,16728.0,United Kingdom
558086,2023-06-26,22287,Decoration Wobbly Chicken,10.65,1,16728.0,United Kingdom
558086,2023-06-26,84536A,English Rose Notebook A7 Size,10.68,2,16728.0,United Kingdom
558086,2023-06-26,22467,Gumball Coat Rack,12.86,8,16728.0,United Kingdom
558086,2023-06-26,23244,Round Storage Tin Vintage Leaf,12.25,2,16728.0,United Kingdom
558087,2023-06-26,85212,Mini Painted Garden Decoration,10.55,12,17323.0,United Kingdom
558087,2023-06-26,21713,Citronella Candle Flowerpot,12.4,1,17323.0,United Kingdom
558087,2023-06-26,22268,Decoration Sitting Bunny,10.44,6,17323.0,United Kingdom
558087,2023-06-26,20735,Black Mini Tape Measure,11.12,3,17323.0,United Kingdom
558087,2023-06-26,21884,Cakes And Bows Gift Tape,10.92,3,17323.0,United Kingdom
558087,2023-06-26,21880,Red Retrospot Tape,10.92,3,17323.0,United Kingdom
558087,2023-06-26,21722,Sweet Pudding Sticker Sheet,11.12,6,17323.0,United Kingdom
558087,2023-06-26,21724,Panda And Bunnies Sticker Sheet,11.12,6,17323.0,United Kingdom
558087,2023-06-26,21725,Sweeties Stickers,11.12,6,17323.0,United Kingdom
558087,2023-06-26,21726,Multi Hearts Stickers,11.12,6,17323.0,United Kingdom
558087,2023-06-26,23308,Set Of 60 Vintage Leaf Cake Cases,10.81,3,17323.0,United Kingdom
558087,2023-06-26,20733,Gold Mini Tape Measure,11.12,3,17323.0,United Kingdom
558087,2023-06-26,21675,Butterflies Stickers,11.12,6,17323.0,United Kingdom
558087,2023-06-26,21676,Flowers Stickers,11.12,6,17323.0,United Kingdom
558087,2023-06-26,21121,Set/10 Red Polkadot Party Candles,11.53,3,17323.0,United Kingdom
558087,2023-06-26,21122,Set/10 Pink Polkadot Party Candles,11.53,2,17323.0,United Kingdom
558087,2023-06-26,21086,Set/6 Red Spotty Paper Cups,10.92,3,17323.0,United Kingdom
558087,2023-06-26,21094,Set/6 Red Spotty Paper Plates,11.12,3,17323.0,United Kingdom
558087,2023-06-26,21080,Set/20 Red Retrospot Paper Napkins,11.12,3,17323.0,United Kingdom
558087,2023-06-26,23198,Pantry Magnetic Shopping List,11.74,3,17323.0,United Kingdom
558087,2023-06-26,23196,Vintage Leaf Magnetic Notepad,11.74,3,17323.0,United Kingdom
558087,2023-06-26,22418,10 Colour Spaceboy Pen,11.12,12,17323.0,United Kingdom
558087,2023-06-26,23205,Charlotte Bag Vintage Alphabet,11.12,3,17323.0,United Kingdom
558087,2023-06-26,20724,Red Retrospot Charlotte Bag,11.12,6,17323.0,United Kingdom
558087,2023-06-26,22564,Alphabet Stencil Craft,11.53,3,17323.0,United Kingdom
558087,2023-06-26,22563,Happy Stencil Craft,11.53,3,17323.0,United Kingdom
558087,2023-06-26,22562,Monsters Stencil Craft,11.53,3,17323.0,United Kingdom
558087,2023-06-26,21993,Floral Folk Stationery Set,11.53,3,17323.0,United Kingdom
558087,2023-06-26,16254,Transparent Acrylic Tape Dispenser,11.12,12,17323.0,United Kingdom
558087,2023-06-26,21382,Set/4 Spring Flower Decoration,11.02,4,17323.0,United Kingdom
558087,2023-06-26,21430,Set/3 Red Gingham Rose Storage Box,14.09,1,17323.0,United Kingdom
558087,2023-06-26,22820,Gift Bag Birthday,5.46,12,17323.0,United Kingdom
558087,2023-06-26,22821,Gift Bag Psychedelic Apples,5.46,12,17323.0,United Kingdom
558089,2023-06-26,22699,Roses Regency Teacup And Saucer,13.27,18,13505.0,Switzerland
558089,2023-06-26,23164,Regency Cake Slice,15.32,4,13505.0,Switzerland
558089,2023-06-26,23163,Regency Sugar Tongs,12.8,8,13505.0,Switzerland
558089,2023-06-26,23161,Regency Cake Fork,11.53,24,13505.0,Switzerland
558089,2023-06-26,23245,Set Of 3 Regency Cake Tins,15.32,4,13505.0,Switzerland
558089,2023-06-26,21498,Red Retrospot Wrap,10.68,50,13505.0,Switzerland
558089,2023-06-26,16161U,Wrap Suki And Friends,10.68,50,13505.0,Switzerland
558089,2023-06-26,21499,Blue Polkadot Wrap,10.68,25,13505.0,Switzerland
558089,2023-06-26,21500,Pink Polkadot Wrap,10.68,25,13505.0,Switzerland
558089,2023-06-26,22046,Tea Party Wrapping Paper,10.68,25,13505.0,Switzerland
558089,2023-06-26,22045,Spaceboy Gift Wrap,10.68,25,13505.0,Switzerland
558089,2023-06-26,22743,Make Your Own Flowerpower Card Kit,13.27,6,13505.0,Switzerland
558089,2023-06-26,23031,Drawer Knob Crackle Glaze Pink,11.94,12,13505.0,Switzerland
558089,2023-06-26,23298,Spotty Bunting,15.32,6,13505.0,Switzerland
558089,2023-06-26,21243,Pink Polkadot Plate,11.98,8,13505.0,Switzerland
558089,2023-06-26,21244,Blue Polkadot Plate,11.98,8,13505.0,Switzerland
558089,2023-06-26,21245,Green Polkadot Plate,11.98,8,13505.0,Switzerland
558089,2023-06-26,21239,Pink Polkadot Cup,11.12,16,13505.0,Switzerland
558089,2023-06-26,20677,Pink Polkadot Bowl,11.53,8,13505.0,Switzerland
558089,2023-06-26,20719,Woodland Charlotte Bag,11.12,10,13505.0,Switzerland
558089,2023-06-26,22324,Blue Polkadot Kids Bag,12.25,12,13505.0,Switzerland
558089,2023-06-26,22661,Charlotte Bag Dolly Girl Design,11.12,10,13505.0,Switzerland
558089,2023-06-26,23028,Drawer Knob Crackle Glaze Blue,11.94,12,13505.0,Switzerland
558089,2023-06-26,23029,Drawer Knob Crackle Glaze Green,11.94,12,13505.0,Switzerland
558089,2023-06-26,23032,Drawer Knob Crackle Glaze Ivory,11.94,12,13505.0,Switzerland
558092,2023-06-26,72802A,Rose Scent Candle In Jewelled Box,14.61,1,14808.0,United Kingdom
558092,2023-06-26,21591,Cosy Hour Cigar Box Matches,11.53,2,14808.0,United Kingdom
558092,2023-06-26,84969,Box Of 6 Assorted Colour Teaspoons,14.61,1,14808.0,United Kingdom
558092,2023-06-26,21090,Set/6 Collage Paper Plates,10.65,2,14808.0,United Kingdom
558092,2023-06-26,21084,Set/6 Collage Paper Cups,10.44,2,14808.0,United Kingdom
558092,2023-06-26,21369,Mirrored Wall Art Splodges,11.53,1,14808.0,United Kingdom
558092,2023-06-26,20828,Glitter Butterfly Clips,12.86,2,14808.0,United Kingdom
558092,2023-06-26,20829,Glitter Hanging Butterfly String,12.4,2,14808.0,United Kingdom
558092,2023-06-26,47504K,English Rose Garden Secateurs,12.25,1,14808.0,United Kingdom
558092,2023-06-26,20986,Blue Calculator Ruler,11.53,1,14808.0,United Kingdom
558092,2023-06-26,21832,Chocolate Calculator,11.94,1,14808.0,United Kingdom
558092,2023-06-26,21833,Camouflage Led Torch,11.98,2,14808.0,United Kingdom
558093,2023-06-26,23050,Recycled Acapulco Mat Green,18.71,1,17969.0,United Kingdom
558093,2023-06-26,21630,Floor Cushion Elephant Carnival,19.42,2,17969.0,United Kingdom
558093,2023-06-26,21034,Rex Cash+Carry Jumbo Shopper,11.22,1,17969.0,United Kingdom
558093,2023-06-26,22752,Set 7 Babushka Nesting Boxes,18.96,1,17969.0,United Kingdom
558093,2023-06-26,71053,White Moroccan Metal Lantern,14.09,8,17969.0,United Kingdom
558093,2023-06-26,84946,Antique Silver T-Light Glass,11.53,6,17969.0,United Kingdom
558094,2023-06-26,23284,Doormat Keep Calm And Come In,18.4,4,14795.0,United Kingdom
558094,2023-06-26,21955,Doormat Union Jack Guns And Roses,18.4,3,14795.0,United Kingdom
558094,2023-06-26,48138,Doormat Union Flag,18.4,3,14795.0,United Kingdom
558094,2023-06-26,48188,Doormat Welcome Puppies,18.4,3,14795.0,United Kingdom
558094,2023-06-26,48111,Doormat 3 Smiley Cats,18.4,3,14795.0,United Kingdom
558094,2023-06-26,22371,Airline Bag Vintage Tokyo 78,14.61,1,14795.0,United Kingdom
558096,2023-06-26,21794,Classic French Style Basket Natural,14.3,3,15532.0,United Kingdom
558096,2023-06-26,22620,4 Traditional Spinning Tops,11.74,2,15532.0,United Kingdom
558096,2023-06-26,21890,S/6 Wooden Skittles In Cotton Bag,13.58,1,15532.0,United Kingdom
558096,2023-06-26,21891,Traditional Wooden Skipping Rope,11.74,1,15532.0,United Kingdom
558096,2023-06-26,84920,Pink Flower Fabric Pony,14.09,1,15532.0,United Kingdom
558096,2023-06-26,22273,Feltcraft Doll Molly,13.27,1,15532.0,United Kingdom
558096,2023-06-26,22749,Feltcraft Princess Charlotte Doll,14.09,1,15532.0,United Kingdom
558096,2023-06-26,21916,Set 12 Retro White Chalk Sticks,10.68,3,15532.0,United Kingdom
558096,2023-06-26,22906,12 Message Cards With Envelopes,11.94,2,15532.0,United Kingdom
558096,2023-06-26,22320,Birds Mobile Vintage Design,16.35,1,15532.0,United Kingdom
558096,2023-06-26,20702,Pink Padded Mobile,14.61,1,15532.0,United Kingdom
558096,2023-06-26,20836,French Paisley Cushion Cover,11.1,2,15532.0,United Kingdom
558096,2023-06-26,22464,Hanging Metal Heart Lantern,11.94,2,15532.0,United Kingdom
558096,2023-06-26,21106,Cream Slice Flannel Chocolate Spot,13.27,3,15532.0,United Kingdom
558096,2023-06-26,23198,Pantry Magnetic Shopping List,11.74,3,15532.0,United Kingdom
558096,2023-06-26,85039B,S/4 Ivory Mini Rose Candle In Bowl,11.94,1,15532.0,United Kingdom
558096,2023-06-26,22759,Set Of 3 Notebooks In Parcel,11.94,3,15532.0,United Kingdom
558096,2023-06-26,21851,Lilac Diamante Pen In Gift Box,15.32,2,15532.0,United Kingdom
558096,2023-06-26,21992,Vintage Paisley Stationery Set,11.53,1,15532.0,United Kingdom
558096,2023-06-26,21991,Bohemian Collage Stationery Set,11.53,1,15532.0,United Kingdom
558096,2023-06-26,84497,Buttons And Stripes Notebook,14.09,1,15532.0,United Kingdom
558096,2023-06-26,20972,Pink Cream Felt Craft Trinket Box,11.53,2,15532.0,United Kingdom
558096,2023-06-26,21647,Assorted Tutti Frutti Large Purse,12.4,1,15532.0,United Kingdom
558096,2023-06-26,21648,Assorted Tutti Frutti Small Purse,11.53,1,15532.0,United Kingdom
558096,2023-06-26,21993,Floral Folk Stationery Set,11.53,1,15532.0,United Kingdom
558096,2023-06-26,23245,Set Of 3 Regency Cake Tins,15.32,2,15532.0,United Kingdom
558096,2023-06-26,22604,Set Of 4 Napkin Charms Cutlery,12.86,2,15532.0,United Kingdom
558096,2023-06-26,22643,Set Of 4 Napkin Charms Leaves,12.86,2,15532.0,United Kingdom
558096,2023-06-26,21391,French Lavender Scent Heart,11.02,3,15532.0,United Kingdom
558096,2023-06-26,22701,Pink Dog Bowl,13.27,1,15532.0,United Kingdom
558096,2023-06-26,84692,Box Of 24 Cocktail Parasols,10.68,6,15532.0,United Kingdom
558096,2023-06-26,22989,Set 2 Pantry Design Tea Towels,13.58,2,15532.0,United Kingdom
558096,2023-06-26,21974,Set Of 36 Paisley Flower Doilies,11.74,1,15532.0,United Kingdom
558096,2023-06-26,23306,Set Of 36 Pantry Paper Doilies,11.74,2,15532.0,United Kingdom
558096,2023-06-26,23299,Food Cover With Beads Set 2,14.09,2,15532.0,United Kingdom
558096,2023-06-26,22907,Pack Of 20 Napkins Pantry Design,11.12,2,15532.0,United Kingdom
558096,2023-06-26,22800,Antique Tall Swirlglass Trinket Pot,14.09,1,15532.0,United Kingdom
558096,2023-06-26,23298,Spotty Bunting,15.32,3,15532.0,United Kingdom
558096,2023-06-26,23299,Food Cover With Beads Set 2,14.09,2,15532.0,United Kingdom
558096,2023-06-26,21108,Fairy Cake Flannel Assorted Colour,12.86,9,15532.0,United Kingdom
558096,2023-06-26,21110,Large Cake Towel Pink Spots,17.17,1,15532.0,United Kingdom
558096,2023-06-26,22251,Birdhouse Decoration Magic Garden,11.53,2,15532.0,United Kingdom
558096,2023-06-26,21112,Swiss Roll Towel Pink Spots,13.27,2,15532.0,United Kingdom
558096,2023-06-26,22456,Natural Slate Chalkboard Large,15.32,1,15532.0,United Kingdom
558096,2023-06-26,22457,Natural Slate Heart Chalkboard,13.27,2,15532.0,United Kingdom
558096,2023-06-26,84913B,Mint Green Rose Towel,15.02,1,15532.0,United Kingdom
558096,2023-06-26,84912B,Green Rose Washbag,14.09,1,15532.0,United Kingdom
558096,2023-06-26,22960,Jam Making Set With Jars,14.61,1,15532.0,United Kingdom
558096,2023-06-26,21992,Vintage Paisley Stationery Set,11.53,1,15532.0,United Kingdom
558096,2023-06-26,21900,Key Fob Shed,10.92,4,15532.0,United Kingdom
558096,2023-06-26,21447,12 Ivory Rose Peg Place Settings,11.53,2,15532.0,United Kingdom
558096,2023-06-26,21382,Set/4 Spring Flower Decoration,11.02,1,15532.0,United Kingdom
558096,2023-06-26,21714,Citronella Candle Garden Pot,11.53,6,15532.0,United Kingdom
558096,2023-06-26,22173,Metal 4 Hook Hanger French Chateau,13.27,2,15532.0,United Kingdom
558096,2023-06-26,22766,Photo Frame Cornice,13.27,1,15532.0,United Kingdom
558096,2023-06-26,82482,Wooden Picture Frame White Finish,12.86,2,15532.0,United Kingdom
558096,2023-06-26,22780,Light Garland Butterfiles Pink,14.61,1,15532.0,United Kingdom
558096,2023-06-26,72741,Grand Chocolatecandle,11.74,9,15532.0,United Kingdom
558096,2023-06-26,21613,S/12 Vanilla Botanical T-Lights,13.27,1,15532.0,United Kingdom
558096,2023-06-26,21609,Set 12 Lavender Botanical T-Lights,13.27,1,15532.0,United Kingdom
558096,2023-06-26,21865,Pink Union Jack Passport Cover,12.4,1,15532.0,United Kingdom
558096,2023-06-26,21867,Pink Union Jack Luggage Tag,11.53,1,15532.0,United Kingdom
558096,2023-06-26,20616,Cherry Blossom Passport Cover,11.02,1,15532.0,United Kingdom
558096,2023-06-26,20653,Cherry Blossom Luggage Tag,11.53,1,15532.0,United Kingdom
558096,2023-06-26,20654,First Class Luggage Tag,11.53,1,15532.0,United Kingdom
558096,2023-06-26,20617,First Class Passport Cover,12.4,1,15532.0,United Kingdom
558096,2023-06-26,22969,Homemade Jam Scented Candles,11.74,12,15532.0,United Kingdom
558096,2023-06-26,22666,Recipe Box Pantry Yellow Design,13.27,2,15532.0,United Kingdom
558096,2023-06-26,22667,Recipe Box Retrospot,13.27,1,15532.0,United Kingdom
558096,2023-06-26,22665,Recipe Box Blue Sketchbook Design,13.27,1,15532.0,United Kingdom
558096,2023-06-26,17012F,Origami Sandlewood Incense/Cand Set,11.12,1,15532.0,United Kingdom
