TransactionNo,Date,ProductNo,ProductName,Price,Quantity,CustomerNo,Country
567164,2023-09-18,21277,French Style Embossed Heart Cabinet,32.75,1,14487.0,United Kingdom
567183,2023-09-18,22848,Bread Bin Diner Style Pink,27.62,1,14769.0,United Kingdom
567184,2023-09-18,22946,Wooden Advent Calendar Cream,27.62,3,16033.0,United Kingdom
567184,2023-09-18,22847,Bread Bin Diner Style Ivory,27.62,1,16033.0,United Kingdom
567185,2023-09-18,22846,Bread Bin Diner Style Red,27.62,2,16370.0,United Kingdom
567185,2023-09-18,22847,Bread Bin Diner Style Ivory,27.62,2,16370.0,United Kingdom
567185,2023-09-18,22848,Bread Bin Diner Style Pink,27.62,1,16370.0,United Kingdom
567160,2023-09-18,22838,3 Tier Cake Tin Red And Cream,25.57,4,14562.0,United Kingdom
567183,2023-09-18,22762,Cupboard 3 Drawer Ma Campagne,25.57,1,14769.0,United Kingdom
567185,2023-09-18,22838,3 Tier Cake Tin Red And Cream,25.57,2,16370.0,United Kingdom
567166,2023-09-18,22423,Regency Cakestand 3 Tier,23.32,3,13078.0,United Kingdom
567178,2023-09-18,22424,Enamel Bread Bin Cream,23.32,1,17858.0,United Kingdom
567179,2023-09-18,22423,Regency Cakestand 3 Tier,23.32,1,15547.0,United Kingdom
567183,2023-09-18,22423,Regency Cakestand 3 Tier,23.32,2,14769.0,United Kingdom
567183,2023-09-18,21258,Victorian Sewing Box Large,23.32,2,14769.0,United Kingdom
567183,2023-09-18,22282,12 Egg House Painted Wood,23.32,1,14769.0,United Kingdom
567183,2023-09-18,22424,Enamel Bread Bin Cream,23.32,1,14769.0,United Kingdom
567164,2023-09-18,23427,Stool Home Sweet Home,23.06,1,14487.0,United Kingdom
567173,2023-09-18,23094,Le Grand Tray Chic Set,23.06,2,16689.0,United Kingdom
567178,2023-09-18,23111,Parisienne Sewing Box,23.06,2,17858.0,United Kingdom
567178,2023-09-18,23111,Parisienne Sewing Box,23.06,1,17858.0,United Kingdom
567178,2023-09-18,23427,Stool Home Sweet Home,23.06,2,17858.0,United Kingdom
567183,2023-09-18,23427,Stool Home Sweet Home,23.06,2,14769.0,United Kingdom
567159,2023-09-18,22622,Box Of Vintage Alphabet Blocks,22.5,4,15465.0,United Kingdom
567159,2023-09-18,22507,Memo Board Retrospot Design,15.32,3,15465.0,United Kingdom
567159,2023-09-18,21523,Doormat Fancy Font Home Sweet Home,17.51,10,15465.0,United Kingdom
567159,2023-09-18,21524,Doormat Spotty Home Sweet Home,18.71,3,15465.0,United Kingdom
567159,2023-09-18,48185,Doormat Fairy Cake,18.71,3,15465.0,United Kingdom
567159,2023-09-18,84879,Assorted Colour Bird Ornament,11.98,16,15465.0,United Kingdom
567159,2023-09-18,22687,Doormat Christmas Village,18.71,3,15465.0,United Kingdom
567159,2023-09-18,82484,Wood Black Board Ant White Finish,17.17,12,15465.0,United Kingdom
567159,2023-09-18,21430,Set/3 Red Gingham Rose Storage Box,13.72,24,15465.0,United Kingdom
567160,2023-09-18,21216,Set 3 Retrospot Tea/Coffee/Sugar,15.32,1,14562.0,United Kingdom
567160,2023-09-18,23243,Set Of Tea Coffee Sugar Tins Pantry,15.32,2,14562.0,United Kingdom
567160,2023-09-18,22191,Ivory Diner Wall Clock,18.96,2,14562.0,United Kingdom
567160,2023-09-18,22193,Red Diner Wall Clock,18.96,1,14562.0,United Kingdom
567160,2023-09-18,21035,Set/2 Red Retrospot Tea Towels,13.58,2,14562.0,United Kingdom
567160,2023-09-18,84030E,English Rose Hot Water Bottle,14.61,1,14562.0,United Kingdom
567160,2023-09-18,22111,Scottie Dog Hot Water Bottle,15.32,2,14562.0,United Kingdom
567160,2023-09-18,22989,Set 2 Pantry Design Tea Towels,13.58,1,14562.0,United Kingdom
567160,2023-09-18,21218,Red Spotty Biscuit Tin,14.09,1,14562.0,United Kingdom
567160,2023-09-18,22840,Round Cake Tin Vintage Red,18.4,1,14562.0,United Kingdom
567160,2023-09-18,22841,Round Cake Tin Vintage Green,18.4,2,14562.0,United Kingdom
567160,2023-09-18,23206,Lunch Bag Apple Design,5.97,2,14562.0,United Kingdom
567161,2023-09-18,21931,Jumbo Storage Bag Suki,12.08,100,15947.0,United Kingdom
567161,2023-09-18,20724,Red Retrospot Charlotte Bag,11.12,30,15947.0,United Kingdom
567161,2023-09-18,22355,Charlotte Bag Suki Design,11.12,30,15947.0,United Kingdom
567161,2023-09-18,20723,Strawberry Charlotte Bag,11.12,30,15947.0,United Kingdom
567161,2023-09-18,20719,Woodland Charlotte Bag,11.12,30,15947.0,United Kingdom
567161,2023-09-18,22558,Clothes Pegs Retrospot Pack 24,11.74,96,15947.0,United Kingdom
567161,2023-09-18,23341,Pink Diner Wall Clock,18.96,2,15947.0,United Kingdom
567161,2023-09-18,22191,Ivory Diner Wall Clock,18.96,2,15947.0,United Kingdom
567161,2023-09-18,22193,Red Diner Wall Clock,18.96,2,15947.0,United Kingdom
567161,2023-09-18,22624,Ivory Kitchen Scales,18.96,4,15947.0,United Kingdom
567161,2023-09-18,22625,Red Kitchen Scales,18.96,4,15947.0,United Kingdom
567161,2023-09-18,22960,Jam Making Set With Jars,14.09,24,15947.0,United Kingdom
567161,2023-09-18,22666,Recipe Box Pantry Yellow Design,13.27,12,15947.0,United Kingdom
567161,2023-09-18,22720,Set Of 3 Cake Tins Pantry Design,15.32,12,15947.0,United Kingdom
567161,2023-09-18,23243,Set Of Tea Coffee Sugar Tins Pantry,15.32,8,15947.0,United Kingdom
567161,2023-09-18,23294,Set Of 6 Snack Loaf Baking Cases,11.1,16,15947.0,United Kingdom
567161,2023-09-18,23296,Set Of 6 Tea Time Baking Cases,11.53,16,15947.0,United Kingdom
567161,2023-09-18,23293,Set Of 12 Fairy Cake Baking Cases,11.1,16,15947.0,United Kingdom
567161,2023-09-18,23295,Set Of 12 Mini Loaf Baking Cases,11.1,16,15947.0,United Kingdom
567161,2023-09-18,22993,Set Of 4 Pantry Jelly Moulds,11.53,24,15947.0,United Kingdom
567161,2023-09-18,22840,Round Cake Tin Vintage Red,18.4,4,15947.0,United Kingdom
567161,2023-09-18,22841,Round Cake Tin Vintage Green,18.4,4,15947.0,United Kingdom
567161,2023-09-18,20914,Set/5 Red Retrospot Lid Glass Bowls,13.27,12,15947.0,United Kingdom
567161,2023-09-18,22385,Jumbo Bag Spaceboy Design,6.04,100,15947.0,United Kingdom
567161,2023-09-18,20713,Jumbo Bag Owls,6.04,100,15947.0,United Kingdom
567161,2023-09-18,85099F,Jumbo Bag Strawberry,6.04,100,15947.0,United Kingdom
567161,2023-09-18,85099B,Jumbo Bag Red Retrospot,6.04,100,15947.0,United Kingdom
567162,2023-09-18,22360,Glass Jar English Confectionery,12.86,24,16525.0,United Kingdom
567162,2023-09-18,23090,Vintage Glass T-Light Holder,10.99,144,16525.0,United Kingdom
567162,2023-09-18,72816,Set/3 Christmas Decoupage Candles,11.34,48,16525.0,United Kingdom
567162,2023-09-18,82482,Wooden Picture Frame White Finish,12.86,36,16525.0,United Kingdom
567162,2023-09-18,23152,Ivory Sweetheart Wire Letter Rack,13.72,48,16525.0,United Kingdom
567162,2023-09-18,21181,Please One Person Metal Sign,12.15,48,16525.0,United Kingdom
567162,2023-09-18,23412,Heart Mirror Antique White,17.07,16,16525.0,United Kingdom
567162,2023-09-18,22796,Photo Frame 3 Classic Hanging,18.96,12,16525.0,United Kingdom
567162,2023-09-18,82494L,Wooden Frame Antique White,12.86,24,16525.0,United Kingdom
567163,2023-09-18,22617,Baking Set Spaceboy Design,15.32,6,13247.0,United Kingdom
567163,2023-09-18,22138,Baking Set 9 Piece Retrospot,15.32,9,13247.0,United Kingdom
567163,2023-09-18,23245,Set Of 3 Regency Cake Tins,15.32,4,13247.0,United Kingdom
567163,2023-09-18,35911A,Multicolour Rabbit Egg Warmer,11.12,6,13247.0,United Kingdom
567163,2023-09-18,84380,Set Of 3 Butterfly Cookie Cutters,11.74,12,13247.0,United Kingdom
567163,2023-09-18,22899,Children's Apron Dolly Girl,12.4,6,13247.0,United Kingdom
567163,2023-09-18,22898,Childrens Apron Apples Design,12.25,8,13247.0,United Kingdom
567163,2023-09-18,22367,Childrens Apron Spaceboy Design,12.25,8,13247.0,United Kingdom
567163,2023-09-18,22733,3d Traditional Christmas Stickers,11.53,18,13247.0,United Kingdom
567163,2023-09-18,22907,Pack Of 20 Napkins Pantry Design,11.12,12,13247.0,United Kingdom
567163,2023-09-18,22952,60 Cake Cases Vintage Christmas,10.81,48,13247.0,United Kingdom
567163,2023-09-18,23307,Set Of 60 Pantry Design Cake Cases,10.81,24,13247.0,United Kingdom
567163,2023-09-18,22909,Set Of 20 Vintage Christmas Napkins,11.12,24,13247.0,United Kingdom
567163,2023-09-18,23234,Biscuit Tin Vintage Christmas,13.21,18,13247.0,United Kingdom
567164,2023-09-18,16008,Small Folding Scissor(Pointed Edge),10.37,4,14487.0,United Kingdom
567164,2023-09-18,23131,Mistletoe Heart Wreath Cream,14.5,1,14487.0,United Kingdom
567164,2023-09-18,22161,Heart Decoration Rustic Hanging,10.44,15,14487.0,United Kingdom
567164,2023-09-18,85049E,Scandinavian Reds Ribbons,11.53,2,14487.0,United Kingdom
567164,2023-09-18,23089,Glass Bon Bon Jar,12.25,12,14487.0,United Kingdom
567164,2023-09-18,79030D,Tumbler Baroque,10.65,6,14487.0,United Kingdom
567164,2023-09-18,84947,Antique Silver Tea Glass Engraved,11.53,6,14487.0,United Kingdom
567164,2023-09-18,23068,Aluminium Stamped Heart,12.8,4,14487.0,United Kingdom
567164,2023-09-18,84876B,Green Heart Compact Mirror,11.53,2,14487.0,United Kingdom
567164,2023-09-18,22119,Peace Wooden Block Letters,17.37,1,14487.0,United Kingdom
567164,2023-09-18,22171,3 Hook Photo Shelf Antique White,18.96,1,14487.0,United Kingdom
567164,2023-09-18,22295,Heart Filigree Dove Large,11.94,12,14487.0,United Kingdom
567164,2023-09-18,22789,T-Light Holder Sweetheart Hanging,12.25,8,14487.0,United Kingdom
567164,2023-09-18,84876B,Green Heart Compact Mirror,11.53,3,14487.0,United Kingdom
567164,2023-09-18,84949,Silver Hanging T-Light Holder,11.94,12,14487.0,United Kingdom
567164,2023-09-18,23360,Set 8 Candles Vintage Doily,12.25,2,14487.0,United Kingdom
567164,2023-09-18,23359,Set Of 12 T-Lights Vintage Doily,12.25,2,14487.0,United Kingdom
567164,2023-09-18,21314,Small Glass Heart Trinket Pot,12.4,4,14487.0,United Kingdom
567164,2023-09-18,23186,French Style Storage Jar Cafe,10.55,6,14487.0,United Kingdom
567164,2023-09-18,23187,French Style Storage Jar Bonbons,10.55,6,14487.0,United Kingdom
567164,2023-09-18,23185,French Style Storage Jar Jam,10.55,12,14487.0,United Kingdom
567164,2023-09-18,21591,Cosy Hour Cigar Box Matches,11.53,6,14487.0,United Kingdom
567164,2023-09-18,46000S,Polyester Filler Pad 40x40cm,11.74,4,14487.0,United Kingdom
567164,2023-09-18,48188,Doormat Welcome Puppies,18.71,1,14487.0,United Kingdom
567164,2023-09-18,23404,Home Sweet Home Blackboard,15.32,2,14487.0,United Kingdom
567164,2023-09-18,23395,Belle Jardiniere Cushion Cover,14.09,2,14487.0,United Kingdom
567164,2023-09-18,23396,Le Jardin Botanique Cushion Cover,14.09,2,14487.0,United Kingdom
567164,2023-09-18,23089,Glass Bon Bon Jar,12.25,6,14487.0,United Kingdom
567164,2023-09-18,21929,Jumbo Bag Pink Vintage Paisley,6.19,1,14487.0,United Kingdom
567164,2023-09-18,21928,Jumbo Bag Scandinavian Blue Paisley,6.19,1,14487.0,United Kingdom
567165,2023-09-18,22874,Number Tile Cottage Garden 6,12.25,1,17841.0,United Kingdom
567165,2023-09-18,23403,Letter Holder Home Sweet Home,14.09,1,17841.0,United Kingdom
567165,2023-09-18,23165,Large Ceramic Top Storage Jar,11.94,2,17841.0,United Kingdom
567165,2023-09-18,23166,Medium Ceramic Top Storage Jar,11.53,2,17841.0,United Kingdom
567165,2023-09-18,22978,Pantry Rolling Pin,14.09,1,17841.0,United Kingdom
567165,2023-09-18,22982,Pantry Pastry Brush,11.53,1,17841.0,United Kingdom
567165,2023-09-18,47480,Hanging Photo Clip Rope Ladder,11.94,1,17841.0,United Kingdom
567165,2023-09-18,47421,Assorted Colour Lizard Suction Hook,10.68,4,17841.0,United Kingdom
567165,2023-09-18,20961,Strawberry Bath Sponge,11.53,1,17841.0,United Kingdom
567165,2023-09-18,21123,Set/10 Ivory Polkadot Party Candles,11.53,1,17841.0,United Kingdom
567165,2023-09-18,22754,Small Red Babushka Notebook,11.12,1,17841.0,United Kingdom
567165,2023-09-18,22681,French Blue Metal Door Sign 6,11.53,1,17841.0,United Kingdom
567165,2023-09-18,23400,Shelf With 4 Hooks Home Sweet Home,16.66,1,17841.0,United Kingdom
567165,2023-09-18,23148,Miniature Antique Rose Hook Ivory,11.1,1,17841.0,United Kingdom
567165,2023-09-18,23034,Drawer Knob Ceramic Black,11.74,2,17841.0,United Kingdom
567165,2023-09-18,23032,Drawer Knob Crackle Glaze Ivory,11.94,1,17841.0,United Kingdom
567165,2023-09-18,23031,Drawer Knob Crackle Glaze Pink,11.94,1,17841.0,United Kingdom
567165,2023-09-18,23034,Drawer Knob Ceramic Black,11.74,6,17841.0,United Kingdom
567165,2023-09-18,46000S,Polyester Filler Pad 40x40cm,11.74,4,17841.0,United Kingdom
567165,2023-09-18,22252,Birdcage Decoration Tealight Holder,11.53,3,17841.0,United Kingdom
567165,2023-09-18,47471,Rainbow Pegs Photo Clip String,10.92,1,17841.0,United Kingdom
567165,2023-09-18,22219,Lovebird Hanging Decoration White,11.12,2,17841.0,United Kingdom
567165,2023-09-18,23408,Photo Frame Linen And Lace Small,12.38,1,17841.0,United Kingdom
567165,2023-09-18,21640,Assorted Tutti Frutti Fob Notebook,11.12,1,17841.0,United Kingdom
567165,2023-09-18,84971S,Small Heart Flowers Hook,11.12,1,17841.0,United Kingdom
567165,2023-09-18,23148,Miniature Antique Rose Hook Ivory,11.1,1,17841.0,United Kingdom
567165,2023-09-18,79321,Chilli Lights,16.14,2,17841.0,United Kingdom
567165,2023-09-18,23395,Belle Jardiniere Cushion Cover,14.09,1,17841.0,United Kingdom
567165,2023-09-18,23394,Poste France Cushion Cover,14.09,1,17841.0,United Kingdom
567165,2023-09-18,23148,Miniature Antique Rose Hook Ivory,11.1,12,17841.0,United Kingdom
567165,2023-09-18,21155,Red Retrospot Peg Bag,12.86,1,17841.0,United Kingdom
567165,2023-09-18,22896,Peg Bag Apples Design,12.86,1,17841.0,United Kingdom
567165,2023-09-18,22135,Mini Ladle Love Heart Pink,10.68,2,17841.0,United Kingdom
567165,2023-09-18,21293,Mirrored Dove Wall Decoration,12.4,4,17841.0,United Kingdom
567165,2023-09-18,21448,12 Daisy Pegs In Wood Box,11.94,1,17841.0,United Kingdom
567165,2023-09-18,22469,Heart Of Wicker Small,11.94,1,17841.0,United Kingdom
567165,2023-09-18,20668,Disco Ball Christmas Decoration,10.37,48,17841.0,United Kingdom
567165,2023-09-18,23080,Red Metal Box Top Secret,18.71,1,17841.0,United Kingdom
567165,2023-09-18,21931,Jumbo Storage Bag Suki,12.38,1,17841.0,United Kingdom
567165,2023-09-18,22613,Pack Of 20 Spaceboy Napkins,11.12,2,17841.0,United Kingdom
567165,2023-09-18,22499,Wooden Union Jack Bunting,16.35,1,17841.0,United Kingdom
567165,2023-09-18,22176,Blue Owl Soft Toy,13.27,1,17841.0,United Kingdom
567165,2023-09-18,22222,Cake Plate Lovebird White,15.32,1,17841.0,United Kingdom
567165,2023-09-18,20781,Gold Ear Muff Headphones,15.88,1,17841.0,United Kingdom
567165,2023-09-18,22557,Plasters In Tin Vintage Paisley,11.94,1,17841.0,United Kingdom
567165,2023-09-18,22173,Metal 4 Hook Hanger French Chateau,13.62,1,17841.0,United Kingdom
567165,2023-09-18,21128,Gold Fishing Gnome,17.37,1,17841.0,United Kingdom
567165,2023-09-18,23239,Set Of 4 Knick Knack Tins Poppies,14.5,4,17841.0,United Kingdom
567165,2023-09-18,22118,Joy Wooden Block Letters,15.32,1,17841.0,United Kingdom
567165,2023-09-18,21670,Blue Spot Ceramic Drawer Knob,11.74,4,17841.0,United Kingdom
567165,2023-09-18,22196,Small Heart Measuring Spoons,11.12,1,17841.0,United Kingdom
567165,2023-09-18,22467,Gumball Coat Rack,12.86,3,17841.0,United Kingdom
567165,2023-09-18,23409,Photo Frame Linen And Lace Large,14.09,3,17841.0,United Kingdom
567165,2023-09-18,46776D,Woven Sunset Cushion Cover,15.32,4,17841.0,United Kingdom
567165,2023-09-18,21927,Blue/Cream Stripe Cushion Cover,11.53,4,17841.0,United Kingdom
567165,2023-09-18,23082,Set 6 Paper Table Lantern Hearts,14.09,1,17841.0,United Kingdom
567165,2023-09-18,20735,Black Mini Tape Measure,11.12,1,17841.0,United Kingdom
567165,2023-09-18,22652,Travel Sewing Kit,11.94,1,17841.0,United Kingdom
567165,2023-09-18,22870,Number Tile Cottage Garden 2,12.25,1,17841.0,United Kingdom
567165,2023-09-18,20713,Jumbo Bag Owls,6.19,1,17841.0,United Kingdom
567165,2023-09-18,20713,Jumbo Bag Owls,6.19,1,17841.0,United Kingdom
567165,2023-09-18,20713,Jumbo Bag Owls,6.19,2,17841.0,United Kingdom
567165,2023-09-18,23202,Jumbo Bag Vintage Leaf,6.19,1,17841.0,United Kingdom
567166,2023-09-18,22726,Alarm Clock Bakelike Green,13.72,50,13078.0,United Kingdom
567166,2023-09-18,22727,Alarm Clock Bakelike Red,13.72,50,13078.0,United Kingdom
567166,2023-09-18,22729,Alarm Clock Bakelike Orange,13.72,50,13078.0,United Kingdom
567166,2023-09-18,22728,Alarm Clock Bakelike Pink,14.09,12,13078.0,United Kingdom
567166,2023-09-18,22730,Alarm Clock Bakelike Ivory,14.09,12,13078.0,United Kingdom
567166,2023-09-18,82582,Area Patrolled Metal Sign,12.4,12,13078.0,United Kingdom
567166,2023-09-18,22725,Alarm Clock Bakelike Chocolate,14.09,12,13078.0,United Kingdom
567166,2023-09-18,22686,French Blue Metal Door Sign No,11.53,12,13078.0,United Kingdom
567166,2023-09-18,21754,Home Building Block Word,16.66,3,13078.0,United Kingdom
567166,2023-09-18,22193,Red Diner Wall Clock,18.96,2,13078.0,United Kingdom
567167,2023-09-18,22199,Frying Pan Red Retrospot,14.61,1,15547.0,United Kingdom
567167,2023-09-18,22203,Milk Pan Red Retrospot,14.09,1,15547.0,United Kingdom
567167,2023-09-18,84836,Zinc Metal Heart Decoration,11.53,2,15547.0,United Kingdom
567167,2023-09-18,23322,Large White Heart Of Wicker,13.27,5,15547.0,United Kingdom
567167,2023-09-18,22470,Heart Of Wicker Large,13.27,1,15547.0,United Kingdom
567167,2023-09-18,23323,White Wicker Star,12.4,4,15547.0,United Kingdom
567167,2023-09-18,22694,Wicker Star,12.4,2,15547.0,United Kingdom
567167,2023-09-18,22062,Ceramic Bowl With Love Heart Design,11.1,3,15547.0,United Kingdom
567167,2023-09-18,37468,Hardman Mug 3 Assorted,10.65,6,15547.0,United Kingdom
567167,2023-09-18,37340,Multicolour Spring Flower Mug,10.65,12,15547.0,United Kingdom
567167,2023-09-18,85130D,Beaded Crystal Heart Pink Large,11.06,6,15547.0,United Kingdom
567167,2023-09-18,85130B,Beaded Crystal Heart Green Large,11.06,2,15547.0,United Kingdom
567167,2023-09-18,85130C,Beaded Crystal Heart Blue Large,11.06,6,15547.0,United Kingdom
567167,2023-09-18,21232,Strawberry Ceramic Trinket Pot,11.53,4,15547.0,United Kingdom
567167,2023-09-18,21654,Ridged Glass Finger Bowl,10.65,4,15547.0,United Kingdom
567167,2023-09-18,23067,Hanging Engraved Metal Heart,14.5,2,15547.0,United Kingdom
567167,2023-09-18,79163,Black Champagne Glass,10.65,2,15547.0,United Kingdom
567167,2023-09-18,22123,Ping Microwave Apron,12.25,4,15547.0,United Kingdom
567167,2023-09-18,84992,72 Sweetheart Fairy Cake Cases,10.81,2,15547.0,United Kingdom
567167,2023-09-18,22645,Ceramic Heart Fairy Cake Money Bank,11.74,1,15547.0,United Kingdom
567167,2023-09-18,17012D,Origami Rose Incense/Candle Set,11.12,2,15547.0,United Kingdom
567167,2023-09-18,17012B,Origami Jasmine Incense/Candle Set,11.12,1,15547.0,United Kingdom
567167,2023-09-18,17012C,Origami Lavender Incense/Candl Set,11.12,1,15547.0,United Kingdom
567167,2023-09-18,20992,Jazz Hearts Purse Notebook,10.65,4,15547.0,United Kingdom
567167,2023-09-18,20996,Jazz Hearts Address Book,10.44,10,15547.0,United Kingdom
567167,2023-09-18,84692,Box Of 24 Cocktail Parasols,10.68,8,15547.0,United Kingdom
567167,2023-09-18,85231G,Orange Scented Set/9 T-Lights,11.12,6,15547.0,United Kingdom
567167,2023-09-18,85231B,Cinammon Set Of 9 T-Lights,11.12,2,15547.0,United Kingdom
567167,2023-09-18,21918,Set 12 Kids Colour Chalk Sticks,10.68,4,15547.0,United Kingdom
567167,2023-09-18,21916,Set 12 Retro White Chalk Sticks,10.68,5,15547.0,United Kingdom
567167,2023-09-18,20914,Set/5 Red Retrospot Lid Glass Bowls,13.27,3,15547.0,United Kingdom
567167,2023-09-18,21530,Dairy Maid Toastrack,11.06,3,15547.0,United Kingdom
567167,2023-09-18,84596L,Biscuits Small Bowl Light Blue,10.68,26,15547.0,United Kingdom
567167,2023-09-18,84596G,Small Chocolates Pink Bowl,10.68,16,15547.0,United Kingdom
567167,2023-09-18,84596F,Small Marshmallows Pink Bowl,10.68,24,15547.0,United Kingdom
567167,2023-09-18,84596B,Small Dolly Mix Design Orange Bowl,10.68,24,15547.0,United Kingdom
567167,2023-09-18,21845,Dairy Maid Stripe Mug,11.06,6,15547.0,United Kingdom
567167,2023-09-18,22726,Alarm Clock Bakelike Green,14.09,1,15547.0,United Kingdom
567167,2023-09-18,22730,Alarm Clock Bakelike Ivory,14.09,1,15547.0,United Kingdom
567167,2023-09-18,22727,Alarm Clock Bakelike Red,14.09,1,15547.0,United Kingdom
567167,2023-09-18,22728,Alarm Clock Bakelike Pink,14.09,1,15547.0,United Kingdom
567167,2023-09-18,21164,Home Sweet Home Metal Sign,13.27,1,15547.0,United Kingdom
567167,2023-09-18,85150,Ladies & Gentlemen Metal Sign,12.86,2,15547.0,United Kingdom
567167,2023-09-18,82600,N0 Singing Metal Sign,12.4,2,15547.0,United Kingdom
567167,2023-09-18,21175,Gin And Tonic Diet Metal Sign,12.86,2,15547.0,United Kingdom
567167,2023-09-18,22116,Metal Sign His Dinner Is Served,11.06,4,15547.0,United Kingdom
567167,2023-09-18,21181,Please One Person Metal Sign,12.4,4,15547.0,United Kingdom
567167,2023-09-18,23169,Classic Glass Cookie Jar,14.5,1,15547.0,United Kingdom
567167,2023-09-18,47503A,Ass Floral Print Multi Screwdriver,10.68,12,15547.0,United Kingdom
567167,2023-09-18,47504K,English Rose Garden Secateurs,11.06,12,15547.0,United Kingdom
567167,2023-09-18,35637C,Pink String Curtain With Pole,12.25,2,15547.0,United Kingdom
567167,2023-09-18,35637A,Ivory String Curtain With Pole,12.25,2,15547.0,United Kingdom
567167,2023-09-18,72232,Feng Shui Pillar Candle,10.44,12,15547.0,United Kingdom
567167,2023-09-18,22791,T-Light Glass Fluted Antique,11.53,5,15547.0,United Kingdom
567167,2023-09-18,84818,Danish Rose Photo Frame,11.06,6,15547.0,United Kingdom
567167,2023-09-18,23404,Home Sweet Home Blackboard,15.32,2,15547.0,United Kingdom
567167,2023-09-18,17091J,Vanilla Incense In Tin,10.64,6,15547.0,United Kingdom
567167,2023-09-18,23112,Parisienne Curio Cabinet,17.94,1,15547.0,United Kingdom
567167,2023-09-18,23412,Heart Mirror Antique White,17.94,1,15547.0,United Kingdom
567168,2023-09-18,22659,Lunch Box I Love London,12.25,2,14878.0,United Kingdom
567168,2023-09-18,22900,Set 2 Tea Towels I Love London,13.58,2,14878.0,United Kingdom
567168,2023-09-18,37447,Ceramic Cake Design Spotted Plate,11.78,4,14878.0,United Kingdom
567168,2023-09-18,22063,Ceramic Bowl With Strawberry Design,13.27,1,14878.0,United Kingdom
567168,2023-09-18,37446,Mini Cake Stand With Hanging Cakes,11.74,2,14878.0,United Kingdom
567168,2023-09-18,47591D,Pink Fairy Cake Childrens Apron,12.25,3,14878.0,United Kingdom
567168,2023-09-18,47567B,Tea Time Kitchen Apron,16.35,1,14878.0,United Kingdom
567168,2023-09-18,22059,Ceramic Strawberry Design Mug,11.78,2,14878.0,United Kingdom
567168,2023-09-18,21231,Sweetheart Ceramic Trinket Box,11.53,4,14878.0,United Kingdom
567168,2023-09-18,21232,Strawberry Ceramic Trinket Pot,11.53,4,14878.0,United Kingdom
567168,2023-09-18,22063,Ceramic Bowl With Strawberry Design,13.27,1,14878.0,United Kingdom
567168,2023-09-18,37448,Ceramic Cake Design Spotted Mug,11.78,4,14878.0,United Kingdom
567168,2023-09-18,37446,Mini Cake Stand With Hanging Cakes,11.74,4,14878.0,United Kingdom
567168,2023-09-18,22139,Retrospot Tea Set Ceramic 11 Pc,15.32,1,14878.0,United Kingdom
567168,2023-09-18,22900,Set 2 Tea Towels I Love London,13.58,2,14878.0,United Kingdom
567168,2023-09-18,23300,Gardeners Kneeling Pad Cup Of Tea,11.94,2,14878.0,United Kingdom
567168,2023-09-18,23302,Kneeling Mat Housework Design,11.94,2,14878.0,United Kingdom
567168,2023-09-18,22891,Tea For One Polkadot,14.61,2,14878.0,United Kingdom
567168,2023-09-18,22650,Ceramic Pirate Chest Money Bank,11.74,4,14878.0,United Kingdom
567168,2023-09-18,22646,Ceramic Strawberry Cake Money Bank,11.74,4,14878.0,United Kingdom
567168,2023-09-18,22645,Ceramic Heart Fairy Cake Money Bank,11.74,4,14878.0,United Kingdom
567168,2023-09-18,22713,Card I Love London,10.68,12,14878.0,United Kingdom
567169,2023-09-18,79030D,Tumbler Baroque,10.65,6,14487.0,United Kingdom
567170,2023-09-18,22993,Set Of 4 Pantry Jelly Moulds,11.53,1,13566.0,United Kingdom
567170,2023-09-18,23148,Miniature Antique Rose Hook Ivory,11.1,1,13566.0,United Kingdom
567170,2023-09-18,21945,Strawberries Design Flannel,11.12,1,13566.0,United Kingdom
567170,2023-09-18,84341B,Small Pink Magic Christmas Tree,10.64,1,13566.0,United Kingdom
567170,2023-09-18,47422,Assorted Monkey Suction Cup Hook,10.68,1,13566.0,United Kingdom
567170,2023-09-18,23238,Set Of 4 Knick Knack Tins London,14.5,1,13566.0,United Kingdom
567170,2023-09-18,23275,Set Of 3 Hanging Owls Ollie Beak,11.53,1,13566.0,United Kingdom
567170,2023-09-18,21823,Painted Metal Heart With Holly Bell,11.74,1,13566.0,United Kingdom
567170,2023-09-18,21824,Painted Metal Star With Holly Bells,11.74,1,13566.0,United Kingdom
567170,2023-09-18,23157,Set Of 6 Nativity Magnets,12.38,1,13566.0,United Kingdom
567170,2023-09-18,22900,Set 2 Tea Towels I Love London,13.58,2,13566.0,United Kingdom
567170,2023-09-18,23309,Set Of 60 I Love London Cake Cases,10.81,2,13566.0,United Kingdom
567170,2023-09-18,22993,Set Of 4 Pantry Jelly Moulds,11.53,1,13566.0,United Kingdom
567170,2023-09-18,23196,Vintage Leaf Magnetic Notepad,11.74,2,13566.0,United Kingdom
567170,2023-09-18,23197,Sketchbook Magnetic Shopping List,11.74,2,13566.0,United Kingdom
567170,2023-09-18,23198,Pantry Magnetic Shopping List,11.74,2,13566.0,United Kingdom
567170,2023-09-18,22580,Advent Calendar Gingham Sack,16.35,8,13566.0,United Kingdom
567170,2023-09-18,21819,Glitter Christmas Star,11.12,5,13566.0,United Kingdom
567170,2023-09-18,21817,Glitter Christmas Tree,11.12,10,13566.0,United Kingdom
567170,2023-09-18,22575,Metal Merry Christmas Wreath,12.25,5,13566.0,United Kingdom
567170,2023-09-18,23211,Red Rocking Horse Hand Painted,11.53,5,13566.0,United Kingdom
567170,2023-09-18,23264,Set Of 3 Wooden Sleigh Decorations,11.53,1,13566.0,United Kingdom
567170,2023-09-18,22581,Wood Stocking Christmas Scandispot,11.12,2,13566.0,United Kingdom
567170,2023-09-18,23275,Set Of 3 Hanging Owls Ollie Beak,11.53,10,13566.0,United Kingdom
567170,2023-09-18,23264,Set Of 3 Wooden Sleigh Decorations,11.53,6,13566.0,United Kingdom
567170,2023-09-18,23266,Set Of 3 Wooden Stocking Decoration,11.53,5,13566.0,United Kingdom
567170,2023-09-18,22581,Wood Stocking Christmas Scandispot,11.12,8,13566.0,United Kingdom
567170,2023-09-18,23264,Set Of 3 Wooden Sleigh Decorations,11.53,1,13566.0,United Kingdom
567170,2023-09-18,23210,White Rocking Horse Hand Painted,11.53,5,13566.0,United Kingdom
567170,2023-09-18,20974,12 Pencils Small Tube Skull,10.92,10,13566.0,United Kingdom
