TransactionNo,Date,ProductNo,ProductName,Price,Quantity,CustomerNo,Country
560415,2023-07-18,20978,36 Pencils Tube Skulls,11.53,16,15152.0,United Kingdom
560415,2023-07-18,21242,Red Retrospot Plate,11.98,8,15152.0,United Kingdom
560415,2023-07-18,21238,Red Retrospot Cup,11.12,8,15152.0,United Kingdom
560415,2023-07-18,20676,Red Retrospot Bowl,11.53,8,15152.0,United Kingdom
560415,2023-07-18,22988,Soldiers Egg Cup,11.53,12,15152.0,United Kingdom
560415,2023-07-18,22977,Dolly Girl Childrens Egg Cup,11.53,12,15152.0,United Kingdom
560415,2023-07-18,21791,Vintage Heads And Tails Card Game,11.53,12,15152.0,United Kingdom
560415,2023-07-18,23243,Set Of Tea Coffee Sugar Tins Pantry,15.32,4,15152.0,United Kingdom
560415,2023-07-18,22720,Set Of 3 Cake Tins Pantry Design,15.32,3,15152.0,United Kingdom
560415,2023-07-18,22663,Jumbo Bag Dolly Girl Design,6.19,10,15152.0,United Kingdom
560415,2023-07-18,23201,Jumbo Bag Alphabet,6.19,10,15152.0,United Kingdom
560416,2023-07-18,22178,Victorian Glass Hanging T-Light,11.53,12,14798.0,United Kingdom
560416,2023-07-18,85172,Hyacinth Bulb T-Light Candles,10.68,16,14798.0,United Kingdom
560417,2023-07-18,21673,White Spot Blue Ceramic Drawer Knob,11.53,12,16011.0,United Kingdom
560417,2023-07-18,21668,Red Stripe Ceramic Drawer Knob,11.53,12,16011.0,United Kingdom
560417,2023-07-18,21670,Blue Spot Ceramic Drawer Knob,11.53,12,16011.0,United Kingdom
560417,2023-07-18,23032,Drawer Knob Crackle Glaze Ivory,11.94,12,16011.0,United Kingdom
560417,2023-07-18,23031,Drawer Knob Crackle Glaze Pink,11.94,6,16011.0,United Kingdom
560417,2023-07-18,84946,Antique Silver T-Light Glass,11.53,24,16011.0,United Kingdom
560417,2023-07-18,23025,Drawer Knob Vintage Glass Ball,12.38,6,16011.0,United Kingdom
560417,2023-07-18,22775,Purple Drawerknob Acrylic Edwardian,11.53,12,16011.0,United Kingdom
560417,2023-07-18,22772,Pink Drawer Knob Acrylic Edwardian,11.53,12,16011.0,United Kingdom
560422,2023-07-18,22381,Toy Tidy Pink Polkadot,12.4,5,16746.0,United Kingdom
560422,2023-07-18,20679,Edwardian Parasol Red,16.35,3,16746.0,United Kingdom
560422,2023-07-18,22664,Toy Tidy Dolly Girl Design,12.4,5,16746.0,United Kingdom
560422,2023-07-18,22356,Charlotte Bag Pink Polkadot,11.12,10,16746.0,United Kingdom
560422,2023-07-18,23205,Charlotte Bag Vintage Alphabet,11.12,10,16746.0,United Kingdom
560422,2023-07-18,16048,Teatime Round Pencil Sharpener,10.37,24,16746.0,United Kingdom
560422,2023-07-18,21928,Jumbo Bag Scandinavian Blue Paisley,6.19,10,16746.0,United Kingdom
560422,2023-07-18,21929,Jumbo Bag Pink Vintage Paisley,6.19,10,16746.0,United Kingdom
560422,2023-07-18,22663,Jumbo Bag Dolly Girl Design,6.19,10,16746.0,United Kingdom
560422,2023-07-18,22386,Jumbo Bag Pink Polkadot,6.19,10,16746.0,United Kingdom
560422,2023-07-18,23201,Jumbo Bag Alphabet,6.19,10,16746.0,United Kingdom
560422,2023-07-18,23202,Jumbo Bag Vintage Leaf,6.19,20,16746.0,United Kingdom
560422,2023-07-18,85099B,Jumbo Bag Red Retrospot,6.19,10,16746.0,United Kingdom
560422,2023-07-18,23203,Jumbo Bag Vintage Doily,6.19,10,16746.0,United Kingdom
560422,2023-07-18,23209,Lunch Bag Vintage Doily,5.97,10,16746.0,United Kingdom
560426,2023-07-18,21931,Jumbo Storage Bag Suki,12.38,10,14038.0,United Kingdom
560426,2023-07-18,20914,Set/5 Red Retrospot Lid Glass Bowls,13.27,6,14038.0,United Kingdom
560426,2023-07-18,82600,N0 Singing Metal Sign,12.4,12,14038.0,United Kingdom
560426,2023-07-18,85152,Hand Over The Chocolate Sign,12.4,12,14038.0,United Kingdom
560426,2023-07-18,23201,Jumbo Bag Alphabet,6.19,10,14038.0,United Kingdom
560426,2023-07-18,23203,Jumbo Bag Vintage Doily,6.19,10,14038.0,United Kingdom
560426,2023-07-18,85099C,Jumbo Bag Baroque Black White,6.19,10,14038.0,United Kingdom
560426,2023-07-18,23202,Jumbo Bag Vintage Leaf,6.19,10,14038.0,United Kingdom
560426,2023-07-18,22382,Lunch Bag Spaceboy Design,5.97,10,14038.0,United Kingdom
560426,2023-07-18,22662,Lunch Bag Dolly Girl Design,5.97,10,14038.0,United Kingdom
560426,2023-07-18,20727,Lunch Bag Black Skull,5.97,10,14038.0,United Kingdom
560426,2023-07-18,23207,Lunch Bag Alphabet Design,5.97,10,14038.0,United Kingdom
560426,2023-07-18,20728,Lunch Bag Cars Blue,5.97,10,14038.0,United Kingdom
560426,2023-07-18,23208,Lunch Bag Vintage Leaf Design,5.97,10,14038.0,United Kingdom
560426,2023-07-18,22383,Lunch Bag Suki Design,5.97,10,14038.0,United Kingdom
560426,2023-07-18,22384,Lunch Bag Pink Polkadot,5.97,10,14038.0,United Kingdom
560426,2023-07-18,20726,Lunch Bag Woodland,5.97,10,14038.0,United Kingdom
560426,2023-07-18,23209,Lunch Bag Vintage Doily,5.97,10,14038.0,United Kingdom
560426,2023-07-18,20725,Lunch Bag Red Retrospot,5.97,10,14038.0,United Kingdom
560426,2023-07-18,23206,Lunch Bag Apple Design,5.97,10,14038.0,United Kingdom
560432,2023-07-18,22197,Popcorn Holder,11.12,24,13327.0,United Kingdom
560432,2023-07-18,23284,Doormat Keep Calm And Come In,17.17,10,13327.0,United Kingdom
560432,2023-07-18,22432,Watering Can Pink Bunny,12.25,6,13327.0,United Kingdom
560432,2023-07-18,22431,Watering Can Blue Elephant,12.25,6,13327.0,United Kingdom
560432,2023-07-18,82484,Wood Black Board Ant White Finish,18.4,4,13327.0,United Kingdom
560432,2023-07-18,82482,Wooden Picture Frame White Finish,12.86,6,13327.0,United Kingdom
560432,2023-07-18,22766,Photo Frame Cornice,13.27,8,13327.0,United Kingdom
560432,2023-07-18,79321,Chilli Lights,16.14,4,13327.0,United Kingdom
560432,2023-07-18,85152,Hand Over The Chocolate Sign,12.4,12,13327.0,United Kingdom
560432,2023-07-18,22427,Enamel Flower Jug Cream,16.35,6,13327.0,United Kingdom
560432,2023-07-18,79191C,Retro Plastic Elephant Tray,11.12,12,13327.0,United Kingdom
560432,2023-07-18,23203,Jumbo Bag Vintage Doily,6.19,30,13327.0,United Kingdom
560432,2023-07-18,21928,Jumbo Bag Scandinavian Blue Paisley,6.19,20,13327.0,United Kingdom
560432,2023-07-18,23199,Jumbo Bag Apples,6.19,30,13327.0,United Kingdom
560432,2023-07-18,85099B,Jumbo Bag Red Retrospot,6.19,20,13327.0,United Kingdom
560433,2023-07-18,21672,White Spot Red Ceramic Drawer Knob,13.62,2,15433.0,United Kingdom
560433,2023-07-18,21688,Silver Plate Candle Bowl Small,16.18,3,15433.0,United Kingdom
560433,2023-07-18,21715,Girls Vintage Tin Seaside Bucket,12.77,6,15433.0,United Kingdom
560433,2023-07-18,21716,Boys Vintage Tin Seaside Bucket,12.77,5,15433.0,United Kingdom
560433,2023-07-18,21749,Large Red Retrospot Windmill,14.48,4,15433.0,United Kingdom
560433,2023-07-18,21774,Decorative Cats Bathroom Bottle,12.77,1,15433.0,United Kingdom
560433,2023-07-18,21775,Decorative Flore Bathroom Bottle,12.77,1,15433.0,United Kingdom
560433,2023-07-18,21803,Christmas Tree Star Decoration,10.68,1,15433.0,United Kingdom
560433,2023-07-18,21846,Pink Diamante Pen In Gift Box,12.77,2,15433.0,United Kingdom
560433,2023-07-18,21851,Lilac Diamante Pen In Gift Box,12.77,2,15433.0,United Kingdom
560433,2023-07-18,21877,Home Sweet Home Mug,13.62,1,15433.0,United Kingdom
560433,2023-07-18,21901,Key Fob Back Door,11.92,1,15433.0,United Kingdom
560433,2023-07-18,21913,Vintage Seaside Jigsaw Puzzles,13.62,3,15433.0,United Kingdom
560433,2023-07-18,21930,Jumbo Storage Bag Skulls,14.48,1,15433.0,United Kingdom
560433,2023-07-18,21934,Skull Shoulder Bag,11.92,4,15433.0,United Kingdom
560433,2023-07-18,21935,Suki Shoulder Bag,11.92,1,15433.0,United Kingdom
560433,2023-07-18,21936,Red Retrospot Picnic Bag,16.18,1,15433.0,United Kingdom
560433,2023-07-18,21972,Set Of 36 Dinosaur Paper Doilies,11.53,1,15433.0,United Kingdom
560433,2023-07-18,21977,Pack Of 60 Pink Paisley Cake Cases,11.53,1,15433.0,United Kingdom
560433,2023-07-18,21982,Pack Of 12 Suki Tissues,11.1,1,15433.0,United Kingdom
560433,2023-07-18,21985,Pack Of 12 Hearts Design Tissues,11.1,7,15433.0,United Kingdom
560433,2023-07-18,21989,Pack Of 20 Skull Paper Napkins,11.92,2,15433.0,United Kingdom
560433,2023-07-18,21990,Modern Floral Stationery Set,12.77,2,15433.0,United Kingdom
560433,2023-07-18,21993,Floral Folk Stationery Set,12.77,1,15433.0,United Kingdom
560433,2023-07-18,22030,Swallows Greeting Card,11.1,3,15433.0,United Kingdom
560433,2023-07-18,22083,Paper Chain Kit Retrospot,16.18,1,15433.0,United Kingdom
560433,2023-07-18,22090,Paper Bunting Retrospot,16.18,10,15433.0,United Kingdom
560433,2023-07-18,22161,Heart Decoration Rustic Hanging,11.06,5,15433.0,United Kingdom
560433,2023-07-18,22173,Metal 4 Hook Hanger French Chateau,16.18,1,15433.0,United Kingdom
560433,2023-07-18,22182,Cake Stand Victorian Filigree Small,14.48,2,15433.0,United Kingdom
560433,2023-07-18,22197,Popcorn Holder,11.92,2,15433.0,United Kingdom
560433,2023-07-18,22201,Frying Pan Blue Polkadot,14.48,1,15433.0,United Kingdom
560433,2023-07-18,22204,Milk Pan Blue Polkadot,13.62,1,15433.0,United Kingdom
560433,2023-07-18,22210,Wood Stamp Set Best Wishes,11.1,2,15433.0,United Kingdom
560433,2023-07-18,22219,Lovebird Hanging Decoration White,11.92,1,15433.0,United Kingdom
560433,2023-07-18,22228,Bunny Wooden Painted With Bird,11.1,5,15433.0,United Kingdom
560433,2023-07-18,22230,Jigsaw Tree With Watering Can,11.1,4,15433.0,United Kingdom
560433,2023-07-18,22231,Jigsaw Tree With Birdhouse,11.53,5,15433.0,United Kingdom
560433,2023-07-18,22233,Jigsaw Rabbit And Birdhouse,11.53,2,15433.0,United Kingdom
560433,2023-07-18,22244,3 Hook Hanger Magic Garden,14.48,1,15433.0,United Kingdom
560433,2023-07-18,22250,Decoration Butterfly Magic Garden,11.1,2,15433.0,United Kingdom
560433,2023-07-18,22251,Birdhouse Decoration Magic Garden,11.1,3,15433.0,United Kingdom
560433,2023-07-18,22278,Overnight Bag Vintage Rose Paisley,14.48,1,15433.0,United Kingdom
560433,2023-07-18,22291,Hanging Chick Cream Decoration,11.53,1,15433.0,United Kingdom
560433,2023-07-18,22297,Heart Ivory Trellis Small,12.77,1,15433.0,United Kingdom
560433,2023-07-18,22322,Bird Decoration Green Polkadot,11.1,3,15433.0,United Kingdom
560433,2023-07-18,22329,Round Container Set Of 5 Retrospot,11.92,2,15433.0,United Kingdom
560433,2023-07-18,22348,Tea Bag Plate Red Retrospot,11.92,2,15433.0,United Kingdom
560433,2023-07-18,22356,Charlotte Bag Pink Polkadot,11.92,3,15433.0,United Kingdom
560433,2023-07-18,22358,Kings Choice Tea Caddy,12.77,1,15433.0,United Kingdom
560433,2023-07-18,22361,Glass Jar Daisy Fresh Cotton Wool,16.18,1,15433.0,United Kingdom
560433,2023-07-18,22377,Bottle Bag Retrospot,11.92,1,15433.0,United Kingdom
560433,2023-07-18,22378,Wall Tidy Retrospot,11.92,1,15433.0,United Kingdom
560433,2023-07-18,22379,Recycling Bag Retrospot,14.48,1,15433.0,United Kingdom
560433,2023-07-18,22440,Balloon Water Bomb Pack Of 35,11.1,1,15433.0,United Kingdom
560433,2023-07-18,22457,Natural Slate Heart Chalkboard,16.18,2,15433.0,United Kingdom
560433,2023-07-18,22470,Heart Of Wicker Large,16.18,1,15433.0,United Kingdom
560433,2023-07-18,22488,Natural Slate Rectangle Chalkboard,13.62,2,15433.0,United Kingdom
560433,2023-07-18,22570,Feltcraft Cushion Rabbit,17.9,1,15433.0,United Kingdom
560433,2023-07-18,22595,Gingham Heart Decoration,11.92,1,15433.0,United Kingdom
560433,2023-07-18,22602,Retrospot Wooden Heart Decoration,11.92,1,15433.0,United Kingdom
560433,2023-07-18,22608,Pens Assorted Funky Jeweled,10.68,3,15433.0,United Kingdom
560433,2023-07-18,22609,Pens Assorted Spaceball,10.68,4,15433.0,United Kingdom
560433,2023-07-18,22610,Pens Assorted Funny Face,10.68,6,15433.0,United Kingdom
560433,2023-07-18,22628,Picnic Boxes Set Of 3 Retrospot,14.48,3,15433.0,United Kingdom
560433,2023-07-18,22667,Recipe Box Retrospot,16.18,2,15433.0,United Kingdom
560433,2023-07-18,22670,French Wc Sign Blue Metal,12.77,1,15433.0,United Kingdom
560433,2023-07-18,22694,Wicker Star,14.48,6,15433.0,United Kingdom
560433,2023-07-18,22715,Card Wedding Day,11.1,1,15433.0,United Kingdom
560433,2023-07-18,22718,Card Cat And Tree,11.1,1,15433.0,United Kingdom
560433,2023-07-18,22721,Set Of 3 Cake Tins Sketchbook,14.48,4,15433.0,United Kingdom
560433,2023-07-18,22723,Set Of 6 Herb Tins Sketchbook,13.62,1,15433.0,United Kingdom
560433,2023-07-18,22728,Alarm Clock Bakelike Pink,17.9,1,15433.0,United Kingdom
560433,2023-07-18,22752,Set 7 Babushka Nesting Boxes,18.75,3,15433.0,United Kingdom
560433,2023-07-18,22792,Fluted Antique Candle Holder,11.92,1,15433.0,United Kingdom
560433,2023-07-18,22807,Set Of 6 T-Lights Toadstools,12.77,1,15433.0,United Kingdom
560433,2023-07-18,22815,Card Psychedelic Apples,10.68,5,15433.0,United Kingdom
560433,2023-07-18,22893,Mini Cake Stand T-Light Holder,11.1,3,15433.0,United Kingdom
560433,2023-07-18,22956,36 Foil Heart Cake Cases,12.77,3,15433.0,United Kingdom
560433,2023-07-18,22961,Jam Making Set Printed,13.62,2,15433.0,United Kingdom
560433,2023-07-18,22962,Jam Jar With Pink Lid,11.92,1,15433.0,United Kingdom
560433,2023-07-18,22963,Jam Jar With Green Lid,11.92,1,15433.0,United Kingdom
560433,2023-07-18,22969,Homemade Jam Scented Candles,13.62,1,15433.0,United Kingdom
560433,2023-07-18,22993,Set Of 4 Pantry Jelly Moulds,12.77,2,15433.0,United Kingdom
560433,2023-07-18,22995,Travel Card Wallet Suki,11.1,1,15433.0,United Kingdom
560433,2023-07-18,23012,Glass Apothecary Bottle Perfume,18.75,1,15433.0,United Kingdom
560433,2023-07-18,23061,Vintage Embossed Heart,12.77,1,15433.0,United Kingdom
560433,2023-07-18,23070,Edwardian Heart Photo Frame,18.75,1,15433.0,United Kingdom
560433,2023-07-18,23089,Glass Bon Bon Jar,13.62,1,15433.0,United Kingdom
560433,2023-07-18,23103,Jingle Bell Heart Decoration,13.62,1,15433.0,United Kingdom
560433,2023-07-18,23124,18pc Wooden Cutlery Set Disposable,12.77,2,15433.0,United Kingdom
560433,2023-07-18,23174,Regency Sugar Bowl Green,18.75,2,15433.0,United Kingdom
560433,2023-07-18,23228,Filigree Heart Bird White,12.77,5,15433.0,United Kingdom
560433,2023-07-18,23275,Set Of 3 Hanging Owls Ollie Beak,12.77,1,15433.0,United Kingdom
560433,2023-07-18,23286,Blue Vintage Spot Beaker,11.92,2,15433.0,United Kingdom
560433,2023-07-18,35004B,Set Of 3 Black Flying Ducks,16.18,2,15433.0,United Kingdom
560433,2023-07-18,35471D,Set Of 3 Bird Light Pink Feather,11.53,1,15433.0,United Kingdom
560433,2023-07-18,35964,Folkart Clip On Stars,11.92,1,15433.0,United Kingdom
560433,2023-07-18,40016,Chinese Dragon Paper Lanterns,18.75,1,15433.0,United Kingdom
560433,2023-07-18,71459,Hanging Jam Jar T-Light Holders,11.95,4,15433.0,United Kingdom
560433,2023-07-18,84032A,Charlie+Lola Pink Hot Water Bottle,13.62,1,15433.0,United Kingdom
560433,2023-07-18,84050,Pink Heart Shape Egg Frying Pan,14.48,1,15433.0,United Kingdom
560433,2023-07-18,84378,Set Of 3 Heart Cookie Cutters,12.77,1,15433.0,United Kingdom
560433,2023-07-18,84380,Set Of 3 Butterfly Cookie Cutters,12.77,1,15433.0,United Kingdom
560433,2023-07-18,84509A,Set Of 4 English Rose Placemats,13.62,2,15433.0,United Kingdom
560433,2023-07-18,84536B,Fairy Cakes Notebook A7 Size,10.68,13,15433.0,United Kingdom
560433,2023-07-18,84558A,3d Dog Picture Playing Cards,12.6,1,15433.0,United Kingdom
560433,2023-07-18,84568,Girls Alphabet Iron On Patches,10.68,6,15433.0,United Kingdom
560433,2023-07-18,84637,Kitchen Flower Pots Wall Plaque,15.33,1,15433.0,United Kingdom
560433,2023-07-18,84659A,White Travel Alarm Clock,12.77,2,15433.0,United Kingdom
560433,2023-07-18,84661C,Pink Square Table Clock,15.33,1,15433.0,United Kingdom
560433,2023-07-18,84673A,Pink Fly Swat,11.06,1,15433.0,United Kingdom
560433,2023-07-18,84692,Box Of 24 Cocktail Parasols,11.1,1,15433.0,United Kingdom
560433,2023-07-18,84746,Pink Easter Hens+Flower,12.77,1,15433.0,United Kingdom
560433,2023-07-18,84748,Folk Felt Hanging Multicol Garland,12.77,2,15433.0,United Kingdom
560433,2023-07-18,84796B,Blue Savannah Picnic Hamper For 2,18.75,2,15433.0,United Kingdom
560433,2023-07-18,84828,Jungle Popsicles Ice Lolly Moulds,11.53,1,15433.0,United Kingdom
560433,2023-07-18,84920,Pink Flower Fabric Pony,13.62,1,15433.0,United Kingdom
560433,2023-07-18,84946,Antique Silver T-Light Glass,12.77,12,15433.0,United Kingdom
560433,2023-07-18,84951B,Set Of 4 Black Lovebird Coasters,12.77,1,15433.0,United Kingdom
560433,2023-07-18,84969,Box Of 6 Assorted Colour Teaspoons,13.62,1,15433.0,United Kingdom
560433,2023-07-18,84991,60 Teatime Fairy Cake Cases,11.53,1,15433.0,United Kingdom
560433,2023-07-18,85017B,Envelope 50 Blossom Images,11.1,1,15433.0,United Kingdom
560433,2023-07-18,85032A,Romantic Images Gift Wrap Set,11.92,1,15433.0,United Kingdom
560433,2023-07-18,85078,Scandinavian 3 Hearts Napkin Ring,11.92,1,15433.0,United Kingdom
560433,2023-07-18,85086A,Candy Spot Heart Decoration,11.1,3,15433.0,United Kingdom
560433,2023-07-18,85087,Candy Spot Cushion Cover,13.62,1,15433.0,United Kingdom
560433,2023-07-18,85095,Three Canvas Luggage Tags,11.1,3,15433.0,United Kingdom
560433,2023-07-18,85106,Cut Glass Hexagon T-Light Holder,14.48,2,15433.0,United Kingdom
560433,2023-07-18,85123A,Cream Hanging Heart T-Light Holder,16.18,4,15433.0,United Kingdom
560433,2023-07-18,85132C,Charlie And Lola Figures Tins,16.18,2,15433.0,United Kingdom
560433,2023-07-18,85199L,Large Hanging Ivory & Red Wood Bird,11.53,1,15433.0,United Kingdom
560433,2023-07-18,90013A,Midnight Blue Vintage Earrings,14.07,1,15433.0,United Kingdom
560433,2023-07-18,90070,Ruby Glass Cluster Bracelet,16.64,1,15433.0,United Kingdom
560433,2023-07-18,90129A,Pink Glass Tassle Bag Charm,11.92,1,15433.0,United Kingdom
560433,2023-07-18,90129B,Turquoise Glass Tassle Bag Charm,11.92,1,15433.0,United Kingdom
560433,2023-07-18,90129C,Green Glass Tassle Bag Charm,11.92,1,15433.0,United Kingdom
560433,2023-07-18,90129D,Amber Glass Tassle Bag Charm,11.92,1,15433.0,United Kingdom
560433,2023-07-18,90129E,Purple Glass Tassle Bag Charm,11.92,2,15433.0,United Kingdom
560433,2023-07-18,90129F,Red Glass Tassle Bag Charm,11.92,1,15433.0,United Kingdom
560433,2023-07-18,90134,Old Rose Combo Bead Necklace,13.22,1,15433.0,United Kingdom
560433,2023-07-18,90161C,Ant Copper Lime Boudicca Bracelet,15.35,1,15433.0,United Kingdom
560433,2023-07-18,90165A,Pink Rosebud Pearl Earrings,12.79,1,15433.0,United Kingdom
560433,2023-07-18,90186A,Amethyst Hoop Earring Floral Leaf,13.22,1,15433.0,United Kingdom
560433,2023-07-18,90209B,Green Enamel+Glass Hair Comb,12.37,1,15433.0,United Kingdom
560433,2023-07-18,90214A,"Letter ""A"" Bling Key Ring",11.1,3,15433.0,United Kingdom
560433,2023-07-18,90214E,"Letter ""E"" Bling Key Ring",11.1,1,15433.0,United Kingdom
560433,2023-07-18,90214M,"Letter ""M"" Bling Key Ring",11.1,1,15433.0,United Kingdom
560433,2023-07-18,90214R,"Letter ""R"" Bling Key Ring",11.1,1,15433.0,United Kingdom
560433,2023-07-18,90214S,"Letter ""S"" Bling Key Ring",11.1,3,15433.0,United Kingdom
560433,2023-07-18,90214W,"Letter ""W"" Bling Key Ring",11.1,1,15433.0,United Kingdom
560433,2023-07-18,21212,Pack Of 72 Retrospot Cake Cases,10.81,9,15433.0,United Kingdom
560433,2023-07-18,22355,Charlotte Bag Suki Design,11.12,5,15433.0,United Kingdom
560433,2023-07-18,23291,Dolly Girl Childrens Cup,11.53,4,15433.0,United Kingdom
560433,2023-07-18,47599A,Pink Party Bags,12.4,3,15433.0,United Kingdom
560433,2023-07-18,47566B,Tea Time Party Bunting,15.32,5,15433.0,United Kingdom
560433,2023-07-18,10133,Colouring Pencils Brown Tube,11.1,3,15433.0,United Kingdom
560433,2023-07-18,11001,Asstd Design Racing Car Pen,11.1,1,15433.0,United Kingdom
560433,2023-07-18,15036,Assorted Colours Silk Fan,11.92,5,15433.0,United Kingdom
560433,2023-07-18,16218,Cartoon Pencil Sharpeners,10.68,5,15433.0,United Kingdom
560433,2023-07-18,16219,House Shape Pencil Sharpener,11.1,1,15433.0,United Kingdom
560433,2023-07-18,16237,Sleeping Cat Erasers,10.68,4,15433.0,United Kingdom
560433,2023-07-18,16254,Transparent Acrylic Tape Dispenser,11.92,1,15433.0,United Kingdom
560433,2023-07-18,20665,Red Retrospot Purse,12.77,2,15433.0,United Kingdom
560433,2023-07-18,20666,Economy Holiday Purse,11.1,1,15433.0,United Kingdom
560433,2023-07-18,20676,Red Retrospot Bowl,12.77,3,15433.0,United Kingdom
560433,2023-07-18,20707,Crazy Daisy Heart Decoration,11.1,5,15433.0,United Kingdom
560433,2023-07-18,20718,Red Retrospot Shopper Bag,12.77,1,15433.0,United Kingdom
560433,2023-07-18,20719,Woodland Charlotte Bag,11.92,1,15433.0,United Kingdom
560433,2023-07-18,20723,Strawberry Charlotte Bag,11.92,5,15433.0,United Kingdom
560433,2023-07-18,20724,Red Retrospot Charlotte Bag,11.92,1,15433.0,United Kingdom
560433,2023-07-18,20856,Denim Patch Purse Pink Butterfly,11.92,2,15433.0,United Kingdom
560433,2023-07-18,20978,36 Pencils Tube Skulls,12.77,2,15433.0,United Kingdom
560433,2023-07-18,20979,36 Pencils Tube Red Retrospot,12.77,2,15433.0,United Kingdom
560433,2023-07-18,20981,12 Pencils Tall Tube Woodland,11.92,1,15433.0,United Kingdom
560433,2023-07-18,20986,Blue Calculator Ruler,11.1,18,15433.0,United Kingdom
560433,2023-07-18,21071,Vintage Billboard Drink Me Mug,12.77,1,15433.0,United Kingdom
560433,2023-07-18,21084,Set/6 Collage Paper Cups,11.1,6,15433.0,United Kingdom
560433,2023-07-18,21086,Set/6 Red Spotty Paper Cups,11.92,2,15433.0,United Kingdom
560433,2023-07-18,21090,Set/6 Collage Paper Plates,11.1,20,15433.0,United Kingdom
560433,2023-07-18,21094,Set/6 Red Spotty Paper Plates,11.1,4,15433.0,United Kingdom
560433,2023-07-18,21108,Fairy Cake Flannel Assorted Colour,15.33,1,15433.0,United Kingdom
560433,2023-07-18,21172,Party Metal Sign,14.48,1,15433.0,United Kingdom
560433,2023-07-18,21201,Tropical Honeycomb Paper Garland,15.33,7,15433.0,United Kingdom
560433,2023-07-18,21204,Daisies Honeycomb Garland,11.92,4,15433.0,United Kingdom
560433,2023-07-18,21206,Strawberry Honeycomb Garland,11.92,1,15433.0,United Kingdom
560433,2023-07-18,21211,Set Of 72 Skull Paper Doilies,11.53,1,15433.0,United Kingdom
560433,2023-07-18,21212,Pack Of 72 Retrospot Cake Cases,11.53,2,15433.0,United Kingdom
560433,2023-07-18,21213,Pack Of 72 Skull Cake Cases,11.53,1,15433.0,United Kingdom
560433,2023-07-18,21215,Ivory Paper Cup Cake Cases,11.53,4,15433.0,United Kingdom
560433,2023-07-18,21246,Red Retrospot Big Bowl,14.48,2,15433.0,United Kingdom
560433,2023-07-18,21314,Small Glass Heart Trinket Pot,14.48,5,15433.0,United Kingdom
560433,2023-07-18,21327,Skulls Writing Set,11.1,10,15433.0,United Kingdom
560433,2023-07-18,21328,Balloons Writing Set,11.1,6,15433.0,United Kingdom
560433,2023-07-18,21329,Dinosaurs Writing Set,11.1,8,15433.0,United Kingdom
560433,2023-07-18,21366,Mirrored Wall Art Photo Frames,13.62,2,15433.0,United Kingdom
560433,2023-07-18,21382,Set/4 Spring Flower Decoration,11.92,1,15433.0,United Kingdom
560433,2023-07-18,21385,Ivory Hanging Decoration Heart,11.92,5,15433.0,United Kingdom
560433,2023-07-18,21390,Filigris Heart With Butterfly,12.77,5,15433.0,United Kingdom
560433,2023-07-18,21391,French Lavender Scent Heart,11.92,3,15433.0,United Kingdom
560433,2023-07-18,21428,Set3 Book Box Green Gingham Flower,18.75,1,15433.0,United Kingdom
560433,2023-07-18,21447,12 Ivory Rose Peg Place Settings,12.77,2,15433.0,United Kingdom
560433,2023-07-18,21454,Painted Pink Rabbit,11.1,2,15433.0,United Kingdom
560433,2023-07-18,21465,Pink Flower Crochet Food Cover,13.62,2,15433.0,United Kingdom
560433,2023-07-18,21470,Flower Vine Raffia Food Cover,13.62,2,15433.0,United Kingdom
560433,2023-07-18,21494,Rotating Leaves T-Light Holder,11.92,5,15433.0,United Kingdom
560433,2023-07-18,21534,Dairy Maid Large Milk Jug,14.48,1,15433.0,United Kingdom
560433,2023-07-18,21557,Set Of 6 Funky Beakers,12.77,1,15433.0,United Kingdom
560433,2023-07-18,21578,Woodland Design Cotton Tote Bag,11.92,2,15433.0,United Kingdom
560433,2023-07-18,21668,Red Stripe Ceramic Drawer Knob,13.62,1,15433.0,United Kingdom
560433,2023-07-18,21671,Red Spot Ceramic Drawer Knob,13.62,2,15433.0,United Kingdom
560433,2023-07-18,22386,Jumbo Bag Pink Polkadot,7.24,2,15433.0,United Kingdom
560433,2023-07-18,22663,Jumbo Bag Dolly Girl Design,6.39,2,15433.0,United Kingdom
560433,2023-07-18,23200,Jumbo Bag Pears,7.24,2,15433.0,United Kingdom
560433,2023-07-18,23203,Jumbo Bag Vintage Doily,7.24,1,15433.0,United Kingdom
560433,2023-07-18,85099B,Jumbo Bag Red Retrospot,7.24,2,15433.0,United Kingdom
560433,2023-07-18,85099F,Jumbo Bag Strawberry,7.24,5,15433.0,United Kingdom
560433,2023-07-18,20712,Jumbo Bag Woodland Animals,7.24,1,15433.0,United Kingdom
560433,2023-07-18,20713,Jumbo Bag Owls,7.24,4,15433.0,United Kingdom
560433,2023-07-18,21033,Jumbo Bag Charlie And Lola Toys,6.39,11,15433.0,United Kingdom
560433,2023-07-18,20727,Lunch Bag Black Skull,7.24,1,15433.0,United Kingdom
560433,2023-07-18,20728,Lunch Bag Cars Blue,7.24,5,15433.0,United Kingdom
560433,2023-07-18,22820,Gift Bag Birthday,5.34,2,15433.0,United Kingdom
560433,2023-07-18,22821,Gift Bag Psychedelic Apples,5.34,1,15433.0,United Kingdom
560434,2023-07-18,20772,Garden Path Journal,12.77,2,15434.0,United Kingdom
560434,2023-07-18,20856,Denim Patch Purse Pink Butterfly,11.92,1,15434.0,United Kingdom
560434,2023-07-18,20902,Vintage Keepsake Box Paris Days,14.48,3,15434.0,United Kingdom
560434,2023-07-18,20903,Vintage Keepsake Box Travelogue,14.48,1,15434.0,United Kingdom
560434,2023-07-18,20914,Set/5 Red Retrospot Lid Glass Bowls,16.18,2,15434.0,United Kingdom
560434,2023-07-18,20932,Pink Pot Plant Candle,17.9,1,15434.0,United Kingdom
560434,2023-07-18,20961,Strawberry Bath Sponge,12.77,1,15434.0,United Kingdom
560434,2023-07-18,20963,Apple Bath Sponge,12.77,1,15434.0,United Kingdom
560434,2023-07-18,20974,12 Pencils Small Tube Skull,11.53,3,15434.0,United Kingdom
560434,2023-07-18,20986,Blue Calculator Ruler,11.1,1,15434.0,United Kingdom
560434,2023-07-18,20992,Jazz Hearts Purse Notebook,11.1,1,15434.0,United Kingdom
560434,2023-07-18,20996,Jazz Hearts Address Book,10.68,1,15434.0,United Kingdom
560434,2023-07-18,20997,Rose Du Sud Cushion Cover,16.18,1,15434.0,United Kingdom
560434,2023-07-18,21058,Party Invites Woodland,11.1,7,15434.0,United Kingdom
560434,2023-07-18,21060,Party Invites Balloon Girl,11.1,2,15434.0,United Kingdom
560434,2023-07-18,21062,Party Invites Spaceman,11.1,1,15434.0,United Kingdom
560434,2023-07-18,21063,Party Invites Jazz Hearts,11.1,1,15434.0,United Kingdom
560434,2023-07-18,21068,Vintage Billboard Love/Hate Mug,12.77,1,15434.0,United Kingdom
