TransactionNo,Date,ProductNo,ProductName,Price,Quantity,CustomerNo,Country
554018,2023-05-20,23202,Jumbo Bag Vintage Leaf,6.13,10,17644.0,United Kingdom
554018,2023-05-20,23203,Jumbo Bag Vintage Doily,6.13,10,17644.0,United Kingdom
554019,2023-05-20,21714,Citronella Candle Garden Pot,11.53,12,17591.0,United Kingdom
554019,2023-05-20,22925,Blue Giant Garden Thermometer,16.35,2,17591.0,United Kingdom
554019,2023-05-20,22928,Yellow Giant Garden Thermometer,16.35,2,17591.0,United Kingdom
554019,2023-05-20,22927,Green Giant Garden Thermometer,16.35,2,17591.0,United Kingdom
554019,2023-05-20,21175,Gin And Tonic Diet Metal Sign,12.86,24,17591.0,United Kingdom
554019,2023-05-20,21166,Cook With Wine Metal Sign,12.38,24,17591.0,United Kingdom
554019,2023-05-20,21907,I'm On Holiday Metal Sign,12.4,12,17591.0,United Kingdom
554019,2023-05-20,21903,Man Flu Metal Sign,12.4,12,17591.0,United Kingdom
554019,2023-05-20,82583,Hot Baths Metal Sign,12.4,24,17591.0,United Kingdom
554019,2023-05-20,82600,N0 Singing Metal Sign,12.4,24,17591.0,United Kingdom
554019,2023-05-20,22727,Alarm Clock Bakelike Red,14.09,4,17591.0,United Kingdom
554019,2023-05-20,22729,Alarm Clock Bakelike Orange,14.09,4,17591.0,United Kingdom
554019,2023-05-20,22730,Alarm Clock Bakelike Ivory,14.09,4,17591.0,United Kingdom
554019,2023-05-20,22191,Ivory Diner Wall Clock,18.96,2,17591.0,United Kingdom
554019,2023-05-20,22192,Blue Diner Wall Clock,18.96,2,17591.0,United Kingdom
554019,2023-05-20,22193,Red Diner Wall Clock,18.96,2,17591.0,United Kingdom
554019,2023-05-20,22918,Herb Marker Parsley,10.92,12,17591.0,United Kingdom
554019,2023-05-20,22919,Herb Marker Mint,10.92,12,17591.0,United Kingdom
554019,2023-05-20,22920,Herb Marker Basil,10.92,12,17591.0,United Kingdom
554019,2023-05-20,22921,Herb Marker Chives,10.92,12,17591.0,United Kingdom
554019,2023-05-20,22916,Herb Marker Thyme,10.92,12,17591.0,United Kingdom
554019,2023-05-20,22917,Herb Marker Rosemary,10.92,12,17591.0,United Kingdom
554026,2023-05-20,23170,Regency Tea Plate Roses,11.74,48,13324.0,United Kingdom
554026,2023-05-20,23172,Regency Tea Plate Pink,11.74,48,13324.0,United Kingdom
554026,2023-05-20,23171,Regency Tea Plate Green,11.74,48,13324.0,United Kingdom
554026,2023-05-20,22697,Green Regency Teacup And Saucer,12.86,24,13324.0,United Kingdom
554026,2023-05-20,22316,200 Bendy Skull Straws,11.34,192,13324.0,United Kingdom
554027,2023-05-20,23087,Zinc Heart T-Light Holder,11.53,16,15260.0,United Kingdom
554027,2023-05-20,23088,Zinc Heart Flower T-Light Holder,11.53,16,15260.0,United Kingdom
554027,2023-05-20,23108,Set Of 10 Led Dolly Lights,16.66,10,15260.0,United Kingdom
554027,2023-05-20,23110,Parisienne Key Cabinet,16.14,2,15260.0,United Kingdom
554027,2023-05-20,84978,Hanging Heart Jar T-Light Holder,11.53,24,15260.0,United Kingdom
554027,2023-05-20,85053,French Enamel Candleholder,12.4,6,15260.0,United Kingdom
554027,2023-05-20,72598,Set/12 Taper Candles,11.12,12,15260.0,United Kingdom
554027,2023-05-20,21770,Open Closed Metal Sign,15.32,2,15260.0,United Kingdom
554027,2023-05-20,21164,Home Sweet Home Metal Sign,13.27,6,15260.0,United Kingdom
554028,2023-05-20,23299,Food Cover With Beads Set 2,14.09,12,15410.0,United Kingdom
554028,2023-05-20,22427,Enamel Flower Jug Cream,16.35,6,15410.0,United Kingdom
554028,2023-05-20,23163,Regency Sugar Tongs,12.8,8,15410.0,United Kingdom
554028,2023-05-20,23092,Large Antique White Photo Frame,18.35,4,15410.0,United Kingdom
554028,2023-05-20,84818,Danish Rose Photo Frame,12.86,24,15410.0,United Kingdom
554028,2023-05-20,22917,Herb Marker Rosemary,10.92,12,15410.0,United Kingdom
554028,2023-05-20,22916,Herb Marker Thyme,10.92,12,15410.0,United Kingdom
554028,2023-05-20,22921,Herb Marker Chives,10.92,12,15410.0,United Kingdom
554028,2023-05-20,22920,Herb Marker Basil,10.92,12,15410.0,United Kingdom
554028,2023-05-20,22919,Herb Marker Mint,10.92,12,15410.0,United Kingdom
554028,2023-05-20,22918,Herb Marker Parsley,10.92,12,15410.0,United Kingdom
554028,2023-05-20,22928,Yellow Giant Garden Thermometer,16.35,6,15410.0,United Kingdom
554028,2023-05-20,22927,Green Giant Garden Thermometer,16.35,6,15410.0,United Kingdom
554028,2023-05-20,22925,Blue Giant Garden Thermometer,16.35,8,15410.0,United Kingdom
554028,2023-05-20,23175,Regency Milk Jug Pink,13.58,6,15410.0,United Kingdom
554028,2023-05-20,23174,Regency Sugar Bowl Green,14.5,6,15410.0,United Kingdom
554028,2023-05-20,22699,Roses Regency Teacup And Saucer,13.27,12,15410.0,United Kingdom
554028,2023-05-20,22698,Pink Regency Teacup And Saucer,13.27,12,15410.0,United Kingdom
554028,2023-05-20,22697,Green Regency Teacup And Saucer,13.27,12,15410.0,United Kingdom
554028,2023-05-20,47566,Party Bunting,15.32,24,15410.0,United Kingdom
554028,2023-05-20,23298,Spotty Bunting,15.32,12,15410.0,United Kingdom
554030,2023-05-20,47566,Party Bunting,15.32,8,16497.0,United Kingdom
554030,2023-05-20,21915,Red Harmonica In Box,11.53,12,16497.0,United Kingdom
554030,2023-05-20,22620,4 Traditional Spinning Tops,11.74,12,16497.0,United Kingdom
554030,2023-05-20,21892,Traditional Wooden Catch Cup Game,11.53,12,16497.0,United Kingdom
554030,2023-05-20,21891,Traditional Wooden Skipping Rope,11.74,12,16497.0,United Kingdom
554030,2023-05-20,21913,Vintage Seaside Jigsaw Puzzles,14.09,4,16497.0,United Kingdom
554030,2023-05-20,21912,Vintage Snakes & Ladders,14.09,4,16497.0,United Kingdom
554030,2023-05-20,21508,Vintage Kid Dolly Card,10.68,12,16497.0,United Kingdom
554030,2023-05-20,22714,Card Birthday Cowboy,10.68,12,16497.0,United Kingdom
554030,2023-05-20,22713,Card I Love London,10.68,12,16497.0,United Kingdom
554030,2023-05-20,21507,Elephant Birthday Card,10.68,12,16497.0,United Kingdom
554030,2023-05-20,21519,Gin & Tonic Diet Greeting Card,10.68,12,16497.0,United Kingdom
554030,2023-05-20,22026,Banquet Birthday Card,10.68,12,16497.0,United Kingdom
554030,2023-05-20,22028,Penny Farthing Birthday Card,10.68,12,16497.0,United Kingdom
554030,2023-05-20,22712,Card Dolly Girl,10.68,12,16497.0,United Kingdom
554030,2023-05-20,22029,Spaceboy Birthday Card,10.68,12,16497.0,United Kingdom
554030,2023-05-20,22027,Tea Party Birthday Card,10.68,12,16497.0,United Kingdom
554030,2023-05-20,23298,Spotty Bunting,15.32,6,16497.0,United Kingdom
554030,2023-05-20,23164,Regency Cake Slice,15.32,4,16497.0,United Kingdom
554030,2023-05-20,23163,Regency Sugar Tongs,12.8,8,16497.0,United Kingdom
554030,2023-05-20,23171,Regency Tea Plate Green,11.94,12,16497.0,United Kingdom
554030,2023-05-20,23172,Regency Tea Plate Pink,11.94,12,16497.0,United Kingdom
554030,2023-05-20,22697,Green Regency Teacup And Saucer,13.27,6,16497.0,United Kingdom
554030,2023-05-20,22698,Pink Regency Teacup And Saucer,13.27,6,16497.0,United Kingdom
554030,2023-05-20,23175,Regency Milk Jug Pink,13.58,4,16497.0,United Kingdom
554030,2023-05-20,23174,Regency Sugar Bowl Green,14.5,6,16497.0,United Kingdom
554030,2023-05-20,84991,60 Teatime Fairy Cake Cases,10.81,24,16497.0,United Kingdom
554030,2023-05-20,21977,Pack Of 60 Pink Paisley Cake Cases,10.81,24,16497.0,United Kingdom
554030,2023-05-20,23146,Triple Hook Antique Ivory Rose,13.62,4,16497.0,United Kingdom
554030,2023-05-20,23148,Miniature Antique Rose Hook Ivory,11.1,12,16497.0,United Kingdom
554030,2023-05-20,22178,Victorian Glass Hanging T-Light,11.53,12,16497.0,United Kingdom
554030,2023-05-20,23087,Zinc Heart T-Light Holder,11.53,16,16497.0,United Kingdom
554030,2023-05-20,23088,Zinc Heart Flower T-Light Holder,11.53,16,16497.0,United Kingdom
554030,2023-05-20,84945,Multi Colour Silver T-Light Holder,11.12,12,16497.0,United Kingdom
554030,2023-05-20,22185,Slate Tile Natural Hanging,11.94,12,16497.0,United Kingdom
554030,2023-05-20,22457,Natural Slate Heart Chalkboard,13.27,6,16497.0,United Kingdom
554030,2023-05-20,22766,Photo Frame Cornice,13.27,8,16497.0,United Kingdom
554030,2023-05-20,22295,Heart Filigree Dove Large,11.94,12,16497.0,United Kingdom
554030,2023-05-20,21390,Filigris Heart With Butterfly,11.53,24,16497.0,United Kingdom
554030,2023-05-20,22469,Heart Of Wicker Small,11.94,12,16497.0,United Kingdom
554030,2023-05-20,22799,Sweetheart Wire Fruit Bowl,18.96,2,16497.0,United Kingdom
554030,2023-05-20,22502,Picnic Basket Wicker Small,16.35,4,16497.0,United Kingdom
554031,2023-05-20,23147,Single Antique Rose Hook Ivory,11.74,12,16497.0,United Kingdom
554031,2023-05-20,23146,Triple Hook Antique Ivory Rose,13.62,6,16497.0,United Kingdom
554031,2023-05-20,23089,Glass Bon Bon Jar,11.94,12,16497.0,United Kingdom
554031,2023-05-20,23161,Regency Cake Fork,11.53,24,16497.0,United Kingdom
554031,2023-05-20,23160,Regency Tea Spoon,11.53,12,16497.0,United Kingdom
554031,2023-05-20,23068,Aluminium Stamped Heart,12.8,6,16497.0,United Kingdom
554031,2023-05-20,23061,Vintage Embossed Heart,11.53,12,16497.0,United Kingdom
554032,2023-05-20,22427,Enamel Flower Jug Cream,15.84,24,13824.0,United Kingdom
554033,2023-05-20,22661,Charlotte Bag Dolly Girl Design,11.12,20,16187.0,United Kingdom
554033,2023-05-20,22356,Charlotte Bag Pink Polkadot,11.12,30,16187.0,United Kingdom
554033,2023-05-20,22411,Jumbo Shopper Vintage Red Paisley,12.38,20,16187.0,United Kingdom
554033,2023-05-20,20723,Strawberry Charlotte Bag,11.12,20,16187.0,United Kingdom
554033,2023-05-20,22555,Plasters In Tin Strongman,11.94,12,16187.0,United Kingdom
554033,2023-05-20,22556,Plasters In Tin Circus Parade,11.94,12,16187.0,United Kingdom
554033,2023-05-20,21790,Vintage Snap Cards,11.12,12,16187.0,United Kingdom
554033,2023-05-20,21507,Elephant Birthday Card,10.68,12,16187.0,United Kingdom
554033,2023-05-20,22025,Ring Of Roses Birthday Card,10.68,12,16187.0,United Kingdom
554033,2023-05-20,22029,Spaceboy Birthday Card,10.68,12,16187.0,United Kingdom
554033,2023-05-20,84879,Assorted Colour Bird Ornament,11.98,16,16187.0,United Kingdom
554033,2023-05-20,21609,Set 12 Lavender Botanical T-Lights,13.27,6,16187.0,United Kingdom
554033,2023-05-20,85231G,Orange Scented Set/9 T-Lights,11.12,12,16187.0,United Kingdom
554033,2023-05-20,72351A,Set/6 Turquoise Butterfly T-Lights,12.4,12,16187.0,United Kingdom
554033,2023-05-20,22386,Jumbo Bag Pink Polkadot,6.19,20,16187.0,United Kingdom
554033,2023-05-20,85099B,Jumbo Bag Red Retrospot,6.19,20,16187.0,United Kingdom
554033,2023-05-20,22384,Lunch Bag Pink Polkadot,5.97,30,16187.0,United Kingdom
554033,2023-05-20,22382,Lunch Bag Spaceboy Design,5.97,20,16187.0,United Kingdom
554033,2023-05-20,22662,Lunch Bag Dolly Girl Design,5.97,20,16187.0,United Kingdom
554033,2023-05-20,20728,Lunch Bag Cars Blue,5.97,20,16187.0,United Kingdom
554034,2023-05-20,23170,Regency Tea Plate Roses,11.74,48,13324.0,United Kingdom
554034,2023-05-20,23172,Regency Tea Plate Pink,11.74,48,13324.0,United Kingdom
554034,2023-05-20,23171,Regency Tea Plate Green,11.74,48,13324.0,United Kingdom
554035,2023-05-20,23086,Zinc Star T-Light Holder,11.53,8,16187.0,United Kingdom
554035,2023-05-20,23087,Zinc Heart T-Light Holder,11.53,8,16187.0,United Kingdom
554035,2023-05-20,23088,Zinc Heart Flower T-Light Holder,11.53,8,16187.0,United Kingdom
554036,2023-05-20,84946,Antique Silver T-Light Glass,11.53,42,13767.0,United Kingdom
554036,2023-05-20,21313,Glass Heart T-Light Holder,11.12,12,13767.0,United Kingdom
554036,2023-05-20,23089,Glass Bon Bon Jar,11.94,12,13767.0,United Kingdom
554036,2023-05-20,23284,Doormat Keep Calm And Come In,18.4,4,13767.0,United Kingdom
554036,2023-05-20,22730,Alarm Clock Bakelike Ivory,14.09,4,13767.0,United Kingdom
554036,2023-05-20,22699,Roses Regency Teacup And Saucer,13.27,6,13767.0,United Kingdom
554036,2023-05-20,22698,Pink Regency Teacup And Saucer,13.27,6,13767.0,United Kingdom
554036,2023-05-20,22697,Green Regency Teacup And Saucer,13.27,6,13767.0,United Kingdom
554036,2023-05-20,21314,Small Glass Heart Trinket Pot,12.4,8,13767.0,United Kingdom
554036,2023-05-20,84879,Assorted Colour Bird Ornament,11.98,32,13767.0,United Kingdom
554037,2023-05-20,84997C,Childrens Cutlery Polkadot Blue,14.09,72,12415.0,Australia
554037,2023-05-20,22712,Card Dolly Girl,10.62,216,12415.0,Australia
554037,2023-05-20,22619,Set Of 6 Soldier Skittles,10.25,80,12415.0,Australia
554038,2023-05-20,23081,Green Metal Box Army Supplies,18.71,2,12775.0,Netherlands
554038,2023-05-20,23080,Red Metal Box Top Secret,18.71,2,12775.0,Netherlands
554038,2023-05-20,23112,Parisienne Curio Cabinet,17.94,2,12775.0,Netherlands
554038,2023-05-20,35961,Folkart Zinc Heart Christmas Dec,11.12,36,12775.0,Netherlands
554038,2023-05-20,84406B,Cream Cupid Hearts Coat Hanger,14.5,12,12775.0,Netherlands
554038,2023-05-20,21390,Filigris Heart With Butterfly,11.53,24,12775.0,Netherlands
554038,2023-05-20,22295,Heart Filigree Dove Large,11.94,12,12775.0,Netherlands
554038,2023-05-20,22296,Heart Ivory Trellis Large,11.94,12,12775.0,Netherlands
554038,2023-05-20,23068,Aluminium Stamped Heart,12.8,8,12775.0,Netherlands
554038,2023-05-20,23061,Vintage Embossed Heart,11.53,12,12775.0,Netherlands
554038,2023-05-20,22690,Doormat Home Sweet Home Blue,18.4,2,12775.0,Netherlands
554038,2023-05-20,22692,Doormat Welcome To Our Home,18.4,2,12775.0,Netherlands
554039,2023-05-20,22088,Paper Bunting Coloured Lace,13.27,6,15095.0,United Kingdom
554039,2023-05-20,22798,Antique Glass Dressing Table Pot,13.27,8,15095.0,United Kingdom
554039,2023-05-20,22800,Antique Tall Swirlglass Trinket Pot,14.09,4,15095.0,United Kingdom
554039,2023-05-20,22792,Fluted Antique Candle Holder,11.12,24,15095.0,United Kingdom
554039,2023-05-20,22791,T-Light Glass Fluted Antique,11.53,24,15095.0,United Kingdom
554039,2023-05-20,22418,10 Colour Spaceboy Pen,11.12,48,15095.0,United Kingdom
554039,2023-05-20,22534,Magic Drawing Slate Spaceboy,10.68,96,15095.0,United Kingdom
554039,2023-05-20,22544,Mini Jigsaw Spaceboy,10.68,96,15095.0,United Kingdom
554039,2023-05-20,22972,Children's Spaceboy Mug,11.94,24,15095.0,United Kingdom
554039,2023-05-20,22491,Pack Of 12 Coloured Pencils,11.12,48,15095.0,United Kingdom
554039,2023-05-20,22489,Pack Of 12 Traditional Crayons,10.68,48,15095.0,United Kingdom
554039,2023-05-20,22493,Paint Your Own Canvas Set,11.94,24,15095.0,United Kingdom
554039,2023-05-20,22560,Traditional Modelling Clay,11.34,48,15095.0,United Kingdom
554039,2023-05-20,22492,Mini Paint Set Vintage,10.92,72,15095.0,United Kingdom
554039,2023-05-20,22904,Calendar Paper Cut Design,13.27,12,15095.0,United Kingdom
554039,2023-05-20,22652,Travel Sewing Kit,11.94,10,15095.0,United Kingdom
554039,2023-05-20,23089,Glass Bon Bon Jar,11.94,12,15095.0,United Kingdom
554039,2023-05-20,23175,Regency Milk Jug Pink,13.58,6,15095.0,United Kingdom
554039,2023-05-20,23174,Regency Sugar Bowl Green,14.5,6,15095.0,United Kingdom
554039,2023-05-20,23172,Regency Tea Plate Pink,11.94,12,15095.0,United Kingdom
554039,2023-05-20,23171,Regency Tea Plate Green,11.94,12,15095.0,United Kingdom
554039,2023-05-20,23170,Regency Tea Plate Roses,11.94,12,15095.0,United Kingdom
554039,2023-05-20,22699,Roses Regency Teacup And Saucer,13.27,6,15095.0,United Kingdom
554039,2023-05-20,22698,Pink Regency Teacup And Saucer,13.27,6,15095.0,United Kingdom
554039,2023-05-20,22697,Green Regency Teacup And Saucer,13.27,6,15095.0,United Kingdom
554039,2023-05-20,22178,Victorian Glass Hanging T-Light,11.53,24,15095.0,United Kingdom
554039,2023-05-20,84879,Assorted Colour Bird Ornament,11.98,8,15095.0,United Kingdom
554040,2023-05-20,21078,Set/20 Strawberry Paper Napkins,11.12,36,15290.0,United Kingdom
554040,2023-05-20,22699,Roses Regency Teacup And Saucer,13.27,6,15290.0,United Kingdom
554040,2023-05-20,23170,Regency Tea Plate Roses,11.94,12,15290.0,United Kingdom
554040,2023-05-20,21080,Set/20 Red Retrospot Paper Napkins,11.12,24,15290.0,United Kingdom
554040,2023-05-20,23164,Regency Cake Slice,15.32,4,15290.0,United Kingdom
554040,2023-05-20,22908,Pack Of 20 Napkins Red Apples,11.12,24,15290.0,United Kingdom
554040,2023-05-20,21868,Potting Shed Tea Mug,11.53,24,15290.0,United Kingdom
554040,2023-05-20,22698,Pink Regency Teacup And Saucer,13.27,6,15290.0,United Kingdom
554040,2023-05-20,23172,Regency Tea Plate Pink,11.94,12,15290.0,United Kingdom
554040,2023-05-20,84879,Assorted Colour Bird Ornament,11.98,16,15290.0,United Kingdom
554040,2023-05-20,22568,Feltcraft Cushion Owl,14.09,8,15290.0,United Kingdom
554040,2023-05-20,21877,Home Sweet Home Mug,11.53,12,15290.0,United Kingdom
554040,2023-05-20,22285,Hanging Hen On Nest Decoration,11.94,12,15290.0,United Kingdom
554040,2023-05-20,22697,Green Regency Teacup And Saucer,13.27,6,15290.0,United Kingdom
554040,2023-05-20,23171,Regency Tea Plate Green,11.94,12,15290.0,United Kingdom
554041,2023-05-20,22855,Fine Wicker Heart,11.53,12,16226.0,United Kingdom
554042,2023-05-20,84879,Assorted Colour Bird Ornament,11.98,8,15237.0,United Kingdom
554042,2023-05-20,71459,Hanging Jam Jar T-Light Holders,11.12,12,15237.0,United Kingdom
554042,2023-05-20,84380,Set Of 3 Butterfly Cookie Cutters,11.53,12,15237.0,United Kingdom
554042,2023-05-20,22964,3 Piece Spaceboy Cookie Cutter Set,12.4,6,15237.0,United Kingdom
554042,2023-05-20,21936,Red Retrospot Picnic Bag,13.27,5,15237.0,United Kingdom
554042,2023-05-20,23231,Wrap Vintage Doily,10.68,25,15237.0,United Kingdom
554042,2023-05-20,22147,Feltcraft Butterfly Hearts,11.74,12,15237.0,United Kingdom
554042,2023-05-20,79030G,Tumbler New England,10.65,24,15237.0,United Kingdom
554042,2023-05-20,21894,Potting Shed Seed Envelopes,11.53,12,15237.0,United Kingdom
554042,2023-05-20,23206,Lunch Bag Apple Design,5.97,10,15237.0,United Kingdom
554043,2023-05-20,23049,Recycled Acapulco Mat Red,18.71,2,16832.0,United Kingdom
554043,2023-05-20,22690,Doormat Home Sweet Home Blue,18.4,2,16832.0,United Kingdom
554043,2023-05-20,23283,Doormat Vintage Leaf,18.4,2,16832.0,United Kingdom
554050,2023-05-20,21034,Rex Cash+Carry Jumbo Shopper,11.22,1,18048.0,United Kingdom
554050,2023-05-20,20836,French Paisley Cushion Cover,11.12,12,18048.0,United Kingdom
554050,2023-05-20,22178,Victorian Glass Hanging T-Light,11.53,18,18048.0,United Kingdom
554050,2023-05-20,84879,Assorted Colour Bird Ornament,11.98,8,18048.0,United Kingdom
554050,2023-05-20,71053,White Moroccan Metal Lantern,14.09,12,18048.0,United Kingdom
554050,2023-05-20,84947,Antique Silver Tea Glass Engraved,11.34,72,18048.0,United Kingdom
554051,2023-05-20,47566,Party Bunting,15.32,24,16696.0,United Kingdom
554052,2023-05-20,21034,Rex Cash+Carry Jumbo Shopper,11.22,4,18048.0,United Kingdom
554053,2023-05-20,22355,Charlotte Bag Suki Design,11.12,30,14282.0,United Kingdom
554053,2023-05-20,20723,Strawberry Charlotte Bag,11.12,30,14282.0,United Kingdom
554053,2023-05-20,23205,Charlotte Bag Vintage Alphabet,11.12,30,14282.0,United Kingdom
554053,2023-05-20,23204,Charlotte Bag Apples Design,11.12,30,14282.0,United Kingdom
554053,2023-05-20,23203,Jumbo Bag Vintage Doily,6.19,20,14282.0,United Kingdom
554054,2023-05-20,15039,Sandalwood Fan,11.92,1,17054.0,United Kingdom
554054,2023-05-20,16237,Sleeping Cat Erasers,10.68,2,17054.0,United Kingdom
554054,2023-05-20,16258A,Swirly Circular Rubbers In Bag,11.1,1,17054.0,United Kingdom
554054,2023-05-20,18007,Essential Balm 35g Tin In Envelope,10.68,1,17054.0,United Kingdom
554054,2023-05-20,20619,Tropical Passport Cover,11.92,1,17054.0,United Kingdom
554054,2023-05-20,20716,Party Food Shopper Bag,11.1,3,17054.0,United Kingdom
554054,2023-05-20,20719,Woodland Charlotte Bag,11.92,2,17054.0,United Kingdom
554054,2023-05-20,20724,Red Retrospot Charlotte Bag,11.92,1,17054.0,United Kingdom
554054,2023-05-20,20766,Garden Path Sketchbook,17.9,1,17054.0,United Kingdom
554054,2023-05-20,21080,Set/20 Red Retrospot Paper Napkins,11.92,3,17054.0,United Kingdom
554054,2023-05-20,21088,Set/6 Fruit Salad Paper Cups,11.1,6,17054.0,United Kingdom
554054,2023-05-20,21094,Set/6 Red Spotty Paper Plates,11.1,6,17054.0,United Kingdom
554054,2023-05-20,21096,Set/6 Fruit Salad Paper Plates,11.1,6,17054.0,United Kingdom
554054,2023-05-20,21121,Set/10 Red Polkadot Party Candles,12.77,1,17054.0,United Kingdom
554054,2023-05-20,21212,Pack Of 72 Retrospot Cake Cases,11.53,1,17054.0,United Kingdom
554054,2023-05-20,21218,Red Spotty Biscuit Tin,18.75,1,17054.0,United Kingdom
554054,2023-05-20,21231,Sweetheart Ceramic Trinket Box,12.77,1,17054.0,United Kingdom
554054,2023-05-20,21232,Strawberry Ceramic Trinket Pot,12.77,1,17054.0,United Kingdom
554054,2023-05-20,21381,Mini Wooden Happy Birthday Garland,13.62,1,17054.0,United Kingdom
554054,2023-05-20,21455,Painted Yellow Wooden Daisy,11.1,2,17054.0,United Kingdom
554054,2023-05-20,21508,Vintage Kid Dolly Card,11.1,2,17054.0,United Kingdom
554054,2023-05-20,21509,Cowboys And Indians Birthday Card,11.1,2,17054.0,United Kingdom
554054,2023-05-20,21531,Red Retrospot Sugar Jam Bowl,15.33,1,17054.0,United Kingdom
554054,2023-05-20,21535,Red Retrospot Small Milk Jug,15.33,1,17054.0,United Kingdom
554054,2023-05-20,21555,Ceramic Strawberry Trinket Tray,12.77,2,17054.0,United Kingdom
554054,2023-05-20,21672,White Spot Red Ceramic Drawer Knob,13.62,2,17054.0,United Kingdom
554054,2023-05-20,21715,Girls Vintage Tin Seaside Bucket,15.33,1,17054.0,United Kingdom
554054,2023-05-20,21718,Red Metal Beach Spade,12.77,1,17054.0,United Kingdom
554054,2023-05-20,21731,Red Toadstool Led Night Light,13.62,1,17054.0,United Kingdom
554054,2023-05-20,21746,Small Red Retrospot Windmill,12.77,2,17054.0,United Kingdom
554054,2023-05-20,21880,Red Retrospot Tape,10.68,3,17054.0,United Kingdom
554054,2023-05-20,21891,Traditional Wooden Skipping Rope,12.77,4,17054.0,United Kingdom
554054,2023-05-20,21899,Garage Key Fob,11.92,1,17054.0,United Kingdom
554054,2023-05-20,21900,Key Fob Shed,11.92,1,17054.0,United Kingdom
554054,2023-05-20,21901,Key Fob Back Door,11.92,2,17054.0,United Kingdom
554054,2023-05-20,21902,Key Fob Front Door,11.92,3,17054.0,United Kingdom
554054,2023-05-20,21931,Jumbo Storage Bag Suki,14.48,1,17054.0,United Kingdom
554054,2023-05-20,21934,Skull Shoulder Bag,13.62,1,17054.0,United Kingdom
554054,2023-05-20,21981,Pack Of 12 Woodland Tissues,11.1,1,17054.0,United Kingdom
554054,2023-05-20,21993,Floral Folk Stationery Set,12.77,5,17054.0,United Kingdom
554054,2023-05-20,22024,Rainy Ladies Birthday Card,11.1,2,17054.0,United Kingdom
554054,2023-05-20,22027,Tea Party Birthday Card,11.1,2,17054.0,United Kingdom
554054,2023-05-20,22077,6 Ribbons Rustic Charm,13.62,1,17054.0,United Kingdom
554054,2023-05-20,22079,Ribbon Reel Hearts Design,13.62,1,17054.0,United Kingdom
554054,2023-05-20,22082,Ribbon Reel Stripes Design,13.62,1,17054.0,United Kingdom
554054,2023-05-20,22083,Paper Chain Kit Retrospot,16.18,1,17054.0,United Kingdom
554054,2023-05-20,22090,Paper Bunting Retrospot,16.18,6,17054.0,United Kingdom
554054,2023-05-20,22104,Mirror Mosaic Candle Plate,11.92,1,17054.0,United Kingdom
554054,2023-05-20,22132,Red Love Heart Shape Cup,11.92,1,17054.0,United Kingdom
554054,2023-05-20,22133,Pink Love Heart Shape Cup,11.92,1,17054.0,United Kingdom
554054,2023-05-20,22173,Metal 4 Hook Hanger French Chateau,16.18,1,17054.0,United Kingdom
554054,2023-05-20,22219,Lovebird Hanging Decoration White,11.92,2,17054.0,United Kingdom
554054,2023-05-20,22342,Home Garland Painted Zinc,13.62,1,17054.0,United Kingdom
554054,2023-05-20,22380,Toy Tidy Spaceboy,14.48,2,17054.0,United Kingdom
554054,2023-05-20,22429,Enamel Measuring Jug Cream,18.75,1,17054.0,United Kingdom
554054,2023-05-20,22436,12 Coloured Party Balloons,11.53,3,17054.0,United Kingdom
554054,2023-05-20,22457,Natural Slate Heart Chalkboard,16.18,1,17054.0,United Kingdom
554054,2023-05-20,22467,Gumball Coat Rack,15.33,1,17054.0,United Kingdom
554054,2023-05-20,22469,Heart Of Wicker Small,13.62,3,17054.0,United Kingdom
554054,2023-05-20,22470,Heart Of Wicker Large,16.18,1,17054.0,United Kingdom
554054,2023-05-20,22483,Red Gingham Teddy Bear,16.18,1,17054.0,United Kingdom
554054,2023-05-20,22488,Natural Slate Rectangle Chalkboard,13.62,4,17054.0,United Kingdom
554054,2023-05-20,22508,Doorstop Retrospot Heart,17.9,1,17054.0,United Kingdom
554054,2023-05-20,22558,Clothes Pegs Retrospot Pack 24,13.62,2,17054.0,United Kingdom
554054,2023-05-20,22566,Feltcraft Hairband Pink And Purple,11.92,1,17054.0,United Kingdom
554054,2023-05-20,22621,Traditional Knitting Nancy,13.62,4,17054.0,United Kingdom
554054,2023-05-20,22629,Spaceboy Lunch Box,14.48,1,17054.0,United Kingdom
554054,2023-05-20,22630,Dolly Girl Lunch Box,14.48,2,17054.0,United Kingdom
554054,2023-05-20,22697,Green Regency Teacup And Saucer,16.18,2,17054.0,United Kingdom
554054,2023-05-20,22712,Card Dolly Girl,11.1,1,17054.0,United Kingdom
554054,2023-05-20,22715,Card Wedding Day,11.1,2,17054.0,United Kingdom
554054,2023-05-20,22717,Card Dog And Ball,11.1,2,17054.0,United Kingdom
554054,2023-05-20,22727,Alarm Clock Bakelike Red,14.48,1,17054.0,United Kingdom
554054,2023-05-20,22745,Poppy's Playhouse Bedroom,14.48,1,17054.0,United Kingdom
554054,2023-05-20,22747,Poppy's Playhouse Bathroom,14.48,1,17054.0,United Kingdom
554054,2023-05-20,22813,Pack 3 Boxes Bird Panettone,14.48,1,17054.0,United Kingdom
554054,2023-05-20,22907,Pack Of 20 Napkins Pantry Design,11.92,2,17054.0,United Kingdom
554054,2023-05-20,22916,Herb Marker Thyme,11.92,1,17054.0,United Kingdom
554054,2023-05-20,22917,Herb Marker Rosemary,11.92,1,17054.0,United Kingdom
554054,2023-05-20,22918,Herb Marker Parsley,11.92,1,17054.0,United Kingdom
554054,2023-05-20,22919,Herb Marker Mint,11.92,1,17054.0,United Kingdom
554054,2023-05-20,22920,Herb Marker Basil,11.92,1,17054.0,United Kingdom
554054,2023-05-20,22921,Herb Marker Chives,11.92,1,17054.0,United Kingdom
554054,2023-05-20,22983,Card Billboard Font,11.1,1,17054.0,United Kingdom
554054,2023-05-20,22993,Set Of 4 Pantry Jelly Moulds,12.77,1,17054.0,United Kingdom
554054,2023-05-20,22996,Travel Card Wallet Vintage Ticket,11.1,1,17054.0,United Kingdom
554054,2023-05-20,23144,Zinc T-Light Holder Stars Small,11.92,4,17054.0,United Kingdom
554054,2023-05-20,23298,Spotty Bunting,15.32,10,17054.0,United Kingdom
554054,2023-05-20,35809A,Enamel Pink Tea Container,12.77,1,17054.0,United Kingdom
554054,2023-05-20,37446,Mini Cake Stand With Hanging Cakes,13.62,1,17054.0,United Kingdom
