TransactionNo,Date,ProductNo,ProductName,Price,Quantity,CustomerNo,Country
572294,2023-10-23,23502,Playing Cards Vintage Doily,11.53,3,13471.0,United Kingdom
572294,2023-10-23,21889,Wooden Box Of Dominoes,11.53,7,13471.0,United Kingdom
572294,2023-10-23,22990,Cotton Apron Pantry Design,15.32,2,13471.0,United Kingdom
572294,2023-10-23,22692,Doormat Welcome To Our Home,18.71,2,13471.0,United Kingdom
572294,2023-10-23,20685,Doormat Red Retrospot,18.71,2,13471.0,United Kingdom
572294,2023-10-23,22333,Retrospot Party Bag + Sticker Set,11.94,16,13471.0,United Kingdom
572294,2023-10-23,22381,Toy Tidy Pink Polkadot,12.4,3,13471.0,United Kingdom
572294,2023-10-23,22960,Jam Making Set With Jars,14.61,4,13471.0,United Kingdom
572294,2023-10-23,22993,Set Of 4 Pantry Jelly Moulds,11.53,7,13471.0,United Kingdom
572294,2023-10-23,23493,Vintage Doily Travel Sewing Kit,12.25,5,13471.0,United Kingdom
572294,2023-10-23,21789,Kids Rain Mac Pink,11.12,6,13471.0,United Kingdom
572294,2023-10-23,21883,Stars Gift Tape,10.92,12,13471.0,United Kingdom
572294,2023-10-23,21880,Red Retrospot Tape,10.92,12,13471.0,United Kingdom
572294,2023-10-23,21918,Set 12 Kids Colour Chalk Sticks,10.68,5,13471.0,United Kingdom
572294,2023-10-23,21788,Kids Rain Mac Blue,11.12,6,13471.0,United Kingdom
572294,2023-10-23,22551,Plasters In Tin Spaceboy,11.94,4,13471.0,United Kingdom
572294,2023-10-23,85099B,Jumbo Bag Red Retrospot,6.19,4,13471.0,United Kingdom
572294,2023-10-23,22663,Jumbo Bag Dolly Girl Design,6.19,3,13471.0,United Kingdom
572294,2023-10-23,23203,Jumbo Bag Vintage Doily,6.19,7,13471.0,United Kingdom
572294,2023-10-23,22384,Lunch Bag Pink Polkadot,5.97,10,13471.0,United Kingdom
572294,2023-10-23,20727,Lunch Bag Black Skull,5.97,10,13471.0,United Kingdom
572294,2023-10-23,23209,Lunch Bag Vintage Doily,5.97,5,13471.0,United Kingdom
572294,2023-10-23,20725,Lunch Bag Red Retrospot,5.97,10,13471.0,United Kingdom
572294,2023-10-23,22662,Lunch Bag Dolly Girl Design,5.97,4,13471.0,United Kingdom
572295,2023-10-23,22599,Christmas Musical Zinc Star,10.55,6,16686.0,United Kingdom
572295,2023-10-23,22598,Christmas Musical Zinc Tree,10.55,6,16686.0,United Kingdom
572295,2023-10-23,23047,Paper Lantern 5 Point Sequin Star,16.14,1,16686.0,United Kingdom
572295,2023-10-23,23040,Paper Lantern 9 Point Snow Star,14.5,1,16686.0,United Kingdom
572295,2023-10-23,84836,Zinc Metal Heart Decoration,11.53,3,16686.0,United Kingdom
572295,2023-10-23,23102,Silver Hearts Table Decoration,11.1,1,16686.0,United Kingdom
572295,2023-10-23,23101,Silver Stars Table Decoration,11.1,2,16686.0,United Kingdom
572295,2023-10-23,23480,Mini Lights Woodland Mushrooms,14.09,1,16686.0,United Kingdom
572295,2023-10-23,23224,Cherub Heart Decoration Gold,11.1,5,16686.0,United Kingdom
572295,2023-10-23,21802,Christmas Tree Heart Decoration,10.68,5,16686.0,United Kingdom
572295,2023-10-23,21803,Christmas Tree Star Decoration,10.68,4,16686.0,United Kingdom
572295,2023-10-23,21804,White Christmas Garland Stars Trees,14.09,2,16686.0,United Kingdom
572295,2023-10-23,22641,Set Of 4 Napkin Charms Instrument,12.86,3,16686.0,United Kingdom
572295,2023-10-23,23275,Set Of 3 Hanging Owls Ollie Beak,11.53,2,16686.0,United Kingdom
572295,2023-10-23,23264,Set Of 3 Wooden Sleigh Decorations,11.53,2,16686.0,United Kingdom
572295,2023-10-23,22604,Set Of 4 Napkin Charms Cutlery,12.86,3,16686.0,United Kingdom
572295,2023-10-23,22574,Heart Wooden Christmas Decoration,11.12,6,16686.0,United Kingdom
572295,2023-10-23,22572,Rocking Horse Green Christmas,11.12,6,16686.0,United Kingdom
572295,2023-10-23,22573,Star Wooden Christmas Decoration,11.12,6,16686.0,United Kingdom
572295,2023-10-23,22576,Swallow Wooden Christmas Decoration,11.12,6,16686.0,United Kingdom
572295,2023-10-23,79190B,Retro Plastic Polka Tray,11.12,2,16686.0,United Kingdom
572295,2023-10-23,79191C,Retro Plastic Elephant Tray,11.12,4,16686.0,United Kingdom
572295,2023-10-23,22955,36 Foil Star Cake Cases,12.4,1,16686.0,United Kingdom
572295,2023-10-23,23392,Spaceboy Rocket Lolly Makers,12.38,1,16686.0,United Kingdom
572295,2023-10-23,84828,Jungle Popsicles Ice Lolly Moulds,11.53,2,16686.0,United Kingdom
572295,2023-10-23,23559,Woodland Bunnies Lolly Makers,12.38,2,16686.0,United Kingdom
572295,2023-10-23,23197,Sketchbook Magnetic Shopping List,11.74,2,16686.0,United Kingdom
572295,2023-10-23,23196,Vintage Leaf Magnetic Notepad,11.74,2,16686.0,United Kingdom
572295,2023-10-23,22560,Traditional Modelling Clay,11.53,4,16686.0,United Kingdom
572295,2023-10-23,22467,Gumball Coat Rack,12.86,2,16686.0,United Kingdom
572295,2023-10-23,23130,Mistletoe Heart Wreath Green,14.5,1,16686.0,United Kingdom
572295,2023-10-23,23129,Heart Shaped Holly Wreath,14.5,1,16686.0,United Kingdom
572295,2023-10-23,84380,Set Of 3 Butterfly Cookie Cutters,11.74,2,16686.0,United Kingdom
572295,2023-10-23,22966,Gingerbread Man Cookie Cutter,11.53,3,16686.0,United Kingdom
572295,2023-10-23,84378,Set Of 3 Heart Cookie Cutters,11.74,2,16686.0,United Kingdom
572295,2023-10-23,22326,Round Snack Boxes Set Of4 Woodland,13.27,1,16686.0,United Kingdom
572295,2023-10-23,22328,Round Snack Boxes Set Of 4 Fruits,13.27,2,16686.0,United Kingdom
572295,2023-10-23,22729,Alarm Clock Bakelike Orange,14.09,2,16686.0,United Kingdom
572295,2023-10-23,22730,Alarm Clock Bakelike Ivory,14.09,2,16686.0,United Kingdom
572295,2023-10-23,23509,Mini Playing Cards Fun Fair,10.68,2,16686.0,United Kingdom
572295,2023-10-23,85034A,3 Gardenia Morris Boxed Candles,11.53,1,16686.0,United Kingdom
572295,2023-10-23,84952B,Black Love Bird T-Light Holder,14.09,3,16686.0,United Kingdom
572295,2023-10-23,22628,Picnic Boxes Set Of 3 Retrospot,15.32,1,16686.0,United Kingdom
572295,2023-10-23,22468,Babushka Lights String Of 10,17.17,1,16686.0,United Kingdom
572295,2023-10-23,23256,Childrens Cutlery Spaceboy,14.5,1,16686.0,United Kingdom
572295,2023-10-23,84510E,Set Of 4 Green Carousel Coasters,11.53,2,16686.0,United Kingdom
572295,2023-10-23,84510C,Set Of 4 Polkadot Coasters,11.53,2,16686.0,United Kingdom
572295,2023-10-23,84510A,Set Of 4 English Rose Coasters,11.53,2,16686.0,United Kingdom
572295,2023-10-23,22211,Wood Stamp Set Flowers,11.1,2,16686.0,United Kingdom
572295,2023-10-23,85034A,3 Gardenia Morris Boxed Candles,11.53,1,16686.0,United Kingdom
572295,2023-10-23,22759,Set Of 3 Notebooks In Parcel,11.94,2,16686.0,United Kingdom
572295,2023-10-23,23392,Spaceboy Rocket Lolly Makers,12.38,1,16686.0,United Kingdom
572295,2023-10-23,22991,Giraffe Wooden Ruler,12.25,2,16686.0,United Kingdom
572295,2023-10-23,23254,Childrens Cutlery Dolly Girl,14.5,2,16686.0,United Kingdom
572295,2023-10-23,23255,Childrens Cutlery Circus Parade,14.5,1,16686.0,United Kingdom
572295,2023-10-23,23256,Childrens Cutlery Spaceboy,14.5,1,16686.0,United Kingdom
572295,2023-10-23,21991,Bohemian Collage Stationery Set,11.53,2,16686.0,United Kingdom
572295,2023-10-23,21992,Vintage Paisley Stationery Set,11.53,1,16686.0,United Kingdom
572295,2023-10-23,22558,Clothes Pegs Retrospot Pack 24,11.94,2,16686.0,United Kingdom
572295,2023-10-23,21640,Assorted Tutti Frutti Fob Notebook,11.12,12,16686.0,United Kingdom
572295,2023-10-23,20903,Vintage Keepsake Box Travelogue,16.76,1,16686.0,United Kingdom
572295,2023-10-23,72803A,Rose Scent Candle Jewelled Drawer,14.61,2,16686.0,United Kingdom
572295,2023-10-23,20794,Blue Tile Hook,12.86,3,16686.0,United Kingdom
572295,2023-10-23,21293,Mirrored Dove Wall Decoration,12.4,4,16686.0,United Kingdom
572295,2023-10-23,85169B,Black Love Bird Candle,11.53,4,16686.0,United Kingdom
572295,2023-10-23,21640,Assorted Tutti Frutti Fob Notebook,11.12,12,16686.0,United Kingdom
572295,2023-10-23,85169A,Ivory Love Bird Candle,11.53,4,16686.0,United Kingdom
572295,2023-10-23,10120,Doggy Rubber,10.47,5,16686.0,United Kingdom
572295,2023-10-23,23403,Letter Holder Home Sweet Home,14.09,2,16686.0,United Kingdom
572295,2023-10-23,85124B,Blue Juicy Fruit Photo Frame,12.86,2,16686.0,United Kingdom
572295,2023-10-23,21636,Madras Notebook Medium,11.02,4,16686.0,United Kingdom
572295,2023-10-23,23505,Playing Cards I Love London,11.53,1,16686.0,United Kingdom
572295,2023-10-23,23509,Mini Playing Cards Fun Fair,10.68,3,16686.0,United Kingdom
572295,2023-10-23,21328,Balloons Writing Set,11.94,3,16686.0,United Kingdom
572295,2023-10-23,21061,Party Invites Football,11.12,3,16686.0,United Kingdom
572295,2023-10-23,21062,Party Invites Spaceman,11.12,2,16686.0,United Kingdom
572295,2023-10-23,22564,Alphabet Stencil Craft,11.53,1,16686.0,United Kingdom
572295,2023-10-23,22562,Monsters Stencil Craft,11.53,1,16686.0,United Kingdom
572295,2023-10-23,22489,Pack Of 12 Traditional Crayons,10.68,6,16686.0,United Kingdom
572295,2023-10-23,22563,Happy Stencil Craft,11.53,3,16686.0,United Kingdom
572295,2023-10-23,20898,Vintage Notebook Travelogue,13.27,5,16686.0,United Kingdom
572295,2023-10-23,22753,Small Yellow Babushka Notebook,11.12,1,16686.0,United Kingdom
572295,2023-10-23,22754,Small Red Babushka Notebook,11.12,1,16686.0,United Kingdom
572295,2023-10-23,22755,Small Purple Babushka Notebook,11.12,1,16686.0,United Kingdom
572295,2023-10-23,22756,Large Yellow Babushka Notebook,11.53,1,16686.0,United Kingdom
572295,2023-10-23,22757,Large Red Babushka Notebook,11.53,1,16686.0,United Kingdom
572295,2023-10-23,21058,Party Invites Woodland,11.12,2,16686.0,United Kingdom
572295,2023-10-23,21060,Party Invites Balloon Girl,11.12,3,16686.0,United Kingdom
572295,2023-10-23,22784,Lantern Cream Gazebo,15.32,2,16686.0,United Kingdom
572295,2023-10-23,21375,Large Camphor Wood Field Mushroom,15.84,1,16686.0,United Kingdom
572295,2023-10-23,21376,Large Tall Camphor Wood Toadstool,15.84,1,16686.0,United Kingdom
572295,2023-10-23,21377,Small Camphor Wood Field Mushroom,11.94,2,16686.0,United Kingdom
572295,2023-10-23,21378,Small Tall Camphor Wood Toadstool,11.94,1,16686.0,United Kingdom
572295,2023-10-23,21379,Camphor Wood Portobello Mushroom,11.53,2,16686.0,United Kingdom
572295,2023-10-23,82486,3 Drawer Antique White Wood Cabinet,19.42,1,16686.0,United Kingdom
572295,2023-10-23,23356,Love Hot Water Bottle,16.35,1,16686.0,United Kingdom
572295,2023-10-23,22111,Scottie Dog Hot Water Bottle,15.32,2,16686.0,United Kingdom
572295,2023-10-23,21484,Chick Grey Hot Water Bottle,14.61,1,16686.0,United Kingdom
572295,2023-10-23,22779,Wooden Owls Light Garland,14.61,1,16686.0,United Kingdom
572295,2023-10-23,84030E,English Rose Hot Water Bottle,14.61,1,16686.0,United Kingdom
572295,2023-10-23,21484,Chick Grey Hot Water Bottle,14.61,1,16686.0,United Kingdom
572295,2023-10-23,21481,Fawn Blue Hot Water Bottle,14.09,2,16686.0,United Kingdom
572295,2023-10-23,84029G,Knitted Union Flag Hot Water Bottle,14.61,1,16686.0,United Kingdom
572295,2023-10-23,21479,White Skull Hot Water Bottle,14.61,2,16686.0,United Kingdom
572295,2023-10-23,23229,Vintage Donkey Tail Game,14.09,2,16686.0,United Kingdom
572295,2023-10-23,23445,Ice Cream Bubbles,11.1,20,16686.0,United Kingdom
572295,2023-10-23,21754,Home Building Block Word,16.66,2,16686.0,United Kingdom
572295,2023-10-23,22466,Fairy Tale Cottage Night Light,12.25,2,16686.0,United Kingdom
572295,2023-10-23,23176,Abc Treasure Book Box,12.56,2,16686.0,United Kingdom
572295,2023-10-23,22550,Holiday Fun Ludo,14.09,2,16686.0,United Kingdom
572295,2023-10-23,21506,Fancy Font Birthday Card,10.68,12,16686.0,United Kingdom
572295,2023-10-23,21504,Skulls Greeting Card,10.68,12,16686.0,United Kingdom
572295,2023-10-23,85227,Set Of 6 3d Kit Cards For Kids,11.12,3,16686.0,United Kingdom
572295,2023-10-23,79321,Chilli Lights,16.14,1,16686.0,United Kingdom
572295,2023-10-23,23388,Woodland Mini Backpack,14.5,1,16686.0,United Kingdom
572295,2023-10-23,23389,Spaceboy Mini Backpack,14.5,3,16686.0,United Kingdom
572295,2023-10-23,23390,Dolly Girl Mini Backpack,14.5,2,16686.0,United Kingdom
572295,2023-10-23,22176,Blue Owl Soft Toy,13.27,1,16686.0,United Kingdom
572295,2023-10-23,22175,Pink Owl Soft Toy,13.27,1,16686.0,United Kingdom
572295,2023-10-23,23193,Buffalo Bill Treasure Book Box,12.56,1,16686.0,United Kingdom
572295,2023-10-23,23505,Playing Cards I Love London,11.53,1,16686.0,United Kingdom
572295,2023-10-23,21790,Vintage Snap Cards,11.12,2,16686.0,United Kingdom
572295,2023-10-23,21731,Red Toadstool Led Night Light,11.94,2,16686.0,United Kingdom
572295,2023-10-23,23506,Mini Playing Cards Spaceboy,10.68,5,16686.0,United Kingdom
572295,2023-10-23,23048,Set Of 10 Lanterns Fairy Light Star,14.5,2,16686.0,United Kingdom
572295,2023-10-23,23499,Set 12 Vintage Doily Chalk,10.68,2,16686.0,United Kingdom
572295,2023-10-23,22531,Magic Drawing Slate Circus Parade,10.68,10,16686.0,United Kingdom
572295,2023-10-23,21889,Wooden Box Of Dominoes,11.53,2,16686.0,United Kingdom
572296,2023-10-23,23503,Playing Cards Keep Calm & Carry On,11.53,1,13598.0,United Kingdom
572296,2023-10-23,23239,Set Of 4 Knick Knack Tins Poppies,14.5,2,13598.0,United Kingdom
572296,2023-10-23,23237,Set Of 4 Knick Knack Tins Leaf,14.5,2,13598.0,United Kingdom
572296,2023-10-23,84947,Antique Silver Tea Glass Engraved,11.53,6,13598.0,United Kingdom
572296,2023-10-23,21390,Filigris Heart With Butterfly,11.53,6,13598.0,United Kingdom
572296,2023-10-23,22411,Jumbo Shopper Vintage Red Paisley,12.38,1,13598.0,United Kingdom
572296,2023-10-23,22744,Make Your Own Monsoon Card Kit,13.27,1,13598.0,United Kingdom
572296,2023-10-23,23016,Glass Twist Bon Bon Jar,18.3,1,13598.0,United Kingdom
572296,2023-10-23,23238,Set Of 4 Knick Knack Tins London,14.5,1,13598.0,United Kingdom
572296,2023-10-23,23239,Set Of 4 Knick Knack Tins Poppies,14.5,1,13598.0,United Kingdom
572296,2023-10-23,23493,Vintage Doily Travel Sewing Kit,12.25,2,13598.0,United Kingdom
572296,2023-10-23,23300,Gardeners Kneeling Pad Cup Of Tea,11.94,1,13598.0,United Kingdom
572296,2023-10-23,21908,Chocolate This Way Metal Sign,12.4,1,13598.0,United Kingdom
572296,2023-10-23,22188,Black Heart Card Holder,14.3,1,13598.0,United Kingdom
572296,2023-10-23,23348,Childrens Toy Cooking Utensil Set,12.38,1,13598.0,United Kingdom
572296,2023-10-23,22139,Retrospot Tea Set Ceramic 11 Pc,15.32,1,13598.0,United Kingdom
572296,2023-10-23,84832,Zinc Willie Winkie Candle Stick,11.12,1,13598.0,United Kingdom
572296,2023-10-23,23355,Hot Water Bottle Keep Calm,15.32,1,13598.0,United Kingdom
572296,2023-10-23,23389,Spaceboy Mini Backpack,14.5,1,13598.0,United Kingdom
572296,2023-10-23,22867,Hand Warmer Bird Design,12.4,1,13598.0,United Kingdom
572296,2023-10-23,22632,Hand Warmer Red Retrospot,12.4,1,13598.0,United Kingdom
572296,2023-10-23,22633,Hand Warmer Union Jack,12.4,3,13598.0,United Kingdom
572296,2023-10-23,23300,Gardeners Kneeling Pad Cup Of Tea,11.94,1,13598.0,United Kingdom
572296,2023-10-23,23301,Gardeners Kneeling Pad Keep Calm,11.94,1,13598.0,United Kingdom
572296,2023-10-23,23302,Kneeling Mat Housework Design,11.94,1,13598.0,United Kingdom
572296,2023-10-23,22188,Black Heart Card Holder,14.3,1,13598.0,United Kingdom
572296,2023-10-23,23103,Jingle Bell Heart Decoration,11.94,1,13598.0,United Kingdom
572296,2023-10-23,22670,French Wc Sign Blue Metal,11.53,1,13598.0,United Kingdom
572296,2023-10-23,23152,Ivory Sweetheart Wire Letter Rack,14.09,1,13598.0,United Kingdom
572296,2023-10-23,23238,Set Of 4 Knick Knack Tins London,14.5,1,13598.0,United Kingdom
572296,2023-10-23,23239,Set Of 4 Knick Knack Tins Poppies,14.5,2,13598.0,United Kingdom
572296,2023-10-23,21755,Love Building Block Word,16.66,1,13598.0,United Kingdom
572296,2023-10-23,22411,Jumbo Shopper Vintage Red Paisley,12.38,1,13598.0,United Kingdom
572296,2023-10-23,21931,Jumbo Storage Bag Suki,12.38,1,13598.0,United Kingdom
572296,2023-10-23,85099C,Jumbo Bag Baroque Black White,6.19,2,13598.0,United Kingdom
572296,2023-10-23,85099B,Jumbo Bag Red Retrospot,6.19,1,13598.0,United Kingdom
572296,2023-10-23,21928,Jumbo Bag Scandinavian Blue Paisley,6.19,1,13598.0,United Kingdom
572296,2023-10-23,23203,Jumbo Bag Vintage Doily,6.19,1,13598.0,United Kingdom
572297,2023-10-23,82494L,Wooden Frame Antique White,13.27,6,15953.0,United Kingdom
572297,2023-10-23,82482,Wooden Picture Frame White Finish,13.27,6,15953.0,United Kingdom
572297,2023-10-23,23456,Medium Parlour Picture Frame,14.5,2,15953.0,United Kingdom
572297,2023-10-23,23455,Small Parlour Picture Frame,13.21,4,15953.0,United Kingdom
572297,2023-10-23,23136,Ivory Wire Sweetheart Letter Tray,14.09,2,15953.0,United Kingdom
572297,2023-10-23,85123A,Cream Hanging Heart T-Light Holder,12.86,32,15953.0,United Kingdom
572297,2023-10-23,23152,Ivory Sweetheart Wire Letter Rack,14.09,2,15953.0,United Kingdom
572298,2023-10-23,23539,Wall Art Loves' Secret,16.35,1,14071.0,United Kingdom
572298,2023-10-23,23534,Wall Art Stop For Tea,16.35,1,14071.0,United Kingdom
572298,2023-10-23,23535,Wall Art Bicycle Safety,16.35,2,14071.0,United Kingdom
572298,2023-10-23,48173C,Doormat Black Flock,18.71,1,14071.0,United Kingdom
572298,2023-10-23,21770,Open Closed Metal Sign,15.32,1,14071.0,United Kingdom
572298,2023-10-23,23526,Wall Art Dog Licence,16.35,1,14071.0,United Kingdom
572300,2023-10-23,45013,Folding Shoe Tidy,13.27,1,18005.0,United Kingdom
572300,2023-10-23,22481,Black Tea Towel Classic Design,11.53,2,18005.0,United Kingdom
572300,2023-10-23,23131,Mistletoe Heart Wreath Cream,14.5,1,18005.0,United Kingdom
572300,2023-10-23,23301,Gardeners Kneeling Pad Keep Calm,11.94,1,18005.0,United Kingdom
572300,2023-10-23,23321,Small White Heart Of Wicker,11.94,1,18005.0,United Kingdom
572300,2023-10-23,22799,Sweetheart Wire Fruit Bowl,18.96,1,18005.0,United Kingdom
572300,2023-10-23,23252,Vintage Red Enamel Trim Jug,14.09,1,18005.0,United Kingdom
572300,2023-10-23,22758,Large Purple Babushka Notebook,11.53,1,18005.0,United Kingdom
572300,2023-10-23,22754,Small Red Babushka Notebook,11.12,5,18005.0,United Kingdom
572300,2023-10-23,22965,3 Traditional Biscuit Cutters Set,12.4,1,18005.0,United Kingdom
572300,2023-10-23,72802C,Vanilla Scent Candle Jewelled Box,14.61,4,18005.0,United Kingdom
572300,2023-10-23,23252,Vintage Red Enamel Trim Jug,14.09,1,18005.0,United Kingdom
572300,2023-10-23,22907,Pack Of 20 Napkins Pantry Design,11.12,2,18005.0,United Kingdom
572300,2023-10-23,22766,Photo Frame Cornice,13.27,1,18005.0,United Kingdom
572300,2023-10-23,23131,Mistletoe Heart Wreath Cream,14.5,1,18005.0,United Kingdom
572300,2023-10-23,21034,Rex Cash+Carry Jumbo Shopper,11.22,1,18005.0,United Kingdom
572300,2023-10-23,23203,Jumbo Bag Vintage Doily,6.19,1,18005.0,United Kingdom
572300,2023-10-23,20712,Jumbo Bag Woodland Animals,6.19,1,18005.0,United Kingdom
572300,2023-10-23,23344,Jumbo Bag 50'S Christmas,6.19,2,18005.0,United Kingdom
572300,2023-10-23,21289,Large Stripes Chocolate Gift Bag,5.77,16,18005.0,United Kingdom
572301,2023-10-23,20992,Jazz Hearts Purse Notebook,10.65,1,16794.0,United Kingdom
572301,2023-10-23,23411,Trellis Coat Rack,15.32,1,16794.0,United Kingdom
572301,2023-10-23,21900,Key Fob Shed,10.92,1,16794.0,United Kingdom
572301,2023-10-23,21899,Garage Key Fob,10.92,2,16794.0,United Kingdom
572301,2023-10-23,21900,Key Fob Shed,10.92,1,16794.0,United Kingdom
572301,2023-10-23,22773,Green Drawer Knob Acrylic Edwardian,11.53,2,16794.0,United Kingdom
572301,2023-10-23,23182,Toilet Sign Occupied Or Vacant,11.1,1,16794.0,United Kingdom
572301,2023-10-23,23415,Home Sweet Home Hook,11.94,1,16794.0,United Kingdom
572301,2023-10-23,23417,Bathroom Hook,11.94,1,16794.0,United Kingdom
572301,2023-10-23,23196,Vintage Leaf Magnetic Notepad,11.74,3,16794.0,United Kingdom
572301,2023-10-23,23198,Pantry Magnetic Shopping List,11.74,3,16794.0,United Kingdom
572301,2023-10-23,22993,Set Of 4 Pantry Jelly Moulds,11.53,1,16794.0,United Kingdom
572301,2023-10-23,22469,Heart Of Wicker Small,11.94,1,16794.0,United Kingdom
572301,2023-10-23,20894,Hanging Bauble T-Light Holder Large,13.27,1,16794.0,United Kingdom
572301,2023-10-23,20893,Hanging Bauble T-Light Holder Small,12.86,1,16794.0,United Kingdom
572301,2023-10-23,82552,Washroom Metal Sign,11.74,2,16794.0,United Kingdom
572301,2023-10-23,22371,Airline Bag Vintage Tokyo 78,14.61,1,16794.0,United Kingdom
572301,2023-10-23,20718,Red Retrospot Shopper Bag,11.53,2,16794.0,United Kingdom
572301,2023-10-23,22720,Set Of 3 Cake Tins Pantry Design,15.32,1,16794.0,United Kingdom
572301,2023-10-23,23243,Set Of Tea Coffee Sugar Tins Pantry,15.32,1,16794.0,United Kingdom
572301,2023-10-23,21216,Set 3 Retrospot Tea/Coffee/Sugar,15.32,1,16794.0,United Kingdom
572301,2023-10-23,22722,Set Of 6 Spice Tins Pantry Design,14.3,1,16794.0,United Kingdom
572301,2023-10-23,22723,Set Of 6 Herb Tins Sketchbook,14.3,1,16794.0,United Kingdom
572301,2023-10-23,22667,Recipe Box Retrospot,13.27,2,16794.0,United Kingdom
572301,2023-10-23,22666,Recipe Box Pantry Yellow Design,13.27,1,16794.0,United Kingdom
572301,2023-10-23,22665,Recipe Box Blue Sketchbook Design,13.27,1,16794.0,United Kingdom
572301,2023-10-23,23200,Jumbo Bag Pears,6.19,2,16794.0,United Kingdom
572301,2023-10-23,23199,Jumbo Bag Apples,6.19,1,16794.0,United Kingdom
572301,2023-10-23,22384,Lunch Bag Pink Polkadot,5.97,3,16794.0,United Kingdom
572301,2023-10-23,20727,Lunch Bag Black Skull,5.97,2,16794.0,United Kingdom
572301,2023-10-23,20725,Lunch Bag Red Retrospot,5.97,4,16794.0,United Kingdom
572301,2023-10-23,22383,Lunch Bag Suki Design,5.97,4,16794.0,United Kingdom
572301,2023-10-23,23209,Lunch Bag Vintage Doily,5.97,2,16794.0,United Kingdom
572301,2023-10-23,23206,Lunch Bag Apple Design,5.97,3,16794.0,United Kingdom
572302,2023-10-23,84519B,Carrot Charlie+Lola Coaster Set,11.53,1,15427.0,United Kingdom
572302,2023-10-23,85071D,Charlie+Lola My Room Door Sign,10.65,1,15427.0,United Kingdom
572302,2023-10-23,22906,12 Message Cards With Envelopes,11.94,1,15427.0,United Kingdom
572302,2023-10-23,21222,Set/4 Badges Beetles,11.53,3,15427.0,United Kingdom
572302,2023-10-23,23101,Silver Stars Table Decoration,11.1,1,15427.0,United Kingdom
572302,2023-10-23,23100,Silver Bells Table Decoration,11.53,1,15427.0,United Kingdom
572302,2023-10-23,22152,Place Setting White Star,10.68,10,15427.0,United Kingdom
572302,2023-10-23,85183B,Charlie & Lola Wastepaper Bin Flora,11.53,1,15427.0,United Kingdom
572302,2023-10-23,85183A,Charlie & Lola Wastepaper Bin Blue,11.53,1,15427.0,United Kingdom
572302,2023-10-23,22093,Motoring Tissue Box,10.65,1,15427.0,United Kingdom
572302,2023-10-23,22091,Empire Tissue Box,10.65,1,15427.0,United Kingdom
572302,2023-10-23,22992,Revolver Wooden Ruler,12.25,1,15427.0,United Kingdom
572302,2023-10-23,22683,French Blue Metal Door Sign 8,11.53,1,15427.0,United Kingdom
572302,2023-10-23,85049E,Scandinavian Reds Ribbons,11.53,2,15427.0,United Kingdom
572302,2023-10-23,22981,Pantry Apple Corer,11.74,1,15427.0,United Kingdom
572302,2023-10-23,23188,Vintage 2 Metre Folding Ruler,11.94,1,15427.0,United Kingdom
572302,2023-10-23,23350,Roll Wrap Vintage Spot,11.53,1,15427.0,United Kingdom
572302,2023-10-23,84519B,Carrot Charlie+Lola Coaster Set,11.53,3,15427.0,United Kingdom
572302,2023-10-23,22037,Robot Birthday Card,10.68,12,15427.0,United Kingdom
572302,2023-10-23,21506,Fancy Font Birthday Card,10.68,12,15427.0,United Kingdom
572302,2023-10-23,21509,Cowboys And Indians Birthday Card,10.68,12,15427.0,United Kingdom
572302,2023-10-23,21504,Skulls Greeting Card,10.68,12,15427.0,United Kingdom
572302,2023-10-23,23533,Wall Art Garden Haven,16.35,1,15427.0,United Kingdom
572302,2023-10-23,22187,Green Christmas Tree Card Holder,12.25,1,15427.0,United Kingdom
572302,2023-10-23,85183B,Charlie & Lola Wastepaper Bin Flora,11.53,2,15427.0,United Kingdom
572302,2023-10-23,85183A,Charlie & Lola Wastepaper Bin Blue,11.53,2,15427.0,United Kingdom
572302,2023-10-23,22596,Christmas Star Wish List Chalkboard,11.53,5,15427.0,United Kingdom
572302,2023-10-23,22574,Heart Wooden Christmas Decoration,11.12,5,15427.0,United Kingdom
572302,2023-10-23,22573,Star Wooden Christmas Decoration,11.12,3,15427.0,United Kingdom
572302,2023-10-23,22579,Wooden Tree Christmas Scandinavian,10.55,2,15427.0,United Kingdom
572302,2023-10-23,22577,Wooden Heart Christmas Scandinavian,10.55,5,15427.0,United Kingdom
572302,2023-10-23,23354,6 Gift Tags 50'S Christmas,11.1,3,15427.0,United Kingdom
572302,2023-10-23,23353,6 Gift Tags Vintage Christmas,11.1,3,15427.0,United Kingdom
572302,2023-10-23,22959,Wrap Christmas Village,10.68,25,15427.0,United Kingdom
572302,2023-10-23,22151,Place Setting White Heart,10.68,13,15427.0,United Kingdom
572302,2023-10-23,21828,Eight Piece Snake Set,11.53,3,15427.0,United Kingdom
572302,2023-10-23,22037,Robot Birthday Card,10.68,12,15427.0,United Kingdom
572302,2023-10-23,23190,Bundle Of 3 School Exercise Books,11.94,2,15427.0,United Kingdom
572302,2023-10-23,23319,Box Of 6 Mini 50'S Crackers,12.8,1,15427.0,United Kingdom
572302,2023-10-23,23318,Box Of 6 Mini Vintage Crackers,12.8,2,15427.0,United Kingdom
572302,2023-10-23,22587,Feltcraft Hairband Red And Blue,11.12,5,15427.0,United Kingdom
572302,2023-10-23,21902,Key Fob Front Door,10.92,6,15427.0,United Kingdom
572302,2023-10-23,21210,Set Of 72 Retrospot Paper Doilies,11.74,1,15427.0,United Kingdom
572302,2023-10-23,23320,Giant 50'S Christmas Cracker,13.21,1,15427.0,United Kingdom
572302,2023-10-23,21770,Open Closed Metal Sign,15.32,1,15427.0,United Kingdom
572302,2023-10-23,85071C,"Charlie+Lola""Extremely Busy"" Sign",10.65,2,15427.0,United Kingdom
572302,2023-10-23,85071B,Red Charlie+Lola Personal Doorsign,10.65,2,15427.0,United Kingdom
572302,2023-10-23,85071D,Charlie+Lola My Room Door Sign,10.65,3,15427.0,United Kingdom
572302,2023-10-23,21888,Bingo Set,14.09,2,15427.0,United Kingdom
572302,2023-10-23,21990,Modern Floral Stationery Set,11.53,2,15427.0,United Kingdom
572302,2023-10-23,22992,Revolver Wooden Ruler,12.25,6,15427.0,United Kingdom
572302,2023-10-23,21754,Home Building Block Word,16.66,2,15427.0,United Kingdom
572302,2023-10-23,84077,World War 2 Gliders Asstd Designs,10.55,48,15427.0,United Kingdom
572302,2023-10-23,21912,Vintage Snakes & Ladders,14.09,2,15427.0,United Kingdom
572302,2023-10-23,22895,Set Of 2 Tea Towels Apple And Pears,13.58,1,15427.0,United Kingdom
572302,2023-10-23,22897,Oven Mitt Apples Design,11.74,2,15427.0,United Kingdom
