TransactionNo,Date,ProductNo,ProductName,Price,Quantity,CustomerNo,Country
570228,2023-10-09,22989,Set 2 Pantry Design Tea Towels,13.58,2,15821.0,United Kingdom
570228,2023-10-09,23296,Set Of 6 Tea Time Baking Cases,11.53,1,15821.0,United Kingdom
570228,2023-10-09,23103,Jingle Bell Heart Decoration,11.94,3,15821.0,United Kingdom
570228,2023-10-09,23493,Vintage Doily Travel Sewing Kit,12.25,5,15821.0,United Kingdom
570228,2023-10-09,23191,Bundle Of 3 Retro Note Books,11.94,2,15821.0,United Kingdom
570228,2023-10-09,22114,Hot Water Bottle Tea And Sympathy,14.61,2,15821.0,United Kingdom
570228,2023-10-09,22110,Bird House Hot Water Bottle,12.86,2,15821.0,United Kingdom
570228,2023-10-09,22960,Jam Making Set With Jars,14.61,3,15821.0,United Kingdom
570228,2023-10-09,23328,Set 6 School Milk Bottles In Crate,14.09,2,15821.0,United Kingdom
570228,2023-10-09,22178,Victorian Glass Hanging T-Light,12.25,4,15821.0,United Kingdom
570228,2023-10-09,46000S,Polyester Filler Pad 40x40cm,11.74,4,15821.0,United Kingdom
570228,2023-10-09,46000M,Polyester Filler Pad 45x45cm,11.84,7,15821.0,United Kingdom
570228,2023-10-09,35970,Zinc Folkart Sleigh Bells,11.98,1,15821.0,United Kingdom
570228,2023-10-09,22152,Place Setting White Star,10.68,5,15821.0,United Kingdom
570228,2023-10-09,22151,Place Setting White Heart,10.68,5,15821.0,United Kingdom
570228,2023-10-09,23090,Vintage Glass T-Light Holder,11.1,12,15821.0,United Kingdom
570228,2023-10-09,20728,Lunch Bag Cars Blue,5.97,2,15821.0,United Kingdom
570228,2023-10-09,23207,Lunch Bag Alphabet Design,5.97,2,15821.0,United Kingdom
570228,2023-10-09,22384,Lunch Bag Pink Polkadot,5.97,2,15821.0,United Kingdom
570228,2023-10-09,23208,Lunch Bag Vintage Leaf Design,5.97,2,15821.0,United Kingdom
570228,2023-10-09,20726,Lunch Bag Woodland,5.97,2,15821.0,United Kingdom
570229,2023-10-09,21992,Vintage Paisley Stationery Set,11.53,1,15756.0,United Kingdom
570229,2023-10-09,21991,Bohemian Collage Stationery Set,11.53,1,15756.0,United Kingdom
570229,2023-10-09,22728,Alarm Clock Bakelike Pink,14.09,1,15756.0,United Kingdom
570229,2023-10-09,22944,Christmas Metal Postcard With Bells,10.65,6,15756.0,United Kingdom
570229,2023-10-09,23503,Playing Cards Keep Calm & Carry On,11.53,1,15756.0,United Kingdom
570229,2023-10-09,23280,Folding Butterfly Mirror Hot Pink,11.1,1,15756.0,United Kingdom
570229,2023-10-09,23281,Folding Butterfly Mirror Red,11.1,1,15756.0,United Kingdom
570229,2023-10-09,23282,Folding Butterfly Mirror Ivory,11.1,1,15756.0,United Kingdom
570229,2023-10-09,22195,Large Heart Measuring Spoons,11.94,2,15756.0,United Kingdom
570229,2023-10-09,23324,Rustic Strawberry Jam Pot Large,12.38,2,15756.0,United Kingdom
570229,2023-10-09,22413,Metal Sign Take It Or Leave It,13.27,1,15756.0,United Kingdom
570229,2023-10-09,82582,Area Patrolled Metal Sign,12.4,1,15756.0,United Kingdom
570229,2023-10-09,82583,Hot Baths Metal Sign,12.4,1,15756.0,United Kingdom
570229,2023-10-09,21162,Toxic Area Door Hanger,10.65,1,15756.0,United Kingdom
570229,2023-10-09,21248,Door Hanger Mum + Dads Room,11.74,1,15756.0,United Kingdom
570229,2023-10-09,21163,Do Not Touch My Stuff Door Hanger,10.65,1,15756.0,United Kingdom
570229,2023-10-09,21159,Moody Boy Door Hanger,10.65,1,15756.0,United Kingdom
570229,2023-10-09,21165,Beware Of The Cat Metal Sign,11.98,1,15756.0,United Kingdom
570229,2023-10-09,22676,French Blue Metal Door Sign 1,11.53,1,15756.0,United Kingdom
570229,2023-10-09,22674,French Toilet Sign Blue Metal,11.53,1,15756.0,United Kingdom
570229,2023-10-09,82552,Washroom Metal Sign,11.74,1,15756.0,United Kingdom
570229,2023-10-09,21166,Cook With Wine Metal Sign,12.38,2,15756.0,United Kingdom
570229,2023-10-09,22992,Revolver Wooden Ruler,12.25,1,15756.0,United Kingdom
570229,2023-10-09,22412,Metal Sign Neighbourhood Witch,12.4,1,15756.0,United Kingdom
570229,2023-10-09,22670,French Wc Sign Blue Metal,11.53,1,15756.0,United Kingdom
570229,2023-10-09,22682,French Blue Metal Door Sign 7,11.53,2,15756.0,United Kingdom
570229,2023-10-09,22671,French Laundry Sign Blue Metal,11.94,1,15756.0,United Kingdom
570229,2023-10-09,22672,French Bathroom Sign Blue Metal,11.94,1,15756.0,United Kingdom
570229,2023-10-09,17021,Namaste Swagat Incense,10.56,6,15756.0,United Kingdom
570229,2023-10-09,22111,Scottie Dog Hot Water Bottle,15.32,1,15756.0,United Kingdom
570229,2023-10-09,21932,Scandinavian Paisley Picnic Bag,11.94,1,15756.0,United Kingdom
570229,2023-10-09,21933,Pink Vintage Paisley Picnic Bag,11.94,1,15756.0,United Kingdom
570229,2023-10-09,23526,Wall Art Dog Licence,16.35,1,15756.0,United Kingdom
570229,2023-10-09,21758,Vintage Shells Print,16.86,1,15756.0,United Kingdom
570229,2023-10-09,23534,Wall Art Stop For Tea,16.35,1,15756.0,United Kingdom
570229,2023-10-09,23129,Heart Shaped Holly Wreath,14.5,1,15756.0,United Kingdom
570229,2023-10-09,84988,Set Of 72 Pink Heart Paper Doilies,11.74,1,15756.0,United Kingdom
570229,2023-10-09,21754,Home Building Block Word,16.66,1,15756.0,United Kingdom
570229,2023-10-09,20914,Set/5 Red Retrospot Lid Glass Bowls,13.27,1,15756.0,United Kingdom
570229,2023-10-09,20679,Edwardian Parasol Red,16.35,1,15756.0,United Kingdom
570229,2023-10-09,85014B,Red Retrospot Umbrella,16.35,1,15756.0,United Kingdom
570229,2023-10-09,15056N,Edwardian Parasol Natural,16.35,1,15756.0,United Kingdom
570229,2023-10-09,85014A,Black/Blue Polkadot Umbrella,16.35,1,15756.0,United Kingdom
570229,2023-10-09,22377,Bottle Bag Retrospot,12.4,2,15756.0,United Kingdom
570229,2023-10-09,21935,Suki Shoulder Bag,11.94,2,15756.0,United Kingdom
570229,2023-10-09,48184,Doormat English Rose,18.71,1,15756.0,United Kingdom
570229,2023-10-09,21930,Jumbo Storage Bag Skulls,12.38,2,15756.0,United Kingdom
570229,2023-10-09,22386,Jumbo Bag Pink Polkadot,6.19,1,15756.0,United Kingdom
570229,2023-10-09,23343,Jumbo Bag Vintage Christmas,6.19,2,15756.0,United Kingdom
570229,2023-10-09,23200,Jumbo Bag Pears,6.19,1,15756.0,United Kingdom
570229,2023-10-09,23203,Jumbo Bag Vintage Doily,6.19,1,15756.0,United Kingdom
570229,2023-10-09,85099C,Jumbo Bag Baroque Black White,6.19,1,15756.0,United Kingdom
570229,2023-10-09,20711,Jumbo Bag Toys,6.19,2,15756.0,United Kingdom
570229,2023-10-09,85099F,Jumbo Bag Strawberry,6.19,1,15756.0,United Kingdom
570229,2023-10-09,23201,Jumbo Bag Alphabet,6.19,1,15756.0,United Kingdom
570230,2023-10-09,21992,Vintage Paisley Stationery Set,11.53,1,18088.0,United Kingdom
570230,2023-10-09,21819,Glitter Christmas Star,10.65,1,18088.0,United Kingdom
570230,2023-10-09,85039B,S/4 Ivory Mini Rose Candle In Bowl,11.94,1,18088.0,United Kingdom
570230,2023-10-09,85231B,Cinammon Set Of 9 T-Lights,11.12,2,18088.0,United Kingdom
570230,2023-10-09,21124,Set/10 Blue Polkadot Party Candles,11.53,1,18088.0,United Kingdom
570230,2023-10-09,21695,Small Silver Flower Candle Pot,13.27,6,18088.0,United Kingdom
570230,2023-10-09,21693,Small Hammered Silver Candlepot,13.27,6,18088.0,United Kingdom
570230,2023-10-09,21894,Potting Shed Seed Envelopes,11.53,3,18088.0,United Kingdom
570230,2023-10-09,22583,Pack Of 6 Handbag Gift Boxes,12.86,4,18088.0,United Kingdom
570230,2023-10-09,22339,Christmas Tree Painted Zinc,10.44,6,18088.0,United Kingdom
570230,2023-10-09,72140E,Best Dad Candle Letters,11.12,1,18088.0,United Kingdom
570230,2023-10-09,85169A,Ivory Love Bird Candle,11.53,2,18088.0,United Kingdom
570230,2023-10-09,23294,Set Of 6 Snack Loaf Baking Cases,11.1,1,18088.0,United Kingdom
570230,2023-10-09,23295,Set Of 12 Mini Loaf Baking Cases,11.1,1,18088.0,United Kingdom
570230,2023-10-09,21124,Set/10 Blue Polkadot Party Candles,11.53,1,18088.0,United Kingdom
570230,2023-10-09,23296,Set Of 6 Tea Time Baking Cases,11.53,1,18088.0,United Kingdom
570230,2023-10-09,21621,Vintage Union Jack Bunting,18.96,1,18088.0,United Kingdom
570230,2023-10-09,23295,Set Of 12 Mini Loaf Baking Cases,11.1,2,18088.0,United Kingdom
570230,2023-10-09,22906,12 Message Cards With Envelopes,11.94,1,18088.0,United Kingdom
570230,2023-10-09,22339,Christmas Tree Painted Zinc,10.44,1,18088.0,United Kingdom
570230,2023-10-09,21819,Glitter Christmas Star,10.65,1,18088.0,United Kingdom
570230,2023-10-09,22082,Ribbon Reel Stripes Design,11.94,2,18088.0,United Kingdom
570230,2023-10-09,84836,Zinc Metal Heart Decoration,11.53,1,18088.0,United Kingdom
570230,2023-10-09,21684,Small Medina Stamped Metal Bowl,11.12,12,18088.0,United Kingdom
570230,2023-10-09,85104,Silver Glass T-Light Set,13.27,1,18088.0,United Kingdom
570230,2023-10-09,23036,T-Light Holder Silver Petit Four,11.53,12,18088.0,United Kingdom
570230,2023-10-09,21326,Aged Glass Silver T-Light Holder,10.92,12,18088.0,United Kingdom
570230,2023-10-09,22720,Set Of 3 Cake Tins Pantry Design,15.32,1,18088.0,United Kingdom
570230,2023-10-09,22411,Jumbo Shopper Vintage Red Paisley,12.38,1,18088.0,United Kingdom
570230,2023-10-09,22098,Boudoir Square Tissue Box,10.65,1,18088.0,United Kingdom
570230,2023-10-09,22197,Popcorn Holder,11.12,2,18088.0,United Kingdom
570230,2023-10-09,22092,Blue Paisley Tissue Box,10.65,1,18088.0,United Kingdom
570230,2023-10-09,22091,Empire Tissue Box,10.65,2,18088.0,United Kingdom
570230,2023-10-09,22093,Motoring Tissue Box,10.65,1,18088.0,United Kingdom
570230,2023-10-09,71459,Hanging Jam Jar T-Light Holders,11.12,12,18088.0,United Kingdom
570230,2023-10-09,21928,Jumbo Bag Scandinavian Blue Paisley,6.19,1,18088.0,United Kingdom
570230,2023-10-09,21929,Jumbo Bag Pink Vintage Paisley,6.19,1,18088.0,United Kingdom
570231,2023-10-09,20718,Red Retrospot Shopper Bag,11.53,2,16685.0,United Kingdom
570231,2023-10-09,20717,Strawberry Shopper Bag,11.53,2,16685.0,United Kingdom
570231,2023-10-09,21935,Suki Shoulder Bag,11.94,2,16685.0,United Kingdom
570231,2023-10-09,22411,Jumbo Shopper Vintage Red Paisley,12.38,1,16685.0,United Kingdom
570231,2023-10-09,22400,Magnets Pack Of 4 Home Sweet Home,10.65,12,16685.0,United Kingdom
570231,2023-10-09,84929,Asstd Fruit+Flowers Fridge Magnets,10.44,24,16685.0,United Kingdom
570231,2023-10-09,22865,Hand Warmer Owl Design,12.4,1,16685.0,United Kingdom
570231,2023-10-09,22834,Hand Warmer Babushka Design,12.4,1,16685.0,United Kingdom
570231,2023-10-09,22633,Hand Warmer Union Jack,12.4,1,16685.0,United Kingdom
570231,2023-10-09,22866,Hand Warmer Scotty Dog Design,12.4,1,16685.0,United Kingdom
570231,2023-10-09,22867,Hand Warmer Bird Design,12.4,1,16685.0,United Kingdom
570231,2023-10-09,23439,Hand Warmer Red Love Heart,12.4,1,16685.0,United Kingdom
570231,2023-10-09,23006,Travel Card Wallet Flower Meadow,10.68,24,16685.0,United Kingdom
570231,2023-10-09,22998,Travel Card Wallet Keep Calm,10.68,24,16685.0,United Kingdom
570231,2023-10-09,22994,Travel Card Wallet Retrospot,10.68,24,16685.0,United Kingdom
570231,2023-10-09,22996,Travel Card Wallet Vintage Ticket,10.68,24,16685.0,United Kingdom
570231,2023-10-09,23005,Travel Card Wallet I Love London,10.68,24,16685.0,United Kingdom
570231,2023-10-09,47503A,Ass Floral Print Multi Screwdriver,10.68,12,16685.0,United Kingdom
570231,2023-10-09,84029G,Knitted Union Flag Hot Water Bottle,14.61,2,16685.0,United Kingdom
570231,2023-10-09,22114,Hot Water Bottle Tea And Sympathy,14.61,1,16685.0,United Kingdom
570231,2023-10-09,22835,Hot Water Bottle I Am So Poorly,15.32,1,16685.0,United Kingdom
570231,2023-10-09,22111,Scottie Dog Hot Water Bottle,15.32,2,16685.0,United Kingdom
570231,2023-10-09,85017B,Envelope 50 Blossom Images,10.68,11,16685.0,United Kingdom
570231,2023-10-09,22269,Egg Cup Natural Chicken,10.65,16,16685.0,United Kingdom
570231,2023-10-09,37467,Pig Mug In Two Colour Designs,10.65,12,16685.0,United Kingdom
570231,2023-10-09,21845,Dairy Maid Stripe Mug,11.06,6,16685.0,United Kingdom
570231,2023-10-09,21530,Dairy Maid Toastrack,11.06,6,16685.0,United Kingdom
570231,2023-10-09,37413,Icon Mug Revolutionary,10.65,6,16685.0,United Kingdom
570231,2023-10-09,37489D,Pink/Green Flower Design Big Mug,10.65,1,16685.0,United Kingdom
570231,2023-10-09,37489A,Yellow/Pink Flower Design Big Mug,10.65,1,16685.0,United Kingdom
570231,2023-10-09,47593B,Scottie Dogs Baby Bib,10.65,6,16685.0,United Kingdom
570231,2023-10-09,85094,Candy Spot Egg Warmer Rabbit,10.44,12,16685.0,United Kingdom
570231,2023-10-09,37489A,Yellow/Pink Flower Design Big Mug,10.65,2,16685.0,United Kingdom
570231,2023-10-09,37489D,Pink/Green Flower Design Big Mug,10.65,2,16685.0,United Kingdom
570231,2023-10-09,22065,Christmas Pudding Trinket Pot,10.65,6,16685.0,United Kingdom
570231,2023-10-09,22062,Ceramic Bowl With Love Heart Design,11.1,4,16685.0,United Kingdom
570231,2023-10-09,22094,Red Retrospot Tissue Box,10.65,6,16685.0,United Kingdom
570231,2023-10-09,22093,Motoring Tissue Box,10.65,6,16685.0,United Kingdom
570231,2023-10-09,22091,Empire Tissue Box,10.65,6,16685.0,United Kingdom
570231,2023-10-09,22097,Swallow Square Tissue Box,10.65,6,16685.0,United Kingdom
570231,2023-10-09,22092,Blue Paisley Tissue Box,10.65,6,16685.0,United Kingdom
570231,2023-10-09,84077,World War 2 Gliders Asstd Designs,10.55,48,16685.0,United Kingdom
570231,2023-10-09,22372,Airline Bag Vintage World Champion,14.61,1,16685.0,United Kingdom
570231,2023-10-09,22371,Airline Bag Vintage Tokyo 78,14.61,1,16685.0,United Kingdom
570231,2023-10-09,22374,Airline Bag Vintage Jet Set Red,14.61,1,16685.0,United Kingdom
570231,2023-10-09,22109,Full English Breakfast Plate,14.09,2,16685.0,United Kingdom
570231,2023-10-09,23189,Set Of 12 Fork Candles,13.21,3,16685.0,United Kingdom
570231,2023-10-09,21790,Vintage Snap Cards,11.12,6,16685.0,United Kingdom
570231,2023-10-09,21791,Vintage Heads And Tails Card Game,11.53,3,16685.0,United Kingdom
570231,2023-10-09,22548,Heads And Tails Sporting Fun,11.53,3,16685.0,United Kingdom
570231,2023-10-09,22558,Clothes Pegs Retrospot Pack 24,11.94,3,16685.0,United Kingdom
570231,2023-10-09,22567,20 Dolly Pegs Retrospot,11.74,3,16685.0,United Kingdom
570231,2023-10-09,20914,Set/5 Red Retrospot Lid Glass Bowls,13.27,2,16685.0,United Kingdom
570231,2023-10-09,21929,Jumbo Bag Pink Vintage Paisley,6.19,1,16685.0,United Kingdom
570231,2023-10-09,21928,Jumbo Bag Scandinavian Blue Paisley,6.19,1,16685.0,United Kingdom
570232,2023-10-09,20970,Pink Floral Feltcraft Shoulder Bag,14.09,4,14040.0,United Kingdom
570232,2023-10-09,22273,Feltcraft Doll Molly,13.27,1,14040.0,United Kingdom
570232,2023-10-09,22750,Feltcraft Princess Lola Doll,14.09,6,14040.0,United Kingdom
570232,2023-10-09,22940,Feltcraft Christmas Fairy,14.61,5,14040.0,United Kingdom
570232,2023-10-09,22940,Feltcraft Christmas Fairy,14.61,2,14040.0,United Kingdom
570232,2023-10-09,22273,Feltcraft Doll Molly,13.27,2,14040.0,United Kingdom
570232,2023-10-09,20969,Red Floral Feltcraft Shoulder Bag,14.09,5,14040.0,United Kingdom
570232,2023-10-09,21481,Fawn Blue Hot Water Bottle,14.09,2,14040.0,United Kingdom
570232,2023-10-09,22568,Feltcraft Cushion Owl,14.09,2,14040.0,United Kingdom
570232,2023-10-09,21481,Fawn Blue Hot Water Bottle,14.09,2,14040.0,United Kingdom
570232,2023-10-09,22274,Feltcraft Doll Emily,13.27,2,14040.0,United Kingdom
570232,2023-10-09,23355,Hot Water Bottle Keep Calm,15.32,7,14040.0,United Kingdom
570232,2023-10-09,23356,Love Hot Water Bottle,16.35,4,14040.0,United Kingdom
570232,2023-10-09,84030E,English Rose Hot Water Bottle,14.61,2,14040.0,United Kingdom
570232,2023-10-09,23355,Hot Water Bottle Keep Calm,15.32,1,14040.0,United Kingdom
570232,2023-10-09,47590B,Pink Happy Birthday Bunting,15.84,1,14040.0,United Kingdom
570232,2023-10-09,22744,Make Your Own Monsoon Card Kit,13.27,2,14040.0,United Kingdom
570232,2023-10-09,22742,Make Your Own Playtime Card Kit,13.27,2,14040.0,United Kingdom
570232,2023-10-09,22533,Magic Drawing Slate Bake A Cake,10.68,11,14040.0,United Kingdom
570232,2023-10-09,22532,Magic Drawing Slate Leap Frog,10.68,10,14040.0,United Kingdom
570232,2023-10-09,20971,Pink Blue Felt Craft Trinket Box,11.53,12,14040.0,United Kingdom
570232,2023-10-09,84030E,English Rose Hot Water Bottle,14.61,2,14040.0,United Kingdom
570232,2023-10-09,84580,Mouse Toy With Pink T-Shirt,14.09,2,14040.0,United Kingdom
570232,2023-10-09,84581,Dog Toy With Pink Crochet Skirt,14.09,2,14040.0,United Kingdom
570232,2023-10-09,48185,Doormat Fairy Cake,18.71,3,14040.0,United Kingdom
570232,2023-10-09,22690,Doormat Home Sweet Home Blue,18.71,1,14040.0,United Kingdom
570232,2023-10-09,48129,Doormat Topiary,18.71,2,14040.0,United Kingdom
570232,2023-10-09,20685,Doormat Red Retrospot,18.71,3,14040.0,United Kingdom
570232,2023-10-09,23284,Doormat Keep Calm And Come In,18.71,4,14040.0,United Kingdom
570232,2023-10-09,20685,Doormat Red Retrospot,18.71,3,14040.0,United Kingdom
570232,2023-10-09,22692,Doormat Welcome To Our Home,18.71,2,14040.0,United Kingdom
570232,2023-10-09,23283,Doormat Vintage Leaf,18.71,3,14040.0,United Kingdom
570232,2023-10-09,48187,Doormat New England,18.71,3,14040.0,United Kingdom
570232,2023-10-09,22687,Doormat Christmas Village,18.71,1,14040.0,United Kingdom
570232,2023-10-09,21523,Doormat Fancy Font Home Sweet Home,18.71,1,14040.0,United Kingdom
570232,2023-10-09,21524,Doormat Spotty Home Sweet Home,18.71,2,14040.0,United Kingdom
570232,2023-10-09,23284,Doormat Keep Calm And Come In,18.71,2,14040.0,United Kingdom
570232,2023-10-09,22689,Doormat Merry Christmas Red,18.71,6,14040.0,United Kingdom
570232,2023-10-09,23130,Mistletoe Heart Wreath Green,14.5,6,14040.0,United Kingdom
570232,2023-10-09,22998,Travel Card Wallet Keep Calm,10.68,10,14040.0,United Kingdom
570232,2023-10-09,22720,Set Of 3 Cake Tins Pantry Design,15.32,2,14040.0,United Kingdom
570232,2023-10-09,23109,Pack Of Six Led Tea Lights,13.21,1,14040.0,United Kingdom
570232,2023-10-09,21974,Set Of 36 Paisley Flower Doilies,11.74,1,14040.0,United Kingdom
570232,2023-10-09,23337,Egg Frying Pan Mint,12.38,2,14040.0,United Kingdom
570232,2023-10-09,23336,Egg Frying Pan Pink,12.38,1,14040.0,United Kingdom
570232,2023-10-09,22411,Jumbo Shopper Vintage Red Paisley,12.38,1,14040.0,United Kingdom
570232,2023-10-09,22197,Popcorn Holder,11.12,12,14040.0,United Kingdom
570232,2023-10-09,23245,Set Of 3 Regency Cake Tins,15.32,4,14040.0,United Kingdom
570232,2023-10-09,22666,Recipe Box Pantry Yellow Design,13.27,6,14040.0,United Kingdom
570232,2023-10-09,22667,Recipe Box Retrospot,13.27,6,14040.0,United Kingdom
570232,2023-10-09,23424,Gingham Recipe Book Box,15.32,2,14040.0,United Kingdom
570232,2023-10-09,22663,Jumbo Bag Dolly Girl Design,6.19,1,14040.0,United Kingdom
570233,2023-10-09,22366,Doormat Airmail,18.71,1,16685.0,United Kingdom
570233,2023-10-09,21523,Doormat Fancy Font Home Sweet Home,18.71,1,16685.0,United Kingdom
570233,2023-10-09,21524,Doormat Spotty Home Sweet Home,18.71,2,16685.0,United Kingdom
570233,2023-10-09,48188,Doormat Welcome Puppies,18.71,1,16685.0,United Kingdom
570233,2023-10-09,48111,Doormat 3 Smiley Cats,18.71,1,16685.0,United Kingdom
570233,2023-10-09,22690,Doormat Home Sweet Home Blue,18.71,1,16685.0,United Kingdom
570233,2023-10-09,48187,Doormat New England,18.71,3,16685.0,United Kingdom
570234,2023-10-09,23330,Decorative Wicker Heart Medium,11.53,1,17790.0,United Kingdom
570234,2023-10-09,23333,Ivory Wicker Heart Medium,11.53,2,17790.0,United Kingdom
570234,2023-10-09,22694,Wicker Star,12.4,3,17790.0,United Kingdom
570234,2023-10-09,22470,Heart Of Wicker Large,13.27,5,17790.0,United Kingdom
570234,2023-10-09,23323,White Wicker Star,12.4,5,17790.0,United Kingdom
570234,2023-10-09,23322,Large White Heart Of Wicker,13.27,6,17790.0,United Kingdom
570234,2023-10-09,23330,Decorative Wicker Heart Medium,11.53,1,17790.0,United Kingdom
570234,2023-10-09,23333,Ivory Wicker Heart Medium,11.53,5,17790.0,United Kingdom
570234,2023-10-09,23330,Decorative Wicker Heart Medium,11.53,4,17790.0,United Kingdom
570234,2023-10-09,23329,Decorative Wicker Heart Large,11.94,6,17790.0,United Kingdom
570234,2023-10-09,22189,Cream Heart Card Holder,14.3,2,17790.0,United Kingdom
570234,2023-10-09,84879,Assorted Colour Bird Ornament,11.98,8,17790.0,United Kingdom
570234,2023-10-09,22795,Sweetheart Recipe Book Stand,17.17,1,17790.0,United Kingdom
570234,2023-10-09,72741,Grand Chocolatecandle,11.74,9,17790.0,United Kingdom
570234,2023-10-09,23067,Hanging Engraved Metal Heart,14.5,4,17790.0,United Kingdom
570234,2023-10-09,23393,Home Sweet Home Cushion Cover,14.09,4,17790.0,United Kingdom
570234,2023-10-09,23356,Love Hot Water Bottle,16.35,2,17790.0,United Kingdom
570234,2023-10-09,22835,Hot Water Bottle I Am So Poorly,15.32,2,17790.0,United Kingdom
570234,2023-10-09,23355,Hot Water Bottle Keep Calm,15.32,2,17790.0,United Kingdom
570234,2023-10-09,46000M,Polyester Filler Pad 45x45cm,11.84,4,17790.0,United Kingdom
570234,2023-10-09,84970S,Hanging Heart Zinc T-Light Holder,11.12,3,17790.0,United Kingdom
570234,2023-10-09,23399,Home Sweet Home Hanging Heart,11.12,5,17790.0,United Kingdom
570234,2023-10-09,23470,Card Holder Love Bird Large,16.66,2,17790.0,United Kingdom
570234,2023-10-09,47480,Hanging Photo Clip Rope Ladder,11.94,1,17790.0,United Kingdom
570234,2023-10-09,72800E,4 Ivory Dinner Candles Silver Flock,12.86,1,17790.0,United Kingdom
570234,2023-10-09,82484,Wood Black Board Ant White Finish,18.4,2,17790.0,United Kingdom
570234,2023-10-09,71038,White Hanging Beads Candle Holder,15.84,4,17790.0,United Kingdom
570234,2023-10-09,20754,Retrospot Red Washing Up Gloves,12.4,2,17790.0,United Kingdom
570234,2023-10-09,21814,Heart T-Light Holder,11.74,4,17790.0,United Kingdom
570234,2023-10-09,17003,Brocade Ring Purse,10.65,13,17790.0,United Kingdom
570234,2023-10-09,23469,Card Holder Love Bird Small,14.5,2,17790.0,United Kingdom
570234,2023-10-09,37500,Tea Time Teapot In Gift Box,15.32,2,17790.0,United Kingdom
570234,2023-10-09,23328,Set 6 School Milk Bottles In Crate,14.09,3,17790.0,United Kingdom
570234,2023-10-09,85111,Silver Glitter Flower Votive Holder,10.55,6,17790.0,United Kingdom
570235,2023-10-09,46000S,Polyester Filler Pad 40x40cm,11.74,2,13193.0,United Kingdom
570235,2023-10-09,23412,Heart Mirror Antique White,17.94,2,13193.0,United Kingdom
570235,2023-10-09,22775,Purple Drawerknob Acrylic Edwardian,11.53,1,13193.0,United Kingdom
570235,2023-10-09,22295,Heart Filigree Dove Large,11.94,1,13193.0,United Kingdom
570235,2023-10-09,21672,White Spot Red Ceramic Drawer Knob,11.74,2,13193.0,United Kingdom
570235,2023-10-09,22805,Blue Drawer Knob Acrylic Edwardian,11.53,1,13193.0,United Kingdom
570235,2023-10-09,22773,Green Drawer Knob Acrylic Edwardian,11.53,2,13193.0,United Kingdom
570235,2023-10-09,22575,Metal Merry Christmas Wreath,12.25,1,13193.0,United Kingdom
570235,2023-10-09,23402,Home Sweet Home 3 Peg Hanger,14.09,1,13193.0,United Kingdom
570235,2023-10-09,21034,Rex Cash+Carry Jumbo Shopper,11.22,2,13193.0,United Kingdom
570235,2023-10-09,23400,Shelf With 4 Hooks Home Sweet Home,16.66,1,13193.0,United Kingdom
570235,2023-10-09,22589,Cardholder Gingham Star,13.21,2,13193.0,United Kingdom
570235,2023-10-09,22575,Metal Merry Christmas Wreath,12.25,2,13193.0,United Kingdom
570235,2023-10-09,84836,Zinc Metal Heart Decoration,11.53,1,13193.0,United Kingdom
570235,2023-10-09,22775,Purple Drawerknob Acrylic Edwardian,11.53,1,13193.0,United Kingdom
570235,2023-10-09,23032,Drawer Knob Crackle Glaze Ivory,11.94,1,13193.0,United Kingdom
570235,2023-10-09,21671,Red Spot Ceramic Drawer Knob,11.74,1,13193.0,United Kingdom
570235,2023-10-09,22295,Heart Filigree Dove Large,11.94,1,13193.0,United Kingdom
570235,2023-10-09,23393,Home Sweet Home Cushion Cover,14.09,1,13193.0,United Kingdom
570235,2023-10-09,23396,Le Jardin Botanique Cushion Cover,14.09,1,13193.0,United Kingdom
570235,2023-10-09,22805,Blue Drawer Knob Acrylic Edwardian,11.53,1,13193.0,United Kingdom
570235,2023-10-09,21672,White Spot Red Ceramic Drawer Knob,11.74,1,13193.0,United Kingdom
570235,2023-10-09,23032,Drawer Knob Crackle Glaze Ivory,11.94,1,13193.0,United Kingdom
570235,2023-10-09,23028,Drawer Knob Crackle Glaze Blue,11.94,2,13193.0,United Kingdom
570235,2023-10-09,84836,Zinc Metal Heart Decoration,11.53,2,13193.0,United Kingdom
570235,2023-10-09,22130,Party Cone Christmas Decoration,11.12,12,13193.0,United Kingdom
570235,2023-10-09,22507,Memo Board Retrospot Design,15.32,2,13193.0,United Kingdom
570235,2023-10-09,22505,Memo Board Cottage Design,15.32,1,13193.0,United Kingdom
570236,2023-10-09,22556,Plasters In Tin Circus Parade,11.94,1,17236.0,United Kingdom
570236,2023-10-09,23514,Embroidered Ribbon Reel Sally,12.38,1,17236.0,United Kingdom
570236,2023-10-09,23515,Embroidered Ribbon Reel Daisy,12.38,1,17236.0,United Kingdom
570236,2023-10-09,47593B,Scottie Dogs Baby Bib,10.65,1,17236.0,United Kingdom
570236,2023-10-09,22685,French Blue Metal Door Sign 0,11.53,1,17236.0,United Kingdom
570236,2023-10-09,22678,French Blue Metal Door Sign 3,11.53,1,17236.0,United Kingdom
570236,2023-10-09,21064,Boom Box Speaker Boys,16.35,1,17236.0,United Kingdom
570236,2023-10-09,23169,Classic Glass Cookie Jar,14.5,1,17236.0,United Kingdom
570236,2023-10-09,22417,Pack Of 60 Spaceboy Cake Cases,10.81,1,17236.0,United Kingdom
570236,2023-10-09,23309,Set Of 60 I Love London Cake Cases,10.81,1,17236.0,United Kingdom
570236,2023-10-09,23349,Roll Wrap Vintage Christmas,11.53,1,17236.0,United Kingdom
570236,2023-10-09,22845,Vintage Cream Cat Food Container,16.76,1,17236.0,United Kingdom
570236,2023-10-09,23353,6 Gift Tags Vintage Christmas,11.1,2,17236.0,United Kingdom
570236,2023-10-09,22993,Set Of 4 Pantry Jelly Moulds,11.53,1,17236.0,United Kingdom
570236,2023-10-09,23350,Roll Wrap Vintage Spot,11.53,2,17236.0,United Kingdom
570236,2023-10-09,22139,Retrospot Tea Set Ceramic 11 Pc,15.32,1,17236.0,United Kingdom
570236,2023-10-09,20682,Red Retrospot Childrens Umbrella,13.58,1,17236.0,United Kingdom
570236,2023-10-09,23348,Childrens Toy Cooking Utensil Set,12.38,1,17236.0,United Kingdom
570236,2023-10-09,23208,Lunch Bag Vintage Leaf Design,5.97,1,17236.0,United Kingdom
570237,2023-10-09,22835,Hot Water Bottle I Am So Poorly,15.32,2,13212.0,United Kingdom
570237,2023-10-09,21625,Vintage Union Jack Apron,17.37,2,13212.0,United Kingdom
570237,2023-10-09,22173,Metal 4 Hook Hanger French Chateau,13.62,1,13212.0,United Kingdom
