TransactionNo,Date,ProductNo,ProductName,Price,Quantity,CustomerNo,Country
569136,2023-09-30,22319,Hairclips Forties Fabric Assorted,10.92,12,15834.0,United Kingdom
569136,2023-09-30,84077,World War 2 Gliders Asstd Designs,10.55,48,15834.0,United Kingdom
569136,2023-09-30,85199S,Small Hanging Ivory/Red Wood Bird,10.68,10,15834.0,United Kingdom
569136,2023-09-30,22295,Heart Filigree Dove Large,11.94,6,15834.0,United Kingdom
569136,2023-09-30,22161,Heart Decoration Rustic Hanging,10.44,10,15834.0,United Kingdom
569136,2023-09-30,22375,Airline Bag Vintage Jet Set Brown,14.61,1,15834.0,United Kingdom
569136,2023-09-30,22371,Airline Bag Vintage Tokyo 78,14.61,2,15834.0,United Kingdom
569136,2023-09-30,22748,Poppy's Playhouse Kitchen,12.4,2,15834.0,United Kingdom
569136,2023-09-30,22745,Poppy's Playhouse Bedroom,12.4,2,15834.0,United Kingdom
569136,2023-09-30,22746,Poppy's Playhouse Livingroom,12.4,2,15834.0,United Kingdom
569136,2023-09-30,84012,Magic Sheep Wool Growing From Paper,11.12,4,15834.0,United Kingdom
569136,2023-09-30,23159,Set Of 5 Pancake Day Magnets,12.38,2,15834.0,United Kingdom
569136,2023-09-30,23154,Set Of 4 Jam Jar Magnets,12.38,2,15834.0,United Kingdom
569136,2023-09-30,23158,Set Of 5 Lucky Cat Magnets,12.38,2,15834.0,United Kingdom
569136,2023-09-30,23156,Set Of 5 Mini Grocery Magnets,12.38,2,15834.0,United Kingdom
569136,2023-09-30,22621,Traditional Knitting Nancy,11.94,1,15834.0,United Kingdom
569136,2023-09-30,21891,Traditional Wooden Skipping Rope,11.74,1,15834.0,United Kingdom
569136,2023-09-30,22620,4 Traditional Spinning Tops,11.74,1,15834.0,United Kingdom
569136,2023-09-30,85231G,Orange Scented Set/9 T-Lights,11.12,4,15834.0,United Kingdom
569136,2023-09-30,85231B,Cinammon Set Of 9 T-Lights,11.12,5,15834.0,United Kingdom
569136,2023-09-30,22097,Swallow Square Tissue Box,10.65,3,15834.0,United Kingdom
569136,2023-09-30,22093,Motoring Tissue Box,10.65,2,15834.0,United Kingdom
569136,2023-09-30,22091,Empire Tissue Box,10.65,2,15834.0,United Kingdom
569136,2023-09-30,22099,Caravan Square Tissue Box,10.65,4,15834.0,United Kingdom
569136,2023-09-30,22884,Number Tile Vintage Font 5,12.25,1,15834.0,United Kingdom
569136,2023-09-30,22880,Number Tile Vintage Font 1,12.25,1,15834.0,United Kingdom
569136,2023-09-30,23241,Treasure Tin Gymkhana Design,12.38,1,15834.0,United Kingdom
569136,2023-09-30,23242,Treasure Tin Buffalo Bill,12.38,2,15834.0,United Kingdom
569136,2023-09-30,22792,Fluted Antique Candle Holder,11.12,6,15834.0,United Kingdom
569136,2023-09-30,79066K,Retro Mod Tray,11.12,2,15834.0,United Kingdom
569136,2023-09-30,23395,Belle Jardiniere Cushion Cover,14.09,3,15834.0,United Kingdom
569136,2023-09-30,23394,Poste France Cushion Cover,14.09,2,15834.0,United Kingdom
569136,2023-09-30,22468,Babushka Lights String Of 10,17.17,1,15834.0,United Kingdom
569136,2023-09-30,23399,Home Sweet Home Hanging Heart,11.12,4,15834.0,United Kingdom
569136,2023-09-30,84581,Dog Toy With Pink Crochet Skirt,14.09,1,15834.0,United Kingdom
569136,2023-09-30,22779,Wooden Owls Light Garland,14.61,1,15834.0,United Kingdom
569136,2023-09-30,23014,Glass Apothecary Bottle Elixir,14.3,1,15834.0,United Kingdom
569136,2023-09-30,23012,Glass Apothecary Bottle Perfume,14.3,1,15834.0,United Kingdom
569136,2023-09-30,23013,Glass Apothecary Bottle Tonic,14.3,1,15834.0,United Kingdom
569136,2023-09-30,22595,Gingham Heart Decoration,11.12,12,15834.0,United Kingdom
569136,2023-09-30,23229,Vintage Donkey Tail Game,14.09,2,15834.0,United Kingdom
569136,2023-09-30,23184,Bull Dog Bottle Opener,15.32,1,15834.0,United Kingdom
569136,2023-09-30,84945,Multi Colour Silver T-Light Holder,11.12,12,15834.0,United Kingdom
569136,2023-09-30,23035,Drawer Knob Ceramic Ivory,11.74,6,15834.0,United Kingdom
569136,2023-09-30,22893,Mini Cake Stand T-Light Holder,10.68,12,15834.0,United Kingdom
569136,2023-09-30,22358,Kings Choice Tea Caddy,13.27,1,15834.0,United Kingdom
569136,2023-09-30,84510A,Set Of 4 English Rose Coasters,11.53,3,15834.0,United Kingdom
569136,2023-09-30,70007,Hi Tec Alpine Hand Warmer,11.94,2,15834.0,United Kingdom
569136,2023-09-30,70006,Love Heart Pocket Warmer,11.94,2,15834.0,United Kingdom
569136,2023-09-30,79191C,Retro Plastic Elephant Tray,11.12,2,15834.0,United Kingdom
569136,2023-09-30,79190B,Retro Plastic Polka Tray,11.12,2,15834.0,United Kingdom
569136,2023-09-30,84509A,Set Of 4 English Rose Placemats,14.09,2,15834.0,United Kingdom
569136,2023-09-30,15058A,Blue Polkadot Garden Parasol,18.4,1,15834.0,United Kingdom
569136,2023-09-30,23051,Recycled Acapulco Mat Blue,18.71,1,15834.0,United Kingdom
569136,2023-09-30,22943,Christmas Lights 10 Vintage Baubles,15.32,2,15834.0,United Kingdom
569137,2023-09-30,21035,Set/2 Red Retrospot Tea Towels,16.66,1,16137.0,United Kingdom
569137,2023-09-30,21080,Set/20 Red Retrospot Paper Napkins,12.77,3,16137.0,United Kingdom
569137,2023-09-30,21116,Owl Doorstop,18.75,3,16137.0,United Kingdom
569137,2023-09-30,21169,You're Confusing Me Metal Sign,14.48,1,16137.0,United Kingdom
569137,2023-09-30,21174,Pottering In The Shed Metal Sign,14.48,1,16137.0,United Kingdom
569137,2023-09-30,21181,Please One Person Metal Sign,14.48,3,16137.0,United Kingdom
569137,2023-09-30,21218,Red Spotty Biscuit Tin,18.75,4,16137.0,United Kingdom
569137,2023-09-30,21328,Balloons Writing Set,13.62,3,16137.0,United Kingdom
569137,2023-09-30,21411,Gingham Heart Doorstop Red,18.75,1,16137.0,United Kingdom
569137,2023-09-30,21424,Woodland Storage Box Large,17.05,3,16137.0,United Kingdom
569137,2023-09-30,21426,Woodland Storage Box Small,15.33,1,16137.0,United Kingdom
569137,2023-09-30,21430,Set/3 Red Gingham Rose Storage Box,17.9,2,16137.0,United Kingdom
569137,2023-09-30,21494,Rotating Leaves T-Light Holder,16.18,10,16137.0,United Kingdom
569137,2023-09-30,21558,Skull Lunch Box With Cutlery,15.33,1,16137.0,United Kingdom
569137,2023-09-30,21559,Strawberry Lunch Box With Cutlery,15.33,3,16137.0,United Kingdom
569137,2023-09-30,21670,Blue Spot Ceramic Drawer Knob,13.62,8,16137.0,United Kingdom
569137,2023-09-30,21673,White Spot Blue Ceramic Drawer Knob,12.77,8,16137.0,United Kingdom
569137,2023-09-30,21713,Citronella Candle Flowerpot,14.48,1,16137.0,United Kingdom
569137,2023-09-30,21731,Red Toadstool Led Night Light,14.48,7,16137.0,United Kingdom
569137,2023-09-30,21802,Christmas Tree Heart Decoration,11.1,6,16137.0,United Kingdom
569137,2023-09-30,21876,Pottering Mug,13.62,1,16137.0,United Kingdom
569137,2023-09-30,21931,Jumbo Storage Bag Suki,14.48,12,16137.0,United Kingdom
569137,2023-09-30,21934,Skull Shoulder Bag,13.62,1,16137.0,United Kingdom
569137,2023-09-30,21935,Suki Shoulder Bag,14.48,1,16137.0,United Kingdom
569137,2023-09-30,21949,Set Of 6 Strawberry Chopsticks,12.77,1,16137.0,United Kingdom
569137,2023-09-30,21974,Set Of 36 Paisley Flower Doilies,14.09,2,16137.0,United Kingdom
569137,2023-09-30,21989,Pack Of 20 Skull Paper Napkins,11.92,2,16137.0,United Kingdom
569137,2023-09-30,22069,Brown Pirate Treasure Chest,14.48,2,16137.0,United Kingdom
569137,2023-09-30,22074,6 Ribbons Shimmering Pinks,12.77,2,16137.0,United Kingdom
569137,2023-09-30,22077,6 Ribbons Rustic Charm,14.48,1,16137.0,United Kingdom
569137,2023-09-30,22083,Paper Chain Kit Retrospot,17.05,1,16137.0,United Kingdom
569137,2023-09-30,22090,Paper Bunting Retrospot,17.05,1,16137.0,United Kingdom
569137,2023-09-30,22131,Food Container Set 3 Love Heart,14.48,3,16137.0,United Kingdom
569137,2023-09-30,22174,Photo Cube,14.48,10,16137.0,United Kingdom
569137,2023-09-30,22195,Large Heart Measuring Spoons,13.62,1,16137.0,United Kingdom
569137,2023-09-30,22196,Small Heart Measuring Spoons,11.92,2,16137.0,United Kingdom
569137,2023-09-30,22219,Lovebird Hanging Decoration White,11.92,1,16137.0,United Kingdom
569137,2023-09-30,22271,Feltcraft Doll Rosie,16.18,2,16137.0,United Kingdom
569137,2023-09-30,22308,Tea Cosy Blue Stripe,15.33,1,16137.0,United Kingdom
569137,2023-09-30,22328,Round Snack Boxes Set Of 4 Fruits,14.48,3,16137.0,United Kingdom
569137,2023-09-30,22352,Lunch Box With Cutlery Retrospot,15.33,3,16137.0,United Kingdom
569137,2023-09-30,22358,Kings Choice Tea Caddy,16.18,2,16137.0,United Kingdom
569137,2023-09-30,22375,Airline Bag Vintage Jet Set Brown,18.75,1,16137.0,United Kingdom
569137,2023-09-30,22379,Recycling Bag Retrospot,15.33,2,16137.0,United Kingdom
569137,2023-09-30,22381,Toy Tidy Pink Polkadot,15.33,1,16137.0,United Kingdom
569137,2023-09-30,22411,Jumbo Shopper Vintage Red Paisley,14.48,14,16137.0,United Kingdom
569137,2023-09-30,22412,Metal Sign Neighbourhood Witch,14.48,1,16137.0,United Kingdom
569137,2023-09-30,22469,Heart Of Wicker Small,14.48,2,16137.0,United Kingdom
569137,2023-09-30,22470,Heart Of Wicker Large,16.18,1,16137.0,United Kingdom
569137,2023-09-30,22629,Spaceboy Lunch Box,12.77,1,16137.0,United Kingdom
569137,2023-09-30,22630,Dolly Girl Lunch Box,12.77,1,16137.0,United Kingdom
569137,2023-09-30,22637,Piggy Bank Retrospot,16.18,2,16137.0,United Kingdom
569137,2023-09-30,22659,Lunch Box I Love London,12.77,2,16137.0,United Kingdom
569137,2023-09-30,22666,Recipe Box Pantry Yellow Design,16.18,1,16137.0,United Kingdom
569137,2023-09-30,22668,Pink Baby Bunting,16.18,1,16137.0,United Kingdom
569137,2023-09-30,22670,French Wc Sign Blue Metal,12.77,1,16137.0,United Kingdom
569137,2023-09-30,22672,French Bathroom Sign Blue Metal,13.62,1,16137.0,United Kingdom
569137,2023-09-30,22676,French Blue Metal Door Sign 1,12.77,1,16137.0,United Kingdom
569137,2023-09-30,22677,French Blue Metal Door Sign 2,12.77,1,16137.0,United Kingdom
569137,2023-09-30,22686,French Blue Metal Door Sign No,12.77,1,16137.0,United Kingdom
569137,2023-09-30,22695,Wicker Wreath Small,13.62,1,16137.0,United Kingdom
569137,2023-09-30,22696,Wicker Wreath Large,14.48,1,16137.0,United Kingdom
569137,2023-09-30,22697,Green Regency Teacup And Saucer,16.18,5,16137.0,United Kingdom
569137,2023-09-30,22698,Pink Regency Teacup And Saucer,16.18,4,16137.0,United Kingdom
569137,2023-09-30,22699,Roses Regency Teacup And Saucer,16.18,4,16137.0,United Kingdom
569137,2023-09-30,22773,Green Drawer Knob Acrylic Edwardian,13.62,1,16137.0,United Kingdom
569137,2023-09-30,22812,Pack 3 Boxes Christmas Panettone,15.33,1,16137.0,United Kingdom
569137,2023-09-30,22900,Set 2 Tea Towels I Love London,14.48,2,16137.0,United Kingdom
569137,2023-09-30,22952,60 Cake Cases Vintage Christmas,12.38,1,16137.0,United Kingdom
569137,2023-09-30,22961,Jam Making Set Printed,13.62,1,16137.0,United Kingdom
569137,2023-09-30,22964,3 Piece Spaceboy Cookie Cutter Set,14.48,3,16137.0,United Kingdom
569137,2023-09-30,23084,Rabbit Night Light,14.48,6,16137.0,United Kingdom
569137,2023-09-30,23170,Regency Tea Plate Roses,13.62,4,16137.0,United Kingdom
569137,2023-09-30,23171,Regency Tea Plate Green,13.62,4,16137.0,United Kingdom
569137,2023-09-30,23172,Regency Tea Plate Pink,13.62,4,16137.0,United Kingdom
569137,2023-09-30,23174,Regency Sugar Bowl Green,18.75,3,16137.0,United Kingdom
569137,2023-09-30,23182,Toilet Sign Occupied Or Vacant,12.81,5,16137.0,United Kingdom
569137,2023-09-30,23229,Vintage Donkey Tail Game,17.9,1,16137.0,United Kingdom
569137,2023-09-30,23301,Gardeners Kneeling Pad Keep Calm,13.62,3,16137.0,United Kingdom
569137,2023-09-30,23354,6 Gift Tags 50'S Christmas,11.92,1,16137.0,United Kingdom
569137,2023-09-30,23403,Letter Holder Home Sweet Home,17.9,3,16137.0,United Kingdom
569137,2023-09-30,37340,Multicolour Spring Flower Mug,11.66,6,16137.0,United Kingdom
569137,2023-09-30,72349B,Set/6 Purple Butterfly T-Lights,14.48,1,16137.0,United Kingdom
569137,2023-09-30,72801C,4 Rose Pink Dinner Candles,12.77,2,16137.0,United Kingdom
569137,2023-09-30,82482,Wooden Picture Frame White Finish,15.33,2,16137.0,United Kingdom
569137,2023-09-30,82494L,Wooden Frame Antique White,18.75,2,16137.0,United Kingdom
569137,2023-09-30,21171,Bathroom Metal Sign,11.53,1,16137.0,United Kingdom
569137,2023-09-30,84029G,Knitted Union Flag Hot Water Bottle,18.75,7,16137.0,United Kingdom
569137,2023-09-30,84032A,Charlie+Lola Pink Hot Water Bottle,16.18,2,16137.0,United Kingdom
569137,2023-09-30,84375,Set Of 20 Kids Cookie Cutters,14.48,1,16137.0,United Kingdom
569137,2023-09-30,84509A,Set Of 4 English Rose Placemats,17.9,1,16137.0,United Kingdom
569137,2023-09-30,84988,Set Of 72 Pink Heart Paper Doilies,14.09,1,16137.0,United Kingdom
569137,2023-09-30,84997A,Childrens Cutlery Polkadot Green,18.75,1,16137.0,United Kingdom
569137,2023-09-30,85039A,Set/4 Red Mini Rose Candle In Bowl,13.62,1,16137.0,United Kingdom
569137,2023-09-30,85040A,S/4 Pink Flower Candles In Bowl,13.62,2,16137.0,United Kingdom
569137,2023-09-30,85123A,Cream Hanging Heart T-Light Holder,17.05,2,16137.0,United Kingdom
569137,2023-09-30,85150,Ladies & Gentlemen Metal Sign,15.33,1,16137.0,United Kingdom
569137,2023-09-30,20711,Jumbo Bag Toys,7.24,4,16137.0,United Kingdom
569137,2023-09-30,20712,Jumbo Bag Woodland Animals,7.24,13,16137.0,United Kingdom
569137,2023-09-30,20713,Jumbo Bag Owls,7.24,9,16137.0,United Kingdom
569137,2023-09-30,21928,Jumbo Bag Scandinavian Blue Paisley,7.24,3,16137.0,United Kingdom
569137,2023-09-30,21929,Jumbo Bag Pink Vintage Paisley,7.24,5,16137.0,United Kingdom
569137,2023-09-30,22385,Jumbo Bag Spaceboy Design,7.24,1,16137.0,United Kingdom
569137,2023-09-30,22386,Jumbo Bag Pink Polkadot,7.24,7,16137.0,United Kingdom
569137,2023-09-30,22663,Jumbo Bag Dolly Girl Design,7.24,3,16137.0,United Kingdom
569137,2023-09-30,23199,Jumbo Bag Apples,7.24,8,16137.0,United Kingdom
569137,2023-09-30,23201,Jumbo Bag Alphabet,7.24,5,16137.0,United Kingdom
569137,2023-09-30,85099B,Jumbo Bag Red Retrospot,7.24,14,16137.0,United Kingdom
569137,2023-09-30,85099C,Jumbo Bag Baroque Black White,7.24,6,16137.0,United Kingdom
569137,2023-09-30,20726,Lunch Bag Woodland,7.67,5,16137.0,United Kingdom
569137,2023-09-30,22384,Lunch Bag Pink Polkadot,7.67,3,16137.0,United Kingdom
569139,2023-09-30,84212,"Assorted Flower Colour ""Leis""",10.92,24,16404.0,United Kingdom
569139,2023-09-30,22469,Heart Of Wicker Small,11.94,12,16404.0,United Kingdom
569139,2023-09-30,21232,Strawberry Ceramic Trinket Pot,11.53,12,16404.0,United Kingdom
569139,2023-09-30,85123A,Cream Hanging Heart T-Light Holder,13.27,6,16404.0,United Kingdom
569139,2023-09-30,84946,Antique Silver T-Light Glass,11.53,12,16404.0,United Kingdom
569139,2023-09-30,23371,Set 36 Colour Pencils Spaceboy,11.53,16,16404.0,United Kingdom
569139,2023-09-30,23372,Set 36 Colour Pencils Dolly Girl,11.53,16,16404.0,United Kingdom
569139,2023-09-30,23404,Home Sweet Home Blackboard,15.32,6,16404.0,United Kingdom
569139,2023-09-30,23401,Rustic Mirror With Lace Heart,16.66,2,16404.0,United Kingdom
569139,2023-09-30,23403,Letter Holder Home Sweet Home,14.09,4,16404.0,United Kingdom
569139,2023-09-30,23503,Playing Cards Keep Calm & Carry On,11.53,12,16404.0,United Kingdom
569139,2023-09-30,21485,Retrospot Heart Hot Water Bottle,15.32,3,16404.0,United Kingdom
569139,2023-09-30,22112,Chocolate Hot Water Bottle,15.32,3,16404.0,United Kingdom
569139,2023-09-30,22114,Hot Water Bottle Tea And Sympathy,14.61,4,16404.0,United Kingdom
569139,2023-09-30,22111,Scottie Dog Hot Water Bottle,15.32,3,16404.0,United Kingdom
569139,2023-09-30,22835,Hot Water Bottle I Am So Poorly,15.32,4,16404.0,United Kingdom
569139,2023-09-30,23355,Hot Water Bottle Keep Calm,15.32,4,16404.0,United Kingdom
569139,2023-09-30,23283,Doormat Vintage Leaf,18.71,2,16404.0,United Kingdom
569140,2023-09-30,22633,Hand Warmer Union Jack,12.4,12,14503.0,United Kingdom
569140,2023-09-30,23439,Hand Warmer Red Love Heart,12.4,12,14503.0,United Kingdom
569140,2023-09-30,21830,Assorted Creepy Crawlies,10.68,24,14503.0,United Kingdom
569140,2023-09-30,21833,Camouflage Led Torch,11.98,12,14503.0,United Kingdom
569140,2023-09-30,16016,Large Chinese Style Scissor,11.12,10,14503.0,United Kingdom
569140,2023-09-30,23241,Treasure Tin Gymkhana Design,12.38,6,14503.0,United Kingdom
569140,2023-09-30,23242,Treasure Tin Buffalo Bill,12.38,6,14503.0,United Kingdom
569140,2023-09-30,20978,36 Pencils Tube Skulls,11.53,16,14503.0,United Kingdom
569140,2023-09-30,20979,36 Pencils Tube Red Retrospot,11.53,16,14503.0,United Kingdom
569140,2023-09-30,20982,12 Pencils Tall Tube Skulls,11.12,12,14503.0,United Kingdom
569140,2023-09-30,22489,Pack Of 12 Traditional Crayons,10.68,24,14503.0,United Kingdom
569140,2023-09-30,20983,12 Pencils Tall Tube Red Retrospot,11.12,12,14503.0,United Kingdom
569140,2023-09-30,22535,Magic Drawing Slate Bunnies,10.68,24,14503.0,United Kingdom
569140,2023-09-30,22534,Magic Drawing Slate Spaceboy,10.68,24,14503.0,United Kingdom
569140,2023-09-30,22138,Baking Set 9 Piece Retrospot,15.32,6,14503.0,United Kingdom
569140,2023-09-30,23348,Childrens Toy Cooking Utensil Set,12.38,6,14503.0,United Kingdom
569140,2023-09-30,22139,Retrospot Tea Set Ceramic 11 Pc,15.32,3,14503.0,United Kingdom
569140,2023-09-30,23080,Red Metal Box Top Secret,18.71,2,14503.0,United Kingdom
569140,2023-09-30,23494,Vintage Doily Deluxe Sewing Kit,16.35,3,14503.0,United Kingdom
569140,2023-09-30,23393,Home Sweet Home Cushion Cover,14.09,4,14503.0,United Kingdom
569140,2023-09-30,23507,Mini Playing Cards Buffalo Bill,10.68,20,14503.0,United Kingdom
569140,2023-09-30,23510,Mini Playing Cards Gymkhana,10.68,20,14503.0,United Kingdom
569140,2023-09-30,23356,Love Hot Water Bottle,16.35,3,14503.0,United Kingdom
569140,2023-09-30,21485,Retrospot Heart Hot Water Bottle,15.32,3,14503.0,United Kingdom
569140,2023-09-30,23090,Vintage Glass T-Light Holder,11.1,24,14503.0,United Kingdom
569140,2023-09-30,84946,Antique Silver T-Light Glass,11.53,12,14503.0,United Kingdom
569140,2023-09-30,22792,Fluted Antique Candle Holder,11.12,12,14503.0,United Kingdom
569140,2023-09-30,22578,Wooden Star Christmas Scandinavian,10.55,24,14503.0,United Kingdom
569140,2023-09-30,22573,Star Wooden Christmas Decoration,11.12,12,14503.0,United Kingdom
569140,2023-09-30,22595,Gingham Heart Decoration,11.12,12,14503.0,United Kingdom
569140,2023-09-30,22594,Christmas Gingham Tree,11.12,12,14503.0,United Kingdom
569140,2023-09-30,85199S,Small Hanging Ivory/Red Wood Bird,10.68,24,14503.0,United Kingdom
569140,2023-09-30,22086,Paper Chain Kit 50'S Christmas,13.27,6,14503.0,United Kingdom
569140,2023-09-30,22910,Paper Chain Kit Vintage Christmas,13.27,6,14503.0,United Kingdom
569140,2023-09-30,47504K,English Rose Garden Secateurs,11.06,12,14503.0,United Kingdom
569140,2023-09-30,22728,Alarm Clock Bakelike Pink,14.09,4,14503.0,United Kingdom
569140,2023-09-30,22726,Alarm Clock Bakelike Green,14.09,4,14503.0,United Kingdom
569140,2023-09-30,22727,Alarm Clock Bakelike Red,14.09,4,14503.0,United Kingdom
569140,2023-09-30,22197,Popcorn Holder,11.12,48,14503.0,United Kingdom
569140,2023-09-30,79191C,Retro Plastic Elephant Tray,11.12,12,14503.0,United Kingdom
569140,2023-09-30,21212,Pack Of 72 Retrospot Cake Cases,10.81,24,14503.0,United Kingdom
569140,2023-09-30,21080,Set/20 Red Retrospot Paper Napkins,11.12,12,14503.0,United Kingdom
569140,2023-09-30,22553,Plasters In Tin Skulls,11.94,12,14503.0,United Kingdom
569141,2023-09-30,23408,Photo Frame Linen And Lace Small,12.38,6,13021.0,United Kingdom
569141,2023-09-30,23421,Pantry Hook Spatula,12.38,12,13021.0,United Kingdom
569141,2023-09-30,23423,Pantry 3 Hook Rolling Pin Hanger,14.09,12,13021.0,United Kingdom
569141,2023-09-30,23426,Metal Sign Drop Your Pants,13.21,18,13021.0,United Kingdom
569141,2023-09-30,23494,Vintage Doily Deluxe Sewing Kit,16.35,3,13021.0,United Kingdom
569141,2023-09-30,20972,Pink Cream Felt Craft Trinket Box,11.53,12,13021.0,United Kingdom
569141,2023-09-30,22568,Feltcraft Cushion Owl,14.09,4,13021.0,United Kingdom
569141,2023-09-30,22865,Hand Warmer Owl Design,12.4,36,13021.0,United Kingdom
569141,2023-09-30,22867,Hand Warmer Bird Design,12.4,12,13021.0,United Kingdom
569141,2023-09-30,22311,Office Mug Warmer Black+Silver,13.27,6,13021.0,United Kingdom
569141,2023-09-30,22835,Hot Water Bottle I Am So Poorly,15.32,8,13021.0,United Kingdom
569141,2023-09-30,23355,Hot Water Bottle Keep Calm,15.32,4,13021.0,United Kingdom
569141,2023-09-30,22411,Jumbo Shopper Vintage Red Paisley,12.38,10,13021.0,United Kingdom
569141,2023-09-30,85099B,Jumbo Bag Red Retrospot,6.19,10,13021.0,United Kingdom
569142,2023-09-30,21181,Please One Person Metal Sign,12.4,12,13021.0,United Kingdom
569143,2023-09-30,21499,Blue Polkadot Wrap,10.68,25,15867.0,United Kingdom
569143,2023-09-30,22047,Empire Gift Wrap,10.68,25,15867.0,United Kingdom
569143,2023-09-30,48184,Doormat English Rose,18.71,3,15867.0,United Kingdom
569143,2023-09-30,21523,Doormat Fancy Font Home Sweet Home,18.71,2,15867.0,United Kingdom
569143,2023-09-30,48173C,Doormat Black Flock,18.71,3,15867.0,United Kingdom
569143,2023-09-30,48116,Doormat Multicolour Stripe,18.71,3,15867.0,United Kingdom
569143,2023-09-30,48194,Doormat Hearts,18.71,2,15867.0,United Kingdom
569143,2023-09-30,48138,Doormat Union Flag,18.71,3,15867.0,United Kingdom
569143,2023-09-30,23283,Doormat Vintage Leaf,18.71,3,15867.0,United Kingdom
569143,2023-09-30,23284,Doormat Keep Calm And Come In,18.71,3,15867.0,United Kingdom
569143,2023-09-30,20685,Doormat Red Retrospot,18.71,2,15867.0,United Kingdom
569143,2023-09-30,48185,Doormat Fairy Cake,18.71,2,15867.0,United Kingdom
569143,2023-09-30,22179,Set 10 Night Owl Lights,17.17,1,15867.0,United Kingdom
569143,2023-09-30,23116,Vegetable Garden Chopping Board,15.32,1,15867.0,United Kingdom
569143,2023-09-30,23117,Poppy Fields Chopping Board,15.32,1,15867.0,United Kingdom
569143,2023-09-30,23114,Vintage Leaf Chopping Board,15.32,1,15867.0,United Kingdom
569143,2023-09-30,23115,Red Apples Chopping Board,15.32,1,15867.0,United Kingdom
569143,2023-09-30,23169,Classic Glass Cookie Jar,14.5,3,15867.0,United Kingdom
569143,2023-09-30,21731,Red Toadstool Led Night Light,11.94,2,15867.0,United Kingdom
569143,2023-09-30,23158,Set Of 5 Lucky Cat Magnets,12.38,12,15867.0,United Kingdom
569143,2023-09-30,23156,Set Of 5 Mini Grocery Magnets,12.38,2,15867.0,United Kingdom
569143,2023-09-30,23318,Box Of 6 Mini Vintage Crackers,12.8,3,15867.0,United Kingdom
569143,2023-09-30,23319,Box Of 6 Mini 50'S Crackers,12.8,3,15867.0,United Kingdom
569143,2023-09-30,23438,Red Spot Gift Bag Large,5.77,5,15867.0,United Kingdom
569143,2023-09-30,23374,Red Spot Paper Gift Bag,5.55,5,15867.0,United Kingdom
569144,2023-09-30,22966,Gingerbread Man Cookie Cutter,11.53,9,17227.0,United Kingdom
569144,2023-09-30,84380,Set Of 3 Butterfly Cookie Cutters,11.74,12,17227.0,United Kingdom
569144,2023-09-30,23308,Set Of 60 Vintage Leaf Cake Cases,10.81,1,17227.0,United Kingdom
569144,2023-09-30,23309,Set Of 60 I Love London Cake Cases,10.81,23,17227.0,United Kingdom
569144,2023-09-30,21088,Set/6 Fruit Salad Paper Cups,10.44,5,17227.0,United Kingdom
569144,2023-09-30,21096,Set/6 Fruit Salad Paper Plates,10.65,5,17227.0,United Kingdom
569144,2023-09-30,22908,Pack Of 20 Napkins Red Apples,11.12,3,17227.0,United Kingdom
569144,2023-09-30,84375,Set Of 20 Kids Cookie Cutters,12.4,12,17227.0,United Kingdom
569144,2023-09-30,22328,Round Snack Boxes Set Of 4 Fruits,13.27,5,17227.0,United Kingdom
569144,2023-09-30,84380,Set Of 3 Butterfly Cookie Cutters,11.74,36,17227.0,United Kingdom
569145,2023-09-30,23119,Pack Of 6 Large Fruit Straws,10.89,12,18008.0,United Kingdom
569145,2023-09-30,23121,Pack Of 6 Cocktail Parasol Straws,10.68,2,18008.0,United Kingdom
569147,2023-09-30,22548,Heads And Tails Sporting Fun,11.53,12,12842.0,United Kingdom
569147,2023-09-30,21915,Red Harmonica In Box,11.53,12,12842.0,United Kingdom
569147,2023-09-30,22549,Picture Dominoes,11.74,12,12842.0,United Kingdom
569147,2023-09-30,22991,Giraffe Wooden Ruler,12.25,24,12842.0,United Kingdom
569147,2023-09-30,23503,Playing Cards Keep Calm & Carry On,11.53,24,12842.0,United Kingdom
569147,2023-09-30,23380,Pack Of 12 Vintage Doily Tissues,10.65,24,12842.0,United Kingdom
569147,2023-09-30,23293,Set Of 12 Fairy Cake Baking Cases,11.1,8,12842.0,United Kingdom
569147,2023-09-30,23360,Set 8 Candles Vintage Doily,12.25,12,12842.0,United Kingdom
569147,2023-09-30,23359,Set Of 12 T-Lights Vintage Doily,12.25,12,12842.0,United Kingdom
569147,2023-09-30,23189,Set Of 12 Fork Candles,13.21,6,12842.0,United Kingdom
569147,2023-09-30,23240,Set Of 4 Knick Knack Tins Doily,14.5,6,12842.0,United Kingdom
569147,2023-09-30,23236,Storage Tin Vintage Doily,13.21,6,12842.0,United Kingdom
569147,2023-09-30,22584,Pack Of 6 Panettone Gift Boxes,12.86,48,12842.0,United Kingdom
569147,2023-09-30,22582,Pack Of 6 Sweetie Gift Boxes,12.86,48,12842.0,United Kingdom
569147,2023-09-30,22585,Pack Of 6 Birdy Gift Tags,11.53,24,12842.0,United Kingdom
569147,2023-09-30,23082,Set 6 Paper Table Lantern Hearts,14.09,12,12842.0,United Kingdom
569147,2023-09-30,84879,Assorted Colour Bird Ornament,11.98,32,12842.0,United Kingdom
569147,2023-09-30,85123A,Cream Hanging Heart T-Light Holder,12.86,32,12842.0,United Kingdom
569147,2023-09-30,22086,Paper Chain Kit 50'S Christmas,13.27,12,12842.0,United Kingdom
569147,2023-09-30,22083,Paper Chain Kit Retrospot,13.27,24,12842.0,United Kingdom
569148,2023-09-30,23130,Mistletoe Heart Wreath Green,14.5,4,16613.0,United Kingdom
569148,2023-09-30,23129,Heart Shaped Holly Wreath,14.5,4,16613.0,United Kingdom
569148,2023-09-30,22086,Paper Chain Kit 50'S Christmas,13.27,12,16613.0,United Kingdom
569148,2023-09-30,23221,Reindeer Heart Decoration Silver,11.1,24,16613.0,United Kingdom
569148,2023-09-30,23223,Christmas Tree Hanging Silver,11.1,24,16613.0,United Kingdom
569148,2023-09-30,84946,Antique Silver T-Light Glass,11.53,12,16613.0,United Kingdom
569148,2023-09-30,85048,15cm Christmas Glass Ball 20 Lights,18.4,4,16613.0,United Kingdom
569148,2023-09-30,85123A,Cream Hanging Heart T-Light Holder,13.27,12,16613.0,United Kingdom
569148,2023-09-30,21259,Victorian Sewing Box Small,16.35,2,16613.0,United Kingdom
569148,2023-09-30,22960,Jam Making Set With Jars,14.61,6,16613.0,United Kingdom
569148,2023-09-30,22969,Homemade Jam Scented Candles,11.74,24,16613.0,United Kingdom
569148,2023-09-30,21790,Vintage Snap Cards,11.12,12,16613.0,United Kingdom
