TransactionNo,Date,ProductNo,ProductName,Price,Quantity,CustomerNo,Country
560580,2023-07-19,22845,Vintage Cream Cat Food Container,15.94,42,14088.0,United Kingdom
560580,2023-07-19,22844,Vintage Cream Dog Food Container,18.09,60,14088.0,United Kingdom
560580,2023-07-19,22798,Antique Glass Dressing Table Pot,12.86,32,14088.0,United Kingdom
560580,2023-07-19,22699,Roses Regency Teacup And Saucer,12.86,36,14088.0,United Kingdom
560580,2023-07-19,22698,Pink Regency Teacup And Saucer,12.86,60,14088.0,United Kingdom
560580,2023-07-19,22697,Green Regency Teacup And Saucer,12.86,48,14088.0,United Kingdom
560580,2023-07-19,22625,Red Kitchen Scales,18.09,20,14088.0,United Kingdom
560580,2023-07-19,22607,Wooden Rounders Garden Set,18.96,18,14088.0,United Kingdom
560580,2023-07-19,22467,Gumball Coat Rack,12.4,60,14088.0,United Kingdom
560580,2023-07-19,22138,Baking Set 9 Piece Retrospot,14.61,33,14088.0,United Kingdom
560580,2023-07-19,21754,Home Building Block Word,15.84,9,14088.0,United Kingdom
560580,2023-07-19,21232,Strawberry Ceramic Trinket Pot,11.34,60,14088.0,United Kingdom
560580,2023-07-19,15056N,Edwardian Parasol Natural,15.32,27,14088.0,United Kingdom
560580,2023-07-19,23134,Large Zinc Heart Wall Organiser,17.48,6,14088.0,United Kingdom
560580,2023-07-19,23133,Large Ivory Heart Wall Organiser,17.48,12,14088.0,United Kingdom
560580,2023-07-19,22796,Photo Frame 3 Classic Hanging,18.96,12,14088.0,United Kingdom
560580,2023-07-19,22171,3 Hook Photo Shelf Antique White,18.09,8,14088.0,United Kingdom
560580,2023-07-19,48188,Doormat Welcome Puppies,17.17,24,14088.0,United Kingdom
560580,2023-07-19,48184,Doormat English Rose,17.17,14,14088.0,United Kingdom
560580,2023-07-19,48194,Doormat Hearts,17.17,14,14088.0,United Kingdom
560580,2023-07-19,79321,Chilli Lights,15.32,12,14088.0,United Kingdom
560580,2023-07-19,22179,Set 10 Night Owl Lights,16.35,12,14088.0,United Kingdom
560580,2023-07-19,22468,Babushka Lights String Of 10,16.35,10,14088.0,United Kingdom
560580,2023-07-19,23079,Toadstool Bedside Light,18.71,6,14088.0,United Kingdom
560580,2023-07-19,47566,Party Bunting,14.5,60,14088.0,United Kingdom
560580,2023-07-19,23108,Set Of 10 Led Dolly Lights,15.77,28,14088.0,United Kingdom
560580,2023-07-19,22570,Feltcraft Cushion Rabbit,13.72,36,14088.0,United Kingdom
560580,2023-07-19,22569,Feltcraft Cushion Butterfly,13.72,24,14088.0,United Kingdom
560580,2023-07-19,22568,Feltcraft Cushion Owl,13.72,52,14088.0,United Kingdom
560580,2023-07-19,22386,Jumbo Bag Pink Polkadot,6.04,30,14088.0,United Kingdom
560580,2023-07-19,20712,Jumbo Bag Woodland Animals,6.04,40,14088.0,United Kingdom
560580,2023-07-19,85099B,Jumbo Bag Red Retrospot,6.04,50,14088.0,United Kingdom
560580,2023-07-19,85099C,Jumbo Bag Baroque Black White,6.04,100,14088.0,United Kingdom
560580,2023-07-19,23200,Jumbo Bag Pears,6.04,50,14088.0,United Kingdom
560580,2023-07-19,23199,Jumbo Bag Apples,6.04,60,14088.0,United Kingdom
560580,2023-07-19,21929,Jumbo Bag Pink Vintage Paisley,6.04,30,14088.0,United Kingdom
560580,2023-07-19,22384,Lunch Bag Pink Polkadot,5.87,60,14088.0,United Kingdom
560580,2023-07-19,20725,Lunch Bag Red Retrospot,5.87,60,14088.0,United Kingdom
560580,2023-07-19,23208,Lunch Bag Vintage Leaf Design,5.87,30,14088.0,United Kingdom
560580,2023-07-19,20728,Lunch Bag Cars Blue,5.87,60,14088.0,United Kingdom
560581,2023-07-19,21977,Pack Of 60 Pink Paisley Cake Cases,10.68,600,12901.0,United Kingdom
560581,2023-07-19,21787,Rain Poncho Retrospot,11.12,36,12901.0,United Kingdom
560581,2023-07-19,84077,World War 2 Gliders Asstd Designs,10.55,144,12901.0,United Kingdom
560581,2023-07-19,22440,Balloon Water Bomb Pack Of 35,10.68,30,12901.0,United Kingdom
560581,2023-07-19,22491,Pack Of 12 Coloured Pencils,11.12,24,12901.0,United Kingdom
560581,2023-07-19,22988,Soldiers Egg Cup,11.34,240,12901.0,United Kingdom
560582,2023-07-19,17096,Assorted Laquered Incense Holders,10.42,291,12875.0,United Kingdom
560584,2023-07-19,22499,Wooden Union Jack Bunting,16.35,1,13827.0,United Kingdom
560584,2023-07-19,20685,Doormat Red Retrospot,18.4,1,13827.0,United Kingdom
560584,2023-07-19,22644,Ceramic Cherry Cake Money Bank,11.74,1,13827.0,United Kingdom
560584,2023-07-19,22645,Ceramic Heart Fairy Cake Money Bank,11.74,1,13827.0,United Kingdom
560584,2023-07-19,22646,Ceramic Strawberry Cake Money Bank,11.74,2,13827.0,United Kingdom
560584,2023-07-19,22062,Ceramic Bowl With Love Heart Design,11.1,1,13827.0,United Kingdom
560584,2023-07-19,37448,Ceramic Cake Design Spotted Mug,11.78,1,13827.0,United Kingdom
560584,2023-07-19,21363,Home Small Wood Letters,15.32,1,13827.0,United Kingdom
560584,2023-07-19,22320,Birds Mobile Vintage Design,16.35,1,13827.0,United Kingdom
560584,2023-07-19,22649,Strawberry Fairy Cake Teapot,15.32,1,13827.0,United Kingdom
560584,2023-07-19,22317,Five Cats Hanging Decoration,13.27,1,13827.0,United Kingdom
560584,2023-07-19,21407,Brown Check Cat Doorstop,14.61,1,13827.0,United Kingdom
560584,2023-07-19,21034,Rex Cash+Carry Jumbo Shopper,11.22,1,13827.0,United Kingdom
560584,2023-07-19,23091,Zinc Herb Garden Container,16.66,1,13827.0,United Kingdom
560584,2023-07-19,23284,Doormat Keep Calm And Come In,18.4,1,13827.0,United Kingdom
560584,2023-07-19,47566,Party Bunting,15.32,1,13827.0,United Kingdom
560584,2023-07-19,23298,Spotty Bunting,15.32,1,13827.0,United Kingdom
560584,2023-07-19,82552,Washroom Metal Sign,11.74,1,13827.0,United Kingdom
560584,2023-07-19,21163,Do Not Touch My Stuff Door Hanger,10.65,1,13827.0,United Kingdom
560584,2023-07-19,21905,More Butter Metal Sign,11.06,1,13827.0,United Kingdom
560584,2023-07-19,22219,Lovebird Hanging Decoration White,11.12,4,13827.0,United Kingdom
560584,2023-07-19,21733,Red Hanging Heart T-Light Holder,13.27,1,13827.0,United Kingdom
560584,2023-07-19,84927D,La Palmiera Tile Hook,10.65,1,13827.0,United Kingdom
560584,2023-07-19,82486,3 Drawer Antique White Wood Cabinet,19.42,1,13827.0,United Kingdom
560584,2023-07-19,21172,Party Metal Sign,11.74,1,13827.0,United Kingdom
560584,2023-07-19,37450,Ceramic Cake Bowl + Hanging Cakes,13.27,1,13827.0,United Kingdom
560586,2023-07-19,21257,Victorian Sewing Box Medium,17.37,96,13631.0,United Kingdom
560587,2023-07-19,22625,Red Kitchen Scales,16.4,10,13631.0,United Kingdom
560590,2023-07-19,22897,Oven Mitt Apples Design,11.74,10,12560.0,Germany
560590,2023-07-19,22302,Coffee Mug Pears Design,12.86,6,12560.0,Germany
560590,2023-07-19,22303,Coffee Mug Apples Design,12.86,6,12560.0,Germany
560590,2023-07-19,22704,Wrap Red Apples,10.68,25,12560.0,Germany
560590,2023-07-19,22895,Set Of 2 Tea Towels Apple And Pears,13.58,12,12560.0,Germany
560590,2023-07-19,22908,Pack Of 20 Napkins Red Apples,11.12,12,12560.0,Germany
560590,2023-07-19,22630,Dolly Girl Lunch Box,12.25,12,12560.0,Germany
560590,2023-07-19,85053,French Enamel Candleholder,12.4,6,12560.0,Germany
560590,2023-07-19,22430,Enamel Watering Can Cream,15.32,4,12560.0,Germany
560590,2023-07-19,16161P,Wrap English Rose,10.68,25,12560.0,Germany
560590,2023-07-19,84030E,English Rose Hot Water Bottle,14.61,20,12560.0,Germany
560590,2023-07-19,84510A,Set Of 4 English Rose Coasters,11.53,10,12560.0,Germany
560590,2023-07-19,21884,Cakes And Bows Gift Tape,10.92,12,12560.0,Germany
560590,2023-07-19,22831,White Brocante Soap Dish,13.27,6,12560.0,Germany
560590,2023-07-19,23196,Vintage Leaf Magnetic Notepad,11.74,12,12560.0,Germany
560590,2023-07-19,23198,Pantry Magnetic Shopping List,11.74,12,12560.0,Germany
560590,2023-07-19,23243,Set Of Tea Coffee Sugar Tins Pantry,15.32,4,12560.0,Germany
560590,2023-07-19,23245,Set Of 3 Regency Cake Tins,15.32,4,12560.0,Germany
560590,2023-07-19,23291,Dolly Girl Childrens Cup,11.53,8,12560.0,Germany
560590,2023-07-19,23289,Dolly Girl Childrens Bowl,11.53,8,12560.0,Germany
560590,2023-07-19,23292,Spaceboy Childrens Cup,11.53,16,12560.0,Germany
560590,2023-07-19,23290,Spaceboy Childrens Bowl,11.53,16,12560.0,Germany
560590,2023-07-19,23293,Set Of 12 Fairy Cake Baking Cases,11.1,8,12560.0,Germany
560590,2023-07-19,23287,Red Vintage Spot Beaker,11.12,8,12560.0,Germany
560590,2023-07-19,23288,Green Vintage Spot Beaker,11.12,8,12560.0,Germany
560590,2023-07-19,23286,Blue Vintage Spot Beaker,11.12,8,12560.0,Germany
560590,2023-07-19,23308,Set Of 60 Vintage Leaf Cake Cases,10.81,24,12560.0,Germany
560590,2023-07-19,23307,Set Of 60 Pantry Design Cake Cases,10.81,24,12560.0,Germany
560590,2023-07-19,22961,Jam Making Set Printed,11.74,12,12560.0,Germany
560590,2023-07-19,22960,Jam Making Set With Jars,14.61,6,12560.0,Germany
560590,2023-07-19,22989,Set 2 Pantry Design Tea Towels,13.58,12,12560.0,Germany
560590,2023-07-19,22907,Pack Of 20 Napkins Pantry Design,11.12,12,12560.0,Germany
560590,2023-07-19,22692,Doormat Welcome To Our Home,18.4,4,12560.0,Germany
560590,2023-07-19,22979,Pantry Washing Up Brush,11.74,12,12560.0,Germany
560590,2023-07-19,22982,Pantry Pastry Brush,11.53,12,12560.0,Germany
560590,2023-07-19,22980,Pantry Scrubbing Brush,11.94,12,12560.0,Germany
560590,2023-07-19,23004,Travel Card Wallet Pantry,10.68,24,12560.0,Germany
560590,2023-07-19,20652,Blue Polkadot Luggage Tag,11.53,12,12560.0,Germany
560590,2023-07-19,22740,Polkadot Pen,11.12,48,12560.0,Germany
560590,2023-07-19,23285,Pink Vintage Spot Beaker,11.12,8,12560.0,Germany
560590,2023-07-19,22697,Green Regency Teacup And Saucer,13.27,6,12560.0,Germany
560590,2023-07-19,23175,Regency Milk Jug Pink,13.58,4,12560.0,Germany
560590,2023-07-19,23174,Regency Sugar Bowl Green,14.5,4,12560.0,Germany
560590,2023-07-19,22319,Hairclips Forties Fabric Assorted,10.92,12,12560.0,Germany
560590,2023-07-19,22624,Ivory Kitchen Scales,18.96,2,12560.0,Germany
560590,2023-07-19,22627,Mint Kitchen Scales,18.96,2,12560.0,Germany
560590,2023-07-19,22725,Alarm Clock Bakelike Chocolate,14.09,4,12560.0,Germany
560590,2023-07-19,22728,Alarm Clock Bakelike Pink,14.09,4,12560.0,Germany
560590,2023-07-19,22726,Alarm Clock Bakelike Green,14.09,4,12560.0,Germany
560590,2023-07-19,22729,Alarm Clock Bakelike Orange,14.09,4,12560.0,Germany
560590,2023-07-19,22727,Alarm Clock Bakelike Red,14.09,4,12560.0,Germany
560590,2023-07-19,22781,Gumball Magazine Rack,18.09,2,12560.0,Germany
560590,2023-07-19,23191,Bundle Of 3 Retro Note Books,11.94,12,12560.0,Germany
560590,2023-07-19,23239,Set Of 4 Knick Knack Tins Poppies,14.5,6,12560.0,Germany
560590,2023-07-19,79191C,Retro Plastic Elephant Tray,11.12,12,12560.0,Germany
560590,2023-07-19,22629,Spaceboy Lunch Box,12.25,12,12560.0,Germany
560590,2023-07-19,22029,Spaceboy Birthday Card,10.68,12,12560.0,Germany
560590,2023-07-19,22551,Plasters In Tin Spaceboy,11.94,12,12560.0,Germany
560590,2023-07-19,22403,Magnets Pack Of 4 Vintage Labels,10.65,12,12560.0,Germany
560590,2023-07-19,23235,Storage Tin Vintage Leaf,13.21,6,12560.0,Germany
560590,2023-07-19,23237,Set Of 4 Knick Knack Tins Leaf,14.5,6,12560.0,Germany
560590,2023-07-19,23089,Glass Bon Bon Jar,11.94,12,12560.0,Germany
560590,2023-07-19,23244,Round Storage Tin Vintage Leaf,12.25,6,12560.0,Germany
560590,2023-07-19,22999,Travel Card Wallet Vintage Leaf,10.68,24,12560.0,Germany
560590,2023-07-19,23232,Wrap Vintage Leaf Design,10.68,25,12560.0,Germany
560590,2023-07-19,20981,12 Pencils Tall Tube Woodland,11.12,12,12560.0,Germany
560590,2023-07-19,22326,Round Snack Boxes Set Of4 Woodland,13.27,6,12560.0,Germany
560590,2023-07-19,22554,Plasters In Tin Woodland Animals,11.94,12,12560.0,Germany
560590,2023-07-19,22637,Piggy Bank Retrospot,12.86,8,12560.0,Germany
560590,2023-07-19,22962,Jam Jar With Pink Lid,11.12,12,12560.0,Germany
560590,2023-07-19,22963,Jam Jar With Green Lid,11.12,12,12560.0,Germany
560590,2023-07-19,23199,Jumbo Bag Apples,6.19,10,12560.0,Germany
560590,2023-07-19,23202,Jumbo Bag Vintage Leaf,6.19,10,12560.0,Germany
560590,2023-07-19,23206,Lunch Bag Apple Design,5.97,10,12560.0,Germany
560590,2023-07-19,23208,Lunch Bag Vintage Leaf Design,5.97,10,12560.0,Germany
560591,2023-07-19,21932,Scandinavian Paisley Picnic Bag,11.94,1,13591.0,United Kingdom
560592,2023-07-19,21175,Gin And Tonic Diet Metal Sign,12.38,96,13225.0,United Kingdom
560592,2023-07-19,85099B,Jumbo Bag Red Retrospot,6.04,200,13225.0,United Kingdom
560595,2023-07-19,22998,Travel Card Wallet Keep Calm,10.62,480,16656.0,United Kingdom
560595,2023-07-19,22625,Red Kitchen Scales,18.96,4,16656.0,United Kingdom
560595,2023-07-19,21704,Bag 250g Swirly Marbles,10.99,72,16656.0,United Kingdom
560595,2023-07-19,21790,Vintage Snap Cards,10.99,72,16656.0,United Kingdom
560595,2023-07-19,84508A,Camouflage Design Teddy,12.4,240,16656.0,United Kingdom
560596,2023-07-19,23188,Vintage 2 Metre Folding Ruler,11.94,12,13199.0,United Kingdom
560596,2023-07-19,23086,Zinc Star T-Light Holder,11.53,64,13199.0,United Kingdom
560596,2023-07-19,84947,Antique Silver Tea Glass Engraved,11.34,72,13199.0,United Kingdom
560596,2023-07-19,22996,Travel Card Wallet Vintage Ticket,10.68,24,13199.0,United Kingdom
560597,2023-07-19,85123A,Cream Hanging Heart T-Light Holder,12.86,96,13798.0,United Kingdom
560597,2023-07-19,21733,Red Hanging Heart T-Light Holder,12.86,32,13798.0,United Kingdom
560598,2023-07-19,23014,Glass Apothecary Bottle Elixir,14.3,4,17096.0,United Kingdom
560598,2023-07-19,23013,Glass Apothecary Bottle Tonic,14.3,4,17096.0,United Kingdom
560598,2023-07-19,23012,Glass Apothecary Bottle Perfume,14.3,4,17096.0,United Kingdom
560598,2023-07-19,22169,Family Album White Picture Frame,18.96,2,17096.0,United Kingdom
560598,2023-07-19,22668,Pink Baby Bunting,13.27,5,17096.0,United Kingdom
560598,2023-07-19,23092,Large Antique White Photo Frame,18.35,2,17096.0,United Kingdom
560598,2023-07-19,22766,Photo Frame Cornice,13.27,8,17096.0,United Kingdom
560598,2023-07-19,22784,Lantern Cream Gazebo,15.32,9,17096.0,United Kingdom
560598,2023-07-19,23298,Spotty Bunting,15.32,3,17096.0,United Kingdom
560598,2023-07-19,82482,Wooden Picture Frame White Finish,12.86,6,17096.0,United Kingdom
560598,2023-07-19,82494L,Wooden Frame Antique White,13.27,6,17096.0,United Kingdom
560599,2023-07-19,18007,Essential Balm 35g Tin In Envelope,10.31,3186,14609.0,United Kingdom
560601,2023-07-19,22427,Enamel Flower Jug Cream,16.35,1,16764.0,United Kingdom
560601,2023-07-19,85032A,Romantic Images Gift Wrap Set,10.92,2,16764.0,United Kingdom
560601,2023-07-19,22489,Pack Of 12 Traditional Crayons,10.68,2,16764.0,United Kingdom
560601,2023-07-19,84519B,Carrot Charlie+Lola Coaster Set,11.53,2,16764.0,United Kingdom
560601,2023-07-19,84596B,Small Dolly Mix Design Orange Bowl,10.68,3,16764.0,United Kingdom
560601,2023-07-19,84596F,Small Marshmallows Pink Bowl,10.68,3,16764.0,United Kingdom
560601,2023-07-19,22508,Doorstop Retrospot Heart,14.09,1,16764.0,United Kingdom
560601,2023-07-19,22549,Picture Dominoes,11.74,1,16764.0,United Kingdom
560601,2023-07-19,21791,Vintage Heads And Tails Card Game,11.53,1,16764.0,United Kingdom
560601,2023-07-19,21790,Vintage Snap Cards,11.12,2,16764.0,United Kingdom
560601,2023-07-19,22614,Pack Of 12 Spaceboy Tissues,10.55,1,16764.0,United Kingdom
560601,2023-07-19,21980,Pack Of 12 Red Retrospot Tissues,10.55,1,16764.0,United Kingdom
560601,2023-07-19,21981,Pack Of 12 Woodland Tissues,10.55,1,16764.0,United Kingdom
560601,2023-07-19,21982,Pack Of 12 Suki Tissues,10.55,1,16764.0,United Kingdom
560601,2023-07-19,21914,Blue Harmonica In Box,11.53,1,16764.0,United Kingdom
560601,2023-07-19,21915,Red Harmonica In Box,11.53,1,16764.0,United Kingdom
560601,2023-07-19,22534,Magic Drawing Slate Spaceboy,10.68,2,16764.0,United Kingdom
560601,2023-07-19,22530,Magic Drawing Slate Dolly Girl,10.68,2,16764.0,United Kingdom
560601,2023-07-19,22409,Money Box Biscuits Design,11.53,1,16764.0,United Kingdom
560601,2023-07-19,22410,Money Box Housekeeping Design,11.53,1,16764.0,United Kingdom
560601,2023-07-19,85014B,Red Retrospot Umbrella,16.35,1,16764.0,United Kingdom
560601,2023-07-19,21754,Home Building Block Word,16.35,2,16764.0,United Kingdom
560601,2023-07-19,22629,Spaceboy Lunch Box,12.25,1,16764.0,United Kingdom
560601,2023-07-19,22630,Dolly Girl Lunch Box,12.25,1,16764.0,United Kingdom
560601,2023-07-19,20684,Strawberry Dream Childs Umbrella,13.58,1,16764.0,United Kingdom
560601,2023-07-19,20682,Red Retrospot Childrens Umbrella,13.58,1,16764.0,United Kingdom
560601,2023-07-19,22654,Deluxe Sewing Kit,16.35,1,16764.0,United Kingdom
560601,2023-07-19,22720,Set Of 3 Cake Tins Pantry Design,15.32,1,16764.0,United Kingdom
560601,2023-07-19,20724,Red Retrospot Charlotte Bag,11.12,1,16764.0,United Kingdom
560601,2023-07-19,22093,Motoring Tissue Box,10.65,1,16764.0,United Kingdom
560601,2023-07-19,84818,Danish Rose Photo Frame,11.06,4,16764.0,United Kingdom
560601,2023-07-19,21164,Home Sweet Home Metal Sign,13.27,2,16764.0,United Kingdom
560601,2023-07-19,21899,Garage Key Fob,10.92,1,16764.0,United Kingdom
560601,2023-07-19,21902,Key Fob Front Door,10.92,1,16764.0,United Kingdom
560601,2023-07-19,21901,Key Fob Back Door,10.92,1,16764.0,United Kingdom
560601,2023-07-19,21171,Bathroom Metal Sign,10.81,1,16764.0,United Kingdom
560601,2023-07-19,82581,Toilet Metal Sign,10.81,1,16764.0,United Kingdom
560601,2023-07-19,82578,Kitchen Metal Sign,10.81,2,16764.0,United Kingdom
560601,2023-07-19,22666,Recipe Box Pantry Yellow Design,13.27,2,16764.0,United Kingdom
560601,2023-07-19,22094,Red Retrospot Tissue Box,10.65,2,16764.0,United Kingdom
560601,2023-07-19,22723,Set Of 6 Herb Tins Sketchbook,14.3,1,16764.0,United Kingdom
560601,2023-07-19,84836,Zinc Metal Heart Decoration,11.53,2,16764.0,United Kingdom
560601,2023-07-19,22469,Heart Of Wicker Small,11.94,1,16764.0,United Kingdom
560601,2023-07-19,23321,Small White Heart Of Wicker,11.94,1,16764.0,United Kingdom
560601,2023-07-19,22804,Pink Hanging Heart T-Light Holder,13.27,1,16764.0,United Kingdom
560601,2023-07-19,22413,Metal Sign Take It Or Leave It,13.27,1,16764.0,United Kingdom
560601,2023-07-19,85123A,Cream Hanging Heart T-Light Holder,13.27,2,16764.0,United Kingdom
560601,2023-07-19,22470,Heart Of Wicker Large,13.27,1,16764.0,United Kingdom
560601,2023-07-19,23322,Large White Heart Of Wicker,13.27,1,16764.0,United Kingdom
560601,2023-07-19,21179,No Junk Mail Metal Sign,10.65,2,16764.0,United Kingdom
560601,2023-07-19,20914,Set/5 Red Retrospot Lid Glass Bowls,13.27,1,16764.0,United Kingdom
560601,2023-07-19,82494L,Wooden Frame Antique White,13.27,2,16764.0,United Kingdom
560601,2023-07-19,20718,Red Retrospot Shopper Bag,11.53,1,16764.0,United Kingdom
560601,2023-07-19,20723,Strawberry Charlotte Bag,11.12,1,16764.0,United Kingdom
560601,2023-07-19,21933,Pink Vintage Paisley Picnic Bag,11.94,1,16764.0,United Kingdom
560601,2023-07-19,21932,Scandinavian Paisley Picnic Bag,11.94,1,16764.0,United Kingdom
560601,2023-07-19,22664,Toy Tidy Dolly Girl Design,12.4,1,16764.0,United Kingdom
560601,2023-07-19,22380,Toy Tidy Spaceboy,12.4,1,16764.0,United Kingdom
560601,2023-07-19,22692,Doormat Welcome To Our Home,18.4,1,16764.0,United Kingdom
560601,2023-07-19,21967,Pack Of 12 Skull Tissues,10.55,1,16764.0,United Kingdom
560601,2023-07-19,21411,Gingham Heart Doorstop Red,14.61,1,16764.0,United Kingdom
560601,2023-07-19,22138,Baking Set 9 Piece Retrospot,15.32,1,16764.0,United Kingdom
560601,2023-07-19,22617,Baking Set Spaceboy Design,15.32,1,16764.0,United Kingdom
560601,2023-07-19,85183A,Charlie & Lola Wastepaper Bin Blue,11.53,1,16764.0,United Kingdom
560601,2023-07-19,85183B,Charlie & Lola Wastepaper Bin Flora,11.53,1,16764.0,United Kingdom
560601,2023-07-19,22512,Doorstop Racing Car Design,14.09,1,16764.0,United Kingdom
560601,2023-07-19,20711,Jumbo Bag Toys,6.19,1,16764.0,United Kingdom
560601,2023-07-19,20727,Lunch Bag Black Skull,5.97,1,16764.0,United Kingdom
560601,2023-07-19,22662,Lunch Bag Dolly Girl Design,5.97,1,16764.0,United Kingdom
560601,2023-07-19,22383,Lunch Bag Suki Design,5.97,1,16764.0,United Kingdom
560601,2023-07-19,20728,Lunch Bag Cars Blue,5.97,1,16764.0,United Kingdom
560601,2023-07-19,22382,Lunch Bag Spaceboy Design,5.97,2,16764.0,United Kingdom
560445,2023-07-19,23065,Large Deco Jewellery Stand,21.68,48,14156.0,EIRE
560491,2023-07-19,21843,Red Retrospot Cake Stand,21.47,1,12415.0,Australia
560504,2023-07-19,21843,Red Retrospot Cake Stand,21.47,4,13081.0,United Kingdom
560504,2023-07-19,22423,Regency Cakestand 3 Tier,21.47,16,13081.0,United Kingdom
560580,2023-07-19,22485,Set Of 2 Wooden Market Crates,21.47,16,14088.0,United Kingdom
560580,2023-07-19,22423,Regency Cakestand 3 Tier,21.47,22,14088.0,United Kingdom
560580,2023-07-19,85066,Cream Sweetheart Mini Chest,21.47,12,14088.0,United Kingdom
C560540,2023-07-19,21843,Red Retrospot Cake Stand,21.47,-1,12415.0,Australia
560567,2023-07-19,23298,Spotty Bunting,21.31,1,13567.0,United Kingdom
560567,2023-07-19,47566,Party Bunting,21.31,88,13567.0,United Kingdom
560547,2023-07-19,22832,Brocante Shelf With Hooks,21.27,2,17419.0,United Kingdom
560451,2023-07-19,23173,Regency Teapot Roses,20.45,4,14911.0,EIRE
560451,2023-07-19,22061,Large Cake Stand Hanging Strawbery,20.45,2,14911.0,EIRE
560453,2023-07-19,22968,Rose Cottage Keepsake Box,20.45,6,13209.0,United Kingdom
560483,2023-07-19,22607,Wooden Rounders Garden Set,20.45,2,12955.0,United Kingdom
560499,2023-07-19,22120,Welcome Wooden Block Letters,20.45,3,16713.0,United Kingdom
560503,2023-07-19,22607,Wooden Rounders Garden Set,20.45,2,17682.0,United Kingdom
560504,2023-07-19,22890,Novelty Biscuits Cake Stand 3 Tier,20.45,4,13081.0,United Kingdom
560504,2023-07-19,22061,Large Cake Stand Hanging Strawbery,20.45,4,13081.0,United Kingdom
560504,2023-07-19,22607,Wooden Rounders Garden Set,20.45,4,13081.0,United Kingdom
560504,2023-07-19,23173,Regency Teapot Roses,20.45,4,13081.0,United Kingdom
560557,2023-07-19,84711A,Silver Oval Shape Trinket Box,20.45,3,18101.0,United Kingdom
560557,2023-07-19,84711B,Pink Oval Shape Trinket Box,20.45,3,18101.0,United Kingdom
560569,2023-07-19,22221,Cake Stand Lovebird 2 Tier Pink,20.45,2,12480.0,Germany
560580,2023-07-19,21340,Classic Metal Birdcage Plant Holder,20.45,4,14088.0,United Kingdom
560584,2023-07-19,22890,Novelty Biscuits Cake Stand 3 Tier,20.45,1,13827.0,United Kingdom
560584,2023-07-19,22120,Welcome Wooden Block Letters,20.45,1,13827.0,United Kingdom
560598,2023-07-19,22767,Triple Photo Frame Cornice,20.45,2,17096.0,United Kingdom
560598,2023-07-19,22796,Photo Frame 3 Classic Hanging,20.45,4,17096.0,United Kingdom
560598,2023-07-19,22768,Family Photo Frame Cornice,20.45,4,17096.0,United Kingdom
C560474,2023-07-19,21429,Red Gingham Rose Jewellery Box,12.25,-2,12705.0,Germany
C560526,2023-07-19,22197,Popcorn Holder,10.99,-4,16401.0,United Kingdom
C560526,2023-07-19,20725,Lunch Bag Red Retrospot,5.97,-2,16401.0,United Kingdom
C560533,2023-07-19,22493,Paint Your Own Canvas Set,11.94,-2,16488.0,United Kingdom
C560533,2023-07-19,23192,Bundle Of 3 Alphabet Exercise Books,11.94,-2,16488.0,United Kingdom
C560540,2023-07-19,23307,Set Of 60 Pantry Design Cake Cases,10.81,-1,12415.0,Australia
C560540,2023-07-19,23306,Set Of 36 Pantry Paper Doilies,11.74,-1,12415.0,Australia
C560540,2023-07-19,23297,Set 40 Heart Shape Petit Four Cases,11.94,-2,12415.0,Australia
C560540,2023-07-19,23296,Set Of 6 Tea Time Baking Cases,11.53,-2,12415.0,Australia
C560540,2023-07-19,23295,Set Of 12 Mini Loaf Baking Cases,11.1,-2,12415.0,Australia
C560540,2023-07-19,23294,Set Of 6 Snack Loaf Baking Cases,11.1,-2,12415.0,Australia
C560540,2023-07-19,23293,Set Of 12 Fairy Cake Baking Cases,11.1,-2,12415.0,Australia
C560540,2023-07-19,23291,Dolly Girl Childrens Cup,11.53,-1,12415.0,Australia
C560540,2023-07-19,23256,Childrens Cutlery Spaceboy,14.5,-1,12415.0,Australia
C560540,2023-07-19,23255,Childrens Cutlery Circus Parade,14.5,-1,12415.0,Australia
C560540,2023-07-19,23254,Childrens Cutlery Dolly Girl,14.5,-1,12415.0,Australia
C560540,2023-07-19,23245,Set Of 3 Regency Cake Tins,15.32,-1,12415.0,Australia
C560540,2023-07-19,23244,Round Storage Tin Vintage Leaf,12.25,-1,12415.0,Australia
C560540,2023-07-19,23243,Set Of Tea Coffee Sugar Tins Pantry,15.32,-1,12415.0,Australia
C560540,2023-07-19,23242,Treasure Tin Buffalo Bill,12.38,-1,12415.0,Australia
C560540,2023-07-19,23241,Treasure Tin Gymkhana Design,12.38,-1,12415.0,Australia
C560540,2023-07-19,23240,Set Of 4 Knick Knack Tins Doily,14.5,-1,12415.0,Australia
C560540,2023-07-19,23237,Set Of 4 Knick Knack Tins Leaf,14.5,-1,12415.0,Australia
C560540,2023-07-19,23236,Storage Tin Vintage Doily,13.21,-1,12415.0,Australia
C560540,2023-07-19,23235,Storage Tin Vintage Leaf,13.21,-1,12415.0,Australia
C560540,2023-07-19,23232,Wrap Vintage Leaf Design,10.68,-1,12415.0,Australia
C560540,2023-07-19,23229,Vintage Donkey Tail Game,14.09,-1,12415.0,Australia
C560540,2023-07-19,23192,Bundle Of 3 Alphabet Exercise Books,11.94,-1,12415.0,Australia
C560540,2023-07-19,23190,Bundle Of 3 School Exercise Books,11.94,-1,12415.0,Australia
C560540,2023-07-19,23174,Regency Sugar Bowl Green,14.5,-1,12415.0,Australia
C560540,2023-07-19,23167,Small Ceramic Top Storage Jar,11.1,-1,12415.0,Australia
C560540,2023-07-19,23166,Medium Ceramic Top Storage Jar,11.53,-1,12415.0,Australia
C560540,2023-07-19,23165,Large Ceramic Top Storage Jar,11.94,-1,12415.0,Australia
C560540,2023-07-19,23159,Set Of 5 Pancake Day Magnets,12.38,-1,12415.0,Australia
C560540,2023-07-19,23154,Set Of 4 Jam Jar Magnets,12.38,-1,12415.0,Australia
C560540,2023-07-19,23108,Set Of 10 Led Dolly Lights,16.66,-1,12415.0,Australia
C560540,2023-07-19,22973,Children's Circus Parade Mug,11.94,-1,12415.0,Australia
C560540,2023-07-19,22720,Set Of 3 Cake Tins Pantry Design,15.32,-1,12415.0,Australia
C560540,2023-07-19,22546,Mini Jigsaw Purdey,10.68,-1,12415.0,Australia
C560540,2023-07-19,22545,Mini Jigsaw Bunnies,10.68,-1,12415.0,Australia
C560540,2023-07-19,22492,Mini Paint Set Vintage,10.92,-36,12415.0,Australia
C560540,2023-07-19,22150,3 Stripey Mice Feltcraft,12.25,-1,12415.0,Australia
C560540,2023-07-19,22147,Feltcraft Butterfly Hearts,11.74,-1,12415.0,Australia
C560540,2023-07-19,22138,Baking Set 9 Piece Retrospot,15.32,-1,12415.0,Australia
C560540,2023-07-19,21974,Set Of 36 Paisley Flower Doilies,11.74,-1,12415.0,Australia
