TransactionNo,Date,ProductNo,ProductName,Price,Quantity,CustomerNo,Country
550163,2023-04-14,22826,Love Seat Antique White Metal,210.12,1,14154.0,United Kingdom
550185,2023-04-14,22826,Love Seat Antique White Metal,210.12,1,17142.0,United Kingdom
550034,2023-04-14,84078A,Set/4 White Retro Storage Cubes,51.2,1,16187.0,United Kingdom
550130,2023-04-14,84078A,Set/4 White Retro Storage Cubes,51.2,1,14390.0,United Kingdom
550152,2023-04-14,22824,3 Tier Sweetheart Garden Shelf,47.1,1,17362.0,United Kingdom
550189,2023-04-14,21473,Sweetheart Cream Steel Table Rect,30.7,2,13230.0,United Kingdom
550008,2023-04-14,22849,Bread Bin Diner Style Mint,27.62,1,15570.0,United Kingdom
550173,2023-04-14,23008,Dolly Girl Baby Gift Set,27.62,1,15235.0,United Kingdom
550173,2023-04-14,23007,Spaceboy Baby Gift Set,27.62,1,15235.0,United Kingdom
550188,2023-04-14,23007,Spaceboy Baby Gift Set,27.62,3,12457.0,Switzerland
550188,2023-04-14,23008,Dolly Girl Baby Gift Set,27.62,3,12457.0,Switzerland
550008,2023-04-14,22606,Wooden Skittles Garden Set,26.6,2,15570.0,United Kingdom
550163,2023-04-14,23010,Circus Parade Baby Gift Set,25.57,6,14154.0,United Kingdom
550163,2023-04-14,23008,Dolly Girl Baby Gift Set,25.57,6,14154.0,United Kingdom
550163,2023-04-14,23007,Spaceboy Baby Gift Set,25.57,6,14154.0,United Kingdom
550189,2023-04-14,21476,Steel Sweetheart Round Table Cream,25.57,3,13230.0,United Kingdom
549991,2023-04-14,22960,Jam Making Set With Jars,14.09,12,18229.0,United Kingdom
549991,2023-04-14,22191,Ivory Diner Wall Clock,18.96,4,18229.0,United Kingdom
549991,2023-04-14,22728,Alarm Clock Bakelike Pink,14.09,8,18229.0,United Kingdom
549991,2023-04-14,22725,Alarm Clock Bakelike Chocolate,14.09,8,18229.0,United Kingdom
549991,2023-04-14,22993,Set Of 4 Pantry Jelly Moulds,11.53,12,18229.0,United Kingdom
549991,2023-04-14,22842,Biscuit Tin Vintage Red,16.35,12,18229.0,United Kingdom
549991,2023-04-14,21218,Red Spotty Biscuit Tin,13.58,24,18229.0,United Kingdom
549991,2023-04-14,21137,Black Record Cover Frame,14.09,12,18229.0,United Kingdom
549992,2023-04-14,23205,Charlotte Bag Vintage Alphabet,11.12,20,17669.0,United Kingdom
549992,2023-04-14,23204,Charlotte Bag Apples Design,11.12,30,17669.0,United Kingdom
549992,2023-04-14,23201,Jumbo Bag Alphabet,6.04,100,17669.0,United Kingdom
549992,2023-04-14,23199,Jumbo Bag Apples,6.04,100,17669.0,United Kingdom
549992,2023-04-14,23206,Lunch Bag Apple Design,5.97,30,17669.0,United Kingdom
549992,2023-04-14,23208,Lunch Bag Vintage Leaf Design,5.97,20,17669.0,United Kingdom
549992,2023-04-14,23207,Lunch Bag Alphabet Design,5.97,20,17669.0,United Kingdom
549993,2023-04-14,22993,Set Of 4 Pantry Jelly Moulds,11.53,24,14057.0,United Kingdom
549993,2023-04-14,22963,Jam Jar With Green Lid,11.12,24,14057.0,United Kingdom
549993,2023-04-14,22951,60 Cake Cases Dolly Girl Design,10.81,24,14057.0,United Kingdom
549993,2023-04-14,22900,Set 2 Tea Towels I Love London,13.58,24,14057.0,United Kingdom
549993,2023-04-14,22659,Lunch Box I Love London,12.25,24,14057.0,United Kingdom
549993,2023-04-14,22630,Dolly Girl Lunch Box,12.25,24,14057.0,United Kingdom
549993,2023-04-14,22629,Spaceboy Lunch Box,12.25,24,14057.0,United Kingdom
549993,2023-04-14,22616,Pack Of 12 London Tissues,10.55,96,14057.0,United Kingdom
549993,2023-04-14,22417,Pack Of 60 Spaceboy Cake Cases,10.81,24,14057.0,United Kingdom
549993,2023-04-14,21213,Pack Of 72 Skull Cake Cases,10.81,24,14057.0,United Kingdom
549993,2023-04-14,21212,Pack Of 72 Retrospot Cake Cases,10.81,24,14057.0,United Kingdom
549994,2023-04-14,23199,Jumbo Bag Apples,6.19,10,14057.0,United Kingdom
549994,2023-04-14,23201,Jumbo Bag Alphabet,6.19,10,14057.0,United Kingdom
549995,2023-04-14,22993,Set Of 4 Pantry Jelly Moulds,11.53,12,16131.0,United Kingdom
549995,2023-04-14,85123A,Cream Hanging Heart T-Light Holder,12.86,32,16131.0,United Kingdom
549995,2023-04-14,21212,Pack Of 72 Retrospot Cake Cases,10.81,24,16131.0,United Kingdom
549995,2023-04-14,20933,Yellow Pot Plant Candle,13.27,8,16131.0,United Kingdom
549995,2023-04-14,20931,Blue Pot Plant Candle,14.09,8,16131.0,United Kingdom
549995,2023-04-14,20932,Pink Pot Plant Candle,14.09,8,16131.0,United Kingdom
549995,2023-04-14,21983,Pack Of 12 Blue Paisley Tissues,10.55,24,16131.0,United Kingdom
549995,2023-04-14,21980,Pack Of 12 Red Retrospot Tissues,10.55,24,16131.0,United Kingdom
549995,2023-04-14,21982,Pack Of 12 Suki Tissues,10.55,24,16131.0,United Kingdom
549995,2023-04-14,21704,Bag 250g Swirly Marbles,10.99,72,16131.0,United Kingdom
549995,2023-04-14,21889,Wooden Box Of Dominoes,11.53,24,16131.0,United Kingdom
549995,2023-04-14,22549,Picture Dominoes,11.74,12,16131.0,United Kingdom
549995,2023-04-14,48194,Doormat Hearts,17.17,10,16131.0,United Kingdom
549995,2023-04-14,48188,Doormat Welcome Puppies,17.17,10,16131.0,United Kingdom
549995,2023-04-14,48187,Doormat New England,17.17,10,16131.0,United Kingdom
549995,2023-04-14,22607,Wooden Rounders Garden Set,18.96,8,16131.0,United Kingdom
549995,2023-04-14,22076,6 Ribbons Empire,11.94,24,16131.0,United Kingdom
549995,2023-04-14,22077,6 Ribbons Rustic Charm,11.94,24,16131.0,United Kingdom
549995,2023-04-14,21136,Painted Metal Pears Assorted,11.98,24,16131.0,United Kingdom
549995,2023-04-14,84879,Assorted Colour Bird Ornament,11.98,32,16131.0,United Kingdom
549995,2023-04-14,85152,Hand Over The Chocolate Sign,12.15,48,16131.0,United Kingdom
549995,2023-04-14,82582,Area Patrolled Metal Sign,12.15,72,16131.0,United Kingdom
549996,2023-04-14,23158,Set Of 5 Lucky Cat Magnets,12.38,12,15189.0,United Kingdom
549997,2023-04-14,22699,Roses Regency Teacup And Saucer,12.86,24,15189.0,United Kingdom
549997,2023-04-14,22697,Green Regency Teacup And Saucer,12.86,24,15189.0,United Kingdom
549997,2023-04-14,22698,Pink Regency Teacup And Saucer,12.86,24,15189.0,United Kingdom
549998,2023-04-14,84879,Assorted Colour Bird Ornament,11.98,64,17675.0,United Kingdom
549998,2023-04-14,85123A,Cream Hanging Heart T-Light Holder,12.86,32,17675.0,United Kingdom
549998,2023-04-14,22189,Cream Heart Card Holder,14.3,8,17675.0,United Kingdom
549998,2023-04-14,21181,Please One Person Metal Sign,12.4,24,17675.0,United Kingdom
549998,2023-04-14,21175,Gin And Tonic Diet Metal Sign,12.86,24,17675.0,United Kingdom
549998,2023-04-14,85152,Hand Over The Chocolate Sign,12.4,12,17675.0,United Kingdom
549998,2023-04-14,47566,Party Bunting,15.32,12,17675.0,United Kingdom
549998,2023-04-14,22244,3 Hook Hanger Magic Garden,12.25,12,17675.0,United Kingdom
549998,2023-04-14,22245,Hook 1 Hanger Magic Garden,11.12,32,17675.0,United Kingdom
549998,2023-04-14,21670,Blue Spot Ceramic Drawer Knob,11.53,12,17675.0,United Kingdom
549998,2023-04-14,21668,Red Stripe Ceramic Drawer Knob,11.53,12,17675.0,United Kingdom
549999,2023-04-14,22960,Jam Making Set With Jars,14.61,6,15813.0,United Kingdom
549999,2023-04-14,22666,Recipe Box Pantry Yellow Design,13.27,6,15813.0,United Kingdom
549999,2023-04-14,22840,Round Cake Tin Vintage Red,18.4,2,15813.0,United Kingdom
549999,2023-04-14,22626,Black Kitchen Scales,18.96,2,15813.0,United Kingdom
549999,2023-04-14,21175,Gin And Tonic Diet Metal Sign,12.86,12,15813.0,United Kingdom
549999,2023-04-14,22189,Cream Heart Card Holder,14.3,4,15813.0,United Kingdom
549999,2023-04-14,22699,Roses Regency Teacup And Saucer,12.86,24,15813.0,United Kingdom
549999,2023-04-14,22698,Pink Regency Teacup And Saucer,12.86,24,15813.0,United Kingdom
549999,2023-04-14,22697,Green Regency Teacup And Saucer,12.86,24,15813.0,United Kingdom
549999,2023-04-14,22707,Wrap Monster Fun,10.68,25,15813.0,United Kingdom
549999,2023-04-14,22711,Wrap Circus Parade,10.68,25,15813.0,United Kingdom
549999,2023-04-14,16156S,Wrap Pink Fairy Cakes,10.68,25,15813.0,United Kingdom
549999,2023-04-14,22986,Wrap Gingham Rose,10.68,25,15813.0,United Kingdom
549999,2023-04-14,16161P,Wrap English Rose,10.68,25,15813.0,United Kingdom
549999,2023-04-14,23230,Wrap Alphabet Design,10.68,25,15813.0,United Kingdom
549999,2023-04-14,21535,Red Retrospot Small Milk Jug,12.86,6,15813.0,United Kingdom
549999,2023-04-14,22964,3 Piece Spaceboy Cookie Cutter Set,12.4,6,15813.0,United Kingdom
549999,2023-04-14,84380,Set Of 3 Butterfly Cookie Cutters,11.53,12,15813.0,United Kingdom
549999,2023-04-14,22425,Enamel Colander Cream,15.32,3,15813.0,United Kingdom
549999,2023-04-14,22938,Cupcake Lace Paper Set 6,12.25,12,15813.0,United Kingdom
549999,2023-04-14,22429,Enamel Measuring Jug Cream,14.61,4,15813.0,United Kingdom
549999,2023-04-14,22898,Childrens Apron Apples Design,12.25,8,15813.0,United Kingdom
549999,2023-04-14,22854,Cream Sweetheart Egg Holder,15.32,4,15813.0,United Kingdom
549999,2023-04-14,22652,Travel Sewing Kit,11.94,10,15813.0,United Kingdom
549999,2023-04-14,22084,Paper Chain Kit Empire,13.27,6,15813.0,United Kingdom
549999,2023-04-14,22417,Pack Of 60 Spaceboy Cake Cases,10.81,24,15813.0,United Kingdom
550000,2023-04-14,22502,Picnic Basket Wicker Small,16.35,4,17058.0,United Kingdom
550000,2023-04-14,21755,Love Building Block Word,16.35,3,17058.0,United Kingdom
550000,2023-04-14,21754,Home Building Block Word,16.35,3,17058.0,United Kingdom
550000,2023-04-14,84879,Assorted Colour Bird Ornament,11.98,8,17058.0,United Kingdom
550000,2023-04-14,22855,Fine Wicker Heart,11.53,12,17058.0,United Kingdom
550000,2023-04-14,84755,Colour Glass T-Light Holder Hanging,10.92,16,17058.0,United Kingdom
550000,2023-04-14,22674,French Toilet Sign Blue Metal,11.53,12,17058.0,United Kingdom
550000,2023-04-14,22672,French Bathroom Sign Blue Metal,11.94,12,17058.0,United Kingdom
550000,2023-04-14,22676,French Blue Metal Door Sign 1,11.53,20,17058.0,United Kingdom
550000,2023-04-14,22677,French Blue Metal Door Sign 2,11.53,10,17058.0,United Kingdom
550000,2023-04-14,22678,French Blue Metal Door Sign 3,11.53,10,17058.0,United Kingdom
550000,2023-04-14,22680,French Blue Metal Door Sign 5,11.53,10,17058.0,United Kingdom
550000,2023-04-14,22682,French Blue Metal Door Sign 7,11.53,10,17058.0,United Kingdom
550000,2023-04-14,22685,French Blue Metal Door Sign 0,11.53,10,17058.0,United Kingdom
550000,2023-04-14,22425,Enamel Colander Cream,15.32,3,17058.0,United Kingdom
550000,2023-04-14,22429,Enamel Measuring Jug Cream,14.61,4,17058.0,United Kingdom
550000,2023-04-14,22427,Enamel Flower Jug Cream,16.35,3,17058.0,United Kingdom
550000,2023-04-14,22428,Enamel Fire Bucket Cream,17.37,6,17058.0,United Kingdom
550000,2023-04-14,22430,Enamel Watering Can Cream,15.32,4,17058.0,United Kingdom
550000,2023-04-14,22499,Wooden Union Jack Bunting,16.35,3,17058.0,United Kingdom
550000,2023-04-14,47566,Party Bunting,15.32,4,17058.0,United Kingdom
550000,2023-04-14,23230,Wrap Alphabet Design,10.68,25,17058.0,United Kingdom
550000,2023-04-14,23231,Wrap Vintage Doily,10.68,25,17058.0,United Kingdom
550000,2023-04-14,23232,Wrap Vintage Leaf Design,10.68,25,17058.0,United Kingdom
550000,2023-04-14,16161P,Wrap English Rose,10.68,25,17058.0,United Kingdom
550000,2023-04-14,22986,Wrap Gingham Rose,10.68,25,17058.0,United Kingdom
550000,2023-04-14,22090,Paper Bunting Retrospot,13.27,6,17058.0,United Kingdom
550000,2023-04-14,22084,Paper Chain Kit Empire,13.27,6,17058.0,United Kingdom
550000,2023-04-14,22679,French Blue Metal Door Sign 4,11.53,10,17058.0,United Kingdom
550000,2023-04-14,22681,French Blue Metal Door Sign 6,11.53,10,17058.0,United Kingdom
550000,2023-04-14,22683,French Blue Metal Door Sign 8,11.53,10,17058.0,United Kingdom
550000,2023-04-14,22684,French Blue Metal Door Sign 9,11.53,10,17058.0,United Kingdom
550001,2023-04-14,22741,Funky Diva Pen,11.12,48,17704.0,United Kingdom
550001,2023-04-14,20914,Set/5 Red Retrospot Lid Glass Bowls,13.27,6,17704.0,United Kingdom
550001,2023-04-14,22090,Paper Bunting Retrospot,13.27,6,17704.0,United Kingdom
550001,2023-04-14,22089,Paper Bunting Vintage Paisley,13.27,6,17704.0,United Kingdom
550001,2023-04-14,22088,Paper Bunting Coloured Lace,13.27,6,17704.0,United Kingdom
550001,2023-04-14,84406B,Cream Cupid Hearts Coat Hanger,14.5,4,17704.0,United Kingdom
550001,2023-04-14,84792,Enchanted Bird Coathanger 5 Hook,15.02,4,17704.0,United Kingdom
550001,2023-04-14,85123A,Cream Hanging Heart T-Light Holder,13.27,18,17704.0,United Kingdom
550001,2023-04-14,47566,Party Bunting,15.32,16,17704.0,United Kingdom
550001,2023-04-14,21090,Set/6 Collage Paper Plates,10.65,12,17704.0,United Kingdom
550001,2023-04-14,21084,Set/6 Collage Paper Cups,10.44,24,17704.0,United Kingdom
550001,2023-04-14,22499,Wooden Union Jack Bunting,16.35,3,17704.0,United Kingdom
550001,2023-04-14,22801,Antique Glass Pedestal Bowl,14.09,4,17704.0,United Kingdom
550001,2023-04-14,22139,Retrospot Tea Set Ceramic 11 Pc,15.32,6,17704.0,United Kingdom
550001,2023-04-14,23206,Lunch Bag Apple Design,5.97,10,17704.0,United Kingdom
550002,2023-04-14,20658,Red Retrospot Luggage Tag,11.53,40,12709.0,Germany
550003,2023-04-14,84978,Hanging Heart Jar T-Light Holder,11.34,72,14428.0,United Kingdom
550003,2023-04-14,84658,White Stitched Cushion Cover,17.37,4,14428.0,United Kingdom
550003,2023-04-14,22595,Gingham Heart Decoration,11.12,12,14428.0,United Kingdom
550004,2023-04-14,22647,Ceramic Love Heart Money Bank,11.74,12,12569.0,Germany
550004,2023-04-14,22649,Strawberry Fairy Cake Teapot,15.32,16,12569.0,Germany
550004,2023-04-14,37448,Ceramic Cake Design Spotted Mug,11.78,12,12569.0,Germany
550004,2023-04-14,22922,Fridge Magnets Us Diner Assorted,11.12,24,12569.0,Germany
550004,2023-04-14,22064,Pink Doughnut Trinket Pot,11.94,12,12569.0,Germany
550004,2023-04-14,21216,Set 3 Retrospot Tea/Coffee/Sugar,15.32,4,12569.0,Germany
550004,2023-04-14,21700,Big Doughnut Fridge Magnets,11.12,12,12569.0,Germany
550004,2023-04-14,21218,Red Spotty Biscuit Tin,14.09,6,12569.0,Germany
550005,2023-04-14,23199,Jumbo Bag Apples,5.97,100,17677.0,United Kingdom
550005,2023-04-14,23206,Lunch Bag Apple Design,5.87,100,17677.0,United Kingdom
550006,2023-04-14,22692,Doormat Welcome To Our Home,18.4,1,17841.0,United Kingdom
550006,2023-04-14,22499,Wooden Union Jack Bunting,16.35,3,17841.0,United Kingdom
550006,2023-04-14,21935,Suki Shoulder Bag,11.94,1,17841.0,United Kingdom
550006,2023-04-14,85114B,Ivory Enchanted Forest Placemat,11.94,8,17841.0,United Kingdom
550006,2023-04-14,22241,Garland Wooden Happy Easter,11.53,4,17841.0,United Kingdom
550006,2023-04-14,21672,White Spot Red Ceramic Drawer Knob,11.53,2,17841.0,United Kingdom
550006,2023-04-14,21671,Red Spot Ceramic Drawer Knob,11.53,2,17841.0,United Kingdom
550006,2023-04-14,21668,Red Stripe Ceramic Drawer Knob,11.53,2,17841.0,United Kingdom
550006,2023-04-14,22799,Sweetheart Wire Fruit Bowl,18.96,1,17841.0,United Kingdom
550006,2023-04-14,22755,Small Purple Babushka Notebook,11.12,2,17841.0,United Kingdom
550006,2023-04-14,22753,Small Yellow Babushka Notebook,11.12,1,17841.0,United Kingdom
550006,2023-04-14,21927,Blue/Cream Stripe Cushion Cover,11.53,2,17841.0,United Kingdom
550006,2023-04-14,22726,Alarm Clock Bakelike Green,14.09,2,17841.0,United Kingdom
550006,2023-04-14,21382,Set/4 Spring Flower Decoration,13.27,1,17841.0,United Kingdom
550006,2023-04-14,22805,Blue Drawer Knob Acrylic Edwardian,11.53,4,17841.0,United Kingdom
550006,2023-04-14,21213,Pack Of 72 Skull Cake Cases,10.81,1,17841.0,United Kingdom
550006,2023-04-14,22355,Charlotte Bag Suki Design,11.12,1,17841.0,United Kingdom
550006,2023-04-14,22794,Sweetheart Wire Magazine Rack,18.4,1,17841.0,United Kingdom
550006,2023-04-14,22457,Natural Slate Heart Chalkboard,13.27,1,17841.0,United Kingdom
550006,2023-04-14,22676,French Blue Metal Door Sign 1,11.53,1,17841.0,United Kingdom
550006,2023-04-14,22681,French Blue Metal Door Sign 6,11.53,1,17841.0,United Kingdom
550006,2023-04-14,22683,French Blue Metal Door Sign 8,11.53,1,17841.0,United Kingdom
550006,2023-04-14,22134,Mini Ladle Love Heart Red,10.68,2,17841.0,United Kingdom
550006,2023-04-14,22467,Gumball Coat Rack,12.86,1,17841.0,United Kingdom
550006,2023-04-14,22188,Black Heart Card Holder,14.3,1,17841.0,United Kingdom
550006,2023-04-14,22467,Gumball Coat Rack,12.86,1,17841.0,United Kingdom
550006,2023-04-14,84992,72 Sweetheart Fairy Cake Cases,10.81,1,17841.0,United Kingdom
550006,2023-04-14,22417,Pack Of 60 Spaceboy Cake Cases,10.81,1,17841.0,United Kingdom
550006,2023-04-14,21558,Skull Lunch Box With Cutlery,12.86,2,17841.0,United Kingdom
550006,2023-04-14,22728,Alarm Clock Bakelike Pink,14.09,1,17841.0,United Kingdom
550006,2023-04-14,20724,Red Retrospot Charlotte Bag,11.12,1,17841.0,United Kingdom
550006,2023-04-14,22719,Gumball Monochrome Coat Rack,11.53,3,17841.0,United Kingdom
550006,2023-04-14,22980,Pantry Scrubbing Brush,11.94,1,17841.0,United Kingdom
550006,2023-04-14,22979,Pantry Washing Up Brush,11.74,1,17841.0,United Kingdom
550006,2023-04-14,22411,Jumbo Shopper Vintage Red Paisley,12.38,3,17841.0,United Kingdom
550006,2023-04-14,22087,Paper Bunting White Lace,13.27,2,17841.0,United Kingdom
550006,2023-04-14,22654,Deluxe Sewing Kit,16.35,1,17841.0,United Kingdom
550006,2023-04-14,20723,Strawberry Charlotte Bag,11.12,2,17841.0,United Kingdom
550006,2023-04-14,72351A,Set/6 Turquoise Butterfly T-Lights,12.4,2,17841.0,United Kingdom
550006,2023-04-14,23205,Charlotte Bag Vintage Alphabet,11.12,3,17841.0,United Kingdom
550006,2023-04-14,22356,Charlotte Bag Pink Polkadot,11.12,1,17841.0,United Kingdom
550006,2023-04-14,23204,Charlotte Bag Apples Design,11.12,2,17841.0,United Kingdom
550006,2023-04-14,79066K,Retro Mod Tray,11.12,1,17841.0,United Kingdom
550006,2023-04-14,22431,Watering Can Blue Elephant,12.25,1,17841.0,United Kingdom
550006,2023-04-14,23201,Jumbo Bag Alphabet,6.19,2,17841.0,United Kingdom
550006,2023-04-14,23199,Jumbo Bag Apples,6.19,2,17841.0,United Kingdom
550006,2023-04-14,85099B,Jumbo Bag Red Retrospot,6.19,3,17841.0,United Kingdom
550006,2023-04-14,22383,Lunch Bag Suki Design,5.97,1,17841.0,United Kingdom
550006,2023-04-14,23207,Lunch Bag Alphabet Design,5.97,3,17841.0,United Kingdom
550006,2023-04-14,23208,Lunch Bag Vintage Leaf Design,5.97,2,17841.0,United Kingdom
550006,2023-04-14,23206,Lunch Bag Apple Design,5.97,3,17841.0,United Kingdom
550007,2023-04-14,23204,Charlotte Bag Apples Design,10.99,100,15125.0,United Kingdom
550007,2023-04-14,23199,Jumbo Bag Apples,5.97,100,15125.0,United Kingdom
550007,2023-04-14,23208,Lunch Bag Vintage Leaf Design,5.87,100,15125.0,United Kingdom
550007,2023-04-14,23206,Lunch Bag Apple Design,5.87,100,15125.0,United Kingdom
550008,2023-04-14,84795B,Sunset Check Hammock,18.4,2,15570.0,United Kingdom
550008,2023-04-14,84879,Assorted Colour Bird Ornament,11.98,16,15570.0,United Kingdom
550008,2023-04-14,85123A,Cream Hanging Heart T-Light Holder,13.27,6,15570.0,United Kingdom
550008,2023-04-14,22727,Alarm Clock Bakelike Red,14.09,4,15570.0,United Kingdom
550008,2023-04-14,37370,Retro Coffee Mugs Assorted,11.53,12,15570.0,United Kingdom
550008,2023-04-14,22722,Set Of 6 Spice Tins Pantry Design,14.3,4,15570.0,United Kingdom
550008,2023-04-14,47566,Party Bunting,15.32,4,15570.0,United Kingdom
550008,2023-04-14,22431,Watering Can Blue Elephant,12.25,6,15570.0,United Kingdom
550008,2023-04-14,82484,Wood Black Board Ant White Finish,18.4,2,15570.0,United Kingdom
550008,2023-04-14,22456,Natural Slate Chalkboard Large,15.32,3,15570.0,United Kingdom
550008,2023-04-14,22488,Natural Slate Rectangle Chalkboard,11.94,12,15570.0,United Kingdom
550008,2023-04-14,22185,Slate Tile Natural Hanging,11.94,12,15570.0,United Kingdom
550008,2023-04-14,22192,Blue Diner Wall Clock,18.96,2,15570.0,United Kingdom
550011,2023-04-14,22970,London Bus Coffee Mug,12.86,1,13011.0,United Kingdom
550011,2023-04-14,22971,Queens Guard Coffee Mug,12.86,1,13011.0,United Kingdom
550011,2023-04-14,22960,Jam Making Set With Jars,14.61,1,13011.0,United Kingdom
550012,2023-04-14,84809A,White Chrysanthemums Art Flower,12.4,6,13012.0,United Kingdom
550012,2023-04-14,84799,Sprig Lavender Artificial Flower,11.53,4,13012.0,United Kingdom
550012,2023-04-14,84880,White Wire Egg Holder,17.94,1,13012.0,United Kingdom
550012,2023-04-14,22808,Set Of 6 T-Lights Easter Chicks,13.27,1,13012.0,United Kingdom
550012,2023-04-14,23183,Mother's Kitchen Spoon Rest,14.09,1,13012.0,United Kingdom
550012,2023-04-14,22956,36 Foil Heart Cake Cases,12.4,1,13012.0,United Kingdom
550012,2023-04-14,22992,Revolver Wooden Ruler,12.25,1,13012.0,United Kingdom
550012,2023-04-14,22440,Balloon Water Bomb Pack Of 35,10.68,2,13012.0,United Kingdom
550012,2023-04-14,22907,Pack Of 20 Napkins Pantry Design,11.12,2,13012.0,United Kingdom
550015,2023-04-14,22488,Natural Slate Rectangle Chalkboard,11.94,12,17735.0,United Kingdom
550015,2023-04-14,21907,I'm On Holiday Metal Sign,12.4,12,17735.0,United Kingdom
550015,2023-04-14,21169,You're Confusing Me Metal Sign,11.98,12,17735.0,United Kingdom
550015,2023-04-14,22413,Metal Sign Take It Or Leave It,13.27,6,17735.0,United Kingdom
550015,2023-04-14,21181,Please One Person Metal Sign,12.4,12,17735.0,United Kingdom
550015,2023-04-14,21175,Gin And Tonic Diet Metal Sign,12.86,12,17735.0,United Kingdom
550015,2023-04-14,23155,Knickerbockerglory Magnet Assorted,11.1,12,17735.0,United Kingdom
550015,2023-04-14,21936,Red Retrospot Picnic Bag,13.27,5,17735.0,United Kingdom
550015,2023-04-14,22652,Travel Sewing Kit,11.94,10,17735.0,United Kingdom
550015,2023-04-14,21931,Jumbo Storage Bag Suki,12.38,10,17735.0,United Kingdom
550015,2023-04-14,21481,Fawn Blue Hot Water Bottle,13.27,6,17735.0,United Kingdom
550015,2023-04-14,21479,White Skull Hot Water Bottle,14.09,4,17735.0,United Kingdom
550015,2023-04-14,20975,12 Pencils Small Tube Red Retrospot,10.92,24,17735.0,United Kingdom
550015,2023-04-14,20973,12 Pencil Small Tube Woodland,10.92,24,17735.0,United Kingdom
550015,2023-04-14,20974,12 Pencils Small Tube Skull,10.92,24,17735.0,United Kingdom
550015,2023-04-14,22756,Large Yellow Babushka Notebook,11.53,12,17735.0,United Kingdom
550015,2023-04-14,22757,Large Red Babushka Notebook,11.53,12,17735.0,United Kingdom
550015,2023-04-14,22753,Small Yellow Babushka Notebook,11.12,12,17735.0,United Kingdom
550015,2023-04-14,22754,Small Red Babushka Notebook,11.12,12,17735.0,United Kingdom
550015,2023-04-14,20971,Pink Blue Felt Craft Trinket Box,11.53,12,17735.0,United Kingdom
550015,2023-04-14,22273,Feltcraft Doll Molly,13.27,6,17735.0,United Kingdom
550015,2023-04-14,22749,Feltcraft Princess Charlotte Doll,14.09,4,17735.0,United Kingdom
550015,2023-04-14,23126,Feltcraft Girl Amelie Kit,15.32,4,17735.0,United Kingdom
550015,2023-04-14,23127,Feltcraft Girl Nicole Kit,15.32,4,17735.0,United Kingdom
550015,2023-04-14,23128,Feltcraft Boy Jean-Paul Kit,15.32,4,17735.0,United Kingdom
550015,2023-04-14,22534,Magic Drawing Slate Spaceboy,10.68,24,17735.0,United Kingdom
550015,2023-04-14,22537,Magic Drawing Slate Dinosaur,10.68,24,17735.0,United Kingdom
550015,2023-04-14,22533,Magic Drawing Slate Bake A Cake,10.68,24,17735.0,United Kingdom
550015,2023-04-14,21718,Red Metal Beach Spade,11.53,12,17735.0,United Kingdom
550015,2023-04-14,21913,Vintage Seaside Jigsaw Puzzles,14.09,4,17735.0,United Kingdom
550015,2023-04-14,21912,Vintage Snakes & Ladders,14.09,4,17735.0,United Kingdom
550015,2023-04-14,22492,Mini Paint Set Vintage,10.92,36,17735.0,United Kingdom
550015,2023-04-14,22560,Traditional Modelling Clay,11.53,24,17735.0,United Kingdom
550015,2023-04-14,21703,Bag 125g Swirly Marbles,10.68,12,17735.0,United Kingdom
550015,2023-04-14,22550,Holiday Fun Ludo,14.09,4,17735.0,United Kingdom
550015,2023-04-14,22138,Baking Set 9 Piece Retrospot,15.32,3,17735.0,United Kingdom
550015,2023-04-14,22326,Round Snack Boxes Set Of4 Woodland,13.27,6,17735.0,United Kingdom
550015,2023-04-14,22327,Round Snack Boxes Set Of 4 Skulls,13.27,6,17735.0,United Kingdom
550015,2023-04-14,21558,Skull Lunch Box With Cutlery,12.86,6,17735.0,United Kingdom
550015,2023-04-14,21561,Dinosaur Lunch Box With Cutlery,12.86,6,17735.0,United Kingdom
550015,2023-04-14,21559,Strawberry Lunch Box With Cutlery,12.86,6,17735.0,United Kingdom
550015,2023-04-14,22631,Circus Parade Lunch Box,12.25,12,17735.0,United Kingdom
550015,2023-04-14,22617,Baking Set Spaceboy Design,15.32,3,17735.0,United Kingdom
550015,2023-04-14,21715,Girls Vintage Tin Seaside Bucket,12.86,8,17735.0,United Kingdom
550015,2023-04-14,20712,Jumbo Bag Woodland Animals,6.19,10,17735.0,United Kingdom
550015,2023-04-14,22385,Jumbo Bag Spaceboy Design,6.19,10,17735.0,United Kingdom
550015,2023-04-14,22383,Lunch Bag Suki Design,5.97,10,17735.0,United Kingdom
550015,2023-04-14,20727,Lunch Bag Black Skull,5.97,10,17735.0,United Kingdom
550015,2023-04-14,22382,Lunch Bag Spaceboy Design,5.97,10,17735.0,United Kingdom
550015,2023-04-14,22662,Lunch Bag Dolly Girl Design,5.97,10,17735.0,United Kingdom
550016,2023-04-14,22241,Garland Wooden Happy Easter,11.53,12,15416.0,United Kingdom
550016,2023-04-14,79000,Moroccan Tea Glass,11.12,12,15416.0,United Kingdom
550016,2023-04-14,48188,Doormat Welcome Puppies,18.4,2,15416.0,United Kingdom
550016,2023-04-14,22139,Retrospot Tea Set Ceramic 11 Pc,15.32,3,15416.0,United Kingdom
550016,2023-04-14,21878,Pack Of 6 Sandcastle Flags Assorted,11.12,12,15416.0,United Kingdom
550016,2023-04-14,22621,Traditional Knitting Nancy,11.94,12,15416.0,United Kingdom
550016,2023-04-14,21181,Please One Person Metal Sign,12.4,12,15416.0,United Kingdom
550016,2023-04-14,21169,You're Confusing Me Metal Sign,11.98,12,15416.0,United Kingdom
550016,2023-04-14,22250,Decoration Butterfly Magic Garden,11.12,16,15416.0,United Kingdom
550016,2023-04-14,22247,Bunny Decoration Magic Garden,11.12,16,15416.0,United Kingdom
550016,2023-04-14,22367,Childrens Apron Spaceboy Design,12.25,8,15416.0,United Kingdom
550016,2023-04-14,47591D,Pink Fairy Cake Childrens Apron,12.25,8,15416.0,United Kingdom
550016,2023-04-14,22249,Decoration White Chick Magic Garden,11.12,16,15416.0,United Kingdom
550016,2023-04-14,21389,Ivory Hanging Decoration Bird,11.12,12,15416.0,United Kingdom
550016,2023-04-14,22266,Easter Decoration Hanging Bunny,10.92,48,15416.0,United Kingdom
550016,2023-04-14,21383,Pack Of 12 Sticky Bunnies,10.92,36,15416.0,United Kingdom
550016,2023-04-14,22957,Set 3 Paper Vintage Chick Paper Egg,13.27,12,15416.0,United Kingdom
