TransactionNo,Date,ProductNo,ProductName,Price,Quantity,CustomerNo,Country
569202,2023-09-30,84078A,Set/4 White Retro Storage Cubes,70.0,1,12202.0,United Kingdom
569133,2023-09-30,84078A,Set/4 White Retro Storage Cubes,51.2,2,15185.0,United Kingdom
569137,2023-09-30,22526,Wheelbarrow For Children,35.83,1,16137.0,United Kingdom
569137,2023-09-30,21217,Red Retrospot Round Cake Tins,31.56,1,16137.0,United Kingdom
569137,2023-09-30,23173,Regency Teapot Roses,30.71,3,16137.0,United Kingdom
569202,2023-09-30,22776,Sweetheart 3 Tier Cake Stand,30.71,1,12202.0,United Kingdom
569060,2023-09-30,22846,Bread Bin Diner Style Red,27.62,1,13954.0,United Kingdom
569060,2023-09-30,22847,Bread Bin Diner Style Ivory,27.62,2,13954.0,United Kingdom
569129,2023-09-30,22847,Bread Bin Diner Style Ivory,27.62,2,15034.0,United Kingdom
569129,2023-09-30,22846,Bread Bin Diner Style Red,27.62,2,15034.0,United Kingdom
569137,2023-09-30,22193,Red Diner Wall Clock,27.3,1,16137.0,United Kingdom
569137,2023-09-30,22692,Doormat Welcome To Our Home,27.3,1,16137.0,United Kingdom
569137,2023-09-30,22844,Vintage Cream Dog Food Container,27.3,1,16137.0,United Kingdom
569202,2023-09-30,22946,Wooden Advent Calendar Cream,27.3,1,12202.0,United Kingdom
569202,2023-09-30,23284,Doormat Keep Calm And Come In,27.3,1,12202.0,United Kingdom
569202,2023-09-30,22169,Family Album White Picture Frame,27.3,2,12202.0,United Kingdom
569137,2023-09-30,22786,Cushion Cover Pink Union Jack,26.43,1,16137.0,United Kingdom
569202,2023-09-30,23016,Glass Twist Bon Bon Jar,26.43,1,12202.0,United Kingdom
569202,2023-09-30,23412,Heart Mirror Antique White,26.43,1,12202.0,United Kingdom
569202,2023-09-30,48116,Doormat Multicolour Stripe,26.43,1,12202.0,United Kingdom
569202,2023-09-30,21257,Victorian Sewing Box Medium,26.43,1,12202.0,United Kingdom
569202,2023-09-30,22365,Doormat Respectable House,26.43,1,12202.0,United Kingdom
569137,2023-09-30,22781,Gumball Magazine Rack,25.58,1,16137.0,United Kingdom
569021,2023-09-30,22847,Bread Bin Diner Style Ivory,25.57,4,15321.0,United Kingdom
569082,2023-09-30,22847,Bread Bin Diner Style Ivory,25.57,4,18229.0,United Kingdom
569097,2023-09-30,23010,Circus Parade Baby Gift Set,25.57,12,12731.0,France
569140,2023-09-30,22605,Wooden Croquet Garden Set,25.57,2,14503.0,United Kingdom
569137,2023-09-30,48111,Doormat 3 Smiley Cats,24.73,1,16137.0,United Kingdom
569137,2023-09-30,48185,Doormat Fairy Cake,24.73,1,16137.0,United Kingdom
569137,2023-09-30,22179,Set 10 Night Owl Lights,23.87,1,16137.0,United Kingdom
569202,2023-09-30,22170,Picture Frame Wood Triple Portrait,23.87,3,12202.0,United Kingdom
569020,2023-09-30,85066,Cream Sweetheart Mini Chest,23.32,2,15321.0,United Kingdom
569025,2023-09-30,22485,Set Of 2 Wooden Market Crates,23.32,6,18041.0,United Kingdom
569122,2023-09-30,22236,Cake Stand 3 Tier Magic Garden,23.32,4,12694.0,France
569122,2023-09-30,22423,Regency Cakestand 3 Tier,23.32,4,12694.0,France
569139,2023-09-30,22423,Regency Cakestand 3 Tier,23.32,2,16404.0,United Kingdom
569143,2023-09-30,22423,Regency Cakestand 3 Tier,23.32,2,15867.0,United Kingdom
C569038,2023-09-30,22423,Regency Cakestand 3 Tier,23.32,-1,12940.0,United Kingdom
C569114,2023-09-30,22423,Regency Cakestand 3 Tier,23.32,-1,14911.0,EIRE
569026,2023-09-30,23111,Parisienne Sewing Box,23.06,1,16101.0,United Kingdom
569103,2023-09-30,23427,Stool Home Sweet Home,23.06,1,16133.0,United Kingdom
569139,2023-09-30,23427,Stool Home Sweet Home,23.06,2,16404.0,United Kingdom
569137,2023-09-30,20679,Edwardian Parasol Red,23.02,1,16137.0,United Kingdom
569202,2023-09-30,23110,Parisienne Key Cabinet,23.02,2,12202.0,United Kingdom
569202,2023-09-30,21755,Love Building Block Word,23.02,1,12202.0,United Kingdom
569202,2023-09-30,21754,Home Building Block Word,22.17,1,12202.0,United Kingdom
569122,2023-09-30,21843,Red Retrospot Cake Stand,21.47,5,12694.0,France
569137,2023-09-30,21216,Set 3 Retrospot Tea/Coffee/Sugar,21.31,2,16137.0,United Kingdom
569137,2023-09-30,22278,Overnight Bag Vintage Rose Paisley,21.31,2,16137.0,United Kingdom
569137,2023-09-30,23245,Set Of 3 Regency Cake Tins,21.31,3,16137.0,United Kingdom
569137,2023-09-30,23404,Home Sweet Home Blackboard,21.31,1,16137.0,United Kingdom
569202,2023-09-30,22835,Hot Water Bottle I Am So Poorly,21.31,1,12202.0,United Kingdom
569202,2023-09-30,23007,Spaceboy Baby Gift Set,21.31,2,12202.0,United Kingdom
569202,2023-09-30,23008,Dolly Girl Baby Gift Set,21.31,1,12202.0,United Kingdom
569202,2023-09-30,23243,Set Of Tea Coffee Sugar Tins Pantry,21.31,1,12202.0,United Kingdom
569202,2023-09-30,23245,Set Of 3 Regency Cake Tins,21.31,2,12202.0,United Kingdom
569202,2023-09-30,23313,Vintage Christmas Bunting,21.31,1,12202.0,United Kingdom
569202,2023-09-30,23393,Home Sweet Home Cushion Cover,21.31,1,12202.0,United Kingdom
569202,2023-09-30,23396,Le Jardin Botanique Cushion Cover,21.31,3,12202.0,United Kingdom
569202,2023-09-30,23404,Home Sweet Home Blackboard,21.31,1,12202.0,United Kingdom
569202,2023-09-30,23413,Decorative Vintage Coffee Box,21.31,1,12202.0,United Kingdom
569202,2023-09-30,22112,Chocolate Hot Water Bottle,21.31,1,12202.0,United Kingdom
C569114,2023-09-30,22832,Brocante Shelf With Hooks,21.27,-2,14911.0,EIRE
569010,2023-09-30,23245,Set Of 3 Regency Cake Tins,14.5,48,14156.0,EIRE
569010,2023-09-30,23298,Spotty Bunting,14.5,200,14156.0,EIRE
569010,2023-09-30,23163,Regency Sugar Tongs,12.38,48,14156.0,EIRE
569010,2023-09-30,23162,Regency Tea Strainer,13.62,48,14156.0,EIRE
569010,2023-09-30,22989,Set 2 Pantry Design Tea Towels,13.07,100,14156.0,EIRE
569010,2023-09-30,22978,Pantry Rolling Pin,13.72,48,14156.0,EIRE
569010,2023-09-30,22795,Sweetheart Recipe Book Stand,16.35,48,14156.0,EIRE
569010,2023-09-30,22637,Piggy Bank Retrospot,12.4,96,14156.0,EIRE
569010,2023-09-30,22615,Pack Of 12 Circus Parade Tissues,10.65,96,14156.0,EIRE
569010,2023-09-30,22548,Heads And Tails Sporting Fun,11.34,72,14156.0,EIRE
569010,2023-09-30,22492,Mini Paint Set Vintage,10.92,216,14156.0,EIRE
569010,2023-09-30,21888,Bingo Set,13.72,72,14156.0,EIRE
569010,2023-09-30,21539,Red Retrospot Butter Dish,14.61,72,14156.0,EIRE
569010,2023-09-30,21485,Retrospot Heart Hot Water Bottle,14.61,72,14156.0,EIRE
569010,2023-09-30,21216,Set 3 Retrospot Tea/Coffee/Sugar,14.61,72,14156.0,EIRE
569010,2023-09-30,20983,12 Pencils Tall Tube Red Retrospot,11.12,96,14156.0,EIRE
569010,2023-09-30,84077,World War 2 Gliders Asstd Designs,10.55,144,14156.0,EIRE
569010,2023-09-30,22112,Chocolate Hot Water Bottle,14.61,96,14156.0,EIRE
569010,2023-09-30,21523,Doormat Fancy Font Home Sweet Home,17.51,40,14156.0,EIRE
569010,2023-09-30,21914,Blue Harmonica In Box,11.53,96,14156.0,EIRE
569010,2023-09-30,21915,Red Harmonica In Box,11.53,96,14156.0,EIRE
569010,2023-09-30,23032,Drawer Knob Crackle Glaze Ivory,11.74,96,14156.0,EIRE
569010,2023-09-30,23205,Charlotte Bag Vintage Alphabet,10.99,100,14156.0,EIRE
569010,2023-09-30,21165,Beware Of The Cat Metal Sign,11.74,192,14156.0,EIRE
569010,2023-09-30,21166,Cook With Wine Metal Sign,12.15,192,14156.0,EIRE
569010,2023-09-30,21787,Rain Poncho Retrospot,11.12,72,14156.0,EIRE
569010,2023-09-30,21169,You're Confusing Me Metal Sign,11.74,192,14156.0,EIRE
569011,2023-09-30,23424,Gingham Recipe Book Box,15.32,4,14655.0,United Kingdom
569011,2023-09-30,23493,Vintage Doily Travel Sewing Kit,12.25,40,14655.0,United Kingdom
569011,2023-09-30,47566,Party Bunting,15.32,4,14655.0,United Kingdom
569011,2023-09-30,23077,Doughnut Lip Gloss,11.53,40,14655.0,United Kingdom
569011,2023-09-30,23076,Ice Cream Sundae Lip Gloss,11.53,48,14655.0,United Kingdom
569011,2023-09-30,22632,Hand Warmer Red Retrospot,12.4,12,14655.0,United Kingdom
569011,2023-09-30,22633,Hand Warmer Union Jack,12.4,12,14655.0,United Kingdom
569011,2023-09-30,23355,Hot Water Bottle Keep Calm,15.32,4,14655.0,United Kingdom
569011,2023-09-30,21485,Retrospot Heart Hot Water Bottle,15.32,3,14655.0,United Kingdom
569011,2023-09-30,23088,Zinc Heart Flower T-Light Holder,11.53,16,14655.0,United Kingdom
569011,2023-09-30,23215,Jingle Bell Heart Antique Silver,12.38,12,14655.0,United Kingdom
569011,2023-09-30,22435,Set Of 9 Heart Shaped Balloons,11.53,24,14655.0,United Kingdom
569011,2023-09-30,22436,12 Coloured Party Balloons,10.92,20,14655.0,United Kingdom
569012,2023-09-30,23320,Giant 50'S Christmas Cracker,13.21,12,15187.0,United Kingdom
569012,2023-09-30,23350,Roll Wrap Vintage Spot,11.53,12,15187.0,United Kingdom
569012,2023-09-30,23466,Tuscan Villa Dovecote Bird Feeder,18.71,2,15187.0,United Kingdom
569012,2023-09-30,22979,Pantry Washing Up Brush,11.74,12,15187.0,United Kingdom
569012,2023-09-30,22966,Gingerbread Man Cookie Cutter,11.53,12,15187.0,United Kingdom
569012,2023-09-30,23368,Set 12 Colour Pencils Dolly Girl,10.92,16,15187.0,United Kingdom
569012,2023-09-30,21915,Red Harmonica In Box,11.53,12,15187.0,United Kingdom
569012,2023-09-30,23507,Mini Playing Cards Buffalo Bill,10.68,20,15187.0,United Kingdom
569012,2023-09-30,23508,Mini Playing Cards Dolly Girl,10.68,20,15187.0,United Kingdom
569012,2023-09-30,23176,Abc Treasure Book Box,12.56,8,15187.0,United Kingdom
569012,2023-09-30,22553,Plasters In Tin Skulls,11.94,12,15187.0,United Kingdom
569012,2023-09-30,20974,12 Pencils Small Tube Skull,10.92,24,15187.0,United Kingdom
569013,2023-09-30,84945,Multi Colour Silver T-Light Holder,11.12,48,15187.0,United Kingdom
569013,2023-09-30,22630,Dolly Girl Lunch Box,12.25,12,15187.0,United Kingdom
569014,2023-09-30,23329,Decorative Wicker Heart Large,11.94,12,18053.0,United Kingdom
569014,2023-09-30,23367,Set 12 Colour Pencils Spaceboy,10.92,16,18053.0,United Kingdom
569014,2023-09-30,23365,Set 12 Colour Pencils Love London,10.92,16,18053.0,United Kingdom
569014,2023-09-30,22971,Queens Guard Coffee Mug,12.86,6,18053.0,United Kingdom
569014,2023-09-30,22970,London Bus Coffee Mug,12.86,6,18053.0,United Kingdom
569014,2023-09-30,23547,Wrap Flower Shop,10.68,25,18053.0,United Kingdom
569014,2023-09-30,22710,Wrap I Love London,10.68,25,18053.0,United Kingdom
569014,2023-09-30,23286,Blue Vintage Spot Beaker,11.12,16,18053.0,United Kingdom
569014,2023-09-30,23285,Pink Vintage Spot Beaker,11.12,16,18053.0,United Kingdom
569014,2023-09-30,22624,Ivory Kitchen Scales,18.96,2,18053.0,United Kingdom
569014,2023-09-30,22302,Coffee Mug Pears Design,12.86,12,18053.0,United Kingdom
569014,2023-09-30,85123A,Cream Hanging Heart T-Light Holder,13.27,12,18053.0,United Kingdom
569014,2023-09-30,23263,Set Of 3 Wooden Heart Decorations,11.53,12,18053.0,United Kingdom
569014,2023-09-30,23265,Set Of 3 Wooden Tree Decorations,11.53,12,18053.0,United Kingdom
569014,2023-09-30,84836,Zinc Metal Heart Decoration,11.53,12,18053.0,United Kingdom
569014,2023-09-30,22594,Christmas Gingham Tree,11.12,12,18053.0,United Kingdom
569014,2023-09-30,22579,Wooden Tree Christmas Scandinavian,10.55,26,18053.0,United Kingdom
569014,2023-09-30,22578,Wooden Star Christmas Scandinavian,10.55,26,18053.0,United Kingdom
569014,2023-09-30,22577,Wooden Heart Christmas Scandinavian,10.55,26,18053.0,United Kingdom
569014,2023-09-30,23332,Ivory Wicker Heart Large,11.94,12,18053.0,United Kingdom
569015,2023-09-30,23434,3 Raffia Ribbons 50'S Christmas,11.06,10,13575.0,United Kingdom
569015,2023-09-30,23435,3 Raffia Ribbons Vintage Christmas,11.06,10,13575.0,United Kingdom
569015,2023-09-30,23311,Vintage Christmas Stocking,12.86,6,13575.0,United Kingdom
569015,2023-09-30,23354,6 Gift Tags 50'S Christmas,11.1,12,13575.0,United Kingdom
569015,2023-09-30,23323,White Wicker Star,12.4,12,13575.0,United Kingdom
569015,2023-09-30,22186,Red Star Card Holder,12.25,12,13575.0,United Kingdom
569015,2023-09-30,82494L,Wooden Frame Antique White,13.27,6,13575.0,United Kingdom
569015,2023-09-30,82482,Wooden Picture Frame White Finish,13.27,6,13575.0,United Kingdom
569015,2023-09-30,22969,Homemade Jam Scented Candles,11.74,12,13575.0,United Kingdom
569015,2023-09-30,22310,Ivory Knitted Mug Cosy,11.94,6,13575.0,United Kingdom
569015,2023-09-30,23147,Single Antique Rose Hook Ivory,11.74,12,13575.0,United Kingdom
569015,2023-09-30,20983,12 Pencils Tall Tube Red Retrospot,11.12,12,13575.0,United Kingdom
569015,2023-09-30,20981,12 Pencils Tall Tube Woodland,11.12,12,13575.0,United Kingdom
569015,2023-09-30,20982,12 Pencils Tall Tube Skulls,11.12,12,13575.0,United Kingdom
569015,2023-09-30,20727,Lunch Bag Black Skull,5.97,10,13575.0,United Kingdom
569016,2023-09-30,22577,Wooden Heart Christmas Scandinavian,10.55,24,14916.0,United Kingdom
569016,2023-09-30,22578,Wooden Star Christmas Scandinavian,10.55,24,14916.0,United Kingdom
569016,2023-09-30,20972,Pink Cream Felt Craft Trinket Box,11.53,12,14916.0,United Kingdom
569016,2023-09-30,23229,Vintage Donkey Tail Game,14.09,6,14916.0,United Kingdom
569016,2023-09-30,21891,Traditional Wooden Skipping Rope,11.74,12,14916.0,United Kingdom
569016,2023-09-30,22620,4 Traditional Spinning Tops,11.74,12,14916.0,United Kingdom
569016,2023-09-30,21232,Strawberry Ceramic Trinket Pot,11.53,12,14916.0,United Kingdom
569016,2023-09-30,84077,World War 2 Gliders Asstd Designs,10.55,48,14916.0,United Kingdom
569016,2023-09-30,21703,Bag 125g Swirly Marbles,10.68,12,14916.0,United Kingdom
569016,2023-09-30,23096,Petit Tray Chic,11.94,12,14916.0,United Kingdom
569016,2023-09-30,22488,Natural Slate Rectangle Chalkboard,11.94,12,14916.0,United Kingdom
569016,2023-09-30,23328,Set 6 School Milk Bottles In Crate,14.09,4,14916.0,United Kingdom
569016,2023-09-30,22610,Pens Assorted Funny Face,10.44,36,14916.0,United Kingdom
569016,2023-09-30,84375,Set Of 20 Kids Cookie Cutters,12.4,24,14916.0,United Kingdom
569016,2023-09-30,23263,Set Of 3 Wooden Heart Decorations,11.53,12,14916.0,United Kingdom
569016,2023-09-30,22571,Rocking Horse Red Christmas,11.12,12,14916.0,United Kingdom
569016,2023-09-30,22596,Christmas Star Wish List Chalkboard,11.53,12,14916.0,United Kingdom
569016,2023-09-30,85099B,Jumbo Bag Red Retrospot,6.19,10,14916.0,United Kingdom
569016,2023-09-30,23374,Red Spot Paper Gift Bag,5.55,10,14916.0,United Kingdom
569017,2023-09-30,85014A,Black/Blue Polkadot Umbrella,16.35,3,13813.0,Germany
569017,2023-09-30,23515,Embroidered Ribbon Reel Daisy,12.38,6,13813.0,Germany
569017,2023-09-30,23518,Embroidered Ribbon Reel Rachel,13.21,6,13813.0,Germany
569017,2023-09-30,23513,Embroidered Ribbon Reel Susie,12.38,6,13813.0,Germany
569017,2023-09-30,23517,Embroidered Ribbon Reel Rebecca,13.21,6,13813.0,Germany
569017,2023-09-30,23520,Embroidered Ribbon Reel Ruby,14.09,6,13813.0,Germany
569017,2023-09-30,23508,Mini Playing Cards Dolly Girl,10.68,20,13813.0,Germany
569017,2023-09-30,23502,Playing Cards Vintage Doily,11.53,12,13813.0,Germany
569017,2023-09-30,23493,Vintage Doily Travel Sewing Kit,12.25,10,13813.0,Germany
569017,2023-09-30,23395,Belle Jardiniere Cushion Cover,14.09,4,13813.0,Germany
569017,2023-09-30,22186,Red Star Card Holder,12.25,12,13813.0,Germany
569017,2023-09-30,21498,Red Retrospot Wrap,10.68,25,13813.0,Germany
569017,2023-09-30,23231,Wrap Vintage Doily,10.68,25,13813.0,Germany
569017,2023-09-30,23546,Wrap Paisley Park,10.68,25,13813.0,Germany
569017,2023-09-30,22393,Paperweight Vintage Collage,12.86,6,13813.0,Germany
569018,2023-09-30,23076,Ice Cream Sundae Lip Gloss,11.53,24,12676.0,Sweden
569018,2023-09-30,23368,Set 12 Colour Pencils Dolly Girl,10.92,16,12676.0,Sweden
569018,2023-09-30,22090,Paper Bunting Retrospot,13.27,12,12676.0,Sweden
569018,2023-09-30,23508,Mini Playing Cards Dolly Girl,10.68,20,12676.0,Sweden
569018,2023-09-30,22531,Magic Drawing Slate Circus Parade,10.68,24,12676.0,Sweden
569018,2023-09-30,21210,Set Of 72 Retrospot Paper Doilies,11.74,12,12676.0,Sweden
569019,2023-09-30,22464,Hanging Metal Heart Lantern,11.94,12,15602.0,United Kingdom
569019,2023-09-30,23057,Beaded Chandelier T-Light Holder,15.32,12,15602.0,United Kingdom
569019,2023-09-30,84946,Antique Silver T-Light Glass,11.53,24,15602.0,United Kingdom
569019,2023-09-30,22460,Embossed Glass Tealight Holder,11.53,12,15602.0,United Kingdom
569019,2023-09-30,22178,Victorian Glass Hanging T-Light,12.25,24,15602.0,United Kingdom
569019,2023-09-30,21811,Hanging Heart With Bell,10.65,48,15602.0,United Kingdom
569019,2023-09-30,21809,Christmas Hanging Tree With Bell,10.65,48,15602.0,United Kingdom
569019,2023-09-30,21822,Glitter Christmas Tree With Bells,11.06,12,15602.0,United Kingdom
569019,2023-09-30,22154,Angel Decoration 3 Buttons,10.68,48,15602.0,United Kingdom
569019,2023-09-30,22153,Angel Decoration Stars On Dress,10.68,48,15602.0,United Kingdom
569019,2023-09-30,22575,Metal Merry Christmas Wreath,12.25,16,15602.0,United Kingdom
569019,2023-09-30,22158,3 Hearts Hanging Decoration Rustic,13.27,24,15602.0,United Kingdom
569019,2023-09-30,22047,Empire Gift Wrap,10.68,25,15602.0,United Kingdom
569019,2023-09-30,23232,Wrap Vintage Leaf Design,10.68,25,15602.0,United Kingdom
569019,2023-09-30,23233,Wrap Poppies Design,10.68,25,15602.0,United Kingdom
569019,2023-09-30,21498,Red Retrospot Wrap,10.68,25,15602.0,United Kingdom
569020,2023-09-30,82583,Hot Baths Metal Sign,12.4,12,15321.0,United Kingdom
569020,2023-09-30,21166,Cook With Wine Metal Sign,12.38,12,15321.0,United Kingdom
569020,2023-09-30,21174,Pottering In The Shed Metal Sign,12.38,12,15321.0,United Kingdom
569020,2023-09-30,21908,Chocolate This Way Metal Sign,12.4,12,15321.0,United Kingdom
569020,2023-09-30,23426,Metal Sign Drop Your Pants,13.21,6,15321.0,United Kingdom
569020,2023-09-30,21175,Gin And Tonic Diet Metal Sign,12.86,12,15321.0,United Kingdom
569020,2023-09-30,48138,Doormat Union Flag,18.71,6,15321.0,United Kingdom
569020,2023-09-30,23284,Doormat Keep Calm And Come In,18.71,6,15321.0,United Kingdom
569020,2023-09-30,22690,Doormat Home Sweet Home Blue,18.71,6,15321.0,United Kingdom
569020,2023-09-30,23355,Hot Water Bottle Keep Calm,15.32,8,15321.0,United Kingdom
569020,2023-09-30,23356,Love Hot Water Bottle,16.35,6,15321.0,United Kingdom
569020,2023-09-30,22113,Grey Heart Hot Water Bottle,14.61,8,15321.0,United Kingdom
569020,2023-09-30,23254,Childrens Cutlery Dolly Girl,14.5,8,15321.0,United Kingdom
569020,2023-09-30,22750,Feltcraft Princess Lola Doll,14.09,8,15321.0,United Kingdom
569020,2023-09-30,22751,Feltcraft Princess Olivia Doll,14.09,8,15321.0,United Kingdom
569020,2023-09-30,22749,Feltcraft Princess Charlotte Doll,14.09,8,15321.0,United Kingdom
569020,2023-09-30,22274,Feltcraft Doll Emily,13.27,6,15321.0,United Kingdom
569020,2023-09-30,22273,Feltcraft Doll Molly,13.27,6,15321.0,United Kingdom
569020,2023-09-30,22271,Feltcraft Doll Rosie,13.27,6,15321.0,United Kingdom
569020,2023-09-30,20972,Pink Cream Felt Craft Trinket Box,11.53,12,15321.0,United Kingdom
569020,2023-09-30,20971,Pink Blue Felt Craft Trinket Box,11.53,12,15321.0,United Kingdom
569020,2023-09-30,22147,Feltcraft Butterfly Hearts,11.74,12,15321.0,United Kingdom
569020,2023-09-30,22150,3 Stripey Mice Feltcraft,12.25,6,15321.0,United Kingdom
569020,2023-09-30,84077,World War 2 Gliders Asstd Designs,10.55,48,15321.0,United Kingdom
569020,2023-09-30,22550,Holiday Fun Ludo,14.09,4,15321.0,United Kingdom
569020,2023-09-30,23229,Vintage Donkey Tail Game,14.09,6,15321.0,United Kingdom
569020,2023-09-30,21918,Set 12 Kids Colour Chalk Sticks,10.68,24,15321.0,United Kingdom
569020,2023-09-30,21917,Set 12 Kids White Chalk Sticks,10.68,24,15321.0,United Kingdom
569020,2023-09-30,22548,Heads And Tails Sporting Fun,11.53,12,15321.0,United Kingdom
569020,2023-09-30,23503,Playing Cards Keep Calm & Carry On,11.53,12,15321.0,United Kingdom
569020,2023-09-30,22960,Jam Making Set With Jars,14.61,6,15321.0,United Kingdom
569020,2023-09-30,22961,Jam Making Set Printed,11.74,12,15321.0,United Kingdom
569020,2023-09-30,22191,Ivory Diner Wall Clock,18.96,2,15321.0,United Kingdom
569020,2023-09-30,22193,Red Diner Wall Clock,18.96,2,15321.0,United Kingdom
569020,2023-09-30,22189,Cream Heart Card Holder,14.3,12,15321.0,United Kingdom
569020,2023-09-30,21314,Small Glass Heart Trinket Pot,12.4,8,15321.0,United Kingdom
569020,2023-09-30,22152,Place Setting White Star,10.68,24,15321.0,United Kingdom
569020,2023-09-30,22151,Place Setting White Heart,10.68,24,15321.0,United Kingdom
569020,2023-09-30,23152,Ivory Sweetheart Wire Letter Rack,14.09,4,15321.0,United Kingdom
569020,2023-09-30,23469,Card Holder Love Bird Small,14.5,6,15321.0,United Kingdom
569020,2023-09-30,23274,Star T-Light Holder Willie Winkie,11.94,24,15321.0,United Kingdom
569020,2023-09-30,23273,Heart T-Light Holder Willie Winkie,11.94,24,15321.0,United Kingdom
569020,2023-09-30,23129,Heart Shaped Holly Wreath,14.5,8,15321.0,United Kingdom
569020,2023-09-30,23130,Mistletoe Heart Wreath Green,14.5,8,15321.0,United Kingdom
569020,2023-09-30,85048,15cm Christmas Glass Ball 20 Lights,17.37,12,15321.0,United Kingdom
569020,2023-09-30,23101,Silver Stars Table Decoration,11.1,24,15321.0,United Kingdom
569020,2023-09-30,23102,Silver Hearts Table Decoration,11.1,24,15321.0,United Kingdom
569021,2023-09-30,23284,Doormat Keep Calm And Come In,17.17,10,15321.0,United Kingdom
569021,2023-09-30,23254,Childrens Cutlery Dolly Girl,14.5,8,15321.0,United Kingdom
569021,2023-09-30,23256,Childrens Cutlery Spaceboy,14.5,8,15321.0,United Kingdom
569021,2023-09-30,85150,Ladies & Gentlemen Metal Sign,12.86,6,15321.0,United Kingdom
569021,2023-09-30,82583,Hot Baths Metal Sign,12.4,12,15321.0,United Kingdom
569021,2023-09-30,23237,Set Of 4 Knick Knack Tins Leaf,14.5,12,15321.0,United Kingdom
569021,2023-09-30,23239,Set Of 4 Knick Knack Tins Poppies,14.5,12,15321.0,United Kingdom
569021,2023-09-30,23206,Lunch Bag Apple Design,5.97,10,15321.0,United Kingdom
569022,2023-09-30,84347,Rotating Silver Angels T-Light Hldr,12.86,12,17725.0,United Kingdom
569022,2023-09-30,23025,Drawer Knob Vintage Glass Ball,12.38,12,17725.0,United Kingdom
569022,2023-09-30,23031,Drawer Knob Crackle Glaze Pink,11.94,12,17725.0,United Kingdom
569022,2023-09-30,23035,Drawer Knob Ceramic Ivory,11.74,12,17725.0,United Kingdom
569022,2023-09-30,21166,Cook With Wine Metal Sign,12.38,12,17725.0,United Kingdom
569022,2023-09-30,23027,Drawer Knob Vintage Glass Hexagon,12.38,12,17725.0,United Kingdom
569022,2023-09-30,22863,Soap Dish Brocante,13.27,8,17725.0,United Kingdom
569022,2023-09-30,21417,Cockle Shell Dish,12.4,30,17725.0,United Kingdom
569022,2023-09-30,21673,White Spot Blue Ceramic Drawer Knob,11.74,12,17725.0,United Kingdom
569022,2023-09-30,72598,Set/12 Taper Candles,11.12,12,17725.0,United Kingdom
569022,2023-09-30,23029,Drawer Knob Crackle Glaze Green,11.94,6,17725.0,United Kingdom
569022,2023-09-30,23034,Drawer Knob Ceramic Black,11.74,6,17725.0,United Kingdom
569022,2023-09-30,23033,Drawer Knob Ceramic Red,11.74,6,17725.0,United Kingdom
569022,2023-09-30,21670,Blue Spot Ceramic Drawer Knob,11.74,12,17725.0,United Kingdom
569022,2023-09-30,23026,Drawer Knob Vintage Glass Star,12.38,6,17725.0,United Kingdom
569024,2023-09-30,23367,Set 12 Colour Pencils Spaceboy,10.92,16,12822.0,United Kingdom
569024,2023-09-30,23368,Set 12 Colour Pencils Dolly Girl,10.92,16,12822.0,United Kingdom
569024,2023-09-30,23439,Hand Warmer Red Love Heart,12.4,12,12822.0,United Kingdom
569024,2023-09-30,22867,Hand Warmer Bird Design,12.4,12,12822.0,United Kingdom
569024,2023-09-30,22866,Hand Warmer Scotty Dog Design,12.4,12,12822.0,United Kingdom
569024,2023-09-30,21485,Retrospot Heart Hot Water Bottle,15.32,3,12822.0,United Kingdom
569024,2023-09-30,22111,Scottie Dog Hot Water Bottle,15.32,3,12822.0,United Kingdom
569024,2023-09-30,22086,Paper Chain Kit 50'S Christmas,12.86,40,12822.0,United Kingdom
569024,2023-09-30,23319,Box Of 6 Mini 50'S Crackers,12.8,12,12822.0,United Kingdom
569025,2023-09-30,23284,Doormat Keep Calm And Come In,18.71,2,18041.0,United Kingdom
569025,2023-09-30,48138,Doormat Union Flag,18.71,2,18041.0,United Kingdom
569025,2023-09-30,84997A,Childrens Cutlery Polkadot Green,14.5,3,18041.0,United Kingdom
569025,2023-09-30,84997B,Childrens Cutlery Retrospot Red,14.5,3,18041.0,United Kingdom
569025,2023-09-30,22996,Travel Card Wallet Vintage Ticket,10.68,2,18041.0,United Kingdom
569025,2023-09-30,22998,Travel Card Wallet Keep Calm,10.68,2,18041.0,United Kingdom
569025,2023-09-30,22999,Travel Card Wallet Vintage Leaf,10.68,1,18041.0,United Kingdom
569025,2023-09-30,22918,Herb Marker Parsley,10.92,1,18041.0,United Kingdom
569025,2023-09-30,22917,Herb Marker Rosemary,10.92,1,18041.0,United Kingdom
569025,2023-09-30,22916,Herb Marker Thyme,10.92,1,18041.0,United Kingdom
569025,2023-09-30,22919,Herb Marker Mint,10.92,1,18041.0,United Kingdom
569025,2023-09-30,22921,Herb Marker Chives,10.92,1,18041.0,United Kingdom
569025,2023-09-30,22920,Herb Marker Basil,10.92,1,18041.0,United Kingdom
569025,2023-09-30,21787,Rain Poncho Retrospot,11.12,5,18041.0,United Kingdom
569025,2023-09-30,21210,Set Of 72 Retrospot Paper Doilies,11.74,3,18041.0,United Kingdom
569025,2023-09-30,21789,Kids Rain Mac Pink,11.12,4,18041.0,United Kingdom
569025,2023-09-30,21788,Kids Rain Mac Blue,11.12,4,18041.0,United Kingdom
569025,2023-09-30,23469,Card Holder Love Bird Small,14.5,1,18041.0,United Kingdom
569025,2023-09-30,22617,Baking Set Spaceboy Design,15.32,12,18041.0,United Kingdom
569025,2023-09-30,22138,Baking Set 9 Piece Retrospot,15.32,12,18041.0,United Kingdom
569025,2023-09-30,22367,Childrens Apron Spaceboy Design,12.25,10,18041.0,United Kingdom
569025,2023-09-30,21156,Retrospot Childrens Apron,12.25,30,18041.0,United Kingdom
569026,2023-09-30,23503,Playing Cards Keep Calm & Carry On,11.53,12,16101.0,United Kingdom
569026,2023-09-30,21121,Set/10 Red Polkadot Party Candles,11.53,24,16101.0,United Kingdom
569026,2023-09-30,47566,Party Bunting,15.32,4,16101.0,United Kingdom
569026,2023-09-30,22326,Round Snack Boxes Set Of4 Woodland,13.27,6,16101.0,United Kingdom
569026,2023-09-30,22327,Round Snack Boxes Set Of 4 Skulls,13.27,6,16101.0,United Kingdom
569026,2023-09-30,22745,Poppy's Playhouse Bedroom,12.4,6,16101.0,United Kingdom
569026,2023-09-30,22748,Poppy's Playhouse Kitchen,12.4,6,16101.0,United Kingdom
569026,2023-09-30,22149,Feltcraft 6 Flower Friends,12.4,6,16101.0,United Kingdom
