TransactionNo,Date,ProductNo,ProductName,Price,Quantity,CustomerNo,Country
569078,2023-09-30,22467,Gumball Coat Rack,12.86,6,14688.0,United Kingdom
569078,2023-09-30,23348,Childrens Toy Cooking Utensil Set,12.38,6,14688.0,United Kingdom
569078,2023-09-30,22138,Baking Set 9 Piece Retrospot,15.32,3,14688.0,United Kingdom
569079,2023-09-30,22910,Paper Chain Kit Vintage Christmas,13.27,6,14226.0,United Kingdom
569079,2023-09-30,23503,Playing Cards Keep Calm & Carry On,11.53,12,14226.0,United Kingdom
569079,2023-09-30,23295,Set Of 12 Mini Loaf Baking Cases,11.1,8,14226.0,United Kingdom
569079,2023-09-30,23294,Set Of 6 Snack Loaf Baking Cases,11.1,8,14226.0,United Kingdom
569079,2023-09-30,23359,Set Of 12 T-Lights Vintage Doily,12.25,12,14226.0,United Kingdom
569079,2023-09-30,23360,Set 8 Candles Vintage Doily,12.25,12,14226.0,United Kingdom
569079,2023-09-30,22666,Recipe Box Pantry Yellow Design,13.27,6,14226.0,United Kingdom
569079,2023-09-30,23355,Hot Water Bottle Keep Calm,15.32,4,14226.0,United Kingdom
569079,2023-09-30,23293,Set Of 12 Fairy Cake Baking Cases,11.1,8,14226.0,United Kingdom
569079,2023-09-30,84029G,Knitted Union Flag Hot Water Bottle,14.61,4,14226.0,United Kingdom
569079,2023-09-30,22111,Scottie Dog Hot Water Bottle,15.32,3,14226.0,United Kingdom
569079,2023-09-30,22113,Grey Heart Hot Water Bottle,14.61,4,14226.0,United Kingdom
569080,2023-09-30,23333,Ivory Wicker Heart Medium,11.53,12,15593.0,United Kingdom
569080,2023-09-30,23332,Ivory Wicker Heart Large,11.94,12,15593.0,United Kingdom
569080,2023-09-30,84832,Zinc Willie Winkie Candle Stick,11.12,12,15593.0,United Kingdom
569080,2023-09-30,22840,Round Cake Tin Vintage Red,17.37,12,15593.0,United Kingdom
569080,2023-09-30,22842,Biscuit Tin Vintage Red,16.35,12,15593.0,United Kingdom
569081,2023-09-30,21823,Painted Metal Heart With Holly Bell,10.65,24,13972.0,United Kingdom
569081,2023-09-30,21824,Painted Metal Star With Holly Bells,10.65,24,13972.0,United Kingdom
569081,2023-09-30,22577,Wooden Heart Christmas Scandinavian,10.55,24,13972.0,United Kingdom
569081,2023-09-30,22578,Wooden Star Christmas Scandinavian,10.55,24,13972.0,United Kingdom
569081,2023-09-30,22579,Wooden Tree Christmas Scandinavian,10.55,24,13972.0,United Kingdom
569081,2023-09-30,22049,Wrap Christmas Screen Print,10.44,25,13972.0,United Kingdom
569082,2023-09-30,22193,Red Diner Wall Clock,18.96,2,18229.0,United Kingdom
569082,2023-09-30,22728,Alarm Clock Bakelike Pink,14.09,4,18229.0,United Kingdom
569082,2023-09-30,22725,Alarm Clock Bakelike Chocolate,14.09,4,18229.0,United Kingdom
569082,2023-09-30,23168,Classic Cafe Sugar Dispenser,11.53,24,18229.0,United Kingdom
569082,2023-09-30,22960,Jam Making Set With Jars,14.09,12,18229.0,United Kingdom
569082,2023-09-30,20728,Lunch Bag Cars Blue,5.97,20,18229.0,United Kingdom
569082,2023-09-30,22382,Lunch Bag Spaceboy Design,5.97,10,18229.0,United Kingdom
569082,2023-09-30,22662,Lunch Bag Dolly Girl Design,5.97,10,18229.0,United Kingdom
569082,2023-09-30,22383,Lunch Bag Suki Design,5.97,10,18229.0,United Kingdom
569082,2023-09-30,23207,Lunch Bag Alphabet Design,5.97,20,18229.0,United Kingdom
569082,2023-09-30,23209,Lunch Bag Vintage Doily,5.97,10,18229.0,United Kingdom
569084,2023-09-30,22941,Christmas Lights 10 Reindeer,16.91,384,17949.0,United Kingdom
569085,2023-09-30,21098,Christmas Toilet Roll,11.34,1200,17949.0,United Kingdom
569086,2023-09-30,22197,Popcorn Holder,10.99,1000,17949.0,United Kingdom
569087,2023-09-30,23380,Pack Of 12 Vintage Doily Tissues,10.65,24,13095.0,United Kingdom
569087,2023-09-30,22615,Pack Of 12 Circus Parade Tissues,10.65,24,13095.0,United Kingdom
569087,2023-09-30,23381,Pack Of 12 Vintage Leaf Tissues,10.65,24,13095.0,United Kingdom
569087,2023-09-30,84077,World War 2 Gliders Asstd Designs,10.55,48,13095.0,United Kingdom
569087,2023-09-30,22549,Picture Dominoes,11.74,12,13095.0,United Kingdom
569087,2023-09-30,22548,Heads And Tails Sporting Fun,11.53,12,13095.0,United Kingdom
569089,2023-09-30,21263,Green Goose Feather Tree 60cm,12.25,6,13764.0,United Kingdom
569089,2023-09-30,23103,Jingle Bell Heart Decoration,11.94,4,13764.0,United Kingdom
569089,2023-09-30,22734,Set Of 6 Ribbons Vintage Christmas,13.21,4,13764.0,United Kingdom
569089,2023-09-30,85049E,Scandinavian Reds Ribbons,11.53,6,13764.0,United Kingdom
569089,2023-09-30,22941,Christmas Lights 10 Reindeer,18.96,2,13764.0,United Kingdom
569089,2023-09-30,85032D,Yuletide Images Gift Wrap Set,10.92,5,13764.0,United Kingdom
569089,2023-09-30,23247,Biscuit Tin 50'S Christmas,13.21,2,13764.0,United Kingdom
569089,2023-09-30,22186,Red Star Card Holder,12.25,4,13764.0,United Kingdom
569089,2023-09-30,22187,Green Christmas Tree Card Holder,12.25,5,13764.0,United Kingdom
569089,2023-09-30,23329,Decorative Wicker Heart Large,11.94,5,13764.0,United Kingdom
569089,2023-09-30,23332,Ivory Wicker Heart Large,11.94,3,13764.0,United Kingdom
569089,2023-09-30,23321,Small White Heart Of Wicker,11.94,6,13764.0,United Kingdom
569089,2023-09-30,23323,White Wicker Star,12.4,3,13764.0,United Kingdom
569089,2023-09-30,23503,Playing Cards Keep Calm & Carry On,11.53,3,13764.0,United Kingdom
569089,2023-09-30,35819B,Acrylic Hanging Jewel Blue,10.64,17,13764.0,United Kingdom
569089,2023-09-30,22603,Christmas Retrospot Tree Wood,11.12,11,13764.0,United Kingdom
569089,2023-09-30,22601,Christmas Retrospot Angel Wood,11.12,12,13764.0,United Kingdom
569089,2023-09-30,23266,Set Of 3 Wooden Stocking Decoration,11.53,5,13764.0,United Kingdom
569089,2023-09-30,23264,Set Of 3 Wooden Sleigh Decorations,11.53,5,13764.0,United Kingdom
569089,2023-09-30,23265,Set Of 3 Wooden Tree Decorations,11.53,4,13764.0,United Kingdom
569089,2023-09-30,22338,Star Decoration Painted Zinc,10.44,13,13764.0,United Kingdom
569089,2023-09-30,22336,Dove Decoration Painted Zinc,10.44,12,13764.0,United Kingdom
569089,2023-09-30,23224,Cherub Heart Decoration Gold,11.1,5,13764.0,United Kingdom
569089,2023-09-30,23217,Laurel Heart Antique Silver,11.53,10,13764.0,United Kingdom
569089,2023-09-30,23220,Reindeer Heart Decoration Gold,11.1,10,13764.0,United Kingdom
569089,2023-09-30,22571,Rocking Horse Red Christmas,11.12,11,13764.0,United Kingdom
569089,2023-09-30,21745,Gaolers Keys Decorative Garden,14.09,1,13764.0,United Kingdom
569089,2023-09-30,22457,Natural Slate Heart Chalkboard,13.27,3,13764.0,United Kingdom
569089,2023-09-30,23263,Set Of 3 Wooden Heart Decorations,11.53,12,13764.0,United Kingdom
569089,2023-09-30,22077,6 Ribbons Rustic Charm,12.25,2,13764.0,United Kingdom
569089,2023-09-30,22141,Christmas Craft Tree Top Angel,12.4,3,13764.0,United Kingdom
569089,2023-09-30,22074,6 Ribbons Shimmering Pinks,11.94,3,13764.0,United Kingdom
569089,2023-09-30,85123A,Cream Hanging Heart T-Light Holder,13.27,2,13764.0,United Kingdom
569089,2023-09-30,21733,Red Hanging Heart T-Light Holder,13.27,4,13764.0,United Kingdom
569089,2023-09-30,21428,Set3 Book Box Green Gingham Flower,14.61,1,13764.0,United Kingdom
569089,2023-09-30,21429,Red Gingham Rose Jewellery Box,12.25,2,13764.0,United Kingdom
569089,2023-09-30,21430,Set/3 Red Gingham Rose Storage Box,14.09,1,13764.0,United Kingdom
569089,2023-09-30,23395,Belle Jardiniere Cushion Cover,14.09,2,13764.0,United Kingdom
569089,2023-09-30,82494L,Wooden Frame Antique White,13.27,3,13764.0,United Kingdom
569089,2023-09-30,22621,Traditional Knitting Nancy,11.94,6,13764.0,United Kingdom
569089,2023-09-30,21891,Traditional Wooden Skipping Rope,11.74,3,13764.0,United Kingdom
569089,2023-09-30,23355,Hot Water Bottle Keep Calm,15.32,2,13764.0,United Kingdom
569089,2023-09-30,22620,4 Traditional Spinning Tops,11.74,4,13764.0,United Kingdom
569089,2023-09-30,23356,Love Hot Water Bottle,16.35,2,13764.0,United Kingdom
569089,2023-09-30,22835,Hot Water Bottle I Am So Poorly,15.32,2,13764.0,United Kingdom
569089,2023-09-30,22113,Grey Heart Hot Water Bottle,14.61,2,13764.0,United Kingdom
569089,2023-09-30,23077,Doughnut Lip Gloss,11.53,20,13764.0,United Kingdom
569089,2023-09-30,85135C,Red Dragonfly Helicopter,18.4,2,13764.0,United Kingdom
569089,2023-09-30,22150,3 Stripey Mice Feltcraft,12.25,3,13764.0,United Kingdom
569089,2023-09-30,23493,Vintage Doily Travel Sewing Kit,12.25,7,13764.0,United Kingdom
569089,2023-09-30,22867,Hand Warmer Bird Design,12.4,5,13764.0,United Kingdom
569089,2023-09-30,22632,Hand Warmer Red Retrospot,12.4,4,13764.0,United Kingdom
569089,2023-09-30,22866,Hand Warmer Scotty Dog Design,12.4,4,13764.0,United Kingdom
569089,2023-09-30,23439,Hand Warmer Red Love Heart,12.4,4,13764.0,United Kingdom
569089,2023-09-30,22466,Fairy Tale Cottage Night Light,12.25,5,13764.0,United Kingdom
569089,2023-09-30,22749,Feltcraft Princess Charlotte Doll,14.09,3,13764.0,United Kingdom
569089,2023-09-30,22750,Feltcraft Princess Lola Doll,14.09,2,13764.0,United Kingdom
569089,2023-09-30,22751,Feltcraft Princess Olivia Doll,14.09,2,13764.0,United Kingdom
569089,2023-09-30,23284,Doormat Keep Calm And Come In,18.71,1,13764.0,United Kingdom
569089,2023-09-30,23510,Mini Playing Cards Gymkhana,10.68,4,13764.0,United Kingdom
569089,2023-09-30,21790,Vintage Snap Cards,11.12,3,13764.0,United Kingdom
569089,2023-09-30,22086,Paper Chain Kit 50'S Christmas,13.27,5,13764.0,United Kingdom
569089,2023-09-30,23319,Box Of 6 Mini 50'S Crackers,12.8,4,13764.0,United Kingdom
569089,2023-09-30,22411,Jumbo Shopper Vintage Red Paisley,12.38,4,13764.0,United Kingdom
569089,2023-09-30,23344,Jumbo Bag 50'S Christmas,6.19,8,13764.0,United Kingdom
569089,2023-09-30,21928,Jumbo Bag Scandinavian Blue Paisley,6.19,3,13764.0,United Kingdom
569089,2023-09-30,85099C,Jumbo Bag Baroque Black White,6.19,4,13764.0,United Kingdom
569089,2023-09-30,85099B,Jumbo Bag Red Retrospot,6.19,5,13764.0,United Kingdom
569089,2023-09-30,23202,Jumbo Bag Vintage Leaf,6.19,4,13764.0,United Kingdom
569097,2023-09-30,23508,Mini Playing Cards Dolly Girl,10.68,20,12731.0,France
569097,2023-09-30,23506,Mini Playing Cards Spaceboy,10.68,20,12731.0,France
569097,2023-09-30,23509,Mini Playing Cards Fun Fair,10.68,20,12731.0,France
569097,2023-09-30,23510,Mini Playing Cards Gymkhana,10.68,20,12731.0,France
569097,2023-09-30,23507,Mini Playing Cards Buffalo Bill,10.68,20,12731.0,France
569097,2023-09-30,22551,Plasters In Tin Spaceboy,11.94,36,12731.0,France
569097,2023-09-30,22554,Plasters In Tin Woodland Animals,11.94,24,12731.0,France
569097,2023-09-30,22555,Plasters In Tin Strongman,11.94,24,12731.0,France
569097,2023-09-30,22553,Plasters In Tin Skulls,11.94,48,12731.0,France
569097,2023-09-30,21563,Red Heart Shape Love Bucket,13.27,12,12731.0,France
569097,2023-09-30,20682,Red Retrospot Childrens Umbrella,13.58,12,12731.0,France
569097,2023-09-30,22558,Clothes Pegs Retrospot Pack 24,11.74,48,12731.0,France
569097,2023-09-30,22748,Poppy's Playhouse Kitchen,12.4,12,12731.0,France
569097,2023-09-30,22747,Poppy's Playhouse Bathroom,12.4,12,12731.0,France
569097,2023-09-30,22746,Poppy's Playhouse Livingroom,12.4,12,12731.0,France
569097,2023-09-30,22745,Poppy's Playhouse Bedroom,12.4,12,12731.0,France
569097,2023-09-30,21558,Skull Lunch Box With Cutlery,12.86,24,12731.0,France
569097,2023-09-30,22352,Lunch Box With Cutlery Retrospot,12.86,24,12731.0,France
569097,2023-09-30,21156,Retrospot Childrens Apron,12.25,24,12731.0,France
569097,2023-09-30,22630,Dolly Girl Lunch Box,12.25,24,12731.0,France
569097,2023-09-30,10125,Mini Funky Design Tapes,11.12,150,12731.0,France
569097,2023-09-30,20727,Lunch Bag Black Skull,5.97,30,12731.0,France
569097,2023-09-30,20725,Lunch Bag Red Retrospot,5.97,30,12731.0,France
569097,2023-09-30,22382,Lunch Bag Spaceboy Design,5.97,20,12731.0,France
569097,2023-09-30,22662,Lunch Bag Dolly Girl Design,5.97,20,12731.0,France
569099,2023-09-30,20682,Red Retrospot Childrens Umbrella,13.58,1,17961.0,United Kingdom
569100,2023-09-30,90152A,Silver/Nat Shell Necklace W Pendant,16.35,1,12748.0,United Kingdom
569100,2023-09-30,90149,Silver Flowr Pink Shell Necklace,17.94,3,12748.0,United Kingdom
569100,2023-09-30,90145,Silver Hoop Earrings With Flower,16.35,3,12748.0,United Kingdom
569100,2023-09-30,84875B,Green Square Compact Mirror,11.53,24,12748.0,United Kingdom
569100,2023-09-30,22766,Photo Frame Cornice,12.86,48,12748.0,United Kingdom
569100,2023-09-30,20956,Porcelain T-Light Holders Assorted,11.53,84,12748.0,United Kingdom
569100,2023-09-30,23390,Dolly Girl Mini Backpack,14.5,2,12748.0,United Kingdom
569100,2023-09-30,23388,Woodland Mini Backpack,14.5,2,12748.0,United Kingdom
569100,2023-09-30,23389,Spaceboy Mini Backpack,14.5,2,12748.0,United Kingdom
569100,2023-09-30,22197,Popcorn Holder,11.12,5,12748.0,United Kingdom
569100,2023-09-30,23356,Love Hot Water Bottle,16.35,2,12748.0,United Kingdom
569100,2023-09-30,21479,White Skull Hot Water Bottle,14.61,2,12748.0,United Kingdom
569100,2023-09-30,22208,Wood Stamp Set Thank You,11.1,2,12748.0,United Kingdom
569100,2023-09-30,22210,Wood Stamp Set Best Wishes,11.1,2,12748.0,United Kingdom
569100,2023-09-30,84006,Magic Tree -Paper Flowers,11.12,2,12748.0,United Kingdom
569100,2023-09-30,21034,Rex Cash+Carry Jumbo Shopper,11.22,3,12748.0,United Kingdom
569100,2023-09-30,84997A,Childrens Cutlery Polkadot Green,14.5,1,12748.0,United Kingdom
569100,2023-09-30,23256,Childrens Cutlery Spaceboy,14.5,1,12748.0,United Kingdom
569100,2023-09-30,84997D,Childrens Cutlery Polkadot Pink,14.5,1,12748.0,United Kingdom
569100,2023-09-30,84997C,Childrens Cutlery Polkadot Blue,14.5,1,12748.0,United Kingdom
569100,2023-09-30,84997B,Childrens Cutlery Retrospot Red,14.5,1,12748.0,United Kingdom
569101,2023-09-30,23343,Jumbo Bag Vintage Christmas,6.04,200,14164.0,United Kingdom
569103,2023-09-30,23396,Le Jardin Botanique Cushion Cover,14.09,4,16133.0,United Kingdom
569103,2023-09-30,23424,Gingham Recipe Book Box,15.32,4,16133.0,United Kingdom
569103,2023-09-30,23425,Storage Tin Home Sweet Home,12.8,6,16133.0,United Kingdom
569103,2023-09-30,22570,Feltcraft Cushion Rabbit,13.72,24,16133.0,United Kingdom
569103,2023-09-30,85015,Set Of 12 Vintage Postcard Set,10.92,48,16133.0,United Kingdom
569103,2023-09-30,23348,Childrens Toy Cooking Utensil Set,12.08,36,16133.0,United Kingdom
569103,2023-09-30,23250,Vintage Red Trim Enamel Bowl,11.53,12,16133.0,United Kingdom
569103,2023-09-30,22625,Red Kitchen Scales,18.96,2,16133.0,United Kingdom
569103,2023-09-30,23241,Treasure Tin Gymkhana Design,12.38,6,16133.0,United Kingdom
569103,2023-09-30,23242,Treasure Tin Buffalo Bill,12.38,6,16133.0,United Kingdom
569103,2023-09-30,35961,Folkart Zinc Heart Christmas Dec,11.12,12,16133.0,United Kingdom
569103,2023-09-30,46000S,Polyester Filler Pad 40x40cm,11.74,4,16133.0,United Kingdom
569104,2023-09-30,21479,White Skull Hot Water Bottle,14.09,24,15287.0,United Kingdom
569104,2023-09-30,22650,Ceramic Pirate Chest Money Bank,11.74,12,15287.0,United Kingdom
569104,2023-09-30,22553,Plasters In Tin Skulls,11.94,12,15287.0,United Kingdom
569104,2023-09-30,23002,Travel Card Wallet Skulls,10.68,24,15287.0,United Kingdom
569104,2023-09-30,21504,Skulls Greeting Card,10.68,12,15287.0,United Kingdom
569104,2023-09-30,21427,Skulls Storage Box Small,12.4,6,15287.0,United Kingdom
569104,2023-09-30,21425,Skulls Storage Box Large,13.27,6,15287.0,United Kingdom
569104,2023-09-30,21679,Skulls Stickers,11.12,12,15287.0,United Kingdom
569104,2023-09-30,21967,Pack Of 12 Skull Tissues,10.65,24,15287.0,United Kingdom
569104,2023-09-30,20982,12 Pencils Tall Tube Skulls,11.12,12,15287.0,United Kingdom
569104,2023-09-30,21064,Boom Box Speaker Boys,16.35,12,15287.0,United Kingdom
569104,2023-09-30,15060B,Fairy Cake Design Umbrella,14.09,4,15287.0,United Kingdom
569104,2023-09-30,85014A,Black/Blue Polkadot Umbrella,16.35,3,15287.0,United Kingdom
569104,2023-09-30,85014B,Red Retrospot Umbrella,16.35,3,15287.0,United Kingdom
569104,2023-09-30,20727,Lunch Bag Black Skull,5.97,10,15287.0,United Kingdom
569105,2023-09-30,20718,Red Retrospot Shopper Bag,11.53,2,16729.0,United Kingdom
569105,2023-09-30,21163,Do Not Touch My Stuff Door Hanger,10.65,2,16729.0,United Kingdom
569105,2023-09-30,21159,Moody Boy Door Hanger,10.65,1,16729.0,United Kingdom
569105,2023-09-30,21162,Toxic Area Door Hanger,10.65,2,16729.0,United Kingdom
569105,2023-09-30,21158,Moody Girl Door Hanger,10.65,2,16729.0,United Kingdom
569105,2023-09-30,84596G,Small Chocolates Pink Bowl,10.68,1,16729.0,United Kingdom
569105,2023-09-30,84596B,Small Dolly Mix Design Orange Bowl,10.68,3,16729.0,United Kingdom
569105,2023-09-30,82613A,Metal Sign Cupcake Single Hook,11.53,3,16729.0,United Kingdom
569105,2023-09-30,82613A,Metal Sign Cupcake Single Hook,11.53,3,16729.0,United Kingdom
569105,2023-09-30,82613A,Metal Sign Cupcake Single Hook,11.53,3,16729.0,United Kingdom
569105,2023-09-30,23146,Triple Hook Antique Ivory Rose,13.62,1,16729.0,United Kingdom
569105,2023-09-30,23417,Bathroom Hook,11.94,4,16729.0,United Kingdom
569105,2023-09-30,23415,Home Sweet Home Hook,11.94,4,16729.0,United Kingdom
569105,2023-09-30,23002,Travel Card Wallet Skulls,10.68,24,16729.0,United Kingdom
569105,2023-09-30,23005,Travel Card Wallet I Love London,10.68,48,16729.0,United Kingdom
569105,2023-09-30,22995,Travel Card Wallet Suki,10.68,24,16729.0,United Kingdom
569105,2023-09-30,22998,Travel Card Wallet Keep Calm,10.68,24,16729.0,United Kingdom
569105,2023-09-30,23004,Travel Card Wallet Pantry,10.68,24,16729.0,United Kingdom
569105,2023-09-30,84929,Asstd Fruit+Flowers Fridge Magnets,10.44,12,16729.0,United Kingdom
569105,2023-09-30,22558,Clothes Pegs Retrospot Pack 24,11.94,2,16729.0,United Kingdom
569105,2023-09-30,84926F,Psychedelic Tile Coaster,10.55,4,16729.0,United Kingdom
569105,2023-09-30,85159B,White Tea Coffee Sugar Jars,12.25,1,16729.0,United Kingdom
569105,2023-09-30,84836,Zinc Metal Heart Decoration,11.53,12,16729.0,United Kingdom
569105,2023-09-30,85123A,Cream Hanging Heart T-Light Holder,13.27,2,16729.0,United Kingdom
569105,2023-09-30,22729,Alarm Clock Bakelike Orange,14.09,5,16729.0,United Kingdom
569105,2023-09-30,22727,Alarm Clock Bakelike Red,14.09,4,16729.0,United Kingdom
569105,2023-09-30,22726,Alarm Clock Bakelike Green,14.09,4,16729.0,United Kingdom
569105,2023-09-30,22728,Alarm Clock Bakelike Pink,14.09,4,16729.0,United Kingdom
569105,2023-09-30,22900,Set 2 Tea Towels I Love London,13.58,8,16729.0,United Kingdom
569105,2023-09-30,22659,Lunch Box I Love London,12.25,4,16729.0,United Kingdom
569105,2023-09-30,23431,Natural Hanging Quilted Hearts,11.1,12,16729.0,United Kingdom
569105,2023-09-30,47566,Party Bunting,15.32,5,16729.0,United Kingdom
569105,2023-09-30,23298,Spotty Bunting,15.32,5,16729.0,United Kingdom
569105,2023-09-30,21936,Red Retrospot Picnic Bag,13.27,2,16729.0,United Kingdom
569105,2023-09-30,23388,Woodland Mini Backpack,14.5,1,16729.0,United Kingdom
569105,2023-09-30,23390,Dolly Girl Mini Backpack,14.5,1,16729.0,United Kingdom
569105,2023-09-30,84879,Assorted Colour Bird Ornament,11.98,16,16729.0,United Kingdom
569105,2023-09-30,23148,Miniature Antique Rose Hook Ivory,11.1,12,16729.0,United Kingdom
569105,2023-09-30,23147,Single Antique Rose Hook Ivory,11.74,6,16729.0,United Kingdom
569105,2023-09-30,23200,Jumbo Bag Pears,6.19,1,16729.0,United Kingdom
569105,2023-09-30,85099B,Jumbo Bag Red Retrospot,6.19,2,16729.0,United Kingdom
569105,2023-09-30,23203,Jumbo Bag Vintage Doily,6.19,2,16729.0,United Kingdom
569105,2023-09-30,22382,Lunch Bag Spaceboy Design,5.97,5,16729.0,United Kingdom
569105,2023-09-30,20727,Lunch Bag Black Skull,5.97,2,16729.0,United Kingdom
569105,2023-09-30,23208,Lunch Bag Vintage Leaf Design,5.97,5,16729.0,United Kingdom
569105,2023-09-30,23206,Lunch Bag Apple Design,5.97,10,16729.0,United Kingdom
569105,2023-09-30,22383,Lunch Bag Suki Design,5.97,10,16729.0,United Kingdom
569105,2023-09-30,20725,Lunch Bag Red Retrospot,5.97,10,16729.0,United Kingdom
569105,2023-09-30,23209,Lunch Bag Vintage Doily,5.97,20,16729.0,United Kingdom
569106,2023-09-30,22621,Traditional Knitting Nancy,11.94,4,17376.0,United Kingdom
569106,2023-09-30,21891,Traditional Wooden Skipping Rope,11.74,10,17376.0,United Kingdom
569106,2023-09-30,21790,Vintage Snap Cards,11.12,10,17376.0,United Kingdom
569106,2023-09-30,21791,Vintage Heads And Tails Card Game,11.53,10,17376.0,United Kingdom
569106,2023-09-30,22966,Gingerbread Man Cookie Cutter,11.53,1,17376.0,United Kingdom
569106,2023-09-30,22549,Picture Dominoes,11.74,5,17376.0,United Kingdom
569106,2023-09-30,84030E,English Rose Hot Water Bottle,14.61,2,17376.0,United Kingdom
569106,2023-09-30,48187,Doormat New England,18.71,1,17376.0,United Kingdom
569106,2023-09-30,21913,Vintage Seaside Jigsaw Puzzles,14.09,2,17376.0,United Kingdom
569106,2023-09-30,21912,Vintage Snakes & Ladders,14.09,4,17376.0,United Kingdom
569106,2023-09-30,22619,Set Of 6 Soldier Skittles,14.09,2,17376.0,United Kingdom
569108,2023-09-30,23089,Glass Bon Bon Jar,11.74,216,16013.0,United Kingdom
569108,2023-09-30,23132,Small Ivory Heart Wall Organiser,15.32,72,16013.0,United Kingdom
569110,2023-09-30,22727,Alarm Clock Bakelike Red,14.09,8,17675.0,United Kingdom
569110,2023-09-30,21181,Please One Person Metal Sign,12.4,24,17675.0,United Kingdom
569110,2023-09-30,82583,Hot Baths Metal Sign,12.4,12,17675.0,United Kingdom
569110,2023-09-30,85150,Ladies & Gentlemen Metal Sign,12.86,18,17675.0,United Kingdom
569110,2023-09-30,85152,Hand Over The Chocolate Sign,12.4,12,17675.0,United Kingdom
569110,2023-09-30,22720,Set Of 3 Cake Tins Pantry Design,15.32,3,17675.0,United Kingdom
569110,2023-09-30,23240,Set Of 4 Knick Knack Tins Doily,14.5,6,17675.0,United Kingdom
569110,2023-09-30,23245,Set Of 3 Regency Cake Tins,15.32,4,17675.0,United Kingdom
569110,2023-09-30,23243,Set Of Tea Coffee Sugar Tins Pantry,15.32,4,17675.0,United Kingdom
569110,2023-09-30,85123A,Cream Hanging Heart T-Light Holder,12.86,32,17675.0,United Kingdom
569110,2023-09-30,23409,Photo Frame Linen And Lace Large,14.09,6,17675.0,United Kingdom
569110,2023-09-30,22692,Doormat Welcome To Our Home,18.71,2,17675.0,United Kingdom
569110,2023-09-30,47566,Party Bunting,15.32,8,17675.0,United Kingdom
569110,2023-09-30,21671,Red Spot Ceramic Drawer Knob,11.74,12,17675.0,United Kingdom
569110,2023-09-30,21669,Blue Stripe Ceramic Drawer Knob,11.74,12,17675.0,United Kingdom
569110,2023-09-30,21670,Blue Spot Ceramic Drawer Knob,11.74,12,17675.0,United Kingdom
569110,2023-09-30,22411,Jumbo Shopper Vintage Red Paisley,12.38,10,17675.0,United Kingdom
569110,2023-09-30,23348,Childrens Toy Cooking Utensil Set,12.38,6,17675.0,United Kingdom
569110,2023-09-30,22139,Retrospot Tea Set Ceramic 11 Pc,15.32,3,17675.0,United Kingdom
569110,2023-09-30,22150,3 Stripey Mice Feltcraft,12.25,6,17675.0,United Kingdom
569110,2023-09-30,22147,Feltcraft Butterfly Hearts,11.74,12,17675.0,United Kingdom
569110,2023-09-30,23126,Feltcraft Girl Amelie Kit,15.32,4,17675.0,United Kingdom
569110,2023-09-30,22750,Feltcraft Princess Lola Doll,14.09,4,17675.0,United Kingdom
569110,2023-09-30,20972,Pink Cream Felt Craft Trinket Box,11.53,12,17675.0,United Kingdom
569110,2023-09-30,22149,Feltcraft 6 Flower Friends,12.4,6,17675.0,United Kingdom
569110,2023-09-30,22621,Traditional Knitting Nancy,11.94,12,17675.0,United Kingdom
569110,2023-09-30,22191,Ivory Diner Wall Clock,18.96,4,17675.0,United Kingdom
569110,2023-09-30,22728,Alarm Clock Bakelike Pink,14.09,4,17675.0,United Kingdom
569110,2023-09-30,22192,Blue Diner Wall Clock,18.96,2,17675.0,United Kingdom
569110,2023-09-30,22726,Alarm Clock Bakelike Green,14.09,4,17675.0,United Kingdom
569110,2023-09-30,22730,Alarm Clock Bakelike Ivory,14.09,4,17675.0,United Kingdom
569110,2023-09-30,22193,Red Diner Wall Clock,18.96,4,17675.0,United Kingdom
569110,2023-09-30,20712,Jumbo Bag Woodland Animals,6.19,10,17675.0,United Kingdom
569110,2023-09-30,21929,Jumbo Bag Pink Vintage Paisley,6.19,10,17675.0,United Kingdom
569110,2023-09-30,20713,Jumbo Bag Owls,6.19,10,17675.0,United Kingdom
569110,2023-09-30,23200,Jumbo Bag Pears,6.19,10,17675.0,United Kingdom
569110,2023-09-30,23203,Jumbo Bag Vintage Doily,6.19,10,17675.0,United Kingdom
569110,2023-09-30,23199,Jumbo Bag Apples,6.19,10,17675.0,United Kingdom
569110,2023-09-30,85099B,Jumbo Bag Red Retrospot,6.19,10,17675.0,United Kingdom
569110,2023-09-30,20728,Lunch Bag Cars Blue,5.97,10,17675.0,United Kingdom
569110,2023-09-30,20725,Lunch Bag Red Retrospot,5.97,10,17675.0,United Kingdom
569110,2023-09-30,23206,Lunch Bag Apple Design,5.97,10,17675.0,United Kingdom
569110,2023-09-30,23209,Lunch Bag Vintage Doily,5.97,10,17675.0,United Kingdom
569110,2023-09-30,23208,Lunch Bag Vintage Leaf Design,5.97,10,17675.0,United Kingdom
569111,2023-09-30,21907,I'm On Holiday Metal Sign,12.4,12,17675.0,United Kingdom
569120,2023-09-30,23368,Set 12 Colour Pencils Dolly Girl,10.92,16,12583.0,France
569120,2023-09-30,23367,Set 12 Colour Pencils Spaceboy,10.92,16,12583.0,France
569120,2023-09-30,23506,Mini Playing Cards Spaceboy,10.68,20,12583.0,France
569120,2023-09-30,23509,Mini Playing Cards Fun Fair,10.68,20,12583.0,France
569120,2023-09-30,22629,Spaceboy Lunch Box,12.25,12,12583.0,France
569120,2023-09-30,21559,Strawberry Lunch Box With Cutlery,12.86,6,12583.0,France
569120,2023-09-30,21156,Retrospot Childrens Apron,12.25,16,12583.0,France
569120,2023-09-30,20750,Red Retrospot Mini Cases,16.76,12,12583.0,France
569120,2023-09-30,22090,Paper Bunting Retrospot,13.27,12,12583.0,France
569120,2023-09-30,23298,Spotty Bunting,15.32,3,12583.0,France
569120,2023-09-30,22539,Mini Jigsaw Dolly Girl,10.68,24,12583.0,France
569120,2023-09-30,23389,Spaceboy Mini Backpack,14.5,4,12583.0,France
569120,2023-09-30,22352,Lunch Box With Cutlery Retrospot,12.86,12,12583.0,France
569122,2023-09-30,21080,Set/20 Red Retrospot Paper Napkins,11.12,12,12694.0,France
569122,2023-09-30,22845,Vintage Cream Cat Food Container,16.76,2,12694.0,France
569122,2023-09-30,22080,Ribbon Reel Polkadots,11.94,10,12694.0,France
569122,2023-09-30,22492,Mini Paint Set Vintage,10.92,36,12694.0,France
569122,2023-09-30,21200,Multicolour Honeycomb Paper Garland,11.94,12,12694.0,France
569122,2023-09-30,22620,4 Traditional Spinning Tops,11.74,12,12694.0,France
