TransactionNo,Date,ProductNo,ProductName,Price,Quantity,CustomerNo,Country
546108,2023-03-09,22433,Watering Can Green Dinosaur,12.25,2,15529.0,United Kingdom
546108,2023-03-09,20751,Funky Washing Up Gloves Assorted,12.4,4,15529.0,United Kingdom
546108,2023-03-09,23000,Travel Card Wallet Transport,10.68,8,15529.0,United Kingdom
546108,2023-03-09,22999,Travel Card Wallet Vintage Leaf,10.68,4,15529.0,United Kingdom
546108,2023-03-09,22995,Travel Card Wallet Suki,10.68,5,15529.0,United Kingdom
546108,2023-03-09,23002,Travel Card Wallet Skulls,10.68,4,15529.0,United Kingdom
546108,2023-03-09,84750B,Black Small Glass Cake Stand,12.25,3,15529.0,United Kingdom
546108,2023-03-09,20726,Lunch Bag Woodland,5.97,1,15529.0,United Kingdom
546108,2023-03-09,22382,Lunch Bag Spaceboy Design,5.97,4,15529.0,United Kingdom
546108,2023-03-09,20728,Lunch Bag Cars Blue,5.97,2,15529.0,United Kingdom
546108,2023-03-09,20726,Lunch Bag Woodland,5.97,1,15529.0,United Kingdom
546108,2023-03-09,22384,Lunch Bag Pink Polkadot,5.97,4,15529.0,United Kingdom
546108,2023-03-09,22820,Gift Bag Birthday,5.46,12,15529.0,United Kingdom
546110,2023-03-09,20685,Doormat Red Retrospot,18.4,4,17770.0,United Kingdom
546110,2023-03-09,23053,Recycled Acapulco Mat Pink,18.71,4,17770.0,United Kingdom
546110,2023-03-09,23050,Recycled Acapulco Mat Green,18.71,4,17770.0,United Kingdom
546110,2023-03-09,23049,Recycled Acapulco Mat Red,18.71,6,17770.0,United Kingdom
546110,2023-03-09,23051,Recycled Acapulco Mat Blue,18.71,4,17770.0,United Kingdom
546110,2023-03-09,23052,Recycled Acapulco Mat Turquoise,18.71,6,17770.0,United Kingdom
546110,2023-03-09,48173C,Doormat Black Flock,18.4,4,17770.0,United Kingdom
546111,2023-03-09,85123A,Cream Hanging Heart T-Light Holder,13.27,2,14165.0,United Kingdom
546111,2023-03-09,21269,Antique Cream Cutlery Shelf,18.96,2,14165.0,United Kingdom
546111,2023-03-09,82494L,Wooden Frame Antique White,13.27,2,14165.0,United Kingdom
546111,2023-03-09,22930,Baking Mould Heart Milk Chocolate,12.86,2,14165.0,United Kingdom
546111,2023-03-09,22078,Ribbon Reel Lace Design,12.4,1,14165.0,United Kingdom
546111,2023-03-09,21447,12 Ivory Rose Peg Place Settings,11.53,2,14165.0,United Kingdom
546111,2023-03-09,21078,Set/20 Strawberry Paper Napkins,11.12,3,14165.0,United Kingdom
546111,2023-03-09,22197,Popcorn Holder,11.12,6,14165.0,United Kingdom
546111,2023-03-09,22584,Pack Of 6 Panettone Gift Boxes,12.86,2,14165.0,United Kingdom
546111,2023-03-09,21625,Vintage Union Jack Apron,17.37,1,14165.0,United Kingdom
546111,2023-03-09,22078,Ribbon Reel Lace Design,12.4,1,14165.0,United Kingdom
546111,2023-03-09,22932,Baking Mould Toffee Cup Chocolate,12.86,1,14165.0,United Kingdom
546111,2023-03-09,22930,Baking Mould Heart Milk Chocolate,12.86,1,14165.0,United Kingdom
546111,2023-03-09,22294,Heart Filigree Dove Small,11.53,2,14165.0,United Kingdom
546111,2023-03-09,22295,Heart Filigree Dove Large,11.94,4,14165.0,United Kingdom
546111,2023-03-09,22296,Heart Ivory Trellis Large,11.94,4,14165.0,United Kingdom
546111,2023-03-09,21397,Blue Polkadot Egg Cup,10.65,2,14165.0,United Kingdom
546111,2023-03-09,84531B,Blue Knitted Egg Cosy,10.65,1,14165.0,United Kingdom
546111,2023-03-09,84531A,Pink Knitted Egg Cosy,10.65,1,14165.0,United Kingdom
546111,2023-03-09,21703,Bag 125g Swirly Marbles,10.68,9,14165.0,United Kingdom
546111,2023-03-09,20914,Set/5 Red Retrospot Lid Glass Bowls,13.27,1,14165.0,United Kingdom
546111,2023-03-09,22624,Ivory Kitchen Scales,18.96,1,14165.0,United Kingdom
546111,2023-03-09,20679,Edwardian Parasol Red,16.35,1,14165.0,United Kingdom
546111,2023-03-09,15056N,Edwardian Parasol Natural,16.35,1,14165.0,United Kingdom
546112,2023-03-09,20713,Jumbo Bag Owls,5.97,200,15769.0,United Kingdom
546113,2023-03-09,85123A,Cream Hanging Heart T-Light Holder,13.27,2,14344.0,United Kingdom
546113,2023-03-09,22804,Pink Hanging Heart T-Light Holder,13.27,3,14344.0,United Kingdom
546113,2023-03-09,20998,Rose Du Sud Oven Glove,13.27,1,14344.0,United Kingdom
546113,2023-03-09,21114,Lavender Scented Fabric Heart,11.53,5,14344.0,United Kingdom
546113,2023-03-09,84531B,Blue Knitted Egg Cosy,10.65,1,14344.0,United Kingdom
546113,2023-03-09,84531A,Pink Knitted Egg Cosy,10.65,1,14344.0,United Kingdom
546113,2023-03-09,20846,Zinc Heart Lattice T-Light Holder,11.53,3,14344.0,United Kingdom
546113,2023-03-09,22189,Cream Heart Card Holder,14.3,1,14344.0,United Kingdom
546113,2023-03-09,20836,French Paisley Cushion Cover,13.27,6,14344.0,United Kingdom
546113,2023-03-09,22470,Heart Of Wicker Large,13.27,1,14344.0,United Kingdom
546113,2023-03-09,22624,Ivory Kitchen Scales,18.96,1,14344.0,United Kingdom
546113,2023-03-09,82494L,Wooden Frame Antique White,13.27,1,14344.0,United Kingdom
546113,2023-03-09,22470,Heart Of Wicker Large,13.27,2,14344.0,United Kingdom
546113,2023-03-09,17084A,Tranquility Masala Incense,10.47,25,14344.0,United Kingdom
546113,2023-03-09,21167,White Sage Incense,10.47,25,14344.0,United Kingdom
546113,2023-03-09,17084J,Love Potion Masala Incense,10.47,25,14344.0,United Kingdom
546113,2023-03-09,17084N,Fairy Dreams Incense,10.47,25,14344.0,United Kingdom
546113,2023-03-09,22699,Roses Regency Teacup And Saucer,13.27,1,14344.0,United Kingdom
546113,2023-03-09,22697,Green Regency Teacup And Saucer,13.27,1,14344.0,United Kingdom
546113,2023-03-09,22698,Pink Regency Teacup And Saucer,13.27,1,14344.0,United Kingdom
546113,2023-03-09,84971S,Small Heart Flowers Hook,11.12,24,14344.0,United Kingdom
546115,2023-03-09,21754,Home Building Block Word,16.35,6,15379.0,United Kingdom
546115,2023-03-09,22381,Toy Tidy Pink Polkadot,12.4,5,15379.0,United Kingdom
546115,2023-03-09,22664,Toy Tidy Dolly Girl Design,12.4,5,15379.0,United Kingdom
546115,2023-03-09,47590B,Pink Happy Birthday Bunting,15.84,3,15379.0,United Kingdom
546115,2023-03-09,22241,Garland Wooden Happy Easter,11.53,12,15379.0,United Kingdom
546115,2023-03-09,22621,Traditional Knitting Nancy,11.74,12,15379.0,United Kingdom
546115,2023-03-09,22355,Charlotte Bag Suki Design,11.12,10,15379.0,United Kingdom
546115,2023-03-09,22899,Children's Apron Dolly Girl,12.4,6,15379.0,United Kingdom
546115,2023-03-09,22661,Charlotte Bag Dolly Girl Design,11.12,10,15379.0,United Kingdom
546115,2023-03-09,85123A,Cream Hanging Heart T-Light Holder,13.27,12,15379.0,United Kingdom
546115,2023-03-09,21363,Home Small Wood Letters,15.32,3,15379.0,United Kingdom
546115,2023-03-09,21380,Wooden Happy Birthday Garland,13.27,6,15379.0,United Kingdom
546115,2023-03-09,22498,Wooden Regatta Bunting,16.35,3,15379.0,United Kingdom
546115,2023-03-09,22668,Pink Baby Bunting,13.27,5,15379.0,United Kingdom
546115,2023-03-09,84879,Assorted Colour Bird Ornament,11.98,16,15379.0,United Kingdom
546115,2023-03-09,22418,10 Colour Spaceboy Pen,11.12,24,15379.0,United Kingdom
546115,2023-03-09,22149,Feltcraft 6 Flower Friends,12.4,6,15379.0,United Kingdom
546115,2023-03-09,22147,Feltcraft Butterfly Hearts,11.74,12,15379.0,United Kingdom
546115,2023-03-09,47591D,Pink Fairy Cake Childrens Apron,12.25,8,15379.0,United Kingdom
546115,2023-03-09,22329,Round Container Set Of 5 Retrospot,11.94,12,15379.0,United Kingdom
546115,2023-03-09,22148,Easter Craft 4 Chicks,12.25,12,15379.0,United Kingdom
546116,2023-03-09,47591D,Pink Fairy Cake Childrens Apron,12.25,8,15367.0,United Kingdom
546116,2023-03-09,47567B,Tea Time Kitchen Apron,16.35,6,15367.0,United Kingdom
546116,2023-03-09,47559B,Tea Time Oven Glove,11.53,10,15367.0,United Kingdom
546116,2023-03-09,47580,Tea Time Des Tea Cosy,12.86,6,15367.0,United Kingdom
546116,2023-03-09,22720,Set Of 3 Cake Tins Pantry Design,15.32,6,15367.0,United Kingdom
546116,2023-03-09,22722,Set Of 6 Spice Tins Pantry Design,14.3,4,15367.0,United Kingdom
546116,2023-03-09,22982,Pantry Pastry Brush,11.53,12,15367.0,United Kingdom
546116,2023-03-09,22978,Pantry Rolling Pin,14.09,6,15367.0,United Kingdom
546116,2023-03-09,22966,Gingerbread Man Cookie Cutter,11.53,12,15367.0,United Kingdom
546116,2023-03-09,21977,Pack Of 60 Pink Paisley Cake Cases,10.81,24,15367.0,United Kingdom
546116,2023-03-09,21975,Pack Of 60 Dinosaur Cake Cases,10.81,24,15367.0,United Kingdom
546116,2023-03-09,21212,Pack Of 72 Retrospot Cake Cases,10.81,24,15367.0,United Kingdom
546116,2023-03-09,21215,Ivory Paper Cup Cake Cases,10.81,24,15367.0,United Kingdom
546116,2023-03-09,84991,60 Teatime Fairy Cake Cases,10.81,24,15367.0,United Kingdom
546116,2023-03-09,22937,Baking Mould Chocolate Cupcakes,12.86,12,15367.0,United Kingdom
546116,2023-03-09,22667,Recipe Box Retrospot,13.27,6,15367.0,United Kingdom
546116,2023-03-09,22666,Recipe Box Pantry Yellow Design,13.27,6,15367.0,United Kingdom
546116,2023-03-09,22665,Recipe Box Blue Sketchbook Design,13.27,6,15367.0,United Kingdom
546116,2023-03-09,22513,Doorstop Football Design,14.09,4,15367.0,United Kingdom
546116,2023-03-09,21407,Brown Check Cat Doorstop,14.61,3,15367.0,United Kingdom
546116,2023-03-09,21116,Owl Doorstop,15.32,9,15367.0,United Kingdom
546116,2023-03-09,22467,Gumball Coat Rack,12.86,6,15367.0,United Kingdom
546116,2023-03-09,84755,Colour Glass T-Light Holder Hanging,10.92,32,15367.0,United Kingdom
546116,2023-03-09,84949,Silver Hanging T-Light Holder,11.94,18,15367.0,United Kingdom
546116,2023-03-09,84946,Antique Silver T-Light Glass,11.53,12,15367.0,United Kingdom
546116,2023-03-09,22893,Mini Cake Stand T-Light Holder,10.68,24,15367.0,United Kingdom
546116,2023-03-09,18097C,White Tall Porcelain T-Light Holder,12.86,12,15367.0,United Kingdom
546116,2023-03-09,22969,Homemade Jam Scented Candles,11.74,24,15367.0,United Kingdom
546116,2023-03-09,22806,Set Of 6 T-Lights Wedding Cake,13.27,12,15367.0,United Kingdom
546116,2023-03-09,22927,Green Giant Garden Thermometer,16.35,4,15367.0,United Kingdom
546116,2023-03-09,22926,Ivory Giant Garden Thermometer,16.35,4,15367.0,United Kingdom
546116,2023-03-09,22443,Grow Your Own Herbs Set Of 3,18.4,4,15367.0,United Kingdom
546116,2023-03-09,22855,Fine Wicker Heart,11.53,12,15367.0,United Kingdom
546116,2023-03-09,22500,Set Of 2 Tins Jardin De Provence,15.32,4,15367.0,United Kingdom
546116,2023-03-09,22854,Cream Sweetheart Egg Holder,15.32,4,15367.0,United Kingdom
546117,2023-03-09,22443,Grow Your Own Herbs Set Of 3,18.4,2,16771.0,United Kingdom
546117,2023-03-09,85206A,Cream Felt Easter Egg Basket,11.94,3,16771.0,United Kingdom
546117,2023-03-09,22021,Blue Felt Easter Egg Basket,11.94,3,16771.0,United Kingdom
546117,2023-03-09,22260,Felt Egg Cosy Blue Rabbit,11.12,6,16771.0,United Kingdom
546117,2023-03-09,22261,Felt Egg Cosy White Rabbit,11.12,6,16771.0,United Kingdom
546117,2023-03-09,22266,Easter Decoration Hanging Bunny,10.92,6,16771.0,United Kingdom
546117,2023-03-09,22267,Easter Decoration Egg Bunny,11.53,6,16771.0,United Kingdom
546117,2023-03-09,22287,Decoration Wobbly Chicken,11.94,6,16771.0,United Kingdom
546117,2023-03-09,21135,Victorian Metal Postcard Spring,11.98,8,16771.0,United Kingdom
546117,2023-03-09,22413,Metal Sign Take It Or Leave It,13.27,2,16771.0,United Kingdom
546117,2023-03-09,21907,I'm On Holiday Metal Sign,12.4,4,16771.0,United Kingdom
546117,2023-03-09,21166,Cook With Wine Metal Sign,12.38,3,16771.0,United Kingdom
546117,2023-03-09,21169,You're Confusing Me Metal Sign,11.98,4,16771.0,United Kingdom
546117,2023-03-09,21164,Home Sweet Home Metal Sign,13.27,4,16771.0,United Kingdom
546117,2023-03-09,23180,Mum's Kitchen Clock,15.32,2,16771.0,United Kingdom
546117,2023-03-09,23178,Jam Clock Magnet,13.21,4,16771.0,United Kingdom
546117,2023-03-09,21876,Pottering Mug,11.53,1,16771.0,United Kingdom
546117,2023-03-09,21877,Home Sweet Home Mug,11.53,6,16771.0,United Kingdom
546117,2023-03-09,37479B,Cubic Mug Flock Blue On Brown,10.65,6,16771.0,United Kingdom
546117,2023-03-09,22720,Set Of 3 Cake Tins Pantry Design,15.32,2,16771.0,United Kingdom
546117,2023-03-09,22295,Heart Filigree Dove Large,11.94,12,16771.0,United Kingdom
546117,2023-03-09,22891,Tea For One Polkadot,14.61,3,16771.0,United Kingdom
546117,2023-03-09,84912A,Pink Rose Washbag,14.09,3,16771.0,United Kingdom
546117,2023-03-09,84912B,Green Rose Washbag,14.09,3,16771.0,United Kingdom
546117,2023-03-09,21232,Strawberry Ceramic Trinket Pot,11.53,4,16771.0,United Kingdom
546117,2023-03-09,22469,Heart Of Wicker Small,11.94,4,16771.0,United Kingdom
546117,2023-03-09,21547,Ceramic Birdhouse Crested Tit Small,13.27,3,16771.0,United Kingdom
546117,2023-03-09,22189,Cream Heart Card Holder,14.3,6,16771.0,United Kingdom
546117,2023-03-09,22989,Set 2 Pantry Design Tea Towels,13.58,4,16771.0,United Kingdom
546117,2023-03-09,22961,Jam Making Set Printed,11.74,4,16771.0,United Kingdom
546117,2023-03-09,22152,Place Setting White Star,10.68,6,16771.0,United Kingdom
546117,2023-03-09,35001G,Hand Open Shape Gold,14.61,2,16771.0,United Kingdom
546117,2023-03-09,22978,Pantry Rolling Pin,14.09,4,16771.0,United Kingdom
546117,2023-03-09,21228,"Pocket Mirror ""Glamorous""",11.53,4,16771.0,United Kingdom
546117,2023-03-09,20868,Silver Fabric Mirror,11.53,3,16771.0,United Kingdom
546117,2023-03-09,22219,Lovebird Hanging Decoration White,11.12,10,16771.0,United Kingdom
546117,2023-03-09,22979,Pantry Washing Up Brush,11.74,4,16771.0,United Kingdom
546117,2023-03-09,22982,Pantry Pastry Brush,11.53,6,16771.0,United Kingdom
546117,2023-03-09,20998,Rose Du Sud Oven Glove,13.27,6,16771.0,United Kingdom
546117,2023-03-09,21294,Etched Glass Coaster,11.53,12,16771.0,United Kingdom
546117,2023-03-09,22912,Yellow Coat Rack Paris Fashion,15.32,2,16771.0,United Kingdom
546117,2023-03-09,22914,Blue Coat Rack Paris Fashion,15.32,2,16771.0,United Kingdom
546117,2023-03-09,20754,Retrospot Red Washing Up Gloves,12.4,2,16771.0,United Kingdom
546117,2023-03-09,20752,Blue Polkadot Washing Up Gloves,12.4,2,16771.0,United Kingdom
546117,2023-03-09,15036,Assorted Colours Silk Fan,11.02,12,16771.0,United Kingdom
546117,2023-03-09,22558,Clothes Pegs Retrospot Pack 24,11.78,4,16771.0,United Kingdom
546117,2023-03-09,21080,Set/20 Red Retrospot Paper Napkins,11.12,6,16771.0,United Kingdom
546117,2023-03-09,21985,Pack Of 12 Hearts Design Tissues,10.55,12,16771.0,United Kingdom
546117,2023-03-09,21494,Rotating Leaves T-Light Holder,11.53,6,16771.0,United Kingdom
546117,2023-03-09,85123A,Cream Hanging Heart T-Light Holder,13.27,6,16771.0,United Kingdom
546117,2023-03-09,84971S,Small Heart Flowers Hook,11.12,24,16771.0,United Kingdom
546117,2023-03-09,22667,Recipe Box Retrospot,13.27,1,16771.0,United Kingdom
546117,2023-03-09,22665,Recipe Box Blue Sketchbook Design,13.27,1,16771.0,United Kingdom
546117,2023-03-09,22170,Picture Frame Wood Triple Portrait,17.17,1,16771.0,United Kingdom
546117,2023-03-09,22507,Memo Board Retrospot Design,15.32,3,16771.0,United Kingdom
546117,2023-03-09,17107D,Flower Fairy 5 Drawer Liners,12.86,6,16771.0,United Kingdom
546117,2023-03-09,22442,Grow Your Own Flowers Set Of 3,18.4,2,16771.0,United Kingdom
546117,2023-03-09,21407,Brown Check Cat Doorstop,14.61,2,16771.0,United Kingdom
546117,2023-03-09,22508,Doorstop Retrospot Heart,14.09,2,16771.0,United Kingdom
546117,2023-03-09,22645,Ceramic Heart Fairy Cake Money Bank,11.74,4,16771.0,United Kingdom
546117,2023-03-09,48129,Doormat Topiary,18.4,2,16771.0,United Kingdom
546117,2023-03-09,21524,Doormat Spotty Home Sweet Home,18.4,1,16771.0,United Kingdom
546117,2023-03-09,48111,Doormat 3 Smiley Cats,18.4,1,16771.0,United Kingdom
546117,2023-03-09,16169M,Wrap Daisy Carpet,10.68,25,16771.0,United Kingdom
546117,2023-03-09,21292,Small Stripes Chocolate Gift Bag,5.56,16,16771.0,United Kingdom
546118,2023-03-09,48138,Doormat Union Flag,17.17,10,13078.0,United Kingdom
546118,2023-03-09,22499,Wooden Union Jack Bunting,15.32,48,13078.0,United Kingdom
546118,2023-03-09,22191,Ivory Diner Wall Clock,18.96,2,13078.0,United Kingdom
546118,2023-03-09,22192,Blue Diner Wall Clock,18.96,2,13078.0,United Kingdom
546118,2023-03-09,22194,Black Diner Wall Clock,18.96,2,13078.0,United Kingdom
546118,2023-03-09,21832,Chocolate Calculator,11.94,12,13078.0,United Kingdom
546118,2023-03-09,21463,Mirrored Disco Ball,16.35,2,13078.0,United Kingdom
546118,2023-03-09,21464,Disco Ball Rotator Battery Operated,14.61,2,13078.0,United Kingdom
546118,2023-03-09,21745,Gaolers Keys Decorative Garden,14.09,4,13078.0,United Kingdom
546118,2023-03-09,85152,Hand Over The Chocolate Sign,12.4,12,13078.0,United Kingdom
546118,2023-03-09,21754,Home Building Block Word,16.35,3,13078.0,United Kingdom
546118,2023-03-09,21523,Doormat Fancy Font Home Sweet Home,17.17,10,13078.0,United Kingdom
546118,2023-03-09,82582,Area Patrolled Metal Sign,12.4,12,13078.0,United Kingdom
546118,2023-03-09,82001S,Silver Record Cover Frame,13.72,24,13078.0,United Kingdom
546118,2023-03-09,84692,Box Of 24 Cocktail Parasols,10.68,25,13078.0,United Kingdom
546118,2023-03-09,22468,Babushka Lights String Of 10,17.17,2,13078.0,United Kingdom
546118,2023-03-09,22568,Feltcraft Cushion Owl,14.09,4,13078.0,United Kingdom
546118,2023-03-09,22570,Feltcraft Cushion Rabbit,14.09,4,13078.0,United Kingdom
546118,2023-03-09,21519,Gin & Tonic Diet Greeting Card,10.68,12,13078.0,United Kingdom
546118,2023-03-09,23049,Recycled Acapulco Mat Red,18.71,2,13078.0,United Kingdom
546118,2023-03-09,23052,Recycled Acapulco Mat Turquoise,18.71,2,13078.0,United Kingdom
546118,2023-03-09,23050,Recycled Acapulco Mat Green,18.71,2,13078.0,United Kingdom
546118,2023-03-09,23053,Recycled Acapulco Mat Pink,18.71,2,13078.0,United Kingdom
546118,2023-03-09,23051,Recycled Acapulco Mat Blue,18.71,2,13078.0,United Kingdom
546118,2023-03-09,23054,Recycled Acapulco Mat Lavender,18.71,2,13078.0,United Kingdom
546118,2023-03-09,23181,Bull Dog Bottle Top Wall Clock,17.94,8,13078.0,United Kingdom
546119,2023-03-09,22411,Jumbo Shopper Vintage Red Paisley,12.25,10,16945.0,United Kingdom
546119,2023-03-09,84536B,Fairy Cakes Notebook A7 Size,10.68,16,16945.0,United Kingdom
546119,2023-03-09,84536A,English Rose Notebook A7 Size,10.68,16,16945.0,United Kingdom
546119,2023-03-09,20974,12 Pencils Small Tube Skull,10.92,24,16945.0,United Kingdom
546119,2023-03-09,22280,Pocket Bag Pink Paisely Brown Spot,11.53,12,16945.0,United Kingdom
546119,2023-03-09,22380,Toy Tidy Spaceboy,12.4,5,16945.0,United Kingdom
546119,2023-03-09,22780,Light Garland Butterfiles Pink,14.61,4,16945.0,United Kingdom
546119,2023-03-09,22779,Wooden Owls Light Garland,14.61,4,16945.0,United Kingdom
546119,2023-03-09,22619,Set Of 6 Soldier Skittles,14.09,4,16945.0,United Kingdom
546119,2023-03-09,20972,Pink Cream Felt Craft Trinket Box,11.53,12,16945.0,United Kingdom
546119,2023-03-09,85185B,Pink Horse Sock Puppet Kit,13.27,6,16945.0,United Kingdom
546119,2023-03-09,22984,Card Gingham Rose,10.68,12,16945.0,United Kingdom
546119,2023-03-09,22367,Childrens Apron Spaceboy Design,12.25,8,16945.0,United Kingdom
546119,2023-03-09,21156,Retrospot Childrens Apron,12.25,8,16945.0,United Kingdom
546119,2023-03-09,22385,Jumbo Bag Spaceboy Design,6.13,20,16945.0,United Kingdom
546119,2023-03-09,20711,Jumbo Bag Toys,6.13,10,16945.0,United Kingdom
546119,2023-03-09,22386,Jumbo Bag Pink Polkadot,6.13,10,16945.0,United Kingdom
546119,2023-03-09,85099C,Jumbo Bag Baroque Black White,6.13,10,16945.0,United Kingdom
546119,2023-03-09,20713,Jumbo Bag Owls,6.13,10,16945.0,United Kingdom
546120,2023-03-09,23006,Travel Card Wallet Flower Meadow,10.68,24,16945.0,United Kingdom
546120,2023-03-09,23002,Travel Card Wallet Skulls,10.68,24,16945.0,United Kingdom
546120,2023-03-09,23126,Feltcraft Girl Amelie Kit,15.32,4,16945.0,United Kingdom
546120,2023-03-09,23128,Feltcraft Boy Jean-Paul Kit,15.32,4,16945.0,United Kingdom
546120,2023-03-09,22997,Travel Card Wallet Union Jack,10.68,24,16945.0,United Kingdom
546120,2023-03-09,22995,Travel Card Wallet Suki,10.68,24,16945.0,United Kingdom
546121,2023-03-09,46000M,Polyester Filler Pad 45x45cm,11.84,2,14085.0,United Kingdom
546121,2023-03-09,82486,3 Drawer Antique White Wood Cabinet,19.42,1,14085.0,United Kingdom
546121,2023-03-09,22173,Metal 4 Hook Hanger French Chateau,13.27,3,14085.0,United Kingdom
546121,2023-03-09,22227,Hanging Heart Mirror Decoration,10.92,7,14085.0,United Kingdom
546121,2023-03-09,22652,Travel Sewing Kit,11.94,3,14085.0,United Kingdom
546121,2023-03-09,22766,Photo Frame Cornice,13.27,2,14085.0,United Kingdom
546121,2023-03-09,84879,Assorted Colour Bird Ornament,11.98,8,14085.0,United Kingdom
546121,2023-03-09,21171,Bathroom Metal Sign,10.81,4,14085.0,United Kingdom
546121,2023-03-09,82578,Kitchen Metal Sign,10.81,3,14085.0,United Kingdom
546121,2023-03-09,22989,Set 2 Pantry Design Tea Towels,13.58,2,14085.0,United Kingdom
546121,2023-03-09,82482,Wooden Picture Frame White Finish,12.86,3,14085.0,United Kingdom
546121,2023-03-09,82494L,Wooden Frame Antique White,13.27,4,14085.0,United Kingdom
546121,2023-03-09,20828,Glitter Butterfly Clips,12.86,3,14085.0,United Kingdom
546121,2023-03-09,85016,Set Of 6 Vintage Notelets Kit,12.86,3,14085.0,United Kingdom
546121,2023-03-09,22030,Swallows Greeting Card,10.68,12,14085.0,United Kingdom
546121,2023-03-09,22023,Empire Birthday Card,10.68,12,14085.0,United Kingdom
546121,2023-03-09,17091A,Lavender Incense In Tin,11.53,2,14085.0,United Kingdom
546121,2023-03-09,17091J,Vanilla Incense In Tin,11.53,2,14085.0,United Kingdom
546121,2023-03-09,22912,Yellow Coat Rack Paris Fashion,15.32,2,14085.0,United Kingdom
546121,2023-03-09,21038,Set/4 Modern Vintage Cotton Napkins,11.06,3,14085.0,United Kingdom
546121,2023-03-09,21622,Vintage Union Jack Cushion Cover,15.32,2,14085.0,United Kingdom
546121,2023-03-09,22720,Set Of 3 Cake Tins Pantry Design,15.32,1,14085.0,United Kingdom
546121,2023-03-09,85232D,Set/3 Decoupage Stacking Tins,15.32,1,14085.0,United Kingdom
546121,2023-03-09,37343,Polkadot Mug Pink,10.65,10,14085.0,United Kingdom
546121,2023-03-09,37342,Polkadot Coffee Cup & Saucer Pink,11.06,12,14085.0,United Kingdom
546122,2023-03-09,47566,Party Bunting,15.32,2,15581.0,United Kingdom
546122,2023-03-09,21745,Gaolers Keys Decorative Garden,14.09,1,15581.0,United Kingdom
546122,2023-03-09,84751B,Black Medium Glass Cake Stand,14.09,4,15581.0,United Kingdom
546122,2023-03-09,21175,Gin And Tonic Diet Metal Sign,12.86,1,15581.0,United Kingdom
546122,2023-03-09,85150,Ladies & Gentlemen Metal Sign,12.86,1,15581.0,United Kingdom
546122,2023-03-09,82599,Fanny's Rest Stopmetal Sign,12.4,1,15581.0,United Kingdom
546122,2023-03-09,82552,Washroom Metal Sign,11.74,1,15581.0,United Kingdom
546122,2023-03-09,21452,Toadstool Money Box,13.27,2,15581.0,United Kingdom
546122,2023-03-09,21259,Victorian Sewing Box Small,16.35,1,15581.0,United Kingdom
546122,2023-03-09,37370,Retro Coffee Mugs Assorted,11.53,6,15581.0,United Kingdom
546122,2023-03-09,21380,Wooden Happy Birthday Garland,13.27,2,15581.0,United Kingdom
546122,2023-03-09,47590B,Pink Happy Birthday Bunting,15.84,1,15581.0,United Kingdom
546122,2023-03-09,21135,Victorian Metal Postcard Spring,11.98,3,15581.0,United Kingdom
546122,2023-03-09,22720,Set Of 3 Cake Tins Pantry Design,15.32,1,15581.0,United Kingdom
546122,2023-03-09,84879,Assorted Colour Bird Ornament,11.98,8,15581.0,United Kingdom
546123,2023-03-09,84947,Antique Silver Tea Glass Engraved,11.34,72,16419.0,United Kingdom
546123,2023-03-09,21894,Potting Shed Seed Envelopes,11.53,12,16419.0,United Kingdom
546123,2023-03-09,21896,Potting Shed Twine,12.4,6,16419.0,United Kingdom
546123,2023-03-09,47566,Party Bunting,15.32,4,16419.0,United Kingdom
546127,2023-03-09,84818,Danish Rose Photo Frame,12.86,6,17730.0,United Kingdom
546127,2023-03-09,22318,Five Heart Hanging Decoration,13.27,6,17730.0,United Kingdom
546127,2023-03-09,22855,Fine Wicker Heart,11.34,48,17730.0,United Kingdom
546127,2023-03-09,21164,Home Sweet Home Metal Sign,13.27,12,17730.0,United Kingdom
546127,2023-03-09,22212,Four Hook White Lovebirds,12.4,12,17730.0,United Kingdom
546127,2023-03-09,84406B,Cream Cupid Hearts Coat Hanger,14.09,32,17730.0,United Kingdom
546127,2023-03-09,21535,Red Retrospot Small Milk Jug,12.86,12,17730.0,United Kingdom
546127,2023-03-09,22966,Gingerbread Man Cookie Cutter,11.53,12,17730.0,United Kingdom
546127,2023-03-09,20914,Set/5 Red Retrospot Lid Glass Bowls,13.27,6,17730.0,United Kingdom
546127,2023-03-09,21527,Red Retrospot Traditional Teapot,17.37,12,17730.0,United Kingdom
546132,2023-03-09,23127,Feltcraft Girl Nicole Kit,15.32,12,15057.0,United Kingdom
546132,2023-03-09,22993,Set Of 4 Pantry Jelly Moulds,11.53,24,15057.0,United Kingdom
546133,2023-03-09,22502,Picnic Basket Wicker Small,16.35,4,14291.0,United Kingdom
546133,2023-03-09,23051,Recycled Acapulco Mat Blue,18.71,2,14291.0,United Kingdom
546133,2023-03-09,23050,Recycled Acapulco Mat Green,18.71,2,14291.0,United Kingdom
546133,2023-03-09,22029,Spaceboy Birthday Card,10.68,12,14291.0,United Kingdom
546133,2023-03-09,22027,Tea Party Birthday Card,10.68,12,14291.0,United Kingdom
546133,2023-03-09,22046,Tea Party Wrapping Paper,10.68,25,14291.0,United Kingdom
546133,2023-03-09,22045,Spaceboy Gift Wrap,10.68,25,14291.0,United Kingdom
546133,2023-03-09,23230,Wrap Alphabet Design,10.68,25,14291.0,United Kingdom
546133,2023-03-09,22708,Wrap Dolly Girl,10.68,25,14291.0,United Kingdom
546133,2023-03-09,22629,Spaceboy Lunch Box,12.25,12,14291.0,United Kingdom
546133,2023-03-09,22617,Baking Set Spaceboy Design,15.32,3,14291.0,United Kingdom
546133,2023-03-09,22417,Pack Of 60 Spaceboy Cake Cases,10.81,24,14291.0,United Kingdom
546133,2023-03-09,22551,Plasters In Tin Spaceboy,11.94,12,14291.0,United Kingdom
546133,2023-03-09,22630,Dolly Girl Lunch Box,12.25,12,14291.0,United Kingdom
546133,2023-03-09,22661,Charlotte Bag Dolly Girl Design,11.12,10,14291.0,United Kingdom
546133,2023-03-09,22951,60 Cake Cases Dolly Girl Design,10.81,24,14291.0,United Kingdom
546133,2023-03-09,22468,Babushka Lights String Of 10,17.17,2,14291.0,United Kingdom
546133,2023-03-09,22179,Set 10 Night Owl Lights,17.17,2,14291.0,United Kingdom
546133,2023-03-09,22899,Children's Apron Dolly Girl,12.4,6,14291.0,United Kingdom
546133,2023-03-09,21731,Red Toadstool Led Night Light,11.94,12,14291.0,United Kingdom
546133,2023-03-09,22139,Retrospot Tea Set Ceramic 11 Pc,15.32,3,14291.0,United Kingdom
