TransactionNo,Date,ProductNo,ProductName,Price,Quantity,CustomerNo,Country
546028,2023-03-09,22655,Vintage Red Kitchen Cabinet,594.5,2,17049.0,United Kingdom
546088,2023-03-09,22826,Love Seat Antique White Metal,210.12,1,12881.0,United Kingdom
546136,2023-03-09,22849,Bread Bin Diner Style Mint,44.37,1,13136.0,United Kingdom
546096,2023-03-09,22764,Rustic Wooden Cabinet Glass Doors,35.82,1,15502.0,United Kingdom
546136,2023-03-09,22829,Sweetheart Wire Wall Tidy,31.56,1,13136.0,United Kingdom
546136,2023-03-09,21623,Vintage Union Jack Memoboard,30.71,1,13136.0,United Kingdom
546109,2023-03-09,23010,Circus Parade Baby Gift Set,27.62,1,15109.0,United Kingdom
546109,2023-03-09,23007,Spaceboy Baby Gift Set,27.62,1,15109.0,United Kingdom
546136,2023-03-09,82484,Wood Black Board Ant White Finish,27.3,1,13136.0,United Kingdom
546079,2023-03-09,22606,Wooden Skittles Garden Set,26.6,1,14534.0,United Kingdom
546136,2023-03-09,22692,Doormat Welcome To Our Home,26.43,1,13136.0,United Kingdom
546136,2023-03-09,22856,Assorted Easter Decorations Bells,26.43,1,13136.0,United Kingdom
546136,2023-03-09,48187,Doormat New England,26.43,1,13136.0,United Kingdom
546136,2023-03-09,48188,Doormat Welcome Puppies,26.43,1,13136.0,United Kingdom
546136,2023-03-09,48194,Doormat Hearts,26.43,2,13136.0,United Kingdom
546027,2023-03-09,22367,Childrens Apron Spaceboy Design,12.25,8,12759.0,Netherlands
546027,2023-03-09,22045,Spaceboy Gift Wrap,10.68,25,12759.0,Netherlands
546027,2023-03-09,22613,Pack Of 20 Spaceboy Napkins,11.12,12,12759.0,Netherlands
546027,2023-03-09,22629,Spaceboy Lunch Box,12.25,12,12759.0,Netherlands
546027,2023-03-09,22964,3 Piece Spaceboy Cookie Cutter Set,12.4,6,12759.0,Netherlands
546027,2023-03-09,22197,Popcorn Holder,11.12,12,12759.0,Netherlands
546027,2023-03-09,21733,Red Hanging Heart T-Light Holder,13.27,6,12759.0,Netherlands
546027,2023-03-09,22131,Food Container Set 3 Love Heart,12.25,6,12759.0,Netherlands
546027,2023-03-09,22804,Pink Hanging Heart T-Light Holder,13.27,6,12759.0,Netherlands
546027,2023-03-09,84992,72 Sweetheart Fairy Cake Cases,10.81,24,12759.0,Netherlands
546027,2023-03-09,85123A,Cream Hanging Heart T-Light Holder,13.27,12,12759.0,Netherlands
546027,2023-03-09,22254,Felt Toadstool Large,11.53,12,12759.0,Netherlands
546027,2023-03-09,22281,Easter Tree Yellow Birds,16.35,2,12759.0,Netherlands
546027,2023-03-09,85206A,Cream Felt Easter Egg Basket,11.94,6,12759.0,Netherlands
546027,2023-03-09,85093,Candy Spot Egg Warmer Hare,11.53,12,12759.0,Netherlands
546027,2023-03-09,21121,Set/10 Red Polkadot Party Candles,11.53,24,12759.0,Netherlands
546027,2023-03-09,84997D,Childrens Cutlery Polkadot Pink,14.5,4,12759.0,Netherlands
546027,2023-03-09,22661,Charlotte Bag Dolly Girl Design,11.12,10,12759.0,Netherlands
546027,2023-03-09,22630,Dolly Girl Lunch Box,12.25,12,12759.0,Netherlands
546027,2023-03-09,22492,Mini Paint Set Vintage,10.92,36,12759.0,Netherlands
546027,2023-03-09,22637,Piggy Bank Retrospot,12.86,4,12759.0,Netherlands
546027,2023-03-09,22745,Poppy's Playhouse Bedroom,12.4,6,12759.0,Netherlands
546027,2023-03-09,22617,Baking Set Spaceboy Design,15.32,3,12759.0,Netherlands
546027,2023-03-09,22138,Baking Set 9 Piece Retrospot,15.32,3,12759.0,Netherlands
546027,2023-03-09,20704,Mr Robot Soft Toy,17.37,2,12759.0,Netherlands
546027,2023-03-09,22382,Lunch Bag Spaceboy Design,5.97,10,12759.0,Netherlands
546028,2023-03-09,23183,Mother's Kitchen Spoon Rest,14.09,6,17049.0,United Kingdom
546028,2023-03-09,23184,Bull Dog Bottle Opener,15.32,4,17049.0,United Kingdom
546028,2023-03-09,23182,Toilet Sign Occupied Or Vacant,11.1,24,17049.0,United Kingdom
546028,2023-03-09,21212,Pack Of 72 Retrospot Cake Cases,10.81,24,17049.0,United Kingdom
546028,2023-03-09,84992,72 Sweetheart Fairy Cake Cases,10.81,24,17049.0,United Kingdom
546028,2023-03-09,22168,Organiser Wood Antique White,18.96,2,17049.0,United Kingdom
546028,2023-03-09,82483,Wood 2 Drawer Cabinet White Finish,17.37,2,17049.0,United Kingdom
546028,2023-03-09,82486,3 Drawer Antique White Wood Cabinet,19.42,2,17049.0,United Kingdom
546028,2023-03-09,22199,Frying Pan Red Retrospot,14.61,4,17049.0,United Kingdom
546028,2023-03-09,22207,Frying Pan Union Flag,14.61,4,17049.0,United Kingdom
546028,2023-03-09,84050,Pink Heart Shape Egg Frying Pan,11.94,6,17049.0,United Kingdom
546028,2023-03-09,22203,Milk Pan Red Retrospot,14.09,4,17049.0,United Kingdom
546028,2023-03-09,22134,Mini Ladle Love Heart Red,10.68,12,17049.0,United Kingdom
546028,2023-03-09,20754,Retrospot Red Washing Up Gloves,12.4,6,17049.0,United Kingdom
546028,2023-03-09,23180,Mum's Kitchen Clock,15.32,4,17049.0,United Kingdom
546028,2023-03-09,23181,Bull Dog Bottle Top Wall Clock,18.71,2,17049.0,United Kingdom
546028,2023-03-09,22193,Red Diner Wall Clock,18.96,2,17049.0,United Kingdom
546028,2023-03-09,23179,Clock Magnet Mum's Kitchen,13.21,6,17049.0,United Kingdom
546028,2023-03-09,21922,Union Stripe With Fringe Hammock,18.4,4,17049.0,United Kingdom
546028,2023-03-09,20685,Doormat Red Retrospot,18.4,2,17049.0,United Kingdom
546028,2023-03-09,21523,Doormat Fancy Font Home Sweet Home,18.4,2,17049.0,United Kingdom
546028,2023-03-09,85123A,Cream Hanging Heart T-Light Holder,13.27,24,17049.0,United Kingdom
546028,2023-03-09,21955,Doormat Union Jack Guns And Roses,18.4,2,17049.0,United Kingdom
546028,2023-03-09,22660,Doormat I Love London,18.4,2,17049.0,United Kingdom
546028,2023-03-09,22690,Doormat Home Sweet Home Blue,18.4,2,17049.0,United Kingdom
546028,2023-03-09,22692,Doormat Welcome To Our Home,18.4,2,17049.0,United Kingdom
546028,2023-03-09,48194,Doormat Hearts,18.4,2,17049.0,United Kingdom
546028,2023-03-09,48187,Doormat New England,18.4,2,17049.0,United Kingdom
546028,2023-03-09,85014B,Red Retrospot Umbrella,16.35,3,17049.0,United Kingdom
546028,2023-03-09,15056P,Edwardian Parasol Pink,16.35,3,17049.0,United Kingdom
546028,2023-03-09,22721,Set Of 3 Cake Tins Sketchbook,15.32,3,17049.0,United Kingdom
546028,2023-03-09,22720,Set Of 3 Cake Tins Pantry Design,15.32,3,17049.0,United Kingdom
546028,2023-03-09,22997,Travel Card Wallet Union Jack,10.68,24,17049.0,United Kingdom
546028,2023-03-09,22995,Travel Card Wallet Suki,10.68,24,17049.0,United Kingdom
546028,2023-03-09,22993,Set Of 4 Pantry Jelly Moulds,11.53,12,17049.0,United Kingdom
546028,2023-03-09,23006,Travel Card Wallet Flower Meadow,10.68,24,17049.0,United Kingdom
546028,2023-03-09,23185,French Style Storage Jar Jam,11.53,12,17049.0,United Kingdom
546028,2023-03-09,23186,French Style Storage Jar Cafe,11.53,12,17049.0,United Kingdom
546028,2023-03-09,85099B,Jumbo Bag Red Retrospot,6.13,10,17049.0,United Kingdom
546029,2023-03-09,22698,Pink Regency Teacup And Saucer,13.27,6,15206.0,United Kingdom
546030,2023-03-09,22652,Travel Sewing Kit,11.94,10,14013.0,United Kingdom
546030,2023-03-09,22651,Gentleman Shirt Repair Kit,11.12,12,14013.0,United Kingdom
546030,2023-03-09,85176,Sewing Susan 21 Needle Set,11.12,12,14013.0,United Kingdom
546030,2023-03-09,85177,Basket Of Flowers Sewing Kit,11.12,12,14013.0,United Kingdom
546030,2023-03-09,85178,Victorian Sewing Kit,11.53,12,14013.0,United Kingdom
546030,2023-03-09,22961,Jam Making Set Printed,11.74,12,14013.0,United Kingdom
546030,2023-03-09,21929,Jumbo Bag Pink Vintage Paisley,6.13,10,14013.0,United Kingdom
546030,2023-03-09,20711,Jumbo Bag Toys,6.13,10,14013.0,United Kingdom
546031,2023-03-09,82482,Wooden Picture Frame White Finish,12.86,6,13267.0,United Kingdom
546031,2023-03-09,21707,Folding Umbrella Blackblue Polkadot,15.32,8,13267.0,United Kingdom
546031,2023-03-09,21706,Folding Umbrella Red/White Polkadot,15.32,4,13267.0,United Kingdom
546031,2023-03-09,22178,Victorian Glass Hanging T-Light,11.53,12,13267.0,United Kingdom
546031,2023-03-09,84978,Hanging Heart Jar T-Light Holder,11.53,12,13267.0,United Kingdom
546031,2023-03-09,79321,Chilli Lights,16.14,8,13267.0,United Kingdom
546031,2023-03-09,22728,Alarm Clock Bakelike Pink,14.09,4,13267.0,United Kingdom
546031,2023-03-09,22726,Alarm Clock Bakelike Green,14.09,4,13267.0,United Kingdom
546031,2023-03-09,84755,Colour Glass T-Light Holder Hanging,10.92,32,13267.0,United Kingdom
546032,2023-03-09,84949,Silver Hanging T-Light Holder,11.94,6,13267.0,United Kingdom
546032,2023-03-09,21916,Set 12 Retro White Chalk Sticks,10.68,24,13267.0,United Kingdom
546032,2023-03-09,84879,Assorted Colour Bird Ornament,11.98,8,13267.0,United Kingdom
546032,2023-03-09,82486,3 Drawer Antique White Wood Cabinet,19.42,2,13267.0,United Kingdom
546032,2023-03-09,82484,Wood Black Board Ant White Finish,18.4,2,13267.0,United Kingdom
546032,2023-03-09,21754,Home Building Block Word,16.35,3,13267.0,United Kingdom
546033,2023-03-09,82486,3 Drawer Antique White Wood Cabinet,18.4,2,13267.0,United Kingdom
546034,2023-03-09,22996,Travel Card Wallet Vintage Ticket,10.68,24,14032.0,United Kingdom
546034,2023-03-09,21731,Red Toadstool Led Night Light,11.94,12,14032.0,United Kingdom
546034,2023-03-09,21918,Set 12 Kids Colour Chalk Sticks,10.68,24,14032.0,United Kingdom
546034,2023-03-09,84077,World War 2 Gliders Asstd Designs,10.55,48,14032.0,United Kingdom
546034,2023-03-09,22197,Popcorn Holder,11.12,12,14032.0,United Kingdom
546034,2023-03-09,22636,Childs Breakfast Set Circus Parade,18.96,4,14032.0,United Kingdom
546034,2023-03-09,22659,Lunch Box I Love London,12.25,12,14032.0,United Kingdom
546034,2023-03-09,22900,Set 2 Tea Towels I Love London,13.27,12,14032.0,United Kingdom
546034,2023-03-09,22970,London Bus Coffee Mug,12.86,6,14032.0,United Kingdom
546034,2023-03-09,22441,Grow Your Own Basil In Enamel Mug,12.4,8,14032.0,United Kingdom
546034,2023-03-09,22109,Full English Breakfast Plate,14.09,8,14032.0,United Kingdom
546034,2023-03-09,22064,Pink Doughnut Trinket Pot,11.94,12,14032.0,United Kingdom
546034,2023-03-09,22976,Circus Parade Childrens Egg Cup,11.53,12,14032.0,United Kingdom
546034,2023-03-09,22892,Set Of Salt And Pepper Toadstools,11.53,12,14032.0,United Kingdom
546034,2023-03-09,84006,Magic Tree -Paper Flowers,11.12,12,14032.0,United Kingdom
546034,2023-03-09,21509,Cowboys And Indians Birthday Card,10.68,12,14032.0,United Kingdom
546034,2023-03-09,21507,Elephant Birthday Card,10.68,12,14032.0,United Kingdom
546034,2023-03-09,22713,Card I Love London,10.68,12,14032.0,United Kingdom
546034,2023-03-09,22030,Swallows Greeting Card,10.68,12,14032.0,United Kingdom
546034,2023-03-09,23230,Wrap Alphabet Design,10.68,25,14032.0,United Kingdom
546035,2023-03-09,22801,Antique Glass Pedestal Bowl,14.09,1,12924.0,United Kingdom
546035,2023-03-09,22800,Antique Tall Swirlglass Trinket Pot,14.09,12,12924.0,United Kingdom
546035,2023-03-09,22801,Antique Glass Pedestal Bowl,14.09,4,12924.0,United Kingdom
546035,2023-03-09,84947,Antique Silver Tea Glass Engraved,11.53,18,12924.0,United Kingdom
546035,2023-03-09,22801,Antique Glass Pedestal Bowl,13.72,16,12924.0,United Kingdom
546035,2023-03-09,22778,Glass Cloche Small,13.72,24,12924.0,United Kingdom
546036,2023-03-09,20724,Red Retrospot Charlotte Bag,11.12,10,14645.0,United Kingdom
546036,2023-03-09,21218,Red Spotty Biscuit Tin,14.09,6,14645.0,United Kingdom
546036,2023-03-09,21080,Set/20 Red Retrospot Paper Napkins,11.12,12,14645.0,United Kingdom
546036,2023-03-09,22456,Natural Slate Chalkboard Large,15.32,6,14645.0,United Kingdom
546036,2023-03-09,22665,Recipe Box Blue Sketchbook Design,13.27,6,14645.0,United Kingdom
546036,2023-03-09,22384,Lunch Bag Pink Polkadot,5.97,10,14645.0,United Kingdom
546036,2023-03-09,20727,Lunch Bag Black Skull,5.97,10,14645.0,United Kingdom
546036,2023-03-09,20725,Lunch Bag Red Retrospot,5.97,10,14645.0,United Kingdom
546037,2023-03-09,22749,Feltcraft Princess Charlotte Doll,14.09,8,14825.0,United Kingdom
546037,2023-03-09,22750,Feltcraft Princess Lola Doll,14.09,4,14825.0,United Kingdom
546037,2023-03-09,22178,Victorian Glass Hanging T-Light,11.53,12,14825.0,United Kingdom
546037,2023-03-09,22751,Feltcraft Princess Olivia Doll,14.09,8,14825.0,United Kingdom
546037,2023-03-09,23127,Feltcraft Girl Nicole Kit,15.32,4,14825.0,United Kingdom
546037,2023-03-09,23126,Feltcraft Girl Amelie Kit,15.32,4,14825.0,United Kingdom
546037,2023-03-09,22189,Cream Heart Card Holder,14.3,4,14825.0,United Kingdom
546038,2023-03-09,22767,Triple Photo Frame Cornice,18.96,16,15071.0,United Kingdom
546038,2023-03-09,22766,Photo Frame Cornice,12.86,48,15071.0,United Kingdom
546038,2023-03-09,22427,Enamel Flower Jug Cream,15.84,12,15071.0,United Kingdom
546038,2023-03-09,72807B,Set/3 Ocean Scent Candle Jewel Box,14.61,4,15071.0,United Kingdom
546038,2023-03-09,71053,White Moroccan Metal Lantern,14.09,8,15071.0,United Kingdom
546038,2023-03-09,22170,Picture Frame Wood Triple Portrait,16.35,24,15071.0,United Kingdom
546038,2023-03-09,84755,Colour Glass T-Light Holder Hanging,10.92,16,15071.0,United Kingdom
546038,2023-03-09,22789,T-Light Holder Sweetheart Hanging,12.25,8,15071.0,United Kingdom
546038,2023-03-09,21242,Red Retrospot Plate,11.98,8,15071.0,United Kingdom
546038,2023-03-09,21238,Red Retrospot Cup,11.12,8,15071.0,United Kingdom
546038,2023-03-09,22759,Set Of 3 Notebooks In Parcel,11.94,12,15071.0,United Kingdom
546038,2023-03-09,21056,Doctor's Bag Soft Toy,19.42,1,15071.0,United Kingdom
546062,2023-03-09,16008,Small Folding Scissor(Pointed Edge),10.51,72,16221.0,United Kingdom
546062,2023-03-09,22228,Bunny Wooden Painted With Bird,11.12,6,16221.0,United Kingdom
546062,2023-03-09,22229,Bunny Wooden Painted With Flower,11.12,6,16221.0,United Kingdom
546062,2023-03-09,85123A,Cream Hanging Heart T-Light Holder,13.27,2,16221.0,United Kingdom
546062,2023-03-09,22934,Baking Mould Easter Egg White Choc,13.27,1,16221.0,United Kingdom
546062,2023-03-09,47504K,English Rose Garden Secateurs,12.25,2,16221.0,United Kingdom
546062,2023-03-09,21458,2 Picture Book Eggs Easter Bunny,11.53,4,16221.0,United Kingdom
546062,2023-03-09,85049C,Romantic Pinks Ribbons,11.53,1,16221.0,United Kingdom
546062,2023-03-09,85049D,Bright Blues Ribbons,11.53,1,16221.0,United Kingdom
546062,2023-03-09,21497,Fancy Fonts Birthday Wrap,10.68,25,16221.0,United Kingdom
546062,2023-03-09,21034,Rex Cash+Carry Jumbo Shopper,11.22,1,16221.0,United Kingdom
546062,2023-03-09,22625,Red Kitchen Scales,18.96,1,16221.0,United Kingdom
546062,2023-03-09,22981,Pantry Apple Corer,11.74,2,16221.0,United Kingdom
546062,2023-03-09,22982,Pantry Pastry Brush,11.53,2,16221.0,United Kingdom
546062,2023-03-09,17003,Brocade Ring Purse,10.55,72,16221.0,United Kingdom
546062,2023-03-09,22928,Yellow Giant Garden Thermometer,16.35,2,16221.0,United Kingdom
546062,2023-03-09,22980,Pantry Scrubbing Brush,11.94,2,16221.0,United Kingdom
546062,2023-03-09,22241,Garland Wooden Happy Easter,11.53,4,16221.0,United Kingdom
546062,2023-03-09,21470,Flower Vine Raffia Food Cover,14.09,7,16221.0,United Kingdom
546062,2023-03-09,21471,Strawberry Raffia Food Cover,14.09,2,16221.0,United Kingdom
546067,2023-03-09,22469,Heart Of Wicker Small,12.23,600,17450.0,United Kingdom
546067,2023-03-09,21621,Vintage Union Jack Bunting,19.34,48,17450.0,United Kingdom
546067,2023-03-09,21906,Pharmacie First Aid Tin,17.56,18,17450.0,United Kingdom
546067,2023-03-09,21260,First Aid Tin,13.73,114,17450.0,United Kingdom
546079,2023-03-09,22963,Jam Jar With Green Lid,11.12,6,14534.0,United Kingdom
546079,2023-03-09,22962,Jam Jar With Pink Lid,11.12,6,14534.0,United Kingdom
546079,2023-03-09,22895,Set Of 2 Tea Towels Apple And Pears,13.27,1,14534.0,United Kingdom
546079,2023-03-09,22439,6 Rocket Balloons,10.92,2,14534.0,United Kingdom
546079,2023-03-09,21915,Red Harmonica In Box,11.53,2,14534.0,United Kingdom
546079,2023-03-09,22993,Set Of 4 Pantry Jelly Moulds,11.53,1,14534.0,United Kingdom
546079,2023-03-09,22128,Party Cones Candy Assorted,11.53,12,14534.0,United Kingdom
546079,2023-03-09,22270,Happy Easter Hanging Decoration,14.09,1,14534.0,United Kingdom
546079,2023-03-09,20867,Pink Rose Fabric Mirror,11.53,11,14534.0,United Kingdom
546079,2023-03-09,20856,Denim Patch Purse Pink Butterfly,11.94,11,14534.0,United Kingdom
546079,2023-03-09,22855,Fine Wicker Heart,11.53,1,14534.0,United Kingdom
546079,2023-03-09,22469,Heart Of Wicker Small,11.94,1,14534.0,United Kingdom
546079,2023-03-09,21826,Eight Piece Dinosaur Set,11.53,2,14534.0,United Kingdom
546079,2023-03-09,21828,Eight Piece Snake Set,11.53,2,14534.0,United Kingdom
546079,2023-03-09,22230,Jigsaw Tree With Watering Can,11.12,2,14534.0,United Kingdom
546079,2023-03-09,21914,Blue Harmonica In Box,11.53,2,14534.0,United Kingdom
546079,2023-03-09,23177,Treasure Island Book Box,12.56,1,14534.0,United Kingdom
546079,2023-03-09,23193,Buffalo Bill Treasure Book Box,12.56,1,14534.0,United Kingdom
546079,2023-03-09,23176,Abc Treasure Book Box,12.56,1,14534.0,United Kingdom
546079,2023-03-09,22636,Childs Breakfast Set Circus Parade,18.96,1,14534.0,United Kingdom
546079,2023-03-09,22470,Heart Of Wicker Large,13.27,1,14534.0,United Kingdom
546079,2023-03-09,22267,Easter Decoration Egg Bunny,11.53,12,14534.0,United Kingdom
546079,2023-03-09,22625,Red Kitchen Scales,18.96,2,14534.0,United Kingdom
546079,2023-03-09,22624,Ivory Kitchen Scales,18.96,1,14534.0,United Kingdom
546082,2023-03-09,40016,Chinese Dragon Paper Lanterns,10.51,600,12971.0,United Kingdom
546082,2023-03-09,22499,Wooden Union Jack Bunting,16.35,12,12971.0,United Kingdom
546083,2023-03-09,21464,Disco Ball Rotator Battery Operated,14.61,2,12971.0,United Kingdom
546083,2023-03-09,22219,Lovebird Hanging Decoration White,11.12,24,12971.0,United Kingdom
546083,2023-03-09,22152,Place Setting White Star,10.68,24,12971.0,United Kingdom
546084,2023-03-09,79000,Moroccan Tea Glass,11.12,12,14112.0,United Kingdom
546084,2023-03-09,22967,Set 3 Song Bird Paper Eggs Assorted,13.27,6,14112.0,United Kingdom
546084,2023-03-09,22861,Easter Tin Chicks In Garden,11.94,6,14112.0,United Kingdom
546084,2023-03-09,22858,Easter Tin Keepsake,11.94,6,14112.0,United Kingdom
546084,2023-03-09,22860,Easter Tin Chicks Pink Daisy,11.94,6,14112.0,United Kingdom
546084,2023-03-09,22859,Easter Tin Bunny Bouquet,11.94,6,14112.0,United Kingdom
546084,2023-03-09,21930,Jumbo Storage Bag Skulls,12.25,10,14112.0,United Kingdom
546084,2023-03-09,22355,Charlotte Bag Suki Design,11.12,10,14112.0,United Kingdom
546084,2023-03-09,20723,Strawberry Charlotte Bag,11.12,10,14112.0,United Kingdom
546084,2023-03-09,20724,Red Retrospot Charlotte Bag,11.12,10,14112.0,United Kingdom
546084,2023-03-09,22243,5 Hook Hanger Red Magic Toadstool,11.94,12,14112.0,United Kingdom
546084,2023-03-09,21452,Toadstool Money Box,13.27,6,14112.0,United Kingdom
546084,2023-03-09,22232,Jigsaw Toadstools 3 Piece,11.94,8,14112.0,United Kingdom
546084,2023-03-09,22740,Polkadot Pen,11.12,48,14112.0,United Kingdom
546084,2023-03-09,22741,Funky Diva Pen,11.12,48,14112.0,United Kingdom
546084,2023-03-09,21749,Large Red Retrospot Windmill,12.4,6,14112.0,United Kingdom
546084,2023-03-09,21746,Small Red Retrospot Windmill,11.53,12,14112.0,United Kingdom
546084,2023-03-09,21535,Red Retrospot Small Milk Jug,12.86,6,14112.0,United Kingdom
546084,2023-03-09,21533,Retrospot Large Milk Jug,15.32,3,14112.0,United Kingdom
546084,2023-03-09,21844,Red Retrospot Mug,13.27,6,14112.0,United Kingdom
546084,2023-03-09,21080,Set/20 Red Retrospot Paper Napkins,11.12,12,14112.0,United Kingdom
546084,2023-03-09,21212,Pack Of 72 Retrospot Cake Cases,10.81,24,14112.0,United Kingdom
546084,2023-03-09,22637,Piggy Bank Retrospot,12.86,4,14112.0,United Kingdom
546084,2023-03-09,22895,Set Of 2 Tea Towels Apple And Pears,13.27,6,14112.0,United Kingdom
546084,2023-03-09,22898,Childrens Apron Apples Design,12.25,8,14112.0,United Kingdom
546084,2023-03-09,22908,Pack Of 20 Napkins Red Apples,11.12,12,14112.0,United Kingdom
546084,2023-03-09,22303,Coffee Mug Apples Design,12.86,6,14112.0,United Kingdom
546084,2023-03-09,22302,Coffee Mug Pears Design,12.86,6,14112.0,United Kingdom
546084,2023-03-09,21239,Pink Polkadot Cup,11.12,8,14112.0,United Kingdom
546084,2023-03-09,20676,Red Retrospot Bowl,11.53,8,14112.0,United Kingdom
546084,2023-03-09,84997B,Childrens Cutlery Retrospot Red,14.5,4,14112.0,United Kingdom
546084,2023-03-09,20675,Blue Polkadot Bowl,11.53,8,14112.0,United Kingdom
546084,2023-03-09,84406B,Cream Cupid Hearts Coat Hanger,14.5,4,14112.0,United Kingdom
546084,2023-03-09,85099B,Jumbo Bag Red Retrospot,6.13,10,14112.0,United Kingdom
546084,2023-03-09,22386,Jumbo Bag Pink Polkadot,6.13,10,14112.0,United Kingdom
546084,2023-03-09,20713,Jumbo Bag Owls,6.13,10,14112.0,United Kingdom
546087,2023-03-09,17003,Brocade Ring Purse,10.55,72,13026.0,United Kingdom
546087,2023-03-09,79000,Moroccan Tea Glass,11.12,24,13026.0,United Kingdom
546087,2023-03-09,22178,Victorian Glass Hanging T-Light,11.53,12,13026.0,United Kingdom
546087,2023-03-09,35095B,Red Victorian Fabric Oval Box,10.68,24,13026.0,United Kingdom
546087,2023-03-09,15036,Assorted Colours Silk Fan,11.02,24,13026.0,United Kingdom
546088,2023-03-09,22853,Cat Bowl Vintage Cream,13.58,6,12881.0,United Kingdom
546088,2023-03-09,22852,Dog Bowl Vintage Cream,14.61,4,12881.0,United Kingdom
546088,2023-03-09,22845,Vintage Cream Cat Food Container,16.76,2,12881.0,United Kingdom
546088,2023-03-09,22844,Vintage Cream Dog Food Container,18.96,2,12881.0,United Kingdom
546088,2023-03-09,22624,Ivory Kitchen Scales,18.96,2,12881.0,United Kingdom
546088,2023-03-09,22430,Enamel Watering Can Cream,15.32,4,12881.0,United Kingdom
546089,2023-03-09,84029E,Red Woolly Hottie White Heart,14.09,3,17864.0,United Kingdom
546089,2023-03-09,21479,White Skull Hot Water Bottle,14.09,3,17864.0,United Kingdom
546089,2023-03-09,84558A,3d Dog Picture Playing Cards,13.27,3,17864.0,United Kingdom
546089,2023-03-09,22264,Felt Farm Animal White Bunny,11.12,2,17864.0,United Kingdom
546089,2023-03-09,16237,Sleeping Cat Erasers,10.47,30,17864.0,United Kingdom
546089,2023-03-09,21829,Dinosaur Keyrings Assorted,10.47,36,17864.0,United Kingdom
546089,2023-03-09,22616,Pack Of 12 London Tissues,10.55,12,17864.0,United Kingdom
546089,2023-03-09,23193,Buffalo Bill Treasure Book Box,12.56,2,17864.0,United Kingdom
546089,2023-03-09,84465,15 Pink Fluffy Chicks In Box,13.27,2,17864.0,United Kingdom
546089,2023-03-09,22085,Paper Chain Kit Skulls,13.27,1,17864.0,United Kingdom
546089,2023-03-09,22084,Paper Chain Kit Empire,13.27,2,17864.0,United Kingdom
546089,2023-03-09,22911,Paper Chain Kit London,13.27,4,17864.0,United Kingdom
546089,2023-03-09,21829,Dinosaur Keyrings Assorted,10.47,36,17864.0,United Kingdom
546089,2023-03-09,21213,Pack Of 72 Skull Cake Cases,10.81,3,17864.0,United Kingdom
546089,2023-03-09,21975,Pack Of 60 Dinosaur Cake Cases,10.81,3,17864.0,United Kingdom
546089,2023-03-09,21977,Pack Of 60 Pink Paisley Cake Cases,10.81,3,17864.0,United Kingdom
546089,2023-03-09,22951,60 Cake Cases Dolly Girl Design,10.81,3,17864.0,United Kingdom
546089,2023-03-09,16236,Kitty Pencil Erasers,10.47,28,17864.0,United Kingdom
546089,2023-03-09,23000,Travel Card Wallet Transport,10.68,24,17864.0,United Kingdom
546089,2023-03-09,22999,Travel Card Wallet Vintage Leaf,10.68,24,17864.0,United Kingdom
546089,2023-03-09,22995,Travel Card Wallet Suki,10.68,24,17864.0,United Kingdom
546089,2023-03-09,22996,Travel Card Wallet Vintage Ticket,10.68,24,17864.0,United Kingdom
546089,2023-03-09,23002,Travel Card Wallet Skulls,10.68,24,17864.0,United Kingdom
546089,2023-03-09,21034,Rex Cash+Carry Jumbo Shopper,11.22,1,17864.0,United Kingdom
546089,2023-03-09,23176,Abc Treasure Book Box,12.56,6,17864.0,United Kingdom
546089,2023-03-09,21981,Pack Of 12 Woodland Tissues,10.55,12,17864.0,United Kingdom
546089,2023-03-09,21967,Pack Of 12 Skull Tissues,10.55,12,17864.0,United Kingdom
546089,2023-03-09,22085,Paper Chain Kit Skulls,13.27,2,17864.0,United Kingdom
546089,2023-03-09,21982,Pack Of 12 Suki Tissues,10.55,12,17864.0,United Kingdom
546089,2023-03-09,22614,Pack Of 12 Spaceboy Tissues,10.55,12,17864.0,United Kingdom
546089,2023-03-09,22616,Pack Of 12 London Tissues,10.55,24,17864.0,United Kingdom
546089,2023-03-09,22970,London Bus Coffee Mug,12.86,6,17864.0,United Kingdom
546090,2023-03-09,22189,Cream Heart Card Holder,13.72,36,16525.0,United Kingdom
546090,2023-03-09,22188,Black Heart Card Holder,13.72,36,16525.0,United Kingdom
546090,2023-03-09,22829,Sweetheart Wire Wall Tidy,18.96,8,16525.0,United Kingdom
546090,2023-03-09,22855,Fine Wicker Heart,11.34,96,16525.0,United Kingdom
546090,2023-03-09,21154,Red Retrospot Oven Glove,11.53,10,16525.0,United Kingdom
546090,2023-03-09,85150,Ladies & Gentlemen Metal Sign,12.4,48,16525.0,United Kingdom
546090,2023-03-09,82583,Hot Baths Metal Sign,12.15,72,16525.0,United Kingdom
546091,2023-03-09,21080,Set/20 Red Retrospot Paper Napkins,11.12,24,14936.0,Channel Islands
546091,2023-03-09,20914,Set/5 Red Retrospot Lid Glass Bowls,13.27,6,14936.0,Channel Islands
546091,2023-03-09,21533,Retrospot Large Milk Jug,15.32,6,14936.0,Channel Islands
546091,2023-03-09,21535,Red Retrospot Small Milk Jug,12.86,6,14936.0,Channel Islands
546091,2023-03-09,22956,36 Foil Heart Cake Cases,12.4,6,14936.0,Channel Islands
546091,2023-03-09,22955,36 Foil Star Cake Cases,12.4,6,14936.0,Channel Islands
546091,2023-03-09,21094,Set/6 Red Spotty Paper Plates,11.12,24,14936.0,Channel Islands
546091,2023-03-09,21086,Set/6 Red Spotty Paper Cups,10.92,24,14936.0,Channel Islands
546091,2023-03-09,21584,Retrospot Small Tube Matches,11.94,20,14936.0,Channel Islands
546091,2023-03-09,22084,Paper Chain Kit Empire,13.27,24,14936.0,Channel Islands
546091,2023-03-09,21955,Doormat Union Jack Guns And Roses,18.4,4,14936.0,Channel Islands
546091,2023-03-09,20685,Doormat Red Retrospot,18.4,4,14936.0,Channel Islands
546091,2023-03-09,22961,Jam Making Set Printed,11.74,12,14936.0,Channel Islands
546091,2023-03-09,22907,Pack Of 20 Napkins Pantry Design,11.12,24,14936.0,Channel Islands
546091,2023-03-09,22980,Pantry Scrubbing Brush,11.94,12,14936.0,Channel Islands
546091,2023-03-09,22962,Jam Jar With Pink Lid,11.12,12,14936.0,Channel Islands
546091,2023-03-09,22963,Jam Jar With Green Lid,11.12,12,14936.0,Channel Islands
546091,2023-03-09,21658,Glass Beurre Dish,14.3,4,14936.0,Channel Islands
