TransactionNo,Date,ProductNo,ProductName,Price,Quantity,CustomerNo,Country
544824,2023-02-24,22827,Rustic Seventeen Drawer Sideboard,179.37,1,17139.0,United Kingdom
544911,2023-02-24,22827,Rustic Seventeen Drawer Sideboard,179.37,1,16838.0,United Kingdom
544824,2023-02-24,22823,Chest Natural Wood 20 Drawers,138.38,1,17139.0,United Kingdom
544928,2023-02-24,22783,Set 3 Wicker Oval Baskets W Lids,50.36,1,15928.0,United Kingdom
544908,2023-02-24,22824,3 Tier Sweetheart Garden Shelf,47.1,1,18056.0,United Kingdom
544928,2023-02-24,22180,Retrospot Lamp,31.56,1,15928.0,United Kingdom
544928,2023-02-24,22501,Picnic Basket Wicker Large,31.56,1,15928.0,United Kingdom
544928,2023-02-24,22776,Sweetheart 3 Tier Cake Stand,30.71,1,15928.0,United Kingdom
544928,2023-02-24,84356,Pompom Curtain,30.71,1,15928.0,United Kingdom
544910,2023-02-24,22849,Bread Bin Diner Style Mint,27.62,2,16072.0,United Kingdom
544910,2023-02-24,22846,Bread Bin Diner Style Red,27.62,2,16072.0,United Kingdom
544928,2023-02-24,82484,Wood Black Board Ant White Finish,27.3,1,15928.0,United Kingdom
544821,2023-02-24,22053,Empire Design Rosette,11.53,60,12971.0,United Kingdom
544821,2023-02-24,21621,Vintage Union Jack Bunting,18.96,4,12971.0,United Kingdom
544822,2023-02-24,21326,Aged Glass Silver T-Light Holder,10.92,24,18231.0,United Kingdom
544822,2023-02-24,22150,3 Stripey Mice Feltcraft,12.25,12,18231.0,United Kingdom
544822,2023-02-24,22149,Feltcraft 6 Flower Friends,12.4,24,18231.0,United Kingdom
544822,2023-02-24,22148,Easter Craft 4 Chicks,12.25,12,18231.0,United Kingdom
544822,2023-02-24,72800C,4 Pink Dinner Candle Silver Flock,12.86,6,18231.0,United Kingdom
544822,2023-02-24,72800D,4 Blue Dinner Candles Silver Flock,12.86,6,18231.0,United Kingdom
544822,2023-02-24,20972,Pink Cream Felt Craft Trinket Box,11.53,24,18231.0,United Kingdom
544822,2023-02-24,22147,Feltcraft Butterfly Hearts,11.74,36,18231.0,United Kingdom
544822,2023-02-24,22271,Feltcraft Doll Rosie,13.27,12,18231.0,United Kingdom
544822,2023-02-24,20971,Pink Blue Felt Craft Trinket Box,11.53,24,18231.0,United Kingdom
544823,2023-02-24,21790,Vintage Snap Cards,11.12,24,14004.0,United Kingdom
544823,2023-02-24,22560,Traditional Modelling Clay,11.53,24,14004.0,United Kingdom
544823,2023-02-24,21914,Blue Harmonica In Box,11.53,24,14004.0,United Kingdom
544823,2023-02-24,21915,Red Harmonica In Box,11.53,24,14004.0,United Kingdom
544823,2023-02-24,22993,Set Of 4 Pantry Jelly Moulds,11.53,24,14004.0,United Kingdom
544823,2023-02-24,22730,Alarm Clock Bakelike Ivory,14.09,8,14004.0,United Kingdom
544823,2023-02-24,22727,Alarm Clock Bakelike Red,14.09,8,14004.0,United Kingdom
544823,2023-02-24,22726,Alarm Clock Bakelike Green,14.09,8,14004.0,United Kingdom
544823,2023-02-24,22625,Red Kitchen Scales,18.96,2,14004.0,United Kingdom
544823,2023-02-24,22191,Ivory Diner Wall Clock,18.96,4,14004.0,United Kingdom
544823,2023-02-24,22192,Blue Diner Wall Clock,18.96,4,14004.0,United Kingdom
544823,2023-02-24,22193,Red Diner Wall Clock,18.96,4,14004.0,United Kingdom
544823,2023-02-24,22488,Natural Slate Rectangle Chalkboard,11.94,12,14004.0,United Kingdom
544823,2023-02-24,22087,Paper Bunting White Lace,13.27,12,14004.0,United Kingdom
544823,2023-02-24,22771,Clear Drawer Knob Acrylic Edwardian,11.53,12,14004.0,United Kingdom
544823,2023-02-24,21672,White Spot Red Ceramic Drawer Knob,11.53,12,14004.0,United Kingdom
544823,2023-02-24,21669,Blue Stripe Ceramic Drawer Knob,11.53,12,14004.0,United Kingdom
544823,2023-02-24,21673,White Spot Blue Ceramic Drawer Knob,11.53,12,14004.0,United Kingdom
544823,2023-02-24,21670,Blue Spot Ceramic Drawer Knob,11.53,12,14004.0,United Kingdom
544823,2023-02-24,21668,Red Stripe Ceramic Drawer Knob,11.53,12,14004.0,United Kingdom
544823,2023-02-24,21671,Red Spot Ceramic Drawer Knob,11.53,12,14004.0,United Kingdom
544823,2023-02-24,22148,Easter Craft 4 Chicks,12.25,24,14004.0,United Kingdom
544823,2023-02-24,21791,Vintage Heads And Tails Card Game,11.34,72,14004.0,United Kingdom
544823,2023-02-24,22624,Ivory Kitchen Scales,18.96,2,14004.0,United Kingdom
544824,2023-02-24,22679,French Blue Metal Door Sign 4,11.53,10,17139.0,United Kingdom
544824,2023-02-24,22680,French Blue Metal Door Sign 5,11.53,10,17139.0,United Kingdom
544824,2023-02-24,22681,French Blue Metal Door Sign 6,11.53,10,17139.0,United Kingdom
544824,2023-02-24,82552,Washroom Metal Sign,11.74,12,17139.0,United Kingdom
544824,2023-02-24,82551,Laundry 15c Metal Sign,11.74,12,17139.0,United Kingdom
544824,2023-02-24,21181,Please One Person Metal Sign,12.4,12,17139.0,United Kingdom
544824,2023-02-24,21166,Cook With Wine Metal Sign,12.38,12,17139.0,United Kingdom
544824,2023-02-24,21907,I'm On Holiday Metal Sign,12.4,12,17139.0,United Kingdom
544824,2023-02-24,22720,Set Of 3 Cake Tins Pantry Design,15.32,3,17139.0,United Kingdom
544824,2023-02-24,22960,Jam Making Set With Jars,14.61,6,17139.0,United Kingdom
544824,2023-02-24,22980,Pantry Scrubbing Brush,11.94,12,17139.0,United Kingdom
544824,2023-02-24,22978,Pantry Rolling Pin,14.09,6,17139.0,United Kingdom
544824,2023-02-24,22993,Set Of 4 Pantry Jelly Moulds,11.53,12,17139.0,United Kingdom
544824,2023-02-24,22966,Gingerbread Man Cookie Cutter,11.53,12,17139.0,United Kingdom
544824,2023-02-24,22965,3 Traditional Biscuit Cutters Set,12.4,6,17139.0,United Kingdom
544824,2023-02-24,84380,Set Of 3 Butterfly Cookie Cutters,11.53,12,17139.0,United Kingdom
544824,2023-02-24,22666,Recipe Box Pantry Yellow Design,13.27,6,17139.0,United Kingdom
544824,2023-02-24,22840,Round Cake Tin Vintage Red,18.4,2,17139.0,United Kingdom
544824,2023-02-24,22842,Biscuit Tin Vintage Red,17.17,2,17139.0,United Kingdom
544824,2023-02-24,22626,Black Kitchen Scales,18.96,2,17139.0,United Kingdom
544824,2023-02-24,22624,Ivory Kitchen Scales,18.96,2,17139.0,United Kingdom
544824,2023-02-24,22852,Dog Bowl Vintage Cream,14.61,4,17139.0,United Kingdom
544824,2023-02-24,22844,Vintage Cream Dog Food Container,18.96,2,17139.0,United Kingdom
544824,2023-02-24,22845,Vintage Cream Cat Food Container,16.76,2,17139.0,United Kingdom
544824,2023-02-24,22853,Cat Bowl Vintage Cream,13.58,6,17139.0,United Kingdom
544824,2023-02-24,22173,Metal 4 Hook Hanger French Chateau,13.27,8,17139.0,United Kingdom
544824,2023-02-24,21257,Victorian Sewing Box Medium,18.4,2,17139.0,United Kingdom
544824,2023-02-24,21259,Victorian Sewing Box Small,16.35,2,17139.0,United Kingdom
544824,2023-02-24,22777,Glass Cloche Large,18.96,2,17139.0,United Kingdom
544824,2023-02-24,22778,Glass Cloche Small,14.3,4,17139.0,United Kingdom
544824,2023-02-24,22429,Enamel Measuring Jug Cream,14.61,4,17139.0,United Kingdom
544824,2023-02-24,22227,Hanging Heart Mirror Decoration,10.92,24,17139.0,United Kingdom
544824,2023-02-24,85123A,Cream Hanging Heart T-Light Holder,13.27,6,17139.0,United Kingdom
544824,2023-02-24,22794,Sweetheart Wire Magazine Rack,18.4,2,17139.0,United Kingdom
544824,2023-02-24,22699,Roses Regency Teacup And Saucer,13.27,6,17139.0,United Kingdom
544824,2023-02-24,22697,Green Regency Teacup And Saucer,13.27,6,17139.0,United Kingdom
544824,2023-02-24,22698,Pink Regency Teacup And Saucer,13.27,6,17139.0,United Kingdom
544824,2023-02-24,84879,Assorted Colour Bird Ornament,11.98,8,17139.0,United Kingdom
544824,2023-02-24,22488,Natural Slate Rectangle Chalkboard,11.94,12,17139.0,United Kingdom
544824,2023-02-24,22456,Natural Slate Chalkboard Large,15.32,3,17139.0,United Kingdom
544824,2023-02-24,21745,Gaolers Keys Decorative Garden,14.09,4,17139.0,United Kingdom
544824,2023-02-24,22926,Ivory Giant Garden Thermometer,16.35,2,17139.0,United Kingdom
544824,2023-02-24,22917,Herb Marker Rosemary,10.92,12,17139.0,United Kingdom
544824,2023-02-24,22916,Herb Marker Thyme,10.92,12,17139.0,United Kingdom
544824,2023-02-24,22918,Herb Marker Parsley,10.92,12,17139.0,United Kingdom
544824,2023-02-24,22920,Herb Marker Basil,10.92,12,17139.0,United Kingdom
544824,2023-02-24,22919,Herb Marker Mint,10.92,12,17139.0,United Kingdom
544824,2023-02-24,22921,Herb Marker Chives,10.92,12,17139.0,United Kingdom
544824,2023-02-24,22502,Picnic Basket Wicker Small,16.35,4,17139.0,United Kingdom
544824,2023-02-24,48185,Doormat Fairy Cake,17.17,10,17139.0,United Kingdom
544824,2023-02-24,48111,Doormat 3 Smiley Cats,17.17,10,17139.0,United Kingdom
544824,2023-02-24,22690,Doormat Home Sweet Home Blue,17.17,10,17139.0,United Kingdom
544824,2023-02-24,22692,Doormat Welcome To Our Home,17.17,10,17139.0,United Kingdom
544824,2023-02-24,22931,Baking Mould Heart White Chocolate,12.86,6,17139.0,United Kingdom
544824,2023-02-24,22932,Baking Mould Toffee Cup Chocolate,12.86,6,17139.0,United Kingdom
544824,2023-02-24,21137,Black Record Cover Frame,14.09,4,17139.0,United Kingdom
544824,2023-02-24,22041,"Record Frame 7"" Single Size",12.86,6,17139.0,United Kingdom
544824,2023-02-24,22751,Feltcraft Princess Olivia Doll,14.09,4,17139.0,United Kingdom
544824,2023-02-24,22271,Feltcraft Doll Rosie,13.27,6,17139.0,United Kingdom
544824,2023-02-24,22273,Feltcraft Doll Molly,13.27,6,17139.0,United Kingdom
544824,2023-02-24,21428,Set3 Book Box Green Gingham Flower,14.61,4,17139.0,United Kingdom
544824,2023-02-24,20749,Assorted Colour Mini Cases,18.4,2,17139.0,United Kingdom
544824,2023-02-24,21930,Jumbo Storage Bag Skulls,12.25,10,17139.0,United Kingdom
544824,2023-02-24,21936,Red Retrospot Picnic Bag,13.27,5,17139.0,United Kingdom
544824,2023-02-24,21452,Toadstool Money Box,13.27,6,17139.0,United Kingdom
544824,2023-02-24,20750,Red Retrospot Mini Cases,18.4,2,17139.0,United Kingdom
544824,2023-02-24,22661,Charlotte Bag Dolly Girl Design,11.12,10,17139.0,United Kingdom
544824,2023-02-24,22356,Charlotte Bag Pink Polkadot,11.12,10,17139.0,United Kingdom
544824,2023-02-24,20724,Red Retrospot Charlotte Bag,11.12,10,17139.0,United Kingdom
544824,2023-02-24,22139,Retrospot Tea Set Ceramic 11 Pc,15.32,3,17139.0,United Kingdom
544824,2023-02-24,21559,Strawberry Lunch Box With Cutlery,12.86,6,17139.0,United Kingdom
544824,2023-02-24,21439,Basket Of Toadstools,11.53,12,17139.0,United Kingdom
544824,2023-02-24,21558,Skull Lunch Box With Cutlery,12.86,6,17139.0,United Kingdom
544824,2023-02-24,22381,Toy Tidy Pink Polkadot,12.4,5,17139.0,United Kingdom
544824,2023-02-24,22630,Dolly Girl Lunch Box,12.25,12,17139.0,United Kingdom
544824,2023-02-24,22629,Spaceboy Lunch Box,12.25,12,17139.0,United Kingdom
544824,2023-02-24,22652,Travel Sewing Kit,11.94,10,17139.0,United Kingdom
544824,2023-02-24,22653,Button Box,12.25,10,17139.0,United Kingdom
544824,2023-02-24,22654,Deluxe Sewing Kit,16.35,3,17139.0,United Kingdom
544824,2023-02-24,22557,Plasters In Tin Vintage Paisley,11.94,12,17139.0,United Kingdom
544824,2023-02-24,22084,Paper Chain Kit Empire,13.27,6,17139.0,United Kingdom
544824,2023-02-24,22476,Empire Union Jack Tv Dinner Tray,15.32,3,17139.0,United Kingdom
544824,2023-02-24,21622,Vintage Union Jack Cushion Cover,15.32,4,17139.0,United Kingdom
544824,2023-02-24,22507,Memo Board Retrospot Design,15.32,4,17139.0,United Kingdom
544824,2023-02-24,21621,Vintage Union Jack Bunting,18.96,2,17139.0,United Kingdom
544824,2023-02-24,22785,Squarecushion Cover Pink Union Jack,17.17,2,17139.0,United Kingdom
544824,2023-02-24,22786,Cushion Cover Pink Union Jack,16.35,2,17139.0,United Kingdom
544824,2023-02-24,22352,Lunch Box With Cutlery Retrospot,12.86,6,17139.0,United Kingdom
544824,2023-02-24,21537,Red Retrospot Pudding Bowl,14.61,4,17139.0,United Kingdom
544824,2023-02-24,21535,Red Retrospot Small Milk Jug,12.86,6,17139.0,United Kingdom
544824,2023-02-24,21533,Retrospot Large Milk Jug,15.32,3,17139.0,United Kingdom
544824,2023-02-24,21216,Set 3 Retrospot Tea/Coffee/Sugar,15.32,4,17139.0,United Kingdom
544824,2023-02-24,20914,Set/5 Red Retrospot Lid Glass Bowls,13.27,6,17139.0,United Kingdom
544824,2023-02-24,22302,Coffee Mug Pears Design,12.86,6,17139.0,United Kingdom
544824,2023-02-24,22303,Coffee Mug Apples Design,12.86,6,17139.0,United Kingdom
544824,2023-02-24,22896,Peg Bag Apples Design,12.86,6,17139.0,United Kingdom
544824,2023-02-24,22939,Adult Apron Apple Delight,15.32,4,17139.0,United Kingdom
544824,2023-02-24,22898,Childrens Apron Apples Design,12.25,8,17139.0,United Kingdom
544824,2023-02-24,22895,Set Of 2 Tea Towels Apple And Pears,13.27,6,17139.0,United Kingdom
544824,2023-02-24,22300,Coffee Mug Dog + Ball Design,12.86,6,17139.0,United Kingdom
544824,2023-02-24,22328,Round Snack Boxes Set Of 4 Fruits,13.27,6,17139.0,United Kingdom
544824,2023-02-24,22377,Bottle Bag Retrospot,12.4,5,17139.0,United Kingdom
544824,2023-02-24,20685,Doormat Red Retrospot,17.17,10,17139.0,United Kingdom
544824,2023-02-24,22908,Pack Of 20 Napkins Red Apples,11.12,12,17139.0,United Kingdom
544824,2023-02-24,22301,Coffee Mug Cat + Bird Design,12.86,6,17139.0,United Kingdom
544824,2023-02-24,22682,French Blue Metal Door Sign 7,11.53,10,17139.0,United Kingdom
544824,2023-02-24,22683,French Blue Metal Door Sign 8,11.53,10,17139.0,United Kingdom
544824,2023-02-24,22684,French Blue Metal Door Sign 9,11.53,10,17139.0,United Kingdom
544824,2023-02-24,22685,French Blue Metal Door Sign 0,11.53,10,17139.0,United Kingdom
544824,2023-02-24,22686,French Blue Metal Door Sign No,11.53,10,17139.0,United Kingdom
544824,2023-02-24,22676,French Blue Metal Door Sign 1,11.53,10,17139.0,United Kingdom
544824,2023-02-24,22677,French Blue Metal Door Sign 2,11.53,10,17139.0,United Kingdom
544824,2023-02-24,22678,French Blue Metal Door Sign 3,11.53,10,17139.0,United Kingdom
544824,2023-02-24,22663,Jumbo Bag Dolly Girl Design,6.13,10,17139.0,United Kingdom
544824,2023-02-24,85099B,Jumbo Bag Red Retrospot,6.13,10,17139.0,United Kingdom
544824,2023-02-24,22386,Jumbo Bag Pink Polkadot,6.13,10,17139.0,United Kingdom
544824,2023-02-24,22384,Lunch Bag Pink Polkadot,5.97,10,17139.0,United Kingdom
544824,2023-02-24,20725,Lunch Bag Red Retrospot,5.97,10,17139.0,United Kingdom
544824,2023-02-24,22662,Lunch Bag Dolly Girl Design,5.97,10,17139.0,United Kingdom
544824,2023-02-24,20727,Lunch Bag Black Skull,5.97,10,17139.0,United Kingdom
544825,2023-02-24,22276,Wash Bag Vintage Rose Paisley,12.86,6,15606.0,United Kingdom
544825,2023-02-24,47594B,Scotties Design Washbag,12.25,6,15606.0,United Kingdom
544825,2023-02-24,47594A,Carousel Design Washbag,12.25,6,15606.0,United Kingdom
544825,2023-02-24,22374,Airline Bag Vintage Jet Set Red,14.3,12,15606.0,United Kingdom
544825,2023-02-24,22375,Airline Bag Vintage Jet Set Brown,14.3,12,15606.0,United Kingdom
544825,2023-02-24,20749,Assorted Colour Mini Cases,16.76,12,15606.0,United Kingdom
544825,2023-02-24,22779,Wooden Owls Light Garland,14.61,4,15606.0,United Kingdom
544825,2023-02-24,22780,Light Garland Butterfiles Pink,14.61,8,15606.0,United Kingdom
544825,2023-02-24,22371,Airline Bag Vintage Tokyo 78,14.09,12,15606.0,United Kingdom
544826,2023-02-24,22837,Hot Water Bottle Babushka,15.02,1,14513.0,United Kingdom
544826,2023-02-24,22195,Large Heart Measuring Spoons,11.94,1,14513.0,United Kingdom
544826,2023-02-24,84755,Colour Glass T-Light Holder Hanging,10.92,1,14513.0,United Kingdom
544826,2023-02-24,22189,Cream Heart Card Holder,14.3,1,14513.0,United Kingdom
544826,2023-02-24,22175,Pink Owl Soft Toy,13.27,1,14513.0,United Kingdom
544826,2023-02-24,71477,Coloured Glass Star T-Light Holder,13.58,1,14513.0,United Kingdom
544826,2023-02-24,22077,6 Ribbons Rustic Charm,11.94,1,14513.0,United Kingdom
544833,2023-02-24,22139,Retrospot Tea Set Ceramic 11 Pc,15.32,3,15974.0,United Kingdom
544833,2023-02-24,21982,Pack Of 12 Suki Tissues,10.55,24,15974.0,United Kingdom
544833,2023-02-24,21984,Pack Of 12 Pink Paisley Tissues,10.55,24,15974.0,United Kingdom
544833,2023-02-24,21983,Pack Of 12 Blue Paisley Tissues,10.55,24,15974.0,United Kingdom
544833,2023-02-24,85014B,Red Retrospot Umbrella,16.35,3,15974.0,United Kingdom
544833,2023-02-24,15056P,Edwardian Parasol Pink,16.35,3,15974.0,United Kingdom
544833,2023-02-24,15056N,Edwardian Parasol Natural,16.35,3,15974.0,United Kingdom
544833,2023-02-24,22699,Roses Regency Teacup And Saucer,13.27,6,15974.0,United Kingdom
544833,2023-02-24,22698,Pink Regency Teacup And Saucer,13.27,6,15974.0,United Kingdom
544833,2023-02-24,22697,Green Regency Teacup And Saucer,13.27,6,15974.0,United Kingdom
544833,2023-02-24,84988,Set Of 72 Pink Heart Paper Doilies,11.74,12,15974.0,United Kingdom
544833,2023-02-24,21974,Set Of 36 Paisley Flower Doilies,11.74,12,15974.0,United Kingdom
544833,2023-02-24,79000,Moroccan Tea Glass,11.12,12,15974.0,United Kingdom
544833,2023-02-24,22402,Magnets Pack Of 4 Vintage Collage,11.53,12,15974.0,United Kingdom
544833,2023-02-24,21135,Victorian Metal Postcard Spring,11.98,8,15974.0,United Kingdom
544833,2023-02-24,21166,Cook With Wine Metal Sign,12.38,12,15974.0,United Kingdom
544833,2023-02-24,22412,Metal Sign Neighbourhood Witch,12.4,12,15974.0,United Kingdom
544833,2023-02-24,82600,N0 Singing Metal Sign,12.4,12,15974.0,United Kingdom
544833,2023-02-24,84970S,Hanging Heart Zinc T-Light Holder,11.12,12,15974.0,United Kingdom
544833,2023-02-24,84970L,Single Heart Zinc T-Light Holder,11.22,12,15974.0,United Kingdom
544833,2023-02-24,22893,Mini Cake Stand T-Light Holder,10.68,24,15974.0,United Kingdom
544833,2023-02-24,71053,White Moroccan Metal Lantern,14.09,4,15974.0,United Kingdom
544833,2023-02-24,22969,Homemade Jam Scented Candles,11.74,60,15974.0,United Kingdom
544833,2023-02-24,22470,Heart Of Wicker Large,13.27,6,15974.0,United Kingdom
544833,2023-02-24,22469,Heart Of Wicker Small,11.94,12,15974.0,United Kingdom
544833,2023-02-24,22863,Soap Dish Brocante,13.27,8,15974.0,United Kingdom
544833,2023-02-24,22495,Set Of 2 Round Tins Camembert,13.27,6,15974.0,United Kingdom
544833,2023-02-24,22854,Cream Sweetheart Egg Holder,15.32,4,15974.0,United Kingdom
544833,2023-02-24,21745,Gaolers Keys Decorative Garden,14.09,4,15974.0,United Kingdom
544833,2023-02-24,22693,Grow A Flytrap Or Sunflower In Tin,11.53,24,15974.0,United Kingdom
544835,2023-02-24,22457,Natural Slate Heart Chalkboard,13.27,6,17830.0,United Kingdom
544835,2023-02-24,21164,Home Sweet Home Metal Sign,13.27,6,17830.0,United Kingdom
544835,2023-02-24,72807A,Set/3 Rose Candle In Jewelled Box,14.61,4,17830.0,United Kingdom
544835,2023-02-24,72807C,Set/3 Vanilla Scented Candle In Box,14.61,4,17830.0,United Kingdom
544835,2023-02-24,20934,Set/3 Pot Plant Candles,15.84,2,17830.0,United Kingdom
544835,2023-02-24,20932,Pink Pot Plant Candle,14.09,4,17830.0,United Kingdom
544835,2023-02-24,21523,Doormat Fancy Font Home Sweet Home,18.4,2,17830.0,United Kingdom
544835,2023-02-24,21621,Vintage Union Jack Bunting,18.96,2,17830.0,United Kingdom
544835,2023-02-24,20931,Blue Pot Plant Candle,14.09,4,17830.0,United Kingdom
544835,2023-02-24,22464,Hanging Metal Heart Lantern,11.94,12,17830.0,United Kingdom
544836,2023-02-24,85123A,Cream Hanging Heart T-Light Holder,13.27,24,17613.0,United Kingdom
544836,2023-02-24,21733,Red Hanging Heart T-Light Holder,13.27,12,17613.0,United Kingdom
544836,2023-02-24,71459,Hanging Jam Jar T-Light Holders,11.12,24,17613.0,United Kingdom
544836,2023-02-24,21626,Vintage Union Jack Pennant,12.25,12,17613.0,United Kingdom
544836,2023-02-24,21136,Painted Metal Pears Assorted,11.98,16,17613.0,United Kingdom
544836,2023-02-24,84879,Assorted Colour Bird Ornament,11.98,16,17613.0,United Kingdom
544836,2023-02-24,22168,Organiser Wood Antique White,18.96,2,17613.0,United Kingdom
544836,2023-02-24,20782,Camouflage Ear Muff Headphones,15.88,2,17613.0,United Kingdom
544836,2023-02-24,22245,Hook 1 Hanger Magic Garden,11.12,12,17613.0,United Kingdom
544836,2023-02-24,82613A,Metal Sign Cupcake Single Hook,11.53,8,17613.0,United Kingdom
544836,2023-02-24,17107D,Flower Fairy 5 Drawer Liners,12.86,6,17613.0,United Kingdom
544836,2023-02-24,22919,Herb Marker Mint,10.92,12,17613.0,United Kingdom
544836,2023-02-24,22918,Herb Marker Parsley,10.92,12,17613.0,United Kingdom
544836,2023-02-24,22921,Herb Marker Chives,10.92,12,17613.0,United Kingdom
544836,2023-02-24,84884A,Ant White Wire Heart Spiral,14.3,5,17613.0,United Kingdom
544837,2023-02-24,22168,Organiser Wood Antique White,18.96,1,15910.0,United Kingdom
544837,2023-02-24,82567,Airline Lounge Metal Sign,12.4,1,15910.0,United Kingdom
544837,2023-02-24,21181,Please One Person Metal Sign,12.4,1,15910.0,United Kingdom
544837,2023-02-24,22413,Metal Sign Take It Or Leave It,13.27,1,15910.0,United Kingdom
544837,2023-02-24,22115,Metal Sign Empire Tea,13.27,1,15910.0,United Kingdom
544837,2023-02-24,21992,Vintage Paisley Stationery Set,13.27,1,15910.0,United Kingdom
544837,2023-02-24,22699,Roses Regency Teacup And Saucer,13.27,1,15910.0,United Kingdom
544837,2023-02-24,22697,Green Regency Teacup And Saucer,13.27,1,15910.0,United Kingdom
544837,2023-02-24,22088,Paper Bunting Coloured Lace,13.27,1,15910.0,United Kingdom
544837,2023-02-24,22087,Paper Bunting White Lace,13.27,1,15910.0,United Kingdom
544837,2023-02-24,20897,Vintage Notebook Paris Days,13.27,2,15910.0,United Kingdom
544837,2023-02-24,22265,Easter Decoration Natural Chick,10.92,4,15910.0,United Kingdom
544837,2023-02-24,22341,Love Garland Painted Zinc,11.94,4,15910.0,United Kingdom
544837,2023-02-24,22961,Jam Making Set Printed,11.74,4,15910.0,United Kingdom
544837,2023-02-24,22960,Jam Making Set With Jars,14.61,1,15910.0,United Kingdom
544837,2023-02-24,22027,Tea Party Birthday Card,10.68,12,15910.0,United Kingdom
544837,2023-02-24,21519,Gin & Tonic Diet Greeting Card,10.68,12,15910.0,United Kingdom
544837,2023-02-24,22030,Swallows Greeting Card,10.68,12,15910.0,United Kingdom
544837,2023-02-24,22983,Card Billboard Font,10.68,12,15910.0,United Kingdom
544837,2023-02-24,22033,Botanical Rose Greeting Card,10.68,12,15910.0,United Kingdom
544837,2023-02-24,22029,Spaceboy Birthday Card,10.68,12,15910.0,United Kingdom
544837,2023-02-24,22713,Card I Love London,10.68,12,15910.0,United Kingdom
544837,2023-02-24,20914,Set/5 Red Retrospot Lid Glass Bowls,13.27,3,15910.0,United Kingdom
544837,2023-02-24,22998,Travel Card Wallet Keep Calm,10.68,4,15910.0,United Kingdom
544837,2023-02-24,22859,Easter Tin Bunny Bouquet,11.94,3,15910.0,United Kingdom
544837,2023-02-24,22860,Easter Tin Chicks Pink Daisy,11.94,1,15910.0,United Kingdom
544837,2023-02-24,22261,Felt Egg Cosy White Rabbit,11.12,3,15910.0,United Kingdom
544837,2023-02-24,20751,Funky Washing Up Gloves Assorted,12.4,1,15910.0,United Kingdom
544837,2023-02-24,21354,Toast Its - Best Mum,11.53,2,15910.0,United Kingdom
544837,2023-02-24,22964,3 Piece Spaceboy Cookie Cutter Set,12.4,2,15910.0,United Kingdom
544837,2023-02-24,22148,Easter Craft 4 Chicks,12.25,3,15910.0,United Kingdom
544837,2023-02-24,22309,Tea Cosy Red Stripe,12.86,1,15910.0,United Kingdom
544837,2023-02-24,22308,Tea Cosy Blue Stripe,12.86,1,15910.0,United Kingdom
544837,2023-02-24,85206A,Cream Felt Easter Egg Basket,11.94,4,15910.0,United Kingdom
544837,2023-02-24,22957,Set 3 Paper Vintage Chick Paper Egg,13.27,3,15910.0,United Kingdom
544838,2023-02-24,22915,Assorted Bottle Top Magnets,10.68,12,12565.0,Saudi Arabia
544838,2023-02-24,22363,Glass Jar Marmalade,13.27,6,12565.0,Saudi Arabia
544838,2023-02-24,22362,Glass Jar Peacock Bath Salts,13.27,6,12565.0,Saudi Arabia
544838,2023-02-24,22361,Glass Jar Daisy Fresh Cotton Wool,13.27,6,12565.0,Saudi Arabia
544838,2023-02-24,22553,Plasters In Tin Skulls,11.94,12,12565.0,Saudi Arabia
544838,2023-02-24,22555,Plasters In Tin Strongman,11.94,12,12565.0,Saudi Arabia
544838,2023-02-24,22556,Plasters In Tin Circus Parade,11.94,12,12565.0,Saudi Arabia
544838,2023-02-24,20781,Gold Ear Muff Headphones,15.88,2,12565.0,Saudi Arabia
544838,2023-02-24,22969,Homemade Jam Scented Candles,11.74,12,12565.0,Saudi Arabia
544839,2023-02-24,22720,Set Of 3 Cake Tins Pantry Design,15.32,3,14841.0,United Kingdom
544839,2023-02-24,22595,Gingham Heart Decoration,11.12,12,14841.0,United Kingdom
544839,2023-02-24,22469,Heart Of Wicker Small,11.94,24,14841.0,United Kingdom
544839,2023-02-24,21314,Small Glass Heart Trinket Pot,12.4,8,14841.0,United Kingdom
544839,2023-02-24,22241,Garland Wooden Happy Easter,11.53,12,14841.0,United Kingdom
544839,2023-02-24,22269,Egg Cup Natural Chicken,11.53,8,14841.0,United Kingdom
544839,2023-02-24,48185,Doormat Fairy Cake,18.4,2,14841.0,United Kingdom
544839,2023-02-24,22079,Ribbon Reel Hearts Design,11.94,10,14841.0,United Kingdom
544839,2023-02-24,22078,Ribbon Reel Lace Design,12.4,10,14841.0,United Kingdom
544839,2023-02-24,22411,Jumbo Shopper Vintage Red Paisley,12.25,10,14841.0,United Kingdom
544839,2023-02-24,85053,French Enamel Candleholder,12.4,12,14841.0,United Kingdom
544839,2023-02-24,22960,Jam Making Set With Jars,14.61,6,14841.0,United Kingdom
544839,2023-02-24,22915,Assorted Bottle Top Magnets,10.68,12,14841.0,United Kingdom
544839,2023-02-24,21624,Vintage Union Jack Doorstop,16.35,3,14841.0,United Kingdom
544839,2023-02-24,84978,Hanging Heart Jar T-Light Holder,11.53,12,14841.0,United Kingdom
544839,2023-02-24,21670,Blue Spot Ceramic Drawer Knob,11.53,12,14841.0,United Kingdom
544839,2023-02-24,21673,White Spot Blue Ceramic Drawer Knob,11.53,12,14841.0,United Kingdom
544839,2023-02-24,20975,12 Pencils Small Tube Red Retrospot,10.92,24,14841.0,United Kingdom
544839,2023-02-24,21668,Red Stripe Ceramic Drawer Knob,11.53,12,14841.0,United Kingdom
544839,2023-02-24,21671,Red Spot Ceramic Drawer Knob,11.53,12,14841.0,United Kingdom
544839,2023-02-24,21672,White Spot Red Ceramic Drawer Knob,11.53,12,14841.0,United Kingdom
544839,2023-02-24,22505,Memo Board Cottage Design,15.32,4,14841.0,United Kingdom
544839,2023-02-24,71459,Hanging Jam Jar T-Light Holders,11.12,24,14841.0,United Kingdom
544839,2023-02-24,84755,Colour Glass T-Light Holder Hanging,10.92,32,14841.0,United Kingdom
544839,2023-02-24,21928,Jumbo Bag Scandinavian Blue Paisley,6.13,10,14841.0,United Kingdom
544839,2023-02-24,21929,Jumbo Bag Pink Vintage Paisley,6.13,10,14841.0,United Kingdom
544839,2023-02-24,22386,Jumbo Bag Pink Polkadot,6.13,20,14841.0,United Kingdom
544839,2023-02-24,85099C,Jumbo Bag Baroque Black White,6.13,10,14841.0,United Kingdom
544839,2023-02-24,85099B,Jumbo Bag Red Retrospot,6.13,10,14841.0,United Kingdom
