TransactionNo,Date,ProductNo,ProductName,Price,Quantity,CustomerNo,Country
570217,2023-10-09,21124,Set/10 Blue Polkadot Party Candles,11.53,3,17323.0,United Kingdom
570217,2023-10-09,21121,Set/10 Red Polkadot Party Candles,11.53,3,17323.0,United Kingdom
570217,2023-10-09,21123,Set/10 Ivory Polkadot Party Candles,11.53,3,17323.0,United Kingdom
570217,2023-10-09,23307,Set Of 60 Pantry Design Cake Cases,10.81,6,17323.0,United Kingdom
570217,2023-10-09,23154,Set Of 4 Jam Jar Magnets,12.38,4,17323.0,United Kingdom
570217,2023-10-09,21680,Woodland Stickers,11.12,6,17323.0,United Kingdom
570217,2023-10-09,21678,Paisley Pattern Stickers,11.12,6,17323.0,United Kingdom
570217,2023-10-09,84559A,3d Sheet Of Dog Stickers,11.12,3,17323.0,United Kingdom
570217,2023-10-09,84559B,3d Sheet Of Cat Stickers,11.12,3,17323.0,United Kingdom
570217,2023-10-09,21833,Camouflage Led Torch,11.98,12,17323.0,United Kingdom
570217,2023-10-09,23196,Vintage Leaf Magnetic Notepad,11.74,3,17323.0,United Kingdom
570217,2023-10-09,23198,Pantry Magnetic Shopping List,11.74,3,17323.0,United Kingdom
570217,2023-10-09,23293,Set Of 12 Fairy Cake Baking Cases,11.1,8,17323.0,United Kingdom
570217,2023-10-09,21430,Set/3 Red Gingham Rose Storage Box,14.09,3,17323.0,United Kingdom
570217,2023-10-09,22505,Memo Board Cottage Design,15.32,2,17323.0,United Kingdom
570217,2023-10-09,22507,Memo Board Retrospot Design,15.32,1,17323.0,United Kingdom
570217,2023-10-09,16254,Transparent Acrylic Tape Dispenser,11.12,12,17323.0,United Kingdom
570217,2023-10-09,23203,Jumbo Bag Vintage Doily,6.19,4,17323.0,United Kingdom
570217,2023-10-09,23199,Jumbo Bag Apples,6.19,2,17323.0,United Kingdom
570217,2023-10-09,20712,Jumbo Bag Woodland Animals,6.19,5,17323.0,United Kingdom
570217,2023-10-09,23202,Jumbo Bag Vintage Leaf,6.19,2,17323.0,United Kingdom
570217,2023-10-09,85099B,Jumbo Bag Red Retrospot,6.19,2,17323.0,United Kingdom
570217,2023-10-09,22386,Jumbo Bag Pink Polkadot,6.19,1,17323.0,United Kingdom
570218,2023-10-09,21733,Red Hanging Heart T-Light Holder,13.27,12,16873.0,United Kingdom
570218,2023-10-09,22470,Heart Of Wicker Large,13.27,12,16873.0,United Kingdom
570218,2023-10-09,35961,Folkart Zinc Heart Christmas Dec,11.12,24,16873.0,United Kingdom
570218,2023-10-09,23126,Feltcraft Girl Amelie Kit,15.32,8,16873.0,United Kingdom
570218,2023-10-09,23127,Feltcraft Girl Nicole Kit,15.32,8,16873.0,United Kingdom
570218,2023-10-09,23128,Feltcraft Boy Jean-Paul Kit,15.32,8,16873.0,United Kingdom
570218,2023-10-09,85178,Victorian Sewing Kit,11.53,24,16873.0,United Kingdom
570218,2023-10-09,85176,Sewing Susan 21 Needle Set,11.12,24,16873.0,United Kingdom
570218,2023-10-09,22900,Set 2 Tea Towels I Love London,13.58,12,16873.0,United Kingdom
570218,2023-10-09,22902,Tote Bag I Love London,12.4,12,16873.0,United Kingdom
570218,2023-10-09,23309,Set Of 60 I Love London Cake Cases,10.81,24,16873.0,United Kingdom
570218,2023-10-09,23510,Mini Playing Cards Gymkhana,10.68,60,16873.0,United Kingdom
570218,2023-10-09,23508,Mini Playing Cards Dolly Girl,10.68,40,16873.0,United Kingdom
570218,2023-10-09,22666,Recipe Box Pantry Yellow Design,13.27,6,16873.0,United Kingdom
570218,2023-10-09,23198,Pantry Magnetic Shopping List,11.74,36,16873.0,United Kingdom
570218,2023-10-09,22720,Set Of 3 Cake Tins Pantry Design,15.32,3,16873.0,United Kingdom
570218,2023-10-09,22722,Set Of 6 Spice Tins Pantry Design,14.3,4,16873.0,United Kingdom
570218,2023-10-09,23113,Pantry Chopping Board,15.32,6,16873.0,United Kingdom
570218,2023-10-09,23165,Large Ceramic Top Storage Jar,11.94,12,16873.0,United Kingdom
570218,2023-10-09,22980,Pantry Scrubbing Brush,11.94,12,16873.0,United Kingdom
570218,2023-10-09,22978,Pantry Rolling Pin,14.09,6,16873.0,United Kingdom
570218,2023-10-09,22979,Pantry Washing Up Brush,11.74,12,16873.0,United Kingdom
570218,2023-10-09,23307,Set Of 60 Pantry Design Cake Cases,10.81,48,16873.0,United Kingdom
570218,2023-10-09,23293,Set Of 12 Fairy Cake Baking Cases,11.1,16,16873.0,United Kingdom
570218,2023-10-09,23359,Set Of 12 T-Lights Vintage Doily,12.25,24,16873.0,United Kingdom
570218,2023-10-09,23360,Set 8 Candles Vintage Doily,12.25,12,16873.0,United Kingdom
570218,2023-10-09,22845,Vintage Cream Cat Food Container,16.76,4,16873.0,United Kingdom
570218,2023-10-09,22853,Cat Bowl Vintage Cream,13.58,6,16873.0,United Kingdom
570218,2023-10-09,22852,Dog Bowl Vintage Cream,14.61,4,16873.0,United Kingdom
570218,2023-10-09,22844,Vintage Cream Dog Food Container,18.96,4,16873.0,United Kingdom
570218,2023-10-09,23534,Wall Art Stop For Tea,16.35,3,16873.0,United Kingdom
570218,2023-10-09,23535,Wall Art Bicycle Safety,16.35,4,16873.0,United Kingdom
570218,2023-10-09,23521,Wall Art Cat And Bird,13.21,6,16873.0,United Kingdom
570218,2023-10-09,23522,Wall Art Dog And Ball,13.21,6,16873.0,United Kingdom
570218,2023-10-09,23247,Biscuit Tin 50'S Christmas,13.21,6,16873.0,United Kingdom
570218,2023-10-09,22086,Paper Chain Kit 50'S Christmas,13.27,12,16873.0,United Kingdom
570218,2023-10-09,23311,Vintage Christmas Stocking,12.86,12,16873.0,United Kingdom
570218,2023-10-09,22734,Set Of 6 Ribbons Vintage Christmas,13.21,12,16873.0,United Kingdom
570218,2023-10-09,22909,Set Of 20 Vintage Christmas Napkins,11.12,12,16873.0,United Kingdom
570218,2023-10-09,22952,60 Cake Cases Vintage Christmas,10.81,48,16873.0,United Kingdom
570218,2023-10-09,22950,36 Doilies Vintage Christmas,11.74,72,16873.0,United Kingdom
570218,2023-10-09,23340,Vintage Christmas Cake Frill,11.94,24,16873.0,United Kingdom
570218,2023-10-09,23234,Biscuit Tin Vintage Christmas,13.21,6,16873.0,United Kingdom
570218,2023-10-09,22766,Photo Frame Cornice,13.27,8,16873.0,United Kingdom
570218,2023-10-09,23203,Jumbo Bag Vintage Doily,6.19,20,16873.0,United Kingdom
570218,2023-10-09,23344,Jumbo Bag 50'S Christmas,6.19,10,16873.0,United Kingdom
570218,2023-10-09,23343,Jumbo Bag Vintage Christmas,6.19,10,16873.0,United Kingdom
570218,2023-10-09,23209,Lunch Bag Vintage Doily,5.97,20,16873.0,United Kingdom
570219,2023-10-09,23283,Doormat Vintage Leaf,18.71,1,16809.0,United Kingdom
570219,2023-10-09,23308,Set Of 60 Vintage Leaf Cake Cases,10.81,4,16809.0,United Kingdom
570219,2023-10-09,23307,Set Of 60 Pantry Design Cake Cases,10.81,4,16809.0,United Kingdom
570219,2023-10-09,21977,Pack Of 60 Pink Paisley Cake Cases,10.81,2,16809.0,United Kingdom
570219,2023-10-09,84536A,English Rose Notebook A7 Size,10.68,2,16809.0,United Kingdom
570219,2023-10-09,17003,Brocade Ring Purse,10.65,3,16809.0,United Kingdom
570219,2023-10-09,22411,Jumbo Shopper Vintage Red Paisley,12.38,4,16809.0,United Kingdom
570219,2023-10-09,23199,Jumbo Bag Apples,6.19,5,16809.0,United Kingdom
570219,2023-10-09,23200,Jumbo Bag Pears,6.19,5,16809.0,United Kingdom
570219,2023-10-09,23203,Jumbo Bag Vintage Doily,6.19,5,16809.0,United Kingdom
570219,2023-10-09,85099B,Jumbo Bag Red Retrospot,6.19,6,16809.0,United Kingdom
570219,2023-10-09,23202,Jumbo Bag Vintage Leaf,6.19,6,16809.0,United Kingdom
570219,2023-10-09,22386,Jumbo Bag Pink Polkadot,6.19,4,16809.0,United Kingdom
570219,2023-10-09,85099B,Jumbo Bag Red Retrospot,6.19,4,16809.0,United Kingdom
570219,2023-10-09,23206,Lunch Bag Apple Design,5.97,2,16809.0,United Kingdom
570219,2023-10-09,23208,Lunch Bag Vintage Leaf Design,5.97,6,16809.0,United Kingdom
570219,2023-10-09,22383,Lunch Bag Suki Design,5.97,6,16809.0,United Kingdom
570219,2023-10-09,23206,Lunch Bag Apple Design,5.97,4,16809.0,United Kingdom
570219,2023-10-09,23209,Lunch Bag Vintage Doily,5.97,4,16809.0,United Kingdom
570219,2023-10-09,22382,Lunch Bag Spaceboy Design,5.97,4,16809.0,United Kingdom
570219,2023-10-09,20727,Lunch Bag Black Skull,5.97,6,16809.0,United Kingdom
570220,2023-10-09,84029E,Red Woolly Hottie White Heart,14.61,4,15612.0,United Kingdom
570220,2023-10-09,23356,Love Hot Water Bottle,16.35,3,15612.0,United Kingdom
570220,2023-10-09,22969,Homemade Jam Scented Candles,11.74,24,15612.0,United Kingdom
570222,2023-10-09,22131,Food Container Set 3 Love Heart,12.25,10,13113.0,United Kingdom
570222,2023-10-09,23263,Set Of 3 Wooden Heart Decorations,11.53,2,13113.0,United Kingdom
570222,2023-10-09,23275,Set Of 3 Hanging Owls Ollie Beak,11.53,12,13113.0,United Kingdom
570222,2023-10-09,22196,Small Heart Measuring Spoons,11.12,30,13113.0,United Kingdom
570222,2023-10-09,84988,Set Of 72 Pink Heart Paper Doilies,11.74,10,13113.0,United Kingdom
570222,2023-10-09,22501,Picnic Basket Wicker Large,18.96,29,13113.0,United Kingdom
570222,2023-10-09,21524,Doormat Spotty Home Sweet Home,17.51,10,13113.0,United Kingdom
570222,2023-10-09,21430,Set/3 Red Gingham Rose Storage Box,13.72,24,13113.0,United Kingdom
570223,2023-10-09,21626,Vintage Union Jack Pennant,12.25,3,15787.0,United Kingdom
570223,2023-10-09,22722,Set Of 6 Spice Tins Pantry Design,14.3,3,15787.0,United Kingdom
570223,2023-10-09,22952,60 Cake Cases Vintage Christmas,10.81,3,15787.0,United Kingdom
570223,2023-10-09,23243,Set Of Tea Coffee Sugar Tins Pantry,15.32,1,15787.0,United Kingdom
570223,2023-10-09,23192,Bundle Of 3 Alphabet Exercise Books,11.94,1,15787.0,United Kingdom
570223,2023-10-09,21908,Chocolate This Way Metal Sign,12.4,3,15787.0,United Kingdom
570223,2023-10-09,23306,Set Of 36 Pantry Paper Doilies,11.74,3,15787.0,United Kingdom
570223,2023-10-09,23295,Set Of 12 Mini Loaf Baking Cases,11.1,3,15787.0,United Kingdom
570223,2023-10-09,23293,Set Of 12 Fairy Cake Baking Cases,11.1,3,15787.0,United Kingdom
570223,2023-10-09,20836,French Paisley Cushion Cover,11.12,5,15787.0,United Kingdom
570223,2023-10-09,21624,Vintage Union Jack Doorstop,16.35,3,15787.0,United Kingdom
570223,2023-10-09,21587,Cosy Hour Giant Tube Matches,12.86,3,15787.0,United Kingdom
570223,2023-10-09,22604,Set Of 4 Napkin Charms Cutlery,12.86,5,15787.0,United Kingdom
570223,2023-10-09,22571,Rocking Horse Red Christmas,11.12,3,15787.0,United Kingdom
570223,2023-10-09,22572,Rocking Horse Green Christmas,11.12,3,15787.0,United Kingdom
570223,2023-10-09,22576,Swallow Wooden Christmas Decoration,11.12,3,15787.0,United Kingdom
570223,2023-10-09,22598,Christmas Musical Zinc Tree,10.55,4,15787.0,United Kingdom
570223,2023-10-09,22599,Christmas Musical Zinc Star,10.55,4,15787.0,United Kingdom
570223,2023-10-09,23263,Set Of 3 Wooden Heart Decorations,11.53,4,15787.0,United Kingdom
570223,2023-10-09,22603,Christmas Retrospot Tree Wood,11.12,4,15787.0,United Kingdom
570223,2023-10-09,22602,Retrospot Wooden Heart Decoration,11.12,4,15787.0,United Kingdom
570223,2023-10-09,22600,Christmas Retrospot Star Wood,11.12,4,15787.0,United Kingdom
570223,2023-10-09,21803,Christmas Tree Star Decoration,10.68,4,15787.0,United Kingdom
570223,2023-10-09,21802,Christmas Tree Heart Decoration,10.68,4,15787.0,United Kingdom
570223,2023-10-09,21807,White Christmas Star Decoration,10.68,4,15787.0,United Kingdom
570223,2023-10-09,22689,Doormat Merry Christmas Red,18.71,2,15787.0,United Kingdom
570223,2023-10-09,84944,Set Of 6 Kashmir Folkart Baubles,11.94,2,15787.0,United Kingdom
570223,2023-10-09,23328,Set 6 School Milk Bottles In Crate,14.09,2,15787.0,United Kingdom
570223,2023-10-09,22557,Plasters In Tin Vintage Paisley,11.94,1,15787.0,United Kingdom
570223,2023-10-09,22551,Plasters In Tin Spaceboy,11.94,1,15787.0,United Kingdom
570223,2023-10-09,22556,Plasters In Tin Circus Parade,11.94,1,15787.0,United Kingdom
570223,2023-10-09,22555,Plasters In Tin Strongman,11.94,1,15787.0,United Kingdom
570223,2023-10-09,22554,Plasters In Tin Woodland Animals,11.94,1,15787.0,United Kingdom
570223,2023-10-09,21908,Chocolate This Way Metal Sign,12.4,1,15787.0,United Kingdom
570223,2023-10-09,22488,Natural Slate Rectangle Chalkboard,11.94,3,15787.0,United Kingdom
570223,2023-10-09,21908,Chocolate This Way Metal Sign,12.4,1,15787.0,United Kingdom
570223,2023-10-09,22866,Hand Warmer Scotty Dog Design,12.4,1,15787.0,United Kingdom
570223,2023-10-09,22867,Hand Warmer Bird Design,12.4,2,15787.0,United Kingdom
570223,2023-10-09,22818,Card Christmas Village,10.68,24,15787.0,United Kingdom
570223,2023-10-09,22816,Card Motorbike Santa,10.68,24,15787.0,United Kingdom
570223,2023-10-09,22759,Set Of 3 Notebooks In Parcel,11.94,3,15787.0,United Kingdom
570223,2023-10-09,20975,12 Pencils Small Tube Red Retrospot,10.92,3,15787.0,United Kingdom
570223,2023-10-09,20983,12 Pencils Tall Tube Red Retrospot,11.12,3,15787.0,United Kingdom
570223,2023-10-09,21619,4 Vanilla Botanical Candles,14.09,2,15787.0,United Kingdom
570223,2023-10-09,21620,Set Of 4 Rose Botanical Candles,14.09,2,15787.0,United Kingdom
570223,2023-10-09,20760,Garden Path Pocket Book,11.12,3,15787.0,United Kingdom
570223,2023-10-09,20758,Abstract Circles Pocket Book,11.12,3,15787.0,United Kingdom
570223,2023-10-09,20759,Chrysanthemum Pocket Book,11.12,3,15787.0,United Kingdom
570223,2023-10-09,20755,Blue Paisley Pocket Book,11.12,3,15787.0,United Kingdom
570223,2023-10-09,20756,Green Fern Pocket Book,11.12,3,15787.0,United Kingdom
570223,2023-10-09,22495,Set Of 2 Round Tins Camembert,13.27,1,15787.0,United Kingdom
570223,2023-10-09,22496,Set Of 2 Round Tins Dutch Cheese,13.27,1,15787.0,United Kingdom
570223,2023-10-09,22893,Mini Cake Stand T-Light Holder,10.68,12,15787.0,United Kingdom
570223,2023-10-09,23178,Jam Clock Magnet,13.21,6,15787.0,United Kingdom
570223,2023-10-09,23243,Set Of Tea Coffee Sugar Tins Pantry,15.32,1,15787.0,United Kingdom
570223,2023-10-09,20984,12 Pencils Tall Tube Posy,10.55,5,15787.0,United Kingdom
570223,2023-10-09,20973,12 Pencil Small Tube Woodland,10.92,4,15787.0,United Kingdom
570223,2023-10-09,23091,Zinc Herb Garden Container,16.66,3,15787.0,United Kingdom
570223,2023-10-09,23349,Roll Wrap Vintage Christmas,11.53,5,15787.0,United Kingdom
570223,2023-10-09,21683,Medium Medina Stamped Metal Bowl,13.27,3,15787.0,United Kingdom
570223,2023-10-09,23290,Spaceboy Childrens Bowl,11.53,3,15787.0,United Kingdom
570223,2023-10-09,23292,Spaceboy Childrens Cup,11.53,3,15787.0,United Kingdom
570223,2023-10-09,84946,Antique Silver T-Light Glass,11.53,6,15787.0,United Kingdom
570223,2023-10-09,23291,Dolly Girl Childrens Cup,11.53,3,15787.0,United Kingdom
570223,2023-10-09,23289,Dolly Girl Childrens Bowl,11.53,3,15787.0,United Kingdom
570223,2023-10-09,84947,Antique Silver Tea Glass Engraved,11.53,6,15787.0,United Kingdom
570223,2023-10-09,23318,Box Of 6 Mini Vintage Crackers,12.8,3,15787.0,United Kingdom
570223,2023-10-09,21269,Antique Cream Cutlery Shelf,18.96,2,15787.0,United Kingdom
570223,2023-10-09,22496,Set Of 2 Round Tins Dutch Cheese,13.27,1,15787.0,United Kingdom
570223,2023-10-09,22495,Set Of 2 Round Tins Camembert,13.27,1,15787.0,United Kingdom
570223,2023-10-09,23300,Gardeners Kneeling Pad Cup Of Tea,11.94,2,15787.0,United Kingdom
570223,2023-10-09,23302,Kneeling Mat Housework Design,11.94,2,15787.0,United Kingdom
570223,2023-10-09,22170,Picture Frame Wood Triple Portrait,17.17,2,15787.0,United Kingdom
570223,2023-10-09,22969,Homemade Jam Scented Candles,11.74,12,15787.0,United Kingdom
570223,2023-10-09,48188,Doormat Welcome Puppies,18.71,1,15787.0,United Kingdom
570223,2023-10-09,22692,Doormat Welcome To Our Home,18.71,1,15787.0,United Kingdom
570223,2023-10-09,22667,Recipe Box Retrospot,13.27,2,15787.0,United Kingdom
570223,2023-10-09,22666,Recipe Box Pantry Yellow Design,13.27,2,15787.0,United Kingdom
570223,2023-10-09,23209,Lunch Bag Vintage Doily,5.97,1,15787.0,United Kingdom
570223,2023-10-09,23209,Lunch Bag Vintage Doily,5.97,2,15787.0,United Kingdom
570223,2023-10-09,22611,Vintage Union Jack Shopping Bag,7.66,3,15787.0,United Kingdom
570224,2023-10-09,22730,Alarm Clock Bakelike Ivory,14.09,2,16931.0,United Kingdom
570224,2023-10-09,22297,Heart Ivory Trellis Small,11.53,6,16931.0,United Kingdom
570224,2023-10-09,22295,Heart Filigree Dove Large,11.94,3,16931.0,United Kingdom
570224,2023-10-09,22296,Heart Ivory Trellis Large,11.94,6,16931.0,United Kingdom
570224,2023-10-09,22142,Christmas Craft White Fairy,11.74,3,16931.0,United Kingdom
570224,2023-10-09,22144,Christmas Craft Little Friends,12.4,3,16931.0,United Kingdom
570224,2023-10-09,22141,Christmas Craft Tree Top Angel,12.4,3,16931.0,United Kingdom
570224,2023-10-09,16235,Recycled Pencil With Rabbit Eraser,10.47,18,16931.0,United Kingdom
570224,2023-10-09,21901,Key Fob Back Door,10.92,7,16931.0,United Kingdom
570224,2023-10-09,21900,Key Fob Shed,10.92,6,16931.0,United Kingdom
570224,2023-10-09,21899,Garage Key Fob,10.92,7,16931.0,United Kingdom
570224,2023-10-09,20992,Jazz Hearts Purse Notebook,10.65,6,16931.0,United Kingdom
570224,2023-10-09,22211,Wood Stamp Set Flowers,11.1,6,16931.0,United Kingdom
570224,2023-10-09,22208,Wood Stamp Set Thank You,11.1,6,16931.0,United Kingdom
570224,2023-10-09,22306,Silver Mug Bone China Tree Of Life,11.34,6,16931.0,United Kingdom
570224,2023-10-09,22307,Gold Mug Bone China Tree Of Life,11.34,6,16931.0,United Kingdom
570224,2023-10-09,22867,Hand Warmer Bird Design,12.4,3,16931.0,United Kingdom
570224,2023-10-09,85123A,Cream Hanging Heart T-Light Holder,13.27,6,16931.0,United Kingdom
570224,2023-10-09,22123,Ping Microwave Apron,12.25,3,16931.0,United Kingdom
570224,2023-10-09,22625,Red Kitchen Scales,18.96,1,16931.0,United Kingdom
570224,2023-10-09,22633,Hand Warmer Union Jack,12.4,6,16931.0,United Kingdom
570224,2023-10-09,23395,Belle Jardiniere Cushion Cover,14.09,3,16931.0,United Kingdom
570224,2023-10-09,20719,Woodland Charlotte Bag,11.12,3,16931.0,United Kingdom
570224,2023-10-09,22191,Ivory Diner Wall Clock,18.96,1,16931.0,United Kingdom
570224,2023-10-09,23526,Wall Art Dog Licence,16.35,1,16931.0,United Kingdom
570224,2023-10-09,23535,Wall Art Bicycle Safety,16.35,3,16931.0,United Kingdom
570224,2023-10-09,20726,Lunch Bag Woodland,5.97,3,16931.0,United Kingdom
570224,2023-10-09,23208,Lunch Bag Vintage Leaf Design,5.97,1,16931.0,United Kingdom
570225,2023-10-09,16169E,Wrap 50'S Christmas,10.68,25,16595.0,United Kingdom
570225,2023-10-09,23232,Wrap Vintage Leaf Design,10.68,25,16595.0,United Kingdom
570225,2023-10-09,21591,Cosy Hour Cigar Box Matches,11.53,3,16595.0,United Kingdom
570225,2023-10-09,23296,Set Of 6 Tea Time Baking Cases,11.53,4,16595.0,United Kingdom
570225,2023-10-09,79190B,Retro Plastic Polka Tray,10.68,1,16595.0,United Kingdom
570225,2023-10-09,21084,Set/6 Collage Paper Cups,10.44,3,16595.0,United Kingdom
570225,2023-10-09,22402,Magnets Pack Of 4 Vintage Collage,10.65,1,16595.0,United Kingdom
570225,2023-10-09,23308,Set Of 60 Vintage Leaf Cake Cases,10.81,6,16595.0,United Kingdom
570225,2023-10-09,23294,Set Of 6 Snack Loaf Baking Cases,11.1,4,16595.0,United Kingdom
570225,2023-10-09,23293,Set Of 12 Fairy Cake Baking Cases,11.1,4,16595.0,United Kingdom
570225,2023-10-09,23295,Set Of 12 Mini Loaf Baking Cases,11.1,4,16595.0,United Kingdom
570225,2023-10-09,22398,Magnets Pack Of 4 Swallows,10.65,7,16595.0,United Kingdom
570225,2023-10-09,22396,Magnets Pack Of 4 Retro Photo,10.65,3,16595.0,United Kingdom
570225,2023-10-09,22400,Magnets Pack Of 4 Home Sweet Home,10.65,1,16595.0,United Kingdom
570225,2023-10-09,22402,Magnets Pack Of 4 Vintage Collage,10.65,3,16595.0,United Kingdom
570225,2023-10-09,21158,Moody Girl Door Hanger,10.65,2,16595.0,United Kingdom
570225,2023-10-09,21163,Do Not Touch My Stuff Door Hanger,10.65,2,16595.0,United Kingdom
570225,2023-10-09,23367,Set 12 Colour Pencils Spaceboy,10.92,3,16595.0,United Kingdom
570225,2023-10-09,23366,Set 12 Colouring Pencils Doily,10.92,3,16595.0,United Kingdom
570225,2023-10-09,21587,Cosy Hour Giant Tube Matches,12.86,2,16595.0,United Kingdom
570225,2023-10-09,22955,36 Foil Star Cake Cases,12.4,2,16595.0,United Kingdom
570225,2023-10-09,22418,10 Colour Spaceboy Pen,11.12,12,16595.0,United Kingdom
570225,2023-10-09,85123A,Cream Hanging Heart T-Light Holder,13.27,2,16595.0,United Kingdom
570225,2023-10-09,21733,Red Hanging Heart T-Light Holder,13.27,2,16595.0,United Kingdom
570225,2023-10-09,22222,Cake Plate Lovebird White,15.32,1,16595.0,United Kingdom
570225,2023-10-09,22966,Gingerbread Man Cookie Cutter,11.53,2,16595.0,United Kingdom
570225,2023-10-09,85231B,Cinammon Set Of 9 T-Lights,11.12,3,16595.0,United Kingdom
570225,2023-10-09,22693,Grow A Flytrap Or Sunflower In Tin,11.53,24,16595.0,United Kingdom
570225,2023-10-09,21833,Camouflage Led Torch,11.98,6,16595.0,United Kingdom
570225,2023-10-09,23081,Green Metal Box Army Supplies,18.71,1,16595.0,United Kingdom
570225,2023-10-09,22809,Set Of 6 T-Lights Santa,13.27,2,16595.0,United Kingdom
570225,2023-10-09,22867,Hand Warmer Bird Design,12.4,3,16595.0,United Kingdom
570225,2023-10-09,22633,Hand Warmer Union Jack,12.4,3,16595.0,United Kingdom
570225,2023-10-09,23439,Hand Warmer Red Love Heart,12.4,3,16595.0,United Kingdom
570225,2023-10-09,22632,Hand Warmer Red Retrospot,12.4,3,16595.0,United Kingdom
570225,2023-10-09,22866,Hand Warmer Scotty Dog Design,12.4,3,16595.0,United Kingdom
570225,2023-10-09,22834,Hand Warmer Babushka Design,12.4,3,16595.0,United Kingdom
570225,2023-10-09,22865,Hand Warmer Owl Design,12.4,3,16595.0,United Kingdom
570225,2023-10-09,21232,Strawberry Ceramic Trinket Pot,11.53,2,16595.0,United Kingdom
570225,2023-10-09,16216,Letter Shape Pencil Sharpener,10.31,15,16595.0,United Kingdom
570225,2023-10-09,16237,Sleeping Cat Erasers,10.47,7,16595.0,United Kingdom
570225,2023-10-09,16238,Party Time Pencil Erasers,10.47,5,16595.0,United Kingdom
570225,2023-10-09,16236,Kitty Pencil Erasers,10.47,5,16595.0,United Kingdom
570225,2023-10-09,21803,Christmas Tree Star Decoration,10.68,4,16595.0,United Kingdom
570225,2023-10-09,23157,Set Of 6 Nativity Magnets,12.38,4,16595.0,United Kingdom
570225,2023-10-09,35933,Pink Stocking Christmas Decoration,10.64,2,16595.0,United Kingdom
570225,2023-10-09,23247,Biscuit Tin 50'S Christmas,13.21,1,16595.0,United Kingdom
570225,2023-10-09,22952,60 Cake Cases Vintage Christmas,10.81,3,16595.0,United Kingdom
570225,2023-10-09,23353,6 Gift Tags Vintage Christmas,11.1,4,16595.0,United Kingdom
570225,2023-10-09,23354,6 Gift Tags 50'S Christmas,11.1,7,16595.0,United Kingdom
570225,2023-10-09,22952,60 Cake Cases Vintage Christmas,10.81,1,16595.0,United Kingdom
570225,2023-10-09,22328,Round Snack Boxes Set Of 4 Fruits,13.27,1,16595.0,United Kingdom
570225,2023-10-09,21090,Set/6 Collage Paper Plates,10.65,3,16595.0,United Kingdom
570225,2023-10-09,22210,Wood Stamp Set Best Wishes,11.1,2,16595.0,United Kingdom
570225,2023-10-09,22211,Wood Stamp Set Flowers,11.1,2,16595.0,United Kingdom
570225,2023-10-09,22694,Wicker Star,12.4,1,16595.0,United Kingdom
570225,2023-10-09,22473,Tv Dinner Tray Vintage Paisley,15.32,1,16595.0,United Kingdom
570225,2023-10-09,22472,Tv Dinner Tray Dolly Girl,15.32,1,16595.0,United Kingdom
570225,2023-10-09,21985,Pack Of 12 Hearts Design Tissues,10.65,12,16595.0,United Kingdom
570225,2023-10-09,22139,Retrospot Tea Set Ceramic 11 Pc,15.32,1,16595.0,United Kingdom
570225,2023-10-09,84030E,English Rose Hot Water Bottle,14.61,2,16595.0,United Kingdom
570225,2023-10-09,22110,Bird House Hot Water Bottle,12.86,2,16595.0,United Kingdom
570225,2023-10-09,22560,Traditional Modelling Clay,11.53,1,16595.0,United Kingdom
570225,2023-10-09,22961,Jam Making Set Printed,11.74,6,16595.0,United Kingdom
570225,2023-10-09,22748,Poppy's Playhouse Kitchen,12.4,1,16595.0,United Kingdom
570225,2023-10-09,22747,Poppy's Playhouse Bathroom,12.4,1,16595.0,United Kingdom
570225,2023-10-09,22745,Poppy's Playhouse Bedroom,12.4,1,16595.0,United Kingdom
570225,2023-10-09,22751,Feltcraft Princess Olivia Doll,14.09,1,16595.0,United Kingdom
570225,2023-10-09,22746,Poppy's Playhouse Livingroom,12.4,1,16595.0,United Kingdom
570225,2023-10-09,22750,Feltcraft Princess Lola Doll,14.09,2,16595.0,United Kingdom
570225,2023-10-09,22749,Feltcraft Princess Charlotte Doll,14.09,1,16595.0,United Kingdom
570225,2023-10-09,22371,Airline Bag Vintage Tokyo 78,14.61,1,16595.0,United Kingdom
570225,2023-10-09,23378,Pack Of 12 50'S Christmas Tissues,10.65,12,16595.0,United Kingdom
570225,2023-10-09,82616C,Midnight Glamour Scarf Knitting Kit,11.53,2,16595.0,United Kingdom
570225,2023-10-09,21034,Rex Cash+Carry Jumbo Shopper,11.22,6,16595.0,United Kingdom
570225,2023-10-09,20728,Lunch Bag Cars Blue,5.97,2,16595.0,United Kingdom
570225,2023-10-09,20727,Lunch Bag Black Skull,5.97,2,16595.0,United Kingdom
570225,2023-10-09,23208,Lunch Bag Vintage Leaf Design,5.97,2,16595.0,United Kingdom
570225,2023-10-09,23207,Lunch Bag Alphabet Design,5.97,2,16595.0,United Kingdom
570225,2023-10-09,23437,50'S Christmas Gift Bag Large,5.77,3,16595.0,United Kingdom
570225,2023-10-09,23436,Vintage Christmas Gift Bag Large,5.77,2,16595.0,United Kingdom
570225,2023-10-09,23374,Red Spot Paper Gift Bag,5.55,5,16595.0,United Kingdom
570225,2023-10-09,23375,50'S Christmas Paper Gift Bag,5.55,4,16595.0,United Kingdom
570225,2023-10-09,23373,Vintage Christmas Paper Gift Bag,5.55,4,16595.0,United Kingdom
570226,2023-10-09,46000S,Polyester Filler Pad 40x40cm,11.74,3,16931.0,United Kingdom
570227,2023-10-09,23163,Regency Sugar Tongs,12.8,8,13260.0,United Kingdom
570227,2023-10-09,23245,Set Of 3 Regency Cake Tins,15.32,4,13260.0,United Kingdom
570227,2023-10-09,23174,Regency Sugar Bowl Green,14.5,4,13260.0,United Kingdom
570227,2023-10-09,23175,Regency Milk Jug Pink,13.58,8,13260.0,United Kingdom
570227,2023-10-09,23170,Regency Tea Plate Roses,11.74,48,13260.0,United Kingdom
570227,2023-10-09,22697,Green Regency Teacup And Saucer,12.86,42,13260.0,United Kingdom
570228,2023-10-09,22963,Jam Jar With Green Lid,11.12,2,15821.0,United Kingdom
570228,2023-10-09,22962,Jam Jar With Pink Lid,11.12,2,15821.0,United Kingdom
570228,2023-10-09,23396,Le Jardin Botanique Cushion Cover,14.09,4,15821.0,United Kingdom
570228,2023-10-09,23470,Card Holder Love Bird Large,16.66,1,15821.0,United Kingdom
570228,2023-10-09,23541,Wall Art Classic Puddings,18.71,2,15821.0,United Kingdom
570228,2023-10-09,23534,Wall Art Stop For Tea,16.35,2,15821.0,United Kingdom
570228,2023-10-09,23240,Set Of 4 Knick Knack Tins Doily,14.5,2,15821.0,United Kingdom
570228,2023-10-09,23236,Storage Tin Vintage Doily,13.21,2,15821.0,United Kingdom
570228,2023-10-09,22990,Cotton Apron Pantry Design,15.32,2,15821.0,United Kingdom
