TransactionNo,Date,ProductNo,ProductName,Price,Quantity,CustomerNo,Country
550123,2023-04-14,21441,Blue Birdhouse Decoration,11.12,4,17123.0,United Kingdom
550123,2023-04-14,85202,Hanging Wood And Felt Heart,10.68,7,17123.0,United Kingdom
550123,2023-04-14,85203,Hanging Wood And Felt Butterfly,10.68,6,17123.0,United Kingdom
550123,2023-04-14,22250,Decoration Butterfly Magic Garden,11.12,8,17123.0,United Kingdom
550123,2023-04-14,22251,Birdhouse Decoration Magic Garden,11.53,4,17123.0,United Kingdom
550123,2023-04-14,85188A,Green Metal Swinging Bunny,11.12,8,17123.0,United Kingdom
550123,2023-04-14,22264,Felt Farm Animal White Bunny,11.12,6,17123.0,United Kingdom
550123,2023-04-14,22260,Felt Egg Cosy Blue Rabbit,11.12,6,17123.0,United Kingdom
550123,2023-04-14,22256,Felt Farm Animal Chicken,11.53,3,17123.0,United Kingdom
550123,2023-04-14,22261,Felt Egg Cosy White Rabbit,11.12,5,17123.0,United Kingdom
550123,2023-04-14,22258,Felt Farm Animal Rabbit,11.53,6,17123.0,United Kingdom
550123,2023-04-14,22262,Felt Egg Cosy Chicken,11.12,2,17123.0,United Kingdom
550123,2023-04-14,22257,Felt Farm Animal Sheep,11.53,4,17123.0,United Kingdom
550123,2023-04-14,22259,Felt Farm Animal Hen,11.53,4,17123.0,United Kingdom
550123,2023-04-14,22367,Childrens Apron Spaceboy Design,12.25,2,17123.0,United Kingdom
550123,2023-04-14,22899,Children's Apron Dolly Girl,12.4,4,17123.0,United Kingdom
550123,2023-04-14,22241,Garland Wooden Happy Easter,11.53,4,17123.0,United Kingdom
550123,2023-04-14,20829,Glitter Hanging Butterfly String,12.4,6,17123.0,United Kingdom
550123,2023-04-14,22084,Paper Chain Kit Empire,13.27,4,17123.0,United Kingdom
550123,2023-04-14,85040A,S/4 Pink Flower Candles In Bowl,11.94,4,17123.0,United Kingdom
550123,2023-04-14,85197,Set Of 12 Mini Bunnies In A Bucket,12.4,2,17123.0,United Kingdom
550123,2023-04-14,22891,Tea For One Polkadot,14.61,2,17123.0,United Kingdom
550123,2023-04-14,85212,Mini Painted Garden Decoration,11.12,2,17123.0,United Kingdom
550123,2023-04-14,23076,Ice Cream Sundae Lip Gloss,11.53,24,17123.0,United Kingdom
550123,2023-04-14,48138,Doormat Union Flag,18.4,2,17123.0,United Kingdom
550123,2023-04-14,22053,Empire Design Rosette,11.53,4,17123.0,United Kingdom
550123,2023-04-14,21626,Vintage Union Jack Pennant,12.25,2,17123.0,United Kingdom
550123,2023-04-14,21878,Pack Of 6 Sandcastle Flags Assorted,11.12,9,17123.0,United Kingdom
550123,2023-04-14,22029,Spaceboy Birthday Card,10.68,12,17123.0,United Kingdom
550123,2023-04-14,22714,Card Birthday Cowboy,10.68,12,17123.0,United Kingdom
550123,2023-04-14,22712,Card Dolly Girl,10.68,12,17123.0,United Kingdom
550123,2023-04-14,22716,Card Circus Parade,10.68,12,17123.0,United Kingdom
550123,2023-04-14,22983,Card Billboard Font,10.68,12,17123.0,United Kingdom
550123,2023-04-14,21704,Bag 250g Swirly Marbles,11.12,3,17123.0,United Kingdom
550123,2023-04-14,22985,Wrap Billboard Fonts Design,10.68,25,17123.0,United Kingdom
550123,2023-04-14,22708,Wrap Dolly Girl,10.68,25,17123.0,United Kingdom
550123,2023-04-14,22711,Wrap Circus Parade,10.68,25,17123.0,United Kingdom
550123,2023-04-14,23207,Lunch Bag Alphabet Design,5.97,6,17123.0,United Kingdom
550124,2023-04-14,22139,Retrospot Tea Set Ceramic 11 Pc,15.32,6,12853.0,United Kingdom
550124,2023-04-14,22904,Calendar Paper Cut Design,13.27,6,12853.0,United Kingdom
550124,2023-04-14,84988,Set Of 72 Pink Heart Paper Doilies,11.74,12,12853.0,United Kingdom
550124,2023-04-14,21212,Pack Of 72 Retrospot Cake Cases,10.81,24,12853.0,United Kingdom
550124,2023-04-14,22178,Victorian Glass Hanging T-Light,11.53,12,12853.0,United Kingdom
550124,2023-04-14,22457,Natural Slate Heart Chalkboard,13.27,6,12853.0,United Kingdom
550124,2023-04-14,22927,Green Giant Garden Thermometer,16.35,2,12853.0,United Kingdom
550124,2023-04-14,22926,Ivory Giant Garden Thermometer,16.35,2,12853.0,United Kingdom
550124,2023-04-14,22925,Blue Giant Garden Thermometer,16.35,2,12853.0,United Kingdom
550124,2023-04-14,22171,3 Hook Photo Shelf Antique White,18.96,2,12853.0,United Kingdom
550124,2023-04-14,22170,Picture Frame Wood Triple Portrait,17.17,4,12853.0,United Kingdom
550124,2023-04-14,22169,Family Album White Picture Frame,18.96,2,12853.0,United Kingdom
550124,2023-04-14,21390,Filigris Heart With Butterfly,11.53,24,12853.0,United Kingdom
550124,2023-04-14,22794,Sweetheart Wire Magazine Rack,18.4,2,12853.0,United Kingdom
550124,2023-04-14,22502,Picnic Basket Wicker Small,16.35,4,12853.0,United Kingdom
550125,2023-04-14,47566,Party Bunting,15.32,8,13317.0,United Kingdom
550125,2023-04-14,22630,Dolly Girl Lunch Box,12.25,12,13317.0,United Kingdom
550125,2023-04-14,22629,Spaceboy Lunch Box,12.25,12,13317.0,United Kingdom
550125,2023-04-14,22654,Deluxe Sewing Kit,16.35,3,13317.0,United Kingdom
550125,2023-04-14,21232,Strawberry Ceramic Trinket Pot,11.53,12,13317.0,United Kingdom
550125,2023-04-14,22059,Ceramic Strawberry Design Mug,11.78,12,13317.0,United Kingdom
550125,2023-04-14,22649,Strawberry Fairy Cake Teapot,15.32,8,13317.0,United Kingdom
550125,2023-04-14,22960,Jam Making Set With Jars,14.61,6,13317.0,United Kingdom
550125,2023-04-14,22697,Green Regency Teacup And Saucer,13.27,6,13317.0,United Kingdom
550125,2023-04-14,22699,Roses Regency Teacup And Saucer,13.27,6,13317.0,United Kingdom
550125,2023-04-14,84991,60 Teatime Fairy Cake Cases,10.81,24,13317.0,United Kingdom
550125,2023-04-14,21212,Pack Of 72 Retrospot Cake Cases,10.81,24,13317.0,United Kingdom
550125,2023-04-14,22178,Victorian Glass Hanging T-Light,11.53,12,13317.0,United Kingdom
550125,2023-04-14,84949,Silver Hanging T-Light Holder,11.94,6,13317.0,United Kingdom
550125,2023-04-14,84946,Antique Silver T-Light Glass,11.53,12,13317.0,United Kingdom
550125,2023-04-14,71053,White Moroccan Metal Lantern,14.09,4,13317.0,United Kingdom
550125,2023-04-14,84970S,Hanging Heart Zinc T-Light Holder,11.12,12,13317.0,United Kingdom
550125,2023-04-14,84755,Colour Glass T-Light Holder Hanging,10.92,16,13317.0,United Kingdom
550125,2023-04-14,21523,Doormat Fancy Font Home Sweet Home,18.4,2,13317.0,United Kingdom
550125,2023-04-14,48187,Doormat New England,18.4,2,13317.0,United Kingdom
550125,2023-04-14,22170,Picture Frame Wood Triple Portrait,17.17,4,13317.0,United Kingdom
550125,2023-04-14,21929,Jumbo Bag Pink Vintage Paisley,6.19,10,13317.0,United Kingdom
550126,2023-04-14,23077,Doughnut Lip Gloss,11.53,40,12853.0,United Kingdom
550126,2023-04-14,22993,Set Of 4 Pantry Jelly Moulds,11.53,12,12853.0,United Kingdom
550126,2023-04-14,22727,Alarm Clock Bakelike Red,14.09,4,12853.0,United Kingdom
550126,2023-04-14,22729,Alarm Clock Bakelike Orange,14.09,4,12853.0,United Kingdom
550126,2023-04-14,22728,Alarm Clock Bakelike Pink,14.09,4,12853.0,United Kingdom
550126,2023-04-14,23199,Jumbo Bag Apples,6.13,10,12853.0,United Kingdom
550128,2023-04-14,22979,Pantry Washing Up Brush,11.74,1,16128.0,United Kingdom
550128,2023-04-14,22970,London Bus Coffee Mug,12.86,1,16128.0,United Kingdom
550128,2023-04-14,22303,Coffee Mug Apples Design,12.86,1,16128.0,United Kingdom
550128,2023-04-14,22302,Coffee Mug Pears Design,12.86,1,16128.0,United Kingdom
550128,2023-04-14,22933,Baking Mould Easter Egg Milk Choc,13.27,1,16128.0,United Kingdom
550128,2023-04-14,22932,Baking Mould Toffee Cup Chocolate,12.86,1,16128.0,United Kingdom
550128,2023-04-14,22930,Baking Mould Heart Milk Chocolate,12.86,1,16128.0,United Kingdom
550128,2023-04-14,22993,Set Of 4 Pantry Jelly Moulds,11.53,1,16128.0,United Kingdom
550129,2023-04-14,21122,Set/10 Pink Polkadot Party Candles,11.53,24,13001.0,United Kingdom
550129,2023-04-14,21124,Set/10 Blue Polkadot Party Candles,11.53,24,13001.0,United Kingdom
550129,2023-04-14,22138,Baking Set 9 Piece Retrospot,15.32,3,13001.0,United Kingdom
550129,2023-04-14,22617,Baking Set Spaceboy Design,15.32,3,13001.0,United Kingdom
550129,2023-04-14,22178,Victorian Glass Hanging T-Light,11.34,96,13001.0,United Kingdom
550129,2023-04-14,84879,Assorted Colour Bird Ornament,11.98,16,13001.0,United Kingdom
550129,2023-04-14,47590A,Blue Happy Birthday Bunting,15.84,3,13001.0,United Kingdom
550129,2023-04-14,21756,Bath Building Block Word,16.35,3,13001.0,United Kingdom
550129,2023-04-14,47566,Party Bunting,14.5,50,13001.0,United Kingdom
550129,2023-04-14,15056N,Edwardian Parasol Natural,16.35,3,13001.0,United Kingdom
550129,2023-04-14,22284,Hen House Decoration,11.94,12,13001.0,United Kingdom
550129,2023-04-14,22285,Hanging Hen On Nest Decoration,11.94,12,13001.0,United Kingdom
550129,2023-04-14,22291,Hanging Chick Cream Decoration,11.74,24,13001.0,United Kingdom
550129,2023-04-14,22212,Four Hook White Lovebirds,12.4,6,13001.0,United Kingdom
550129,2023-04-14,21559,Strawberry Lunch Box With Cutlery,12.86,6,13001.0,United Kingdom
550129,2023-04-14,22352,Lunch Box With Cutlery Retrospot,12.86,6,13001.0,United Kingdom
550129,2023-04-14,20979,36 Pencils Tube Red Retrospot,11.53,16,13001.0,United Kingdom
550129,2023-04-14,22386,Jumbo Bag Pink Polkadot,6.19,10,13001.0,United Kingdom
550130,2023-04-14,84997D,Childrens Cutlery Polkadot Pink,14.5,2,14390.0,United Kingdom
550130,2023-04-14,84997B,Childrens Cutlery Retrospot Red,14.5,2,14390.0,United Kingdom
550130,2023-04-14,84997A,Childrens Cutlery Polkadot Green,14.5,2,14390.0,United Kingdom
550130,2023-04-14,17003,Brocade Ring Purse,10.55,36,14390.0,United Kingdom
550130,2023-04-14,22412,Metal Sign Neighbourhood Witch,12.4,1,14390.0,United Kingdom
550130,2023-04-14,21626,Vintage Union Jack Pennant,12.25,1,14390.0,United Kingdom
550130,2023-04-14,21733,Red Hanging Heart T-Light Holder,13.27,4,14390.0,United Kingdom
550130,2023-04-14,22804,Pink Hanging Heart T-Light Holder,13.27,4,14390.0,United Kingdom
550130,2023-04-14,85123A,Cream Hanging Heart T-Light Holder,13.27,4,14390.0,United Kingdom
550130,2023-04-14,22645,Ceramic Heart Fairy Cake Money Bank,11.74,4,14390.0,United Kingdom
550130,2023-04-14,22650,Ceramic Pirate Chest Money Bank,11.74,4,14390.0,United Kingdom
550130,2023-04-14,22084,Paper Chain Kit Empire,13.27,6,14390.0,United Kingdom
550130,2023-04-14,48138,Doormat Union Flag,18.4,2,14390.0,United Kingdom
550130,2023-04-14,85135C,Red Dragonfly Helicopter,18.4,1,14390.0,United Kingdom
550130,2023-04-14,23256,Childrens Cutlery Spaceboy,14.5,3,14390.0,United Kingdom
550130,2023-04-14,22197,Popcorn Holder,11.12,4,14390.0,United Kingdom
550130,2023-04-14,22112,Chocolate Hot Water Bottle,15.32,2,14390.0,United Kingdom
550130,2023-04-14,21479,White Skull Hot Water Bottle,14.09,2,14390.0,United Kingdom
550130,2023-04-14,21833,Camouflage Led Torch,11.98,36,14390.0,United Kingdom
550130,2023-04-14,22374,Airline Bag Vintage Jet Set Red,14.61,2,14390.0,United Kingdom
550130,2023-04-14,22372,Airline Bag Vintage World Champion,14.61,2,14390.0,United Kingdom
550130,2023-04-14,22375,Airline Bag Vintage Jet Set Brown,14.61,2,14390.0,United Kingdom
550130,2023-04-14,22371,Airline Bag Vintage Tokyo 78,14.61,2,14390.0,United Kingdom
550130,2023-04-14,22174,Photo Cube,11.94,6,14390.0,United Kingdom
550130,2023-04-14,22331,Woodland Party Bag + Sticker Set,11.94,1,14390.0,United Kingdom
550130,2023-04-14,22333,Retrospot Party Bag + Sticker Set,11.94,1,14390.0,United Kingdom
550130,2023-04-14,21626,Vintage Union Jack Pennant,12.25,1,14390.0,United Kingdom
550130,2023-04-14,20724,Red Retrospot Charlotte Bag,11.12,2,14390.0,United Kingdom
550130,2023-04-14,21625,Vintage Union Jack Apron,17.37,1,14390.0,United Kingdom
550130,2023-04-14,21056,Doctor's Bag Soft Toy,19.42,2,14390.0,United Kingdom
550130,2023-04-14,22554,Plasters In Tin Woodland Animals,11.94,4,14390.0,United Kingdom
550130,2023-04-14,22553,Plasters In Tin Skulls,11.94,4,14390.0,United Kingdom
550130,2023-04-14,21930,Jumbo Storage Bag Skulls,12.38,2,14390.0,United Kingdom
550130,2023-04-14,20717,Strawberry Shopper Bag,11.53,2,14390.0,United Kingdom
550130,2023-04-14,20718,Red Retrospot Shopper Bag,11.53,3,14390.0,United Kingdom
550130,2023-04-14,22835,Hot Water Bottle I Am So Poorly,15.02,4,14390.0,United Kingdom
550130,2023-04-14,22523,Childs Garden Fork Pink,11.12,1,14390.0,United Kingdom
550130,2023-04-14,22521,Childs Garden Trowel Pink,11.12,1,14390.0,United Kingdom
550130,2023-04-14,20724,Red Retrospot Charlotte Bag,11.12,1,14390.0,United Kingdom
550130,2023-04-14,20723,Strawberry Charlotte Bag,11.12,2,14390.0,United Kingdom
550130,2023-04-14,22356,Charlotte Bag Pink Polkadot,11.12,2,14390.0,United Kingdom
550130,2023-04-14,22519,Childs Garden Brush Pink,12.4,1,14390.0,United Kingdom
550130,2023-04-14,22110,Bird House Hot Water Bottle,12.86,4,14390.0,United Kingdom
550130,2023-04-14,90185C,Black Diamante Expandable Ring,14.61,6,14390.0,United Kingdom
550130,2023-04-14,90185A,Amber Diamante Expandable Ring,14.61,6,14390.0,United Kingdom
550130,2023-04-14,90201B,Black Enamel Flower Ring,13.27,6,14390.0,United Kingdom
550130,2023-04-14,22386,Jumbo Bag Pink Polkadot,6.19,2,14390.0,United Kingdom
550130,2023-04-14,85099B,Jumbo Bag Red Retrospot,6.19,2,14390.0,United Kingdom
550130,2023-04-14,21928,Jumbo Bag Scandinavian Blue Paisley,6.19,1,14390.0,United Kingdom
550130,2023-04-14,85099F,Jumbo Bag Strawberry,6.19,2,14390.0,United Kingdom
550130,2023-04-14,85099C,Jumbo Bag Baroque Black White,6.19,1,14390.0,United Kingdom
550130,2023-04-14,20725,Lunch Bag Red Retrospot,5.97,2,14390.0,United Kingdom
550130,2023-04-14,20727,Lunch Bag Black Skull,5.97,2,14390.0,United Kingdom
550130,2023-04-14,22384,Lunch Bag Pink Polkadot,5.97,2,14390.0,United Kingdom
550131,2023-04-14,22722,Set Of 6 Spice Tins Pantry Design,14.3,4,15935.0,United Kingdom
550131,2023-04-14,22030,Swallows Greeting Card,10.68,12,15935.0,United Kingdom
550131,2023-04-14,22814,Card Party Games,10.68,12,15935.0,United Kingdom
550131,2023-04-14,22714,Card Birthday Cowboy,10.68,12,15935.0,United Kingdom
550131,2023-04-14,22027,Tea Party Birthday Card,10.68,12,15935.0,United Kingdom
550131,2023-04-14,22028,Penny Farthing Birthday Card,10.68,12,15935.0,United Kingdom
550131,2023-04-14,22983,Card Billboard Font,10.68,12,15935.0,United Kingdom
550131,2023-04-14,22982,Pantry Pastry Brush,11.53,12,15935.0,United Kingdom
550131,2023-04-14,22993,Set Of 4 Pantry Jelly Moulds,11.53,12,15935.0,United Kingdom
550131,2023-04-14,22171,3 Hook Photo Shelf Antique White,18.96,2,15935.0,United Kingdom
550131,2023-04-14,22855,Fine Wicker Heart,11.53,12,15935.0,United Kingdom
550132,2023-04-14,82484,Wood Black Board Ant White Finish,18.4,2,16933.0,United Kingdom
550132,2023-04-14,22975,Spaceboy Childrens Egg Cup,11.53,2,16933.0,United Kingdom
550132,2023-04-14,22977,Dolly Girl Childrens Egg Cup,11.53,4,16933.0,United Kingdom
550132,2023-04-14,21403,Blue Egg Spoon,10.37,3,16933.0,United Kingdom
550132,2023-04-14,22858,Easter Tin Keepsake,11.94,3,16933.0,United Kingdom
550132,2023-04-14,22858,Easter Tin Keepsake,11.94,6,16933.0,United Kingdom
550132,2023-04-14,22766,Photo Frame Cornice,13.27,4,16933.0,United Kingdom
550132,2023-04-14,22967,Set 3 Song Bird Paper Eggs Assorted,13.27,3,16933.0,United Kingdom
550132,2023-04-14,22957,Set 3 Paper Vintage Chick Paper Egg,13.27,3,16933.0,United Kingdom
550132,2023-04-14,22268,Decoration Sitting Bunny,11.12,11,16933.0,United Kingdom
550132,2023-04-14,22267,Easter Decoration Egg Bunny,11.53,12,16933.0,United Kingdom
550132,2023-04-14,22815,Card Psychedelic Apples,10.68,36,16933.0,United Kingdom
550132,2023-04-14,22585,Pack Of 6 Birdy Gift Tags,11.53,6,16933.0,United Kingdom
550132,2023-04-14,22813,Pack 3 Boxes Bird Panettone,12.25,3,16933.0,United Kingdom
550132,2023-04-14,21034,Rex Cash+Carry Jumbo Shopper,11.22,1,16933.0,United Kingdom
550132,2023-04-14,72351B,Set/6 Pink Butterfly T-Lights,12.4,9,16933.0,United Kingdom
550132,2023-04-14,84580,Mouse Toy With Pink T-Shirt,14.09,3,16933.0,United Kingdom
550132,2023-04-14,22283,6 Egg House Painted Wood,18.4,4,16933.0,United Kingdom
550132,2023-04-14,72351A,Set/6 Turquoise Butterfly T-Lights,12.4,10,16933.0,United Kingdom
550134,2023-04-14,21212,Pack Of 72 Retrospot Cake Cases,10.81,24,16249.0,United Kingdom
550134,2023-04-14,21977,Pack Of 60 Pink Paisley Cake Cases,10.81,24,16249.0,United Kingdom
550134,2023-04-14,21975,Pack Of 60 Dinosaur Cake Cases,10.81,24,16249.0,United Kingdom
550134,2023-04-14,21213,Pack Of 72 Skull Cake Cases,10.81,24,16249.0,United Kingdom
550134,2023-04-14,84991,60 Teatime Fairy Cake Cases,10.81,24,16249.0,United Kingdom
550134,2023-04-14,22087,Paper Bunting White Lace,13.27,18,16249.0,United Kingdom
550134,2023-04-14,47566,Party Bunting,15.32,8,16249.0,United Kingdom
550134,2023-04-14,22607,Wooden Rounders Garden Set,18.96,8,16249.0,United Kingdom
550134,2023-04-14,21749,Large Red Retrospot Windmill,12.4,24,16249.0,United Kingdom
550134,2023-04-14,21716,Boys Vintage Tin Seaside Bucket,12.4,32,16249.0,United Kingdom
550134,2023-04-14,21718,Red Metal Beach Spade,11.53,64,16249.0,United Kingdom
550134,2023-04-14,21715,Girls Vintage Tin Seaside Bucket,12.4,32,16249.0,United Kingdom
550134,2023-04-14,21937,Strawberry Picnic Bag,13.27,5,16249.0,United Kingdom
550134,2023-04-14,21936,Red Retrospot Picnic Bag,13.27,5,16249.0,United Kingdom
550134,2023-04-14,21907,I'm On Holiday Metal Sign,12.4,12,16249.0,United Kingdom
550134,2023-04-14,22464,Hanging Metal Heart Lantern,11.74,48,16249.0,United Kingdom
550134,2023-04-14,84755,Colour Glass T-Light Holder Hanging,10.92,16,16249.0,United Kingdom
550134,2023-04-14,22457,Natural Slate Heart Chalkboard,13.27,6,16249.0,United Kingdom
550134,2023-04-14,22456,Natural Slate Chalkboard Large,15.32,3,16249.0,United Kingdom
550134,2023-04-14,84879,Assorted Colour Bird Ornament,11.98,32,16249.0,United Kingdom
550135,2023-04-14,84997B,Childrens Cutlery Retrospot Red,13.72,288,15769.0,United Kingdom
550135,2023-04-14,84997A,Childrens Cutlery Polkadot Green,13.72,72,15769.0,United Kingdom
550136,2023-04-14,22432,Watering Can Pink Bunny,12.25,12,16957.0,United Kingdom
550136,2023-04-14,22433,Watering Can Green Dinosaur,12.25,12,16957.0,United Kingdom
550136,2023-04-14,22514,Childs Garden Spade Blue,12.4,12,16957.0,United Kingdom
550136,2023-04-14,22520,Childs Garden Trowel Blue,11.12,12,16957.0,United Kingdom
550136,2023-04-14,22515,Childs Garden Spade Pink,12.4,12,16957.0,United Kingdom
550136,2023-04-14,22521,Childs Garden Trowel Pink,11.12,12,16957.0,United Kingdom
550136,2023-04-14,21128,Gold Fishing Gnome,17.37,6,16957.0,United Kingdom
550136,2023-04-14,21129,Silver Fishing Gnome,17.37,6,16957.0,United Kingdom
550136,2023-04-14,22502,Picnic Basket Wicker Small,16.35,4,16957.0,United Kingdom
550136,2023-04-14,21172,Party Metal Sign,11.74,12,16957.0,United Kingdom
550136,2023-04-14,47566,Party Bunting,15.32,4,16957.0,United Kingdom
550137,2023-04-14,48185,Doormat Fairy Cake,18.4,2,12477.0,Germany
550137,2023-04-14,48138,Doormat Union Flag,18.4,2,12477.0,Germany
550137,2023-04-14,48188,Doormat Welcome Puppies,18.4,2,12477.0,Germany
550137,2023-04-14,22962,Jam Jar With Pink Lid,11.12,12,12477.0,Germany
550137,2023-04-14,22446,Pin Cushion Babushka Pink,13.68,12,12477.0,Germany
550137,2023-04-14,22447,Pin Cushion Babushka Blue,13.68,6,12477.0,Germany
550137,2023-04-14,22453,Measuring Tape Babushka Blue,13.27,6,12477.0,Germany
550137,2023-04-14,21257,Victorian Sewing Box Medium,18.4,2,12477.0,Germany
550137,2023-04-14,21672,White Spot Red Ceramic Drawer Knob,11.53,12,12477.0,Germany
550137,2023-04-14,15044A,Pink Paper Parasol,13.27,6,12477.0,Germany
550137,2023-04-14,22243,5 Hook Hanger Red Magic Toadstool,11.94,24,12477.0,Germany
550137,2023-04-14,22244,3 Hook Hanger Magic Garden,12.25,36,12477.0,Germany
550137,2023-04-14,22467,Gumball Coat Rack,12.86,12,12477.0,Germany
550137,2023-04-14,22212,Four Hook White Lovebirds,12.4,12,12477.0,Germany
550137,2023-04-14,21171,Bathroom Metal Sign,10.81,12,12477.0,Germany
550137,2023-04-14,21164,Home Sweet Home Metal Sign,13.27,12,12477.0,Germany
550137,2023-04-14,44242B,Pink Feathers Curtain,11.53,20,12477.0,Germany
550137,2023-04-14,84356,Pompom Curtain,16.35,12,12477.0,Germany
550137,2023-04-14,21042,Red Retrospot Apron,16.35,3,12477.0,Germany
550137,2023-04-14,22123,Ping Microwave Apron,12.25,12,12477.0,Germany
550137,2023-04-14,22990,Cotton Apron Pantry Design,15.32,6,12477.0,Germany
550137,2023-04-14,22939,Adult Apron Apple Delight,15.32,4,12477.0,Germany
550137,2023-04-14,22979,Pantry Washing Up Brush,11.74,12,12477.0,Germany
550137,2023-04-14,21212,Pack Of 72 Retrospot Cake Cases,10.81,24,12477.0,Germany
550137,2023-04-14,21155,Red Retrospot Peg Bag,12.86,12,12477.0,Germany
550137,2023-04-14,21216,Set 3 Retrospot Tea/Coffee/Sugar,14.61,72,12477.0,Germany
550137,2023-04-14,35810B,Enamel Blue Rim Coffee Container,11.1,24,12477.0,Germany
550137,2023-04-14,22200,Frying Pan Pink Polkadot,14.61,8,12477.0,Germany
550137,2023-04-14,21035,Set/2 Red Retrospot Tea Towels,13.07,100,12477.0,Germany
550137,2023-04-14,22989,Set 2 Pantry Design Tea Towels,13.58,6,12477.0,Germany
550137,2023-04-14,22723,Set Of 6 Herb Tins Sketchbook,14.3,8,12477.0,Germany
550137,2023-04-14,21041,Red Retrospot Oven Glove Double,13.27,6,12477.0,Germany
550137,2023-04-14,22626,Black Kitchen Scales,18.96,2,12477.0,Germany
550137,2023-04-14,20754,Retrospot Red Washing Up Gloves,12.4,6,12477.0,Germany
550137,2023-04-14,21936,Red Retrospot Picnic Bag,13.27,10,12477.0,Germany
550137,2023-04-14,20750,Red Retrospot Mini Cases,18.4,2,12477.0,Germany
550137,2023-04-14,22449,Silk Purse Babushka Pink,13.68,6,12477.0,Germany
550137,2023-04-14,22278,Overnight Bag Vintage Rose Paisley,15.32,3,12477.0,Germany
550137,2023-04-14,22176,Blue Owl Soft Toy,13.27,6,12477.0,Germany
550137,2023-04-14,22646,Ceramic Strawberry Cake Money Bank,11.74,12,12477.0,Germany
550137,2023-04-14,22637,Piggy Bank Retrospot,12.86,4,12477.0,Germany
550137,2023-04-14,82486,3 Drawer Antique White Wood Cabinet,19.42,6,12477.0,Germany
550137,2023-04-14,48116,Doormat Multicolour Stripe,18.4,2,12477.0,Germany
550137,2023-04-14,22692,Doormat Welcome To Our Home,17.17,10,12477.0,Germany
550137,2023-04-14,48184,Doormat English Rose,18.4,6,12477.0,Germany
550137,2023-04-14,21231,Sweetheart Ceramic Trinket Box,11.53,12,12477.0,Germany
550137,2023-04-14,21539,Red Retrospot Butter Dish,15.32,12,12477.0,Germany
550137,2023-04-14,21531,Red Retrospot Sugar Jam Bowl,12.86,12,12477.0,Germany
550137,2023-04-14,22222,Cake Plate Lovebird White,15.32,3,12477.0,Germany
550137,2023-04-14,22070,Small Red Retrospot Mug In Box,14.09,6,12477.0,Germany
550137,2023-04-14,21877,Home Sweet Home Mug,11.53,12,12477.0,Germany
550137,2023-04-14,21564,Pink Heart Shape Love Bucket,13.27,36,12477.0,Germany
550137,2023-04-14,21563,Red Heart Shape Love Bucket,13.27,36,12477.0,Germany
550137,2023-04-14,22354,Retrospot Padded Seat Cushion,14.09,5,12477.0,Germany
550137,2023-04-14,23199,Jumbo Bag Apples,6.19,10,12477.0,Germany
550138,2023-04-14,84380,Set Of 3 Butterfly Cookie Cutters,11.53,3,12841.0,United Kingdom
550138,2023-04-14,47566B,Tea Time Party Bunting,15.32,3,12841.0,United Kingdom
550138,2023-04-14,47566,Party Bunting,15.32,7,12841.0,United Kingdom
550138,2023-04-14,22998,Travel Card Wallet Keep Calm,10.68,4,12841.0,United Kingdom
550138,2023-04-14,22997,Travel Card Wallet Union Jack,10.68,4,12841.0,United Kingdom
550138,2023-04-14,22996,Travel Card Wallet Vintage Ticket,10.68,4,12841.0,United Kingdom
550138,2023-04-14,22994,Travel Card Wallet Retrospot,10.68,4,12841.0,United Kingdom
550138,2023-04-14,23004,Travel Card Wallet Pantry,10.68,4,12841.0,United Kingdom
550138,2023-04-14,23002,Travel Card Wallet Skulls,10.68,4,12841.0,United Kingdom
550138,2023-04-14,22224,White Lovebird Lantern,13.27,4,12841.0,United Kingdom
550138,2023-04-14,22980,Pantry Scrubbing Brush,11.94,1,12841.0,United Kingdom
550138,2023-04-14,22979,Pantry Washing Up Brush,11.74,1,12841.0,United Kingdom
550138,2023-04-14,22248,Decoration Pink Chick Magic Garden,11.12,5,12841.0,United Kingdom
550138,2023-04-14,22249,Decoration White Chick Magic Garden,11.12,6,12841.0,United Kingdom
550138,2023-04-14,85202,Hanging Wood And Felt Heart,10.68,4,12841.0,United Kingdom
550138,2023-04-14,85203,Hanging Wood And Felt Butterfly,10.68,5,12841.0,United Kingdom
550138,2023-04-14,22582,Pack Of 6 Sweetie Gift Boxes,12.86,1,12841.0,United Kingdom
550138,2023-04-14,21446,12 Red Rose Peg Place Settings,11.53,10,12841.0,United Kingdom
550138,2023-04-14,22250,Decoration Butterfly Magic Garden,11.12,6,12841.0,United Kingdom
550138,2023-04-14,22251,Birdhouse Decoration Magic Garden,11.53,4,12841.0,United Kingdom
550138,2023-04-14,47422,Assorted Monkey Suction Cup Hook,10.68,2,12841.0,United Kingdom
550138,2023-04-14,47422,Assorted Monkey Suction Cup Hook,10.68,2,12841.0,United Kingdom
550138,2023-04-14,47422,Assorted Monkey Suction Cup Hook,10.68,2,12841.0,United Kingdom
550138,2023-04-14,22722,Set Of 6 Spice Tins Pantry Design,14.3,1,12841.0,United Kingdom
550138,2023-04-14,15036,Assorted Colours Silk Fan,11.1,24,12841.0,United Kingdom
550138,2023-04-14,22084,Paper Chain Kit Empire,13.27,4,12841.0,United Kingdom
550138,2023-04-14,22960,Jam Making Set With Jars,14.61,1,12841.0,United Kingdom
550138,2023-04-14,22907,Pack Of 20 Napkins Pantry Design,11.12,4,12841.0,United Kingdom
550144,2023-04-14,23051,Recycled Acapulco Mat Blue,18.71,1,16520.0,United Kingdom
550144,2023-04-14,23050,Recycled Acapulco Mat Green,18.71,1,16520.0,United Kingdom
550144,2023-04-14,20961,Strawberry Bath Sponge,11.53,4,16520.0,United Kingdom
550144,2023-04-14,22919,Herb Marker Mint,10.92,12,16520.0,United Kingdom
550144,2023-04-14,23184,Bull Dog Bottle Opener,15.32,1,16520.0,United Kingdom
550144,2023-04-14,82582,Area Patrolled Metal Sign,12.4,12,16520.0,United Kingdom
550144,2023-04-14,22413,Metal Sign Take It Or Leave It,13.27,2,16520.0,United Kingdom
550144,2023-04-14,21166,Cook With Wine Metal Sign,12.38,2,16520.0,United Kingdom
550144,2023-04-14,21169,You're Confusing Me Metal Sign,11.98,1,16520.0,United Kingdom
550144,2023-04-14,21908,Chocolate This Way Metal Sign,12.4,2,16520.0,United Kingdom
550144,2023-04-14,21905,More Butter Metal Sign,12.4,1,16520.0,United Kingdom
550144,2023-04-14,21907,I'm On Holiday Metal Sign,12.4,2,16520.0,United Kingdom
