TransactionNo,Date,ProductNo,ProductName,Price,Quantity,CustomerNo,Country
540906,2023-01-12,22348,Tea Bag Plate Red Retrospot,11.12,36,16701.0,United Kingdom
540906,2023-01-12,22730,Alarm Clock Bakelike Ivory,14.09,4,16701.0,United Kingdom
540906,2023-01-12,22727,Alarm Clock Bakelike Red,14.09,4,16701.0,United Kingdom
540906,2023-01-12,22725,Alarm Clock Bakelike Chocolate,14.09,4,16701.0,United Kingdom
540907,2023-01-12,22962,Jam Jar With Pink Lid,11.12,12,13488.0,United Kingdom
540907,2023-01-12,21688,Silver Plate Candle Bowl Small,13.27,12,13488.0,United Kingdom
540907,2023-01-12,21671,Red Spot Ceramic Drawer Knob,11.53,12,13488.0,United Kingdom
540907,2023-01-12,21672,White Spot Red Ceramic Drawer Knob,11.53,12,13488.0,United Kingdom
540907,2023-01-12,84692,Box Of 24 Cocktail Parasols,10.68,25,13488.0,United Kingdom
540907,2023-01-12,22859,Easter Tin Bunny Bouquet,11.94,6,13488.0,United Kingdom
540907,2023-01-12,22858,Easter Tin Keepsake,11.94,6,13488.0,United Kingdom
540907,2023-01-12,21121,Set/10 Red Polkadot Party Candles,11.53,24,13488.0,United Kingdom
540907,2023-01-12,22661,Charlotte Bag Dolly Girl Design,11.12,10,13488.0,United Kingdom
540907,2023-01-12,84077,World War 2 Gliders Asstd Designs,10.55,48,13488.0,United Kingdom
540907,2023-01-12,22139,Retrospot Tea Set Ceramic 11 Pc,15.32,3,13488.0,United Kingdom
540907,2023-01-12,21704,Bag 250g Swirly Marbles,11.12,12,13488.0,United Kingdom
540907,2023-01-12,21791,Vintage Heads And Tails Card Game,11.53,12,13488.0,United Kingdom
540907,2023-01-12,21917,Set 12 Kids White Chalk Sticks,10.68,24,13488.0,United Kingdom
540907,2023-01-12,21912,Vintage Snakes & Ladders,14.09,4,13488.0,United Kingdom
540907,2023-01-12,22550,Holiday Fun Ludo,14.09,4,13488.0,United Kingdom
540907,2023-01-12,22751,Feltcraft Princess Olivia Doll,14.09,4,13488.0,United Kingdom
540907,2023-01-12,22749,Feltcraft Princess Charlotte Doll,14.09,4,13488.0,United Kingdom
540907,2023-01-12,22715,Card Wedding Day,10.68,12,13488.0,United Kingdom
540907,2023-01-12,22851,Set 20 Napkins Fairy Cakes Design,11.12,12,13488.0,United Kingdom
540907,2023-01-12,22084,Paper Chain Kit Empire,13.27,6,13488.0,United Kingdom
540907,2023-01-12,22907,Pack Of 20 Napkins Pantry Design,11.12,12,13488.0,United Kingdom
540907,2023-01-12,22961,Jam Making Set Printed,11.74,12,13488.0,United Kingdom
540907,2023-01-12,22960,Jam Making Set With Jars,14.61,6,13488.0,United Kingdom
540907,2023-01-12,22720,Set Of 3 Cake Tins Pantry Design,15.32,3,13488.0,United Kingdom
540907,2023-01-12,22722,Set Of 6 Spice Tins Pantry Design,14.3,4,13488.0,United Kingdom
540907,2023-01-12,84997D,Childrens Cutlery Polkadot Pink,14.09,6,13488.0,United Kingdom
540907,2023-01-12,84997C,Childrens Cutlery Polkadot Blue,14.09,6,13488.0,United Kingdom
540907,2023-01-12,84997B,Childrens Cutlery Retrospot Red,14.09,6,13488.0,United Kingdom
540907,2023-01-12,22699,Roses Regency Teacup And Saucer,13.27,6,13488.0,United Kingdom
540907,2023-01-12,22697,Green Regency Teacup And Saucer,13.27,6,13488.0,United Kingdom
540907,2023-01-12,22955,36 Foil Star Cake Cases,12.4,6,13488.0,United Kingdom
540907,2023-01-12,22956,36 Foil Heart Cake Cases,12.4,6,13488.0,United Kingdom
540907,2023-01-12,21972,Set Of 36 Dinosaur Paper Doilies,11.74,36,13488.0,United Kingdom
540907,2023-01-12,22949,Set Of 36 Dolly Girl Paper Doilies,11.74,36,13488.0,United Kingdom
540907,2023-01-12,22951,60 Cake Cases Dolly Girl Design,10.81,24,13488.0,United Kingdom
540907,2023-01-12,21975,Pack Of 60 Dinosaur Cake Cases,10.81,24,13488.0,United Kingdom
540907,2023-01-12,22147,Feltcraft Butterfly Hearts,11.74,12,13488.0,United Kingdom
540907,2023-01-12,22750,Feltcraft Princess Lola Doll,14.09,4,13488.0,United Kingdom
540907,2023-01-12,20969,Red Floral Feltcraft Shoulder Bag,14.09,4,13488.0,United Kingdom
540907,2023-01-12,22480,Red Tea Towel Classic Design,11.53,12,13488.0,United Kingdom
540907,2023-01-12,22348,Tea Bag Plate Red Retrospot,11.12,12,13488.0,United Kingdom
540907,2023-01-12,22203,Milk Pan Red Retrospot,14.09,4,13488.0,United Kingdom
540907,2023-01-12,22199,Frying Pan Red Retrospot,14.61,4,13488.0,United Kingdom
540907,2023-01-12,22624,Ivory Kitchen Scales,18.96,2,13488.0,United Kingdom
540907,2023-01-12,22625,Red Kitchen Scales,18.96,2,13488.0,United Kingdom
540907,2023-01-12,82583,Hot Baths Metal Sign,12.4,12,13488.0,United Kingdom
540907,2023-01-12,22948,Metal Decoration Naughty Children,11.12,24,13488.0,United Kingdom
540907,2023-01-12,84970S,Hanging Heart Zinc T-Light Holder,11.12,12,13488.0,United Kingdom
540907,2023-01-12,84970L,Single Heart Zinc T-Light Holder,11.22,12,13488.0,United Kingdom
540907,2023-01-12,85123A,Cream Hanging Heart T-Light Holder,13.27,12,13488.0,United Kingdom
540907,2023-01-12,21900,Key Fob Shed,10.92,24,13488.0,United Kingdom
540907,2023-01-12,21868,Potting Shed Tea Mug,11.53,12,13488.0,United Kingdom
540907,2023-01-12,22855,Fine Wicker Heart,11.53,12,13488.0,United Kingdom
540907,2023-01-12,21390,Filigris Heart With Butterfly,11.53,24,13488.0,United Kingdom
540907,2023-01-12,22227,Hanging Heart Mirror Decoration,10.92,24,13488.0,United Kingdom
540907,2023-01-12,84836,Zinc Metal Heart Decoration,11.53,12,13488.0,United Kingdom
540907,2023-01-12,22862,Love Heart Napkin Box,14.61,4,13488.0,United Kingdom
540907,2023-01-12,22795,Sweetheart Recipe Book Stand,17.17,2,13488.0,United Kingdom
540907,2023-01-12,21755,Love Building Block Word,16.35,3,13488.0,United Kingdom
540907,2023-01-12,21754,Home Building Block Word,16.35,3,13488.0,United Kingdom
540907,2023-01-12,20711,Jumbo Bag Toys,6.13,10,13488.0,United Kingdom
540907,2023-01-12,20728,Lunch Bag Cars Blue,5.97,10,13488.0,United Kingdom
540907,2023-01-12,22382,Lunch Bag Spaceboy Design,5.97,10,13488.0,United Kingdom
540907,2023-01-12,22384,Lunch Bag Pink Polkadot,5.97,10,13488.0,United Kingdom
540908,2023-01-12,82001S,Silver Record Cover Frame,13.72,48,12980.0,United Kingdom
540915,2023-01-12,22629,Spaceboy Lunch Box,12.25,12,13267.0,United Kingdom
540915,2023-01-12,22558,Clothes Pegs Retrospot Pack 24,11.78,12,13267.0,United Kingdom
540915,2023-01-12,22798,Antique Glass Dressing Table Pot,13.27,8,13267.0,United Kingdom
540915,2023-01-12,79321,Chilli Lights,15.32,8,13267.0,United Kingdom
540915,2023-01-12,21314,Small Glass Heart Trinket Pot,12.4,8,13267.0,United Kingdom
540915,2023-01-12,22699,Roses Regency Teacup And Saucer,13.27,6,13267.0,United Kingdom
540915,2023-01-12,22697,Green Regency Teacup And Saucer,13.27,6,13267.0,United Kingdom
540915,2023-01-12,21668,Red Stripe Ceramic Drawer Knob,11.53,12,13267.0,United Kingdom
540915,2023-01-12,21669,Blue Stripe Ceramic Drawer Knob,11.53,12,13267.0,United Kingdom
540915,2023-01-12,22730,Alarm Clock Bakelike Ivory,14.09,4,13267.0,United Kingdom
540915,2023-01-12,22728,Alarm Clock Bakelike Pink,14.09,4,13267.0,United Kingdom
540915,2023-01-12,22726,Alarm Clock Bakelike Green,14.09,4,13267.0,United Kingdom
540915,2023-01-12,84978,Hanging Heart Jar T-Light Holder,11.53,12,13267.0,United Kingdom
540915,2023-01-12,84792,Enchanted Bird Coathanger 5 Hook,15.02,4,13267.0,United Kingdom
540915,2023-01-12,82484,Wood Black Board Ant White Finish,16.86,3,13267.0,United Kingdom
540915,2023-01-12,84879,Assorted Colour Bird Ornament,11.98,16,13267.0,United Kingdom
540939,2023-01-12,22467,Gumball Coat Rack,12.4,1,15061.0,United Kingdom
540939,2023-01-12,22543,Mini Jigsaw Bake A Cake,10.62,1,15061.0,United Kingdom
540940,2023-01-12,22469,Heart Of Wicker Small,11.94,5,18109.0,United Kingdom
540940,2023-01-12,22470,Heart Of Wicker Large,13.27,1,18109.0,United Kingdom
540940,2023-01-12,21259,Victorian Sewing Box Small,16.35,2,18109.0,United Kingdom
540940,2023-01-12,22667,Recipe Box Retrospot,13.27,5,18109.0,United Kingdom
540940,2023-01-12,22149,Feltcraft 6 Flower Friends,12.4,3,18109.0,United Kingdom
540940,2023-01-12,84459A,Pink Metal Chicken Heart,11.78,2,18109.0,United Kingdom
540940,2023-01-12,22169,Family Album White Picture Frame,18.09,8,18109.0,United Kingdom
540943,2023-01-12,21810,Christmas Hanging Star With Bell,11.53,4,17841.0,United Kingdom
540943,2023-01-12,21809,Christmas Hanging Tree With Bell,11.53,1,17841.0,United Kingdom
540943,2023-01-12,15060B,Fairy Cake Design Umbrella,14.09,1,17841.0,United Kingdom
540943,2023-01-12,21495,Skulls And Crossbones Wrap,10.68,25,17841.0,United Kingdom
540943,2023-01-12,79160,Heart Shape Wireless Doorbell,12.4,1,17841.0,United Kingdom
540943,2023-01-12,20617,First Class Passport Cover,12.4,1,17841.0,United Kingdom
540943,2023-01-12,20662,First Class Holiday Purse,13.27,1,17841.0,United Kingdom
540943,2023-01-12,20654,First Class Luggage Tag,11.53,1,17841.0,United Kingdom
540943,2023-01-12,21668,Red Stripe Ceramic Drawer Knob,11.53,3,17841.0,United Kingdom
540943,2023-01-12,21672,White Spot Red Ceramic Drawer Knob,11.53,2,17841.0,United Kingdom
540943,2023-01-12,22179,Set 10 Night Owl Lights,17.17,1,17841.0,United Kingdom
540943,2023-01-12,22701,Pink Dog Bowl,13.27,1,17841.0,United Kingdom
540943,2023-01-12,22700,Black And White Dog Bowl,13.27,2,17841.0,United Kingdom
540943,2023-01-12,85064,Cream Sweetheart Letter Rack,15.84,1,17841.0,United Kingdom
540943,2023-01-12,22694,Wicker Star,12.4,1,17841.0,United Kingdom
540943,2023-01-12,22470,Heart Of Wicker Large,13.27,1,17841.0,United Kingdom
540943,2023-01-12,85123A,Cream Hanging Heart T-Light Holder,13.27,1,17841.0,United Kingdom
540943,2023-01-12,22804,Pink Hanging Heart T-Light Holder,13.27,1,17841.0,United Kingdom
540943,2023-01-12,82484,Wood Black Board Ant White Finish,16.86,1,17841.0,United Kingdom
540943,2023-01-12,22189,Cream Heart Card Holder,14.3,2,17841.0,United Kingdom
540943,2023-01-12,22188,Black Heart Card Holder,14.3,1,17841.0,United Kingdom
540943,2023-01-12,21935,Suki Shoulder Bag,11.94,3,17841.0,United Kingdom
540943,2023-01-12,21934,Skull Shoulder Bag,11.94,5,17841.0,United Kingdom
540943,2023-01-12,82001S,Silver Record Cover Frame,14.09,2,17841.0,United Kingdom
540943,2023-01-12,21811,Hanging Heart With Bell,11.53,1,17841.0,United Kingdom
540943,2023-01-12,20972,Pink Cream Felt Craft Trinket Box,11.53,5,17841.0,United Kingdom
540943,2023-01-12,22654,Deluxe Sewing Kit,16.35,1,17841.0,United Kingdom
540943,2023-01-12,20668,Disco Ball Christmas Decoration,10.37,24,17841.0,United Kingdom
540943,2023-01-12,22661,Charlotte Bag Dolly Girl Design,11.12,3,17841.0,United Kingdom
540943,2023-01-12,22356,Charlotte Bag Pink Polkadot,11.12,2,17841.0,United Kingdom
540943,2023-01-12,79321,Chilli Lights,15.32,3,17841.0,United Kingdom
540945,2023-01-12,22322,Bird Decoration Green Polkadot,11.12,1,16554.0,United Kingdom
540946,2023-01-12,22511,Retrospot Babushka Doorstop,11.53,8,12359.0,Cyprus
540946,2023-01-12,22510,Gingham Babushka Doorstop,11.53,8,12359.0,Cyprus
540946,2023-01-12,22720,Set Of 3 Cake Tins Pantry Design,15.32,3,12359.0,Cyprus
540946,2023-01-12,22721,Set Of 3 Cake Tins Sketchbook,15.32,3,12359.0,Cyprus
540946,2023-01-12,22666,Recipe Box Pantry Yellow Design,13.27,6,12359.0,Cyprus
540946,2023-01-12,82484,Wood Black Board Ant White Finish,15.94,12,12359.0,Cyprus
540946,2023-01-12,20704,Mr Robot Soft Toy,12.25,8,12359.0,Cyprus
540946,2023-01-12,82613A,Metal Sign Cupcake Single Hook,10.68,20,12359.0,Cyprus
540946,2023-01-12,85054,French Enamel Pot W Lid,11.53,12,12359.0,Cyprus
540946,2023-01-12,82613A,Metal Sign Cupcake Single Hook,10.68,20,12359.0,Cyprus
540946,2023-01-12,20705,Mrs Robot Soft Toy,12.25,8,12359.0,Cyprus
540946,2023-01-12,22471,Tv Dinner Tray Air Hostess,12.25,8,12359.0,Cyprus
540946,2023-01-12,82613A,Metal Sign Cupcake Single Hook,10.68,20,12359.0,Cyprus
540947,2023-01-12,22456,Natural Slate Chalkboard Large,14.61,18,15939.0,United Kingdom
540947,2023-01-12,22457,Natural Slate Heart Chalkboard,12.86,48,15939.0,United Kingdom
540947,2023-01-12,85170D,Set/6 Pink Bird T-Light Candles,11.98,24,15939.0,United Kingdom
540947,2023-01-12,85169C,Eau De Nil Love Bird Candle,11.34,72,15939.0,United Kingdom
540947,2023-01-12,85169D,Pink Love Bird Candle,11.34,72,15939.0,United Kingdom
540947,2023-01-12,85169A,Ivory Love Bird Candle,11.34,72,15939.0,United Kingdom
540947,2023-01-12,22151,Place Setting White Heart,10.68,24,15939.0,United Kingdom
540947,2023-01-12,22152,Place Setting White Star,10.68,24,15939.0,United Kingdom
540947,2023-01-12,22088,Paper Bunting Coloured Lace,12.86,40,15939.0,United Kingdom
540947,2023-01-12,21210,Set Of 72 Retrospot Paper Doilies,11.74,24,15939.0,United Kingdom
540947,2023-01-12,72351A,Set/6 Turquoise Butterfly T-Lights,11.98,72,15939.0,United Kingdom
540951,2023-01-12,22061,Large Cake Stand Hanging Strawbery,18.96,12,13113.0,United Kingdom
540951,2023-01-12,21217,Red Retrospot Round Cake Tins,19.42,12,13113.0,United Kingdom
540951,2023-01-12,37448,Ceramic Cake Design Spotted Mug,11.78,10,13113.0,United Kingdom
540951,2023-01-12,22059,Ceramic Strawberry Design Mug,11.78,10,13113.0,United Kingdom
540951,2023-01-12,47566,Party Bunting,15.02,15,13113.0,United Kingdom
540951,2023-01-12,22720,Set Of 3 Cake Tins Pantry Design,15.32,1,13113.0,United Kingdom
540951,2023-01-12,22195,Large Heart Measuring Spoons,11.94,15,13113.0,United Kingdom
540951,2023-01-12,22196,Small Heart Measuring Spoons,11.12,20,13113.0,United Kingdom
540951,2023-01-12,22131,Food Container Set 3 Love Heart,12.25,5,13113.0,United Kingdom
540951,2023-01-12,22501,Picnic Basket Wicker Large,18.96,16,13113.0,United Kingdom
540953,2023-01-12,85232A,Set/3 Polkadot Stacking Tins,15.32,3,14587.0,United Kingdom
540953,2023-01-12,21755,Love Building Block Word,16.35,1,14587.0,United Kingdom
540953,2023-01-12,22558,Clothes Pegs Retrospot Pack 24,11.78,1,14587.0,United Kingdom
540953,2023-01-12,22567,20 Dolly Pegs Retrospot,11.53,1,14587.0,United Kingdom
540953,2023-01-12,22880,Number Tile Vintage Font 1,12.25,1,14587.0,United Kingdom
540953,2023-01-12,22882,Number Tile Vintage Font 3,12.25,1,14587.0,United Kingdom
540953,2023-01-12,22508,Doorstop Retrospot Heart,14.09,2,14587.0,United Kingdom
540953,2023-01-12,82484,Wood Black Board Ant White Finish,16.86,2,14587.0,United Kingdom
540953,2023-01-12,84997A,Childrens Cutlery Polkadot Green,14.09,1,14587.0,United Kingdom
540953,2023-01-12,84997D,Childrens Cutlery Polkadot Pink,14.09,1,14587.0,United Kingdom
540953,2023-01-12,84997C,Childrens Cutlery Polkadot Blue,14.09,1,14587.0,United Kingdom
540953,2023-01-12,84997B,Childrens Cutlery Retrospot Red,14.09,1,14587.0,United Kingdom
540953,2023-01-12,22139,Retrospot Tea Set Ceramic 11 Pc,15.32,1,14587.0,United Kingdom
540953,2023-01-12,84510A,Set Of 4 English Rose Coasters,11.53,1,14587.0,United Kingdom
540953,2023-01-12,21231,Sweetheart Ceramic Trinket Box,11.53,4,14587.0,United Kingdom
540953,2023-01-12,84509A,Set Of 4 English Rose Placemats,14.09,1,14587.0,United Kingdom
540953,2023-01-12,84509C,Set Of 4 Polkadot Placemats,14.09,1,14587.0,United Kingdom
540953,2023-01-12,84510C,Set Of 4 Polkadot Coasters,11.53,1,14587.0,United Kingdom
540953,2023-01-12,17003,Brocade Ring Purse,10.47,6,14587.0,United Kingdom
540953,2023-01-12,21916,Set 12 Retro White Chalk Sticks,10.68,2,14587.0,United Kingdom
540953,2023-01-12,21967,Pack Of 12 Skull Tissues,10.55,2,14587.0,United Kingdom
540953,2023-01-12,21212,Pack Of 72 Retrospot Cake Cases,10.81,1,14587.0,United Kingdom
540953,2023-01-12,21986,Pack Of 12 Pink Polkadot Tissues,10.55,2,14587.0,United Kingdom
540953,2023-01-12,21558,Skull Lunch Box With Cutlery,12.86,1,14587.0,United Kingdom
540953,2023-01-12,21982,Pack Of 12 Suki Tissues,10.55,2,14587.0,United Kingdom
540953,2023-01-12,21559,Strawberry Lunch Box With Cutlery,12.86,1,14587.0,United Kingdom
540953,2023-01-12,22645,Ceramic Heart Fairy Cake Money Bank,11.74,2,14587.0,United Kingdom
540953,2023-01-12,21213,Pack Of 72 Skull Cake Cases,10.81,2,14587.0,United Kingdom
540953,2023-01-12,21746,Small Red Retrospot Windmill,11.53,1,14587.0,United Kingdom
540953,2023-01-12,21747,Small Skull Windmill,11.53,1,14587.0,United Kingdom
540953,2023-01-12,84992,72 Sweetheart Fairy Cake Cases,10.81,1,14587.0,United Kingdom
540953,2023-01-12,21212,Pack Of 72 Retrospot Cake Cases,10.81,1,14587.0,United Kingdom
540953,2023-01-12,21899,Garage Key Fob,10.92,1,14587.0,United Kingdom
540953,2023-01-12,21901,Key Fob Back Door,10.92,1,14587.0,United Kingdom
540953,2023-01-12,21900,Key Fob Shed,10.92,1,14587.0,United Kingdom
540953,2023-01-12,22522,Childs Garden Fork Blue,11.12,1,14587.0,United Kingdom
540953,2023-01-12,22521,Childs Garden Trowel Pink,11.12,1,14587.0,United Kingdom
540953,2023-01-12,22523,Childs Garden Fork Pink,11.12,1,14587.0,United Kingdom
540953,2023-01-12,22520,Childs Garden Trowel Blue,11.12,1,14587.0,United Kingdom
540953,2023-01-12,22083,Paper Chain Kit Retrospot,13.27,2,14587.0,United Kingdom
540953,2023-01-12,22457,Natural Slate Heart Chalkboard,13.27,1,14587.0,United Kingdom
540953,2023-01-12,21985,Pack Of 12 Hearts Design Tissues,10.55,2,14587.0,United Kingdom
540953,2023-01-12,21122,Set/10 Pink Polkadot Party Candles,11.53,1,14587.0,United Kingdom
540953,2023-01-12,22367,Childrens Apron Spaceboy Design,12.25,1,14587.0,United Kingdom
540953,2023-01-12,21156,Retrospot Childrens Apron,12.25,1,14587.0,United Kingdom
540953,2023-01-12,22367,Childrens Apron Spaceboy Design,12.25,1,14587.0,United Kingdom
540953,2023-01-12,21156,Retrospot Childrens Apron,12.25,1,14587.0,United Kingdom
540953,2023-01-12,22333,Retrospot Party Bag + Sticker Set,11.94,1,14587.0,United Kingdom
540953,2023-01-12,22333,Retrospot Party Bag + Sticker Set,11.94,1,14587.0,United Kingdom
540953,2023-01-12,22332,Skulls Party Bag + Sticker Set,11.94,1,14587.0,United Kingdom
540953,2023-01-12,22334,Dinosaur Party Bag + Sticker Set,11.94,1,14587.0,United Kingdom
540953,2023-01-12,21154,Red Retrospot Oven Glove,11.53,2,14587.0,United Kingdom
540953,2023-01-12,47559B,Tea Time Oven Glove,11.53,2,14587.0,United Kingdom
540953,2023-01-12,22862,Love Heart Napkin Box,14.61,2,14587.0,United Kingdom
540953,2023-01-12,35653,Vintage Bead Notebook,13.27,1,14587.0,United Kingdom
540953,2023-01-12,84536A,English Rose Notebook A7 Size,10.68,2,14587.0,United Kingdom
540953,2023-01-12,22851,Set 20 Napkins Fairy Cakes Design,11.12,1,14587.0,United Kingdom
540953,2023-01-12,84884A,Ant White Wire Heart Spiral,14.3,1,14587.0,United Kingdom
540953,2023-01-12,84375,Set Of 20 Kids Cookie Cutters,12.4,1,14587.0,United Kingdom
540953,2023-01-12,84992,72 Sweetheart Fairy Cake Cases,10.81,1,14587.0,United Kingdom
540953,2023-01-12,84673A,Pink Fly Swat,10.92,2,14587.0,United Kingdom
540953,2023-01-12,21380,Wooden Happy Birthday Garland,13.27,2,14587.0,United Kingdom
540953,2023-01-12,21975,Pack Of 60 Dinosaur Cake Cases,10.81,1,14587.0,United Kingdom
540953,2023-01-12,84991,60 Teatime Fairy Cake Cases,10.81,1,14587.0,United Kingdom
540953,2023-01-12,21975,Pack Of 60 Dinosaur Cake Cases,10.81,1,14587.0,United Kingdom
540953,2023-01-12,22524,Childrens Garden Gloves Blue,11.53,1,14587.0,United Kingdom
540953,2023-01-12,84991,60 Teatime Fairy Cake Cases,10.81,1,14587.0,United Kingdom
540953,2023-01-12,22525,Childrens Garden Gloves Pink,11.53,1,14587.0,United Kingdom
540953,2023-01-12,85123A,Cream Hanging Heart T-Light Holder,13.27,1,14587.0,United Kingdom
540953,2023-01-12,47593B,Scottie Dogs Baby Bib,11.53,1,14587.0,United Kingdom
540953,2023-01-12,47593A,Carousel Ponies Baby Bib,11.53,1,14587.0,United Kingdom
540953,2023-01-12,21080,Set/20 Red Retrospot Paper Napkins,11.12,1,14587.0,United Kingdom
540953,2023-01-12,21124,Set/10 Blue Polkadot Party Candles,11.53,1,14587.0,United Kingdom
540953,2023-01-12,21989,Pack Of 20 Skull Paper Napkins,11.12,1,14587.0,United Kingdom
540953,2023-01-12,21078,Set/20 Strawberry Paper Napkins,11.12,1,14587.0,United Kingdom
540953,2023-01-12,85123A,Cream Hanging Heart T-Light Holder,13.27,1,14587.0,United Kingdom
540953,2023-01-12,84375,Set Of 20 Kids Cookie Cutters,12.4,1,14587.0,United Kingdom
540953,2023-01-12,21918,Set 12 Kids Colour Chalk Sticks,10.68,2,14587.0,United Kingdom
540953,2023-01-12,21790,Vintage Snap Cards,11.12,2,14587.0,United Kingdom
540953,2023-01-12,21430,Set/3 Red Gingham Rose Storage Box,14.09,1,14587.0,United Kingdom
540953,2023-01-12,82494L,Wooden Frame Antique White,13.27,1,14587.0,United Kingdom
540953,2023-01-12,82482,Wooden Picture Frame White Finish,12.86,1,14587.0,United Kingdom
540953,2023-01-12,84535B,Fairy Cakes Notebook A6 Size,10.92,1,14587.0,United Kingdom
540953,2023-01-12,22469,Heart Of Wicker Small,11.94,2,14587.0,United Kingdom
540953,2023-01-12,21829,Dinosaur Keyrings Assorted,10.47,36,14587.0,United Kingdom
540953,2023-01-12,20682,Red Retrospot Childrens Umbrella,13.58,2,14587.0,United Kingdom
540953,2023-01-12,20681,Pink Polkadot Childrens Umbrella,13.58,2,14587.0,United Kingdom
540953,2023-01-12,20727,Lunch Bag Black Skull,5.97,2,14587.0,United Kingdom
540954,2023-01-12,22323,Pink Polkadot Kids Bag,12.25,1,14606.0,United Kingdom
540954,2023-01-12,22381,Toy Tidy Pink Polkadot,12.4,4,14606.0,United Kingdom
540954,2023-01-12,22380,Toy Tidy Spaceboy,12.4,1,14606.0,United Kingdom
540954,2023-01-12,21201,Tropical Honeycomb Paper Garland,12.86,1,14606.0,United Kingdom
540954,2023-01-12,20752,Blue Polkadot Washing Up Gloves,12.4,1,14606.0,United Kingdom
540954,2023-01-12,20652,Blue Polkadot Luggage Tag,11.53,1,14606.0,United Kingdom
540954,2023-01-12,22499,Wooden Union Jack Bunting,16.35,1,14606.0,United Kingdom
540954,2023-01-12,21723,Alphabet Hearts Sticker Sheet,11.12,3,14606.0,United Kingdom
540954,2023-01-12,21724,Panda And Bunnies Sticker Sheet,11.12,2,14606.0,United Kingdom
540954,2023-01-12,21564,Pink Heart Shape Love Bucket,13.27,1,14606.0,United Kingdom
540954,2023-01-12,84832,Zinc Willie Winkie Candle Stick,11.12,1,14606.0,United Kingdom
540954,2023-01-12,21427,Skulls Storage Box Small,12.4,1,14606.0,United Kingdom
540954,2023-01-12,85129D,Beaded Crystal Heart Pink Small,11.53,6,14606.0,United Kingdom
540954,2023-01-12,85129C,Beaded Crystal Heart Blue Small,11.53,5,14606.0,United Kingdom
540954,2023-01-12,85129B,Beaded Crystal Heart Green Small,11.53,1,14606.0,United Kingdom
540954,2023-01-12,22179,Set 10 Night Owl Lights,17.17,1,14606.0,United Kingdom
540954,2023-01-12,22434,Balloon Pump With 10 Balloons,12.25,1,14606.0,United Kingdom
540954,2023-01-12,20996,Jazz Hearts Address Book,10.68,5,14606.0,United Kingdom
540954,2023-01-12,22483,Red Gingham Teddy Bear,13.27,1,14606.0,United Kingdom
540954,2023-01-12,22365,Doormat Respectable House,18.4,1,14606.0,United Kingdom
540954,2023-01-12,21531,Red Retrospot Sugar Jam Bowl,12.86,1,14606.0,United Kingdom
540955,2023-01-12,22985,Wrap Billboard Fonts Design,10.68,25,14715.0,United Kingdom
540955,2023-01-12,22988,Soldiers Egg Cup,11.53,12,14715.0,United Kingdom
540955,2023-01-12,16016,Large Chinese Style Scissor,11.12,20,14715.0,United Kingdom
540955,2023-01-12,21181,Please One Person Metal Sign,12.4,1,14715.0,United Kingdom
540955,2023-01-12,21907,I'm On Holiday Metal Sign,12.4,1,14715.0,United Kingdom
540955,2023-01-12,85123A,Cream Hanging Heart T-Light Holder,13.27,4,14715.0,United Kingdom
540955,2023-01-12,82551,Laundry 15c Metal Sign,11.74,3,14715.0,United Kingdom
540955,2023-01-12,82552,Washroom Metal Sign,11.74,3,14715.0,United Kingdom
540955,2023-01-12,22784,Lantern Cream Gazebo,15.32,2,14715.0,United Kingdom
540955,2023-01-12,47566,Party Bunting,15.02,3,14715.0,United Kingdom
540955,2023-01-12,47566B,Tea Time Party Bunting,15.02,1,14715.0,United Kingdom
540955,2023-01-12,71053,White Moroccan Metal Lantern,14.09,2,14715.0,United Kingdom
540955,2023-01-12,84356,Pompom Curtain,17.37,5,14715.0,United Kingdom
540957,2023-01-12,82484,Wood Black Board Ant White Finish,16.86,1,15311.0,United Kingdom
540957,2023-01-12,21175,Gin And Tonic Diet Metal Sign,12.4,2,15311.0,United Kingdom
540957,2023-01-12,82599,Fanny's Rest Stopmetal Sign,12.4,2,15311.0,United Kingdom
540957,2023-01-12,20719,Woodland Charlotte Bag,11.12,4,15311.0,United Kingdom
540957,2023-01-12,20718,Red Retrospot Shopper Bag,11.53,2,15311.0,United Kingdom
540957,2023-01-12,20724,Red Retrospot Charlotte Bag,11.12,3,15311.0,United Kingdom
540957,2023-01-12,20677,Pink Polkadot Bowl,11.53,5,15311.0,United Kingdom
540957,2023-01-12,20675,Blue Polkadot Bowl,11.53,4,15311.0,United Kingdom
540957,2023-01-12,20674,Green Polkadot Bowl,11.53,5,15311.0,United Kingdom
540957,2023-01-12,20676,Red Retrospot Bowl,11.53,5,15311.0,United Kingdom
540957,2023-01-12,84997B,Childrens Cutlery Retrospot Red,14.09,5,15311.0,United Kingdom
540957,2023-01-12,21242,Red Retrospot Plate,11.98,8,15311.0,United Kingdom
540957,2023-01-12,22103,Mirror Mosaic T-Light Holder Round,11.94,1,15311.0,United Kingdom
540957,2023-01-12,84993A,75 Green Petit Four Cases,10.68,2,15311.0,United Kingdom
540957,2023-01-12,21244,Blue Polkadot Plate,11.98,4,15311.0,United Kingdom
540957,2023-01-12,21243,Pink Polkadot Plate,11.98,4,15311.0,United Kingdom
540957,2023-01-12,21245,Green Polkadot Plate,11.98,3,15311.0,United Kingdom
540957,2023-01-12,21240,Blue Polkadot Cup,11.12,4,15311.0,United Kingdom
540957,2023-01-12,21239,Pink Polkadot Cup,11.12,4,15311.0,United Kingdom
540957,2023-01-12,21238,Red Retrospot Cup,11.12,4,15311.0,United Kingdom
540957,2023-01-12,20676,Red Retrospot Bowl,11.53,4,15311.0,United Kingdom
540957,2023-01-12,21212,Pack Of 72 Retrospot Cake Cases,10.81,3,15311.0,United Kingdom
540957,2023-01-12,22774,Red Drawer Knob Acrylic Edwardian,11.53,12,15311.0,United Kingdom
540957,2023-01-12,22775,Purple Drawerknob Acrylic Edwardian,11.53,12,15311.0,United Kingdom
540957,2023-01-12,22773,Green Drawer Knob Acrylic Edwardian,11.53,12,15311.0,United Kingdom
540957,2023-01-12,22772,Pink Drawer Knob Acrylic Edwardian,11.53,12,15311.0,United Kingdom
540957,2023-01-12,22845,Vintage Cream Cat Food Container,16.76,2,15311.0,United Kingdom
540957,2023-01-12,22844,Vintage Cream Dog Food Container,18.96,3,15311.0,United Kingdom
540957,2023-01-12,22571,Rocking Horse Red Christmas,11.12,20,15311.0,United Kingdom
540957,2023-01-12,82001S,Silver Record Cover Frame,13.72,24,15311.0,United Kingdom
540957,2023-01-12,85099F,Jumbo Bag Strawberry,6.13,2,15311.0,United Kingdom
