TransactionNo,Date,ProductNo,ProductName,Price,Quantity,CustomerNo,Country
571671,2023-10-18,16008,Small Folding Scissor(Pointed Edge),10.37,48,16940.0,United Kingdom
571671,2023-10-18,84596F,Small Marshmallows Pink Bowl,10.68,8,16940.0,United Kingdom
571671,2023-10-18,20675,Blue Polkadot Bowl,11.53,6,16940.0,United Kingdom
571671,2023-10-18,84596B,Small Dolly Mix Design Orange Bowl,10.68,8,16940.0,United Kingdom
571671,2023-10-18,20676,Red Retrospot Bowl,11.53,7,16940.0,United Kingdom
571671,2023-10-18,20677,Pink Polkadot Bowl,11.53,6,16940.0,United Kingdom
571671,2023-10-18,85199S,Small Hanging Ivory/Red Wood Bird,10.68,12,16940.0,United Kingdom
571671,2023-10-18,22210,Wood Stamp Set Best Wishes,11.1,6,16940.0,United Kingdom
571671,2023-10-18,22208,Wood Stamp Set Thank You,11.1,4,16940.0,United Kingdom
571671,2023-10-18,22209,Wood Stamp Set Happy Birthday,11.1,4,16940.0,United Kingdom
571671,2023-10-18,20752,Blue Polkadot Washing Up Gloves,12.4,6,16940.0,United Kingdom
571671,2023-10-18,22469,Heart Of Wicker Small,11.94,6,16940.0,United Kingdom
571671,2023-10-18,85049C,Romantic Pinks Ribbons,11.53,5,16940.0,United Kingdom
571671,2023-10-18,85049H,Urban Black Ribbons,11.53,6,16940.0,United Kingdom
571671,2023-10-18,85049G,Chocolate Box Ribbons,11.53,6,16940.0,United Kingdom
571671,2023-10-18,85049A,Traditional Christmas Ribbons,11.53,6,16940.0,United Kingdom
571671,2023-10-18,23435,3 Raffia Ribbons Vintage Christmas,11.06,10,16940.0,United Kingdom
571671,2023-10-18,23434,3 Raffia Ribbons 50'S Christmas,11.06,10,16940.0,United Kingdom
571671,2023-10-18,22367,Childrens Apron Spaceboy Design,12.25,4,16940.0,United Kingdom
571671,2023-10-18,21156,Retrospot Childrens Apron,12.25,4,16940.0,United Kingdom
571671,2023-10-18,47591D,Pink Fairy Cake Childrens Apron,12.25,6,16940.0,United Kingdom
571671,2023-10-18,22898,Childrens Apron Apples Design,12.25,2,16940.0,United Kingdom
571671,2023-10-18,22896,Peg Bag Apples Design,12.86,10,16940.0,United Kingdom
571671,2023-10-18,47567B,Tea Time Kitchen Apron,16.35,2,16940.0,United Kingdom
571671,2023-10-18,21041,Red Retrospot Oven Glove Double,13.27,4,16940.0,United Kingdom
571671,2023-10-18,21155,Red Retrospot Peg Bag,12.86,4,16940.0,United Kingdom
571671,2023-10-18,23501,Key Ring Baseball Boot Union Jack,11.53,10,16940.0,United Kingdom
571671,2023-10-18,20983,12 Pencils Tall Tube Red Retrospot,11.12,2,16940.0,United Kingdom
571671,2023-10-18,20973,12 Pencil Small Tube Woodland,10.92,1,16940.0,United Kingdom
571671,2023-10-18,23367,Set 12 Colour Pencils Spaceboy,10.92,2,16940.0,United Kingdom
571671,2023-10-18,23368,Set 12 Colour Pencils Dolly Girl,10.92,2,16940.0,United Kingdom
571671,2023-10-18,22759,Set Of 3 Notebooks In Parcel,11.94,2,16940.0,United Kingdom
571671,2023-10-18,21060,Party Invites Balloon Girl,11.12,2,16940.0,United Kingdom
571671,2023-10-18,21063,Party Invites Jazz Hearts,11.12,4,16940.0,United Kingdom
571671,2023-10-18,22666,Recipe Box Pantry Yellow Design,13.27,4,16940.0,United Kingdom
571671,2023-10-18,21980,Pack Of 12 Red Retrospot Tissues,10.65,12,16940.0,United Kingdom
571671,2023-10-18,21982,Pack Of 12 Suki Tissues,10.65,12,16940.0,United Kingdom
571671,2023-10-18,21985,Pack Of 12 Hearts Design Tissues,10.65,12,16940.0,United Kingdom
571671,2023-10-18,23379,Pack Of 12 Red Apple Tissues,10.65,12,16940.0,United Kingdom
571671,2023-10-18,23551,Pack Of 12 Paisley Park Tissues,10.65,12,16940.0,United Kingdom
571671,2023-10-18,23381,Pack Of 12 Vintage Leaf Tissues,10.65,12,16940.0,United Kingdom
571671,2023-10-18,22943,Christmas Lights 10 Vintage Baubles,15.32,4,16940.0,United Kingdom
571671,2023-10-18,22666,Recipe Box Pantry Yellow Design,13.27,2,16940.0,United Kingdom
571671,2023-10-18,22667,Recipe Box Retrospot,13.27,2,16940.0,United Kingdom
571671,2023-10-18,22665,Recipe Box Blue Sketchbook Design,13.27,4,16940.0,United Kingdom
571671,2023-10-18,22507,Memo Board Retrospot Design,15.32,3,16940.0,United Kingdom
571671,2023-10-18,22189,Cream Heart Card Holder,14.3,8,16940.0,United Kingdom
571671,2023-10-18,23530,Wall Art Only One Person,15.32,2,16940.0,United Kingdom
571671,2023-10-18,23534,Wall Art Stop For Tea,16.35,2,16940.0,United Kingdom
571671,2023-10-18,23300,Gardeners Kneeling Pad Cup Of Tea,11.94,4,16940.0,United Kingdom
571671,2023-10-18,23301,Gardeners Kneeling Pad Keep Calm,11.94,6,16940.0,United Kingdom
571671,2023-10-18,20750,Red Retrospot Mini Cases,18.4,3,16940.0,United Kingdom
571671,2023-10-18,20749,Assorted Colour Mini Cases,18.4,3,16940.0,United Kingdom
571671,2023-10-18,21034,Rex Cash+Carry Jumbo Shopper,11.22,6,16940.0,United Kingdom
571671,2023-10-18,23199,Jumbo Bag Apples,6.19,4,16940.0,United Kingdom
571671,2023-10-18,85099B,Jumbo Bag Red Retrospot,6.19,2,16940.0,United Kingdom
571671,2023-10-18,85099F,Jumbo Bag Strawberry,6.19,4,16940.0,United Kingdom
571671,2023-10-18,23201,Jumbo Bag Alphabet,6.19,4,16940.0,United Kingdom
571671,2023-10-18,23202,Jumbo Bag Vintage Leaf,6.19,4,16940.0,United Kingdom
571671,2023-10-18,22386,Jumbo Bag Pink Polkadot,6.19,4,16940.0,United Kingdom
571671,2023-10-18,85099C,Jumbo Bag Baroque Black White,6.19,4,16940.0,United Kingdom
571671,2023-10-18,23344,Jumbo Bag 50'S Christmas,6.19,4,16940.0,United Kingdom
571671,2023-10-18,23343,Jumbo Bag Vintage Christmas,6.19,4,16940.0,United Kingdom
571671,2023-10-18,22384,Lunch Bag Pink Polkadot,5.97,4,16940.0,United Kingdom
571671,2023-10-18,20725,Lunch Bag Red Retrospot,5.97,6,16940.0,United Kingdom
571671,2023-10-18,20728,Lunch Bag Cars Blue,5.97,6,16940.0,United Kingdom
571671,2023-10-18,23206,Lunch Bag Apple Design,5.97,6,16940.0,United Kingdom
571671,2023-10-18,23208,Lunch Bag Vintage Leaf Design,5.97,6,16940.0,United Kingdom
571671,2023-10-18,22383,Lunch Bag Suki Design,5.97,6,16940.0,United Kingdom
571671,2023-10-18,20727,Lunch Bag Black Skull,5.97,6,16940.0,United Kingdom
571671,2023-10-18,20726,Lunch Bag Woodland,5.97,4,16940.0,United Kingdom
571671,2023-10-18,23207,Lunch Bag Alphabet Design,5.97,6,16940.0,United Kingdom
571672,2023-10-18,23355,Hot Water Bottle Keep Calm,15.32,8,13880.0,United Kingdom
571672,2023-10-18,23434,3 Raffia Ribbons 50'S Christmas,11.06,10,13880.0,United Kingdom
571672,2023-10-18,23319,Box Of 6 Mini 50'S Crackers,12.8,6,13880.0,United Kingdom
571672,2023-10-18,84029E,Red Woolly Hottie White Heart,14.61,12,13880.0,United Kingdom
571672,2023-10-18,84946,Antique Silver T-Light Glass,11.53,12,13880.0,United Kingdom
571672,2023-10-18,22652,Travel Sewing Kit,11.94,10,13880.0,United Kingdom
571672,2023-10-18,22565,Feltcraft Hairbands Pink And White,11.12,24,13880.0,United Kingdom
571672,2023-10-18,20969,Red Floral Feltcraft Shoulder Bag,14.09,8,13880.0,United Kingdom
571672,2023-10-18,22750,Feltcraft Princess Lola Doll,14.09,8,13880.0,United Kingdom
571672,2023-10-18,22632,Hand Warmer Red Retrospot,12.4,12,13880.0,United Kingdom
571672,2023-10-18,22139,Retrospot Tea Set Ceramic 11 Pc,15.32,6,13880.0,United Kingdom
571672,2023-10-18,22577,Wooden Heart Christmas Scandinavian,10.55,24,13880.0,United Kingdom
571672,2023-10-18,23438,Red Spot Gift Bag Large,5.77,12,13880.0,United Kingdom
571673,2023-10-18,21794,Classic French Style Basket Natural,14.3,8,13991.0,United Kingdom
571673,2023-10-18,22577,Wooden Heart Christmas Scandinavian,10.55,24,13991.0,United Kingdom
571673,2023-10-18,22579,Wooden Tree Christmas Scandinavian,10.55,24,13991.0,United Kingdom
571673,2023-10-18,22578,Wooden Star Christmas Scandinavian,10.55,24,13991.0,United Kingdom
571673,2023-10-18,21811,Hanging Heart With Bell,10.65,48,13991.0,United Kingdom
571673,2023-10-18,21810,Christmas Hanging Star With Bell,10.65,48,13991.0,United Kingdom
571673,2023-10-18,22065,Christmas Pudding Trinket Pot,10.65,48,13991.0,United Kingdom
571673,2023-10-18,22649,Strawberry Fairy Cake Teapot,15.32,8,13991.0,United Kingdom
571673,2023-10-18,21809,Christmas Hanging Tree With Bell,10.65,48,13991.0,United Kingdom
571673,2023-10-18,20727,Lunch Bag Black Skull,5.97,10,13991.0,United Kingdom
571673,2023-10-18,22384,Lunch Bag Pink Polkadot,5.97,10,13991.0,United Kingdom
571675,2023-10-18,22112,Chocolate Hot Water Bottle,15.32,12,13700.0,United Kingdom
571675,2023-10-18,22835,Hot Water Bottle I Am So Poorly,15.32,8,13700.0,United Kingdom
571675,2023-10-18,23355,Hot Water Bottle Keep Calm,15.32,8,13700.0,United Kingdom
571675,2023-10-18,22866,Hand Warmer Scotty Dog Design,12.4,12,13700.0,United Kingdom
571675,2023-10-18,22865,Hand Warmer Owl Design,12.4,12,13700.0,United Kingdom
571675,2023-10-18,22834,Hand Warmer Babushka Design,12.4,12,13700.0,United Kingdom
571675,2023-10-18,84347,Rotating Silver Angels T-Light Hldr,12.86,24,13700.0,United Kingdom
571675,2023-10-18,22154,Angel Decoration 3 Buttons,10.68,48,13700.0,United Kingdom
571675,2023-10-18,22909,Set Of 20 Vintage Christmas Napkins,11.12,12,13700.0,United Kingdom
571676,2023-10-18,22842,Biscuit Tin Vintage Red,17.17,1,16910.0,United Kingdom
571676,2023-10-18,22428,Enamel Fire Bucket Cream,17.37,1,16910.0,United Kingdom
571676,2023-10-18,23269,Set Of 2 Ceramic Christmas Trees,11.74,2,16910.0,United Kingdom
571676,2023-10-18,21544,Skulls Water Transfer Tattoos,11.12,2,16910.0,United Kingdom
571676,2023-10-18,22593,Christmas Gingham Star,11.12,1,16910.0,United Kingdom
571676,2023-10-18,23100,Silver Bells Table Decoration,11.53,1,16910.0,United Kingdom
571676,2023-10-18,22892,Set Of Salt And Pepper Toadstools,11.53,1,16910.0,United Kingdom
571676,2023-10-18,23267,Set Of 4 Santa Place Settings,11.53,1,16910.0,United Kingdom
571676,2023-10-18,22594,Christmas Gingham Tree,11.12,2,16910.0,United Kingdom
571676,2023-10-18,23266,Set Of 3 Wooden Stocking Decoration,11.53,1,16910.0,United Kingdom
571676,2023-10-18,23265,Set Of 3 Wooden Tree Decorations,11.53,1,16910.0,United Kingdom
571676,2023-10-18,23333,Ivory Wicker Heart Medium,11.53,2,16910.0,United Kingdom
571676,2023-10-18,23334,Ivory Wicker Heart Small,10.9,1,16910.0,United Kingdom
571676,2023-10-18,23331,Decorative Wicker Heart Small,10.9,2,16910.0,United Kingdom
571676,2023-10-18,23330,Decorative Wicker Heart Medium,11.53,2,16910.0,United Kingdom
571676,2023-10-18,23264,Set Of 3 Wooden Sleigh Decorations,11.53,1,16910.0,United Kingdom
571676,2023-10-18,22578,Wooden Star Christmas Scandinavian,10.55,2,16910.0,United Kingdom
571676,2023-10-18,22601,Christmas Retrospot Angel Wood,11.12,2,16910.0,United Kingdom
571676,2023-10-18,22571,Rocking Horse Red Christmas,11.12,1,16910.0,United Kingdom
571676,2023-10-18,22600,Christmas Retrospot Star Wood,11.12,2,16910.0,United Kingdom
571676,2023-10-18,22603,Christmas Retrospot Tree Wood,11.12,2,16910.0,United Kingdom
571676,2023-10-18,22581,Wood Stocking Christmas Scandispot,11.12,2,16910.0,United Kingdom
571676,2023-10-18,22579,Wooden Tree Christmas Scandinavian,10.55,2,16910.0,United Kingdom
571676,2023-10-18,35970,Zinc Folkart Sleigh Bells,11.98,1,16910.0,United Kingdom
571676,2023-10-18,22173,Metal 4 Hook Hanger French Chateau,13.62,1,16910.0,United Kingdom
571676,2023-10-18,21407,Brown Check Cat Doorstop,14.61,1,16910.0,United Kingdom
571676,2023-10-18,23461,Sweetheart Bird House,14.5,1,16910.0,United Kingdom
571676,2023-10-18,22193,Red Diner Wall Clock,18.96,1,16910.0,United Kingdom
571676,2023-10-18,23342,Mint Diner Wall Clock,18.96,1,16910.0,United Kingdom
571676,2023-10-18,21899,Garage Key Fob,10.92,1,16910.0,United Kingdom
571676,2023-10-18,22429,Enamel Measuring Jug Cream,14.61,1,16910.0,United Kingdom
571676,2023-10-18,22425,Enamel Colander Cream,15.32,1,16910.0,United Kingdom
571676,2023-10-18,21747,Small Skull Windmill,11.53,2,16910.0,United Kingdom
571676,2023-10-18,21750,Large Skull Windmill,12.4,1,16910.0,United Kingdom
571676,2023-10-18,21224,Set/4 Skull Badges,11.53,1,16910.0,United Kingdom
571676,2023-10-18,22100,Skulls Square Tissue Box,10.65,1,16910.0,United Kingdom
571676,2023-10-18,21987,Pack Of 6 Skull Paper Cups,10.92,2,16910.0,United Kingdom
571676,2023-10-18,21988,Pack Of 6 Skull Paper Plates,11.12,2,16910.0,United Kingdom
571676,2023-10-18,21989,Pack Of 20 Skull Paper Napkins,11.12,2,16910.0,United Kingdom
571676,2023-10-18,22437,Set Of 9 Black Skull Balloons,11.12,2,16910.0,United Kingdom
571676,2023-10-18,21213,Pack Of 72 Skull Cake Cases,10.81,1,16910.0,United Kingdom
571676,2023-10-18,22650,Ceramic Pirate Chest Money Bank,11.74,1,16910.0,United Kingdom
571676,2023-10-18,22068,Black Pirate Treasure Chest,11.94,1,16910.0,United Kingdom
571676,2023-10-18,23148,Miniature Antique Rose Hook Ivory,11.1,2,16910.0,United Kingdom
571676,2023-10-18,23147,Single Antique Rose Hook Ivory,11.74,1,16910.0,United Kingdom
571676,2023-10-18,22111,Scottie Dog Hot Water Bottle,15.32,1,16910.0,United Kingdom
571676,2023-10-18,23355,Hot Water Bottle Keep Calm,15.32,1,16910.0,United Kingdom
571676,2023-10-18,21485,Retrospot Heart Hot Water Bottle,15.32,1,16910.0,United Kingdom
571676,2023-10-18,21479,White Skull Hot Water Bottle,14.61,1,16910.0,United Kingdom
571676,2023-10-18,23356,Love Hot Water Bottle,16.35,1,16910.0,United Kingdom
571676,2023-10-18,35648,Vintage Bead Pink Purse,11.1,2,16910.0,United Kingdom
571676,2023-10-18,35646,Vintage Bead Pink Evening Bag,11.53,3,16910.0,United Kingdom
571676,2023-10-18,22620,4 Traditional Spinning Tops,11.74,1,16910.0,United Kingdom
571676,2023-10-18,21207,Skull And Crossbones Garland,11.94,2,16910.0,United Kingdom
571676,2023-10-18,85032C,Curious Images Gift Wrap Set,10.92,1,16910.0,United Kingdom
571676,2023-10-18,85032B,Blossom Images Gift Wrap Set,10.92,1,16910.0,United Kingdom
571676,2023-10-18,85032A,Romantic Images Gift Wrap Set,10.92,1,16910.0,United Kingdom
571676,2023-10-18,85049A,Traditional Christmas Ribbons,11.53,1,16910.0,United Kingdom
571676,2023-10-18,22632,Hand Warmer Red Retrospot,12.4,1,16910.0,United Kingdom
571676,2023-10-18,21900,Key Fob Shed,10.92,1,16910.0,United Kingdom
571676,2023-10-18,22867,Hand Warmer Bird Design,12.4,1,16910.0,United Kingdom
571676,2023-10-18,85049E,Scandinavian Reds Ribbons,11.53,1,16910.0,United Kingdom
571676,2023-10-18,21902,Key Fob Front Door,10.92,1,16910.0,United Kingdom
571676,2023-10-18,21901,Key Fob Back Door,10.92,1,16910.0,United Kingdom
571676,2023-10-18,82581,Toilet Metal Sign,10.81,1,16910.0,United Kingdom
571676,2023-10-18,21171,Bathroom Metal Sign,10.81,1,16910.0,United Kingdom
571676,2023-10-18,22865,Hand Warmer Owl Design,12.4,2,16910.0,United Kingdom
571676,2023-10-18,22866,Hand Warmer Scotty Dog Design,12.4,2,16910.0,United Kingdom
571676,2023-10-18,22557,Plasters In Tin Vintage Paisley,11.94,1,16910.0,United Kingdom
571676,2023-10-18,21889,Wooden Box Of Dominoes,11.53,1,16910.0,United Kingdom
571676,2023-10-18,22077,6 Ribbons Rustic Charm,12.25,2,16910.0,United Kingdom
571676,2023-10-18,21934,Skull Shoulder Bag,11.94,1,16910.0,United Kingdom
571676,2023-10-18,20914,Set/5 Red Retrospot Lid Glass Bowls,13.27,1,16910.0,United Kingdom
571676,2023-10-18,23406,Home Sweet Home Key Holder,16.66,1,16910.0,United Kingdom
571676,2023-10-18,23402,Home Sweet Home 3 Peg Hanger,14.09,1,16910.0,United Kingdom
571676,2023-10-18,22852,Dog Bowl Vintage Cream,14.61,1,16910.0,United Kingdom
571676,2023-10-18,22853,Cat Bowl Vintage Cream,13.58,1,16910.0,United Kingdom
571676,2023-10-18,22625,Red Kitchen Scales,18.96,1,16910.0,United Kingdom
571676,2023-10-18,22627,Mint Kitchen Scales,18.96,1,16910.0,United Kingdom
571676,2023-10-18,22624,Ivory Kitchen Scales,18.96,1,16910.0,United Kingdom
571676,2023-10-18,22694,Wicker Star,12.4,2,16910.0,United Kingdom
571676,2023-10-18,23321,Small White Heart Of Wicker,11.94,3,16910.0,United Kingdom
571676,2023-10-18,22696,Wicker Wreath Large,12.25,2,16910.0,United Kingdom
571676,2023-10-18,22695,Wicker Wreath Small,11.74,2,16910.0,United Kingdom
571676,2023-10-18,23329,Decorative Wicker Heart Large,11.94,2,16910.0,United Kingdom
571676,2023-10-18,22469,Heart Of Wicker Small,11.94,3,16910.0,United Kingdom
571676,2023-10-18,23332,Ivory Wicker Heart Large,11.94,2,16910.0,United Kingdom
571676,2023-10-18,23323,White Wicker Star,12.4,2,16910.0,United Kingdom
571676,2023-10-18,22470,Heart Of Wicker Large,13.27,3,16910.0,United Kingdom
571676,2023-10-18,23343,Jumbo Bag Vintage Christmas,6.19,1,16910.0,United Kingdom
571677,2023-10-18,21535,Red Retrospot Small Milk Jug,12.86,6,13637.0,United Kingdom
571677,2023-10-18,21430,Set/3 Red Gingham Rose Storage Box,14.09,4,13637.0,United Kingdom
571677,2023-10-18,21531,Red Retrospot Sugar Jam Bowl,12.86,6,13637.0,United Kingdom
571677,2023-10-18,22197,Popcorn Holder,11.12,12,13637.0,United Kingdom
571677,2023-10-18,22668,Pink Baby Bunting,13.27,5,13637.0,United Kingdom
571677,2023-10-18,22795,Sweetheart Recipe Book Stand,17.17,2,13637.0,United Kingdom
571677,2023-10-18,22386,Jumbo Bag Pink Polkadot,6.19,10,13637.0,United Kingdom
571677,2023-10-18,22385,Jumbo Bag Spaceboy Design,6.19,10,13637.0,United Kingdom
571679,2023-10-18,23204,Charlotte Bag Apples Design,11.12,5,14159.0,United Kingdom
571679,2023-10-18,22661,Charlotte Bag Dolly Girl Design,11.12,3,14159.0,United Kingdom
571679,2023-10-18,20724,Red Retrospot Charlotte Bag,11.12,5,14159.0,United Kingdom
571679,2023-10-18,22381,Toy Tidy Pink Polkadot,12.4,5,14159.0,United Kingdom
571679,2023-10-18,22379,Recycling Bag Retrospot,12.4,5,14159.0,United Kingdom
571679,2023-10-18,22380,Toy Tidy Spaceboy,12.4,3,14159.0,United Kingdom
571679,2023-10-18,23004,Travel Card Wallet Pantry,10.68,2,14159.0,United Kingdom
571679,2023-10-18,23004,Travel Card Wallet Pantry,10.68,6,14159.0,United Kingdom
571679,2023-10-18,22999,Travel Card Wallet Vintage Leaf,10.68,4,14159.0,United Kingdom
571679,2023-10-18,23000,Travel Card Wallet Transport,10.68,4,14159.0,United Kingdom
571679,2023-10-18,23005,Travel Card Wallet I Love London,10.68,6,14159.0,United Kingdom
571679,2023-10-18,23004,Travel Card Wallet Pantry,10.68,2,14159.0,United Kingdom
571679,2023-10-18,22994,Travel Card Wallet Retrospot,10.68,4,14159.0,United Kingdom
571679,2023-10-18,22996,Travel Card Wallet Vintage Ticket,10.68,6,14159.0,United Kingdom
571679,2023-10-18,22997,Travel Card Wallet Union Jack,10.68,4,14159.0,United Kingdom
571679,2023-10-18,23002,Travel Card Wallet Skulls,10.68,4,14159.0,United Kingdom
571679,2023-10-18,22995,Travel Card Wallet Suki,10.68,4,14159.0,United Kingdom
571679,2023-10-18,20723,Strawberry Charlotte Bag,11.12,1,14159.0,United Kingdom
571679,2023-10-18,22356,Charlotte Bag Pink Polkadot,11.12,1,14159.0,United Kingdom
571679,2023-10-18,22355,Charlotte Bag Suki Design,11.12,5,14159.0,United Kingdom
571679,2023-10-18,23506,Mini Playing Cards Spaceboy,10.68,2,14159.0,United Kingdom
571679,2023-10-18,23508,Mini Playing Cards Dolly Girl,10.68,2,14159.0,United Kingdom
571679,2023-10-18,23509,Mini Playing Cards Fun Fair,10.68,2,14159.0,United Kingdom
571679,2023-10-18,23503,Playing Cards Keep Calm & Carry On,11.53,6,14159.0,United Kingdom
571679,2023-10-18,23504,Playing Cards Jubilee Union Jack,11.53,6,14159.0,United Kingdom
571679,2023-10-18,22356,Charlotte Bag Pink Polkadot,11.12,4,14159.0,United Kingdom
571679,2023-10-18,20723,Strawberry Charlotte Bag,11.12,4,14159.0,United Kingdom
571679,2023-10-18,20719,Woodland Charlotte Bag,11.12,2,14159.0,United Kingdom
571679,2023-10-18,21931,Jumbo Storage Bag Suki,12.38,3,14159.0,United Kingdom
571679,2023-10-18,22661,Charlotte Bag Dolly Girl Design,11.12,2,14159.0,United Kingdom
571679,2023-10-18,22664,Toy Tidy Dolly Girl Design,12.4,3,14159.0,United Kingdom
571679,2023-10-18,23205,Charlotte Bag Vintage Alphabet,11.12,5,14159.0,United Kingdom
571679,2023-10-18,20719,Woodland Charlotte Bag,11.12,3,14159.0,United Kingdom
571679,2023-10-18,23200,Jumbo Bag Pears,6.19,2,14159.0,United Kingdom
571679,2023-10-18,23199,Jumbo Bag Apples,6.19,2,14159.0,United Kingdom
571679,2023-10-18,22386,Jumbo Bag Pink Polkadot,6.19,3,14159.0,United Kingdom
571679,2023-10-18,23203,Jumbo Bag Vintage Doily,6.19,2,14159.0,United Kingdom
571679,2023-10-18,22385,Jumbo Bag Spaceboy Design,6.19,2,14159.0,United Kingdom
571679,2023-10-18,85099B,Jumbo Bag Red Retrospot,6.19,2,14159.0,United Kingdom
571679,2023-10-18,20727,Lunch Bag Black Skull,5.97,1,14159.0,United Kingdom
571679,2023-10-18,20727,Lunch Bag Black Skull,5.97,4,14159.0,United Kingdom
571679,2023-10-18,20728,Lunch Bag Cars Blue,5.97,1,14159.0,United Kingdom
571679,2023-10-18,22382,Lunch Bag Spaceboy Design,5.97,5,14159.0,United Kingdom
571679,2023-10-18,23208,Lunch Bag Vintage Leaf Design,5.97,4,14159.0,United Kingdom
571679,2023-10-18,22662,Lunch Bag Dolly Girl Design,5.97,2,14159.0,United Kingdom
571679,2023-10-18,23208,Lunch Bag Vintage Leaf Design,5.97,1,14159.0,United Kingdom
571679,2023-10-18,20728,Lunch Bag Cars Blue,5.97,4,14159.0,United Kingdom
571679,2023-10-18,22662,Lunch Bag Dolly Girl Design,5.97,3,14159.0,United Kingdom
571681,2023-10-18,23382,Box Of 6 Christmas Cake Decorations,14.09,4,16734.0,United Kingdom
571681,2023-10-18,23503,Playing Cards Keep Calm & Carry On,11.53,12,16734.0,United Kingdom
571681,2023-10-18,23531,Wall Art Big Love,17.37,3,16734.0,United Kingdom
571681,2023-10-18,23537,Wall Art I Love London,15.32,6,16734.0,United Kingdom
571681,2023-10-18,23543,Wall Art Keep Calm,18.71,2,16734.0,United Kingdom
571681,2023-10-18,21015,Dark Bird House Tree Decoration,10.55,24,16734.0,United Kingdom
571681,2023-10-18,21824,Painted Metal Star With Holly Bells,10.65,24,16734.0,United Kingdom
571681,2023-10-18,22577,Wooden Heart Christmas Scandinavian,10.55,24,16734.0,United Kingdom
571681,2023-10-18,22578,Wooden Star Christmas Scandinavian,10.55,24,16734.0,United Kingdom
571681,2023-10-18,17012B,Origami Jasmine Incense/Candle Set,11.12,24,16734.0,United Kingdom
571681,2023-10-18,17012D,Origami Rose Incense/Candle Set,11.12,24,16734.0,United Kingdom
571681,2023-10-18,72800E,4 Ivory Dinner Candles Silver Flock,12.86,6,16734.0,United Kingdom
571681,2023-10-18,23318,Box Of 6 Mini Vintage Crackers,12.8,12,16734.0,United Kingdom
571681,2023-10-18,23319,Box Of 6 Mini 50'S Crackers,12.8,12,16734.0,United Kingdom
571681,2023-10-18,22365,Doormat Respectable House,18.71,2,16734.0,United Kingdom
571681,2023-10-18,22138,Baking Set 9 Piece Retrospot,15.32,3,16734.0,United Kingdom
571681,2023-10-18,22139,Retrospot Tea Set Ceramic 11 Pc,15.32,3,16734.0,United Kingdom
571681,2023-10-18,21888,Bingo Set,14.09,4,16734.0,United Kingdom
571681,2023-10-18,21912,Vintage Snakes & Ladders,14.09,4,16734.0,United Kingdom
571681,2023-10-18,23077,Doughnut Lip Gloss,11.53,20,16734.0,United Kingdom
571682,2023-10-18,21034,Rex Cash+Carry Jumbo Shopper,11.22,1,14179.0,United Kingdom
571682,2023-10-18,22169,Family Album White Picture Frame,18.96,1,14179.0,United Kingdom
571682,2023-10-18,22867,Hand Warmer Bird Design,12.4,2,14179.0,United Kingdom
571682,2023-10-18,23439,Hand Warmer Red Love Heart,12.4,2,14179.0,United Kingdom
571682,2023-10-18,23035,Drawer Knob Ceramic Ivory,11.74,2,14179.0,United Kingdom
571682,2023-10-18,22197,Popcorn Holder,11.12,4,14179.0,United Kingdom
571682,2023-10-18,22352,Lunch Box With Cutlery Retrospot,12.86,1,14179.0,United Kingdom
571682,2023-10-18,23035,Drawer Knob Ceramic Ivory,11.74,24,14179.0,United Kingdom
571682,2023-10-18,23517,Embroidered Ribbon Reel Rebecca,13.21,1,14179.0,United Kingdom
571682,2023-10-18,23518,Embroidered Ribbon Reel Rachel,13.21,1,14179.0,United Kingdom
571682,2023-10-18,23516,Embroidered Ribbon Reel Sophie,14.09,1,14179.0,United Kingdom
571682,2023-10-18,23100,Silver Bells Table Decoration,11.53,1,14179.0,United Kingdom
571682,2023-10-18,23177,Treasure Island Book Box,12.56,1,14179.0,United Kingdom
571682,2023-10-18,23193,Buffalo Bill Treasure Book Box,12.56,1,14179.0,United Kingdom
571682,2023-10-18,23176,Abc Treasure Book Box,12.56,1,14179.0,United Kingdom
571682,2023-10-18,22086,Paper Chain Kit 50'S Christmas,13.27,1,14179.0,United Kingdom
571682,2023-10-18,22734,Set Of 6 Ribbons Vintage Christmas,13.21,1,14179.0,United Kingdom
571682,2023-10-18,22866,Hand Warmer Scotty Dog Design,12.4,1,14179.0,United Kingdom
571682,2023-10-18,22457,Natural Slate Heart Chalkboard,13.27,1,14179.0,United Kingdom
571682,2023-10-18,23182,Toilet Sign Occupied Or Vacant,11.1,1,14179.0,United Kingdom
571682,2023-10-18,21070,Vintage Billboard Mug,11.53,1,14179.0,United Kingdom
571682,2023-10-18,23205,Charlotte Bag Vintage Alphabet,11.12,1,14179.0,United Kingdom
571682,2023-10-18,23328,Set 6 School Milk Bottles In Crate,14.09,1,14179.0,United Kingdom
571682,2023-10-18,22667,Recipe Box Retrospot,13.27,1,14179.0,United Kingdom
571682,2023-10-18,22665,Recipe Box Blue Sketchbook Design,13.27,1,14179.0,United Kingdom
571682,2023-10-18,22666,Recipe Box Pantry Yellow Design,13.27,1,14179.0,United Kingdom
571682,2023-10-18,22139,Retrospot Tea Set Ceramic 11 Pc,15.32,1,14179.0,United Kingdom
571682,2023-10-18,23355,Hot Water Bottle Keep Calm,15.32,1,14179.0,United Kingdom
571682,2023-10-18,22835,Hot Water Bottle I Am So Poorly,15.32,1,14179.0,United Kingdom
571682,2023-10-18,22111,Scottie Dog Hot Water Bottle,15.32,1,14179.0,United Kingdom
571682,2023-10-18,22380,Toy Tidy Spaceboy,12.4,1,14179.0,United Kingdom
571682,2023-10-18,22114,Hot Water Bottle Tea And Sympathy,14.61,1,14179.0,United Kingdom
571682,2023-10-18,22381,Toy Tidy Pink Polkadot,12.4,1,14179.0,United Kingdom
571682,2023-10-18,48194,Doormat Hearts,18.71,1,14179.0,United Kingdom
571682,2023-10-18,23284,Doormat Keep Calm And Come In,18.71,2,14179.0,United Kingdom
571682,2023-10-18,21524,Doormat Spotty Home Sweet Home,18.71,1,14179.0,United Kingdom
571682,2023-10-18,21523,Doormat Fancy Font Home Sweet Home,18.71,1,14179.0,United Kingdom
571682,2023-10-18,22470,Heart Of Wicker Large,13.27,2,14179.0,United Kingdom
571682,2023-10-18,23322,Large White Heart Of Wicker,13.27,2,14179.0,United Kingdom
571682,2023-10-18,22650,Ceramic Pirate Chest Money Bank,11.74,1,14179.0,United Kingdom
571682,2023-10-18,22069,Brown Pirate Treasure Chest,11.94,1,14179.0,United Kingdom
571682,2023-10-18,15056P,Edwardian Parasol Pink,16.35,1,14179.0,United Kingdom
571682,2023-10-18,20679,Edwardian Parasol Red,16.35,1,14179.0,United Kingdom
571682,2023-10-18,15056N,Edwardian Parasol Natural,16.35,1,14179.0,United Kingdom
