TransactionNo,Date,ProductNo,ProductName,Price,Quantity,CustomerNo,Country
566008,2023-09-08,22555,Plasters In Tin Strongman,11.94,1,16426.0,United Kingdom
566008,2023-09-08,22554,Plasters In Tin Woodland Animals,11.94,1,16426.0,United Kingdom
566008,2023-09-08,23181,Bull Dog Bottle Top Wall Clock,18.71,1,16426.0,United Kingdom
566008,2023-09-08,22386,Jumbo Bag Pink Polkadot,6.19,2,16426.0,United Kingdom
566008,2023-09-08,20712,Jumbo Bag Woodland Animals,6.19,2,16426.0,United Kingdom
566008,2023-09-08,22385,Jumbo Bag Spaceboy Design,6.19,2,16426.0,United Kingdom
566008,2023-09-08,85099B,Jumbo Bag Red Retrospot,6.19,2,16426.0,United Kingdom
566008,2023-09-08,85099F,Jumbo Bag Strawberry,6.19,2,16426.0,United Kingdom
566008,2023-09-08,20711,Jumbo Bag Toys,6.19,2,16426.0,United Kingdom
566008,2023-09-08,21929,Jumbo Bag Pink Vintage Paisley,6.19,2,16426.0,United Kingdom
566008,2023-09-08,85099C,Jumbo Bag Baroque Black White,6.19,2,16426.0,United Kingdom
566008,2023-09-08,23202,Jumbo Bag Vintage Leaf,6.19,2,16426.0,United Kingdom
566009,2023-09-08,21790,Vintage Snap Cards,10.99,72,16076.0,United Kingdom
566010,2023-09-08,22959,Wrap Christmas Village,10.68,25,13700.0,United Kingdom
566010,2023-09-08,23232,Wrap Vintage Leaf Design,10.68,25,13700.0,United Kingdom
566010,2023-09-08,16169E,Wrap 50'S Christmas,10.68,25,13700.0,United Kingdom
566010,2023-09-08,22909,Set Of 20 Vintage Christmas Napkins,11.12,6,13700.0,United Kingdom
566010,2023-09-08,23198,Pantry Magnetic Shopping List,11.74,1,13700.0,United Kingdom
566010,2023-09-08,22940,Feltcraft Christmas Fairy,14.61,4,13700.0,United Kingdom
566010,2023-09-08,23275,Set Of 3 Hanging Owls Ollie Beak,11.53,12,13700.0,United Kingdom
566010,2023-09-08,22950,36 Doilies Vintage Christmas,11.74,6,13700.0,United Kingdom
566010,2023-09-08,23264,Set Of 3 Wooden Sleigh Decorations,11.53,4,13700.0,United Kingdom
566010,2023-09-08,22155,Star Decoration Rustic,10.68,12,13700.0,United Kingdom
566010,2023-09-08,23354,6 Gift Tags 50'S Christmas,11.1,6,13700.0,United Kingdom
566010,2023-09-08,22572,Rocking Horse Green Christmas,11.12,6,13700.0,United Kingdom
566010,2023-09-08,22571,Rocking Horse Red Christmas,11.12,6,13700.0,United Kingdom
566010,2023-09-08,22154,Angel Decoration 3 Buttons,10.68,12,13700.0,United Kingdom
566010,2023-09-08,23267,Set Of 4 Santa Place Settings,11.53,4,13700.0,United Kingdom
566010,2023-09-08,22748,Poppy's Playhouse Kitchen,12.4,1,13700.0,United Kingdom
566010,2023-09-08,22746,Poppy's Playhouse Livingroom,12.4,1,13700.0,United Kingdom
566010,2023-09-08,22141,Christmas Craft Tree Top Angel,12.4,6,13700.0,United Kingdom
566010,2023-09-08,20618,Queen Of The Skies Passport Cover,12.4,2,13700.0,United Kingdom
566010,2023-09-08,20655,Queen Of Skies Luggage Tag,11.53,2,13700.0,United Kingdom
566010,2023-09-08,22745,Poppy's Playhouse Bedroom,12.4,2,13700.0,United Kingdom
566010,2023-09-08,35933,Pink Stocking Christmas Decoration,10.64,24,13700.0,United Kingdom
566010,2023-09-08,21915,Red Harmonica In Box,11.53,3,13700.0,United Kingdom
566010,2023-09-08,21914,Blue Harmonica In Box,11.53,3,13700.0,United Kingdom
566010,2023-09-08,85071D,Charlie+Lola My Room Door Sign,10.65,4,13700.0,United Kingdom
566010,2023-09-08,85071C,"Charlie+Lola""Extremely Busy"" Sign",10.65,6,13700.0,United Kingdom
566010,2023-09-08,85227,Set Of 6 3d Kit Cards For Kids,11.12,6,13700.0,United Kingdom
566010,2023-09-08,21481,Fawn Blue Hot Water Bottle,14.09,2,13700.0,United Kingdom
566010,2023-09-08,22865,Hand Warmer Owl Design,12.4,2,13700.0,United Kingdom
566010,2023-09-08,22866,Hand Warmer Scotty Dog Design,12.4,2,13700.0,United Kingdom
566010,2023-09-08,22834,Hand Warmer Babushka Design,12.4,2,13700.0,United Kingdom
566010,2023-09-08,21174,Pottering In The Shed Metal Sign,12.38,2,13700.0,United Kingdom
566010,2023-09-08,21181,Please One Person Metal Sign,12.4,2,13700.0,United Kingdom
566010,2023-09-08,85152,Hand Over The Chocolate Sign,12.4,4,13700.0,United Kingdom
566010,2023-09-08,22112,Chocolate Hot Water Bottle,15.32,2,13700.0,United Kingdom
566010,2023-09-08,22835,Hot Water Bottle I Am So Poorly,15.32,2,13700.0,United Kingdom
566010,2023-09-08,23355,Hot Water Bottle Keep Calm,15.32,2,13700.0,United Kingdom
566010,2023-09-08,22111,Scottie Dog Hot Water Bottle,15.32,2,13700.0,United Kingdom
566010,2023-09-08,22715,Card Wedding Day,10.68,12,13700.0,United Kingdom
566010,2023-09-08,22030,Swallows Greeting Card,10.68,12,13700.0,United Kingdom
566010,2023-09-08,22026,Banquet Birthday Card,10.68,12,13700.0,United Kingdom
566010,2023-09-08,22983,Card Billboard Font,10.68,12,13700.0,United Kingdom
566010,2023-09-08,22028,Penny Farthing Birthday Card,10.68,12,13700.0,United Kingdom
566010,2023-09-08,22031,Botanical Lavender Birthday Card,10.68,12,13700.0,United Kingdom
566010,2023-09-08,22024,Rainy Ladies Birthday Card,10.68,12,13700.0,United Kingdom
566010,2023-09-08,84247N,Pack/12 Blue Folkart Cards,13.27,1,13700.0,United Kingdom
566010,2023-09-08,20972,Pink Cream Felt Craft Trinket Box,11.53,4,13700.0,United Kingdom
566010,2023-09-08,22659,Lunch Box I Love London,12.25,1,13700.0,United Kingdom
566010,2023-09-08,23551,Pack Of 12 Paisley Park Tissues,10.65,24,13700.0,United Kingdom
566010,2023-09-08,23377,Pack Of 12 Dolly Girl Tissues,10.65,36,13700.0,United Kingdom
566010,2023-09-08,22306,Silver Mug Bone China Tree Of Life,11.53,6,13700.0,United Kingdom
566010,2023-09-08,84347,Rotating Silver Angels T-Light Hldr,12.86,6,13700.0,United Kingdom
566010,2023-09-08,22732,3d Vintage Christmas Stickers,11.53,18,13700.0,United Kingdom
566010,2023-09-08,21116,Owl Doorstop,15.32,1,13700.0,United Kingdom
566010,2023-09-08,23300,Gardeners Kneeling Pad Cup Of Tea,11.94,2,13700.0,United Kingdom
566010,2023-09-08,23301,Gardeners Kneeling Pad Keep Calm,11.94,2,13700.0,United Kingdom
566010,2023-09-08,22355,Charlotte Bag Suki Design,11.12,10,13700.0,United Kingdom
566010,2023-09-08,22661,Charlotte Bag Dolly Girl Design,11.12,15,13700.0,United Kingdom
566013,2023-09-08,23351,Roll Wrap 50'S Christmas,11.53,1,17004.0,United Kingdom
566013,2023-09-08,23354,6 Gift Tags 50'S Christmas,11.1,1,17004.0,United Kingdom
566013,2023-09-08,22734,Set Of 6 Ribbons Vintage Christmas,13.21,1,17004.0,United Kingdom
566013,2023-09-08,22551,Plasters In Tin Spaceboy,11.94,24,17004.0,United Kingdom
566013,2023-09-08,22553,Plasters In Tin Skulls,11.94,24,17004.0,United Kingdom
566013,2023-09-08,22557,Plasters In Tin Vintage Paisley,11.94,24,17004.0,United Kingdom
566013,2023-09-08,22554,Plasters In Tin Woodland Animals,11.94,24,17004.0,United Kingdom
566013,2023-09-08,22865,Hand Warmer Owl Design,12.4,48,17004.0,United Kingdom
566013,2023-09-08,22633,Hand Warmer Union Jack,12.4,48,17004.0,United Kingdom
566013,2023-09-08,22865,Hand Warmer Owl Design,12.4,48,17004.0,United Kingdom
566013,2023-09-08,23247,Biscuit Tin 50'S Christmas,13.21,2,17004.0,United Kingdom
566013,2023-09-08,23439,Hand Warmer Red Love Heart,12.4,12,17004.0,United Kingdom
566013,2023-09-08,21706,Folding Umbrella Red/White Polkadot,15.32,1,17004.0,United Kingdom
566013,2023-09-08,21833,Camouflage Led Torch,11.78,180,17004.0,United Kingdom
566013,2023-09-08,21882,Skulls Tape,10.92,12,17004.0,United Kingdom
566013,2023-09-08,21879,Hearts Gift Tape,10.92,12,17004.0,United Kingdom
566013,2023-09-08,21884,Cakes And Bows Gift Tape,10.92,36,17004.0,United Kingdom
566013,2023-09-08,21883,Stars Gift Tape,10.92,12,17004.0,United Kingdom
566013,2023-09-08,21930,Jumbo Storage Bag Skulls,12.38,10,17004.0,United Kingdom
566013,2023-09-08,23201,Jumbo Bag Alphabet,6.19,10,17004.0,United Kingdom
566013,2023-09-08,22385,Jumbo Bag Spaceboy Design,6.19,10,17004.0,United Kingdom
566013,2023-09-08,22386,Jumbo Bag Pink Polkadot,6.19,10,17004.0,United Kingdom
566013,2023-09-08,23203,Jumbo Bag Vintage Doily,6.19,20,17004.0,United Kingdom
566013,2023-09-08,21929,Jumbo Bag Pink Vintage Paisley,6.19,10,17004.0,United Kingdom
566013,2023-09-08,21928,Jumbo Bag Scandinavian Blue Paisley,6.19,20,17004.0,United Kingdom
566013,2023-09-08,23437,50'S Christmas Gift Bag Large,5.77,2,17004.0,United Kingdom
566014,2023-09-08,21901,Key Fob Back Door,10.92,18,14688.0,United Kingdom
566014,2023-09-08,21900,Key Fob Shed,10.92,5,14688.0,United Kingdom
566014,2023-09-08,21899,Garage Key Fob,10.92,6,14688.0,United Kingdom
566014,2023-09-08,21902,Key Fob Front Door,10.92,15,14688.0,United Kingdom
566014,2023-09-08,22953,Birthday Party Cordon Barrier Tape,11.53,10,14688.0,United Kingdom
566014,2023-09-08,22997,Travel Card Wallet Union Jack,10.68,24,14688.0,United Kingdom
566014,2023-09-08,21558,Skull Lunch Box With Cutlery,12.86,1,14688.0,United Kingdom
566014,2023-09-08,21770,Open Closed Metal Sign,15.32,24,14688.0,United Kingdom
566014,2023-09-08,22379,Recycling Bag Retrospot,12.4,30,14688.0,United Kingdom
566014,2023-09-08,21934,Skull Shoulder Bag,11.94,30,14688.0,United Kingdom
566014,2023-09-08,82551,Laundry 15c Metal Sign,11.74,7,14688.0,United Kingdom
566014,2023-09-08,21935,Suki Shoulder Bag,11.94,30,14688.0,United Kingdom
566014,2023-09-08,20711,Jumbo Bag Toys,6.19,5,14688.0,United Kingdom
566015,2023-09-08,21162,Toxic Area Door Hanger,10.65,24,16426.0,United Kingdom
566015,2023-09-08,21158,Moody Girl Door Hanger,10.65,24,16426.0,United Kingdom
566015,2023-09-08,21163,Do Not Touch My Stuff Door Hanger,10.65,24,16426.0,United Kingdom
566015,2023-09-08,22470,Heart Of Wicker Large,13.27,2,16426.0,United Kingdom
566015,2023-09-08,23322,Large White Heart Of Wicker,13.27,4,16426.0,United Kingdom
566016,2023-09-08,22693,Grow A Flytrap Or Sunflower In Tin,11.53,24,15144.0,United Kingdom
566016,2023-09-08,22970,London Bus Coffee Mug,12.86,12,15144.0,United Kingdom
566016,2023-09-08,22557,Plasters In Tin Vintage Paisley,11.94,12,15144.0,United Kingdom
566016,2023-09-08,22551,Plasters In Tin Spaceboy,11.94,12,15144.0,United Kingdom
566016,2023-09-08,22556,Plasters In Tin Circus Parade,11.94,24,15144.0,United Kingdom
566016,2023-09-08,22554,Plasters In Tin Woodland Animals,11.94,24,15144.0,United Kingdom
566016,2023-09-08,23128,Feltcraft Boy Jean-Paul Kit,15.32,4,15144.0,United Kingdom
566016,2023-09-08,23127,Feltcraft Girl Nicole Kit,15.32,4,15144.0,United Kingdom
566016,2023-09-08,23126,Feltcraft Girl Amelie Kit,15.32,4,15144.0,United Kingdom
566016,2023-09-08,84029G,Knitted Union Flag Hot Water Bottle,14.09,8,15144.0,United Kingdom
566016,2023-09-08,21980,Pack Of 12 Red Retrospot Tissues,10.55,24,15144.0,United Kingdom
566016,2023-09-08,22616,Pack Of 12 London Tissues,10.55,24,15144.0,United Kingdom
566016,2023-09-08,21985,Pack Of 12 Hearts Design Tissues,10.55,24,15144.0,United Kingdom
566016,2023-09-08,21982,Pack Of 12 Suki Tissues,10.55,24,15144.0,United Kingdom
566016,2023-09-08,21981,Pack Of 12 Woodland Tissues,10.55,24,15144.0,United Kingdom
566016,2023-09-08,22350,Illustrated Cat Bowl,12.86,12,15144.0,United Kingdom
566016,2023-09-08,22349,Dog Bowl Chasing Ball Design,14.09,12,15144.0,United Kingdom
566016,2023-09-08,21977,Pack Of 60 Pink Paisley Cake Cases,10.81,24,15144.0,United Kingdom
566016,2023-09-08,21975,Pack Of 60 Dinosaur Cake Cases,10.81,24,15144.0,United Kingdom
566016,2023-09-08,84992,72 Sweetheart Fairy Cake Cases,10.81,24,15144.0,United Kingdom
566016,2023-09-08,22417,Pack Of 60 Spaceboy Cake Cases,10.81,24,15144.0,United Kingdom
566016,2023-09-08,84991,60 Teatime Fairy Cake Cases,10.81,24,15144.0,United Kingdom
566016,2023-09-08,21212,Pack Of 72 Retrospot Cake Cases,10.81,24,15144.0,United Kingdom
566016,2023-09-08,22897,Oven Mitt Apples Design,11.74,30,15144.0,United Kingdom
566016,2023-09-08,22726,Alarm Clock Bakelike Green,14.09,4,15144.0,United Kingdom
566016,2023-09-08,22725,Alarm Clock Bakelike Chocolate,14.09,4,15144.0,United Kingdom
566016,2023-09-08,22730,Alarm Clock Bakelike Ivory,14.09,4,15144.0,United Kingdom
566016,2023-09-08,22729,Alarm Clock Bakelike Orange,14.09,4,15144.0,United Kingdom
566016,2023-09-08,22728,Alarm Clock Bakelike Pink,14.09,4,15144.0,United Kingdom
566016,2023-09-08,22727,Alarm Clock Bakelike Red,14.09,4,15144.0,United Kingdom
566017,2023-09-08,20992,Jazz Hearts Purse Notebook,10.65,24,13330.0,United Kingdom
566017,2023-09-08,21369,Mirrored Wall Art Splodges,11.53,12,13330.0,United Kingdom
566017,2023-09-08,21365,Mirrored Wall Art Stars,11.02,12,13330.0,United Kingdom
566017,2023-09-08,21374,Mirrored Wall Art Skulls,11.53,12,13330.0,United Kingdom
566017,2023-09-08,21373,Mirrored Wall Art Snowflakes,11.02,12,13330.0,United Kingdom
566017,2023-09-08,22210,Wood Stamp Set Best Wishes,11.1,12,13330.0,United Kingdom
566017,2023-09-08,22211,Wood Stamp Set Flowers,11.1,12,13330.0,United Kingdom
566017,2023-09-08,22610,Pens Assorted Funny Face,10.44,72,13330.0,United Kingdom
566017,2023-09-08,23287,Red Vintage Spot Beaker,11.12,8,13330.0,United Kingdom
566017,2023-09-08,22139,Retrospot Tea Set Ceramic 11 Pc,15.32,6,13330.0,United Kingdom
566017,2023-09-08,22433,Watering Can Green Dinosaur,12.25,12,13330.0,United Kingdom
566017,2023-09-08,22431,Watering Can Blue Elephant,12.25,12,13330.0,United Kingdom
566017,2023-09-08,22489,Pack Of 12 Traditional Crayons,10.68,24,13330.0,United Kingdom
566017,2023-09-08,21931,Jumbo Storage Bag Suki,12.38,10,13330.0,United Kingdom
566017,2023-09-08,21242,Red Retrospot Plate,11.98,8,13330.0,United Kingdom
566017,2023-09-08,23035,Drawer Knob Ceramic Ivory,11.74,12,13330.0,United Kingdom
566017,2023-09-08,22386,Jumbo Bag Pink Polkadot,6.19,10,13330.0,United Kingdom
566017,2023-09-08,23201,Jumbo Bag Alphabet,6.19,10,13330.0,United Kingdom
566017,2023-09-08,21929,Jumbo Bag Pink Vintage Paisley,6.19,10,13330.0,United Kingdom
566017,2023-09-08,22385,Jumbo Bag Spaceboy Design,6.19,10,13330.0,United Kingdom
566017,2023-09-08,20728,Lunch Bag Cars Blue,5.97,10,13330.0,United Kingdom
566017,2023-09-08,22382,Lunch Bag Spaceboy Design,5.97,10,13330.0,United Kingdom
566017,2023-09-08,22383,Lunch Bag Suki Design,5.97,10,13330.0,United Kingdom
566017,2023-09-08,22384,Lunch Bag Pink Polkadot,5.97,10,13330.0,United Kingdom
566017,2023-09-08,23207,Lunch Bag Alphabet Design,5.97,10,13330.0,United Kingdom
566018,2023-09-08,82583,Hot Baths Metal Sign,12.4,1,13137.0,United Kingdom
566018,2023-09-08,22080,Ribbon Reel Polkadots,11.94,1,13137.0,United Kingdom
566018,2023-09-08,21705,Bag 500g Swirly Marbles,11.94,1,13137.0,United Kingdom
566018,2023-09-08,20677,Pink Polkadot Bowl,11.53,1,13137.0,United Kingdom
566018,2023-09-08,20676,Red Retrospot Bowl,11.53,1,13137.0,United Kingdom
566018,2023-09-08,20675,Blue Polkadot Bowl,11.53,1,13137.0,United Kingdom
566018,2023-09-08,20674,Green Polkadot Bowl,11.53,1,13137.0,United Kingdom
566018,2023-09-08,22211,Wood Stamp Set Flowers,11.1,4,13137.0,United Kingdom
566018,2023-09-08,85185B,Pink Horse Sock Puppet Kit,13.27,2,13137.0,United Kingdom
566018,2023-09-08,23126,Feltcraft Girl Amelie Kit,15.32,1,13137.0,United Kingdom
566018,2023-09-08,20675,Blue Polkadot Bowl,11.53,1,13137.0,United Kingdom
566018,2023-09-08,20674,Green Polkadot Bowl,11.53,1,13137.0,United Kingdom
566018,2023-09-08,20677,Pink Polkadot Bowl,11.53,1,13137.0,United Kingdom
566018,2023-09-08,20676,Red Retrospot Bowl,11.53,1,13137.0,United Kingdom
566018,2023-09-08,22211,Wood Stamp Set Flowers,11.1,1,13137.0,United Kingdom
566018,2023-09-08,22208,Wood Stamp Set Thank You,11.1,1,13137.0,United Kingdom
566018,2023-09-08,85185B,Pink Horse Sock Puppet Kit,13.27,1,13137.0,United Kingdom
566018,2023-09-08,85185B,Pink Horse Sock Puppet Kit,13.27,1,13137.0,United Kingdom
566018,2023-09-08,23236,Storage Tin Vintage Doily,13.21,2,13137.0,United Kingdom
566018,2023-09-08,84997B,Childrens Cutlery Retrospot Red,14.5,1,13137.0,United Kingdom
566018,2023-09-08,84997C,Childrens Cutlery Polkadot Blue,14.5,1,13137.0,United Kingdom
566018,2023-09-08,22297,Heart Ivory Trellis Small,11.53,12,13137.0,United Kingdom
566018,2023-09-08,21671,Red Spot Ceramic Drawer Knob,11.74,2,13137.0,United Kingdom
566018,2023-09-08,21669,Blue Stripe Ceramic Drawer Knob,11.74,2,13137.0,United Kingdom
566018,2023-09-08,21672,White Spot Red Ceramic Drawer Knob,11.74,2,13137.0,United Kingdom
566018,2023-09-08,21673,White Spot Blue Ceramic Drawer Knob,11.74,2,13137.0,United Kingdom
566018,2023-09-08,21668,Red Stripe Ceramic Drawer Knob,11.74,2,13137.0,United Kingdom
566018,2023-09-08,21670,Blue Spot Ceramic Drawer Knob,11.74,2,13137.0,United Kingdom
566018,2023-09-08,23035,Drawer Knob Ceramic Ivory,11.74,2,13137.0,United Kingdom
566018,2023-09-08,23321,Small White Heart Of Wicker,11.94,13,13137.0,United Kingdom
566018,2023-09-08,23322,Large White Heart Of Wicker,13.27,3,13137.0,United Kingdom
566018,2023-09-08,22694,Wicker Star,12.4,2,13137.0,United Kingdom
566018,2023-09-08,23323,White Wicker Star,12.4,3,13137.0,United Kingdom
566018,2023-09-08,23332,Ivory Wicker Heart Large,11.94,5,13137.0,United Kingdom
566018,2023-09-08,23329,Decorative Wicker Heart Large,11.94,5,13137.0,United Kingdom
566018,2023-09-08,35961,Folkart Zinc Heart Christmas Dec,11.12,10,13137.0,United Kingdom
566018,2023-09-08,22600,Christmas Retrospot Star Wood,11.12,10,13137.0,United Kingdom
566018,2023-09-08,22602,Retrospot Wooden Heart Decoration,11.12,10,13137.0,United Kingdom
566018,2023-09-08,23281,Folding Butterfly Mirror Red,11.1,2,13137.0,United Kingdom
566018,2023-09-08,23280,Folding Butterfly Mirror Hot Pink,11.1,2,13137.0,United Kingdom
566018,2023-09-08,22577,Wooden Heart Christmas Scandinavian,11.12,1,13137.0,United Kingdom
566018,2023-09-08,22595,Gingham Heart Decoration,11.12,1,13137.0,United Kingdom
566018,2023-09-08,84997D,Childrens Cutlery Polkadot Pink,14.5,2,13137.0,United Kingdom
566018,2023-09-08,23236,Storage Tin Vintage Doily,13.21,2,13137.0,United Kingdom
566018,2023-09-08,23241,Treasure Tin Gymkhana Design,12.38,3,13137.0,United Kingdom
566018,2023-09-08,22595,Gingham Heart Decoration,11.12,4,13137.0,United Kingdom
566018,2023-09-08,22348,Tea Bag Plate Red Retrospot,11.12,4,13137.0,United Kingdom
566018,2023-09-08,22577,Wooden Heart Christmas Scandinavian,11.12,5,13137.0,United Kingdom
566018,2023-09-08,22296,Heart Ivory Trellis Large,11.94,12,13137.0,United Kingdom
566018,2023-09-08,22294,Heart Filigree Dove Small,11.53,4,13137.0,United Kingdom
566018,2023-09-08,22295,Heart Filigree Dove Large,11.94,4,13137.0,United Kingdom
566018,2023-09-08,21770,Open Closed Metal Sign,15.32,2,13137.0,United Kingdom
566018,2023-09-08,21533,Retrospot Large Milk Jug,15.32,2,13137.0,United Kingdom
566018,2023-09-08,21535,Red Retrospot Small Milk Jug,12.86,2,13137.0,United Kingdom
566018,2023-09-08,22964,3 Piece Spaceboy Cookie Cutter Set,12.4,4,13137.0,United Kingdom
566018,2023-09-08,22966,Gingerbread Man Cookie Cutter,11.53,4,13137.0,United Kingdom
566018,2023-09-08,22329,Round Container Set Of 5 Retrospot,11.94,3,13137.0,United Kingdom
566018,2023-09-08,21992,Vintage Paisley Stationery Set,11.53,4,13137.0,United Kingdom
566018,2023-09-08,21990,Modern Floral Stationery Set,11.53,4,13137.0,United Kingdom
566018,2023-09-08,21993,Floral Folk Stationery Set,11.53,4,13137.0,United Kingdom
566018,2023-09-08,22911,Paper Chain Kit London,13.27,2,13137.0,United Kingdom
566018,2023-09-08,23350,Roll Wrap Vintage Spot,11.53,3,13137.0,United Kingdom
566018,2023-09-08,22726,Alarm Clock Bakelike Green,14.09,2,13137.0,United Kingdom
566018,2023-09-08,22727,Alarm Clock Bakelike Red,14.09,4,13137.0,United Kingdom
566018,2023-09-08,22728,Alarm Clock Bakelike Pink,14.09,3,13137.0,United Kingdom
566018,2023-09-08,48187,Doormat New England,18.71,1,13137.0,United Kingdom
566018,2023-09-08,84077,World War 2 Gliders Asstd Designs,10.55,48,13137.0,United Kingdom
566018,2023-09-08,85014B,Red Retrospot Umbrella,16.35,2,13137.0,United Kingdom
566018,2023-09-08,85014A,Black/Blue Polkadot Umbrella,16.35,2,13137.0,United Kingdom
566018,2023-09-08,21930,Jumbo Storage Bag Skulls,12.38,3,13137.0,United Kingdom
566018,2023-09-08,22377,Bottle Bag Retrospot,12.4,7,13137.0,United Kingdom
566018,2023-09-08,22381,Toy Tidy Pink Polkadot,12.4,3,13137.0,United Kingdom
566018,2023-09-08,23200,Jumbo Bag Pears,6.19,4,13137.0,United Kingdom
566018,2023-09-08,23199,Jumbo Bag Apples,6.19,4,13137.0,United Kingdom
566018,2023-09-08,23203,Jumbo Bag Vintage Doily,6.19,4,13137.0,United Kingdom
566018,2023-09-08,22386,Jumbo Bag Pink Polkadot,6.19,2,13137.0,United Kingdom
566018,2023-09-08,85099B,Jumbo Bag Red Retrospot,6.19,2,13137.0,United Kingdom
566018,2023-09-08,20727,Lunch Bag Black Skull,5.97,4,13137.0,United Kingdom
566018,2023-09-08,23208,Lunch Bag Vintage Leaf Design,5.97,4,13137.0,United Kingdom
566018,2023-09-08,23209,Lunch Bag Vintage Doily,5.97,4,13137.0,United Kingdom
566018,2023-09-08,20725,Lunch Bag Red Retrospot,5.97,5,13137.0,United Kingdom
566019,2023-09-08,84029G,Knitted Union Flag Hot Water Bottle,14.61,2,17243.0,United Kingdom
566019,2023-09-08,84029E,Red Woolly Hottie White Heart,14.61,2,17243.0,United Kingdom
566019,2023-09-08,22904,Calendar Paper Cut Design,13.27,2,17243.0,United Kingdom
566019,2023-09-08,23355,Hot Water Bottle Keep Calm,15.32,1,17243.0,United Kingdom
566019,2023-09-08,23357,Hot Water Bottle Sex Bomb,15.32,2,17243.0,United Kingdom
566019,2023-09-08,82484,Wood Black Board Ant White Finish,18.4,5,17243.0,United Kingdom
566019,2023-09-08,23184,Bull Dog Bottle Opener,15.32,3,17243.0,United Kingdom
566019,2023-09-08,21034,Rex Cash+Carry Jumbo Shopper,11.22,2,17243.0,United Kingdom
566019,2023-09-08,82486,3 Drawer Antique White Wood Cabinet,19.42,2,17243.0,United Kingdom
566019,2023-09-08,23412,Heart Mirror Antique White,17.94,4,17243.0,United Kingdom
566019,2023-09-08,84836,Zinc Metal Heart Decoration,11.53,12,17243.0,United Kingdom
566019,2023-09-08,23092,Large Antique White Photo Frame,18.35,2,17243.0,United Kingdom
566019,2023-09-08,23357,Hot Water Bottle Sex Bomb,15.32,2,17243.0,United Kingdom
566019,2023-09-08,23355,Hot Water Bottle Keep Calm,15.32,3,17243.0,United Kingdom
566019,2023-09-08,84029G,Knitted Union Flag Hot Water Bottle,14.61,4,17243.0,United Kingdom
566019,2023-09-08,84029E,Red Woolly Hottie White Heart,14.61,2,17243.0,United Kingdom
566019,2023-09-08,22904,Calendar Paper Cut Design,13.27,4,17243.0,United Kingdom
566019,2023-09-08,22112,Chocolate Hot Water Bottle,15.32,2,17243.0,United Kingdom
566019,2023-09-08,22633,Hand Warmer Union Jack,12.4,6,17243.0,United Kingdom
566019,2023-09-08,21754,Home Building Block Word,16.66,3,17243.0,United Kingdom
566019,2023-09-08,84378,Set Of 3 Heart Cookie Cutters,11.74,12,17243.0,United Kingdom
566019,2023-09-08,72802A,Rose Scent Candle In Jewelled Box,14.61,6,17243.0,United Kingdom
566019,2023-09-08,22841,Round Cake Tin Vintage Green,18.4,1,17243.0,United Kingdom
566019,2023-09-08,72802C,Vanilla Scent Candle Jewelled Box,14.61,6,17243.0,United Kingdom
566019,2023-09-08,22840,Round Cake Tin Vintage Red,18.4,1,17243.0,United Kingdom
566019,2023-09-08,72807C,Set/3 Vanilla Scented Candle In Box,14.61,5,17243.0,United Kingdom
566019,2023-09-08,22469,Heart Of Wicker Small,11.94,3,17243.0,United Kingdom
566019,2023-09-08,22470,Heart Of Wicker Large,13.27,3,17243.0,United Kingdom
566019,2023-09-08,47559B,Tea Time Oven Glove,11.53,4,17243.0,United Kingdom
566019,2023-09-08,16168M,Funky Monkey Gift Bag Medium,5.34,12,17243.0,United Kingdom
566020,2023-09-08,23296,Set Of 6 Tea Time Baking Cases,11.53,8,13925.0,United Kingdom
566020,2023-09-08,23293,Set Of 12 Fairy Cake Baking Cases,11.1,40,13925.0,United Kingdom
566021,2023-09-08,22607,Wooden Rounders Garden Set,18.96,12,15306.0,United Kingdom
566021,2023-09-08,85175,Cacti T-Light Candles,10.68,32,15306.0,United Kingdom
566021,2023-09-08,22558,Clothes Pegs Retrospot Pack 24,11.94,12,15306.0,United Kingdom
566021,2023-09-08,21980,Pack Of 12 Red Retrospot Tissues,10.65,48,15306.0,United Kingdom
566021,2023-09-08,21506,Fancy Font Birthday Card,10.68,12,15306.0,United Kingdom
566021,2023-09-08,21500,Pink Polkadot Wrap,10.68,25,15306.0,United Kingdom
566021,2023-09-08,21499,Blue Polkadot Wrap,10.68,25,15306.0,United Kingdom
566021,2023-09-08,21498,Red Retrospot Wrap,10.68,25,15306.0,United Kingdom
566021,2023-09-08,22090,Paper Bunting Retrospot,13.27,6,15306.0,United Kingdom
566021,2023-09-08,21356,Toast Its - Fairy Flower,11.53,24,15306.0,United Kingdom
566021,2023-09-08,21470,Flower Vine Raffia Food Cover,14.09,6,15306.0,United Kingdom
566021,2023-09-08,48184,Doormat English Rose,18.71,4,15306.0,United Kingdom
566021,2023-09-08,21754,Home Building Block Word,16.66,3,15306.0,United Kingdom
566022,2023-09-08,23411,Trellis Coat Rack,15.32,6,13925.0,United Kingdom
566022,2023-09-08,23355,Hot Water Bottle Keep Calm,15.32,4,13925.0,United Kingdom
566023,2023-09-08,22295,Heart Filigree Dove Large,11.94,24,12955.0,United Kingdom
566023,2023-09-08,20972,Pink Cream Felt Craft Trinket Box,11.53,24,12955.0,United Kingdom
566023,2023-09-08,22536,Magic Drawing Slate Purdey,10.68,48,12955.0,United Kingdom
566023,2023-09-08,21790,Vintage Snap Cards,11.12,24,12955.0,United Kingdom
566023,2023-09-08,23310,Bubblegum Ring Assorted,10.68,36,12955.0,United Kingdom
566023,2023-09-08,21915,Red Harmonica In Box,11.53,24,12955.0,United Kingdom
566023,2023-09-08,22620,4 Traditional Spinning Tops,11.74,12,12955.0,United Kingdom
566023,2023-09-08,20983,12 Pencils Tall Tube Red Retrospot,11.12,12,12955.0,United Kingdom
566023,2023-09-08,21136,Painted Metal Pears Assorted,11.98,24,12955.0,United Kingdom
566023,2023-09-08,84879,Assorted Colour Bird Ornament,11.98,48,12955.0,United Kingdom
566023,2023-09-08,22489,Pack Of 12 Traditional Crayons,10.68,24,12955.0,United Kingdom
566023,2023-09-08,22800,Antique Tall Swirlglass Trinket Pot,14.09,4,12955.0,United Kingdom
566023,2023-09-08,21791,Vintage Heads And Tails Card Game,11.53,24,12955.0,United Kingdom
566023,2023-09-08,21891,Traditional Wooden Skipping Rope,11.74,12,12955.0,United Kingdom
566023,2023-09-08,21890,S/6 Wooden Skittles In Cotton Bag,13.58,12,12955.0,United Kingdom
566023,2023-09-08,22621,Traditional Knitting Nancy,11.94,12,12955.0,United Kingdom
566023,2023-09-08,22561,Wooden School Colouring Set,11.94,12,12955.0,United Kingdom
