TransactionNo,Date,ProductNo,ProductName,Price,Quantity,CustomerNo,Country
553129,2023-05-13,20727,Lunch Bag Black Skull,5.97,2,17765.0,United Kingdom
553130,2023-05-13,22842,Biscuit Tin Vintage Red,17.17,2,17398.0,United Kingdom
553130,2023-05-13,22843,Biscuit Tin Vintage Green,17.17,2,17398.0,United Kingdom
553130,2023-05-13,21975,Pack Of 60 Dinosaur Cake Cases,10.81,24,17398.0,United Kingdom
553130,2023-05-13,84378,Set Of 3 Heart Cookie Cutters,11.53,12,17398.0,United Kingdom
553130,2023-05-13,84380,Set Of 3 Butterfly Cookie Cutters,11.53,12,17398.0,United Kingdom
553130,2023-05-13,21242,Red Retrospot Plate,11.98,8,17398.0,United Kingdom
553130,2023-05-13,22138,Baking Set 9 Piece Retrospot,15.32,6,17398.0,United Kingdom
553130,2023-05-13,22215,Cake Stand White Two Tier Lace,18.96,2,17398.0,United Kingdom
553130,2023-05-13,22840,Round Cake Tin Vintage Red,18.4,2,17398.0,United Kingdom
553131,2023-05-13,22431,Watering Can Blue Elephant,12.25,24,16401.0,United Kingdom
553131,2023-05-13,22432,Watering Can Pink Bunny,12.25,24,16401.0,United Kingdom
553131,2023-05-13,22433,Watering Can Green Dinosaur,12.25,24,16401.0,United Kingdom
553131,2023-05-13,22197,Popcorn Holder,10.99,100,16401.0,United Kingdom
553134,2023-05-13,23049,Recycled Acapulco Mat Red,18.71,2,15382.0,United Kingdom
553134,2023-05-13,23051,Recycled Acapulco Mat Blue,18.71,2,15382.0,United Kingdom
553134,2023-05-13,23052,Recycled Acapulco Mat Turquoise,18.71,2,15382.0,United Kingdom
553134,2023-05-13,23282,Folding Butterfly Mirror Ivory,11.1,6,15382.0,United Kingdom
553134,2023-05-13,23281,Folding Butterfly Mirror Red,11.1,6,15382.0,United Kingdom
553134,2023-05-13,23128,Feltcraft Boy Jean-Paul Kit,15.32,2,15382.0,United Kingdom
553134,2023-05-13,23126,Feltcraft Girl Amelie Kit,15.32,2,15382.0,United Kingdom
553134,2023-05-13,23204,Charlotte Bag Apples Design,11.12,10,15382.0,United Kingdom
553134,2023-05-13,23205,Charlotte Bag Vintage Alphabet,11.12,10,15382.0,United Kingdom
553134,2023-05-13,23254,Childrens Cutlery Dolly Girl,14.5,4,15382.0,United Kingdom
553134,2023-05-13,23256,Childrens Cutlery Spaceboy,14.5,4,15382.0,United Kingdom
553134,2023-05-13,23168,Classic Cafe Sugar Dispenser,11.53,12,15382.0,United Kingdom
553134,2023-05-13,23183,Mother's Kitchen Spoon Rest,14.09,4,15382.0,United Kingdom
553134,2023-05-13,23154,Set Of 4 Jam Jar Magnets,12.38,12,15382.0,United Kingdom
553134,2023-05-13,23158,Set Of 5 Lucky Cat Magnets,12.38,12,15382.0,United Kingdom
553134,2023-05-13,23159,Set Of 5 Pancake Day Magnets,12.38,12,15382.0,United Kingdom
553134,2023-05-13,23156,Set Of 5 Mini Grocery Magnets,12.38,12,15382.0,United Kingdom
553134,2023-05-13,23040,Paper Lantern 9 Point Snow Star,14.5,4,15382.0,United Kingdom
553134,2023-05-13,23045,Paper Lantern 5 Point Star Moon,14.5,2,15382.0,United Kingdom
553134,2023-05-13,23190,Bundle Of 3 School Exercise Books,11.94,6,15382.0,United Kingdom
553134,2023-05-13,23192,Bundle Of 3 Alphabet Exercise Books,11.94,6,15382.0,United Kingdom
553134,2023-05-13,22431,Watering Can Blue Elephant,12.25,6,15382.0,United Kingdom
553134,2023-05-13,22630,Dolly Girl Lunch Box,12.25,12,15382.0,United Kingdom
553134,2023-05-13,21201,Tropical Honeycomb Paper Garland,12.86,12,15382.0,United Kingdom
553134,2023-05-13,20914,Set/5 Red Retrospot Lid Glass Bowls,13.27,12,15382.0,United Kingdom
553134,2023-05-13,23201,Jumbo Bag Alphabet,6.13,10,15382.0,United Kingdom
553134,2023-05-13,23199,Jumbo Bag Apples,6.13,10,15382.0,United Kingdom
553134,2023-05-13,23202,Jumbo Bag Vintage Leaf,6.13,10,15382.0,United Kingdom
553134,2023-05-13,23203,Jumbo Bag Vintage Doily,6.13,10,15382.0,United Kingdom
553134,2023-05-13,23200,Jumbo Bag Pears,6.13,10,15382.0,United Kingdom
553134,2023-05-13,23207,Lunch Bag Alphabet Design,5.97,10,15382.0,United Kingdom
553134,2023-05-13,23206,Lunch Bag Apple Design,5.97,10,15382.0,United Kingdom
553134,2023-05-13,23208,Lunch Bag Vintage Leaf Design,5.97,10,15382.0,United Kingdom
553134,2023-05-13,23209,Lunch Bag Vintage Doily,5.97,10,15382.0,United Kingdom
553140,2023-05-13,22322,Bird Decoration Green Polkadot,11.12,2,15373.0,United Kingdom
553140,2023-05-13,23147,Single Antique Rose Hook Ivory,11.74,1,15373.0,United Kingdom
553140,2023-05-13,21042,Red Retrospot Apron,16.35,1,15373.0,United Kingdom
553140,2023-05-13,22325,Mobile Vintage Hearts,15.32,1,15373.0,United Kingdom
553140,2023-05-13,22317,Five Cats Hanging Decoration,13.27,1,15373.0,United Kingdom
553140,2023-05-13,22558,Clothes Pegs Retrospot Pack 24,11.94,1,15373.0,United Kingdom
553140,2023-05-13,21084,Set/6 Collage Paper Cups,10.44,6,15373.0,United Kingdom
553140,2023-05-13,22938,Cupcake Lace Paper Set 6,12.25,2,15373.0,United Kingdom
553140,2023-05-13,22995,Travel Card Wallet Suki,10.68,3,15373.0,United Kingdom
553140,2023-05-13,21216,Set 3 Retrospot Tea/Coffee/Sugar,15.32,10,15373.0,United Kingdom
553140,2023-05-13,79030D,Tumbler Baroque,10.65,6,15373.0,United Kingdom
553140,2023-05-13,20914,Set/5 Red Retrospot Lid Glass Bowls,13.27,1,15373.0,United Kingdom
553140,2023-05-13,84828,Jungle Popsicles Ice Lolly Moulds,11.53,2,15373.0,United Kingdom
553140,2023-05-13,21042,Red Retrospot Apron,16.35,2,15373.0,United Kingdom
553140,2023-05-13,22090,Paper Bunting Retrospot,13.27,3,15373.0,United Kingdom
553140,2023-05-13,21080,Set/20 Red Retrospot Paper Napkins,11.12,4,15373.0,United Kingdom
553140,2023-05-13,21989,Pack Of 20 Skull Paper Napkins,11.12,4,15373.0,United Kingdom
553140,2023-05-13,21090,Set/6 Collage Paper Plates,10.65,5,15373.0,United Kingdom
553140,2023-05-13,21034,Rex Cash+Carry Jumbo Shopper,11.22,4,15373.0,United Kingdom
553141,2023-05-13,84279B,Cherry Blossom Decorative Flask,14.09,1,15907.0,United Kingdom
553141,2023-05-13,20801,Large Pink Glass Sundae Dish,11.06,2,15907.0,United Kingdom
553141,2023-05-13,85141,Jardin Etched Glass Fruitbowl,14.3,1,15907.0,United Kingdom
553141,2023-05-13,79030G,Tumbler New England,10.65,24,15907.0,United Kingdom
553141,2023-05-13,21089,Set/6 Green Spring Paper Cups,10.44,10,15907.0,United Kingdom
553141,2023-05-13,22619,Set Of 6 Soldier Skittles,14.09,1,15907.0,United Kingdom
553141,2023-05-13,22516,Childs Garden Rake Blue,12.4,1,15907.0,United Kingdom
553141,2023-05-13,22514,Childs Garden Spade Blue,12.4,1,15907.0,United Kingdom
553141,2023-05-13,22907,Pack Of 20 Napkins Pantry Design,11.12,1,15907.0,United Kingdom
553141,2023-05-13,22507,Memo Board Retrospot Design,15.32,1,15907.0,United Kingdom
553141,2023-05-13,20682,Red Retrospot Childrens Umbrella,13.58,1,15907.0,United Kingdom
553141,2023-05-13,48187,Doormat New England,18.4,1,15907.0,United Kingdom
553141,2023-05-13,85014B,Red Retrospot Umbrella,16.35,1,15907.0,United Kingdom
553141,2023-05-13,85014A,Black/Blue Polkadot Umbrella,16.35,1,15907.0,United Kingdom
553141,2023-05-13,21401,Blue Pudding Spoon,10.37,6,15907.0,United Kingdom
553141,2023-05-13,22178,Victorian Glass Hanging T-Light,11.53,4,15907.0,United Kingdom
553141,2023-05-13,84879,Assorted Colour Bird Ornament,11.98,1,15907.0,United Kingdom
553141,2023-05-13,20974,12 Pencils Small Tube Skull,10.92,1,15907.0,United Kingdom
553141,2023-05-13,20975,12 Pencils Small Tube Red Retrospot,10.92,4,15907.0,United Kingdom
553141,2023-05-13,22420,Lipstick Pen Baby Pink,10.68,4,15907.0,United Kingdom
553141,2023-05-13,22421,Lipstick Pen Fuschia,10.68,4,15907.0,United Kingdom
553141,2023-05-13,22419,Lipstick Pen Red,10.68,4,15907.0,United Kingdom
553141,2023-05-13,20974,12 Pencils Small Tube Skull,10.92,4,15907.0,United Kingdom
553141,2023-05-13,21260,First Aid Tin,13.58,1,15907.0,United Kingdom
553141,2023-05-13,22759,Set Of 3 Notebooks In Parcel,11.94,3,15907.0,United Kingdom
553141,2023-05-13,47593B,Scottie Dogs Baby Bib,10.65,2,15907.0,United Kingdom
553141,2023-05-13,47594B,Scotties Design Washbag,12.25,1,15907.0,United Kingdom
553141,2023-05-13,22276,Wash Bag Vintage Rose Paisley,12.86,1,15907.0,United Kingdom
553141,2023-05-13,22907,Pack Of 20 Napkins Pantry Design,11.12,1,15907.0,United Kingdom
553141,2023-05-13,22727,Alarm Clock Bakelike Red,14.09,1,15907.0,United Kingdom
553141,2023-05-13,22759,Set Of 3 Notebooks In Parcel,11.94,1,15907.0,United Kingdom
553141,2023-05-13,85078,Scandinavian 3 Hearts Napkin Ring,10.44,9,15907.0,United Kingdom
553141,2023-05-13,22277,Cosmetic Bag Vintage Rose Paisley,12.4,1,15907.0,United Kingdom
553141,2023-05-13,23298,Spotty Bunting,15.32,4,15907.0,United Kingdom
553141,2023-05-13,47590B,Pink Happy Birthday Bunting,15.84,1,15907.0,United Kingdom
553141,2023-05-13,22520,Childs Garden Trowel Blue,11.12,1,15907.0,United Kingdom
553141,2023-05-13,22522,Childs Garden Fork Blue,11.12,1,15907.0,United Kingdom
553141,2023-05-13,21718,Red Metal Beach Spade,11.53,2,15907.0,United Kingdom
553141,2023-05-13,85014B,Red Retrospot Umbrella,16.35,1,15907.0,United Kingdom
553141,2023-05-13,85135B,Blue Dragonfly Helicopter,18.4,1,15907.0,United Kingdom
553141,2023-05-13,85135C,Red Dragonfly Helicopter,18.4,1,15907.0,United Kingdom
553141,2023-05-13,22623,Box Of Vintage Jigsaw Blocks,16.35,1,15907.0,United Kingdom
553141,2023-05-13,22514,Childs Garden Spade Blue,12.4,1,15907.0,United Kingdom
553141,2023-05-13,22516,Childs Garden Rake Blue,12.4,1,15907.0,United Kingdom
553141,2023-05-13,22271,Feltcraft Doll Rosie,13.27,1,15907.0,United Kingdom
553141,2023-05-13,22274,Feltcraft Doll Emily,13.27,2,15907.0,United Kingdom
553141,2023-05-13,22174,Photo Cube,11.94,1,15907.0,United Kingdom
553141,2023-05-13,48187,Doormat New England,18.4,1,15907.0,United Kingdom
553141,2023-05-13,22178,Victorian Glass Hanging T-Light,11.53,4,15907.0,United Kingdom
553141,2023-05-13,21121,Set/10 Red Polkadot Party Candles,11.53,1,15907.0,United Kingdom
553141,2023-05-13,23298,Spotty Bunting,15.32,7,15907.0,United Kingdom
553141,2023-05-13,20829,Glitter Hanging Butterfly String,12.4,1,15907.0,United Kingdom
553141,2023-05-13,21922,Union Stripe With Fringe Hammock,18.4,1,15907.0,United Kingdom
553141,2023-05-13,22907,Pack Of 20 Napkins Pantry Design,11.12,8,15907.0,United Kingdom
553141,2023-05-13,47593B,Scottie Dogs Baby Bib,10.65,10,15907.0,United Kingdom
553141,2023-05-13,23200,Jumbo Bag Pears,6.19,1,15907.0,United Kingdom
553141,2023-05-13,23203,Jumbo Bag Vintage Doily,6.19,2,15907.0,United Kingdom
553141,2023-05-13,23203,Jumbo Bag Vintage Doily,6.19,2,15907.0,United Kingdom
553142,2023-05-13,22844,Vintage Cream Dog Food Container,18.96,2,14527.0,United Kingdom
553142,2023-05-13,21215,Ivory Paper Cup Cake Cases,10.81,1,14527.0,United Kingdom
553142,2023-05-13,21212,Pack Of 72 Retrospot Cake Cases,10.81,1,14527.0,United Kingdom
553142,2023-05-13,22939,Adult Apron Apple Delight,15.32,1,14527.0,United Kingdom
553142,2023-05-13,22898,Childrens Apron Apples Design,12.25,2,14527.0,United Kingdom
553142,2023-05-13,82484,Wood Black Board Ant White Finish,18.4,2,14527.0,United Kingdom
553142,2023-05-13,22192,Blue Diner Wall Clock,18.96,1,14527.0,United Kingdom
553142,2023-05-13,21930,Jumbo Storage Bag Skulls,12.38,2,14527.0,United Kingdom
553142,2023-05-13,21936,Red Retrospot Picnic Bag,13.27,2,14527.0,United Kingdom
553142,2023-05-13,22379,Recycling Bag Retrospot,12.4,2,14527.0,United Kingdom
553142,2023-05-13,23200,Jumbo Bag Pears,6.19,2,14527.0,United Kingdom
553142,2023-05-13,23202,Jumbo Bag Vintage Leaf,6.19,2,14527.0,United Kingdom
553142,2023-05-13,20712,Jumbo Bag Woodland Animals,6.19,2,14527.0,United Kingdom
553143,2023-05-13,47590A,Blue Happy Birthday Bunting,15.84,3,12695.0,France
553143,2023-05-13,23284,Doormat Keep Calm And Come In,18.4,2,12695.0,France
553143,2023-05-13,21894,Potting Shed Seed Envelopes,11.53,12,12695.0,France
553143,2023-05-13,48138,Doormat Union Flag,18.4,2,12695.0,France
553143,2023-05-13,22595,Gingham Heart Decoration,11.12,12,12695.0,France
553143,2023-05-13,21955,Doormat Union Jack Guns And Roses,18.4,2,12695.0,France
553144,2023-05-13,23298,Spotty Bunting,15.32,6,17669.0,United Kingdom
553144,2023-05-13,23165,Large Ceramic Top Storage Jar,11.94,12,17669.0,United Kingdom
553144,2023-05-13,23203,Jumbo Bag Vintage Doily,6.04,100,17669.0,United Kingdom
553144,2023-05-13,23202,Jumbo Bag Vintage Leaf,6.04,100,17669.0,United Kingdom
553144,2023-05-13,23200,Jumbo Bag Pears,6.04,100,17669.0,United Kingdom
553144,2023-05-13,23209,Lunch Bag Vintage Doily,5.97,20,17669.0,United Kingdom
553145,2023-05-13,21715,Girls Vintage Tin Seaside Bucket,12.86,8,14342.0,United Kingdom
553145,2023-05-13,21499,Blue Polkadot Wrap,10.68,25,14342.0,United Kingdom
553145,2023-05-13,21500,Pink Polkadot Wrap,10.68,25,14342.0,United Kingdom
553145,2023-05-13,21718,Red Metal Beach Spade,11.53,12,14342.0,United Kingdom
553145,2023-05-13,21716,Boys Vintage Tin Seaside Bucket,12.86,8,14342.0,United Kingdom
553145,2023-05-13,23112,Parisienne Curio Cabinet,17.07,12,14342.0,United Kingdom
553146,2023-05-13,22960,Jam Making Set With Jars,14.61,6,14873.0,United Kingdom
553146,2023-05-13,22978,Pantry Rolling Pin,14.09,6,14873.0,United Kingdom
553146,2023-05-13,22722,Set Of 6 Spice Tins Pantry Design,14.3,4,14873.0,United Kingdom
553146,2023-05-13,23168,Classic Cafe Sugar Dispenser,11.53,12,14873.0,United Kingdom
553146,2023-05-13,22644,Ceramic Cherry Cake Money Bank,11.74,12,14873.0,United Kingdom
553146,2023-05-13,22055,Mini Cake Stand Hanging Strawbery,11.94,8,14873.0,United Kingdom
553146,2023-05-13,21877,Home Sweet Home Mug,11.53,12,14873.0,United Kingdom
553146,2023-05-13,21155,Red Retrospot Peg Bag,12.86,6,14873.0,United Kingdom
553146,2023-05-13,22558,Clothes Pegs Retrospot Pack 24,11.78,12,14873.0,United Kingdom
553146,2023-05-13,21216,Set 3 Retrospot Tea/Coffee/Sugar,15.32,4,14873.0,United Kingdom
553146,2023-05-13,21218,Red Spotty Biscuit Tin,14.09,6,14873.0,United Kingdom
553146,2023-05-13,21080,Set/20 Red Retrospot Paper Napkins,11.12,12,14873.0,United Kingdom
553146,2023-05-13,22699,Roses Regency Teacup And Saucer,13.27,6,14873.0,United Kingdom
553146,2023-05-13,22698,Pink Regency Teacup And Saucer,13.27,6,14873.0,United Kingdom
553146,2023-05-13,23170,Regency Tea Plate Roses,11.94,12,14873.0,United Kingdom
553146,2023-05-13,23172,Regency Tea Plate Pink,11.94,12,14873.0,United Kingdom
553146,2023-05-13,22429,Enamel Measuring Jug Cream,14.61,4,14873.0,United Kingdom
553146,2023-05-13,22425,Enamel Colander Cream,15.32,3,14873.0,United Kingdom
553146,2023-05-13,23134,Large Zinc Heart Wall Organiser,18.71,2,14873.0,United Kingdom
553146,2023-05-13,23153,Zinc Sweetheart Wire Letter Rack,14.09,4,14873.0,United Kingdom
553146,2023-05-13,23152,Ivory Sweetheart Wire Letter Rack,14.09,4,14873.0,United Kingdom
553146,2023-05-13,23133,Large Ivory Heart Wall Organiser,18.71,2,14873.0,United Kingdom
553148,2023-05-13,21294,Etched Glass Coaster,10.65,48,13148.0,United Kingdom
553148,2023-05-13,21794,Classic French Style Basket Natural,14.3,8,13148.0,United Kingdom
553148,2023-05-13,79030G,Tumbler New England,10.65,24,13148.0,United Kingdom
553148,2023-05-13,84563A,Pink & White Breakfast Tray,13.27,4,13148.0,United Kingdom
553148,2023-05-13,84563B,Blue & White Breakfast Tray,13.27,4,13148.0,United Kingdom
553148,2023-05-13,84706D,Cherry Blossom Table Clock,12.25,2,13148.0,United Kingdom
553148,2023-05-13,85132A,Charlie + Lola Biscuits Tins,12.25,12,13148.0,United Kingdom
553148,2023-05-13,22139,Retrospot Tea Set Ceramic 11 Pc,15.32,6,13148.0,United Kingdom
553148,2023-05-13,22617,Baking Set Spaceboy Design,15.32,6,13148.0,United Kingdom
553148,2023-05-13,22138,Baking Set 9 Piece Retrospot,15.32,6,13148.0,United Kingdom
553148,2023-05-13,23077,Doughnut Lip Gloss,11.53,20,13148.0,United Kingdom
553148,2023-05-13,23076,Ice Cream Sundae Lip Gloss,11.53,24,13148.0,United Kingdom
553148,2023-05-13,84580,Mouse Toy With Pink T-Shirt,14.09,4,13148.0,United Kingdom
553148,2023-05-13,84581,Dog Toy With Pink Crochet Skirt,14.09,4,13148.0,United Kingdom
553148,2023-05-13,22176,Blue Owl Soft Toy,13.27,6,13148.0,United Kingdom
553148,2023-05-13,22128,Party Cones Candy Assorted,11.53,12,13148.0,United Kingdom
553148,2023-05-13,22129,Party Cones Candy Decoration,11.12,12,13148.0,United Kingdom
553148,2023-05-13,22333,Retrospot Party Bag + Sticker Set,11.94,8,13148.0,United Kingdom
553148,2023-05-13,47599B,Blue Party Bags,12.4,6,13148.0,United Kingdom
553148,2023-05-13,47599A,Pink Party Bags,12.4,6,13148.0,United Kingdom
553148,2023-05-13,22331,Woodland Party Bag + Sticker Set,11.94,8,13148.0,United Kingdom
553148,2023-05-13,22334,Dinosaur Party Bag + Sticker Set,11.94,8,13148.0,United Kingdom
553148,2023-05-13,22332,Skulls Party Bag + Sticker Set,11.94,8,13148.0,United Kingdom
553148,2023-05-13,22356,Charlotte Bag Pink Polkadot,11.12,10,13148.0,United Kingdom
553148,2023-05-13,20724,Red Retrospot Charlotte Bag,11.12,10,13148.0,United Kingdom
553148,2023-05-13,20719,Woodland Charlotte Bag,11.12,10,13148.0,United Kingdom
553148,2023-05-13,23204,Charlotte Bag Apples Design,11.12,10,13148.0,United Kingdom
553148,2023-05-13,85088,Candy Spot Hand Bag,12.4,6,13148.0,United Kingdom
553148,2023-05-13,22962,Jam Jar With Pink Lid,11.12,12,13148.0,United Kingdom
553148,2023-05-13,22963,Jam Jar With Green Lid,11.12,12,13148.0,United Kingdom
553148,2023-05-13,22960,Jam Making Set With Jars,14.61,6,13148.0,United Kingdom
553148,2023-05-13,22565,Feltcraft Hairbands Pink And White,11.12,36,13148.0,United Kingdom
553148,2023-05-13,22452,Measuring Tape Babushka Pink,13.27,6,13148.0,United Kingdom
553148,2023-05-13,22453,Measuring Tape Babushka Blue,13.27,6,13148.0,United Kingdom
553148,2023-05-13,20702,Pink Padded Mobile,14.61,6,13148.0,United Kingdom
553148,2023-05-13,22320,Birds Mobile Vintage Design,16.35,3,13148.0,United Kingdom
553148,2023-05-13,22325,Mobile Vintage Hearts,15.32,3,13148.0,United Kingdom
553148,2023-05-13,21371,Mirrored Wall Art Poppies,12.86,6,13148.0,United Kingdom
553148,2023-05-13,21249,Woodland Height Chart Stickers,13.27,6,13148.0,United Kingdom
553148,2023-05-13,21251,Dinosaur Height Chart Sticker Set,13.27,6,13148.0,United Kingdom
553148,2023-05-13,23254,Childrens Cutlery Dolly Girl,14.5,8,13148.0,United Kingdom
553148,2023-05-13,84997C,Childrens Cutlery Polkadot Blue,14.5,8,13148.0,United Kingdom
553148,2023-05-13,84997D,Childrens Cutlery Polkadot Pink,14.5,8,13148.0,United Kingdom
553148,2023-05-13,23256,Childrens Cutlery Spaceboy,14.5,8,13148.0,United Kingdom
553148,2023-05-13,23255,Childrens Cutlery Circus Parade,14.5,8,13148.0,United Kingdom
553148,2023-05-13,22326,Round Snack Boxes Set Of4 Woodland,13.27,6,13148.0,United Kingdom
553148,2023-05-13,22628,Picnic Boxes Set Of 3 Retrospot,15.32,4,13148.0,United Kingdom
553148,2023-05-13,22352,Lunch Box With Cutlery Retrospot,12.86,6,13148.0,United Kingdom
553148,2023-05-13,22659,Lunch Box I Love London,12.25,12,13148.0,United Kingdom
553148,2023-05-13,22636,Childs Breakfast Set Circus Parade,18.96,4,13148.0,United Kingdom
553148,2023-05-13,21212,Pack Of 72 Retrospot Cake Cases,10.81,24,13148.0,United Kingdom
553148,2023-05-13,21975,Pack Of 60 Dinosaur Cake Cases,10.81,24,13148.0,United Kingdom
553148,2023-05-13,22417,Pack Of 60 Spaceboy Cake Cases,10.81,24,13148.0,United Kingdom
553148,2023-05-13,21213,Pack Of 72 Skull Cake Cases,10.81,24,13148.0,United Kingdom
553148,2023-05-13,21976,Pack Of 60 Mushroom Cake Cases,10.81,24,13148.0,United Kingdom
553148,2023-05-13,21977,Pack Of 60 Pink Paisley Cake Cases,10.81,24,13148.0,United Kingdom
553148,2023-05-13,22951,60 Cake Cases Dolly Girl Design,10.81,24,13148.0,United Kingdom
553148,2023-05-13,84991,60 Teatime Fairy Cake Cases,10.81,24,13148.0,United Kingdom
553148,2023-05-13,22195,Large Heart Measuring Spoons,11.94,12,13148.0,United Kingdom
553148,2023-05-13,22135,Mini Ladle Love Heart Pink,10.68,12,13148.0,United Kingdom
553148,2023-05-13,22196,Small Heart Measuring Spoons,11.12,12,13148.0,United Kingdom
553148,2023-05-13,21216,Set 3 Retrospot Tea/Coffee/Sugar,15.32,4,13148.0,United Kingdom
553148,2023-05-13,21218,Red Spotty Biscuit Tin,14.09,6,13148.0,United Kingdom
553148,2023-05-13,22900,Set 2 Tea Towels I Love London,13.58,6,13148.0,United Kingdom
553148,2023-05-13,21035,Set/2 Red Retrospot Tea Towels,13.58,6,13148.0,United Kingdom
553148,2023-05-13,22989,Set 2 Pantry Design Tea Towels,13.58,6,13148.0,United Kingdom
553148,2023-05-13,22895,Set Of 2 Tea Towels Apple And Pears,13.58,6,13148.0,United Kingdom
553148,2023-05-13,20998,Rose Du Sud Oven Glove,13.27,6,13148.0,United Kingdom
553148,2023-05-13,21154,Red Retrospot Oven Glove,11.53,10,13148.0,United Kingdom
553148,2023-05-13,47559B,Tea Time Oven Glove,11.53,10,13148.0,United Kingdom
553148,2023-05-13,21238,Red Retrospot Cup,11.12,32,13148.0,United Kingdom
553148,2023-05-13,21240,Blue Polkadot Cup,11.12,32,13148.0,United Kingdom
553148,2023-05-13,21239,Pink Polkadot Cup,11.12,32,13148.0,United Kingdom
553148,2023-05-13,21242,Red Retrospot Plate,11.98,40,13148.0,United Kingdom
553148,2023-05-13,21244,Blue Polkadot Plate,11.98,40,13148.0,United Kingdom
553148,2023-05-13,21243,Pink Polkadot Plate,11.98,40,13148.0,United Kingdom
553148,2023-05-13,21245,Green Polkadot Plate,11.98,16,13148.0,United Kingdom
553148,2023-05-13,20674,Green Polkadot Bowl,11.53,32,13148.0,United Kingdom
553148,2023-05-13,20676,Red Retrospot Bowl,11.53,32,13148.0,United Kingdom
553148,2023-05-13,20675,Blue Polkadot Bowl,11.53,32,13148.0,United Kingdom
553148,2023-05-13,20677,Pink Polkadot Bowl,11.53,32,13148.0,United Kingdom
553148,2023-05-13,22131,Food Container Set 3 Love Heart,12.25,12,13148.0,United Kingdom
553148,2023-05-13,21947,Set Of 6 Heart Chopsticks,11.53,12,13148.0,United Kingdom
553148,2023-05-13,21949,Set Of 6 Strawberry Chopsticks,11.53,10,13148.0,United Kingdom
553148,2023-05-13,22740,Polkadot Pen,11.12,48,13148.0,United Kingdom
553148,2023-05-13,84905,Pink Butterfly Cushion Cover,12.25,6,13148.0,United Kingdom
553148,2023-05-13,85087,Candy Spot Cushion Cover,13.27,6,13148.0,United Kingdom
553148,2023-05-13,47585A,Pink Fairy Cake Cushion Cover,14.09,4,13148.0,United Kingdom
553148,2023-05-13,20728,Lunch Bag Cars Blue,5.97,10,13148.0,United Kingdom
553148,2023-05-13,22382,Lunch Bag Spaceboy Design,5.97,10,13148.0,United Kingdom
553148,2023-05-13,22384,Lunch Bag Pink Polkadot,5.97,10,13148.0,United Kingdom
553148,2023-05-13,23206,Lunch Bag Apple Design,5.97,10,13148.0,United Kingdom
553149,2023-05-13,23170,Regency Tea Plate Roses,11.74,48,14226.0,United Kingdom
553149,2023-05-13,23171,Regency Tea Plate Green,11.74,48,14226.0,United Kingdom
553149,2023-05-13,23172,Regency Tea Plate Pink,11.74,48,14226.0,United Kingdom
553149,2023-05-13,23075,Parlour Ceramic Wall Hook,14.5,4,14226.0,United Kingdom
553149,2023-05-13,23167,Small Ceramic Top Storage Jar,11.1,24,14226.0,United Kingdom
553149,2023-05-13,23166,Medium Ceramic Top Storage Jar,11.53,12,14226.0,United Kingdom
553149,2023-05-13,23165,Large Ceramic Top Storage Jar,11.94,12,14226.0,United Kingdom
553149,2023-05-13,23167,Small Ceramic Top Storage Jar,11.1,12,14226.0,United Kingdom
553149,2023-05-13,21755,Love Building Block Word,16.35,6,14226.0,United Kingdom
553149,2023-05-13,22831,White Brocante Soap Dish,13.27,6,14226.0,United Kingdom
553149,2023-05-13,21984,Pack Of 12 Pink Paisley Tissues,10.55,24,14226.0,United Kingdom
553149,2023-05-13,21983,Pack Of 12 Blue Paisley Tissues,10.55,24,14226.0,United Kingdom
553149,2023-05-13,22986,Wrap Gingham Rose,10.68,25,14226.0,United Kingdom
553149,2023-05-13,23299,Food Cover With Beads Set 2,14.09,12,14226.0,United Kingdom
553149,2023-05-13,23298,Spotty Bunting,15.32,12,14226.0,United Kingdom
553149,2023-05-13,23175,Regency Milk Jug Pink,13.07,24,14226.0,United Kingdom
553149,2023-05-13,23174,Regency Sugar Bowl Green,14.09,24,14226.0,United Kingdom
553149,2023-05-13,23173,Regency Teapot Roses,18.6,12,14226.0,United Kingdom
553151,2023-05-13,84978,Hanging Heart Jar T-Light Holder,11.53,24,13089.0,United Kingdom
553151,2023-05-13,84879,Assorted Colour Bird Ornament,11.98,36,13089.0,United Kingdom
553151,2023-05-13,82484,Wood Black Board Ant White Finish,18.4,4,13089.0,United Kingdom
553151,2023-05-13,82482,Wooden Picture Frame White Finish,12.86,18,13089.0,United Kingdom
553151,2023-05-13,23205,Charlotte Bag Vintage Alphabet,11.12,10,13089.0,United Kingdom
553151,2023-05-13,23204,Charlotte Bag Apples Design,11.12,10,13089.0,United Kingdom
553151,2023-05-13,22983,Card Billboard Font,10.68,12,13089.0,United Kingdom
553151,2023-05-13,22772,Pink Drawer Knob Acrylic Edwardian,11.53,12,13089.0,United Kingdom
553151,2023-05-13,22771,Clear Drawer Knob Acrylic Edwardian,11.53,12,13089.0,United Kingdom
553151,2023-05-13,22718,Card Cat And Tree,10.68,12,13089.0,United Kingdom
553151,2023-05-13,22716,Card Circus Parade,10.68,12,13089.0,United Kingdom
553151,2023-05-13,22558,Clothes Pegs Retrospot Pack 24,11.94,12,13089.0,United Kingdom
553151,2023-05-13,22784,Lantern Cream Gazebo,15.32,6,13089.0,United Kingdom
553151,2023-05-13,22151,Place Setting White Heart,10.68,24,13089.0,United Kingdom
553151,2023-05-13,22088,Paper Bunting Coloured Lace,13.27,12,13089.0,United Kingdom
553151,2023-05-13,21872,Glamorous Mug,11.53,12,13089.0,United Kingdom
553151,2023-05-13,21559,Strawberry Lunch Box With Cutlery,12.86,10,13089.0,United Kingdom
553151,2023-05-13,21509,Cowboys And Indians Birthday Card,10.68,12,13089.0,United Kingdom
553151,2023-05-13,21508,Vintage Kid Dolly Card,10.68,12,13089.0,United Kingdom
553151,2023-05-13,21390,Filigris Heart With Butterfly,11.53,24,13089.0,United Kingdom
553151,2023-05-13,21166,Cook With Wine Metal Sign,12.38,12,13089.0,United Kingdom
553151,2023-05-13,21165,Beware Of The Cat Metal Sign,11.98,12,13089.0,United Kingdom
553151,2023-05-13,20723,Strawberry Charlotte Bag,11.12,10,13089.0,United Kingdom
553151,2023-05-13,72349B,Set/6 Purple Butterfly T-Lights,12.4,12,13089.0,United Kingdom
553151,2023-05-13,72741,Grand Chocolatecandle,11.74,18,13089.0,United Kingdom
553151,2023-05-13,21198,White Heart Confetti In Tube,11.94,12,13089.0,United Kingdom
553151,2023-05-13,21188,3d Hearts Honeycomb Paper Garland,13.27,12,13089.0,United Kingdom
553151,2023-05-13,21462,Nursery A B C Painted Letters,17.17,6,13089.0,United Kingdom
