TransactionNo,Date,ProductNo,ProductName,Price,Quantity,CustomerNo,Country
577297,2023-11-18,22801,Antique Glass Pedestal Bowl,14.09,1,14593.0,United Kingdom
577297,2023-11-18,23215,Jingle Bell Heart Antique Silver,12.38,1,14593.0,United Kingdom
577297,2023-11-18,21811,Hanging Heart With Bell,10.65,2,14593.0,United Kingdom
577297,2023-11-18,21810,Christmas Hanging Star With Bell,10.65,2,14593.0,United Kingdom
577297,2023-11-18,22154,Angel Decoration 3 Buttons,10.68,2,14593.0,United Kingdom
577297,2023-11-18,21819,Glitter Christmas Star,10.65,2,14593.0,United Kingdom
577297,2023-11-18,21818,Glitter Heart Decoration,10.65,2,14593.0,United Kingdom
577297,2023-11-18,22155,Star Decoration Rustic,10.68,2,14593.0,United Kingdom
577297,2023-11-18,22154,Angel Decoration 3 Buttons,10.68,2,14593.0,United Kingdom
577297,2023-11-18,20668,Disco Ball Christmas Decoration,10.37,12,14593.0,United Kingdom
577297,2023-11-18,35953,Folkart Star Christmas Decorations,10.65,6,14593.0,United Kingdom
577297,2023-11-18,23419,Home Sweet Home Bottle,12.38,1,14593.0,United Kingdom
577297,2023-11-18,22997,Travel Card Wallet Union Jack,10.68,1,14593.0,United Kingdom
577297,2023-11-18,23166,Medium Ceramic Top Storage Jar,11.53,2,14593.0,United Kingdom
577297,2023-11-18,22792,Fluted Antique Candle Holder,11.12,3,14593.0,United Kingdom
577297,2023-11-18,22791,T-Light Glass Fluted Antique,11.53,3,14593.0,United Kingdom
577297,2023-11-18,21815,Star T-Light Holder,11.74,1,14593.0,United Kingdom
577297,2023-11-18,21816,Christmas Tree T-Light Holder,11.74,2,14593.0,United Kingdom
577297,2023-11-18,23344,Jumbo Bag 50'S Christmas,6.19,1,14593.0,United Kingdom
577297,2023-11-18,23343,Jumbo Bag Vintage Christmas,6.19,1,14593.0,United Kingdom
577297,2023-11-18,23199,Jumbo Bag Apples,6.19,1,14593.0,United Kingdom
577297,2023-11-18,23203,Jumbo Bag Vintage Doily,6.19,1,14593.0,United Kingdom
577297,2023-11-18,23582,Vintage Doily Jumbo Bag Red,6.19,1,14593.0,United Kingdom
577297,2023-11-18,23202,Jumbo Bag Vintage Leaf,6.19,1,14593.0,United Kingdom
577297,2023-11-18,23681,Lunch Bag Red Vintage Doily,5.97,1,14593.0,United Kingdom
577297,2023-11-18,23209,Lunch Bag Vintage Doily,5.97,1,14593.0,United Kingdom
577297,2023-11-18,23583,Lunch Bag Paisley Park,5.97,1,14593.0,United Kingdom
577297,2023-11-18,23206,Lunch Bag Apple Design,5.97,1,14593.0,United Kingdom
577297,2023-11-18,23208,Lunch Bag Vintage Leaf Design,5.97,2,14593.0,United Kingdom
577298,2023-11-18,23083,Set 6 Paper Table Lantern Stars,14.09,6,14299.0,United Kingdom
577298,2023-11-18,23043,Paper Lantern 9 Point Holly Star L,16.66,12,14299.0,United Kingdom
577298,2023-11-18,23000,Travel Card Wallet Transport,10.68,24,14299.0,United Kingdom
577298,2023-11-18,22969,Homemade Jam Scented Candles,11.74,12,14299.0,United Kingdom
577298,2023-11-18,22960,Jam Making Set With Jars,14.61,6,14299.0,United Kingdom
577298,2023-11-18,22867,Hand Warmer Bird Design,12.4,12,14299.0,United Kingdom
577298,2023-11-18,22720,Set Of 3 Cake Tins Pantry Design,15.32,3,14299.0,United Kingdom
577298,2023-11-18,22698,Pink Regency Teacup And Saucer,13.27,12,14299.0,United Kingdom
577298,2023-11-18,22699,Roses Regency Teacup And Saucer,13.27,12,14299.0,United Kingdom
577298,2023-11-18,22197,Popcorn Holder,11.12,12,14299.0,United Kingdom
577298,2023-11-18,22195,Large Heart Measuring Spoons,11.94,24,14299.0,United Kingdom
577298,2023-11-18,22153,Angel Decoration Stars On Dress,10.62,288,14299.0,United Kingdom
577298,2023-11-18,22028,Penny Farthing Birthday Card,10.68,12,14299.0,United Kingdom
577298,2023-11-18,21507,Elephant Birthday Card,10.68,12,14299.0,United Kingdom
577298,2023-11-18,84879,Assorted Colour Bird Ornament,11.98,24,14299.0,United Kingdom
577298,2023-11-18,72351B,Set/6 Pink Butterfly T-Lights,12.4,12,14299.0,United Kingdom
577298,2023-11-18,21889,Wooden Box Of Dominoes,11.53,12,14299.0,United Kingdom
577299,2023-11-18,20719,Woodland Charlotte Bag,11.12,10,12498.0,Germany
577299,2023-11-18,23204,Charlotte Bag Apples Design,11.12,10,12498.0,Germany
577299,2023-11-18,22355,Charlotte Bag Suki Design,11.12,10,12498.0,Germany
577299,2023-11-18,23206,Lunch Bag Apple Design,5.97,10,12498.0,Germany
577299,2023-11-18,20726,Lunch Bag Woodland,5.97,10,12498.0,Germany
577299,2023-11-18,23207,Lunch Bag Alphabet Design,5.97,10,12498.0,Germany
577299,2023-11-18,20728,Lunch Bag Cars Blue,5.97,20,12498.0,Germany
577300,2023-11-18,10080,Groovy Cactus Inflatable,10.65,4,16924.0,United Kingdom
577300,2023-11-18,22197,Popcorn Holder,11.12,12,16924.0,United Kingdom
577300,2023-11-18,21311,Set/4 Bird Mirror Magnets,10.55,24,16924.0,United Kingdom
577300,2023-11-18,47503A,Ass Floral Print Multi Screwdriver,10.68,24,16924.0,United Kingdom
577300,2023-11-18,47504H,English Rose Spirit Level,11.06,9,16924.0,United Kingdom
577300,2023-11-18,21479,White Skull Hot Water Bottle,14.61,1,16924.0,United Kingdom
577300,2023-11-18,21306,Set/4 Daisy Mirror Magnets,10.55,24,16924.0,United Kingdom
577300,2023-11-18,23355,Hot Water Bottle Keep Calm,15.32,2,16924.0,United Kingdom
577300,2023-11-18,22371,Airline Bag Vintage Tokyo 78,14.61,1,16924.0,United Kingdom
577300,2023-11-18,21901,Key Fob Back Door,10.92,2,16924.0,United Kingdom
577300,2023-11-18,21900,Key Fob Shed,10.92,1,16924.0,United Kingdom
577300,2023-11-18,21899,Garage Key Fob,10.92,1,16924.0,United Kingdom
577300,2023-11-18,51014A,Feather Pen Hot Pink,10.65,24,16924.0,United Kingdom
577300,2023-11-18,22114,Hot Water Bottle Tea And Sympathy,14.61,2,16924.0,United Kingdom
577300,2023-11-18,22111,Scottie Dog Hot Water Bottle,15.32,3,16924.0,United Kingdom
577300,2023-11-18,23355,Hot Water Bottle Keep Calm,15.32,2,16924.0,United Kingdom
577300,2023-11-18,22112,Chocolate Hot Water Bottle,15.32,6,16924.0,United Kingdom
577300,2023-11-18,22835,Hot Water Bottle I Am So Poorly,15.32,5,16924.0,United Kingdom
577300,2023-11-18,23301,Gardeners Kneeling Pad Keep Calm,11.94,5,16924.0,United Kingdom
577300,2023-11-18,23300,Gardeners Kneeling Pad Cup Of Tea,11.94,5,16924.0,United Kingdom
577300,2023-11-18,21311,Set/4 Bird Mirror Magnets,10.55,24,16924.0,United Kingdom
577300,2023-11-18,72232,Feng Shui Pillar Candle,10.44,24,16924.0,United Kingdom
577300,2023-11-18,17091J,Vanilla Incense In Tin,10.64,6,16924.0,United Kingdom
577300,2023-11-18,17091J,Vanilla Incense In Tin,10.64,12,16924.0,United Kingdom
577300,2023-11-18,85034B,3 White Choc Morris Boxed Candles,11.53,12,16924.0,United Kingdom
577300,2023-11-18,21287,Scented Velvet Lounge Candle,10.64,12,16924.0,United Kingdom
577300,2023-11-18,85034C,3 Rose Morris Boxed Candles,11.53,12,16924.0,United Kingdom
577300,2023-11-18,85035C,Rose 3 Wick Morris Box Candle,11.53,12,16924.0,United Kingdom
577300,2023-11-18,23461,Sweetheart Bird House,14.5,5,16924.0,United Kingdom
577300,2023-11-18,84946,Antique Silver T-Light Glass,11.53,6,16924.0,United Kingdom
577300,2023-11-18,22383,Lunch Bag Suki Design,5.97,10,16924.0,United Kingdom
577300,2023-11-18,23207,Lunch Bag Alphabet Design,5.97,6,16924.0,United Kingdom
577300,2023-11-18,23583,Lunch Bag Paisley Park,5.97,5,16924.0,United Kingdom
577300,2023-11-18,20727,Lunch Bag Black Skull,5.97,5,16924.0,United Kingdom
577300,2023-11-18,22384,Lunch Bag Pink Polkadot,5.97,4,16924.0,United Kingdom
577301,2023-11-18,22175,Pink Owl Soft Toy,13.27,6,12498.0,Germany
577301,2023-11-18,21408,Spotty Pink Duck Doorstop,14.61,3,12498.0,Germany
577302,2023-11-18,48138,Doormat Union Flag,18.71,1,17904.0,United Kingdom
577302,2023-11-18,22895,Set Of 2 Tea Towels Apple And Pears,13.58,3,17904.0,United Kingdom
577302,2023-11-18,23354,6 Gift Tags 50'S Christmas,11.1,4,17904.0,United Kingdom
577302,2023-11-18,23215,Jingle Bell Heart Antique Silver,12.38,2,17904.0,United Kingdom
577302,2023-11-18,23330,Decorative Wicker Heart Medium,11.53,3,17904.0,United Kingdom
577302,2023-11-18,84029G,Knitted Union Flag Hot Water Bottle,14.61,1,17904.0,United Kingdom
577302,2023-11-18,21479,White Skull Hot Water Bottle,14.61,1,17904.0,United Kingdom
577302,2023-11-18,85136C,Red Shark Helicopter,18.4,1,17904.0,United Kingdom
577302,2023-11-18,85135A,Yellow Dragonfly Helicopter,18.4,1,17904.0,United Kingdom
577302,2023-11-18,21888,Bingo Set,14.09,1,17904.0,United Kingdom
577302,2023-11-18,23528,Wall Art Spaceboy,14.09,1,17904.0,United Kingdom
577302,2023-11-18,23126,Feltcraft Girl Amelie Kit,15.32,1,17904.0,United Kingdom
577302,2023-11-18,21062,Party Invites Spaceman,11.12,2,17904.0,United Kingdom
577302,2023-11-18,21034,Rex Cash+Carry Jumbo Shopper,11.22,1,17904.0,United Kingdom
577302,2023-11-18,20982,12 Pencils Tall Tube Skulls,11.12,1,17904.0,United Kingdom
577302,2023-11-18,22714,Card Birthday Cowboy,10.68,12,17904.0,United Kingdom
577302,2023-11-18,23504,Playing Cards Jubilee Union Jack,11.53,1,17904.0,United Kingdom
577302,2023-11-18,23503,Playing Cards Keep Calm & Carry On,11.53,1,17904.0,United Kingdom
577302,2023-11-18,23505,Playing Cards I Love London,11.53,1,17904.0,United Kingdom
577302,2023-11-18,23330,Decorative Wicker Heart Medium,11.53,2,17904.0,United Kingdom
577302,2023-11-18,21871,Save The Planet Mug,11.94,1,17904.0,United Kingdom
577302,2023-11-18,22594,Christmas Gingham Tree,11.12,1,17904.0,United Kingdom
577302,2023-11-18,22595,Gingham Heart Decoration,11.12,1,17904.0,United Kingdom
577302,2023-11-18,22086,Paper Chain Kit 50'S Christmas,13.27,1,17904.0,United Kingdom
577302,2023-11-18,22930,Baking Mould Heart Milk Chocolate,12.86,1,17904.0,United Kingdom
577302,2023-11-18,22742,Make Your Own Playtime Card Kit,13.27,1,17904.0,United Kingdom
577302,2023-11-18,22513,Doorstop Football Design,14.09,1,17904.0,United Kingdom
577302,2023-11-18,23568,Egg Cup Henrietta Hen Cream,11.53,2,17904.0,United Kingdom
577302,2023-11-18,21034,Rex Cash+Carry Jumbo Shopper,11.22,1,17904.0,United Kingdom
577302,2023-11-18,21888,Bingo Set,14.09,1,17904.0,United Kingdom
577302,2023-11-18,23355,Hot Water Bottle Keep Calm,15.32,1,17904.0,United Kingdom
577302,2023-11-18,23356,Love Hot Water Bottle,16.35,1,17904.0,United Kingdom
577302,2023-11-18,21034,Rex Cash+Carry Jumbo Shopper,11.22,1,17904.0,United Kingdom
577302,2023-11-18,22786,Cushion Cover Pink Union Jack,16.35,1,17904.0,United Kingdom
577302,2023-11-18,23355,Hot Water Bottle Keep Calm,15.32,1,17904.0,United Kingdom
577303,2023-11-18,21479,White Skull Hot Water Bottle,14.61,12,14390.0,United Kingdom
577303,2023-11-18,22835,Hot Water Bottle I Am So Poorly,15.32,12,14390.0,United Kingdom
577303,2023-11-18,22112,Chocolate Hot Water Bottle,15.32,12,14390.0,United Kingdom
577303,2023-11-18,23109,Pack Of Six Led Tea Lights,13.21,36,14390.0,United Kingdom
577303,2023-11-18,22174,Photo Cube,11.94,12,14390.0,United Kingdom
577303,2023-11-18,23388,Woodland Mini Backpack,14.5,4,14390.0,United Kingdom
577303,2023-11-18,23389,Spaceboy Mini Backpack,14.5,4,14390.0,United Kingdom
577303,2023-11-18,22197,Popcorn Holder,11.12,12,14390.0,United Kingdom
577303,2023-11-18,23390,Dolly Girl Mini Backpack,14.5,3,14390.0,United Kingdom
577303,2023-11-18,20723,Strawberry Charlotte Bag,11.12,10,14390.0,United Kingdom
577303,2023-11-18,22086,Paper Chain Kit 50'S Christmas,13.27,12,14390.0,United Kingdom
577303,2023-11-18,84879,Assorted Colour Bird Ornament,11.98,32,14390.0,United Kingdom
577303,2023-11-18,22437,Set Of 9 Black Skull Balloons,11.12,1,14390.0,United Kingdom
577303,2023-11-18,21891,Traditional Wooden Skipping Rope,11.74,4,14390.0,United Kingdom
577303,2023-11-18,22554,Plasters In Tin Woodland Animals,11.94,6,14390.0,United Kingdom
577303,2023-11-18,22553,Plasters In Tin Skulls,11.94,6,14390.0,United Kingdom
577303,2023-11-18,22556,Plasters In Tin Circus Parade,11.94,6,14390.0,United Kingdom
577303,2023-11-18,85135A,Yellow Dragonfly Helicopter,18.4,10,14390.0,United Kingdom
577303,2023-11-18,22356,Charlotte Bag Pink Polkadot,11.12,10,14390.0,United Kingdom
577303,2023-11-18,20724,Red Retrospot Charlotte Bag,11.12,10,14390.0,United Kingdom
577303,2023-11-18,84997C,Childrens Cutlery Polkadot Blue,14.5,3,14390.0,United Kingdom
577303,2023-11-18,84997A,Childrens Cutlery Polkadot Green,14.5,3,14390.0,United Kingdom
577303,2023-11-18,84997B,Childrens Cutlery Retrospot Red,14.5,3,14390.0,United Kingdom
577303,2023-11-18,84997D,Childrens Cutlery Polkadot Pink,14.5,3,14390.0,United Kingdom
577303,2023-11-18,20717,Strawberry Shopper Bag,11.53,10,14390.0,United Kingdom
577303,2023-11-18,20718,Red Retrospot Shopper Bag,11.53,10,14390.0,United Kingdom
577303,2023-11-18,21833,Camouflage Led Torch,11.98,36,14390.0,United Kingdom
577303,2023-11-18,21930,Jumbo Storage Bag Skulls,12.38,10,14390.0,United Kingdom
577303,2023-11-18,23344,Jumbo Bag 50'S Christmas,6.19,10,14390.0,United Kingdom
577303,2023-11-18,85099B,Jumbo Bag Red Retrospot,6.19,10,14390.0,United Kingdom
577303,2023-11-18,22386,Jumbo Bag Pink Polkadot,6.19,10,14390.0,United Kingdom
577303,2023-11-18,22663,Jumbo Bag Dolly Girl Design,6.19,10,14390.0,United Kingdom
577303,2023-11-18,85099C,Jumbo Bag Baroque Black White,6.19,10,14390.0,United Kingdom
577303,2023-11-18,22385,Jumbo Bag Spaceboy Design,6.19,10,14390.0,United Kingdom
577303,2023-11-18,85099F,Jumbo Bag Strawberry,6.19,10,14390.0,United Kingdom
577303,2023-11-18,20725,Lunch Bag Red Retrospot,5.97,10,14390.0,United Kingdom
577303,2023-11-18,20728,Lunch Bag Cars Blue,5.97,10,14390.0,United Kingdom
577303,2023-11-18,20727,Lunch Bag Black Skull,5.97,20,14390.0,United Kingdom
577303,2023-11-18,22384,Lunch Bag Pink Polkadot,5.97,10,14390.0,United Kingdom
577308,2023-11-18,21756,Bath Building Block Word,16.66,3,15088.0,United Kingdom
577308,2023-11-18,21754,Home Building Block Word,16.66,3,15088.0,United Kingdom
577308,2023-11-18,22623,Box Of Vintage Jigsaw Blocks,16.35,3,15088.0,United Kingdom
577308,2023-11-18,23077,Doughnut Lip Gloss,11.53,20,15088.0,United Kingdom
577308,2023-11-18,22553,Plasters In Tin Skulls,11.94,12,15088.0,United Kingdom
577308,2023-11-18,22557,Plasters In Tin Vintage Paisley,11.94,12,15088.0,United Kingdom
577308,2023-11-18,22197,Popcorn Holder,11.12,12,15088.0,United Kingdom
577308,2023-11-18,22030,Swallows Greeting Card,10.68,12,15088.0,United Kingdom
577308,2023-11-18,22113,Grey Heart Hot Water Bottle,14.61,4,15088.0,United Kingdom
577308,2023-11-18,22114,Hot Water Bottle Tea And Sympathy,14.61,4,15088.0,United Kingdom
577308,2023-11-18,22915,Assorted Bottle Top Magnets,10.68,12,15088.0,United Kingdom
577308,2023-11-18,21172,Party Metal Sign,11.74,12,15088.0,United Kingdom
577308,2023-11-18,48187,Doormat New England,18.71,2,15088.0,United Kingdom
577308,2023-11-18,21523,Doormat Fancy Font Home Sweet Home,18.71,2,15088.0,United Kingdom
577308,2023-11-18,82484,Wood Black Board Ant White Finish,18.4,2,15088.0,United Kingdom
577309,2023-11-18,22087,Paper Bunting White Lace,13.27,6,15933.0,United Kingdom
577309,2023-11-18,20749,Assorted Colour Mini Cases,18.4,2,15933.0,United Kingdom
577309,2023-11-18,22138,Baking Set 9 Piece Retrospot,15.32,3,15933.0,United Kingdom
577309,2023-11-18,22139,Retrospot Tea Set Ceramic 11 Pc,15.32,6,15933.0,United Kingdom
577309,2023-11-18,22621,Traditional Knitting Nancy,11.94,12,15933.0,United Kingdom
577309,2023-11-18,22027,Tea Party Birthday Card,10.68,12,15933.0,United Kingdom
577309,2023-11-18,22037,Robot Birthday Card,10.68,12,15933.0,United Kingdom
577309,2023-11-18,22029,Spaceboy Birthday Card,10.68,12,15933.0,United Kingdom
577309,2023-11-18,22814,Card Party Games,10.68,12,15933.0,United Kingdom
577309,2023-11-18,22585,Pack Of 6 Birdy Gift Tags,11.53,12,15933.0,United Kingdom
577309,2023-11-18,20718,Red Retrospot Shopper Bag,11.53,20,15933.0,United Kingdom
577309,2023-11-18,84378,Set Of 3 Heart Cookie Cutters,11.74,12,15933.0,United Kingdom
577309,2023-11-18,23167,Small Ceramic Top Storage Jar,11.1,12,15933.0,United Kingdom
577309,2023-11-18,23245,Set Of 3 Regency Cake Tins,15.32,4,15933.0,United Kingdom
577309,2023-11-18,21871,Save The Planet Mug,11.94,12,15933.0,United Kingdom
577309,2023-11-18,20914,Set/5 Red Retrospot Lid Glass Bowls,13.27,6,15933.0,United Kingdom
577309,2023-11-18,23035,Drawer Knob Ceramic Ivory,11.74,6,15933.0,United Kingdom
577309,2023-11-18,85123A,Cream Hanging Heart T-Light Holder,13.27,6,15933.0,United Kingdom
577309,2023-11-18,84970S,Hanging Heart Zinc T-Light Holder,11.12,12,15933.0,United Kingdom
577309,2023-11-18,23144,Zinc T-Light Holder Stars Small,11.1,12,15933.0,United Kingdom
577309,2023-11-18,84945,Multi Colour Silver T-Light Holder,11.12,12,15933.0,United Kingdom
577309,2023-11-18,84879,Assorted Colour Bird Ornament,11.98,8,15933.0,United Kingdom
577309,2023-11-18,23263,Set Of 3 Wooden Heart Decorations,11.53,12,15933.0,United Kingdom
577309,2023-11-18,23271,Christmas Table Silver Candle Spike,11.1,16,15933.0,United Kingdom
577309,2023-11-18,22945,Christmas Metal Tags Assorted,11.12,12,15933.0,United Kingdom
577309,2023-11-18,23353,6 Gift Tags Vintage Christmas,11.1,12,15933.0,United Kingdom
577309,2023-11-18,22910,Paper Chain Kit Vintage Christmas,13.27,6,15933.0,United Kingdom
577310,2023-11-18,21891,Traditional Wooden Skipping Rope,11.53,144,13516.0,United Kingdom
577310,2023-11-18,21892,Traditional Wooden Catch Cup Game,11.34,144,13516.0,United Kingdom
577310,2023-11-18,21914,Blue Harmonica In Box,11.53,120,13516.0,United Kingdom
577310,2023-11-18,23371,Set 36 Colour Pencils Spaceboy,11.34,128,13516.0,United Kingdom
577310,2023-11-18,23372,Set 36 Colour Pencils Dolly Girl,11.34,128,13516.0,United Kingdom
577311,2023-11-18,22112,Chocolate Hot Water Bottle,15.32,1,18225.0,United Kingdom
577311,2023-11-18,23355,Hot Water Bottle Keep Calm,15.32,1,18225.0,United Kingdom
577311,2023-11-18,21479,White Skull Hot Water Bottle,14.61,6,18225.0,United Kingdom
577311,2023-11-18,22914,Blue Coat Rack Paris Fashion,15.32,1,18225.0,United Kingdom
577311,2023-11-18,22913,Red Coat Rack Paris Fashion,15.32,1,18225.0,United Kingdom
577311,2023-11-18,22912,Yellow Coat Rack Paris Fashion,15.32,1,18225.0,United Kingdom
577311,2023-11-18,23355,Hot Water Bottle Keep Calm,15.32,2,18225.0,United Kingdom
577311,2023-11-18,23356,Love Hot Water Bottle,16.35,1,18225.0,United Kingdom
577311,2023-11-18,22114,Hot Water Bottle Tea And Sympathy,14.61,2,18225.0,United Kingdom
577311,2023-11-18,37413,Icon Mug Revolutionary,10.65,6,18225.0,United Kingdom
577311,2023-11-18,21930,Jumbo Storage Bag Skulls,12.38,2,18225.0,United Kingdom
577311,2023-11-18,23581,Jumbo Bag Paisley Park,6.19,1,18225.0,United Kingdom
577311,2023-11-18,21928,Jumbo Bag Scandinavian Blue Paisley,6.19,1,18225.0,United Kingdom
577311,2023-11-18,23581,Jumbo Bag Paisley Park,6.19,2,18225.0,United Kingdom
577311,2023-11-18,21929,Jumbo Bag Pink Vintage Paisley,6.19,1,18225.0,United Kingdom
577311,2023-11-18,23202,Jumbo Bag Vintage Leaf,6.19,1,18225.0,United Kingdom
577311,2023-11-18,22385,Jumbo Bag Spaceboy Design,6.19,2,18225.0,United Kingdom
577311,2023-11-18,23201,Jumbo Bag Alphabet,6.19,2,18225.0,United Kingdom
577311,2023-11-18,21929,Jumbo Bag Pink Vintage Paisley,6.19,1,18225.0,United Kingdom
577311,2023-11-18,23581,Jumbo Bag Paisley Park,6.19,1,18225.0,United Kingdom
577311,2023-11-18,85099F,Jumbo Bag Strawberry,6.19,2,18225.0,United Kingdom
577312,2023-11-18,22661,Charlotte Bag Dolly Girl Design,11.12,10,17049.0,United Kingdom
577312,2023-11-18,22112,Chocolate Hot Water Bottle,15.32,6,17049.0,United Kingdom
577312,2023-11-18,23355,Hot Water Bottle Keep Calm,15.32,4,17049.0,United Kingdom
577312,2023-11-18,23356,Love Hot Water Bottle,16.35,3,17049.0,United Kingdom
577312,2023-11-18,22508,Doorstop Retrospot Heart,14.09,4,17049.0,United Kingdom
577312,2023-11-18,21411,Gingham Heart Doorstop Red,14.61,3,17049.0,United Kingdom
577312,2023-11-18,22469,Heart Of Wicker Small,11.94,24,17049.0,United Kingdom
577312,2023-11-18,23321,Small White Heart Of Wicker,11.94,24,17049.0,United Kingdom
577312,2023-11-18,82486,3 Drawer Antique White Wood Cabinet,19.42,2,17049.0,United Kingdom
577312,2023-11-18,82483,Wood 2 Drawer Cabinet White Finish,17.37,2,17049.0,United Kingdom
577312,2023-11-18,82484,Wood Black Board Ant White Finish,18.4,4,17049.0,United Kingdom
577312,2023-11-18,48138,Doormat Union Flag,18.71,2,17049.0,United Kingdom
577312,2023-11-18,22086,Paper Chain Kit 50'S Christmas,13.27,24,17049.0,United Kingdom
577312,2023-11-18,23329,Decorative Wicker Heart Large,11.94,12,17049.0,United Kingdom
577312,2023-11-18,23330,Decorative Wicker Heart Medium,11.53,12,17049.0,United Kingdom
577312,2023-11-18,23333,Ivory Wicker Heart Medium,11.53,12,17049.0,United Kingdom
577312,2023-11-18,23332,Ivory Wicker Heart Large,11.94,12,17049.0,United Kingdom
577312,2023-11-18,23319,Box Of 6 Mini 50'S Crackers,12.8,6,17049.0,United Kingdom
577312,2023-11-18,22356,Charlotte Bag Pink Polkadot,11.12,10,17049.0,United Kingdom
577312,2023-11-18,23378,Pack Of 12 50'S Christmas Tissues,10.65,48,17049.0,United Kingdom
577312,2023-11-18,22355,Charlotte Bag Suki Design,11.12,10,17049.0,United Kingdom
577312,2023-11-18,20719,Woodland Charlotte Bag,11.12,10,17049.0,United Kingdom
577312,2023-11-18,22065,Christmas Pudding Trinket Pot,10.65,48,17049.0,United Kingdom
577312,2023-11-18,23263,Set Of 3 Wooden Heart Decorations,11.53,12,17049.0,United Kingdom
577312,2023-11-18,23265,Set Of 3 Wooden Tree Decorations,11.53,12,17049.0,United Kingdom
577312,2023-11-18,23266,Set Of 3 Wooden Stocking Decoration,11.53,12,17049.0,United Kingdom
577312,2023-11-18,20685,Doormat Red Retrospot,18.71,2,17049.0,United Kingdom
577312,2023-11-18,23581,Jumbo Bag Paisley Park,6.19,10,17049.0,United Kingdom
577312,2023-11-18,22663,Jumbo Bag Dolly Girl Design,6.19,10,17049.0,United Kingdom
577312,2023-11-18,23582,Vintage Doily Jumbo Bag Red,6.19,10,17049.0,United Kingdom
577312,2023-11-18,23344,Jumbo Bag 50'S Christmas,6.19,10,17049.0,United Kingdom
577312,2023-11-18,23203,Jumbo Bag Vintage Doily,6.19,10,17049.0,United Kingdom
577312,2023-11-18,22662,Lunch Bag Dolly Girl Design,5.97,10,17049.0,United Kingdom
577312,2023-11-18,23583,Lunch Bag Paisley Park,5.97,10,17049.0,United Kingdom
577312,2023-11-18,23209,Lunch Bag Vintage Doily,5.97,10,17049.0,United Kingdom
577312,2023-11-18,23681,Lunch Bag Red Vintage Doily,5.97,10,17049.0,United Kingdom
577313,2023-11-18,84879,Assorted Colour Bird Ornament,11.98,64,14342.0,United Kingdom
577313,2023-11-18,21500,Pink Polkadot Wrap,10.68,25,14342.0,United Kingdom
577313,2023-11-18,22816,Card Motorbike Santa,10.68,24,14342.0,United Kingdom
577313,2023-11-18,23489,Vintage Bells Garland,13.21,6,14342.0,United Kingdom
577313,2023-11-18,22433,Watering Can Green Dinosaur,12.25,6,14342.0,United Kingdom
577314,2023-11-18,22626,Black Kitchen Scales,18.96,4,12444.0,Norway
577314,2023-11-18,22624,Ivory Kitchen Scales,18.96,2,12444.0,Norway
577314,2023-11-18,82551,Laundry 15c Metal Sign,11.74,12,12444.0,Norway
577314,2023-11-18,85053,French Enamel Candleholder,12.4,12,12444.0,Norway
577314,2023-11-18,85059,French Enamel Water Basin,14.09,8,12444.0,Norway
577314,2023-11-18,23482,Pearlised Ivory Heart Large,11.94,12,12444.0,Norway
577314,2023-11-18,82494L,Wooden Frame Antique White,13.27,6,12444.0,Norway
577314,2023-11-18,23311,Vintage Christmas Stocking,12.86,6,12444.0,Norway
577314,2023-11-18,23479,Wire Egg Basket,18.3,2,12444.0,Norway
577314,2023-11-18,23564,Egg Cup Milkmaid Ingrid,11.53,12,12444.0,Norway
577314,2023-11-18,22550,Holiday Fun Ludo,14.09,4,12444.0,Norway
577314,2023-11-18,82482,Wooden Picture Frame White Finish,13.27,6,12444.0,Norway
577314,2023-11-18,21012,Antique All Glass Candlestick,12.4,6,12444.0,Norway
577314,2023-11-18,84378,Set Of 3 Heart Cookie Cutters,11.74,12,12444.0,Norway
577314,2023-11-18,22630,Dolly Girl Lunch Box,12.25,12,12444.0,Norway
577314,2023-11-18,85232D,Set/3 Decoupage Stacking Tins,15.32,3,12444.0,Norway
577314,2023-11-18,22720,Set Of 3 Cake Tins Pantry Design,15.32,3,12444.0,Norway
577314,2023-11-18,23425,Storage Tin Home Sweet Home,12.8,6,12444.0,Norway
577314,2023-11-18,23244,Round Storage Tin Vintage Leaf,12.25,6,12444.0,Norway
577314,2023-11-18,22728,Alarm Clock Bakelike Pink,14.09,4,12444.0,Norway
577314,2023-11-18,22726,Alarm Clock Bakelike Green,14.09,4,12444.0,Norway
577314,2023-11-18,22562,Monsters Stencil Craft,11.53,12,12444.0,Norway
577314,2023-11-18,22654,Deluxe Sewing Kit,16.35,3,12444.0,Norway
577314,2023-11-18,72807C,Set/3 Vanilla Scented Candle In Box,14.61,4,12444.0,Norway
577314,2023-11-18,23333,Ivory Wicker Heart Medium,11.53,12,12444.0,Norway
577314,2023-11-18,23330,Decorative Wicker Heart Medium,11.53,12,12444.0,Norway
577314,2023-11-18,22337,Angel Decoration Painted Zinc,10.92,24,12444.0,Norway
577314,2023-11-18,22694,Wicker Star,12.4,6,12444.0,Norway
577314,2023-11-18,23407,Set Of 2 Trays Home Sweet Home,10.25,2,12444.0,Norway
577315,2023-11-18,22812,Pack 3 Boxes Christmas Panettone,12.25,3,17811.0,United Kingdom
577315,2023-11-18,23284,Doormat Keep Calm And Come In,18.71,1,17811.0,United Kingdom
577315,2023-11-18,21682,Large Medina Stamped Metal Bowl,15.32,1,17811.0,United Kingdom
577315,2023-11-18,47471,Rainbow Pegs Photo Clip String,10.92,1,17811.0,United Kingdom
577315,2023-11-18,21707,Folding Umbrella Blackblue Polkadot,15.32,1,17811.0,United Kingdom
577315,2023-11-18,22982,Pantry Pastry Brush,11.53,1,17811.0,United Kingdom
577315,2023-11-18,21866,Union Jack Flag Luggage Tag,11.53,1,17811.0,United Kingdom
577315,2023-11-18,21864,Union Jack Flag Passport Cover,12.4,1,17811.0,United Kingdom
577315,2023-11-18,22197,Popcorn Holder,11.12,3,17811.0,United Kingdom
577315,2023-11-18,23074,Embossed Heart Trinket Box,12.38,8,17811.0,United Kingdom
577315,2023-11-18,21098,Christmas Toilet Roll,11.53,1,17811.0,United Kingdom
577315,2023-11-18,22086,Paper Chain Kit 50'S Christmas,13.27,2,17811.0,United Kingdom
577315,2023-11-18,23219,Laurel Star Antique Silver,11.53,5,17811.0,United Kingdom
577315,2023-11-18,23434,3 Raffia Ribbons 50'S Christmas,11.06,10,17811.0,United Kingdom
577315,2023-11-18,23293,Set Of 12 Fairy Cake Baking Cases,11.1,1,17811.0,United Kingdom
577315,2023-11-18,23439,Hand Warmer Red Love Heart,12.4,1,17811.0,United Kingdom
577315,2023-11-18,22866,Hand Warmer Scotty Dog Design,12.4,1,17811.0,United Kingdom
