TransactionNo,Date,ProductNo,ProductName,Price,Quantity,CustomerNo,Country
550178,2023-04-14,20712,Jumbo Bag Woodland Animals,6.19,20,12662.0,Germany
550178,2023-04-14,20726,Lunch Bag Woodland,5.97,20,12662.0,Germany
550178,2023-04-14,23206,Lunch Bag Apple Design,5.97,10,12662.0,Germany
550179,2023-04-14,21703,Bag 125g Swirly Marbles,10.68,12,15220.0,United Kingdom
550179,2023-04-14,21891,Traditional Wooden Skipping Rope,11.74,12,15220.0,United Kingdom
550179,2023-04-14,22109,Full English Breakfast Plate,14.09,4,15220.0,United Kingdom
550179,2023-04-14,22904,Calendar Paper Cut Design,13.27,6,15220.0,United Kingdom
550179,2023-04-14,21172,Party Metal Sign,11.74,12,15220.0,United Kingdom
550179,2023-04-14,22138,Baking Set 9 Piece Retrospot,15.32,3,15220.0,United Kingdom
550179,2023-04-14,85123A,Cream Hanging Heart T-Light Holder,13.27,6,15220.0,United Kingdom
550179,2023-04-14,84945,Multi Colour Silver T-Light Holder,11.12,24,15220.0,United Kingdom
550179,2023-04-14,22189,Cream Heart Card Holder,14.3,4,15220.0,United Kingdom
550179,2023-04-14,22617,Baking Set Spaceboy Design,15.32,3,15220.0,United Kingdom
550179,2023-04-14,22906,12 Message Cards With Envelopes,11.94,12,15220.0,United Kingdom
550179,2023-04-14,22969,Homemade Jam Scented Candles,11.74,12,15220.0,United Kingdom
550179,2023-04-14,84388,Wise Man Star Shape Egg Pan,10.65,6,15220.0,United Kingdom
550180,2023-04-14,82483,Wood 2 Drawer Cabinet White Finish,17.37,2,14163.0,United Kingdom
550180,2023-04-14,82486,3 Drawer Antique White Wood Cabinet,19.42,2,14163.0,United Kingdom
550180,2023-04-14,22443,Grow Your Own Herbs Set Of 3,18.4,2,14163.0,United Kingdom
550180,2023-04-14,22442,Grow Your Own Flowers Set Of 3,18.4,2,14163.0,United Kingdom
550180,2023-04-14,84750B,Black Small Glass Cake Stand,10.65,8,14163.0,United Kingdom
550180,2023-04-14,22801,Antique Glass Pedestal Bowl,14.09,5,14163.0,United Kingdom
550180,2023-04-14,22799,Sweetheart Wire Fruit Bowl,18.96,6,14163.0,United Kingdom
550180,2023-04-14,23078,Ice Cream Pen Lip Gloss,11.53,48,14163.0,United Kingdom
550180,2023-04-14,23077,Doughnut Lip Gloss,11.53,40,14163.0,United Kingdom
550180,2023-04-14,22441,Grow Your Own Basil In Enamel Mug,12.4,2,14163.0,United Kingdom
550180,2023-04-14,22283,6 Egg House Painted Wood,18.4,8,14163.0,United Kingdom
550180,2023-04-14,22969,Homemade Jam Scented Candles,11.74,12,14163.0,United Kingdom
550180,2023-04-14,72122,Coffee Scent Pillar Candle,11.22,3,14163.0,United Kingdom
550180,2023-04-14,20679,Edwardian Parasol Red,16.35,3,14163.0,United Kingdom
550180,2023-04-14,15056N,Edwardian Parasol Natural,16.35,5,14163.0,United Kingdom
550180,2023-04-14,15056P,Edwardian Parasol Pink,16.35,3,14163.0,United Kingdom
550182,2023-04-14,22855,Fine Wicker Heart,11.53,12,18198.0,United Kingdom
550182,2023-04-14,22178,Victorian Glass Hanging T-Light,11.34,96,18198.0,United Kingdom
550182,2023-04-14,22087,Paper Bunting White Lace,12.86,40,18198.0,United Kingdom
550182,2023-04-14,71459,Hanging Jam Jar T-Light Holders,11.12,24,18198.0,United Kingdom
550182,2023-04-14,84946,Antique Silver T-Light Glass,11.34,72,18198.0,United Kingdom
550182,2023-04-14,21658,Glass Beurre Dish,14.3,4,18198.0,United Kingdom
550183,2023-04-14,22697,Green Regency Teacup And Saucer,13.27,6,14105.0,United Kingdom
550183,2023-04-14,22699,Roses Regency Teacup And Saucer,13.27,6,14105.0,United Kingdom
550183,2023-04-14,22698,Pink Regency Teacup And Saucer,13.27,6,14105.0,United Kingdom
550183,2023-04-14,84879,Assorted Colour Bird Ornament,11.98,24,14105.0,United Kingdom
550183,2023-04-14,21754,Home Building Block Word,16.35,9,14105.0,United Kingdom
550183,2023-04-14,21756,Bath Building Block Word,16.35,3,14105.0,United Kingdom
550183,2023-04-14,85175,Cacti T-Light Candles,10.68,32,14105.0,United Kingdom
550183,2023-04-14,85174,S/4 Cacti Candles,15.32,8,14105.0,United Kingdom
550183,2023-04-14,22119,Peace Wooden Block Letters,17.37,3,14105.0,United Kingdom
550183,2023-04-14,21755,Love Building Block Word,16.35,3,14105.0,United Kingdom
550183,2023-04-14,82482,Wooden Picture Frame White Finish,12.86,6,14105.0,United Kingdom
550183,2023-04-14,22151,Place Setting White Heart,10.68,24,14105.0,United Kingdom
550183,2023-04-14,22193,Red Diner Wall Clock,18.96,2,14105.0,United Kingdom
550183,2023-04-14,22192,Blue Diner Wall Clock,18.96,2,14105.0,United Kingdom
550183,2023-04-14,22191,Ivory Diner Wall Clock,18.96,2,14105.0,United Kingdom
550183,2023-04-14,22722,Set Of 6 Spice Tins Pantry Design,14.3,4,14105.0,United Kingdom
550183,2023-04-14,22993,Set Of 4 Pantry Jelly Moulds,11.53,6,14105.0,United Kingdom
550183,2023-04-14,22960,Jam Making Set With Jars,14.61,6,14105.0,United Kingdom
550183,2023-04-14,22907,Pack Of 20 Napkins Pantry Design,11.12,12,14105.0,United Kingdom
550183,2023-04-14,22197,Popcorn Holder,11.12,12,14105.0,United Kingdom
550183,2023-04-14,22195,Large Heart Measuring Spoons,11.94,12,14105.0,United Kingdom
550183,2023-04-14,22196,Small Heart Measuring Spoons,11.12,12,14105.0,United Kingdom
550183,2023-04-14,22614,Pack Of 12 Spaceboy Tissues,10.55,24,14105.0,United Kingdom
550183,2023-04-14,21498,Red Retrospot Wrap,10.68,25,14105.0,United Kingdom
550183,2023-04-14,21500,Pink Polkadot Wrap,10.68,25,14105.0,United Kingdom
550183,2023-04-14,21499,Blue Polkadot Wrap,10.68,25,14105.0,United Kingdom
550183,2023-04-14,21497,Fancy Fonts Birthday Wrap,10.68,25,14105.0,United Kingdom
550183,2023-04-14,21506,Fancy Font Birthday Card,10.68,12,14105.0,United Kingdom
550183,2023-04-14,22551,Plasters In Tin Spaceboy,11.94,12,14105.0,United Kingdom
550183,2023-04-14,22937,Baking Mould Chocolate Cupcakes,12.86,6,14105.0,United Kingdom
550183,2023-04-14,22953,Birthday Party Cordon Barrier Tape,11.53,6,14105.0,United Kingdom
550183,2023-04-14,22556,Plasters In Tin Circus Parade,11.94,12,14105.0,United Kingdom
550183,2023-04-14,21523,Doormat Fancy Font Home Sweet Home,18.4,2,14105.0,United Kingdom
550183,2023-04-14,22149,Feltcraft 6 Flower Friends,12.4,6,14105.0,United Kingdom
550183,2023-04-14,21212,Pack Of 72 Retrospot Cake Cases,10.81,24,14105.0,United Kingdom
550183,2023-04-14,21974,Set Of 36 Paisley Flower Doilies,11.74,12,14105.0,United Kingdom
550183,2023-04-14,21977,Pack Of 60 Pink Paisley Cake Cases,10.81,24,14105.0,United Kingdom
550183,2023-04-14,84987,Set Of 36 Teatime Paper Doilies,11.74,12,14105.0,United Kingdom
550183,2023-04-14,84991,60 Teatime Fairy Cake Cases,10.81,24,14105.0,United Kingdom
550183,2023-04-14,20914,Set/5 Red Retrospot Lid Glass Bowls,13.27,6,14105.0,United Kingdom
550183,2023-04-14,20972,Pink Cream Felt Craft Trinket Box,11.53,12,14105.0,United Kingdom
550183,2023-04-14,20971,Pink Blue Felt Craft Trinket Box,11.53,12,14105.0,United Kingdom
550183,2023-04-14,22352,Lunch Box With Cutlery Retrospot,12.86,6,14105.0,United Kingdom
550183,2023-04-14,21559,Strawberry Lunch Box With Cutlery,12.86,6,14105.0,United Kingdom
550183,2023-04-14,22353,Lunch Box With Cutlery Fairy Cakes,12.86,6,14105.0,United Kingdom
550183,2023-04-14,22326,Round Snack Boxes Set Of4 Woodland,13.27,6,14105.0,United Kingdom
550183,2023-04-14,22366,Doormat Airmail,18.4,2,14105.0,United Kingdom
550183,2023-04-14,21495,Skulls And Crossbones Wrap,10.68,25,14105.0,United Kingdom
550183,2023-04-14,22716,Card Circus Parade,10.68,12,14105.0,United Kingdom
550183,2023-04-14,21508,Vintage Kid Dolly Card,10.68,12,14105.0,United Kingdom
550183,2023-04-14,22027,Tea Party Birthday Card,10.68,12,14105.0,United Kingdom
550183,2023-04-14,22029,Spaceboy Birthday Card,10.68,12,14105.0,United Kingdom
550183,2023-04-14,22712,Card Dolly Girl,10.68,12,14105.0,United Kingdom
550183,2023-04-14,22375,Airline Bag Vintage Jet Set Brown,14.61,6,14105.0,United Kingdom
550183,2023-04-14,22374,Airline Bag Vintage Jet Set Red,14.61,6,14105.0,United Kingdom
550183,2023-04-14,22371,Airline Bag Vintage Tokyo 78,14.61,6,14105.0,United Kingdom
550183,2023-04-14,22729,Alarm Clock Bakelike Orange,14.09,12,14105.0,United Kingdom
550183,2023-04-14,22728,Alarm Clock Bakelike Pink,14.09,12,14105.0,United Kingdom
550183,2023-04-14,22973,Children's Circus Parade Mug,11.94,6,14105.0,United Kingdom
550183,2023-04-14,22974,Childrens Dolly Girl Mug,11.94,6,14105.0,United Kingdom
550183,2023-04-14,22972,Children's Spaceboy Mug,11.94,12,14105.0,United Kingdom
550183,2023-04-14,22630,Dolly Girl Lunch Box,12.25,12,14105.0,United Kingdom
550183,2023-04-14,22107,Pizza Plate In Box,14.09,4,14105.0,United Kingdom
550183,2023-04-14,22109,Full English Breakfast Plate,14.09,4,14105.0,United Kingdom
550183,2023-04-14,22417,Pack Of 60 Spaceboy Cake Cases,10.81,24,14105.0,United Kingdom
550183,2023-04-14,22951,60 Cake Cases Dolly Girl Design,10.81,24,14105.0,United Kingdom
550183,2023-04-14,22416,Set Of 36 Spaceboy Paper Doilies,11.74,12,14105.0,United Kingdom
550183,2023-04-14,22949,Set Of 36 Dolly Girl Paper Doilies,11.74,12,14105.0,United Kingdom
550183,2023-04-14,22935,Baking Mould Rose Milk Chocolate,13.58,6,14105.0,United Kingdom
550183,2023-04-14,22931,Baking Mould Heart White Chocolate,12.86,6,14105.0,United Kingdom
550183,2023-04-14,22930,Baking Mould Heart Milk Chocolate,12.86,6,14105.0,United Kingdom
550184,2023-04-14,23078,Ice Cream Pen Lip Gloss,11.53,24,17601.0,United Kingdom
550184,2023-04-14,21829,Dinosaur Keyrings Assorted,10.47,36,17601.0,United Kingdom
550184,2023-04-14,84375,Set Of 20 Kids Cookie Cutters,12.4,1,17601.0,United Kingdom
550184,2023-04-14,84569D,Pack 6 Heart/Ice-Cream Patches,11.53,6,17601.0,United Kingdom
550184,2023-04-14,22621,Traditional Knitting Nancy,11.94,6,17601.0,United Kingdom
550184,2023-04-14,22149,Feltcraft 6 Flower Friends,12.4,7,17601.0,United Kingdom
550184,2023-04-14,22147,Feltcraft Butterfly Hearts,11.74,12,17601.0,United Kingdom
550184,2023-04-14,21108,Fairy Cake Flannel Assorted Colour,12.86,9,17601.0,United Kingdom
550184,2023-04-14,22438,Balloon Art Make Your Own Flowers,12.25,2,17601.0,United Kingdom
550185,2023-04-14,23053,Recycled Acapulco Mat Pink,18.71,2,17142.0,United Kingdom
550185,2023-04-14,23052,Recycled Acapulco Mat Turquoise,18.71,2,17142.0,United Kingdom
550185,2023-04-14,23051,Recycled Acapulco Mat Blue,18.71,2,17142.0,United Kingdom
550185,2023-04-14,23049,Recycled Acapulco Mat Red,18.71,2,17142.0,United Kingdom
550185,2023-04-14,22825,Decorative Plant Pot With Frieze,18.4,6,17142.0,United Kingdom
550185,2023-04-14,22090,Paper Bunting Retrospot,13.27,6,17142.0,United Kingdom
550185,2023-04-14,22087,Paper Bunting White Lace,13.27,6,17142.0,United Kingdom
550185,2023-04-14,21189,White Honeycomb Paper Garland,11.94,12,17142.0,United Kingdom
550185,2023-04-14,22083,Paper Chain Kit Retrospot,13.27,6,17142.0,United Kingdom
550185,2023-04-14,22992,Revolver Wooden Ruler,12.25,12,17142.0,United Kingdom
550185,2023-04-14,22991,Giraffe Wooden Ruler,12.25,12,17142.0,United Kingdom
550186,2023-04-14,21871,Save The Planet Mug,11.53,12,14051.0,United Kingdom
550186,2023-04-14,21523,Doormat Fancy Font Home Sweet Home,17.17,20,14051.0,United Kingdom
550186,2023-04-14,48173C,Doormat Black Flock,17.17,10,14051.0,United Kingdom
550186,2023-04-14,22699,Roses Regency Teacup And Saucer,13.27,18,14051.0,United Kingdom
550186,2023-04-14,22698,Pink Regency Teacup And Saucer,13.27,12,14051.0,United Kingdom
550186,2023-04-14,22697,Green Regency Teacup And Saucer,13.27,12,14051.0,United Kingdom
550186,2023-04-14,22314,Office Mug Warmer Choc+Blue,13.27,12,14051.0,United Kingdom
550187,2023-04-14,23050,Recycled Acapulco Mat Green,18.71,5,13811.0,Germany
550187,2023-04-14,23051,Recycled Acapulco Mat Blue,18.71,5,13811.0,Germany
550187,2023-04-14,23052,Recycled Acapulco Mat Turquoise,18.71,5,13811.0,Germany
550187,2023-04-14,23049,Recycled Acapulco Mat Red,18.71,7,13811.0,Germany
550187,2023-04-14,23053,Recycled Acapulco Mat Pink,18.71,5,13811.0,Germany
550188,2023-04-14,22551,Plasters In Tin Spaceboy,11.94,12,12457.0,Switzerland
550188,2023-04-14,22554,Plasters In Tin Woodland Animals,11.94,12,12457.0,Switzerland
550188,2023-04-14,22556,Plasters In Tin Circus Parade,11.94,12,12457.0,Switzerland
550188,2023-04-14,22555,Plasters In Tin Strongman,11.94,12,12457.0,Switzerland
550188,2023-04-14,22623,Box Of Vintage Jigsaw Blocks,15.32,3,12457.0,Switzerland
550188,2023-04-14,47566,Party Bunting,15.32,8,12457.0,Switzerland
550188,2023-04-14,21889,Wooden Box Of Dominoes,11.53,12,12457.0,Switzerland
550188,2023-04-14,47594A,Carousel Design Washbag,12.25,6,12457.0,Switzerland
550188,2023-04-14,22636,Childs Breakfast Set Circus Parade,18.09,8,12457.0,Switzerland
550188,2023-04-14,21976,Pack Of 60 Mushroom Cake Cases,10.81,24,12457.0,Switzerland
550188,2023-04-14,84086C,Pink/Purple Retro Radio,13.27,12,12457.0,Switzerland
550188,2023-04-14,22629,Spaceboy Lunch Box,12.25,12,12457.0,Switzerland
550188,2023-04-14,22192,Blue Diner Wall Clock,18.96,2,12457.0,Switzerland
550188,2023-04-14,21888,Bingo Set,14.09,4,12457.0,Switzerland
550188,2023-04-14,22243,5 Hook Hanger Red Magic Toadstool,11.94,12,12457.0,Switzerland
550188,2023-04-14,22367,Childrens Apron Spaceboy Design,12.25,16,12457.0,Switzerland
550188,2023-04-14,22898,Childrens Apron Apples Design,12.25,8,12457.0,Switzerland
550188,2023-04-14,21156,Retrospot Childrens Apron,12.25,8,12457.0,Switzerland
550188,2023-04-14,22636,Childs Breakfast Set Circus Parade,10.25,1,12457.0,Switzerland
550189,2023-04-14,85186A,Easter Bunny Garland Of Flowers,10.68,7,13230.0,United Kingdom
550189,2023-04-14,85186C,Bunny Egg Garland,10.68,6,13230.0,United Kingdom
550189,2023-04-14,22668,Pink Baby Bunting,13.27,2,13230.0,United Kingdom
550189,2023-04-14,22669,Red Baby Bunting,13.27,2,13230.0,United Kingdom
550189,2023-04-14,22268,Decoration Sitting Bunny,11.12,3,13230.0,United Kingdom
550189,2023-04-14,22934,Baking Mould Easter Egg White Choc,13.27,2,13230.0,United Kingdom
550189,2023-04-14,85123A,Cream Hanging Heart T-Light Holder,13.27,1,13230.0,United Kingdom
550189,2023-04-14,47566B,Tea Time Party Bunting,15.32,5,13230.0,United Kingdom
550189,2023-04-14,47566,Party Bunting,15.32,5,13230.0,United Kingdom
550189,2023-04-14,21730,Glass Star Frosted T-Light Holder,15.32,1,13230.0,United Kingdom
550189,2023-04-14,22719,Gumball Monochrome Coat Rack,11.53,3,13230.0,United Kingdom
550189,2023-04-14,22467,Gumball Coat Rack,12.86,3,13230.0,United Kingdom
550189,2023-04-14,21034,Rex Cash+Carry Jumbo Shopper,11.22,1,13230.0,United Kingdom
550189,2023-04-14,22465,Hanging Metal Star Lantern,11.94,2,13230.0,United Kingdom
550189,2023-04-14,22464,Hanging Metal Heart Lantern,11.94,2,13230.0,United Kingdom
550189,2023-04-14,22349,Dog Bowl Chasing Ball Design,14.09,1,13230.0,United Kingdom
550189,2023-04-14,22350,Illustrated Cat Bowl,12.86,2,13230.0,United Kingdom
550189,2023-04-14,82484,Wood Black Board Ant White Finish,18.4,2,13230.0,United Kingdom
550189,2023-04-14,84792,Enchanted Bird Coathanger 5 Hook,15.02,1,13230.0,United Kingdom
550189,2023-04-14,23199,Jumbo Bag Apples,6.19,2,13230.0,United Kingdom
550190,2023-04-14,22653,Button Box,12.25,10,15135.0,United Kingdom
550190,2023-04-14,22654,Deluxe Sewing Kit,16.35,3,15135.0,United Kingdom
550190,2023-04-14,20967,Grey Floral Feltcraft Shoulder Bag,14.09,4,15135.0,United Kingdom
550190,2023-04-14,20969,Red Floral Feltcraft Shoulder Bag,14.09,4,15135.0,United Kingdom
550190,2023-04-14,20970,Pink Floral Feltcraft Shoulder Bag,14.09,4,15135.0,United Kingdom
550190,2023-04-14,22749,Feltcraft Princess Charlotte Doll,14.09,4,15135.0,United Kingdom
550190,2023-04-14,22569,Feltcraft Cushion Butterfly,14.09,4,15135.0,United Kingdom
550190,2023-04-14,22570,Feltcraft Cushion Rabbit,14.09,4,15135.0,United Kingdom
550190,2023-04-14,62086A,Pink Retro Big Flower Bag,12.25,6,15135.0,United Kingdom
550191,2023-04-14,21654,Ridged Glass Finger Bowl,10.65,6,16806.0,United Kingdom
550191,2023-04-14,22362,Glass Jar Peacock Bath Salts,13.27,9,16806.0,United Kingdom
550191,2023-04-14,85144,Jardin Etched Glass Cheese Dish,12.25,3,16806.0,United Kingdom
550191,2023-04-14,85141,Jardin Etched Glass Fruitbowl,14.3,1,16806.0,United Kingdom
550191,2023-04-14,22488,Natural Slate Rectangle Chalkboard,11.94,6,16806.0,United Kingdom
550191,2023-04-14,20803,Small Pink Glass Sundae Dish,10.65,6,16806.0,United Kingdom
550191,2023-04-14,22304,Coffee Mug Blue Paisley Design,12.86,6,16806.0,United Kingdom
550191,2023-04-14,22305,Coffee Mug Pink Paisley Design,12.86,6,16806.0,United Kingdom
550191,2023-04-14,84978,Hanging Heart Jar T-Light Holder,11.53,6,16806.0,United Kingdom
550191,2023-04-14,22295,Heart Filigree Dove Large,11.94,24,16806.0,United Kingdom
550191,2023-04-14,20801,Large Pink Glass Sundae Dish,11.06,2,16806.0,United Kingdom
550191,2023-04-14,22358,Kings Choice Tea Caddy,13.27,2,16806.0,United Kingdom
550191,2023-04-14,85141,Jardin Etched Glass Fruitbowl,14.3,1,16806.0,United Kingdom
550191,2023-04-14,21654,Ridged Glass Finger Bowl,10.65,6,16806.0,United Kingdom
550191,2023-04-14,84879,Assorted Colour Bird Ornament,11.98,16,16806.0,United Kingdom
550191,2023-04-14,84978,Hanging Heart Jar T-Light Holder,11.53,6,16806.0,United Kingdom
550191,2023-04-14,22178,Victorian Glass Hanging T-Light,11.53,6,16806.0,United Kingdom
550191,2023-04-14,22722,Set Of 6 Spice Tins Pantry Design,14.3,2,16806.0,United Kingdom
550191,2023-04-14,85144,Jardin Etched Glass Cheese Dish,12.25,1,16806.0,United Kingdom
549995,2023-04-14,22423,Regency Cakestand 3 Tier,23.32,2,16131.0,United Kingdom
549995,2023-04-14,22605,Wooden Croquet Garden Set,23.32,4,16131.0,United Kingdom
549999,2023-04-14,22424,Enamel Bread Bin Cream,23.32,2,15813.0,United Kingdom
550000,2023-04-14,22424,Enamel Bread Bin Cream,23.32,2,17058.0,United Kingdom
550003,2023-04-14,22423,Regency Cakestand 3 Tier,23.32,1,14428.0,United Kingdom
550006,2023-04-14,22760,Tray Breakfast In Bed,23.32,2,17841.0,United Kingdom
550016,2023-04-14,22605,Wooden Croquet Garden Set,23.32,4,15416.0,United Kingdom
550016,2023-04-14,22606,Wooden Skittles Garden Set,23.32,4,15416.0,United Kingdom
550035,2023-04-14,22424,Enamel Bread Bin Cream,23.32,3,15039.0,United Kingdom
550054,2023-04-14,22423,Regency Cakestand 3 Tier,23.32,6,14040.0,United Kingdom
550071,2023-04-14,85066,Cream Sweetheart Mini Chest,23.32,2,16735.0,United Kingdom
550124,2023-04-14,22423,Regency Cakestand 3 Tier,23.32,4,12853.0,United Kingdom
550125,2023-04-14,22423,Regency Cakestand 3 Tier,23.32,2,13317.0,United Kingdom
550128,2023-04-14,22423,Regency Cakestand 3 Tier,23.32,1,16128.0,United Kingdom
550134,2023-04-14,22605,Wooden Croquet Garden Set,23.32,4,16249.0,United Kingdom
550134,2023-04-14,22606,Wooden Skittles Garden Set,23.32,4,16249.0,United Kingdom
550137,2023-04-14,84968A,Set Of 16 Vintage Rose Cutlery,23.32,5,12477.0,Germany
550137,2023-04-14,84968C,Set Of 16 Vintage Pistachio Cutlery,23.32,5,12477.0,Germany
550145,2023-04-14,22423,Regency Cakestand 3 Tier,23.32,1,12637.0,France
550151,2023-04-14,22423,Regency Cakestand 3 Tier,23.32,11,13089.0,United Kingdom
550158,2023-04-14,21340,Classic Metal Birdcage Plant Holder,23.32,2,13989.0,United Kingdom
550161,2023-04-14,22423,Regency Cakestand 3 Tier,23.32,4,14154.0,United Kingdom
550167,2023-04-14,22485,Set Of 2 Wooden Market Crates,23.32,2,14206.0,United Kingdom
550183,2023-04-14,22423,Regency Cakestand 3 Tier,23.32,2,14105.0,United Kingdom
550183,2023-04-14,85066,Cream Sweetheart Mini Chest,23.32,2,14105.0,United Kingdom
550185,2023-04-14,22423,Regency Cakestand 3 Tier,23.32,3,17142.0,United Kingdom
550185,2023-04-14,21340,Classic Metal Birdcage Plant Holder,23.32,6,17142.0,United Kingdom
550186,2023-04-14,22423,Regency Cakestand 3 Tier,23.32,10,14051.0,United Kingdom
550189,2023-04-14,21735,Two Door Curio Cabinet,23.32,1,13230.0,United Kingdom
550191,2023-04-14,21340,Classic Metal Birdcage Plant Holder,23.32,2,16806.0,United Kingdom
C550024,2023-04-14,22423,Regency Cakestand 3 Tier,23.32,-11,13089.0,United Kingdom
550185,2023-04-14,22622,Box Of Vintage Alphabet Blocks,22.5,3,17142.0,United Kingdom
549996,2023-04-14,22423,Regency Cakestand 3 Tier,21.47,32,15189.0,United Kingdom
549999,2023-04-14,22423,Regency Cakestand 3 Tier,21.47,16,15813.0,United Kingdom
550017,2023-04-14,21843,Red Retrospot Cake Stand,21.47,2,17865.0,United Kingdom
550158,2023-04-14,21843,Red Retrospot Cake Stand,21.47,2,13989.0,United Kingdom
550144,2023-04-14,22832,Brocante Shelf With Hooks,21.27,1,16520.0,United Kingdom
550191,2023-04-14,22832,Brocante Shelf With Hooks,21.27,2,16806.0,United Kingdom
549999,2023-04-14,22061,Large Cake Stand Hanging Strawbery,20.45,2,15813.0,United Kingdom
550000,2023-04-14,22501,Picnic Basket Wicker Large,20.45,2,17058.0,United Kingdom
550000,2023-04-14,22120,Welcome Wooden Block Letters,20.45,3,17058.0,United Kingdom
550001,2023-04-14,22767,Triple Photo Frame Cornice,20.45,2,17704.0,United Kingdom
550006,2023-04-14,22788,Brocante Coat Rack,20.45,2,17841.0,United Kingdom
550006,2023-04-14,22776,Sweetheart 3 Tier Cake Stand,20.45,1,17841.0,United Kingdom
550008,2023-04-14,22607,Wooden Rounders Garden Set,20.45,2,15570.0,United Kingdom
550016,2023-04-14,22607,Wooden Rounders Garden Set,20.45,6,15416.0,United Kingdom
550016,2023-04-14,22796,Photo Frame 3 Classic Hanging,20.45,2,15416.0,United Kingdom
550106,2023-04-14,22607,Wooden Rounders Garden Set,20.45,1,13772.0,United Kingdom
550123,2023-04-14,21623,Vintage Union Jack Memoboard,20.45,1,17123.0,United Kingdom
550130,2023-04-14,22501,Picnic Basket Wicker Large,20.45,1,14390.0,United Kingdom
550132,2023-04-14,22487,White Wood Garden Plant Ladder,20.45,2,16933.0,United Kingdom
550136,2023-04-14,22501,Picnic Basket Wicker Large,20.45,4,16957.0,United Kingdom
550144,2023-04-14,22607,Wooden Rounders Garden Set,20.45,1,16520.0,United Kingdom
550144,2023-04-14,84974,S/2 Zinc Heart Design Planters,20.45,1,16520.0,United Kingdom
550144,2023-04-14,22501,Picnic Basket Wicker Large,20.45,1,16520.0,United Kingdom
550161,2023-04-14,22796,Photo Frame 3 Classic Hanging,20.45,2,14154.0,United Kingdom
550161,2023-04-14,22768,Family Photo Frame Cornice,20.45,2,14154.0,United Kingdom
550161,2023-04-14,22767,Triple Photo Frame Cornice,20.45,2,14154.0,United Kingdom
550163,2023-04-14,22634,Childs Breakfast Set Spaceboy,20.45,2,14154.0,United Kingdom
550178,2023-04-14,22894,Tablecloth Red Apples Design,20.45,2,12662.0,Germany
550183,2023-04-14,22120,Welcome Wooden Block Letters,20.45,3,14105.0,United Kingdom
550188,2023-04-14,22622,Box Of Vintage Alphabet Blocks,20.45,4,12457.0,Switzerland
C550010,2023-04-14,84950,Assorted Colour T-Light Holder,10.81,-4,15299.0,United Kingdom
C550010,2023-04-14,84856S,Small Tahiti Beach Bag,14.16,-1,15299.0,United Kingdom
C550013,2023-04-14,85159B,White Tea Coffee Sugar Jars,12.25,-1,12982.0,United Kingdom
C550013,2023-04-14,22892,Set Of Salt And Pepper Toadstools,11.53,-1,12982.0,United Kingdom
C550013,2023-04-14,22757,Large Red Babushka Notebook,11.53,-1,12982.0,United Kingdom
C550013,2023-04-14,22644,Ceramic Cherry Cake Money Bank,11.74,-5,12982.0,United Kingdom
C550013,2023-04-14,21877,Home Sweet Home Mug,11.53,-1,12982.0,United Kingdom
C550013,2023-04-14,21318,Glass Chalice Blue Small,10.65,-1,12982.0,United Kingdom
C550014,2023-04-14,23177,Treasure Island Book Box,12.56,-8,16133.0,United Kingdom
C550024,2023-04-14,84949,Silver Hanging T-Light Holder,11.74,-14,13089.0,United Kingdom
C550024,2023-04-14,22456,Natural Slate Chalkboard Large,15.32,-3,13089.0,United Kingdom
C550026,2023-04-14,23076,Ice Cream Sundae Lip Gloss,11.53,-4,14339.0,United Kingdom
C550027,2023-04-14,75049L,Large Circular Mirror Mobile,11.12,-58,14195.0,United Kingdom
C550028,2023-04-14,22332,Skulls Party Bag + Sticker Set,11.94,-1,14606.0,United Kingdom
C550029,2023-04-14,90185C,Black Diamante Expandable Ring,14.61,-6,13539.0,United Kingdom
C550099,2023-04-14,22627,Mint Kitchen Scales,18.96,-1,16933.0,United Kingdom
C550099,2023-04-14,20682,Red Retrospot Childrens Umbrella,13.58,-1,16933.0,United Kingdom
C550127,2023-04-14,37446,Mini Cake Stand With Hanging Cakes,11.74,-2,15212.0,United Kingdom
C550165,2023-04-14,22962,Jam Jar With Pink Lid,11.12,-1,15358.0,United Kingdom
C550165,2023-04-14,22962,Jam Jar With Pink Lid,11.12,-1,15358.0,United Kingdom
C550168,2023-04-14,23155,Knickerbockerglory Magnet Assorted,11.1,-1,14339.0,United Kingdom
C550170,2023-04-14,22960,Jam Making Set With Jars,14.61,-3,17017.0,United Kingdom
C550171,2023-04-14,20971,Pink Blue Felt Craft Trinket Box,11.53,-1,12585.0,Germany
C550172,2023-04-14,21736,Gold Scroll Glass T-Light Holder,10.65,-3,17440.0,United Kingdom
C550174,2023-04-14,22228,Bunny Wooden Painted With Bird,11.12,-2,16394.0,United Kingdom
C550174,2023-04-14,22229,Bunny Wooden Painted With Flower,11.12,-2,16394.0,United Kingdom
C550174,2023-04-14,22997,Travel Card Wallet Union Jack,10.68,-2,16394.0,United Kingdom
C550174,2023-04-14,23004,Travel Card Wallet Pantry,10.68,-6,16394.0,United Kingdom
C550174,2023-04-14,23002,Travel Card Wallet Skulls,10.68,-8,16394.0,United Kingdom
C550174,2023-04-14,20983,12 Pencils Tall Tube Red Retrospot,11.12,-2,16394.0,United Kingdom
C550176,2023-04-14,23155,Knickerbockerglory Magnet Assorted,11.1,-6,14619.0,United Kingdom
C550177,2023-04-14,20726,Lunch Bag Woodland,5.97,-2,13534.0,United Kingdom
C550181,2023-04-14,84596F,Small Marshmallows Pink Bowl,10.68,-16,13069.0,United Kingdom
C550181,2023-04-14,84596B,Small Dolly Mix Design Orange Bowl,10.68,-16,13069.0,United Kingdom
C550181,2023-04-14,23204,Charlotte Bag Apples Design,11.12,-5,13069.0,United Kingdom
C550181,2023-04-14,22844,Vintage Cream Dog Food Container,18.96,-5,13069.0,United Kingdom
C550181,2023-04-14,22748,Poppy's Playhouse Kitchen,12.4,-1,13069.0,United Kingdom
C550181,2023-04-14,22381,Toy Tidy Pink Polkadot,12.4,-10,13069.0,United Kingdom
C550181,2023-04-14,22090,Paper Bunting Retrospot,13.27,-10,13069.0,United Kingdom
C550181,2023-04-14,22088,Paper Bunting Coloured Lace,13.27,-15,13069.0,United Kingdom
C550181,2023-04-14,22087,Paper Bunting White Lace,13.27,-10,13069.0,United Kingdom
C550181,2023-04-14,21937,Strawberry Picnic Bag,13.27,-5,13069.0,United Kingdom
C550181,2023-04-14,21394,Red Polkadot Beaker,10.65,-12,13069.0,United Kingdom
