TransactionNo,Date,ProductNo,ProductName,Price,Quantity,CustomerNo,Country
546993,2023-03-18,22902,Tote Bag I Love London,12.4,1,17921.0,United Kingdom
546993,2023-03-18,21576,Lets Go Shopping Cotton Tote Bag,12.56,1,17921.0,United Kingdom
546993,2023-03-18,85049C,Romantic Pinks Ribbons,11.53,1,17921.0,United Kingdom
546993,2023-03-18,22082,Ribbon Reel Stripes Design,11.94,1,17921.0,United Kingdom
546993,2023-03-18,22602,Retrospot Wooden Heart Decoration,11.12,5,17921.0,United Kingdom
546993,2023-03-18,84836,Zinc Metal Heart Decoration,11.53,3,17921.0,United Kingdom
546993,2023-03-18,21389,Ivory Hanging Decoration Bird,11.12,6,17921.0,United Kingdom
546993,2023-03-18,22297,Heart Ivory Trellis Small,11.53,6,17921.0,United Kingdom
546993,2023-03-18,21385,Ivory Hanging Decoration Heart,11.12,6,17921.0,United Kingdom
546993,2023-03-18,22296,Heart Ivory Trellis Large,11.94,4,17921.0,United Kingdom
546993,2023-03-18,84970S,Hanging Heart Zinc T-Light Holder,11.12,12,17921.0,United Kingdom
546993,2023-03-18,23194,Gymkhana Treasure Book Box,12.56,4,17921.0,United Kingdom
546993,2023-03-18,84580,Mouse Toy With Pink T-Shirt,14.09,4,17921.0,United Kingdom
546993,2023-03-18,22569,Feltcraft Cushion Butterfly,14.09,1,17921.0,United Kingdom
546993,2023-03-18,22570,Feltcraft Cushion Rabbit,14.09,1,17921.0,United Kingdom
546993,2023-03-18,22568,Feltcraft Cushion Owl,14.09,1,17921.0,United Kingdom
546993,2023-03-18,22759,Set Of 3 Notebooks In Parcel,11.94,4,17921.0,United Kingdom
546993,2023-03-18,22558,Clothes Pegs Retrospot Pack 24,11.78,2,17921.0,United Kingdom
546993,2023-03-18,20979,36 Pencils Tube Red Retrospot,11.53,2,17921.0,United Kingdom
546993,2023-03-18,20979,36 Pencils Tube Red Retrospot,11.53,2,17921.0,United Kingdom
546993,2023-03-18,20992,Jazz Hearts Purse Notebook,11.12,2,17921.0,United Kingdom
546993,2023-03-18,85123A,Cream Hanging Heart T-Light Holder,13.27,5,17921.0,United Kingdom
546993,2023-03-18,21754,Home Building Block Word,16.35,2,17921.0,United Kingdom
546993,2023-03-18,21756,Bath Building Block Word,16.35,2,17921.0,United Kingdom
546993,2023-03-18,20749,Assorted Colour Mini Cases,18.4,2,17921.0,United Kingdom
546993,2023-03-18,21043,Apron Modern Vintage Cotton,12.25,12,17921.0,United Kingdom
546993,2023-03-18,21038,Set/4 Modern Vintage Cotton Napkins,11.06,2,17921.0,United Kingdom
546993,2023-03-18,21175,Gin And Tonic Diet Metal Sign,12.86,2,17921.0,United Kingdom
546993,2023-03-18,82583,Hot Baths Metal Sign,12.4,2,17921.0,United Kingdom
546993,2023-03-18,82582,Area Patrolled Metal Sign,12.4,4,17921.0,United Kingdom
546993,2023-03-18,85152,Hand Over The Chocolate Sign,12.4,1,17921.0,United Kingdom
546993,2023-03-18,22116,Metal Sign His Dinner Is Served,13.27,2,17921.0,United Kingdom
546993,2023-03-18,21179,No Junk Mail Metal Sign,11.53,6,17921.0,United Kingdom
546993,2023-03-18,21181,Please One Person Metal Sign,12.4,4,17921.0,United Kingdom
546993,2023-03-18,21166,Cook With Wine Metal Sign,12.38,2,17921.0,United Kingdom
546993,2023-03-18,22084,Paper Chain Kit Empire,13.27,2,17921.0,United Kingdom
546993,2023-03-18,22301,Coffee Mug Cat + Bird Design,12.86,4,17921.0,United Kingdom
546993,2023-03-18,22898,Childrens Apron Apples Design,12.25,2,17921.0,United Kingdom
546993,2023-03-18,22939,Adult Apron Apple Delight,15.32,2,17921.0,United Kingdom
546993,2023-03-18,22897,Oven Mitt Apples Design,11.74,2,17921.0,United Kingdom
546993,2023-03-18,22481,Black Tea Towel Classic Design,11.53,2,17921.0,United Kingdom
546993,2023-03-18,22367,Childrens Apron Spaceboy Design,12.25,2,17921.0,United Kingdom
546993,2023-03-18,22480,Red Tea Towel Classic Design,11.53,4,17921.0,United Kingdom
546994,2023-03-18,21877,Home Sweet Home Mug,11.34,144,16684.0,United Kingdom
546995,2023-03-18,21982,Pack Of 12 Suki Tissues,10.55,2,14041.0,United Kingdom
546995,2023-03-18,21985,Pack Of 12 Hearts Design Tissues,10.55,3,14041.0,United Kingdom
546995,2023-03-18,84997B,Childrens Cutlery Retrospot Red,14.5,1,14041.0,United Kingdom
546995,2023-03-18,84997D,Childrens Cutlery Polkadot Pink,14.5,1,14041.0,United Kingdom
546995,2023-03-18,21126,Set Of 6 Girls Celebration Candles,11.53,2,14041.0,United Kingdom
546995,2023-03-18,21122,Set/10 Pink Polkadot Party Candles,11.53,2,14041.0,United Kingdom
546995,2023-03-18,22907,Pack Of 20 Napkins Pantry Design,11.12,2,14041.0,United Kingdom
546995,2023-03-18,22851,Set 20 Napkins Fairy Cakes Design,11.12,1,14041.0,United Kingdom
546995,2023-03-18,21078,Set/20 Strawberry Paper Napkins,11.12,2,14041.0,United Kingdom
546995,2023-03-18,21714,Citronella Candle Garden Pot,11.53,2,14041.0,United Kingdom
546995,2023-03-18,71053,White Moroccan Metal Lantern,14.09,2,14041.0,United Kingdom
546995,2023-03-18,85160B,Black Bird Garden Design Mug,10.65,6,14041.0,United Kingdom
546995,2023-03-18,21485,Retrospot Heart Hot Water Bottle,15.32,2,14041.0,United Kingdom
546995,2023-03-18,47591D,Pink Fairy Cake Childrens Apron,12.25,19,14041.0,United Kingdom
546995,2023-03-18,22467,Gumball Coat Rack,12.86,1,14041.0,United Kingdom
546995,2023-03-18,84375,Set Of 20 Kids Cookie Cutters,12.4,19,14041.0,United Kingdom
546995,2023-03-18,22720,Set Of 3 Cake Tins Pantry Design,15.32,1,14041.0,United Kingdom
546995,2023-03-18,22906,12 Message Cards With Envelopes,11.94,1,14041.0,United Kingdom
546995,2023-03-18,84991,60 Teatime Fairy Cake Cases,10.81,1,14041.0,United Kingdom
546995,2023-03-18,20992,Jazz Hearts Purse Notebook,11.12,8,14041.0,United Kingdom
546995,2023-03-18,84536B,Fairy Cakes Notebook A7 Size,10.68,16,14041.0,United Kingdom
546996,2023-03-18,21693,Small Hammered Silver Candlepot,13.27,6,17060.0,United Kingdom
546996,2023-03-18,21694,Small Regal Silver Candlepot,13.27,6,17060.0,United Kingdom
546996,2023-03-18,84978,Hanging Heart Jar T-Light Holder,11.34,144,17060.0,United Kingdom
546996,2023-03-18,22335,Heart Decoration Painted Zinc,10.92,48,17060.0,United Kingdom
546996,2023-03-18,84946,Antique Silver T-Light Glass,11.53,12,17060.0,United Kingdom
546998,2023-03-18,20685,Doormat Red Retrospot,18.4,1,16023.0,United Kingdom
546998,2023-03-18,22507,Memo Board Retrospot Design,15.32,1,16023.0,United Kingdom
546998,2023-03-18,20717,Strawberry Shopper Bag,11.53,2,16023.0,United Kingdom
546998,2023-03-18,20718,Red Retrospot Shopper Bag,11.53,2,16023.0,United Kingdom
546998,2023-03-18,84459B,Yellow Metal Chicken Heart,11.78,3,16023.0,United Kingdom
546998,2023-03-18,84459A,Pink Metal Chicken Heart,11.78,3,16023.0,United Kingdom
546998,2023-03-18,21588,Retrospot Giant Tube Matches,12.86,3,16023.0,United Kingdom
546998,2023-03-18,22358,Kings Choice Tea Caddy,13.27,3,16023.0,United Kingdom
546998,2023-03-18,20979,36 Pencils Tube Red Retrospot,11.53,2,16023.0,United Kingdom
546998,2023-03-18,20978,36 Pencils Tube Skulls,11.53,2,16023.0,United Kingdom
546998,2023-03-18,22961,Jam Making Set Printed,11.74,4,16023.0,United Kingdom
546998,2023-03-18,21212,Pack Of 72 Retrospot Cake Cases,10.81,2,16023.0,United Kingdom
546998,2023-03-18,21977,Pack Of 60 Pink Paisley Cake Cases,10.81,1,16023.0,United Kingdom
546998,2023-03-18,22951,60 Cake Cases Dolly Girl Design,10.81,2,16023.0,United Kingdom
546998,2023-03-18,22488,Natural Slate Rectangle Chalkboard,11.94,2,16023.0,United Kingdom
546998,2023-03-18,22457,Natural Slate Heart Chalkboard,13.27,2,16023.0,United Kingdom
546998,2023-03-18,21625,Vintage Union Jack Apron,17.37,3,16023.0,United Kingdom
546998,2023-03-18,22072,Red Retrospot Tea Cup And Saucer,14.09,2,16023.0,United Kingdom
546998,2023-03-18,22649,Strawberry Fairy Cake Teapot,15.32,2,16023.0,United Kingdom
546998,2023-03-18,22060,Large Cake Stand Hanging Hearts,14.3,3,16023.0,United Kingdom
546998,2023-03-18,85099B,Jumbo Bag Red Retrospot,6.13,1,16023.0,United Kingdom
546999,2023-03-18,22926,Ivory Giant Garden Thermometer,15.32,36,17133.0,United Kingdom
546999,2023-03-18,21868,Potting Shed Tea Mug,11.34,72,17133.0,United Kingdom
546999,2023-03-18,85123A,Cream Hanging Heart T-Light Holder,12.86,32,17133.0,United Kingdom
546999,2023-03-18,22082,Ribbon Reel Stripes Design,11.94,4,17133.0,United Kingdom
546999,2023-03-18,47566,Party Bunting,14.5,50,17133.0,United Kingdom
546999,2023-03-18,82582,Area Patrolled Metal Sign,12.15,72,17133.0,United Kingdom
547000,2023-03-18,21931,Jumbo Storage Bag Suki,12.25,30,14282.0,United Kingdom
547000,2023-03-18,21935,Suki Shoulder Bag,11.94,10,14282.0,United Kingdom
547000,2023-03-18,22379,Recycling Bag Retrospot,12.4,5,14282.0,United Kingdom
547000,2023-03-18,37482P,Cubic Mug Pink Polkadot,10.65,6,14282.0,United Kingdom
547000,2023-03-18,22994,Travel Card Wallet Retrospot,10.68,24,14282.0,United Kingdom
547000,2023-03-18,22996,Travel Card Wallet Vintage Ticket,10.68,24,14282.0,United Kingdom
547000,2023-03-18,21746,Small Red Retrospot Windmill,11.53,12,14282.0,United Kingdom
547000,2023-03-18,21747,Small Skull Windmill,11.53,12,14282.0,United Kingdom
547000,2023-03-18,21749,Large Red Retrospot Windmill,12.4,6,14282.0,United Kingdom
547000,2023-03-18,21750,Large Skull Windmill,12.4,6,14282.0,United Kingdom
547000,2023-03-18,22523,Childs Garden Fork Pink,11.12,12,14282.0,United Kingdom
547000,2023-03-18,22525,Childrens Garden Gloves Pink,11.53,10,14282.0,United Kingdom
547000,2023-03-18,22524,Childrens Garden Gloves Blue,11.53,10,14282.0,United Kingdom
547000,2023-03-18,22522,Childs Garden Fork Blue,11.12,12,14282.0,United Kingdom
547000,2023-03-18,22521,Childs Garden Trowel Pink,11.12,12,14282.0,United Kingdom
547000,2023-03-18,22520,Childs Garden Trowel Blue,11.12,12,14282.0,United Kingdom
547000,2023-03-18,47504K,English Rose Garden Secateurs,12.25,12,14282.0,United Kingdom
547000,2023-03-18,15036,Assorted Colours Silk Fan,11.02,12,14282.0,United Kingdom
547000,2023-03-18,22355,Charlotte Bag Suki Design,11.12,40,14282.0,United Kingdom
547000,2023-03-18,21155,Red Retrospot Peg Bag,12.86,6,14282.0,United Kingdom
547000,2023-03-18,20754,Retrospot Red Washing Up Gloves,12.4,6,14282.0,United Kingdom
547001,2023-03-18,21704,Bag 250g Swirly Marbles,10.99,144,16656.0,United Kingdom
547001,2023-03-18,21790,Vintage Snap Cards,10.99,72,16656.0,United Kingdom
547001,2023-03-18,84508A,Camouflage Design Teddy,12.4,96,16656.0,United Kingdom
547002,2023-03-18,22805,Blue Drawer Knob Acrylic Edwardian,11.53,12,12878.0,United Kingdom
547002,2023-03-18,22771,Clear Drawer Knob Acrylic Edwardian,11.53,24,12878.0,United Kingdom
547002,2023-03-18,21668,Red Stripe Ceramic Drawer Knob,11.53,12,12878.0,United Kingdom
547002,2023-03-18,21671,Red Spot Ceramic Drawer Knob,11.53,12,12878.0,United Kingdom
547002,2023-03-18,21669,Blue Stripe Ceramic Drawer Knob,11.53,12,12878.0,United Kingdom
547002,2023-03-18,21672,White Spot Red Ceramic Drawer Knob,11.53,12,12878.0,United Kingdom
547002,2023-03-18,22772,Pink Drawer Knob Acrylic Edwardian,11.53,12,12878.0,United Kingdom
547002,2023-03-18,21670,Blue Spot Ceramic Drawer Knob,11.53,12,12878.0,United Kingdom
547002,2023-03-18,21673,White Spot Blue Ceramic Drawer Knob,11.53,12,12878.0,United Kingdom
547002,2023-03-18,22150,3 Stripey Mice Feltcraft,12.25,6,12878.0,United Kingdom
547002,2023-03-18,22570,Feltcraft Cushion Rabbit,14.09,4,12878.0,United Kingdom
547002,2023-03-18,22568,Feltcraft Cushion Owl,14.09,4,12878.0,United Kingdom
547002,2023-03-18,22693,Grow A Flytrap Or Sunflower In Tin,11.53,24,12878.0,United Kingdom
547002,2023-03-18,22567,20 Dolly Pegs Retrospot,11.53,12,12878.0,United Kingdom
547002,2023-03-18,21155,Red Retrospot Peg Bag,12.86,6,12878.0,United Kingdom
547002,2023-03-18,20754,Retrospot Red Washing Up Gloves,12.4,6,12878.0,United Kingdom
547002,2023-03-18,21447,12 Ivory Rose Peg Place Settings,11.53,12,12878.0,United Kingdom
547002,2023-03-18,84086C,Pink/Purple Retro Radio,13.27,6,12878.0,United Kingdom
547002,2023-03-18,22558,Clothes Pegs Retrospot Pack 24,11.78,12,12878.0,United Kingdom
547003,2023-03-18,15056P,Edwardian Parasol Pink,16.35,3,14155.0,United Kingdom
547003,2023-03-18,15056N,Edwardian Parasol Natural,16.35,3,14155.0,United Kingdom
547003,2023-03-18,20679,Edwardian Parasol Red,16.35,3,14155.0,United Kingdom
547003,2023-03-18,85014B,Red Retrospot Umbrella,16.35,3,14155.0,United Kingdom
547003,2023-03-18,15044D,Red Paper Parasol,13.27,10,14155.0,United Kingdom
547004,2023-03-18,22194,Black Diner Wall Clock,18.96,2,17419.0,United Kingdom
547004,2023-03-18,22193,Red Diner Wall Clock,18.96,2,17419.0,United Kingdom
547004,2023-03-18,47566,Party Bunting,15.32,4,17419.0,United Kingdom
547004,2023-03-18,22794,Sweetheart Wire Magazine Rack,18.4,4,17419.0,United Kingdom
547004,2023-03-18,22585,Pack Of 6 Birdy Gift Tags,11.53,12,17419.0,United Kingdom
547004,2023-03-18,21288,Stripey Chocolate Nesting Boxes,13.27,6,17419.0,United Kingdom
547004,2023-03-18,22840,Round Cake Tin Vintage Red,18.4,2,17419.0,United Kingdom
547004,2023-03-18,22841,Round Cake Tin Vintage Green,18.4,2,17419.0,United Kingdom
547004,2023-03-18,21041,Red Retrospot Oven Glove Double,13.27,6,17419.0,United Kingdom
547004,2023-03-18,21043,Apron Modern Vintage Cotton,12.25,12,17419.0,United Kingdom
547004,2023-03-18,22464,Hanging Metal Heart Lantern,11.94,12,17419.0,United Kingdom
547004,2023-03-18,82581,Toilet Metal Sign,10.81,12,17419.0,United Kingdom
547004,2023-03-18,84406B,Cream Cupid Hearts Coat Hanger,14.5,4,17419.0,United Kingdom
547004,2023-03-18,22587,Feltcraft Hairband Red And Blue,11.12,12,17419.0,United Kingdom
547004,2023-03-18,20972,Pink Cream Felt Craft Trinket Box,11.53,12,17419.0,United Kingdom
547004,2023-03-18,22189,Cream Heart Card Holder,14.3,12,17419.0,United Kingdom
547005,2023-03-18,22570,Feltcraft Cushion Rabbit,14.09,4,12474.0,Germany
547005,2023-03-18,22972,Children's Spaceboy Mug,11.94,12,12474.0,Germany
547005,2023-03-18,22973,Children's Circus Parade Mug,11.94,12,12474.0,Germany
547005,2023-03-18,22975,Spaceboy Childrens Egg Cup,11.53,12,12474.0,Germany
547005,2023-03-18,22859,Easter Tin Bunny Bouquet,11.94,12,12474.0,Germany
547005,2023-03-18,35909B,Pink Flowers Rabbit Easter,12.25,6,12474.0,Germany
547005,2023-03-18,21124,Set/10 Blue Polkadot Party Candles,11.53,24,12474.0,Germany
547005,2023-03-18,21094,Set/6 Red Spotty Paper Plates,11.12,12,12474.0,Germany
547005,2023-03-18,21086,Set/6 Red Spotty Paper Cups,10.92,12,12474.0,Germany
547005,2023-03-18,21987,Pack Of 6 Skull Paper Cups,10.92,12,12474.0,Germany
547005,2023-03-18,21088,Set/6 Fruit Salad Paper Cups,10.92,12,12474.0,Germany
547005,2023-03-18,20675,Blue Polkadot Bowl,11.53,8,12474.0,Germany
547005,2023-03-18,22303,Coffee Mug Apples Design,12.86,6,12474.0,Germany
547005,2023-03-18,22908,Pack Of 20 Napkins Red Apples,11.12,12,12474.0,Germany
547005,2023-03-18,21122,Set/10 Pink Polkadot Party Candles,11.53,24,12474.0,Germany
547005,2023-03-18,22326,Round Snack Boxes Set Of4 Woodland,13.27,12,12474.0,Germany
547005,2023-03-18,22328,Round Snack Boxes Set Of 4 Fruits,13.27,6,12474.0,Germany
547005,2023-03-18,20719,Woodland Charlotte Bag,11.12,20,12474.0,Germany
547005,2023-03-18,22554,Plasters In Tin Woodland Animals,11.94,12,12474.0,Germany
547005,2023-03-18,85203,Hanging Wood And Felt Butterfly,10.68,24,12474.0,Germany
547005,2023-03-18,22228,Bunny Wooden Painted With Bird,11.12,12,12474.0,Germany
547005,2023-03-18,22247,Bunny Decoration Magic Garden,11.12,16,12474.0,Germany
547005,2023-03-18,22321,Bird Decoration Red Retrospot,11.12,12,12474.0,Germany
547005,2023-03-18,22907,Pack Of 20 Napkins Pantry Design,11.12,12,12474.0,Germany
547005,2023-03-18,22367,Childrens Apron Spaceboy Design,12.25,8,12474.0,Germany
547005,2023-03-18,22631,Circus Parade Lunch Box,12.25,24,12474.0,Germany
547005,2023-03-18,22716,Card Circus Parade,10.68,12,12474.0,Germany
547005,2023-03-18,22711,Wrap Circus Parade,10.68,25,12474.0,Germany
547005,2023-03-18,16161U,Wrap Suki And Friends,10.68,25,12474.0,Germany
547005,2023-03-18,22045,Spaceboy Gift Wrap,10.68,25,12474.0,Germany
547005,2023-03-18,21791,Vintage Heads And Tails Card Game,11.53,12,12474.0,Germany
547005,2023-03-18,22629,Spaceboy Lunch Box,12.25,12,12474.0,Germany
547005,2023-03-18,23177,Treasure Island Book Box,12.56,8,12474.0,Germany
547005,2023-03-18,23194,Gymkhana Treasure Book Box,12.56,8,12474.0,Germany
547005,2023-03-18,22302,Coffee Mug Pears Design,12.86,6,12474.0,Germany
547005,2023-03-18,22637,Piggy Bank Retrospot,12.86,4,12474.0,Germany
547005,2023-03-18,21561,Dinosaur Lunch Box With Cutlery,12.86,6,12474.0,Germany
547005,2023-03-18,22432,Watering Can Pink Bunny,12.25,6,12474.0,Germany
547005,2023-03-18,22431,Watering Can Blue Elephant,12.25,6,12474.0,Germany
547005,2023-03-18,21746,Small Red Retrospot Windmill,11.53,12,12474.0,Germany
547005,2023-03-18,21698,Mock Lobster Fridge Magnet,11.12,12,12474.0,Germany
547005,2023-03-18,21700,Big Doughnut Fridge Magnets,11.12,12,12474.0,Germany
547005,2023-03-18,22399,Magnets Pack Of 4 Childhood Memory,11.53,12,12474.0,Germany
547006,2023-03-18,22431,Watering Can Blue Elephant,12.25,1,15006.0,United Kingdom
547006,2023-03-18,21420,Oyster Trinket Box,13.58,1,15006.0,United Kingdom
547006,2023-03-18,21709,Folding Umbrella Chocolate Polkadot,15.32,1,15006.0,United Kingdom
547007,2023-03-18,22567,20 Dolly Pegs Retrospot,11.53,1,17007.0,United Kingdom
547009,2023-03-18,22567,20 Dolly Pegs Retrospot,11.53,1,13009.0,United Kingdom
547017,2023-03-18,21524,Doormat Spotty Home Sweet Home,18.4,4,13468.0,United Kingdom
547017,2023-03-18,20828,Glitter Butterfly Clips,12.86,6,13468.0,United Kingdom
547017,2023-03-18,46776E,Woven Candy Cushion Cover,15.32,2,13468.0,United Kingdom
547017,2023-03-18,46776B,Woven Berries Cushion Cover,15.32,2,13468.0,United Kingdom
547017,2023-03-18,46000M,Polyester Filler Pad 45x45cm,11.84,2,13468.0,United Kingdom
547017,2023-03-18,22379,Recycling Bag Retrospot,12.4,5,13468.0,United Kingdom
547018,2023-03-18,79000,Moroccan Tea Glass,11.12,84,17043.0,United Kingdom
547018,2023-03-18,20801,Large Pink Glass Sundae Dish,12.86,10,17043.0,United Kingdom
547018,2023-03-18,71459,Hanging Jam Jar T-Light Holders,11.12,12,17043.0,United Kingdom
547018,2023-03-18,84828,Jungle Popsicles Ice Lolly Moulds,11.53,1,17043.0,United Kingdom
547018,2023-03-18,22534,Magic Drawing Slate Spaceboy,10.68,12,17043.0,United Kingdom
547018,2023-03-18,22530,Magic Drawing Slate Dolly Girl,10.68,10,17043.0,United Kingdom
547018,2023-03-18,22230,Jigsaw Tree With Watering Can,11.12,1,17043.0,United Kingdom
547018,2023-03-18,22231,Jigsaw Tree With Birdhouse,11.74,1,17043.0,United Kingdom
547018,2023-03-18,22233,Jigsaw Rabbit And Birdhouse,11.94,1,17043.0,United Kingdom
547018,2023-03-18,21791,Vintage Heads And Tails Card Game,11.53,24,17043.0,United Kingdom
547018,2023-03-18,37342,Polkadot Coffee Cup & Saucer Pink,11.06,4,17043.0,United Kingdom
547019,2023-03-18,72800E,4 Ivory Dinner Candles Silver Flock,12.86,1,17841.0,United Kingdom
547019,2023-03-18,22753,Small Yellow Babushka Notebook,11.12,1,17841.0,United Kingdom
547019,2023-03-18,21155,Red Retrospot Peg Bag,12.86,1,17841.0,United Kingdom
547019,2023-03-18,85205B,Pink Felt Easter Rabbit Garland,12.86,1,17841.0,United Kingdom
547019,2023-03-18,22451,Silk Purse Babushka Red,13.68,2,17841.0,United Kingdom
547019,2023-03-18,21975,Pack Of 60 Dinosaur Cake Cases,10.81,4,17841.0,United Kingdom
547019,2023-03-18,22978,Pantry Rolling Pin,14.09,1,17841.0,United Kingdom
547019,2023-03-18,22965,3 Traditional Biscuit Cutters Set,12.4,1,17841.0,United Kingdom
547019,2023-03-18,21668,Red Stripe Ceramic Drawer Knob,11.53,9,17841.0,United Kingdom
547019,2023-03-18,22726,Alarm Clock Bakelike Green,14.09,1,17841.0,United Kingdom
547019,2023-03-18,20668,Disco Ball Christmas Decoration,10.37,24,17841.0,United Kingdom
547019,2023-03-18,20996,Jazz Hearts Address Book,10.68,5,17841.0,United Kingdom
547019,2023-03-18,22149,Feltcraft 6 Flower Friends,12.4,1,17841.0,United Kingdom
547019,2023-03-18,22041,"Record Frame 7"" Single Size",12.86,2,17841.0,United Kingdom
547019,2023-03-18,22352,Lunch Box With Cutlery Retrospot,12.86,1,17841.0,United Kingdom
547019,2023-03-18,20723,Strawberry Charlotte Bag,11.12,1,17841.0,United Kingdom
547019,2023-03-18,22179,Set 10 Night Owl Lights,17.17,2,17841.0,United Kingdom
547019,2023-03-18,79321,Chilli Lights,16.14,4,17841.0,United Kingdom
547019,2023-03-18,82483,Wood 2 Drawer Cabinet White Finish,17.37,2,17841.0,United Kingdom
547019,2023-03-18,20725,Lunch Bag Red Retrospot,5.97,1,17841.0,United Kingdom
547019,2023-03-18,22382,Lunch Bag Spaceboy Design,5.97,1,17841.0,United Kingdom
547019,2023-03-18,22383,Lunch Bag Suki Design,5.97,5,17841.0,United Kingdom
547020,2023-03-18,21559,Strawberry Lunch Box With Cutlery,12.86,6,17017.0,United Kingdom
547020,2023-03-18,21731,Red Toadstool Led Night Light,11.94,12,17017.0,United Kingdom
547020,2023-03-18,21878,Pack Of 6 Sandcastle Flags Assorted,11.12,12,17017.0,United Kingdom
547020,2023-03-18,22616,Pack Of 12 London Tissues,10.55,24,17017.0,United Kingdom
547020,2023-03-18,22659,Lunch Box I Love London,12.25,12,17017.0,United Kingdom
547020,2023-03-18,22900,Set 2 Tea Towels I Love London,13.27,6,17017.0,United Kingdom
547020,2023-03-18,22911,Paper Chain Kit London,13.27,6,17017.0,United Kingdom
547020,2023-03-18,22992,Revolver Wooden Ruler,12.25,12,17017.0,United Kingdom
547020,2023-03-18,22993,Set Of 4 Pantry Jelly Moulds,11.53,12,17017.0,United Kingdom
547020,2023-03-18,22197,Popcorn Holder,11.12,72,17017.0,United Kingdom
547020,2023-03-18,22978,Pantry Rolling Pin,14.09,12,17017.0,United Kingdom
547020,2023-03-18,22979,Pantry Washing Up Brush,11.74,36,17017.0,United Kingdom
547020,2023-03-18,22982,Pantry Pastry Brush,11.53,12,17017.0,United Kingdom
547020,2023-03-18,84828,Jungle Popsicles Ice Lolly Moulds,11.53,12,17017.0,United Kingdom
547020,2023-03-18,22045,Spaceboy Gift Wrap,10.68,25,17017.0,United Kingdom
547020,2023-03-18,20979,36 Pencils Tube Red Retrospot,11.53,16,17017.0,United Kingdom
547021,2023-03-18,21937,Strawberry Picnic Bag,13.27,5,13046.0,United Kingdom
547021,2023-03-18,22720,Set Of 3 Cake Tins Pantry Design,15.32,3,13046.0,United Kingdom
547021,2023-03-18,20749,Assorted Colour Mini Cases,18.4,2,13046.0,United Kingdom
547021,2023-03-18,22499,Wooden Union Jack Bunting,16.35,3,13046.0,United Kingdom
547021,2023-03-18,21442,Green Birdhouse Decoration,11.12,12,13046.0,United Kingdom
547021,2023-03-18,84879,Assorted Colour Bird Ornament,11.98,8,13046.0,United Kingdom
547021,2023-03-18,22212,Four Hook White Lovebirds,12.4,6,13046.0,United Kingdom
547021,2023-03-18,82613A,Metal Sign Cupcake Single Hook,11.53,8,13046.0,United Kingdom
547021,2023-03-18,82613A,Metal Sign Cupcake Single Hook,11.53,8,13046.0,United Kingdom
547021,2023-03-18,82484,Wood Black Board Ant White Finish,18.35,2,13046.0,United Kingdom
547021,2023-03-18,84279B,Cherry Blossom Decorative Flask,14.09,4,13046.0,United Kingdom
547021,2023-03-18,22478,Birdhouse Garden Marker,11.53,10,13046.0,United Kingdom
547021,2023-03-18,22611,Vintage Union Jack Shopping Bag,7.66,3,13046.0,United Kingdom
547022,2023-03-18,84279B,Cherry Blossom Decorative Flask,14.09,1,17961.0,United Kingdom
547022,2023-03-18,84279B,Cherry Blossom Decorative Flask,14.09,1,17961.0,United Kingdom
547022,2023-03-18,22981,Pantry Apple Corer,11.74,1,17961.0,United Kingdom
547022,2023-03-18,22998,Travel Card Wallet Keep Calm,10.68,12,17961.0,United Kingdom
547022,2023-03-18,23181,Bull Dog Bottle Top Wall Clock,18.71,1,17961.0,United Kingdom
547023,2023-03-18,22127,Party Cones Carnival Assorted,11.34,120,16422.0,United Kingdom
547023,2023-03-18,17003,Brocade Ring Purse,10.51,720,16422.0,United Kingdom
547023,2023-03-18,20974,12 Pencils Small Tube Skull,10.92,24,16422.0,United Kingdom
547023,2023-03-18,20975,12 Pencils Small Tube Red Retrospot,10.92,24,16422.0,United Kingdom
547023,2023-03-18,22090,Paper Bunting Retrospot,12.86,40,16422.0,United Kingdom
547023,2023-03-18,47590B,Pink Happy Birthday Bunting,15.02,50,16422.0,United Kingdom
547023,2023-03-18,22499,Wooden Union Jack Bunting,16.35,18,16422.0,United Kingdom
547023,2023-03-18,22084,Paper Chain Kit Empire,13.27,18,16422.0,United Kingdom
547025,2023-03-18,22730,Alarm Clock Bakelike Ivory,14.09,1,14025.0,United Kingdom
547026,2023-03-18,82484,Wood Black Board Ant White Finish,18.35,2,14633.0,United Kingdom
547026,2023-03-18,22170,Picture Frame Wood Triple Portrait,17.17,4,14633.0,United Kingdom
547026,2023-03-18,22169,Family Album White Picture Frame,18.96,2,14633.0,United Kingdom
547026,2023-03-18,82494L,Wooden Frame Antique White,13.27,6,14633.0,United Kingdom
547026,2023-03-18,22173,Metal 4 Hook Hanger French Chateau,13.27,8,14633.0,United Kingdom
547026,2023-03-18,22457,Natural Slate Heart Chalkboard,13.27,6,14633.0,United Kingdom
547026,2023-03-18,22171,3 Hook Photo Shelf Antique White,18.96,2,14633.0,United Kingdom
547026,2023-03-18,21693,Small Hammered Silver Candlepot,13.27,6,14633.0,United Kingdom
547026,2023-03-18,84946,Antique Silver T-Light Glass,11.53,12,14633.0,United Kingdom
547026,2023-03-18,84970L,Single Heart Zinc T-Light Holder,11.22,12,14633.0,United Kingdom
547026,2023-03-18,84970S,Hanging Heart Zinc T-Light Holder,11.12,12,14633.0,United Kingdom
547026,2023-03-18,22499,Wooden Union Jack Bunting,16.35,3,14633.0,United Kingdom
547026,2023-03-18,22617,Baking Set Spaceboy Design,15.32,3,14633.0,United Kingdom
547026,2023-03-18,22138,Baking Set 9 Piece Retrospot,15.32,3,14633.0,United Kingdom
547026,2023-03-18,47590A,Blue Happy Birthday Bunting,15.84,3,14633.0,United Kingdom
547026,2023-03-18,47590B,Pink Happy Birthday Bunting,15.84,3,14633.0,United Kingdom
547026,2023-03-18,21363,Home Small Wood Letters,15.32,3,14633.0,United Kingdom
547004,2023-03-18,22839,3 Tier Cake Tin Green And Cream,25.57,1,17419.0,United Kingdom
546973,2023-03-18,48116,Doormat Multicolour Stripe,24.73,2,17973.0,EIRE
546974,2023-03-18,21115,Rose Caravan Doorstop,24.73,1,12974.0,United Kingdom
546974,2023-03-18,48138,Doormat Union Flag,24.73,1,12974.0,United Kingdom
546974,2023-03-18,48194,Doormat Hearts,24.73,1,12974.0,United Kingdom
546976,2023-03-18,21625,Vintage Union Jack Apron,24.73,1,16976.0,United Kingdom
546976,2023-03-18,48138,Doormat Union Flag,24.73,1,16976.0,United Kingdom
