TransactionNo,Date,ProductNo,ProductName,Price,Quantity,CustomerNo,Country
560090,2023-07-14,22754,Small Red Babushka Notebook,11.92,2,17090.0,United Kingdom
560090,2023-07-14,22755,Small Purple Babushka Notebook,11.92,1,17090.0,United Kingdom
560090,2023-07-14,22771,Clear Drawer Knob Acrylic Edwardian,12.77,4,17090.0,United Kingdom
560090,2023-07-14,22775,Purple Drawerknob Acrylic Edwardian,12.77,1,17090.0,United Kingdom
560090,2023-07-14,22778,Glass Cloche Small,18.75,1,17090.0,United Kingdom
560090,2023-07-14,22798,Antique Glass Dressing Table Pot,16.18,1,17090.0,United Kingdom
560090,2023-07-14,22800,Antique Tall Swirlglass Trinket Pot,17.9,4,17090.0,United Kingdom
560090,2023-07-14,22801,Antique Glass Pedestal Bowl,14.09,9,17090.0,United Kingdom
560090,2023-07-14,22807,Set Of 6 T-Lights Toadstools,12.77,1,17090.0,United Kingdom
560090,2023-07-14,22811,Set Of 6 T-Lights Cacti,12.77,4,17090.0,United Kingdom
560090,2023-07-14,22814,Card Party Games,10.68,2,17090.0,United Kingdom
560090,2023-07-14,22815,Card Psychedelic Apples,10.68,2,17090.0,United Kingdom
560090,2023-07-14,22819,Birthday Card Retro Spot,10.68,4,17090.0,United Kingdom
560090,2023-07-14,22891,Tea For One Polkadot,14.48,1,17090.0,United Kingdom
560090,2023-07-14,22902,Tote Bag I Love London,14.48,1,17090.0,United Kingdom
560090,2023-07-14,22945,Christmas Metal Tags Assorted,12.09,6,17090.0,United Kingdom
560090,2023-07-14,22950,36 Doilies Vintage Christmas,13.24,1,17090.0,United Kingdom
560090,2023-07-14,22960,Jam Making Set With Jars,18.75,1,17090.0,United Kingdom
560090,2023-07-14,23025,Drawer Knob Vintage Glass Ball,14.48,1,17090.0,United Kingdom
560090,2023-07-14,23028,Drawer Knob Crackle Glaze Blue,13.62,2,17090.0,United Kingdom
560090,2023-07-14,23031,Drawer Knob Crackle Glaze Pink,13.62,1,17090.0,United Kingdom
560090,2023-07-14,23084,Rabbit Night Light,14.48,1,17090.0,United Kingdom
560090,2023-07-14,23089,Glass Bon Bon Jar,13.62,1,17090.0,United Kingdom
560090,2023-07-14,23140,Triple Wire Hook Ivory Heart,14.48,1,17090.0,United Kingdom
560090,2023-07-14,23147,Single Antique Rose Hook Ivory,13.62,3,17090.0,United Kingdom
560090,2023-07-14,23168,Classic Cafe Sugar Dispenser,12.77,1,17090.0,United Kingdom
560090,2023-07-14,23182,Toilet Sign Occupied Or Vacant,12.77,1,17090.0,United Kingdom
560090,2023-07-14,23197,Sketchbook Magnetic Shopping List,13.62,1,17090.0,United Kingdom
560090,2023-07-14,23266,Set Of 3 Wooden Stocking Decoration,12.77,2,17090.0,United Kingdom
560090,2023-07-14,23288,Green Vintage Spot Beaker,11.92,3,17090.0,United Kingdom
560090,2023-07-14,23298,Spotty Bunting,15.32,4,17090.0,United Kingdom
560090,2023-07-14,23301,Gardeners Kneeling Pad Keep Calm,13.62,2,17090.0,United Kingdom
560090,2023-07-14,23306,Set Of 36 Pantry Paper Doilies,13.24,2,17090.0,United Kingdom
560090,2023-07-14,23307,Set Of 60 Pantry Design Cake Cases,11.53,2,17090.0,United Kingdom
560090,2023-07-14,23308,Set Of 60 Vintage Leaf Cake Cases,11.53,1,17090.0,United Kingdom
560090,2023-07-14,23309,Set Of 60 I Love London Cake Cases,11.53,1,17090.0,United Kingdom
560090,2023-07-14,23311,Vintage Christmas Stocking,15.33,1,17090.0,United Kingdom
560090,2023-07-14,23322,Large White Heart Of Wicker,16.18,2,17090.0,United Kingdom
560090,2023-07-14,35916A,Yellow Felt Hanging Heart W Flower,10.9,2,17090.0,United Kingdom
560090,2023-07-14,35916B,Blue Felt Hanging Heart With Flower,10.9,3,17090.0,United Kingdom
560090,2023-07-14,35916C,Pink Felt Hanging Heart W Flower,10.9,1,17090.0,United Kingdom
560090,2023-07-14,35924,Hanging Fairy Cake Decoration,11.92,1,17090.0,United Kingdom
560090,2023-07-14,37342,Polkadot Coffee Cup & Saucer Pink,12.77,2,17090.0,United Kingdom
560090,2023-07-14,40016,Chinese Dragon Paper Lanterns,18.75,5,17090.0,United Kingdom
560090,2023-07-14,47369B,Blue Green Embroidery Cosmetic Bag,11.92,1,17090.0,United Kingdom
560090,2023-07-14,47563A,Retro Longboard Ironing Board Cover,13.62,1,17090.0,United Kingdom
560090,2023-07-14,47593B,Scottie Dogs Baby Bib,11.1,3,17090.0,United Kingdom
560090,2023-07-14,51014C,Feather Pen Coal Black,11.1,1,17090.0,United Kingdom
560090,2023-07-14,72807C,Set/3 Vanilla Scented Candle In Box,18.75,1,17090.0,United Kingdom
560090,2023-07-14,72817,Set Of 2 Christmas Decoupage Candle,11.92,2,17090.0,United Kingdom
560090,2023-07-14,75049L,Large Circular Mirror Mobile,12.77,1,17090.0,United Kingdom
560090,2023-07-14,79144B,Painted Lightbulb Star+ Moon,11.1,2,17090.0,United Kingdom
560090,2023-07-14,82567,Airline Lounge Metal Sign,11.92,1,17090.0,United Kingdom
560090,2023-07-14,21171,Bathroom Metal Sign,11.53,1,17090.0,United Kingdom
560090,2023-07-14,84356,Pompom Curtain,16.18,1,17090.0,United Kingdom
560090,2023-07-14,84522,Pink Party Sunglasses,11.92,1,17090.0,United Kingdom
560090,2023-07-14,84536A,English Rose Notebook A7 Size,10.68,5,17090.0,United Kingdom
560090,2023-07-14,84559A,3d Sheet Of Dog Stickers,11.06,1,17090.0,United Kingdom
560090,2023-07-14,84569D,Pack 6 Heart/Ice-Cream Patches,11.1,1,17090.0,United Kingdom
560090,2023-07-14,84596B,Small Dolly Mix Design Orange Bowl,11.1,1,17090.0,United Kingdom
560090,2023-07-14,84637,Kitchen Flower Pots Wall Plaque,15.33,1,17090.0,United Kingdom
560090,2023-07-14,84748,Folk Felt Hanging Multicol Garland,12.77,2,17090.0,United Kingdom
560090,2023-07-14,84796B,Blue Savannah Picnic Hamper For 2,18.75,2,17090.0,United Kingdom
560090,2023-07-14,84907,Pink Yellow Patch Cushion Cover,16.18,1,17090.0,United Kingdom
560090,2023-07-14,84910A,Pink Paisley Cushion Cover,18.75,2,17090.0,United Kingdom
560090,2023-07-14,84913A,Soft Pink Rose Towel,13.62,1,17090.0,United Kingdom
560090,2023-07-14,84919,Blue Cushion Cover With Flower,16.18,1,17090.0,United Kingdom
560090,2023-07-14,84947,Antique Silver Tea Glass Engraved,12.77,1,17090.0,United Kingdom
560090,2023-07-14,84969,Box Of 6 Assorted Colour Teaspoons,13.62,2,17090.0,United Kingdom
560090,2023-07-14,85017B,Envelope 50 Blossom Images,11.1,1,17090.0,United Kingdom
560090,2023-07-14,85032C,Curious Images Gift Wrap Set,11.92,1,17090.0,United Kingdom
560090,2023-07-14,85039A,Set/4 Red Mini Rose Candle In Bowl,11.92,2,17090.0,United Kingdom
560090,2023-07-14,85039B,S/4 Ivory Mini Rose Candle In Bowl,11.92,4,17090.0,United Kingdom
560090,2023-07-14,85053,French Enamel Candleholder,14.48,1,17090.0,United Kingdom
560090,2023-07-14,85086A,Candy Spot Heart Decoration,11.1,2,17090.0,United Kingdom
560090,2023-07-14,85131B,Beaded Crystal Heart Green On Stick,11.1,6,17090.0,United Kingdom
560090,2023-07-14,85131D,Beaded Crystal Heart Pink On Stick,11.1,4,17090.0,United Kingdom
560090,2023-07-14,85132C,Charlie And Lola Figures Tins,16.18,1,17090.0,United Kingdom
560090,2023-07-14,85170C,Set/6 Eau De Nil Bird T-Lights,12.77,2,17090.0,United Kingdom
560090,2023-07-14,85170D,Set/6 Pink Bird T-Light Candles,12.77,2,17090.0,United Kingdom
560090,2023-07-14,85176,Sewing Susan 21 Needle Set,11.06,2,17090.0,United Kingdom
560090,2023-07-14,85194S,Hanging Spring Flower Egg Small,10.9,2,17090.0,United Kingdom
560090,2023-07-14,85227,Set Of 6 3d Kit Cards For Kids,11.92,1,17090.0,United Kingdom
560090,2023-07-14,90019B,Gold Mop Orbit Bracelet,15.78,1,17090.0,United Kingdom
560090,2023-07-14,90037C,Tiny Crystal Bracelet Blue,12.79,1,17090.0,United Kingdom
560090,2023-07-14,90059E,Diamante Hair Grip Pack/2 Ruby,11.94,1,17090.0,United Kingdom
560090,2023-07-14,90114,Summer Daisies Bag Charm,12.77,1,17090.0,United Kingdom
560090,2023-07-14,90120C,Green Murano Twist Bracelet,14.5,1,17090.0,United Kingdom
560090,2023-07-14,90200B,Black Sweetheart Bracelet,14.5,1,17090.0,United Kingdom
560090,2023-07-14,90200E,Green Sweetheart Bracelet,14.5,1,17090.0,United Kingdom
560090,2023-07-14,23291,Dolly Girl Childrens Cup,11.53,4,17090.0,United Kingdom
560090,2023-07-14,22970,London Bus Coffee Mug,12.86,6,17090.0,United Kingdom
560090,2023-07-14,22892,Set Of Salt And Pepper Toadstools,11.53,5,17090.0,United Kingdom
560090,2023-07-14,21033,Jumbo Bag Charlie And Lola Toys,6.39,4,17090.0,United Kingdom
560090,2023-07-14,21928,Jumbo Bag Scandinavian Blue Paisley,7.24,1,17090.0,United Kingdom
560090,2023-07-14,22663,Jumbo Bag Dolly Girl Design,6.39,7,17090.0,United Kingdom
560090,2023-07-14,85099B,Jumbo Bag Red Retrospot,7.24,1,17090.0,United Kingdom
560090,2023-07-14,22821,Gift Bag Psychedelic Apples,5.34,6,17090.0,United Kingdom
560093,2023-07-14,23012,Glass Apothecary Bottle Perfume,14.3,4,14461.0,United Kingdom
560093,2023-07-14,23013,Glass Apothecary Bottle Tonic,14.3,4,14461.0,United Kingdom
560093,2023-07-14,23014,Glass Apothecary Bottle Elixir,14.3,4,14461.0,United Kingdom
560093,2023-07-14,23212,Heart Wreath Decoration With Bell,11.53,12,14461.0,United Kingdom
560093,2023-07-14,23210,White Rocking Horse Hand Painted,11.53,24,14461.0,United Kingdom
560093,2023-07-14,23243,Set Of Tea Coffee Sugar Tins Pantry,15.32,4,14461.0,United Kingdom
560093,2023-07-14,23245,Set Of 3 Regency Cake Tins,15.32,4,14461.0,United Kingdom
560093,2023-07-14,23263,Set Of 3 Wooden Heart Decorations,11.53,12,14461.0,United Kingdom
560093,2023-07-14,23240,Set Of 4 Knick Knack Tins Doily,14.5,6,14461.0,United Kingdom
560093,2023-07-14,23236,Storage Tin Vintage Doily,13.21,6,14461.0,United Kingdom
560093,2023-07-14,84879,Assorted Colour Bird Ornament,11.98,40,14461.0,United Kingdom
560093,2023-07-14,21136,Painted Metal Pears Assorted,11.98,40,14461.0,United Kingdom
560094,2023-07-14,22720,Set Of 3 Cake Tins Pantry Design,15.32,2,18109.0,United Kingdom
560094,2023-07-14,84380,Set Of 3 Butterfly Cookie Cutters,11.53,2,18109.0,United Kingdom
560094,2023-07-14,22961,Jam Making Set Printed,11.74,4,18109.0,United Kingdom
560094,2023-07-14,23245,Set Of 3 Regency Cake Tins,15.32,8,18109.0,United Kingdom
560094,2023-07-14,22169,Family Album White Picture Frame,18.96,3,18109.0,United Kingdom
560094,2023-07-14,22178,Victorian Glass Hanging T-Light,11.53,12,18109.0,United Kingdom
560094,2023-07-14,84836,Zinc Metal Heart Decoration,11.53,4,18109.0,United Kingdom
560094,2023-07-14,21212,Pack Of 72 Retrospot Cake Cases,10.81,1,18109.0,United Kingdom
560094,2023-07-14,21977,Pack Of 60 Pink Paisley Cake Cases,10.81,2,18109.0,United Kingdom
560094,2023-07-14,21755,Love Building Block Word,16.35,1,18109.0,United Kingdom
560094,2023-07-14,22197,Popcorn Holder,11.12,6,18109.0,United Kingdom
560094,2023-07-14,23118,Parisienne Jewellery Drawer,17.94,5,18109.0,United Kingdom
560094,2023-07-14,22151,Place Setting White Heart,10.62,432,18109.0,United Kingdom
560095,2023-07-14,84884A,Ant White Wire Heart Spiral,14.3,1,17848.0,United Kingdom
560095,2023-07-14,23013,Glass Apothecary Bottle Tonic,14.3,1,17848.0,United Kingdom
560095,2023-07-14,23012,Glass Apothecary Bottle Perfume,14.3,1,17848.0,United Kingdom
560095,2023-07-14,82494L,Wooden Frame Antique White,13.27,2,17848.0,United Kingdom
560096,2023-07-14,48185,Doormat Fairy Cake,18.4,4,13538.0,United Kingdom
560096,2023-07-14,48138,Doormat Union Flag,18.4,4,13538.0,United Kingdom
560096,2023-07-14,23284,Doormat Keep Calm And Come In,18.4,4,13538.0,United Kingdom
560097,2023-07-14,82494L,Wooden Frame Antique White,13.27,6,13050.0,United Kingdom
560097,2023-07-14,23092,Large Antique White Photo Frame,18.35,2,13050.0,United Kingdom
560097,2023-07-14,22993,Set Of 4 Pantry Jelly Moulds,11.53,12,13050.0,United Kingdom
560097,2023-07-14,22178,Victorian Glass Hanging T-Light,11.53,24,13050.0,United Kingdom
560097,2023-07-14,23243,Set Of Tea Coffee Sugar Tins Pantry,15.32,4,13050.0,United Kingdom
560097,2023-07-14,21391,French Lavender Scent Heart,11.02,12,13050.0,United Kingdom
560097,2023-07-14,22464,Hanging Metal Heart Lantern,11.94,12,13050.0,United Kingdom
560097,2023-07-14,21671,Red Spot Ceramic Drawer Knob,11.53,12,13050.0,United Kingdom
560097,2023-07-14,22030,Swallows Greeting Card,10.68,12,13050.0,United Kingdom
560097,2023-07-14,22151,Place Setting White Heart,10.68,72,13050.0,United Kingdom
560097,2023-07-14,23301,Gardeners Kneeling Pad Keep Calm,11.94,12,13050.0,United Kingdom
560097,2023-07-14,23198,Pantry Magnetic Shopping List,11.74,12,13050.0,United Kingdom
560097,2023-07-14,85062,Pearl Crystal Pumpkin T-Light Hldr,11.94,12,13050.0,United Kingdom
560097,2023-07-14,22720,Set Of 3 Cake Tins Pantry Design,15.32,3,13050.0,United Kingdom
560097,2023-07-14,23245,Set Of 3 Regency Cake Tins,15.32,4,13050.0,United Kingdom
560097,2023-07-14,21755,Love Building Block Word,16.35,3,13050.0,United Kingdom
560097,2023-07-14,23321,Small White Heart Of Wicker,11.94,12,13050.0,United Kingdom
560097,2023-07-14,20914,Set/5 Red Retrospot Lid Glass Bowls,13.27,6,13050.0,United Kingdom
560097,2023-07-14,22151,Place Setting White Heart,10.68,12,13050.0,United Kingdom
560097,2023-07-14,23102,Silver Hearts Table Decoration,11.1,12,13050.0,United Kingdom
560098,2023-07-14,23132,Small Ivory Heart Wall Organiser,16.14,1,16907.0,United Kingdom
560098,2023-07-14,22505,Memo Board Cottage Design,15.32,1,16907.0,United Kingdom
560098,2023-07-14,22171,3 Hook Photo Shelf Antique White,18.96,1,16907.0,United Kingdom
560098,2023-07-14,23321,Small White Heart Of Wicker,11.94,1,16907.0,United Kingdom
560098,2023-07-14,23176,Abc Treasure Book Box,12.56,1,16907.0,United Kingdom
560098,2023-07-14,23177,Treasure Island Book Box,12.56,1,16907.0,United Kingdom
560098,2023-07-14,23194,Gymkhana Treasure Book Box,12.56,1,16907.0,United Kingdom
560098,2023-07-14,82582,Area Patrolled Metal Sign,12.4,2,16907.0,United Kingdom
560098,2023-07-14,82600,N0 Singing Metal Sign,12.4,2,16907.0,United Kingdom
560098,2023-07-14,82567,Airline Lounge Metal Sign,12.4,1,16907.0,United Kingdom
560098,2023-07-14,21903,Man Flu Metal Sign,12.4,2,16907.0,United Kingdom
560098,2023-07-14,21905,More Butter Metal Sign,11.06,1,16907.0,United Kingdom
560098,2023-07-14,21907,I'm On Holiday Metal Sign,12.4,1,16907.0,United Kingdom
560098,2023-07-14,22412,Metal Sign Neighbourhood Witch,12.4,1,16907.0,United Kingdom
560098,2023-07-14,21169,You're Confusing Me Metal Sign,11.98,1,16907.0,United Kingdom
560098,2023-07-14,22117,Metal Sign Her Dinner Is Served,13.27,1,16907.0,United Kingdom
560098,2023-07-14,21179,No Junk Mail Metal Sign,10.65,4,16907.0,United Kingdom
560098,2023-07-14,21175,Gin And Tonic Diet Metal Sign,12.86,2,16907.0,United Kingdom
560098,2023-07-14,23146,Triple Hook Antique Ivory Rose,13.62,1,16907.0,United Kingdom
560098,2023-07-14,71477,Coloured Glass Star T-Light Holder,13.07,24,16907.0,United Kingdom
560101,2023-07-14,22693,Grow A Flytrap Or Sunflower In Tin,11.53,24,14891.0,United Kingdom
560101,2023-07-14,20972,Pink Cream Felt Craft Trinket Box,11.53,12,14891.0,United Kingdom
560101,2023-07-14,22379,Recycling Bag Retrospot,12.4,5,14891.0,United Kingdom
560101,2023-07-14,20728,Lunch Bag Cars Blue,5.97,10,14891.0,United Kingdom
560101,2023-07-14,22384,Lunch Bag Pink Polkadot,5.97,10,14891.0,United Kingdom
560101,2023-07-14,20727,Lunch Bag Black Skull,5.97,10,14891.0,United Kingdom
560102,2023-07-14,23147,Single Antique Rose Hook Ivory,11.74,12,13994.0,United Kingdom
560102,2023-07-14,21407,Brown Check Cat Doorstop,14.61,3,13994.0,United Kingdom
560102,2023-07-14,23298,Spotty Bunting,15.32,3,13994.0,United Kingdom
560102,2023-07-14,22800,Antique Tall Swirlglass Trinket Pot,14.09,4,13994.0,United Kingdom
560102,2023-07-14,22798,Antique Glass Dressing Table Pot,13.27,8,13994.0,United Kingdom
560102,2023-07-14,21770,Open Closed Metal Sign,15.32,2,13994.0,United Kingdom
560102,2023-07-14,22804,Pink Hanging Heart T-Light Holder,13.27,6,13994.0,United Kingdom
560102,2023-07-14,22079,Ribbon Reel Hearts Design,11.94,10,13994.0,United Kingdom
560102,2023-07-14,21754,Home Building Block Word,16.35,3,13994.0,United Kingdom
560102,2023-07-14,21755,Love Building Block Word,16.35,3,13994.0,United Kingdom
560102,2023-07-14,47566,Party Bunting,15.32,4,13994.0,United Kingdom
560102,2023-07-14,21314,Small Glass Heart Trinket Pot,12.4,8,13994.0,United Kingdom
560102,2023-07-14,84946,Antique Silver T-Light Glass,11.53,12,13994.0,United Kingdom
560102,2023-07-14,84879,Assorted Colour Bird Ornament,11.98,8,13994.0,United Kingdom
560102,2023-07-14,85123A,Cream Hanging Heart T-Light Holder,13.27,6,13994.0,United Kingdom
560103,2023-07-14,22637,Piggy Bank Retrospot,12.86,4,17837.0,United Kingdom
560103,2023-07-14,22646,Ceramic Strawberry Cake Money Bank,11.74,4,17837.0,United Kingdom
560103,2023-07-14,22138,Baking Set 9 Piece Retrospot,15.32,3,17837.0,United Kingdom
560103,2023-07-14,21754,Home Building Block Word,16.35,3,17837.0,United Kingdom
560103,2023-07-14,20837,French Floral Cushion Cover,11.12,6,17837.0,United Kingdom
560103,2023-07-14,20836,French Paisley Cushion Cover,11.12,6,17837.0,United Kingdom
560103,2023-07-14,22233,Jigsaw Rabbit And Birdhouse,10.85,4,17837.0,United Kingdom
560103,2023-07-14,21747,Small Skull Windmill,11.53,4,17837.0,United Kingdom
560103,2023-07-14,21750,Large Skull Windmill,12.4,3,17837.0,United Kingdom
560103,2023-07-14,21749,Large Red Retrospot Windmill,12.4,2,17837.0,United Kingdom
560103,2023-07-14,21746,Small Red Retrospot Windmill,11.53,3,17837.0,United Kingdom
560104,2023-07-14,23004,Travel Card Wallet Pantry,10.68,1,17921.0,United Kingdom
560104,2023-07-14,22999,Travel Card Wallet Vintage Leaf,10.68,2,17921.0,United Kingdom
560104,2023-07-14,22481,Black Tea Towel Classic Design,11.53,4,17921.0,United Kingdom
560104,2023-07-14,21172,Party Metal Sign,11.74,1,17921.0,United Kingdom
560104,2023-07-14,85123A,Cream Hanging Heart T-Light Holder,13.27,4,17921.0,United Kingdom
560104,2023-07-14,23322,Large White Heart Of Wicker,13.27,1,17921.0,United Kingdom
560104,2023-07-14,23004,Travel Card Wallet Pantry,10.68,2,17921.0,United Kingdom
560104,2023-07-14,22997,Travel Card Wallet Union Jack,10.68,2,17921.0,United Kingdom
560104,2023-07-14,22998,Travel Card Wallet Keep Calm,10.68,2,17921.0,United Kingdom
560104,2023-07-14,22999,Travel Card Wallet Vintage Leaf,10.68,2,17921.0,United Kingdom
560104,2023-07-14,22995,Travel Card Wallet Suki,10.68,2,17921.0,United Kingdom
560104,2023-07-14,22080,Ribbon Reel Polkadots,11.94,1,17921.0,United Kingdom
560104,2023-07-14,84836,Zinc Metal Heart Decoration,11.53,2,17921.0,United Kingdom
560104,2023-07-14,22939,Adult Apron Apple Delight,15.32,2,17921.0,United Kingdom
560104,2023-07-14,21259,Victorian Sewing Box Small,16.35,1,17921.0,United Kingdom
560104,2023-07-14,21175,Gin And Tonic Diet Metal Sign,12.86,2,17921.0,United Kingdom
560104,2023-07-14,22413,Metal Sign Take It Or Leave It,13.27,4,17921.0,United Kingdom
560104,2023-07-14,21174,Pottering In The Shed Metal Sign,12.38,4,17921.0,United Kingdom
560104,2023-07-14,21907,I'm On Holiday Metal Sign,12.4,2,17921.0,United Kingdom
560104,2023-07-14,21165,Beware Of The Cat Metal Sign,11.98,6,17921.0,United Kingdom
560104,2023-07-14,82483,Wood 2 Drawer Cabinet White Finish,17.37,2,17921.0,United Kingdom
560104,2023-07-14,21936,Red Retrospot Picnic Bag,13.27,1,17921.0,United Kingdom
560104,2023-07-14,23093,Small Parisienne Heart Photo Frame,12.8,2,17921.0,United Kingdom
560104,2023-07-14,23322,Large White Heart Of Wicker,13.27,1,17921.0,United Kingdom
560104,2023-07-14,22178,Victorian Glass Hanging T-Light,11.53,18,17921.0,United Kingdom
560104,2023-07-14,23196,Vintage Leaf Magnetic Notepad,11.74,1,17921.0,United Kingdom
560104,2023-07-14,23197,Sketchbook Magnetic Shopping List,11.74,1,17921.0,United Kingdom
560104,2023-07-14,23198,Pantry Magnetic Shopping List,11.74,1,17921.0,United Kingdom
560104,2023-07-14,23207,Lunch Bag Alphabet Design,5.97,1,17921.0,United Kingdom
560104,2023-07-14,23209,Lunch Bag Vintage Doily,5.97,2,17921.0,United Kingdom
560104,2023-07-14,23208,Lunch Bag Vintage Leaf Design,5.97,2,17921.0,United Kingdom
560104,2023-07-14,20728,Lunch Bag Cars Blue,5.97,2,17921.0,United Kingdom
560104,2023-07-14,20725,Lunch Bag Red Retrospot,5.97,2,17921.0,United Kingdom
560104,2023-07-14,22384,Lunch Bag Pink Polkadot,5.97,2,17921.0,United Kingdom
560104,2023-07-14,23206,Lunch Bag Apple Design,5.97,2,17921.0,United Kingdom
560105,2023-07-14,22151,Place Setting White Heart,10.68,50,16794.0,United Kingdom
560105,2023-07-14,85203,Hanging Wood And Felt Butterfly,10.68,2,16794.0,United Kingdom
560105,2023-07-14,85204,Hanging Wood And Felt Flower,10.37,4,16794.0,United Kingdom
560105,2023-07-14,22457,Natural Slate Heart Chalkboard,13.27,2,16794.0,United Kingdom
560105,2023-07-14,22219,Lovebird Hanging Decoration White,11.12,5,16794.0,United Kingdom
560105,2023-07-14,21158,Moody Girl Door Hanger,10.65,1,16794.0,United Kingdom
560105,2023-07-14,23103,Jingle Bell Heart Decoration,11.94,6,16794.0,United Kingdom
560105,2023-07-14,21231,Sweetheart Ceramic Trinket Box,11.53,5,16794.0,United Kingdom
560105,2023-07-14,22064,Pink Doughnut Trinket Pot,11.94,2,16794.0,United Kingdom
560105,2023-07-14,21232,Strawberry Ceramic Trinket Pot,11.53,5,16794.0,United Kingdom
560105,2023-07-14,22268,Decoration Sitting Bunny,10.44,20,16794.0,United Kingdom
560105,2023-07-14,22266,Easter Decoration Hanging Bunny,10.44,40,16794.0,United Kingdom
560105,2023-07-14,22855,Fine Wicker Heart,11.53,6,16794.0,United Kingdom
560105,2023-07-14,22233,Jigsaw Rabbit And Birdhouse,10.85,3,16794.0,United Kingdom
560105,2023-07-14,23321,Small White Heart Of Wicker,11.94,2,16794.0,United Kingdom
560105,2023-07-14,22469,Heart Of Wicker Small,11.94,3,16794.0,United Kingdom
560105,2023-07-14,23281,Folding Butterfly Mirror Red,11.1,2,16794.0,United Kingdom
560105,2023-07-14,23282,Folding Butterfly Mirror Ivory,11.1,2,16794.0,United Kingdom
560105,2023-07-14,23280,Folding Butterfly Mirror Hot Pink,11.1,2,16794.0,United Kingdom
560105,2023-07-14,22230,Jigsaw Tree With Watering Can,10.55,5,16794.0,United Kingdom
560105,2023-07-14,20723,Strawberry Charlotte Bag,11.12,5,16794.0,United Kingdom
560105,2023-07-14,22243,5 Hook Hanger Red Magic Toadstool,11.94,1,16794.0,United Kingdom
560105,2023-07-14,22244,3 Hook Hanger Magic Garden,12.25,2,16794.0,United Kingdom
560105,2023-07-14,22212,Four Hook White Lovebirds,12.4,2,16794.0,United Kingdom
560105,2023-07-14,20984,12 Pencils Tall Tube Posy,10.55,4,16794.0,United Kingdom
560105,2023-07-14,84510A,Set Of 4 English Rose Coasters,11.53,2,16794.0,United Kingdom
560105,2023-07-14,22356,Charlotte Bag Pink Polkadot,11.12,3,16794.0,United Kingdom
560105,2023-07-14,84924F,Psychedelic Metal Sign Calendar,11.06,2,16794.0,United Kingdom
560105,2023-07-14,21179,No Junk Mail Metal Sign,10.65,3,16794.0,United Kingdom
560105,2023-07-14,23300,Gardeners Kneeling Pad Cup Of Tea,11.94,1,16794.0,United Kingdom
560105,2023-07-14,23301,Gardeners Kneeling Pad Keep Calm,11.94,1,16794.0,United Kingdom
560105,2023-07-14,20719,Woodland Charlotte Bag,11.12,1,16794.0,United Kingdom
560105,2023-07-14,23302,Kneeling Mat Housework Design,11.94,1,16794.0,United Kingdom
560105,2023-07-14,22355,Charlotte Bag Suki Design,11.12,3,16794.0,United Kingdom
560105,2023-07-14,23205,Charlotte Bag Vintage Alphabet,11.12,6,16794.0,United Kingdom
560105,2023-07-14,20724,Red Retrospot Charlotte Bag,11.12,3,16794.0,United Kingdom
560105,2023-07-14,22661,Charlotte Bag Dolly Girl Design,11.12,5,16794.0,United Kingdom
560105,2023-07-14,21932,Scandinavian Paisley Picnic Bag,11.94,3,16794.0,United Kingdom
560105,2023-07-14,21933,Pink Vintage Paisley Picnic Bag,11.94,3,16794.0,United Kingdom
560105,2023-07-14,23200,Jumbo Bag Pears,6.19,1,16794.0,United Kingdom
560105,2023-07-14,23199,Jumbo Bag Apples,6.19,1,16794.0,United Kingdom
560105,2023-07-14,22382,Lunch Bag Spaceboy Design,5.97,5,16794.0,United Kingdom
560105,2023-07-14,20728,Lunch Bag Cars Blue,5.97,4,16794.0,United Kingdom
560105,2023-07-14,20726,Lunch Bag Woodland,5.97,2,16794.0,United Kingdom
560105,2023-07-14,22384,Lunch Bag Pink Polkadot,5.97,2,16794.0,United Kingdom
560105,2023-07-14,23208,Lunch Bag Vintage Leaf Design,5.97,5,16794.0,United Kingdom
560105,2023-07-14,23207,Lunch Bag Alphabet Design,5.97,5,16794.0,United Kingdom
560105,2023-07-14,22383,Lunch Bag Suki Design,5.97,5,16794.0,United Kingdom
560105,2023-07-14,20727,Lunch Bag Black Skull,5.97,5,16794.0,United Kingdom
560105,2023-07-14,22662,Lunch Bag Dolly Girl Design,5.97,5,16794.0,United Kingdom
560105,2023-07-14,23209,Lunch Bag Vintage Doily,5.97,5,16794.0,United Kingdom
560106,2023-07-14,22704,Wrap Red Apples,10.68,25,17554.0,United Kingdom
560106,2023-07-14,22705,Wrap Green Pears,10.68,25,17554.0,United Kingdom
560106,2023-07-14,22536,Magic Drawing Slate Purdey,10.68,48,17554.0,United Kingdom
560106,2023-07-14,21220,Set/4 Badges Dogs,11.53,10,17554.0,United Kingdom
560106,2023-07-14,21222,Set/4 Badges Beetles,11.53,10,17554.0,United Kingdom
560106,2023-07-14,22400,Magnets Pack Of 4 Home Sweet Home,10.65,24,17554.0,United Kingdom
560106,2023-07-14,16045,Popart Wooden Pencils Asst,10.29,100,17554.0,United Kingdom
560106,2023-07-14,22191,Ivory Diner Wall Clock,18.96,1,17554.0,United Kingdom
560106,2023-07-14,22193,Red Diner Wall Clock,18.96,1,17554.0,United Kingdom
560106,2023-07-14,22725,Alarm Clock Bakelike Chocolate,14.09,1,17554.0,United Kingdom
560106,2023-07-14,22727,Alarm Clock Bakelike Red,14.09,2,17554.0,United Kingdom
560106,2023-07-14,22726,Alarm Clock Bakelike Green,14.09,3,17554.0,United Kingdom
560106,2023-07-14,22729,Alarm Clock Bakelike Orange,14.09,4,17554.0,United Kingdom
560106,2023-07-14,21868,Potting Shed Tea Mug,11.53,12,17554.0,United Kingdom
560106,2023-07-14,23342,Mint Diner Wall Clock,18.96,2,17554.0,United Kingdom
560106,2023-07-14,23239,Set Of 4 Knick Knack Tins Poppies,14.5,6,17554.0,United Kingdom
560106,2023-07-14,23237,Set Of 4 Knick Knack Tins Leaf,14.5,6,17554.0,United Kingdom
560106,2023-07-14,82001S,Silver Record Cover Frame,14.09,3,17554.0,United Kingdom
560106,2023-07-14,21621,Vintage Union Jack Bunting,18.96,1,17554.0,United Kingdom
560106,2023-07-14,16016,Large Chinese Style Scissor,11.12,10,17554.0,United Kingdom
560106,2023-07-14,22897,Oven Mitt Apples Design,11.74,5,17554.0,United Kingdom
560106,2023-07-14,22620,4 Traditional Spinning Tops,11.74,6,17554.0,United Kingdom
560106,2023-07-14,20984,12 Pencils Tall Tube Posy,10.55,48,17554.0,United Kingdom
