TransactionNo,Date,ProductNo,ProductName,Price,Quantity,CustomerNo,Country
572309,2023-10-23,23100,Silver Bells Table Decoration,11.53,2,14432.0,United Kingdom
572309,2023-10-23,23102,Silver Hearts Table Decoration,11.1,2,14432.0,United Kingdom
572309,2023-10-23,21015,Dark Bird House Tree Decoration,10.55,6,14432.0,United Kingdom
572309,2023-10-23,21014,Swiss Chalet Tree Decoration,10.55,10,14432.0,United Kingdom
572309,2023-10-23,23226,Filigree Heart Daisy White,11.53,4,14432.0,United Kingdom
572309,2023-10-23,21817,Glitter Christmas Tree,10.65,4,14432.0,United Kingdom
572309,2023-10-23,21819,Glitter Christmas Star,10.65,2,14432.0,United Kingdom
572309,2023-10-23,21818,Glitter Heart Decoration,10.65,6,14432.0,United Kingdom
572309,2023-10-23,22163,Heart String Memo Holder Hanging,11.06,5,14432.0,United Kingdom
572309,2023-10-23,21822,Glitter Christmas Tree With Bells,11.06,2,14432.0,United Kingdom
572309,2023-10-23,23211,Red Rocking Horse Hand Painted,11.53,1,14432.0,United Kingdom
572309,2023-10-23,22571,Rocking Horse Red Christmas,11.12,1,14432.0,United Kingdom
572309,2023-10-23,23266,Set Of 3 Wooden Stocking Decoration,11.53,2,14432.0,United Kingdom
572309,2023-10-23,21824,Painted Metal Star With Holly Bells,10.65,8,14432.0,United Kingdom
572309,2023-10-23,23210,White Rocking Horse Hand Painted,11.53,3,14432.0,United Kingdom
572309,2023-10-23,23270,Set Of 2 Ceramic Painted Hearts,11.74,3,14432.0,United Kingdom
572309,2023-10-23,23490,T-Light Holder Hanging Love Bird,14.09,2,14432.0,United Kingdom
572309,2023-10-23,23321,Small White Heart Of Wicker,11.94,3,14432.0,United Kingdom
572309,2023-10-23,23103,Jingle Bell Heart Decoration,11.94,4,14432.0,United Kingdom
572309,2023-10-23,85123A,Cream Hanging Heart T-Light Holder,13.27,8,14432.0,United Kingdom
572309,2023-10-23,23074,Embossed Heart Trinket Box,12.38,1,14432.0,United Kingdom
572309,2023-10-23,17003,Brocade Ring Purse,10.65,12,14432.0,United Kingdom
572309,2023-10-23,22342,Home Garland Painted Zinc,11.02,2,14432.0,United Kingdom
572309,2023-10-23,47469,Assorted Shapes Photo Clip Silver,10.92,1,14432.0,United Kingdom
572309,2023-10-23,47469,Assorted Shapes Photo Clip Silver,10.92,1,14432.0,United Kingdom
572309,2023-10-23,23107,White Hearts Wire Plant Pot Holder,13.21,2,14432.0,United Kingdom
572309,2023-10-23,23150,Ivory Sweetheart Soap Dish,12.8,2,14432.0,United Kingdom
572309,2023-10-23,22294,Heart Filigree Dove Small,11.53,2,14432.0,United Kingdom
572309,2023-10-23,22227,Hanging Heart Mirror Decoration,10.92,1,14432.0,United Kingdom
572309,2023-10-23,85194S,Hanging Spring Flower Egg Small,10.44,4,14432.0,United Kingdom
572309,2023-10-23,22643,Set Of 4 Napkin Charms Leaves,12.86,1,14432.0,United Kingdom
572309,2023-10-23,22639,Set Of 4 Napkin Charms Hearts,12.86,1,14432.0,United Kingdom
572309,2023-10-23,23060,Heart Beaded Trellis Decoration,12.38,1,14432.0,United Kingdom
572309,2023-10-23,22287,Decoration Wobbly Chicken,10.65,1,14432.0,United Kingdom
572309,2023-10-23,22286,Decoration Wobbly Rabbit Metal,10.65,1,14432.0,United Kingdom
572309,2023-10-23,22268,Decoration Sitting Bunny,10.44,2,14432.0,United Kingdom
572309,2023-10-23,22267,Easter Decoration Egg Bunny,10.65,1,14432.0,United Kingdom
572309,2023-10-23,22211,Wood Stamp Set Flowers,11.1,1,14432.0,United Kingdom
572309,2023-10-23,22210,Wood Stamp Set Best Wishes,11.1,2,14432.0,United Kingdom
572309,2023-10-23,22208,Wood Stamp Set Thank You,11.1,2,14432.0,United Kingdom
572309,2023-10-23,22161,Heart Decoration Rustic Hanging,10.44,12,14432.0,United Kingdom
572309,2023-10-23,84879,Assorted Colour Bird Ornament,11.98,7,14432.0,United Kingdom
572309,2023-10-23,21386,Ivory Hanging Decoration Egg,10.44,4,14432.0,United Kingdom
572309,2023-10-23,21650,Assorted Tutti Frutti Bracelet,10.44,7,14432.0,United Kingdom
572309,2023-10-23,85049A,Traditional Christmas Ribbons,11.53,1,14432.0,United Kingdom
572309,2023-10-23,85049E,Scandinavian Reds Ribbons,11.53,1,14432.0,United Kingdom
572309,2023-10-23,85049C,Romantic Pinks Ribbons,11.53,1,14432.0,United Kingdom
572309,2023-10-23,81952V,Round Purple Clock With Sucker,10.44,1,14432.0,United Kingdom
572309,2023-10-23,23551,Pack Of 12 Paisley Park Tissues,10.65,6,14432.0,United Kingdom
572309,2023-10-23,23381,Pack Of 12 Vintage Leaf Tissues,10.65,6,14432.0,United Kingdom
572309,2023-10-23,21171,Bathroom Metal Sign,10.81,4,14432.0,United Kingdom
572309,2023-10-23,85071B,Red Charlie+Lola Personal Doorsign,10.65,4,14432.0,United Kingdom
572309,2023-10-23,47480,Hanging Photo Clip Rope Ladder,11.94,1,14432.0,United Kingdom
572309,2023-10-23,23452,Heart Mini Portrait Frame,12.25,2,14432.0,United Kingdom
572309,2023-10-23,23451,Square Mini Portrait Frame,12.25,2,14432.0,United Kingdom
572309,2023-10-23,82482,Wooden Picture Frame White Finish,13.27,4,14432.0,United Kingdom
572309,2023-10-23,23439,Hand Warmer Red Love Heart,12.4,2,14432.0,United Kingdom
572309,2023-10-23,22866,Hand Warmer Scotty Dog Design,12.4,2,14432.0,United Kingdom
572309,2023-10-23,22865,Hand Warmer Owl Design,12.4,2,14432.0,United Kingdom
572309,2023-10-23,22633,Hand Warmer Union Jack,12.4,2,14432.0,United Kingdom
572309,2023-10-23,22632,Hand Warmer Red Retrospot,12.4,4,14432.0,United Kingdom
572309,2023-10-23,22637,Piggy Bank Retrospot,12.86,2,14432.0,United Kingdom
572309,2023-10-23,85035B,Chocolate 3 Wick Morris Box Candle,11.53,4,14432.0,United Kingdom
572309,2023-10-23,22806,Set Of 6 T-Lights Wedding Cake,13.27,1,14432.0,United Kingdom
572309,2023-10-23,22893,Mini Cake Stand T-Light Holder,10.68,2,14432.0,United Kingdom
572309,2023-10-23,23090,Vintage Glass T-Light Holder,11.1,2,14432.0,United Kingdom
572309,2023-10-23,22792,Fluted Antique Candle Holder,11.12,2,14432.0,United Kingdom
572309,2023-10-23,22791,T-Light Glass Fluted Antique,11.53,2,14432.0,United Kingdom
572309,2023-10-23,21326,Aged Glass Silver T-Light Holder,10.92,2,14432.0,United Kingdom
572309,2023-10-23,84947,Antique Silver Tea Glass Engraved,11.53,2,14432.0,United Kingdom
572309,2023-10-23,85230B,Cinnamon Scented Votive Candle,10.55,24,14432.0,United Kingdom
572309,2023-10-23,85231B,Cinammon Set Of 9 T-Lights,11.12,4,14432.0,United Kingdom
572309,2023-10-23,21620,Set Of 4 Rose Botanical Candles,11.53,4,14432.0,United Kingdom
572309,2023-10-23,21619,4 Vanilla Botanical Candles,11.53,4,14432.0,United Kingdom
572309,2023-10-23,21615,4 Lavender Botanical Dinner Candles,11.53,4,14432.0,United Kingdom
572309,2023-10-23,21617,4 Lily Botanical Dinner Candles,11.53,4,14432.0,United Kingdom
572309,2023-10-23,23240,Set Of 4 Knick Knack Tins Doily,14.5,1,14432.0,United Kingdom
572309,2023-10-23,23493,Vintage Doily Travel Sewing Kit,12.25,4,14432.0,United Kingdom
572309,2023-10-23,35648,Vintage Bead Pink Purse,11.1,6,14432.0,United Kingdom
572309,2023-10-23,35646,Vintage Bead Pink Evening Bag,11.53,6,14432.0,United Kingdom
572309,2023-10-23,35651,Vintage Bead Pink Scarf,11.94,4,14432.0,United Kingdom
572309,2023-10-23,21034,Rex Cash+Carry Jumbo Shopper,11.22,1,14432.0,United Kingdom
572309,2023-10-23,22561,Wooden School Colouring Set,11.94,60,14432.0,United Kingdom
572309,2023-10-23,90142D,Mop Pendant Shell Necklace,15.32,3,14432.0,United Kingdom
572309,2023-10-23,90180A,Black+White Necklace W Tassel,13.27,6,14432.0,United Kingdom
572309,2023-10-23,22383,Lunch Bag Suki Design,5.97,1,14432.0,United Kingdom
572309,2023-10-23,23209,Lunch Bag Vintage Doily,5.97,1,14432.0,United Kingdom
572310,2023-10-23,23321,Small White Heart Of Wicker,11.94,2,12748.0,United Kingdom
572310,2023-10-23,21636,Madras Notebook Medium,11.02,1,12748.0,United Kingdom
572310,2023-10-23,22993,Set Of 4 Pantry Jelly Moulds,11.53,2,12748.0,United Kingdom
572310,2023-10-23,22091,Empire Tissue Box,10.65,2,12748.0,United Kingdom
572311,2023-10-23,46000S,Polyester Filler Pad 40x40cm,11.74,2,14035.0,United Kingdom
572311,2023-10-23,46000M,Polyester Filler Pad 45x45cm,11.84,4,14035.0,United Kingdom
572311,2023-10-23,23321,Small White Heart Of Wicker,11.94,6,14035.0,United Kingdom
572311,2023-10-23,23147,Single Antique Rose Hook Ivory,11.74,1,14035.0,United Kingdom
572311,2023-10-23,23147,Single Antique Rose Hook Ivory,11.74,6,14035.0,United Kingdom
572311,2023-10-23,21314,Small Glass Heart Trinket Pot,12.4,4,14035.0,United Kingdom
572311,2023-10-23,22151,Place Setting White Heart,10.68,24,14035.0,United Kingdom
572311,2023-10-23,23245,Set Of 3 Regency Cake Tins,15.32,1,14035.0,United Kingdom
572311,2023-10-23,35095B,Red Victorian Fabric Oval Box,10.68,6,14035.0,United Kingdom
572311,2023-10-23,35095A,Blue Victorian Fabric Oval Box,10.68,6,14035.0,United Kingdom
572311,2023-10-23,21171,Bathroom Metal Sign,10.81,1,14035.0,United Kingdom
572311,2023-10-23,22804,Pink Hanging Heart T-Light Holder,13.27,3,14035.0,United Kingdom
572311,2023-10-23,21992,Vintage Paisley Stationery Set,11.53,4,14035.0,United Kingdom
572311,2023-10-23,84946,Antique Silver T-Light Glass,11.53,6,14035.0,United Kingdom
572311,2023-10-23,85035A,Gardenia 3 Wick Morris Boxed Candle,11.53,6,14035.0,United Kingdom
572311,2023-10-23,85036C,Rose 1 Wick Morris Boxed Candle,11.53,6,14035.0,United Kingdom
572311,2023-10-23,85036B,Chocolate 1 Wick Morris Box Candle,11.53,6,14035.0,United Kingdom
572311,2023-10-23,84884A,Ant White Wire Heart Spiral,14.3,3,14035.0,United Kingdom
572311,2023-10-23,23393,Home Sweet Home Cushion Cover,14.09,2,14035.0,United Kingdom
572311,2023-10-23,23394,Poste France Cushion Cover,14.09,2,14035.0,United Kingdom
572311,2023-10-23,23395,Belle Jardiniere Cushion Cover,14.09,2,14035.0,United Kingdom
572311,2023-10-23,82486,3 Drawer Antique White Wood Cabinet,19.42,2,14035.0,United Kingdom
572311,2023-10-23,82483,Wood 2 Drawer Cabinet White Finish,17.37,2,14035.0,United Kingdom
572311,2023-10-23,21135,Victorian Metal Postcard Spring,11.98,16,14035.0,United Kingdom
572311,2023-10-23,21136,Painted Metal Pears Assorted,11.98,16,14035.0,United Kingdom
572311,2023-10-23,84879,Assorted Colour Bird Ornament,11.98,32,14035.0,United Kingdom
572311,2023-10-23,23202,Jumbo Bag Vintage Leaf,6.19,2,14035.0,United Kingdom
572312,2023-10-23,21034,Rex Cash+Carry Jumbo Shopper,11.22,4,15022.0,United Kingdom
572312,2023-10-23,84792,Enchanted Bird Coathanger 5 Hook,15.02,2,15022.0,United Kingdom
572312,2023-10-23,22436,12 Coloured Party Balloons,10.92,10,15022.0,United Kingdom
572312,2023-10-23,23500,Key Ring Baseball Boot Assorted,11.53,20,15022.0,United Kingdom
572312,2023-10-23,21618,4 Wildflower Botanical Candles,11.53,4,15022.0,United Kingdom
572312,2023-10-23,21617,4 Lily Botanical Dinner Candles,11.53,2,15022.0,United Kingdom
572312,2023-10-23,21618,4 Wildflower Botanical Candles,11.53,2,15022.0,United Kingdom
572312,2023-10-23,21617,4 Lily Botanical Dinner Candles,11.53,2,15022.0,United Kingdom
572312,2023-10-23,21615,4 Lavender Botanical Dinner Candles,11.53,2,15022.0,United Kingdom
572312,2023-10-23,21991,Bohemian Collage Stationery Set,11.53,3,15022.0,United Kingdom
572312,2023-10-23,22138,Baking Set 9 Piece Retrospot,15.32,2,15022.0,United Kingdom
572312,2023-10-23,21499,Blue Polkadot Wrap,10.68,25,15022.0,United Kingdom
572312,2023-10-23,21500,Pink Polkadot Wrap,10.68,25,15022.0,United Kingdom
572312,2023-10-23,22704,Wrap Red Apples,10.68,25,15022.0,United Kingdom
572312,2023-10-23,22707,Wrap Monster Fun,10.68,25,15022.0,United Kingdom
572312,2023-10-23,16156S,Wrap Pink Fairy Cakes,10.68,25,15022.0,United Kingdom
572312,2023-10-23,22113,Grey Heart Hot Water Bottle,14.61,5,15022.0,United Kingdom
572312,2023-10-23,22112,Chocolate Hot Water Bottle,15.32,1,15022.0,United Kingdom
572312,2023-10-23,84029G,Knitted Union Flag Hot Water Bottle,14.61,2,15022.0,United Kingdom
572312,2023-10-23,21484,Chick Grey Hot Water Bottle,14.61,1,15022.0,United Kingdom
572312,2023-10-23,21791,Vintage Heads And Tails Card Game,11.53,2,15022.0,United Kingdom
572312,2023-10-23,21790,Vintage Snap Cards,11.12,2,15022.0,United Kingdom
572312,2023-10-23,22114,Hot Water Bottle Tea And Sympathy,14.61,2,15022.0,United Kingdom
572312,2023-10-23,21485,Retrospot Heart Hot Water Bottle,15.32,1,15022.0,United Kingdom
572312,2023-10-23,21485,Retrospot Heart Hot Water Bottle,15.32,1,15022.0,United Kingdom
572312,2023-10-23,21481,Fawn Blue Hot Water Bottle,14.09,2,15022.0,United Kingdom
572312,2023-10-23,21484,Chick Grey Hot Water Bottle,14.61,1,15022.0,United Kingdom
572312,2023-10-23,21479,White Skull Hot Water Bottle,14.61,1,15022.0,United Kingdom
572312,2023-10-23,23357,Hot Water Bottle Sex Bomb,15.32,2,15022.0,United Kingdom
572312,2023-10-23,22111,Scottie Dog Hot Water Bottle,15.32,2,15022.0,United Kingdom
572312,2023-10-23,84029E,Red Woolly Hottie White Heart,14.61,2,15022.0,United Kingdom
572312,2023-10-23,84031A,Charlie+Lola Red Hot Water Bottle,15.02,1,15022.0,United Kingdom
572312,2023-10-23,21479,White Skull Hot Water Bottle,14.61,1,15022.0,United Kingdom
572312,2023-10-23,23356,Love Hot Water Bottle,16.35,1,15022.0,United Kingdom
572312,2023-10-23,23490,T-Light Holder Hanging Love Bird,14.09,6,15022.0,United Kingdom
572312,2023-10-23,22110,Bird House Hot Water Bottle,12.86,2,15022.0,United Kingdom
572312,2023-10-23,23356,Love Hot Water Bottle,16.35,1,15022.0,United Kingdom
572312,2023-10-23,84031B,Charlie Lola Blue Hot Water Bottle,15.02,1,15022.0,United Kingdom
572312,2023-10-23,22470,Heart Of Wicker Large,13.27,1,15022.0,United Kingdom
572312,2023-10-23,23321,Small White Heart Of Wicker,11.94,2,15022.0,United Kingdom
572312,2023-10-23,23392,Spaceboy Rocket Lolly Makers,12.38,1,15022.0,United Kingdom
572312,2023-10-23,23321,Small White Heart Of Wicker,11.94,1,15022.0,United Kingdom
572312,2023-10-23,22470,Heart Of Wicker Large,13.27,3,15022.0,United Kingdom
572312,2023-10-23,23075,Parlour Ceramic Wall Hook,14.5,2,15022.0,United Kingdom
572312,2023-10-23,22113,Grey Heart Hot Water Bottle,14.61,1,15022.0,United Kingdom
572312,2023-10-23,21484,Chick Grey Hot Water Bottle,14.61,1,15022.0,United Kingdom
572312,2023-10-23,21484,Chick Grey Hot Water Bottle,14.61,1,15022.0,United Kingdom
572312,2023-10-23,23322,Large White Heart Of Wicker,13.27,3,15022.0,United Kingdom
572312,2023-10-23,22111,Scottie Dog Hot Water Bottle,15.32,1,15022.0,United Kingdom
572312,2023-10-23,22112,Chocolate Hot Water Bottle,15.32,1,15022.0,United Kingdom
572313,2023-10-23,23313,Vintage Christmas Bunting,15.32,3,14731.0,United Kingdom
572313,2023-10-23,23312,Vintage Christmas Gift Sack,14.5,6,14731.0,United Kingdom
572313,2023-10-23,23311,Vintage Christmas Stocking,12.86,6,14731.0,United Kingdom
572313,2023-10-23,21620,Set Of 4 Rose Botanical Candles,11.53,2,14731.0,United Kingdom
572313,2023-10-23,21619,4 Vanilla Botanical Candles,11.53,2,14731.0,United Kingdom
572313,2023-10-23,22144,Christmas Craft Little Friends,12.4,5,14731.0,United Kingdom
572313,2023-10-23,22142,Christmas Craft White Fairy,11.74,5,14731.0,United Kingdom
572313,2023-10-23,20992,Jazz Hearts Purse Notebook,10.65,6,14731.0,United Kingdom
572313,2023-10-23,85017B,Envelope 50 Blossom Images,10.68,6,14731.0,United Kingdom
572313,2023-10-23,72818,Christmas Decoupage Candle,10.65,6,14731.0,United Kingdom
572313,2023-10-23,22141,Christmas Craft Tree Top Angel,12.4,4,14731.0,United Kingdom
572313,2023-10-23,22187,Green Christmas Tree Card Holder,12.25,4,14731.0,United Kingdom
572313,2023-10-23,85036C,Rose 1 Wick Morris Boxed Candle,11.53,6,14731.0,United Kingdom
572313,2023-10-23,85032B,Blossom Images Gift Wrap Set,10.92,12,14731.0,United Kingdom
572314,2023-10-23,21915,Red Harmonica In Box,11.53,12,17111.0,United Kingdom
572314,2023-10-23,21914,Blue Harmonica In Box,11.53,12,17111.0,United Kingdom
572314,2023-10-23,85054,French Enamel Pot W Lid,13.27,1,17111.0,United Kingdom
572314,2023-10-23,17090A,Lavender Incense 40 Cones In Tin,11.53,6,17111.0,United Kingdom
572314,2023-10-23,23048,Set Of 10 Lanterns Fairy Light Star,14.5,3,17111.0,United Kingdom
572314,2023-10-23,23293,Set Of 12 Fairy Cake Baking Cases,11.1,1,17111.0,United Kingdom
572314,2023-10-23,23295,Set Of 12 Mini Loaf Baking Cases,11.1,1,17111.0,United Kingdom
572314,2023-10-23,17084N,Fairy Dreams Incense,10.47,50,17111.0,United Kingdom
572314,2023-10-23,72598,Set/12 Taper Candles,11.12,5,17111.0,United Kingdom
572314,2023-10-23,23190,Bundle Of 3 School Exercise Books,11.94,1,17111.0,United Kingdom
572314,2023-10-23,22624,Ivory Kitchen Scales,18.96,1,17111.0,United Kingdom
572314,2023-10-23,22334,Dinosaur Party Bag + Sticker Set,11.94,6,17111.0,United Kingdom
572314,2023-10-23,22331,Woodland Party Bag + Sticker Set,11.94,3,17111.0,United Kingdom
572314,2023-10-23,22481,Black Tea Towel Classic Design,11.53,2,17111.0,United Kingdom
572314,2023-10-23,22816,Card Motorbike Santa,10.68,12,17111.0,United Kingdom
572314,2023-10-23,22355,Charlotte Bag Suki Design,11.12,20,17111.0,United Kingdom
572314,2023-10-23,21167,White Sage Incense,10.47,50,17111.0,United Kingdom
572314,2023-10-23,23205,Charlotte Bag Vintage Alphabet,11.12,20,17111.0,United Kingdom
572314,2023-10-23,22355,Charlotte Bag Suki Design,11.12,20,17111.0,United Kingdom
572314,2023-10-23,15044C,Purple Paper Parasol,13.27,3,17111.0,United Kingdom
572314,2023-10-23,15044A,Pink Paper Parasol,13.27,3,17111.0,United Kingdom
572314,2023-10-23,15044D,Red Paper Parasol,13.27,5,17111.0,United Kingdom
572314,2023-10-23,21932,Scandinavian Paisley Picnic Bag,11.94,4,17111.0,United Kingdom
572314,2023-10-23,21936,Red Retrospot Picnic Bag,13.27,2,17111.0,United Kingdom
572314,2023-10-23,21933,Pink Vintage Paisley Picnic Bag,11.94,3,17111.0,United Kingdom
572314,2023-10-23,17003,Brocade Ring Purse,10.65,48,17111.0,United Kingdom
572314,2023-10-23,21929,Jumbo Bag Pink Vintage Paisley,6.19,2,17111.0,United Kingdom
572314,2023-10-23,23202,Jumbo Bag Vintage Leaf,6.19,2,17111.0,United Kingdom
572314,2023-10-23,85099F,Jumbo Bag Strawberry,6.19,2,17111.0,United Kingdom
572314,2023-10-23,22663,Jumbo Bag Dolly Girl Design,6.19,2,17111.0,United Kingdom
572315,2023-10-23,22791,T-Light Glass Fluted Antique,11.53,6,14504.0,United Kingdom
572315,2023-10-23,84879,Assorted Colour Bird Ornament,11.98,8,14504.0,United Kingdom
572315,2023-10-23,84947,Antique Silver Tea Glass Engraved,11.53,4,14504.0,United Kingdom
572315,2023-10-23,23109,Pack Of Six Led Tea Lights,13.21,2,14504.0,United Kingdom
572315,2023-10-23,23014,Glass Apothecary Bottle Elixir,14.3,1,14504.0,United Kingdom
572315,2023-10-23,23012,Glass Apothecary Bottle Perfume,14.3,2,14504.0,United Kingdom
572315,2023-10-23,22457,Natural Slate Heart Chalkboard,13.27,3,14504.0,United Kingdom
572315,2023-10-23,22470,Heart Of Wicker Large,13.27,4,14504.0,United Kingdom
572315,2023-10-23,21745,Gaolers Keys Decorative Garden,14.09,7,14504.0,United Kingdom
572315,2023-10-23,21260,First Aid Tin,13.58,4,14504.0,United Kingdom
572315,2023-10-23,21906,Pharmacie First Aid Tin,17.17,4,14504.0,United Kingdom
572316,2023-10-23,23447,Pink Bunny Easter Egg Basket,11.94,1,17836.0,United Kingdom
572316,2023-10-23,21123,Set/10 Ivory Polkadot Party Candles,11.53,1,17836.0,United Kingdom
572316,2023-10-23,21121,Set/10 Red Polkadot Party Candles,11.53,1,17836.0,United Kingdom
572316,2023-10-23,21122,Set/10 Pink Polkadot Party Candles,11.53,1,17836.0,United Kingdom
572316,2023-10-23,23338,Egg Frying Pan Red,12.38,1,17836.0,United Kingdom
572316,2023-10-23,84375,Set Of 20 Kids Cookie Cutters,12.4,1,17836.0,United Kingdom
572316,2023-10-23,22563,Happy Stencil Craft,11.53,1,17836.0,United Kingdom
572316,2023-10-23,23295,Set Of 12 Mini Loaf Baking Cases,11.1,1,17836.0,United Kingdom
572316,2023-10-23,72799F,Ivory Pillar Candle Gold Flock,13.27,1,17836.0,United Kingdom
572316,2023-10-23,21713,Citronella Candle Flowerpot,12.4,1,17836.0,United Kingdom
572316,2023-10-23,85017B,Envelope 50 Blossom Images,10.68,1,17836.0,United Kingdom
572316,2023-10-23,23185,French Style Storage Jar Jam,10.55,4,17836.0,United Kingdom
572316,2023-10-23,21866,Union Jack Flag Luggage Tag,11.53,2,17836.0,United Kingdom
572316,2023-10-23,21864,Union Jack Flag Passport Cover,12.4,2,17836.0,United Kingdom
572316,2023-10-23,21619,4 Vanilla Botanical Candles,11.53,5,17836.0,United Kingdom
572316,2023-10-23,21865,Pink Union Jack Passport Cover,12.4,1,17836.0,United Kingdom
572316,2023-10-23,21867,Pink Union Jack Luggage Tag,11.53,1,17836.0,United Kingdom
572316,2023-10-23,22906,12 Message Cards With Envelopes,11.94,4,17836.0,United Kingdom
572316,2023-10-23,17091J,Vanilla Incense In Tin,10.64,3,17836.0,United Kingdom
572316,2023-10-23,17012C,Origami Lavender Incense/Candl Set,11.12,18,17836.0,United Kingdom
572316,2023-10-23,72369A,Pink Clear Glass Candle Plate,11.53,12,17836.0,United Kingdom
572316,2023-10-23,85040A,S/4 Pink Flower Candles In Bowl,11.94,18,17836.0,United Kingdom
572316,2023-10-23,72369A,Pink Clear Glass Candle Plate,11.53,6,17836.0,United Kingdom
572317,2023-10-23,23284,Doormat Keep Calm And Come In,18.71,2,14629.0,United Kingdom
572317,2023-10-23,23283,Doormat Vintage Leaf,18.71,2,14629.0,United Kingdom
572317,2023-10-23,48188,Doormat Welcome Puppies,18.71,2,14629.0,United Kingdom
572317,2023-10-23,22660,Doormat I Love London,18.71,2,14629.0,United Kingdom
572317,2023-10-23,22690,Doormat Home Sweet Home Blue,18.71,2,14629.0,United Kingdom
572317,2023-10-23,22692,Doormat Welcome To Our Home,18.71,2,14629.0,United Kingdom
572317,2023-10-23,23543,Wall Art Keep Calm,18.71,3,14629.0,United Kingdom
572317,2023-10-23,22689,Doormat Merry Christmas Red,18.71,2,14629.0,United Kingdom
572317,2023-10-23,23536,Wall Art Village Show,16.35,2,14629.0,United Kingdom
572317,2023-10-23,23535,Wall Art Bicycle Safety,16.35,2,14629.0,United Kingdom
572317,2023-10-23,23526,Wall Art Dog Licence,16.35,2,14629.0,United Kingdom
572317,2023-10-23,23243,Set Of Tea Coffee Sugar Tins Pantry,15.32,6,14629.0,United Kingdom
572317,2023-10-23,22818,Card Christmas Village,10.68,12,14629.0,United Kingdom
572317,2023-10-23,23353,6 Gift Tags Vintage Christmas,11.1,1,14629.0,United Kingdom
572317,2023-10-23,23354,6 Gift Tags 50'S Christmas,11.1,1,14629.0,United Kingdom
572317,2023-10-23,23434,3 Raffia Ribbons 50'S Christmas,11.06,4,14629.0,United Kingdom
572317,2023-10-23,16169E,Wrap 50'S Christmas,10.68,25,14629.0,United Kingdom
572317,2023-10-23,22959,Wrap Christmas Village,10.68,25,14629.0,United Kingdom
572317,2023-10-23,22498,Wooden Regatta Bunting,16.35,1,14629.0,United Kingdom
572317,2023-10-23,21621,Vintage Union Jack Bunting,18.96,2,14629.0,United Kingdom
572317,2023-10-23,22738,Ribbon Reel Snowy Village,11.94,1,14629.0,United Kingdom
572317,2023-10-23,37413,Icon Mug Revolutionary,10.65,6,14629.0,United Kingdom
572317,2023-10-23,22720,Set Of 3 Cake Tins Pantry Design,15.32,1,14629.0,United Kingdom
572317,2023-10-23,22721,Set Of 3 Cake Tins Sketchbook,15.32,1,14629.0,United Kingdom
572317,2023-10-23,20735,Black Mini Tape Measure,11.12,2,14629.0,United Kingdom
572317,2023-10-23,21248,Door Hanger Mum + Dads Room,11.74,2,14629.0,United Kingdom
572317,2023-10-23,21163,Do Not Touch My Stuff Door Hanger,10.65,2,14629.0,United Kingdom
572317,2023-10-23,21159,Moody Boy Door Hanger,10.65,2,14629.0,United Kingdom
572317,2023-10-23,23569,Tradtional Alphabet Stamp Set,15.32,1,14629.0,United Kingdom
572317,2023-10-23,23193,Buffalo Bill Treasure Book Box,12.56,1,14629.0,United Kingdom
572317,2023-10-23,22114,Hot Water Bottle Tea And Sympathy,14.61,1,14629.0,United Kingdom
572317,2023-10-23,23356,Love Hot Water Bottle,16.35,1,14629.0,United Kingdom
572317,2023-10-23,21485,Retrospot Heart Hot Water Bottle,15.32,1,14629.0,United Kingdom
572317,2023-10-23,22112,Chocolate Hot Water Bottle,15.32,1,14629.0,United Kingdom
572317,2023-10-23,22835,Hot Water Bottle I Am So Poorly,15.32,1,14629.0,United Kingdom
572317,2023-10-23,23355,Hot Water Bottle Keep Calm,15.32,2,14629.0,United Kingdom
572317,2023-10-23,20981,12 Pencils Tall Tube Woodland,11.12,1,14629.0,United Kingdom
572317,2023-10-23,20983,12 Pencils Tall Tube Red Retrospot,11.12,1,14629.0,United Kingdom
572317,2023-10-23,23439,Hand Warmer Red Love Heart,12.4,2,14629.0,United Kingdom
572317,2023-10-23,22867,Hand Warmer Bird Design,12.4,2,14629.0,United Kingdom
572317,2023-10-23,22866,Hand Warmer Scotty Dog Design,12.4,5,14629.0,United Kingdom
572317,2023-10-23,21899,Garage Key Fob,10.92,4,14629.0,United Kingdom
572317,2023-10-23,21900,Key Fob Shed,10.92,4,14629.0,United Kingdom
572317,2023-10-23,20979,36 Pencils Tube Red Retrospot,11.53,1,14629.0,United Kingdom
572317,2023-10-23,22328,Round Snack Boxes Set Of 4 Fruits,13.27,1,14629.0,United Kingdom
572317,2023-10-23,23245,Set Of 3 Regency Cake Tins,15.32,1,14629.0,United Kingdom
572317,2023-10-23,23184,Bull Dog Bottle Opener,15.32,2,14629.0,United Kingdom
572317,2023-10-23,23336,Egg Frying Pan Pink,12.38,1,14629.0,United Kingdom
572317,2023-10-23,82583,Hot Baths Metal Sign,12.4,2,14629.0,United Kingdom
572317,2023-10-23,82582,Area Patrolled Metal Sign,12.4,2,14629.0,United Kingdom
572317,2023-10-23,21181,Please One Person Metal Sign,12.4,1,14629.0,United Kingdom
572317,2023-10-23,21992,Vintage Paisley Stationery Set,11.53,2,14629.0,United Kingdom
572317,2023-10-23,23494,Vintage Doily Deluxe Sewing Kit,16.35,2,14629.0,United Kingdom
572317,2023-10-23,23493,Vintage Doily Travel Sewing Kit,12.25,2,14629.0,United Kingdom
572317,2023-10-23,85049G,Chocolate Box Ribbons,11.53,1,14629.0,United Kingdom
572317,2023-10-23,22428,Enamel Fire Bucket Cream,17.37,2,14629.0,United Kingdom
572317,2023-10-23,22739,Ribbon Reel Christmas Sock Bauble,11.94,1,14629.0,United Kingdom
572317,2023-10-23,22737,Ribbon Reel Christmas Present,11.94,1,14629.0,United Kingdom
572317,2023-10-23,22738,Ribbon Reel Snowy Village,11.94,1,14629.0,United Kingdom
572317,2023-10-23,22736,Ribbon Reel Making Snowmen,11.94,1,14629.0,United Kingdom
572317,2023-10-23,84378,Set Of 3 Heart Cookie Cutters,11.74,2,14629.0,United Kingdom
572317,2023-10-23,22314,Office Mug Warmer Choc+Blue,13.27,2,14629.0,United Kingdom
572317,2023-10-23,23182,Toilet Sign Occupied Or Vacant,11.1,4,14629.0,United Kingdom
572317,2023-10-23,22313,Office Mug Warmer Pink,13.27,2,14629.0,United Kingdom
572317,2023-10-23,22312,Office Mug Warmer Polkadot,13.27,2,14629.0,United Kingdom
