TransactionNo,Date,ProductNo,ProductName,Price,Quantity,CustomerNo,Country
544598,2023-02-21,21332,Moroccan Beaten Metal Mirror,35.83,1,14598.0,United Kingdom
544599,2023-02-21,22282,12 Egg House Painted Wood,35.83,1,15599.0,United Kingdom
544599,2023-02-21,22424,Enamel Bread Bin Cream,35.83,1,15599.0,United Kingdom
544599,2023-02-21,22829,Sweetheart Wire Wall Tidy,31.56,1,15599.0,United Kingdom
544599,2023-02-21,21843,Red Retrospot Cake Stand,31.56,1,15599.0,United Kingdom
544599,2023-02-21,22061,Large Cake Stand Hanging Strawbery,31.56,1,15599.0,United Kingdom
544599,2023-02-21,22180,Retrospot Lamp,31.56,1,15599.0,United Kingdom
544599,2023-02-21,22220,Cake Stand Lovebird 2 Tier White,30.71,1,15599.0,United Kingdom
544472,2023-02-21,22797,Chest Of Drawers Gingham Heart,27.62,1,15129.0,United Kingdom
544572,2023-02-21,22846,Bread Bin Diner Style Red,27.62,1,14639.0,United Kingdom
544572,2023-02-21,22849,Bread Bin Diner Style Mint,27.62,1,14639.0,United Kingdom
544468,2023-02-21,22801,Antique Glass Pedestal Bowl,14.09,4,13468.0,United Kingdom
544468,2023-02-21,79000,Moroccan Tea Glass,11.12,12,13468.0,United Kingdom
544468,2023-02-21,21669,Blue Stripe Ceramic Drawer Knob,11.53,36,13468.0,United Kingdom
544468,2023-02-21,85123A,Cream Hanging Heart T-Light Holder,13.27,6,13468.0,United Kingdom
544468,2023-02-21,22505,Memo Board Cottage Design,15.32,4,13468.0,United Kingdom
544468,2023-02-21,22138,Baking Set 9 Piece Retrospot,15.32,6,13468.0,United Kingdom
544468,2023-02-21,22493,Paint Your Own Canvas Set,11.94,12,13468.0,United Kingdom
544468,2023-02-21,21790,Vintage Snap Cards,11.12,12,13468.0,United Kingdom
544468,2023-02-21,22726,Alarm Clock Bakelike Green,14.09,4,13468.0,United Kingdom
544468,2023-02-21,21918,Set 12 Kids Colour Chalk Sticks,10.68,24,13468.0,United Kingdom
544468,2023-02-21,21704,Bag 250g Swirly Marbles,11.12,12,13468.0,United Kingdom
544468,2023-02-21,22550,Holiday Fun Ludo,14.09,4,13468.0,United Kingdom
544468,2023-02-21,21891,Traditional Wooden Skipping Rope,11.53,12,13468.0,United Kingdom
544468,2023-02-21,22149,Feltcraft 6 Flower Friends,12.4,12,13468.0,United Kingdom
544468,2023-02-21,22652,Travel Sewing Kit,11.94,10,13468.0,United Kingdom
544468,2023-02-21,22507,Memo Board Retrospot Design,15.32,4,13468.0,United Kingdom
544468,2023-02-21,22960,Jam Making Set With Jars,14.61,6,13468.0,United Kingdom
544468,2023-02-21,22961,Jam Making Set Printed,11.74,12,13468.0,United Kingdom
544468,2023-02-21,22907,Pack Of 20 Napkins Pantry Design,11.12,24,13468.0,United Kingdom
544468,2023-02-21,22978,Pantry Rolling Pin,14.09,6,13468.0,United Kingdom
544468,2023-02-21,22722,Set Of 6 Spice Tins Pantry Design,14.3,4,13468.0,United Kingdom
544468,2023-02-21,84378,Set Of 3 Heart Cookie Cutters,11.53,12,13468.0,United Kingdom
544468,2023-02-21,21871,Save The Planet Mug,11.53,12,13468.0,United Kingdom
544468,2023-02-21,21658,Glass Beurre Dish,14.3,4,13468.0,United Kingdom
544468,2023-02-21,21977,Pack Of 60 Pink Paisley Cake Cases,10.81,24,13468.0,United Kingdom
544468,2023-02-21,21465,Pink Flower Crochet Food Cover,14.09,12,13468.0,United Kingdom
544468,2023-02-21,22666,Recipe Box Pantry Yellow Design,13.27,6,13468.0,United Kingdom
544468,2023-02-21,22665,Recipe Box Blue Sketchbook Design,13.27,12,13468.0,United Kingdom
544468,2023-02-21,22567,20 Dolly Pegs Retrospot,11.53,12,13468.0,United Kingdom
544468,2023-02-21,21175,Gin And Tonic Diet Metal Sign,12.86,12,13468.0,United Kingdom
544468,2023-02-21,48187,Doormat New England,17.17,10,13468.0,United Kingdom
544468,2023-02-21,21896,Potting Shed Twine,12.4,6,13468.0,United Kingdom
544468,2023-02-21,21868,Potting Shed Tea Mug,11.53,12,13468.0,United Kingdom
544468,2023-02-21,22429,Enamel Measuring Jug Cream,14.61,4,13468.0,United Kingdom
544468,2023-02-21,84836,Zinc Metal Heart Decoration,11.53,12,13468.0,United Kingdom
544468,2023-02-21,22482,Blue Tea Towel Classic Design,11.53,12,13468.0,United Kingdom
544468,2023-02-21,22480,Red Tea Towel Classic Design,11.53,12,13468.0,United Kingdom
544468,2023-02-21,22169,Family Album White Picture Frame,18.96,2,13468.0,United Kingdom
544468,2023-02-21,82482,Wooden Picture Frame White Finish,12.86,6,13468.0,United Kingdom
544468,2023-02-21,82494L,Wooden Frame Antique White,13.27,6,13468.0,United Kingdom
544469,2023-02-21,21907,I'm On Holiday Metal Sign,12.4,12,12469.0,EIRE
544469,2023-02-21,22560,Traditional Modelling Clay,11.53,24,12469.0,EIRE
544469,2023-02-21,85053,French Enamel Candleholder,12.4,12,12469.0,EIRE
544470,2023-02-21,22514,Childs Garden Spade Blue,12.4,6,12707.0,France
544470,2023-02-21,22515,Childs Garden Spade Pink,12.4,6,12707.0,France
544470,2023-02-21,22516,Childs Garden Rake Blue,12.4,6,12707.0,France
544470,2023-02-21,22517,Childs Garden Rake Pink,12.4,6,12707.0,France
544470,2023-02-21,22518,Childs Garden Brush Blue,12.4,6,12707.0,France
544470,2023-02-21,22519,Childs Garden Brush Pink,12.4,6,12707.0,France
544470,2023-02-21,22520,Childs Garden Trowel Blue,11.12,12,12707.0,France
544470,2023-02-21,22521,Childs Garden Trowel Pink,11.12,12,12707.0,France
544470,2023-02-21,22522,Childs Garden Fork Blue,11.12,12,12707.0,France
544470,2023-02-21,22523,Childs Garden Fork Pink,11.12,12,12707.0,France
544470,2023-02-21,22524,Childrens Garden Gloves Blue,11.53,10,12707.0,France
544470,2023-02-21,22525,Childrens Garden Gloves Pink,11.53,10,12707.0,France
544470,2023-02-21,22619,Set Of 6 Soldier Skittles,14.09,4,12707.0,France
544470,2023-02-21,22607,Wooden Rounders Garden Set,18.96,8,12707.0,France
544470,2023-02-21,22713,Card I Love London,10.68,12,12707.0,France
544470,2023-02-21,22900,Set 2 Tea Towels I Love London,13.27,6,12707.0,France
544470,2023-02-21,22891,Tea For One Polkadot,14.61,3,12707.0,France
544470,2023-02-21,21527,Red Retrospot Traditional Teapot,18.4,2,12707.0,France
544470,2023-02-21,21528,Dairy Maid Traditional Teapot,17.37,6,12707.0,France
544470,2023-02-21,22970,London Bus Coffee Mug,12.86,6,12707.0,France
544470,2023-02-21,22971,Queens Guard Coffee Mug,12.86,6,12707.0,France
544470,2023-02-21,37370,Retro Coffee Mugs Assorted,11.53,12,12707.0,France
544470,2023-02-21,22969,Homemade Jam Scented Candles,11.74,12,12707.0,France
544470,2023-02-21,22084,Paper Chain Kit Empire,13.27,6,12707.0,France
544470,2023-02-21,22139,Retrospot Tea Set Ceramic 11 Pc,15.32,6,12707.0,France
544470,2023-02-21,22659,Lunch Box I Love London,12.25,12,12707.0,France
544470,2023-02-21,22922,Fridge Magnets Us Diner Assorted,11.12,12,12707.0,France
544470,2023-02-21,22109,Full English Breakfast Plate,14.09,4,12707.0,France
544470,2023-02-21,22623,Box Of Vintage Jigsaw Blocks,15.32,3,12707.0,France
544470,2023-02-21,22037,Robot Birthday Card,10.68,12,12707.0,France
544470,2023-02-21,22024,Rainy Ladies Birthday Card,10.68,12,12707.0,France
544471,2023-02-21,21523,Doormat Fancy Font Home Sweet Home,18.4,6,18094.0,United Kingdom
544471,2023-02-21,85152,Hand Over The Chocolate Sign,12.4,24,18094.0,United Kingdom
544471,2023-02-21,21175,Gin And Tonic Diet Metal Sign,12.86,24,18094.0,United Kingdom
544471,2023-02-21,21166,Cook With Wine Metal Sign,12.38,24,18094.0,United Kingdom
544471,2023-02-21,21181,Please One Person Metal Sign,12.4,24,18094.0,United Kingdom
544471,2023-02-21,21164,Home Sweet Home Metal Sign,13.27,12,18094.0,United Kingdom
544471,2023-02-21,82552,Washroom Metal Sign,11.74,12,18094.0,United Kingdom
544471,2023-02-21,82578,Kitchen Metal Sign,10.81,24,18094.0,United Kingdom
544471,2023-02-21,21171,Bathroom Metal Sign,10.81,24,18094.0,United Kingdom
544471,2023-02-21,82581,Toilet Metal Sign,10.81,24,18094.0,United Kingdom
544471,2023-02-21,21877,Home Sweet Home Mug,11.53,12,18094.0,United Kingdom
544471,2023-02-21,21874,Gin And Tonic Mug,11.53,12,18094.0,United Kingdom
544471,2023-02-21,21232,Strawberry Ceramic Trinket Pot,11.53,12,18094.0,United Kingdom
544471,2023-02-21,21231,Sweetheart Ceramic Trinket Box,11.53,12,18094.0,United Kingdom
544471,2023-02-21,21524,Doormat Spotty Home Sweet Home,18.4,6,18094.0,United Kingdom
544471,2023-02-21,84029G,Knitted Union Flag Hot Water Bottle,14.09,12,18094.0,United Kingdom
544472,2023-02-21,22860,Easter Tin Chicks Pink Daisy,11.94,6,15129.0,United Kingdom
544472,2023-02-21,22858,Easter Tin Keepsake,11.94,6,15129.0,United Kingdom
544472,2023-02-21,22933,Baking Mould Easter Egg Milk Choc,13.27,6,15129.0,United Kingdom
544472,2023-02-21,22957,Set 3 Paper Vintage Chick Paper Egg,13.27,6,15129.0,United Kingdom
544472,2023-02-21,21499,Blue Polkadot Wrap,10.68,25,15129.0,United Kingdom
544472,2023-02-21,22251,Birdhouse Decoration Magic Garden,11.53,12,15129.0,United Kingdom
544472,2023-02-21,22112,Chocolate Hot Water Bottle,14.61,24,15129.0,United Kingdom
544472,2023-02-21,22720,Set Of 3 Cake Tins Pantry Design,15.32,3,15129.0,United Kingdom
544472,2023-02-21,22360,Glass Jar English Confectionery,13.27,12,15129.0,United Kingdom
544472,2023-02-21,22457,Natural Slate Heart Chalkboard,13.27,6,15129.0,United Kingdom
544472,2023-02-21,22430,Enamel Watering Can Cream,15.32,4,15129.0,United Kingdom
544472,2023-02-21,22168,Organiser Wood Antique White,18.96,2,15129.0,United Kingdom
544473,2023-02-21,22456,Natural Slate Chalkboard Large,14.61,18,14229.0,United Kingdom
544473,2023-02-21,22488,Natural Slate Rectangle Chalkboard,11.74,48,14229.0,United Kingdom
544473,2023-02-21,84879,Assorted Colour Bird Ornament,11.98,24,14229.0,United Kingdom
544473,2023-02-21,22425,Enamel Colander Cream,15.32,3,14229.0,United Kingdom
544473,2023-02-21,22427,Enamel Flower Jug Cream,15.84,12,14229.0,United Kingdom
544474,2023-02-21,20724,Red Retrospot Charlotte Bag,11.12,10,12423.0,Belgium
544474,2023-02-21,22907,Pack Of 20 Napkins Pantry Design,11.12,12,12423.0,Belgium
544474,2023-02-21,22962,Jam Jar With Pink Lid,11.12,12,12423.0,Belgium
544474,2023-02-21,22398,Magnets Pack Of 4 Swallows,11.53,12,12423.0,Belgium
544474,2023-02-21,22252,Birdcage Decoration Tealight Holder,11.53,12,12423.0,Belgium
544474,2023-02-21,22969,Homemade Jam Scented Candles,11.74,12,12423.0,Belgium
544474,2023-02-21,85040A,S/4 Pink Flower Candles In Bowl,11.94,12,12423.0,Belgium
544474,2023-02-21,85230E,Strawbry Scented Votive Candle,10.55,24,12423.0,Belgium
544474,2023-02-21,85230G,Orange Votive Candle,10.55,24,12423.0,Belgium
544474,2023-02-21,22893,Mini Cake Stand T-Light Holder,10.68,24,12423.0,Belgium
544474,2023-02-21,22326,Round Snack Boxes Set Of4 Woodland,13.27,6,12423.0,Belgium
544474,2023-02-21,22328,Round Snack Boxes Set Of 4 Fruits,13.27,6,12423.0,Belgium
544474,2023-02-21,22720,Set Of 3 Cake Tins Pantry Design,15.32,3,12423.0,Belgium
544474,2023-02-21,21980,Pack Of 12 Red Retrospot Tissues,10.55,24,12423.0,Belgium
544475,2023-02-21,21137,Black Record Cover Frame,14.09,12,17361.0,United Kingdom
544476,2023-02-21,22962,Jam Jar With Pink Lid,11.12,6,14796.0,United Kingdom
544476,2023-02-21,22963,Jam Jar With Green Lid,11.12,6,14796.0,United Kingdom
544476,2023-02-21,22649,Strawberry Fairy Cake Teapot,15.32,4,14796.0,United Kingdom
544476,2023-02-21,37448,Ceramic Cake Design Spotted Mug,11.78,6,14796.0,United Kingdom
544476,2023-02-21,22059,Ceramic Strawberry Design Mug,11.78,6,14796.0,United Kingdom
544476,2023-02-21,22064,Pink Doughnut Trinket Pot,11.94,6,14796.0,United Kingdom
544476,2023-02-21,22720,Set Of 3 Cake Tins Pantry Design,15.32,2,14796.0,United Kingdom
544476,2023-02-21,22624,Ivory Kitchen Scales,18.96,1,14796.0,United Kingdom
544476,2023-02-21,22626,Black Kitchen Scales,18.96,1,14796.0,United Kingdom
544476,2023-02-21,22644,Ceramic Cherry Cake Money Bank,11.74,4,14796.0,United Kingdom
544476,2023-02-21,22646,Ceramic Strawberry Cake Money Bank,11.74,8,14796.0,United Kingdom
544476,2023-02-21,22063,Ceramic Bowl With Strawberry Design,13.27,1,14796.0,United Kingdom
544476,2023-02-21,22067,Choc Truffle Gold Trinket Pot,11.94,2,14796.0,United Kingdom
544476,2023-02-21,22891,Tea For One Polkadot,14.61,1,14796.0,United Kingdom
544476,2023-02-21,21231,Sweetheart Ceramic Trinket Box,11.53,12,14796.0,United Kingdom
544476,2023-02-21,21232,Strawberry Ceramic Trinket Pot,11.53,16,14796.0,United Kingdom
544476,2023-02-21,84836,Zinc Metal Heart Decoration,11.53,2,14796.0,United Kingdom
544476,2023-02-21,22294,Heart Filigree Dove Small,11.53,4,14796.0,United Kingdom
544476,2023-02-21,35961,Folkart Zinc Heart Christmas Dec,11.12,1,14796.0,United Kingdom
544476,2023-02-21,22978,Pantry Rolling Pin,14.09,2,14796.0,United Kingdom
544476,2023-02-21,37501,Tea Time Tea Set In Gift Box,17.37,1,14796.0,United Kingdom
544476,2023-02-21,23005,Travel Card Wallet I Love London,10.68,12,14796.0,United Kingdom
544476,2023-02-21,23000,Travel Card Wallet Transport,10.68,6,14796.0,United Kingdom
544476,2023-02-21,22997,Travel Card Wallet Union Jack,10.68,6,14796.0,United Kingdom
544476,2023-02-21,22998,Travel Card Wallet Keep Calm,10.68,6,14796.0,United Kingdom
544476,2023-02-21,22999,Travel Card Wallet Vintage Leaf,10.68,6,14796.0,United Kingdom
544476,2023-02-21,23002,Travel Card Wallet Skulls,10.68,6,14796.0,United Kingdom
544476,2023-02-21,23004,Travel Card Wallet Pantry,10.68,6,14796.0,United Kingdom
544476,2023-02-21,22995,Travel Card Wallet Suki,10.68,6,14796.0,United Kingdom
544476,2023-02-21,22994,Travel Card Wallet Retrospot,10.68,6,14796.0,United Kingdom
544476,2023-02-21,23003,Travel Card Wallet Vintage Rose,10.68,6,14796.0,United Kingdom
544476,2023-02-21,22900,Set 2 Tea Towels I Love London,13.27,3,14796.0,United Kingdom
544476,2023-02-21,47591D,Pink Fairy Cake Childrens Apron,12.25,2,14796.0,United Kingdom
544476,2023-02-21,21156,Retrospot Childrens Apron,12.25,1,14796.0,United Kingdom
544476,2023-02-21,22367,Childrens Apron Spaceboy Design,12.25,1,14796.0,United Kingdom
544476,2023-02-21,22993,Set Of 4 Pantry Jelly Moulds,11.53,6,14796.0,United Kingdom
544476,2023-02-21,22222,Cake Plate Lovebird White,15.32,1,14796.0,United Kingdom
544476,2023-02-21,22223,Cake Plate Lovebird Pink,15.32,1,14796.0,United Kingdom
544476,2023-02-21,22951,60 Cake Cases Dolly Girl Design,10.81,2,14796.0,United Kingdom
544476,2023-02-21,84992,72 Sweetheart Fairy Cake Cases,10.81,2,14796.0,United Kingdom
544476,2023-02-21,22417,Pack Of 60 Spaceboy Cake Cases,10.81,2,14796.0,United Kingdom
544476,2023-02-21,84991,60 Teatime Fairy Cake Cases,10.81,1,14796.0,United Kingdom
544476,2023-02-21,21977,Pack Of 60 Pink Paisley Cake Cases,10.81,2,14796.0,United Kingdom
544476,2023-02-21,21213,Pack Of 72 Skull Cake Cases,10.81,2,14796.0,United Kingdom
544476,2023-02-21,21976,Pack Of 60 Mushroom Cake Cases,10.81,2,14796.0,United Kingdom
544476,2023-02-21,84991,60 Teatime Fairy Cake Cases,10.81,4,14796.0,United Kingdom
544476,2023-02-21,21212,Pack Of 72 Retrospot Cake Cases,10.81,2,14796.0,United Kingdom
544476,2023-02-21,84596B,Small Dolly Mix Design Orange Bowl,11.53,2,14796.0,United Kingdom
544476,2023-02-21,22915,Assorted Bottle Top Magnets,10.68,12,14796.0,United Kingdom
544476,2023-02-21,22403,Magnets Pack Of 4 Vintage Labels,11.53,1,14796.0,United Kingdom
544476,2023-02-21,22399,Magnets Pack Of 4 Childhood Memory,11.53,1,14796.0,United Kingdom
544476,2023-02-21,22396,Magnets Pack Of 4 Retro Photo,11.53,1,14796.0,United Kingdom
544476,2023-02-21,22398,Magnets Pack Of 4 Swallows,11.53,2,14796.0,United Kingdom
544476,2023-02-21,22659,Lunch Box I Love London,12.25,2,14796.0,United Kingdom
544476,2023-02-21,22629,Spaceboy Lunch Box,12.25,3,14796.0,United Kingdom
544476,2023-02-21,21181,Please One Person Metal Sign,12.4,2,14796.0,United Kingdom
544476,2023-02-21,21907,I'm On Holiday Metal Sign,12.4,2,14796.0,United Kingdom
544476,2023-02-21,21908,Chocolate This Way Metal Sign,12.4,2,14796.0,United Kingdom
544476,2023-02-21,21166,Cook With Wine Metal Sign,12.38,2,14796.0,United Kingdom
544476,2023-02-21,21175,Gin And Tonic Diet Metal Sign,12.86,2,14796.0,United Kingdom
544476,2023-02-21,21165,Beware Of The Cat Metal Sign,11.98,2,14796.0,United Kingdom
544476,2023-02-21,82582,Area Patrolled Metal Sign,12.4,2,14796.0,United Kingdom
544476,2023-02-21,85152,Hand Over The Chocolate Sign,12.4,3,14796.0,United Kingdom
544476,2023-02-21,22964,3 Piece Spaceboy Cookie Cutter Set,12.4,1,14796.0,United Kingdom
544476,2023-02-21,22966,Gingerbread Man Cookie Cutter,11.53,2,14796.0,United Kingdom
544476,2023-02-21,84378,Set Of 3 Heart Cookie Cutters,11.53,1,14796.0,United Kingdom
544476,2023-02-21,84380,Set Of 3 Butterfly Cookie Cutters,11.53,1,14796.0,United Kingdom
544477,2023-02-21,22779,Wooden Owls Light Garland,13.7,48,16029.0,United Kingdom
544477,2023-02-21,21731,Red Toadstool Led Night Light,11.53,144,16029.0,United Kingdom
544477,2023-02-21,21166,Cook With Wine Metal Sign,11.82,48,16029.0,United Kingdom
544477,2023-02-21,85152,Hand Over The Chocolate Sign,11.82,48,16029.0,United Kingdom
544477,2023-02-21,21181,Please One Person Metal Sign,11.94,48,16029.0,United Kingdom
544478,2023-02-21,21749,Large Red Retrospot Windmill,12.15,216,16333.0,United Kingdom
544479,2023-02-21,22078,Ribbon Reel Lace Design,12.15,120,14646.0,Netherlands
544479,2023-02-21,22329,Round Container Set Of 5 Retrospot,11.74,48,14646.0,Netherlands
544479,2023-02-21,20719,Woodland Charlotte Bag,10.99,100,14646.0,Netherlands
544479,2023-02-21,21975,Pack Of 60 Dinosaur Cake Cases,10.68,120,14646.0,Netherlands
544479,2023-02-21,21390,Filigris Heart With Butterfly,11.34,288,14646.0,Netherlands
544479,2023-02-21,21559,Strawberry Lunch Box With Cutlery,12.4,60,14646.0,Netherlands
544479,2023-02-21,22352,Lunch Box With Cutlery Retrospot,12.4,60,14646.0,Netherlands
544479,2023-02-21,22131,Food Container Set 3 Love Heart,11.94,216,14646.0,Netherlands
544479,2023-02-21,22505,Memo Board Cottage Design,14.61,24,14646.0,Netherlands
544479,2023-02-21,21058,Party Invites Woodland,10.99,144,14646.0,Netherlands
544479,2023-02-21,21672,White Spot Red Ceramic Drawer Knob,11.34,96,14646.0,Netherlands
544479,2023-02-21,22553,Plasters In Tin Skulls,11.74,96,14646.0,Netherlands
544479,2023-02-21,21481,Fawn Blue Hot Water Bottle,12.86,36,14646.0,Netherlands
544479,2023-02-21,84997B,Childrens Cutlery Retrospot Red,14.09,72,14646.0,Netherlands
544479,2023-02-21,84997D,Childrens Cutlery Polkadot Pink,14.09,72,14646.0,Netherlands
544479,2023-02-21,22326,Round Snack Boxes Set Of4 Woodland,12.86,192,14646.0,Netherlands
544479,2023-02-21,21122,Set/10 Pink Polkadot Party Candles,11.34,288,14646.0,Netherlands
544479,2023-02-21,22629,Spaceboy Lunch Box,11.94,128,14646.0,Netherlands
544479,2023-02-21,22961,Jam Making Set Printed,11.53,96,14646.0,Netherlands
544479,2023-02-21,84459B,Yellow Metal Chicken Heart,11.53,96,14646.0,Netherlands
544479,2023-02-21,85194L,Hanging Spring Flower Egg Large,10.99,144,14646.0,Netherlands
544479,2023-02-21,20979,36 Pencils Tube Red Retrospot,11.34,128,14646.0,Netherlands
544479,2023-02-21,22148,Easter Craft 4 Chicks,11.94,80,14646.0,Netherlands
544479,2023-02-21,20685,Doormat Red Retrospot,17.17,30,14646.0,Netherlands
544479,2023-02-21,20717,Strawberry Shopper Bag,11.34,100,14646.0,Netherlands
544479,2023-02-21,21035,Set/2 Red Retrospot Tea Towels,13.07,200,14646.0,Netherlands
544479,2023-02-21,21240,Blue Polkadot Cup,10.99,96,14646.0,Netherlands
544479,2023-02-21,21245,Green Polkadot Plate,11.74,96,14646.0,Netherlands
544479,2023-02-21,21684,Small Medina Stamped Metal Bowl,10.91,360,14646.0,Netherlands
544479,2023-02-21,21936,Red Retrospot Picnic Bag,12.86,50,14646.0,Netherlands
544479,2023-02-21,21947,Set Of 6 Heart Chopsticks,11.34,120,14646.0,Netherlands
544479,2023-02-21,22024,Rainy Ladies Birthday Card,10.62,72,14646.0,Netherlands
544479,2023-02-21,22192,Blue Diner Wall Clock,18.09,12,14646.0,Netherlands
544479,2023-02-21,22480,Red Tea Towel Classic Design,11.34,96,14646.0,Netherlands
544479,2023-02-21,22482,Blue Tea Towel Classic Design,11.34,96,14646.0,Netherlands
544479,2023-02-21,22754,Small Red Babushka Notebook,10.99,72,14646.0,Netherlands
544479,2023-02-21,22755,Small Purple Babushka Notebook,10.99,72,14646.0,Netherlands
544479,2023-02-21,22757,Large Red Babushka Notebook,11.34,72,14646.0,Netherlands
544479,2023-02-21,22819,Birthday Card Retro Spot,10.62,72,14646.0,Netherlands
544479,2023-02-21,22908,Pack Of 20 Napkins Red Apples,10.99,96,14646.0,Netherlands
544479,2023-02-21,84406B,Cream Cupid Hearts Coat Hanger,14.09,128,14646.0,Netherlands
544479,2023-02-21,22466,Fairy Tale Cottage Night Light,11.94,48,14646.0,Netherlands
544479,2023-02-21,22188,Black Heart Card Holder,13.72,108,14646.0,Netherlands
544479,2023-02-21,22366,Doormat Airmail,17.17,20,14646.0,Netherlands
544479,2023-02-21,21239,Pink Polkadot Cup,10.99,96,14646.0,Netherlands
544479,2023-02-21,21485,Retrospot Heart Hot Water Bottle,14.61,24,14646.0,Netherlands
544479,2023-02-21,21508,Vintage Kid Dolly Card,10.62,72,14646.0,Netherlands
544479,2023-02-21,21509,Cowboys And Indians Birthday Card,10.62,72,14646.0,Netherlands
544479,2023-02-21,21949,Set Of 6 Strawberry Chopsticks,11.34,120,14646.0,Netherlands
544479,2023-02-21,22088,Paper Bunting Coloured Lace,12.86,40,14646.0,Netherlands
544479,2023-02-21,22292,Hanging Chick Yellow Decoration,11.53,288,14646.0,Netherlands
544479,2023-02-21,22333,Retrospot Party Bag + Sticker Set,11.74,48,14646.0,Netherlands
544479,2023-02-21,22666,Recipe Box Pantry Yellow Design,12.86,24,14646.0,Netherlands
544479,2023-02-21,22667,Recipe Box Retrospot,12.86,24,14646.0,Netherlands
544479,2023-02-21,22668,Pink Baby Bunting,12.86,50,14646.0,Netherlands
544479,2023-02-21,22355,Charlotte Bag Suki Design,10.99,100,14646.0,Netherlands
544479,2023-02-21,22613,Pack Of 20 Spaceboy Napkins,10.99,96,14646.0,Netherlands
544479,2023-02-21,84970L,Single Heart Zinc T-Light Holder,11.06,144,14646.0,Netherlands
544479,2023-02-21,22417,Pack Of 60 Spaceboy Cake Cases,10.68,120,14646.0,Netherlands
544479,2023-02-21,84992,72 Sweetheart Fairy Cake Cases,10.68,120,14646.0,Netherlands
544479,2023-02-21,22328,Round Snack Boxes Set Of 4 Fruits,12.86,96,14646.0,Netherlands
544479,2023-02-21,22487,White Wood Garden Plant Ladder,18.96,4,14646.0,Netherlands
544479,2023-02-21,22964,3 Piece Spaceboy Cookie Cutter Set,12.15,144,14646.0,Netherlands
544479,2023-02-21,22243,5 Hook Hanger Red Magic Toadstool,11.74,288,14646.0,Netherlands
544479,2023-02-21,35961,Folkart Zinc Heart Christmas Dec,10.99,288,14646.0,Netherlands
544479,2023-02-21,21195,Pink Honeycomb Paper Ball,11.98,48,14646.0,Netherlands
544479,2023-02-21,21209,Multicolour Honeycomb Fan,11.74,48,14646.0,Netherlands
544479,2023-02-21,21208,Pastel Colour Honeycomb Fan,11.74,48,14646.0,Netherlands
544479,2023-02-21,22630,Dolly Girl Lunch Box,11.94,384,14646.0,Netherlands
544479,2023-02-21,22077,6 Ribbons Rustic Charm,11.74,144,14646.0,Netherlands
544479,2023-02-21,22663,Jumbo Bag Dolly Girl Design,5.97,100,14646.0,Netherlands
544479,2023-02-21,85099F,Jumbo Bag Strawberry,5.97,100,14646.0,Netherlands
544479,2023-02-21,20725,Lunch Bag Red Retrospot,5.87,100,14646.0,Netherlands
544479,2023-02-21,22384,Lunch Bag Pink Polkadot,5.87,100,14646.0,Netherlands
544479,2023-02-21,22383,Lunch Bag Suki Design,5.87,100,14646.0,Netherlands
544480,2023-02-21,84978,Hanging Heart Jar T-Light Holder,11.34,72,14646.0,Netherlands
544480,2023-02-21,22967,Set 3 Song Bird Paper Eggs Assorted,12.86,48,14646.0,Netherlands
544480,2023-02-21,22150,3 Stripey Mice Feltcraft,11.94,40,14646.0,Netherlands
544480,2023-02-21,22935,Baking Mould Rose Milk Chocolate,13.07,72,14646.0,Netherlands
544480,2023-02-21,22931,Baking Mould Heart White Chocolate,12.4,96,14646.0,Netherlands
544480,2023-02-21,22984,Card Gingham Rose,10.62,72,14646.0,Netherlands
544480,2023-02-21,22026,Banquet Birthday Card,10.62,72,14646.0,Netherlands
544480,2023-02-21,22814,Card Party Games,10.62,72,14646.0,Netherlands
544480,2023-02-21,22331,Woodland Party Bag + Sticker Set,11.74,48,14646.0,Netherlands
544480,2023-02-21,22334,Dinosaur Party Bag + Sticker Set,11.74,48,14646.0,Netherlands
544480,2023-02-21,22332,Skulls Party Bag + Sticker Set,11.74,48,14646.0,Netherlands
544480,2023-02-21,22780,Light Garland Butterfiles Pink,14.09,48,14646.0,Netherlands
544480,2023-02-21,22779,Wooden Owls Light Garland,14.09,48,14646.0,Netherlands
544480,2023-02-21,22743,Make Your Own Flowerpower Card Kit,12.86,48,14646.0,Netherlands
544480,2023-02-21,22557,Plasters In Tin Vintage Paisley,11.74,96,14646.0,Netherlands
544480,2023-02-21,22653,Button Box,11.94,200,14646.0,Netherlands
544480,2023-02-21,20724,Red Retrospot Charlotte Bag,10.99,200,14646.0,Netherlands
544480,2023-02-21,22411,Jumbo Shopper Vintage Red Paisley,11.94,100,14646.0,Netherlands
544480,2023-02-21,21988,Pack Of 6 Skull Paper Plates,10.91,192,14646.0,Netherlands
544480,2023-02-21,21987,Pack Of 6 Skull Paper Cups,10.79,216,14646.0,Netherlands
544480,2023-02-21,21989,Pack Of 20 Skull Paper Napkins,10.99,192,14646.0,Netherlands
544480,2023-02-21,22437,Set Of 9 Black Skull Balloons,10.99,200,14646.0,Netherlands
544480,2023-02-21,22948,Metal Decoration Naughty Children,11.12,144,14646.0,Netherlands
544480,2023-02-21,21715,Girls Vintage Tin Seaside Bucket,12.4,64,14646.0,Netherlands
544480,2023-02-21,22992,Revolver Wooden Ruler,11.94,144,14646.0,Netherlands
544480,2023-02-21,22956,36 Foil Heart Cake Cases,12.15,96,14646.0,Netherlands
544480,2023-02-21,21210,Set Of 72 Retrospot Paper Doilies,11.53,192,14646.0,Netherlands
544480,2023-02-21,21080,Set/20 Red Retrospot Paper Napkins,10.99,96,14646.0,Netherlands
544480,2023-02-21,22303,Coffee Mug Apples Design,12.4,72,14646.0,Netherlands
544480,2023-02-21,22908,Pack Of 20 Napkins Red Apples,10.99,96,14646.0,Netherlands
544480,2023-02-21,22895,Set Of 2 Tea Towels Apple And Pears,12.86,100,14646.0,Netherlands
544480,2023-02-21,22989,Set 2 Pantry Design Tea Towels,13.07,100,14646.0,Netherlands
544480,2023-02-21,22993,Set Of 4 Pantry Jelly Moulds,11.34,72,14646.0,Netherlands
544480,2023-02-21,22966,Gingerbread Man Cookie Cutter,11.34,144,14646.0,Netherlands
544480,2023-02-21,84987,Set Of 36 Teatime Paper Doilies,11.53,144,14646.0,Netherlands
544480,2023-02-21,47591D,Pink Fairy Cake Childrens Apron,11.94,50,14646.0,Netherlands
544480,2023-02-21,85099B,Jumbo Bag Red Retrospot,5.97,100,14646.0,Netherlands
