TransactionNo,Date,ProductNo,ProductName,Price,Quantity,CustomerNo,Country
570237,2023-10-09,15056N,Edwardian Parasol Natural,16.35,1,13212.0,United Kingdom
570237,2023-10-09,20679,Edwardian Parasol Red,16.35,1,13212.0,United Kingdom
570237,2023-10-09,22309,Tea Cosy Red Stripe,12.86,1,13212.0,United Kingdom
570237,2023-10-09,22308,Tea Cosy Blue Stripe,12.86,1,13212.0,United Kingdom
570237,2023-10-09,22429,Enamel Measuring Jug Cream,14.61,2,13212.0,United Kingdom
570237,2023-10-09,23402,Home Sweet Home 3 Peg Hanger,14.09,1,13212.0,United Kingdom
570237,2023-10-09,21269,Antique Cream Cutlery Shelf,18.96,1,13212.0,United Kingdom
570237,2023-10-09,48138,Doormat Union Flag,18.71,1,13212.0,United Kingdom
570237,2023-10-09,23284,Doormat Keep Calm And Come In,18.71,1,13212.0,United Kingdom
570237,2023-10-09,22597,Musical Zinc Heart Decoration,10.55,11,13212.0,United Kingdom
570237,2023-10-09,23035,Drawer Knob Ceramic Ivory,11.74,1,13212.0,United Kingdom
570237,2023-10-09,23028,Drawer Knob Crackle Glaze Blue,11.94,1,13212.0,United Kingdom
570237,2023-10-09,23034,Drawer Knob Ceramic Black,11.74,1,13212.0,United Kingdom
570237,2023-10-09,23027,Drawer Knob Vintage Glass Hexagon,12.38,3,13212.0,United Kingdom
570237,2023-10-09,21673,White Spot Blue Ceramic Drawer Knob,11.74,1,13212.0,United Kingdom
570237,2023-10-09,23033,Drawer Knob Ceramic Red,11.74,1,13212.0,United Kingdom
570237,2023-10-09,23032,Drawer Knob Crackle Glaze Ivory,11.94,2,13212.0,United Kingdom
570237,2023-10-09,23031,Drawer Knob Crackle Glaze Pink,11.94,1,13212.0,United Kingdom
570237,2023-10-09,21668,Red Stripe Ceramic Drawer Knob,11.74,2,13212.0,United Kingdom
570237,2023-10-09,21669,Blue Stripe Ceramic Drawer Knob,11.74,2,13212.0,United Kingdom
570237,2023-10-09,21670,Blue Spot Ceramic Drawer Knob,11.74,2,13212.0,United Kingdom
570237,2023-10-09,21671,Red Spot Ceramic Drawer Knob,11.74,2,13212.0,United Kingdom
570237,2023-10-09,21672,White Spot Red Ceramic Drawer Knob,11.74,2,13212.0,United Kingdom
570237,2023-10-09,22596,Christmas Star Wish List Chalkboard,11.53,3,13212.0,United Kingdom
570237,2023-10-09,22594,Christmas Gingham Tree,11.12,2,13212.0,United Kingdom
570237,2023-10-09,23330,Decorative Wicker Heart Medium,11.53,3,13212.0,United Kingdom
570237,2023-10-09,22595,Gingham Heart Decoration,11.12,3,13212.0,United Kingdom
570237,2023-10-09,22593,Christmas Gingham Star,11.12,3,13212.0,United Kingdom
570237,2023-10-09,23329,Decorative Wicker Heart Large,11.94,2,13212.0,United Kingdom
570237,2023-10-09,22508,Doorstop Retrospot Heart,14.09,1,13212.0,United Kingdom
570237,2023-10-09,21257,Victorian Sewing Box Medium,18.4,1,13212.0,United Kingdom
570237,2023-10-09,21259,Victorian Sewing Box Small,16.35,1,13212.0,United Kingdom
570237,2023-10-09,23012,Glass Apothecary Bottle Perfume,14.3,1,13212.0,United Kingdom
570237,2023-10-09,23014,Glass Apothecary Bottle Elixir,14.3,2,13212.0,United Kingdom
570237,2023-10-09,22171,3 Hook Photo Shelf Antique White,18.96,1,13212.0,United Kingdom
570237,2023-10-09,23395,Belle Jardiniere Cushion Cover,14.09,1,13212.0,United Kingdom
570237,2023-10-09,23394,Poste France Cushion Cover,14.09,1,13212.0,United Kingdom
570237,2023-10-09,23393,Home Sweet Home Cushion Cover,14.09,1,13212.0,United Kingdom
570237,2023-10-09,23396,Le Jardin Botanique Cushion Cover,14.09,1,13212.0,United Kingdom
570237,2023-10-09,20752,Blue Polkadot Washing Up Gloves,12.4,1,13212.0,United Kingdom
570238,2023-10-09,16048,Teatime Round Pencil Sharpener,10.37,1,16332.0,United Kingdom
570238,2023-10-09,22299,Pig Keyring With Light & Sound,11.53,1,16332.0,United Kingdom
570238,2023-10-09,23510,Mini Playing Cards Gymkhana,10.68,1,16332.0,United Kingdom
570238,2023-10-09,22439,6 Rocket Balloons,10.92,1,16332.0,United Kingdom
570238,2023-10-09,23188,Vintage 2 Metre Folding Ruler,11.94,1,16332.0,United Kingdom
570238,2023-10-09,22906,12 Message Cards With Envelopes,11.94,1,16332.0,United Kingdom
570238,2023-10-09,21916,Set 12 Retro White Chalk Sticks,10.68,2,16332.0,United Kingdom
570238,2023-10-09,21879,Hearts Gift Tape,10.92,4,16332.0,United Kingdom
570238,2023-10-09,23061,Vintage Embossed Heart,11.53,12,16332.0,United Kingdom
570238,2023-10-09,22883,Number Tile Vintage Font 4,12.25,1,16332.0,United Kingdom
570238,2023-10-09,22639,Set Of 4 Napkin Charms Hearts,12.86,3,16332.0,United Kingdom
570238,2023-10-09,21240,Blue Polkadot Cup,11.12,1,16332.0,United Kingdom
570238,2023-10-09,21239,Pink Polkadot Cup,11.12,1,16332.0,United Kingdom
570238,2023-10-09,23360,Set 8 Candles Vintage Doily,12.25,6,16332.0,United Kingdom
570238,2023-10-09,22063,Ceramic Bowl With Strawberry Design,13.27,1,16332.0,United Kingdom
570238,2023-10-09,23357,Hot Water Bottle Sex Bomb,15.32,2,16332.0,United Kingdom
570238,2023-10-09,22114,Hot Water Bottle Tea And Sympathy,14.61,2,16332.0,United Kingdom
570238,2023-10-09,23356,Love Hot Water Bottle,16.35,2,16332.0,United Kingdom
570238,2023-10-09,22692,Doormat Welcome To Our Home,18.71,3,16332.0,United Kingdom
570238,2023-10-09,21523,Doormat Fancy Font Home Sweet Home,18.71,3,16332.0,United Kingdom
570239,2023-10-09,23546,Wrap Paisley Park,10.68,25,16518.0,United Kingdom
570239,2023-10-09,22147,Feltcraft Butterfly Hearts,11.74,8,16518.0,United Kingdom
570239,2023-10-09,22150,3 Stripey Mice Feltcraft,12.25,6,16518.0,United Kingdom
570239,2023-10-09,22983,Card Billboard Font,10.68,12,16518.0,United Kingdom
570239,2023-10-09,22586,Feltcraft Hairband Pink And Blue,11.12,12,16518.0,United Kingdom
570239,2023-10-09,21026,Space Owl,11.53,10,16518.0,United Kingdom
570239,2023-10-09,23232,Wrap Vintage Leaf Design,10.68,25,16518.0,United Kingdom
570239,2023-10-09,22866,Hand Warmer Scotty Dog Design,12.4,3,16518.0,United Kingdom
570239,2023-10-09,23439,Hand Warmer Red Love Heart,12.4,3,16518.0,United Kingdom
570239,2023-10-09,22865,Hand Warmer Owl Design,12.4,6,16518.0,United Kingdom
570239,2023-10-09,21741,Cosy Slipper Shoes Large Green,13.27,8,16518.0,United Kingdom
570239,2023-10-09,51014L,Feather Pen Light Pink,10.65,12,16518.0,United Kingdom
570239,2023-10-09,23106,Zinc Hearts Plant Pot Holder,13.21,3,16518.0,United Kingdom
570239,2023-10-09,85185B,Pink Horse Sock Puppet Kit,13.27,6,16518.0,United Kingdom
570239,2023-10-09,22599,Christmas Musical Zinc Star,10.55,10,16518.0,United Kingdom
570239,2023-10-09,22246,Magic Garden Felt Garland,12.25,5,16518.0,United Kingdom
570239,2023-10-09,84030E,English Rose Hot Water Bottle,14.61,4,16518.0,United Kingdom
570239,2023-10-09,22155,Star Decoration Rustic,10.68,10,16518.0,United Kingdom
570239,2023-10-09,23215,Jingle Bell Heart Antique Silver,12.38,6,16518.0,United Kingdom
570239,2023-10-09,21257,Victorian Sewing Box Medium,18.4,3,16518.0,United Kingdom
570239,2023-10-09,21259,Victorian Sewing Box Small,16.35,4,16518.0,United Kingdom
570239,2023-10-09,21328,Balloons Writing Set,11.94,2,16518.0,United Kingdom
570239,2023-10-09,22563,Happy Stencil Craft,11.53,2,16518.0,United Kingdom
570239,2023-10-09,22561,Wooden School Colouring Set,11.94,2,16518.0,United Kingdom
570239,2023-10-09,23270,Set Of 2 Ceramic Painted Hearts,11.74,6,16518.0,United Kingdom
570239,2023-10-09,23100,Silver Bells Table Decoration,11.53,3,16518.0,United Kingdom
570239,2023-10-09,22083,Paper Chain Kit Retrospot,13.27,3,16518.0,United Kingdom
570239,2023-10-09,22086,Paper Chain Kit 50'S Christmas,13.27,3,16518.0,United Kingdom
570239,2023-10-09,22627,Mint Kitchen Scales,18.96,1,16518.0,United Kingdom
570240,2023-10-09,23403,Letter Holder Home Sweet Home,14.09,1,13212.0,United Kingdom
570240,2023-10-09,46000S,Polyester Filler Pad 40x40cm,11.74,3,13212.0,United Kingdom
570240,2023-10-09,46000M,Polyester Filler Pad 45x45cm,11.84,3,13212.0,United Kingdom
570240,2023-10-09,21622,Vintage Union Jack Cushion Cover,15.32,2,13212.0,United Kingdom
570240,2023-10-09,22507,Memo Board Retrospot Design,15.32,2,13212.0,United Kingdom
570240,2023-10-09,23014,Glass Apothecary Bottle Elixir,14.3,1,13212.0,United Kingdom
570240,2023-10-09,23013,Glass Apothecary Bottle Tonic,14.3,1,13212.0,United Kingdom
570240,2023-10-09,22611,Vintage Union Jack Shopping Bag,7.66,1,13212.0,United Kingdom
570241,2023-10-09,16048,Teatime Round Pencil Sharpener,10.37,6,14801.0,United Kingdom
570241,2023-10-09,20992,Jazz Hearts Purse Notebook,10.65,6,14801.0,United Kingdom
570241,2023-10-09,20996,Jazz Hearts Address Book,10.44,5,14801.0,United Kingdom
570241,2023-10-09,20984,12 Pencils Tall Tube Posy,10.55,5,14801.0,United Kingdom
570241,2023-10-09,21642,Assorted Tutti Frutti Pen,10.55,24,14801.0,United Kingdom
570241,2023-10-09,35923,Candy Heart Hanging Decoration,10.65,3,14801.0,United Kingdom
570241,2023-10-09,16258A,Swirly Circular Rubbers In Bag,10.68,1,14801.0,United Kingdom
570241,2023-10-09,51014A,Feather Pen Hot Pink,10.65,12,14801.0,United Kingdom
570241,2023-10-09,47503A,Ass Floral Print Multi Screwdriver,10.68,12,14801.0,United Kingdom
570241,2023-10-09,22340,Noel Garland Painted Zinc,10.65,4,14801.0,United Kingdom
570241,2023-10-09,23275,Set Of 3 Hanging Owls Ollie Beak,11.53,2,14801.0,United Kingdom
570241,2023-10-09,22752,Set 7 Babushka Nesting Boxes,18.96,1,14801.0,United Kingdom
570241,2023-10-09,22568,Feltcraft Cushion Owl,14.09,1,14801.0,United Kingdom
570241,2023-10-09,22570,Feltcraft Cushion Rabbit,14.09,1,14801.0,United Kingdom
570241,2023-10-09,22750,Feltcraft Princess Lola Doll,14.09,1,14801.0,United Kingdom
570241,2023-10-09,20972,Pink Cream Felt Craft Trinket Box,11.53,1,14801.0,United Kingdom
570241,2023-10-09,22749,Feltcraft Princess Charlotte Doll,14.09,1,14801.0,United Kingdom
570241,2023-10-09,20971,Pink Blue Felt Craft Trinket Box,11.53,2,14801.0,United Kingdom
570241,2023-10-09,20972,Pink Cream Felt Craft Trinket Box,11.53,1,14801.0,United Kingdom
570241,2023-10-09,20971,Pink Blue Felt Craft Trinket Box,11.53,1,14801.0,United Kingdom
570241,2023-10-09,22599,Christmas Musical Zinc Star,10.55,9,14801.0,United Kingdom
570241,2023-10-09,22598,Christmas Musical Zinc Tree,10.55,10,14801.0,United Kingdom
570241,2023-10-09,35471D,Set Of 3 Bird Light Pink Feather,10.65,3,14801.0,United Kingdom
570241,2023-10-09,79157V,Ubo-Light Triobase Purple,11.12,2,14801.0,United Kingdom
570241,2023-10-09,84192,Assorted Colour Metal Cat,11.53,3,14801.0,United Kingdom
570241,2023-10-09,85071A,Blue Charlie+Lola Personal Doorsign,10.65,4,14801.0,United Kingdom
570241,2023-10-09,21163,Do Not Touch My Stuff Door Hanger,10.65,2,14801.0,United Kingdom
570241,2023-10-09,21158,Moody Girl Door Hanger,10.65,2,14801.0,United Kingdom
570241,2023-10-09,21162,Toxic Area Door Hanger,10.65,2,14801.0,United Kingdom
570241,2023-10-09,85071B,Red Charlie+Lola Personal Doorsign,10.65,4,14801.0,United Kingdom
570241,2023-10-09,23000,Travel Card Wallet Transport,10.68,4,14801.0,United Kingdom
570241,2023-10-09,22999,Travel Card Wallet Vintage Leaf,10.68,6,14801.0,United Kingdom
570241,2023-10-09,21990,Modern Floral Stationery Set,11.53,3,14801.0,United Kingdom
570241,2023-10-09,21993,Floral Folk Stationery Set,11.53,3,14801.0,United Kingdom
570241,2023-10-09,84663A,Grass Hopper Wooden Wall Clock,11.06,4,14801.0,United Kingdom
570241,2023-10-09,21034,Rex Cash+Carry Jumbo Shopper,11.22,1,14801.0,United Kingdom
570241,2023-10-09,90025A,Baroque Butterfly Earrings Black,14.09,1,14801.0,United Kingdom
570241,2023-10-09,90019A,Silver Mop Orbit Bracelet,15.32,1,14801.0,United Kingdom
570241,2023-10-09,90018A,Silver Mop Orbit Drop Earrings,14.61,1,14801.0,United Kingdom
570241,2023-10-09,90177D,Drop Diamante Earrings Purple,13.27,1,14801.0,United Kingdom
570241,2023-10-09,90064B,Black Vintage Crystal Earrings,14.09,1,14801.0,United Kingdom
570241,2023-10-09,90001D,Antique Olive Green Flower Earrings,14.61,1,14801.0,United Kingdom
570241,2023-10-09,90189A,Silver 2 Strand Necklace-Leaf Charm,17.94,1,14801.0,United Kingdom
570241,2023-10-09,90054,Cracked Glaze Earrings Red,12.86,1,14801.0,United Kingdom
570241,2023-10-09,90188,Drop Earrings W Flower & Leaf,12.86,1,14801.0,United Kingdom
570241,2023-10-09,90079,Vintage Enamel & Crystal Necklace,15.32,1,14801.0,United Kingdom
570241,2023-10-09,90160A,Purple Boudicca Large Bracelet,17.37,1,14801.0,United Kingdom
570241,2023-10-09,90176E,Diamante Necklace Green,17.94,1,14801.0,United Kingdom
570241,2023-10-09,90161C,Ant Copper Lime Boudicca Bracelet,15.32,1,14801.0,United Kingdom
570241,2023-10-09,90195A,Purple Gemstone Bracelet,13.27,1,14801.0,United Kingdom
570241,2023-10-09,90051,Cracked Glaze Necklace Red,17.37,1,14801.0,United Kingdom
570241,2023-10-09,90014A,Silver Mop Orbit Necklace,13.27,1,14801.0,United Kingdom
570241,2023-10-09,90188,Drop Earrings W Flower & Leaf,12.86,1,14801.0,United Kingdom
570241,2023-10-09,90019B,Gold Mop Orbit Bracelet,15.32,1,14801.0,United Kingdom
570241,2023-10-09,90071,Ruby Glass Cluster Earrings,11.53,1,14801.0,United Kingdom
570241,2023-10-09,90183A,Amber Drop Earrings W Long Beads,13.27,1,14801.0,United Kingdom
570241,2023-10-09,90014B,Gold Mop Orbit Necklace,13.27,1,14801.0,United Kingdom
570241,2023-10-09,90176D,Diamante Necklace Purple,17.94,1,14801.0,United Kingdom
570241,2023-10-09,90199D,5 Strand Glass Necklace Amber,16.76,1,14801.0,United Kingdom
570242,2023-10-09,22142,Christmas Craft White Fairy,11.53,80,16380.0,United Kingdom
570242,2023-10-09,22141,Christmas Craft Tree Top Angel,12.15,48,16380.0,United Kingdom
570242,2023-10-09,23048,Set Of 10 Lanterns Fairy Light Star,14.09,200,16380.0,United Kingdom
570242,2023-10-09,22144,Christmas Craft Little Friends,12.15,120,16380.0,United Kingdom
570242,2023-10-09,23354,6 Gift Tags 50'S Christmas,11.1,36,16380.0,United Kingdom
570242,2023-10-09,22573,Star Wooden Christmas Decoration,11.12,96,16380.0,United Kingdom
570242,2023-10-09,21802,Christmas Tree Heart Decoration,10.68,36,16380.0,United Kingdom
570242,2023-10-09,21803,Christmas Tree Star Decoration,10.68,72,16380.0,United Kingdom
570242,2023-10-09,21014,Swiss Chalet Tree Decoration,10.55,48,16380.0,United Kingdom
570242,2023-10-09,22294,Heart Filigree Dove Small,11.53,24,16380.0,United Kingdom
570242,2023-10-09,21823,Painted Metal Heart With Holly Bell,10.65,24,16380.0,United Kingdom
570242,2023-10-09,23504,Playing Cards Jubilee Union Jack,11.53,1,16380.0,United Kingdom
570242,2023-10-09,20979,36 Pencils Tube Red Retrospot,11.53,1,16380.0,United Kingdom
570242,2023-10-09,22960,Jam Making Set With Jars,14.61,2,16380.0,United Kingdom
570242,2023-10-09,21809,Christmas Hanging Tree With Bell,10.65,144,16380.0,United Kingdom
570242,2023-10-09,21811,Hanging Heart With Bell,10.65,48,16380.0,United Kingdom
570242,2023-10-09,21810,Christmas Hanging Star With Bell,10.65,96,16380.0,United Kingdom
570242,2023-10-09,22155,Star Decoration Rustic,10.68,96,16380.0,United Kingdom
570242,2023-10-09,21811,Hanging Heart With Bell,10.65,96,16380.0,United Kingdom
570242,2023-10-09,21810,Christmas Hanging Star With Bell,10.65,96,16380.0,United Kingdom
570242,2023-10-09,21823,Painted Metal Heart With Holly Bell,10.65,48,16380.0,United Kingdom
570242,2023-10-09,22295,Heart Filigree Dove Large,11.94,24,16380.0,United Kingdom
570242,2023-10-09,20668,Disco Ball Christmas Decoration,10.37,24,16380.0,United Kingdom
570242,2023-10-09,22294,Heart Filigree Dove Small,11.53,48,16380.0,United Kingdom
570242,2023-10-09,84880,White Wire Egg Holder,17.94,2,16380.0,United Kingdom
570242,2023-10-09,21466,Red Flower Crochet Food Cover,14.09,1,16380.0,United Kingdom
570242,2023-10-09,79190A,Retro Plastic 70'S Tray,10.68,5,16380.0,United Kingdom
570242,2023-10-09,85180A,Red Hearts Light Chain,15.02,1,16380.0,United Kingdom
570242,2023-10-09,85180B,Pink Hearts Light Chain,15.02,2,16380.0,United Kingdom
570242,2023-10-09,85179A,Green Bitty Light Chain,11.53,2,16380.0,United Kingdom
570242,2023-10-09,21349,Ivy Heart Wreath,17.17,1,16380.0,United Kingdom
570242,2023-10-09,21261,Green Goose Feather Christmas Tree,13.27,2,16380.0,United Kingdom
570243,2023-10-09,22468,Babushka Lights String Of 10,17.17,4,15606.0,United Kingdom
570243,2023-10-09,21731,Red Toadstool Led Night Light,11.94,12,15606.0,United Kingdom
570243,2023-10-09,22252,Birdcage Decoration Tealight Holder,11.53,12,15606.0,United Kingdom
570243,2023-10-09,21259,Victorian Sewing Box Small,16.35,12,15606.0,United Kingdom
570243,2023-10-09,22807,Set Of 6 T-Lights Toadstools,13.27,12,15606.0,United Kingdom
570243,2023-10-09,23108,Set Of 10 Led Dolly Lights,15.77,12,15606.0,United Kingdom
570243,2023-10-09,22371,Airline Bag Vintage Tokyo 78,14.3,12,15606.0,United Kingdom
570243,2023-10-09,35004B,Set Of 3 Black Flying Ducks,15.02,12,15606.0,United Kingdom
570243,2023-10-09,84947,Antique Silver Tea Glass Engraved,11.53,12,15606.0,United Kingdom
570243,2023-10-09,20749,Assorted Colour Mini Cases,16.76,12,15606.0,United Kingdom
570243,2023-10-09,22178,Victorian Glass Hanging T-Light,12.25,12,15606.0,United Kingdom
570243,2023-10-09,22943,Christmas Lights 10 Vintage Baubles,15.32,6,15606.0,United Kingdom
570244,2023-10-09,85123A,Cream Hanging Heart T-Light Holder,13.27,18,14514.0,United Kingdom
570244,2023-10-09,23130,Mistletoe Heart Wreath Green,14.5,6,14514.0,United Kingdom
570244,2023-10-09,22809,Set Of 6 T-Lights Santa,13.27,6,14514.0,United Kingdom
570244,2023-10-09,85049E,Scandinavian Reds Ribbons,11.53,24,14514.0,United Kingdom
570244,2023-10-09,22809,Set Of 6 T-Lights Santa,13.27,6,14514.0,United Kingdom
570244,2023-10-09,22295,Heart Filigree Dove Large,11.94,12,14514.0,United Kingdom
570244,2023-10-09,22294,Heart Filigree Dove Small,11.53,48,14514.0,United Kingdom
570244,2023-10-09,22810,Set Of 6 T-Lights Snowmen,13.27,12,14514.0,United Kingdom
570244,2023-10-09,22625,Red Kitchen Scales,18.96,1,14514.0,United Kingdom
570244,2023-10-09,22603,Christmas Retrospot Tree Wood,11.12,14,14514.0,United Kingdom
570244,2023-10-09,22602,Retrospot Wooden Heart Decoration,11.12,15,14514.0,United Kingdom
570244,2023-10-09,22600,Christmas Retrospot Star Wood,11.12,4,14514.0,United Kingdom
570244,2023-10-09,22601,Christmas Retrospot Angel Wood,11.12,5,14514.0,United Kingdom
570244,2023-10-09,22627,Mint Kitchen Scales,18.96,1,14514.0,United Kingdom
570244,2023-10-09,22412,Metal Sign Neighbourhood Witch,12.4,2,14514.0,United Kingdom
570244,2023-10-09,22295,Heart Filigree Dove Large,11.94,12,14514.0,United Kingdom
570244,2023-10-09,22809,Set Of 6 T-Lights Santa,13.27,6,14514.0,United Kingdom
570244,2023-10-09,22810,Set Of 6 T-Lights Snowmen,13.27,6,14514.0,United Kingdom
570244,2023-10-09,72586,Set Of 6 Halloween Ghost T-Lights,10.68,6,14514.0,United Kingdom
570244,2023-10-09,85049A,Traditional Christmas Ribbons,11.53,24,14514.0,United Kingdom
570244,2023-10-09,22077,6 Ribbons Rustic Charm,12.25,24,14514.0,United Kingdom
570244,2023-10-09,85199L,Large Hanging Ivory & Red Wood Bird,10.92,48,14514.0,United Kingdom
570244,2023-10-09,22577,Wooden Heart Christmas Scandinavian,10.55,24,14514.0,United Kingdom
570244,2023-10-09,22579,Wooden Tree Christmas Scandinavian,10.55,15,14514.0,United Kingdom
570244,2023-10-09,22578,Wooden Star Christmas Scandinavian,10.55,22,14514.0,United Kingdom
570244,2023-10-09,23307,Set Of 60 Pantry Design Cake Cases,10.81,8,14514.0,United Kingdom
570244,2023-10-09,21212,Pack Of 72 Retrospot Cake Cases,10.81,12,14514.0,United Kingdom
570244,2023-10-09,21210,Set Of 72 Retrospot Paper Doilies,11.74,4,14514.0,United Kingdom
570244,2023-10-09,23465,Tuscan Villa Bird Feeder,18.71,2,14514.0,United Kingdom
570244,2023-10-09,23466,Tuscan Villa Dovecote Bird Feeder,18.71,3,14514.0,United Kingdom
570244,2023-10-09,22306,Silver Mug Bone China Tree Of Life,11.34,18,14514.0,United Kingdom
570245,2023-10-09,21181,Please One Person Metal Sign,12.4,12,14415.0,United Kingdom
570245,2023-10-09,22111,Scottie Dog Hot Water Bottle,15.32,2,14415.0,United Kingdom
570245,2023-10-09,22113,Grey Heart Hot Water Bottle,14.61,2,14415.0,United Kingdom
570245,2023-10-09,22349,Dog Bowl Chasing Ball Design,14.09,1,14415.0,United Kingdom
570245,2023-10-09,22681,French Blue Metal Door Sign 6,11.53,20,14415.0,United Kingdom
570245,2023-10-09,23138,Single Wire Hook Ivory Heart,11.74,12,14415.0,United Kingdom
570245,2023-10-09,21931,Jumbo Storage Bag Suki,12.38,5,14415.0,United Kingdom
570245,2023-10-09,22411,Jumbo Shopper Vintage Red Paisley,12.38,10,14415.0,United Kingdom
570245,2023-10-09,23201,Jumbo Bag Alphabet,6.19,10,14415.0,United Kingdom
570245,2023-10-09,22385,Jumbo Bag Spaceboy Design,6.19,10,14415.0,United Kingdom
570245,2023-10-09,23202,Jumbo Bag Vintage Leaf,6.19,7,14415.0,United Kingdom
570245,2023-10-09,22663,Jumbo Bag Dolly Girl Design,6.19,5,14415.0,United Kingdom
570245,2023-10-09,21929,Jumbo Bag Pink Vintage Paisley,6.19,5,14415.0,United Kingdom
570245,2023-10-09,21928,Jumbo Bag Scandinavian Blue Paisley,6.19,10,14415.0,United Kingdom
570245,2023-10-09,85099B,Jumbo Bag Red Retrospot,6.19,10,14415.0,United Kingdom
570245,2023-10-09,22386,Jumbo Bag Pink Polkadot,6.19,10,14415.0,United Kingdom
570245,2023-10-09,23203,Jumbo Bag Vintage Doily,6.19,10,14415.0,United Kingdom
570246,2023-10-09,47503A,Ass Floral Print Multi Screwdriver,10.68,4,16921.0,United Kingdom
570246,2023-10-09,47504K,English Rose Garden Secateurs,11.06,1,16921.0,United Kingdom
570246,2023-10-09,47503H,Ass Floral Print Spirit Level,11.06,3,16921.0,United Kingdom
570246,2023-10-09,22651,Gentleman Shirt Repair Kit,11.12,1,16921.0,United Kingdom
570246,2023-10-09,85178,Victorian Sewing Kit,11.53,1,16921.0,United Kingdom
570246,2023-10-09,84347,Rotating Silver Angels T-Light Hldr,12.86,1,16921.0,United Kingdom
570246,2023-10-09,20986,Blue Calculator Ruler,11.53,1,16921.0,United Kingdom
570246,2023-10-09,22775,Purple Drawerknob Acrylic Edwardian,11.53,2,16921.0,United Kingdom
570246,2023-10-09,22269,Egg Cup Natural Chicken,10.65,3,16921.0,United Kingdom
570246,2023-10-09,22284,Hen House Decoration,11.94,1,16921.0,United Kingdom
570246,2023-10-09,21293,Mirrored Dove Wall Decoration,12.4,6,16921.0,United Kingdom
570246,2023-10-09,21479,White Skull Hot Water Bottle,14.61,1,16921.0,United Kingdom
570246,2023-10-09,21084,Set/6 Collage Paper Cups,10.44,4,16921.0,United Kingdom
570246,2023-10-09,22113,Grey Heart Hot Water Bottle,14.61,1,16921.0,United Kingdom
570246,2023-10-09,23302,Kneeling Mat Housework Design,11.94,1,16921.0,United Kingdom
570246,2023-10-09,22136,Love Heart Sock Hanger,11.94,3,16921.0,United Kingdom
570246,2023-10-09,48111,Doormat 3 Smiley Cats,18.71,1,16921.0,United Kingdom
570246,2023-10-09,21365,Mirrored Wall Art Stars,11.02,6,16921.0,United Kingdom
570246,2023-10-09,78124,Magazine Rack Gebra Assorted,11.53,2,16921.0,United Kingdom
570246,2023-10-09,21262,White Goose Feather Christmas Tree,13.27,1,16921.0,United Kingdom
570246,2023-10-09,21371,Mirrored Wall Art Poppies,11.02,7,16921.0,United Kingdom
570246,2023-10-09,47518F,Icon Placemat Pop Art Elvis,10.37,4,16921.0,United Kingdom
570246,2023-10-09,20986,Blue Calculator Ruler,11.53,1,16921.0,United Kingdom
570246,2023-10-09,21090,Set/6 Collage Paper Plates,10.65,3,16921.0,United Kingdom
570246,2023-10-09,22992,Revolver Wooden Ruler,12.25,1,16921.0,United Kingdom
570246,2023-10-09,22049,Wrap Christmas Screen Print,10.44,25,16921.0,United Kingdom
570246,2023-10-09,20914,Set/5 Red Retrospot Lid Glass Bowls,13.27,2,16921.0,United Kingdom
570246,2023-10-09,22062,Ceramic Bowl With Love Heart Design,11.1,1,16921.0,United Kingdom
570246,2023-10-09,35471D,Set Of 3 Bird Light Pink Feather,10.65,12,16921.0,United Kingdom
570246,2023-10-09,22066,Love Heart Trinket Pot,10.65,2,16921.0,United Kingdom
570246,2023-10-09,20914,Set/5 Red Retrospot Lid Glass Bowls,13.27,2,16921.0,United Kingdom
570246,2023-10-09,22062,Ceramic Bowl With Love Heart Design,11.1,2,16921.0,United Kingdom
570246,2023-10-09,35819B,Acrylic Hanging Jewel Blue,10.64,10,16921.0,United Kingdom
570246,2023-10-09,21564,Pink Heart Shape Love Bucket,13.27,2,16921.0,United Kingdom
570246,2023-10-09,22233,Jigsaw Rabbit And Birdhouse,10.85,1,16921.0,United Kingdom
570246,2023-10-09,22229,Bunny Wooden Painted With Flower,10.65,1,16921.0,United Kingdom
570246,2023-10-09,21454,Painted Pink Rabbit,11.12,1,16921.0,United Kingdom
570246,2023-10-09,21239,Pink Polkadot Cup,11.12,1,16921.0,United Kingdom
570246,2023-10-09,22749,Feltcraft Princess Charlotte Doll,14.09,1,16921.0,United Kingdom
570246,2023-10-09,71496B,A4 Wall Tidy Red Flowers,10.79,2,16921.0,United Kingdom
570246,2023-10-09,21243,Pink Polkadot Plate,11.98,1,16921.0,United Kingdom
570246,2023-10-09,21365,Mirrored Wall Art Stars,11.02,3,16921.0,United Kingdom
570246,2023-10-09,84997D,Childrens Cutlery Polkadot Pink,14.5,1,16921.0,United Kingdom
570246,2023-10-09,21194,Pink Honeycomb Paper Fan,10.92,2,16921.0,United Kingdom
570246,2023-10-09,21408,Spotty Pink Duck Doorstop,14.61,1,16921.0,United Kingdom
570246,2023-10-09,47503A,Ass Floral Print Multi Screwdriver,10.68,2,16921.0,United Kingdom
570246,2023-10-09,22230,Jigsaw Tree With Watering Can,10.55,1,16921.0,United Kingdom
570246,2023-10-09,22136,Love Heart Sock Hanger,11.94,2,16921.0,United Kingdom
570246,2023-10-09,22228,Bunny Wooden Painted With Bird,10.65,1,16921.0,United Kingdom
570246,2023-10-09,22231,Jigsaw Tree With Birdhouse,10.85,1,16921.0,United Kingdom
570246,2023-10-09,35471D,Set Of 3 Bird Light Pink Feather,10.65,12,16921.0,United Kingdom
570246,2023-10-09,20914,Set/5 Red Retrospot Lid Glass Bowls,13.27,1,16921.0,United Kingdom
570246,2023-10-09,84596F,Small Marshmallows Pink Bowl,10.68,4,16921.0,United Kingdom
570246,2023-10-09,22349,Dog Bowl Chasing Ball Design,14.09,2,16921.0,United Kingdom
570246,2023-10-09,21108,Fairy Cake Flannel Assorted Colour,11.06,3,16921.0,United Kingdom
570246,2023-10-09,22195,Large Heart Measuring Spoons,11.94,2,16921.0,United Kingdom
570246,2023-10-09,22062,Ceramic Bowl With Love Heart Design,11.1,1,16921.0,United Kingdom
570246,2023-10-09,21262,White Goose Feather Christmas Tree,13.27,1,16921.0,United Kingdom
570246,2023-10-09,22386,Jumbo Bag Pink Polkadot,6.19,4,16921.0,United Kingdom
570246,2023-10-09,22383,Lunch Bag Suki Design,5.97,1,16921.0,United Kingdom
570209,2023-10-09,23397,Foot Stool Home Sweet Home,20.45,1,16326.0,United Kingdom
