TransactionNo,Date,ProductNo,ProductName,Price,Quantity,CustomerNo,Country
571547,2023-10-18,84078A,Set/4 White Retro Storage Cubes,51.2,1,17679.0,United Kingdom
571556,2023-10-18,22504,Cabin Bag Vintage Retrospot,40.95,1,12662.0,Germany
571716,2023-10-18,23472,Nine Drawer Office Tidy,40.11,1,12716.0,France
571554,2023-10-18,22423,Regency Cakestand 3 Tier,35.83,2,17554.0,United Kingdom
571713,2023-10-18,22423,Regency Cakestand 3 Tier,35.83,1,15713.0,United Kingdom
571713,2023-10-18,23314,Vintage Christmas Tablecloth,35.83,1,15713.0,United Kingdom
571713,2023-10-18,23427,Stool Home Sweet Home,35.83,1,15713.0,United Kingdom
571713,2023-10-18,84968A,Set Of 16 Vintage Rose Cutlery,35.83,1,15713.0,United Kingdom
571714,2023-10-18,21258,Victorian Sewing Box Large,35.83,1,12714.0,France
571716,2023-10-18,22423,Regency Cakestand 3 Tier,35.83,1,12716.0,France
571716,2023-10-18,22424,Enamel Bread Bin Cream,35.83,1,12716.0,France
571713,2023-10-18,23085,Antique Silver Bauble Lamp,31.56,1,15713.0,United Kingdom
571713,2023-10-18,23397,Foot Stool Home Sweet Home,30.71,1,15713.0,United Kingdom
571652,2023-10-18,22947,Wooden Advent Calendar Red,27.62,2,14652.0,Hong Kong
571697,2023-10-18,23007,Spaceboy Baby Gift Set,27.62,2,12759.0,Netherlands
571697,2023-10-18,23008,Dolly Girl Baby Gift Set,27.62,1,12759.0,Netherlands
571701,2023-10-18,22847,Bread Bin Diner Style Ivory,27.62,1,14639.0,United Kingdom
571705,2023-10-18,23008,Dolly Girl Baby Gift Set,27.62,2,12360.0,Austria
571713,2023-10-18,22941,Christmas Lights 10 Reindeer,27.3,2,15713.0,United Kingdom
571713,2023-10-18,23541,Wall Art Classic Puddings,27.3,1,15713.0,United Kingdom
571714,2023-10-18,21055,Tool Box Soft Toy,27.3,1,12714.0,France
571714,2023-10-18,21621,Vintage Union Jack Bunting,27.3,1,12714.0,France
571714,2023-10-18,22624,Ivory Kitchen Scales,27.3,1,12714.0,France
571716,2023-10-18,21524,Doormat Spotty Home Sweet Home,27.3,1,12716.0,France
571716,2023-10-18,22946,Wooden Advent Calendar Cream,27.3,1,12716.0,France
571716,2023-10-18,23341,Pink Diner Wall Clock,27.3,1,12716.0,France
571716,2023-10-18,23541,Wall Art Classic Puddings,27.3,1,12716.0,France
571716,2023-10-18,21055,Tool Box Soft Toy,27.3,1,12716.0,France
571713,2023-10-18,22414,Doormat Neighbourhood Witch,26.43,1,15713.0,United Kingdom
571713,2023-10-18,48194,Doormat Hearts,26.43,1,15713.0,United Kingdom
571714,2023-10-18,20685,Doormat Red Retrospot,26.43,1,12714.0,France
571716,2023-10-18,22692,Doormat Welcome To Our Home,26.43,1,12716.0,France
571716,2023-10-18,48111,Doormat 3 Smiley Cats,26.43,1,12716.0,France
571714,2023-10-18,22781,Gumball Magazine Rack,25.58,1,12714.0,France
571716,2023-10-18,22781,Gumball Magazine Rack,25.58,1,12716.0,France
571559,2023-10-18,22838,3 Tier Cake Tin Red And Cream,25.57,1,14911.0,EIRE
571716,2023-10-18,23531,Wall Art Big Love,24.73,1,12716.0,France
571554,2023-10-18,84997C,Childrens Cutlery Polkadot Blue,23.71,1,17554.0,United Kingdom
571559,2023-10-18,22423,Regency Cakestand 3 Tier,23.32,2,14911.0,EIRE
571638,2023-10-18,22423,Regency Cakestand 3 Tier,23.32,3,15327.0,United Kingdom
571638,2023-10-18,22236,Cake Stand 3 Tier Magic Garden,23.32,2,15327.0,United Kingdom
571653,2023-10-18,21628,Triangular Pouffe Vintage,23.32,4,14298.0,United Kingdom
571676,2023-10-18,22424,Enamel Bread Bin Cream,23.32,1,16910.0,United Kingdom
571682,2023-10-18,85066,Cream Sweetheart Mini Chest,23.32,2,14179.0,United Kingdom
571710,2023-10-18,22423,Regency Cakestand 3 Tier,23.32,3,13032.0,United Kingdom
571712,2023-10-18,22424,Enamel Bread Bin Cream,23.32,1,14056.0,United Kingdom
571629,2023-10-18,23427,Stool Home Sweet Home,23.06,2,13362.0,United Kingdom
571665,2023-10-18,23314,Vintage Christmas Tablecloth,23.06,4,12540.0,Spain
571697,2023-10-18,23111,Parisienne Sewing Box,23.06,1,12759.0,Netherlands
571710,2023-10-18,23427,Stool Home Sweet Home,23.06,2,13032.0,United Kingdom
571554,2023-10-18,22111,Scottie Dog Hot Water Bottle,23.02,1,17554.0,United Kingdom
571554,2023-10-18,22112,Chocolate Hot Water Bottle,23.02,8,17554.0,United Kingdom
571554,2023-10-18,22835,Hot Water Bottle I Am So Poorly,23.02,2,17554.0,United Kingdom
571554,2023-10-18,79321,Chilli Lights,23.02,9,17554.0,United Kingdom
571713,2023-10-18,23526,Wall Art Dog Licence,23.02,1,15713.0,United Kingdom
571713,2023-10-18,23534,Wall Art Stop For Tea,23.02,1,15713.0,United Kingdom
571714,2023-10-18,22499,Wooden Union Jack Bunting,23.02,1,12714.0,France
571714,2023-10-18,23091,Zinc Herb Garden Container,23.02,1,12714.0,France
571714,2023-10-18,23534,Wall Art Stop For Tea,23.02,1,12714.0,France
571716,2023-10-18,23534,Wall Art Stop For Tea,23.02,1,12716.0,France
571554,2023-10-18,21485,Retrospot Heart Hot Water Bottle,22.77,2,17554.0,United Kingdom
571652,2023-10-18,22622,Box Of Vintage Alphabet Blocks,22.5,2,14652.0,Hong Kong
571670,2023-10-18,22622,Box Of Vintage Alphabet Blocks,22.5,2,12611.0,Italy
571716,2023-10-18,21754,Home Building Block Word,22.17,1,12716.0,France
571716,2023-10-18,22121,Noel Wooden Block Letters,22.17,1,12716.0,France
571547,2023-10-18,23020,Glass Songbird Storage Jar,21.68,16,17679.0,United Kingdom
571565,2023-10-18,21843,Red Retrospot Cake Stand,21.47,2,12720.0,Germany
571658,2023-10-18,22423,Regency Cakestand 3 Tier,21.47,16,12621.0,Germany
571715,2023-10-18,21843,Red Retrospot Cake Stand,21.47,1,17576.0,United Kingdom
571554,2023-10-18,22943,Christmas Lights 10 Vintage Baubles,21.31,1,17554.0,United Kingdom
571554,2023-10-18,23298,Spotty Bunting,21.31,4,17554.0,United Kingdom
571554,2023-10-18,47566,Party Bunting,21.31,15,17554.0,United Kingdom
571713,2023-10-18,22165,Diamante Heart Shaped Wall Mirror,21.31,1,15713.0,United Kingdom
571713,2023-10-18,23113,Pantry Chopping Board,21.31,1,15713.0,United Kingdom
571713,2023-10-18,23115,Red Apples Chopping Board,21.31,1,15713.0,United Kingdom
571713,2023-10-18,23411,Trellis Coat Rack,21.31,1,15713.0,United Kingdom
571713,2023-10-18,23413,Decorative Vintage Coffee Box,21.31,1,15713.0,United Kingdom
571714,2023-10-18,22165,Diamante Heart Shaped Wall Mirror,21.31,1,12714.0,France
571714,2023-10-18,22505,Memo Board Cottage Design,21.31,1,12714.0,France
571714,2023-10-18,23243,Set Of Tea Coffee Sugar Tins Pantry,21.31,1,12714.0,France
571714,2023-10-18,23413,Decorative Vintage Coffee Box,21.31,1,12714.0,France
571714,2023-10-18,23424,Gingham Recipe Book Box,21.31,1,12714.0,France
571714,2023-10-18,23431,Natural Hanging Quilted Hearts,21.31,1,12714.0,France
571714,2023-10-18,23432,Pretty Hanging Quilted Hearts,21.31,1,12714.0,France
571716,2023-10-18,22112,Chocolate Hot Water Bottle,21.31,1,12716.0,France
571716,2023-10-18,22139,Retrospot Tea Set Ceramic 11 Pc,21.31,1,12716.0,France
571716,2023-10-18,22720,Set Of 3 Cake Tins Pantry Design,21.31,2,12716.0,France
571716,2023-10-18,23245,Set Of 3 Regency Cake Tins,21.31,1,12716.0,France
571716,2023-10-18,23298,Spotty Bunting,21.31,1,12716.0,France
571716,2023-10-18,23313,Vintage Christmas Bunting,21.31,1,12716.0,France
571716,2023-10-18,23396,Le Jardin Botanique Cushion Cover,21.31,1,12716.0,France
571701,2023-10-18,23085,Antique Silver Bauble Lamp,20.91,2,14639.0,United Kingdom
571713,2023-10-18,85127,Small Square Cut Glass Candlestick,20.46,2,15713.0,United Kingdom
571547,2023-10-18,23484,Heart Trellis Triple T-Light Holder,12.8,24,17679.0,United Kingdom
571547,2023-10-18,23284,Doormat Keep Calm And Come In,17.51,10,17679.0,United Kingdom
571548,2023-10-18,47503A,Ass Floral Print Multi Screwdriver,10.68,48,15505.0,United Kingdom
571548,2023-10-18,21888,Bingo Set,14.09,4,15505.0,United Kingdom
571548,2023-10-18,22550,Holiday Fun Ludo,14.09,4,15505.0,United Kingdom
571548,2023-10-18,23108,Set Of 10 Led Dolly Lights,15.77,12,15505.0,United Kingdom
571548,2023-10-18,35970,Zinc Folkart Sleigh Bells,11.78,72,15505.0,United Kingdom
571548,2023-10-18,22141,Christmas Craft Tree Top Angel,12.15,48,15505.0,United Kingdom
571548,2023-10-18,22144,Christmas Craft Little Friends,12.15,40,15505.0,United Kingdom
571548,2023-10-18,22142,Christmas Craft White Fairy,11.53,40,15505.0,United Kingdom
571548,2023-10-18,23110,Parisienne Key Cabinet,16.14,2,15505.0,United Kingdom
571548,2023-10-18,23118,Parisienne Jewellery Drawer,17.94,2,15505.0,United Kingdom
571548,2023-10-18,22273,Feltcraft Doll Molly,13.27,6,15505.0,United Kingdom
571548,2023-10-18,22274,Feltcraft Doll Emily,13.27,6,15505.0,United Kingdom
571548,2023-10-18,22271,Feltcraft Doll Rosie,13.27,6,15505.0,United Kingdom
571548,2023-10-18,22749,Feltcraft Princess Charlotte Doll,14.09,4,15505.0,United Kingdom
571548,2023-10-18,22750,Feltcraft Princess Lola Doll,14.09,4,15505.0,United Kingdom
571548,2023-10-18,22568,Feltcraft Cushion Owl,14.09,4,15505.0,United Kingdom
571548,2023-10-18,21108,Fairy Cake Flannel Assorted Colour,11.06,36,15505.0,United Kingdom
571548,2023-10-18,22577,Wooden Heart Christmas Scandinavian,10.55,24,15505.0,United Kingdom
571548,2023-10-18,22578,Wooden Star Christmas Scandinavian,10.55,24,15505.0,United Kingdom
571548,2023-10-18,22579,Wooden Tree Christmas Scandinavian,10.55,48,15505.0,United Kingdom
571548,2023-10-18,22944,Christmas Metal Postcard With Bells,10.65,72,15505.0,United Kingdom
571548,2023-10-18,22597,Musical Zinc Heart Decoration,10.55,72,15505.0,United Kingdom
571548,2023-10-18,22599,Christmas Musical Zinc Star,10.55,72,15505.0,United Kingdom
571548,2023-10-18,35953,Folkart Star Christmas Decorations,10.65,48,15505.0,United Kingdom
571548,2023-10-18,22065,Christmas Pudding Trinket Pot,10.65,48,15505.0,United Kingdom
571548,2023-10-18,21216,Set 3 Retrospot Tea/Coffee/Sugar,14.61,24,15505.0,United Kingdom
571548,2023-10-18,84347,Rotating Silver Angels T-Light Hldr,12.86,6,15505.0,United Kingdom
571548,2023-10-18,20969,Red Floral Feltcraft Shoulder Bag,14.09,4,15505.0,United Kingdom
571548,2023-10-18,85208,Set/12 Funky Felt Flower Peg In Bag,12.4,12,15505.0,United Kingdom
571549,2023-10-18,21810,Christmas Hanging Star With Bell,10.65,48,13536.0,United Kingdom
571549,2023-10-18,21811,Hanging Heart With Bell,10.65,48,13536.0,United Kingdom
571549,2023-10-18,22577,Wooden Heart Christmas Scandinavian,10.55,48,13536.0,United Kingdom
571549,2023-10-18,72818,Christmas Decoupage Candle,10.65,72,13536.0,United Kingdom
571549,2023-10-18,21888,Bingo Set,14.09,4,13536.0,United Kingdom
571549,2023-10-18,23494,Vintage Doily Deluxe Sewing Kit,16.35,6,13536.0,United Kingdom
571549,2023-10-18,21625,Vintage Union Jack Apron,17.37,3,13536.0,United Kingdom
571549,2023-10-18,22969,Homemade Jam Scented Candles,11.74,12,13536.0,United Kingdom
571549,2023-10-18,47566,Party Bunting,15.32,8,13536.0,United Kingdom
571549,2023-10-18,48138,Doormat Union Flag,18.71,4,13536.0,United Kingdom
571549,2023-10-18,22086,Paper Chain Kit 50'S Christmas,13.27,6,13536.0,United Kingdom
571549,2023-10-18,23313,Vintage Christmas Bunting,15.32,5,13536.0,United Kingdom
571549,2023-10-18,23503,Playing Cards Keep Calm & Carry On,11.53,12,13536.0,United Kingdom
571549,2023-10-18,22617,Baking Set Spaceboy Design,15.32,3,13536.0,United Kingdom
571549,2023-10-18,22138,Baking Set 9 Piece Retrospot,15.32,3,13536.0,United Kingdom
571549,2023-10-18,23203,Jumbo Bag Vintage Doily,6.19,20,13536.0,United Kingdom
571550,2023-10-18,22699,Roses Regency Teacup And Saucer,12.86,24,13892.0,United Kingdom
571550,2023-10-18,85111,Silver Glitter Flower Votive Holder,10.55,396,13892.0,United Kingdom
571551,2023-10-18,23298,Spotty Bunting,15.32,3,15637.0,United Kingdom
571551,2023-10-18,23293,Set Of 12 Fairy Cake Baking Cases,11.1,8,15637.0,United Kingdom
571551,2023-10-18,22577,Wooden Heart Christmas Scandinavian,10.55,24,15637.0,United Kingdom
571551,2023-10-18,23434,3 Raffia Ribbons 50'S Christmas,11.06,10,15637.0,United Kingdom
571551,2023-10-18,22578,Wooden Star Christmas Scandinavian,10.55,24,15637.0,United Kingdom
571551,2023-10-18,22960,Jam Making Set With Jars,14.61,6,15637.0,United Kingdom
571551,2023-10-18,84375,Set Of 20 Kids Cookie Cutters,12.4,12,15637.0,United Kingdom
571551,2023-10-18,22138,Baking Set 9 Piece Retrospot,15.32,3,15637.0,United Kingdom
571551,2023-10-18,21912,Vintage Snakes & Ladders,14.09,4,15637.0,United Kingdom
571551,2023-10-18,22620,4 Traditional Spinning Tops,11.74,12,15637.0,United Kingdom
571551,2023-10-18,22619,Set Of 6 Soldier Skittles,14.09,8,15637.0,United Kingdom
571551,2023-10-18,22928,Yellow Giant Garden Thermometer,16.35,2,15637.0,United Kingdom
571551,2023-10-18,22431,Watering Can Blue Elephant,12.25,6,15637.0,United Kingdom
571551,2023-10-18,22822,Cream Wall Planter Heart Shaped,16.35,2,15637.0,United Kingdom
571551,2023-10-18,23461,Sweetheart Bird House,14.5,4,15637.0,United Kingdom
571552,2023-10-18,23320,Giant 50'S Christmas Cracker,13.21,12,16848.0,United Kingdom
571552,2023-10-18,22086,Paper Chain Kit 50'S Christmas,13.27,6,16848.0,United Kingdom
571552,2023-10-18,23247,Biscuit Tin 50'S Christmas,13.21,6,16848.0,United Kingdom
571552,2023-10-18,23340,Vintage Christmas Cake Frill,11.94,12,16848.0,United Kingdom
571552,2023-10-18,22909,Set Of 20 Vintage Christmas Napkins,11.12,12,16848.0,United Kingdom
571552,2023-10-18,22952,60 Cake Cases Vintage Christmas,10.81,24,16848.0,United Kingdom
571552,2023-10-18,22950,36 Doilies Vintage Christmas,11.74,12,16848.0,United Kingdom
571552,2023-10-18,22732,3d Vintage Christmas Stickers,11.53,18,16848.0,United Kingdom
571552,2023-10-18,21790,Vintage Snap Cards,11.12,12,16848.0,United Kingdom
571552,2023-10-18,21915,Red Harmonica In Box,11.53,12,16848.0,United Kingdom
571552,2023-10-18,21791,Vintage Heads And Tails Card Game,11.53,12,16848.0,United Kingdom
571552,2023-10-18,22938,Cupcake Lace Paper Set 6,12.25,24,16848.0,United Kingdom
571552,2023-10-18,23344,Jumbo Bag 50'S Christmas,6.19,10,16848.0,United Kingdom
571552,2023-10-18,23201,Jumbo Bag Alphabet,6.19,10,16848.0,United Kingdom
571553,2023-10-18,21098,Christmas Toilet Roll,11.34,504,17317.0,United Kingdom
571554,2023-10-18,20675,Blue Polkadot Bowl,12.77,3,17554.0,United Kingdom
571554,2023-10-18,20677,Pink Polkadot Bowl,12.77,3,17554.0,United Kingdom
571554,2023-10-18,20719,Woodland Charlotte Bag,12.77,45,17554.0,United Kingdom
571554,2023-10-18,20723,Strawberry Charlotte Bag,12.77,49,17554.0,United Kingdom
571554,2023-10-18,20724,Red Retrospot Charlotte Bag,12.77,40,17554.0,United Kingdom
571554,2023-10-18,21154,Red Retrospot Oven Glove,13.62,3,17554.0,United Kingdom
571554,2023-10-18,21155,Red Retrospot Peg Bag,15.33,5,17554.0,United Kingdom
571554,2023-10-18,21212,Pack Of 72 Retrospot Cake Cases,12.38,7,17554.0,United Kingdom
571554,2023-10-18,21213,Pack Of 72 Skull Cake Cases,12.38,3,17554.0,United Kingdom
571554,2023-10-18,21238,Red Retrospot Cup,11.92,6,17554.0,United Kingdom
571554,2023-10-18,21240,Blue Polkadot Cup,11.92,2,17554.0,United Kingdom
571554,2023-10-18,21479,White Skull Hot Water Bottle,19.61,8,17554.0,United Kingdom
571554,2023-10-18,21484,Chick Grey Hot Water Bottle,19.61,3,17554.0,United Kingdom
571554,2023-10-18,21485,Retrospot Heart Hot Water Bottle,17.9,2,17554.0,United Kingdom
571554,2023-10-18,21668,Red Stripe Ceramic Drawer Knob,13.62,3,17554.0,United Kingdom
571554,2023-10-18,21670,Blue Spot Ceramic Drawer Knob,13.62,12,17554.0,United Kingdom
571554,2023-10-18,21671,Red Spot Ceramic Drawer Knob,13.62,2,17554.0,United Kingdom
571554,2023-10-18,21672,White Spot Red Ceramic Drawer Knob,13.62,2,17554.0,United Kingdom
571554,2023-10-18,21673,White Spot Blue Ceramic Drawer Knob,13.62,4,17554.0,United Kingdom
571554,2023-10-18,21714,Citronella Candle Garden Pot,13.62,1,17554.0,United Kingdom
571554,2023-10-18,22041,"Record Frame 7"" Single Size",16.18,9,17554.0,United Kingdom
571554,2023-10-18,22079,Ribbon Reel Hearts Design,12.77,2,17554.0,United Kingdom
571554,2023-10-18,22086,Paper Chain Kit 50'S Christmas,17.05,27,17554.0,United Kingdom
571554,2023-10-18,22110,Bird House Hot Water Bottle,16.18,6,17554.0,United Kingdom
571554,2023-10-18,22114,Hot Water Bottle Tea And Sympathy,19.61,32,17554.0,United Kingdom
571554,2023-10-18,22197,Popcorn Holder,12.77,21,17554.0,United Kingdom
571554,2023-10-18,22327,Round Snack Boxes Set Of 4 Skulls,17.05,5,17554.0,United Kingdom
571554,2023-10-18,22355,Charlotte Bag Suki Design,12.77,91,17554.0,United Kingdom
571554,2023-10-18,22356,Charlotte Bag Pink Polkadot,12.77,29,17554.0,United Kingdom
571554,2023-10-18,22631,Circus Parade Lunch Box,14.48,2,17554.0,United Kingdom
571554,2023-10-18,22645,Ceramic Heart Fairy Cake Money Bank,14.48,7,17554.0,United Kingdom
571554,2023-10-18,22665,Recipe Box Blue Sketchbook Design,17.05,3,17554.0,United Kingdom
571554,2023-10-18,22725,Alarm Clock Bakelike Chocolate,18.75,4,17554.0,United Kingdom
571554,2023-10-18,22726,Alarm Clock Bakelike Green,18.75,8,17554.0,United Kingdom
571554,2023-10-18,22727,Alarm Clock Bakelike Red,18.75,7,17554.0,United Kingdom
571554,2023-10-18,22731,3d Christmas Stamps Stickers,11.92,4,17554.0,United Kingdom
571554,2023-10-18,22732,3d Vintage Christmas Stickers,11.92,4,17554.0,United Kingdom
571554,2023-10-18,22733,3d Traditional Christmas Stickers,11.92,7,17554.0,United Kingdom
571554,2023-10-18,22898,Childrens Apron Apples Design,15.33,2,17554.0,United Kingdom
571554,2023-10-18,22910,Paper Chain Kit Vintage Christmas,17.05,2,17554.0,United Kingdom
571554,2023-10-18,23168,Classic Cafe Sugar Dispenser,13.62,7,17554.0,United Kingdom
571554,2023-10-18,23204,Charlotte Bag Apples Design,12.77,24,17554.0,United Kingdom
571554,2023-10-18,23205,Charlotte Bag Vintage Alphabet,12.77,9,17554.0,United Kingdom
571554,2023-10-18,35970,Zinc Folkart Sleigh Bells,14.48,1,17554.0,United Kingdom
571554,2023-10-18,82583,Hot Baths Metal Sign,15.33,2,17554.0,United Kingdom
571554,2023-10-18,84029E,Red Woolly Hottie White Heart,19.61,7,17554.0,United Kingdom
571554,2023-10-18,84692,Box Of 24 Cocktail Parasols,11.92,6,17554.0,United Kingdom
571554,2023-10-18,84997B,Childrens Cutlery Retrospot Red,18.75,2,17554.0,United Kingdom
571554,2023-10-18,84997C,Childrens Cutlery Polkadot Blue,18.75,4,17554.0,United Kingdom
571554,2023-10-18,20725,Lunch Bag Red Retrospot,7.67,19,17554.0,United Kingdom
571554,2023-10-18,20727,Lunch Bag Black Skull,7.67,10,17554.0,United Kingdom
571554,2023-10-18,20728,Lunch Bag Cars Blue,7.67,8,17554.0,United Kingdom
571554,2023-10-18,22382,Lunch Bag Spaceboy Design,7.67,4,17554.0,United Kingdom
571554,2023-10-18,22383,Lunch Bag Suki Design,7.67,8,17554.0,United Kingdom
571554,2023-10-18,23206,Lunch Bag Apple Design,7.67,7,17554.0,United Kingdom
571555,2023-10-18,85123A,Cream Hanging Heart T-Light Holder,13.27,6,16458.0,United Kingdom
571555,2023-10-18,20724,Red Retrospot Charlotte Bag,11.12,10,16458.0,United Kingdom
571555,2023-10-18,22355,Charlotte Bag Suki Design,11.12,10,16458.0,United Kingdom
571555,2023-10-18,23203,Jumbo Bag Vintage Doily,6.19,10,16458.0,United Kingdom
571555,2023-10-18,85099B,Jumbo Bag Red Retrospot,6.19,10,16458.0,United Kingdom
571555,2023-10-18,23344,Jumbo Bag 50'S Christmas,6.19,10,16458.0,United Kingdom
571555,2023-10-18,22386,Jumbo Bag Pink Polkadot,6.19,10,16458.0,United Kingdom
571555,2023-10-18,20725,Lunch Bag Red Retrospot,5.97,10,16458.0,United Kingdom
571555,2023-10-18,23209,Lunch Bag Vintage Doily,5.97,20,16458.0,United Kingdom
571555,2023-10-18,22384,Lunch Bag Pink Polkadot,5.97,10,16458.0,United Kingdom
571556,2023-10-18,23545,Wrap Red Vintage Doily,10.68,25,12662.0,Germany
571556,2023-10-18,23388,Woodland Mini Backpack,14.5,4,12662.0,Germany
571556,2023-10-18,23432,Pretty Hanging Quilted Hearts,11.1,12,12662.0,Germany
571556,2023-10-18,23433,Hanging Quilted Patchwork Apples,11.1,12,12662.0,Germany
571556,2023-10-18,22865,Hand Warmer Owl Design,12.4,12,12662.0,Germany
571556,2023-10-18,23298,Spotty Bunting,15.32,3,12662.0,Germany
571556,2023-10-18,22318,Five Heart Hanging Decoration,13.27,6,12662.0,Germany
571556,2023-10-18,84347,Rotating Silver Angels T-Light Hldr,12.86,6,12662.0,Germany
571556,2023-10-18,22144,Christmas Craft Little Friends,12.4,6,12662.0,Germany
571556,2023-10-18,20750,Red Retrospot Mini Cases,18.4,4,12662.0,Germany
571556,2023-10-18,16235,Recycled Pencil With Rabbit Eraser,10.47,60,12662.0,Germany
571556,2023-10-18,20718,Red Retrospot Shopper Bag,11.53,10,12662.0,Germany
571556,2023-10-18,23311,Vintage Christmas Stocking,12.86,6,12662.0,Germany
571556,2023-10-18,22326,Round Snack Boxes Set Of4 Woodland,13.27,12,12662.0,Germany
571556,2023-10-18,21680,Woodland Stickers,11.12,12,12662.0,Germany
571556,2023-10-18,84997B,Childrens Cutlery Retrospot Red,14.5,4,12662.0,Germany
571556,2023-10-18,21238,Red Retrospot Cup,11.12,8,12662.0,Germany
571556,2023-10-18,20675,Blue Polkadot Bowl,11.53,8,12662.0,Germany
571556,2023-10-18,20674,Green Polkadot Bowl,11.53,8,12662.0,Germany
571556,2023-10-18,23204,Charlotte Bag Apples Design,11.12,10,12662.0,Germany
571556,2023-10-18,22175,Pink Owl Soft Toy,13.27,6,12662.0,Germany
571556,2023-10-18,22176,Blue Owl Soft Toy,13.27,6,12662.0,Germany
571556,2023-10-18,22779,Wooden Owls Light Garland,14.61,4,12662.0,Germany
571556,2023-10-18,23108,Set Of 10 Led Dolly Lights,16.66,2,12662.0,Germany
571556,2023-10-18,23082,Set 6 Paper Table Lantern Hearts,14.09,6,12662.0,Germany
571556,2023-10-18,22319,Hairclips Forties Fabric Assorted,10.92,12,12662.0,Germany
571556,2023-10-18,20712,Jumbo Bag Woodland Animals,6.19,10,12662.0,Germany
571556,2023-10-18,23199,Jumbo Bag Apples,6.19,10,12662.0,Germany
571556,2023-10-18,20726,Lunch Bag Woodland,5.97,10,12662.0,Germany
571557,2023-10-18,21820,Glitter Heart Garland With Bells,14.09,6,15678.0,United Kingdom
571557,2023-10-18,22488,Natural Slate Rectangle Chalkboard,11.94,12,15678.0,United Kingdom
571557,2023-10-18,22457,Natural Slate Heart Chalkboard,13.27,12,15678.0,United Kingdom
571557,2023-10-18,23399,Home Sweet Home Hanging Heart,11.12,24,15678.0,United Kingdom
571557,2023-10-18,84832,Zinc Willie Winkie Candle Stick,11.12,12,15678.0,United Kingdom
571557,2023-10-18,21930,Jumbo Storage Bag Skulls,12.38,10,15678.0,United Kingdom
571557,2023-10-18,21429,Red Gingham Rose Jewellery Box,12.25,8,15678.0,United Kingdom
571557,2023-10-18,23201,Jumbo Bag Alphabet,6.19,20,15678.0,United Kingdom
571557,2023-10-18,22386,Jumbo Bag Pink Polkadot,6.19,10,15678.0,United Kingdom
571557,2023-10-18,85099B,Jumbo Bag Red Retrospot,6.19,30,15678.0,United Kingdom
571557,2023-10-18,85099F,Jumbo Bag Strawberry,6.19,20,15678.0,United Kingdom
571557,2023-10-18,23344,Jumbo Bag 50'S Christmas,6.19,20,15678.0,United Kingdom
571558,2023-10-18,22114,Hot Water Bottle Tea And Sympathy,14.09,24,17730.0,United Kingdom
571558,2023-10-18,22112,Chocolate Hot Water Bottle,14.61,24,17730.0,United Kingdom
571558,2023-10-18,22028,Penny Farthing Birthday Card,10.68,12,17730.0,United Kingdom
571558,2023-10-18,22984,Card Gingham Rose,10.68,12,17730.0,United Kingdom
571558,2023-10-18,22585,Pack Of 6 Birdy Gift Tags,11.53,12,17730.0,United Kingdom
571558,2023-10-18,17084N,Fairy Dreams Incense,10.47,50,17730.0,United Kingdom
571558,2023-10-18,23263,Set Of 3 Wooden Heart Decorations,11.53,12,17730.0,United Kingdom
571558,2023-10-18,22072,Red Retrospot Tea Cup And Saucer,14.09,8,17730.0,United Kingdom
571558,2023-10-18,23502,Playing Cards Vintage Doily,11.53,12,17730.0,United Kingdom
571558,2023-10-18,22741,Funky Diva Pen,11.12,48,17730.0,United Kingdom
571558,2023-10-18,22667,Recipe Box Retrospot,13.27,6,17730.0,United Kingdom
571559,2023-10-18,22193,Red Diner Wall Clock,18.09,12,14911.0,EIRE
571559,2023-10-18,22191,Ivory Diner Wall Clock,18.09,12,14911.0,EIRE
571559,2023-10-18,23308,Set Of 60 Vintage Leaf Cake Cases,10.81,24,14911.0,EIRE
571559,2023-10-18,21212,Pack Of 72 Retrospot Cake Cases,10.81,24,14911.0,EIRE
571559,2023-10-18,21975,Pack Of 60 Dinosaur Cake Cases,10.81,24,14911.0,EIRE
571559,2023-10-18,22840,Round Cake Tin Vintage Red,18.4,2,14911.0,EIRE
571559,2023-10-18,21524,Doormat Spotty Home Sweet Home,17.17,10,14911.0,EIRE
571559,2023-10-18,23283,Doormat Vintage Leaf,17.17,10,14911.0,EIRE
571559,2023-10-18,22773,Green Drawer Knob Acrylic Edwardian,11.53,12,14911.0,EIRE
571559,2023-10-18,23341,Pink Diner Wall Clock,18.96,2,14911.0,EIRE
571559,2023-10-18,23342,Mint Diner Wall Clock,18.96,2,14911.0,EIRE
571559,2023-10-18,22192,Blue Diner Wall Clock,18.96,2,14911.0,EIRE
571559,2023-10-18,23389,Spaceboy Mini Backpack,14.5,4,14911.0,EIRE
571559,2023-10-18,23390,Dolly Girl Mini Backpack,14.5,4,14911.0,EIRE
571559,2023-10-18,23388,Woodland Mini Backpack,14.5,4,14911.0,EIRE
571559,2023-10-18,84997D,Childrens Cutlery Polkadot Pink,14.5,4,14911.0,EIRE
571559,2023-10-18,84997C,Childrens Cutlery Polkadot Blue,14.5,4,14911.0,EIRE
571559,2023-10-18,22960,Jam Making Set With Jars,14.09,12,14911.0,EIRE
571559,2023-10-18,23306,Set Of 36 Pantry Paper Doilies,11.74,12,14911.0,EIRE
571559,2023-10-18,23199,Jumbo Bag Apples,6.19,10,14911.0,EIRE
571559,2023-10-18,23201,Jumbo Bag Alphabet,6.19,10,14911.0,EIRE
571559,2023-10-18,23202,Jumbo Bag Vintage Leaf,6.19,10,14911.0,EIRE
571559,2023-10-18,22385,Jumbo Bag Spaceboy Design,6.19,10,14911.0,EIRE
571559,2023-10-18,23206,Lunch Bag Apple Design,5.97,20,14911.0,EIRE
571559,2023-10-18,23208,Lunch Bag Vintage Leaf Design,5.97,20,14911.0,EIRE
571559,2023-10-18,20728,Lunch Bag Cars Blue,5.97,20,14911.0,EIRE
571560,2023-10-18,23274,Star T-Light Holder Willie Winkie,11.94,12,14897.0,United Kingdom
571560,2023-10-18,23273,Heart T-Light Holder Willie Winkie,11.94,12,14897.0,United Kingdom
571560,2023-10-18,22297,Heart Ivory Trellis Small,11.53,24,14897.0,United Kingdom
571560,2023-10-18,23415,Home Sweet Home Hook,11.94,12,14897.0,United Kingdom
571560,2023-10-18,23145,Zinc T-Light Holder Star Large,11.22,12,14897.0,United Kingdom
571560,2023-10-18,84970L,Single Heart Zinc T-Light Holder,11.53,12,14897.0,United Kingdom
571560,2023-10-18,22178,Victorian Glass Hanging T-Light,12.25,6,14897.0,United Kingdom
571560,2023-10-18,22670,French Wc Sign Blue Metal,11.53,12,14897.0,United Kingdom
571560,2023-10-18,23182,Toilet Sign Occupied Or Vacant,11.1,24,14897.0,United Kingdom
571560,2023-10-18,22699,Roses Regency Teacup And Saucer,13.27,6,14897.0,United Kingdom
