TransactionNo,Date,ProductNo,ProductName,Price,Quantity,CustomerNo,Country
546983,2023-03-18,21686,Medina Stamped Metal Stool,51.2,1,16626.0,United Kingdom
546944,2023-03-18,20785,Fuschia Retro Bar Stool,47.1,9,14701.0,United Kingdom
546977,2023-03-18,22839,3 Tier Cake Tin Green And Cream,40.15,1,13977.0,United Kingdom
546972,2023-03-18,22423,Regency Cakestand 3 Tier,35.83,8,13972.0,United Kingdom
546983,2023-03-18,22782,Set 3 Wicker Storage Baskets,35.82,1,16626.0,United Kingdom
546973,2023-03-18,21843,Red Retrospot Cake Stand,31.56,1,17973.0,EIRE
546976,2023-03-18,21217,Red Retrospot Round Cake Tins,31.56,1,16976.0,United Kingdom
546976,2023-03-18,21843,Red Retrospot Cake Stand,31.56,1,16976.0,United Kingdom
546977,2023-03-18,21843,Red Retrospot Cake Stand,31.56,2,13977.0,United Kingdom
546977,2023-03-18,22776,Sweetheart 3 Tier Cake Stand,30.71,1,13977.0,United Kingdom
546983,2023-03-18,22783,Set 3 Wicker Oval Baskets W Lids,30.7,1,16626.0,United Kingdom
546917,2023-03-18,22797,Chest Of Drawers Gingham Heart,27.62,1,14911.0,EIRE
547005,2023-03-18,23007,Spaceboy Baby Gift Set,27.62,1,12474.0,Germany
547005,2023-03-18,23010,Circus Parade Baby Gift Set,27.62,1,12474.0,Germany
546972,2023-03-18,21523,Doormat Fancy Font Home Sweet Home,27.3,1,13972.0,United Kingdom
546972,2023-03-18,21524,Doormat Spotty Home Sweet Home,27.3,1,13972.0,United Kingdom
546972,2023-03-18,48189,Doormat Friendship,27.3,2,13972.0,United Kingdom
546973,2023-03-18,22844,Vintage Cream Dog Food Container,27.3,1,17973.0,EIRE
546974,2023-03-18,22844,Vintage Cream Dog Food Container,27.3,2,12974.0,United Kingdom
546977,2023-03-18,20749,Assorted Colour Mini Cases,27.3,1,13977.0,United Kingdom
546976,2023-03-18,21257,Victorian Sewing Box Medium,26.43,1,16976.0,United Kingdom
546976,2023-03-18,22283,6 Egg House Painted Wood,26.43,1,16976.0,United Kingdom
546977,2023-03-18,22166,Wall Mirror Rectangle Diamante Pink,26.43,2,13977.0,United Kingdom
546914,2023-03-18,22993,Set Of 4 Pantry Jelly Moulds,11.53,12,13072.0,United Kingdom
546914,2023-03-18,22138,Baking Set 9 Piece Retrospot,15.32,6,13072.0,United Kingdom
546914,2023-03-18,22139,Retrospot Tea Set Ceramic 11 Pc,15.32,3,13072.0,United Kingdom
546914,2023-03-18,22617,Baking Set Spaceboy Design,15.32,6,13072.0,United Kingdom
546914,2023-03-18,22961,Jam Making Set Printed,11.74,24,13072.0,United Kingdom
546914,2023-03-18,22084,Paper Chain Kit Empire,13.27,12,13072.0,United Kingdom
546914,2023-03-18,22934,Baking Mould Easter Egg White Choc,13.27,6,13072.0,United Kingdom
546915,2023-03-18,22698,Pink Regency Teacup And Saucer,13.27,6,15695.0,United Kingdom
546915,2023-03-18,22697,Green Regency Teacup And Saucer,13.27,6,15695.0,United Kingdom
546915,2023-03-18,22699,Roses Regency Teacup And Saucer,13.27,6,15695.0,United Kingdom
546915,2023-03-18,84879,Assorted Colour Bird Ornament,11.98,16,15695.0,United Kingdom
546915,2023-03-18,21136,Painted Metal Pears Assorted,11.98,8,15695.0,United Kingdom
546915,2023-03-18,22971,Queens Guard Coffee Mug,12.86,6,15695.0,United Kingdom
546915,2023-03-18,22970,London Bus Coffee Mug,12.86,6,15695.0,United Kingdom
546915,2023-03-18,22902,Tote Bag I Love London,12.4,12,15695.0,United Kingdom
546915,2023-03-18,22659,Lunch Box I Love London,12.25,12,15695.0,United Kingdom
546915,2023-03-18,22616,Pack Of 12 London Tissues,10.55,48,15695.0,United Kingdom
546915,2023-03-18,22148,Easter Craft 4 Chicks,12.25,12,15695.0,United Kingdom
546915,2023-03-18,22147,Feltcraft Butterfly Hearts,11.74,12,15695.0,United Kingdom
546915,2023-03-18,22149,Feltcraft 6 Flower Friends,12.4,6,15695.0,United Kingdom
546915,2023-03-18,22150,3 Stripey Mice Feltcraft,12.25,6,15695.0,United Kingdom
546915,2023-03-18,22569,Feltcraft Cushion Butterfly,14.09,4,15695.0,United Kingdom
546915,2023-03-18,22568,Feltcraft Cushion Owl,14.09,4,15695.0,United Kingdom
546915,2023-03-18,22557,Plasters In Tin Vintage Paisley,11.94,12,15695.0,United Kingdom
546915,2023-03-18,22555,Plasters In Tin Strongman,11.94,12,15695.0,United Kingdom
546916,2023-03-18,84032B,Charlie + Lola Red Hot Water Bottle,13.27,6,15695.0,United Kingdom
546916,2023-03-18,84032A,Charlie+Lola Pink Hot Water Bottle,13.27,6,15695.0,United Kingdom
546916,2023-03-18,22112,Chocolate Hot Water Bottle,15.32,3,15695.0,United Kingdom
546917,2023-03-18,22380,Toy Tidy Spaceboy,12.4,5,14911.0,EIRE
546917,2023-03-18,21430,Set/3 Red Gingham Rose Storage Box,14.09,8,14911.0,EIRE
546917,2023-03-18,22623,Box Of Vintage Jigsaw Blocks,15.32,3,14911.0,EIRE
546917,2023-03-18,22617,Baking Set Spaceboy Design,15.32,6,14911.0,EIRE
546917,2023-03-18,21466,Red Flower Crochet Food Cover,14.09,12,14911.0,EIRE
546917,2023-03-18,22961,Jam Making Set Printed,11.74,12,14911.0,EIRE
546917,2023-03-18,22966,Gingerbread Man Cookie Cutter,11.53,12,14911.0,EIRE
546917,2023-03-18,22556,Plasters In Tin Circus Parade,11.94,12,14911.0,EIRE
546917,2023-03-18,20749,Assorted Colour Mini Cases,18.4,2,14911.0,EIRE
546917,2023-03-18,22381,Toy Tidy Pink Polkadot,12.4,5,14911.0,EIRE
546917,2023-03-18,21576,Lets Go Shopping Cotton Tote Bag,12.56,6,14911.0,EIRE
546917,2023-03-18,22372,Airline Bag Vintage World Champion,14.61,4,14911.0,EIRE
546917,2023-03-18,22112,Chocolate Hot Water Bottle,15.32,3,14911.0,EIRE
546917,2023-03-18,21411,Gingham Heart Doorstop Red,14.61,3,14911.0,EIRE
546917,2023-03-18,82011B,Bathroom Scales Rubber Ducks,14.09,2,14911.0,EIRE
546917,2023-03-18,85053,French Enamel Candleholder,12.4,6,14911.0,EIRE
546917,2023-03-18,79403,Frosted White Base,11.12,12,14911.0,EIRE
546917,2023-03-18,21790,Vintage Snap Cards,11.12,12,14911.0,EIRE
546917,2023-03-18,21791,Vintage Heads And Tails Card Game,11.53,12,14911.0,EIRE
546917,2023-03-18,22191,Ivory Diner Wall Clock,18.96,2,14911.0,EIRE
546917,2023-03-18,22194,Black Diner Wall Clock,18.96,2,14911.0,EIRE
546917,2023-03-18,17012A,Origami Vanilla Incense/Candle Set,12.86,6,14911.0,EIRE
546917,2023-03-18,22896,Peg Bag Apples Design,12.86,6,14911.0,EIRE
546917,2023-03-18,20754,Retrospot Red Washing Up Gloves,12.4,6,14911.0,EIRE
546917,2023-03-18,47348A,Fuschia Voile Pointy Shoe Dec,12.25,6,14911.0,EIRE
546917,2023-03-18,21906,Pharmacie First Aid Tin,17.17,2,14911.0,EIRE
546917,2023-03-18,22500,Set Of 2 Tins Jardin De Provence,15.32,4,14911.0,EIRE
546917,2023-03-18,79000,Moroccan Tea Glass,11.12,12,14911.0,EIRE
546917,2023-03-18,79051A,Smokey Grey Colour Glass,10.92,24,14911.0,EIRE
546917,2023-03-18,22283,6 Egg House Painted Wood,18.4,2,14911.0,EIRE
546917,2023-03-18,37447,Ceramic Cake Design Spotted Plate,11.78,12,14911.0,EIRE
546917,2023-03-18,22720,Set Of 3 Cake Tins Pantry Design,15.32,3,14911.0,EIRE
546917,2023-03-18,23176,Abc Treasure Book Box,12.56,8,14911.0,EIRE
546917,2023-03-18,23178,Jam Clock Magnet,13.21,6,14911.0,EIRE
546917,2023-03-18,23179,Clock Magnet Mum's Kitchen,13.21,6,14911.0,EIRE
546917,2023-03-18,23183,Mother's Kitchen Spoon Rest,14.09,6,14911.0,EIRE
546917,2023-03-18,22138,Baking Set 9 Piece Retrospot,15.32,3,14911.0,EIRE
546918,2023-03-18,15056N,Edwardian Parasol Natural,16.35,8,15854.0,United Kingdom
546918,2023-03-18,15056P,Edwardian Parasol Pink,16.35,4,15854.0,United Kingdom
546918,2023-03-18,20679,Edwardian Parasol Red,16.35,8,15854.0,United Kingdom
546919,2023-03-18,22585,Pack Of 6 Birdy Gift Tags,11.34,144,12500.0,Germany
546919,2023-03-18,47367B,Pair Padded Hangers Pink Check,13.27,24,12500.0,Germany
546920,2023-03-18,20719,Woodland Charlotte Bag,11.12,10,12471.0,Germany
546920,2023-03-18,21577,Save The Planet Cotton Tote Bag,12.56,6,12471.0,Germany
546920,2023-03-18,21700,Big Doughnut Fridge Magnets,11.12,24,12471.0,Germany
546920,2023-03-18,21787,Rain Poncho Retrospot,11.12,24,12471.0,Germany
546920,2023-03-18,21232,Strawberry Ceramic Trinket Pot,11.53,24,12471.0,Germany
546920,2023-03-18,21231,Sweetheart Ceramic Trinket Box,11.53,12,12471.0,Germany
546920,2023-03-18,22326,Round Snack Boxes Set Of4 Woodland,13.27,6,12471.0,Germany
546920,2023-03-18,22445,Pencil Case Life Is Beautiful,13.27,6,12471.0,Germany
546920,2023-03-18,22649,Strawberry Fairy Cake Teapot,15.32,8,12471.0,Germany
546920,2023-03-18,22908,Pack Of 20 Napkins Red Apples,11.12,12,12471.0,Germany
546920,2023-03-18,22419,Lipstick Pen Red,10.68,36,12471.0,Germany
546920,2023-03-18,22728,Alarm Clock Bakelike Pink,14.09,4,12471.0,Germany
546920,2023-03-18,22741,Funky Diva Pen,11.12,48,12471.0,Germany
546920,2023-03-18,22720,Set Of 3 Cake Tins Pantry Design,15.32,12,12471.0,Germany
546920,2023-03-18,22962,Jam Jar With Pink Lid,11.12,12,12471.0,Germany
546920,2023-03-18,22961,Jam Making Set Printed,11.74,12,12471.0,Germany
546921,2023-03-18,23183,Mother's Kitchen Spoon Rest,14.09,4,12471.0,Germany
546921,2023-03-18,23177,Treasure Island Book Box,12.56,8,12471.0,Germany
546922,2023-03-18,22355,Charlotte Bag Suki Design,11.12,10,14110.0,United Kingdom
546922,2023-03-18,20723,Strawberry Charlotte Bag,11.12,10,14110.0,United Kingdom
546922,2023-03-18,15056N,Edwardian Parasol Natural,16.35,3,14110.0,United Kingdom
546922,2023-03-18,47566,Party Bunting,15.32,4,14110.0,United Kingdom
546922,2023-03-18,82552,Washroom Metal Sign,11.74,12,14110.0,United Kingdom
546922,2023-03-18,85150,Ladies & Gentlemen Metal Sign,12.86,6,14110.0,United Kingdom
546922,2023-03-18,82599,Fanny's Rest Stopmetal Sign,12.4,12,14110.0,United Kingdom
546922,2023-03-18,21174,Pottering In The Shed Metal Sign,12.38,12,14110.0,United Kingdom
546922,2023-03-18,21169,You're Confusing Me Metal Sign,11.98,12,14110.0,United Kingdom
546922,2023-03-18,21907,I'm On Holiday Metal Sign,12.4,12,14110.0,United Kingdom
546922,2023-03-18,22412,Metal Sign Neighbourhood Witch,12.4,12,14110.0,United Kingdom
546922,2023-03-18,22041,"Record Frame 7"" Single Size",12.4,48,14110.0,United Kingdom
546922,2023-03-18,22468,Babushka Lights String Of 10,17.17,2,14110.0,United Kingdom
546922,2023-03-18,85059,French Enamel Water Basin,14.09,4,14110.0,United Kingdom
546922,2023-03-18,16156S,Wrap Pink Fairy Cakes,10.68,25,14110.0,United Kingdom
546922,2023-03-18,47566B,Tea Time Party Bunting,15.32,4,14110.0,United Kingdom
546922,2023-03-18,47580,Tea Time Des Tea Cosy,12.86,6,14110.0,United Kingdom
546922,2023-03-18,85123A,Cream Hanging Heart T-Light Holder,13.27,6,14110.0,United Kingdom
546922,2023-03-18,22692,Doormat Welcome To Our Home,17.17,10,14110.0,United Kingdom
546922,2023-03-18,21500,Pink Polkadot Wrap,10.68,25,14110.0,United Kingdom
546922,2023-03-18,21137,Black Record Cover Frame,13.72,48,14110.0,United Kingdom
546922,2023-03-18,20724,Red Retrospot Charlotte Bag,11.12,10,14110.0,United Kingdom
546922,2023-03-18,20685,Doormat Red Retrospot,17.17,10,14110.0,United Kingdom
546922,2023-03-18,21041,Red Retrospot Oven Glove Double,13.27,6,14110.0,United Kingdom
546922,2023-03-18,22090,Paper Bunting Retrospot,13.27,6,14110.0,United Kingdom
546922,2023-03-18,22139,Retrospot Tea Set Ceramic 11 Pc,15.32,3,14110.0,United Kingdom
546922,2023-03-18,21931,Jumbo Storage Bag Suki,12.25,10,14110.0,United Kingdom
546922,2023-03-18,22386,Jumbo Bag Pink Polkadot,6.13,20,14110.0,United Kingdom
546922,2023-03-18,85099B,Jumbo Bag Red Retrospot,6.13,10,14110.0,United Kingdom
546922,2023-03-18,20713,Jumbo Bag Owls,6.13,10,14110.0,United Kingdom
546922,2023-03-18,85099C,Jumbo Bag Baroque Black White,6.13,10,14110.0,United Kingdom
546922,2023-03-18,85099F,Jumbo Bag Strawberry,6.13,10,14110.0,United Kingdom
546923,2023-03-18,22171,3 Hook Photo Shelf Antique White,17.37,24,16716.0,United Kingdom
546924,2023-03-18,22630,Dolly Girl Lunch Box,12.25,12,14059.0,United Kingdom
546924,2023-03-18,22556,Plasters In Tin Circus Parade,11.94,12,14059.0,United Kingdom
546924,2023-03-18,22554,Plasters In Tin Woodland Animals,11.94,12,14059.0,United Kingdom
546924,2023-03-18,22555,Plasters In Tin Strongman,11.94,12,14059.0,United Kingdom
546924,2023-03-18,23127,Feltcraft Girl Nicole Kit,15.32,4,14059.0,United Kingdom
546924,2023-03-18,23128,Feltcraft Boy Jean-Paul Kit,15.32,4,14059.0,United Kingdom
546924,2023-03-18,22262,Felt Egg Cosy Chicken,11.12,60,14059.0,United Kingdom
546924,2023-03-18,21313,Glass Heart T-Light Holder,11.12,12,14059.0,United Kingdom
546925,2023-03-18,22989,Set 2 Pantry Design Tea Towels,13.58,6,12647.0,Germany
546925,2023-03-18,22243,5 Hook Hanger Red Magic Toadstool,11.74,96,12647.0,Germany
546925,2023-03-18,22352,Lunch Box With Cutlery Retrospot,12.4,60,12647.0,Germany
546925,2023-03-18,21558,Skull Lunch Box With Cutlery,12.4,60,12647.0,Germany
546926,2023-03-18,21190,Pink Hearts Paper Garland,11.74,50,17857.0,United Kingdom
546926,2023-03-18,22536,Magic Drawing Slate Purdey,10.62,100,17857.0,United Kingdom
546927,2023-03-18,22559,Seaside Flying Disc,11.34,48,16672.0,United Kingdom
546927,2023-03-18,21746,Small Red Retrospot Windmill,11.34,96,16672.0,United Kingdom
546927,2023-03-18,21716,Boys Vintage Tin Seaside Bucket,12.86,24,16672.0,United Kingdom
546927,2023-03-18,21715,Girls Vintage Tin Seaside Bucket,12.86,24,16672.0,United Kingdom
546927,2023-03-18,21878,Pack Of 6 Sandcastle Flags Assorted,11.12,48,16672.0,United Kingdom
546927,2023-03-18,22699,Roses Regency Teacup And Saucer,13.27,12,16672.0,United Kingdom
546927,2023-03-18,22698,Pink Regency Teacup And Saucer,13.27,12,16672.0,United Kingdom
546927,2023-03-18,22697,Green Regency Teacup And Saucer,13.27,12,16672.0,United Kingdom
546927,2023-03-18,22972,Children's Spaceboy Mug,11.94,24,16672.0,United Kingdom
546927,2023-03-18,22974,Childrens Dolly Girl Mug,11.94,24,16672.0,United Kingdom
546927,2023-03-18,22629,Spaceboy Lunch Box,12.25,24,16672.0,United Kingdom
546927,2023-03-18,22630,Dolly Girl Lunch Box,12.25,24,16672.0,United Kingdom
546927,2023-03-18,22634,Childs Breakfast Set Spaceboy,18.96,8,16672.0,United Kingdom
546927,2023-03-18,22635,Childs Breakfast Set Dolly Girl,18.96,8,16672.0,United Kingdom
546927,2023-03-18,22467,Gumball Coat Rack,12.86,12,16672.0,United Kingdom
546927,2023-03-18,22781,Gumball Magazine Rack,17.17,12,16672.0,United Kingdom
546927,2023-03-18,22729,Alarm Clock Bakelike Orange,14.09,12,16672.0,United Kingdom
546927,2023-03-18,22727,Alarm Clock Bakelike Red,14.09,12,16672.0,United Kingdom
546927,2023-03-18,22726,Alarm Clock Bakelike Green,14.09,12,16672.0,United Kingdom
546927,2023-03-18,22725,Alarm Clock Bakelike Chocolate,14.09,12,16672.0,United Kingdom
546928,2023-03-18,22813,Pack 3 Boxes Bird Panettone,12.25,12,17685.0,United Kingdom
546928,2023-03-18,21088,Set/6 Fruit Salad Paper Cups,10.92,12,17685.0,United Kingdom
546928,2023-03-18,21096,Set/6 Fruit Salad Paper Plates,11.12,12,17685.0,United Kingdom
546928,2023-03-18,20886,Box Of 9 Pebble Candles,12.25,24,17685.0,United Kingdom
546928,2023-03-18,79321,Chilli Lights,15.32,24,17685.0,United Kingdom
546928,2023-03-18,22328,Round Snack Boxes Set Of 4 Fruits,13.27,6,17685.0,United Kingdom
546928,2023-03-18,85123A,Cream Hanging Heart T-Light Holder,13.27,6,17685.0,United Kingdom
546928,2023-03-18,23232,Wrap Vintage Leaf Design,10.68,25,17685.0,United Kingdom
546928,2023-03-18,23233,Wrap Poppies Design,10.68,25,17685.0,United Kingdom
546928,2023-03-18,22264,Felt Farm Animal White Bunny,11.12,12,17685.0,United Kingdom
546928,2023-03-18,22258,Felt Farm Animal Rabbit,11.53,12,17685.0,United Kingdom
546928,2023-03-18,22908,Pack Of 20 Napkins Red Apples,11.12,12,17685.0,United Kingdom
546928,2023-03-18,22820,Gift Bag Birthday,5.46,12,17685.0,United Kingdom
546929,2023-03-18,22638,Set Of 4 Napkin Charms Crowns,12.86,6,13090.0,United Kingdom
546929,2023-03-18,22178,Victorian Glass Hanging T-Light,11.53,24,13090.0,United Kingdom
546929,2023-03-18,22622,Box Of Vintage Alphabet Blocks,18.96,24,13090.0,United Kingdom
546929,2023-03-18,22139,Retrospot Tea Set Ceramic 11 Pc,14.61,24,13090.0,United Kingdom
546929,2023-03-18,22138,Baking Set 9 Piece Retrospot,14.61,24,13090.0,United Kingdom
546929,2023-03-18,22617,Baking Set Spaceboy Design,14.61,24,13090.0,United Kingdom
546933,2023-03-18,85123A,Cream Hanging Heart T-Light Holder,10.25,1,17933.0,United Kingdom
546933,2023-03-18,48184,Doormat English Rose,10.25,2,17933.0,United Kingdom
546933,2023-03-18,22692,Doormat Welcome To Our Home,10.25,1,17933.0,United Kingdom
546933,2023-03-18,22683,French Blue Metal Door Sign 8,10.25,2,17933.0,United Kingdom
546933,2023-03-18,22686,French Blue Metal Door Sign No,10.25,3,17933.0,United Kingdom
546933,2023-03-18,22681,French Blue Metal Door Sign 6,10.25,7,17933.0,United Kingdom
546933,2023-03-18,22682,French Blue Metal Door Sign 7,10.25,3,17933.0,United Kingdom
546933,2023-03-18,22685,French Blue Metal Door Sign 0,10.25,1,17933.0,United Kingdom
546933,2023-03-18,22680,French Blue Metal Door Sign 5,10.25,3,17933.0,United Kingdom
546933,2023-03-18,22684,French Blue Metal Door Sign 9,10.25,3,17933.0,United Kingdom
546933,2023-03-18,22678,French Blue Metal Door Sign 3,10.25,3,17933.0,United Kingdom
546933,2023-03-18,22679,French Blue Metal Door Sign 4,10.25,4,17933.0,United Kingdom
546933,2023-03-18,22676,French Blue Metal Door Sign 1,10.25,3,17933.0,United Kingdom
546933,2023-03-18,22666,Recipe Box Pantry Yellow Design,10.25,9,17933.0,United Kingdom
546933,2023-03-18,22627,Mint Kitchen Scales,10.25,1,17933.0,United Kingdom
546933,2023-03-18,22626,Black Kitchen Scales,10.25,1,17933.0,United Kingdom
546933,2023-03-18,22625,Red Kitchen Scales,10.25,3,17933.0,United Kingdom
546933,2023-03-18,22623,Box Of Vintage Jigsaw Blocks,10.25,1,17933.0,United Kingdom
546933,2023-03-18,22521,Childs Garden Trowel Pink,10.25,1,17933.0,United Kingdom
546933,2023-03-18,22430,Enamel Watering Can Cream,10.25,3,17933.0,United Kingdom
546933,2023-03-18,22375,Airline Bag Vintage Jet Set Brown,10.25,1,17933.0,United Kingdom
546933,2023-03-18,22374,Airline Bag Vintage Jet Set Red,10.25,1,17933.0,United Kingdom
546933,2023-03-18,22366,Doormat Airmail,10.25,1,17933.0,United Kingdom
546933,2023-03-18,22364,Glass Jar Digestive Biscuits,10.25,2,17933.0,United Kingdom
546933,2023-03-18,22631,Circus Parade Lunch Box,10.25,3,17933.0,United Kingdom
546933,2023-03-18,21556,Ceramic Strawberry Money Box,10.25,2,17933.0,United Kingdom
546933,2023-03-18,22666,Recipe Box Pantry Yellow Design,10.25,1,17933.0,United Kingdom
546933,2023-03-18,22372,Airline Bag Vintage World Champion,10.25,1,17933.0,United Kingdom
546933,2023-03-18,20719,Woodland Charlotte Bag,10.25,1,17933.0,United Kingdom
546933,2023-03-18,85099B,Jumbo Bag Red Retrospot,5.13,2,17933.0,United Kingdom
546944,2023-03-18,22300,Coffee Mug Dog + Ball Design,12.86,6,14701.0,United Kingdom
546944,2023-03-18,22303,Coffee Mug Apples Design,12.86,6,14701.0,United Kingdom
546944,2023-03-18,22971,Queens Guard Coffee Mug,12.86,6,14701.0,United Kingdom
546944,2023-03-18,22301,Coffee Mug Cat + Bird Design,12.86,6,14701.0,United Kingdom
546944,2023-03-18,22988,Soldiers Egg Cup,11.53,2,14701.0,United Kingdom
546944,2023-03-18,22977,Dolly Girl Childrens Egg Cup,11.53,4,14701.0,United Kingdom
546944,2023-03-18,22993,Set Of 4 Pantry Jelly Moulds,11.53,2,14701.0,United Kingdom
546944,2023-03-18,21626,Vintage Union Jack Pennant,12.25,5,14701.0,United Kingdom
546944,2023-03-18,21625,Vintage Union Jack Apron,17.37,2,14701.0,United Kingdom
546944,2023-03-18,21626,Vintage Union Jack Pennant,12.25,3,14701.0,United Kingdom
546944,2023-03-18,22785,Squarecushion Cover Pink Union Jack,17.17,6,14701.0,United Kingdom
546944,2023-03-18,22786,Cushion Cover Pink Union Jack,16.35,3,14701.0,United Kingdom
546944,2023-03-18,22907,Pack Of 20 Napkins Pantry Design,11.12,4,14701.0,United Kingdom
546944,2023-03-18,22151,Place Setting White Heart,10.68,9,14701.0,United Kingdom
546944,2023-03-18,48138,Doormat Union Flag,18.4,2,14701.0,United Kingdom
546944,2023-03-18,22701,Pink Dog Bowl,13.27,1,14701.0,United Kingdom
546944,2023-03-18,22701,Pink Dog Bowl,13.27,2,14701.0,United Kingdom
546944,2023-03-18,22577,Wooden Heart Christmas Scandinavian,11.12,8,14701.0,United Kingdom
546944,2023-03-18,22151,Place Setting White Heart,10.68,1,14701.0,United Kingdom
546944,2023-03-18,22720,Set Of 3 Cake Tins Pantry Design,15.32,1,14701.0,United Kingdom
546944,2023-03-18,22499,Wooden Union Jack Bunting,16.35,2,14701.0,United Kingdom
546944,2023-03-18,84459A,Pink Metal Chicken Heart,11.78,3,14701.0,United Kingdom
546944,2023-03-18,84459B,Yellow Metal Chicken Heart,11.78,3,14701.0,United Kingdom
546949,2023-03-18,84856L,Large Tahiti Beach Bag,16.35,1,14949.0,United Kingdom
546949,2023-03-18,84977,Wire Flower T-Light Holder,11.53,1,14949.0,United Kingdom
546949,2023-03-18,85025B,Eau De Nile Heart Shape Photo Frame,11.94,1,14949.0,United Kingdom
546949,2023-03-18,85023B,Eau De Nile Jewelled Photoframe,12.86,1,14949.0,United Kingdom
546949,2023-03-18,85123A,Cream Hanging Heart T-Light Holder,13.27,1,14949.0,United Kingdom
546949,2023-03-18,51014L,Feather Pen Light Pink,11.12,2,14949.0,United Kingdom
546949,2023-03-18,21114,Lavender Scented Fabric Heart,11.53,5,14949.0,United Kingdom
546949,2023-03-18,20775,Daisy Notebook,11.94,1,14949.0,United Kingdom
546949,2023-03-18,84946,Antique Silver T-Light Glass,11.53,3,14949.0,United Kingdom
546949,2023-03-18,84947,Antique Silver Tea Glass Engraved,11.53,3,14949.0,United Kingdom
546949,2023-03-18,21417,Cockle Shell Dish,12.4,1,14949.0,United Kingdom
546949,2023-03-18,85096,Hilda Candy Spot Rabbit,14.09,1,14949.0,United Kingdom
546949,2023-03-18,85014A,Black/Blue Polkadot Umbrella,16.35,1,14949.0,United Kingdom
546950,2023-03-18,22873,Number Tile Cottage Garden 5,12.25,1,16511.0,United Kingdom
546950,2023-03-18,84519A,Tomato Charlie+Lola Coaster Set,11.53,2,16511.0,United Kingdom
546950,2023-03-18,22256,Felt Farm Animal Chicken,11.53,1,16511.0,United Kingdom
546950,2023-03-18,20984,12 Pencils Tall Tube Posy,11.12,1,16511.0,United Kingdom
546950,2023-03-18,22979,Pantry Washing Up Brush,11.74,1,16511.0,United Kingdom
546950,2023-03-18,22262,Felt Egg Cosy Chicken,11.12,3,16511.0,United Kingdom
546950,2023-03-18,22261,Felt Egg Cosy White Rabbit,11.12,2,16511.0,United Kingdom
546950,2023-03-18,22930,Baking Mould Heart Milk Chocolate,12.86,1,16511.0,United Kingdom
546950,2023-03-18,22933,Baking Mould Easter Egg Milk Choc,13.27,2,16511.0,United Kingdom
546950,2023-03-18,22256,Felt Farm Animal Chicken,11.53,1,16511.0,United Kingdom
546950,2023-03-18,21034,Rex Cash+Carry Jumbo Shopper,11.22,1,16511.0,United Kingdom
546950,2023-03-18,22427,Enamel Flower Jug Cream,16.35,1,16511.0,United Kingdom
546950,2023-03-18,22963,Jam Jar With Green Lid,11.12,4,16511.0,United Kingdom
546950,2023-03-18,22021,Blue Felt Easter Egg Basket,11.94,2,16511.0,United Kingdom
546950,2023-03-18,20977,36 Pencils Tube Woodland,11.53,4,16511.0,United Kingdom
546950,2023-03-18,22630,Dolly Girl Lunch Box,12.25,2,16511.0,United Kingdom
546950,2023-03-18,22084,Paper Chain Kit Empire,13.27,4,16511.0,United Kingdom
546950,2023-03-18,84997A,Childrens Cutlery Polkadot Green,14.5,2,16511.0,United Kingdom
546950,2023-03-18,84997B,Childrens Cutlery Retrospot Red,14.5,2,16511.0,United Kingdom
546950,2023-03-18,20984,12 Pencils Tall Tube Posy,11.12,2,16511.0,United Kingdom
546950,2023-03-18,22636,Childs Breakfast Set Circus Parade,18.96,2,16511.0,United Kingdom
546950,2023-03-18,79030G,Tumbler New England,11.94,6,16511.0,United Kingdom
546950,2023-03-18,85062,Pearl Crystal Pumpkin T-Light Hldr,11.94,4,16511.0,United Kingdom
546950,2023-03-18,21933,Pink Vintage Paisley Picnic Bag,13.27,2,16511.0,United Kingdom
546950,2023-03-18,21467,Cherry Crochet Food Cover,14.09,2,16511.0,United Kingdom
546950,2023-03-18,22262,Felt Egg Cosy Chicken,11.12,1,16511.0,United Kingdom
546950,2023-03-18,22148,Easter Craft 4 Chicks,12.25,2,16511.0,United Kingdom
546950,2023-03-18,22441,Grow Your Own Basil In Enamel Mug,12.4,1,16511.0,United Kingdom
546950,2023-03-18,22367,Childrens Apron Spaceboy Design,12.25,2,16511.0,United Kingdom
546950,2023-03-18,22899,Children's Apron Dolly Girl,12.4,2,16511.0,United Kingdom
546950,2023-03-18,22262,Felt Egg Cosy Chicken,11.12,3,16511.0,United Kingdom
546950,2023-03-18,22261,Felt Egg Cosy White Rabbit,11.12,3,16511.0,United Kingdom
546950,2023-03-18,21625,Vintage Union Jack Apron,17.37,2,16511.0,United Kingdom
546950,2023-03-18,22139,Retrospot Tea Set Ceramic 11 Pc,15.32,1,16511.0,United Kingdom
546950,2023-03-18,22222,Cake Plate Lovebird White,15.32,1,16511.0,United Kingdom
546950,2023-03-18,21888,Bingo Set,14.09,1,16511.0,United Kingdom
546950,2023-03-18,22500,Set Of 2 Tins Jardin De Provence,15.32,1,16511.0,United Kingdom
546950,2023-03-18,23054,Recycled Acapulco Mat Lavender,18.71,1,16511.0,United Kingdom
546950,2023-03-18,22975,Spaceboy Childrens Egg Cup,11.53,4,16511.0,United Kingdom
546950,2023-03-18,22977,Dolly Girl Childrens Egg Cup,11.53,5,16511.0,United Kingdom
546950,2023-03-18,22774,Red Drawer Knob Acrylic Edwardian,11.53,2,16511.0,United Kingdom
546950,2023-03-18,22497,Set Of 2 Tins Vintage Bathroom,14.61,2,16511.0,United Kingdom
546950,2023-03-18,21428,Set3 Book Box Green Gingham Flower,14.61,1,16511.0,United Kingdom
546950,2023-03-18,48187,Doormat New England,18.4,1,16511.0,United Kingdom
546950,2023-03-18,22493,Paint Your Own Canvas Set,11.94,2,16511.0,United Kingdom
546950,2023-03-18,22139,Retrospot Tea Set Ceramic 11 Pc,15.32,1,16511.0,United Kingdom
546950,2023-03-18,22629,Spaceboy Lunch Box,12.25,2,16511.0,United Kingdom
546950,2023-03-18,21731,Red Toadstool Led Night Light,11.94,2,16511.0,United Kingdom
546950,2023-03-18,22960,Jam Making Set With Jars,14.61,2,16511.0,United Kingdom
546950,2023-03-18,22411,Jumbo Shopper Vintage Red Paisley,12.25,3,16511.0,United Kingdom
546950,2023-03-18,22357,Kings Choice Biscuit Tin,14.61,2,16511.0,United Kingdom
546950,2023-03-18,21471,Strawberry Raffia Food Cover,14.09,2,16511.0,United Kingdom
546950,2023-03-18,22505,Memo Board Cottage Design,15.32,1,16511.0,United Kingdom
546950,2023-03-18,22662,Lunch Bag Dolly Girl Design,5.97,1,16511.0,United Kingdom
546950,2023-03-18,22382,Lunch Bag Spaceboy Design,5.97,1,16511.0,United Kingdom
546950,2023-03-18,22382,Lunch Bag Spaceboy Design,5.97,1,16511.0,United Kingdom
546950,2023-03-18,22662,Lunch Bag Dolly Girl Design,5.97,2,16511.0,United Kingdom
546950,2023-03-18,22611,Vintage Union Jack Shopping Bag,7.66,3,16511.0,United Kingdom
