TransactionNo,Date,ProductNo,ProductName,Price,Quantity,CustomerNo,Country
577010,2023-11-17,20983,12 Pencils Tall Tube Red Retrospot,11.12,48,15506.0,United Kingdom
577010,2023-11-17,23108,Set Of 10 Led Dolly Lights,16.66,1,15506.0,United Kingdom
577010,2023-11-17,21913,Vintage Seaside Jigsaw Puzzles,14.09,1,15506.0,United Kingdom
577010,2023-11-17,20992,Jazz Hearts Purse Notebook,10.65,5,15506.0,United Kingdom
577010,2023-11-17,21908,Chocolate This Way Metal Sign,12.4,4,15506.0,United Kingdom
577010,2023-11-17,21907,I'm On Holiday Metal Sign,12.4,2,15506.0,United Kingdom
577010,2023-11-17,21175,Gin And Tonic Diet Metal Sign,12.86,5,15506.0,United Kingdom
577010,2023-11-17,23344,Jumbo Bag 50'S Christmas,6.19,1,15506.0,United Kingdom
577010,2023-11-17,23202,Jumbo Bag Vintage Leaf,6.19,1,15506.0,United Kingdom
577010,2023-11-17,20712,Jumbo Bag Woodland Animals,6.19,1,15506.0,United Kingdom
577010,2023-11-17,22385,Jumbo Bag Spaceboy Design,6.19,1,15506.0,United Kingdom
577010,2023-11-17,20728,Lunch Bag Cars Blue,5.97,6,15506.0,United Kingdom
577010,2023-11-17,23208,Lunch Bag Vintage Leaf Design,5.97,3,15506.0,United Kingdom
577010,2023-11-17,20725,Lunch Bag Red Retrospot,5.97,3,15506.0,United Kingdom
577010,2023-11-17,23583,Lunch Bag Paisley Park,5.97,5,15506.0,United Kingdom
577010,2023-11-17,20726,Lunch Bag Woodland,5.97,5,15506.0,United Kingdom
577010,2023-11-17,23206,Lunch Bag Apple Design,5.97,5,15506.0,United Kingdom
577010,2023-11-17,23207,Lunch Bag Alphabet Design,5.97,5,15506.0,United Kingdom
577010,2023-11-17,22382,Lunch Bag Spaceboy Design,5.97,5,15506.0,United Kingdom
577010,2023-11-17,22383,Lunch Bag Suki Design,5.97,5,15506.0,United Kingdom
577010,2023-11-17,20727,Lunch Bag Black Skull,5.97,5,15506.0,United Kingdom
577010,2023-11-17,22662,Lunch Bag Dolly Girl Design,5.97,5,15506.0,United Kingdom
577010,2023-11-17,22384,Lunch Bag Pink Polkadot,5.97,6,15506.0,United Kingdom
577010,2023-11-17,22820,Gift Bag Birthday,5.46,2,15506.0,United Kingdom
577010,2023-11-17,22821,Gift Bag Psychedelic Apples,5.46,4,15506.0,United Kingdom
577010,2023-11-17,16168M,Funky Monkey Gift Bag Medium,5.34,4,15506.0,United Kingdom
577011,2023-11-17,22993,Set Of 4 Pantry Jelly Moulds,11.53,24,15657.0,United Kingdom
577016,2023-11-17,47566,Party Bunting,15.32,4,17095.0,United Kingdom
577016,2023-11-17,22835,Hot Water Bottle I Am So Poorly,15.32,4,17095.0,United Kingdom
577016,2023-11-17,85014B,Red Retrospot Umbrella,16.35,2,17095.0,United Kingdom
577016,2023-11-17,15056P,Edwardian Parasol Pink,16.35,2,17095.0,United Kingdom
577016,2023-11-17,20679,Edwardian Parasol Red,16.35,2,17095.0,United Kingdom
577016,2023-11-17,15056N,Edwardian Parasol Natural,16.35,2,17095.0,United Kingdom
577016,2023-11-17,22928,Yellow Giant Garden Thermometer,16.35,7,17095.0,United Kingdom
577016,2023-11-17,22637,Piggy Bank Retrospot,12.86,4,17095.0,United Kingdom
577016,2023-11-17,22720,Set Of 3 Cake Tins Pantry Design,15.32,4,17095.0,United Kingdom
577016,2023-11-17,22505,Memo Board Cottage Design,15.32,4,17095.0,United Kingdom
577016,2023-11-17,23300,Gardeners Kneeling Pad Cup Of Tea,11.94,6,17095.0,United Kingdom
577016,2023-11-17,20718,Red Retrospot Shopper Bag,11.53,6,17095.0,United Kingdom
577016,2023-11-17,20717,Strawberry Shopper Bag,11.53,6,17095.0,United Kingdom
577016,2023-11-17,75049L,Large Circular Mirror Mobile,11.53,6,17095.0,United Kingdom
577016,2023-11-17,22507,Memo Board Retrospot Design,15.32,4,17095.0,United Kingdom
577016,2023-11-17,22795,Sweetheart Recipe Book Stand,17.17,3,17095.0,United Kingdom
577016,2023-11-17,23301,Gardeners Kneeling Pad Keep Calm,11.94,6,17095.0,United Kingdom
577016,2023-11-17,22090,Paper Bunting Retrospot,13.27,4,17095.0,United Kingdom
577016,2023-11-17,22469,Heart Of Wicker Small,11.94,12,17095.0,United Kingdom
577016,2023-11-17,23284,Doormat Keep Calm And Come In,17.51,10,17095.0,United Kingdom
577016,2023-11-17,48184,Doormat English Rose,17.51,10,17095.0,United Kingdom
577016,2023-11-17,22690,Doormat Home Sweet Home Blue,17.51,10,17095.0,United Kingdom
577016,2023-11-17,23547,Wrap Flower Shop,10.68,25,17095.0,United Kingdom
577016,2023-11-17,23546,Wrap Paisley Park,10.68,25,17095.0,United Kingdom
577016,2023-11-17,21498,Red Retrospot Wrap,10.68,25,17095.0,United Kingdom
577016,2023-11-17,21500,Pink Polkadot Wrap,10.68,25,17095.0,United Kingdom
577016,2023-11-17,21499,Blue Polkadot Wrap,10.68,25,17095.0,United Kingdom
577016,2023-11-17,16156S,Wrap Pink Fairy Cakes,10.68,25,17095.0,United Kingdom
577016,2023-11-17,22704,Wrap Red Apples,10.68,25,17095.0,United Kingdom
577016,2023-11-17,22047,Empire Gift Wrap,10.68,25,17095.0,United Kingdom
577016,2023-11-17,22187,Green Christmas Tree Card Holder,12.25,4,17095.0,United Kingdom
577016,2023-11-17,22186,Red Star Card Holder,12.25,4,17095.0,United Kingdom
577016,2023-11-17,85099B,Jumbo Bag Red Retrospot,6.19,10,17095.0,United Kingdom
577016,2023-11-17,85099C,Jumbo Bag Baroque Black White,6.19,10,17095.0,United Kingdom
577016,2023-11-17,85099F,Jumbo Bag Strawberry,6.19,10,17095.0,United Kingdom
577016,2023-11-17,23344,Jumbo Bag 50'S Christmas,6.19,10,17095.0,United Kingdom
577016,2023-11-17,22386,Jumbo Bag Pink Polkadot,6.19,10,17095.0,United Kingdom
577018,2023-11-17,22090,Paper Bunting Retrospot,12.86,40,12971.0,United Kingdom
577018,2023-11-17,22947,Wooden Advent Calendar Red,18.4,6,12971.0,United Kingdom
577018,2023-11-17,21819,Glitter Christmas Star,10.65,36,12971.0,United Kingdom
577019,2023-11-17,22865,Hand Warmer Owl Design,12.4,12,14112.0,United Kingdom
577019,2023-11-17,22867,Hand Warmer Bird Design,12.4,12,14112.0,United Kingdom
577019,2023-11-17,23439,Hand Warmer Red Love Heart,12.4,12,14112.0,United Kingdom
577019,2023-11-17,22752,Set 7 Babushka Nesting Boxes,18.96,2,14112.0,United Kingdom
577019,2023-11-17,22086,Paper Chain Kit 50'S Christmas,12.86,40,14112.0,United Kingdom
577019,2023-11-17,23681,Lunch Bag Red Vintage Doily,5.97,10,14112.0,United Kingdom
577020,2023-11-17,21810,Christmas Hanging Star With Bell,10.65,48,17147.0,United Kingdom
577020,2023-11-17,22577,Wooden Heart Christmas Scandinavian,10.55,24,17147.0,United Kingdom
577020,2023-11-17,22578,Wooden Star Christmas Scandinavian,10.55,24,17147.0,United Kingdom
577020,2023-11-17,21804,White Christmas Garland Stars Trees,14.09,6,17147.0,United Kingdom
577020,2023-11-17,21813,Garland With Stars And Bells,15.32,6,17147.0,United Kingdom
577020,2023-11-17,23313,Vintage Christmas Bunting,15.32,10,17147.0,United Kingdom
577020,2023-11-17,23489,Vintage Bells Garland,13.21,6,17147.0,United Kingdom
577020,2023-11-17,22294,Heart Filigree Dove Small,11.53,24,17147.0,United Kingdom
577020,2023-11-17,23224,Cherub Heart Decoration Gold,11.1,12,17147.0,United Kingdom
577020,2023-11-17,84279B,Cherry Blossom Decorative Flask,14.09,4,17147.0,United Kingdom
577020,2023-11-17,22697,Green Regency Teacup And Saucer,13.27,6,17147.0,United Kingdom
577020,2023-11-17,22698,Pink Regency Teacup And Saucer,13.27,6,17147.0,United Kingdom
577020,2023-11-17,22699,Roses Regency Teacup And Saucer,13.27,6,17147.0,United Kingdom
577020,2023-11-17,35004G,Set Of 3 Gold Flying Ducks,16.76,2,17147.0,United Kingdom
577020,2023-11-17,35004B,Set Of 3 Black Flying Ducks,15.84,3,17147.0,United Kingdom
577021,2023-11-17,21479,White Skull Hot Water Bottle,14.09,300,12931.0,United Kingdom
577021,2023-11-17,23215,Jingle Bell Heart Antique Silver,12.08,456,12931.0,United Kingdom
577021,2023-11-17,23203,Jumbo Bag Vintage Doily,6.04,150,12931.0,United Kingdom
577022,2023-11-17,21287,Scented Velvet Lounge Candle,10.64,8,13668.0,United Kingdom
577022,2023-11-17,22578,Wooden Star Christmas Scandinavian,10.55,6,13668.0,United Kingdom
577022,2023-11-17,22577,Wooden Heart Christmas Scandinavian,10.55,6,13668.0,United Kingdom
577022,2023-11-17,22579,Wooden Tree Christmas Scandinavian,10.55,6,13668.0,United Kingdom
577022,2023-11-17,23210,White Rocking Horse Hand Painted,11.53,6,13668.0,United Kingdom
577022,2023-11-17,23211,Red Rocking Horse Hand Painted,11.53,6,13668.0,United Kingdom
577022,2023-11-17,23212,Heart Wreath Decoration With Bell,11.53,6,13668.0,United Kingdom
577022,2023-11-17,23213,Star Wreath Decoration With Bell,11.53,6,13668.0,United Kingdom
577022,2023-11-17,23223,Christmas Tree Hanging Silver,11.1,8,13668.0,United Kingdom
577022,2023-11-17,23219,Laurel Star Antique Silver,11.53,8,13668.0,United Kingdom
577022,2023-11-17,23217,Laurel Heart Antique Silver,11.53,8,13668.0,United Kingdom
577022,2023-11-17,22800,Antique Tall Swirlglass Trinket Pot,14.09,1,13668.0,United Kingdom
577022,2023-11-17,22739,Ribbon Reel Christmas Sock Bauble,11.94,5,13668.0,United Kingdom
577022,2023-11-17,22737,Ribbon Reel Christmas Present,11.94,5,13668.0,United Kingdom
577022,2023-11-17,23330,Decorative Wicker Heart Medium,11.53,6,13668.0,United Kingdom
577022,2023-11-17,23333,Ivory Wicker Heart Medium,11.53,6,13668.0,United Kingdom
577022,2023-11-17,23331,Decorative Wicker Heart Small,10.9,12,13668.0,United Kingdom
577022,2023-11-17,23334,Ivory Wicker Heart Small,10.9,12,13668.0,United Kingdom
577022,2023-11-17,23215,Jingle Bell Heart Antique Silver,12.38,6,13668.0,United Kingdom
577022,2023-11-17,21673,White Spot Blue Ceramic Drawer Knob,11.74,12,13668.0,United Kingdom
577022,2023-11-17,21754,Home Building Block Word,16.66,2,13668.0,United Kingdom
577022,2023-11-17,82483,Wood 2 Drawer Cabinet White Finish,17.37,2,13668.0,United Kingdom
577022,2023-11-17,82494L,Wooden Frame Antique White,13.27,6,13668.0,United Kingdom
577022,2023-11-17,82482,Wooden Picture Frame White Finish,13.27,6,13668.0,United Kingdom
577022,2023-11-17,22696,Wicker Wreath Large,12.25,2,13668.0,United Kingdom
577022,2023-11-17,22695,Wicker Wreath Small,11.74,2,13668.0,United Kingdom
577022,2023-11-17,23400,Shelf With 4 Hooks Home Sweet Home,16.66,2,13668.0,United Kingdom
577022,2023-11-17,22178,Victorian Glass Hanging T-Light,12.25,6,13668.0,United Kingdom
577022,2023-11-17,23404,Home Sweet Home Blackboard,15.32,2,13668.0,United Kingdom
577022,2023-11-17,22801,Antique Glass Pedestal Bowl,14.09,1,13668.0,United Kingdom
577022,2023-11-17,23490,T-Light Holder Hanging Love Bird,14.09,2,13668.0,United Kingdom
577022,2023-11-17,22470,Heart Of Wicker Large,13.27,4,13668.0,United Kingdom
577022,2023-11-17,21175,Gin And Tonic Diet Metal Sign,12.86,4,13668.0,United Kingdom
577022,2023-11-17,22110,Bird House Hot Water Bottle,12.86,2,13668.0,United Kingdom
577022,2023-11-17,21484,Chick Grey Hot Water Bottle,14.61,4,13668.0,United Kingdom
577022,2023-11-17,22469,Heart Of Wicker Small,11.94,4,13668.0,United Kingdom
577022,2023-11-17,20894,Hanging Bauble T-Light Holder Large,13.27,4,13668.0,United Kingdom
577023,2023-11-17,23531,Wall Art Big Love,17.37,4,16186.0,United Kingdom
577023,2023-11-17,22727,Alarm Clock Bakelike Red,14.09,4,16186.0,United Kingdom
577023,2023-11-17,22726,Alarm Clock Bakelike Green,14.09,8,16186.0,United Kingdom
577023,2023-11-17,23542,Wall Art 70'S Alphabet,18.71,2,16186.0,United Kingdom
577023,2023-11-17,23503,Playing Cards Keep Calm & Carry On,11.53,12,16186.0,United Kingdom
577023,2023-11-17,23493,Vintage Doily Travel Sewing Kit,12.25,10,16186.0,United Kingdom
577023,2023-11-17,23366,Set 12 Colouring Pencils Doily,10.92,32,16186.0,United Kingdom
577023,2023-11-17,23286,Blue Vintage Spot Beaker,11.12,8,16186.0,United Kingdom
577023,2023-11-17,23285,Pink Vintage Spot Beaker,11.12,8,16186.0,United Kingdom
577023,2023-11-17,23240,Set Of 4 Knick Knack Tins Doily,14.5,6,16186.0,United Kingdom
577023,2023-11-17,22988,Soldiers Egg Cup,11.53,12,16186.0,United Kingdom
577023,2023-11-17,22904,Calendar Paper Cut Design,13.27,8,16186.0,United Kingdom
577023,2023-11-17,22865,Hand Warmer Owl Design,12.4,24,16186.0,United Kingdom
577023,2023-11-17,22867,Hand Warmer Bird Design,12.4,24,16186.0,United Kingdom
577023,2023-11-17,21481,Fawn Blue Hot Water Bottle,14.09,8,16186.0,United Kingdom
577023,2023-11-17,21213,Pack Of 72 Skull Cake Cases,10.81,24,16186.0,United Kingdom
577023,2023-11-17,20973,12 Pencil Small Tube Woodland,10.92,24,16186.0,United Kingdom
577023,2023-11-17,20972,Pink Cream Felt Craft Trinket Box,11.53,12,16186.0,United Kingdom
577023,2023-11-17,23209,Lunch Bag Vintage Doily,5.97,10,16186.0,United Kingdom
577024,2023-11-17,23469,Card Holder Love Bird Small,14.5,1,14704.0,United Kingdom
577024,2023-11-17,21617,4 Lily Botanical Dinner Candles,11.53,6,14704.0,United Kingdom
577024,2023-11-17,21616,4 Pear Botanical Dinner Candles,11.53,3,14704.0,United Kingdom
577024,2023-11-17,21619,4 Vanilla Botanical Candles,11.53,3,14704.0,United Kingdom
577024,2023-11-17,21615,4 Lavender Botanical Dinner Candles,11.53,3,14704.0,United Kingdom
577024,2023-11-17,21620,Set Of 4 Rose Botanical Candles,11.53,3,14704.0,United Kingdom
577024,2023-11-17,21899,Garage Key Fob,10.92,2,14704.0,United Kingdom
577024,2023-11-17,21900,Key Fob Shed,10.92,2,14704.0,United Kingdom
577024,2023-11-17,21902,Key Fob Front Door,10.92,2,14704.0,United Kingdom
577024,2023-11-17,21494,Rotating Leaves T-Light Holder,11.53,1,14704.0,United Kingdom
577024,2023-11-17,21901,Key Fob Back Door,10.92,3,14704.0,United Kingdom
577024,2023-11-17,22732,3d Vintage Christmas Stickers,11.53,2,14704.0,United Kingdom
577024,2023-11-17,22733,3d Traditional Christmas Stickers,11.53,2,14704.0,United Kingdom
577024,2023-11-17,84821,Danish Rose Deluxe Coaster,11.12,12,14704.0,United Kingdom
577024,2023-11-17,22087,Paper Bunting White Lace,13.27,2,14704.0,United Kingdom
577024,2023-11-17,23082,Set 6 Paper Table Lantern Hearts,14.09,1,14704.0,United Kingdom
577024,2023-11-17,22083,Paper Chain Kit Retrospot,13.27,1,14704.0,United Kingdom
577024,2023-11-17,84821,Danish Rose Deluxe Coaster,11.12,12,14704.0,United Kingdom
577024,2023-11-17,84926D,La Palmiera Tile Coaster,10.55,8,14704.0,United Kingdom
577024,2023-11-17,23082,Set 6 Paper Table Lantern Hearts,14.09,1,14704.0,United Kingdom
577024,2023-11-17,23068,Aluminium Stamped Heart,12.8,4,14704.0,United Kingdom
577024,2023-11-17,23313,Vintage Christmas Bunting,15.32,1,14704.0,United Kingdom
577024,2023-11-17,21494,Rotating Leaves T-Light Holder,11.53,2,14704.0,United Kingdom
577024,2023-11-17,22910,Paper Chain Kit Vintage Christmas,13.27,2,14704.0,United Kingdom
577024,2023-11-17,22086,Paper Chain Kit 50'S Christmas,13.27,2,14704.0,United Kingdom
577024,2023-11-17,23301,Gardeners Kneeling Pad Keep Calm,11.94,2,14704.0,United Kingdom
577024,2023-11-17,21116,Owl Doorstop,15.32,1,14704.0,United Kingdom
577024,2023-11-17,21162,Toxic Area Door Hanger,10.65,1,14704.0,United Kingdom
577024,2023-11-17,21466,Red Flower Crochet Food Cover,14.09,1,14704.0,United Kingdom
577024,2023-11-17,23275,Set Of 3 Hanging Owls Ollie Beak,11.53,1,14704.0,United Kingdom
577024,2023-11-17,22307,Gold Mug Bone China Tree Of Life,11.34,2,14704.0,United Kingdom
577024,2023-11-17,82494L,Wooden Frame Antique White,13.27,3,14704.0,United Kingdom
577024,2023-11-17,47504H,English Rose Spirit Level,11.06,1,14704.0,United Kingdom
577024,2023-11-17,23196,Vintage Leaf Magnetic Notepad,11.74,1,14704.0,United Kingdom
577024,2023-11-17,23197,Sketchbook Magnetic Shopping List,11.74,1,14704.0,United Kingdom
577024,2023-11-17,21620,Set Of 4 Rose Botanical Candles,11.53,1,14704.0,United Kingdom
577024,2023-11-17,21494,Rotating Leaves T-Light Holder,11.53,1,14704.0,United Kingdom
577024,2023-11-17,17107D,Flower Fairy 5 Drawer Liners,12.86,1,14704.0,United Kingdom
577024,2023-11-17,21615,4 Lavender Botanical Dinner Candles,11.53,1,14704.0,United Kingdom
577024,2023-11-17,21620,Set Of 4 Rose Botanical Candles,11.53,1,14704.0,United Kingdom
577024,2023-11-17,21617,4 Lily Botanical Dinner Candles,11.53,1,14704.0,United Kingdom
577024,2023-11-17,21034,Rex Cash+Carry Jumbo Shopper,11.22,2,14704.0,United Kingdom
577024,2023-11-17,22577,Wooden Heart Christmas Scandinavian,10.55,1,14704.0,United Kingdom
577024,2023-11-17,22578,Wooden Star Christmas Scandinavian,10.55,1,14704.0,United Kingdom
577024,2023-11-17,22579,Wooden Tree Christmas Scandinavian,10.55,1,14704.0,United Kingdom
577025,2023-11-17,22568,Feltcraft Cushion Owl,14.09,4,16161.0,United Kingdom
577025,2023-11-17,23368,Set 12 Colour Pencils Dolly Girl,10.92,16,16161.0,United Kingdom
577025,2023-11-17,23367,Set 12 Colour Pencils Spaceboy,10.92,16,16161.0,United Kingdom
577025,2023-11-17,23372,Set 36 Colour Pencils Dolly Girl,11.53,16,16161.0,United Kingdom
577025,2023-11-17,23371,Set 36 Colour Pencils Spaceboy,11.53,16,16161.0,United Kingdom
577025,2023-11-17,22113,Grey Heart Hot Water Bottle,14.61,4,16161.0,United Kingdom
577025,2023-11-17,21098,Christmas Toilet Roll,11.53,12,16161.0,United Kingdom
577025,2023-11-17,23328,Set 6 School Milk Bottles In Crate,14.09,4,16161.0,United Kingdom
577025,2023-11-17,23491,Vintage Jingle Bells Heart,18.71,2,16161.0,United Kingdom
577025,2023-11-17,23313,Vintage Christmas Bunting,15.32,5,16161.0,United Kingdom
577025,2023-11-17,22086,Paper Chain Kit 50'S Christmas,13.27,6,16161.0,United Kingdom
577025,2023-11-17,22910,Paper Chain Kit Vintage Christmas,13.27,6,16161.0,United Kingdom
577025,2023-11-17,21259,Victorian Sewing Box Small,16.35,2,16161.0,United Kingdom
577025,2023-11-17,21257,Victorian Sewing Box Medium,18.4,2,16161.0,United Kingdom
577025,2023-11-17,22738,Ribbon Reel Snowy Village,11.94,10,16161.0,United Kingdom
577025,2023-11-17,22737,Ribbon Reel Christmas Present,11.94,10,16161.0,United Kingdom
577025,2023-11-17,22736,Ribbon Reel Making Snowmen,11.94,10,16161.0,United Kingdom
577025,2023-11-17,22735,Ribbon Reel Socks And Mittens,11.94,10,16161.0,United Kingdom
577025,2023-11-17,22909,Set Of 20 Vintage Christmas Napkins,11.12,12,16161.0,United Kingdom
577025,2023-11-17,23068,Aluminium Stamped Heart,12.8,8,16161.0,United Kingdom
577026,2023-11-17,22433,Watering Can Green Dinosaur,12.25,3,17237.0,United Kingdom
577026,2023-11-17,20828,Glitter Butterfly Clips,12.86,2,17237.0,United Kingdom
577026,2023-11-17,21749,Large Red Retrospot Windmill,12.4,7,17237.0,United Kingdom
577026,2023-11-17,21710,Folding Umbrella Pinkwhite Polkadot,15.32,2,17237.0,United Kingdom
577026,2023-11-17,15058B,Pink Polkadot Garden Parasol,18.4,1,17237.0,United Kingdom
577026,2023-11-17,20686,Dolly Mixture Children's Umbrella,13.58,2,17237.0,United Kingdom
577026,2023-11-17,20699,Mousey Long Legs Soft Toy,12.86,2,17237.0,United Kingdom
577026,2023-11-17,21828,Eight Piece Snake Set,11.53,6,17237.0,United Kingdom
577026,2023-11-17,22139,Retrospot Tea Set Ceramic 11 Pc,15.32,8,17237.0,United Kingdom
577026,2023-11-17,23082,Set 6 Paper Table Lantern Hearts,14.09,24,17237.0,United Kingdom
577026,2023-11-17,84347,Rotating Silver Angels T-Light Hldr,12.86,12,17237.0,United Kingdom
577026,2023-11-17,23084,Rabbit Night Light,12.38,10,17237.0,United Kingdom
577027,2023-11-17,22505,Memo Board Cottage Design,15.32,8,12647.0,Germany
577027,2023-11-17,22507,Memo Board Retrospot Design,15.32,4,12647.0,Germany
577027,2023-11-17,35599D,Pink And White Christmas Tree 120cm,12.25,24,12647.0,Germany
577027,2023-11-17,47559B,Tea Time Oven Glove,11.34,50,12647.0,Germany
577027,2023-11-17,21154,Red Retrospot Oven Glove,11.53,40,12647.0,Germany
577028,2023-11-17,23491,Vintage Jingle Bells Heart,18.71,8,17080.0,United Kingdom
577028,2023-11-17,23393,Home Sweet Home Cushion Cover,14.09,4,17080.0,United Kingdom
577028,2023-11-17,23399,Home Sweet Home Hanging Heart,11.12,24,17080.0,United Kingdom
577028,2023-11-17,23398,Hanging Heart Bonheur,11.12,24,17080.0,United Kingdom
577028,2023-11-17,23328,Set 6 School Milk Bottles In Crate,14.09,8,17080.0,United Kingdom
577028,2023-11-17,23103,Jingle Bell Heart Decoration,11.94,24,17080.0,United Kingdom
577029,2023-11-17,46000S,Polyester Filler Pad 40x40cm,11.74,25,15563.0,United Kingdom
577029,2023-11-17,21211,Set Of 72 Skull Paper Doilies,11.74,6,15563.0,United Kingdom
577029,2023-11-17,21210,Set Of 72 Retrospot Paper Doilies,11.74,6,15563.0,United Kingdom
577029,2023-11-17,23251,Vintage Red Enamel Trim Mug,11.53,12,15563.0,United Kingdom
577029,2023-11-17,22720,Set Of 3 Cake Tins Pantry Design,15.32,4,15563.0,United Kingdom
577029,2023-11-17,22898,Childrens Apron Apples Design,12.25,2,15563.0,United Kingdom
577029,2023-11-17,47591D,Pink Fairy Cake Childrens Apron,12.25,2,15563.0,United Kingdom
577029,2023-11-17,22367,Childrens Apron Spaceboy Design,12.25,2,15563.0,United Kingdom
577029,2023-11-17,23250,Vintage Red Trim Enamel Bowl,11.53,12,15563.0,United Kingdom
577029,2023-11-17,23368,Set 12 Colour Pencils Dolly Girl,10.92,12,15563.0,United Kingdom
577029,2023-11-17,23367,Set 12 Colour Pencils Spaceboy,10.92,12,15563.0,United Kingdom
577029,2023-11-17,84077,World War 2 Gliders Asstd Designs,10.55,48,15563.0,United Kingdom
577029,2023-11-17,22699,Roses Regency Teacup And Saucer,13.27,8,15563.0,United Kingdom
577029,2023-11-17,22066,Love Heart Trinket Pot,10.65,8,15563.0,United Kingdom
577029,2023-11-17,21108,Fairy Cake Flannel Assorted Colour,11.06,18,15563.0,United Kingdom
577029,2023-11-17,23243,Set Of Tea Coffee Sugar Tins Pantry,15.32,12,15563.0,United Kingdom
577029,2023-11-17,23123,Cocktail Swords 50 Pieces,11.1,6,15563.0,United Kingdom
577029,2023-11-17,23082,Set 6 Paper Table Lantern Hearts,14.09,12,15563.0,United Kingdom
577029,2023-11-17,23691,Wrap Keep Calm Birthday,10.68,25,15563.0,United Kingdom
577029,2023-11-17,23233,Wrap Poppies Design,10.68,25,15563.0,United Kingdom
577029,2023-11-17,23548,Wrap Magic Forest,10.68,25,15563.0,United Kingdom
577029,2023-11-17,21495,Skulls And Crossbones Wrap,10.68,25,15563.0,United Kingdom
577029,2023-11-17,23267,Set Of 4 Santa Place Settings,11.53,12,15563.0,United Kingdom
577029,2023-11-17,23310,Bubblegum Ring Assorted,10.68,72,15563.0,United Kingdom
577029,2023-11-17,84692,Box Of 24 Cocktail Parasols,10.68,10,15563.0,United Kingdom
577029,2023-11-17,22748,Poppy's Playhouse Kitchen,12.4,2,15563.0,United Kingdom
577029,2023-11-17,22746,Poppy's Playhouse Livingroom,12.4,2,15563.0,United Kingdom
577029,2023-11-17,22747,Poppy's Playhouse Bathroom,12.4,2,15563.0,United Kingdom
577029,2023-11-17,22745,Poppy's Playhouse Bedroom,12.4,2,15563.0,United Kingdom
577029,2023-11-17,22752,Set 7 Babushka Nesting Boxes,18.96,3,15563.0,United Kingdom
577029,2023-11-17,21918,Set 12 Kids Colour Chalk Sticks,10.68,12,15563.0,United Kingdom
577029,2023-11-17,21917,Set 12 Kids White Chalk Sticks,10.68,8,15563.0,United Kingdom
577029,2023-11-17,21704,Bag 250g Swirly Marbles,11.12,8,15563.0,United Kingdom
577029,2023-11-17,22620,4 Traditional Spinning Tops,11.74,6,15563.0,United Kingdom
577029,2023-11-17,23157,Set Of 6 Nativity Magnets,12.38,12,15563.0,United Kingdom
577029,2023-11-17,23252,Vintage Red Enamel Trim Jug,14.09,2,15563.0,United Kingdom
577029,2023-11-17,20668,Disco Ball Christmas Decoration,10.37,120,15563.0,United Kingdom
577029,2023-11-17,23002,Travel Card Wallet Skulls,10.68,24,15563.0,United Kingdom
577029,2023-11-17,22998,Travel Card Wallet Keep Calm,10.68,24,15563.0,United Kingdom
577029,2023-11-17,22997,Travel Card Wallet Union Jack,10.68,24,15563.0,United Kingdom
577029,2023-11-17,21676,Flowers Stickers,11.12,6,15563.0,United Kingdom
577029,2023-11-17,21679,Skulls Stickers,11.12,6,15563.0,United Kingdom
577029,2023-11-17,21544,Skulls Water Transfer Tattoos,11.12,12,15563.0,United Kingdom
577029,2023-11-17,84508B,Stripes Design Teddy,12.86,3,15563.0,United Kingdom
577029,2023-11-17,84508C,Blue Circles Design Teddy,12.86,3,15563.0,United Kingdom
577029,2023-11-17,47503A,Ass Floral Print Multi Screwdriver,10.68,12,15563.0,United Kingdom
577030,2023-11-17,85230B,Cinnamon Scented Votive Candle,10.47,144,14060.0,United Kingdom
577030,2023-11-17,22734,Set Of 6 Ribbons Vintage Christmas,12.8,72,14060.0,United Kingdom
577030,2023-11-17,22900,Set 2 Tea Towels I Love London,13.58,12,14060.0,United Kingdom
577030,2023-11-17,21506,Fancy Font Birthday Card,10.68,12,14060.0,United Kingdom
577030,2023-11-17,22467,Gumball Coat Rack,12.4,36,14060.0,United Kingdom
577030,2023-11-17,21263,Green Goose Feather Tree 60cm,12.25,12,14060.0,United Kingdom
577030,2023-11-17,21617,4 Lily Botanical Dinner Candles,11.53,24,14060.0,United Kingdom
577030,2023-11-17,21615,4 Lavender Botanical Dinner Candles,11.53,24,14060.0,United Kingdom
577031,2023-11-17,23084,Rabbit Night Light,12.08,24,15298.0,United Kingdom
577031,2023-11-17,21731,Red Toadstool Led Night Light,11.94,12,15298.0,United Kingdom
577031,2023-11-17,21931,Jumbo Storage Bag Suki,12.38,10,15298.0,United Kingdom
577031,2023-11-17,22027,Tea Party Birthday Card,10.68,12,15298.0,United Kingdom
577031,2023-11-17,22037,Robot Birthday Card,10.68,12,15298.0,United Kingdom
577031,2023-11-17,23199,Jumbo Bag Apples,6.19,10,15298.0,United Kingdom
577031,2023-11-17,23200,Jumbo Bag Pears,6.19,10,15298.0,United Kingdom
577031,2023-11-17,20711,Jumbo Bag Toys,6.19,10,15298.0,United Kingdom
577031,2023-11-17,23201,Jumbo Bag Alphabet,6.19,10,15298.0,United Kingdom
577031,2023-11-17,21929,Jumbo Bag Pink Vintage Paisley,6.19,10,15298.0,United Kingdom
577031,2023-11-17,85099B,Jumbo Bag Red Retrospot,6.19,10,15298.0,United Kingdom
577031,2023-11-17,22663,Jumbo Bag Dolly Girl Design,6.19,10,15298.0,United Kingdom
577031,2023-11-17,23202,Jumbo Bag Vintage Leaf,6.19,10,15298.0,United Kingdom
577031,2023-11-17,85099F,Jumbo Bag Strawberry,6.19,10,15298.0,United Kingdom
577031,2023-11-17,22385,Jumbo Bag Spaceboy Design,6.19,10,15298.0,United Kingdom
577032,2023-11-17,23212,Heart Wreath Decoration With Bell,11.53,12,13160.0,United Kingdom
577032,2023-11-17,23035,Drawer Knob Ceramic Ivory,11.74,18,13160.0,United Kingdom
577032,2023-11-17,21670,Blue Spot Ceramic Drawer Knob,11.74,24,13160.0,United Kingdom
577032,2023-11-17,85048,15cm Christmas Glass Ball 20 Lights,18.4,2,13160.0,United Kingdom
577033,2023-11-17,46000S,Polyester Filler Pad 40x40cm,11.74,5,17797.0,United Kingdom
577033,2023-11-17,23221,Reindeer Heart Decoration Silver,11.1,6,17797.0,United Kingdom
577033,2023-11-17,23223,Christmas Tree Hanging Silver,11.1,7,17797.0,United Kingdom
577033,2023-11-17,22603,Christmas Retrospot Tree Wood,11.12,9,17797.0,United Kingdom
